"","pathway","pval","padj","ES","NES","nMoreExtreme","size","leadingEdge"
"1","A tetrasaccharide linker sequence is required for GAG synthesis",0.0551212667869313,0.177444946650036,0.316420534458509,1.54480803732955,274,24,"AGRN, B3GALT6, B3GAT1, B3GAT2, B3GAT3, B4GALT7, BCAN, BGN, CSPG4, CSPG5, DCN, GPC1, GPC3, GPC4, GPC5, GPC6, HSPG2"
"2","ABC transporter disorders",0.0936555891238671,0.180867182164459,-0.381890959282264,-2.05964131809317,464,69,"VCP, UBC, UBB, SEL1L, RPS27A, RNF5, RNF185, PSMF1, PSME4, PSME3, PSME2, PSME1, PSMD9, PSMD8, PSMD7, PSMD6, PSMD5, PSMD4, PSMD3, PSMD2, PSMD14, PSMD13, PSMD12, PSMD11, PSMD10, PSMD1, PSMC6, PSMC5, PSMC4, PSMC3, PSMC2, PSMC1, PSMB9, PSMB8, PSMB7, PSMB6, PSMB5, PSMB4, PSMB3, PSMB2, PSMB10, PSMB1, PSMA8, PSMA7, PSMA6, PSMA5, PSMA4, PSMA3, PSMA1"
"3","ABC transporters in lipid homeostasis",0.0254827792156082,0.177444946650036,0.808264811300864,3.47164483821261,127,15,"ABCA2, ABCA3, ABCA5, ABCA6, ABCA7, ABCA9, ABCD1, ABCD2, ABCD3, ABCG1, ABCG4, ABCG8, APOA1"
"4","ABC-family proteins mediated transport",0.14617676266137,0.206420035220555,0.28644732732897,1.30003259871274,735,93,"ABCA2, ABCA3, ABCA4, ABCA5, ABCA6, ABCA7, ABCA8, ABCA9, ABCB10, ABCB1, ABCB4, ABCB7, ABCB8, ABCB9, ABCC1, ABCC10, ABCC2, ABCC3, ABCC4, ABCC5, ABCC9, ABCD1, ABCD2, ABCD3, ABCF1, ABCG1, ABCG4, ABCG8"
"5","ADP signalling through P2Y purinoceptor 1",0.0312312312312312,0.177444946650036,0.483059187403346,2.19452116307062,155,18,"GNA11, GNA14, GNB1, GNB2, GNB4, GNB5, GNG11, GNG12, GNG13, GNG2, GNG3, GNG4, GNG7, GNG8, GNGT2"
"6","ADP signalling through P2Y purinoceptor 12",0.0290406569196876,0.177444946650036,0.590997233925552,2.63864352658865,144,17,"GNAI1, GNAI2, GNAI3, GNB1, GNB2, GNB4, GNB5, GNG11, GNG12, GNG13, GNG2, GNG3, GNG4, GNG7, GNG8, GNGT2"
"7","APC-Cdc20 mediated degradation of Nek2A",0.0372833534864974,0.177444946650036,0.523096393165999,2.46611219419862,184,21,"ANAPC1, ANAPC10, ANAPC15, ANAPC16, ANAPC2, ANAPC4, ANAPC5, ANAPC7, BUB3, CDC16, CDC20, CDC23, CDC26, CDC27"
"8","APC/C-mediated degradation of cell cycle proteins",0.0123182552504039,0.177444946650036,-0.999929418407679,-5.22412722920006,60,76,"PTTG1"
"9","APC/C:Cdc20 mediated degradation of Cyclin B",0.0351160443995964,0.177444946650036,0.553135545556805,2.57486045150427,173,20,"ANAPC1, ANAPC10, ANAPC15, ANAPC16, ANAPC2, ANAPC4, ANAPC5, ANAPC7, CDC16, CDC20, CDC23, CDC26, CDC27, CDK1"
"10","APC/C:Cdc20 mediated degradation of Securin",0.00910010111223458,0.177444946650036,-0.999929488083486,-5.50725340760511,44,62,"PTTG1"
"11","APC/C:Cdc20 mediated degradation of mitotic proteins",0.0096579476861167,0.177444946650036,-0.999929468190154,-5.42888502531752,47,66,"PTTG1"
"12","APC/C:Cdh1 mediated degradation of Cdc20 and other APC/C:Cdh1 targeted proteins in late mitosis/early G1",0.0096579476861167,0.177444946650036,-0.999929468190154,-5.42888502531752,47,66,"PTTG1"
"13","APC:Cdc20 mediated degradation of cell cycle proteins prior to satisfation of the cell cycle checkpoint",0.0878147029204431,0.179302929269829,-0.394774504006467,-2.15341659562676,435,65,"UBE2E1, UBE2D1, UBC, UBB, RPS27A, PSMF1, PSME4, PSME3, PSME2, PSME1, PSMD9, PSMD8, PSMD7, PSMD6, PSMD5, PSMD4, PSMD3, PSMD2, PSMD14, PSMD13, PSMD12, PSMD11, PSMD10, PSMD1, PSMC6, PSMC5, PSMC4, PSMC3, PSMC2, PSMC1, PSMB9, PSMB8, PSMB7, PSMB6, PSMB5, PSMB4, PSMB3, PSMB2, PSMB10, PSMB1, PSMA8, PSMA7, PSMA6, PSMA5, PSMA4, PSMA3, PSMA1"
"14","ATF4 activates genes in response to endoplasmic reticulum  stress",0.0385232744783307,0.177444946650036,0.446088646271462,2.13364718299683,191,22,"ASNS, ATF4, ATF6, CEBPB, CEBPG, DCP2, DDIT3, DIS3, EXOSC1, EXOSC2, EXOSC3, EXOSC4, EXOSC5, EXOSC7, EXOSC8, EXOSC9"
"15","AUF1 (hnRNP D0) binds and destabilizes mRNA",0.0708502024291498,0.177444946650036,-0.554233445650507,-3.07274755542758,349,51,"UBC, UBB, RPS27A, PSMF1, PSME4, PSME3, PSME2, PSME1, PSMD9, PSMD8, PSMD7, PSMD6, PSMD5, PSMD4, PSMD3, PSMD2, PSMD14, PSMD13, PSMD12, PSMD11, PSMD10, PSMD1, PSMC6, PSMC5, PSMC4, PSMC3, PSMC2, PSMC1, PSMB9, PSMB8, PSMB7, PSMB6, PSMB5, PSMB4, PSMB3, PSMB2, PSMB10, PSMB1, PSMA8, PSMA7, PSMA6, PSMA5, PSMA4, PSMA3, PSMA1"
"16","AURKA Activation by TPX2",0.107845084409136,0.181397866039711,0.251058126410835,1.26427247676634,542,68,"ACTR1A, AKAP9, ALMS1, AURKA, CCP110, CDK1, CDK5RAP2, CENPJ, CEP131, CEP135, CEP152, CEP164, CEP192, CEP250, CEP290, CEP41, CEP57, CEP63, CEP70, CEP72, CEP76, CEP78, CETN2, CKAP5, CLASP1, CNTRL, CSNK1D, CSNK1E, DCTN1, DCTN2, DCTN3, DYNC1H1, DYNC1I2, DYNLL1"
"17","Abortive elongation of HIV-1 transcript in the absence of Tat",0.0327966607036374,0.177444946650036,-0.413408828951673,-2.05245603911108,164,23,"SUPT5H, SUPT4H1, POLR2L, POLR2K, POLR2J, POLR2I, POLR2H, POLR2G, POLR2F, POLR2E, POLR2D, POLR2C, POLR2B, POLR2A, NELFE, NELFCD, NELFB, NELFA, NCBP2, NCBP1"
"18","Activated NOTCH1 Transmits Signal to the Nucleus",0.107414829659319,0.181397866039711,0.234049700070131,1.18672224640898,535,31,"ADAM10, ADAM17, APH1A, APH1B, ARRB1, ARRB2, CNTN1, DLK1, DLL1, DLL4, DNER, DTX1, DTX2, DTX4, UBA52, ITCH, JAG1, JAG2, MIB1, MIB2, NCSTN, NEURL1, NEURL1B, NOTCH1, NUMB, PSEN1, PSEN2, PSENEN"
"19","Activation of APC/C and APC/C:Cdc20 mediated degradation of mitotic proteins",0.00970285021224985,0.177444946650036,-0.999929463215067,-5.41313114344574,47,67,"PTTG1"
"20","Activation of ATR in response to replication stress",0.0689998011533108,0.177444946650036,0.275497993946646,1.43040338935358,346,37,"ATR, ATRIP, CDC25A, CDC25C, CDC45, CDC6, CDC7, CDK2, CHEK1, CLSPN, DBF4, HUS1, MCM10, MCM2, MCM3, MCM4, MCM5, MCM6, MCM7, MCM8, ORC1, ORC2, ORC3, ORC4, ORC5, ORC6, RAD1, RAD17, RAD9A, RAD9B, RFC2, RFC3, RFC4, RFC5, RPA1, RPA2, RPA3"
"21","Activation of BH3-only proteins",0.0431364644224955,0.177444946650036,-0.323192702641289,-1.65247561725253,213,26,"YWHAZ, YWHAQ, YWHAH, YWHAG, YWHAE, YWHAB, TP73, TP63, TP53BP2, TP53, TFDP2, TFDP1"
"22","Activation of G protein gated Potassium channels",0.0351160443995964,0.177444946650036,0.574170416197975,2.67277832525425,173,20,"GABBR1, GABBR2, GNB1, GNB2, GNG12, GNG2, GNG3, GNG4, GNG7, GNG8, GNGT2, KCNJ10, KCNJ12, KCNJ15, KCNJ16, KCNJ2, KCNJ3, KCNJ4, KCNJ6, KCNJ9"
"23","Activation of GABAB receptors",0.0559581320450886,0.177444946650036,0.574655220940051,2.92801249717,277,32,"ADCY1, ADCY2, ADCY3, ADCY5, ADCY6, ADCY7, ADCY8, ADCY9, GABBR1, GABBR2, GNAI1, GNAI2, GNAI3, GNAL, GNB1, GNB2, GNG12, GNG2, GNG3, GNG4, GNG7, GNG8, GNGT2, KCNJ10, KCNJ12, KCNJ15, KCNJ16, KCNJ2, KCNJ3, KCNJ4, KCNJ6, KCNJ9"
"24","Activation of HOX genes during differentiation",0.0918244059605316,0.180867182164459,-0.208133073588717,-1.15396392047063,455,49,"ZNF335, YY1, WDR5, SUZ12, RXRA, RBBP7, RBBP5, RARG, RARB, RARA, POLR2L, POLR2K, POLR2J, POLR2I, POLR2H, POLR2G, POLR2F, POLR2E, POLR2D, POLR2C, POLR2B, POLR2A, PKNOX1, PIAS2, PCGF2, PBX1, PAXIP1, PAX6, PAGR1, NCOR1, NCOA6, NCOA3, MEIS1, MAFB, KMT2D, KMT2C, KDM6A, JUN, HOXD1, HDAC3, H3-3A"
"25","Activation of Matrix Metalloproteinases",0.281193671139595,0.322037444601213,0.241355074500984,1.05499572007334,1403,16,"COL18A1, CTRB1, CTRB2, CTSK, FURIN, MMP11, MMP14, MMP15, MMP16, MMP17, MMP2, MMP24"
"26","Activation of NF-kappaB in B cells",0.0861234368697055,0.177618758131686,-0.429306241184767,-2.35355843873205,426,64,"UBC, UBB, SKP1, RPS27A, RELA, REL, PSMF1, PSME4, PSME3, PSME2, PSME1, PSMD9, PSMD8, PSMD7, PSMD6, PSMD5, PSMD4, PSMD3, PSMD2, PSMD14, PSMD13, PSMD12, PSMD11, PSMD10, PSMD1, PSMC6, PSMC5, PSMC4, PSMC3, PSMC2, PSMC1, PSMB9, PSMB8, PSMB7, PSMB6, PSMB5, PSMB4, PSMB3, PSMB2, PSMB10, PSMB1, PSMA8, PSMA7, PSMA6, PSMA5, PSMA4, PSMA3, PSMA1, PRKCB"
"27","Activation of NMDA receptors and postsynaptic events",0.112408470215713,0.181446743261585,0.256291748988616,1.28351735256589,567,72,"ACTN2, ADCY1, ADCY8, APBA1, ARHGEF7, CALM1, CAMK1, CAMK2A, CAMK2B, CAMK2G, CAMK4, CAMKK1, CAMKK2, CASK, CREB1, DLG1, DLG2, DLG3, DLG4, ERBB4, GIT1, GRIA1, GRIA2, GRIA3, GRIA4, GRIN1, GRIN2A, GRIN2B, GRIN2C, GRIN2D, GRIN3A, GRIN3B, HRAS, KIF17, KPNA2, KRAS, LIN7A, LIN7B, LIN7C, LRRC7, MAPK1, MAPK3, MAPT, NEFL, NRAS, NRG1, NRGN, PDPK1, PPM1E, PPM1F, PRKAA1, PRKAA2, PRKAB1, PRKAB2, PRKACA, PRKACB, PRKAG1, PRKAG2, PRKAG3, PRKAR1A, PRKAR1B, PRKAR2A, PRKAR2B, PRKX, RAC1, RASGRF1, RASGRF2, RPS6KA1, RPS6KA2, RPS6KA3, RPS6KA6"
"28","Activation of anterior HOX genes in hindbrain development during early embryogenesis",0.0918244059605316,0.180867182164459,-0.208133073588717,-1.15396392047063,455,49,"ZNF335, YY1, WDR5, SUZ12, RXRA, RBBP7, RBBP5, RARG, RARB, RARA, POLR2L, POLR2K, POLR2J, POLR2I, POLR2H, POLR2G, POLR2F, POLR2E, POLR2D, POLR2C, POLR2B, POLR2A, PKNOX1, PIAS2, PCGF2, PBX1, PAXIP1, PAX6, PAGR1, NCOR1, NCOA6, NCOA3, MEIS1, MAFB, KMT2D, KMT2C, KDM6A, JUN, HOXD1, HDAC3, H3-3A"
"29","Activation of gene expression by SREBF (SREBP)",0.50088809946714,0.524959408950735,0.128986833767514,0.676352817596847,2537,41,"ACACA, ACACB, CARM1, CHD9, CREBBP, CYP51A1, DHCR7, ELOVL6, FASN, FDFT1, GGPS1, GPAM, HELZ2, HMGCR, HMGCS1, IDI1, LSS, MED1, MTF1, MVD, MVK, NCOA1, NCOA2, NCOA6, NFYA, NFYB, NFYC, PMVK, PPARA, RXRA, SC5D, SCD, SMARCD3, SP1, SQLE, SREBF1, SREBF2, TBL1X, TBL1XR1, TGS1, TM7SF2"
"30","Activation of kainate receptors upon glutamate binding",0.0438526231477773,0.177444946650036,0.518441521907307,2.550865683969,218,25,"CALM1, DLG1, DLG3, DLG4, GNB1, GNB2, GNB4, GNB5, GNG11, GNG12, GNG13, GNG2, GNG3, GNG4, GNG7, GNG8, GNGT2, GRIK1, GRIK2, GRIK3, GRIK4, GRIK5"
"31","Activation of the mRNA upon binding of the cap-binding complex and eIFs, and subsequent binding to 43S",0.0806451612903226,0.177444946650036,0.269230769230769,1.41557404693568,404,48,"EIF1AX, EIF2S1, EIF2S2, EIF2S3, EIF3A, EIF3B, EIF3C, EIF3D, EIF3E, EIF3F, EIF3G, EIF3H, EIF3I, EIF3J, EIF3K, EIF3L, EIF3M, EIF4A1, EIF4A2, EIF4E, EIF4EBP1, EIF4G1, EIF4H, FAU, RPS18, RPS11, RPS12, RPS13, RPS14, RPS15, RPS15A, RPS16, RPS17, RPS19, RPS20, RPS21, RPS24, RPS25, RPS27A, RPS27L, RPS28, RPS3A, RPS4X, RPS5, RPS7, RPS8, RPS9, RPSA"
"32","Activation of the pre-replicative complex",0.0490822027134876,0.177444946650036,-0.296355222274928,-1.59090967607471,245,31,"RPA3, RPA2, RPA1, PRIM2, PRIM1, POLE4, POLE3, POLE2, POLE, POLA2, POLA1, ORC6, ORC5, ORC4, ORC3, ORC2, ORC1, MCM8, MCM7, MCM6, MCM5, MCM4, MCM3, MCM2, MCM10"
"33","Acyl chain remodelling of PC",0.0288270377733598,0.177444946650036,-0.40796596059569,-1.91932378129082,144,19,"TMEM86B, PNPLA8, PLB1, PLAAT3, PLA2R1, PLA2G6, PLA2G5, PLA2G4E, PLA2G4A, PLA2G3, PLA2G2F, PLA2G12A, PLA2G10, MBOAT2, LPCAT4, LPCAT3, LPCAT2, LPCAT1"
"34","Acyl chain remodelling of PE",0.0430410297666935,0.177444946650036,0.360632688927944,1.66277441237522,213,19,"ABHD4, PLA2G4B, LPCAT3, LPCAT4, MBOAT1, MBOAT2, PLA2G10, PLA2G12A, PLA2G2F, PLA2G3, PLA2G4A, PLA2G4E, PLA2G5, PLA2G6, PLA2R1, PLAAT1, PLAAT3, PLAAT5, PNPLA8"
"35","Acyl chain remodelling of PS",0.033340028118096,0.177444946650036,-0.393941949539673,-1.71543714603818,165,15,"PLAAT3, PLA2R1, PLA2G5, PLA2G4E, PLA2G4A, PLA2G2F, PLA2G12A, PLA2G10, OSBPL8, OSBPL5, OSBPL10, MBOAT1, LPCAT4, LPCAT3"
"36","Adherens junctions interactions",0.0502411575562701,0.177444946650036,0.583899429214567,2.90666887255165,249,28,"AFDN, CADM1, CADM2, CADM3, CDH1, CDH10, CDH11, CDH12, CDH13, CDH18, CDH2, CDH24, CDH3, CDH4, CDH5, CDH6, CDH7, CDH8, CDH9, CTNNA1, CTNNB1, CTNND1"
"37","Adrenaline,noradrenaline inhibits insulin secretion",0.0422930446983363,0.177444946650036,0.650210970464135,3.17441829384354,210,24,"ADCY5, ADCY6, ADRA2A, ADRA2C, CACNA1C, CACNA1D, CACNA2D2, CACNB2, CACNB3, GNAI1, GNAI2, GNB1, GNB2, GNB4, GNB5, GNG11, GNG12, GNG13, GNG2, GNG3, GNG4, GNG7, GNG8, GNGT2"
"38","Aggrephagy",0.164480322906155,0.219235801012756,0.25130764904387,1.16984368819075,814,20,"ARL13B, CFTR, DYNC1H1, DYNC1I1, DYNC1I2, DYNC1LI1, DYNC1LI2, DYNLL1, DYNLL2, UBA52, HDAC6, HSF1, IFT88"
"39","Amine ligand-binding receptors",0.0466084886949623,0.177444946650036,0.607750738500492,3.00620963733244,234,26,"ADRA1A, ADRA1B, ADRA2A, ADRA2C, ADRB1, ADRB3, CHRM1, CHRM2, CHRM3, CHRM5, DRD1, DRD5, HRH1, HRH2, HRH3, HRH4, HTR1A, HTR1B, HTR1F, HTR2A, HTR2B, HTR2C, HTR4, HTR5A, HTR6, HTR7"
"40","Amino acid transport across the plasma membrane",0.0351437699680511,0.177444946650036,-0.775511639355792,-3.92673657429529,175,25,"SLC7A8, SLC7A6, SLC7A5, SLC7A3, SLC7A2, SLC7A11, SLC7A10, SLC7A1, SLC6A6, SLC6A20, SLC6A15, SLC43A2, SLC3A2, SLC3A1, SLC38A5, SLC38A4, SLC38A3, SLC38A2, SLC38A1, SLC36A4, SLC36A1, SLC25A29, SLC1A5, SLC1A4, SLC16A10"
"41","Amino acids regulate mTORC1",0.0833004342676668,0.177545516271502,0.257139636466112,1.35414489372947,421,50,"ATP6V0B, ATP6V0C, ATP6V0D1, ATP6V0D2, ATP6V0E1, ATP6V0E2, ATP6V1A, ATP6V1B2, ATP6V1C1, ATP6V1C2, ATP6V1D, ATP6V1E1, ATP6V1F, ATP6V1G1, ATP6V1G2, ATP6V1H, C12orf66, BMT2"
"42","Amplification  of signal from unattached  kinetochores via a MAD2  inhibitory signal",0.15107057890563,0.20897077378984,0.161280958993308,0.770422935875811,761,81,"AHCTF1, B9D2, BIRC5, BUB3, CDC20, CDCA8, CENPA, CENPC, CENPE, CENPH, CENPK, CENPL, CENPM, CENPN, CENPO, CENPP, CENPQ, CENPT, CENPU, CKAP5, CLASP1, CLASP2, CLIP1, DSN1, DYNC1H1, DYNC1I1, DYNC1I2, DYNC1LI1, DYNC1LI2, DYNLL1, DYNLL2, INCENP, ITGB3BP, KIF18A, KIF2A, KNL1, KNTC1, MAD1L1, MAD2L1, MAPRE1, MIS12, NDE1, NDEL1, NSL1, NUDC, NUF2, NUP107, NUP133, NUP160, NUP37, NUP43, NUP85, NUP98, PAFAH1B1, PLK1, PMF1, PPP1CC, PPP2CA, PPP2CB, PPP2R1A, PPP2R1B, PPP2R5A, PPP2R5B, PPP2R5C, PPP2R5D, PPP2R5E"
"43","Amplification of signal from the kinetochores",0.15107057890563,0.20897077378984,0.161280958993308,0.770422935875811,761,81,"AHCTF1, B9D2, BIRC5, BUB3, CDC20, CDCA8, CENPA, CENPC, CENPE, CENPH, CENPK, CENPL, CENPM, CENPN, CENPO, CENPP, CENPQ, CENPT, CENPU, CKAP5, CLASP1, CLASP2, CLIP1, DSN1, DYNC1H1, DYNC1I1, DYNC1I2, DYNC1LI1, DYNC1LI2, DYNLL1, DYNLL2, INCENP, ITGB3BP, KIF18A, KIF2A, KNL1, KNTC1, MAD1L1, MAD2L1, MAPRE1, MIS12, NDE1, NDEL1, NSL1, NUDC, NUF2, NUP107, NUP133, NUP160, NUP37, NUP43, NUP85, NUP98, PAFAH1B1, PLK1, PMF1, PPP1CC, PPP2CA, PPP2CB, PPP2R1A, PPP2R1B, PPP2R5A, PPP2R5B, PPP2R5C, PPP2R5D, PPP2R5E"
"44","Amyloid fiber formation",0.543157469173236,0.564069306892165,-0.121069102568931,-0.66795532247815,2686,43,"USP9X, UBE2L6, UBC, UBB, TTR, TSPAN5, TSPAN33, TSPAN15, TSPAN14"
"45","Anchoring of the basal body to the plasma membrane",0.1449821499405,0.206053649026532,0.20772298277091,0.946058159888682,730,92,"ACTR1A, AHI1, AKAP9, ALMS1, B9D1, B9D2, C2CD3, CC2D2A, CCP110, CDK1, CDK5RAP2, CENPJ, CEP131, CEP135, CEP152, CEP162, CEP164, CEP192, CEP250, CEP290, CEP41, CEP57, CEP63, CEP70, CEP72, CEP76, CEP78, CEP83, CEP89, CEP97, CETN2, CKAP5, CLASP1, CNTRL, CSNK1D, CSNK1E, DCTN1, DCTN2, DCTN3, DYNC1H1, DYNC1I2, DYNLL1"
"46","Antigen Presentation: Folding, assembly and peptide loading of class I MHC",0.0413173652694611,0.177444946650036,-0.367690469496767,-1.63765271189226,206,16,"TAPBP, TAP2, TAP1, SEC31A, SEC24D, SEC24B, SEC24A, SEC23A, SEC13, SAR1B"
"47","Antigen activates B Cell Receptor (BCR) leading to generation of second messengers",0.756107328794553,0.764309676542818,0.129224277375343,0.635816694387742,3775,25,"AHCYL1, BLNK, BTK, CALM1, DAPP1, FYN, GRB2, IGHM, ITPR1, ITPR2, ITPR3, LYN, NCK1, ORAI1, ORAI2, PIK3AP1, PIK3CD, PIK3R1, PLCG2"
"48","Antigen processing-Cross presentation",0.109116579265833,0.181397866039711,-0.400569036168838,-2.08793459029747,540,81,"VAMP8, UBC, UBB, TLR4, TLR2, TIRAP, TAPBP, TAP2, TAP1, STX4, SNAP23, SEC61G, SEC61B, SEC61A2, SEC61A1, SEC22B, RPS27A, PSMF1, PSME4, PSME3, PSME2, PSME1, PSMD9, PSMD8, PSMD7, PSMD6, PSMD5, PSMD4, PSMD3, PSMD2, PSMD14, PSMD13, PSMD12, PSMD11, PSMD10, PSMD1, PSMC6, PSMC5, PSMC4, PSMC3, PSMC2, PSMC1, PSMB9, PSMB8, PSMB7, PSMB6, PSMB5, PSMB4, PSMB3, PSMB2, PSMB10, PSMB1, PSMA8, PSMA7, PSMA6, PSMA5, PSMA4, PSMA3, PSMA1"
"49","Antigen processing: Ubiquitination & Proteasome degradation",0.167603581095149,0.219999525868585,-0.999570415980526,-2.85653263537266,804,277,"RNF220"
"50","Antimicrobial peptides",0.127727727727728,0.191974834379485,0.276746801630817,1.2572511378069,637,18,"ATOX1, ATP7A, BPIFB4, CAMP, CHGA, CLU, DEFB136, DEFB130B, DEFB130A"
"51","Antiviral mechanism by IFN-stimulated genes",0.0986312399355878,0.181397866039711,-0.205003960118575,-1.09410391215374,489,71,"USP41, USP18, UBE2N, UBE2L6, UBE2E1, UBC, UBB, TRIM25, TPR, STAT1, SEH1L, SEC13, RPS27A, RNASEL, RANBP2, RAE1, PPM1B, POM121C, POM121, PLCG1, PIN1, PDE12, OAS1, NUP42, NUP58, NUP98, NUP93, NUP88, NUP85, NUP54, NUP50, NUP43, NUP37, NUP35, NUP214, NUP210, NUP205, NUP188, NUP160, NUP155, NUP153, NUP133, NUP107, NEDD4, NDC1, MAPK3, KPNB1, KPNA7, KPNA4, KPNA3, KPNA2, KPNA1, JAK1, ISG15, IRF3, UBA52, FLNB, FLNA, EIF4G3, EIF4G2, EIF4G1, EIF4E2, EIF4E, EIF4A3, EIF4A2, EIF4A1, EIF2AK2"
"52","Apoptosis",0.194562791641307,0.243798119110439,-0.189655942102674,-0.764774085742976,958,151,"YWHAZ, YWHAQ, YWHAH, YWHAG, YWHAE, YWHAB, XIAP, VIM, UNC5B, UNC5A, UBC, UBB, TP73, TP63, TP53BP2, TP53, TRAF2, TRADD, TNFRSF10B, TLR4, TJP2, TJP1, TICAM1, TFDP2, TFDP1, STK26, STK24, STAT3, SPTAN1, SATB1, RPS27A, ROCK1, RIPK1, PTK2, PSMF1, PSME4, PSME3, PSME2, PSME1, PSMD9, PSMD8, PSMD7, PSMD6, PSMD5, PSMD4, PSMD3, PSMD2, PSMD14, PSMD13, PSMD12, PSMD11, PSMD10, PSMD1, PSMC6, PSMC5, PSMC4, PSMC3, PSMC2, PSMC1, PSMB9, PSMB8, PSMB7, PSMB6, PSMB5, PSMB4, PSMB3, PSMB2, PSMB10, PSMB1, PSMA8, PSMA7, PSMA6, PSMA5, PSMA4, PSMA3, PSMA1, PRKCQ, PRKCD, PPP3R1, PPP3CC, PPP1R13B"
"53","Apoptotic cleavage of cellular proteins",0.215010949631694,0.262326619286362,0.182882076752159,0.943268748938782,1079,35,"ACIN1, ADD1, APC, BCAP31, BIRC2, CASP3, CASP6, CASP7, CDH1, CLSPN, CTNNB1, DBNL, DSG2, DSG3, DSP"
"54","Apoptotic execution phase",0.165905026822968,0.219990494817002,0.182972217192749,0.95916692362873,834,42,"ACIN1, ADD1, APC, BCAP31, BIRC2, CASP3, CASP6, CASP7, CDH1, CLSPN, CTNNB1, DBNL, DFFA, DFFB, DNM1L, DSG2, DSG3, DSP"
"55","Aquaporin-mediated transport",0.0636309405448399,0.177444946650036,0.379831792093353,1.97211121217745,319,37,"ADCY1, ADCY2, ADCY3, ADCY5, ADCY6, ADCY7, ADCY8, ADCY9, AQP11, AQP12A, AQP4, AQP9, AVP, GNAS, GNB1, GNB2, GNB4, GNB5, GNG11, GNG12, GNG13, GNG2, GNG3, GNG4, GNG7, GNG8, GNGT2"
"56","Arachidonic acid metabolism",0.0677093644822807,0.177444946650036,0.299908476485497,1.57296815324229,341,40,"ABCC1, ALOX12, ALOX12B, ALOX5, ALOX5AP, ALOX15B, ALOXE3, CBR1, CYP1B1, CYP2J2, CYP2U1, CYP4B1, CYP4F8, CYP4F2, CYP4F3, EPHX2, FAAH, GGT1, GGT5, GPX1, GPX4, HPGD, HPGDS, LTA4H, LTC4S, MAPKAPK2, PLA2G4A, PON1, PON2, PON3, PRXL2B, PTGDS, PTGES2, PTGES3, PTGIS, PTGR1, PTGR2, PTGS1, PTGS2"
"57","Asparagine N-linked glycosylation",0.360405121345309,0.39383288846369,0.122318590105505,0.316896909376143,1885,259,"ACTR10, ACTR1A, ALG1, ALG10, ALG10B, ALG11, ALG12, ALG14, ALG2, ALG3, ALG5, ALG6, ALG8, ALG9, AMDHD2, AMFR, ANK1, ANK2, ANK3, ANKRD28, ARCN1, AREG, ARF1, ARF3, ARF4, ARF5, ARFGAP1, ARFGAP2, ARFGAP3, ASGR1, B4GALNT2, B4GALT1, B4GALT2, B4GALT3, B4GALT4, B4GALT5, B4GALT6, BET1L, CALR, CANX, CAPZA2, CAPZB, CD55, CD59, CGA, CHST10, CHST8, CMAS, CNIH1, CNIH2, CNIH3, COG1, COG2, COG3, COG4, COG5, COG6, COG7, COG8, COPA, COPB1, COPB2, COPE, COPG1, COPG2, COPZ1, COPZ2, CSNK1D, CTSA, CTSC, CTSZ, DAD1, DCTN1, DCTN2, DCTN3, DCTN4, DCTN5, DCTN6, DDOST, DERL1, DERL2, DHDDS, DOLK, DOLPP1, DPAGT1, DPM2, DPM3, DYNC1H1, DYNC1I1, DYNC1I2, DYNC1LI1, DYNC1LI2, DYNLL1, DYNLL2, EDEM1, EDEM2, EDEM3"
"58","Assembly Of The HIV Virion",0.0223552894211577,0.177444946650036,-0.473379955018274,-2.10838199900074,111,16,"VPS37D, VPS37C, VPS37B, VPS37A, VPS28, UBC, UBB, UBAP1, TSG101"
"59","Assembly and cell surface presentation of NMDA receptors",0.0406356869845102,0.177444946650036,0.49129425864383,2.37605872031429,201,23,"ACTN2, APBA1, CAMK2A, CAMK2B, CAMK2G, CASK, DLG1, DLG2, DLG3, DLG4, GRIN1, GRIN2A, GRIN2B, GRIN2C, GRIN2D, GRIN3A, GRIN3B, KIF17, LIN7A, LIN7B, LIN7C, LRRC7"
"60","Assembly of collagen fibrils and other multimeric structures",0.0690744029998027,0.177444946650036,0.455621708227221,2.38908900324819,349,41,"BMP1, CD151, COL11A1, COL11A2, COL15A1, COL18A1, COL1A1, COL1A2, COL2A1, COL3A1, COL4A1, COL4A2, COL4A4, COL4A5, COL5A1, COL5A2, COL5A3, COL6A2, COL6A3, COL6A5, COL6A6, COL8A1, COL8A2, COL9A1, COL9A2, CTSB, CTSS"
"61","Assembly of the pre-replicative complex",0.0847799757771498,0.177618758131686,-0.411785051091165,-2.26338289285159,419,63,"UBC, UBB, RPS27A, PSMF1, PSME4, PSME3, PSME2, PSME1, PSMD9, PSMD8, PSMD7, PSMD6, PSMD5, PSMD4, PSMD3, PSMD2, PSMD14, PSMD13, PSMD12, PSMD11, PSMD10, PSMD1, PSMC6, PSMC5, PSMC4, PSMC3, PSMC2, PSMC1, PSMB9, PSMB8, PSMB7, PSMB6, PSMB5, PSMB4, PSMB3, PSMB2, PSMB10, PSMB1, PSMA8, PSMA7, PSMA6, PSMA5, PSMA4, PSMA3, PSMA1, ORC6, ORC5, ORC4, ORC3, ORC2, ORC1, MCM8, MCM7, MCM6, MCM5, MCM4, MCM3, MCM2"
"62","Association of TriC/CCT with target proteins during biosynthesis",0.0666666666666667,0.177444946650036,0.338542766631468,1.76642143281985,334,39,"AP3M1, ARFGEF2, CCNE1, CCNE2, CCT2, CCT3, CCT4, CCT5, CCT6A, CCT6B, CCT7, CCT8, DCAF7, FBXL3, FBXL5, FBXO4, FBXO6, FBXW10, FBXW2, FBXW4, FBXW5, FBXW7, FBXW9, FKBP9, GAPDHS, GBA"
"63","Asymmetric localization of PCP proteins",0.0818843509906996,0.177444946650036,-0.498407814481202,-2.7532793137613,404,61,"WNT5A, VANGL2, UBC, UBB, SMURF2, SMURF1, SCRIB, RPS27A, PSMF1, PSME4, PSME3, PSME2, PSME1, PSMD9, PSMD8, PSMD7, PSMD6, PSMD5, PSMD4, PSMD3, PSMD2, PSMD14, PSMD13, PSMD12, PSMD11, PSMD10, PSMD1, PSMC6, PSMC5, PSMC4, PSMC3, PSMC2, PSMC1, PSMB9, PSMB8, PSMB7, PSMB6, PSMB5, PSMB4, PSMB3, PSMB2, PSMB10, PSMB1, PSMA8, PSMA7, PSMA6, PSMA5, PSMA4, PSMA3, PSMA1, PRICKLE1"
"64","Attenuation phase",0.0460671897002615,0.177444946650036,0.347174876101784,1.67905054317703,228,23,"COL4A6, CREBBP, DEDD2, DNAJB1, DNAJB6, EP300, FKBP4, GML, HSBP1, HSF1, HSP90AB1, HSPA1A, HSPA1B, HSPA1L, HSPA2, HSPA8, HSPH1"
"65","Autodegradation of Cdh1 by Cdh1:APC/C",0.0792099368763999,0.177444946650036,-0.43440731735003,-2.40913102566765,388,59,"UBE2E1, UBE2D1, UBC, UBB, RPS27A, PSMF1, PSME3, PSME2, PSME1, PSMD9, PSMD8, PSMD7, PSMD6, PSMD5, PSMD4, PSMD3, PSMD2, PSMD14, PSMD13, PSMD12, PSMD11, PSMD10, PSMD1, PSMC6, PSMC5, PSMC4, PSMC3, PSMC2, PSMC1, PSMB9, PSMB8, PSMB7, PSMB6, PSMB5, PSMB4, PSMB3, PSMB2, PSMB10, PSMB1, PSMA7, PSMA6, PSMA5, PSMA4, PSMA3, PSMA1"
"66","Autodegradation of the E3 ubiquitin ligase COP1",0.0660642570281124,0.177444946650036,-0.630353620738236,-3.50124369084331,328,48,"UBC, UBB, TP53, RPS27A, PSMF1, PSME4, PSME3, PSME2, PSME1, PSMD9, PSMD8, PSMD7, PSMD6, PSMD5, PSMD4, PSMD3, PSMD2, PSMD14, PSMD13, PSMD12, PSMD11, PSMD10, PSMD1, PSMC6, PSMC5, PSMC4, PSMC3, PSMC2, PSMC1, PSMB9, PSMB8, PSMB7, PSMB6, PSMB5, PSMB4, PSMB3, PSMB2, PSMB10, PSMB1, PSMA8, PSMA7, PSMA6, PSMA5, PSMA4, PSMA3, PSMA1"
"67","Autophagy",0.237008355410638,0.281498915754234,-0.114415018437814,-0.519827770339223,1162,114,"WIPI2, WIPI1, WDR45B, VPS37D, VPS37C, VPS37B, VPS37A, VPS28, VDAC1, VCP, UVRAG, ULK1, UBE2N, UBC, UBB, UBAP1, TSG101, TSC2, TSC1, TOMM70, TOMM7, TOMM6, TOMM40, TOMM22, TOMM20"
"68","Axon guidance",0.425883694412771,0.455250769628532,0.999202146950025,1.87102825616299,2240,457,"UNC5C, ABL1"
"69","B-WICH complex positively regulates rRNA expression",0.0903853794199444,0.180867182164459,-0.236938854489164,-1.27347829770006,454,32,"ZNRD1, TWISTNB, TBP, TAF1D, TAF1C, TAF1B, TAF1A, SMARCA5, SF3B1, POLR2L, POLR2K, POLR2H, POLR2F, POLR2E, POLR1E, POLR1D, POLR1C, POLR1B, POLR1A"
"70","BBSome-mediated cargo-targeting to cilium",0.0372833534864974,0.177444946650036,0.480117716776649,2.26349134014762,184,21,"ARL6, BBS1, BBS10, BBS2, BBS4, BBS5, BBS7, BBS9, CCT2, CCT3, CCT4, CCT5, CCT8"
"71","BMAL1:CLOCK,NPAS2 activates circadian gene expression",0.291750100120144,0.330435196268672,0.194489063928546,0.956936237007814,1456,25,"ARNTL, ARNTL2, AVP, BHLHE40, BHLHE41, CARM1, CHD9, CLOCK, CREBBP, DBP, HELZ2, KLF15, MED1, NAMPT, NCOA1, NCOA2, NCOA6, NOCT, NPAS2"
"72","Base Excision Repair",0.0602385284010511,0.177444946650036,-0.362226374493771,-1.99845402048241,297,43,"XRCC1, TINF2, TERF2IP, TERF2, TERF1, TDG, SMUG1, RPA3, RPA2, RPA1, RFC5, RFC4, RFC3, RFC2, RFC1, POT1, POLE4, POLE3, POLE2, POLE, POLD4, POLD2, POLD1, POLB, PNKP, PCNA, PARP2, PARP1, PARG, OGG1, NTHL1, NEIL3, NEIL2, NEIL1, MUTYH, MPG, MBD4, LIG3, LIG1"
"73","Base-Excision Repair, AP Site Formation",0.0255489021956088,0.177444946650036,-0.425200309249367,-1.89379518183508,127,16,"TINF2, TERF2IP, TERF2, TERF1, TDG, SMUG1, POT1, OGG1, NTHL1, NEIL3, NEIL2, NEIL1, MUTYH, MPG, MBD4"
"74","Basigin interactions",0.353781174577635,0.387007154687381,0.207662565905097,0.957472829270252,1758,19,"ATP1B1, ATP1B2, ATP1B3, BSG, ITGA3, ITGA6, ITGB1, L1CAM, MAG, PPIA, PPIL2, SLC16A1, SLC16A3, SLC3A2, SLC7A10, SLC7A11, SLC7A5, SLC7A6, SLC7A8"
"75","Beta-catenin independent WNT signaling",0.174538820190553,0.227033363826545,-0.20111913853835,-0.859726769348785,860,134,"WNT5B, WNT5A, WNT4, VANGL2, UBC, UBB, TNRC6C, TNRC6B, TNRC6A, TCF7L2, TCF7L1, TCF7, SMURF2, SMURF1, SCRIB, RYK, RPS27A, ROR1, RHOA, RAC3, RAC2, RAC1, PSMF1, PSME4, PSME3, PSME2, PSME1, PSMD9, PSMD8, PSMD7, PSMD6, PSMD5, PSMD4, PSMD3, PSMD2, PSMD14, PSMD13, PSMD12, PSMD11, PSMD10, PSMD1, PSMC6, PSMC5, PSMC4, PSMC3, PSMC2, PSMC1, PSMB9, PSMB8, PSMB7, PSMB6, PSMB5, PSMB4, PSMB3, PSMB2, PSMB10, PSMB1, PSMA8, PSMA7, PSMA6, PSMA5, PSMA4, PSMA3, PSMA1, PRKG2, PRKG1, PRKCG, PRKCB, PRKCA, PRICKLE1, PPP3R1, PPP3CB, PPP3CA"
"76","Beta-catenin phosphorylation cascade",0.0532745844181855,0.177444946650036,0.345961903423069,1.54462675036574,265,17,"AMER1, APC, AXIN1, CSNK1A1, CTNNB1, FRAT1, FRAT2, GSK3B, PPP2CA, PPP2CB, PPP2R1A, PPP2R1B, PPP2R5A, PPP2R5B, PPP2R5C, PPP2R5D, PPP2R5E"
"77","Bile acid and bile salt metabolism",0.371462734157035,0.404192465510574,-0.174259298336108,-0.905141828689274,1863,27,"STARD5, SLCO1A2, SLC27A5, SLC27A2, SLC10A1, SCP2, RXRA, PTGIS, OSBPL9, OSBPL7, OSBPL6, OSBPL3, OSBPL2, OSBPL1A, OSBP, NCOA2, NCOA1"
