"","pathway","pval","padj","ES","NES","nMoreExtreme","size","leadingEdge"
"761","Response to elevated platelet cytosolic Ca2+",0.493211752786221,0.515088080530771,-0.0820903067149395,-0.958722920272313,2433,100,"WDR1, VTI1B, VEGFD, VEGFC, VEGFB, VEGFA, VCL, TUBA4A, TTN, TF, TMX3, TMSB4X, TLN1, TIMP3, TGFB3, TGFB2, TGFB1, TEX264, STXBP3, STXBP2, STX4, SRGN, SPARC, SOD1, SERPING1, SERPINF2, SERPINE1, SERPINA3, SELP, SELENOP, SCG3, SCCPDH, RAB27B, QSOX1, PSAP, PROS1, PRKCG, PRKCB, PRKCA, PPIA, PLEK, PHACTR2, PFN1, PECAM1, PDGFB, PDGFA, PCYOX1L, PCDH7"
"762","Retinoid metabolism and transport",0.0872162485065711,0.110324827170705,0.22203075066295,1.40700905997921,437,32,"AGRN, AKR1B10, APOA1, APOA2, APOE, APOM, BCO1, CLPS, GPC1, GPC3, GPC4, GPC5, GPC6, HSPG2, LDLR, LPL, LRP1, LRP10, LRP12, LRP2, LRP8, PLB1, RBP1, RBP2, RBP4, RDH11, RETSAT, SDC1, SDC2, SDC3, SDC4"
"763","Retrograde transport at the Trans-Golgi-Network",0.188394276629571,0.213074749550475,-0.159039970963205,-1.25969155432027,947,45,"VTI1A, VPS54, VPS53, VPS52, VPS51, VAMP4, USP6NL, TMF1, TGOLN2, STX6, STX16, SCOC, RIC1, RHOBTB3, RGP1, RABEPK, RAB9B, RAB9A, RAB6B, RAB6A, PLIN3, NSF, NAPG, NAPB, NAPA, NAA38, NAA35, NAA30"
"764","Rev-mediated nuclear export of HIV RNA",2e-04,0.000853517877739331,-0.516573321958879,-3.52387903518551,0,33,"XPO1, TPR, SEH1L, SEC13, RCC1, RANGAP1, RANBP2, RANBP1, RAE1, POM121, POM121C, NUP42, NUP58, NUP98, NUP93, NUP88, NUP85, NUP54, NUP50, NUP43, NUP37, NUP35, NUP214, NUP210, NUP205, NUP188, NUP160, NUP155, NUP153, NUP133, NUP107"
"765","Rho GTPase cycle",0.0543605788032851,0.0761048103245991,0.403996115656966,3.21287030093873,277,126,"ABR, AKAP13, ARAP1, ARAP2, ARAP3, ARHGAP1, ARHGAP10, ARHGAP11B, ARHGAP11A, ARHGAP12, ARHGAP15, ARHGAP17, ARHGAP18, ARHGAP19, ARHGAP20, ARHGAP21, ARHGAP22, ARHGAP23, ARHGAP24, ARHGAP25, ARHGAP26, ARHGAP27, ARHGAP28, ARHGAP29, ARHGAP30, ARHGAP31, ARHGAP32, ARHGAP33, ARHGAP35, ARHGAP39, ARHGAP4, ARHGAP40, ARHGAP42, ARHGAP44, ARHGAP5, ARHGAP6, ARHGAP8, ARHGDIA, ARHGDIB, ARHGDIG, ARHGEF1, ARHGEF10, ARHGEF10L, ARHGEF11, ARHGEF12, ARHGEF15, ARHGEF17, ARHGEF18, ARHGEF19, ARHGEF2, ARHGEF26, ARHGEF3, ARHGEF33, ARHGEF37, ARHGEF4, ARHGEF40, ARHGEF6, ARHGEF7, ARHGEF9"
"766","Ribosomal scanning and start codon recognition",0.0206206206206206,0.0384225952571276,0.271390647335103,1.95713477015423,102,48,"EIF1AX, EIF2S1, EIF2S2, EIF2S3, EIF3A, EIF3B, EIF3C, EIF3D, EIF3E, EIF3F, EIF3G, EIF3H, EIF3I, EIF3J, EIF3K, EIF3L, EIF3M, EIF4A1, EIF4A2, EIF4E, EIF4G1, EIF4H, EIF5, FAU, RPS18, RPS11, RPS12, RPS13, RPS14, RPS15, RPS15A, RPS16, RPS17, RPS19, RPS20, RPS21, RPS24, RPS25, RPS27A, RPS27L, RPS28, RPS3A, RPS4X, RPS5, RPS7, RPS8, RPS9, RPSA"
"767","Role of phospholipids in phagocytosis",0.0134042972600039,0.0288108961854027,-0.318987319332995,-1.83334965444146,67,23,"SYK, PRKCE, PRKCD, PLPP5, PLPP4, PLD4, PLD3, PLD2, PLD1, PLCG2, PLCG1, PLA2G6, PIK3R2, PIK3R1, PIK3CB, PIK3CA"
"768","S Phase",0.00020755500207555,0.000853517877739331,-0.194395027747941,-2.74287585444529,0,147,"WEE1, WAPL, UBE2E1, UBE2D1, UBC, UBB, TFDP2, TFDP1, STAG2, STAG1, SMC3, SMC1A, SKP2, SKP1, RPS27A, RPA3, RPA2, RPA1, RFC5, RFC4, RFC3, RFC2, RFC1, RBX1, RBL2, RB1, RAD21, PTK6, PSMF1, PSME4, PSME3, PSME2, PSME1, PSMD9, PSMD8, PSMD7, PSMD6, PSMD5, PSMD4, PSMD3, PSMD2, PSMD14, PSMD13, PSMD12, PSMD11, PSMD10, PSMD1, PSMC6, PSMC5, PSMC4, PSMC3, PSMC2, PSMC1, PSMB9, PSMB8, PSMB7, PSMB6, PSMB5, PSMB4, PSMB3, PSMB2, PSMB10, PSMB1, PSMA7, PSMA6, PSMA5, PSMA4, PSMA3, PSMA1, PRIM2, PRIM1, POLE4, POLE3, POLE2, POLE, POLD4, POLD2, POLD1, POLA2, POLA1, PDS5B, PDS5A, PCNA, ORC6, ORC5, ORC4, ORC3, ORC2, ORC1"
"769","S33 mutants of beta-catenin aren't phosphorylated",0.0413108242303873,0.0622969634682405,0.346577017114914,1.59255434786438,207,15,"AMER1, APC, AXIN1, CSNK1A1, CTNNB1, GSK3B, PPP2CA, PPP2CB, PPP2R1A, PPP2R1B, PPP2R5A, PPP2R5B, PPP2R5C, PPP2R5D, PPP2R5E"
"770","S37 mutants of beta-catenin aren't phosphorylated",0.0413108242303873,0.0622969634682405,0.346577017114914,1.59255434786438,207,15,"AMER1, APC, AXIN1, CSNK1A1, CTNNB1, GSK3B, PPP2CA, PPP2CB, PPP2R1A, PPP2R1B, PPP2R5A, PPP2R5B, PPP2R5C, PPP2R5D, PPP2R5E"
"771","S45 mutants of beta-catenin aren't phosphorylated",0.0413108242303873,0.0622969634682405,0.346577017114914,1.59255434786438,207,15,"AMER1, APC, AXIN1, CSNK1A1, CTNNB1, GSK3B, PPP2CA, PPP2CB, PPP2R1A, PPP2R1B, PPP2R5A, PPP2R5B, PPP2R5C, PPP2R5D, PPP2R5E"
"772","SCF(Skp2)-mediated degradation of p27/p21",0.000201288244766506,0.000853517877739331,-0.492612934297195,-4.35641877768147,0,56,"UBC, UBB, SKP2, SKP1, RPS27A, PTK6, PSMF1, PSME3, PSME2, PSME1, PSMD9, PSMD8, PSMD7, PSMD6, PSMD5, PSMD4, PSMD3, PSMD2, PSMD14, PSMD13, PSMD12, PSMD11, PSMD10, PSMD1, PSMC6, PSMC5, PSMC4, PSMC3, PSMC2, PSMC1, PSMB9, PSMB8, PSMB7, PSMB6, PSMB5, PSMB4, PSMB3, PSMB2, PSMB10, PSMB1, PSMA7, PSMA6, PSMA5, PSMA4, PSMA3, PSMA1"
"773","SCF-beta-TrCP mediated degradation of Emi1",0.000201979398101394,0.000853517877739331,-0.553581154684096,-4.66018260745929,0,51,"UBC, UBB, SKP1, RPS27A, PSMF1, PSME4, PSME3, PSME2, PSME1, PSMD9, PSMD8, PSMD7, PSMD6, PSMD5, PSMD4, PSMD3, PSMD2, PSMD14, PSMD13, PSMD12, PSMD11, PSMD10, PSMD1, PSMC6, PSMC5, PSMC4, PSMC3, PSMC2, PSMC1, PSMB9, PSMB8, PSMB7, PSMB6, PSMB5, PSMB4, PSMB3, PSMB2, PSMB10, PSMB1, PSMA7, PSMA6, PSMA5, PSMA4, PSMA3, PSMA1"
"774","SHC-mediated cascade:FGFR1",0.0135674381484437,0.0290410452929498,0.382217090069284,1.85929907380527,67,17,"FGF1, FGF10, FGF17, FGF2, FGF20, FGF22, FGF23, FGF5, FGF9, FGFR1, GRB2, HRAS, KL, KRAS"
"775","SHC-mediated cascade:FGFR2",0.00798562587342783,0.0202994263354686,0.402856836384439,2.05908938121559,39,19,"FGF1, FGF10, FGF16, FGF17, FGF18, FGF2, FGF20, FGF22, FGF23, FGF5, FGF7, FGF9, FGFR2, GRB2, HRAS"
"776","SHC-mediated cascade:FGFR3",0.0195266272189349,0.0369827893945458,0.371149731712287,1.7617155434718,98,16,"FGF1, FGF16, FGF17, FGF18, FGF2, FGF20, FGF23, FGF5, FGF9, FGFR3, GRB2, HRAS, KRAS"
"777","SHC-mediated cascade:FGFR4",0.0195266272189349,0.0369827893945458,0.371149731712287,1.7617155434718,98,16,"FGF1, FGF16, FGF17, FGF18, FGF2, FGF20, FGF23, FGF9, FGFR4, GRB2, HRAS, KLB, KRAS"
"778","SHC1 events in ERBB2 signaling",0.233485419559611,0.259818361615206,0.224002989333514,1.17644266348912,1176,20,"BTC, EGF, EGFR, ERBB2, ERBB4, GRB2, HBEGF, HRAS, KRAS, NRAS, NRG1, NRG2, NRG3, NRG4, PRKCA, PRKCD, PRKCE, PTPN12"
"779","SLC transporter disorders",0.000203210729526519,0.000853517877739331,-0.488866327724523,-5.0799318609666,0,78,"TPR, SLCO2A1, SLC9A9, SLC9A6, SLC7A7, SLC6A20, SLC6A19, SLC5A5, SLC5A2, SLC5A1, SLC4A4, SLC4A1, SLC40A1, SLC3A2, SLC3A1, SLC35C1, SLC35A3, SLC35A2, SLC35A1, SLC34A2, SLC34A1, SLC33A1, SLC2A9, SLC2A2, SLC2A1, SLC29A3, SLC27A4, SLC26A4, SLC26A3, SLC26A2, SLC24A5, SLC24A4, SLC24A1, SLC22A5, SLC22A18, SLC20A2, SLC1A3, SLC1A1, SLC17A8, SLC17A5, SLC16A1, SLC12A6, SLC12A3, SLC12A1, SLC11A2, SEH1L, SEC13, RANBP2, RAE1, POM121, POM121C, NUP42, NUP58, NUP98, NUP93, NUP88, NUP85, NUP54, NUP50, NUP43, NUP37, NUP35, NUP214, NUP210, NUP205, NUP188, NUP160, NUP155, NUP153, NUP133, NUP107"
"780","SLC-mediated transmembrane transport",0.00020708221163802,0.000853517877739331,-0.705452575830525,-11.6058186952434,0,200,"SRI, SLCO4C1, SLCO3A1, SLCO2B1, SLCO2A1, SLCO1C1, SLCO1A2, SLC9A9, SLC9A8, SLC9A7, SLC9A6, SLC9A5, SLC9A4, SLC9A3, SLC9A2, SLC9A1, SLC8B1, SLC8A3, SLC8A2, SLC8A1, SLC7A8, SLC7A7, SLC7A6, SLC7A5, SLC7A3, SLC7A2, SLC7A11, SLC7A10, SLC7A1, SLC6A9, SLC6A7, SLC6A6, SLC6A20, SLC6A19, SLC6A15, SLC6A13, SLC6A11, SLC6A1, SLC5A8, SLC5A6, SLC5A5, SLC5A4, SLC5A2, SLC5A12, SLC5A11, SLC5A10, SLC5A1, SLC50A1, SLC4A9, SLC4A8, SLC4A7, SLC4A5, SLC4A4, SLC4A3, SLC4A2, SLC4A10, SLC4A1, SLC47A1, SLC44A5, SLC44A4, SLC44A3, SLC44A2, SLC44A1, SLC43A2, SLC43A1, SLC41A2, SLC41A1, SLC40A1, SLC3A2, SLC3A1, SLC39A8, SLC39A7, SLC39A6, SLC39A3, SLC39A2, SLC39A14, SLC39A10, SLC39A1, SLC38A4, SLC38A2, SLC38A1, SLC36A4, SLC36A1, SLC35D2, SLC35D1, SLC35C1, SLC35B4, SLC35B3, SLC35B2, SLC35A3, SLC35A2, SLC35A1, SLC34A2, SLC34A1, SLC33A1, SLC32A1, SLC31A1, SLC30A8, SLC30A7, SLC30A6, SLC30A5, SLC30A3, SLC30A10, SLC30A1, SLC2A9, SLC2A8, SLC2A7, SLC2A6, SLC2A2, SLC2A13, SLC2A12, SLC2A1, SLC29A4, SLC29A3, SLC29A2, SLC29A1, SLC28A3, SLC28A2, SLC28A1, SLC27A6, SLC27A4, SLC27A1, SLC26A9, SLC26A6, SLC26A4, SLC26A3, SLC26A2, SLC26A11, SLC25A5, SLC25A4, SLC25A29, SLC25A26, SLC25A22, SLC25A18, SLC24A5, SLC24A4, SLC24A3, SLC24A2, SLC24A1, SLC22A8, SLC22A7, SLC22A5, SLC22A4, SLC22A3, SLC22A2, SLC22A18, SLC22A15, SLC22A1, SLC20A2, SLC20A1, SLC1A7, SLC1A6, SLC1A5, SLC1A4, SLC1A3, SLC1A2, SLC1A1, SLC18A2, SLC18A1, SLC17A8, SLC17A7, SLC17A6, SLC17A5, SLC16A7, SLC16A3, SLC16A2, SLC16A10, SLC16A1, SLC15A4, SLC15A3, SLC15A2, SLC15A1, SLC14A2, SLC14A1, SLC13A5, SLC13A4, SLC13A1, SLC12A7, SLC12A6, SLC12A5, SLC12A3, SLC12A2, SLC12A1, SLC11A2, SLC11A1"
"781","SMAD2/SMAD3:SMAD4 heterotrimer regulates transcription",0.0689724110355858,0.0917271088997007,-0.231477326806717,-1.50827073328906,344,30,"WWTR1, UBC, UBB, TGIF2, TFDP2, TFDP1, SP1, SNW1, SMAD7, SMAD4, SMAD3, SMAD2, SERPINE1, RPS27A, RNF111, RBL1"
"782","SRP-dependent cotranslational protein targeting to membrane",0.000204123290467442,0.000853517877739331,-0.654604392806567,-6.93596005545249,0,82,"TRAM1, SSR4, SSR3, SSR2, SSR1, SRPRB, SRPRA, SRP9, SRP72, SRP68, SRP54, SRP19, SRP14, SPCS2, SPCS1, SEC61G, SEC61B, SEC61A2, SEC61A1, SEC11C, SEC11A, RPSA, RPS9, RPS8, RPS7, RPS5, RPS4X, RPS3A, RPS28, RPS27L, RPS27A, RPS25, RPS24, RPS21, RPS20, RPS19, RPS17, RPS16, RPS15A, RPS15, RPS14, RPS13, RPS12, RPS11, RPN2, RPN1, RPLP1, RPL8, RPL7A, RPL6, RPL5, RPL4, RPL3L, RPL38, RPL37A, RPL36, RPL35, RPL34, RPL32, RPL30, RPL3, RPL29, RPL28, RPL27, RPL26, RPL23, RPL22L1, RPL19, RPL18A, RPL18, RPL14, RPL13A, RPL12, RPL11, RPL10A, RPL10"
"783","SUMO E3 ligases SUMOylate target proteins",0.00020755500207555,0.000853517877739331,-0.245567881757966,-3.46491482474831,0,147,"ZNF131, XRCC4, XPC, WRN, VDR, UHRF2, UBE2I, TP53BP1, TP53, TRIM28, TRIM27, TPR, TOPORS, TOP2B, TOP1, THRB, THRA, TDG, SUZ12, SUMO2, SUMO1, STAG2, STAG1, SP3, SMC6, SMC5, SMC3, SMC1A, SIN3A, SEH1L, SEC13, SCMH1, SATB2, SATB1, SAFB, RXRA, RPA1, RORA, RNF2, RNF168, RING1, RELA, RARA, RANGAP1, RANBP2, RAE1, RAD52, RAD21, PPARGC1A, PPARG, PPARA, POM121, POM121C, PML, PIAS4, PIAS3, PIAS2, PIAS1, PHC3, PHC2, PHC1, PGR, PCNA, PCGF2, PARP1, PARK7, NUP42, NUP58, NUP98, NUP93, NUP88, NUP85, NUP54, NUP50, NUP43, NUP37, NUP35, NUP214, NUP210, NUP205, NUP188, NUP160, NUP155, NUP153, NUP133, NUP107, NSMCE2, NSMCE1, NRIP1, NR5A1, NR4A2, NR3C2, NR3C1, NR2C1, NR1H3, NR1H2, NOP58, NFKBIA, NFKB2, NDC1, NCOR2, NCOA2, NCOA1"
"784","SUMOylation",0.000208073241781107,0.000853517877739331,-0.257530051647699,-3.70278816520205,0,153,"ZNF131, XRCC4, XPC, WRN, VDR, UHRF2, UBE2I, UBA2, TP53BP1, TP53, TRIM28, TRIM27, TPR, TOPORS, TOP2B, TOP1, THRB, THRA, TDG, SUZ12, SUMO2, SUMO1, STAG2, STAG1, SP3, SMC6, SMC5, SMC3, SMC1A, SIN3A, SENP5, SENP2, SENP1, SEH1L, SEC13, SCMH1, SATB2, SATB1, SAFB, SAE1, RXRA, RWDD3, RPA1, RORA, RNF2, RNF168, RING1, RELA, RARA, RANGAP1, RANBP2, RAE1, RAD52, RAD21, PPARGC1A, PPARG, PPARA, POM121, POM121C, PML, PIAS4, PIAS3, PIAS2, PIAS1, PHC3, PHC2, PHC1, PGR, PCNA, PCGF2, PARP1, PARK7, NUP42, NUP58, NUP98, NUP93, NUP88, NUP85, NUP54, NUP50, NUP43, NUP37, NUP35, NUP214, NUP210, NUP205, NUP188, NUP160, NUP155, NUP153, NUP133, NUP107, NSMCE2, NSMCE1, NRIP1, NR5A1, NR4A2, NR3C2, NR3C1, NR2C1, NR1H3, NR1H2, NOP58, NFKBIA, NFKB2, NDC1, NCOR2, NCOA2, NCOA1"
"785","SUMOylation of DNA damage response and repair proteins",0.000201450443190975,0.000853517877739331,-0.401275771062396,-3.9565872334595,0,70,"XRCC4, XPC, WRN, UBE2I, TPR, TDG, SUMO2, SUMO1, STAG2, STAG1, SMC6, SMC5, SMC3, SMC1A, SEH1L, SEC13, SCMH1, RPA1, RNF2, RNF168, RING1, RANBP2, RAE1, RAD52, RAD21, POM121, POM121C, PML, PIAS4, PIAS2, PIAS1, PHC3, PHC2, PHC1, PCGF2, PARP1, NUP42, NUP58, NUP98, NUP93, NUP88, NUP85, NUP54, NUP50, NUP43, NUP37, NUP35, NUP214, NUP210, NUP205, NUP188, NUP160, NUP155, NUP153, NUP133, NUP107, NSMCE2, NSMCE1"
"786","SUMOylation of DNA methylation proteins",0.494082840236686,0.515478169672917,0.199097500509407,0.945044900600139,2504,16,"BMI1, CBX2, CBX4, CBX8, DNMT1, DNMT3A, DNMT3B"
"787","SUMOylation of DNA replication proteins",0.000197355437142293,0.000853517877739331,-0.434403522584784,-3.32889459363818,0,42,"UBE2I, TPR, TOP2B, TOP1, SUMO2, SUMO1, SEH1L, SEC13, RANGAP1, RANBP2, RAE1, POM121, POM121C, PIAS4, PIAS3, PCNA, NUP42, NUP58, NUP98, NUP93, NUP88, NUP85, NUP54, NUP50, NUP43, NUP37, NUP35, NUP214, NUP210, NUP205, NUP188, NUP160, NUP155, NUP153, NUP133, NUP107"
"788","SUMOylation of RNA binding proteins",0.000198570293884035,0.000853517877739331,-0.392234989154847,-3.14616827725108,0,46,"UBE2I, TPR, SUMO2, SUMO1, SEH1L, SEC13, SCMH1, RNF2, RING1, RANBP2, RAE1, POM121, POM121C, PHC3, PHC2, PHC1, PCGF2, NUP42, NUP58, NUP98, NUP93, NUP88, NUP85, NUP54, NUP50, NUP43, NUP37, NUP35, NUP214, NUP210, NUP205, NUP188, NUP160, NUP155, NUP153, NUP133, NUP107, NOP58, NDC1"
"789","SUMOylation of SUMOylation proteins",0.000200080032012805,0.000853517877739331,-0.518395103706222,-3.58631754702825,0,34,"UBE2I, TPR, TOPORS, SUMO2, SUMO1, SEH1L, SEC13, RANBP2, RAE1, POM121, POM121C, PIAS4, NUP42, NUP58, NUP98, NUP93, NUP88, NUP85, NUP54, NUP50, NUP43, NUP37, NUP35, NUP214, NUP210, NUP205, NUP188, NUP160, NUP155, NUP153, NUP133, NUP107"
"790","SUMOylation of chromatin organization proteins",0.000203748981255094,0.000853517877739331,-0.355101577573488,-3.07381859160913,0,54,"UBE2I, TPR, SUZ12, SUMO2, SUMO1, SEH1L, SEC13, SCMH1, SATB2, SATB1, RNF2, RING1, RANBP2, RAE1, POM121, POM121C, PIAS2, PIAS1, PHC3, PHC2, PHC1, PCGF2, NUP42, NUP58, NUP98, NUP93, NUP88, NUP85, NUP54, NUP50, NUP43, NUP37, NUP35, NUP214, NUP210, NUP205, NUP188, NUP160, NUP155, NUP153, NUP133, NUP107"
"791","SUMOylation of intracellular receptors",0.000198965380023876,0.000853517877739331,-0.45234460367336,-2.74507859611309,0,26,"VDR, UBE2I, THRB, THRA, SUMO2, SUMO1, RXRA, RORA, RARA, PPARG, PPARA, PIAS4, PIAS3, PIAS2, PIAS1, PGR, NR5A1, NR4A2, NR3C2, NR3C1, NR2C1, NR1H3, NR1H2"
"792","SUMOylation of transcription cofactors",0.128769841269841,0.15351617440225,-0.179627890305301,-1.36085033896762,648,41,"ZNF131, UHRF2, UBE2I, TRIM28, TOPORS, SUMO2, SUMO1, SIN3A, SCMH1, SAFB, RNF2, RING1, PPARGC1A, PIAS4, PIAS3, PIAS2, PIAS1, PHC3, PHC2, PHC1, PCGF2, PARK7, NRIP1, NCOR2, NCOA2, NCOA1, MRTFA"
"793","SUMOylation of ubiquitinylation proteins",0.0002000400080016,0.000853517877739331,-0.496187317776217,-3.56618918575611,0,37,"UBE2I, TRIM27, TPR, SUMO1, SEH1L, SEC13, RANBP2, RAE1, POM121, POM121C, PML, PIAS4, PIAS2, PIAS1, NUP42, NUP58, NUP98, NUP93, NUP88, NUP85, NUP54, NUP50, NUP43, NUP37, NUP35, NUP214, NUP210, NUP205, NUP188, NUP160, NUP155, NUP153, NUP133, NUP107"
"794","Scavenging by Class A Receptors",0.00591715976331361,0.0172820997675882,0.453495381376078,2.15258100437543,29,16,"APOA1, APOE, CALR, COL1A1, COL1A2, COL3A1, COL4A1, COL4A2, COLEC11, COLEC12, FTH1, FTL, HSP90B1, MARCO, MASP1"
"795","Selective autophagy",0.424909164311667,0.449648512999885,-0.120762475321669,-1.00344277093676,2104,50,"VDAC1, VCP, ULK1, UBE2N, UBC, UBB, TOMM70, TOMM7, TOMM40, TOMM22, TOMM20, SRC, SQSTM1, RPS27A, PRKAG3, PRKAG2, PRKAG1, PRKAB2, PRKAB1, PRKAA2, PLIN3, PLIN2, PINK1, PGAM5, PCNT, PARK7, MTERF3, MFN2, MFN1, MAP1LC3A, IFT88, HSPA8, HSF1, HDAC6, UBA52, FUNDC1, DYNLL2, DYNLL1, DYNC1LI2, DYNC1LI1, DYNC1I2, DYNC1I1, DYNC1H1, CSNK2B, CSNK2A2, CSNK2A1"
"796","Selenoamino acid metabolism",0.000203252032520325,0.000853517877739331,-0.479887047885957,-4.94680437693848,0,77,"TXNRD1, SEPSECS, SEPHS2, SECISBP2, SCLY, RPSA, RPS9, RPS8, RPS7, RPS5, RPS4X, RPS3A, RPS28, RPS27L, RPS27A, RPS25, RPS24, RPS21, RPS20, RPS19, RPS17, RPS16, RPS15A, RPS15, RPS14, RPS13, RPS12, RPS11, RPLP1, RPL8, RPL7A, RPL6, RPL5, RPL4, RPL3L, RPL38, RPL37A, RPL36, RPL35, RPL34, RPL32, RPL30, RPL3, RPL29, RPL28, RPL27, RPL26, RPL23, RPL22L1, RPL19, RPL18A, RPL18, RPL14, RPL13A, RPL12, RPL11, RPL10A, RPL10"
"797","Selenocysteine synthesis",0.000202265372168285,0.000853517877739331,-0.630009209054325,-5.83982246928077,0,62,"SEPSECS, SEPHS2, SECISBP2, RPSA, RPS9, RPS8, RPS7, RPS5, RPS4X, RPS3A, RPS28, RPS27L, RPS27A, RPS25, RPS24, RPS21, RPS20, RPS19, RPS17, RPS16, RPS15A, RPS15, RPS14, RPS13, RPS12, RPS11, RPLP1, RPL8, RPL7A, RPL6, RPL5, RPL4, RPL3L, RPL38, RPL37A, RPL36, RPL35, RPL34, RPL32, RPL30, RPL3, RPL29, RPL28, RPL27, RPL26, RPL23, RPL22L1, RPL19, RPL18A, RPL18, RPL14, RPL13A, RPL12, RPL11, RPL10A, RPL10"
"798","Sema3A PAK dependent Axon repulsion",0.271300893743793,0.297426164993196,0.248437924477044,1.14159588565313,1365,15,"CFL1, FES, FYN, HSP90AB1, LIMK1, NRP1, PAK1, PAK2, PAK3, PLXNA1, PLXNA2, PLXNA3, PLXNA4, RAC1, SEMA3A"
"799","Sema4D in semaphorin signaling",0.0608903972848872,0.0838862388126903,-0.272826107099396,-1.52861604728167,304,22,"SEMA4D, RRAS, ROCK2, ROCK1, RND1, RHOC, RHOB, RHOA, RAC1, MYL9, MYL12B, MYH9, MYH14, MYH11, MYH10, MET, LIMK2, LIMK1"
"800","Sema4D induced cell migration and growth-cone collapse",0.0841475573280159,0.107493057203236,-0.28792201616738,-1.46954805004564,421,18,"SEMA4D, ROCK2, ROCK1, RND1, RHOC, RHOB, RHOA, MYL9, MYL12B, MYH9, MYH14, MYH11, MYH10, LIMK2, LIMK1"
"801","Semaphorin interactions",0.0376577287066246,0.0586783464280895,0.198605474011513,1.51881629953543,190,61,"ARHGAP35, ARHGEF11, ARHGEF12, CD72, CDK5, CDK5R1, CFL1, CRMP1, DPYSL2, DPYSL3, DPYSL4, DPYSL5, ERBB2, FARP2, FES, FYN, GSK3B, HSP90AB1, ITGA1, ITGB1, LIMK1, LIMK2, MET, MYH10, MYH11, MYH14, MYH9, MYL12B, MYL9, NRP1, PAK1, PAK2, PAK3, PIP5K1C, PLXNA1, PLXNA2, PLXNA3, PLXNA4, PLXNB3, PLXNC1, PLXND1, PTPRC, RAC1, RHOA, RHOB, RHOC, RND1, ROCK1, ROCK2, RRAS, SEMA3A, SEMA3E, SEMA4A, SEMA4D, SEMA5A, SEMA6A, SEMA6D, SEMA7A"
"802","Senescence-Associated Secretory Phenotype (SASP)",0.0174453579306196,0.0345571526120878,0.32599678307402,2.29524385284828,86,44,"ANAPC1, ANAPC10, ANAPC15, ANAPC16, ANAPC2, ANAPC4, ANAPC5, ANAPC7, CCNA1, CCNA2, CDC16, CDC23, CDC26, CDC27, CDK4, CDK6, CDKN1A, CDKN1B, CDKN2B, CDKN2D, CEBPB"
"803","Separation of Sister Chromatids",0.000208073241781107,0.000853517877739331,-0.177064765300059,-2.54585169083197,0,153,"ZWINT, ZWILCH, ZW10, XPO1, WAPL, UBE2E1, UBE2D1, UBC, UBB, TAOK1, STAG2, STAG1, SPDL1, SPC25, SPC24, SMC3, SMC1A, SKA2, SGO2, SEH1L, SEC13, RPS27A, RCC2, RANGAP1, RANBP2, RAD21, PTTG1, PSMF1, PSME4, PSME3, PSME2, PSME1, PSMD9, PSMD8, PSMD7, PSMD6, PSMD5, PSMD4, PSMD3, PSMD2, PSMD14, PSMD13, PSMD12, PSMD11, PSMD10, PSMD1, PSMC6, PSMC5, PSMC4, PSMC3, PSMC2, PSMC1, PSMB9, PSMB8, PSMB7, PSMB6, PSMB5, PSMB4, PSMB3, PSMB2, PSMB10, PSMB1, PSMA7, PSMA6, PSMA5, PSMA4, PSMA3, PSMA1, PPP2R5E, PPP2R5D, PPP2R5C, PPP2R5B, PPP2R5A, PPP2R1B, PPP2R1A, PPP2CB, PPP2CA, PPP1CC, PMF1, PLK1, PDS5B, PDS5A, PAFAH1B1, NUP98, NUP85, NUP43, NUP37, NUP160, NUP133, NUP107, NUF2, NUDC"
"804","Serotonin Neurotransmitter Release Cycle",0.000199401794616152,0.000853517877739331,-0.592362384801757,-3.02340543141984,0,18,"VAMP2, UNC13B, TSPOAP1, SYT1, SYN3, SYN2, SYN1, STXBP1, STX1A, SNAP25, SLC18A2, RIMS1, RAB3A, PPFIA4, PPFIA3, PPFIA2, PPFIA1"
"805","Sialic acid metabolism",0.000199920031987205,0.000853517877739331,-0.440682575294038,-2.87142002266791,0,30,"ST8SIA6, ST8SIA5, ST8SIA4, ST8SIA3, ST8SIA1, ST6GALNAC6, ST6GALNAC5, ST6GALNAC4, ST6GALNAC3, ST6GALNAC2, ST6GAL2, ST6GAL1, ST3GAL6, ST3GAL5, ST3GAL4, ST3GAL3, ST3GAL2, ST3GAL1, SLC35A1, SLC17A5"
"806","Signal amplification",0.0066079295154185,0.0177848988584018,0.423607207496587,2.31701713292744,32,22,"GNA11, GNA13, GNA14, GNA15, GNAI1, GNAI2, GNAI3, GNB1, GNB4, GNB5, GNG11, GNG12, GNG13, GNG2, GNG3, GNG4, GNG7"
"807","Signal transduction by L1",0.03017669247568,0.0502621437376277,0.310931221245123,1.67152914576312,151,21,"CSNK2A1, CSNK2A2, CSNK2B, EGFR, FGFR1, ITGA2B, ITGA5, ITGA9, ITGAV, ITGB1, ITGB3, L1CAM, MAP2K1, MAP2K2, MAPK1, MAPK3, NCAM1, NRP1, PAK1"
"808","Signaling by BMP",0.0415821501014199,0.0625241037809448,0.288287223607549,1.59293876062159,204,23,"ACVR2A, ACVR2B, ACVRL1, AMH, AMHR2, BMP2, BMPR1A, BMPR1B, BMPR2"
"809","Signaling by BRAF and RAF fusions",0.0302316450726345,0.050272847985954,0.220489539590663,1.64660069401698,153,54,"AGGF1, AGK, AGTRAP, AKAP9, AP3B1, APBB1IP, ARAF, ARRB1, ARRB2, ATG7, BCL2L11, BRAF, CALM1, CAMK2A, CAMK2B, CAMK2G, CLCN6, CNKSR2, CSK, FAM114A2, FAM131B, FN1, FXR1, HRAS, IQGAP1, ITGA2B, ITGB3, JAK2, KDM7A, KRAS, KSR1, KSR2, LMNA, MAP2K1, MAP2K2, MAPK1, MAPK3, MARK3"
"810","Signaling by EGFR",0.54507379337854,0.563007427657196,-0.112557999432315,-0.912222547546841,2732,47,"UBC, UBB, TGFA, STAM2, STAM, SRC, SPRY2, SPRY1, SOS1, SHC1, SH3KBP1, SH3GL3, SH3GL2, SH3GL1, RPS27A, PXN, PTPRK, PTPN3, PTPN12, PTPN11, PLCG1, PIK3R1, PIK3CA"
"811","Signaling by EGFR in Cancer",0.909491389667601,0.912132700576607,0.11303254739417,0.618257537303197,4541,22,"AREG, BTC, CBL, CDC37, EGF, EGFR, GAB1, UBA52, GRB2, HBEGF, HRAS"
"812","Signaling by ERBB2",0.596330275229358,0.610472495195271,-0.108618961831884,-0.880298748857537,2989,47,"YES1, USP8, UBC, UBB, STUB1, SRC, SOS1, SHC1, RPS27A, RNF41, RHOA, PTPN18, PTPN12, PTK6, PRKCE, PRKCD, PRKCA, PLCG1, PIK3R1, PIK3CA, NRG4, NRG3, NRG2, NRG1, NRAS, MEMO1, MATK, KRAS, HRAS, HBEGF, GRB7, GRB2, UBA52, GAB1, FYN, ERBIN, ERBB4, ERBB2, EGFR, EGF"
"813","Signaling by ERBB2 KD Mutants",0.0596716059271125,0.0825364268898379,0.279071203987967,1.52644419052293,297,22,"BTC, CDC37, EGF, EGFR, ERBB2, ERBB4, ERBIN, GAB1, GRB2, HBEGF, HRAS, KRAS, NRAS, NRG1, NRG2, NRG3, NRG4, PIK3CA, PIK3R1, PLCG1"
"814","Signaling by ERBB2 in Cancer",0.129614604462475,0.154345666923131,0.239502700402992,1.32337857353272,638,23,"BTC, CDC37, EGF, EGFR, ERBB2, ERBB4, ERBIN, GAB1, GRB2, HBEGF, HRAS, KRAS, NRAS, NRG1, NRG2, NRG3, NRG4, PIK3CA, PIK3R1, PLCG1"
"815","Signaling by ERBB4",0.507538712306438,0.528452367788412,-0.109461657776265,-0.947518400341118,2490,54,"YAP1, WWP1, WWOX, UBC, UBB, TAB2, STMN1, SRC, SPARC, SOS1, SHC1, S100B, RPS27A, PSENEN, PSEN2, PSEN1, PIK3R1, PIK3CA, PGR, NRG4, NRG3, NRG2, NRG1, NRAS, NEDD4, NCSTN, NCOR1, MXD4, KRAS, ITCH, HRAS, HBEGF, GRB2, UBA52, GFAP, GABRQ, GABRG3, GABRG2, GABRB3, GABRB2, GABRB1, GABRA1, ESR1, ERBB4, EGFR, EGF"
"816","Signaling by Erythropoietin",0.163808397397989,0.188143569516981,-0.228130872046988,-1.31116075808069,830,23,"STAT5B, SOS1, SHC1, RAPGEF1, PLCG2, PLCG1, PIK3R5, PIK3R1, PIK3CG, PIK3CD, PIK3CB, PIK3CA, NRAS, LYN, KRAS, JAK2, IRS2, HRAS, GRB2, GAB1, EPOR, EPO"
"817","Signaling by FGFR",0.000203376042302217,0.000853517877739331,-0.279215138712908,-2.85929417848757,0,76,"UBC, UBB, TIAL1, TIA1, SRC, SPRY2, SPRED2, SPRED1, SOS1, SHC1, RPS27A, RBFOX2, PTPN11, PTBP1, PPP2R1A, PPP2CB, PPP2CA, POLR2L, POLR2K, POLR2J, POLR2I, POLR2H, POLR2G, POLR2F, POLR2E, POLR2D, POLR2C, POLR2B, POLR2A, PLCG1, PIK3R1, PIK3CA, NRAS, NCBP2, NCBP1, MKNK1, MAPK3, MAPK1, KRAS, KLB, KL, HRAS, HNRNPM, HNRNPH1, HNRNPF, HNRNPA1, GTF2F2, GTF2F1, GRB2, UBA52, GALNT3, GAB1, FRS3, FRS2, FLRT3, FLRT2, FGFRL1, FGFR4, FGFR3, FGFR2, FGFR1, FGFBP3, FGF9, FGF7, FGF5, FGF23, FGF22, FGF20, FGF2, FGF18, FGF17, FGF16, FGF10, FGF1"
"818","Signaling by FGFR in disease",0.0242078331037197,0.0430916066932193,0.254088676661601,1.92996021353673,122,58,"BAG4, BCR, CNTRL, CPSF6, CUX1, ERLIN2, FGF1, FGF10, FGF16, FGF17, FGF18, FGF2, FGF20, FGF22, FGF23, FGF5, FGF7, FGF9, FGFR1, FGFR1OP, FGFR1OP2, FGFR2, FGFR3, FGFR4, FRS2, GAB1, GAB2, GRB2, GTF2F1, GTF2F2, HRAS, KRAS, LRRFIP1, MYO18A, NCBP1, NCBP2, NRAS, PIK3CA, PIK3R1, PLCG1, POLR2A, POLR2B, POLR2C, POLR2D, POLR2E, POLR2F, POLR2G, POLR2H, POLR2I, POLR2J, POLR2K, POLR2L"
"819","Signaling by FGFR1",0.00538384845463609,0.0160739682968386,-0.259411055089857,-2.02845785750128,26,44,"UBC, UBB, SRC, SPRY2, SPRED2, SPRED1, SOS1, SHC1, RPS27A, PTPN11, PPP2R1A, PPP2CB, PPP2CA, PLCG1, PIK3R1, PIK3CA, NRAS, MKNK1, MAPK3, MAPK1, KRAS, KL, HRAS, GRB2, UBA52, GAB1, FRS3, FRS2, FLRT3, FLRT2, FGFRL1, FGFR1, FGF9, FGF5, FGF23, FGF22, FGF20, FGF2, FGF18, FGF17, FGF10, FGF1"
"820","Signaling by FGFR1 in disease",0.0443645083932854,0.0657534058590038,0.238320299217953,1.54784901722112,221,34,"BAG4, BCR, CNTRL, CPSF6, CUX1, ERLIN2, FGF1, FGF17, FGF2, FGF20, FGF23, FGF5, FGF9, FGFR1, FGFR1OP, FGFR1OP2, FRS2, GAB1, GAB2"
"821","Signaling by FGFR2",0.000202224469160768,0.000853517877739331,-0.274532663738061,-2.61011645975451,0,65,"UBC, UBB, TIAL1, TIA1, SRC, SPRY2, SOS1, SHC1, RPS27A, RBFOX2, PTPN11, PTBP1, PPP2R1A, PPP2CB, PPP2CA, POLR2L, POLR2K, POLR2J, POLR2I, POLR2H, POLR2G, POLR2F, POLR2E, POLR2D, POLR2C, POLR2B, POLR2A, PLCG1, PIK3R1, PIK3CA, NRAS, NCBP2, NCBP1, MKNK1, MAPK3, MAPK1, KRAS, HRAS, HNRNPM, HNRNPH1, HNRNPF, HNRNPA1, GTF2F2, GTF2F1, GRB2, UBA52, GAB1, FRS3, FRS2, FGFR2, FGFBP3, FGF9, FGF7, FGF5, FGF23, FGF22, FGF20, FGF2, FGF18, FGF17, FGF16, FGF10, FGF1"
"822","Signaling by FGFR2 IIIa TM",0.0153723298063486,0.031661498368543,0.356997282608696,1.82469117401524,76,19,"FGF1, FGF2, FGFR2, GTF2F1, GTF2F2, NCBP1, NCBP2, POLR2A, POLR2B, POLR2C, POLR2D, POLR2E, POLR2F, POLR2G, POLR2H, POLR2I, POLR2J, POLR2K, POLR2L"
"823","Signaling by FGFR2 in disease",0.0139902676399027,0.0297296860348563,0.331773940345369,2.26089889425184,68,39,"FGF1, FGF10, FGF16, FGF17, FGF18, FGF2, FGF20, FGF22, FGF23, FGF5, FGF7, FGF9, FGFR2, FRS2, GAB1, GRB2, GTF2F1, GTF2F2, HRAS, KRAS, NCBP1, NCBP2, NRAS, PIK3CA, PIK3R1, PLCG1, POLR2A, POLR2B, POLR2C, POLR2D, POLR2E, POLR2F, POLR2G, POLR2H, POLR2I, POLR2J, POLR2K, POLR2L"
"824","Signaling by FGFR3",0.0142574257425743,0.0300217338807051,-0.252109595122423,-1.83983441644349,71,38,"UBC, UBB, SRC, SPRY2, SOS1, SHC1, RPS27A, PTPN11, PPP2R1A, PPP2CB, PPP2CA, PLCG1, PIK3R1, PIK3CA, NRAS, MKNK1, MAPK3, MAPK1, KRAS, HRAS, GRB2, UBA52, GALNT3, GAB1, FRS3, FRS2, FGFR3, FGF9, FGF5, FGF23, FGF20, FGF2, FGF18, FGF17, FGF16, FGF1"
