"","pathway","pval","padj","ES","NES","nMoreExtreme","size","leadingEdge"
"744","Regulation of TP53 Activity through Methylation",0.459836808703536,0.882202221634539,-0.411545248763317,-1.00003450847093,2535,18,"KMT5A, JMY, TTC5, UBB, MDM2, EHMT2, MDM4"
"745","Regulation of TP53 Activity through Phosphorylation",0.995841035120148,0.999106145251397,0.18896821690162,0.648849709578464,4309,90,"ATM, TAF1, TAF1L, TAF3, RFC2, RAD17, PRKAA2, RMI1, WRN, TAF9, TAF6, TP53INP1, RMI2, BLM, RAD9B, TP53, TAF12"
"746","Regulation of TP53 Degradation",0.323358642251005,0.803146692419936,0.382606945821099,1.08791483188705,1447,33,"ATM, SGK1, PHF20, USP2, USP7, RICTOR, PPP2R5C, PPP2R1A"
"747","Regulation of TP53 Expression and Degradation",0.372478709099059,0.83619643727818,0.368791917878235,1.05361683220109,1661,34,"ATM, SGK1, PHF20, USP2, USP7, RICTOR, PPP2R5C, PPP2R1A"
"748","Regulation of actin dynamics for phagocytic cup formation",0.556163135110504,0.926440843122684,0.30124202186697,0.941360641337528,2440,54,"ELMO1, VAV3, BAIAP2, BRK1, CYFIP2"
"749","Regulation of activated PAK-2p34 by proteasome mediated degradation",0.0176596503745986,0.446408190284879,-0.521675003401135,-1.54424480772695,98,48,"PSMD4, PSMD3, PSMC3, PAK2, PSMC6, PSMC2, UBB, PSMB4, PSMD12, PSME4, PSME3, PSMD13, PSMA3, PSMC5, PSMB1, PSMA1, PSMB8, PSMD2, PSMD6, PSME1, PSMB7, PSMA4"
"750","Regulation of beta-cell development",0.251676352257488,0.744394844705245,0.425870354137899,1.1666677796506,1125,28,"MAML2, CREBBP, KAT2B, MAML1, PAX6, MAMLD1, FOXO1"
"751","Regulation of cholesterol biosynthesis by SREBP (SREBF)",0.526241134751773,0.915730572554279,-0.317109029074869,-0.954253173707399,2967,52,"SAR1B, SEC24A, NCOA1, CHD9, SMARCD3, ELOVL6, MTF1, SQLE, CARM1, CYP51A1, ACACA, KPNB1, MBTPS2, SC5D, SREBF2"
"752","Regulation of expression of SLITs and ROBOs",0.837740999829381,0.990941572957721,-0.239000910841136,-0.838304124115595,4909,136,"SLIT1, PSMD4, PSMD3, ZSWIM8, ISL1, RPL8, PSMC3, PSMC6, PSMC2, UBB, PSMB4, PSMD12, MSI1, PSME4, PSME3, PSMD13, RPS15A, UPF3A, ELOC, PSMA3, EIF4G1, NCBP1, PSMC5, RPL34, UPF3B, PSMB1, PSMA1, PSMB8, PSMD2, PSMD6"
"753","Regulation of insulin secretion",0.302440749911567,0.786046503483033,-0.344775212723353,-1.09030974293157,1709,69,"CHRM3, CACNA2D2, PRKCA, GNAS, GNAI1, CACNA1A, GNB3"
"754","Regulation of lipid metabolism by PPARalpha",0.790360873694207,0.990099867216044,0.243363053997084,0.857639360901057,3328,108,"TIAM2, RORA, NCOA2, ARNT2, CREBBP, NPAS2, ABCB4, HMGCS1, GPS2, ABCA1, ARNTL, ALAS1, PPARGC1B, ESRRA, MED4, FDFT1, HMGCR, NCOA6, SIN3B, NFYA, MED24, MED10, TXNRD1, SP1, CLOCK, AHR, RXRB, MED6, MED17, GRHL1, AHRR, APOA1, MED12, MED1"
"755","Regulation of mRNA stability by proteins that bind AU-rich elements",0.0411847178408693,0.494192539647085,-0.426881211286291,-1.3869399957942,234,81,"PRKCA, PRKCD, KHSRP, PSMD4, PSMD3, MAPK11, PSMC3, ENPP2, PSMC6, PSMC2, UBB, PSMB4, PSMD12, PSME4, PSME3, PSMD13, PSMA3, EIF4G1, XRN1, PSMC5, ZFP36L1, PSMB1, PSMA1, DIS3, PSMB8, PSMD2, PSMD6"
"756","Regulation of mitotic cell cycle",0.264214046822742,0.756520983449543,-0.345403918091601,-1.11450070932173,1500,78,"PSMD4, PSMD3, UBE2D1, PSMC3, PSMC6, ANAPC2, PSMC2, UBB, PSMB4, PSMD12, PSME4, PSME3, PSMD13, PSMA3, PSMC5, PTTG1, PSMB1, PSMA1, CDC23, PSMB8, PSMD2, PSMD6, ANAPC1, ANAPC10, PSME1, PSMB7, PSMA4"
"757","Regulation of ornithine decarboxylase (ODC)",0.0178126113288208,0.446408190284879,-0.516986158037341,-1.53690940921003,99,49,"PSMD4, PSMD3, OAZ2, ODC1, PSMC3, PSMC6, PSMC2, PSMB4, PSMD12, PSME4, PSME3, PSMD13, PSMA3, PSMC5, PSMB1, PSMA1, PSMB8, PSMD2, PSMD6"
"758","Regulation of signaling by CBL",0.533585409252669,0.919891152850601,0.385178336729942,0.944043726838421,2398,17,"YES1, PIK3R1, HCK, LYN, GRB2, BLNK, CRK, PIK3CB"
"759","Reproduction",0.518449756323973,0.91032147849527,0.294612639277501,0.967175550633535,2233,71,"SYNE1, ATM, STAG2, CD9, H3-3A, UBE2I, SUN1, RAD21, IZUMO4, LMNA, MLH3, SYCE2, BLM"
"760","Resolution of AP sites via the multiple-nucleotide patch replacement pathway",0.994860335195531,0.999106145251397,0.181516812123672,0.48160370100782,4451,24,"RFC2, PARG, POLE, APEX1, RFC4, RFC1, ADPRHL2"
"761","Resolution of Abasic Sites (AP sites)",0.971345421983434,0.999106145251397,0.218768177414341,0.635314857889964,4338,37,"RFC2, TDG, PARG, UNG, MBD4, SMUG1, POLE, APEX1, RFC4, XRCC1, RFC1, ADPRHL2"
"762","Resolution of D-Loop Structures",0.845105051408136,0.990941572957721,0.268045302651169,0.756898603453458,3780,32,"ATM, RAD51D, RMI1, WRN, RMI2, BLM"
"763","Resolution of D-loop Structures through Holliday Junction Intermediates",0.789166104742639,0.990099867216044,0.282659297877593,0.791736264752004,3510,31,"ATM, RAD51D, RMI1, WRN, RMI2, BLM"
"764","Resolution of D-loop Structures through Synthesis-Dependent Strand Annealing (SDSA)",0.480984340044743,0.88866866434335,0.364277752895033,0.981156586395075,2149,26,"ATM, RAD51D, RMI1, WRN, RMI2, BLM, KAT5"
"765","Resolution of Sister Chromatid Cohesion",0.900280898876405,0.990941572957721,0.228924895300561,0.793293350465812,3845,96,"CLASP1, ITGB3BP, CENPP, ZWINT, STAG2, DYNC1I1, NUP133, KIF18A, CENPH, PPP2R5C, RAD21, PPP2R1A, BUB3, XPO1, RCC2, SPDL1, ZWILCH, DYNC1I2, MAD2L1, SPC24, MIS12, PPP2R5B, B9D2, HDAC8, NUP37"
"766","Respiratory electron transport",0.426029962546816,0.859819671958674,0.291545311501416,1.01029185432149,1819,96,"MT-ND2, UQCRC2, COX6C, UQCRB, NDUFAF7, UQCR11, MT-ND1, NDUFB2, COQ10B, NDUFS3, UQCRQ, NDUFA2, NDUFAF3, NDUFA3, NDUFB7, COX8A, COX5B, COX20, NDUFA6, NDUFB4, TRAP1, NDUFA8, SDHD"
"767","Respiratory electron transport, ATP synthesis by chemiosmotic coupling, and heat production by uncoupling proteins.",0.469368295589988,0.884778564696946,0.27795011395571,0.989214836804567,1968,116,"MT-ND2, UQCRC2, COX6C, UQCRB, ATP5F1E, NDUFAF7, UQCR11, MT-ND1, ATP5F1B, NDUFB2, COQ10B, NDUFS3, UQCRQ, NDUFA2, NDUFAF3, NDUFA3, NDUFB7, COX8A, COX5B, COX20, NDUFA6, NDUFB4, SLC25A14, TRAP1, ATP5F1A, NDUFA8, SDHD, ATP5ME, ATP5F1C, NDUFB9, ATP5PF"
"768","Response of EIF2AK1 (HRI) to heme deficiency",0.956415388036469,0.994293225186428,0.239123325887402,0.570676514261297,4300,15,"GRB10, CEBPB"
"769","Response of EIF2AK4 (GCN2) to amino acid deficiency",0.234857275469947,0.722002183461548,0.345486071120616,1.1341865097565,1011,71,"RPL26, RPS24, RPL36, RPL32, RPL4, RPS8, RPL23, RPS9, ATF2, RPS5, RPL28, CEBPB, RPL37A, RPS19, RPS25, RPLP1, RPS14, RPS21, RPL11, RPSA, RPL14, FAU"
"770","Response of Mtb to phagocytosis",0.407656023222061,0.859218436873748,-0.411121332235268,-1.03931730495603,2246,22,"VPS33B, UBB, KPNB1, KPNA1, DUSP16, RAB5A, PGK1, SFPQ, GSK3A, MAPK3, HGS, CORO1A"
"771","Response to elevated platelet cytosolic Ca2+",0.166925868325557,0.639133445444653,-0.344055297301174,-1.17330200532614,965,112,"PRKCA, PHACTR2, PRKCB, CAP1, FAM49B, PDGFA, OLA1, PSAP, ENDOD1, TLN1, TF, GAS6, PDGFB, VTI1B, ISLR, ACTN4, FLNA, PPIA, PLEK"
"772","Retinoid metabolism and transport",0.204413892908828,0.691113382785947,-0.442367068514585,-1.21104514752894,1129,32,"GPC6, TTR, GPC5, AGRN, GPC3, LRP1, GPC1, LRP8, GPC4, LDLR, RBP1"
"773","Retrograde transport at the Trans-Golgi-Network",0.213420148308917,0.6935261370686,-0.404374253379571,-1.17988551373462,1179,45,"USP6NL, GCC2, ARFRP1, COG1, GOLGA1, STX6, RAB9B, VAMP4, NAA35, TMF1, COG8, TGOLN2, COG3, ARFIP2, RIC1, COG7, COG2"
"774","Rev-mediated nuclear export of HIV RNA",0.942795076031861,0.99135329697839,-0.238692844874936,-0.656860330724778,5207,33,"RANGAP1, RAE1, NUP155, NUP210, NUP50, SEH1L, RANBP1, NUP153, RANBP2, NUP160, AAAS, NUP85, SEC13, NUP93, NUP188, NUP107, POM121C, POM121"
"775","Rho GTPase cycle",0.286058851905451,0.76536328303296,0.297439324672139,1.07658545601571,1185,130,"TIAM1, VAV3, ARHGAP6, CHN2, ARHGAP18, TIAM2, BCR, ARHGAP32, ARHGAP10, ARHGAP21, PREX1, RHOB, ARHGEF33, MCF2, ARHGEF2, ARHGAP40, ARHGEF26, ARHGEF10, NGEF, ARHGAP17"
"776","Ribosomal scanning and start codon recognition",0.943275062433107,0.99135329697839,-0.234122587274886,-0.693041812265707,5287,48,"EIF3C, EIF4H, EIF3B, EIF3K, RPS15A, EIF3L, EIF4G1, EIF3M"
"777","Role of phospholipids in phagocytosis",0.848142753095412,0.990941572957721,-0.290120625517064,-0.726554281938507,4657,21,"PRKCD, PLCG1, AHCYL1, PLPP4"
"778","S Phase",0.770688779827382,0.990099867216044,-0.245177416185256,-0.869050878684999,4553,148,"SMC3, PSMD4, PSMD3, UBE2D1, WAPL, PSMC3, PSMC6, ANAPC2, PSMC2, UBB, PSMB4, ORC1, PSMD12, CABLES1, PSME4, PSME3, PSMD13, PSMA3, AKT2, PSMC5, PSMB1, PSMA1, CDC23, TFDP2, GINS1, PSMB8, PSMD2, PSMD6, POLD2, POLD4, ANAPC1, ORC5, ANAPC10, GSK3B, E2F5, PSME1, PSMB7, PSMA4, CCNE2"
"779","S33 mutants of beta-catenin aren't phosphorylated",0.928428701180745,0.990941572957721,-0.260260594280796,-0.608585102862684,5110,15,"AXIN1, PPP2CB, CTNNB1, PPP2R5D, GSK3B, CSNK1A1"
"780","S37 mutants of beta-catenin aren't phosphorylated",0.928428701180745,0.990941572957721,-0.260260594280796,-0.608585102862684,5110,15,"AXIN1, PPP2CB, CTNNB1, PPP2R5D, GSK3B, CSNK1A1"
"781","S45 mutants of beta-catenin aren't phosphorylated",0.928428701180745,0.990941572957721,-0.260260594280796,-0.608585102862684,5110,15,"AXIN1, PPP2CB, CTNNB1, PPP2R5D, GSK3B, CSNK1A1"
"782","SCF(Skp2)-mediated degradation of p27/p21",0.0563204005006258,0.524922326529249,-0.46110178527796,-1.39856652231484,314,55,"PSMD4, PSMD3, PSMC3, PSMC6, PSMC2, UBB, PSMB4, PSMD12, PSME3, PSMD13, PSMA3, PSMC5, PSMB1, PSMA1, PSMB8, PSMD2, PSMD6, PSME1, PSMB7, PSMA4, CCNE2"
"783","SCF-beta-TrCP mediated degradation of Emi1",0.0554964539007092,0.524922326529249,-0.464243986507913,-1.39701571662016,312,52,"PSMD4, PSMD3, PSMC3, PSMC6, PSMC2, UBB, PSMB4, PSMD12, PSME4, PSME3, PSMD13, PSMA3, PSMC5, PSMB1, PSMA1, PSMB8, PSMD2, PSMD6, PSME1, PSMB7, PSMA4"
"784","SHC-mediated cascade:FGFR1",0.844577439245557,0.990941572957721,-0.292733644082503,-0.720050263232614,4656,19,"FGF1"
"785","SHC-mediated cascade:FGFR2",0.182629278951202,0.654002366561131,-0.503403482431064,-1.26068236290058,1002,21,"FGFR2, FGF1"
"786","SHC-mediated cascade:FGFR3",0.695241554667635,0.975120893780223,-0.345259024521627,-0.829115539291885,3827,17,"FGF1"
"787","SHC-mediated cascade:FGFR4",0.762828649138713,0.990099867216044,-0.320768878833004,-0.779452439410903,4206,18,"FGF1"
"788","SHC1 events in ERBB2 signaling",0.174688057040998,0.650941256520753,0.495875453225313,1.25974809467493,783,20,"NRG1, ERBB4, HRAS, GRB2, NRAS"
"789","SLC transporter disorders",0.739110394100023,0.984855220564751,0.260250333653328,0.871215421648954,3206,79,"SLC4A4, SLC9A9, NUP54, SLC35A3, NUP133, NUP88, BSG, NUP35, SLC9A6"
"790","SLC-mediated transmembrane transport",0.629740518962076,0.953351752759586,-0.253962286407276,-0.933312456535053,3785,202,"SLC8A1, SLC8A3, SLC24A3, SLC1A1, SLC4A3, SLC24A5, SLCO4C1, SLC15A2, SLC1A2, SLC30A5, SLC12A2, SLC24A4, SLC4A8, SLC11A2, SLC22A5, SLC44A2, SLC17A6, SLC12A5, SLC25A5, SLC43A2, ARL2BP, SLCO3A1, SLC27A1, SLC3A2, SLC26A11, SLC27A4, SLC6A15, EMB, SLC16A7, SLC2A12, SLC26A4, SLC16A10, CALM1, SLC9A2, SLC6A1, SLC7A3, SLC9A1, SLC2A8, SLCO1C1, SLC32A1, SLC7A8, SLC6A11"
"791","SMAD2/SMAD3:SMAD4 heterotrimer regulates transcription",0.814432989690722,0.990941572957721,0.276067768062294,0.769272406146028,3633,30,"SMAD3, CCNK, SMAD2, CCNT1, SP1, HDAC1, SMAD4, RBL1, JUNB, E2F4, SERPINE1"
"792","SRP-dependent cotranslational protein targeting to membrane",0.121593291404612,0.571802122703501,0.36343248336842,1.22425656045208,521,82,"TRAM1, SPCS1, RPL26, SRP9, RPS24, SRP14, RPL36, RPL32, RPL4, RPS8, RPL23, RPS9, RPS5, RPL28, RPL37A, RPS19, SSR2, RPS25, RPLP1, RPS14, RPS21, SEC61G, RPL11, RPSA, RPL14, FAU, SEC11C, RPS27L"
"793","SUMO E3 ligases SUMOylate target proteins",0.406645302749199,0.859218436873748,-0.286624855395367,-1.01823161686679,2410,150,"NR3C2, TP53BP1, SMC3, UHRF2, TOP1, HIPK2, NCOA1, SMC6, CHD3, NCOR2, HERC2, PHC3, PIAS1, RANGAP1, THRB, RAE1, HDAC4, SP3, DNMT3A, NUP155, PGR, MDM2, PPARGC1A, RNF2, SAFB, MITF, NUP210, NR2C1, CASP8AP2, NUP50, SEH1L, SCMH1, NR1H3, L3MBTL2, CBX5"
"794","SUMOylation",0.430613961312027,0.859819671958674,-0.282562237398556,-1.00888094919208,2559,156,"NR3C2, TP53BP1, SMC3, UHRF2, TOP1, HIPK2, NCOA1, SMC6, CHD3, NCOR2, HERC2, PHC3, PIAS1, RANGAP1, THRB, RAE1, HDAC4, SP3, DNMT3A, NUP155, PGR, MDM2, PPARGC1A, RNF2, SAFB, MITF, NUP210, SENP2, NR2C1, CASP8AP2, NUP50, SEH1L, SCMH1, NR1H3, L3MBTL2, CBX5"
"795","SUMOylation of DNA damage response and repair proteins",0.831416743330267,0.990941572957721,0.248180637273406,0.811909606643245,3614,69,"PIAS2, NUP54, STAG2, UBE2I, NSMCE2, NUP133, NUP88, SUMO1, NUP35, RAD21, TDG, WRN, XRCC4, SUMO2"
"796","SUMOylation of DNA methylation proteins",0.924613987284287,0.990941572957721,-0.262966629583327,-0.614912809819212,5089,15,"PHC3, DNMT3A, RNF2, SCMH1"
"797","SUMOylation of DNA replication proteins",0.769797010930181,0.990099867216044,0.273183712071038,0.820622626210677,3450,44,"NUP54, TOP2B, UBE2I, NUP133, NUP88, SUMO1, NUP35, SUMO2, TOP2A"
"798","SUMOylation of RNA binding proteins",0.929130337581042,0.990941572957721,0.233209218520007,0.703720079782334,4155,45,"NUP54, UBE2I, NUP133, NUP88, SUMO1, NUP35"
"799","SUMOylation of SUMOylation proteins",0.558718063648588,0.926440843122684,0.327373777146443,0.935287638642407,2492,34,"NUP54, UBE2I, NUP133, NUP88, SUMO1, NUP35, SUMO2"
"800","SUMOylation of chromatin organization proteins",0.969134701159679,0.999106145251397,-0.2196941725475,-0.662315149163439,5431,53,"CHD3, PHC3, PIAS1, RAE1, HDAC4, NUP155, RNF2, NUP210, NUP50, SEH1L, SCMH1, L3MBTL2, CBX5, NUP153, PHC2, RANBP2, NUP160, SUZ12, SATB2, AAAS, NUP85, SEC13, NUP93, NUP188, NUP107, POM121C, POM121"
"801","SUMOylation of intracellular receptors",0.714669051878354,0.976451351246958,0.30930590282423,0.82791948497546,3195,25,"RORA, PIAS2, ESR1, UBE2I, SUMO1, NR3C1, THRA, SUMO2"
"802","SUMOylation of transcription cofactors",0.671346292296616,0.967503093445832,-0.303085156895148,-0.868100892843266,3729,40,"UHRF2, HIPK2, NCOA1, NCOR2, PHC3, PIAS1, PPARGC1A, RNF2, SAFB, CASP8AP2, SCMH1"
"803","SUMOylation of transcription factors",0.586924762600438,0.941194383118905,-0.382994095537737,-0.906818734776304,3213,16,"TP53BP1, PIAS1, SP3, MDM2, MITF"
"804","SUMOylation of ubiquitinylation proteins",0.462502798298634,0.882959887661029,0.341338276039516,0.991265187183639,2065,37,"PIAS2, NUP54, UBE2I, NUP133, NUP88, SUMO1, NUP35"
"805","Selective autophagy",0.877308238636364,0.990941572957721,-0.252404756247259,-0.754082865183304,4940,50,"UBB, HDAC6, ULK1, DYNLL1, PRKAG1, TOMM20, TOMM22, UBE2N, ATG5, MFN2, DYNC1H1, IFT88, DYNLL2, DYNC1LI2, PCNT, CSNK2A1, SQSTM1, CSNK2B, MTERF3, DYNC1LI1, CFTR, FUNDC1, PRKAB2"
"806","Selenoamino acid metabolism",0.0928025919925943,0.553651827228546,0.379452758141378,1.26586341175822,400,78,"RPL26, RPS24, RPL36, RPL32, RPL4, RPS8, RPL23, RPS9, PAPSS1, RPS5, SECISBP2, RPL28, AIMP1, RPL37A, RPS19, RPS25, RPLP1, RPS14, RPS21, EEF1E1, RPL11, TXNRD1, RPSA, RPL14, FAU"
"807","Selenocysteine synthesis",0.158195970695971,0.624215965367603,0.377992238168347,1.2143303435186,690,62,"RPL26, RPS24, RPL36, RPL32, RPL4, RPS8, RPL23, RPS9, RPS5, SECISBP2, RPL28, RPL37A, RPS19, RPS25, RPLP1, RPS14, RPS21, RPL11, RPSA, RPL14, FAU"
"808","Sema4D in semaphorin signaling",0.557510885341074,0.926440843122684,-0.36802541276681,-0.930370550398113,3072,22,"MET, ARHGEF12, MYH9, MYL9, LIMK2, MYH14, ARHGAP35"
"809","Sema4D induced cell migration and growth-cone collapse",0.806890299184044,0.990941572957721,-0.307970235313897,-0.748352371510263,4449,18,"ARHGEF12, MYH9, MYL9, LIMK2"
"810","Semaphorin interactions",0.22188879082083,0.701756717957443,-0.374596376754308,-1.15884365990615,1256,60,"SEMA6D, SEMA5A, SEMA3A, MET, DPYSL2, ARHGEF12, FARP2, MYH9, FYN, PAK2, TLN1, CRMP1, PIP5K1C, MYL9, DPYSL5, PLXNA1, LIMK2"
"811","Senescence-Associated Secretory Phenotype (SASP)",0.520633504349766,0.91110863261209,0.318980776124745,0.958193445098731,2333,44,"RPS6KA3, CDC26, H3-3A, ANAPC7, RPS6KA2, CDC27, ANAPC16, EHMT1, CDC16, CEBPB"
"812","Separation of Sister Chromatids",0.68174936921783,0.967503093445832,-0.253583237608893,-0.905412201621274,4052,156,"SMC3, PSMD4, MAPRE1, PSMD3, UBE2D1, WAPL, PSMC3, PSMC6, ANAPC2, RANGAP1, PSMC2, UBB, PSMB4, PSMD12, PSME4, PPP2CB, PSME3, PSMD13, DYNLL1, NUDC, PSMA3, CKAP5, AHCTF1, TAOK1, PSMC5, PTTG1, PSMB1, PAFAH1B1, PPP1CC, PSMA1, CDC23, PPP2R5D, SEH1L, PSMB8, PSMD2, PSMD6"
"813","Serotonin Neurotransmitter Release Cycle",0.0869177624247827,0.538444150224432,0.572096352851053,1.41973227341302,389,18,"SYN2, SYT1, RIMS1, RAB3A, SYN3"
"814","Sialic acid metabolism",0.599687080911936,0.94466610522828,0.321289746612571,0.907248730381398,2682,32,"ST6GALNAC3, ST3GAL4, NPL, ST3GAL3, ST6GALNAC4, ST3GAL6, NEU1, ST8SIA2, SLC35A1"
"815","Signal amplification",0.651175406871609,0.960735708407192,-0.334564270563127,-0.869368095648931,3600,25,"GNAI1, GNB3, GNB5, GNG11"
"816","Signal transduction by L1",0.635033259423503,0.958024313785457,0.339778808876833,0.875309435697313,2863,21,"NCAM1, ITGAV, MAP2K2, PAK1, CSNK2A2, MAPK1, MAP2K1, FGFR1, ITGB1"
"817","Signaling by BMP",0.580098170459616,0.939131640777966,0.347455455082919,0.914493372428717,2599,23,"ACVR2A, BMPR1B, BMPR1A, GREM2, SMAD4"
"818","Signaling by BRAF and RAF fusions",0.0868677704694942,0.538444150224432,0.42056570780232,1.32263219547964,382,55,"CNKSR2, YWHAB, TRIM24, RAF1, SRC, JAK2, IQGAP1, PAPSS1, HRAS, LMNA, CAMK2G, ATG7, BRAF, MAP2K2, AGK, NRAS"
"819","Signaling by EGFR",0.682384823848239,0.967503093445832,-0.296764737153305,-0.870108321887681,3776,46,"PAG1, PTPN3, PLCG1, EPS15, EPN1, UBB, ADAM10, SH3GL1, EPS15L1, PTPN11"
"820","Signaling by EGFR in Cancer",0.97068463219228,0.999106145251397,-0.227355206681509,-0.569369718685336,5330,21,"PLCG1, UBB, CBL, TGFA, SHC1, GAB1, SOS1"
"821","Signaling by ERBB2",0.338706066711439,0.818194232933854,0.35339559683158,1.07094628273483,1512,46,"NRG1, ERBB4, ERBIN, YES1, PIK3R1, SRC, HRAS"
"822","Signaling by ERBB2 KD Mutants",0.0211581291759465,0.446408190284879,0.61488003532138,1.59856848543567,94,22,"NRG1, ERBB4, ERBIN, PIK3R1, HRAS, GRB2, NRAS"
"823","Signaling by ERBB2 in Cancer",0.0225345827755466,0.446408190284879,0.601921546078703,1.58424125037743,100,23,"NRG1, ERBB4, ERBIN, PIK3R1, HRAS, GRB2, NRAS"
"824","Signaling by ERBB4",0.0331893612184587,0.466707877075238,0.46052075962875,1.45070809960713,145,56,"NRG1, ERBB4, STMN1, APOE, GABRB3, ESR1, PIK3R1, SRC, GABRB2, HRAS, GABRG2, GFAP, GRB2, TAB2, NRAS, NEDD4, YAP1, EGF, APH1B"
"825","Signaling by Erythropoietin",0.682905027932961,0.967503093445832,0.319845089454075,0.848618797499095,3055,24,"PIK3R1, JAK2, IRS2, HRAS, LYN, GRB2, NRAS"
"826","Signaling by FGFR",0.225145682500441,0.707793313249891,-0.354356476164572,-1.14432122314195,1274,79,"FLRT2, FGFR2, FGF1, PLCG1, TIAL1, GTF2F2, POLR2C, UBB, FRS2, RBFOX2, PPP2CB, SPRED1"
"827","Signaling by FGFR in disease",0.157604832977967,0.624215965367603,-0.39590728318172,-1.22543288060759,886,61,"LRRFIP1, FGFR2, FGF1, ZMYM2, PLCG1, GTF2F2, POLR2C, FRS2, FGFR1OP, STAT3, STAT5B, FGFR1OP2"
"828","Signaling by FGFR1",0.3806684733514,0.83619643727818,-0.35609206767744,-1.04405487800349,2106,46,"FLRT2, FGF1, PLCG1, UBB, FRS2, PPP2CB, SPRED1, PTPN11"
"829","Signaling by FGFR1 in disease",0.206306306306306,0.691113382785947,-0.427568807203923,-1.2002039237768,1144,36,"LRRFIP1, FGF1, ZMYM2, PLCG1, FRS2, FGFR1OP, STAT3, STAT5B, FGFR1OP2"
"830","Signaling by FGFR2",0.427589852008457,0.859819671958674,-0.32196179595413,-1.01496512561129,2426,67,"FGFR2, FGF1, PLCG1, TIAL1, GTF2F2, POLR2C, UBB, FRS2, RBFOX2, PPP2CB"
"831","Signaling by FGFR2 IIIa TM",0.159412404787813,0.624215965367603,-0.525760190043298,-1.29323626064386,878,19,"FGFR2, FGF1, GTF2F2, POLR2C"
"832","Signaling by FGFR2 in disease",0.243316473988439,0.732040967586995,-0.402260788598808,-1.15639497157229,1346,41,"FGFR2, FGF1, PLCG1, GTF2F2, POLR2C, FRS2"
"833","Signaling by FGFR3",0.743083003952569,0.986393368078632,-0.288891716705277,-0.82253683332963,4135,39,"FGF1, PLCG1, UBB, FRS2, PPP2CB, PTPN11"
"834","Signaling by FGFR3 in disease",0.415331391114348,0.859819671958674,-0.4123056956173,-1.03254454275525,2280,21,"FGF1, PLCG1, FRS2"
"835","Signaling by FGFR3 point mutants in cancer",0.415331391114348,0.859819671958674,-0.4123056956173,-1.03254454275525,2280,21,"FGF1, PLCG1, FRS2"
"836","Signaling by FGFR4",0.780632411067194,0.990099867216044,-0.280564310658285,-0.798826917801901,4344,39,"FGF1, PLCG1, UBB, FRS2, PPP2CB, PTPN11"
"837","Signaling by Hedgehog",0.0619120916709424,0.524922326529249,-0.372397399963993,-1.29559055420885,361,127,"GNAS, IFT122, ADCY2, GPC5, OS9, NUMB, PSMD4, PSMD3, PSMC3, PSMC6, PSMC2, UBB, PSMB4, PSMD12, TULP3, ITCH, PSME4, SMURF2, SPOP, PSME3, PSMD13, PSMA3, CDC73, PRKAR2A, PSMC5, PSMB1, HHAT, PSMA1, PSMB8, PRKACA, PSMD2, PSMD6, FUZ, CDON, KIF3A, IFT88, GSK3B, SMURF1, PSME1, MKS1, PRKAR1A, PSMB7, PSMA4, ADCY10"
"838","Signaling by Hippo",0.380570409982175,0.83619643727818,0.422910150729017,1.06130236771614,1707,19,"AMOTL1, YWHAB, DVL2, CASP3, TJP2, YAP1, SAV1, MOB1A"
"839","Signaling by Insulin receptor",0.758377425044092,0.990099867216044,-0.264618678713916,-0.845905707451601,4299,74,"FGFR2, FGF1, IRS1, ATP6V0C, FRS2, ATP6V1G1, ATP6V1B2, PTPN11, ATP6V0A1, AKT2, ATP6V0B, PDPK1, ATP6V0A2"
"840","Signaling by Interleukins",0.854502740798747,0.990941572957721,-0.225057790680404,-0.87283472108026,5455,341,"POMC, CSF2RA, TBK1, PTPN5, IRS1, BRWD1, TYK2, PSMD4, CANX, PSMD3, MAPK11, HSPA9, PTPN13, MAP3K7, PSMC3, FYN, TEC, PTPN2, PAK2, IKBKB, PSMC6, PSMC2, BCL2L1, UBB, PSMB4, PITPNA, PSMD12, PSME4, PPP2CB, PSME3, SOS2, PSMD13, STAT3, PELI3, MAPK10, STAT5B, LMNB1, PIK3R3, PTPN11, PSMA3, FSCN1, HIF1A, STX3, STAT2, RALA, PPIA, PIK3CD, PSMC5, IL1R2, PSMB1, JUN, CBL, PSMA1, NKIRAS1, VIM, PPP2R5D, PTPN14, S100B, PSMB8, PRKACA, PSMD2, PSMD6, RPS6KA1, GSTO1, SMARCA4, CDC42, IRAK2, TAB3, UBE2N"
"841","Signaling by Ligand-Responsive EGFR Variants in Cancer",0.948866727107888,0.99135329697839,-0.247247737678572,-0.600799719017383,5232,18,"PLCG1, UBB"
"842","Signaling by MET",0.583156028368794,0.939131640777966,-0.29591681099963,-0.924777437777089,3288,64,"RANBP10, LAMA3, PTPN1, EPS15, MET, PTPN2, UBB, SH3GL1, SPINT2, STAT3, PTPN11"
"843","Signaling by NODAL",0.128307760729375,0.573289994748272,0.566292665529211,1.35147804262359,576,15,"ACVR2A, SMAD3, DAND5, SMAD2, PCSK6, ACVR1B, SMAD4"
"844","Signaling by NOTCH",0.0237339127527996,0.446408190284879,-0.375735737106129,-1.35422020136382,141,167,"E2F3, DNER, NEURL1, HDAC3, POGLUT1, HDAC9, NUMB, PSMD4, CCNC, ATP2A2, PSMD3, NCOR2, ACTA2, NOTCH3, NCSTN, PSMC3, PSMC6, HDAC11, TLE4, RBPJ, PSMC2, UBB, PSMB4, ADAM10, HDAC4, HDAC6, PSMD12, ITCH, TNRC6B, PSME3, TNRC6C, PSMD13, DTX2, PRKCI, HDAC5, PSMA3, MOV10, HIF1A, MIB2, PSEN1, PSENEN, PSMC5, FBXW7, PSMB1, JUN, PSMA1, TFDP2, PSMB8, PSMD2, PSMD6, CNTN1"
"845","Signaling by NOTCH1",0.0244159494115581,0.446408190284879,-0.458674359725907,-1.4594275752732,138,71,"DNER, NEURL1, HDAC3, HDAC9, NUMB, CCNC, NCOR2, NCSTN, HDAC11, TLE4, RBPJ, UBB, ADAM10, HDAC4, HDAC6, ITCH, DTX2, HDAC5, HIF1A, MIB2, PSEN1, PSENEN, FBXW7"
"846","Signaling by NOTCH1 HD+PEST Domain Mutants in Cancer",0.0737105122255934,0.524922326529249,-0.445967738038501,-1.35829565818937,412,56,"NEURL1, HDAC3, HDAC9, CCNC, NCOR2, NCSTN, HDAC11, RBPJ, UBB, ADAM10, HDAC4, HDAC6, HDAC5, MIB2, PSEN1, PSENEN, FBXW7"
"847","Signaling by NOTCH1 PEST Domain Mutants in Cancer",0.0737105122255934,0.524922326529249,-0.445967738038501,-1.35829565818937,412,56,"NEURL1, HDAC3, HDAC9, CCNC, NCOR2, NCSTN, HDAC11, RBPJ, UBB, ADAM10, HDAC4, HDAC6, HDAC5, MIB2, PSEN1, PSENEN, FBXW7"
"848","Signaling by NOTCH1 in Cancer",0.0737105122255934,0.524922326529249,-0.445967738038501,-1.35829565818937,412,56,"NEURL1, HDAC3, HDAC9, CCNC, NCOR2, NCSTN, HDAC11, RBPJ, UBB, ADAM10, HDAC4, HDAC6, HDAC5, MIB2, PSEN1, PSENEN, FBXW7"
"849","Signaling by NOTCH2",0.573383756528003,0.939131640777966,-0.338044809863716,-0.920386377372884,3183,31,"NEURL1, NCSTN, RBPJ, UBB, ADAM10, MIB2, PSEN1, PSENEN"
"850","Signaling by NOTCH3",0.735077129443327,0.984855220564751,0.279224454319852,0.842573276125821,3287,45,"MAML2, PBX1, CREBBP, KAT2B, PLXND1, MAML1"
"851","Signaling by NOTCH4",0.352930822038374,0.822198816607203,-0.327126279142469,-1.05552499854785,2004,78,"PSMD4, PSMD3, ACTA2, NCSTN, PSMC3, PSMC6, RBPJ, PSMC2, UBB, PSMB4, ADAM10, PSMD12, PSME3, PSMD13, PSMA3, PSEN1, PSENEN, PSMC5, FBXW7, PSMB1, PSMA1, PSMB8, PSMD2, PSMD6"
"852","Signaling by NTRK1 (TRKA)",0.134104046242775,0.589160035794616,0.366916492927489,1.21919924740325,579,76,"RPS6KA5, RPS6KA3, MEF2C, SH3GL2, YWHAB, ADORA2A, ATF1, PIK3R1, SRC, IRS2, RPS6KA2, CREB1, HRAS, NGF, PPP2R1A, RIT2, BRAF, MAP2K2, GRB2, MAPKAPK2, MEF2A, NRAS"
"853","Signaling by NTRK2 (TRKB)",0.752402234636872,0.990099867216044,0.302045750897134,0.801393269327777,3366,24,"TIAM1, PIK3R1, SRC, HRAS, GRB2, NRAS"
"854","Signaling by NTRK3 (TRKC)",0.428260079912822,0.859819671958674,-0.427994099702213,-1.02779806923227,2357,17,"NTF3, PTPRS, IRS1, PLCG1"
"855","Signaling by NTRKs",0.0957397003745318,0.554324356659014,0.359471290529734,1.24567572297543,408,96,"TIAM1, RPS6KA5, PTPRO, RPS6KA3, MEF2C, SH3GL2, YWHAB, ADORA2A, ATF1, PIK3R1, SRC, IRS2, RPS6KA2, CREB1, HRAS, PCSK5, NGF, PPP2R1A, RIT2, BRAF, MAP2K2, GRB2, MAPKAPK2, MEF2A, NRAS"
"856","Signaling by Non-Receptor Tyrosine Kinases",0.00955414012738853,0.345925763233033,0.527195997549119,1.60926368955504,41,48,"NRG1, ERBB4, ELMO1, LRRK2, KHDRBS3"
"857","Signaling by Nuclear Receptors",0.263565891472868,0.756520983449543,0.281208983212178,1.07557260742743,1053,198,"RARB, ERBB4, GNG7, APOE, GTF2A2, NCOA2, CREBBP, KAT2B, STAG2, H3-3A, ESR1, ESR2, GPS2, PIK3R1, SRC, GNG3, ABCA1, TNRC6A, USF2, POLR2D, CREB1, HRAS, RAD21, POLR2K, KCTD6, GNAI2, PTK2, KDM3A, ATF2, CBFB, UHMK1, SCD, EEPD1, POLR2H, RARG, NRAS, PLTP, XPO1, CCNT1, APOD"
"858","Signaling by PDGF",0.341151385927505,0.818194232933854,-0.358326692335737,-1.07413025114126,1919,51,"COL6A3, PLCG1, PDGFA, COL9A1, NCK1, PDGFC, PDGFB, STAT3, STAT5B, COL4A2, PTPN11"
