"","pathway","pval","padj","ES","NES","nMoreExtreme","size","leadingEdge"
"756","Rev-mediated nuclear export of HIV RNA",0.046132431895009,0.177444946650036,-0.518663519296831,-2.78843669492605,231,33,"XPO1, TPR, SEH1L, SEC13, RCC1, RANGAP1, RANBP2, RANBP1, RAE1, POM121C, POM121, NUP42, NUP58, NUP98, NUP93, NUP88, NUP85, NUP54, NUP50, NUP43, NUP37, NUP35, NUP214, NUP210, NUP205, NUP188, NUP160, NUP155, NUP153, NUP133, NUP107"
"757","Rho GTPase cycle",0.196594733716096,0.245145501288319,0.397321744828563,1.55957373863184,992,128,"A2M, ABR, AKAP13, ARAP1, ARAP2, ARHGAP1, ARHGAP10, ARHGAP11B, ARHGAP11A, ARHGAP12, ARHGAP15, ARHGAP17, ARHGAP18, ARHGAP19, ARHGAP20, ARHGAP21, ARHGAP22, ARHGAP23, ARHGAP24, ARHGAP25, ARHGAP26, ARHGAP27, ARHGAP28, ARHGAP29, ARHGAP31, ARHGAP32, ARHGAP33, ARHGAP35, ARHGAP36, ARHGAP39, ARHGAP4, ARHGAP40, ARHGAP42, ARHGAP44, ARHGAP5, ARHGAP6, ARHGAP8, ARHGDIA, ARHGDIB, ARHGDIG, ARHGEF1, ARHGEF10, ARHGEF10L, ARHGEF11, ARHGEF12, ARHGEF15, ARHGEF17, ARHGEF18, ARHGEF19, ARHGEF2, ARHGEF26, ARHGEF3, ARHGEF33, ARHGEF37, ARHGEF4, ARHGEF40, ARHGEF6, ARHGEF7, ARHGEF9"
"758","Ribosomal scanning and start codon recognition",0.0806451612903226,0.177444946650036,0.269230769230769,1.41557404693568,404,48,"EIF1AX, EIF2S1, EIF2S2, EIF2S3, EIF3A, EIF3B, EIF3C, EIF3D, EIF3E, EIF3F, EIF3G, EIF3H, EIF3I, EIF3J, EIF3K, EIF3L, EIF3M, EIF4A1, EIF4A2, EIF4E, EIF4G1, EIF4H, EIF5, FAU, RPS18, RPS11, RPS12, RPS13, RPS14, RPS15, RPS15A, RPS16, RPS17, RPS19, RPS20, RPS21, RPS24, RPS25, RPS27A, RPS27L, RPS28, RPS3A, RPS4X, RPS5, RPS7, RPS8, RPS9, RPSA"
"759","Role of phospholipids in phagocytosis",0.0465116279069767,0.177444946650036,-0.319588605950172,-1.58666559196828,233,23,"SYK, PRKCE, PRKCD, PLPP5, PLPP4, PLD4, PLD3, PLD2, PLD1, PLCG2, PLCG1, PLA2G6, PIK3R2, PIK3R1, PIK3CB, PIK3CA"
"760","S Phase",0.19426362896664,0.243798119110439,-0.182449269192564,-0.735843363505035,954,150,"WEE1, WAPL, UBE2E1, UBE2D1, UBC, UBB, TFDP2, TFDP1, STAG2, STAG1, SMC3, SMC1A, SKP2, SKP1, RPS27A, RPA3, RPA2, RPA1, RFC5, RFC4, RFC3, RFC2, RFC1, RBX1, RBL2, RB1, RAD21, PSMF1, PSME4, PSME3, PSME2, PSME1, PSMD9, PSMD8, PSMD7, PSMD6, PSMD5, PSMD4, PSMD3, PSMD2, PSMD14, PSMD13, PSMD12, PSMD11, PSMD10, PSMD1, PSMC6, PSMC5, PSMC4, PSMC3, PSMC2, PSMC1, PSMB9, PSMB8, PSMB7, PSMB6, PSMB5, PSMB4, PSMB3, PSMB2, PSMB10, PSMB1, PSMA8, PSMA7, PSMA6, PSMA5, PSMA4, PSMA3, PSMA1, PRIM2, PRIM1, POLE4, POLE3, POLE2, POLE, POLD4, POLD2, POLD1, POLA2, POLA1, PDS5B, PDS5A, PCNA, ORC6, ORC5, ORC4, ORC3, ORC2, ORC1"
"761","S33 mutants of beta-catenin aren't phosphorylated",0.0645032848895083,0.177444946650036,0.345913275704547,1.48576063349353,323,15,"AMER1, APC, AXIN1, CSNK1A1, CTNNB1, GSK3B, PPP2CA, PPP2CB, PPP2R1A, PPP2R1B, PPP2R5A, PPP2R5B, PPP2R5C, PPP2R5D, PPP2R5E"
"762","S37 mutants of beta-catenin aren't phosphorylated",0.0645032848895083,0.177444946650036,0.345913275704547,1.48576063349353,323,15,"AMER1, APC, AXIN1, CSNK1A1, CTNNB1, GSK3B, PPP2CA, PPP2CB, PPP2R1A, PPP2R1B, PPP2R5A, PPP2R5B, PPP2R5C, PPP2R5D, PPP2R5E"
"763","S45 mutants of beta-catenin aren't phosphorylated",0.0645032848895083,0.177444946650036,0.345913275704547,1.48576063349353,323,15,"AMER1, APC, AXIN1, CSNK1A1, CTNNB1, GSK3B, PPP2CA, PPP2CB, PPP2R1A, PPP2R1B, PPP2R5A, PPP2R5B, PPP2R5C, PPP2R5D, PPP2R5E"
"764","SCF(Skp2)-mediated degradation of p27/p21",0.076703386372909,0.177444946650036,-0.475336300294011,-2.62908799724693,375,56,"UBC, UBB, SKP2, SKP1, RPS27A, PSMF1, PSME3, PSME2, PSME1, PSMD9, PSMD8, PSMD7, PSMD6, PSMD5, PSMD4, PSMD3, PSMD2, PSMD14, PSMD13, PSMD12, PSMD11, PSMD10, PSMD1, PSMC6, PSMC5, PSMC4, PSMC3, PSMC2, PSMC1, PSMB9, PSMB8, PSMB7, PSMB6, PSMB5, PSMB4, PSMB3, PSMB2, PSMB10, PSMB1, PSMA7, PSMA6, PSMA5, PSMA4, PSMA3, PSMA1"
"765","SCF-beta-TrCP mediated degradation of Emi1",0.0715738104920699,0.177444946650036,-0.556543231289567,-3.09305386095242,351,52,"UBC, UBB, SKP1, RPS27A, PSMF1, PSME4, PSME3, PSME2, PSME1, PSMD9, PSMD8, PSMD7, PSMD6, PSMD5, PSMD4, PSMD3, PSMD2, PSMD14, PSMD13, PSMD12, PSMD11, PSMD10, PSMD1, PSMC6, PSMC5, PSMC4, PSMC3, PSMC2, PSMC1, PSMB9, PSMB8, PSMB7, PSMB6, PSMB5, PSMB4, PSMB3, PSMB2, PSMB10, PSMB1, PSMA8, PSMA7, PSMA6, PSMA5, PSMA4, PSMA3, PSMA1"
"766","SHC-mediated cascade:FGFR1",0.0539518216205455,0.177444946650036,0.35808559983133,1.53804298654536,270,15,"FGF1, FGF10, FGF2, FGF20, FGF22, FGF5, FGF9, FGFR1, GRB2, HRAS, KL, KRAS"
"767","SHC-mediated cascade:FGFR2",0.0539518216205455,0.177444946650036,0.35808559983133,1.53804298654536,270,15,"FGF1, FGF10, FGF2, FGF20, FGF22, FGF5, FGF7, FGF9, FGFR2, GRB2, HRAS, KRAS"
"768","SHC1 events in ERBB2 signaling",0.215235792019347,0.262326619286362,0.227900483120901,1.07442560841718,1067,21,"BTC, EGF, EGFR, ERBB2, ERBB3, ERBB4, GRB2, HBEGF, HRAS, KRAS, NRAS, NRG1, NRG2, NRG3, NRG4, PRKCA, PRKCD, PRKCE, PTPN12"
"769","SLC transporter disorders",0.105591311343524,0.181397866039711,-0.450633858271326,-2.36100878958174,524,77,"TPR, SLCO2A1, SLC9A9, SLC9A6, SLC6A20, SLC5A5, SLC5A2, SLC5A1, SLC4A4, SLC4A1, SLC3A2, SLC3A1, SLC35C1, SLC35A3, SLC35A2, SLC35A1, SLC34A3, SLC33A1, SLC2A9, SLC2A2, SLC2A1, SLC29A3, SLC27A4, SLC26A4, SLC26A2, SLC24A5, SLC24A4, SLC24A1, SLC22A5, SLC22A18, SLC22A12, SLC20A2, SLC1A3, SLC1A1, SLC17A8, SLC17A5, SLC16A1, SLC12A6, SLC12A3, SLC11A2, SEH1L, SEC13, RHAG, RANBP2, RAE1, POM121C, POM121, NUP42, NUP58, NUP98, NUP93, NUP88, NUP85, NUP54, NUP50, NUP43, NUP37, NUP35, NUP214, NUP210, NUP205, NUP188, NUP160, NUP155, NUP153, NUP133, NUP107"
"770","SLC-mediated transmembrane transport",0.2383696994648,0.282788127258588,-0.694940236644273,-2.41832652944989,1157,195,"SRI, SLCO4C1, SLCO3A1, SLCO2B1, SLCO2A1, SLCO1C1, SLCO1A2, SLC9A9, SLC9A8, SLC9A7, SLC9A6, SLC9A5, SLC9A4, SLC9A3, SLC9A2, SLC9A1, SLC8B1, SLC8A3, SLC8A2, SLC8A1, SLC7A8, SLC7A6, SLC7A5, SLC7A3, SLC7A2, SLC7A11, SLC7A10, SLC7A1, SLC6A9, SLC6A7, SLC6A6, SLC6A20, SLC6A15, SLC6A13, SLC6A11, SLC6A1, SLC5A8, SLC5A6, SLC5A5, SLC5A4, SLC5A2, SLC5A12, SLC5A11, SLC5A1, SLC50A1, SLC4A9, SLC4A8, SLC4A7, SLC4A5, SLC4A4, SLC4A3, SLC4A2, SLC4A10, SLC4A1, SLC47A1, SLC44A5, SLC44A4, SLC44A3, SLC44A2, SLC44A1, SLC43A2, SLC41A2, SLC41A1, SLC3A2, SLC3A1, SLC39A7, SLC39A6, SLC39A3, SLC39A2, SLC39A14, SLC39A10, SLC39A1, SLC38A5, SLC38A4, SLC38A3, SLC38A2, SLC38A1, SLC36A4, SLC36A1, SLC35D2, SLC35D1, SLC35C1, SLC35B4, SLC35B3, SLC35B2, SLC35A3, SLC35A2, SLC35A1, SLC34A3, SLC33A1, SLC32A1, SLC31A1, SLC30A7, SLC30A6, SLC30A5, SLC30A3, SLC30A10, SLC30A1, SLC2A9, SLC2A8, SLC2A7, SLC2A6, SLC2A2, SLC2A13, SLC2A12, SLC2A1, SLC29A4, SLC29A3, SLC29A2, SLC29A1, SLC28A3, SLC28A1, SLC27A6, SLC27A4, SLC27A1, SLC26A7, SLC26A6, SLC26A4, SLC26A2, SLC26A11, SLC26A1, SLC25A5, SLC25A4, SLC25A29, SLC25A26, SLC25A22, SLC25A18, SLC24A5, SLC24A4, SLC24A3, SLC24A2, SLC24A1, SLC22A8, SLC22A7, SLC22A6, SLC22A5, SLC22A4, SLC22A3, SLC22A18, SLC22A15, SLC22A12, SLC20A2, SLC20A1, SLC1A6, SLC1A5, SLC1A4, SLC1A3, SLC1A2, SLC1A1, SLC18A2, SLC18A1, SLC17A8, SLC17A7, SLC17A6, SLC17A5, SLC16A7, SLC16A3, SLC16A2, SLC16A10, SLC16A1, SLC15A4, SLC15A3, SLC15A2, SLC15A1, SLC14A2, SLC14A1, SLC13A5, SLC13A4, SLC13A3, SLC13A1, SLC12A7, SLC12A6, SLC12A5, SLC12A4, SLC12A3, SLC12A2, SLC11A2, SLC11A1"
"771","SMAD2/SMAD3:SMAD4 heterotrimer regulates transcription",0.10337972166998,0.181397866039711,-0.232995638103279,-1.24813113226824,519,30,"WWTR1, UBC, UBB, TGIF2, TGIF1, TFDP2, TFDP1, SP1, SNW1, SMAD7, SMAD4, SMAD3, SMAD2, RPS27A, RNF111, RBL1"
"772","SRP-dependent cotranslational protein targeting to membrane",0.107906413876563,0.181397866039711,-0.655856025481105,-3.41859793995616,534,81,"TRAM1, SSR4, SSR3, SSR2, SSR1, SRPRB, SRPRA, SRP9, SRP72, SRP68, SRP54, SRP19, SRP14, SPCS2, SPCS1, SEC61G, SEC61B, SEC61A2, SEC61A1, SEC11C, SEC11A, RPSA, RPS9, RPS8, RPS7, RPS5, RPS4X, RPS3A, RPS28, RPS27L, RPS27A, RPS25, RPS24, RPS21, RPS20, RPS19, RPS17, RPS16, RPS15A, RPS15, RPS14, RPS13, RPS12, RPS11, RPN2, RPN1, RPLP1, RPL8, RPL7A, RPL6, RPL5, RPL4, RPL38, RPL37A, RPL36, RPL35, RPL34, RPL32, RPL30, RPL3, RPL29, RPL28, RPL27, RPL26, RPL23, RPL22L1, RPL19, RPL18A, RPL18, RPL14, RPL13A, RPL12, RPL11, RPL10A, RPL10"
"773","SUMO E3 ligases SUMOylate target proteins",0.185598377281947,0.236909510229136,-0.248197399527187,-1.02730307444542,914,144,"ZNF131, XRCC4, XPC, WRN, UHRF2, UBE2I, TP53BP1, TP53, TRIM28, TRIM27, TPR, TOPORS, TOP2B, TOP1, THRB, THRA, TDG, SUZ12, SUMO2, SUMO1, STAG2, STAG1, SP3, SMC6, SMC5, SMC3, SMC1A, SIN3A, SEH1L, SEC13, SCMH1, SATB2, SATB1, SAFB, RXRA, RPA1, RORA, RNF2, RNF168, RING1, RELA, RARA, RANGAP1, RANBP2, RAE1, RAD52, RAD21, PPARGC1A, PPARG, PPARA, POM121C, POM121, PML, PIAS4, PIAS3, PIAS2, PIAS1, PHC3, PHC2, PHC1, PGR, PCNA, PCGF2, PARP1, PARK7, NUP42, NUP58, NUP98, NUP93, NUP88, NUP85, NUP54, NUP50, NUP43, NUP37, NUP35, NUP214, NUP210, NUP205, NUP188, NUP160, NUP155, NUP153, NUP133, NUP107, NSMCE2, NSMCE1, NRIP1, NR5A2, NR4A2, NR3C2, NR3C1, NR2C1, NR1H2, NOP58, NFKBIA, NFKB2, NDC1, NCOR2, NCOA2, NCOA1"
"774","SUMOylation",0.19426362896664,0.243798119110439,-0.260374627501064,-1.05012720807085,954,150,"ZNF131, XRCC4, XPC, WRN, UHRF2, UBE2I, UBA2, TP53BP1, TP53, TRIM28, TRIM27, TPR, TOPORS, TOP2B, TOP1, THRB, THRA, TDG, SUZ12, SUMO2, SUMO1, STAG2, STAG1, SP3, SMC6, SMC5, SMC3, SMC1A, SIN3A, SENP5, SENP2, SENP1, SEH1L, SEC13, SCMH1, SATB2, SATB1, SAFB, SAE1, RXRA, RWDD3, RPA1, RORA, RNF2, RNF168, RING1, RELA, RARA, RANGAP1, RANBP2, RAE1, RAD52, RAD21, PPARGC1A, PPARG, PPARA, POM121C, POM121, PML, PIAS4, PIAS3, PIAS2, PIAS1, PHC3, PHC2, PHC1, PGR, PCNA, PCGF2, PARP1, PARK7, NUP42, NUP58, NUP98, NUP93, NUP88, NUP85, NUP54, NUP50, NUP43, NUP37, NUP35, NUP214, NUP210, NUP205, NUP188, NUP160, NUP155, NUP153, NUP133, NUP107, NSMCE2, NSMCE1, NRIP1, NR5A2, NR4A2, NR3C2, NR3C1, NR2C1, NR1H2, NOP58, NFKBIA, NFKB2, NDC1, NCOR2, NCOA2, NCOA1"
"775","SUMOylation of DNA damage response and repair proteins",0.0951429142514491,0.180867182164459,-0.403285694128082,-2.17128649583918,475,70,"XRCC4, XPC, WRN, UBE2I, TPR, TDG, SUMO2, SUMO1, STAG2, STAG1, SMC6, SMC5, SMC3, SMC1A, SEH1L, SEC13, SCMH1, RPA1, RNF2, RNF168, RING1, RANBP2, RAE1, RAD52, RAD21, POM121C, POM121, PML, PIAS4, PIAS2, PIAS1, PHC3, PHC2, PHC1, PCGF2, PARP1, NUP42, NUP58, NUP98, NUP93, NUP88, NUP85, NUP54, NUP50, NUP43, NUP37, NUP35, NUP214, NUP210, NUP205, NUP188, NUP160, NUP155, NUP153, NUP133, NUP107, NSMCE2, NSMCE1"
"776","SUMOylation of DNA methylation proteins",0.506509112757861,0.530308315195922,0.197691172336238,0.864134889818369,2528,16,"BMI1, CBX2, CBX4, CBX8, DNMT1, DNMT3A, DNMT3B"
"777","SUMOylation of DNA replication proteins",0.0583618434292614,0.177444946650036,-0.436497877562516,-2.40824319623273,289,42,"UBE2I, TPR, TOP2B, TOP1, SUMO2, SUMO1, SEH1L, SEC13, RANGAP1, RANBP2, RAE1, POM121C, POM121, PIAS4, PIAS3, PCNA, NUP42, NUP58, NUP98, NUP93, NUP88, NUP85, NUP54, NUP50, NUP43, NUP37, NUP35, NUP214, NUP210, NUP205, NUP188, NUP160, NUP155, NUP153, NUP133, NUP107"
"778","SUMOylation of RNA binding proteins",0.0625125628140703,0.177444946650036,-0.394170642527729,-2.20238656627713,310,46,"UBE2I, TPR, SUMO2, SUMO1, SEH1L, SEC13, SCMH1, RNF2, RING1, RANBP2, RAE1, POM121C, POM121, PHC3, PHC2, PHC1, PCGF2, NUP42, NUP58, NUP98, NUP93, NUP88, NUP85, NUP54, NUP50, NUP43, NUP37, NUP35, NUP214, NUP210, NUP205, NUP188, NUP160, NUP155, NUP153, NUP133, NUP107, NOP58, NDC1"
"779","SUMOylation of SUMOylation proteins",0.0477049508919623,0.177444946650036,-0.520486815415822,-2.80493942103493,237,34,"UBE2I, TPR, TOPORS, SUMO2, SUMO1, SEH1L, SEC13, RANBP2, RAE1, POM121C, POM121, PIAS4, NUP42, NUP58, NUP98, NUP93, NUP88, NUP85, NUP54, NUP50, NUP43, NUP37, NUP35, NUP214, NUP210, NUP205, NUP188, NUP160, NUP155, NUP153, NUP133, NUP107"
"780","SUMOylation of chromatin organization proteins",0.0741116751269036,0.177444946650036,-0.357199906037115,-1.98331439481933,364,54,"UBE2I, TPR, SUZ12, SUMO2, SUMO1, SEH1L, SEC13, SCMH1, SATB2, SATB1, RNF2, RING1, RANBP2, RAE1, POM121C, POM121, PIAS2, PIAS1, PHC3, PHC2, PHC1, PCGF2, NUP42, NUP58, NUP98, NUP93, NUP88, NUP85, NUP54, NUP50, NUP43, NUP37, NUP35, NUP214, NUP210, NUP205, NUP188, NUP160, NUP155, NUP153, NUP133, NUP107"
"781","SUMOylation of intracellular receptors",0.033905065815716,0.177444946650036,-0.444620253164557,-2.22618637054898,169,24,"UBE2I, THRB, THRA, SUMO2, SUMO1, RXRA, RORA, RARA, PPARG, PPARA, PIAS4, PIAS3, PIAS2, PIAS1, PGR, NR5A2, NR4A2, NR3C2, NR3C1, NR2C1, NR1H2"
"782","SUMOylation of transcription cofactors",0.178926038500507,0.230690804355999,-0.18124305582984,-0.995051486498427,882,41,"ZNF131, UHRF2, UBE2I, TRIM28, TOPORS, SUMO2, SUMO1, SIN3A, SCMH1, SAFB, RNF2, RING1, PPARGC1A, PIAS4, PIAS3, PIAS2, PIAS1, PHC3, PHC2, PHC1, PCGF2, PARK7, NRIP1, NCOR2, NCOA2, NCOA1, MRTFA"
"783","SUMOylation of ubiquitinylation proteins",0.051276895234265,0.177444946650036,-0.498281205115864,-2.72549241051919,254,37,"UBE2I, TRIM27, TPR, SUMO1, SEH1L, SEC13, RANBP2, RAE1, POM121C, POM121, PML, PIAS4, PIAS2, PIAS1, NUP42, NUP58, NUP98, NUP93, NUP88, NUP85, NUP54, NUP50, NUP43, NUP37, NUP35, NUP214, NUP210, NUP205, NUP188, NUP160, NUP155, NUP153, NUP133, NUP107"
"784","Scavenging by Class A Receptors",0.0268763687039618,0.177444946650036,0.482113992550425,2.07076756313808,134,15,"APOA1, APOE, CALR, COL1A1, COL1A2, COL3A1, COL4A1, COL4A2, COLEC11, COLEC12"
"785","Selective autophagy",0.368421052631579,0.40130879803121,-0.129960502484655,-0.720519159292454,1819,51,"VDAC1, VCP, ULK1, UBE2N, UBC, UBB, TOMM70, TOMM7, TOMM6, TOMM40, TOMM22, TOMM20"
"786","Selenoamino acid metabolism",0.105210016155089,0.181397866039711,-0.478754940711462,-2.501253264323,520,76,"TXNRD1, SEPSECS, SEPHS2, SECISBP2, SCLY, RPSA, RPS9, RPS8, RPS7, RPS5, RPS4X, RPS3A, RPS28, RPS27L, RPS27A, RPS25, RPS24, RPS21, RPS20, RPS19, RPS17, RPS16, RPS15A, RPS15, RPS14, RPS13, RPS12, RPS11, RPLP1, RPL8, RPL7A, RPL6, RPL5, RPL4, RPL38, RPL37A, RPL36, RPL35, RPL34, RPL32, RPL30, RPL3, RPL29, RPL28, RPL27, RPL26, RPL23, RPL22L1, RPL19, RPL18A, RPL18, RPL14, RPL13A, RPL12, RPL11, RPL10A, RPL10"
"787","Selenocysteine synthesis",0.0814799838253134,0.177444946650036,-0.630540140990773,-3.48319804835545,402,61,"SEPSECS, SEPHS2, SECISBP2, RPSA, RPS9, RPS8, RPS7, RPS5, RPS4X, RPS3A, RPS28, RPS27L, RPS27A, RPS25, RPS24, RPS21, RPS20, RPS19, RPS17, RPS16, RPS15A, RPS15, RPS14, RPS13, RPS12, RPS11, RPLP1, RPL8, RPL7A, RPL6, RPL5, RPL4, RPL38, RPL37A, RPL36, RPL35, RPL34, RPL32, RPL30, RPL3, RPL29, RPL28, RPL27, RPL26, RPL23, RPL22L1, RPL19, RPL18A, RPL18, RPL14, RPL13A, RPL12, RPL11, RPL10A, RPL10"
"788","Sema3A PAK dependent Axon repulsion",0.292255624129007,0.330642400366702,0.246398200857404,1.0583252297904,1467,15,"CFL1, FES, FYN, HSP90AB1, LIMK1, NRP1, PAK1, PAK2, PAK3, PLXNA1, PLXNA2, PLXNA3, PLXNA4, RAC1, SEMA3A"
"789","Sema4D in semaphorin signaling",0.0946592267835791,0.180867182164459,-0.273251428644482,-1.33492996249553,474,22,"SEMA4D, RRAS, ROCK2, ROCK1, RND1, RHOC, RHOB, RHOA, RAC1, PLXNB1, MYL12B, MYH9, MYH14, MYH11, MYH10, MET, LIMK2, LIMK1"
"790","Sema4D induced cell migration and growth-cone collapse",0.103654883163571,0.181397866039711,-0.288345283284128,-1.33133955438072,518,18,"SEMA4D, ROCK2, ROCK1, RND1, RHOC, RHOB, RHOA, PLXNB1, MYL12B, MYH9, MYH14, MYH11, MYH10, LIMK2, LIMK1"
"791","Semaphorin interactions",0.108979430379747,0.181397866039711,0.196606882171336,1.01545080501912,550,61,"ARHGAP35, ARHGEF11, ARHGEF12, CD72, CDK5, CDK5R1, CFL1, CRMP1, DPYSL2, DPYSL3, DPYSL4, DPYSL5, ERBB2, FARP2, FES, FYN, GSK3B, HSP90AB1, ITGA1, ITGB1, LIMK1, LIMK2, MET, MYH10, MYH11, MYH14, MYH9, MYL12B, NRP1, PAK1, PAK2, PAK3, PIP5K1C, PLXNA1, PLXNA2, PLXNA3, PLXNA4, PLXNB1, PLXNB3, PLXNC1, PLXND1, PTPRC, RAC1, RHOA, RHOB, RHOC, RND1, ROCK1, ROCK2, RRAS, SEMA3A, SEMA3E, SEMA4A, SEMA4D, SEMA5A, SEMA6A, SEMA6D, SEMA7A"
"792","Senescence-Associated Secretory Phenotype (SASP)",0.0716122650840752,0.177444946650036,0.314633918672612,1.65711914762316,361,43,"ANAPC1, ANAPC10, ANAPC15, ANAPC16, ANAPC2, ANAPC4, ANAPC5, ANAPC7, CCNA2, CDC16, CDC23, CDC26, CDC27, CDK2, CDK4, CDK6, CDKN1A, CDKN1B, CDKN2D, CEBPB"
"793","Separation of Sister Chromatids",0.0210355987055016,0.177444946650036,-0.999929037751916,-4.02235626747892,103,152,"PTTG1"
"794","Serotonin Neurotransmitter Release Cycle",0.0249650489314959,0.177444946650036,-0.592975303435025,-2.737868527768,124,18,"VAMP2, UNC13B, TSPOAP1, SYT1, SYN3, SYN2, SYN1, STXBP1, STX1A, SNAP25, SLC18A2, RIMS1, RAB3A, PPFIA4, PPFIA3, PPFIA2, PPFIA1"
"795","Sialic acid metabolism",0.0395626242544732,0.177444946650036,-0.442591810890671,-2.37091399030723,198,30,"ST8SIA6, ST8SIA5, ST8SIA4, ST8SIA3, ST8SIA1, ST6GALNAC6, ST6GALNAC5, ST6GALNAC4, ST6GALNAC3, ST6GALNAC2, ST6GAL2, ST6GAL1, ST3GAL6, ST3GAL5, ST3GAL4, ST3GAL3, ST3GAL2, ST3GAL1, SLC35A1, SLC17A5"
"796","Signal amplification",0.0422930446983363,0.177444946650036,0.441526019690577,2.1555900127511,210,24,"GNA11, GNA13, GNA14, GNAI1, GNAI2, GNAI3, GNB1, GNB2, GNB4, GNB5, GNG11, GNG12, GNG13, GNG2, GNG3, GNG4, GNG7, GNG8, GNGT2"
"797","Signal transduction by L1",0.0685207577589682,0.177444946650036,0.310935004670504,1.46588777257693,339,21,"CSNK2A1, CSNK2A2, CSNK2B, EGFR, FGFR1, ITGA2B, ITGA5, ITGA9, ITGAV, ITGB1, ITGB3, L1CAM, MAP2K1, MAP2K2, MAPK1, MAPK3, NCAM1, NRP1, PAK1"
"798","Signaling by BMP",0.0766445383222692,0.177444946650036,0.288147045245396,1.39357276732287,380,23,"ACVR2A, ACVR2B, ACVRL1, AMH, AMHR2, BMP2, BMPR1A, BMPR1B, BMPR2"
"799","Signaling by BRAF and RAF fusions",0.0970797158642463,0.181397866039711,0.217719706328625,1.13844986717757,491,57,"AGGF1, AGK, AGTRAP, AKAP9, AP3B1, APBB1IP, ARAF, ARRB1, ARRB2, ATG7, BCL2L11, BRAF, CALM1, CAMK2A, CAMK2B, CAMK2G, CLCN6, CNKSR2, CSK, ESRP1, FAM114A2, FAM131B, FGG, FN1, FXR1, HRAS, IQGAP1, ITGA2B, ITGB3, JAK2, KDM7A, KRAS, KSR1, KSR2, LMNA, MAP2K1, MAP2K2, MAPK1, MAPK3, MARK3"
"800","Signaling by EGFR",0.0300870942201108,0.177444946650036,0.999647812918222,5.26138341527442,151,47,"PTPRK, ADAM10"
"801","Signaling by EGFR in Cancer",0.920746388443018,0.923449166491285,0.111868935452116,0.535070419270459,4588,22,"AREG, BTC, CBL, CDC37, EGF, EGFR, GAB1, UBA52, GRB2, HBEGF, HRAS"
"802","Signaling by ERBB2",0.660301507537688,0.673441836045901,-0.106313197817206,-0.594013692113325,3284,46,"YES1, USP8, UBC, UBB, STUB1, SRC, SOS1, SHC1, RPS27A, RNF41, RHOA, PTPN18, PTPN12, PRKCE, PRKCD, PRKCA, PLCG1, PIK3R1, PIK3CA, NRG4, NRG3, NRG2, NRG1, NRAS, MEMO1, MATK, KRAS, HRAS, HBEGF, GRB2, UBA52, GAB1, FYN, ERBIN, ERBB4, ERBB3, ERBB2, EGFR, EGF"
"803","Signaling by ERBB2 KD Mutants",0.0828807081070207,0.177545516271502,0.282567421724761,1.36658789443046,411,23,"BTC, CDC37, EGF, EGFR, ERBB2, ERBB3, ERBB4, ERBIN, GAB1, GRB2, HBEGF, HRAS, KRAS, NRAS, NRG1, NRG2, NRG3, NRG4, PIK3CA, PIK3R1, PLCG1"
"804","Signaling by ERBB2 in Cancer",0.132291040288635,0.195105491073167,0.244479606188467,1.19358265180046,659,24,"BTC, CDC37, EGF, EGFR, ERBB2, ERBB3, ERBB4, ERBIN, GAB1, GRB2, HBEGF, HRAS, KRAS, NRAS, NRG1, NRG2, NRG3, NRG4, PIK3CA, PIK3R1, PLCG1"
"805","Signaling by ERBB4",0.488984088127295,0.513533494191063,-0.113126045143805,-0.625572089065318,2396,55,"YAP1, WWP1, WWOX, UBC, UBB, TAB2, STMN1, STAT5A, SRC, SPARC, SOS1, SHC1, S100B, RPS27A, PSENEN, PSEN2, PSEN1, PIK3R1, PIK3CA, PGR, NRG4, NRG3, NRG2, NRG1, NRAS, NEDD4, NCSTN, NCOR1, MXD4, KRAS, ITCH, HRAS, HBEGF, GRB2, UBA52, GFAP, GABRG3, GABRG2, GABRB3, GABRB2, GABRB1, GABRA1, ESR1, ERBB4, ERBB3, EGFR, EGF"
"806","Signaling by Erythropoietin",0.165573444643212,0.219990494817002,-0.235383679371903,-1.16861232852751,832,23,"VAV1, STAT5B, STAT5A, SOS1, SHC1, RAPGEF1, PLCG2, PLCG1, PIK3R5, PIK3R1, PIK3CD, PIK3CB, PIK3CA, NRAS, LYN, KRAS, JAK2, IRS2, HRAS, GRB2, GAB1"
"807","Signaling by FGFR",0.0264006449012495,0.177444946650036,-0.999788300049397,-5.2937103409065,130,73,"SPRED2"
"808","Signaling by FGFR in disease",0.0913725490196078,0.180867182164459,0.229552982784359,1.20766806202564,465,55,"BAG4, BCR, CNTRL, CPSF6, CUX1, ERLIN2, FGF1, FGF10, FGF2, FGF20, FGF22, FGF5, FGF7, FGF9, FGFR1, FGFR1OP, FGFR1OP2, FGFR2, FGFR3, FGFR4, FRS2, GAB1, GAB2, GRB2, GTF2F1, GTF2F2, HRAS, KRAS, LRRFIP1, MYO18A, NCBP1, NCBP2, NRAS, PIK3CA, PIK3R1, PLCG1, POLR2A, POLR2B, POLR2C, POLR2D, POLR2E, POLR2F, POLR2G, POLR2H, POLR2I, POLR2J, POLR2K, POLR2L"
"809","Signaling by FGFR1",0.0145896656534954,0.177444946650036,-0.99978877701894,-5.48898993234337,71,41,"SPRED2"
"810","Signaling by FGFR1 in disease",0.193042429117233,0.243380676316315,0.193499273929926,0.986479116844988,959,33,"BAG4, BCR, CNTRL, CPSF6, CUX1, ERLIN2, FGF1, FGF2, FGF20, FGF5, FGF9, FGFR1, FGFR1OP, FGFR1OP2, FRS2, GAB1, GAB2"
"811","Signaling by FGFR2",0.0833164812942366,0.177545516271502,-0.257634620896093,-1.41895919737952,411,62,"UBC, UBB, TIAL1, TIA1, SRC, SPRY2, SOS1, SHC1, RPS27A, RBFOX2, PTPN11, PTBP1, PPP2R1A, PPP2CB, PPP2CA, POLR2L, POLR2K, POLR2J, POLR2I, POLR2H, POLR2G, POLR2F, POLR2E, POLR2D, POLR2C, POLR2B, POLR2A, PLCG1, PIK3R1, PIK3CA, NRAS, NCBP2, NCBP1, MKNK1, MAPK3, MAPK1, KRAS, HRAS, HNRNPM, HNRNPH1, HNRNPF, HNRNPA1, GTF2F2, GTF2F1, GRB2, UBA52, GAB1, FRS3, FRS2, FGFR2, FGFBP3, FGF9, FGF7, FGF5, FGF22, FGF20, FGF2, FGF10, FGF1"
"812","Signaling by FGFR2 IIIa TM",0.0436444086886565,0.177444946650036,0.356414762741652,1.64332675842931,216,19,"FGF1, FGF2, FGFR2, GTF2F1, GTF2F2, NCBP1, NCBP2, POLR2A, POLR2B, POLR2C, POLR2D, POLR2E, POLR2F, POLR2G, POLR2H, POLR2I, POLR2J, POLR2K, POLR2L"
"813","Signaling by FGFR2 in disease",0.0611188532749353,0.177444946650036,0.328174295969355,1.69265661835407,306,35,"FGF1, FGF10, FGF2, FGF20, FGF22, FGF5, FGF7, FGF9, FGFR2, FRS2, GAB1, GRB2, GTF2F1, GTF2F2, HRAS, KRAS, NCBP1, NCBP2, NRAS, PIK3CA, PIK3R1, PLCG1, POLR2A, POLR2B, POLR2C, POLR2D, POLR2E, POLR2F, POLR2G, POLR2H, POLR2I, POLR2J, POLR2K, POLR2L"
"814","Signaling by FGFR3",0.0769693325315695,0.177444946650036,-0.246665562776835,-1.32929776576907,383,34,"UBC, UBB, SRC, SPRY2, SOS1, SHC1, RPS27A, PTPN11, PPP2R1A, PPP2CB, PPP2CA, PLCG1, PIK3R1, PIK3CA, NRAS, MKNK1, MAPK3, MAPK1, KRAS, HRAS, GRB2, UBA52, GALNT3, GAB1, FRS3, FRS2, FGFR3, FGF9, FGF5, FGF20, FGF2, FGF1"
"815","Signaling by FGFR3 in disease",0.101742439415181,0.181397866039711,0.306912426201856,1.34155578352657,507,16,"FGF1, FGF2, FGF20, FGF5, FGF9, FGFR3, FRS2, GAB1, GRB2, HRAS, KRAS, NRAS, PIK3CA, PIK3R1, PLCG1"
"816","Signaling by FGFR3 point mutants in cancer",0.101742439415181,0.181397866039711,0.306912426201856,1.34155578352657,507,16,"FGF1, FGF2, FGF20, FGF5, FGF9, FGFR3, FRS2, GAB1, GRB2, HRAS, KRAS, NRAS, PIK3CA, PIK3R1, PLCG1"
"817","Signaling by FGFR4",0.0775502087890237,0.177444946650036,-0.244861534918533,-1.31642358434698,389,33,"UBC, UBB, SRC, SPRY2, SOS1, SHC1, RPS27A, PTPN11, PPP2R1A, PPP2CB, PPP2CA, PLCG1, PIK3R1, PIK3CA, NRAS, MKNK1, MAPK3, MAPK1, KRAS, KLB, HRAS, GRB2, UBA52, GAB1, FRS3, FRS2, FGFR4, FGF9, FGF20, FGF2, FGF1"
"818","Signaling by Hedgehog",0.164082947453191,0.218990912942084,-0.227547290505346,-1.0027640916947,814,124,"WDR35, WDR19, VCP, UBC, UBB, TULP3, TTC21B, SYVN1, SUFU, SPOPL, SPOP, SMURF2, SMURF1, SMO, SKP1, SHH, SEL1L, SCUBE2, RPS27A, RPGRIP1L, RBX1, PTCH1, PSMF1, PSME4, PSME3, PSME2, PSME1, PSMD9, PSMD8, PSMD7, PSMD6, PSMD5, PSMD4, PSMD3, PSMD2, PSMD14, PSMD13, PSMD12, PSMD11, PSMD10, PSMD1, PSMC6, PSMC5, PSMC4, PSMC3, PSMC2, PSMC1, PSMB9, PSMB8, PSMB7, PSMB6, PSMB5, PSMB4, PSMB3, PSMB2, PSMB10, PSMB1, PSMA8, PSMA7, PSMA6, PSMA5, PSMA4, PSMA3, PSMA1, PRKAR2B, PRKAR2A, PRKAR1B, PRKAR1A, PRKACB, PRKACA"
"819","Signaling by Hippo",0.0727634194831014,0.177444946650036,-0.304053279067616,-1.43045436546182,365,19,"YWHAE, YWHAB, YAP1, WWTR1, WWC1, TJP2, TJP1, STK4, STK3"
"820","Signaling by Insulin receptor",0.101506740681998,0.181397866039711,0.293401798307475,1.49964909822309,511,64,"AKT2, ATP6AP1, ATP6V0A1, ATP6V0A2, ATP6V0A4, ATP6V0B, ATP6V0C, ATP6V0D1, ATP6V0D2, ATP6V0E1, ATP6V0E2, ATP6V1A, ATP6V1B2, ATP6V1C1, ATP6V1C2, ATP6V1D, ATP6V1E1, ATP6V1F, ATP6V1G1, ATP6V1G2, ATP6V1H, FGF1, FGF10, FGF2, FGF20, FGF22, FGF5, FGF7, FGF9, FGFR1, FGFR2, FGFR3, FGFR4, FLT3, FLT3LG, FRS2, GAB1, GAB2, GRB10, GRB2, HRAS, INSR, IRS1, IRS2, KL, KLB, KRAS"
"821","Signaling by Interleukins",0.109449875407322,0.181397866039711,0.999712643678161,2.28359630967112,570,324,"IL12B, AIP"
"822","Signaling by Ligand-Responsive EGFR Variants in Cancer",0.792690233672858,0.798140952371984,-0.147218707530812,-0.67973398506209,3968,18,"UBC, UBB, SOS1, SHC1, RPS27A, PLCG1, PIK3R1, PIK3CA, NRAS, KRAS, HRAS, GRB2, UBA52, GAB1, EGFR, EGF"
"823","Signaling by MET",0.0853387259858443,0.177618758131686,-0.226170384085233,-1.24566545271116,421,62,"USP8, UBC, UBB, TNS4, TNS3, STAT3, STAM2, STAM, SRC, SPINT2, SPINT1, SOS1, SHC1, SH3KBP1, SH3GL3, SH3GL2, SH3GL1, RPS27A, RAPGEF1, RAP1B, RAP1A, RANBP9, RANBP10, RAC1, RAB4B, PTPRJ, PTPN2, PTPN11, PTPN1, PTK2, PIK3R1, PIK3CA, NRAS, MUC20, MET, LRIG1, LAMC3, LAMC2, LAMC1, LAMB1, LAMA5, LAMA4, LAMA3, LAMA2, LAMA1, KRAS, ITGB1, ITGA3, ITGA2, HRAS, HPN, HGS, GRB2, UBA52, GGA3, GAB1"
"824","Signaling by NODAL",0.167628907027673,0.219999525868585,0.282774615222433,1.21456856662426,841,15,"ACVR1B, ACVR1C, ACVR2A, ACVR2B, GDF1, DAND5, DRAP1, FOXO3, FURIN, LEFTY1, LEFTY2"
"825","Signaling by NOTCH",0.211585365853659,0.259761981996594,-0.147092703817115,-0.566214903803958,1040,166,"YWHAZ, YBX1, WWP2, WWC1, UBC, UBB, TP53, TNRC6C, TNRC6B, TNRC6A, TMED2, TLE4, TLE3, TLE2, TLE1, TFDP2, TFDP1, TBL1XR1, TBL1X, TACC3, STAT1, ST3GAL6, ST3GAL4, ST3GAL3, SNW1, SMAD3, SKP1, SIRT6, SEL1L, RUNX1, RPS27A, RFNG, RBX1, RBPJ, RAB6A, PTCRA, PSMF1, PSME3, PSME2, PSME1, PSMD9, PSMD8, PSMD7, PSMD6, PSMD5, PSMD4, PSMD3, PSMD2, PSMD14, PSMD13, PSMD12, PSMD11, PSMD10, PSMD1, PSMC6, PSMC5, PSMC4, PSMC3, PSMC2, PSMC1, PSMB9, PSMB8, PSMB7, PSMB6, PSMB5, PSMB4, PSMB3, PSMB2, PSMB10, PSMB1, PSMA7, PSMA6, PSMA5, PSMA4, PSMA3, PSMA1, PSENEN, PSEN2, PSEN1"
