"","pathway","pval","padj","ES","NES","nMoreExtreme","size","leadingEdge"
"526","Mitotic G2-G2/M phases",0.594238111766748,0.625728649583631,0.178135018966307,0.294437217537085,3423,176,"ACTR1A, AJUBA, AKAP9, ALMS1, AURKA, BORA, BTRC, CCNA1, CCNA2, CCNB1, CCNB2, CCNH, CCP110, CDC25A, CDC25B, CDC25C, CDK11A, CDK11B, CDK2, CDK5RAP2, CDK7, CDKN1A, CENPF, CENPJ, CEP131, CEP135, CEP152, CEP164, CEP192, CEP250, CEP290, CEP41, CEP57, CEP63, CEP70, CEP72, CEP76, CEP78, CETN2, CKAP5, CLASP1, CNTRL, CSNK1D, CSNK1E, CUL1, DCTN1, DCTN2, DCTN3, DYNC1H1, DYNC1I2, DYNLL1, E2F1, E2F3, EP300, FBXL18, FBXL7, FBXW11, FGFR1OP, FKBPL, FOXM1, UBA52, HAUS1, HAUS2, HAUS3, HAUS4, HAUS6, HAUS7, HAUS8, HMMR, HSP90AB1, LCMT1, LIN37, LIN52, LIN54, LIN9, MAPRE1, MNAT1, MYBL2, MZT1, MZT2A, MZT2B, NDE1, NEDD1, NINL, NME7, ODF2, OFD1, OPTN, PAFAH1B1, PCM1, PCNT, PHLDA1, PKMYT1, PLK1, PLK4, PPME1, PPP1CB, PPP1R12A, PPP1R12B, PPP2CA, PPP2CB, PPP2R1A, PPP2R1B, PPP2R2A, PPP2R3B, PRKACA, PRKAR2B, PSMA1, PSMA3, PSMA4, PSMA5, PSMA6, PSMA7, PSMA8, PSMB1, PSMB10, PSMB11, PSMB2, PSMB3, PSMB4, PSMB5, PSMB6, PSMB7, PSMB8, PSMB9, PSMC1, PSMC2, PSMC3, PSMC4, PSMC5, PSMC6, PSMD1, PSMD10, PSMD11, PSMD12, PSMD13, PSMD14, PSMD2, PSMD3, PSMD4, PSMD5, PSMD6, PSMD7, PSMD8, PSMD9, PSME1, PSME2, PSME3, PSME4, PSMF1"
"527","Mitotic Metaphase and Anaphase",0.403286384976526,0.459745971953564,-0.162955137273276,-0.384333863387402,1717,172,"ZWINT, ZWILCH, ZW10, XPO1, WAPL, VRK2, VRK1, UBE2E1, UBE2D1, UBE2C, UBC, UBB, TMPO, TAOK1, STAG2, STAG1, SPDL1, SPC25, SPC24, SMC3, SMC1A, SKA2, SKA1, SGO2, SGO1, SEH1L, SEC13, RPS27A, RCC2, RANGAP1, RANBP2, RAD21, PTTG1, PSMF1, PSME4, PSME3, PSME2, PSME1, PSMD9, PSMD8, PSMD7, PSMD6, PSMD5, PSMD4, PSMD3, PSMD2, PSMD14, PSMD13, PSMD12, PSMD11, PSMD10, PSMD1, PSMC6, PSMC5, PSMC4, PSMC3, PSMC2, PSMC1, PSMB9, PSMB8, PSMB7, PSMB6, PSMB5, PSMB4, PSMB3, PSMB2, PSMB11, PSMB10, PSMB1, PSMA8, PSMA7, PSMA6, PSMA5, PSMA4, PSMA3, PSMA1, PPP2R5E, PPP2R5D, PPP2R5C, PPP2R5B, PPP2R5A, PPP2R2A, PPP2R1B, PPP2R1A, PPP2CB, PPP2CA, PPP1CC, PMF1, PLK1, PDS5B, PDS5A, PAFAH1B1, NUP98, NUP85, NUP43, NUP37, NUP160, NUP133, NUP107, NUDC, NSL1"
"528","Mitotic Prometaphase",0.597014925373134,0.62643704268267,0.126130344916677,0.208479321021565,3439,176,"ACTR1A, AHCTF1, AKAP9, ALMS1, B9D2, BIRC5, BUB1, BUB3, CCNB1, CCNB2, CCP110, CDC20, CDCA8, CDK5RAP2, CENPA, CENPC, CENPE, CENPF, CENPH, CENPI, CENPJ, CENPK, CENPL, CENPM, CENPN, CENPO, CENPP, CENPQ, CENPT, CENPU, CEP131, CEP135, CEP152, CEP164, CEP192, CEP250, CEP290, CEP41, CEP57, CEP63, CEP70, CEP72, CEP76, CEP78, CETN2, CKAP5, CLASP1, CLASP2, CLIP1, CNTRL, CSNK1D, CSNK1E, CSNK2A1, CSNK2A2, CSNK2B, DCTN1, DCTN2, DCTN3, DSN1, DYNC1H1, DYNC1I1, DYNC1I2, DYNC1LI1, DYNC1LI2, DYNLL1, DYNLL2"
"529","Mitotic Prophase",0.197376908191787,0.327670681256273,-0.306792073993614,-1.13816371628098,917,78,"VRK2, VRK1, USO1, TPR, TMPO, SMC4, SMC2, SET, SEH1L, SEC13, RB1, RANBP2, RAE1, RAB2A, RAB1B, RAB1A, PRKCB, PRKCA, PPP2R2D, PPP2R1B, PPP2R1A, PPP2CB, PPP2CA, POM121, POM121C, PLK1, PHF8, NUP42, NUP58, NUP98, NUP93, NUP88, NUP85, NUP54, NUP50, NUP43, NUP37, NUP35, NUP214, NUP210, NUP205, NUP188, NUP160, NUP155, NUP153, NUP133, NUP107, NUMA1, NEK9, NEK7, NEK6, NDC1, NCAPH2, NCAPG2, NCAPD3, MCPH1, MASTL, MAPK3, MAPK1, LPIN3, LPIN2, LPIN1, LMNB1, LMNA, LEMD3, LEMD2, KMT5A"
"530","Mitotic Spindle Checkpoint",0.415652805520247,0.470459346332516,0.197614477909579,0.432396378912844,2288,103,"AHCTF1, ANAPC1, ANAPC10, ANAPC15, ANAPC16, ANAPC2, ANAPC4, ANAPC5, ANAPC7, B9D2, BIRC5, BUB1, BUB3, CDC16, CDC20, CDC23, CDC26, CDC27, CDCA8, CENPA, CENPC, CENPE, CENPF, CENPH, CENPI, CENPK, CENPL, CENPM, CENPN, CENPO, CENPP, CENPQ, CENPT, CENPU, CKAP5, CLASP1, CLASP2, CLIP1, DSN1, DYNC1H1, DYNC1I1, DYNC1I2, DYNC1LI1, DYNC1LI2, DYNLL1, DYNLL2"
"531","Molecules associated with elastic fibres",0.134468584850264,0.327670681256273,0.355095512293209,1.32357213379211,686,28,"BMP2, BMP4, BMP7, EFEMP1, EFEMP2, FBLN1, FBLN2, FBLN5, ITGA8, ITGAV, ITGB1, ITGB3, ITGB5, ITGB6, ITGB8, LTBP1, LTBP2, LTBP3, LTBP4, MFAP1, MFAP2, MFAP3, MFAP4, MFAP5"
"532","Muscle contraction",0.110209923664122,0.327670681256273,-0.999483137356248,-2.27909617555245,461,180,"FGF12"
"533","MyD88 cascade initiated on plasma membrane",0.191934440370929,0.327670681256273,-0.217707330638088,-0.819655170635409,889,75,"VRK3, UBE2N, UBC, UBB, TRAF6, TNIP2, TLR5, TAB3, TAB2, TAB1, SKP1, SAA1, S100B, RPS6KA5, RPS6KA3, RPS6KA2, RPS6KA1, RPS27A, RIPK2, RELA, PPP2R5D, PPP2R1B, PPP2R1A, PPP2CB, PPP2CA, PELI3, PELI2, PELI1, NOD2, NOD1, NKIRAS2, NKIRAS1, NFKBIB, NFKBIA, NFKB2, NFKB1, MEF2C, MEF2A, MAPKAPK3, MAPKAPK2, MAPK9, MAPK8, MAPK7, MAPK3, MAPK14, MAPK11, MAPK10, MAPK1, MAP3K8, MAP3K7, MAP3K1, MAP2K6, MAP2K4, MAP2K3, MAP2K1"
"534","MyD88 dependent cascade initiated on endosome",0.20567837017772,0.327670681256273,-0.20967206319542,-0.764408918251779,948,81,"VRK3, UBE2N, UBC, UBB, TRAF6, TNIP2, TLR8, TLR7, TLR4, TICAM1, TAB3, TAB2, TAB1, SKP1, SAA1, S100B, RPS6KA5, RPS6KA3, RPS6KA2, RPS6KA1, RPS27A, RIPK2, RELA, PPP2R5D, PPP2R1B, PPP2R1A, PPP2CB, PPP2CA, PELI3, PELI2, PELI1, NOD2, NOD1, NKIRAS2, NKIRAS1, NFKBIB, NFKBIA, NFKB2, NFKB1, MEF2C, MEF2A, MAPKAPK3, MAPKAPK2, MAPK9, MAPK8, MAPK7, MAPK3, MAPK14, MAPK11, MAPK10, MAPK1, MAP3K8, MAP3K7, MAP3K1, MAP2K6, MAP2K4, MAP2K3, MAP2K1, LY96, JUN, IRF7, IRAK2, IRAK1, IKBKG, IKBKB"
"535","MyD88-independent TLR4 cascade",0.224667683591196,0.33086025351085,-0.19373632852954,-0.674487531730085,1030,89,"VRK3, UBE2N, UBE2D3, UBE2D2, UBE2D1, UBC, UBB, TRAF6, TRAF3, TNIP2, TLR4, TICAM1, TBK1, TANK, TAB3, TAB2, TAB1, SKP1, SARM1, SAA1, S100B, RPS6KA5, RPS6KA3, RPS6KA2, RPS6KA1, RPS27A, RIPK2, RIPK1, RELA, PTPN11, PPP2R5D, PPP2R1B, PPP2R1A, PPP2CB, PPP2CA, NOD2, NOD1, NKIRAS2, NKIRAS1, NFKBIB, NFKBIA, NFKB2, NFKB1, MEF2C, MEF2A, MAPKAPK3, MAPKAPK2, MAPK9, MAPK8, MAPK7, MAPK3, MAPK14, MAPK11, MAPK10, MAPK1, MAP3K8, MAP3K7, MAP2K6, MAP2K4, MAP2K3, MAP2K1, LY96, JUN, IRF7, IRF3, IRAK2, IRAK1, IKBKG, IKBKE, IKBKB"
"536","MyD88:MAL(TIRAP) cascade initiated on plasma membrane",0.215109949923797,0.327670681256273,-0.192867232934011,-0.688361650170846,987,84,"VRK3, UBE2N, UBC, UBB, TRAF6, TNIP2, TLR6, TLR4, TLR1, TIRAP, TAB3, TAB2, TAB1, SOCS1, SKP1, SAA1, S100B, RPS6KA5, RPS6KA3, RPS6KA2, RPS6KA1, RPS27A, RIPK2, RELA, PPP2R5D, PPP2R1B, PPP2R1A, PPP2CB, PPP2CA, PELI3, PELI2, PELI1, NOD2, NOD1, NKIRAS2, NKIRAS1, NFKBIB, NFKBIA, NFKB2, NFKB1, MEF2C, MEF2A, MAPKAPK3, MAPKAPK2, MAPK9, MAPK8, MAPK7, MAPK3, MAPK14, MAPK11, MAPK10, MAPK1, MAP3K8, MAP3K7, MAP3K1, MAP2K6, MAP2K4, MAP2K3, MAP2K1, LY96, JUN, IRAK3, IRAK2, IRAK1, IKBKG, IKBKB"
"537","Myogenesis",0.154450776183926,0.327670681256273,0.270603692622628,1.01213451760641,785,26,"ABL1, BNIP2, BOC, CDC42, CDH2, CDH4, CDON, CTNNA1, CTNNA2, CTNNB1, MAP2K6, MAPK11, MAPK12, MAPK14, MEF2A, MEF2B, MEF2C, MEF2D, MYF6, MYOD1, NEO1, NTN3"
"538","N-Glycan antennae elongation",0.164789567279194,0.327670681256273,0.308393530652688,1.12016619253281,833,15,"B4GALT1, B4GALT2, B4GALT3, B4GALT4, B4GALT5, B4GALT6"
"539","N-glycan antennae elongation in the medial/trans-Golgi",0.0653414682149183,0.327670681256273,0.998401023345059,3.732349810844,331,23,"MAN2A1, B4GALT1"
"540","N-glycan trimming in the ER and Calnexin/Calreticulin cycle",0.356079404466501,0.430262613730356,-0.164618535586277,-0.7599586693529,1721,34,"VCP, UGGT2, UGGT1, UBXN1, UBC, UBB, TRIM13, SYVN1, SEL1L, RPS27A, RNF5, RNF185, RNF139, RNF103, RAD23B, PSMC1, PRKCSH"
"541","NCAM signaling for neurite out-growth",0.249764195434824,0.346712787485079,0.277252043604668,0.834211150172602,1323,55,"AGRN, ARTN, CACNA1C, CACNA1D, CACNA1G, CACNA1H, CACNA1I, CACNA1S, CACNB1, CACNB2, CACNB3, CACNB4, CNTN2, COL4A1, COL4A2, COL4A3, COL4A4, COL4A5, COL6A1, COL6A2, COL6A3, COL6A5, COL6A6, COL9A1, COL9A2, CREB1"
"542","NCAM1 interactions",0.160724609751397,0.327670681256273,0.528341913479211,1.89976620401011,833,35,"AGRN, ARTN, CACNA1C, CACNA1D, CACNA1G, CACNA1H, CACNA1I, CACNA1S, CACNB1, CACNB2, CACNB3, CACNB4, CNTN2, COL4A1, COL4A2, COL4A3, COL4A4, COL4A5, COL6A1, COL6A2, COL6A3, COL6A5, COL6A6, COL9A1, COL9A2"
"543","NEP/NS2 Interacts with the Cellular Export Machinery",0.0745867768595041,0.327670681256273,-0.515105366436311,-2.38155586512908,360,30,"XPO1, TPR, SEH1L, SEC13, RANBP2, RAE1, POM121, POM121C, NUP42, NUP58, NUP98, NUP93, NUP88, NUP85, NUP54, NUP50, NUP43, NUP37, NUP35, NUP214, NUP210, NUP205, NUP188, NUP160, NUP155, NUP153, NUP133, NUP107, NDC1"
"544","NIK-->noncanonical NF-kB signaling",0.14291754756871,0.327670681256273,-0.552406109819771,-2.32396023325833,675,57,"UBE2M, UBC, UBB, UBA3, SKP1, RPS27A, RELB, PSMF1, PSME4, PSME3, PSME2, PSME1, PSMD9, PSMD8, PSMD7, PSMD6, PSMD5, PSMD4, PSMD3, PSMD2, PSMD14, PSMD13, PSMD12, PSMD11, PSMD10, PSMD1, PSMC6, PSMC5, PSMC4, PSMC3, PSMC2, PSMC1, PSMB9, PSMB8, PSMB7, PSMB6, PSMB5, PSMB4, PSMB3, PSMB2, PSMB11, PSMB10, PSMB1, PSMA8, PSMA7, PSMA6, PSMA5, PSMA4, PSMA3, PSMA1"
"545","NOD1/2 Signaling Pathway",0.269959008393519,0.362535689619833,0.203891527906787,0.749320823497334,1382,29,"BIRC2, BIRC3, CARD9, CASP1, CASP2, CASP8, CASP9, CHUK, CYLD, IKBKB, IKBKG, IRAK1, IRAK2, ITCH, MAP2K6, MAP3K7, MAPK11, MAPK12, MAPK13, MAPK14"
"546","NOTCH1 Intracellular Domain Regulates Transcription",0.130251213848427,0.327670681256273,-0.231116356851484,-1.01793958424479,616,47,"UBC, UBB, TLE4, TLE3, TLE2, TLE1, TBL1XR1, TBL1X, SNW1, SKP1, RPS27A, RBX1, RBPJ, NOTCH1, NCOR2, NCOR1, MYC, MAMLD1, MAML3, MAML2, MAML1, KAT2B, KAT2A, HIF1A, HEYL, HEY2, HEY1, HES5, HES1, HDAC9, HDAC8, HDAC7, HDAC6, HDAC5, HDAC4, HDAC3, HDAC2, HDAC11, HDAC10, HDAC1"
"547","NOTCH2 Activation and Transmission of Signal to the Nucleus",0.415198891747477,0.470441827713878,0.191981208865322,0.717074777711918,2097,22,"ADAM10, APH1A, APH1B, CNTN1, DLL1, DLL4, UBA52, JAG1, JAG2, MDK, MIB1, MIB2, NCSTN, NEURL1, NEURL1B, NOTCH2, PSEN1, PSEN2, PSENEN"
"548","NOTCH3 Activation and Transmission of Signal to the Nucleus",0.878590344265635,0.884359699246741,-0.113800294249344,-0.519227393838134,4312,25,"YBX1, WWP2, UBC, UBB, TACC3, RPS27A, PSENEN, PSEN2, PSEN1, NOTCH3, NEURL1B, NEURL1, NCSTN, MIB2, MIB1, JAG2, JAG1, UBA52, EGFR, EGF, DLL4, DLL1"
"549","NOTCH3 Intracellular Domain Regulates Transcription",0.19759625178244,0.327670681256273,-0.223547623616708,-1.01996265277566,969,25,"WWC1, STAT1, SNW1, RBPJ, PTCRA, PLXND1, PBX1, NOTCH3, NOTCH1, MAMLD1, MAML3, MAML2, MAML1, KAT2B, KAT2A, IKZF1, HEYL, HEY2, HEY1, HES5, HES1"
"550","NOTCH4 Intracellular Domain Regulates Transcription",0.180063668921608,0.327670681256273,0.275764704298633,1.02153898724854,904,19,"ACTA2, CREBBP, EP300, FLT4, HES1, HES5, HEY1, HEY2, KAT2A, KAT2B, MAML1, MAML2, MAML3, MAMLD1, NOTCH1, NOTCH2"
"551","NR1H2 and NR1H3-mediated signaling",0.201032899770467,0.327670681256273,0.239595530835285,0.814617283335913,1050,42,"ABCA1, ABCG1, ABCG5, ABCG8, AGO1, AGO2, AGO3, AGO4, ANGPTL3, APOC1, APOD, APOE, ARL4C"
"552","NR1H3 & NR1H2 regulate gene expression linked to cholesterol transport and efflux",0.16221447928765,0.327670681256273,0.282984699256047,1.02151758770074,837,34,"ABCA1, ABCG1, ABCG5, ABCG8, AGO1, AGO2, AGO3, AGO4, APOC1, APOD, APOE, ARL4C"
"553","NRAGE signals death through JNK",0.249575551782683,0.346712787485079,0.357320561896605,1.07512569806381,1322,55,"AATF, ABR, AKAP13, ARHGEF1, ARHGEF10, ARHGEF10L, ARHGEF11, ARHGEF12, ARHGEF15, ARHGEF17, ARHGEF18, ARHGEF19, ARHGEF2, ARHGEF26, ARHGEF3, ARHGEF33, ARHGEF37, ARHGEF38, ARHGEF4, ARHGEF40, ARHGEF6, ARHGEF7, ARHGEF9, BAD, BCL2L11"
"554","NRIF signals cell death from the nucleus",0.311623246492986,0.396022263651347,-0.236766398158803,-0.993228936217432,1554,16,"UBC, UBB, TRAF6, SQSTM1, RPS27A, PSENEN, PSEN2, PSEN1, NGFR, NGF, NCSTN, MAPK8"
"555","NS1 Mediated Effects on Host Pathways",0.0991065863286931,0.327670681256273,-0.345095798838036,-1.56801770316963,476,39,"TPR, SEH1L, SEC13, RANBP2, RAE1, POM121, POM121C, PABPN1, NUP42, NUP58, NUP98, NUP93, NUP88, NUP85, NUP54, NUP50, NUP43, NUP37, NUP35, NUP214, NUP210, NUP205, NUP188, NUP160, NUP155, NUP153, NUP133, NUP107, NDC1, KPNB1, KPNA7, KPNA4, KPNA3, KPNA2, KPNA1"
"556","Na+/Cl- dependent neurotransmitter transporters",0.0384769539078156,0.327670681256273,-0.776051655798491,-3.2555166887386,191,16,"SLC6A9, SLC6A7, SLC6A6, SLC6A5, SLC6A20, SLC6A2, SLC6A19, SLC6A15, SLC6A13, SLC6A12, SLC6A11, SLC6A1, SLC22A2, SLC22A1, SLC18A2, SLC18A1"
"557","Neddylation",0.540229885057471,0.582579564489112,0.997408822957829,1.49352216444274,3195,221,"UCHL3, ANKRD9"
"558","Nef-mediates down modulation of cell surface receptors by recruiting them to clathrin adapters",0.1018,0.327670681256273,0.755288400051157,2.8000407176574,508,20,"AP1B1, AP1G1, AP1M1, AP1M2, AP1S1, AP1S2, AP1S3, AP2A1, AP2A2, AP2B1, AP2M1, AP2S1, ARF1, ATP6V1H, B2M, CD28, CD4, CD8B"
"559","Negative epigenetic regulation of rRNA expression",0.125289534638871,0.327670681256273,-0.266783700666325,-1.17278597759183,594,50,"ZNRD1, UBTF, TWISTNB, TTF1, TBP, TAF1D, TAF1C, TAF1B, TAF1A, SUV39H1, SUDS3, SMARCA5, SIRT1, SIN3B, SIN3A, SAP30L, SAP30BP, SAP30, SAP18, SAP130, RRP8, POLR2L, POLR2K, POLR2H, POLR2F, POLR2E, POLR1E, POLR1D, POLR1C, POLR1B, POLR1A"
"560","Negative regulation of FGFR1 signaling",0.0206611570247934,0.327670681256273,-0.999616073713847,-4.6216593309844,99,30,"FGF1"
"561","Negative regulation of FGFR2 signaling",0.0212590299277606,0.327670681256273,-0.999616024574427,-4.62658328117733,102,32,"FGF1"
"562","Negative regulation of FGFR3 signaling",0.0196761631481861,0.327670681256273,-0.999616098278841,-4.61088256023524,95,29,"FGF1"
"563","Negative regulation of FGFR4 signaling",0.0196761631481861,0.327670681256273,-0.999616098278841,-4.61088256023524,95,29,"FGF1"
"564","Negative regulation of MAPK pathway",0.215648487184429,0.327670681256273,0.214582502244965,0.746518519522036,1118,39,"ARAF, BRAF, BRAP, DUSP1, DUSP10, DUSP16, DUSP2, DUSP4, DUSP5, DUSP6, DUSP7, DUSP8, DUSP9, UBA52, HRAS, KRAS, KSR1, MAP2K1, MAP2K2, MAPK1, MAPK3, MARK3, NRAS, PAQR3, PPP2CA, PPP2CB, PPP2R1A, PPP2R1B, PPP2R5A, PPP2R5B, PPP2R5C, PPP2R5D, PPP2R5E, PPP5C"
"565","Negative regulation of MET activity",0.0871219707590627,0.327670681256273,-0.299548993991662,-1.33208461436238,434,21,"USP8, UBC, UBB, STAM2, STAM, SH3KBP1, SH3GL3, SH3GL2, SH3GL1, RPS27A, PTPRJ, PTPN2, PTPN1"
"566","Negative regulation of NMDA receptor-mediated neuronal transmission",0.1034,0.327670681256273,0.43307328302852,1.60550966508593,516,20,"ACTN2, CALM1, CAMK1, CAMK2A, CAMK2B, CAMK2G, CAMK4, DLG1, DLG2, DLG3, DLG4, GRIN1, GRIN2A, GRIN2B, GRIN2C, GRIN2D"
"567","Negative regulation of NOTCH4 signaling",0.125447274258051,0.327670681256273,-0.59671439537563,-2.61619022304552,595,51,"YWHAZ, UBC, UBB, TACC3, SKP1, RPS27A, RBX1, PSMF1, PSME3, PSME2, PSME1, PSMD9, PSMD8, PSMD7, PSMD6, PSMD5, PSMD4, PSMD3, PSMD2, PSMD14, PSMD13, PSMD12, PSMD11, PSMD10, PSMD1, PSMC6, PSMC5, PSMC4, PSMC3, PSMC2, PSMC1, PSMB9, PSMB8, PSMB7, PSMB6, PSMB5, PSMB4, PSMB3, PSMB2, PSMB10, PSMB1, PSMA7, PSMA6, PSMA5, PSMA4, PSMA3, PSMA1"
"568","Negative regulation of the PI3K/AKT network",0.059254327563249,0.327670681256273,-0.999614296734379,-3.24848528631306,266,102,"FGF1"
"569","Negative regulators of DDX58/IFIH1 signaling",0.119585492227979,0.327670681256273,-0.241090172715957,-1.11121831649464,576,31,"UBE2L6, UBE2K, UBE2D3, UBE2D2, UBE2D1, UBC, UBB, TRIM25, TRAF3, TNFAIP3, TBK1, TAX1BP1, RPS27A, RNF216, RNF125, PIN1, PCBP2, OTUD5, NLRX1, NLRC5, MAVS, ITCH, ISG15, IRF3, IKBKE, IFIH1"
"570","Nephrin family interactions",0.0910361349570773,0.327670681256273,0.997761718999808,3.70206998295322,455,21,"KIRREL3, ACTN1"
"571","Netrin-1 signaling",0.125,0.327670681256273,-0.262216591422269,-1.15285359959716,593,49,"WASL, UNC5D, UNC5C, UNC5B, UNC5A, TRPC7, TRPC6, TRPC5, TRPC4, TRPC3, TRPC1, TRIO, SRC, SLIT3, SLIT2, SLIT1, SIAH2, SIAH1, ROBO1, RGMB, RGMA, RAC1, PTPN11, PTK2, PRKCQ, PLCG1, PITPNA, PAK1, NTN4, NTN1, NEO1, NCK1, MYO10, MAPK8, MAPK14, MAPK13, MAPK12, MAPK11"
"572","Neurexins and neuroligins",0.177702320316921,0.327670681256273,0.998013202589246,3.00287684373771,941,55,"LRRTM4, NLGN2, APBA1"
"573","Neurodegenerative Diseases",0.1042,0.327670681256273,0.399085560813403,1.47950878105764,520,20,"APP, BCL2L11, CAPN1, CAPN2, CAPNS1, CAST, CDC25A, CDC25B, CDC25C, CDK5, CDK5R1"
"574","Neuronal System",0.362181011253764,0.435068686935974,0.998103335513407,1.25828869255898,2284,368,"LRRTM4, SYN2, GABRA1, NLGN2, ABAT"
"575","Neurotransmitter receptors and postsynaptic signal transmission",0.302028681357118,0.388115898318787,0.998321280991736,1.66746666859732,1726,170,"GABRA1, ACTN2"
"576","Neurotransmitter release cycle",0.0178945364553588,0.327670681256273,0.999807790876474,3.13752490606525,93,50,"SYN2, ABAT"
"577","Neutrophil degranulation",0.443568126189829,0.494325305461448,-0.943960935051795,-1.43916327842962,1630,393,"TTR, VPS35L"
"578","Nicotinamide salvaging",0.0414644012944984,0.327670681256273,-0.543187775717665,-2.30509917791377,204,17,"SLC5A8, RNLS, PTGS2, PTGIS, PARP9, PARP8, PARP6, PARP4, PARP16, PARP14, PARP10, NUDT12, NNMT, NAXE, NAXD, NAPRT, NAMPT"
"579","Nicotinate metabolism",0.0667752442996743,0.327670681256273,-0.505730540213299,-2.33022185578612,327,27,"SLC5A8, RNLS, PTGS2, PTGIS, PARP9, PARP8, PARP6, PARP4, PARP16, PARP14, PARP10, NUDT12, NT5E, NNMT, NMRK2, NMRK1, NMNAT3, NMNAT2, NMNAT1, NAXE, NAXD, NAPRT, NAMPT, NADSYN1, NADK2, NADK"
"580","Nitric oxide stimulates guanylate cyclase",0.0593762495001999,0.327670681256273,-0.350172656349917,-1.54985900462154,296,20,"PRKG2, PRKG1, PDE9A, PDE5A, PDE1B, PDE1A, PDE11A, PDE10A, NOS3, NOS2, NOS1, MRVI1, KCNMB4, KCNMB3, KCNMB2, KCNMB1, KCNMA1, ITPR1, GUCY1A2, PDE2A"
"581","NoRC negatively regulates rRNA expression",0.125818028287946,0.327670681256273,-0.242404087679582,-1.06765578859637,595,47,"ZNRD1, UBTF, TWISTNB, TTF1, TBP, TAF1D, TAF1C, TAF1B, TAF1A, SUDS3, SMARCA5, SIN3B, SIN3A, SAP30L, SAP30BP, SAP30, SAP18, SAP130, POLR2L, POLR2K, POLR2H, POLR2F, POLR2E, POLR1E, POLR1D, POLR1C, POLR1B, POLR1A"
"582","Non-integrin membrane-ECM interactions",0.000208811860513677,0.0540826612903226,-1,-4.51063233217434,0,41,"TTR"
"583","Nonhomologous End-Joining (NHEJ)",0.168214654282766,0.327670681256273,-0.21395030718034,-0.990239141699169,814,32,"XRCC6, XRCC5, XRCC4, UIMC1, UBE2V2, UBE2N, TP53BP1, TDP2, TDP1, SUMO1, RNF168, RIF1, RAD50, PRKDC, POLM, POLL, PIAS4, PAXIP1, NSD2, NHEJ1, NBN, MRE11, MDC1"
"584","Nonsense Mediated Decay (NMD) enhanced by the Exon Junction Complex (EJC)",0.210240833152528,0.327670681256273,-0.498467964957744,-1.79155784533869,968,83,"UPF3B, UPF3A, UPF2, UPF1, SMG9, SMG8, SMG7, SMG6, SMG5, SMG1, RPSA, RPS9, RPS8, RPS7, RPS5, RPS4X, RPS3A, RPS28, RPS27L, RPS27A, RPS25, RPS24, RPS21, RPS20, RPS19, RPS17, RPS16, RPS15A, RPS15, RPS14, RPS13, RPS12, RPS11, RPLP1, RPL8, RPL7A, RPL6, RPL5, RPL4, RPL3L, RPL38, RPL37A, RPL36, RPL35, RPL34, RPL32, RPL30, RPL3, RPL29, RPL28, RPL27, RPL26, RPL23, RPL22L1, RPL19, RPL18A, RPL18, RPL14, RPL13A, RPL12, RPL11, RPL10A, RPL10, RNPS1"
"585","Nonsense Mediated Decay (NMD) independent of the Exon Junction Complex (EJC)",0.15823989845568,0.327670681256273,-0.586863921586589,-2.38019823530223,747,63,"UPF1, RPSA, RPS9, RPS8, RPS7, RPS5, RPS4X, RPS3A, RPS28, RPS27L, RPS27A, RPS25, RPS24, RPS21, RPS20, RPS19, RPS17, RPS16, RPS15A, RPS15, RPS14, RPS13, RPS12, RPS11, RPLP1, RPL8, RPL7A, RPL6, RPL5, RPL4, RPL3L, RPL38, RPL37A, RPL36, RPL35, RPL34, RPL32, RPL30, RPL3, RPL29, RPL28, RPL27, RPL26, RPL23, RPL22L1, RPL19, RPL18A, RPL18, RPL14, RPL13A, RPL12, RPL11, RPL10A, RPL10"
"586","Nonsense-Mediated Decay (NMD)",0.210240833152528,0.327670681256273,-0.498467964957744,-1.79155784533869,968,83,"UPF3B, UPF3A, UPF2, UPF1, SMG9, SMG8, SMG7, SMG6, SMG5, SMG1, RPSA, RPS9, RPS8, RPS7, RPS5, RPS4X, RPS3A, RPS28, RPS27L, RPS27A, RPS25, RPS24, RPS21, RPS20, RPS19, RPS17, RPS16, RPS15A, RPS15, RPS14, RPS13, RPS12, RPS11, RPLP1, RPL8, RPL7A, RPL6, RPL5, RPL4, RPL3L, RPL38, RPL37A, RPL36, RPL35, RPL34, RPL32, RPL30, RPL3, RPL29, RPL28, RPL27, RPL26, RPL23, RPL22L1, RPL19, RPL18A, RPL18, RPL14, RPL13A, RPL12, RPL11, RPL10A, RPL10, RNPS1"
"587","Norepinephrine Neurotransmitter Release Cycle",0.0438455349959775,0.327670681256273,-0.540295538505257,-2.33480829559084,217,18,"VAMP2, UNC13B, TSPOAP1, SYT1, STXBP1, STX1A, SNAP25, SLC22A2, SLC22A1, SLC18A2, RIMS1, RAB3A, PPFIA4, PPFIA3, PPFIA2, PPFIA1"
"588","Notch-HLH transcription pathway",0.068200325732899,0.327670681256273,-0.342913062124885,-1.5800183071027,334,27,"TBL1XR1, TBL1X, SNW1, RBPJ, NOTCH3, NOTCH2, NOTCH1, NCOR2, NCOR1, MAMLD1, MAML3, MAML2, MAML1, KAT2B, KAT2A, HDAC9, HDAC8, HDAC7, HDAC6, HDAC5, HDAC4, HDAC3, HDAC2, HDAC11, HDAC10, HDAC1"
"589","Nuclear Envelope Breakdown",0.124657822699516,0.327670681256273,-0.336817016914403,-1.4806537035993,591,50,"VRK2, VRK1, TPR, TMPO, SEH1L, SEC13, RANBP2, RAE1, PRKCB, PRKCA, POM121, POM121C, PLK1, NUP42, NUP58, NUP98, NUP93, NUP88, NUP85, NUP54, NUP50, NUP43, NUP37, NUP35, NUP214, NUP210, NUP205, NUP188, NUP160, NUP155, NUP153, NUP133, NUP107, NEK9, NEK7, NEK6, NDC1, LPIN3, LPIN2, LPIN1, LMNB1, LMNA, LEMD3, LEMD2"
"590","Nuclear Events (kinase and transcription factor activation)",0.174373599511102,0.327670681256273,-0.236119994882947,-1.07176093261613,855,24,"VRK3, RPS6KA5, RPS6KA3, RPS6KA2, RPS6KA1, PPP2R5D, PPP2R1B, PPP2R1A, PPP2CB, PPP2CA, MEF2C, MEF2A, MAPKAPK2, MAPK7, MAPK3, MAPK14, MAPK11, MAPK1"
"591","Nuclear Pore Complex (NPC) Disassembly",0.0849875930521092,0.327670681256273,-0.460215806752809,-2.12457844354795,410,34,"TPR, SEH1L, SEC13, RANBP2, RAE1, POM121, POM121C, NUP42, NUP58, NUP98, NUP93, NUP88, NUP85, NUP54, NUP50, NUP43, NUP37, NUP35, NUP214, NUP210, NUP205, NUP188, NUP160, NUP155, NUP153, NUP133, NUP107, NEK9, NEK7, NEK6, NDC1"
"592","Nuclear Receptor transcription pathway",0.120368432070337,0.327670681256273,-0.360802370275464,-1.6003554290654,574,48,"VDR, THRB, THRA, RXRG, RXRB, RXRA, RORC, RORB, RORA, RARG, RARB, RARA, PPARG, PPARD, PPARA, PGR, NRBP1, NRBF2, NR6A1, NR5A2, NR4A3, NR4A2, NR4A1, NR3C2, NR3C1, NR2F6, NR2F1, NR2E1, NR2C2AP, NR2C2, NR2C1, NR1I3, NR1I2, NR1H3, NR1H2, NR1D2, NR1D1, NCOR2, NCOR1"
"593","Nuclear import of Rev protein",0.0781347150259067,0.327670681256273,-0.483893674512888,-2.23033360628982,376,31,"TPR, SEH1L, SEC13, RCC1, RANBP2, RAE1, POM121, POM121C, NUP42, NUP58, NUP98, NUP93, NUP88, NUP85, NUP54, NUP50, NUP43, NUP37, NUP35, NUP214, NUP210, NUP205, NUP188, NUP160, NUP155, NUP153, NUP133, NUP107, NDC1"
"594","Nuclear signaling by ERBB4",0.526632124352332,0.571361243104198,-0.147106847742844,-0.678036030469924,2540,31,"YAP1, WWOX, TAB2, STMN1, STAT5A, SRC, SPARC, S100B, PSENEN, PSEN2, PSEN1, PGR, NRG4, NRG3, NRG2, NRG1, NCSTN, NCOR1, MXD4"
"595","Nucleobase catabolism",0.234362934362934,0.336451557579615,0.209510787878788,0.758192887650468,1213,33,"ADPRM, AGXT2, DNPH1, DPYD, DPYS, ENTPD1, ENTPD3, ENTPD5, ENTPD6, ENTPD7, GDA, GPX1, ITPA, NT5C, NT5C1A, NT5C1B, NT5C2, NT5C3A, NT5E, NT5M, NUDT1, NUDT15, NUDT16, NUDT18, NUDT5, NUDT9"
"596","Nucleosome assembly",0.119772236402906,0.327670681256273,0.42777493497079,1.59590951755975,609,24,"CENPA, CENPC, CENPH, CENPI, CENPK, CENPL, CENPM, CENPN, CENPO, CENPP, CENPQ, CENPT, CENPU, CENPW"
"597","Nucleotide Excision Repair",0.278385010037921,0.369251946487719,-0.14989758246993,-0.469683477459739,1247,108,"ZNF830, YY1, XRCC1, XPC, XPA, XAB2, UVSSA, USP7, USP45, UBE2V2, UBE2N, UBE2I, UBC, UBB, TFPT, TCEA1, SUMO2, SUMO1, RUVBL1, RPS27A, RPA3, RPA2, RPA1, RNF111, RFC5, RFC4, RFC3, RFC2, RFC1, RBX1, RAD23B, RAD23A, PRPF19, PPIE, POLR2L, POLR2K, POLR2J, POLR2I, POLR2H, POLR2G, POLR2F, POLR2E, POLR2D, POLR2C, POLR2B, POLR2A, POLK, POLE4, POLE3, POLE2, POLE, POLD4, POLD2, POLD1, PIAS3, PIAS1, PCNA, PARP2, PARP1"
"598","Nucleotide salvage",0.211572525093486,0.327670681256273,0.241987736544264,0.904629363951884,1074,23,"ADA, ADAL, ADK, AMPD1, AMPD2, AMPD3, APRT"
"599","Nucleotide-binding domain, leucine rich repeat containing receptor (NLR) signaling pathways",0.550807217473884,0.588075765521868,0.122930230592994,0.401090140908142,2899,47,"AIM2, APP, BCL2, BCL2L1, BIRC2, BIRC3, CARD9, CASP1, CASP2, CASP8, CASP9, CHUK, CYLD, HSP90AB1, IKBKB, IKBKG, IRAK1, IRAK2, ITCH, MAP2K6, MAP3K7, MAPK11, MAPK12, MAPK13, MAPK14, NFKB1, NFKB2, NLRC4, NLRP1, NLRP3, NOD1, NOD2, P2RX7, PANX1"
"600","O-glycosylation of TSR domain-containing proteins",0.15625,0.327670681256273,0.997567221510884,3.50664236422534,814,38,"ADAMTS6, ADAMTS1"
"601","O-linked glycosylation",0.232728077945084,0.336339112326621,-0.681617336392348,-2.2647342846708,1050,97,"GALNT2"
"602","O-linked glycosylation of mucins",0.119107744107744,0.327670681256273,-0.764719004634073,-3.36214063492655,565,49,"GALNT2"
"603","Olfactory Signaling Pathway",0.182302771855011,0.327670681256273,-0.547226214176786,-2.09746302750745,854,73,"RTP4, RTP3, REEP6, REEP5, REEP4, REEP3, REEP2, REEP1, OR6X1, OR10G6, OR2H1, OR7G2, OR9K2, OR6C70, OR6S1, OR11H4, OR5D18, OR2T6, OR2AG2, OR2AG1, OR52B2, OR56B4, OR56A3, OR52E5, OR51B4, OR56B1, OR51Q1, OR51V1, OR51A7, OR2V2, OR2V1, OR51E1, OR52I1, OR52I2, OR52K2, OR5P2, OR2A5, OR6Y1, OR11L1, OR14C36, OR2T1, OR10AD1, OR8S1, OR13C8, OR2K2, OR10H2, OR10H5, OR5AU1, OR6P1, OR7E24, OR2AJ1, OR2C1, OR5B3, OR5A2, OR4D6, OR4D10, OR4D11, OR10V1, OR2W1, OR7C2, OR4B1, OR4C3, OR4C15, OR4S2, OR5L2, OR5L1, OR5V1, OR8J3, OR8J1, OR5M3"
"604","Oncogene Induced Senescence",0.441341865425635,0.49357112366374,0.159373800076795,0.578719047002584,2275,32,"AGO1, AGO3, AGO4, CDK4, CDK6, CDKN2B, CDKN2C, CDKN2D, E2F1, E2F2, E2F3, ERF, ETS1, ETS2"
"605","Oncogenic MAPK signaling",0.315938206480784,0.397889314030377,0.1735630879734,0.483602924732162,1676,65,"AGGF1, AGK, AGTRAP, AKAP9, AP3B1, APBB1IP, ARAF, ARRB1, ARRB2, ATG7, BCL2L11, BRAF, BRAP, CALM1, CAMK2A, CAMK2B, CAMK2G, CLCN6, CNKSR1, CNKSR2, CSK, ESRP1, FAM114A2, FAM131B, FGG, FN1, FXR1, HRAS, IQGAP1, ITGA2B, ITGB3, JAK2, KDM7A, KRAS, KSR1, KSR2, LMNA, MAP2K1, MAP2K2, MAP3K11, MAPK1, MAPK3, MARK3"
