"","pathway","pval","padj","ES","NES","nMoreExtreme","size","leadingEdge"
"816","Signaling by FGFR in disease",0.0430711610486891,0.453455970815384,0.457573387521639,1.41173460060332,275,60,"LRRFIP1, PIK3CA, FGFR2, ZMYM2, FRS2, POLR2F, FGFR1, CPSF6, PIK3R1, FGF9, POLR2E, BAG4, CNTRL, FGF1, FGFR1OP"
"817","Signaling by FGFR1",0.142378292098962,0.544781405033639,0.430772684053916,1.26477266005237,891,45,"FLRT2, PIK3CA, FRS2, UBB, FGFR1, PIK3R1, SPRED1, FGF9, FGF1, MAPK3"
"818","Signaling by FGFR1 in disease",0.0552567237163814,0.453455970815384,0.513573532489205,1.43666822451963,338,35,"LRRFIP1, PIK3CA, ZMYM2, FRS2, FGFR1, CPSF6, PIK3R1, FGF9, BAG4, CNTRL, FGF1, FGFR1OP"
"819","Signaling by FGFR2",0.114703139571029,0.5298226810327,0.403140387850703,1.26474279713327,737,66,"PIK3CA, FGFR2, FRS2, TIAL1, POLR2F, UBB, RBFOX2, PIK3R1, TIA1, FGF9, POLR2E, FGF1, MAPK3, HNRNPH1, SHC1, PLCG1, KRAS, NCBP1, GTF2F2, UBC, FGF16"
"820","Signaling by FGFR2 IIIa TM",0.343384719634084,0.728395016471646,0.447108517952028,1.10260370270587,2026,19,"FGFR2, POLR2F, POLR2E, FGF1, NCBP1, GTF2F2"
"821","Signaling by FGFR2 in disease",0.114897760467381,0.5298226810327,0.458881722253869,1.31352465277916,707,40,"PIK3CA, FGFR2, FRS2, POLR2F, PIK3R1, FGF9, POLR2E, FGF1, PLCG1, KRAS, NCBP1, GTF2F2, FGF16"
"822","Signaling by FGFR3",0.284738041002278,0.661531748323547,0.397134230527678,1.1269692970922,1749,38,"PIK3CA, FRS2, UBB, PIK3R1, FGF9, FGF1, MAPK3, GALNT3, SHC1, PLCG1, KRAS, UBC, FGF16, BRAF"
"823","Signaling by FGFR3 in disease",0.122197876285185,0.531807747149283,0.53566875214778,1.33545022911015,724,20,"PIK3CA, FRS2, PIK3R1, FGF9, FGF1, PLCG1, KRAS, FGF16"
"824","Signaling by FGFR3 point mutants in cancer",0.122197876285185,0.531807747149283,0.53566875214778,1.33545022911015,724,20,"PIK3CA, FRS2, PIK3R1, FGF9, FGF1, PLCG1, KRAS, FGF16"
"825","Signaling by FGFR4",0.331320385180349,0.715209349220211,0.385424757826441,1.08931916177771,2029,37,"PIK3CA, FRS2, UBB, PIK3R1, FGF9, FGF1, MAPK3, SHC1, PLCG1, KRAS, UBC, FGF16, BRAF"
"826","Signaling by Hedgehog",0.319421914171951,0.69679801530337,0.3110278026689,1.07000416624765,2165,123,"ADCY2, GNAS, ITCH, UBB, GSK3B, NUMB, PSMC2, BTRC, PRKAR2A, PSMD1, BOC, TULP3, PSMD4, PSMA6, PSMA3, PSME3, PSME1, SMO, SMURF2, SPOP, IFT88, ADCY3, PSMD6, RBX1, CUL1, PSMD11, PSMD13, PSMB2, ARRB1, PSMB4, OS9, PRKACA, DISP2, GPC5, PSMD3, ADCY10, PSMB7, ERLEC1, PSMC6, PSMB6, SYVN1, MKS1, UBC, PSMB10, ADCY1"
"827","Signaling by Hippo",0.762625030495243,0.947134661823893,-0.300656964243226,-0.780315054828448,3125,19,"AMOTL1, WWC1, DVL2, TJP1"
"828","Signaling by Insulin receptor",0.712274774774775,0.930465067005668,-0.257077311659399,-0.876288165045479,2529,72,"GRB10, ATP6V1D, ATP6V0D1, ATP6V0B, GAB2, ATP6V0E1, ATP6V1G2, GRB2, ATP6V1C2, THEM4, FGF10, IRS2, PIK3CB, ATP6V1F, ATP6V0E2, ATP6V1H"
"829","Signaling by Interleukins",0.968,1,0.208541520346801,0.798188178397156,7380,330,"PIK3CA, PTPN13, CANX, CRKL, UBB, CDC42, HSPA9, FYN, SOS2, PSMC2, BTRC, MEF2A, PIK3R1, IL6ST, APP, TBK1, HNRNPA2B1, PSMD1, PTPN9, IKBKB, PAK2, PSMD4, BCL2L1, PSMA6, BRWD1, PSMA3, PSME3, JUN, PSME1, STAT2, HSPA8, BOLA2, PTPN12, SOD1, IKBKG, PSMD6, ZEB1, VRK3, FBXW11, BCL2, SYK, RBX1, LIFR, BCL6, CUL1, PSMD11, PSMD13, MAPK3, PPP2R5D, VEGFA, TAB1, TCP1, PSMB2, HSP90B1, PSMB4, CRLF2, NFKBIA, BIRC5, NFKB1, IRS1, NDN, TEC, PRKACA, IL11RA, PSMD3, CFL1, IFNLR1, ELK1, SHC1, IL17RE, STAT5A, STAT3, PSMB7, DUSP6, CEBPD, NFKB2, IL17RC, PSMC6, PSMB6, F13A1, TYK2, MAPK10, DUSP7, UBC, PSMB10, RAPGEF1, IL33, MAPK7, CNTFR, RORC, CREB1"
"830","Signaling by Ligand-Responsive EGFR Variants in Cancer",0.174325928438189,0.56741068616555,0.523923844656268,1.27629775174802,1027,18,"EGFR, PIK3CA, UBB, PIK3R1, SHC1, PLCG1, KRAS, UBC"
"831","Signaling by MET",0.315879694561321,0.69345988147857,0.34929134831256,1.08839656355654,2026,63,"PIK3CA, MET, DOCK7, CRKL, UBB, SPINT2, PIK3R1, RAP1A, STAM2, USP8, SH3KBP1, PTPN1, STAM, RANBP10, EPS15, SHC1, STAT3, SH3GL1, KRAS, LAMC2, UBC, ITGA3, RAPGEF1"
"832","Signaling by NODAL",0.00508844196753089,0.239156772473952,-0.732573678124013,-1.793325121275,20,15,"ACVR2A, SMAD3, DAND5, SMAD4, FOXO3, FURIN, ACVR2B"
"833","Signaling by NOTCH",0.00793650793650794,0.263027257030094,0.403315688117185,1.44023038919407,54,165,"MAML3, EGFR, E2F3, HDAC9, ATP2A2, ITCH, PRKCI, PBX1, UBB, ADAM10, NCOR2, HDAC5, HDAC4, DNER, NUMB, PSMC2, MIB1, TLE4, PSMD1, PSMD4, PSMA6, PSMA3, PSME3, JUN, PSME1, KAT2B, AGO1, TNRC6C, DTX2, HDAC3, PSMD6, E2F1, ST3GAL3, NEURL1, RBX1, CUL1, NCSTN, PSMD11, PSMD13, PSEN1, H3-3A, HDAC2, TBL1X, RBPJ, DTX1, PSMB2, ARRB1, PSMB4, YBX1"
"834","Signaling by NOTCH1",0.0145736434108527,0.327590158409168,0.473674659135211,1.50699301185352,93,72,"MAML3, HDAC9, ITCH, UBB, ADAM10, NCOR2, HDAC5, HDAC4, DNER, NUMB, MIB1, TLE4, KAT2B, DTX2, HDAC3, NEURL1, RBX1, CUL1, NCSTN, PSEN1, HDAC2, TBL1X, RBPJ, DTX1, ARRB1"
"835","Signaling by NOTCH1 HD Domain Mutants in Cancer",0.164425531914894,0.555399555399555,0.55479292370214,1.3030072897245,965,15,"UBB, ADAM10, MIB1, NEURL1, UBC"
"836","Signaling by NOTCH1 HD+PEST Domain Mutants in Cancer",0.0222326600908095,0.348109078666816,0.488551452748846,1.4925873759919,141,57,"MAML3, HDAC9, UBB, ADAM10, NCOR2, HDAC5, HDAC4, MIB1, KAT2B, HDAC3, NEURL1, RBX1, CUL1, NCSTN, PSEN1, HDAC2, TBL1X, RBPJ"
"837","Signaling by NOTCH1 PEST Domain Mutants in Cancer",0.0222326600908095,0.348109078666816,0.488551452748846,1.4925873759919,141,57,"MAML3, HDAC9, UBB, ADAM10, NCOR2, HDAC5, HDAC4, MIB1, KAT2B, HDAC3, NEURL1, RBX1, CUL1, NCSTN, PSEN1, HDAC2, TBL1X, RBPJ"
"838","Signaling by NOTCH1 in Cancer",0.0222326600908095,0.348109078666816,0.488551452748846,1.4925873759919,141,57,"MAML3, HDAC9, UBB, ADAM10, NCOR2, HDAC5, HDAC4, MIB1, KAT2B, HDAC3, NEURL1, RBX1, CUL1, NCSTN, PSEN1, HDAC2, TBL1X, RBPJ"
"839","Signaling by NOTCH2",0.24173655648742,0.628184528805647,0.426862245225132,1.1715434616917,1469,32,"MAML3, UBB, ADAM10, MIB1, NEURL1, NCSTN, PSEN1, RBPJ"
"840","Signaling by NOTCH3",0.0630601792573624,0.482987599510104,0.4684177045004,1.37878298245041,393,46,"MAML3, EGFR, PBX1, UBB, ADAM10, MIB1, KAT2B, NEURL1, NCSTN, PSEN1, RBPJ, YBX1"
"841","Signaling by NOTCH4",0.0812143627677608,0.482987599510104,0.405016970568876,1.30339217124961,526,77,"MAML3, UBB, ADAM10, PSMC2, PSMD1, PSMD4, PSMA6, PSMA3, PSME3, PSME1, KAT2B, PSMD6, RBX1, CUL1, NCSTN, PSMD11, PSMD13, PSEN1, RBPJ, PSMB2, PSMB4, PSMD3, PSMB7, PSMC6, PSMB6, TACC3, UBC, PSMB10, PSENEN"
"842","Signaling by NTRK1 (TRKA)",0.725868725868726,0.935040032685428,0.268305260373943,0.861538620164191,4699,76,"RALGDS, PIK3CA, FRS2, CRKL, MEF2A, PIK3R1, RAP1A, KIDINS220, DNM2, MAP2K5, VRK3, DNM3, MAPK3, PPP2R5D, IRS1, DNAL4, ELK1, SHC1, STAT3, DUSP6, SHC3, PLCG1, KRAS, DUSP7, RALB, RAPGEF1, MAPK7, CREB1, RPS6KA1, BRAF, CRK"
"843","Signaling by NTRK2 (TRKB)",0.477211343686698,0.830701227899067,0.382861557434182,0.988129027720894,2826,24,"PIK3CA, FRS2, BDNF, FYN, PIK3R1"
"844","Signaling by NTRK3 (TRKC)",0.451618369767836,0.806517088670021,0.417885752810103,1.0083867072042,2664,17,"PIK3CA, PTPRS, PIK3R1, NELFB, NTRK3, IRS1, SHC1, PLCG1, NTF3, KRAS"
"845","Signaling by NTRKs",0.627865961199294,0.895149246677631,-0.25762879707371,-0.921775196926803,2135,96,"RPS6KA5, TIAM1, PCSK5, PTPRO, MEF2C, SH3GL2, ATF1, RAC1, MAP2K2, SRC, GRB2, MAP2K1, ADORA2A, IRS2, RHOA, PIK3CB, RPS6KA3, YWHAB, MAPKAPK2, MAPK11, RPS6KA2, FURIN, RIT2"
"846","Signaling by Non-Receptor Tyrosine Kinases",0.0225563909774436,0.348109078666816,-0.482412259741883,-1.52466836876709,83,48,"NRG1, ERBB4, ELMO1, LRRK2, NR3C1, CBL, RAC1"
"847","Signaling by Nuclear Receptors",0.0443974630021142,0.453455970815384,0.353678958962676,1.28739221375544,314,195,"NCOA1, EGFR, PIK3CA, GNG2, GNAI1, POLR2F, IGF1R, NCOR2, GNB1, APOD, SMC1A, UHMK1, FKBP4, PIK3R1, KDM1A, DLD, PDK3, PPARD, ANGPTL3, KDM4B, AKT3, TGFA, NCOA3, CHD1, JUN, ABCG1, KAT2B, KDM3A, PPP5C, AGO1, TNRC6C, CALM1, CXXC5, HDAC3, POLR2E, CDK9, DLAT, BCL2, NR1H2, PTGES3, ZDHHC21, RDH11, PRKCZ, KDM1B, MAPK3, AXIN1, H3-3A, CARM1, TBL1X, PDHX, RARG, AKT2, RXRA, USF2, SP1, GNAI3, TLE3, NCOR1, XPO1, KDM4A, RDH13, TNRC6B, ELK1, CITED1, SHC1, GNG11, JUND, PDHB, AGO4, HSP90AB1, FKBP5, ZDHHC7, KRAS, APOE"
"848","Signaling by PDGF",0.489280609814197,0.834772867737948,0.32982945883413,0.981896798008124,3080,49,"COL6A3, PIK3CA, CRKL, PDGFA, COL9A1, PIK3R1, PTPN12, NCK1, COL4A3, NCK2, BCAR1, COL4A2, STAT5A, STAT3, PLCG1, KRAS"
"849","Signaling by PTK6",0.0225563909774436,0.348109078666816,-0.482412259741883,-1.52466836876709,83,48,"NRG1, ERBB4, ELMO1, LRRK2, NR3C1, CBL, RAC1"
"850","Signaling by RAS mutants",0.132387096774194,0.543207373271889,-0.42857553985088,-1.28230170843128,512,37,"CNKSR2, CAMK2A, CAMK2G, MAP2K2, ARRB2, SRC, MAP2K1, JAK2, RAF1, YWHAB, APBB1IP"
"851","Signaling by ROBO receptors",0.097254004576659,0.514855052880025,0.339543543362505,1.21959723524924,679,173,"PRKCA, SLIT1, SRGAP1, PPP3CB, SRGAP2, UBB, CDC42, EVL, SOS2, CLASP2, NRP1, PSMC2, PRKAR2A, RPS4X, EIF4G1, PSMD1, RPL19, PAK2, PSMD4, RPS15A, MSI1, PSMA6, PSMA3, PSME3, PSME1, RPL14, RPS20, PSMD6, NCK1, RPS16, RPL32, ABL1, RBX1, RPS5, PSMD11, RPL8, PSMD13, UPF3B, ELOC, NCK2, RPS13, RPL29, DCC, CASC3, RPS28, PSMB2, PSMB4, MYO9B, ISL1, RPLP1"
"852","Signaling by Receptor Tyrosine Kinases",0.543814762696687,0.854389062785956,0.250732204396144,0.97577524412876,4250,409,"PRKCA, NRP2, KITLG, FLRT2, COL6A3, EGFR, RALGDS, PIK3CA, FGFR2, PRKCB, FRS2, MET, ITCH, TIAL1, DOCK7, PAG1, POLR2F, CRKL, CYFIP1, UBB, CDC42, RBFOX2, ATP6V0C, PDGFA, COL9A1, ADAM10, IGF1R, BDNF, PTPRS, WASF1, FYN, SPINT2, NRP1, FGFR1, NRG3, SHB, ABI2, MEF2A, PRKCD, FER, PIK3R1, RAP1A, RICTOR, SPRED1, PDE3B, KIDINS220, VAV2, PAK2, AKT3, TGFA, TIA1, EPN1, FGF9, STAM2, USP8, PTPN12, CALM1, POLR2E, NCK1, DNM2, SH3KBP1, MAP2K5, COL4A3, VRK3, FGF1, VEGFC, NCSTN, DNM3, WASF2, PSEN1, PTPN1, NELFB, NCK2, PRKCZ, MAPK3, BCAR1, GABRB2, PXN, PPP2R5D, VEGFA, NCF2, STAM, RANBP10, MTOR, AKT2, PRR5, EPS15, SPARC, ROCK1, GALNT3, ATP6V1B2, NTRK3, IRS1, ABI1, TEC"
"853","Signaling by Retinoic Acid",0.565802845528455,0.866412265864446,-0.324234096726546,-0.925545171099465,2226,30,"RARB, PDK1, RDH14"
"854","Signaling by Rho GTPases",0.211827816302499,0.606731196833197,0.287110804076303,1.10198318439919,1618,343,"PRKCA, SRGAP1, FMNL2, ACTB, PRKCB, SRGAP2, OPHN1, ITSN1, ACTG1, NF2, KIF5A, CYFIP1, MAPRE1, FMNL3, CHN2, CDC42, EVL, ARPC5, CENPC, ACTR3, WIPF1, MYO9A, INPP5B, WASF1, ARHGAP5, SOS2, PPP1CB, CLASP2, SCAI, DLC1, DIAPH3, TIAM2, ABI2, ARHGEF18, PRKCD, YWHAE, ARHGEF11, NUP98, KDM1A, NDEL1, PPP1R12A, DAAM1, ARHGAP26, TRIO, VAV2, PAK2, MYL12B, GDI1, ARHGAP35, GDI2, PKN1, CKAP5, SEH1L, MCF2L, CALM1, ARHGAP12, ARHGAP31, PKN2, NCK1, RHOT1, FLNA, DYNC1LI1, AHCTF1, ABL1, PPP2R5C, WASF2, PRKCZ, MAPK3, FAM13B, H3-3A, ARHGEF10L, PPP2R5D, NCF2, ARHGEF12, SKA2, MYO9B, ARHGEF3, BIRC5, ARHGEF2, CENPN, ROCK1, FAM13A, ABI1, PPP1R14A, DYNLL2, ACTR2, RALBP1, NDC80, MEN1, MYH9, CFL1, ZWINT, RHPN2, XPO1, DEPDC7, CENPO, MYH14"
"855","Signaling by SCF-KIT",0.204848682069639,0.600892138967221,0.422729404786725,1.19960210818316,1258,38,"PRKCA, KITLG, PIK3CA, FYN, FER, PIK3R1"
"856","Signaling by TGF-beta Receptor Complex",0.121348663766314,0.531807747149283,0.395110760860427,1.25285474607271,780,71,"NEDD4L, PMEPA1, TGFBR1, ZFYVE9, UBB, USP15, UBE2D3, UBE2D1, NCOR2, PPP1CB, ARHGEF18, SMURF2, USP9X, SKIL, TRIM33, CDK9, E2F4, PRKCZ, SP1, MEN1, NCOR1, CCNT2, PPM1A, XPO1, UCHL5"
"857","Signaling by TGF-beta family members",0.671964880411747,0.920356747355,0.269708751497544,0.89449017205098,4438,94,"NEDD4L, PMEPA1, TGFBR1, ZFYVE9, UBB, USP15, UBE2D3, UBE2D1, NCOR2, PPP1CB, ARHGEF18, SMURF2, USP9X, SKIL, TRIM33, CDK9, E2F4, PRKCZ, SP1, MEN1, NCOR1, CCNT2, PPM1A, XPO1, UCHL5, CGN, BMPR2, MTMR4, UBC, INHBB"
"858","Signaling by Type 1 Insulin-like Growth Factor 1 Receptor (IGF1R)",0.196240841032176,0.598563509224985,0.405264563650651,1.20190747696915,1231,48,"PIK3CA, FGFR2, FRS2, IGF1R, FGFR1, PIK3R1, PDE3B, FGF9, FGF1, AKT2, IRS1, SHC1, KRAS, FGF16, PIK3R4"
"859","Signaling by VEGF",0.0620260843190779,0.482987599510104,0.401680102754426,1.32549243211917,408,90,"PRKCA, NRP2, PIK3CA, PRKCB, CYFIP1, CDC42, WASF1, FYN, NRP1, SHB, ABI2, PRKCD, PIK3R1, RICTOR, VAV2, PAK2, AKT3, CALM1, NCK1, VEGFC, WASF2, NCK2, PRKCZ, BCAR1, PXN, VEGFA, NCF2, MTOR, AKT2, PRR5, ROCK1, ABI1, PRKACA"
"860","Signaling by WNT",0.291108071135431,0.665941914942557,0.287897685202285,1.07228477663557,2127,242,"PRKCA, TCF4, PPP3CB, GNG2, SOX4, PRKCB, ROR1, BCL9, PRKG2, UBB, GSK3B, ZNRF3, TRRAP, GNB1, HECW1, PSMC2, BTRC, PYGO1, LGR4, TLE4, PSMD1, DAAM1, KLHL12, PSMD4, TNKS2, CSNK2A1, CSNK1E, PSMA6, PSMA3, PSME3, FZD3, PSME1, USP8, RSPO3, AGO1, SMURF2, TNRC6C, CALM1, PSMD6, TNKS, TLE5, ASH2L, RYK, RBX1, CUL1, PPP2R5C, PSMD11, PSMD13, AXIN1, H3-3A, PPP2R5D, PSMB2, PSMB4, AKT2, VPS35, PORCN, TLE3, MEN1, PSMD3, XPO1, TNRC6B, VPS26A, CBY1, FZD7, GNG11, PSMB7, APC, PFN1, LGR6, PSMC6, AGO4, PSMB6"
"861","Signaling by WNT in cancer",0.880646224859875,0.991156952596975,0.26164097262724,0.710802036965688,5341,30,"GSK3B, TNKS2, TNKS, PPP2R5C, AXIN1, PPP2R5D, PORCN, APC"
"862","Signaling by cytosolic FGFR1 fusion mutants",0.270137357978633,0.651302625160526,0.482043409953676,1.17427547275017,1592,18,"LRRFIP1, PIK3CA, ZMYM2, CPSF6, PIK3R1, CNTRL, FGFR1OP"
"863","Signaling by high-kinase activity BRAF mutants",0.207332490518331,0.600892138967221,-0.425214490028156,-1.20306762830367,819,29,"CNKSR2, MAP2K2, ARRB2, SRC, MAP2K1, RAF1, YWHAB, APBB1IP"
"864","Signaling by moderate kinase activity BRAF mutants",0.132387096774194,0.543207373271889,-0.42857553985088,-1.28230170843128,512,37,"CNKSR2, CAMK2A, CAMK2G, MAP2K2, ARRB2, SRC, MAP2K1, JAK2, RAF1, YWHAB, APBB1IP"
"865","Signaling by the B Cell Receptor (BCR)",0.0414147521160822,0.450766880926621,0.405976240924809,1.35927785407605,273,101,"PPP3CB, PRKCB, UBB, FYN, PSMC2, BTRC, PIK3R1, PSMD1, NFATC3, IKBKB, PSMD4, PSMA6, PSMA3, PSME3, PSME1, CALM1, IKBKG, PSMD6, NCK1, SH3KBP1, FBXW11, SYK, STIM1, CUL1, PSMD11, PSMD13, PSMB2, PSMB4, NFKBIA, NFKB1, PSMD3, PSMB7, PSMC6, PSMB6, KRAS, UBC, PSMB10, PIK3AP1"
"866","Signaling downstream of RAS mutants",0.132387096774194,0.543207373271889,-0.42857553985088,-1.28230170843128,512,37,"CNKSR2, CAMK2A, CAMK2G, MAP2K2, ARRB2, SRC, MAP2K1, JAK2, RAF1, YWHAB, APBB1IP"
"867","Signalling to ERKs",0.50404357154646,0.834772867737948,0.356144529095542,0.972009175333876,3053,31,"RALGDS, FRS2, CRKL, RAP1A, KIDINS220, MAPK3, SHC1, SHC3, KRAS, RALB, RAPGEF1, BRAF, CRK"
"868","Signalling to RAS",0.892899508557872,0.995963421627658,0.276436073086148,0.667059021795542,5268,17,"RALGDS, SHC1, SHC3, KRAS, RALB"
"869","Smooth Muscle Contraction",0.496807795698925,0.834772867737948,0.373901683654346,0.975349687258595,2956,25,"CALD1, TLN1, PAK2, MYL12B, CALM1, PXN, ITGB5, ANXA6"
"870","Sphingolipid de novo biosynthesis",0.935787254742987,0.999590931202736,0.235633034231646,0.671546300441364,5770,39,"SPTLC2, PPM1L, SPHK2, DEGS1, DEGS2, FA2H, KDSR, SGPL1, PLPP1, ACER2, SPTSSA, CERS4, SGPP1, CERS2, SAMD8, ALDH3B1, CERS1"
"871","Sphingolipid metabolism",0.997996609647095,1,0.184335282063745,0.593212583634483,6475,77,"SPTLC2, PPM1L, ARSG, ASAH1, SPHK2, SMPD4, DEGS1, CTSA, B3GALNT1, SMPD2, DEGS2, FA2H, UGT8, KDSR, SGPL1, B4GALNT1, GLB1, PLPP1, GBA, ACER2, CERK, ARSA, SPTSSA, PSAP, NEU1"
"872","Spry regulation of FGF signaling",0.710775966918025,0.930465067005668,-0.327150136144894,-0.81328719280987,2921,16,"CBL, SRC, GRB2, MKNK1"
"873","Stabilization of p53",0.223581757508343,0.619795006068703,0.392325290893945,1.17072338343378,1406,50,"UBB, MDM2, PSMC2, PSMD1, PSMD4, PSMA6, PSMA3, PSME3, PSME1, CHEK2, PSMD6, PSMD11, PSMD13, PSMB2, PSMB4, MDM4, PSMD3, PSMB7, PSMC6, PSMB6, UBC, PSMB10"
"874","Stimuli-sensing channels",0.0203264551894056,0.348109078666816,0.453095553742347,1.47030123137109,131,81,"ASIC2, ANO1, TRPC4, NEDD4L, TRPC3, RYR3, STOML3, UBB, ANO2, TRPM3, TRPC6, CLCN3, TRPM7, WNK1, ANO8, CALM1, TPCN1, TTYH2, CLCN2, CLCN4, TRPV2"
"875","Striated Muscle Contraction",0.0551220739994966,0.453455970815384,-0.518191633333384,-1.45736394885955,218,28,"DMD, TMOD1, TPM3, MYL4, MYBPC3, ACTN2, TNNC1, TMOD2"
"876","Sulfur amino acid metabolism",0.646522619851452,0.907061586060246,0.337055459572664,0.8699078742394,3829,24,"GOT1, MTR, APIP, ADI1"
"877","Switching of origins to a post-replicative state",0.127052324689274,0.542859932763262,0.383553472025993,1.24056979157732,827,79,"UBB, UBE2D1, PSMC2, ANAPC16, PSMD1, PSMD4, PSMA6, PSMA3, PSME3, PSME1, ANAPC5, PSMD6, ANAPC2, CDC23, ORC3, RBX1, CUL1, PSMD11, PSMD13, PSMB2, PSMB4, PSMD3, PSMB7, PSMC6, PSMB6, ORC4, UBC, PSMB10, ANAPC1"
"878","Synaptic adhesion-like molecules",0.124321657622102,0.535619141588555,-0.50672521287,-1.34287496968758,503,21,"GRIN2A, LRFN2, GRIN1, GRIA4, GRIA3, DLG4, PTPRF"
"879","Syndecan interactions",0.226664407928172,0.623622047244095,0.490933730303584,1.2106800185677,1337,19,"PRKCA, ITGB5, CASK, SDC3"
"880","Synthesis of DNA",0.314903846153846,0.692908750334493,0.317964345228841,1.07328750486733,2095,107,"UBB, UBE2D1, PSMC2, ANAPC16, PSMD1, PSMD4, PSMA6, PSMA3, PSME3, PSME1, ANAPC5, PSMD6, ANAPC2, GINS1, CDC23, ORC3, RBX1, CUL1, PSMD11, PSMD13, PSMB2, PSMB4, PSMD3, POLD4, PSMB7, PSMC6, PSMB6, ORC4, UBC, PSMB10, ANAPC1, RPA1, PSMC3, POLD1, PCNA, PSMB5, PSME4, MCM3, LIG1, POLA2, PSMB3"
"881","Synthesis of IP3 and IP4 in the cytosol",0.461424332344214,0.81978137395862,-0.355463886921165,-0.989769752994409,1865,26,"PLCB1, PLCE1, OCRL"
"882","Synthesis of PA",0.944435257152307,1,0.237476325228488,0.640215253240525,5710,29,"AGPAT4, GNPAT, GPD1L, AGPAT3, MIGA1, GPD2, PLD1"
"883","Synthesis of PC",0.617966436327739,0.889153094949676,-0.328396235456346,-0.886475520669522,2503,23,"SLC44A5, CHKA, SLC44A1, PCYT1B, BCHE, CSNK2A2, CHPT1, PEMT"
"884","Synthesis of PIPs at the Golgi membrane",0.800048649963513,0.95968712768245,-0.299142441492212,-0.743660752700222,3288,16,"OCRL, PI4KA"
"885","Synthesis of PIPs at the early endosome membrane",0.843590367307224,0.977883901116222,-0.28406509910299,-0.706178850319679,3467,16,"INPP4B, INPP4A"
"886","Synthesis of PIPs at the plasma membrane",0.764500238360083,0.947134661823893,0.275185881043524,0.821172004981878,4810,50,"PIK3CA, PTPN13, PLEKHA6, PIK3R1, PLEKHA1, MTMR2, MTMR3, PIP4K2A, PIP4K2B"
"887","Synthesis of active ubiquitin: roles of E1 and E2 enzymes",0.0474373859678222,0.453455970815384,0.548613690950646,1.46746361338297,285,28,"UBE2H, UBB, UBE2E3, UBE2D2, UBE2D1, UBA1, UBE2G1, UBA6, UBE2Q2, USP9X, UCHL3, UBE2R2, UBE2K"
"888","Synthesis of bile acids and bile salts",0.381330182309251,0.758260400976471,0.412384209925954,1.06432416754621,2258,24,"NCOA1, OSBPL6, OSBPL9, RXRA, OSBPL3, OSBPL7, OSBPL2"
"889","Synthesis of bile acids and bile salts via 7alpha-hydroxycholesterol",0.474553191489362,0.830701227899067,0.421656480565775,0.990318088901502,2787,15,"NCOA1, RXRA, ACOT8, NCOA2, SLC27A2, HSD17B4"
"890","Synthesis of glycosylphosphatidylinositol (GPI)",0.925565555825833,0.997950766135466,-0.252259039806266,-0.627109769118624,3804,16,"PIGN, PIGA"
"891","Synthesis of substrates in N-glycan biosythesis",0.946693762701266,1,0.225236592892124,0.697012564459649,6055,61,"ST6GAL1, ST8SIA4, ST8SIA5, ST3GAL3, ST8SIA3, NAGK, ST6GALNAC6, CTSA, PMM1, GLB1, ST8SIA2, DOLK, ST8SIA1, NUS1, SLC35C1, NANS"
"892","Synthesis of very long-chain fatty acyl-CoAs",0.620519159456119,0.889898489428054,-0.330850890406961,-0.883642776750643,2509,22,"HACD2, ACSL4, HACD1, ELOVL7, ACSL3, ACSL6, ELOVL5"
"893","T41 mutants of beta-catenin aren't phosphorylated",0.364765957446809,0.739545098039216,0.46025992067079,1.08098356374141,2142,15,"GSK3B, PPP2R5C, AXIN1, PPP2R5D, APC, PPP2R5A, PPP2CA, PPP2R5E, PPP2CB"
"894","TAK1 activates NFkB by phosphorylation and activation of IKKs complex",0.864618501012829,0.982676846378001,0.275739334729973,0.711656825921923,5121,24,"APP, IKBKB, IKBKG, TAB1, NFKBIA, NFKB1, NFKB2, CHUK, NKIRAS1, MAP3K7, NFKBIB, S100B"
"895","TBC/RABGAPs",0.860604102729769,0.98219055432956,0.259604218530961,0.747612065095316,5327,41,"TBC1D16, POLG, RAB8B, RABGEF1, RABGAP1, TSC2, GABARAP, RABEP1, RAB8A, TBC1D14, ULK1, TBC1D13"
"896","TCF dependent signaling in response to WNT",0.13587035161337,0.544781405033639,0.334161424003013,1.18671825894014,938,157,"TCF4, SOX4, BCL9, UBB, GSK3B, ZNRF3, TRRAP, HECW1, PSMC2, BTRC, PYGO1, LGR4, TLE4, PSMD1, KLHL12, PSMD4, TNKS2, CSNK2A1, CSNK1E, PSMA6, PSMA3, PSME3, PSME1, USP8, RSPO3, SMURF2, PSMD6, TNKS, ASH2L, RYK, RBX1, PPP2R5C, PSMD11, PSMD13, AXIN1, H3-3A, PPP2R5D, PSMB2, PSMB4, AKT2, TLE3, MEN1, PSMD3, XPO1, CBY1, PSMB7, APC, LGR6, PSMC6, PSMB6"
"897","TCR signaling",0.0745501285347044,0.482987599510104,0.387850454415032,1.29352828828124,492,98,"PIK3CA, PAG1, UBB, EVL, UBE2D2, UBE2D1, PSMC2, BTRC, PIK3R1, PSMD1, IKBKB, PAK2, PSMD4, PSMA6, PSMA3, PSME3, PSME1, IKBKG, PSMD6, NCK1, FBXW11, CUL1, PSMD11, PSMD13, PSMB2, PSMB4, NFKBIA, NFKB1, PSMD3, PSMB7, PLCG1, PSMC6, PSMB6"
"898","TGF-beta receptor signaling activates SMADs",0.0736720934056899,0.482987599510104,0.508224191505099,1.39484514100637,447,32,"NEDD4L, PMEPA1, TGFBR1, ZFYVE9, UBB, USP15, PPP1CB, SMURF2"
"899","TGF-beta receptor signaling in EMT (epithelial to mesenchymal transition)",0.539976234934646,0.851121077625646,0.394173045218659,0.938398469955824,3180,16,"TGFBR1, UBB, ARHGEF18, PRKCZ, CGN, UBC"
"900","TICAM1, RIP1-mediated IKK complex recruitment",0.0755744680851064,0.482987599510104,0.616538533388596,1.4480253245492,443,15,"UBB, UBE2D2, UBE2D3, UBE2D1, IKBKB, IKBKG, RIPK1"
"901","TNF signaling",0.545808334684612,0.855099724339225,0.330747982470859,0.942620735377859,3365,39,"RACK1, TAX1BP1, UBB, OTUD7B, IKBKB, IKBKG, BAG4, SMPD2, TAB1, SPPL2A, RIPK1, USP21, SPPL2B, UBC, TRAF2, CHUK, MADD, MAP3K7"
"902","TNFR1-induced NFkappaB signaling pathway",0.670830519918974,0.920356747355,0.330516850929871,0.853032351284968,3973,24,"RACK1, OTUD7B, IKBKB, IKBKG, TAB1, RIPK1, USP21, TRAF2, CHUK, MAP3K7"
"903","TNFR2 non-canonical NF-kB pathway",0.0446511627906977,0.453455970815384,0.435296006019037,1.38489156324317,287,72,"UBB, PSMC2, BTRC, PSMD1, PSMD4, PSMA6, PSMA3, PSME3, PSME1, PSMD6, FBXW11, CUL1, PSMD11, PSMD13, RELB, PSMB2, PSMB4, TNFRSF11A, PSMD3, CD27, PSMB7, TRAF3, NFKB2, PSMC6, PSMB6, EDARADD, UBC, PSMB10, TRAF2, PSMC3, CHUK, PSMB5, PSME4"
"904","TP53 Regulates Metabolic Genes",0.697263397947548,0.924998791662346,-0.25562644565254,-0.892795620806004,2445,81,"SESN3, SLC38A9, GPI, PRDX5, TACO1, TP53, RRAGA, COX6A1, AGO3, RRAGC, PTEN, PRDX2, COX11, YWHAB, COX6C, NDUFA4, AGO2"
"905","TP53 Regulates Transcription of Cell Cycle Genes",0.947938689217759,1,-0.223704341155908,-0.685200785865935,3586,42,"PLK2, PLAGL1, TP53"
"906","TP53 Regulates Transcription of Cell Death Genes",0.518977536793184,0.837165012549379,-0.321916940290718,-0.957513233929867,2009,36,"PRELID3A, ATM, TP53, PPP1R13B, RABGGTB, PRELID1, CRADD"
"907","TP53 Regulates Transcription of DNA Repair Genes",0.891629711751663,0.995621082020755,-0.232807203554631,-0.761996617286067,3216,59,"ATM, CCNH, CCNK, TP53, SUPT5H, NELFA, ATR, RAD51D, NELFE, GTF2H1, POLR2K, SUPT16H, POLR2D, POLR2H"
"908","TP53 Regulates Transcription of Genes Involved in Cytochrome C Release",0.0548646671543526,0.453455970815384,-0.597592008754385,-1.50618544290614,224,17,"PRELID3A, ATM, TP53, PPP1R13B, PRELID1"
"909","TP53 Regulates Transcription of Genes Involved in G2 Cell Cycle Arrest",0.95111186555763,1,0.245621202382489,0.58474460214949,5602,16,"E2F4, CARM1, BAX, PCNA, ZNF385A, CDK1"
"910","TP53 regulates transcription of additional cell cycle genes whose exact role in the p53 pathway remain uncertain",0.296657721395462,0.674162821808589,-0.43505508826652,-1.1291274622844,1215,19,"PLK2, PLAGL1, TP53"
"911","TRAF6 mediated NF-kB activation",0.226833813315263,0.623622047244095,0.490650609858083,1.20998182195773,1338,19,"APP, IKBKB, MAP3K1, IKBKG, NFKBIA, NFKB1, DDX58, NFKB2, TRAF2, CHUK, NKIRAS1, NFKBIB, S100B"
"912","TRAF6 mediated induction of NFkB and MAP kinases upon TLR7/8 or 9 activation",0.741750358680057,0.939554767080899,-0.252650662276659,-0.875445894206347,2584,79,"RPS6KA5, MEF2C, RIPK2, PELI1, MAP2K6, ATF1, MAPK8, PELI2, MAP2K1, MAP2K4, TRAF6, RPS6KA3, MAPKAPK2, MAPK11, RPS6KA2, TAB3, TAB2, TNIP2"
"913","TRIF(TICAM1)-mediated TLR4 signaling",0.600768049155146,0.884891969838206,0.284669208134006,0.926620105069975,3910,83,"TANK, UBB, UBE2D2, UBE2D3, UBE2D1, BTRC, MEF2A, APP, TBK1, IKBKB, JUN, IKBKG, VRK3, FBXW11, CUL1, MAPK3, PPP2R5D, TAB1, IRF3, RIPK1, NFKBIA, NFKB1, ELK1, DUSP6, TRAF3, NFKB2, MAPK10, DUSP7, UBC, MAPK7, CREB1"
"914","TRP channels",0.0176181602574962,0.343720334080209,0.653386945940579,1.61130203735251,103,19,"TRPC4, TRPC3, TRPM3, TRPC6, TRPM7, TRPV2, MCOLN1"
"915","Tat-mediated HIV elongation arrest and recovery",0.974202083677857,1,0.214370550780506,0.577924120744262,5890,29,"POLR2F, POLR2E, CDK9, ELOC, NELFB, ELOA, GTF2F2, ELL, SUPT4H1"
"916","Tat-mediated elongation of the HIV-1 transcript",0.918656520598268,0.997950766135466,-0.233441259091063,-0.712844134975201,3500,41,"CCNH, SUPT5H, NELFA, NELFE, GTF2H1, POLR2K, SUPT16H, POLR2D, POLR2H, CDK7, POLR2I, GTF2F1, NELFCD, MNAT1"
"917","Telomere C-strand (Lagging Strand) Synthesis",0.927936821322804,0.999154264925784,-0.241936663236717,-0.653085834597897,3759,23,"POLA1, RFC2, DNA2, RFC4, POLE4, PRIM2, RFC5, PRIM1, POLE"
"918","Telomere Maintenance",0.856477889837083,0.979643958065867,-0.254675510396685,-0.751710133916073,3311,35,"POLA1, TERF1, RUVBL1, TERT, RFC2, DNA2, TERF2, RFC4, RUVBL2, POLE4, PRIM2, RFC5, NHP2"
"919","Termination of translesion DNA synthesis",0.624647536904959,0.893341014052182,0.33261758567822,0.889704745261251,3765,28,"POLH, UBB, POLD4, UBC, RPA1, POLD1, PCNA, POLI, PCLAF, RFC3"
"920","The canonical retinoid cycle in rods (twilight vision)",0.996085106382979,1,0.183702766595576,0.431451148329905,5851,15,"RDH11, RBP1, RLBP1, ABCA4, DHRS9, RDH10, RDH12, HSD17B1"
