"","pathway","pval","padj","ES","NES","nMoreExtreme","size","leadingEdge"
"1","A tetrasaccharide linker sequence is required for GAG synthesis",0.0125075650595118,0.697118626563554,-0.99959807073955,-2.62132498178073,61,23,"GPC6"
"2","ABC transporter disorders",0.585960737656157,0.735246351552465,-0.359562888081175,-0.601247705797132,2954,71,"VCP, UBC, UBB, SEL1L, RPS27A, RNF5, RNF185, PSMF1, PSME4, PSME3, PSME2, PSME1, PSMD9, PSMD8, PSMD7, PSMD6, PSMD5, PSMD4, PSMD3, PSMD2, PSMD14, PSMD13, PSMD12, PSMD11, PSMD10, PSMD1, PSMC6, PSMC5, PSMC4, PSMC3, PSMC2, PSMC1, PSMB9, PSMB8, PSMB7, PSMB6, PSMB5, PSMB4, PSMB3, PSMB2, PSMB10, PSMB1, PSMA8, PSMA7, PSMA6, PSMA5, PSMA4, PSMA3, PSMA1"
"3","ABC transporters in lipid homeostasis",0.167931309904153,0.697118626563554,0.810654502845665,2.36032093225102,840,16,"ABCA12, ABCA2, ABCA3, ABCA5, ABCA6, ABCA7, ABCA9, ABCD1, ABCD2, ABCD3, ABCG1, ABCG4, ABCG5, APOA1"
"4","ABC-family proteins mediated transport",0.674582410947877,0.762697029936786,0.288856603162919,0.439642400974013,3351,94,"ABCA12, ABCA2, ABCA3, ABCA4, ABCA5, ABCA6, ABCA7, ABCA8, ABCA9, ABCB10, ABCB1, ABCB4, ABCB6, ABCB7, ABCB8, ABCB9, ABCC1, ABCC10, ABCC2, ABCC3, ABCC4, ABCC5, ABCD1, ABCD2, ABCD3, ABCF1, ABCG1, ABCG4, ABCG5"
"5","ADP signalling through P2Y purinoceptor 1",0.228395061728395,0.697118626563554,0.505300928140848,1.38110855523295,1146,21,"GNA11, GNA14, GNA15, GNB1, GNB2, GNB3, GNB4, GNB5, GNG10, GNG11, GNG12, GNG13, GNG2, GNG3, GNG4, GNG7, GNG8, GNGT2"
"6","ADP signalling through P2Y purinoceptor 12",0.204523107177974,0.697118626563554,0.595573617945211,1.67996678925348,1039,19,"GNAI1, GNAI2, GNAI3, GNB1, GNB2, GNB3, GNB4, GNB5, GNG10, GNG11, GNG12, GNG13, GNG2, GNG3, GNG4, GNG7, GNG8, GNGT2"
"7","APC-Cdc20 mediated degradation of Nek2A",0.228195937873357,0.697118626563554,0.516968073230632,1.41299765933164,1145,21,"ANAPC1, ANAPC10, ANAPC15, ANAPC16, ANAPC2, ANAPC4, ANAPC5, ANAPC7, BUB3, CDC16, CDC20, CDC23, CDC26, CDC27"
"8","APC/C-mediated degradation of cell cycle proteins",0.320739549839228,0.697118626563554,0.995764705882353,1.63917412749834,1595,76,"PTTG1, ANAPC1"
"9","APC/C:Cdc20 mediated degradation of Cyclin B",0.213962635201573,0.697118626563554,0.550311432589914,1.53819415800871,1087,20,"ANAPC1, ANAPC10, ANAPC15, ANAPC16, ANAPC2, ANAPC4, ANAPC5, ANAPC7, CCNB1, CDC16, CDC20, CDC23, CDC26, CDC27"
"10","APC/C:Cdc20 mediated degradation of Securin",0.305746661270741,0.697118626563554,0.995768688293371,1.77506813138518,1510,62,"PTTG1, ANAPC1"
"11","APC/C:Cdc20 mediated degradation of mitotic proteins",0.311227575085668,0.697118626563554,0.995767266863746,1.72428792892606,1543,67,"PTTG1, ANAPC1"
"12","APC/C:Cdh1 mediated degradation of Cdc20 and other APC/C:Cdh1 targeted proteins in late mitosis/early G1",0.311385737439222,0.697118626563554,0.995767551226067,1.73011388710736,1536,66,"PTTG1, ANAPC1"
"13","APC:Cdc20 mediated degradation of cell cycle proteins prior to satisfation of the cell cycle checkpoint",0.548374384236453,0.722950499068283,-0.392497855496646,-0.687750417829888,2782,65,"UBE2E1, UBE2D1, UBC, UBB, RPS27A, PSMF1, PSME4, PSME3, PSME2, PSME1, PSMD9, PSMD8, PSMD7, PSMD6, PSMD5, PSMD4, PSMD3, PSMD2, PSMD14, PSMD13, PSMD12, PSMD11, PSMD10, PSMD1, PSMC6, PSMC5, PSMC4, PSMC3, PSMC2, PSMC1, PSMB9, PSMB8, PSMB7, PSMB6, PSMB5, PSMB4, PSMB3, PSMB2, PSMB10, PSMB1, PSMA8, PSMA7, PSMA6, PSMA5, PSMA4, PSMA3, PSMA1"
"14","ATF4 activates genes in response to endoplasmic reticulum  stress",0.244598612487611,0.697118626563554,0.457110070366746,1.22985012698372,1233,23,"ASNS, ATF3, ATF4, ATF6, CEBPB, CEBPG, DCP2, DDIT3, DIS3, EXOSC1, EXOSC2, EXOSC3, EXOSC4, EXOSC5, EXOSC7, EXOSC8, EXOSC9"
"15","AUF1 (hnRNP D0) binds and destabilizes mRNA",0.454276704769413,0.697261918948401,-0.569619488624925,-1.11720339219261,2304,50,"UBC, UBB, RPS27A, PSMF1, PSME4, PSME3, PSME2, PSME1, PSMD9, PSMD8, PSMD7, PSMD6, PSMD5, PSMD4, PSMD3, PSMD2, PSMD14, PSMD13, PSMD12, PSMD11, PSMD10, PSMD1, PSMC6, PSMC5, PSMC4, PSMC3, PSMC2, PSMC1, PSMB9, PSMB8, PSMB7, PSMB6, PSMB5, PSMB4, PSMB3, PSMB2, PSMB10, PSMB1, PSMA8, PSMA7, PSMA6, PSMA5, PSMA4, PSMA3, PSMA1"
"16","AURKA Activation by TPX2",0.556118314424635,0.725013506212858,0.249412159892509,0.433345554303472,2744,66,"ACTR1A, AKAP9, ALMS1, AURKA, CCP110, CDK5RAP2, CENPJ, CEP131, CEP135, CEP152, CEP164, CEP192, CEP250, CEP290, CEP41, CEP57, CEP63, CEP70, CEP72, CEP76, CEP78, CETN2, CKAP5, CLASP1, CNTRL, CSNK1D, CSNK1E, DCTN1, DCTN2, DCTN3, DYNC1H1, DYNC1I2, DYNLL1"
"17","Abortive elongation of HIV-1 transcript in the absence of Tat",0.256405083719992,0.697118626563554,-0.412906589309847,-1.08279756572459,1270,23,"SUPT5H, SUPT4H1, POLR2L, POLR2K, POLR2J, POLR2I, POLR2H, POLR2G, POLR2F, POLR2E, POLR2D, POLR2C, POLR2B, POLR2A, NELFE, NELFCD, NELFB, NELFA, NCBP2, NCBP1"
"18","Acetylcholine Neurotransmitter Release Cycle",0.0634984025559105,0.697118626563554,0.997790425175762,2.90519033481563,317,16,"PPFIA2, CHAT"
"19","Activated NOTCH1 Transmits Signal to the Nucleus",0.196070488150699,0.697118626563554,-0.995710455764075,-2.34788956420825,967,31,"DNER"
"20","Activation of APC/C and APC/C:Cdc20 mediated degradation of mitotic proteins",0.311343523732904,0.697118626563554,0.995766982463213,1.71829943875183,1547,68,"PTTG1, ANAPC1"
"21","Activation of ATR in response to replication stress",0.343550955414013,0.697118626563554,0.278876449688275,0.656474789228569,1725,34,"ATR, ATRIP, CDC25A, CDC25C, CDC45, CDC6, CDC7, CHEK1, CLSPN, DBF4, HUS1, MCM10, MCM4, MCM5, MCM6, MCM7, MCM8, ORC1, ORC2, ORC3, ORC4, ORC5, ORC6, RAD1, RAD17, RAD9A, RAD9B, RFC2, RFC3, RFC4, RFC5, RPA1, RPA2, RPA3"
"22","Activation of BH3-only proteins",0.301168412570508,0.697118626563554,-0.301587301587302,-0.749437959946269,1494,27,"YWHAZ, YWHAQ, YWHAH, YWHAG, YWHAE, YWHAB, TP73, TP63, TP53BP2, TP53, TFDP2, TFDP1"
"23","Activation of G protein gated Potassium channels",0.256001613879363,0.697118626563554,-0.515421932427507,-1.35163164793858,1268,23,"GABBR2"
"24","Activation of GABAB receptors",0.35728582866293,0.697118626563554,-0.515418806670319,-1.17021489055613,1784,35,"GABBR2"
"25","Activation of HOX genes during differentiation",0.452845048237842,0.697261918948401,-0.21540685320629,-0.431628659748916,2299,48,"ZNF335, YY1, WDR5, SUZ12, RXRA, RBBP7, RBBP5, RARG, RARB, RARA, POLR2L, POLR2K, POLR2J, POLR2I, POLR2H, POLR2G, POLR2F, POLR2E, POLR2D, POLR2C, POLR2B, POLR2A, PKNOX1, PIAS2, PCGF2, PBX1, PAXIP1, PAX6, PAGR1, NCOR1, NCOA6, NCOA3, MEIS1, MAFB, KMT2D, KMT2C, KDM6A, JUN"
"26","Activation of IRF3/IRF7 mediated by TBK1/IKK epsilon",0.257509010812976,0.697118626563554,-0.29972380314697,-0.854132432408822,1285,16,"UBC, UBB, TRAF3, TLR4, TICAM1, TBK1, TANK, SARM1, RPS27A, PTPN11"
"27","Activation of Matrix Metalloproteinases",0.227687425624752,0.697118626563554,0.314757481940144,0.91121005926044,1147,17,"COL18A1, CTSK, FURIN, KLKB1, MMP11, MMP14, MMP15, MMP16, MMP17, MMP1, MMP2, MMP24, MMP25, MMP9"
"28","Activation of NF-kappaB in B cells",0.153388822829964,0.697118626563554,-0.997649113379903,-1.75629061359424,773,63,"PRKCB"
"29","Activation of NMDA receptors and postsynaptic events",0.474292546831407,0.706421621232674,-0.961547400890632,-1.62686329869793,2379,69,"GRIA1, NRG1, GRIN2B, PRKAG2"
"30","Activation of SMO",0.184709600948242,0.697118626563554,0.364140332083557,1.08036470180978,934,15,"ARRB1, ARRB2, BOC, CDON, CSNK1A1, EFCAB7, EVC, EVC2, GAS1, GRK2, IHH, KIF3A"
"31","Activation of anterior HOX genes in hindbrain development during early embryogenesis",0.452845048237842,0.697261918948401,-0.21540685320629,-0.431628659748916,2299,48,"ZNF335, YY1, WDR5, SUZ12, RXRA, RBBP7, RBBP5, RARG, RARB, RARA, POLR2L, POLR2K, POLR2J, POLR2I, POLR2H, POLR2G, POLR2F, POLR2E, POLR2D, POLR2C, POLR2B, POLR2A, PKNOX1, PIAS2, PCGF2, PBX1, PAXIP1, PAX6, PAGR1, NCOR1, NCOA6, NCOA3, MEIS1, MAFB, KMT2D, KMT2C, KDM6A, JUN"
"32","Activation of gene expression by SREBF (SREBP)",0.643455706304868,0.749726104029416,0.133668678739101,0.293082403327908,3224,41,"ACACA, ACACB, CARM1, CHD9, CREBBP, CYP51A1, DHCR7, ELOVL6, FASN, FDFT1, GGPS1, GPAM, HELZ2, HMGCR, HMGCS1, IDI1, LSS, MED1, MTF1, MVD, MVK, NCOA1, NCOA2, NCOA6, NFYA, NFYB, NFYC, PMVK, PPARA, RXRA, SC5D, SCD, SMARCD3, SP1, SQLE, SREBF1, SREBF2, TBL1X, TBL1XR1, TGS1, TM7SF2"
"33","Activation of kainate receptors upon glutamate binding",0.26740220661986,0.697118626563554,-0.993969041077531,-2.43298036960799,1332,28,"GRIK3"
"34","Activation of the mRNA upon binding of the cap-binding complex and eIFs, and subsequent binding to 43S",0.446272598009344,0.697118626563554,0.272830973629471,0.548463119591116,2196,48,"EIF1AX, EIF2S1, EIF2S2, EIF2S3, EIF3A, EIF3B, EIF3C, EIF3D, EIF3E, EIF3F, EIF3G, EIF3H, EIF3I, EIF3J, EIF3K, EIF3L, EIF3M, EIF4A1, EIF4A2, EIF4E, EIF4EBP1, EIF4G1, EIF4H, FAU, RPS18, RPS11, RPS12, RPS13, RPS14, RPS15, RPS15A, RPS16, RPS17, RPS19, RPS20, RPS21, RPS24, RPS25, RPS27A, RPS27L, RPS28, RPS3A, RPS4X, RPS5, RPS7, RPS8, RPS9, RPSA"
"35","Activation of the pre-replicative complex",0.308324974924774,0.697118626563554,-0.312013574444051,-0.763728919414487,1536,28,"RPA3, RPA2, RPA1, PRIM2, PRIM1, POLE4, POLE3, POLE2, POLE, POLA2, POLA1, ORC6, ORC5, ORC4, ORC3, ORC2, ORC1, MCM8, MCM7, MCM6, MCM5, MCM4, MCM10"
"36","Acyl chain remodelling of PC",0.24683925346177,0.697118626563554,-0.462656574452408,-1.22877250512694,1229,22,"TMEM86B, PNPLA8, PLB1, PLAAT3, PLA2R1, PLA2G6, PLA2G5, PLA2G4F, PLA2G4E, PLA2G4D, PLA2G4C, PLA2G4A, PLA2G3, PLA2G2D, PLA2G1B, PLA2G12A, PLA2G10, MBOAT2, LPCAT4, LPCAT3, LPCAT2, LPCAT1"
"37","Acyl chain remodelling of PE",0.247240618101545,0.697118626563554,-0.417269012720818,-1.10822739454132,1231,22,"PNPLA8, PLAAT5, PLAAT3, PLAAT1, PLA2R1, PLA2G6, PLA2G5, PLA2G4F, PLA2G4E, PLA2G4D, PLA2G4C, PLA2G4A, PLA2G3, PLA2G2D, PLA2G1B, PLA2G12A, PLA2G10, MBOAT2, MBOAT1, LPCAT4, LPCAT3"
"38","Acyl chain remodelling of PS",0.207371405427299,0.697118626563554,-0.462666577378959,-1.28921456715041,1023,18,"PLAAT3, PLA2R1, PLA2G5, PLA2G4F, PLA2G4E, PLA2G4D, PLA2G4A, PLA2G2D, PLA2G1B, PLA2G12A, PLA2G10, PLA1A, OSBPL8, OSBPL5, OSBPL10, MBOAT1, LPCAT4, LPCAT3"
"39","Adherens junctions interactions",0.28226779252111,0.697118626563554,-0.622582406128363,-1.56681347448051,1403,26,"CDH4, CDH9"
"40","Adrenaline,noradrenaline inhibits insulin secretion",0.26491646778043,0.697118626563554,0.64857621440536,1.68569843075341,1331,26,"ADCY5, ADCY6, ADRA2A, ADRA2C, CACNA1C, CACNA1D, CACNA2D2, CACNB2, CACNB3, GNAI1, GNAI2, GNB1, GNB2, GNB3, GNB4, GNB5, GNG10, GNG11, GNG12, GNG13, GNG2, GNG3, GNG4, GNG7, GNG8, GNGT2"
"41","Aggrephagy",0.32369714847591,0.697118626563554,0.250026789900208,0.698858364181511,1645,20,"ARL13B, CFTR, DYNC1H1, DYNC1I1, DYNC1I2, DYNC1LI1, DYNC1LI2, DYNLL1, DYNLL2, UBA52, HDAC6, HSF1, IFT88"
"42","Amine ligand-binding receptors",0.0134484142914492,0.697118626563554,-0.999664924272886,-2.41744095329583,66,29,"HTR1F"
"43","Amino acid transport across the plasma membrane",0.28505237711523,0.697118626563554,-0.771106941838649,-1.91618417072072,1414,27,"SLC7A8, SLC7A7, SLC7A6, SLC7A5, SLC7A3, SLC7A2, SLC7A11, SLC7A10, SLC7A1, SLC6A6, SLC6A20, SLC6A19, SLC6A15, SLC43A2, SLC43A1, SLC3A2, SLC3A1, SLC38A5, SLC38A4, SLC38A3, SLC38A2, SLC38A1, SLC36A4, SLC36A1, SLC25A29, SLC1A4, SLC16A10"
"44","Amino acids regulate mTORC1",0.466693827663475,0.698786920708878,0.264965126990393,0.518655646956389,2290,51,"ATP6V0B, ATP6V0C, ATP6V0D1, ATP6V0D2, ATP6V0E1, ATP6V0E2, ATP6V1A, ATP6V1B1, ATP6V1B2, ATP6V1C1, ATP6V1C2, ATP6V1D, ATP6V1E1, ATP6V1F, ATP6V1G1, ATP6V1G2, ATP6V1H, C12orf66, BMT2"
"45","Amplification  of signal from unattached  kinetochores via a MAD2  inhibitory signal",0.650541951023685,0.74982416870418,0.161750326582655,0.25532080921607,3240,86,"AHCTF1, B9D2, BIRC5, BUB1, BUB3, CDC20, CDCA8, CENPA, CENPC, CENPE, CENPF, CENPH, CENPI, CENPK, CENPL, CENPM, CENPN, CENPO, CENPP, CENPQ, CENPT, CENPU, CKAP5, CLASP1, CLASP2, CLIP1, DSN1, DYNC1H1, DYNC1I1, DYNC1I2, DYNC1LI1, DYNC1LI2, DYNLL1, DYNLL2, INCENP, ITGB3BP, KIF18A, KIF2A, KIF2C, KNL1, KNTC1, MAD1L1, MAD2L1, MAPRE1, MIS12, NDC80, NDE1, NDEL1, NSL1, NUDC, NUP107, NUP133, NUP160, NUP37, NUP43, NUP85, NUP98, PAFAH1B1, PLK1, PMF1, PPP1CC, PPP2CA, PPP2CB, PPP2R1A, PPP2R1B, PPP2R5A, PPP2R5B, PPP2R5C, PPP2R5D, PPP2R5E"
"46","Amplification of signal from the kinetochores",0.650541951023685,0.74982416870418,0.161750326582655,0.25532080921607,3240,86,"AHCTF1, B9D2, BIRC5, BUB1, BUB3, CDC20, CDCA8, CENPA, CENPC, CENPE, CENPF, CENPH, CENPI, CENPK, CENPL, CENPM, CENPN, CENPO, CENPP, CENPQ, CENPT, CENPU, CKAP5, CLASP1, CLASP2, CLIP1, DSN1, DYNC1H1, DYNC1I1, DYNC1I2, DYNC1LI1, DYNC1LI2, DYNLL1, DYNLL2, INCENP, ITGB3BP, KIF18A, KIF2A, KIF2C, KNL1, KNTC1, MAD1L1, MAD2L1, MAPRE1, MIS12, NDC80, NDE1, NDEL1, NSL1, NUDC, NUP107, NUP133, NUP160, NUP37, NUP43, NUP85, NUP98, PAFAH1B1, PLK1, PMF1, PPP1CC, PPP2CA, PPP2CB, PPP2R1A, PPP2R1B, PPP2R5A, PPP2R5B, PPP2R5C, PPP2R5D, PPP2R5E"
"47","Amyloid fiber formation",0.66746650669866,0.75627106338389,-0.131981423110455,-0.283004785045845,3337,40,"USP9X, UBE2L6, UBC, UBB, TTR, TSPAN5, TSPAN33, TSPAN15, TSPAN14"
"48","Anchoring of the basal body to the plasma membrane",0.659223496278415,0.752583796832439,0.205101346552124,0.317392411297471,3276,90,"ACTR1A, AHI1, AKAP9, ALMS1, B9D1, B9D2, C2CD3, CC2D2A, CCP110, CDK5RAP2, CENPJ, CEP131, CEP135, CEP152, CEP162, CEP164, CEP192, CEP250, CEP290, CEP41, CEP57, CEP63, CEP70, CEP72, CEP76, CEP78, CEP83, CEP89, CEP97, CETN2, CKAP5, CLASP1, CNTRL, CSNK1D, CSNK1E, DCTN1, DCTN2, DCTN3, DYNC1H1, DYNC1I2, DYNLL1"
"49","Antigen Presentation: Folding, assembly and peptide loading of class I MHC",0.21417004048583,0.697118626563554,-0.338685056239957,-0.96891532465074,1057,15,"TAPBP, TAP2, SEC31A, SEC24D, SEC24B, SEC24A, SEC23A, SEC13, SAR1B"
"50","Antigen activates B Cell Receptor (BCR) leading to generation of second messengers",0.213622902270484,0.697118626563554,0.995576407506702,2.42672556234414,1081,31,"ITPR1, AHCYL1"
"51","Antigen processing-Cross presentation",0.642699779691568,0.749726104029416,-0.377099842691211,-0.589022625188066,3208,82,"VAMP8, UBC, UBB, TLR4, TLR2, TIRAP, TAPBP, TAP2, STX4, SNAP23, SEC61G, SEC61B, SEC61A2, SEC61A1, SEC22B, RPS27A, PSMF1, PSME4, PSME3, PSME2, PSME1, PSMD9, PSMD8, PSMD7, PSMD6, PSMD5, PSMD4, PSMD3, PSMD2, PSMD14, PSMD13, PSMD12, PSMD11, PSMD10, PSMD1, PSMC6, PSMC5, PSMC4, PSMC3, PSMC2, PSMC1, PSMB9, PSMB8, PSMB7, PSMB6, PSMB5, PSMB4, PSMB3, PSMB2, PSMB10, PSMB1, PSMA8, PSMA7, PSMA6, PSMA5, PSMA4, PSMA3, PSMA1"
"52","Antigen processing: Ubiquitination & Proteasome degradation",0.0254134731746672,0.697118626563554,0.998772755164655,1.2649548423076,125,284,"HECW2, ZBTB16, ANAPC1"
"53","Antimicrobial peptides",0.238992463308211,0.697118626563554,0.303551312047519,0.87876865494814,1204,17,"ATOX1, ATP7A, BPIFB1, CAMP, CHGA, CLU, DEFB129, DEFB110, DEFB136"
"54","Antiviral mechanism by IFN-stimulated genes",0.592217589835219,0.735246351552465,-0.207566966119288,-0.34517844456569,2982,72,"USP41, USP18, UBE2N, UBE2L6, UBE2E1, UBC, UBB, UBA7, TPR, STAT1, SEH1L, SEC13, RPS27A, RNASEL, RANBP2, RAE1, PPM1B, POM121, POM121C, PLCG1, PIN1, PDE12, OAS1, NUP42, NUP58, NUP98, NUP93, NUP88, NUP85, NUP62, NUP54, NUP50, NUP43, NUP37, NUP35, NUP214, NUP210, NUP205, NUP188, NUP160, NUP155, NUP153, NUP133, NUP107, NEDD4, NDC1, MAPK3, KPNB1, KPNA7, KPNA4, KPNA3, KPNA2, KPNA1, JAK1, ISG15, IRF3, UBA52, FLNB, FLNA, EIF4G3, EIF4G2, EIF4G1, EIF4E2, EIF4E, EIF4A3, EIF4A2, EIF4A1, EIF2AK2"
"55","Apoptosis",0.716229540524551,0.785398125435022,-0.714647188824751,-0.91596244133164,3631,156,"DCC, PTK2"
"56","Apoptotic cleavage of cellular proteins",0.322703569995989,0.697118626563554,-0.993898350543114,-2.21484805517587,1608,37,"PTK2"
"57","Apoptotic execution phase",0.361659684819469,0.697118626563554,-0.993895485342457,-2.04876342104579,1812,44,"PTK2"
"58","Apoptotic factor-mediated response",0.161201106282102,0.697118626563554,0.47131762185324,1.39834804641835,815,15,"APAF1, APIP, AVEN, BAK1, BAX, C1QBP, CASP3, CASP7, CASP9"
"59","Aquaporin-mediated transport",0.367098703888335,0.697118626563554,0.385269651699153,0.868455265763195,1840,38,"ADCY1, ADCY2, ADCY3, ADCY5, ADCY6, ADCY7, ADCY8, ADCY9, AQP11, AQP12A, AQP4, AQP7, GNAS, GNB1, GNB2, GNB3, GNB4, GNB5, GNG10, GNG11, GNG12, GNG13, GNG2, GNG3, GNG4, GNG7, GNG8, GNGT2"
"60","Arachidonic acid metabolism",0.354690618762475,0.697118626563554,0.299409617461914,0.687773176205457,1776,36,"ABCC1, ALOX12, ALOX12B, ALOX5, ALOX5AP, ALOX15B, ALOXE3, CBR1, CYP1B1, CYP2J2, CYP2U1, CYP4B1, CYP4F8, CYP4F3, EPHX2, FAAH, GPX1, GPX4, HPGD, HPGDS, LTA4H, LTC4S, MAPKAPK2, PLA2G4A, PON2, PON3, PRXL2B, PTGDS, PTGES, PTGES2, PTGES3, PTGIS, PTGR2, PTGS1, PTGS2"
"61","Asparagine N-linked glycosylation",0.910199106054449,0.918023167138012,0.533985160845837,0.670870054572218,4479,264,"MGAT4C, ACTR10"
"62","Assembly Of The HIV Virion",0.187224669603524,0.697118626563554,-0.468693505189153,-1.33565075392136,934,16,"VPS37D, VPS37C, VPS37B, VPS37A, VPS28, UBC, UBB, UBAP1, TSG101"
"63","Assembly and cell surface presentation of NMDA receptors",0.23469182895001,0.697118626563554,-0.622072679731168,-1.67467874399283,1168,21,"GRIN2B"
"64","Assembly of collagen fibrils and other multimeric structures",0.411422845691383,0.697118626563554,0.406820773645084,0.860889078170286,2052,44,"BMP1, CD151, COL11A1, COL11A2, COL15A1, COL18A1, COL1A1, COL27A1, COL4A1, COL4A2, COL4A3, COL4A4, COL4A5, COL5A1, COL5A2, COL5A3, COL6A1, COL6A2, COL6A3, COL6A5, COL6A6, COL8A1, COL8A2, COL9A1, COL9A2, CTSB, CTSS"
"65","Assembly of the pre-replicative complex",0.534639746634996,0.71690317834922,-0.42585738035209,-0.757582777996012,2700,61,"UBC, UBB, RPS27A, PSMF1, PSME4, PSME3, PSME2, PSME1, PSMD9, PSMD8, PSMD7, PSMD6, PSMD5, PSMD4, PSMD3, PSMD2, PSMD14, PSMD13, PSMD12, PSMD11, PSMD10, PSMD1, PSMC6, PSMC5, PSMC4, PSMC3, PSMC2, PSMC1, PSMB9, PSMB8, PSMB7, PSMB6, PSMB5, PSMB4, PSMB3, PSMB2, PSMB10, PSMB1, PSMA8, PSMA7, PSMA6, PSMA5, PSMA4, PSMA3, PSMA1, ORC6, ORC5, ORC4, ORC3, ORC2, ORC1"
"66","Association of TriC/CCT with target proteins during biosynthesis",0.376126577208091,0.697118626563554,0.338541666666667,0.75267895397204,1877,39,"AP3M1, ARFGEF2, CCNE1, CCNE2, CCT2, CCT3, CCT4, CCT5, CCT6A, CCT6B, CCT7, CCT8, DCAF7, FBXL3, FBXL5, FBXO4, FBXO6, FBXW10, FBXW2, FBXW4, FBXW5, FBXW7, FBXW9, FKBP9, GAPDHS, GBA"
"67","Asymmetric localization of PCP proteins",0.534639746634996,0.71690317834922,-0.496575983441412,-0.883388266537999,2700,61,"WNT5A, VANGL2, UBC, UBB, SMURF2, SMURF1, SCRIB, RPS27A, PSMF1, PSME4, PSME3, PSME2, PSME1, PSMD9, PSMD8, PSMD7, PSMD6, PSMD5, PSMD4, PSMD3, PSMD2, PSMD14, PSMD13, PSMD12, PSMD11, PSMD10, PSMD1, PSMC6, PSMC5, PSMC4, PSMC3, PSMC2, PSMC1, PSMB9, PSMB8, PSMB7, PSMB6, PSMB5, PSMB4, PSMB3, PSMB2, PSMB10, PSMB1, PSMA8, PSMA7, PSMA6, PSMA5, PSMA4, PSMA3, PSMA1, PRICKLE1"
"68","Attenuation phase",0.229390681003584,0.697118626563554,0.41622173316748,1.13763376344178,1151,21,"COL4A6, CREBBP, DEDD2, DNAJB1, DNAJB6, EP300, FKBP4, GML, HSBP1, HSF1, HSP90AB1, HSPA1A, HSPA1B, HSPA1L, HSPA2, HSPA8, HSPH1"
"69","Autodegradation of Cdh1 by Cdh1:APC/C",0.523395853899309,0.71690317834922,-0.43213168713039,-0.780041391080467,2650,59,"UBE2E1, UBE2D1, UBC, UBB, RPS27A, PSMF1, PSME3, PSME2, PSME1, PSMD9, PSMD8, PSMD7, PSMD6, PSMD5, PSMD4, PSMD3, PSMD2, PSMD14, PSMD13, PSMD12, PSMD11, PSMD10, PSMD1, PSMC6, PSMC5, PSMC4, PSMC3, PSMC2, PSMC1, PSMB9, PSMB8, PSMB7, PSMB6, PSMB5, PSMB4, PSMB3, PSMB2, PSMB10, PSMB1, PSMA7, PSMA6, PSMA5, PSMA4, PSMA3, PSMA1"
"70","Autodegradation of the E3 ubiquitin ligase COP1",0.43630635951959,0.697118626563554,-0.628064259992395,-1.25850468887866,2215,48,"UBC, UBB, TP53, RPS27A, PSMF1, PSME4, PSME3, PSME2, PSME1, PSMD9, PSMD8, PSMD7, PSMD6, PSMD5, PSMD4, PSMD3, PSMD2, PSMD14, PSMD13, PSMD12, PSMD11, PSMD10, PSMD1, PSMC6, PSMC5, PSMC4, PSMC3, PSMC2, PSMC1, PSMB9, PSMB8, PSMB7, PSMB6, PSMB5, PSMB4, PSMB3, PSMB2, PSMB10, PSMB1, PSMA8, PSMA7, PSMA6, PSMA5, PSMA4, PSMA3, PSMA1"
"71","Autophagy",0.410509679968392,0.697118626563554,-0.994743581103848,-1.38614364761186,2077,112,"PRKAG2"
"72","Axon guidance",0.502324680356451,0.712976965667221,0.732209039364264,0.984450524502769,2592,474,"DAB1, SEMA6D, UNC5D, PRKCA, EPHB1, EPHB2, DPYSL2"
"73","B-WICH complex positively regulates rRNA expression",0.364278506559031,0.697118626563554,-0.236085277163349,-0.553209722261753,1804,32,"ZNRD1, TWISTNB, TBP, TAF1D, TAF1C, TAF1B, TAF1A, SMARCA5, SF3B1, POLR2L, POLR2K, POLR2H, POLR2F, POLR2E, POLR1E, POLR1D, POLR1C, POLR1B, POLR1A"
"74","BBSome-mediated cargo-targeting to cilium",0.228594185583433,0.697118626563554,0.474372468344337,1.29657366118021,1147,21,"ARL6, BBS1, BBS10, BBS2, BBS4, BBS5, BBS7, BBS9, CCT2, CCT3, CCT4, CCT5, CCT8"
"75","BMAL1:CLOCK,NPAS2 activates circadian gene expression",0.512529832935561,0.71690317834922,0.185385542975816,0.492168368634447,2576,24,"ARNTL, ARNTL2, BHLHE40, BHLHE41, CARM1, CHD9, CLOCK, CREBBP, DBP, HELZ2, KLF15, MED1, NAMPT, NCOA1, NCOA2, NCOA6, NOCT, NPAS2"
"76","Base Excision Repair",0.415158146011538,0.697118626563554,-0.364113851779285,-0.762195426208095,2086,43,"XRCC1, UNG, TINF2, TERF2IP, TERF2, TERF1, TDG, SMUG1, RPA3, RPA2, RPA1, RFC5, RFC4, RFC3, RFC2, RFC1, POT1, POLE4, POLE3, POLE2, POLE, POLD4, POLD2, POLD1, POLB, PNKP, PCNA, PARP2, PARP1, PARG, OGG1, NTHL1, NEIL2, NEIL1, MUTYH, MPG, MBD4, LIG3, LIG1"
"77","Base-Excision Repair, AP Site Formation",0.189627553063676,0.697118626563554,-0.425882992969535,-1.21365227882234,946,16,"UNG, TINF2, TERF2IP, TERF2, TERF1, TDG, SMUG1, POT1, OGG1, NTHL1, NEIL2, NEIL1, MUTYH, MPG, MBD4"
"78","Basigin interactions",0.175896414342629,0.697118626563554,0.995378123116083,2.7031274358289,882,22,"ATP1B1, ATP1B2"
"79","Beta-catenin independent WNT signaling",0.783407347597901,0.828106265328712,0.538919771939647,0.727715917029522,3880,140,"PRKCA, ITPR1, AGO1"
"80","Beta-catenin phosphorylation cascade",0.203689012296708,0.697118626563554,0.347261282978439,1.00530723619721,1026,17,"AMER1, APC, AXIN1, CSNK1A1, CTNNB1, FRAT1, FRAT2, GSK3B, PPP2CA, PPP2CB, PPP2R1A, PPP2R1B, PPP2R5A, PPP2R5B, PPP2R5C, PPP2R5D, PPP2R5E"
"81","Bile acid and bile salt metabolism",0.50059500198334,0.712437091771438,0.177711502803655,0.438006233978344,2523,30,"ABCB11, ABCC3, ACOT8, ACOX2, AMACR, BAAT, CH25H, CYP27A1, CYP39A1, CYP46A1, CYP7B1, HSD17B4, NCOA1, NCOA2, OSBP, OSBPL1A, OSBPL2, OSBPL3, OSBPL6, OSBPL7, OSBPL9, PTGIS, RXRA, SCP2, SLC10A1, SLC27A2, SLC27A5, SLCO1B1, SLCO1B3"
"82","Binding and Uptake of Ligands by Scavenger Receptors",0.200795228628231,0.697118626563554,0.996045046252849,2.36869429775497,1009,33,"FTH1, AMBP"
"83","Biological oxidations",0.774259033698741,0.82199436718015,0.246679444866275,0.342741535410436,3813,124,"ABHD10, ABHD14B, ACSM2B, ACSM2A, ACSS1, ACSS2, ACY1, ADH4, ADH5, AHCY, AHR, AHRR, AIP, AKR1A1, AKR7L, ALDH1A1, ALDH1B1, ALDH2, ALDH3A1, AOC2, AOC3, ARNT, ARNT2, AS3MT, BPHL, BPNT1, CBR3, CES1, CHAC1, CHAC2, CMBL, CNDP2, COMT, CYB5B, CYB5R3, CYP11A1, CYP19A1, CYP1B1, CYP26B1, CYP26C1, CYP27A1, CYP27B1, CYP2J2, CYP2R1, CYP2S1, CYP2U1, CYP39A1, CYP46A1, CYP4B1, CYP4F8, CYP4F3, CYP51A1, CYP7B1, EPHX1, ESD, FDX1, FMO1, GCLC, GCLM, GGCT, GGT7, GLYAT, CYP4V2, GSS, GSTA5, GSTK1, GSTM1, GSTM4, GSTM3, GSTM2, GSTO1, GSTO2, GSTP1, GSTT2, GSTT2B, GSTZ1"
"84","Biosynthesis of the N-glycan precursor (dolichol lipid-linked oligosaccharide, LLO) and transfer to a nascent protein",0.28125,0.697118626563554,-0.996033880075289,-1.62013855499619,1412,75,"ST6GAL1"
"85","Blood group systems biosynthesis",0.0480047412090083,0.697118626563554,0.998192287091591,2.96152778908619,242,15,"FUT9, B3GALT1"
"86","Branched-chain amino acid catabolism",0.206882989183874,0.697118626563554,0.458485485076205,1.29327486153635,1051,19,"ACAD8, ACADSB, ACAT1, ALDH6A1, AUH, BCAT1, BCAT2, BCKDHA, BCKDHB, BCKDK, DBT, DLD, HIBADH, HIBCH, HSD17B10, IVD, MCCC1, MCCC2"
"87","Budding and maturation of HIV virion",0.285886610373945,0.697118626563554,-0.367870119829919,-0.925795292212992,1421,26,"VTA1, VPS4B, VPS4A, VPS37D, VPS37C, VPS37B, VPS37A, VPS28, UBC, UBB, UBAP1, TSG101"
"88","Butyrate Response Factor 1 (BRF1) binds and destabilizes mRNA",0.175519169329073,0.697118626563554,0.46777703381319,1.36199073792818,878,16,"AKT1, DCP1A, DCP2, DIS3, EXOSC1, EXOSC2, EXOSC3, EXOSC4, EXOSC5, EXOSC7, EXOSC8, EXOSC9"
"89","C-type lectin receptors (CLRs)",0.357070399675391,0.697118626563554,0.99554986177601,1.39575170682771,1759,120,"ITPR1, AHCYL1"
"90","CD209 (DC-SIGN) signaling",0.290162633875446,0.697118626563554,0.272867282710593,0.789939642788975,1462,17,"CREBBP, EP300, FYN, HRAS, KRAS, LYN, NFKB1, NRAS, PAK1, PAK2, PAK3, PRKACA, PRKACB, RAF1, RELA, RELB, RPS6KA5"
"91","CD28 co-stimulation",0.578843106180666,0.732199987453736,0.158017879884711,0.379122764096736,2921,32,"AKT1, AKT2, AKT3, CD28, CD80, CD86, CDC42, FYN, GRAP2, GRB2, LCK, LYN, MAP3K14, MAP3K8, MAPKAP1, MLST8, MTOR, PAK1, PAK2, PAK3, PDPK1, PIK3CA, PIK3R1, PIK3R2, PIK3R3"
"92","CD28 dependent PI3K/Akt signaling",0.358622062923138,0.697118626563554,0.233901062099321,0.639307667872324,1800,21,"AKT1, AKT2, AKT3, CD28, CD80, CD86, FYN, LCK, MAP3K14, MAP3K8, MAPKAP1, MLST8, MTOR, PDPK1, PIK3CA, PIK3R1, PIK3R2, PIK3R3"
"93","CDK-mediated phosphorylation and removal of Cdc6",0.555467824713778,0.725013506212858,-0.381519935668407,-0.662548253811006,2813,66,"UBE2E1, UBE2D1, UBC, UBB, RPS27A, PSMF1, PSME4, PSME3, PSME2, PSME1, PSMD9, PSMD8, PSMD7, PSMD6, PSMD5, PSMD4, PSMD3, PSMD2, PSMD14, PSMD13, PSMD12, PSMD11, PSMD10, PSMD1, PSMC6, PSMC5, PSMC4, PSMC3, PSMC2, PSMC1, PSMB9, PSMB8, PSMB7, PSMB6, PSMB5, PSMB4, PSMB3, PSMB2, PSMB10, PSMB1, PSMA8, PSMA7, PSMA6, PSMA5, PSMA4, PSMA3, PSMA1"
