"","pathway","pval","padj","ES","NES","nMoreExtreme","size","leadingEdge"
"1","A tetrasaccharide linker sequence is required for GAG synthesis",0.357552959809939,0.391321850458655,0.216347396135232,1.04733924452125,1805,17,"AGRN, B3GAT1, B3GAT2, B3GAT3, BCAN, CSPG4, CSPG5"
"2","ABC transporter disorders",0.000199282582702272,0.000873517348409267,-0.406922738187226,-3.14409344304275,0,43,"VCP, UBC, UBB, SEL1L, RNF5, RNF185, PSMF1, PSME4, PSME3, PSME1, PSMD9, PSMD7, PSMD5, PSMD4, PSMD3, PSMD2, PSMD14, PSMD13, PSMD12, PSMD11, PSMD1, PSMC6, PSMC3, PSMC1, PSMB5, PSMB4, PSMB3, PSMB2, PSMB1, PSMA6, PSMA3, PSMA1"
"3","ABC-family proteins mediated transport",0.0177822177822178,0.0372669883308181,0.277277700367457,2.19421445773897,88,59,"ABCA2, ABCA3, ABCA5, ABCA6, ABCA8, ABCB10, ABCB4, ABCB7, ABCC1, ABCC10, ABCC4, ABCC5, ABCD1, ABCD2, ABCD3, ABCF1, ABCG4"
"4","APC/C-mediated degradation of cell cycle proteins",0.000198137507430157,0.000873517348409267,-0.367122872363463,-2.87827348081078,0,44,"UBE2E1, UBE2D1, UBC, UBB, SKP2, PSMF1, PSME4, PSME3, PSME1, PSMD9, PSMD7, PSMD5, PSMD4, PSMD3, PSMD2, PSMD14, PSMD13, PSMD12, PSMD11, PSMD1, PSMC6, PSMC3, PSMC1, PSMB5, PSMB4, PSMB3, PSMB2, PSMB1, PSMA6, PSMA3, PSMA1"
"5","APC/C:Cdc20 mediated degradation of Securin",0.000199322304165836,0.000873517348409267,-0.412619047619048,-3.06890368608296,0,40,"UBE2E1, UBE2D1, UBC, UBB, PSMF1, PSME4, PSME3, PSME1, PSMD9, PSMD7, PSMD5, PSMD4, PSMD3, PSMD2, PSMD14, PSMD13, PSMD12, PSMD11, PSMD1, PSMC6, PSMC3, PSMC1, PSMB5, PSMB4, PSMB3, PSMB2, PSMB1, PSMA6, PSMA3, PSMA1"
"6","APC/C:Cdc20 mediated degradation of mitotic proteins",0.000199322304165836,0.000873517348409267,-0.412619047619048,-3.06890368608296,0,40,"UBE2E1, UBE2D1, UBC, UBB, PSMF1, PSME4, PSME3, PSME1, PSMD9, PSMD7, PSMD5, PSMD4, PSMD3, PSMD2, PSMD14, PSMD13, PSMD12, PSMD11, PSMD1, PSMC6, PSMC3, PSMC1, PSMB5, PSMB4, PSMB3, PSMB2, PSMB1, PSMA6, PSMA3, PSMA1"
"7","APC/C:Cdh1 mediated degradation of Cdc20 and other APC/C:Cdh1 targeted proteins in late mitosis/early G1",0.000199600798403194,0.000873517348409267,-0.41879550120659,-3.16048917203432,0,41,"UBE2E1, UBE2D1, UBC, UBB, SKP2, PSMF1, PSME4, PSME3, PSME1, PSMD9, PSMD7, PSMD5, PSMD4, PSMD3, PSMD2, PSMD14, PSMD13, PSMD12, PSMD11, PSMD1, PSMC6, PSMC3, PSMC1, PSMB5, PSMB4, PSMB3, PSMB2, PSMB1, PSMA6, PSMA3, PSMA1"
"8","APC:Cdc20 mediated degradation of cell cycle proteins prior to satisfation of the cell cycle checkpoint",0.000199322304165836,0.000873517348409267,-0.412619047619048,-3.06890368608296,0,40,"UBE2E1, UBE2D1, UBC, UBB, PSMF1, PSME4, PSME3, PSME1, PSMD9, PSMD7, PSMD5, PSMD4, PSMD3, PSMD2, PSMD14, PSMD13, PSMD12, PSMD11, PSMD1, PSMC6, PSMC3, PSMC1, PSMB5, PSMB4, PSMB3, PSMB2, PSMB1, PSMA6, PSMA3, PSMA1"
"9","AUF1 (hnRNP D0) binds and destabilizes mRNA",0.000197941409342835,0.000873517348409267,-0.537702188392008,-3.60199992357674,0,32,"UBC, UBB, PSMF1, PSME4, PSME3, PSME1, PSMD9, PSMD7, PSMD5, PSMD4, PSMD3, PSMD2, PSMD14, PSMD13, PSMD12, PSMD11, PSMD1, PSMC6, PSMC3, PSMC1, PSMB5, PSMB4, PSMB3, PSMB2, PSMB1, PSMA6, PSMA3, PSMA1"
"10","AURKA Activation by TPX2",0.0183193946634807,0.0376910783154642,0.265775527229125,1.9601939772119,91,49,"ACTR1A, AKAP9, ALMS1, CCP110, CDK5RAP2, CEP164, CEP192, CEP250, CEP290, CEP57, CEP63, CEP70, CEP76, CEP78, CKAP5, CLASP1, CNTRL, CSNK1D, CSNK1E, DCTN1, DCTN2, DCTN3, DYNC1H1, DYNC1I2, DYNLL1"
"11","Abortive elongation of HIV-1 transcript in the absence of Tat",0.00825115717448179,0.0216730395116388,-0.405864197530864,-1.94659077996779,40,16,"SUPT5H, POLR2L, POLR2K, POLR2J, POLR2I, POLR2G, POLR2E, POLR2D, POLR2B, POLR2A, NELFCD, NELFB, NCBP2, NCBP1"
"12","Activated NOTCH1 Transmits Signal to the Nucleus",0.174609531437725,0.210707979744146,0.240142517814727,1.25383910794218,871,20,"ADAM10, ADAM17, APH1A, APH1B, ARRB1, CNTN1, DLL1, DNER, DTX2, ITCH, MIB1, MIB2, NCSTN, NEURL1, NOTCH1, NUMB, PSEN1, PSEN2"
"13","Activation of APC/C and APC/C:Cdc20 mediated degradation of mitotic proteins",0.000199322304165836,0.000873517348409267,-0.412619047619048,-3.06890368608296,0,40,"UBE2E1, UBE2D1, UBC, UBB, PSMF1, PSME4, PSME3, PSME1, PSMD9, PSMD7, PSMD5, PSMD4, PSMD3, PSMD2, PSMD14, PSMD13, PSMD12, PSMD11, PSMD1, PSMC6, PSMC3, PSMC1, PSMB5, PSMB4, PSMB3, PSMB2, PSMB1, PSMA6, PSMA3, PSMA1"
"14","Activation of BH3-only proteins",0.00958083832335329,0.0245011543215155,-0.36104513064133,-1.92996106582232,47,20,"YWHAZ, YWHAQ, YWHAH, YWHAG, YWHAE, YWHAB, TP63, TP53BP2, TFDP2, TFDP1"
"15","Activation of GABAB receptors",0.00600720865038046,0.01753214969074,0.585985748218527,3.05956585488958,29,20,"ADCY1, ADCY2, ADCY3, ADCY5, ADCY7, ADCY8, ADCY9, GABBR1, GABBR2, GNAI1, GNAI2, GNAL, GNB1, GNG12, GNG2, GNG3, GNG7, KCNJ10, KCNJ16, KCNJ3"
"16","Activation of HOX genes during differentiation",0.105454545454545,0.135118994826312,0.215241436726927,1.35662839756285,521,32,"ASH2L, CNOT6, CREBBP, CTCF, EP300, EZH2, H3-3A, HDAC3, JUN, KDM6A, KMT2C, NCOA3, NCOA6, NCOR1, PAX6, PBX1, PCGF2, PIAS2, POLR2A, POLR2B, POLR2D, POLR2E, POLR2G, POLR2I, POLR2J, POLR2K, POLR2L, RARB, RBBP7"
"17","Activation of NF-kappaB in B cells",0.000199401794616152,0.000873517348409267,-0.368727247984214,-2.81430816546732,0,42,"UBC, UBB, REL, PSMF1, PSME4, PSME3, PSME1, PSMD9, PSMD7, PSMD5, PSMD4, PSMD3, PSMD2, PSMD14, PSMD13, PSMD12, PSMD11, PSMD1, PSMC6, PSMC3, PSMC1, PSMB5, PSMB4, PSMB3, PSMB2, PSMB1, PSMA6, PSMA3, PSMA1, PRKCB"
"18","Activation of NMDA receptors and postsynaptic events",0.0189658614493911,0.0382227591358572,0.256940579978977,1.9667868265255,94,54,"ADCY1, ADCY8, APBA1, ARHGEF7, CALM1, CAMK1, CAMK2B, CAMK2G, CAMK4, CAMKK2, CASK, CREB1, DLG1, DLG2, DLG4, ERBB4, GIT1, GRIA1, GRIA2, GRIA3, GRIA4, GRIN1, GRIN2B, GRIN2C, GRIN3A, KIF17, KPNA2, KRAS, LIN7A, LIN7C, LRRC7, MAPK1, MAPT, NEFL, NRAS, NRG1, NRGN, PDPK1, PPM1E, PRKAA2, PRKAB2, PRKACA, PRKACB, PRKAG2, PRKAR1A, PRKAR2A, PRKAR2B, RAC1, RASGRF1, RASGRF2, RPS6KA1, RPS6KA2, RPS6KA3"
"19","Activation of anterior HOX genes in hindbrain development during early embryogenesis",0.105454545454545,0.135118994826312,0.215241436726927,1.35662839756285,521,32,"ASH2L, CNOT6, CREBBP, CTCF, EP300, EZH2, H3-3A, HDAC3, JUN, KDM6A, KMT2C, NCOA3, NCOA6, NCOR1, PAX6, PBX1, PCGF2, PIAS2, POLR2A, POLR2B, POLR2D, POLR2E, POLR2G, POLR2I, POLR2J, POLR2K, POLR2L, RARB, RBBP7"
"20","Activation of gene expression by SREBF (SREBP)",0.627345309381238,0.646206671624072,0.131287905815198,0.818707043746041,3142,31,"ACACA, ACACB, CARM1, CHD9, CREBBP, CYP51A1, ELOVL6, FASN, GGPS1, GPAM, HMGCR, HMGCS1, IDI1, MED1, MVK, NCOA1, NCOA2, NCOA6, NFYC, PMVK, PPARA, SCD, SMARCD3, SP1, SQLE, SREBF1, SREBF2, TBL1X, TBL1XR1, TGS1, TM7SF2"
"21","Activation of kainate receptors upon glutamate binding",0.00536139793486894,0.0163346029323361,0.52196106362773,2.46441010062203,26,16,"CALM1, DLG1, DLG4, GNB1, GNB4, GNG12, GNG2, GNG3, GNG7, GRIK1, GRIK2, GRIK3, GRIK4, GRIK5"
"22","Activation of the mRNA upon binding of the cap-binding complex and eIFs, and subsequent binding to 43S",0.026080031853474,0.0458941631604213,0.275188267934998,1.69423601039908,130,30,"EIF1AX, EIF2S1, EIF2S2, EIF2S3, EIF3A, EIF3B, EIF3C, EIF3E, EIF3H, EIF3J, EIF3M, EIF4A1, EIF4A2, EIF4E, EIF4G1, EIF4H"
"23","Adaptive Immune System",0.00230704697986577,0.00767068784866763,-0.101516779280077,-2.19241520081608,10,367,"ZNRF2, ZNRF1, ZBTB16, YWHAZ, YWHAB, YES1, WWP1, WSB1, UFL1, UBR4, UBR2, UBR1, UBOX5, UBE4A, UBE3C, UBE3B, UBE3A, UBE2Z, UBE2W, UBE2V2, UBE2R2, UBE2Q2, UBE2Q1, UBE2O, UBE2N, UBE2M, UBE2K, UBE2J2, UBE2J1, UBE2H, UBE2G2, UBE2G1, UBE2F, UBE2E3, UBE2E2, UBE2E1, UBE2D3, UBE2D2, UBE2D1, UBE2B, UBE2A, UBC, UBB, UBAC1, UBA6, UBA5, UBA3, UBA1, TRPC1, TRIP12, TRIM9, TRIM39, TRIM37, TRIM32, TRIM11, TRAF7, TRAF6, TPP2, THEM4, TAPBP, TAP2, TAP1, TAB2, STX4, STUB1, STIM1, SRC, SPTBN2, SPSB4, SPSB1, SOS1, SNAP23, SMURF2, SKP2, SIAH2, SIAH1, SH3RF1, SH3KBP1, SH3GL2, SEC61A2, SEC61A1, SEC31A, SEC24D, SEC24B, SEC24A, SEC23A, SEC22B, SAR1B, RNF7, RNF6, RNF41, RNF4, RNF34, RNF25, RNF217, RNF213, RNF182, RNF144B, RNF14, RNF138, RNF130, RNF123, RNF115, RNF114, RNF111, RLIM, RIPK2, RICTOR, REL, RCHY1, RBX1, RAPGEF4, RAPGEF3, RAP1GAP, RAP1B, RAP1A, RAF1, RAC1, RAB7A, PVR, PTPRJ, PTPN11, PTEN, PSMF1, PSME4, PSME3, PSME1, PSMD9, PSMD7, PSMD5, PSMD4, PSMD3, PSMD2, PSMD14, PSMD13, PSMD12, PSMD11, PSMD1, PSMC6, PSMC3, PSMC1, PSMB5, PSMB4, PSMB3, PSMB2, PSMB1, PSMA6, PSMA3, PSMA1, PRR5, PRKG1, PRKCQ, PRKCB, PRKACB, PRKACA, PPP3R1, PPP3CB, PPP3CA, PPP2R5E, PPP2R5D, PPP2R5C, PPP2R5B, PPP2R5A, PPP2R1B, PPP2R1A, PPP2CB, PPP2CA"
"24","Adherens junctions interactions",0.00560224089635854,0.016658738967285,0.636467980685506,3.17078487890091,27,18,"AFDN, CADM1, CADM2, CADM3, CDH10, CDH11, CDH12, CDH13, CDH18, CDH2, CDH4, CDH6, CDH9, CTNNA1, CTNNB1"
"25","Aggrephagy",0.185111859037814,0.221684110823401,0.257173984398461,1.2449810413343,934,17,"ARL13B, DYNC1H1, DYNC1I1, DYNC1I2, DYNC1LI1, DYNC1LI2, DYNLL1, DYNLL2, HDAC6, HSF1, IFT88"
"26","Amino acids regulate mTORC1",0.0134200894672631,0.030433263948248,0.30234697389285,2.00872751403688,65,37,"ATP6V0B, ATP6V0C, ATP6V0D1, ATP6V0E1, ATP6V0E2, ATP6V1A, ATP6V1B2, ATP6V1C1, ATP6V1D, ATP6V1E1, ATP6V1F, ATP6V1G1, ATP6V1G2, ATP6V1H, BMT2"
"27","Amplification  of signal from unattached  kinetochores via a MAD2  inhibitory signal",0.0418334667734187,0.0648912831052243,0.206168675599934,1.54540449288638,208,51,"AHCTF1, CENPC, CENPP, CENPQ, CENPT, CKAP5, CLASP1, CLASP2, CLIP1, DSN1, DYNC1H1, DYNC1I1, DYNC1I2, DYNC1LI1, DYNC1LI2, DYNLL1, DYNLL2, ITGB3BP, KIF18A, KIF2A, MAD1L1, MAPRE1, MIS12, NDE1, NDEL1, NUDC, NUP107, NUP133, NUP160, NUP43, NUP98, PAFAH1B1, PMF1, PPP1CC, PPP2CA, PPP2CB, PPP2R1A, PPP2R1B, PPP2R5A, PPP2R5B, PPP2R5C, PPP2R5D, PPP2R5E, RANBP2, RANGAP1, RCC2"
"28","Amplification of signal from the kinetochores",0.0418334667734187,0.0648912831052243,0.206168675599934,1.54540449288638,208,51,"AHCTF1, CENPC, CENPP, CENPQ, CENPT, CKAP5, CLASP1, CLASP2, CLIP1, DSN1, DYNC1H1, DYNC1I1, DYNC1I2, DYNC1LI1, DYNC1LI2, DYNLL1, DYNLL2, ITGB3BP, KIF18A, KIF2A, MAD1L1, MAPRE1, MIS12, NDE1, NDEL1, NUDC, NUP107, NUP133, NUP160, NUP43, NUP98, PAFAH1B1, PMF1, PPP1CC, PPP2CA, PPP2CB, PPP2R1A, PPP2R1B, PPP2R5A, PPP2R5B, PPP2R5C, PPP2R5D, PPP2R5E, RANBP2, RANGAP1, RCC2"
"29","Amyloid fiber formation",0.424370594159114,0.458087709859427,-0.160569934107737,-1.00984802906665,2106,28,"USP9X, UBC, UBB, TTR, TSPAN5, TSPAN14, SORL1, SNCAIP, SNCA, SIAH2, SIAH1"
"30","Anchoring of the basal body to the plasma membrane",0.0212724049635612,0.0409382847443275,0.214188973868706,1.81568630771065,107,72,"ACTR1A, AHI1, AKAP9, ALMS1, B9D1, C2CD3, CC2D2A, CCP110, CDK5RAP2, CEP162, CEP164, CEP192, CEP250, CEP290, CEP57, CEP63, CEP70, CEP76, CEP78, CEP83, CEP89, CEP97, CKAP5, CLASP1, CNTRL, CSNK1D, CSNK1E, DCTN1, DCTN2, DCTN3, DYNC1H1, DYNC1I2, DYNLL1"
"31","Antigen activates B Cell Receptor (BCR) leading to generation of second messengers",0.886616362192216,0.887742939526641,0.137345679012346,0.64846997644296,4464,16,"AHCYL1, BTK, CALM1, DAPP1, FYN, GRB2, ITPR1, ITPR2, LYN, NCK1, ORAI1, PIK3R1"
"32","Antigen processing-Cross presentation",0.000198807157057654,0.000873517348409267,-0.463132817153067,-3.6694413567136,0,45,"UBC, UBB, TAPBP, TAP2, TAP1, STX4, SNAP23, SEC61A2, SEC61A1, SEC22B, PSMF1, PSME4, PSME3, PSME1, PSMD9, PSMD7, PSMD5, PSMD4, PSMD3, PSMD2, PSMD14, PSMD13, PSMD12, PSMD11, PSMD1, PSMC6, PSMC3, PSMC1, PSMB5, PSMB4, PSMB3, PSMB2, PSMB1, PSMA6, PSMA3, PSMA1"
"33","Antigen processing: Ubiquitination & Proteasome degradation",0.000204457166223676,0.000873517348409267,-0.217202467425631,-3.46799928490306,0,194,"ZNRF2, ZNRF1, ZBTB16, WWP1, WSB1, UFL1, UBR4, UBR2, UBR1, UBOX5, UBE4A, UBE3C, UBE3B, UBE3A, UBE2Z, UBE2W, UBE2V2, UBE2R2, UBE2Q2, UBE2Q1, UBE2O, UBE2N, UBE2M, UBE2K, UBE2J2, UBE2J1, UBE2H, UBE2G2, UBE2G1, UBE2F, UBE2E3, UBE2E2, UBE2E1, UBE2D3, UBE2D2, UBE2D1, UBE2B, UBE2A, UBC, UBB, UBAC1, UBA6, UBA5, UBA3, UBA1, TRIP12, TRIM9, TRIM39, TRIM37, TRIM32, TRIM11, TRAF7, TPP2, STUB1, SPSB4, SPSB1, SMURF2, SKP2, SIAH2, SIAH1, SH3RF1, RNF7, RNF6, RNF41, RNF4, RNF34, RNF25, RNF217, RNF213, RNF182, RNF144B, RNF14, RNF138, RNF130, RNF123, RNF115, RNF114, RNF111, RLIM, RCHY1, RBX1, PSMF1, PSME4, PSME3, PSME1, PSMD9, PSMD7, PSMD5, PSMD4, PSMD3, PSMD2, PSMD14, PSMD13, PSMD12, PSMD11, PSMD1, PSMC6, PSMC3, PSMC1, PSMB5, PSMB4, PSMB3, PSMB2, PSMB1, PSMA6, PSMA3, PSMA1"
"34","Antiviral mechanism by IFN-stimulated genes",0.0225638977635783,0.042435206295226,-0.215516259025598,-1.72554265309815,112,46,"UBE2N, UBE2E1, UBC, UBB, TRIM25, TPR, SEH1L, RANBP2, PPM1B, POM121, POM121C, PLCG1, PDE12, NUP98, NUP93, NUP54, NUP50, NUP43, NUP35, NUP214, NUP210, NUP205, NUP188, NUP160, NUP153, NUP133, NUP107, NEDD4, KPNA4, KPNA3, KPNA2, KPNA1, JAK1, IRF3, FLNB, FLNA, EIF4G3, EIF4G2, EIF4G1, EIF4E2, EIF4E, EIF4A3, EIF4A2, EIF4A1"
"35","Apoptosis",0.000406091370558376,0.00160967438820117,-0.227809474279946,-2.56878254342826,1,94,"YWHAZ, YWHAQ, YWHAH, YWHAG, YWHAE, YWHAB, XIAP, UBC, UBB, TP63, TP53BP2, TRADD, TNFRSF10B, TJP2, TJP1, TFDP2, TFDP1, STK24, STAT3, SPTAN1, SATB1, ROCK1, RIPK1, PTK2, PSMF1, PSME4, PSME3, PSME1, PSMD9, PSMD7, PSMD5, PSMD4, PSMD3, PSMD2, PSMD14, PSMD13, PSMD12, PSMD11, PSMD1, PSMC6, PSMC3, PSMC1, PSMB5, PSMB4, PSMB3, PSMB2, PSMB1, PSMA6, PSMA3, PSMA1, PRKCQ, PRKCD, PPP3R1, PPP3CC, PPP1R13B"
"36","Apoptotic cleavage of cellular proteins",0.51369726054789,0.544077206064164,0.16496118104664,0.910607689858058,2568,23,"ACIN1, ADD1, APC, BCAP31, BIRC2, CASP8, CTNNB1, DBNL, DSP, FNTA, GAS2, GSN"
"37","Apoptotic execution phase",0.47108097327483,0.501637576946711,0.159048386315711,0.940379827464082,2361,27,"ACIN1, ADD1, APC, BCAP31, BIRC2, CASP8, CTNNB1, DBNL, DNM1L, DSP, FNTA, GAS2, GSN, HMGB2, KPNA1, LMNB1, MAPT"
"38","Aquaporin-mediated transport",0.0111977604479104,0.0270200764654448,0.354081543046939,1.95457727623925,55,23,"ADCY1, ADCY2, ADCY3, ADCY5, ADCY7, ADCY8, ADCY9, AQP11, AQP4, GNAS, GNB1, GNB4, GNG12, GNG2, GNG3, GNG7"
"39","Asparagine N-linked glycosylation",0.0530097087378641,0.0786843223022869,0.12345138622916,1.14618784790043,272,186,"ACTR10, ACTR1A, ALG1, ALG11, ALG12, ALG5, ALG6, ALG9, AMFR, ANK1, ANK2, ANK3, ANKRD28, ARF1, ARF3, ARF4, ARF5, ARFGAP2, ARFGAP3, B4GALT4, B4GALT5, B4GALT6, CALR, CANX, CAPZA2, CAPZB, CHST10, CMAS, CNIH1, CNIH2, COG1, COG2, COG3, COG4, COG5, COG6, COG7, COG8, COPA, COPB1, COPB2, COPE, COPG2, COPZ1, COPZ2, CSNK1D, CTSZ, DAD1, DCTN1, DCTN2, DCTN3, DCTN4, DCTN5, DCTN6, DDOST, DERL2, DHDDS, DOLK, DPM2, DPM3, DYNC1H1, DYNC1I1, DYNC1I2, DYNC1LI1, DYNC1LI2, DYNLL1, DYNLL2, EDEM2, EDEM3"
"40","Assembly and cell surface presentation of NMDA receptors",0.00555996822875298,0.016658738967285,0.485576923076923,2.29262440677608,27,16,"APBA1, CAMK2B, CAMK2G, CASK, DLG1, DLG2, DLG4, GRIN1, GRIN2B, GRIN2C, GRIN3A, KIF17, LIN7A, LIN7C, LRRC7"
"41","Assembly of collagen fibrils and other multimeric structures",0.00536139793486894,0.0163346029323361,0.508428300094967,2.40051591106758,26,16,"BMP1, CD151, COL11A1, COL11A2, COL18A1, COL27A1, COL4A1, COL4A5, COL5A1, COL5A2, CTSB, DST"
"42","Assembly of the pre-replicative complex",0.000198491464867011,0.000873517348409267,-0.491155005552911,-3.47406327085506,0,36,"UBC, UBB, PSMF1, PSME4, PSME3, PSME1, PSMD9, PSMD7, PSMD5, PSMD4, PSMD3, PSMD2, PSMD14, PSMD13, PSMD12, PSMD11, PSMD1, PSMC6, PSMC3, PSMC1, PSMB5, PSMB4, PSMB3, PSMB2, PSMB1, PSMA6, PSMA3, PSMA1, ORC6, ORC4, ORC3, ORC2, ORC1"
"43","Association of TriC/CCT with target proteins during biosynthesis",0.00994431185361973,0.0247218218802081,0.381622587826287,2.31424421238443,49,29,"AP3M1, ARFGEF2, CCNE1, CCNE2, CCT2, CCT3, CCT4, CCT5, CCT6A, CCT7, CCT8, DCAF7, FBXL3, FBXL5, FBXO4, FBXW2, FBXW4, FBXW7, GAPDHS, GBA, HDAC3, KIF13A, KIFC3, LONP2"
"44","Asymmetric localization of PCP proteins",0.000199441563621859,0.000873517348409267,-0.535576828875733,-3.67805616046439,0,34,"UBC, UBB, SMURF2, PSMF1, PSME4, PSME3, PSME1, PSMD9, PSMD7, PSMD5, PSMD4, PSMD3, PSMD2, PSMD14, PSMD13, PSMD12, PSMD11, PSMD1, PSMC6, PSMC3, PSMC1, PSMB5, PSMB4, PSMB3, PSMB2, PSMB1, PSMA6, PSMA3, PSMA1, PRICKLE1"
"45","Autodegradation of Cdh1 by Cdh1:APC/C",0.000199004975124378,0.000873517348409267,-0.406129917378578,-2.97782725765829,0,39,"UBE2E1, UBE2D1, UBC, UBB, PSMF1, PSME3, PSME1, PSMD9, PSMD7, PSMD5, PSMD4, PSMD3, PSMD2, PSMD14, PSMD13, PSMD12, PSMD11, PSMD1, PSMC6, PSMC3, PSMC1, PSMB5, PSMB4, PSMB3, PSMB2, PSMB1, PSMA6, PSMA3, PSMA1"
"46","Autodegradation of the E3 ubiquitin ligase COP1",0.000201045436268597,0.000873517348409267,-0.628339735731944,-4.00665810760638,0,29,"UBC, UBB, PSMF1, PSME4, PSME3, PSME1, PSMD9, PSMD7, PSMD5, PSMD4, PSMD3, PSMD2, PSMD14, PSMD13, PSMD12, PSMD11, PSMD1, PSMC6, PSMC3, PSMC1, PSMB5, PSMB4, PSMB3, PSMB2, PSMB1, PSMA6, PSMA3, PSMA1"
"47","Autophagy",0.210761421319797,0.246409495548961,-0.11331711309441,-1.22197982351605,1037,86,"WIPI2, WIPI1, WDR45B, VPS37D, VPS37C, VPS37B, VPS37A, VDAC1, VCP, UVRAG, UBE2N, UBC, UBB, UBAP1, TSG101, TSC1, TOMM7, TOMM40, TOMM20"
"48","Axon guidance",0.0745196972637299,0.10141886259727,0.139029238537619,1.15799313983319,383,314,"ABL1, ABL2, ABLIM1, ABLIM2, ABLIM3, ACTB, ACTR2, ACTR3, ADAM10, AGAP2, AGRN, AKAP5, ALCAM, ANK1, ANK2, ANK3, AP2A1, AP2A2, AP2B1, AP2S1, APH1A, APH1B, ARHGAP35, ARHGAP39, ARHGEF11, ARHGEF12, ARHGEF28, ARHGEF7, ARPC1A, ARPC1B, ARPC2, ARPC3, ARPC5, CACNA1C, CACNA1D, CACNB2, CACNB4, CAP1, CAP2, CASC3, CDC42, CDK5, CDK5R1, CFL1, CHL1, CLASP1, CLASP2, CLTA, CLTB, CLTC, CNTN1, CNTN6, COL4A1, COL4A5, CREB1, CRMP1, CSNK2A1, CSNK2A2, CSNK2B, CUL2, CXCL12, DAB1, DAG1, DCC, DCX, DLG1, DLG4, DNM1, DNM2, DNM3, DOCK1, DOK5, DOK6, DPYSL2, DPYSL3, DSCAM, DSCAML1, EFNA5, EFNB3, EGFR, EIF4A3, EIF4G1, ELOC, ENAH, EPHA1, EPHA3, EPHA4, EPHA5, EPHA6, EPHB1, EPHB2, EPHB3, ETF1, EVL, EZR, FARP2, FAU, FGFR1, FLRT3, FRS2, FYN, GAB1, GAB2, GAP43, GFRA1, GIT1, GRB2, GRIN1, GRIN2B, GSK3B, GSPT1, HSP90AB1, HSPA8, IRS2, ITGA1, ITGA2, ITGA9, ITGAV, ITGB1, ITSN1, KALRN, KCNQ2, KCNQ3, KRAS, L1CAM, LAMB1, LAMC1, LDB1, LIMK2, LYN, LYPLA2, MAGOH, MAP2K1, MAP2K2, MAPK1, MAPK14, MAPK7, MAPK8, MSI1, MYH10, MYH14, MYH9, MYL12B, MYO10, MYO9B, NCAM1, NCAN, NCBP1, NCBP2, NCK1, NCK2, NCSTN, NELL2, NEO1, NFASC, NGEF, NRAS, NRCAM, NRP1, NRP2, NTN1, NTN4, NUMB, PAK1, PAK2, PAK3, PAK5, PFN1, PFN2, PIK3CA, PIK3CB, PIK3R1, PIK3R2, PIP5K1C, PITPNA, PLCG1, PLXNA2, PLXNA4, PLXNB1, PLXNB3, PLXNC1, PPP3CB, PRKACA, PRKACB, PRKAR2A, PRKCA, PRKCQ, PSEN1, PSEN2, PSMA1, PSMA3, PSMA6, PSMB1, PSMB2, PSMB3, PSMB4, PSMB5, PSMC1, PSMC3, PSMC6, PSMD1, PSMD11, PSMD12, PSMD13, PSMD14, PSMD2, PSMD3, PSMD4, PSMD5, PSMD7, PSMD9, PSME1, PSME3, PSME4, PSMF1, PTK2, PTPN11, PTPRA, RAC1, RANBP9, RAP1GAP, RASA1, RBM8A, RBX1, RDX, RGMA, RHOA, RND1, RNPS1, ROBO1, ROBO2, ROCK1, ROCK2, RPL14, RPL22L1, RPL23, RPL29, RPL3, RPL30, RPL32, RPL37A, RPL4, RPL5, RPL6, RPL8, RPLP1, RPS11, RPS15, RPS15A, RPS19, RPS24, RPS25, RPS3A, RPS4X, RPS5, RPS6KA1, RPS6KA2, RPS6KA3, RPS6KA5, RPS7, RPS8, RPS9, RPSA, SCN1A, SCN1B, SCN2A, SCN2B, SCN3A, SCN8A, SDC2, SDCBP, SEMA3E, SEMA4A, SEMA5A, SEMA6A, SEMA6D, SEMA7A, SH3GL2, SH3KBP1, SHC3, SHTN1, SIAH1, SIAH2"
"49","B-WICH complex positively regulates rRNA expression",0.584507042253521,0.608783539836014,-0.149827688651218,-0.892744571647662,2904,25,"ZNRD1, TAF1D, TAF1B, TAF1A, SMARCA5, SF3B1, POLR2L, POLR2K, POLR2E, POLR1E, POLR1D, POLR1B, POLR1A"
"50","BMAL1:CLOCK,NPAS2 activates circadian gene expression",0.240648129625925,0.274827139340912,0.219639251353232,1.16504016713838,1202,21,"ARNTL, ARNTL2, BHLHE40, BHLHE41, CARM1, CHD9, CLOCK, CREBBP, DBP"
"51","Base Excision Repair",0.00140562248995984,0.00494370663277652,-0.397287198427612,-2.22446144713741,6,22,"XRCC1, TINF2, TERF2, TERF1, RPA1, RFC4, RFC3, RFC1, POT1, POLE, POLD4, POLD2, POLB, PCNA, PARP2, PARP1, PARG, MUTYH, MPG, LIG3, LIG1"
"52","Beta-catenin independent WNT signaling",0.00160642570281125,0.00555872995718085,-0.212070971453121,-2.25136893129107,7,83,"UBC, UBB, TNRC6C, TNRC6B, TNRC6A, TCF7L2, TCF7L1, SMURF2, RYK, ROR1, RHOA, RAC3, RAC1, PSMF1, PSME4, PSME3, PSME1, PSMD9, PSMD7, PSMD5, PSMD4, PSMD3, PSMD2, PSMD14, PSMD13, PSMD12, PSMD11, PSMD1, PSMC6, PSMC3, PSMC1, PSMB5, PSMB4, PSMB3, PSMB2, PSMB1, PSMA6, PSMA3, PSMA1, PRKG2, PRKG1, PRKCB, PRKCA, PRICKLE1, PPP3R1, PPP3CB, PPP3CA"
"53","Beta-catenin phosphorylation cascade",0.0376610505450942,0.0598324754627705,0.356913946587537,1.63567643031861,189,15,"AMER1, APC, AXIN1, CSNK1A1, CTNNB1, GSK3B, PPP2CA, PPP2CB, PPP2R1A, PPP2R1B, PPP2R5A, PPP2R5B, PPP2R5C, PPP2R5D, PPP2R5E"
"54","Bile acid and bile salt metabolism",0.20810647307925,0.244855910519076,-0.265321463897132,-1.23060340352587,1031,15,"SLCO1B1, SLCO1B3, SCP2, OSBPL9, OSBPL7, OSBPL6, OSBPL3, OSBPL1A, OSBP, NCOA2, NCOA1"
"55","Biological oxidations",0.0248347686761466,0.0452190918226444,0.222392435819359,1.73375936195227,123,57,"ABHD10, ABHD14B, ACSS1, ACSS2, AHR, AIP, AKR1A1, ALDH2, ARNT, ARNT2, AS3MT, BPHL, BPNT1, CNDP2, COMT, CYB5B, CYP2J2, CYP46A1, CYP4F8, CYP4F2, CYP51A1, CYP7B1, EPHX1, ESD, FDX1, FMO1, GCLC, GCLM, GGT7, GSTA5, GSTK1, GSTM3, GSTZ1"
"56","Biosynthesis of the N-glycan precursor (dolichol lipid-linked oligosaccharide, LLO) and transfer to a nascent protein",0.167703109327984,0.204250463911053,0.17547619047619,1.20006027646956,835,40,"ALG1, ALG11, ALG12, ALG5, ALG6, ALG9, CMAS, DHDDS, DOLK, DPM2, DPM3, FUOM, GFPT1, GFPT2, GLB1, GMDS, GMPPA, GNPNAT1, MPDU1, NAGK, NEU1, NEU4, NUS1, PMM1, PMM2, RFT1, SLC17A5, SLC35A1, ST3GAL2, ST3GAL3, ST3GAL4, ST3GAL5, ST3GAL6, ST6GAL1, ST6GALNAC3, ST6GALNAC5, ST6GALNAC6, ST8SIA1, ST8SIA4, ST8SIA5"
"57","Branched-chain amino acid catabolism",0.00613739853494358,0.0177804045791748,0.464980340943216,2.25097305398721,30,17,"ACADSB, ACAT1, ALDH6A1, AUH, BCAT1, BCAT2, BCKDHA, BCKDHB, DBT, DLD, HIBADH, HIBCH, HSD17B10, IVD, MCCC1, MCCC2"
"58","Budding and maturation of HIV virion",0.00221372509559267,0.00739159057341961,-0.470975783475784,-2.2588765485587,10,16,"VPS4B, VPS37D, VPS37C, VPS37B, VPS37A, UBC, UBB, UBAP1, TSG101"
"59","C-type lectin receptors (CLRs)",0.000202101859337106,0.000873517348409267,-0.265951471494386,-2.757278416209,0,79,"UBE2N, UBE2M, UBE2D2, UBE2D1, UBC, UBB, UBA3, TRAF6, TAB2, TAB1, SRC, RPS6KA5, RELB, RAF1, PSMF1, PSME4, PSME3, PSME1, PSMD9, PSMD7, PSMD5, PSMD4, PSMD3, PSMD2, PSMD14, PSMD13, PSMD12, PSMD11, PSMD1, PSMC6, PSMC3, PSMC1, PSMB5, PSMB4, PSMB3, PSMB2, PSMB1, PSMA6, PSMA3, PSMA1, PRKCD, PRKACB, PRKACA, PPP3R1, PPP3CB, PPP3CA, PDPK1, PAK3, PAK2, PAK1, NRAS, NFKBIA, NFKB2, NFKB1, NFATC3, NFATC2, NFATC1"
"60","CD209 (DC-SIGN) signaling",0.178790882061447,0.215094984831176,0.274183976261128,1.25653892718191,901,15,"CREBBP, EP300, FYN, KRAS, LYN, NFKB1, NRAS, PAK1, PAK2, PAK3, PRKACA, PRKACB, RAF1, RELB, RPS6KA5"
"61","CD28 co-stimulation",0.287142571485703,0.321403901037974,-0.197844941138793,-1.1338713442981,1435,23,"YES1, THEM4, SRC, RICTOR, RAC1, PRR5, PIK3R2, PIK3R1, PIK3CA, PDPK1, PAK3, PAK2, PAK1, MTOR, MAPKAP1, MAP3K14, LYN"
"62","CDK-mediated phosphorylation and removal of Cdc6",0.000199401794616152,0.000873517348409267,-0.376824413976117,-2.8761097287983,0,42,"UBE2E1, UBE2D1, UBC, UBB, PSMF1, PSME4, PSME3, PSME1, PSMD9, PSMD7, PSMD5, PSMD4, PSMD3, PSMD2, PSMD14, PSMD13, PSMD12, PSMD11, PSMD1, PSMC6, PSMC3, PSMC1, PSMB5, PSMB4, PSMB3, PSMB2, PSMB1, PSMA6, PSMA3, PSMA1"
"63","CDT1 association with the CDC6:ORC:origin complex",0.000198925800676348,0.000873517348409267,-0.574640180801713,-3.89415835421047,0,33,"UBC, UBB, PSMF1, PSME4, PSME3, PSME1, PSMD9, PSMD7, PSMD5, PSMD4, PSMD3, PSMD2, PSMD14, PSMD13, PSMD12, PSMD11, PSMD1, PSMC6, PSMC3, PSMC1, PSMB5, PSMB4, PSMB3, PSMB2, PSMB1, PSMA6, PSMA3, PSMA1, ORC6, ORC4, ORC3, ORC2, ORC1"
"64","CLEC7A (Dectin-1) signaling",0.000202265372168285,0.000873517348409267,-0.298084959816303,-2.79880304416445,0,65,"UBE2N, UBE2M, UBE2D2, UBE2D1, UBC, UBB, UBA3, TRAF6, TAB2, TAB1, SRC, RELB, PSMF1, PSME4, PSME3, PSME1, PSMD9, PSMD7, PSMD5, PSMD4, PSMD3, PSMD2, PSMD14, PSMD13, PSMD12, PSMD11, PSMD1, PSMC6, PSMC3, PSMC1, PSMB5, PSMB4, PSMB3, PSMB2, PSMB1, PSMA6, PSMA3, PSMA1, PRKCD, PPP3R1, PPP3CB, PPP3CA, PDPK1, NFKBIA, NFKB2, NFKB1, NFATC3, NFATC2, NFATC1"
"65","COPI-dependent Golgi-to-ER retrograde traffic",0.0193042429117233,0.0386084858234466,0.256281287246722,1.90098933778517,95,50,"ARF1, ARF3, ARF4, ARF5, ARFGAP2, ARFGAP3, COPA, COPB1, COPB2, COPE, COPG2, COPZ1, COPZ2, GBF1, KDELR1, KIF13B, KIF16B, KIF18A, KIF19, KIF1A, KIF1B, KIF1C, KIF21A, KIF21B, KIF2A, KIF3A, KIF3B, KIF3C, KIF5A, KIF5B, KIF5C, KIF9, KIFAP3, KLC1"
"66","COPI-independent Golgi-to-ER retrograde traffic",0.00954653937947494,0.0245011543215155,0.41049282753701,2.48931976423071,47,29,"ACTR10, ACTR1A, AGPAT3, BICD1, CAPZA2, CAPZB, DCTN1, DCTN2, DCTN3, DCTN4, DCTN5, DCTN6, DYNC1H1, DYNC1I1, DYNC1I2, DYNC1LI1, DYNC1LI2, DYNLL1, DYNLL2"
"67","COPI-mediated anterograde transport",0.0188,0.038047317730172,0.407747214121811,3.28200463598872,93,63,"ACTR10, ACTR1A, ANK1, ANK2, ANK3, ARF1, ARF3, ARF4, ARF5, ARFGAP2, ARFGAP3, CAPZA2, CAPZB, COG1, COG2, COG3, COG4, COG5, COG6, COG7, COG8, COPA, COPB1, COPB2, COPE, COPG2, COPZ1, COPZ2, DCTN1, DCTN2, DCTN3, DCTN4, DCTN5, DCTN6, DYNC1H1, DYNC1I1, DYNC1I2, DYNC1LI1, DYNC1LI2, DYNLL1, DYNLL2"
"68","COPII-mediated vesicle transport",0.000596421471172962,0.0023207299893486,-0.31324200913242,-2.48184352392949,2,45,"USO1, TRAPPC9, TRAPPC6B, TRAPPC4, TRAPPC3, TRAPPC10, TRAPPC1, TMED2, TMED10, TGFA, TFG, TBC1D20, STX5, STX17, SEC31A, SEC24D, SEC24B, SEC24A, SEC23IP, SEC23A, SEC22B, SEC22A, SEC16A, SCFD1, SAR1B, RAB1B, RAB1A, PREB, PPP6R3, PPP6C"
"69","CREB1 phosphorylation through NMDA receptor-mediated activation of RAS signaling",0.0820985182218662,0.110023184283725,0.274465558194774,1.43304756600118,409,20,"CALM1, CAMK2B, CAMK2G, CREB1, DLG1, DLG2, DLG4, GRIN1, GRIN2B, KRAS, LRRC7, MAPK1, NEFL, NRAS, PDPK1, RASGRF1, RASGRF2, RPS6KA1, RPS6KA2, RPS6KA3"
