"","pathway","pval","padj","ES","NES","nMoreExtreme","size","leadingEdge"
"424","Interleukin-1 family signaling",0.595652923926169,0.94466610522828,-0.27213157870942,-0.934501497615094,3452,117,"TBK1, PTPN5, PSMD4, PSMD3, PTPN13, MAP3K7, PSMC3, PTPN2, IKBKB, PSMC6, PSMC2, UBB, PSMB4, PSMD12, PSME4, PSME3, PSMD13, STAT3, PELI3, PTPN11, PSMA3, PSMC5, IL1R2, PSMB1, PSMA1, NKIRAS1, PTPN14, S100B, PSMB8, PSMD2, PSMD6, IRAK2, TAB3, UBE2N, MAP2K4, IKBKG, PSME1, PSMB7, SQSTM1, PSMA4"
"425","Interleukin-1 signaling",0.349401829697396,0.82107542794661,-0.319212574817845,-1.05595567298864,1985,91,"PSMD4, PSMD3, MAP3K7, PSMC3, IKBKB, PSMC6, PSMC2, UBB, PSMB4, PSMD12, PSME4, PSME3, PSMD13, PELI3, PSMA3, PSMC5, IL1R2, PSMB1, PSMA1, NKIRAS1, S100B, PSMB8, PSMD2, PSMD6, IRAK2, TAB3, UBE2N, MAP2K4, IKBKG, PSME1, PSMB7, SQSTM1, PSMA4"
"426","Interleukin-10 signaling",0.861775362318841,0.990941572957721,-0.282073129415421,-0.720052105321007,4756,23,"TYK2, STAT3, IL1R2"
"427","Interleukin-12 family signaling",0.510509440684004,0.903967338244431,-0.324248886934317,-0.963935218589035,2865,49,"TYK2, CANX, HSPA9, PAK2, PITPNA, STAT3, LMNB1, RALA, PPIA, GSTO1, CDC42, LCP1, BOLA2, PDCD4, CNN2"
"428","Interleukin-12 signaling",0.720122390208783,0.981202536491651,-0.292814674937166,-0.838684029777487,4000,40,"TYK2, HSPA9, PAK2, PITPNA, LMNB1, RALA, PPIA, GSTO1, CDC42, LCP1, BOLA2, PDCD4, CNN2"
"429","Interleukin-17 signaling",0.124942686840899,0.571802122703501,0.388826358854841,1.25517974153887,544,64,"RPS6KA5, MAP2K6, RPS6KA3, MEF2C, ATF1, TNIP2, RPS6KA2, BTRC, CREB1, ATF2, PPP2R1A, TAB2, MAPKAPK2, MEF2A, MAPK8"
"430","Interleukin-2 family signaling",0.639834323788943,0.960735708407192,-0.323305516009208,-0.880256060681277,3552,31,"CSF2RA, SOS2, STAT3, STAT5B, PIK3R3, PIK3CD"
"431","Interleukin-20 family signaling",0.215258855585831,0.6935261370686,-0.525835639972111,-1.22959735001614,1184,15,"TYK2, STAT3, STAT5B, PTPN11, STAT2"
"432","Interleukin-3, Interleukin-5 and GM-CSF signaling",0.777558702276394,0.990099867216044,-0.286128013252348,-0.79884338975399,4337,35,"CSF2RA, FYN, TEC, STAT5B, PIK3R3, PTPN11, PIK3CD, CBL, PRKACA"
"433","Interleukin-37 signaling",0.472393752270251,0.884778564696946,-0.412509909945198,-0.990613864246829,2600,17,"TBK1, PTPN5, PTPN13, PTPN2, STAT3, PTPN11"
"434","Interleukin-4 and Interleukin-13 signaling",0.850449180905408,0.990941572957721,-0.248553138187426,-0.798683488118709,4827,76,"POMC, TYK2, BCL2L1, STAT3, FSCN1, HIF1A"
"435","Interleukin-6 family signaling",0.532328369051943,0.919891152850601,-0.392359839125476,-0.942224870338238,2930,17,"TYK2, STAT3, PTPN11, CBL"
"436","Interleukin-7 signaling",0.19133115705477,0.674074074074074,-0.509338066687176,-1.25284201664612,1054,19,"IRS1, BRWD1, STAT3, STAT5B, PIK3R3"
"437","Intra-Golgi and retrograde Golgi-to-ER traffic",0.0291958625291959,0.457547099338144,-0.370583966098385,-1.33906750149039,174,171,"MAN1A1, USP6NL, KIF5C, MAN2A1, GALNT2, KIFAP3, KIF26B, GCC2, CAPZA2, KIFC2, GALNT1, KIF21A, ARFRP1, KIF5A, RAB30, ARFGAP1, COG1, DCTN1, GOLGA1, KIF1C, CAPZB, STX6, RAB9B, VAMP4, ARF4, DCTN2, KIF1B, NAA35, DYNLL1, TMED7, COPG1, DCTN5, CYTH1, MAN2A2, TMF1, KIF21B, COG8, PAFAH1B1, TGOLN2, RAB3GAP1, BICD1, YKT6, COG3, GBF1, ARFIP2, RIC1"
"438","Intra-Golgi traffic",0.141979768786127,0.616027922419147,-0.440697989097352,-1.26689190947334,785,41,"MAN1A1, MAN2A1, RAB30, COG1, STX6, CYTH1, MAN2A2, COG8, YKT6, COG3, RIC1, COG7, COG2, COG5, CYTH4, VPS45"
"439","Intracellular signaling by second messengers",0.269988783848742,0.757056336418695,-0.281872332199197,-1.07462853949459,1684,282,"PRKCA, FGFR2, ADCY2, FGF1, PRKCD, HDAC3, RPS6KB2, IRS1, PLCG1, EED, CAMK2A, CAMKK2, USP13, PSMD4, RCOR1, MET, CHD3, PSMD3, PDGFA, PSMC3, FYN, TNKS2, PHC3, PSMC6, PSMC2, PIP5K1A, UBB, PSMB4, FRS2, PSMD12, PIP5K1B, LAMTOR1, PSME4, AHCYL1, TNRC6B, PPP2CB, PIP5K1C, PSME3, MTA3, TNRC6C, PSMD13, PDGFB, KDM1A, NR4A1, PRKX, PIK3R3, HDAC5, PTPN11, PSMA3, MDM2, RPTOR, PHLPP1, OTUD3, MOV10, RNF2, PRKAR2A, PIP4K2B, AKT2, PIK3CD, PSMC5, MAF1, NRG3, PDPK1, PSMB1, JUN, RNF146, PSMA1, GATAD2B, PPP2R5D, CASP9, CALM1, SCMH1, PSMB8, PRKACA, PSMD2, PSMD6"
"440","Intraflagellar transport",0.534412955465587,0.919891152850601,0.322407606611019,0.950170881977013,2375,40,"CLUAP1, IFT43, IFT140, KIF17, DYNC2H1, DYNLRB1, IFT22, TNPO1, TRIP11, WDR19, TCTEX1D2, KIF3C, TCTE3"
"441","Intrinsic Pathway for Apoptosis",0.979180658159839,0.999106145251397,0.207538728235508,0.628934914639744,4373,46,"YWHAB, YWHAZ, YWHAH, NMT1, UACA, CASP3, MAPK8"
"442","Inwardly rectifying K+ channels",0.592815707273539,0.944585211587695,0.343843690128421,0.904987304628256,2656,23,"GNG7, KCNJ9, GNG3, KCNJ4, GNB1"
"443","Ion channel transport",0.00202088245200404,0.163225121123403,-0.441011378652026,-1.56787414911891,11,151,"ANO1, TRPC4, ANO2, TRPM3, TRPC3, ASIC2, TRPC6, RYR3, RYR2, TRPM7, ATP13A2, CAMK2A, ATP2B2, TRPC1, ATP2A2, ATP6V0C, TRPV2, NEDD4L, TRPC4AP, CLCN3, UBB, ATP9A, ATP6V1G1, ATP6V1B2, FXYD4, ATP2B3, TTYH1, TRPC5"
"444","Ion homeostasis",0.0422761327149483,0.498682950191571,-0.486331474244266,-1.43962208087325,236,48,"SLC8A1, SLC8A3, RYR3, RYR2, CAMK2A, ATP2B2, TRPC1, ATP2A2"
"445","Ion transport by P-type ATPases",0.963041933191187,0.999106145251397,-0.222527172456828,-0.667053760574586,5419,51,"ATP13A2, CAMK2A, ATP2B2, ATP2A2, ATP9A, FXYD4, ATP2B3, CALM1, ATP10D, ATP1B3, ATP2C1, PLN, ATP2B4, ATP1B2"
"446","Iron uptake and transport",0.522259967816914,0.912416454068186,-0.314753339535505,-0.954677464967507,2920,55,"ATP6V0C, SLC11A2, UBB, TF, ATP6V1G1, ATP6V1B2, ATP6V0A1, ATP6V0B, ATP6V0A2, SLC22A17, IREB2, ATP6V1E1, FTH1, GLRX3, FLVCR1"
"447","JNK (c-Jun kinases) phosphorylation and  activation mediated by activated human TAK1",0.518261504747991,0.91032147849527,-0.405197295590933,-0.959389461100309,2837,16,"MAP3K7, MAPK10, IRAK2, TAB3, UBE2N, MAP2K4, IKBKG"
"448","KSRP (KHSRP) binds and destabilizes mRNA",0.921110299488678,0.990941572957721,-0.266626225826126,-0.631293431357887,5043,16,"KHSRP, MAPK11"
"449","Keratan sulfate biosynthesis",0.327978580990629,0.808397910892396,0.418450522622292,1.10135047249754,1469,23,"ST3GAL4, CHST1, ST3GAL3, ST3GAL6"
"450","Keratan sulfate/keratin metabolism",0.324318283415288,0.803146692419936,0.400244289128485,1.09646541859112,1450,28,"ST3GAL4, CHST1, HEXB, ST3GAL3, ST3GAL6"
"451","Keratinization",0.849120433017591,0.990941572957721,0.254424402884176,0.774566216981308,3764,47,"PKP2, KRT12, PCSK6, KAZN, JUP, DSG2, KRT1, KRT77, KRT2, KRT24, KRT20, TGM5, DSG3, PKP4, TCHH, KRT10"
"452","Kinesins",0.236794825727632,0.722774904110505,-0.409915128188761,-1.16711650759537,1317,39,"KIF5C, KIFAP3, KIF26B, KIFC2, KIF21A, KIF5A, KIF1C"
"453","L13a-mediated translational silencing of Ceruloplasmin expression",0.466927863563033,0.884778564696946,0.295696406112557,0.989874885134993,2025,79,"RPL26, RPS24, RPL36, RPL32, RPL4, RPS8, RPL23, RPS9, EIF4A1, RPS5, EIF3F, RPL28, RPL37A, EIF1AX, RPS19, RPS25, RPLP1, RPS14, RPS21, RPL11, RPSA, RPL14, FAU"
"454","L1CAM interactions",0.0365541327124563,0.475067246016967,0.396258424266432,1.36638083786359,156,93,"KCNQ3, RPS6KA5, DLG1, RPS6KA3, SH3GL2, CNTN6, SCN3A, GAP43, ANK2, SPTB, ALCAM, RPS6KA6, NCAM1, SPTBN2, SCN2A, CHL1, SHTN1, SRC, ITGAV, RPS6KA2"
"455","LDL clearance",0.66764061358656,0.966775750180265,-0.358855344408305,-0.849665185900992,3655,16,"AP2A1, AP2B1, AP2S1, CLTC, LDLR, AP2A2, NPC1, AP2M1"
"456","Lagging Strand Synthesis",0.235071301247772,0.722002183461548,0.476147949481063,1.19490380000653,1054,19,"POLA1, PRIM1, RFC2, PRIM2, RFC4"
"457","Laminin interactions",0.911689730517116,0.990941572957721,-0.266032479294671,-0.66622990565313,5006,21,"LAMA3"
"458","Late Phase of HIV Life Cycle",0.856246985045827,0.990941572957721,0.232431520253821,0.841288872951516,3549,130,"GTF2A2, TAF1, TAF1L, CCNK, NELFA, NUP54, GTF2H1, NUP133, NUP88, TAF3, NUP35, NMT1, POLR2D, POLR2K, CHMP3, TCEA1, VPS4B, VTA1, TAF9, POLR2H, RNGTT, NELFCD, TAF6, XPO1, CCNT1, UBAP1, GTF2B, CCNH, VPS4A, ERCC2, RNMT, TAF12, CHMP4B"
"459","Late endosomal microautophagy",0.510526315789474,0.903967338244431,-0.358807393216379,-0.962952457689413,2812,29,"VPS37A, UBB, HDAC6, VPS37D, MVB12B, VPS37B, IFT88, TSG101, PCNT"
"460","Listeria monocytogenes entry into host cells",0.907145447950671,0.990941572957721,-0.268706735797871,-0.667953101031784,5001,20,"EPS15, MET, UBB, SH3GL1, CTNNB1, CBL, STAM, STAM2, SH3GL3"
"461","Long-term potentiation",0.0167037861915367,0.446408190284879,0.626254932357993,1.62814100508709,74,22,"NRG1, ERBB4, GRIN2A, DLG1, LRRC7, SRC, GRIN1, NRGN, CAMK2G"
"462","Loss of Nlp from mitotic centrosomes",0.558333333333333,0.926440843122684,-0.300662118769001,-0.939607124355552,3148,64,"ALMS1, MAPRE1, CEP135, DCTN1, ODF2, CSNK1E, FGFR1OP, CEP76, DCTN2, DYNLL1, AKAP9, CKAP5, HAUS1, PAFAH1B1, CNTRL, CEP70, PRKACA, CEP250, SFI1, DYNC1H1, PCNT, CEP78, CEP41, TUBB, TUBB4A"
"463","Loss of proteins required for interphase microtubule organization from the centrosome",0.558333333333333,0.926440843122684,-0.300662118769001,-0.939607124355552,3148,64,"ALMS1, MAPRE1, CEP135, DCTN1, ODF2, CSNK1E, FGFR1OP, CEP76, DCTN2, DYNLL1, AKAP9, CKAP5, HAUS1, PAFAH1B1, CNTRL, CEP70, PRKACA, CEP250, SFI1, DYNC1H1, PCNT, CEP78, CEP41, TUBB, TUBB4A"
"464","Lysosome Vesicle Biogenesis",0.159167985530183,0.624215965367603,0.433553707581427,1.2437136968891,703,35,"SH3GL2, AP4S1, AP1M1, AP1G1, CLVS1, CTSZ, AP1S1"
"465","M Phase",0.309299728824374,0.791545935789646,-0.276130395412746,-1.05674945418126,1938,296,"PRKCA, LPIN2, PRKCB, ALMS1, SMC3, PSMD4, LEMD3, MAPRE1, PSMD3, UBE2D1, PPP2R2D, WAPL, PSMC3, CEP135, USO1, KMT5A, DCTN1, ODF2, PSMC6, ANAPC2, RANGAP1, ENSA, PSMC2, RAE1, UBB, PSMB4, RAB2A, TUBGCP6, PSMD12, PSME4, PPP2CB, CSNK1E, FGFR1OP, PSME3, PSMD13, CEP76, DCTN2, LMNB1, MAU2, DYNLL1, NUDC, AKAP9, NUP155, PHF8, PSMA3, CKAP5, AHCTF1, NIPBL, NUP210, HAUS1, TUBGCP4, TAOK1, PSMC5, PTTG1, PSMB1, PAFAH1B1, PPP1CC, CNTRL, PSMA1, CEP70, CDC23, NUP50, PPP2R5D, SEH1L, PSMB8, PRKACA, PSMD2, PSMD6, NCAPD2, NCAPD3, GORASP2, CEP250, TUBGCP5, NCAPH2, ANAPC1, ARPP19, ANAPC10, NUP153, SFI1, DYNC1H1, PSME1, DYNLL2, DYNC1LI2, PSMB7, PCNT, CSNK2A1"
"466","MAP kinase activation",0.115517638920913,0.55790629693632,0.396881669102691,1.26346692994705,500,60,"RPS6KA5, MAP2K6, RPS6KA3, MEF2C, ATF1, TNIP2, RPS6KA2, BTRC, CREB1, ATF2, PPP2R1A, TAB2, MAPKAPK2, MEF2A, MAPK8"
"467","MAP2K and MAPK activation",0.0614113443501563,0.524922326529249,0.499887812549768,1.42139438787594,274,33,"CNKSR2, YWHAB, RAF1, SRC, IQGAP1, HRAS, BRAF, MAP2K2, NRAS, RAP1A, VCL, APBB1IP, RAP1B, MAPK1, MAP2K1, IL17RD"
"468","MAP3K8 (TPL2)-dependent MAPK1/3 activation",0.897552958363769,0.990941572957721,-0.27794600185989,-0.658095371911245,4914,16,"IKBKB, UBB, MAP2K4, IKBKG"
"469","MAPK family signaling cascades",0.357916868833899,0.825963624228266,-0.274756421742599,-1.03759571608653,2212,254,"RASAL2, GFRA1, FGFR2, GFRA2, CSF2RA, FGF1, IRS1, CAMK2A, TYK2, PSMD4, RASGRF2, MET, PSMD3, PDGFA, SPTBN1, PSMC3, FYN, KALRN, PAK2, PSMC6, PSMC2, TLN1, UBB, PSMB4, SHC3, FRS2, PSMD12, PSME4, TNRC6B, PPP2CB, PSME3, SPRED1, TNRC6C, PHB, PSMD13, PDGFB, KSR2, RASGRF1, DLG4, SYNGAP1, PPP5C, PTPN11, PSMA3, RASA4, MOV10, KSR1, PSMC5, NCOA3, NRG3, PSMB1, JUN, PSMA1, PPP2R5D, CALM1, SPRED3, PSMB8, PRKACA, PSMD2, PSMD6, DLG3, CDC42, NEFL, NRG2"
"470","MAPK targets/ Nuclear events mediated by MAP kinases",0.0602868668758404,0.524922326529249,0.513246160499048,1.43017821893362,268,30,"RPS6KA5, RPS6KA3, MEF2C, ATF1, RPS6KA2, CREB1, ATF2, PPP2R1A, MAPKAPK2, MEF2A, MAPK8"
"471","MAPK1/MAPK3 signaling",0.36176519018607,0.831189167823573,-0.278848355125623,-1.03525417750868,2196,221,"RASAL2, GFRA1, FGFR2, GFRA2, CSF2RA, FGF1, IRS1, CAMK2A, TYK2, PSMD4, RASGRF2, MET, PSMD3, PDGFA, SPTBN1, PSMC3, FYN, PSMC6, PSMC2, TLN1, UBB, PSMB4, SHC3, FRS2, PSMD12, PSME4, PPP2CB, PSME3, SPRED1, PHB, PSMD13, PDGFB, KSR2, RASGRF1, DLG4, SYNGAP1, PPP5C, PTPN11, PSMA3, RASA4, KSR1, PSMC5, NRG3, PSMB1, PSMA1, PPP2R5D, CALM1, SPRED3, PSMB8, PSMD2, PSMD6"
"472","MAPK6/MAPK4 signaling",0.0768011273559979,0.528763106094083,-0.403970537061081,-1.30763658261048,435,80,"PSMD4, PSMD3, PSMC3, KALRN, PAK2, PSMC6, PSMC2, UBB, PSMB4, PSMD12, PSME4, TNRC6B, PSME3, TNRC6C, PSMD13, PSMA3, MOV10, PSMC5, NCOA3, PSMB1, JUN, PSMA1, PSMB8, PRKACA, PSMD2, PSMD6, CDC42, PSME1, CDC42EP2, PSMB7, AGO3, PSMA4"
"473","MECP2 regulates neuronal receptors and channels",0.471307829181495,0.884778564696946,0.401830043440869,0.984855833238438,2118,17,"GRIN2A, OPRM1, PTPN4, GPRIN1, CREB1"
"474","MET activates PTK2 signaling",0.519796585543044,0.91110863261209,-0.396596584041012,-0.952399118644574,2861,17,"LAMA3, MET"
"475","MET promotes cell motility",0.886034732272069,0.990941572957721,-0.263549087964118,-0.702921249091896,4897,28,"LAMA3, MET"
"476","MHC class II antigen presentation",0.496658459373901,0.897323528803946,-0.295480108750136,-0.973701184324428,2823,89,"KIF5C, SAR1B, KIFAP3, SEC24A, CAPZA2, CANX, AP2A1, KIF5A, DCTN1, CAPZB, AP2B1, DCTN2, DYNLL1, AP2S1, DCTN5, DNM2, CTSC, ACTR1B, CLTC, AP2A2, DNM3, KIF3A, DYNC1H1, DYNLL2, DYNC1LI2, KIF3B, DYNC1LI1, KLC2, SEC24B, KIF20A, AP2M1"
"477","Macroautophagy",0.722289890377588,0.982389099606823,-0.260785465445035,-0.875092464801111,4150,100,"ATG3, UBB, HDAC6, LAMTOR1, RB1CC1, ATG4B, ULK1, GABARAPL1, DYNLL1, RPTOR, PRKAG1, GABARAPL2, TOMM20, TOMM22, ATG14, WIPI1, WIPI2, AMBRA1, WDR45B, UBE2N, ATG5, MFN2, ATG13, ATG10, DYNC1H1, IFT88, DYNLL2, DYNC1LI2, PCNT, CSNK2A1, SQSTM1, CSNK2B, ATG101, MTERF3, RRAGD, DYNC1LI1, CFTR, FUNDC1, PRKAB2, ATG4D"
"478","Major pathway of rRNA processing in the nucleolus and cytosol",0.380298946336682,0.83619643727818,0.277838934483049,1.02294178910434,1551,149,"RPL26, SENP3, BMS1, RPS24, NOL11, IMP3, RPL36, CSNK1D, RPL32, RPL4, RIOK3, ISG20L2, RIOK2, RBM28, RPS8, RPL23, RPS9, RPP14, RPS5, RCL1, TSR1, UTP14A, UTP14C, RPL28, RPL37A, PES1, RPP30, EXOSC1, RPS19, RPS25, EXOSC3, RPLP1, RPS14, RPS21, EXOSC7, RPL11, RPSA, MPHOSPH6, RPL14, NOP14, FAU"
"479","Meiosis",0.581041145714935,0.939131640777966,0.294974987832689,0.929214579545485,2555,56,"SYNE1, ATM, STAG2, H3-3A, UBE2I, SUN1, RAD21, LMNA, MLH3, SYCE2, BLM"
"480","Meiotic recombination",0.787472035794183,0.990099867216044,0.290578325181613,0.782652345222252,3519,26,"ATM, H3-3A, MLH3, BLM"
"481","Meiotic synapsis",0.680152843335581,0.967503093445832,0.307082066983998,0.860145095214674,3025,31,"SYNE1, STAG2, UBE2I, SUN1, RAD21, LMNA, SYCE2, TERF1"
"482","Metabolic disorders of biological oxidation enzymes",0.151251360174102,0.624215965367603,-0.524263893423696,-1.3032188878018,833,20,"POMC"
"483","Metabolism of amino acids and derivatives",0.321588010204082,0.803146692419936,-0.274301814265682,-1.04996124205628,2016,297,"DDO, SERINC5, PYCR2, DLST, PSPH, TPH1, PSMD4, GLS, PSMD3, OAZ2, ODC1, RPL8, PSMC3, BCAT1, PSMC6, MTR, PSMC2, TMLHE, SRR, PSMB4, PSMD12, DLAT, SEPSECS, PSME4, ASNS, PDHX, PSME3, KYAT1, SLC6A8, CKB, PSMD13, DLD, GLS2, SLC25A13, GOT1, RPS15A, GPT2, ACAT1, PSMA3, PSTK, AANAT, SLC3A2, PIPOX, ASS1, DHTKD1, GLUD2, GLUD1, PSMC5, RPL34, PSMB1, GATM, PSMA1, AUH, SEPHS2, MRI1, GSR, PRODH, PSMB8, PSMD2, PSMD6"
"484","Metabolism of carbohydrates",0.440938722294654,0.867014341590613,0.254342004558784,1.00241486642768,1690,258,"CHST9, CSGALNACT1, CHSY3, B3GALT1, NDST3, FUT9, CHST11, EXT1, GLCE, XYLT1, ST3GAL4, NUP54, PGM2L1, GPI, CHST1, HS3ST5, ARSB, NUP133, NUP88, NUP35, PFKFB4, ALDOC, SORD, GYS1, HEXB, PAPSS1, ENO1, PHKA2, PRKACB, CHPF2, RBKS, B3GALT5, TKT, PPP2R1A, ST3GAL3, MANBA, PFKFB2, PFKM, GBE1, AKR1A1, ST3GAL6, PKM"
"485","Metabolism of cofactors",0.601162368325463,0.94466610522828,-0.371657167284568,-0.892508843503195,3309,17,"PDSS2, PDSS1, GCH1, PRKG2, CALM1"
"486","Metabolism of fat-soluble vitamins",0.285765765765766,0.76536328303296,-0.400922132667201,-1.12540556899569,1585,36,"GPC6, TTR, GPC5, AGRN, GPC3, LRP1, GPC1, LRP8, GPC4, LDLR, RBP1"
"487","Metabolism of folate and pterines",0.888848528877588,0.990941572957721,-0.279226609003596,-0.670543285086988,4893,17,"MTHFD1L, MTHFS, SLC25A32, MTHFD2"
"488","Metabolism of non-coding RNA",0.895396536007293,0.990941572957721,0.2425383578139,0.742914389834777,3928,49,"NUP54, GEMIN5, NUP133, NUP88, GEMIN8, NUP35, DDX20"
"489","Metabolism of nucleotides",0.0304226660473758,0.465255482396474,0.410641879710969,1.39932048937058,130,87,"DPYD, ADK, AK5, GDA, GMPS, ITPA, AK2, NT5C3A, ENTPD3, CTPS2, UCK2, GLRX, DTYMK, HPRT1, NUDT13, DUT, NT5E, GMPR2"
"490","Metabolism of polyamines",0.0535427449580582,0.524922326529249,-0.460876334804783,-1.40370316310531,299,56,"PSMD4, PSMD3, OAZ2, ODC1, PSMC3, PSMC6, PSMC2, PSMB4, PSMD12, PSME4, PSME3, PSMD13, PSMA3, PSMC5, PSMB1, PSMA1, PSMB8, PSMD2, PSMD6, PSME1, PSMB7, PSMA4, SMS"
"491","Metabolism of porphyrins",0.839572192513369,0.990941572957721,0.286156279865618,0.72696647110738,3767,20,"CPOX, FECH, ALAS1, ALAS2, HMOX2"
"492","Metabolism of steroid hormones",0.0507798331519768,0.524922326529249,-0.603293149563012,-1.48394760879228,279,19,"POMC, HSD17B12, STARD3NL, SRD5A1, TSPOAP1"
"493","Metabolism of steroids",0.262786292405717,0.756520983449543,-0.321295313709011,-1.10086048973196,1525,115,"POMC, OSBPL6, SAR1B, SEC24A, NCOA1, CHD9, HSD17B12, STARD3NL, SMARCD3, OSBPL9, ELOVL6, MTF1, SQLE, CARM1, SRD5A1, CYP51A1, ACACA, KPNB1, TSPOAP1, MBTPS2, SC5D, SREBF2"
"494","Metabolism of vitamins and cofactors",0.0689189189189189,0.524922326529249,-0.355818513967507,-1.26845020806621,407,155,"GPC6, TTR, PDSS2, GPC5, PDSS1, AGRN, NADK2, NAXD, ENPP2, PPCDC, GPHN, ENPP1, GPC3, NMRK1, MTR, LRP1, ABCC1, GCH1, MMADHC, PARP6, MTHFD1L, PC, PARP8, PDXK, NADK, ACACA, PRKG2, LMBRD1, MOCS1, GPC1, MTHFS, LRP8, GPC4, MMAB, PARP9, CALM1, NAMPT, LDLR, PPCS, GSTO1, RBP1, PANK2, CYB5R3"
"495","Metabolism of water-soluble vitamins and cofactors",0.208861859252824,0.691813729386324,-0.339256604149893,-1.14246135764822,1201,103,"NADK2, NAXD, ENPP2, PPCDC, GPHN, ENPP1, NMRK1, MTR, ABCC1, MMADHC, PARP6, MTHFD1L, PC, PARP8, PDXK, NADK, ACACA, LMBRD1, MOCS1, MTHFS, MMAB, PARP9, NAMPT, PPCS, GSTO1, PANK2, CYB5R3"
"496","Metal ion SLC transporters",0.741856314145471,0.986393368078632,0.308989627592289,0.813252353499334,3324,23,"SLC39A10, SLC30A7, SLC39A6, SLC41A2, SLC30A10, SLC41A1, SLC30A6"
"497","Metalloprotease DUBs",0.68743189248093,0.968863741080505,-0.347557446091648,-0.834635038868147,3784,17,"UBB, MYSM1, STAMBP, BABAM1, STAMBPL1, STAM"
"498","MicroRNA (miRNA) biogenesis",0.991304347826087,0.999106145251397,-0.198840547937858,-0.507583106063878,5471,23,"POLR2C, XPO5, PRKRA, AGO3, POLR2B, DROSHA, POLR2G"
"499","Miscellaneous transport and binding events",0.489973262032086,0.892770389513012,0.383642338024774,0.974625183037139,2198,20,"ANKH, ADD2, ADD3, TUSC3, NIPA2"
"500","Misspliced GSK3beta mutants stabilize beta-catenin",0.928428701180745,0.990941572957721,-0.260260594280796,-0.608585102862684,5110,15,"AXIN1, PPP2CB, CTNNB1, PPP2R5D, GSK3B, CSNK1A1"
"501","Mitochondrial Fatty Acid Beta-Oxidation",0.608977221974096,0.94466610522828,0.317069041191498,0.901562599456117,2726,33,"MMAA, MCEE, ACADVL, ACOT13, MCAT, THEM4, ACOT2, ACOT1, PCCB, ACAA2, ACADL, ACADS, ACADM, HADHA, HADHB, DBI, ACSM3, ACBD7"
"502","Mitochondrial biogenesis",0.733395262424524,0.984855220564751,0.256950094062824,0.875593915605689,3157,87,"CAMK4, MEF2C, NCOA2, CREBBP, ATP5F1E, TFB2M, POLG2, CHCHD6, ATP5F1B, PRKAA2, ALAS1, PPARGC1B, CREB1, GABPA, ESRRA, SIRT4, ATF2"
"503","Mitochondrial calcium ion transport",0.174253459577567,0.650941256520753,-0.507492501555275,-1.27092256677553,956,21,"SLC8A3, MCU, VDAC3, SMDT1, PHB, STOML2, LETM1, PMPCA, PARL"
"504","Mitochondrial protein import",0.946286119482361,0.99135329697839,-0.227338601859065,-0.697991851537302,5337,58,"HSPA9, SAMM50, SLC25A13, TIMM17A, TIMM44, TOMM20, NDUFB8, HSPD1, MTX2, TOMM22, PMPCA, TIMM17B, TIMM50, IDH3G, CHCHD7, COA6, TIMM13"
"505","Mitochondrial tRNA aminoacylation",0.943181818181818,0.99135329697839,0.246566391879711,0.618763808459249,4232,19,"WARS2, LARS2, VARS2, DARS2, YARS2, IARS2"
"506","Mitochondrial translation",0.376794812413154,0.83619643727818,0.299833280174845,1.03108560370429,1626,91,"MRPL23, MRRF, MRPS21, MRPL35, MRPL3, CHCHD1, MRPS26, MRPL52, MRPL41, AURKAIP1, MRPL9, MTIF3, MRPS17, MRPL14, MRPL37, MRPL43, MRPL32, MRPS5, MRPL12, MRPS27, MRPL48, MRPL54, MRPL15, MRPL57"
"507","Mitochondrial translation elongation",0.39567843866171,0.85691859984761,0.301533181408229,1.02199382789931,1702,85,"MRPL23, MRPS21, MRPL35, MRPL3, CHCHD1, MRPS26, MRPL52, MRPL41, AURKAIP1, MRPL9, MRPS17, MRPL14, MRPL37, MRPL43, MRPL32, MRPS5, MRPL12, MRPS27, MRPL48, MRPL54, MRPL15, MRPL57"
"508","Mitochondrial translation initiation",0.357806691449814,0.825963624228266,0.30731481357266,1.04158965599238,1539,85,"MRPL23, MRPS21, MRPL35, MRPL3, CHCHD1, MRPS26, MRPL52, MRPL41, AURKAIP1, MRPL9, MTIF3, MRPS17, MRPL14, MRPL37, MRPL43, MRPL32, MRPS5, MRPL12, MRPS27, MRPL48, MRPL54, MRPL15, MRPL57"
"509","Mitochondrial translation termination",0.378485130111524,0.83619643727818,0.304187532311338,1.03099028469848,1628,85,"MRPL23, MRRF, MRPS21, MRPL35, MRPL3, CHCHD1, MRPS26, MRPL52, MRPL41, AURKAIP1, MRPL9, MRPS17, MRPL14, MRPL37, MRPL43, MRPL32, MRPS5, MRPL12, MRPS27, MRPL48, MRPL54, MRPL15, MRPL57"
"510","Mitophagy",0.818691250903832,0.990941572957721,-0.288460155133258,-0.756310610178044,4528,26,"UBB, ULK1, TOMM20, TOMM22, ATG5, MFN2, CSNK2A1, SQSTM1, CSNK2B, MTERF3, FUNDC1"
"511","Mitotic Anaphase",0.684351464435146,0.967503093445832,-0.251908295464332,-0.907541809414339,4088,166,"SMC3, PSMD4, LEMD3, MAPRE1, PSMD3, UBE2D1, WAPL, PSMC3, PSMC6, ANAPC2, RANGAP1, PSMC2, UBB, PSMB4, PSMD12, PSME4, PPP2CB, PSME3, PSMD13, LMNB1, DYNLL1, NUDC, PSMA3, CKAP5, AHCTF1, TAOK1, PSMC5, PTTG1, PSMB1, PAFAH1B1, PPP1CC, PSMA1, CDC23, PPP2R5D, SEH1L, PSMB8, PSMD2, PSMD6"
"512","Mitotic G1 phase and G1/S transition",0.75670138296056,0.990099867216044,-0.248720433559202,-0.871768076794266,4431,135,"E2F3, PSMD4, PSMD3, PSMC3, ABL1, PSMC6, PSMC2, UBB, PSMB4, ORC1, PSMD12, CABLES1, PPP2CB, PSME3, PSMD13, PPP2R3B, PSMA3, AKT2, PSMC5, PSMB1, PSMA1, TFDP2, GMNN, PSMB8, PSMD2, PSMD6"
"513","Mitotic G2-G2/M phases",0.0623328877005348,0.524922326529249,-0.350670125744142,-1.26916866022244,372,174,"E2F3, ALMS1, PPP1R12A, PSMD4, MAPRE1, PSMD3, PSMC3, CEP135, DCTN1, ODF2, PSMC6, RAB8A, PSMC2, UBB, PSMB4, CDK11A, CDK11B, TUBGCP6, PSMD12, PSME4, PPP2CB, CSNK1E, FGFR1OP, PSME3, PSMD13, CEP76, DCTN2, DYNLL1, PPP2R3B, AKAP9, PSMA3, CKAP5, HAUS1, BORA, PHLDA1, TUBGCP4, OPTN, PSMC5, PPME1, PSMB1, PAFAH1B1, CNTRL, PSMA1, CEP70, PSMB8, PRKACA, PSMD2, PSMD6"
"514","Mitotic Metaphase and Anaphase",0.691124853752298,0.971460637804435,-0.251087277594707,-0.904964393972866,4134,167,"SMC3, PSMD4, LEMD3, MAPRE1, PSMD3, UBE2D1, WAPL, PSMC3, PSMC6, ANAPC2, RANGAP1, PSMC2, UBB, PSMB4, PSMD12, PSME4, PPP2CB, PSME3, PSMD13, LMNB1, DYNLL1, NUDC, PSMA3, CKAP5, AHCTF1, TAOK1, PSMC5, PTTG1, PSMB1, PAFAH1B1, PPP1CC, PSMA1, CDC23, PPP2R5D, SEH1L, PSMB8, PSMD2, PSMD6"
"515","Mitotic Prometaphase",0.971471098982883,0.999106145251397,0.20724399282768,0.778139098947929,3915,173,"SDCCAG8, CLASP1, ITGB3BP, CENPP, ZWINT, STAG2, CEP63, DYNC1I1, NME7, EML4, NUP133, CSNK1D, CDK5RAP2, NUMA1, KIF18A, CENPH, PPP2R5C, RAD21, PCM1, CEP57, PPP2R1A, SMC4, NEK7, BUB3, CEP290, DCTN3, XPO1, RCC2, SPDL1, NCAPH, ZWILCH, NINL, PRKAR2B, DYNC1I2, NEDD1, TUBA4A, MAD2L1"
"516","Mitotic Prophase",0.321422284809012,0.803146692419936,-0.334113199039714,-1.07613374030338,1825,77,"PRKCA, LPIN2, PRKCB, LEMD3, PPP2R2D, USO1, KMT5A, ENSA, RAE1, RAB2A, PPP2CB, LMNB1, NUP155, PHF8, NUP210, NUP50, SEH1L, NCAPD3, GORASP2, NCAPH2, ARPP19, NUP153"
"517","Mitotic Spindle Checkpoint",0.654341212263047,0.960735708407192,0.262256596657295,0.913119832330978,2795,99,"CLASP1, ITGB3BP, CDC26, CENPP, ZWINT, DYNC1I1, NUP133, KIF18A, ANAPC7, CDC27, ANAPC16, CENPH, PPP2R5C, PPP2R1A, CDC16, BUB3, XPO1, RCC2, SPDL1, ZWILCH, DYNC1I2, UBE2E1, MAD2L1, SPC24, MIS12, ANAPC15, PPP2R5B, B9D2, NUP37"
"518","Molecules associated with elastic fibres",0.417710196779964,0.859819671958674,0.376638377883382,1.02416843314445,1867,27,"MFAP1, ITGAV, LTBP3, ITGA8, ITGB8, FBLN1, TGFB3"
"519","Muscle contraction",0.073843858776728,0.524922326529249,0.325897028583172,1.22499791342959,296,175,"KCND2, KCNIP4, CACNA2D3, CACNA1C, SORBS1, ITPR1, KCNIP3, FGF14, TMOD1, FXYD6, CACNG3, SCN3A, KCNK1, DMD, CACNA2D1, GUCY1A2, KAT2B, ATP2B1, CACNB3, TPM3, SCN2A, FXYD7, CACNG4"
"520","MyD88 cascade initiated on plasma membrane",0.115928587989798,0.55790629693632,0.376854029609224,1.24327338470374,499,73,"RPS6KA5, MAP2K6, RPS6KA3, MEF2C, PELI2, PELI1, ATF1, TNIP2, RPS6KA2, BTRC, CREB1, ATF2, PPP2R1A, TAB2, MAPKAPK2, MEF2A, MAPK8"
"521","MyD88 dependent cascade initiated on endosome",0.107052023121387,0.556459755564598,0.370277123455153,1.24248999457454,462,80,"RPS6KA5, MAP2K6, RPS6KA3, MEF2C, PELI2, PELI1, ATF1, TNIP2, RPS6KA2, BTRC, CREB1, ATF2, PPP2R1A, TAB2, MAPKAPK2, MEF2A, MAPK8"
"522","MyD88-independent TLR4 cascade",0.880083662561004,0.990941572957721,0.236119486259038,0.80213855386876,3786,86,"RPS6KA5, MAP2K6, RPS6KA3, MEF2C, ATF1, TNIP2, RPS6KA2, BTRC, CREB1, ATF2, PPP2R1A, TAB2, MAPKAPK2, MEF2A, MAPK8, TRAF6, SARM1, NOD2"
"523","MyD88:MAL(TIRAP) cascade initiated on plasma membrane",0.0998603351955307,0.554324356659014,0.372225389144633,1.25104119673175,428,81,"RPS6KA5, MAP2K6, RPS6KA3, MEF2C, PELI2, PELI1, ATF1, TNIP2, RPS6KA2, BTRC, CREB1, ATF2, PPP2R1A, IRAK3, TAB2, MAPKAPK2, MEF2A, MAPK8"
"524","Myogenesis",0.184357541899441,0.655372920997921,0.466670055452493,1.23817746260504,824,24,"CDH4, MAP2K6, CDH2, MEF2C"
"525","N-Glycan antennae elongation",0.649046321525886,0.960735708407192,-0.368785907655485,-0.862357246839585,3572,15,"MGAT4B, MGAT5, ST8SIA6"
"526","N-glycan antennae elongation in the medial/trans-Golgi",0.17536231884058,0.650941256520753,-0.494785827695882,-1.26304684765177,967,23,"MAN2A1, MGAT4B, CHST10, MGAT5, CHST8, ST8SIA6, MGAT3, MAN2A2, FUCA1"
