"","pathway","pval","padj","ES","NES","nMoreExtreme","size","leadingEdge"
"1","A tetrasaccharide linker sequence is required for GAG synthesis",0.0463669209152951,0.0681363547067315,0.275908936459395,1.55527195614506,230,24,"AGRN, B3GALT6, B3GAT1, B3GAT2, B3GAT3, B4GALT7, BCAN, CSPG4, CSPG5, DCN, GPC1, GPC3, GPC4, GPC5, GPC6, HSPG2"
"2","ABC transporter disorders",0.000201450443190975,0.000853517877739331,-0.356721170982539,-3.51727797389185,0,70,"VCP, UBC, UBB, SEL1L, RPS27A, RNF5, RNF185, PSMF1, PSME4, PSME3, PSME2, PSME1, PSMD9, PSMD8, PSMD7, PSMD6, PSMD5, PSMD4, PSMD3, PSMD2, PSMD14, PSMD13, PSMD12, PSMD11, PSMD10, PSMD1, PSMC6, PSMC5, PSMC4, PSMC3, PSMC2, PSMC1, PSMB9, PSMB8, PSMB7, PSMB6, PSMB5, PSMB4, PSMB3, PSMB2, PSMB10, PSMB1, PSMA7, PSMA6, PSMA5, PSMA4, PSMA3, PSMA1"
"3","ABC transporters in lipid homeostasis",0.00493096646942801,0.0150249448891983,0.816248386877674,3.87444028010482,24,16,"ABCA12, ABCA2, ABCA3, ABCA5, ABCA6, ABCA7, ABCA9, ABCD1, ABCD2, ABCD3, ABCG1, ABCG4, ABCG8, APOA1"
"4","ABC-family proteins mediated transport",0.0404874213836478,0.0618657353295857,0.315447869071573,2.53630511759668,205,94,"ABCA12, ABCA2, ABCA3, ABCA4, ABCA5, ABCA6, ABCA7, ABCA8, ABCA9, ABCB10, ABCB1, ABCB4, ABCB5, ABCB7, ABCB8, ABCB9, ABCC1, ABCC10, ABCC2, ABCC3, ABCC4, ABCC5, ABCC6, ABCC9, ABCD1, ABCD2, ABCD3, ABCF1, ABCG1, ABCG4, ABCG8"
"5","ADP signalling through P2Y purinoceptor 1",0.00591715976331361,0.0172820997675882,0.463250526387285,2.1988852021874,29,16,"GNA11, GNA14, GNA15, GNB1, GNB4, GNB5, GNG11, GNG12, GNG13, GNG2, GNG3, GNG4, GNG7"
"6","APC-Cdc20 mediated degradation of Nek2A",0.0066079295154185,0.0177848988584018,0.491701001315733,2.68947181295377,32,22,"ANAPC1, ANAPC10, ANAPC15, ANAPC16, ANAPC2, ANAPC4, ANAPC5, ANAPC7, BUB3, CDC16, CDC20, CDC23, CDC26, CDC27"
"7","APC/C-mediated degradation of cell cycle proteins",0.000203252032520325,0.000853517877739331,-0.307281655733436,-3.16754170847366,0,77,"UBE2E1, UBE2D1, UBC, UBB, SKP2, SKP1, RPS27A, PTTG1, PSMF1, PSME4, PSME3, PSME2, PSME1, PSMD9, PSMD8, PSMD7, PSMD6, PSMD5, PSMD4, PSMD3, PSMD2, PSMD14, PSMD13, PSMD12, PSMD11, PSMD10, PSMD1, PSMC6, PSMC5, PSMC4, PSMC3, PSMC2, PSMC1, PSMB9, PSMB8, PSMB7, PSMB6, PSMB5, PSMB4, PSMB3, PSMB2, PSMB10, PSMB1, PSMA7, PSMA6, PSMA5, PSMA4, PSMA3, PSMA1"
"8","APC/C:Cdc20 mediated degradation of Cyclin B",0.00635298788961684,0.0175045091852209,0.566371595519578,3.04474611926154,31,21,"ANAPC1, ANAPC10, ANAPC15, ANAPC16, ANAPC2, ANAPC4, ANAPC5, ANAPC7, CCNB1, CDC16, CDC20, CDC23, CDC26, CDC27, CDK1"
"9","APC/C:Cdc20 mediated degradation of Securin",0.000202839756592292,0.000853517877739331,-0.441632285633233,-4.05563015539317,0,61,"UBE2E1, UBE2D1, UBC, UBB, RPS27A, PTTG1, PSMF1, PSME4, PSME3, PSME2, PSME1, PSMD9, PSMD8, PSMD7, PSMD6, PSMD5, PSMD4, PSMD3, PSMD2, PSMD14, PSMD13, PSMD12, PSMD11, PSMD10, PSMD1, PSMC6, PSMC5, PSMC4, PSMC3, PSMC2, PSMC1, PSMB9, PSMB8, PSMB7, PSMB6, PSMB5, PSMB4, PSMB3, PSMB2, PSMB10, PSMB1, PSMA7, PSMA6, PSMA5, PSMA4, PSMA3, PSMA1"
"10","APC/C:Cdc20 mediated degradation of mitotic proteins",0.000201938610662359,0.000853517877739331,-0.362160043623475,-3.52030194872922,0,68,"UBE2E1, UBE2D1, UBC, UBB, RPS27A, PTTG1, PSMF1, PSME4, PSME3, PSME2, PSME1, PSMD9, PSMD8, PSMD7, PSMD6, PSMD5, PSMD4, PSMD3, PSMD2, PSMD14, PSMD13, PSMD12, PSMD11, PSMD10, PSMD1, PSMC6, PSMC5, PSMC4, PSMC3, PSMC2, PSMC1, PSMB9, PSMB8, PSMB7, PSMB6, PSMB5, PSMB4, PSMB3, PSMB2, PSMB10, PSMB1, PSMA7, PSMA6, PSMA5, PSMA4, PSMA3, PSMA1"
"11","APC/C:Cdh1 mediated degradation of Cdc20 and other APC/C:Cdh1 targeted proteins in late mitosis/early G1",0.000202224469160768,0.000853517877739331,-0.409580524423103,-3.89408259780569,0,65,"UBE2E1, UBE2D1, UBC, UBB, SKP2, RPS27A, PTTG1, PSMF1, PSME4, PSME3, PSME2, PSME1, PSMD9, PSMD8, PSMD7, PSMD6, PSMD5, PSMD4, PSMD3, PSMD2, PSMD14, PSMD13, PSMD12, PSMD11, PSMD10, PSMD1, PSMC6, PSMC5, PSMC4, PSMC3, PSMC2, PSMC1, PSMB9, PSMB8, PSMB7, PSMB6, PSMB5, PSMB4, PSMB3, PSMB2, PSMB10, PSMB1, PSMA7, PSMA6, PSMA5, PSMA4, PSMA3, PSMA1"
"12","APC:Cdc20 mediated degradation of cell cycle proteins prior to satisfation of the cell cycle checkpoint",0.00020271639975674,0.000853517877739331,-0.367929964127061,-3.51887119239939,0,66,"UBE2E1, UBE2D1, UBC, UBB, RPS27A, PSMF1, PSME4, PSME3, PSME2, PSME1, PSMD9, PSMD8, PSMD7, PSMD6, PSMD5, PSMD4, PSMD3, PSMD2, PSMD14, PSMD13, PSMD12, PSMD11, PSMD10, PSMD1, PSMC6, PSMC5, PSMC4, PSMC3, PSMC2, PSMC1, PSMB9, PSMB8, PSMB7, PSMB6, PSMB5, PSMB4, PSMB3, PSMB2, PSMB10, PSMB1, PSMA7, PSMA6, PSMA5, PSMA4, PSMA3, PSMA1"
"13","ATF4 activates genes in response to endoplasmic reticulum  stress",0.0066079295154185,0.0177848988584018,0.447800008648008,2.44934522784494,32,22,"ASNS, ATF4, ATF6, CEBPB, CEBPG, DCP2, DDIT3, DIS3, EXOSC1, EXOSC2, EXOSC3, EXOSC4, EXOSC5, EXOSC7, EXOSC8, EXOSC9"
"14","AUF1 (hnRNP D0) binds and destabilizes mRNA",0.00020185708518369,0.000853517877739331,-0.551182517530125,-4.57990043023806,0,50,"UBC, UBB, RPS27A, PSMF1, PSME4, PSME3, PSME2, PSME1, PSMD9, PSMD8, PSMD7, PSMD6, PSMD5, PSMD4, PSMD3, PSMD2, PSMD14, PSMD13, PSMD12, PSMD11, PSMD10, PSMD1, PSMC6, PSMC5, PSMC4, PSMC3, PSMC2, PSMC1, PSMB9, PSMB8, PSMB7, PSMB6, PSMB5, PSMB4, PSMB3, PSMB2, PSMB10, PSMB1, PSMA7, PSMA6, PSMA5, PSMA4, PSMA3, PSMA1"
"15","AURKA Activation by TPX2",0.0283168316831683,0.0481711619437806,0.252300456683253,1.97449888990767,142,68,"ACTR1A, AKAP9, ALMS1, AURKA, CCP110, CDK1, CDK5RAP2, CENPJ, CEP131, CEP135, CEP152, CEP164, CEP192, CEP250, CEP290, CEP41, CEP57, CEP63, CEP70, CEP72, CEP76, CEP78, CETN2, CKAP5, CLASP1, CNTRL, CSNK1D, CSNK1E, DCTN1, DCTN2, DCTN3, DYNC1H1, DYNC1I2, DYNLL1"
"16","Abortive elongation of HIV-1 transcript in the absence of Tat",0.000394244037058939,0.00157345896704545,-0.411492371509271,-2.36501375255072,1,23,"SUPT5H, SUPT4H1, POLR2L, POLR2K, POLR2J, POLR2I, POLR2H, POLR2G, POLR2F, POLR2E, POLR2D, POLR2C, POLR2B, POLR2A, NELFE, NELFCD, NELFB, NELFA, NCBP2, NCBP1"
"17","Acetylcholine Neurotransmitter Release Cycle",0.000603986309643648,0.00229482269393578,-0.51438467807661,-2.40153562953522,2,15,"VAMP2, UNC13B, TSPOAP1, SYT1, STXBP1, STX1A, SNAP25, RIMS1, RAB3A, PPFIA4, PPFIA3, PPFIA2, PPFIA1"
"18","Activated NOTCH1 Transmits Signal to the Nucleus",0.0806,0.103799248309565,0.231293765721667,1.42947202737117,402,30,"ADAM10, ADAM17, APH1A, APH1B, ARRB1, ARRB2, CNTN1, DLK1, DLL1, DNER, DTX1, DTX2, DTX4, UBA52, ITCH, JAG1, JAG2, MIB1, MIB2, NCSTN, NEURL1, NEURL1B, NOTCH1, NUMB, PSEN1, PSEN2, PSENEN"
"19","Activation of APC/C and APC/C:Cdc20 mediated degradation of mitotic proteins",0.000201816347124117,0.000853517877739331,-0.352120565484129,-3.44315115988983,0,69,"UBE2E1, UBE2D1, UBC, UBB, RPS27A, PTTG1, PSMF1, PSME4, PSME3, PSME2, PSME1, PSMD9, PSMD8, PSMD7, PSMD6, PSMD5, PSMD4, PSMD3, PSMD2, PSMD14, PSMD13, PSMD12, PSMD11, PSMD10, PSMD1, PSMC6, PSMC5, PSMC4, PSMC3, PSMC2, PSMC1, PSMB9, PSMB8, PSMB7, PSMB6, PSMB5, PSMB4, PSMB3, PSMB2, PSMB10, PSMB1, PSMA7, PSMA6, PSMA5, PSMA4, PSMA3, PSMA1"
"20","Activation of ATR in response to replication stress",0.0234966148944644,0.0422612726226824,0.277418916162372,1.75800391290216,117,32,"ATR, ATRIP, CDC25A, CDC45, CDC7, CHEK1, DBF4, HUS1, MCM10, MCM2, MCM3, MCM4, MCM6, MCM7, MCM8, ORC1, ORC2, ORC3, ORC4, ORC5, ORC6, RAD1, RAD17, RAD9A, RAD9B, RFC2, RFC3, RFC4, RFC5, RPA1, RPA2, RPA3"
"21","Activation of BH3-only proteins",0.0335408716609761,0.0540409689592088,-0.269628723339979,-1.66478818311582,166,27,"YWHAZ, YWHAQ, YWHAH, YWHAG, YWHAE, YWHAB, TP73, TP53BP2, TP53, TFDP2, TFDP1"
"22","Activation of G protein gated Potassium channels",0.00493096646942801,0.0150249448891983,0.575154520138559,2.73005359144819,24,16,"GABBR1, GABBR2, GNB1, GNG12, GNG2, GNG3, GNG4, GNG7, KCNJ10, KCNJ12, KCNJ16, KCNJ2, KCNJ3, KCNJ4, KCNJ6, KCNJ9"
"23","Activation of GABAB receptors",0.00940376150460184,0.0229703515843183,0.575623682958331,3.45882954816398,46,28,"ADCY1, ADCY2, ADCY3, ADCY5, ADCY6, ADCY7, ADCY8, ADCY9, GABBR1, GABBR2, GNAI1, GNAI2, GNAI3, GNAL, GNB1, GNG12, GNG2, GNG3, GNG4, GNG7, KCNJ10, KCNJ12, KCNJ16, KCNJ2, KCNJ3, KCNJ4, KCNJ6, KCNJ9"
"24","Activation of HOX genes during differentiation",0.0227681246255243,0.0410222210644228,-0.212128173711796,-1.73430250229673,113,48,"ZNF335, YY1, WDR5, SUZ12, RXRA, RBBP7, RBBP5, RARG, RARB, RARA, POLR2L, POLR2K, POLR2J, POLR2I, POLR2H, POLR2G, POLR2F, POLR2E, POLR2D, POLR2C, POLR2B, POLR2A, PKNOX1, PIAS2, PCGF2, PBX1, PAXIP1, PAX6, PAGR1, NCOR1, NCOA6, NCOA3, MEIS1, MAFB, KMT2D, KMT2C, KDM6A, JUN"
"25","Activation of IRF3/IRF7 mediated by TBK1/IKK epsilon",0.0904298459042985,0.113557964068913,-0.301492562657067,-1.44873122648536,445,16,"UBC, UBB, TRAF3, TLR4, TICAM1, TBK1, TANK, SARM1, RPS27A, PTPN11"
"26","Activation of Matrix Metalloproteinases",0.0806548213216211,0.103799248309565,0.282136727688787,1.44206250848009,403,19,"COL18A1, CTRB2, CTRB1, CTSK, FURIN, KLKB1, MMP11, MMP14, MMP15, MMP16, MMP17, MMP1, MMP2, MMP24, MMP9"
"27","Activation of NF-kappaB in B cells",0.000202183582693085,0.000853517877739331,-0.4246193980454,-3.96962898063299,0,63,"UBC, UBB, SKP1, RPS27A, RELA, REL, PSMF1, PSME4, PSME3, PSME2, PSME1, PSMD9, PSMD8, PSMD7, PSMD6, PSMD5, PSMD4, PSMD3, PSMD2, PSMD14, PSMD13, PSMD12, PSMD11, PSMD10, PSMD1, PSMC6, PSMC5, PSMC4, PSMC3, PSMC2, PSMC1, PSMB9, PSMB8, PSMB7, PSMB6, PSMB5, PSMB4, PSMB3, PSMB2, PSMB10, PSMB1, PSMA7, PSMA6, PSMA5, PSMA4, PSMA3, PSMA1, PRKCB"
"28","Activation of NMDA receptors and postsynaptic events",0.0306589687437786,0.0508203065896874,0.25820892082794,2.02031823625584,153,71,"ACTN2, ADCY1, ADCY8, APBA1, ARHGEF7, CALM1, CAMK1, CAMK2A, CAMK2B, CAMK2G, CAMK4, CAMKK1, CAMKK2, CASK, CREB1, DLG1, DLG2, DLG3, DLG4, ERBB4, GIT1, GRIA1, GRIA2, GRIA3, GRIA4, GRIN1, GRIN2A, GRIN2B, GRIN2C, GRIN2D, GRIN3A, HRAS, KIF17, KPNA2, KRAS, LIN7A, LIN7B, LIN7C, LRRC7, MAPK1, MAPK3, MAPT, NEFL, NRAS, NRG1, NRGN, PDPK1, PPM1E, PPM1F, PRKAA1, PRKAA2, PRKAB1, PRKAB2, PRKACA, PRKACB, PRKAG1, PRKAG2, PRKAG3, PRKAR1A, PRKAR1B, PRKAR2A, PRKAR2B, PRKX, RAC1, RASGRF1, RASGRF2, RPS6KA1, RPS6KA2, RPS6KA3, RPS6KA6"
"29","Activation of anterior HOX genes in hindbrain development during early embryogenesis",0.0227681246255243,0.0410222210644228,-0.212128173711796,-1.73430250229673,113,48,"ZNF335, YY1, WDR5, SUZ12, RXRA, RBBP7, RBBP5, RARG, RARB, RARA, POLR2L, POLR2K, POLR2J, POLR2I, POLR2H, POLR2G, POLR2F, POLR2E, POLR2D, POLR2C, POLR2B, POLR2A, PKNOX1, PIAS2, PCGF2, PBX1, PAXIP1, PAX6, PAGR1, NCOR1, NCOA6, NCOA3, MEIS1, MAFB, KMT2D, KMT2C, KDM6A, JUN"
"30","Activation of gene expression by SREBF (SREBP)",0.490038237069833,0.512807690509441,0.12810395264984,0.883239305095537,2434,40,"ACACA, CARM1, CHD9, CREBBP, CYP51A1, DHCR7, ELOVL6, FASN, FDFT1, GGPS1, GPAM, HELZ2, HMGCR, HMGCS1, IDI1, LSS, MED1, MTF1, MVD, MVK, NCOA1, NCOA2, NCOA6, NFYA, NFYB, NFYC, PMVK, PPARA, RXRA, SC5D, SCD, SMARCD3, SP1, SQLE, SREBF1, SREBF2, TBL1X, TBL1XR1, TGS1, TM7SF2"
"31","Activation of kainate receptors upon glutamate binding",0.00730223123732252,0.0192007907661577,0.464847489275205,2.56852722842869,35,23,"CALM1, DLG1, DLG3, DLG4, GNB1, GNB4, GNB5, GNG11, GNG12, GNG13, GNG2, GNG3, GNG4, GNG7, GRIK1, GRIK2, GRIK3, GRIK4, GRIK5"
"32","Activation of the mRNA upon binding of the cap-binding complex and eIFs, and subsequent binding to 43S",0.0206206206206206,0.0384225952571276,0.271390647335103,1.95713477015423,102,48,"EIF1AX, EIF2S1, EIF2S2, EIF2S3, EIF3A, EIF3B, EIF3C, EIF3D, EIF3E, EIF3F, EIF3G, EIF3H, EIF3I, EIF3J, EIF3K, EIF3L, EIF3M, EIF4A1, EIF4A2, EIF4E, EIF4EBP1, EIF4G1, EIF4H, FAU, RPS18, RPS11, RPS12, RPS13, RPS14, RPS15, RPS15A, RPS16, RPS17, RPS19, RPS20, RPS21, RPS24, RPS25, RPS27A, RPS27L, RPS28, RPS3A, RPS4X, RPS5, RPS7, RPS8, RPS9, RPSA"
"33","Activation of the pre-replicative complex",0.0017982017982018,0.00634539530097753,-0.346164677549356,-2.18196756484843,8,28,"RPA3, RPA2, RPA1, PRIM2, PRIM1, POLE4, POLE3, POLE2, POLE, POLA2, POLA1, ORC6, ORC5, ORC4, ORC3, ORC2, ORC1, MCM8, MCM7, MCM6, MCM4, MCM3, MCM2, MCM10"
"34","Acyl chain remodelling of PC",0.000201572263656521,0.000853517877739331,-0.460357361233779,-2.46891492360207,0,20,"TMEM86B, PNPLA8, PLBD1, PLB1, PLAAT3, PLA2R1, PLA2G6, PLA2G5, PLA2G4F, PLA2G4E, PLA2G4C, PLA2G4A, PLA2G3, PLA2G12A, PLA2G10, MBOAT2, LPCAT4, LPCAT3, LPCAT2, LPCAT1"
"35","Acyl chain remodelling of PE",0.00280392549569397,0.00937053810819018,-0.407762442791762,-2.1356142562514,13,19,"PNPLA8, PLBD1, PLAAT3, PLAAT1, PLA2R1, PLA2G6, PLA2G5, PLA2G4F, PLA2G4E, PLA2G4C, PLA2G4A, PLA2G3, PLA2G12A, PLA2G10, MBOAT2, MBOAT1, LPCAT4, LPCAT3"
"36","Acyl chain remodelling of PS",0.00301993154821824,0.0100540355889569,-0.460336864982342,-2.14919967479861,14,15,"PLAAT3, PLA2R1, PLA2G5, PLA2G4F, PLA2G4E, PLA2G4A, PLA2G12A, PLA2G10, PLA1A, OSBPL8, OSBPL5, OSBPL10, MBOAT1, LPCAT4, LPCAT3"
"37","Adherens junctions interactions",0.00780937124549459,0.0201256433092846,0.557607720538263,3.19985010552691,38,25,"AFDN, CADM1, CADM2, CADM3, CDH10, CDH11, CDH12, CDH13, CDH18, CDH2, CDH24, CDH4, CDH6, CDH7, CDH8, CDH9, CTNNA1, CTNNB1, CTNND1"
"38","Adrenaline,noradrenaline inhibits insulin secretion",0.00635298788961684,0.0175045091852209,0.65117543144449,3.5006414225809,31,21,"ADCY5, ADCY6, ADRA2A, ADRA2C, CACNA1C, CACNA1D, CACNA2D2, CACNB2, CACNB3, GNAI1, GNAI2, GNB1, GNB4, GNB5, GNG11, GNG12, GNG13, GNG2, GNG3, GNG4, GNG7"
"39","Aggrephagy",0.132315016861734,0.157380433374003,0.252486581968884,1.32603581706888,666,20,"ARL13B, CFTR, DYNC1H1, DYNC1I1, DYNC1I2, DYNC1LI1, DYNC1LI2, DYNLL1, DYNLL2, UBA52, HDAC6, HSF1, IFT88"
"40","Amine ligand-binding receptors",0.00940376150460184,0.0229703515843183,0.608932091632112,3.65897438503224,46,28,"ADRA1A, ADRA1B, ADRA1D, ADRA2A, ADRA2C, ADRB1, ADRB2, ADRB3, CHRM1, CHRM2, CHRM3, DRD1, DRD2, DRD5, HRH1, HRH2, HRH3, HRH4, HTR1A, HTR1B, HTR1F, HTR2A, HTR2B, HTR2C, HTR4, HTR5A, HTR6, HTR7"
"41","Amino acid transport across the plasma membrane",0.000198965380023876,0.000853517877739331,-0.773669543940733,-4.69505701690624,0,26,"SLC7A8, SLC7A7, SLC7A6, SLC7A5, SLC7A3, SLC7A2, SLC7A11, SLC7A10, SLC7A1, SLC6A6, SLC6A20, SLC6A19, SLC6A15, SLC43A2, SLC43A1, SLC3A2, SLC3A1, SLC38A4, SLC38A2, SLC38A1, SLC36A4, SLC36A1, SLC25A29, SLC1A5, SLC1A4, SLC16A10"
"42","Amino acids regulate mTORC1",0.021975846367056,0.0400827056976585,0.269880174291939,1.98376559723499,110,51,"ATP6V0B, ATP6V0C, ATP6V0D1, ATP6V0D2, ATP6V0E1, ATP6V0E2, ATP6V1A, ATP6V1B1, ATP6V1B2, ATP6V1C1, ATP6V1C2, ATP6V1D, ATP6V1E1, ATP6V1F, ATP6V1G1, ATP6V1G2, ATP6V1H, C12orf66, BMT2"
"43","Amplification  of signal from unattached  kinetochores via a MAD2  inhibitory signal",0.0492156862745098,0.0710131629253373,0.166438680486137,1.34232047059992,250,83,"AHCTF1, B9D2, BIRC5, BUB1, BUB3, CDC20, CDCA8, CENPC, CENPE, CENPF, CENPH, CENPI, CENPK, CENPL, CENPM, CENPN, CENPO, CENPP, CENPQ, CENPT, CENPU, CKAP5, CLASP1, CLASP2, CLIP1, DSN1, DYNC1H1, DYNC1I1, DYNC1I2, DYNC1LI1, DYNC1LI2, DYNLL1, DYNLL2, INCENP, ITGB3BP, KIF18A, KIF2A, KIF2C, KNL1, KNTC1, MAD1L1, MAD2L1, MAPRE1, MIS12, NDE1, NDEL1, NUDC, NUF2, NUP107, NUP133, NUP160, NUP37, NUP43, NUP85, NUP98, PAFAH1B1, PLK1, PMF1, PPP1CC, PPP2CA, PPP2CB, PPP2R1A, PPP2R1B, PPP2R5A, PPP2R5B, PPP2R5C, PPP2R5D, PPP2R5E"
"44","Amplification of signal from the kinetochores",0.0492156862745098,0.0710131629253373,0.166438680486137,1.34232047059992,250,83,"AHCTF1, B9D2, BIRC5, BUB1, BUB3, CDC20, CDCA8, CENPC, CENPE, CENPF, CENPH, CENPI, CENPK, CENPL, CENPM, CENPN, CENPO, CENPP, CENPQ, CENPT, CENPU, CKAP5, CLASP1, CLASP2, CLIP1, DSN1, DYNC1H1, DYNC1I1, DYNC1I2, DYNC1LI1, DYNC1LI2, DYNLL1, DYNLL2, INCENP, ITGB3BP, KIF18A, KIF2A, KIF2C, KNL1, KNTC1, MAD1L1, MAD2L1, MAPRE1, MIS12, NDE1, NDEL1, NUDC, NUF2, NUP107, NUP133, NUP160, NUP37, NUP43, NUP85, NUP98, PAFAH1B1, PLK1, PMF1, PPP1CC, PPP2CA, PPP2CB, PPP2R1A, PPP2R1B, PPP2R5A, PPP2R5B, PPP2R5C, PPP2R5D, PPP2R5E"
"45","Amyloid fiber formation",0.364394993045897,0.390396290378024,-0.142195047282128,-1.06274849508488,1833,40,"USP9X, UBE2L6, UBC, UBB, TTR, TSPAN5, TSPAN33, TSPAN15, TSPAN14, TGFBI, SORL1, SNCAIP, SNCA, SIAH2, SIAH1"
"46","Anchoring of the basal body to the plasma membrane",0.0401970443349754,0.0615127591300362,0.208962511984944,1.68324422370527,203,92,"ACTR1A, AHI1, AKAP9, ALMS1, B9D1, B9D2, C2CD3, CC2D2A, CCP110, CDK1, CDK5RAP2, CENPJ, CEP131, CEP135, CEP152, CEP162, CEP164, CEP192, CEP250, CEP290, CEP41, CEP57, CEP63, CEP70, CEP72, CEP76, CEP78, CEP83, CEP89, CEP97, CETN2, CKAP5, CLASP1, CNTRL, CSNK1D, CSNK1E, DCTN1, DCTN2, DCTN3, DYNC1H1, DYNC1I2, DYNLL1"
"47","Antigen Presentation: Folding, assembly and peptide loading of class I MHC",0.0218978102189781,0.0400827056976585,-0.365406167221354,-1.75584870199948,107,16,"TAPBP, TAP2, TAP1, SEC31A, SEC24D, SEC24B, SEC24A, SEC23A, SEC13, SAR1B"
"48","Antigen activates B Cell Receptor (BCR) leading to generation of second messengers",0.753904685622747,0.762739506157389,0.129715916813919,0.74437902277405,3764,25,"AHCYL1, BLNK, BTK, CALM1, DAPP1, FYN, GRB2, IGHM, ITPR1, ITPR2, ITPR3, LYN, NCK1, ORAI1, ORAI2, PIK3AP1, PIK3CD, PIK3R1, PLCG2"
"49","Antigen processing-Cross presentation",0.000203998368013056,0.000853517877739331,-0.383896411760693,-4.02702824699691,0,80,"VAMP8, UBC, UBB, TLR4, TIRAP, TAPBP, TAP2, TAP1, STX4, SNAP23, SEC61G, SEC61B, SEC61A2, SEC61A1, SEC22B, RPS27A, PSMF1, PSME4, PSME3, PSME2, PSME1, PSMD9, PSMD8, PSMD7, PSMD6, PSMD5, PSMD4, PSMD3, PSMD2, PSMD14, PSMD13, PSMD12, PSMD11, PSMD10, PSMD1, PSMC6, PSMC5, PSMC4, PSMC3, PSMC2, PSMC1, PSMB9, PSMB8, PSMB7, PSMB6, PSMB5, PSMB4, PSMB3, PSMB2, PSMB10, PSMB1, PSMA7, PSMA6, PSMA5, PSMA4, PSMA3, PSMA1"
"50","Antigen processing: Ubiquitination & Proteasome degradation",0.000211014982063727,0.000853951255539143,-0.185366379630869,-3.57721081223281,0,279,"ZNRF2, ZNRF1, ZBTB16, WWP1, WSB1, UNKL, UFL1, UBR4, UBR2, UBR1, UBOX5, UBE4A, UBE3C, UBE3B, UBE3A, UBE2Z, UBE2W, UBE2V2, UBE2U, UBE2S, UBE2R2, UBE2Q2, UBE2Q1, UBE2O, UBE2N, UBE2M, UBE2L6, UBE2K, UBE2J2, UBE2J1, UBE2H, UBE2G2, UBE2G1, UBE2F, UBE2E3, UBE2E2, UBE2E1, UBE2D3, UBE2D2, UBE2D1, UBE3D, UBE2B, UBE2A, UBC, UBB, UBAC1, UBA7, UBA6, UBA5, UBA3, UBA1, TRIP12, TRIM9, TRIM71, TRIM39, TRIM37, TRIM36, TRIM32, TRIM11, TRAIP, TRAF7, TPP2, THOP1, STUB1, SPSB2, SPSB1, SOCS3, SOCS1, SMURF2, SMURF1, SKP2, SKP1, SIAH2, SIAH1, SH3RF1, RPS27A, RNF7, RNF6, RNF41, RNF4, RNF34, RNF25, RNF220, RNF217, RNF213, RNF19B, RNF19A, RNF182, RNF144B, RNF14, RNF138, RNF130, RNF126, RNF123, RNF115, RNF114, RNF111, RLIM, RCHY1, RBX1, RBCK1, RBBP6, PSMF1, PSME4, PSME3, PSME2, PSME1, PSMD9, PSMD8, PSMD7, PSMD6, PSMD5, PSMD4, PSMD3, PSMD2, PSMD14, PSMD13, PSMD12, PSMD11, PSMD10, PSMD1, PSMC6, PSMC5, PSMC4, PSMC3, PSMC2, PSMC1, PSMB9, PSMB8, PSMB7, PSMB6, PSMB5, PSMB4, PSMB3, PSMB2, PSMB10, PSMB1, PSMA7, PSMA6, PSMA5, PSMA4, PSMA3, PSMA1"
"51","Antimicrobial peptides",0.0249950406665344,0.0443405173467974,0.324784292411169,1.70573660271443,125,20,"ATOX1, ATP7A, BPIFB1, BPIFB2, CAMP, CCR2, CCR6, CD4, CHGA, CLU"
"52","Antiviral mechanism by IFN-stimulated genes",0.00220839188917888,0.0075259670960175,-0.20546730953524,-2.07317858893945,10,73,"USP41, USP18, UBE2N, UBE2L6, UBE2E1, UBC, UBB, UBA7, TRIM25, TPR, STAT1, SEH1L, SEC13, RPS27A, RNASEL, RANBP2, RAE1, PPM1B, POM121, POM121C, PLCG1, PIN1, PDE12, OAS2, OAS1, NUP42, NUP58, NUP98, NUP93, NUP88, NUP85, NUP54, NUP50, NUP43, NUP37, NUP35, NUP214, NUP210, NUP205, NUP188, NUP160, NUP155, NUP153, NUP133, NUP107, NEDD4, NDC1, MAPK3, KPNB1, KPNA7, KPNA4, KPNA3, KPNA2, KPNA1, JAK1, ISG15, IRF3, UBA52, FLNB, FLNA, EIF4G3, EIF4G2, EIF4G1, EIF4E2, EIF4E, EIF4A3, EIF4A2, EIF4A1, EIF2AK2"
"53","Apoptosis",0.000207900207900208,0.000853517877739331,-0.185324982951655,-2.65375874310192,0,152,"YWHAZ, YWHAQ, YWHAH, YWHAG, YWHAE, YWHAB, XIAP, VIM, UNC5B, UNC5A, UBC, UBB, UACA, TP73, TP53BP2, TP53, TRAF2, TRADD, TNFSF10, TNFRSF10B, TLR4, TJP2, TJP1, TICAM1, TFDP2, TFDP1, STK26, STK24, STAT3, SPTAN1, SATB1, RPS27A, ROCK1, RIPK1, PTK2, PSMF1, PSME4, PSME3, PSME2, PSME1, PSMD9, PSMD8, PSMD7, PSMD6, PSMD5, PSMD4, PSMD3, PSMD2, PSMD14, PSMD13, PSMD12, PSMD11, PSMD10, PSMD1, PSMC6, PSMC5, PSMC4, PSMC3, PSMC2, PSMC1, PSMB9, PSMB8, PSMB7, PSMB6, PSMB5, PSMB4, PSMB3, PSMB2, PSMB10, PSMB1, PSMA7, PSMA6, PSMA5, PSMA4, PSMA3, PSMA1, PRKCQ, PRKCD, PPP3R1, PPP3CC, PPP1R13B"
"54","Apoptotic cleavage of cellular proteins",0.103872889771599,0.127805598341302,0.200208574213879,1.33285076724025,522,36,"ACIN1, ADD1, APC, BCAP31, BIRC2, BMX, CASP3, CASP6, CASP7, CASP8, CTNNB1, DBNL, DSG1, DSG2, DSG3, DSP"
"55","Apoptotic execution phase",0.0613981762917933,0.0841382415850501,0.208249496981891,1.44269330851441,302,42,"ACIN1, ADD1, APC, BCAP31, BIRC2, BMX, CASP3, CASP6, CASP7, CASP8, CTNNB1, DBNL, DFFA, DFFB, DNM1L, DSG1, DSG2, DSG3, DSP"
"56","Aquaporin-mediated transport",0.0117905675459632,0.0261616049642163,0.356953417205032,2.31835054683796,58,34,"ADCY1, ADCY2, ADCY3, ADCY5, ADCY6, ADCY7, ADCY8, ADCY9, AQP1, AQP11, AQP4, AQP7, AQP9, GNAS, GNB1, GNB4, GNB5, GNG11, GNG12, GNG13, GNG2, GNG3, GNG4, GNG7"
"57","Arachidonic acid metabolism",0.0152068126520681,0.0314456245659533,0.30007326007326,2.04487218371624,74,39,"ABCC1, ALOX12, ALOX12B, ALOX5, ALOX5AP, ALOX15B, ALOXE3, CBR1, CYP1B1, CYP2J2, CYP2U1, CYP4B1, CYP4F8, CYP4F3, CYP4F22, EPHX2, FAAH, GGT5, GPX1, GPX4, HPGD, HPGDS, LTA4H, LTC4S, MAPKAPK2, PLA2G4A, PON1, PON2, PON3, PRXL2B, PTGDS, PTGES, PTGES2, PTGES3, PTGIS, PTGR2, PTGS1, PTGS2"
"58","Asparagine N-linked glycosylation",0.100966092062891,0.12437677928318,0.118864774712402,0.809397460569932,532,262,"ACTR10, ACTR1A, ALG1, ALG10B, ALG10, ALG11, ALG12, ALG14, ALG2, ALG3, ALG5, ALG6, ALG8, ALG9, AMDHD2, AMFR, ANK1, ANK2, ANK3, ANKRD28, ARCN1, AREG, ARF1, ARF3, ARF4, ARF5, ARFGAP1, ARFGAP2, ARFGAP3, B4GALNT2, B4GALT1, B4GALT2, B4GALT3, B4GALT4, B4GALT5, B4GALT6, BET1L, CALR, CANX, CAPZA2, CAPZB, CD55, CD59, CGA, CHST10, CHST8, CMAS, CNIH1, CNIH2, CNIH3, COG1, COG2, COG3, COG4, COG5, COG6, COG7, COG8, COPA, COPB1, COPB2, COPE, COPG1, COPG2, COPZ1, COPZ2, CSNK1D, CTSA, CTSC, CTSZ, DAD1, DCTN1, DCTN2, DCTN3, DCTN4, DCTN5, DCTN6, DDOST, DERL1, DERL2, DHDDS, DOLK, DOLPP1, DPAGT1, DPM1, DPM2, DPM3, DYNC1H1, DYNC1I1, DYNC1I2, DYNC1LI1, DYNC1LI2, DYNLL1, DYNLL2, EDEM1, EDEM2, EDEM3"
"59","Assembly Of The HIV Virion",0.00121654501216545,0.00443781912888523,-0.474678224546628,-2.28092248900857,5,16,"VPS37D, VPS37C, VPS37B, VPS37A, VPS28, UBC, UBB, UBAP1, TSG101"
"60","Assembly and cell surface presentation of NMDA receptors",0.0066079295154185,0.0177848988584018,0.489776819633448,2.67894705830885,32,22,"ACTN2, APBA1, CAMK2A, CAMK2B, CAMK2G, CASK, DLG1, DLG2, DLG3, DLG4, GRIN1, GRIN2A, GRIN2B, GRIN2C, GRIN2D, GRIN3A, KIF17, LIN7A, LIN7B, LIN7C, LRRC7"
"61","Assembly of collagen fibrils and other multimeric structures",0.0170443152195709,0.0339575203220681,0.455892542299483,3.20980024834991,84,44,"BMP1, CD151, COL11A1, COL11A2, COL15A1, COL18A1, COL1A1, COL1A2, COL27A1, COL3A1, COL4A1, COL4A2, COL4A3, COL4A4, COL4A5, COL5A1, COL5A2, COL5A3, COL6A1, COL6A2, COL6A3, COL6A5, COL6A6, COL8A1, COL8A2, COL9A1, COL9A2, CTSB, CTSS"
"62","Assembly of the pre-replicative complex",0.000201734920314706,0.000853517877739331,-0.423489338510798,-3.86403317061933,0,60,"UBC, UBB, RPS27A, PSMF1, PSME4, PSME3, PSME2, PSME1, PSMD9, PSMD8, PSMD7, PSMD6, PSMD5, PSMD4, PSMD3, PSMD2, PSMD14, PSMD13, PSMD12, PSMD11, PSMD10, PSMD1, PSMC6, PSMC5, PSMC4, PSMC3, PSMC2, PSMC1, PSMB9, PSMB8, PSMB7, PSMB6, PSMB5, PSMB4, PSMB3, PSMB2, PSMB10, PSMB1, PSMA7, PSMA6, PSMA5, PSMA4, PSMA3, PSMA1, ORC6, ORC5, ORC4, ORC3, ORC2, ORC1, MCM8, MCM7, MCM6, MCM4, MCM3, MCM2"
"63","Association of TriC/CCT with target proteins during biosynthesis",0.0131920847491505,0.0284137209981703,0.348917411493932,2.33868530597666,65,37,"AP3M1, ARFGEF2, CCNE1, CCNE2, CCT2, CCT3, CCT4, CCT5, CCT6A, CCT6B, CCT7, CCT8, DCAF7, FBXL3, FBXL5, FBXO4, FBXO6, FBXW2, FBXW4, FBXW5, FBXW7, FBXW9, FKBP9, GAPDHS, GBA"
"64","Asymmetric localization of PCP proteins",0.000201409869083585,0.000853517877739331,-0.508969888699025,-4.60879481048406,0,59,"WNT5A, VANGL2, UBC, UBB, SMURF2, SMURF1, SCRIB, RPS27A, PSMF1, PSME4, PSME3, PSME2, PSME1, PSMD9, PSMD8, PSMD7, PSMD6, PSMD5, PSMD4, PSMD3, PSMD2, PSMD14, PSMD13, PSMD12, PSMD11, PSMD10, PSMD1, PSMC6, PSMC5, PSMC4, PSMC3, PSMC2, PSMC1, PSMB9, PSMB8, PSMB7, PSMB6, PSMB5, PSMB4, PSMB3, PSMB2, PSMB10, PSMB1, PSMA7, PSMA6, PSMA5, PSMA4, PSMA3, PSMA1, PRICKLE1"
"65","Attenuation phase",0.00972801270597578,0.0233833437665682,0.371158736629589,1.99530508225124,48,21,"COL4A6, CREBBP, DEDD2, DNAJB1, DNAJB6, EP300, FKBP4, HSBP1, HSF1, HSP90AB1, HSPA1A, HSPA1B, HSPA1L, HSPA2, HSPA8, HSPH1"
"66","Autodegradation of Cdh1 by Cdh1:APC/C",0.000201409869083585,0.000853517877739331,-0.433760910728306,-3.9277668065303,0,59,"UBE2E1, UBE2D1, UBC, UBB, RPS27A, PSMF1, PSME3, PSME2, PSME1, PSMD9, PSMD8, PSMD7, PSMD6, PSMD5, PSMD4, PSMD3, PSMD2, PSMD14, PSMD13, PSMD12, PSMD11, PSMD10, PSMD1, PSMC6, PSMC5, PSMC4, PSMC3, PSMC2, PSMC1, PSMB9, PSMB8, PSMB7, PSMB6, PSMB5, PSMB4, PSMB3, PSMB2, PSMB10, PSMB1, PSMA7, PSMA6, PSMA5, PSMA4, PSMA3, PSMA1"
"67","Autodegradation of the E3 ubiquitin ligase COP1",0.000199441563621859,0.000853517877739331,-0.62876453244203,-5.09580115570795,0,47,"UBC, UBB, TP53, RPS27A, PSMF1, PSME4, PSME3, PSME2, PSME1, PSMD9, PSMD8, PSMD7, PSMD6, PSMD5, PSMD4, PSMD3, PSMD2, PSMD14, PSMD13, PSMD12, PSMD11, PSMD10, PSMD1, PSMC6, PSMC5, PSMC4, PSMC3, PSMC2, PSMC1, PSMB9, PSMB8, PSMB7, PSMB6, PSMB5, PSMB4, PSMB3, PSMB2, PSMB10, PSMB1, PSMA7, PSMA6, PSMA5, PSMA4, PSMA3, PSMA1"
"68","Autophagy",0.127280180364829,0.152265897064622,-0.110368301282364,-1.36063019028679,620,112,"WIPI2, WIPI1, WDR45B, VPS37D, VPS37C, VPS37B, VPS37A, VPS28, VDAC1, VCP, UVRAG, ULK1, UBE2N, UBC, UBB, UBAP1, TSG101, TSC2, TSC1, TOMM70, TOMM7, TOMM40, TOMM22, TOMM20"
