"","pathway","pval","padj","ES","NES","nMoreExtreme","size","leadingEdge"
"1","HALLMARK_TNFA_SIGNALING_VIA_NFKB",0.000183217295712715,0.00459896983075791,1,1.66551629913762,0,175,"IL12B, ABCA1"
"2","HALLMARK_HYPOXIA",0.608400586940572,0.729077161024231,0.116107474211666,0.190246130135694,3316,182,"ACKR3, ADM, ADORA2B, AK4, AKAP12, ALDOA, ALDOB, ALDOC, AMPD3, ANKZF1, ANXA2, ATF3, ATP7A, B3GALT6, B4GALNT2, BCAN, BCL2, BGN, BHLHE40, BNIP3L, BTG1, CA12, CASP6, CAV1, CAVIN1, CAVIN3, CCN2, CCNG2, CDKN1A, CDKN1B, CDKN1C, CHST2, CHST3, CITED2, COL5A1, CP, CSRP2, DCN, DDIT3, DDIT4, DPYSL4, DTNA, DUSP1, EDN2, EFNA1, EFNA3, EGFR, ENO1, ENO2, ENO3, ERO1A, ERRFI1, ETS1, EXT1, F3, FAM162A, FBP1, FOS, FOSL2, FOXO3, GAA, GALK1, GAPDH, GAPDHS, GBE1, GCK, GCNT2, GLRX, GPC1, GPC3, GPC4, GPI, GRHPR, GYS1, HAS1, HDLBP, HEXA, HK1, HK2, HMOX1, HS3ST1, HSPA5, IDS, IER3, IGFBP3, ILVBL, INHA, IRS2, JMJD6, JUN, KDELR3, KDM3A, KIF5A, KLF6, KLF7, KLHL24, LARGE1, LDHA, LDHC, LOX, LXN, MAFF, MAP3K1, MIF, MXI1, MYH9, NAGK, NCAN, NDRG1, NDST1, NDST2, NEDD4L, NFIL3, NOCT, NR3C1, P4HA1, P4HA2, PAM, PDGFB, PDK1, PDK3, PFKFB3, PFKL, PFKP, PGAM2, PGF, PGK1, PGM1, PGM2, PHKG1, PIM1, PKP1, PLAC8, PLAUR, PLIN2, PNRC1, PPARGC1A, PPFIA4, PPP1R15A, PPP1R3C, PRDX5, PRKCA"
"3","HALLMARK_CHOLESTEROL_HOMEOSTASIS",0.31919426689909,0.729077161024231,0.185114137732592,0.490468338205027,1647,72,"ABCA2, ACAT2, ACSS2, ACTG1, ADH4, ALCAM, ALDOC, ANTXR2, ANXA5, ATF3, ATF5, ATXN2, AVPR1A, CBS, CD9, CHKA, CLU, CPEB2, CTNNB1, CXCL16, CYP51A1, DHCR7, EBP, ECH1, ERRFI1, ETHE1, FABP5, FADS2, FASN, FBXO6, FDFT1, FDPS, GLDC, GNAI1, GPX8, GSTM2, GUSB, HMGCR, HMGCS1, HSD17B7, IDI1, JAG1, LDLR, LGALS3, LGMN, LPL, LSS, MAL2"
"4","HALLMARK_MITOTIC_SPINDLE",0.624450146627566,0.729077161024231,0.123395061192518,0.197150325078806,3406,193,"ABI1, ABL1, ABR, ACTN4, AKAP13, ALMS1, ALS2, ANLN, APC, ARAP3, ARF6, ARFGEF1, ARFIP2, ARHGAP10, ARHGAP27, ARHGAP29, ARHGAP4, ARHGAP5, ARHGDIA, ARHGEF11, ARHGEF12, ARHGEF2, ARHGEF3, ARHGEF7, ARL8A, ATG4B, AURKA, BCAR1, BCL2L11, BCR, BIN1, BIRC5, BRCA2, BUB1, CAPZB, CCDC88A, CCNB2, CD2AP, CDC27, CDC42, CDC42BPA, CDC42EP1, CDC42EP2, CDC42EP4, CDK5RAP2, CENPE, CENPF, CENPJ, CEP131, CEP192, CEP250, CEP57, CEP72, CKAP5, CLASP1, CLIP1, CLIP2, CNTRL, CNTROB"
"5","HALLMARK_WNT_BETA_CATENIN_SIGNALING",0.266887934400625,0.729077161024231,0.189534495621785,0.645391660922118,1366,39,"ADAM17, AXIN1, AXIN2, CCND2, CSNK1E, CTNNB1, CUL1, DKK4, DLL1, DVL2, FRAT1, FZD1, FZD8, GNAI1, HDAC11, HDAC2, HDAC5, HEY1, HEY2, JAG1, JAG2, KAT2A, LEF1, MAML1, MYC, NCOR2, NCSTN, NKD1, NOTCH1, NUMB"
"6","HALLMARK_TGF_BETA_SIGNALING",0.368539786710418,0.729077161024231,-0.137975457711712,-0.523349616428182,1796,52,"XIAP, WWTR1, UBE2D3, TRIM33, TJP1, THBS1, TGIF1, TGFBR1, TGFB1, SPTBN1, SMURF2, SMURF1, SMAD7, SMAD6, SMAD3, SMAD1, SLC20A1, SKIL, SKI"
"7","HALLMARK_IL6_JAK_STAT3_SIGNALING",0.11611143580752,0.590369393139842,0.998849546209894,2.79512183218242,595,65,"ITGA4, A2M"
"8","HALLMARK_DNA_REPAIR",0.317684171460382,0.729077161024231,0.998136965180522,1.83825572403868,1711,145,"ARL6IP1, EIF1B, AAAS"
"9","HALLMARK_G2M_CHECKPOINT",0.382875960482986,0.729077161024231,-0.99698393100262,-1.94125844900654,1743,186,"PTTG1, PRPF4B"
"10","HALLMARK_APOPTOSIS",0.35537037037037,0.729077161024231,0.997944501541624,1.85228276987517,1918,143,"PLPPR4, TGFB2, LMNA, ADD1"
"11","HALLMARK_NOTCH_SIGNALING",0.868154577392023,0.868154577392023,-0.107257190230215,-0.451276768964185,4200,30,"WNT5A, WNT2, TCF7L2, ST3GAL6, SKP1, SAP30, RBX1, PSENEN, PSEN2, PRKCA, PPARD, NOTCH3, NOTCH2, NOTCH1, MAML2, LFNG, KAT2A, JAG1, HES1, FZD7, FZD1, FBXW11, DTX4, DTX2, DTX1, DLL1, CUL1"
"12","HALLMARK_ADIPOGENESIS",0.624610306253438,0.729077161024231,0.114899538511362,0.184250395896348,3405,191,"ABCA1, ABCB8, ACAA2, ACADL, ACADM, ACADS, ACLY, ACO2, ACOX1, ADCY6, ADIG, ADIPOR2, AGPAT3, AIFM1, AK2, ALDH2, ALDOA, ANGPT1, APLP2, APOE, ARAF, ARL4A, ATL2, ATP1B3, ATP5PO, BAZ2A, BCKDHA, BCL2L13, BCL6, CAT, CAVIN1, CAVIN2, CCNG2, CD151, CD36, CDKN2C, CHCHD10, CHUK, CIDEA, CMBL, CMPK1, COL15A1, COL4A1, COQ3, COQ5, COQ9, COX6A1, COX7B, COX8A, CPT2, CRAT, CS, CYC1, CYP4B1, DBT, DDT, DECR1, DGAT1, DHCR7, DHRS7, DHRS7B, DLAT, DLD, DNAJB9, DNAJC15, DRAM2, ECH1, ECHS1, ELMOD3, ELOVL6, ENPP2, EPHX2, ESRRA, ESYT1, ETFB"
"13","HALLMARK_ESTROGEN_RESPONSE_EARLY",0.772377109317682,0.809326868225898,0.0636943711835849,0.104365439963089,4210,182,"ABAT, ABCA3, ABHD2, ABLIM1, ADCY1, ADCY9, ADD3, AFF1, AKAP1, ALDH3B1, AMFR, ANXA9, AR, AREG, ARL3, ASB13, B4GALT1, BAG1, BCL11B, BCL2, BHLHE40, BLVRB, CALB2, CALCR, CANT1, CA12, CBFA2T3, CCND1, CD44, CELSR1, CELSR2, CHPT1, CISH, CLDN7, CLIC3, CXCL12, CYP26B1, DEPTOR, DHCR7, DHRS2, DHRS3, DLC1, DYNLT3, EGR3, ELF1, ELOVL2, ELOVL5, ENDOD1, FAM102A, FARP1, FASN, FCMR, FDFT1, FHL2, FKBP4, FKBP5, FLNB, FOS, FOXC1, FRK, GAB2, GFRA1, GLA, GREB1, HES1, HR, HSPB8, IGF1R, IGFBP4, IL17RB, IL6ST, INHBB, INPP5F, ISG20L2, ITPK1, JAK2, KAZN, KCNK5, KDM4B, KLF10, KLK10, KRT15, KRT8, LAD1, LRIG1, MAPT, MAST4, MED13L, MED24, MICB, MINDY1, MLPH, MPPED2, MREG, MYB, MYBBP1A, MYBL1, MYC, MYOF, NADSYN1, NAV2, NBL1, NCOR2, NPY1R, NRIP1, NXT1, OLFM1, OLFML3, OPN3, OVOL2, P2RY2, PAPSS2, PDLIM3, PDZK1, PEX11A, PGR, PLAAT3, PMAIP1, PODXL, PPIF, PRSS23, PTGES, RAB31, RAPGEFL1, RARA, RASGRP1, RBBP8, REEP1, RET, RETREG1, RHOBTB3, RHOD, RPS6KA2, RRP12, SCARB1, SCNN1A, SEC14L2, SEMA3B, SFN, SH3BP5, SIAH2, SLC16A1, SLC19A2, SLC1A1, SLC1A4, SLC22A5, SLC24A3, SLC26A2, SLC27A2, SLC2A1, SLC37A1, SLC39A6, SLC7A2, SLC7A5, SLC9A3R1, SNX24, SOX3, STC2, SULT2B1, SVIL, SYBU, SYNGR1, SYT12, TBC1D30, TGIF2, TGM2, THSD4, TIAM1, TIPARP, TJP3"
"14","HALLMARK_ESTROGEN_RESPONSE_LATE",0.725101065784638,0.80566785087182,0.0706909147726792,0.115430758889841,3945,183,"ABCA3, ABHD2, ACOX2, ADD3, AFF1, AGR2, ALDH3A2, ALDH3B1, AMFR, ANXA9, AREG, ARL3, ASCL1, ASS1, ATP2B4, BAG1, BATF, BCL2, BLVRB, BTG3, CACNA2D2, CALCR, CA12, CA2, CAV1, CCNA1, CCND1, CD44, CD9, CDC20, CDC6, CELSR2, CHPT1, CHST8, CISH, CKB, CLIC3, COX6C, CPE, CXCL12, CXCL14, CYP26B1, DCXR, DHCR7, DHRS2, DLG5, DNAJC1, DNAJC12, DUSP2, DYNLT3, EGR3, ELOVL5, EMP2, ETFB, FABP5, FAM102A, FARP1, FDFT1, FGFR3, FKBP4, FKBP5, FLNB, FOS, FOXC1, FRK, GALE, GINS2, GJB3, GLA, GPER1, HMGCS2, HOMER2, HPRT1, HR, HSPA4L, HSPB8, ID2, IDH2, IGFBP4, IGSF1, IL17RB, IL6ST, IMPA2, ITPK1, JAK1, JAK2, KCNK5, KIF20A, KLK10, KLK11, LAMC2, LARGE1, LLGL2, LSR, LTF, MAPK13, MAPT, MDK, MEST, METTL3, MICB, MOCS2, MYB, MYOF, NAB2, NBL1, NCOR2, NMU, NPY1R, NRIP1, NXT1, OLFM1, OPN3, OVOL2, PAPSS2, PCP4, PDCD4, PDLIM3, PDZK1, PERP, PGR, PKP3, PLAAT3, PLAC1, PLK4, PLXNB1, PPIF, PRKAR2B, PRLR, PRSS23, PTGER3, PTGES, PTPN6, RAB31, RABEP1, RAPGEFL1, RBBP8, RET, RNASEH2A, RPS6KA2, SCARB1, SCNN1A, SCUBE2, SEMA3B, SERPINA3, SFN, SGK1, SIAH2, SLC16A1, SLC1A4, SLC22A5, SLC24A3, SLC26A2, SLC27A2, SLC29A1, SLC2A8, SLC7A5, SLC9A3R1"
"15","HALLMARK_ANDROGEN_RESPONSE",0.776953793496863,0.809326868225898,0.0750714074657737,0.176977068639516,4085,91,"ABCC4, ABHD2, ACSL3, ACTN1, ADAMTS1, ADRM1, AKAP12, AKT1, ALDH1A3, ANKH, APPBP2, ARID5B, SPCS3, B2M, B4GALT1, BMPR1B, CAMKK2, CCND1, CCND3, CDK6, CENPN"
"16","HALLMARK_MYOGENESIS",0.118073878627968,0.590369393139842,-0.99935608499678,-1.97052924074331,536,181,"CRYAB"
"17","HALLMARK_PROTEIN_SECRETION",0.411151147354447,0.729077161024231,0.1343363116999,0.31437644730323,2167,93,"ABCA1, ADAM10, ANP32E, AP1G1, AP2B1, AP2M1, AP2S1, AP3B1, AP3S1, ARCN1, ARF1, ARFGAP3, ARFGEF1, ARFGEF2, ARFIP1, ATP1A1, ATP6V1B1, ATP6V1H, ATP7A, BNIP3, CAV2, CD63, CLCN3, CLN5, CLTA, CLTC, COG2, COPB1, COPB2, COPE"
"18","HALLMARK_INTERFERON_ALPHA_RESPONSE",0.437109537692628,0.729077161024231,-0.111184569086041,-0.353203516869731,2098,81,"UBE2L6, UBA7, TXNIP, TRIM5, TRIM26, TRIM25, TRIM21, TRIM14, TRAFD1, TMEM140, TENT5A, TDRD7, TAP1, STAT2, SP110, SLC25A28, SAMD9L, RTP4, RSAD2, RNF31, RIPK2, PSME2, PSME1, PSMB9, PSMB8, PSMA3, PROCR, PNPT1, PLSCR1, PARP9, PARP14, PARP12, OGFR, OASL, NUB1, NMI, NCOA7, MVB12A, MOV10, LY6E, LPAR6, LGALS3BP, LAP3, ISG15, IRF9, IRF7, IRF2, IRF1, IL7, IL15, IFITM3, IFITM2, IFITM1, IFIT3, IFIT2, IFIH1, IFI35, HERC6, HELZ2"
"19","HALLMARK_INTERFERON_GAMMA_RESPONSE",0.468777484608619,0.729077161024231,-0.115858128124004,-0.243858261324518,2131,157,"ZNFX1, ZBP1, XAF1, VCAM1, VAMP8, VAMP5, UBE2L6, TXNIP, TRIM26, TRIM25, TRIM21, TRIM14, TRAFD1, TOR1B, TNFSF10, TNFAIP6, TNFAIP3, TDRD7, TAPBP, TAP1, STAT4, STAT3, STAT2, STAT1, ST8SIA4, ST3GAL5, SSPN, SRI, SPPL2A, SP110, SOD2, SOCS1, SLC25A28, SERPING1, SELP, SAMHD1, SAMD9L, RTP4, RSAD2, RNF31, RIPK2, RIPK1, RBCK1, RAPGEF6, PTPN6, PTPN2, PTPN1, PTGS2, PSME2, PSME1, PSMB9, PSMB8, PSMB2, PSMB10, PSMA3, PNPT1, PNP, PML, PLSCR1, PLA2G4A, PIM1, PFKP, PELI1, PDE4B, PARP14, PARP12, P2RY14, OGFR, OASL, OAS3, OAS2, NUP93, NOD1, NMI, NLRC5, NFKBIA, NFKB1, NCOA3, NAMPT, MVP, MTHFD2, METTL7B, LYSMD2, LY6E, LGALS3BP, LCP2, LATS2, LAP3, KLRK1, JAK2, ITGB7, ISOC1, ISG15, IRF9, IRF7, IRF5, IRF2, IRF1, IL7, IL18BP, IL15RA, IL15, IL10RA, IFNAR2, IFITM3, IFITM2, IFIT3, IFIT2, IFIH1, IFI35, IDO1, ICAM1, HIF1A, HERC6, HELZ2"
"20","HALLMARK_APICAL_JUNCTION",0.0104740904079383,0.0872840867328188,0.999935600206079,1.63278867650706,56,183,"THY1, ACTA1"
"21","HALLMARK_APICAL_SURFACE",0.00370948848106209,0.0463686060132761,0.999936191934661,3.4049236135708,18,39,"THY1, ADAM10"
"22","HALLMARK_HEDGEHOG_SIGNALING",0.00253065991824022,0.0421776653040036,0.999936216354127,3.57651439269755,12,33,"THY1, ACHE"
"23","HALLMARK_COMPLEMENT",0.576299299668264,0.729077161024231,0.161755618973068,0.275300496181332,3126,167,"ACTN2, ADAM9, AKAP10, ANG, ANXA5, APOC1, ATOX1, BRPF3, C1QA, C1QC, C1R, C1S, C2, C9, CALM1, CALM3, CA2, CASP3, CASP7, CASP9, CBLB, CCL5, CD36, CD40LG, CD46, CD55, CD59, CDA, CDH13, CDK5R1, CEBPB, CLU, COL4A2, CP, CPM, CPQ, CR1, CR2, CSRP1, CTSB, CTSC, CTSD, CTSH, CTSO, CTSS, DGKG, DGKH, DOCK10, DOCK4, DOCK9, DPP4, DUSP5, DUSP6, DYRK2, EHD1, F10, F2, F3, F5, F7, F8, FCER1G, FCN1, FDX1, FN1, FYN, GCA, ITGAM, GMFB, GNAI2, GNAI3, GNB2, GNB4, GNG2, GNGT2, GP1BA, GP9, GPD2, GRB2, GZMK, HNF4A, HPCAL4, HSPA1A, HSPA5, IRF1, IRF2, IRF7, ITIH1, JAK2, KCNIP2, KCNIP3, KIF2A, KLKB1, KYNU, L3MBTL4, LAMP2, LAP3, LCK, LCP2, LGALS3, LGMN, LIPA, LRP1, LTA4H, LTF, LYN, MAFF"
"24","HALLMARK_UNFOLDED_PROTEIN_RESPONSE",0.414093578329229,0.729077161024231,0.165207784904928,0.364343572495366,2185,103,"ALDH18A1, ARFGAP1, SPCS3, ASNS, ATF3, ATF4, ATF6, ATP6V0D1, BAG3, CALR, CEBPB, CEBPG, CHAC1, CKS1B, CNOT4, CNOT6, CXXC1, DCP1A, DCP2, DCTN1, DDIT4, DDX10, DKC1, DNAJA4, DNAJB9, DNAJC3, EDC4, EDEM1, EEF2, EIF2AK3, EIF2S1, EIF4A1, EIF4A2, EIF4A3, EIF4E, EIF4EBP1, EIF4G1, ERN1, ERO1A, EXOC2, EXOSC1, EXOSC10, EXOSC2, EXOSC4, EXOSC5, EXOSC9"
"25","HALLMARK_PI3K_AKT_MTOR_SIGNALING",0.641587901701323,0.729077161024231,0.0883425905953408,0.203668288812284,3393,95,"ACACA, ACTR2, ACTR3, ADCY2, AKT1, AKT1S1, AP2M1, ARF1, ARHGDIA, ARPC3, ATF1, CAB39, CAB39L, CALR, CAMK4, CDK2, CDK4, CDKN1A, CDKN1B, CFL1, CLTC, CSNK2B, DAPP1, DDIT3, E2F1, ECSIT, EGFR, EIF4E, FASLG, FGF17, FGF22, GNA14, GRB2, GRK2, GSK3B, HRAS, HSP90B1, IL4, ITPR2, LCK, MAP2K3, MAP2K6, MAP3K7, MAPK1, MAPK10, MAPK8, MAPK9, MAPKAP1, MKNK1, MKNK2, NCK1, NFKBIB, NGF, NOD1, PDK1, PFN1, PIK3R3, PIKFYVE, PIN1, PLA2G12A, PLCB1, PLCG1, PPP1CA, PPP2R1B, PRKAA2, PRKAG1, PRKAR2A, PRKCB, PTEN, PTPN11, RAC1, RAF1, RALB, RIPK1, RIT1, RPS6KA1, RPS6KA3, RPTOR"
"26","HALLMARK_MTORC1_SIGNALING",0.811721611721612,0.828287358899604,0.0583258171197869,0.0940513954176239,4431,189,"ABCF2, ACACA, ACLY, ACSL3, ACTR2, ACTR3, ADD3, ADIPOR2, AK4, ALDOA, ARPC5L, ASNS, ATP2A2, ATP6V1D, AURKA, BCAT1, BHLHE40, BTG2, BUB1, CACYBP, CALR, CANX, CCNF, CCNG1, CCT6A, CD9, CDC25A, CDKN1A, CFP, COPS5, CORO1A, CTH, CTSC, CYB5B, CYP51A1, DAPP1, DDIT3, DDIT4, DDX39A, DHCR24, DHCR7, DHFR, EBP, EDEM1, EEF1E1, EGLN3, EIF2S2, ELOVL5, ELOVL6, ENO1, ERO1A, ETF1, FADS1, FADS2, FGL2, FKBP2, G6PD, GAPDH, GBE1, GCLC, GGA2, GLA, GLRX, GMPS, GOT1, GPI, GSK3B, GSR, GTF2H1, HK2, HMBS, HMGCR, HMGCS1, HPRT1, HSP90B1, HSPA4, HSPA5, HSPA9, HSPD1, IDH1, IDI1, IFRD1, IGFBP5, IMMT, INSIG1, LDHA, LDLR, LGMN, LTA4H, M6PR, MAP2K3, MCM2, MCM4, ME1, MLLT11, MTHFD2, MTHFD2L, NAMPT, NFIL3, NFKBIB, NFYC, NMT1, NUFIP1, NUP205, NUPR1, P4HA1, PDAP1, PDK1, PFKL, PGK1, PGM1, PHGDH, PIK3R3, PITPNB, PLK1, PLOD2, PNO1, PNP, PPA1, PPIA, PPP1R15A, PRDX1, PSAT1, PSMA3, PSMA4, PSMB5, PSMC2, PSMC4, PSMC6, PSMD12, PSMD13, PSMD14, PSME3, PSMG1, PSPH, QDPR, RAB1A, RDH11, RIT1, RPA1, RPN1, RRM2, RRP9, SC5D, SCD, SDF2L1, SEC11A, SERP1, SERPINH1, SHMT2, SKAP2, SLA, SLC1A4, SLC1A5, SLC2A1, SLC37A4, SLC6A6, SLC7A11, SLC7A5, SLC9A3R1, SORD, SQLE, SQSTM1, SRD5A1, SSR1, STARD4, STC1, STIP1"
"27","HALLMARK_E2F_TARGETS",0.39292773995168,0.729077161024231,-0.977785490260708,-1.91741678259295,1788,184,"PTTG1"
"28","HALLMARK_MYC_TARGETS_V1",0.497263772345859,0.729077161024231,0.997489054854494,1.65369685353073,2725,179,"SRSF2, ABCE1"
"29","HALLMARK_MYC_TARGETS_V2",0.200164914450629,0.729077161024231,-0.190386976361301,-0.712233478750114,970,54,"WDR74, WDR43, UTP20, UNG, TMEM97, TFB2M, TCOF1, TBRG4, SUPV3L1, SRM, SORD, SLC29A2, SLC19A1, RRP9, RRP12, RCL1, RABEPK, PUS1, PRMT3, PPRC1, PPAN, PLK4, PLK1, PHB, PES1, PA2G4, NOP56, NOLC1, NOC4L, NIP7, NDUFAF4, MYC, MYBBP1A, MRTO4, MPHOSPH10, MCM5, MCM4, MAP3K6"
"30","HALLMARK_EPITHELIAL_MESENCHYMAL_TRANSITION",0.0104052573932092,0.0872840867328188,0.999935625080469,1.66503039966053,56,177,"THY1, ABI3BP"
"31","HALLMARK_INFLAMMATORY_RESPONSE",0.000183958793230316,0.00459896983075791,1,1.6936537134468,0,169,"IL12B, ABCA1"
"32","HALLMARK_XENOBIOTIC_METABOLISM",0.562362030905077,0.729077161024231,0.653633342260143,1.10702853735154,3056,169,"TGFB2, ABCC2"
"33","HALLMARK_FATTY_ACID_METABOLISM",0.515943641082684,0.729077161024231,0.255931568601021,0.475411601373856,2782,142,"AADAT, ACAA1, ACAA2, ACADL, ACADM, ACADS, ACADVL, ACAT2, ACO2, ACOT2, ACOT8, ACOX1, ACSL1, ACSL4, ACSL5, ACSM3, ACSS1, ADH1C, ADIPOR2, ADSL, ALAD, ALDH1A1, ALDH3A1, ALDH3A2, ALDH9A1, ALDOA, AOC3, APEX1, AUH, BCKDHB, BLVRA, BMPR1B, BPHL, CA2, CA4, CBR1, CBR3, CCDC58, CD36, CIDEA, CPOX, CPT1A, CPT2, CRAT, CRYZ, D2HGDH, DECR1, DHCR24, DLD, DLST, ECH1, ECHS1, ECI1, EHHADH, ELOVL5, ENO2, ENO3, EPHX1, ERP29, ETFDH, FABP2, FASN, FH, FMO1, G0S2, GABARAPL1, GAD2, GAPDHS, GCDH, GLUL, GPD1, GPD2, GRHPR, GSTZ1, HADH, HADHB, HAO2, HCCS, HIBCH, HMGCL, HMGCS1, HMGCS2, HPGD, HSD17B10, HSD17B11, HSD17B4, HSD17B7, HSDL2, HSPH1, IDH1, IDH3B, IDH3G, IDI1"
"34","HALLMARK_OXIDATIVE_PHOSPHORYLATION",0.618726044898704,0.729077161024231,0.178615729106257,0.287340624523673,3389,192,"ABCB7, ACAA1, ACAA2, ACADM, ACADSB, ACADVL, ACAT1, ACO2, AFG3L2, AIFM1, ALAS1, ALDH6A1, ATP1B1, ATP5F1A, ATP5F1B, ATP5F1C, ATP5F1D, ATP5F1E, ATP5MC3, ATP5PD, ATP5PF, ATP5MF, ATP5ME, ATP5MG, ATP5PO, ATP6AP1, ATP6V0B, ATP6V0C, ATP6V0E1, ATP6V1C1, ATP6V1D, ATP6V1E1, ATP6V1F, ATP6V1G1, ATP6V1H, BAX, BCKDHA, BDH2, CASP7, COX10, COX11, COX17, COX5A, COX5B, COX6A1, COX6B1, COX6C, COX7A2, COX7A2L, COX7B, COX7C, COX8A, CPT1A, CS, CYB5A, CYB5R3, CYC1, DECR1, DLAT, DLD, DLST, ECH1, ECHS1, ECI1, ETFA, ETFB, ETFDH, FDX1, FH, FXN, GLUD1, CYCS, GOT2, GPI, GPX4, GRPEL1, HADHA, HADHB, HCCS, HSD17B10, HSPA9, HTRA2, IDH1, IDH2, IDH3A, IDH3B, IDH3G, IMMT, ISCA1, ISCU, LDHA, LDHB, LRPPRC, MAOB, MDH1, MDH2, MFN2, MGST3, MPC1, MRPL11, MRPL15, MRPL34, MRPL35, MRPS11, MRPS12, MRPS15, MRPS22, MRPS30, MTRF1, MTRR, MTX2, NDUFA1, NDUFA2, NDUFA3, NDUFA4, NDUFA5, NDUFA6, NDUFA7, NDUFA8, NDUFA9, NDUFAB1, NDUFB1, NDUFB2, NDUFB3, NDUFB4, NDUFB5, NDUFB6, NDUFB7, NDUFB8, NDUFC1, NDUFC2, NDUFS1, NDUFS2, NDUFS3, NDUFS4, NDUFS6, NDUFS7, NDUFS8, NDUFV1, NDUFV2"
"35","HALLMARK_GLYCOLYSIS",0.606945975744212,0.729077161024231,0.136115826724436,0.222262694240762,3302,183,"ADORA2B, AGL, AGRN, AK3, AK4, AKR1A1, ALDH7A1, ALDH9A1, ALDOA, ALDOB, ALG1, ANG, ANKZF1, ARPP19, ARTN, AURKA, B3GALT6, B3GAT1, B3GAT3, B3GNT3, B4GALT1, B4GALT2, B4GALT4, B4GALT7, BPNT1, CACNA1H, CAPN5, CASP6, CD44, CENPA, CHPF, CHPF2, CHST1, CHST12, CHST2, CHST4, CITED2, CLN6, COG2, COL5A1, COPB2, CTH, CYB5A, DCN, DDIT4, DEPDC1, DLD, DPYSL4, DSC2, ECD, EFNA3, EGFR, EGLN3, ENO1, ENO2, ERO1A, EXT1, EXT2, FAM162A, FBP2, AC074143.1, FKBP4, FUT8, G6PD, GAL3ST1, GALE, GALK1, GALK2, GAPDHS, GCLC, GFPT1, GLCE, GLRX, GMPPA, GMPPB, GNE, GNPDA1, GOT1, GOT2, GPC1, GPC3, GPC4, GPR87, GUSB, GYS1, GYS2, HAX1, HDLBP, HK2, HMMR, HOMER1, HS2ST1, HS6ST2, HSPA5, IDH1, IDUA, IER3, IGFBP3, IL13RA1, IRS2, KDELR3, KIF20A, KIF2A, LCT, LDHA, LDHC, LHPP, LHX9, MDH1, MDH2, ME1, ME2, MED24, MERTK, MET, MIF, MPI, MXI1, NASP, NDST3, NDUFV3, NSDHL, NT5E, P4HA1, P4HA2, PAM, PAXIP1, PC, PDK3, PFKFB1, PFKP, PGAM1, PGAM2, PGK1, PGM2, PHKA2, PKM, PKP2, PLOD1, PLOD2, PMM2, POLR3K, PPFIA4, PPIA, PPP2CB"
"36","HALLMARK_REACTIVE_OXYGEN_SPECIES_PATHWAY",0.235874255188001,0.729077161024231,-0.176299976408221,-0.6883449457201,1147,46,"TXNRD2, TXNRD1, TXN, STK25, SRXN1, SOD2, SOD1, SELENOS, SCAF4, SBNO2, PTPA, PRNP, PRDX6, PRDX4, PRDX2, PRDX1, PFKP, PDLIM1, NQO1, NDUFS2, NDUFB4, NDUFA6, MSRA, MPO, MGST1, MBP, LSP1, LAMTOR5, JUNB, IPCEF1, HMOX2, GSR, GPX4, GPX3, GLRX, GCLM, GCLC, G6PD, FTL, FES"
"37","HALLMARK_P53_PATHWAY",0.310653046333455,0.729077161024231,0.998326036569663,1.65508445174256,1702,179,"TPRKB, ABAT"
"38","HALLMARK_UV_RESPONSE_UP",0.103626943005181,0.590369393139842,0.999357739242132,1.86394245744813,559,141,"SELENOW, ABCB1"
"39","HALLMARK_UV_RESPONSE_DN",0.478657968313141,0.729077161024231,0.805797429818638,1.52765157969318,2567,137,"MIOS, ABCC1"
"40","HALLMARK_ANGIOGENESIS",0.350513347022587,0.729077161024231,-0.171901907009376,-0.719526940453678,1706,32,"VTN, VEGFA, VCAN, VAV2, TNFRSF21, TIMP1, THBD, STC1, SPP1, SLCO2A1, S100A4, PTK2, PGLYRP1, PDGFA, OLR1, NRP1, MSX1, LUM, LRPAP1, LPL, KCNJ8, JAG2, JAG1, ITGAV"
"41","HALLMARK_HEME_METABOLISM",0.318751373928336,0.729077161024231,-0.998455300251014,-2.00772638619404,1449,174,"RAP1GAP"
"42","HALLMARK_COAGULATION",0.449433962264151,0.729077161024231,0.194745029383231,0.401819845519398,2381,115,"A2M, ACOX2, ADAM9, ANG, ANXA1, APOA1, APOC1, ARF4, BMP1, C1QA, C1R, C1S, C2, C8A, C8B, C8G, C9, CAPN2, CAPN5, CASP9, CD9, CFI, CLU, COMP, CPB2, CPN1, CPQ, CRIP2, CSRP1, CTSB, CTSE, CTSH, CTSK, CTSO, DCT, DPP4, DUSP14, DUSP6, F10, F11, F12, F13B, F2, F2RL2, F3, F8, FBN1, FN1, FURIN, FYN, GDA, GNB2, GNG12, GP1BA, GP9, GSN, HMGCS2, HNF4A, HPN, HTRA1, ISCU, ITGA2, ITGB3, ITIH1, KLF7, KLK8, KLKB1, LAMP2, LEFTY2, LGMN, LRP1, LTA4H, MAFF, MASP2, MBL2, MMP11, MMP14, MMP15, MMP1, MMP2, MMP9, MSRB2, MST1"
"43","HALLMARK_IL2_STAT5_SIGNALING",0.634506656939632,0.729077161024231,0.089670684963572,0.149560414873273,3478,176,"ABCB1, AGER, AHCY, AHNAK, AHR, ALCAM, AMACR, ANXA4, APLP1, ARL4A, BATF, BATF3, BCL2, BCL2L1, BHLHE40, BMP2, BMPR2, CAPN3, CA2, CASP3, CCND2, CCND3, CCNE1, CCR4, CD44, CD48, CD81, CD83, CD86, CDC42SE2, CDC6, CDCP1, CDKN1C, CISH, CKAP4, COCH, COL6A1, CSF1, CST7, CTLA4, CTSZ, CXCL10, CYFIP1, DCPS, DENND5A, DHRS3, DRC1, ECM1, EEF1AKMT1, EMP1, ENO3, ENPP1, EOMES, ETFBKMT, ETV4, F2RL2, FAH, FAM126B, FGL2, FLT3LG, FURIN, GABARAPL1, GADD45B, GALM, GATA1, GLIPR2, GPR83, GPX4, GSTO1, GUCY1B1, HIPK2, HK2, HOPX, HUWE1, ICOS, IFITM3, IFNGR1, IGF1R, IGF2R, IKZF2, IKZF4, IL10, IL10RA, IL1R2, IL2RA, IRF6, ITGA6, ITGAE, ITGAV, ITIH5"
"44","HALLMARK_BILE_ACID_METABOLISM",0.41255946717412,0.729077161024231,0.164673095838374,0.364136813421143,2167,102,"ABCA1, ABCA2, ABCA3, ABCA4, ABCA5, ABCA6, ABCA8, ABCA9, ABCD1, ABCD2, ABCD3, ABCG4, ACSL1, ACSL5, AKR1D1, ALDH1A1, ALDH8A1, ALDH9A1, AMACR, APOA1, AQP9, AR, ATXN1, BBOX1, BCAR3, BMP6, CAT, CROT, CYP27A1, CYP39A1, CYP46A1, CYP7B1, DHCR24, DIO1, DIO2, EFHC1, EPHX2, FADS1, FADS2, GC, GCLM, GNMT, GNPAT, GSTK1, HAO1, HSD17B11, HSD17B4, HSD17B6, HSD3B1, IDH1, IDH2, IDI1, ISOC1, KLF1, LCK, LIPE, LONP2, MLYCD, NEDD4, NPC1, NR0B2, NR1H4, NR1I2, NR3C2, NUDT12, OPTN, PAOX, PECR, PEX1, PEX11A, PEX11G, PEX12, PEX13, PEX16, PEX19, PEX26, PEX6, PEX7, PFKM, PHYH, PIPOX"
"45","HALLMARK_PEROXISOME",0.379670017068083,0.729077161024231,0.203115511878354,0.475334868201101,2001,93,"ABCB1, ABCB4, ABCB9, ABCC5, ABCC8, ABCD1, ABCD2, ABCD3, ACAA1, ACOT8, ACOX1, ACSL1, ACSL4, ACSL5, ALB, ALDH1A1, ALDH9A1, ATXN1, BCL10, CACNA1B, CADM1, CAT, CDK7, CLN6, CNBP, CRABP2, CRAT, CTBP1, CTPS1, DHCR24, DHRS3, DIO1, DLG4, ECH1, EHHADH, ELOVL5, EPHX2, ERCC1, ERCC3, ESR2, FABP6, FADS1, FDPS, FIS1, GNPAT, GSTK1, HAO2, HMGCL, HRAS, HSD11B2, HSD17B11, HSD17B4, IDE, IDH1, IDH2, IDI1, ISOC1, ITGB1BP1"
"46","HALLMARK_ALLOGRAFT_REJECTION",0.344411437059042,0.729077161024231,0.998008607952721,1.84048977191336,1854,144,"IL12B, THY1, TGFB2"
"47","HALLMARK_SPERMATOGENESIS",0.14676286310993,0.667103923226953,0.998974621891823,2.13986885964534,772,107,"COIL, ACE"
"48","HALLMARK_KRAS_SIGNALING_UP",0.0905770635500365,0.590369393139842,0.999484967488573,1.65768989015389,495,178,"SNAP25, ABCB1"
"49","HALLMARK_KRAS_SIGNALING_DN",0.495599559955996,0.729077161024231,0.95089604616225,1.68190860323711,2702,157,"IL12B, TGFB2"
"50","HALLMARK_PANCREAS_BETA_CELLS",0.742204144877009,0.80674363573588,0.123480645367005,0.451537163759313,3831,30,"ABCC8, AKT3, CHGA, DCX, DPP4, ELP4, FOXO1, G6PC2, GCK, HNF1A, INS, INSM1, LMO2, MAFB, NKX2-2, PAK3, PAX6, PCSK1, PCSK2, SCGN, SEC11A, SLC2A2, SPCS1, SRP14, SRP9, SRPRB, SST, STXBP1, SYT13"
