"","pathway","pval","padj","ES","NES","nMoreExtreme","size","leadingEdge"
"374","Mitochondrial translation",0.000200601805416249,0.000873517348409267,-0.435203556133789,-3.78379073968597,0,55,"TUFM, PTCD3, OXA1L, MTRF1L, MTIF3, MTIF2, MTFMT, MRPS9, MRPS7, MRPS36, MRPS35, MRPS34, MRPS33, MRPS31, MRPS28, MRPS27, MRPS26, MRPS25, MRPS24, MRPS22, MRPS21, MRPS18A, MRPS17, MRPS15, MRPS14, MRPS12, MRPS10, MRPL58, MRPL55, MRPL54, MRPL52, MRPL51, MRPL48, MRPL45, MRPL42, MRPL40, MRPL4, MRPL38, MRPL36, MRPL35, MRPL32, MRPL30, MRPL27, MRPL23, MRPL22, MRPL21, MRPL15, MRPL14, MRPL11, MRPL10, MRPL1"
"375","Mitochondrial translation elongation",0.000198846689202625,0.000873517348409267,-0.447747318235995,-3.73180929692715,0,50,"TUFM, PTCD3, OXA1L, MRPS9, MRPS7, MRPS36, MRPS35, MRPS34, MRPS33, MRPS31, MRPS28, MRPS27, MRPS26, MRPS25, MRPS24, MRPS22, MRPS21, MRPS18A, MRPS17, MRPS15, MRPS14, MRPS12, MRPS10, MRPL58, MRPL55, MRPL54, MRPL52, MRPL51, MRPL48, MRPL45, MRPL42, MRPL40, MRPL4, MRPL38, MRPL36, MRPL35, MRPL32, MRPL30, MRPL27, MRPL23, MRPL22, MRPL21, MRPL15, MRPL14, MRPL11, MRPL10, MRPL1"
"376","Mitochondrial translation initiation",0.000199242877067145,0.000873517348409267,-0.450176075712556,-3.81968162719455,0,52,"PTCD3, OXA1L, MTIF3, MTIF2, MTFMT, MRPS9, MRPS7, MRPS36, MRPS35, MRPS34, MRPS33, MRPS31, MRPS28, MRPS27, MRPS26, MRPS25, MRPS24, MRPS22, MRPS21, MRPS18A, MRPS17, MRPS15, MRPS14, MRPS12, MRPS10, MRPL58, MRPL55, MRPL54, MRPL52, MRPL51, MRPL48, MRPL45, MRPL42, MRPL40, MRPL4, MRPL38, MRPL36, MRPL35, MRPL32, MRPL30, MRPL27, MRPL23, MRPL22, MRPL21, MRPL15, MRPL14, MRPL11, MRPL10, MRPL1"
"377","Mitochondrial translation termination",0.016212970376301,0.0352607376536594,0.445228228375627,3.33735327391198,80,51,"AURKAIP1, CHCHD1, DAP3, GFM2, MRPL1, MRPL10, MRPL11, MRPL14, MRPL15, MRPL21, MRPL22, MRPL23, MRPL27, MRPL30, MRPL32, MRPL35, MRPL36, MRPL38, MRPL4, MRPL40, MRPL42, MRPL45, MRPL48, MRPL51, MRPL52, MRPL54, MRPL55, MRPL58, MRPS10, MRPS12, MRPS14, MRPS15, MRPS17, MRPS18A, MRPS21, MRPS22, MRPS24, MRPS25, MRPS26, MRPS27, MRPS28, MRPS31, MRPS33, MRPS34, MRPS35, MRPS36, MRPS7, MRPS9, MTRF1L"
"378","Mitophagy",0.145083932853717,0.178355911214866,-0.261590015567693,-1.32491714516748,725,18,"VDAC1, UBC, UBB, TOMM7, TOMM40, TOMM20, SRC, SQSTM1"
"379","Mitotic Anaphase",0.00141786510026332,0.00494370663277652,-0.190910814002654,-2.30219965754589,6,107,"ZWINT, ZWILCH, XPO1, WAPL, VRK2, UBE2E1, UBE2D1, UBC, UBB, TMPO, TAOK1, STAG2, STAG1, SMC3, SMC1A, SEH1L, RCC2, RANGAP1, RANBP2, RAD21, PSMF1, PSME4, PSME3, PSME1, PSMD9, PSMD7, PSMD5, PSMD4, PSMD3, PSMD2, PSMD14, PSMD13, PSMD12, PSMD11, PSMD1, PSMC6, PSMC3, PSMC1, PSMB5, PSMB4, PSMB3, PSMB2, PSMB1, PSMA6, PSMA3, PSMA1, PPP2R5E, PPP2R5D, PPP2R5C, PPP2R5B, PPP2R5A, PPP2R2A, PPP2R1B, PPP2R1A, PPP2CB, PPP2CA, PPP1CC, PMF1, PDS5B, PDS5A, PAFAH1B1, NUP98, NUP43, NUP160, NUP133, NUP107, NUDC"
"380","Mitotic G1 phase and G1/S transition",0.00101419878296146,0.00363267564078923,-0.236892248012659,-2.42563412923878,4,77,"UBC, UBB, TYMS, TFDP2, TFDP1, SRC, SKP2, RPA1, RBL2, RBL1, RB1, PSMF1, PSME3, PSME1, PSMD9, PSMD7, PSMD5, PSMD4, PSMD3, PSMD2, PSMD14, PSMD13, PSMD12, PSMD11, PSMD1, PSMC6, PSMC3, PSMC1, PSMB5, PSMB4, PSMB3, PSMB2, PSMB1, PSMA6, PSMA3, PSMA1, PRIM2, PPP2R3B, PPP2R2A, PPP2R1B, PPP2R1A, PPP2CB, PPP2CA, POLE, POLA2, PCNA, ORC6, ORC4, ORC3, ORC2, ORC1"
"381","Mitotic G2-G2/M phases",0.0314976228209192,0.0526966598362724,0.183366750070424,1.69887383727389,158,116,"ACTR1A, AKAP9, ALMS1, BORA, BTRC, CCNH, CCP110, CDC25B, CDK11B, CDK11A, CDK5RAP2, CDK7, CEP164, CEP192, CEP250, CEP290, CEP57, CEP63, CEP70, CEP76, CEP78, CKAP5, CLASP1, CNTRL, CSNK1D, CSNK1E, CUL1, DCTN1, DCTN2, DCTN3, DYNC1H1, DYNC1I2, DYNLL1, E2F3, EP300, FBXL7, FBXW11, HAUS1, HAUS2, HAUS7, HAUS8, HSP90AB1, LCMT1, LIN37, LIN52, LIN54, LIN9, MAPRE1, MNAT1, MZT1, NDE1, NME7, ODF2, OFD1, OPTN, PAFAH1B1, PCM1, PCNT, PHLDA1, PLK4, PPME1, PPP1CB, PPP1R12A, PPP1R12B, PPP2CA, PPP2CB, PPP2R1A, PPP2R1B, PPP2R2A, PPP2R3B, PRKACA, PRKAR2B, PSMA1, PSMA3, PSMA6, PSMB1, PSMB2, PSMB3, PSMB4, PSMB5, PSMC1, PSMC3, PSMC6, PSMD1, PSMD11, PSMD12, PSMD13, PSMD14, PSMD2, PSMD3, PSMD4, PSMD5, PSMD7, PSMD9, PSME1, PSME3, PSME4, PSMF1"
"382","Mitotic Metaphase and Anaphase",0.00141786510026332,0.00494370663277652,-0.190910814002654,-2.30219965754589,6,107,"ZWINT, ZWILCH, XPO1, WAPL, VRK2, UBE2E1, UBE2D1, UBC, UBB, TMPO, TAOK1, STAG2, STAG1, SMC3, SMC1A, SEH1L, RCC2, RANGAP1, RANBP2, RAD21, PSMF1, PSME4, PSME3, PSME1, PSMD9, PSMD7, PSMD5, PSMD4, PSMD3, PSMD2, PSMD14, PSMD13, PSMD12, PSMD11, PSMD1, PSMC6, PSMC3, PSMC1, PSMB5, PSMB4, PSMB3, PSMB2, PSMB1, PSMA6, PSMA3, PSMA1, PPP2R5E, PPP2R5D, PPP2R5C, PPP2R5B, PPP2R5A, PPP2R2A, PPP2R1B, PPP2R1A, PPP2CB, PPP2CA, PPP1CC, PMF1, PDS5B, PDS5A, PAFAH1B1, NUP98, NUP43, NUP160, NUP133, NUP107, NUDC"
"383","Mitotic Prometaphase",0.13745704467354,0.170576616067321,-0.105769102404931,-1.33163718422065,679,117,"ZWINT, ZWILCH, YWHAG, YWHAE, XPO1, WAPL, TUBGCP6, TUBGCP5, TUBGCP4, TUBGCP3, TUBGCP2, TUBG1, TUBB4B, TUBB4A, TUBA4A, TUBA1A, TAOK1, STAG2, STAG1, SMC4, SMC3, SMC2, SMC1A, SFI1, SEH1L, SDCCAG8, RCC2, RANGAP1, RANBP2, RAD21, PRKAR2B, PRKACA, PPP2R5E, PPP2R5D, PPP2R5C, PPP2R5B, PPP2R5A, PPP2R1B, PPP2R1A, PPP2CB, PPP2CA, PPP1CC, PMF1, PLK4, PDS5B, PDS5A, PCNT, PCM1, PAFAH1B1, OFD1, ODF2, NUP98, NUP43, NUP160, NUP133, NUP107, NUMA1, NUDC, NME7, NEK9, NEK7, NDEL1, NDE1, NCAPD2, MZT1, MIS12, MAPRE1, MAD1L1, KIF2A, KIF18A, ITGB3BP, HDAC8, HAUS8, HAUS7, HAUS2, HAUS1, EML4, DYNLL2, DYNLL1, DYNC1LI2, DYNC1LI1, DYNC1I2, DYNC1I1, DYNC1H1, DSN1, DCTN3, DCTN2, DCTN1, CSNK2B, CSNK2A2, CSNK2A1, CSNK1E, CSNK1D, CNTRL, CLIP1, CLASP2, CLASP1, CKAP5, CEP78, CEP76, CEP70, CEP63, CEP57, CEP290, CEP250, CEP192, CEP164, CENPT, CENPQ, CENPP, CENPC, CDK5RAP2"
"384","Mitotic Prophase",0.000200601805416249,0.000873517348409267,-0.32251314576896,-2.80402638532768,0,55,"VRK2, USO1, TPR, TMPO, SMC4, SMC2, SET, SEH1L, RB1, RANBP2, RAB2A, RAB1B, RAB1A, PRKCB, PRKCA, PPP2R2D, PPP2R1B, PPP2R1A, PPP2CB, PPP2CA, POM121, POM121C, PHF8, NUP98, NUP93, NUP54, NUP50, NUP43, NUP35, NUP214, NUP210, NUP205, NUP188, NUP160, NUP153, NUP133, NUP107, NUMA1, NEK9, NEK7, NCAPD3, MCPH1, MASTL, MAPK1, LPIN2, LMNB1, LEMD3, LEMD2, KMT5A"
"385","Mitotic Spindle Checkpoint",0.0314,0.0526966598362724,0.199035151046611,1.60205702414571,156,63,"AHCTF1, ANAPC1, ANAPC10, ANAPC15, ANAPC16, ANAPC5, ANAPC7, CDC16, CDC23, CDC26, CDC27, CENPC, CENPP, CENPQ, CENPT, CKAP5, CLASP1, CLASP2, CLIP1, DSN1, DYNC1H1, DYNC1I1, DYNC1I2, DYNC1LI1, DYNC1LI2, DYNLL1, DYNLL2, ITGB3BP, KIF18A, KIF2A, MAD1L1, MAPRE1, MIS12, NDE1, NDEL1, NUDC, NUP107, NUP133, NUP160, NUP43, NUP98, PAFAH1B1, PMF1, PPP1CC, PPP2CA, PPP2CB, PPP2R1A, PPP2R1B, PPP2R5A, PPP2R5B, PPP2R5C, PPP2R5D, PPP2R5E"
"386","Molecules associated with elastic fibres",0.00613739853494358,0.0177804045791748,0.455363814764894,2.20441938409128,30,17,"BMP7, EFEMP1, EFEMP2, FBLN1, FBLN2, FBLN5, ITGA8, ITGAV, ITGB1, ITGB5, ITGB8, LTBP1, LTBP3, LTBP4, MFAP1, MFAP3"
"387","Muscle contraction",0.0245301681503462,0.0451651264310398,0.206054557551564,1.82999921563304,123,90,"AHCYL1, AKAP9, ANXA2, ANXA6, ASPH, ATP1A1, ATP1A2, ATP1A3, ATP1B1, ATP1B2, ATP2A2, ATP2B1, ATP2B2, ATP2B3, CACNA1C, CACNA1D, CACNA2D1, CACNA2D2, CACNA2D3, CACNB2, CACNB4, CACNG3, CACNG4, CACNG7, CACNG8, CALD1, CALM1, CAMK2B, CAMK2G"
"388","MyD88 cascade initiated on plasma membrane",0.0257023311416617,0.0458222555195235,-0.200992260005136,-1.70539147717866,128,52,"UBE2N, UBC, UBB, TRAF6, TNIP2, TAB2, TAB1, S100B, RPS6KA5, RPS6KA3, RPS6KA2, RPS6KA1, RIPK2, PPP2R5D, PPP2R1B, PPP2R1A, PPP2CB, PPP2CA, PELI2, PELI1, NKIRAS1, NFKBIA, NFKB2, NFKB1, MEF2C, MEF2A, MAPKAPK2, MAPK9, MAPK8, MAPK7, MAPK14, MAPK10, MAPK1, MAP3K7, MAP3K1, MAP2K6, MAP2K4, MAP2K1, JUN, IRAK2, IKBKG, IKBKB"
"389","MyD88 dependent cascade initiated on endosome",0.0257023311416617,0.0458222555195235,-0.200992260005136,-1.70539147717866,128,52,"UBE2N, UBC, UBB, TRAF6, TNIP2, TAB2, TAB1, S100B, RPS6KA5, RPS6KA3, RPS6KA2, RPS6KA1, RIPK2, PPP2R5D, PPP2R1B, PPP2R1A, PPP2CB, PPP2CA, PELI2, PELI1, NKIRAS1, NFKBIA, NFKB2, NFKB1, MEF2C, MEF2A, MAPKAPK2, MAPK9, MAPK8, MAPK7, MAPK14, MAPK10, MAPK1, MAP3K7, MAP3K1, MAP2K6, MAP2K4, MAP2K1, JUN, IRAK2, IKBKG, IKBKB"
"390","MyD88-independent TLR4 cascade",0.0127388535031847,0.0294375852214356,-0.199982288482123,-1.84466236761413,63,62,"UBE2N, UBE2D3, UBE2D2, UBE2D1, UBC, UBB, TRAF6, TRAF3, TNIP2, TBK1, TANK, TAB2, TAB1, SARM1, S100B, RPS6KA5, RPS6KA3, RPS6KA2, RPS6KA1, RIPK2, RIPK1, PTPN11, PPP2R5D, PPP2R1B, PPP2R1A, PPP2CB, PPP2CA, NKIRAS1, NFKBIA, NFKB2, NFKB1, MEF2C, MEF2A, MAPKAPK2, MAPK9, MAPK8, MAPK7, MAPK14, MAPK10, MAPK1, MAP3K7, MAP2K6, MAP2K4, MAP2K1, JUN, IRF3, IRAK2, IKBKG, IKBKE, IKBKB"
"391","MyD88:MAL(TIRAP) cascade initiated on plasma membrane",0.0445643485211831,0.0680556330129695,-0.185680444353458,-1.58842304916405,222,53,"UBE2N, UBC, UBB, TRAF6, TNIP2, TAB2, TAB1, S100B, RPS6KA5, RPS6KA3, RPS6KA2, RPS6KA1, RIPK2, PPP2R5D, PPP2R1B, PPP2R1A, PPP2CB, PPP2CA, PELI2, PELI1, NKIRAS1, NFKBIA, NFKB2, NFKB1, MEF2C, MEF2A, MAPKAPK2, MAPK9, MAPK8, MAPK7, MAPK14, MAPK10, MAPK1, MAP3K7, MAP3K1, MAP2K6, MAP2K4, MAP2K1, JUN, IRAK2, IKBKG, IKBKB"
"392","Myogenesis",0.0506810897435897,0.0759252827337428,0.307226920168251,1.56851737642429,252,19,"ABL1, BNIP2, BOC, CDC42, CDH2, CDH4, CTNNA1, CTNNA2, CTNNB1, MAP2K6, MAPK14, MEF2A, MEF2B, MEF2C, MEF2D"
"393","N-glycan antennae elongation in the medial/trans-Golgi",0.0162827640984909,0.0352607376536594,0.386514719848053,1.82490772973058,81,16,"B4GALT4, B4GALT5, B4GALT6, CHST10, FUCA1, FUT8, MAN2A1, MAN2A2, MGAT2, MGAT3, MGAT4A, MGAT4B, MGAT4C, MGAT5"
"394","N-glycan trimming in the ER and Calnexin/Calreticulin cycle",0.323340040241449,0.357351965933046,-0.184171122994652,-1.09737907450789,1606,25,"VCP, UGGT2, UGGT1, UBXN1, UBC, UBB, SEL1L, RNF5, RNF185, RNF103, RAD23B, PSMC1, PDIA3, OS9, NGLY1, MOGS, MLEC, MAN1B1"
"395","NCAM signaling for neurite out-growth",0.355205424810531,0.389293288943947,0.175323903482705,1.036609461602,1780,27,"AGRN, CACNA1C, CACNA1D, CACNB2, CACNB4, COL4A1, COL4A5, CREB1, FGFR1, FYN, GFRA1, GRB2, KRAS, MAPK1, NCAM1, NCAN, NRAS, PTK2, PTPRA, RPS6KA5, SOS1, SPTAN1, SPTB, SPTBN1, SPTBN2, SRC, ST8SIA4"
"396","NEP/NS2 Interacts with the Cellular Export Machinery",0.000199600798403194,0.000873517348409267,-0.565795724465558,-3.02445214393998,0,20,"XPO1, TPR, SEH1L, RANBP2, POM121, POM121C, NUP98, NUP93, NUP54, NUP50, NUP43, NUP35, NUP214, NUP210, NUP205, NUP188, NUP160, NUP153, NUP133, NUP107"
"397","NIK-->noncanonical NF-kB signaling",0.00019669551534225,0.000873517348409267,-0.500696340753463,-3.59424051412235,0,37,"UBE2M, UBC, UBB, UBA3, RELB, PSMF1, PSME4, PSME3, PSME1, PSMD9, PSMD7, PSMD5, PSMD4, PSMD3, PSMD2, PSMD14, PSMD13, PSMD12, PSMD11, PSMD1, PSMC6, PSMC3, PSMC1, PSMB5, PSMB4, PSMB3, PSMB2, PSMB1, PSMA6, PSMA3, PSMA1"
"398","NOD1/2 Signaling Pathway",0.168867547018808,0.205351276312994,0.253568695743951,1.26323995963094,843,18,"BIRC2, BIRC3, CASP2, CASP8, CHUK, CYLD, IKBKB, IKBKG, IRAK2, ITCH, MAP2K6, MAP3K7, MAPK14"
"399","NOTCH1 Intracellular Domain Regulates Transcription",0.125623130608175,0.158132630861409,-0.194782017506586,-1.35726555743693,629,35,"UBC, UBB, TLE4, TLE3, TLE1, TBL1XR1, TBL1X, SNW1, RBX1, RBPJ, NOTCH1, NCOR2, NCOR1, MAMLD1, MAML3, MAML2, KAT2B, KAT2A, HIF1A, HES5, HES1, HDAC9, HDAC8, HDAC7, HDAC6, HDAC4, HDAC3, HDAC2, HDAC1"
"400","NOTCH2 Activation and Transmission of Signal to the Nucleus",0.493161546085233,0.524441698131125,0.206607319485658,0.946846504724954,2487,15,"ADAM10, APH1A, APH1B, CNTN1, DLL1, MDK, MIB1, MIB2, NCSTN, NEURL1, NOTCH2, PSEN1, PSEN2"
"401","NOTCH3 Activation and Transmission of Signal to the Nucleus",0.468390224197132,0.499447221471367,-0.196800078217206,-0.972619415300876,2318,17,"YBX1, WWP2, UBC, UBB, TACC3, PSEN2, PSEN1, NOTCH3, NEURL1, NCSTN, MIB2, MIB1"
"402","NOTCH3 Intracellular Domain Regulates Transcription",0.255988913086517,0.288996079530338,0.237989817795811,1.15211035781643,1292,17,"CREBBP, DLGAP5, EP300, FABP7, HES1, HES5, KAT2A, KAT2B, MAML2, MAML3, MAMLD1, NOTCH1, NOTCH3, PBX1"
"403","NR1H2 and NR1H3-mediated signaling",0.235656144530474,0.270834501382971,0.193057536852116,1.15477184830886,1186,28,"ABCA1, AGO2, AGO3, AGO4, APOD, APOE, EEPD1, EP300, FASN, GPS2, HDAC3, KDM1A, KDM1B, KDM3A, KDM4A, MOV10, NCOA1, NCOR1, NCOR2, NR1H2, NRIP1"
"404","NR1H3 & NR1H2 regulate gene expression linked to cholesterol transport and efflux",0.131981713377062,0.165081889112897,0.237365335868188,1.33372177441789,663,24,"ABCA1, AGO2, AGO3, AGO4, APOD, APOE, EEPD1, EP300, GPS2, HDAC3, KDM1A, KDM1B, KDM3A, KDM4A, MOV10, NCOA1, NCOR1, NCOR2, NR1H2"
"405","NRAGE signals death through JNK",0.0136217948717949,0.0305811235298415,0.425059313100572,2.93300681986679,67,41,"AATF, ABR, AKAP13, ARHGEF1, ARHGEF10, ARHGEF10L, ARHGEF11, ARHGEF12, ARHGEF18, ARHGEF19, ARHGEF2, ARHGEF26, ARHGEF3, ARHGEF37, ARHGEF4, ARHGEF40, ARHGEF5, ARHGEF6, ARHGEF7, ARHGEF9"
"406","NS1 Mediated Effects on Host Pathways",0.0001999600079984,0.000873517348409267,-0.431270048710942,-2.47165657647186,0,23,"TPR, SEH1L, RANBP2, POM121, POM121C, NUP98, NUP93, NUP54, NUP50, NUP43, NUP35, NUP214, NUP210, NUP205, NUP188, NUP160, NUP153, NUP133, NUP107, KPNA4, KPNA3, KPNA2, KPNA1"
"407","Neddylation",0.0363172359638791,0.0585234804489503,0.215972461273666,2.03304965937192,184,140,"ASB13, ASB14, ASB3, ASB6, ASB7, ASB8, BTBD1, BTRC, CCNF, COMMD1, COMMD10, COMMD3, COMMD4, COMMD6, COMMD7, COMMD9, COPS2, COPS3, COPS5, COPS7A, COPS7B, COPS8, CUL1, CUL2, CUL3, CUL4A, CUL5, CUL7, CUL9, DCAF10, DCAF11, DCAF13, DCAF17, DCAF4, DCAF5, DCAF6, DCAF7, DCAF8, DCUN1D1, DCUN1D3, DCUN1D4, DCUN1D5, DDB1, DDB2, ELOC, EPAS1, ERCC8, FBXL12, FBXL13, FBXL15, FBXL19, FBXL20, FBXL22, FBXL3, FBXL4, FBXL5, FBXL7, FBXO10, FBXO11, FBXO2, FBXO21, FBXO22, FBXO31, FBXO4, FBXO41, FBXO7, FBXW11, FBXW2, FBXW4, FBXW7, FBXW8, FEM1B"
"408","Negative epigenetic regulation of rRNA expression",0.0271240526525728,0.0473919146124775,-0.248030118542778,-1.7033386365911,135,34,"ZNRD1, UBTF, TTF1, TAF1D, TAF1B, TAF1A, SUV39H1, SMARCA5, SIN3B, SIN3A, SAP30L, SAP30BP, SAP18, SAP130, POLR2L, POLR2K, POLR2E, POLR1E, POLR1D, POLR1B, POLR1A"
"409","Negative regulation of FGFR1 signaling",0.638961561682431,0.655601185684578,-0.17818138651472,-0.854586943764741,3174,16,"UBC, UBB, SRC, SPRY2, PTPN11, PPP2R1A, PPP2CB, PPP2CA, MKNK1, MAPK1, GRB2, FRS2, FGFR1, FGF1"
"410","Negative regulation of FGFR2 signaling",0.638961561682431,0.655601185684578,-0.17818138651472,-0.854586943764741,3174,16,"UBC, UBB, SRC, SPRY2, PTPN11, PPP2R1A, PPP2CB, PPP2CA, MKNK1, MAPK1, GRB2, FRS2, FGFR2, FGF1"
"411","Negative regulation of FGFR3 signaling",0.638961561682431,0.655601185684578,-0.17818138651472,-0.854586943764741,3174,16,"UBC, UBB, SRC, SPRY2, PTPN11, PPP2R1A, PPP2CB, PPP2CA, MKNK1, MAPK1, GRB2, FRS2, FGFR3, FGF1"
"412","Negative regulation of FGFR4 signaling",0.695704779189353,0.70920487192912,-0.175707220573689,-0.81495820385601,3449,15,"UBC, UBB, SRC, SPRY2, PTPN11, PPP2R1A, PPP2CB, PPP2CA"
"413","Negative regulation of MAPK pathway",0.0128772635814889,0.0296704201819102,-0.311729055258467,-1.85742985433546,63,25,"YWHAB, UBC, UBB, RAF1, PPP5C, PPP2R5E, PPP2R5D, PPP2R5C, PPP2R5B, PPP2R5A, PPP2R1B, PPP2R1A, PPP2CB, PPP2CA, PAQR3, NRAS, MARK3, MAPK1, MAP2K2, MAP2K1, KSR1, KRAS"
"414","Negative regulation of MET activity",0.0141385578670976,0.0314722700544431,-0.374765173788855,-1.85215314702949,69,17,"USP8, UBC, UBB, STAM2, STAM, SH3KBP1, SH3GL3, SH3GL2, SH3GL1, PTPRJ, PTPN2, PTPN1"
"415","Negative regulation of NOTCH4 signaling",0.000197941409342835,0.000873517348409267,-0.600440057088487,-4.02227308431258,0,32,"YWHAZ, UBC, UBB, TACC3, RBX1, PSMF1, PSME3, PSME1, PSMD9, PSMD7, PSMD5, PSMD4, PSMD3, PSMD2, PSMD14, PSMD13, PSMD12, PSMD11, PSMD1, PSMC6, PSMC3, PSMC1, PSMB5, PSMB4, PSMB3, PSMB2, PSMB1, PSMA6, PSMA3, PSMA1"
"416","Negative regulation of the PI3K/AKT network",0.024955080854462,0.0452190918226444,0.22543745749088,1.72564186488075,124,54,"AKT2, AKT3, CD80, EGFR, ERBB4, FGF1, FGFR1, FGFR2, FGFR3, FRS2, FYN, GAB1, GRB2, IL1RAP, IL33, INSR, IRS1, IRS2, KIT, MAPK1, NRG1, NRG2, NRG3, PDGFA, PDGFRA, PDGFRB, PHLPP1, PHLPP2, PIK3CA, PIK3CB, PIK3R1, PIK3R2, PIP4K2A, PIP4K2C, PIP5K1A, PIP5K1B, PIP5K1C, PPP2CA, PPP2CB, PPP2R1A, PPP2R1B, PPP2R5A, PPP2R5B, PPP2R5C, PPP2R5D, PPP2R5E, PTEN, PTPN11, RAC1"
"417","Negative regulators of DDX58/IFIH1 signaling",0.0187887267639416,0.038047317730172,-0.325341206681033,-1.78658978559851,93,21,"UBE2K, UBE2D3, UBE2D2, UBE2D1, UBC, UBB, TRIM25, TRAF3, TBK1, TAX1BP1"
"418","Nephrin family interactions",0.235777243589744,0.270834501382971,0.229588934930843,1.17214413918077,1176,19,"ACTN1, ACTN4, CASK, CD2AP, FYN, IQGAP1, KIRREL2, KIRREL3, MAGI2, NCK1, NCK2, NPHS1, PIK3CA, PIK3CB, PIK3R1, PIK3R2"
"419","Netrin-1 signaling",0.111442786069652,0.141869007145211,-0.189461572035075,-1.38917082771552,559,39,"WASL, UNC5C, TRPC6, TRPC5, TRPC3, TRPC1, TRIO, SRC, SLIT2, SLIT1, SIAH2, SIAH1, ROBO1, RGMA, RAC1, PTPN11, PTK2, PRKCQ, PLCG1, PITPNA, PAK1, NTN4, NTN1, NEO1, NCK1, MYO10"
"420","Neurexins and neuroligins",0.0380128720836685,0.060269905838895,0.220660446032691,1.56787894978154,188,45,"APBA1, APBA2, APBA3, BEGAIN, CASK, DBNL, DLG2, DLG4, DLGAP1, DLGAP2, DLGAP3, DLGAP4, EPB41, EPB41L1, EPB41L2, EPB41L3, EPB41L5, GRIN1, GRIN2B, GRIN2C, GRM5, HOMER1, HOMER2, LIN7A, LIN7C, LRRTM1, LRRTM2, LRRTM3, LRRTM4, NLGN1, NLGN2, NLGN3, NRXN1, NRXN2, NRXN3"
"421","Neuronal System",0.0572764465225015,0.0831194104230776,0.191307819155304,1.72307650101004,293,231,"ABAT, ACHE, ADCY1, ADCY2, ADCY3, ADCY5, ADCY7, ADCY8, ADCY9, AKAP5, ALDH2, ALDH5A1, AP2A1, AP2A2, AP2B1, AP2S1, APBA1, APBA2, APBA3, ARHGEF7, ARHGEF9, ARL6IP5, BCHE, BEGAIN, CACFD1, CACNA1A, CACNA1E, CACNA2D1, CACNA2D2, CACNA2D3, CACNB2, CACNB4, CACNG3, CACNG4, CACNG8, CALM1, CAMK1, CAMK2B, CAMK2G, CAMK4, CAMKK2, CASK, COMT, CREB1, DBNL, DLG1, DLG2, DLG4, DLGAP1, DLGAP2, DLGAP3, DLGAP4, DNAJC5, EPB41, EPB41L1, EPB41L2, EPB41L3, EPB41L5, ERBB4, GABBR1, GABBR2, GABRA1, GABRA2, GABRA3, GABRA4, GABRA5, GABRB1, GABRB2, GABRB3, GABRG3, GAD1, GIT1, GLRB, GLS, GLUL, GNAI1, GNAI2, GNAL, GNB1, GNB4, GNG12, GNG2, GNG3, GNG7, GRIA1, GRIA2, GRIA3, GRIA4, GRIK1, GRIK2, GRIK3, GRIK4, GRIK5, GRIN1, GRIN2B, GRIN2C, GRIN3A, GRIP1, GRM5, HCN1, HCN2, HOMER1, HOMER2, HSPA8, IL1RAP, IL1RAPL1, KCNA1, KCNA2, KCNAB1, KCNB1, KCNC2, KCNC3, KCND1, KCND2, KCND3, KCNF1, KCNH3, KCNH5, KCNH7, KCNH8, KCNJ10, KCNJ11, KCNJ16, KCNJ3, KCNK1, KCNK10, KCNK2, KCNMA1, KCNMB4, KCNN1, KCNN2, KCNN3, KCNQ1, KCNQ2, KCNQ3, KCNQ5, KIF17, KPNA2, KRAS, LIN7A, LIN7C, LRFN2, LRRC4B, LRRC7, LRRTM1, LRRTM2, LRRTM3, LRRTM4"
"422","Neurotransmitter receptors and postsynaptic signal transmission",0.0286278381046397,0.0493746754017517,0.276007675821052,2.52100825541629,144,107,"ADCY1, ADCY2, ADCY3, ADCY5, ADCY7, ADCY8, ADCY9, AKAP5, AP2A1, AP2A2, AP2B1, AP2S1, APBA1, ARHGEF7, ARHGEF9, CACNG3, CACNG4, CACNG8, CALM1, CAMK1, CAMK2B, CAMK2G, CAMK4, CAMKK2, CASK, CREB1, DLG1, DLG2, DLG4, EPB41L1, ERBB4, GABBR1, GABBR2, GABRA1, GABRA2, GABRA3, GABRA4, GABRA5, GABRB1, GABRB2, GABRB3, GABRG3, GIT1, GLRB, GNAI1, GNAI2, GNAL, GNB1, GNB4, GNG12, GNG2, GNG3, GNG7, GRIA1, GRIA2, GRIA3, GRIA4, GRIK1, GRIK2, GRIK3, GRIK4, GRIK5, GRIN1, GRIN2B, GRIN2C, GRIN3A, GRIP1, KCNJ10, KCNJ16, KCNJ3, KIF17, KPNA2, KRAS, LIN7A, LIN7C, LRRC7, MAPK1, MAPT, MYO6, NCALD, NEFL, NPTN, NRAS, NRG1, NRGN, NSF, PDPK1, PLCB1, PPM1E, PRKAA2, PRKAB2, PRKACA, PRKACB, PRKAG2, PRKAR1A, PRKAR2A, PRKAR2B, PRKCA, PRKCB"
"423","Neurotransmitter release cycle",0.000983477576711251,0.00363267564078923,-0.314906838291344,-2.26055360152558,4,37,"VAMP2, UNC13B, TSPOAP1, SYT1, SYN3, SYN2, SYN1, STXBP1, STX1A, SNAP25, SLC6A11, SLC6A1, SLC5A7, SLC38A2, SLC32A1, SLC1A6, SLC1A3, SLC1A2, SLC1A1, SLC17A7"
"424","Neutrophil degranulation",0.053030303030303,0.0786843223022869,0.16541537868851,1.51117813673458,272,212,"ACLY, ACTR10, ACTR1B, ACTR2, ADAM10, AGL, ALDOA, ALDOC, AMPD3, ANO6, ANXA2, AP1M1, AP2A2, APAF1, APRT, ARL8A, ARMC8, ARPC5, ARSA, ARSB, ASAH1, ATG7, ATP11A, ATP11B, ATP6AP2, ATP6V0A1, ATP6V0C, ATP6V1D, ATP8A1, BRI3, CAB39, CAP1, CAT, CCT2, CCT8, CD300A, CD47, CD63, CDK13, CEP290, CHI3L1, COMMD3, COMMD9, COPB1, COTL1, CPNE3, CPPED1, CR1, CRACR2A, CREG1, CSNK2B, CST3, CTSB, CTSZ, CYFIP1, CYSTM1, DBNL, DDOST, DDX3X, DEGS1, DERA, DGAT1, DIAPH1, DNAJC13, DNAJC3, DNAJC5, DOCK2, DOK3, DSN1, DSP, DYNC1H1, DYNC1LI1, DYNLL1, EEF2, ERP44, FABP5, FAF2, FCER1G, FRMPD3, FTH1, FTL, FUCA1, GAA, GCA, GDI2, GLB1, GM2A, GNS, GPI, GRN, GSN, GUSB, GYG1, HEXB, HGSNAT, HMOX2, HSP90AB1, HSPA8, HUWE1, IDH1, ILF2, IQGAP1, IQGAP2, IST1, ITGAV, KCMF1, LAIR1, LAMP1, LAMP2, LAMTOR1, LAMTOR3, LGALS3, LPCAT1, LRRC7, LTA4H, MAGT1, MAPK1, MAPK14, METTL7A, MLEC, MOSPD2, NCSTN, NEU1, NFAM1, NFASC, NFKB1, NPC2, NRAS, ORMDL3, OSCAR, OSTF1, PADI2, PAFAH1B2, PDXK, PECAM1, PFKL, PGAM1, PGLYRP1, PGM1, PGRMC1, PKM, PLD1, PLEKHO2, PPIA, PPIE, PRCP, PRDX4, PRDX6, PRKCD, PSAP, PSEN1, PSMB1, PSMC3, PSMD1, PSMD11, PSMD12, PSMD13, PSMD14, PSMD2, PSMD3, PSMD7, PTPRJ, PTPRN2, PYGB, PYGL, RAB10, RAB14, RAB18, RAB24, RAB27A, RAB31, RAB3A, RAB5B, RAB5C, RAB6A, RAB7A, RAB9B, RAC1, RAP1A, RAP1B"
"425","NoRC negatively regulates rRNA expression",0.0419733439427094,0.0649803438641552,-0.238726025570322,-1.61777226497657,210,33,"ZNRD1, UBTF, TTF1, TAF1D, TAF1B, TAF1A, SMARCA5, SIN3B, SIN3A, SAP30L, SAP30BP, SAP18, SAP130, POLR2L, POLR2K, POLR2E, POLR1E, POLR1D, POLR1B, POLR1A, MNAT1, MBD2, HDAC2, HDAC1, H3-3A, GTF2H5, GTF2H4, GTF2H2, GTF2H1"
"426","Non-integrin membrane-ECM interactions",0.239728759473474,0.274174546393466,0.196014985626301,1.15894629699508,1201,27,"ACTN1, AGRN, CASK, DAG1, DDR1, DMD, HSPG2, ITGA2, ITGA6, ITGAV, ITGB1, ITGB5, LAMA2, LAMA3, LAMA5, LAMB1, LAMC1"
"427","Nonhomologous End-Joining (NHEJ)",0.123092369477912,0.155693077285063,-0.245156482861401,-1.37266226246239,612,22,"XRCC6, XRCC5, XRCC4, UIMC1, UBE2V2, UBE2N, TP53BP1, TDP1, SUMO1"
"428","Nonsense Mediated Decay (NMD) enhanced by the Exon Junction Complex (EJC)",0.000200803212851406,0.000873517348409267,-0.440537602241469,-3.62329699401358,0,49,"UPF3B, UPF2, UPF1, SMG8, SMG7, SMG6, SMG5, SMG1, RPSA, RPS9, RPS8, RPS7, RPS5, RPS4X, RPS3A, RPS25, RPS24, RPS19, RPS15A, RPS15, RPS11, RPLP1, RPL8, RPL6, RPL5, RPL4, RPL37A, RPL32, RPL30, RPL3, RPL29, RPL23, RPL22L1, RPL14, RNPS1, RBM8A, PPP2R2A, PPP2R1A, PPP2CA"
"429","Nonsense Mediated Decay (NMD) independent of the Exon Junction Complex (EJC)",0.000198925800676348,0.000873517348409267,-0.542102360586957,-3.67365963405429,0,33,"UPF1, RPSA, RPS9, RPS8, RPS7, RPS5, RPS4X, RPS3A, RPS25, RPS24, RPS19, RPS15A, RPS15, RPS11, RPLP1, RPL8, RPL6, RPL5, RPL4, RPL37A, RPL32, RPL30, RPL3, RPL29, RPL23, RPL22L1, RPL14"
"430","Nonsense-Mediated Decay (NMD)",0.000200803212851406,0.000873517348409267,-0.440537602241469,-3.62329699401358,0,49,"UPF3B, UPF2, UPF1, SMG8, SMG7, SMG6, SMG5, SMG1, RPSA, RPS9, RPS8, RPS7, RPS5, RPS4X, RPS3A, RPS25, RPS24, RPS19, RPS15A, RPS15, RPS11, RPLP1, RPL8, RPL6, RPL5, RPL4, RPL37A, RPL32, RPL30, RPL3, RPL29, RPL23, RPL22L1, RPL14, RNPS1, RBM8A, PPP2R2A, PPP2R1A, PPP2CA"
"431","Notch-HLH transcription pathway",0.013997200559888,0.0312458754707982,-0.322804262594852,-1.85002710237009,69,23,"TBL1XR1, TBL1X, SNW1, RBPJ, NOTCH3, NOTCH2, NOTCH1, NCOR2, NCOR1, MAMLD1, MAML3, MAML2, KAT2B, KAT2A, HDAC9, HDAC8, HDAC7, HDAC6, HDAC4, HDAC3, HDAC2, HDAC1"
"432","Nuclear Envelope Breakdown",0.000200803212851406,0.000873517348409267,-0.406975822433611,-2.63681740662303,0,30,"VRK2, TPR, TMPO, SEH1L, RANBP2, PRKCB, PRKCA, POM121, POM121C, NUP98, NUP93, NUP54, NUP50, NUP43, NUP35, NUP214, NUP210, NUP205, NUP188, NUP160, NUP153, NUP133, NUP107, NEK9, NEK7, LPIN2, LMNB1, LEMD3, LEMD2"
"433","Nuclear Events (kinase and transcription factor activation)",0.0599520383693046,0.085377111133262,-0.302818016306499,-1.53373125040494,299,18,"RPS6KA5, RPS6KA3, RPS6KA2, RPS6KA1, PPP2R5D, PPP2R1B, PPP2R1A, PPP2CB, PPP2CA, MEF2C, MEF2A, MAPKAPK2, MAPK7, MAPK14, MAPK1"
"434","Nuclear Pore Complex (NPC) Disassembly",0.000199880071956826,0.000873517348409267,-0.540681791186602,-2.96911840724849,0,21,"TPR, SEH1L, RANBP2, POM121, POM121C, NUP98, NUP93, NUP54, NUP50, NUP43, NUP35, NUP214, NUP210, NUP205, NUP188, NUP160, NUP153, NUP133, NUP107, NEK9, NEK7"
"435","Nuclear Receptor transcription pathway",0.000402171727327569,0.00160967438820117,-0.408388783269962,-2.38747703569492,1,24,"THRB, THRA, RORC, RORB, RORA, RARB, PPARD, PPARA, NRBP1, NRBF2, NR6A1, NR4A1, NR3C2, NR3C1, NR2E1, NR2C2, NR2C1, NR1H2, NR1D2, NCOR2, NCOR1"
"436","Nuclear import of Rev protein",0.000199560965875075,0.000873517348409267,-0.565728535803349,-2.9499404739776,0,19,"TPR, SEH1L, RANBP2, POM121, POM121C, NUP98, NUP93, NUP54, NUP50, NUP43, NUP35, NUP214, NUP210, NUP205, NUP188, NUP160, NUP153, NUP133, NUP107"
"437","Nuclear signaling by ERBB4",0.447310537892422,0.478264184340879,-0.172668150895444,-0.989580361501074,2236,23,"YAP1, WWOX, TAB2, STAT5A, SRC, SPARC, S100B, PSEN2, PSEN1, NRG3, NRG2, NRG1, NCSTN, NCOR1, MXD4"
"438","Nucleobase catabolism",0.103666997026759,0.133479728197853,0.30322453016815,1.38962688858906,522,15,"DPYD, ENTPD1, ENTPD2, ENTPD6, ENTPD7, NT5C2, NT5E, NT5M, NUDT1, NUDT15, NUDT16, NUDT5, NUDT9"
"439","Nucleotide Excision Repair",0.13480194017785,0.167545629116949,-0.129401273846778,-1.34158061770756,666,79,"ZNF830, YY1, XRCC1, XPA, UVSSA, USP7, USP45, UBE2V2, UBE2N, UBE2I, UBC, UBB, TCEA1, SUMO2, SUMO1, RUVBL1, RPA1, RNF111, RFC4, RFC3, RFC1, RBX1, RAD23B, PRPF19, PPIE, POLR2L, POLR2K, POLR2J, POLR2I, POLR2G, POLR2E, POLR2D, POLR2B, POLR2A, POLK, POLE, POLD4, POLD2, PIAS3, PIAS1, PCNA, PARP2, PARP1"
"440","Nucleotide salvage",0.141526263627354,0.174800463539741,0.2875568743818,1.31782466417866,713,15,"ADA, ADK, AMPD2, AMPD3, APRT, DCK, DGUOK, GMPR, GMPR2, HPRT1"
