"","pathway","pval","padj","ES","NES","nMoreExtreme","size","leadingEdge"
"711","Regulation of RAS by GAPs",0.00020259319286872,0.000811533243965676,-0.543952436533411,-5.1110074709059,0,64,"UBC, UBB, SYNGAP1, SPRED3, SPRED2, SPRED1, RPS27A, RBX1, RASAL3, RASAL2, RASAL1, RASA4, RASA3, RASA2, RASA1, PSMF1, PSME4, PSME3, PSME2, PSME1, PSMD9, PSMD8, PSMD7, PSMD6, PSMD5, PSMD4, PSMD3, PSMD2, PSMD14, PSMD13, PSMD12, PSMD11, PSMD10, PSMD1, PSMC6, PSMC5, PSMC4, PSMC3, PSMC2, PSMC1, PSMB8, PSMB7, PSMB6, PSMB5, PSMB4, PSMB3, PSMB2, PSMB10, PSMB1, PSMA8, PSMA7, PSMA6, PSMA5, PSMA4, PSMA3, PSMA1"
"712","Regulation of RUNX1 Expression and Activity",0.01544324107501,0.0300493314393355,0.381392862488507,1.87098857200436,76,17,"AGO1, AGO2, AGO3, AGO4, CBFB, CCND1, CCND2, CCND3, CDK6"
"713","Regulation of RUNX2 expression and activity",0.000200803212851406,0.000811533243965676,-0.494216879640386,-4.6870714458499,0,65,"WWP1, UBC, UBB, TWIST1, STUB1, STAT1, SMURF1, SKP2, SKP1, RUNX2, RPS27A, RBX1, PSMF1, PSME4, PSME3, PSME2, PSME1, PSMD9, PSMD8, PSMD7, PSMD6, PSMD5, PSMD4, PSMD3, PSMD2, PSMD14, PSMD13, PSMD12, PSMD11, PSMD10, PSMD1, PSMC6, PSMC5, PSMC4, PSMC3, PSMC2, PSMC1, PSMB8, PSMB7, PSMB6, PSMB5, PSMB4, PSMB3, PSMB2, PSMB10, PSMB1, PSMA8, PSMA7, PSMA6, PSMA5, PSMA4, PSMA3, PSMA1, PPARGC1B, PPARGC1A"
"714","Regulation of RUNX3 expression and activity",0.000199481348493916,0.000811533243965676,-0.586880062817228,-4.85961544190014,0,49,"UBC, UBB, SRC, SMURF2, SMURF1, RPS27A, PSMF1, PSME3, PSME2, PSME1, PSMD9, PSMD8, PSMD7, PSMD6, PSMD5, PSMD4, PSMD3, PSMD2, PSMD14, PSMD13, PSMD12, PSMD11, PSMD10, PSMD1, PSMC6, PSMC5, PSMC4, PSMC3, PSMC2, PSMC1, PSMB8, PSMB7, PSMB6, PSMB5, PSMB4, PSMB3, PSMB2, PSMB10, PSMB1, PSMA7, PSMA6, PSMA5, PSMA4, PSMA3, PSMA1"
"715","Regulation of TNFR1 signaling",0.00235109717868339,0.00781894489358192,-0.312481804949054,-2.10271197758008,11,32,"XIAP, USP4, USP21, USP2, UBC, UBB, TRAF2, TRAF1, TRADD, TNFRSF1A, TNFAIP3, TAX1BP1, SPPL2B, SPPL2A, SHARPIN, RPS27A, RNF31, RIPK1, RBCK1, RACK1"
"716","Regulation of TP53 Activity",0.000607410406964973,0.00218670873299227,-0.176511641442066,-2.47982634910221,2,145,"ZNF385A, WRN, USP7, USP2, UBC, UBB, TTC5, TP73, TP63, TP53RK, TP53INP1, TP53BP2, TP53, TPX2, TOPBP1, TOP3A, TBP, TAF9B, TAF7L, TAF7, TAF6, TAF5, TAF4B, TAF4, TAF3, TAF2, TAF15, TAF13, TAF12, TAF11, TAF10, TAF1L, TAF1, SUPT16H, STK11, SSRP1, SMYD2, SGK1, RPS27A, RPA3, RPA2, RPA1, RNF34, RMI2, RMI1, RICTOR, RHNO1, RFFL, RFC5, RFC4, RFC3, RFC2, RBBP8, RBBP7, RAD9B, RAD9A, RAD50, RAD17, RAD1, PRMT5, PRKAG3, PRKAG2, PRKAG1, PRKAB2, PRKAB1, PRKAA2, PRKAA1, PPP2R5C, PPP2R1B, PPP2R1A, PPP2CB, PPP2CA, PPP1R13L, PPP1R13B, PML, PLK3, PIP4K2C, PIP4K2B, PIP4K2A, PIN1, PHF20"
"717","Regulation of TP53 Activity through Acetylation",0.0193640440277212,0.0350843163297959,0.293166888408448,1.78197194992085,94,28,"AKT1, AKT2, AKT3, BRD1, BRD7, BRPF1, BRPF3, CHD3, CHD4, EP300, GATAD2A, GATAD2B, HDAC1, HDAC2, ING2, ING5, KAT6A, MAP2K6, MBD3, MEAF6, MTA2, PIN1, PIP4K2A, PIP4K2B, PIP4K2C, PML"
"718","Regulation of TP53 Activity through Methylation",0.470107612594659,0.490483793945511,-0.198900934419569,-0.979691421264376,2358,17,"UBC, UBB, TTC5, TP53, SMYD2, RPS27A, PRMT5, MDM4, MDM2, L3MBTL1, KMT5A, JMY, UBA52, EP300, EHMT2, EHMT1"
"719","Regulation of TP53 Activity through Phosphorylation",0.000405926527298559,0.00151996932999572,-0.268384295247334,-2.93760549979491,1,87,"WRN, UBC, UBB, TP53RK, TP53INP1, TP53, TPX2, TOPBP1, TOP3A, TBP, TAF9B, TAF7L, TAF7, TAF6, TAF5, TAF4B, TAF4, TAF3, TAF2, TAF15, TAF13, TAF12, TAF11, TAF10, TAF1L, TAF1, SUPT16H, STK11, SSRP1, RPS27A, RPA3, RPA2, RPA1, RMI2, RMI1, RHNO1, RFC5, RFC4, RFC3, RFC2, RBBP8, RAD9B, RAD9A, RAD50, RAD17, RAD1, PRKAG3, PRKAG2, PRKAG1, PRKAB2, PRKAB1, PRKAA2, PRKAA1"
"720","Regulation of TP53 Degradation",0.183076314748913,0.20726780986691,-0.190428456397266,-1.25960529766387,925,31,"USP7, USP2, UBC, UBB, TP53, SGK1, RPS27A, RNF34, RICTOR, RFFL, PPP2R5C, PPP2R1B, PPP2R1A, PPP2CB, PPP2CA, PHF20, PDPK1, MTOR, MLST8, MDM4, MDM2, MAPKAP1"
"721","Regulation of TP53 Expression and Degradation",0.183076314748913,0.20726780986691,-0.190428456397266,-1.25960529766387,925,31,"USP7, USP2, UBC, UBB, TP53, SGK1, RPS27A, RNF34, RICTOR, RFFL, PPP2R5C, PPP2R1B, PPP2R1A, PPP2CB, PPP2CA, PHF20, PDPK1, MTOR, MLST8, MDM4, MDM2, MAPKAP1"
"722","Regulation of actin dynamics for phagocytic cup formation",0.0427690471454148,0.0611591324809255,0.195698767952176,1.52471262252214,214,55,"ABI1, ABI2, ABL1, ACTB, ACTG1, ACTR2, ACTR3, ARPC1A, ARPC1B, ARPC2, ARPC3, ARPC4, ARPC5, BAIAP2, BRK1, BTK, CD247, CDC42, CFL1, CRK, CYFIP1, CYFIP2, DOCK1, ELMO1, ELMO2, FCGR2A, GRB2, HSP90AB1, LIMK1, MAPK1, MAPK3, MYH9, MYO10, MYO1C, MYO5A, MYO9B, NCK1, NCKAP1, NCKAP1L, NCKIPSD, NF2"
"723","Regulation of activated PAK-2p34 by proteasome mediated degradation",0.000199441563621859,0.000811533243965676,-0.62503405153026,-4.9953584269935,0,46,"UBC, UBB, RPS27A, PSMF1, PSME4, PSME3, PSME2, PSME1, PSMD9, PSMD8, PSMD7, PSMD6, PSMD5, PSMD4, PSMD3, PSMD2, PSMD14, PSMD13, PSMD12, PSMD11, PSMD10, PSMD1, PSMC6, PSMC5, PSMC4, PSMC3, PSMC2, PSMC1, PSMB8, PSMB7, PSMB6, PSMB5, PSMB4, PSMB3, PSMB2, PSMB10, PSMB1, PSMA8, PSMA7, PSMA6, PSMA5, PSMA4, PSMA3, PSMA1"
"724","Regulation of beta-cell development",0.0181078331637843,0.033839222418828,0.3177068179614,1.80797096607382,88,24,"AKT1, AKT2, AKT3, CREBBP, EP300, FGF10, FOXO1, HES1, HNF1A, HNF1B, HNF4G, INS, INSM1, KAT2A, KAT2B, MAML1, MAML2, MAML3, MAMLD1"
"725","Regulation of cholesterol biosynthesis by SREBP (SREBF)",0.00658682634730539,0.0177356352146159,0.999927119014649,7.6196603103237,32,51,"FDFT1, ACACA"
"726","Regulation of expression of SLITs and ROBOs",0.000202757502027575,0.000811533243965676,-0.496945259042033,-6.67293452867591,0,132,"ZSWIM8, USP33, UPF3B, UPF3A, UPF2, UBC, UBB, SLIT2, SLIT1, RPSA, RPS9, RPS8, RPS7, RPS5, RPS4X, RPS3A, RPS28, RPS27L, RPS27A, RPS25, RPS24, RPS21, RPS20, RPS19, RPS17, RPS16, RPS15A, RPS15, RPS14, RPS13, RPS12, RPS11, RPLP1, RPL8, RPL7A, RPL6, RPL5, RPL4, RPL3L, RPL38, RPL37A, RPL36, RPL35, RPL34, RPL32, RPL30, RPL3, RPL29, RPL28, RPL27, RPL26, RPL23, RPL22L1, RPL19, RPL18A, RPL18, RPL14, RPL13A, RPL12, RPL11, RPL10A, RPL10, ROBO3, ROBO2, ROBO1, RNPS1, RBX1, RBM8A, PSMF1, PSME4, PSME3, PSME2, PSME1, PSMD9, PSMD8, PSMD7, PSMD6, PSMD5, PSMD4, PSMD3, PSMD2, PSMD14, PSMD13, PSMD12, PSMD11, PSMD10, PSMD1, PSMC6, PSMC5, PSMC4, PSMC3, PSMC2, PSMC1, PSMB8, PSMB7, PSMB6, PSMB5, PSMB4, PSMB3, PSMB2, PSMB10, PSMB1, PSMA8, PSMA7, PSMA6, PSMA5, PSMA4, PSMA3, PSMA1"
"727","Regulation of insulin secretion",0.0193419740777667,0.0350843163297959,0.262634292964219,2.16767946283357,96,67,"ABCC8, ACSL3, ACSL4, ADCY5, ADCY6, ADCY8, ADRA2A, ADRA2C, AHCYL1, AKAP5, CACNA1A, CACNA1C, CACNA1D, CACNA1E, CACNA2D2, CACNB2, CACNB3, CD36, CHRM3, GLP1R, GNA11, GNA14, GNA15, GNAI1, GNAI2, GNAS, GNB1, GNB4, GNB5, GNG12, GNG13, GNG2, GNG3, GNG4, GNG7, GNGT2, INS, IQGAP1, ITPR1, ITPR2, ITPR3, KCNB1, KCNC2, KCNG2, KCNJ11, KCNS3"
"728","Regulation of lipid metabolism by PPARalpha",0.0170287727539636,0.0324220136615013,0.999926836406204,8.85719191233408,86,104,"FDFT1, ABCA1"
"729","Regulation of mRNA stability by proteins that bind AU-rich elements",0.000200682319887618,0.000811533243965676,-0.335385626643295,-3.53388962589333,0,80,"ZFP36L1, ZFP36, YWHAZ, YWHAB, XRN1, XPO1, UBC, UBB, TNPO1, SET, RPS27A, PSMF1, PSME4, PSME3, PSME2, PSME1, PSMD9, PSMD8, PSMD7, PSMD6, PSMD5, PSMD4, PSMD3, PSMD2, PSMD14, PSMD13, PSMD12, PSMD11, PSMD10, PSMD1, PSMC6, PSMC5, PSMC4, PSMC3, PSMC2, PSMC1, PSMB8, PSMB7, PSMB6, PSMB5, PSMB4, PSMB3, PSMB2, PSMB10, PSMB1, PSMA8, PSMA7, PSMA6, PSMA5, PSMA4, PSMA3, PSMA1, PRKCD, PRKCA"
"730","Regulation of mitotic cell cycle",0.000200883889112093,0.000811533243965676,-0.358413233947147,-3.54983120804855,0,71,"UBE2E1, UBE2D1, UBC, UBB, SKP2, SKP1, RPS27A, PTTG1, PSMF1, PSME4, PSME3, PSME2, PSME1, PSMD9, PSMD8, PSMD7, PSMD6, PSMD5, PSMD4, PSMD3, PSMD2, PSMD14, PSMD13, PSMD12, PSMD11, PSMD10, PSMD1, PSMC6, PSMC5, PSMC4, PSMC3, PSMC2, PSMC1, PSMB8, PSMB7, PSMB6, PSMB5, PSMB4, PSMB3, PSMB2, PSMB10, PSMB1, PSMA8, PSMA7, PSMA6, PSMA5, PSMA4, PSMA3, PSMA1"
"731","Regulation of ornithine decarboxylase (ODC)",0.000199203187250996,0.000811533243965676,-0.545207921559509,-4.41444533836277,0,47,"PSMF1, PSME4, PSME3, PSME2, PSME1, PSMD9, PSMD8, PSMD7, PSMD6, PSMD5, PSMD4, PSMD3, PSMD2, PSMD14, PSMD13, PSMD12, PSMD11, PSMD10, PSMD1, PSMC6, PSMC5, PSMC4, PSMC3, PSMC2, PSMC1, PSMB8, PSMB7, PSMB6, PSMB5, PSMB4, PSMB3, PSMB2, PSMB10, PSMB1, PSMA8, PSMA7, PSMA6, PSMA5, PSMA4, PSMA3, PSMA1, ODC1, OAZ3, OAZ2, OAZ1, NQO1"
"732","Regulation of signaling by CBL",0.574591144794575,0.589758017652097,-0.177265603541596,-0.898712460174468,2880,18,"YES1, VAV1, SYK, RAPGEF1, PIK3R3, PIK3R2, PIK3R1, PIK3CD, PIK3CB, PIK3CA"
"733","Reproduction",0.145439935717155,0.168817192893277,-0.132181670721817,-1.31894009114646,723,72,"PRDM9, UBE2I, TOP3A, TINF2, TEX15, TEX12, TERF2IP, TERF2, TERF1, SYNE2, SYNE1, SYCP3, SYCP2, SYCP1, SYCE2, SYCE1, SUN2, SUN1, STAG3, STAG2, STAG1, SMC3, SMC1B, SMC1A, RPA3, RPA2, RPA1, RBBP8, RAD51C, RAD51, RAD50, RAD21"
"734","Resolution of AP sites via the multiple-nucleotide patch replacement pathway",0.000196540880503145,0.000811533243965676,-0.429565512559403,-2.50449131440418,0,24,"RPA3, RPA2, RPA1, RFC5, RFC4, RFC3, RFC2, RFC1, POLE4, POLE3, POLE2, POLE, POLD4, POLD2, POLD1, POLB, PCNA, PARP2, PARP1, PARG"
"735","Resolution of Abasic Sites (AP sites)",0.000197550375345713,0.000811533243965676,-0.369054552514075,-2.61662400194515,0,36,"XRCC1, UNG, TDG, SMUG1, RPA3, RPA2, RPA1, RFC5, RFC4, RFC3, RFC2, RFC1, POLE4, POLE3, POLE2, POLE, POLD4, POLD2, POLD1, POLB, PNKP, PCNA, PARP2, PARP1, PARG, OGG1, NTHL1, NEIL2, NEIL1, MPG, MBD4, LIG3, LIG1"
"736","Resolution of D-Loop Structures",0.0799373040752351,0.101401021857042,-0.219168486171761,-1.47480011214282,407,32,"XRCC3, XRCC2, WRN, TOP3A, SPIDR, SLX4, SLX1A, RTEL1, RMI2, RMI1, RBBP8, RAD51D, RAD51C, RAD51B, RAD51AP1, RAD51, RAD50"
"737","Resolution of D-loop Structures through Holliday Junction Intermediates",0.133451957295374,0.15761673928227,-0.203997455225825,-1.34935859993709,674,31,"XRCC3, XRCC2, WRN, TOP3A, SPIDR, SLX4, SLX1A, RMI2, RMI1, RBBP8, RAD51D, RAD51C, RAD51B, RAD51AP1, RAD51, RAD50"
"738","Resolution of D-loop Structures through Synthesis-Dependent Strand Annealing (SDSA)",0.0816446980129845,0.103049675020134,-0.247859169273296,-1.47126600204823,414,25,"XRCC3, XRCC2, WRN, TOP3A, RTEL1, RMI2, RMI1, RBBP8, RAD51D, RAD51C, RAD51B, RAD51AP1, RAD51, RAD50"
"739","Resolution of Sister Chromatid Cohesion",0.165770073719865,0.189800163681521,0.125686532281624,1.07206225179206,831,80,"AHCTF1, B9D2, BIRC5, BUB3, CCNB2, CDCA8, CENPC, CENPF, CENPH, CENPK, CENPM, CENPN, CENPO, CENPP, CENPQ, CENPT, CENPU, CKAP5, CLASP1, CLASP2, CLIP1, DYNC1H1, DYNC1I1, DYNC1I2, DYNC1LI1, DYNC1LI2, DYNLL1, DYNLL2, HDAC8, INCENP, ITGB3BP, KIF2A, KNL1, KNTC1, MAD1L1, MAPRE1, MIS12, NDEL1, NSL1, NUDC, NUF2, NUP107, NUP133, NUP160, NUP37, NUP43, NUP85, NUP98, PAFAH1B1, PDS5A, PDS5B, PMF1, PPP1CC, PPP2CA, PPP2CB, PPP2R1A, PPP2R1B, PPP2R5A, PPP2R5B, PPP2R5C, PPP2R5D, PPP2R5E, RAD21, RANBP2, RANGAP1, RCC2"
"740","Respiratory electron transport",0.000205549845837616,0.000811533243965676,-0.287090249790315,-3.23280884844088,0,93,"UQCRQ, UQCRH, UQCRFS1, UQCRC2, UQCRC1, UQCRB, UQCR11, UQCR10, TRAP1, TMEM126B, TIMMDC1, TACO1, SURF1, SDHD, SDHC, SDHB, SDHA, SCO2, SCO1, NUBPL, NDUFV3, NDUFV2, NDUFV1, NDUFS8, NDUFS7, NDUFS6, NDUFS5, NDUFS4, NDUFS3, NDUFS2, NDUFS1, NDUFC2, NDUFC1, NDUFB9, NDUFB8, NDUFB7, NDUFB6, NDUFB5, NDUFB4, NDUFB3, NDUFB2, NDUFB11, NDUFB10, NDUFB1, NDUFAF7, NDUFAF6, NDUFAF5, NDUFAF4, NDUFAF3, NDUFAF2, NDUFAF1, NDUFAB1, NDUFA9, NDUFA8, NDUFA7, NDUFA6, NDUFA5, NDUFA4, NDUFA3, NDUFA2, NDUFA12, NDUFA11, NDUFA10, NDUFA1, MT-ND5, MT-ND4, MT-ND2, MT-ND1, MT-CYB, MT-CO3, MT-CO1"
"741","Respiratory electron transport, ATP synthesis by chemiosmotic coupling, and heat production by uncoupling proteins.",0.0332811276429131,0.0513698015984506,0.244747248142878,2.18268706046968,169,109,"ACAD9, ATP5F1A, ATP5F1B, ATP5F1C, ATP5F1D, ATP5F1E, ATP5MC3, ATP5PD, ATP5PF, ATP5MF, ATP5ME, ATP5MG, ATP5PO, COQ10A, COQ10B, COX11, COX14, COX18, COX19, COX20, COX5A, COX5B, COX6A1, COX6B1, COX6C, COX7A2L, COX7B, COX7C, COX8A, CYC1, DMAC2L, ECSIT, ETFA, ETFDH, LRPPRC, MT-CO1, MT-CO3, MT-CYB, MT-ND1, MT-ND2, MT-ND4, MT-ND5, NDUFA1, NDUFA10, NDUFA11, NDUFA12, NDUFA2, NDUFA3, NDUFA4, NDUFA5, NDUFA6, NDUFA7, NDUFA8, NDUFA9, NDUFAB1, NDUFAF1, NDUFAF2, NDUFAF3, NDUFAF4, NDUFAF5, NDUFAF6, NDUFAF7, NDUFB1, NDUFB10, NDUFB11, NDUFB2, NDUFB3, NDUFB4, NDUFB5, NDUFB6, NDUFB7, NDUFB8, NDUFB9, NDUFC1, NDUFC2, NDUFS1, NDUFS2, NDUFS3, NDUFS4, NDUFS5, NDUFS6, NDUFS7, NDUFS8, NDUFV1, NDUFV2, NDUFV3"
"742","Response of EIF2AK4 (GCN2) to amino acid deficiency",0.000200682319887618,0.000811533243965676,-0.494380263710369,-4.83433360261186,0,69,"RPSA, RPS9, RPS8, RPS7, RPS5, RPS4X, RPS3A, RPS28, RPS27L, RPS27A, RPS25, RPS24, RPS21, RPS20, RPS19, RPS17, RPS16, RPS15A, RPS15, RPS14, RPS13, RPS12, RPS11, RPLP1, RPL8, RPL7A, RPL6, RPL5, RPL4, RPL3L, RPL38, RPL37A, RPL36, RPL35, RPL34, RPL32, RPL30, RPL3, RPL29, RPL28, RPL27, RPL26, RPL23, RPL22L1, RPL19, RPL18A, RPL18, RPL14, RPL13A, RPL12, RPL11, RPL10A, RPL10"
"743","Response of Mtb to phagocytosis",0.669095922789049,0.681224549788246,-0.151216708048938,-0.828549731081497,3396,21,"VPS33B, UBC, UBB, TRIM27, SFPQ, RPS27A, RNF213, RAB7A, RAB5A, PGK1, MAPK3, MAPK1, KPNB1, KPNA1, HGS, GSK3A, UBA52, ENO1, DUSP16"
"744","Response to elevated platelet cytosolic Ca2+",0.278483606557377,0.304046356619339,-0.095955150919664,-1.14840245644023,1358,105,"WDR1, VWF, VTI1B, VEGFD, VEGFC, VEGFB, VEGFA, VCL, TUBA4A, TTN, TF, TOR4A, TMX3, TMSB4X, TLN1, TIMP3, TIMP1, THBS1, TGFB3, TGFB2, TEX264, STXBP3, STXBP2, STX4, SRGN, SPARC, SOD1, SERPING1, SERPINF2, SERPINE1, SERPINA3, SELP, SELENOP, SCG3, SCCPDH, RARRES2, RAB27B, QSOX1, PSAP, PROS1, PRKCG, PRKCB, PRKCA, PPIA, PLEK, PHACTR2, PFN1, PECAM1, PDGFB, PDGFA, PCYOX1L, PCDH7"
"745","Retinoid metabolism and transport",0.000203169443315725,0.000811533243965676,1,5.90280425537746,0,26,"LDLR, AGRN"
"746","Retrograde transport at the Trans-Golgi-Network",0.19789599047241,0.221810250961869,-0.15693483240653,-1.23955617580718,996,45,"VTI1A, VPS54, VPS53, VPS52, VPS51, VAMP4, USP6NL, TMF1, TGOLN2, STX6, STX16, SCOC, RIC1, RHOBTB3, RGP1, RABEPK, RAB9B, RAB9A, RAB6B, RAB6A, PLIN3, NSF, NAPG, NAPB, NAPA, NAA38, NAA35, NAA30"
"747","Rev-mediated nuclear export of HIV RNA",0.000196193839513439,0.000811533243965676,-0.515127253317806,-3.52240136548949,0,33,"XPO1, TPR, SEH1L, SEC13, RCC1, RANGAP1, RANBP2, RANBP1, RAE1, POM121, POM121C, NUP42, NUP58, NUP98, NUP93, NUP88, NUP85, NUP54, NUP50, NUP43, NUP37, NUP35, NUP214, NUP210, NUP205, NUP188, NUP160, NUP155, NUP153, NUP133, NUP107"
"748","Rho GTPase cycle",0.0362161092420344,0.0542436836202916,0.390960369203721,3.52245980574199,182,121,"ABR, AKAP13, ARAP1, ARAP2, ARAP3, ARHGAP1, ARHGAP10, ARHGAP12, ARHGAP15, ARHGAP17, ARHGAP18, ARHGAP19, ARHGAP20, ARHGAP21, ARHGAP22, ARHGAP23, ARHGAP24, ARHGAP25, ARHGAP26, ARHGAP27, ARHGAP28, ARHGAP29, ARHGAP30, ARHGAP31, ARHGAP32, ARHGAP33, ARHGAP35, ARHGAP39, ARHGAP4, ARHGAP42, ARHGAP44, ARHGAP5, ARHGAP6, ARHGAP8, ARHGDIA, ARHGDIB, ARHGDIG, ARHGEF1, ARHGEF10, ARHGEF10L, ARHGEF11, ARHGEF12, ARHGEF15, ARHGEF17, ARHGEF18, ARHGEF2, ARHGEF26, ARHGEF3, ARHGEF33, ARHGEF37, ARHGEF4, ARHGEF40, ARHGEF6, ARHGEF7, ARHGEF9"
"749","Ribosomal scanning and start codon recognition",0.0154030806161232,0.0300493314393355,0.271495190906441,2.02098888971826,76,48,"EIF1AX, EIF2S1, EIF2S2, EIF2S3, EIF3A, EIF3B, EIF3C, EIF3D, EIF3E, EIF3F, EIF3G, EIF3H, EIF3I, EIF3J, EIF3K, EIF3L, EIF3M, EIF4A1, EIF4A2, EIF4E, EIF4G1, EIF4H, EIF5, FAU, RPS18, RPS11, RPS12, RPS13, RPS14, RPS15, RPS15A, RPS16, RPS17, RPS19, RPS20, RPS21, RPS24, RPS25, RPS27A, RPS27L, RPS28, RPS3A, RPS4X, RPS5, RPS7, RPS8, RPS9, RPSA"
"750","Role of phospholipids in phagocytosis",0.00747002162374681,0.01888047965402,-0.349309090909091,-1.9547818140425,37,22,"SYK, PRKCE, PRKCD, PLPP5, PLPP4, PLD4, PLD3, PLD2, PLD1, PLCG2, PLCG1, PLA2G6, PIK3R2, PIK3R1, PIK3CB, PIK3CA"
"751","S Phase",0.000202020202020202,0.000811533243965676,-0.198211199165118,-2.77946123862529,0,144,"WEE1, WAPL, UBE2E1, UBE2D1, UBC, UBB, TFDP2, TFDP1, STAG2, STAG1, SMC3, SMC1A, SKP2, SKP1, RPS27A, RPA3, RPA2, RPA1, RFC5, RFC4, RFC3, RFC2, RFC1, RBX1, RBL2, RB1, RAD21, PSMF1, PSME4, PSME3, PSME2, PSME1, PSMD9, PSMD8, PSMD7, PSMD6, PSMD5, PSMD4, PSMD3, PSMD2, PSMD14, PSMD13, PSMD12, PSMD11, PSMD10, PSMD1, PSMC6, PSMC5, PSMC4, PSMC3, PSMC2, PSMC1, PSMB8, PSMB7, PSMB6, PSMB5, PSMB4, PSMB3, PSMB2, PSMB10, PSMB1, PSMA8, PSMA7, PSMA6, PSMA5, PSMA4, PSMA3, PSMA1, PRIM2, PRIM1, POLE4, POLE3, POLE2, POLE, POLD4, POLD2, POLD1, POLA2, POLA1, PDS5B, PDS5A, PCNA, ORC6, ORC5, ORC4, ORC3, ORC2, ORC1"
"752","S33 mutants of beta-catenin aren't phosphorylated",0.0406371247702675,0.05885978960278,0.34760485570982,1.60354276298513,198,15,"AMER1, APC, AXIN1, CSNK1A1, CTNNB1, GSK3B, PPP2CA, PPP2CB, PPP2R1A, PPP2R1B, PPP2R5A, PPP2R5B, PPP2R5C, PPP2R5D, PPP2R5E"
"753","S37 mutants of beta-catenin aren't phosphorylated",0.0406371247702675,0.05885978960278,0.34760485570982,1.60354276298513,198,15,"AMER1, APC, AXIN1, CSNK1A1, CTNNB1, GSK3B, PPP2CA, PPP2CB, PPP2R1A, PPP2R1B, PPP2R5A, PPP2R5B, PPP2R5C, PPP2R5D, PPP2R5E"
"754","S45 mutants of beta-catenin aren't phosphorylated",0.0406371247702675,0.05885978960278,0.34760485570982,1.60354276298513,198,15,"AMER1, APC, AXIN1, CSNK1A1, CTNNB1, GSK3B, PPP2CA, PPP2CB, PPP2R1A, PPP2R1B, PPP2R5A, PPP2R5B, PPP2R5C, PPP2R5D, PPP2R5E"
"755","SCF(Skp2)-mediated degradation of p27/p21",0.000201775625504439,0.000811533243965676,-0.49853185294599,-4.2759645476147,0,53,"UBC, UBB, SKP2, SKP1, RPS27A, PSMF1, PSME3, PSME2, PSME1, PSMD9, PSMD8, PSMD7, PSMD6, PSMD5, PSMD4, PSMD3, PSMD2, PSMD14, PSMD13, PSMD12, PSMD11, PSMD10, PSMD1, PSMC6, PSMC5, PSMC4, PSMC3, PSMC2, PSMC1, PSMB8, PSMB7, PSMB6, PSMB5, PSMB4, PSMB3, PSMB2, PSMB10, PSMB1, PSMA7, PSMA6, PSMA5, PSMA4, PSMA3, PSMA1"
"756","SCF-beta-TrCP mediated degradation of Emi1",0.000199481348493916,0.000811533243965676,-0.586880062817228,-4.85961544190014,0,49,"UBC, UBB, SKP1, RPS27A, PSMF1, PSME4, PSME3, PSME2, PSME1, PSMD9, PSMD8, PSMD7, PSMD6, PSMD5, PSMD4, PSMD3, PSMD2, PSMD14, PSMD13, PSMD12, PSMD11, PSMD10, PSMD1, PSMC6, PSMC5, PSMC4, PSMC3, PSMC2, PSMC1, PSMB8, PSMB7, PSMB6, PSMB5, PSMB4, PSMB3, PSMB2, PSMB10, PSMB1, PSMA8, PSMA7, PSMA6, PSMA5, PSMA4, PSMA3, PSMA1"
"757","SHC-mediated cascade:FGFR1",0.0318562385133755,0.0497784499799423,0.360151195754888,1.66142052979635,155,15,"FGF1, FGF10, FGF2, FGF20, FGF22, FGF4, FGF5, FGF9, FGFR1, GRB2, HRAS, KRAS"
"758","SHC-mediated cascade:FGFR2",0.0148415563578018,0.0293636271579993,0.383762054440097,1.88261105239738,73,17,"FGF1, FGF10, FGF18, FGF2, FGF20, FGF22, FGF4, FGF5, FGF7, FGF9, FGFR2, GRB2, HRAS, KRAS"
"759","SHC1 events in ERBB2 signaling",0.124288238759081,0.147482874865529,-0.256617219313554,-1.37592862349802,632,20,"SOS1, SHC1, PTPN12, PRKCE, PRKCD, PRKCA, NRG4, NRG3, NRG2, NRG1, NRAS, KRAS, HRAS, HBEGF, GRB2, ERBB4, ERBB3, ERBB2, EGFR, EGF"
"760","SLC transporter disorders",0.000200883889112093,0.000811533243965676,-0.507708840227088,-5.06603934076661,0,72,"TPR, SLCO2A1, SLCO1B3, SLCO1B1, SLC9A9, SLC9A6, SLC6A20, SLC6A19, SLC5A7, SLC5A5, SLC5A1, SLC4A4, SLC3A2, SLC3A1, SLC35C1, SLC35A3, SLC35A2, SLC35A1, SLC33A1, SLC2A9, SLC2A2, SLC2A1, SLC29A3, SLC27A4, SLC26A4, SLC26A2, SLC24A5, SLC24A4, SLC24A1, SLC22A5, SLC22A12, SLC20A2, SLC1A3, SLC1A1, SLC17A8, SLC17A5, SLC16A1, SLC12A6, SLC12A3, SLC12A1, SLC11A2, SEH1L, SEC13, RANBP2, RAE1, POM121, POM121C, NUP42, NUP58, NUP98, NUP93, NUP88, NUP85, NUP54, NUP50, NUP43, NUP37, NUP35, NUP214, NUP210, NUP205, NUP188, NUP160, NUP155, NUP153, NUP133, NUP107"
"761","SLC-mediated transmembrane transport",0.000206015657189946,0.000811533243965676,-0.695510299795068,-11.0756988827748,0,189,"SRI, SLCO4C1, SLCO3A1, SLCO2B1, SLCO2A1, SLCO1C1, SLCO1B3, SLCO1B1, SLCO1A2, SLC9A9, SLC9A8, SLC9A7, SLC9A6, SLC9A5, SLC9A4, SLC9A3, SLC9A2, SLC9A1, SLC8B1, SLC8A3, SLC8A2, SLC8A1, SLC7A8, SLC7A6, SLC7A5, SLC7A3, SLC7A2, SLC7A11, SLC7A10, SLC7A1, SLC6A9, SLC6A7, SLC6A6, SLC6A20, SLC6A19, SLC6A15, SLC6A13, SLC6A12, SLC6A11, SLC6A1, SLC5A7, SLC5A6, SLC5A5, SLC5A4, SLC5A12, SLC5A11, SLC5A10, SLC5A1, SLC50A1, SLC4A9, SLC4A8, SLC4A7, SLC4A5, SLC4A4, SLC4A3, SLC4A2, SLC4A10, SLC47A1, SLC44A5, SLC44A2, SLC44A1, SLC43A2, SLC43A1, SLC41A2, SLC41A1, SLC3A2, SLC3A1, SLC39A6, SLC39A3, SLC39A2, SLC39A14, SLC39A10, SLC39A1, SLC38A5, SLC38A3, SLC38A2, SLC38A1, SLC36A4, SLC36A1, SLC35D2, SLC35D1, SLC35C1, SLC35B4, SLC35B3, SLC35B2, SLC35A3, SLC35A2, SLC35A1, SLC33A1, SLC32A1, SLC31A1, SLC30A8, SLC30A7, SLC30A6, SLC30A5, SLC30A3, SLC30A10, SLC30A1, SLC2A9, SLC2A8, SLC2A7, SLC2A6, SLC2A2, SLC2A13, SLC2A12, SLC2A1, SLC29A4, SLC29A3, SLC29A2, SLC29A1, SLC28A3, SLC28A2, SLC27A6, SLC27A4, SLC27A1, SLC26A6, SLC26A4, SLC26A2, SLC26A11, SLC26A1, SLC25A5, SLC25A4, SLC25A29, SLC25A26, SLC25A22, SLC25A18, SLC24A5, SLC24A4, SLC24A3, SLC24A2, SLC24A1, SLC22A8, SLC22A5, SLC22A4, SLC22A3, SLC22A2, SLC22A15, SLC22A12, SLC22A1, SLC20A2, SLC20A1, SLC1A7, SLC1A6, SLC1A5, SLC1A4, SLC1A3, SLC1A2, SLC1A1, SLC18A2, SLC18A1, SLC17A8, SLC17A7, SLC17A6, SLC17A5, SLC16A7, SLC16A2, SLC16A10, SLC16A1, SLC15A4, SLC15A3, SLC15A2, SLC14A2, SLC14A1, SLC13A5, SLC13A4, SLC13A1, SLC12A6, SLC12A5, SLC12A3, SLC12A2, SLC12A1, SLC11A2, SLC11A1"
"762","SMAD2/SMAD3:SMAD4 heterotrimer regulates transcription",0.0477688224886967,0.0663382960660334,-0.248296938629572,-1.59048889511587,242,29,"WWTR1, UBC, UBB, TGIF2, TFDP2, TFDP1, SP1, SNW1, SMAD7, SMAD4, SMAD3, SMAD2, SERPINE1, RPS27A, RNF111, RBL1"
"763","SRP-dependent cotranslational protein targeting to membrane",0.000201045436268597,0.000811533243965676,-0.654513709490638,-6.9797493848969,0,82,"TRAM1, SSR4, SSR3, SSR2, SSR1, SRPRB, SRPRA, SRP9, SRP72, SRP68, SRP54, SRP19, SRP14, SPCS2, SPCS1, SEC61G, SEC61B, SEC61A2, SEC61A1, SEC11C, SEC11A, RPSA, RPS9, RPS8, RPS7, RPS5, RPS4X, RPS3A, RPS28, RPS27L, RPS27A, RPS25, RPS24, RPS21, RPS20, RPS19, RPS17, RPS16, RPS15A, RPS15, RPS14, RPS13, RPS12, RPS11, RPN2, RPN1, RPLP1, RPL8, RPL7A, RPL6, RPL5, RPL4, RPL3L, RPL38, RPL37A, RPL36, RPL35, RPL34, RPL32, RPL30, RPL3, RPL29, RPL28, RPL27, RPL26, RPL23, RPL22L1, RPL19, RPL18A, RPL18, RPL14, RPL13A, RPL12, RPL11, RPL10A, RPL10"
"764","SUMO E3 ligases SUMOylate target proteins",0.000203500203500203,0.000811533243965676,-0.237070211570867,-3.3506036645261,0,147,"ZNF131, XRCC4, XPC, WRN, VDR, UHRF2, UBE2I, TP53BP1, TP53, TRIM28, TRIM27, TPR, TOPORS, TOP2B, TOP2A, TOP1, THRB, THRA, TDG, SUZ12, SUMO2, SUMO1, STAG2, STAG1, SP3, SMC6, SMC5, SMC3, SMC1A, SIN3A, SEH1L, SEC13, SCMH1, SATB2, SATB1, SAFB, RPA1, RORA, RNF2, RNF168, RING1, RELA, RARA, RANGAP1, RANBP2, RAE1, RAD52, RAD21, PPARGC1A, PPARG, PPARA, POM121, POM121C, PML, PIAS4, PIAS3, PIAS2, PIAS1, PHC3, PHC2, PHC1, PGR, PCNA, PCGF2, PARP1, PARK7, NUP42, NUP58, NUP98, NUP93, NUP88, NUP85, NUP54, NUP50, NUP43, NUP37, NUP35, NUP214, NUP210, NUP205, NUP188, NUP160, NUP155, NUP153, NUP133, NUP107, NSMCE2, NSMCE1, NRIP1, NR4A2, NR3C2, NR3C1, NR2C1, NR1H3, NR1H2, NOP58, NFKBIA, NFKB2, NDC1, NCOR2, NCOA2, NCOA1"
"765","SUMOylation",0.000205930807248764,0.000811533243965676,-0.24931432298303,-3.58534900386244,0,153,"ZNF131, XRCC4, XPC, WRN, VDR, UHRF2, UBE2I, UBA2, TP53BP1, TP53, TRIM28, TRIM27, TPR, TOPORS, TOP2B, TOP2A, TOP1, THRB, THRA, TDG, SUZ12, SUMO2, SUMO1, STAG2, STAG1, SP3, SMC6, SMC5, SMC3, SMC1A, SIN3A, SENP5, SENP2, SENP1, SEH1L, SEC13, SCMH1, SATB2, SATB1, SAFB, SAE1, RWDD3, RPA1, RORA, RNF2, RNF168, RING1, RELA, RARA, RANGAP1, RANBP2, RAE1, RAD52, RAD21, PPARGC1A, PPARG, PPARA, POM121, POM121C, PML, PIAS4, PIAS3, PIAS2, PIAS1, PHC3, PHC2, PHC1, PGR, PCNA, PCGF2, PARP1, PARK7, NUP42, NUP58, NUP98, NUP93, NUP88, NUP85, NUP54, NUP50, NUP43, NUP37, NUP35, NUP214, NUP210, NUP205, NUP188, NUP160, NUP155, NUP153, NUP133, NUP107, NSMCE2, NSMCE1, NRIP1, NR4A2, NR3C2, NR3C1, NR2C1, NR1H3, NR1H2, NOP58, NFKBIA, NFKB2, NDC1, NCOR2, NCOA2, NCOA1"
"766","SUMOylation of DNA damage response and repair proteins",0.000200160128102482,0.000811533243965676,-0.399728923827596,-3.93793562827547,0,70,"XRCC4, XPC, WRN, UBE2I, TPR, TDG, SUMO2, SUMO1, STAG2, STAG1, SMC6, SMC5, SMC3, SMC1A, SEH1L, SEC13, SCMH1, RPA1, RNF2, RNF168, RING1, RANBP2, RAE1, RAD52, RAD21, POM121, POM121C, PML, PIAS4, PIAS2, PIAS1, PHC3, PHC2, PHC1, PCGF2, PARP1, NUP42, NUP58, NUP98, NUP93, NUP88, NUP85, NUP54, NUP50, NUP43, NUP37, NUP35, NUP214, NUP210, NUP205, NUP188, NUP160, NUP155, NUP153, NUP133, NUP107, NSMCE2, NSMCE1"
"767","SUMOylation of DNA methylation proteins",0.479839518555667,0.49857939697819,0.199422070369293,0.954376990032565,2391,16,"BMI1, CBX2, CBX4, CBX8, DNMT1, DNMT3A, DNMT3B"
"768","SUMOylation of DNA replication proteins",0.000199600798403194,0.000811533243965676,-0.436326431742687,-3.36022966809133,0,43,"UBE2I, TPR, TOP2B, TOP2A, TOP1, SUMO2, SUMO1, SEH1L, SEC13, RANGAP1, RANBP2, RAE1, POM121, POM121C, PIAS4, PIAS3, PCNA, NUP42, NUP58, NUP98, NUP93, NUP88, NUP85, NUP54, NUP50, NUP43, NUP37, NUP35, NUP214, NUP210, NUP205, NUP188, NUP160, NUP155, NUP153, NUP133, NUP107"
"769","SUMOylation of RNA binding proteins",0.000199441563621859,0.000811533243965676,-0.390591641378786,-3.12166231983327,0,46,"UBE2I, TPR, SUMO2, SUMO1, SEH1L, SEC13, SCMH1, RNF2, RING1, RANBP2, RAE1, POM121, POM121C, PHC3, PHC2, PHC1, PCGF2, NUP42, NUP58, NUP98, NUP93, NUP88, NUP85, NUP54, NUP50, NUP43, NUP37, NUP35, NUP214, NUP210, NUP205, NUP188, NUP160, NUP155, NUP153, NUP133, NUP107, NOP58, NDC1"
