"","pathway","pval","padj","ES","NES","nMoreExtreme","size","leadingEdge"
"1","HALLMARK_TNFA_SIGNALING_VIA_NFKB",0.290608824254375,0.86798156499331,0.286984501232997,1.06550930710659,1178,162,"PDE4B, PLK2, SMAD3, PTPRE, SGK1, INHBA, IL12B, SAT1, DRAM1, ATP2B1, RHOB, BTG3, TNIP2, IRS2, ABCA1, MARCKS, NFIL3, CEBPB, DENND5A, ETS2, IFIT2, EFNA1, TNFAIP6"
"2","HALLMARK_HYPOXIA",0.370965016055433,0.86798156499331,-0.286601294927921,-1.03385374165572,2194,173,"PRKCA, GAA, BTG1, BCAN, SCARB1, TES, AKAP12, KIF5A, NAGK, P4HA1, MYH9, NEDD4L, GPC3, RBPJ, GCNT2, VLDLR, KLF7, MAP3K1, AMPD3, PDGFB, LDHA, KLHL24, PNRC1, PPARGC1A, PDK3, B4GALNT2, ERO1A, GPC1, PFKFB3, TPST2, PPFIA4, JUN, GPC4, F3, PGM1, HDLBP"
"3","HALLMARK_CHOLESTEROL_HOMEOSTASIS",0.795659078877713,0.999829467939973,-0.259426270947353,-0.818642216752556,4508,68,"GNAI1, PCYT2, ATXN2, SQLE, ACTG1, PNRC1, GUSB, CYP51A1, PDK3, CTNNB1, SC5D, SREBF2"
"4","HALLMARK_MITOTIC_SPINDLE",0.179952909519004,0.86798156499331,-0.312901970647356,-1.14076064384611,1069,191,"RASAL2, DOCK4, ARHGAP5, ALMS1, SMC3, KIFAP3, HOOK3, CDC42BPA, MAPRE1, ABI1, ARHGEF12, SPTBN1, MYO1E, LLGL1, WASL, WASF1, MYH9, ABL1, NEDD9, ALS2, CAPZB, NCK1, RHOF, TUBGCP6, HDAC6, TRIO, ITSN1, RAPGEF6, MAP1S, ATG4B, NUSAP1, KIF1B, SSH2, ARFGEF1, LMNB1, TUBD1, ARL8A, ACTN4, FSCN1, CKAP5, FLNA, AKAP13, STK38L, PAFAH1B1, CNTRL, RAB3GAP1, KPTN, FARP1, LATS1, ARFIP2"
"5","HALLMARK_WNT_BETA_CATENIN_SIGNALING",0.116948542641238,0.86798156499331,-0.461430973557765,-1.30702664149667,649,38,"GNAI1, NUMB, NCOR2, NCSTN, AXIN1, HDAC11, RBPJ, WNT5B, CSNK1E, HDAC5, CTNNB1"
"6","HALLMARK_TGF_BETA_SIGNALING",0.240847092605887,0.86798156499331,-0.38368492265545,-1.15265984084077,1341,52,"HIPK2, ACVR1, TRIM33, NCOR2, SPTBN1, MAP3K7, SMAD7, FNTA, SMURF2, RAB31, CTNNB1, ARID4B, UBE2D3"
"7","HALLMARK_IL6_JAK_STAT3_SIGNALING",0.0199430199430199,0.86798156499331,-0.485238775710718,-1.49984973579506,111,61,"CSF2RA, TNFRSF21, PTPN1, TYK2, PTPN2, PDGFC, STAT3, PTPN11, IRF9, STAT2, IL1R2, JUN, CBL"
"8","HALLMARK_DNA_REPAIR",0.189805825242718,0.86798156499331,0.309887099128771,1.13489366455092,781,144,"PDE4B, POLA1, GTF2A2, ERCC4, ITPA, ZWINT, PRIM1, NT5C3A, GTF2H1, DAD1, RFC2, EDF1, USP11, HPRT1, POLR2D, POLR2K, DUT, GMPR2, TAF9, POLR2H, POLR1C, NELFCD, TAF6, SF3A3, NFX1, BRF2, GTF2B, SDCBP, SRSF6, DGUOK, ERCC2, TP53, RNMT, TAF12, DGCR8, POLR2I, RBX1, POLR2E, ERCC5"
"9","HALLMARK_G2M_CHECKPOINT",0.343040473840079,0.86798156499331,0.277442972272349,1.04308999493538,1389,179,"MEIS2, RPS6KA5, STMN1, SMAD3, PURA, MEIS1, DMD, KIF11, UBE2S, HMGN2, ORC6, TMPO, NUMA1, EZH2, UCK2, HNRNPD, G3BP1, SRSF10, CDC27, DTYMK, MARCKS, MCM6, RAD21, SRSF2, POLQ, PRC1, WRN, MAP3K20, SRSF1, SMC4, BUB3, XPO1, TOP2A, CDC25A, CCNT1, TROAP, KIF20B"
"10","HALLMARK_APOPTOSIS",0.841277522380837,0.999829467939973,0.233138761214409,0.840633732149785,3476,131,"DPYD, ANKH, LEF1, PLPPR4, CREBBP, SAT1, RHOB, BTG3, PLAT, PTK2, LMNA, TGFBR3, BNIP3L, DFFA, TOP2A, CASP3"
"11","HALLMARK_NOTCH_SIGNALING",0.530506953790938,0.86798156499331,0.33965848214949,0.949280583021296,2364,31,"TCF7L2, MAML2, ST3GAL6, DTX4, DTX1"
"12","HALLMARK_ADIPOGENESIS",0.242138893559778,0.86798156499331,-0.302646826938228,-1.10024024550162,1439,185,"MAP4K3, MYLK, SPARCL1, ATP5PO, UBQLN1, REEP5, SUCLG1, SCARB1, BAZ2A, ENPP2, PREB, SAMM50, GPHN, ACLY, ARL4A, CRAT, ELOVL6, PTCD3, DLAT, ITSN1, ME1, MDH2, DLD, DGAT1, ESYT1, ALDH2, SLC27A1, ATL2, ABCB8, PFKFB3, NKIRAS1, COL15A1, VEGFB, TANK, PGM1, UQCR10, IDH3G, EPHX2, MARC2, ATP1B3"
"13","HALLMARK_ESTROGEN_RESPONSE_EARLY",0.775551439636302,0.999829467939973,-0.242467795465938,-0.875967926681706,4605,174,"NAV2, GFRA1, SLC24A3, DLC1, ABAT, SLC1A1, FKBP4, DEPTOR, NCOR2, SCARB1, ENDOD1, TPD52L1, SLC22A5, ABHD2, SYNGR1, ELF1, RETREG1, SNX24, AMFR, RAB31, PGR, CALB2, GREB1, RRP12, SLC37A1, FARP1, UNC119, MAPT, SYBU, GLA, NBL1, MYBBP1A, MYBL1, SULT2B1"
"14","HALLMARK_ESTROGEN_RESPONSE_LATE",0.489588623666836,0.86798156499331,-0.272921504931167,-0.982143172110067,2891,169,"CACNA2D2, HOMER2, SLC24A3, FKBP4, PRLR, NCOR2, SCARB1, IDH2, PCP4, CHST8, CA2, TPD52L1, CXCL14, CPE, SLC22A5, RABEP1, ABHD2, CKB, AMFR, RAB31, PGR, ASS1, FARP1, MAPT, GLA, TSTA3, NBL1, HSPA4L, SLC2A8, IMPA2, SULT2B1, MEST, ID2, NAB2, FKBP5"
"15","HALLMARK_ANDROGEN_RESPONSE",0.126902364785764,0.86798156499331,0.360758718727691,1.22182531087308,541,86,"INPP4B, BMPR1B, ANKH, RPS6KA3, SGK1, GUCY1A1, SAT1, MAP7, VAPA, UBE2I, HMGCS1, ARID5B, SEC24D, TPD52, ITGAV, SORD, DNAJB9, ELOVL5, SCD, PTK2B, STK39, HMGCR, SLC38A2, UBE2J1"
"16","HALLMARK_MYOGENESIS",0.657578323454699,0.939397604935285,-0.254848239582717,-0.918406263163808,3882,172,"NAV2, MYLK, COL6A3, GAA, PDLIM7, AGRN, TAGLN, FLII, MYH9, CDH13, TPD52L1, MYOM1, CRAT, KIFC3, CRYAB, SLC6A8, CKB, ACHE, PC, COL4A2, SPEG, HDAC5, GABARAPL2, AKT2, AGL"
"17","HALLMARK_PROTEIN_SECRETION",0.580786026200873,0.86798156499331,-0.281771424882018,-0.934511858316043,3324,93,"GNAS, PPT1, SCAMP1, SCRN1, USO1, DOP1A, AP3S1, CLCN3, RAB2A, ADAM10, AP2B1, ARFGEF2, VAMP4, KIF1B, ARFGEF1, AP2S1, CTSC, CLTC, SNX2, YKT6, GBF1, GLA, MON2, BNIP3, ANP32E, COG2, SNAP23, STAM, TSG101"
"18","HALLMARK_INTERFERON_ALPHA_RESPONSE",0.589952237749867,0.86798156499331,-0.293041779172478,-0.925864972066662,3334,69,"PNPT1, NUB1, SLC25A28, ELF1, RNF31, PSMA3, MOV10, IRF9, STAT2, PARP9, PSMB8, TRIM26, SP110, PSME1, TRIM5, CMTR1"
"19","HALLMARK_INTERFERON_GAMMA_RESPONSE",0.996429785787147,0.999829467939973,-0.19190272743612,-0.675694816741619,5860,143,"PTPN1, BTG1, PNPT1, PTPN2, ARL4A, GCH1, SLC25A28, RAPGEF6, STAT3, ZNFX1, RNF31, PSMA3, HIF1A, IRF9, LYSMD2, STAT2, NCOA3, GPR18, PSMB8, NAMPT, TRIM26"
"20","HALLMARK_APICAL_JUNCTION",0.356111484217596,0.86798156499331,-0.28745761563156,-1.04183330649237,2120,180,"CDH11, CDH8, GNAI1, TRO, LAMA3, IRS1, CAP1, PLCG1, TIAL1, PKD1, PARD6G, COL9A1, NFASC, MAPK11, WASL, MYH9, CRAT, RHOF, NF2, NECTIN1, MYL9, ACTG1, NLGN3, CD276, SPEG, MPZL1, PIK3R3, ACTN4, FSCN1, CALB2, AKT2, ADAM9, JAM3"
"21","HALLMARK_APICAL_SURFACE",0.432937792161093,0.86798156499331,-0.354708547341892,-1.01141974296594,2407,39,"SULF2, SCUBE1, AKAP7, FLOT2, EFNA5, RTN4RL1, ADAM10"
"22","HALLMARK_HEDGEHOG_SIGNALING",0.40004502476362,0.86798156499331,0.362367653311423,1.0305897479649,1776,34,"THY1, UNC5C, SCG2, RTN1, TLE1"
"23","HALLMARK_COMPLEMENT",0.555985856204748,0.86798156499331,-0.268342931774328,-0.954317526382086,3301,153,"DGKG, DOCK4, DGKH, PRKCD, USP15, KCNIP2, FYN, CA2, CDH13, LRP1, CR2, DOCK10, PPP2CB, ME1, CPM, PDGFB, COL4A2, PSEN1, PLEK, ADAM9, CTSC, USP8, MT3, F3, CASP9, CALM1, PRDM4"
"24","HALLMARK_UNFOLDED_PROTEIN_RESPONSE",0.990062761506276,0.999829467939973,-0.198602918122175,-0.666136352607724,5678,101,"SRPRA, KHSRP, HSPA9, ARFGAP1, DCTN1, PREB, SLC30A5, ASNS, RRP9, EIF4G1, ERO1A, FUS, TATDN2, WIPI1, ZBTB17, CEBPG, SPCS3, EXOSC5, LSM1, DKC1, CALR, CNOT4, SEC11A, TSPYL2, HYOU1, SHC1, DNAJC3, EXOSC10, YIF1A, DDIT4, MTHFD2, SERP1"
"25","HALLMARK_PI3K_AKT_MTOR_SIGNALING",0.210427870002338,0.86798156499331,0.331985040646398,1.13731865681616,899,93,"TIAM1, CAMK4, VAV3, MAP2K6, RPS6KA3, PLCB1, MKNK1, YWHAB, RAF1, ATF1, PRKAA2, HRAS, SMAD2, NGF, GRB2, PTEN, PLA2G12A, MAPK8, HSP90B1, THEM4, FGF22"
"26","HALLMARK_MTORC1_SIGNALING",0.0371491006891915,0.86798156499331,-0.35994452986376,-1.30891483774696,220,186,"STIP1, TBK1, HSPA4, NUFIP1, PSPH, CANX, ATP2A2, TES, HSPA9, P4HA1, USO1, BCAT1, PSMC6, ACLY, SYTL2, PPA1, PSMC2, ELOVL6, PSMD12, VLDLR, RPN1, ABCF2, ASNS, PSME3, ME1, ACTR3, PSMD13, RRP9, SQLE, LDHA, GOT1, PIK3R3, PSMA3, SRD5A1, CYP51A1, ACACA, PDAP1, UFM1, PPIA, HSPD1, ERO1A, CTSC, SC5D, CCT6A, YKT6, UBE2D3, PGM1, GSR, BTG2, NAMPT, LDLR, GLA, SDF2L1"
"27","HALLMARK_E2F_TARGETS",0.999263080324245,0.999829467939973,0.178454312243035,0.670721529573376,4067,178,"STMN1, CIT, TIPIN, UBE2S, AK2, ORC6, TMPO, EZH2, RFC2, HNRNPD, MCM6, RAD21, SRSF2, DUT, SRSF1, PNN, RNASEH2A, UNG, ORC2, SMC4, SPAG5, XPO1, TOP2A, CDC25A"
"28","HALLMARK_MYC_TARGETS_V1",0.836535220761712,0.999829467939973,-0.235353885770844,-0.851235128077017,4963,177,"HNRNPU, EIF4H, CANX, PSMD3, PTGES3, ODC1, VDAC3, PSMC6, AP3S1, SRPK1, SSB, CCT7, EIF3B, PHB, RUVBL2, RRP9, LDHA, TXNL4A, MRPS18B, KPNB1, PPM1G, PPIA, HSPD1, DEK, NCBP1, RPL34, RSL1D1, USP1, STARD7, PSMA1, CCT3, SF3A1, PABPC4, POLD2, U2AF1, IFRD1, HNRNPC, PWP1, RANBP1, CLNS1A, GOT2, EIF2S2, SSBP1, SRSF3, FAM120A, PA2G4, CCT5, NCBP2, PSMA4, PRPF31, PGK1, HDGF"
"29","HALLMARK_MYC_TARGETS_V2",0.982641374373658,0.999829467939973,-0.208144535726192,-0.627297072750227,5490,53,"WDR43, FARSA, PHB, RRP9, HSPD1, RRP12, MYBBP1A, PUS1, EXOSC5, NDUFAF4, PA2G4"
"30","HALLMARK_EPITHELIAL_MESENCHYMAL_TRANSITION",0.407187658925242,0.86798156499331,-0.282561601129833,-1.01696280989684,2401,170,"CDH11, NTM, CALD1, MYLK, COL6A3, POSTN, FSTL1, LAMA3, CADM1, HTRA1, ACTA2, TAGLN, SNTB1, TPM1, LRP1, PFN2, CTHRC1, MATN2, FERMT2, SLC6A8, MYL9, FBLN5, COL4A2"
"31","HALLMARK_INFLAMMATORY_RESPONSE",0.203174603174603,0.86798156499331,0.305047936013284,1.12267275351975,831,150,"SLC4A4, PDE4B, ACVR2A, RASGRP1, PTPRE, TACR1, INHBA, IL12B, NPFFR2, RAF1, ATP2B1, CALCRL, LY6E, CX3CL1, ABCA1, PCDH7, TPBG, LYN, LPAR1"
"32","HALLMARK_XENOBIOTIC_METABOLISM",0.590227464195451,0.86798156499331,-0.263312528051678,-0.941980601276295,3502,159,"MAN1A1, LPIN2, SAR1B, ATP2A2, PTGES3, CA2, BCAT1, GCNT2, GCH1, SPINT2, COMT, PC, ALDH2, SLC35B1, GABARAPL1"
"33","HALLMARK_FATTY_ACID_METABOLISM",0.999829467939973,0.999829467939973,-0.169303992849064,-0.594433326427849,5862,140,"DLST, SUCLG1, ODC1, CA2, KMT5A, CRAT, MLYCD, SLC22A5, ME1, MDH2, DLD, SUCLA2, LDHA, GABARAPL1, HSPH1, ACSS1, D2HGDH, AUH, ACSL4, HMGCL, IDH3G, CBR1, ACOT8, EHHADH, NCAPH2, PSME1, IDI1, PTPRG, GAPDHS"
"34","HALLMARK_OXIDATIVE_PHOSPHORYLATION",0.951851851851852,0.999829467939973,0.211870771040556,0.801736875453016,3854,188,"PDP1, HCCS, UQCRC2, TOMM70, COX6C, UQCRB, PHB2, ATP5F1E, MRPL35, GPI, UQCR11, HSD17B10, ATP5F1B, BCKDHA, VDAC1, OPA1, NDUFB2, GRPEL1, AFG3L2, NDUFS3, UQCRQ, ATP6V0E1, ALAS1, TIMM9, NDUFA2, ACADVL, NDUFA3, NDUFB7, ALDH6A1, COX8A, COX5B, COX7A2, NDUFA6, NDUFB4, SLC25A4, ATP5F1A, MRPL15, NDUFA8, SDHD, ATP5ME, ATP5F1C, ATP5PF, ABCB7, MPC1, SDHB, PDHA1, MRPL11, MRPS30, ATP6V1C1, IDH1, CYB5A, POR, CS, SLC25A12, COX11, ACAA2"
"35","HALLMARK_GLYCOLYSIS",0.951272972517282,0.999829467939973,-0.217095675358718,-0.785813217539186,5641,178,"FKBP4, B3GAT1, PYGB, HOMER1, AGRN, MET, GALK2, P4HA1, GPC3, VLDLR, B3GAT3, PPP2CB, ME1, MDH2, PAXIP1, DLD, LDHA, SLC25A13, GOT1, HS6ST2, PC, GUSB, HS2ST1, PPIA, AGL, PDK3, GFPT1, ERO1A, GPC1, PPFIA4, GPC4, GMPPA, HDLBP, TSTA3, ANKZF1, ALDH7A1, BPNT1, IDUA, MPI, ARPP19, GOT2, COG2, G6PD, TPI1, GAPDHS, GNE, TGFA, XYLT2, CHST2, PGK1, LHX9, RRAGD"
"36","HALLMARK_REACTIVE_OXYGEN_SPECIES_PATHWAY",0.155102040816327,0.86798156499331,0.417390159556634,1.24276911968978,683,42,"MSRA, IPCEF1, PRDX6, PRDX2, GLRX, STK25, GCLC, NDUFA6, NDUFB4, PRDX1, SRXN1, TXNRD1, ERCC2, HMOX2, SBNO2, MBP, EGLN2, JUNB, CAT"
"37","HALLMARK_P53_PATHWAY",0.764260474507824,0.999829467939973,-0.243474521949903,-0.879989123161806,4541,175,"ABAT, HDAC3, BTG1, ABCC5, ISCU, MKNK2, PDGFA, RCHY1, POLH, TPRKB, CDH13, TPD52L1, SEC61A1, RALGDS, TM7SF3, GLS2, MDM2, SLC3A2, DGKA, HINT1, FBXW7, ZFP36L1, CD81, JUN, AEN, PTPN14, FUCA1, BTG2, ANKRA2, ZMAT3, KIF13B, EI24, HSPA4L, TSC22D1, PLK3"
"38","HALLMARK_UV_RESPONSE_UP",0.481835237932799,0.86798156499331,-0.282292829090289,-0.989182059576518,2824,137,"PRKCD, HNRNPU, STIP1, PPT1, FKBP4, SIGMAR1, BTG1, GLS, HTR7, PSMC3, CA2, GCH1, KLHDC3, RPN1, ASNS, SLC6A8, DGAT1, NR4A1, DLG4, AP2S1, PDAP1, PTPRD, NXF1, YKT6, BTG2, PRKACA, MARK2, GRINA, CEBPG"
"39","HALLMARK_UV_RESPONSE_DN",0.366899542278969,0.86798156499331,0.285222561322003,1.0331868833058,1522,134,"PTPRM, INPP4B, ACVR2A, DLG1, SYNE1, SMAD3, RASA2, CELF2, WDR37, KCNMA1, ICA1, MMP16, CAP2, MIOS, ATP2B1, SIPA1L1, ADD3, NFIB, SCAF8, COL11A1, IGFBP5, DYRK1A"
"40","HALLMARK_ANGIOGENESIS",0.167904365151241,0.86798156499331,-0.473049710308122,-1.2610443530989,926,28,"POSTN, TNFRSF21, FSTL1, PDGFA"
"41","HALLMARK_HEME_METABOLISM",0.440775063184499,0.86798156499331,-0.279477183616493,-1.00382144364738,2615,165,"DAAM1, LPIN2, AGPAT4, RANBP10, NUDT4, TOP1, USP15, FBXO34, ARHGEF12, MFHAS1, CA2, ENDOD1, BMP2K, CLCN3, SLC11A2, SNCA, TNRC6B, ASNS, SLC6A8, MBOAT2, EZH1, PC, ARL2BP, FBXO7, ATP6V0A1, SLC25A38, SYNJ1, TSPAN5, ACKR1, ACSL6, OPTN, GAPVD1, RNF123, PIGQ, LMO2, NFE2L1, TFDP2, DCAF11, BTG2, RBM5, ANK1, OSBP2, FBXO9"
"42","HALLMARK_COAGULATION",0.978064066852368,0.999829467939973,-0.21006540526233,-0.700022096207907,5617,96,"ISCU, HTRA1, FYN, LRP1, CAPN2, TF, RAPGEF3, KLF7, PDGFB, ARF4, PLEK, ADAM9, F3, CASP9, WDR1, F2RL2"
"43","HALLMARK_IL2_STAT5_SIGNALING",0.306308526367669,0.86798156499331,0.284025640513576,1.05859433138582,1242,167,"TIAM1, PENK, COL6A1, RORA, ST3GAL4, CDC42SE2, PRKCH, WLS, IKZF2, ALCAM, LCLAT1, RHOB, GPR83, UCK2, ITGAV, CTSZ, AMACR, LRIG1, NCS1, NT5E, PTRH2, GUCY1B1, SERPINC1, FAM126B, NFIL3, DENND5A, MAPKAPK2, PLAGL1, RABGAP1L, CASP3, CST7"
"44","HALLMARK_BILE_ACID_METABOLISM",0.364017467248908,0.86798156499331,-0.315632871161646,-1.04681537916204,2083,93,"NR3C2, GNPAT, TTR, PEX13, IDH2, PEX26, MLYCD, BMP6, PIPOX, OPTN, PEX1, PEX6, EPHX2, RBP1, SULT2B1, IDI1, NPC1, CYP7B1, BCAR3, ATXN1, ALDH9A1, NUDT12, AR, CYP27A1, HSD17B4, AQP9, ACSL1, PEX12, PEX19, SCP2, PEX16, ABCD2, ABCA2, SLC23A2, PXMP2, GSTK1"
"45","HALLMARK_PEROXISOME",0.732799163908727,0.999829467939973,-0.26149140449415,-0.865121925381928,4206,91,"GNPAT, TTR, PEX13, ABCC5, CADM1, IDH2, CRAT, MLYCD, NUDT19, DLG4, ERCC3, PEX5, PEX6, ACSL4, HMGCL, ACOT8, EPHX2, EHHADH, SLC25A17, SULT2B1, CRABP2, IDI1, ITGB1BP1"
"46","HALLMARK_ALLOGRAFT_REJECTION",0.807295416366691,0.999829467939973,0.238921972901558,0.856747899063514,3363,125,"THY1, ACVR2A, INHBA, IL12B, MRPL3, CARTPT, PRKCG, TPD52, JAK2, RPS9, LY86, CTSS, LYN"
"47","HALLMARK_SPERMATOGENESIS",0.160913528591353,0.86798156499331,-0.354359289651859,-1.18856060602363,922,101,"POMC, CLPB, CHFR, CNIH2, STRBP, GRM8, PHKG2, ZPBP, VDAC3, SNAP91, SCG5, TLE4, SLC12A2, PACRG, ARL4A, NF2"
"48","HALLMARK_KRAS_SIGNALING_UP",0.481960060412821,0.86798156499331,-0.274626768100772,-0.985694668191518,2871,163,"ANO1, SPARCL1, CSF2RA, KIF5C, SPON1, PEG3, RELN, HDAC9, TPH1, EPB41L3, PCP4, AKAP12, CA2, SNAP91, SCG5, CPE, GNG11"
"49","HALLMARK_KRAS_SIGNALING_DN",0.423058252427184,0.86798156499331,0.275869105582191,1.0091072403304,1742,143,"ARPP21, CAMK1D, GRID2, BMPR1B, DCC, SGK1, IL12B, YPEL1, SYNPO, SPTBN2, BRDT, ZNF112, RYR1, PTPRJ, DLK2, GPR19, NOS1, CNTFR, TCF7L1, KMT2D, ITGB1BP2, MYO15A, FGF22, EGF, SHOX2, COQ8A"
"50","HALLMARK_PANCREAS_BETA_CELLS",0.584201077199282,0.86798156499331,-0.339329644257231,-0.91975057666178,3253,30,"PCSK2, PCSK1, CHGA, ISL1"
