"","pathway","pval","padj","ES","NES","nMoreExtreme","size","leadingEdge"
"464","Metabolism of amino acids and derivatives",0.000207296849087894,0.000811533243965676,-0.17831019109899,-3.41408389089768,0,277,"TYRP1, TYR, TXNRD1, TXN2, TSTD1, TST, TPO, TMLHE, TDO2, SUOX, SRR, SRM, SMS, SMOX, SLC7A5, SLC6A8, SLC6A7, SLC6A12, SLC6A11, SLC5A5, SLC44A1, SLC3A2, SLC36A4, SLC25A21, SLC25A15, SLC25A13, SLC25A12, SHMT1, SERINC5, SERINC3, SERINC2, SERINC1, SEPSECS, SEPHS2, SECISBP2, SCLY, SAT1, RPSA, RPS9, RPS8, RPS7, RPS5, RPS4X, RPS3A, RPS28, RPS27L, RPS27A, RPS25, RPS24, RPS21, RPS20, RPS19, RPS17, RPS16, RPS15A, RPS15, RPS14, RPS13, RPS12, RPS11, RPLP1, RPL8, RPL7A, RPL6, RPL5, RPL4, RPL3L, RPL38, RPL37A, RPL36, RPL35, RPL34, RPL32, RPL30, RPL3, RPL29, RPL28, RPL27, RPL26, RPL23, RPL22L1, RPL19, RPL18A, RPL18, RPL14, RPL13A, RPL12, RPL11, RPL10A, RPL10, RIMKLB, RIMKLA, RIDA, QDPR, PYCR2, PYCR1, PXMP2, PSTK, PSPH, PSMF1, PSME4, PSME3, PSME2, PSME1, PSMD9, PSMD8, PSMD7, PSMD6, PSMD5, PSMD4, PSMD3, PSMD2, PSMD14, PSMD13, PSMD12, PSMD11, PSMD10, PSMD1, PSMC6, PSMC5, PSMC4, PSMC3, PSMC2, PSMC1, PSMB8, PSMB7, PSMB6, PSMB5, PSMB4, PSMB3, PSMB2, PSMB10, PSMB1, PSMA8, PSMA7, PSMA6, PSMA5, PSMA4, PSMA3, PSMA1, PSAT1"
"465","Metabolism of carbohydrates",0.0683744221879815,0.0893107762687976,0.128963309446787,1.08165550382364,354,246,"AAAS, ABCC5, ACAN, ADPGK, AGL, AGRN, AKR1A1, AKR1B1, ALDOA, ALDOB, ALDOC, ARSB, B3GALT1, B3GALT2, B3GALT4, B3GALT5, B3GALT6, B3GAT1, B3GAT2, B3GAT3, B3GNT2, B4GALNT2, B4GALT1, B4GALT2, B4GALT3, B4GALT4, B4GALT5, B4GALT6, B4GALT7, BCAN, BPGM, CALM1, CD44, CEMIP, CHP1, CHPF, CHPF2, CHST1, CHST11, CHST12, CHST13, CHST2, CHST3, CHST7, CHST9, CHSY1, CHSY3, CRYL1, CSGALNACT1, CSGALNACT2, CSPG5, DCN, DERA, DSE, DSEL, ENO1, ENO2, ENO3, EPM2A, EXT1, EXT2, FBP1, FMOD, FUT10, FUT11, FUT9, G6PC3, G6PD, GAA, GALE, GALK1, GAPDH, GAPDHS, GBE1, GLB1, GLB1L, GLCE, GLYCTK, UBA52, GNPDA1, GNPDA2, GNS, GOT1, GOT2, GPC1, GPC3, GPC4, GPC5, GPC6, GPI, GUSB, GYG1, GYS1, GYS2, HAS1, HAS3, HEXA, HEXB, HK1, HK2, HMMR, HPSE, HPSE2, HS2ST1, HS3ST1, HS3ST2, HS3ST3A1, HS3ST4, HS3ST5, HS6ST1, HS6ST2, HS6ST3, HSPG2, HYAL2, HYAL3, IDS, IDUA, KHK, LUM, MAN2B1, MAN2B2, MAN2C1, MANBA, MDH1, MDH2, NAGLU, NCAN, NDC1, NDST1, NDST2, NDST3, NDST4, NHLRC1, NUP107, NUP133, NUP153, NUP155, NUP160, NUP188, NUP205, NUP210, NUP214, NUP35, NUP37, NUP43, NUP50, NUP54, NUP85, NUP88, NUP93, NUP98, NUP58, NUP42, OGN, OMD, PAPSS1, PAPSS2, PCK2, PC, PFKFB1, PFKFB2, PFKFB3, PFKFB4, PFKL, PFKM, PFKP, PGAM1, PGAM2, PGD, PGK1, PGLS, PGM1, PGM2, PGM2L1, PGP, PHKA1, PHKA2, PHKB, PHKG1, PHKG2, PKM, POM121C, POM121, PPP2CA, PPP2CB, PPP2R1A, PPP2R1B, PPP2R5D, PRKACA, PRKACB, PRPS1, PRPS2, PYGB, PYGL, PYGM, RAE1, RANBP2, RBKS, RHCE, RHD, RPEL1, RPE, RPIA, RPS27A, SDC2, SDC3, SDC4, SEC13, SEH1L, SGSH, SHPK, SLC25A1, SLC25A11, SLC25A12, SLC25A13, SLC26A1, SLC26A2, SLC2A1, SLC35B2, SLC35B3, SLC35D2, SLC37A1, SLC37A2, SLC37A4"
"466","Metabolism of cofactors",0.071399919775371,0.0919558202457326,0.303966472085017,1.49116003858276,355,17,"AKT1, CALM1, COQ2, COQ3, COQ5, COQ6, COQ7, COQ9, DHFR"
"467","Metabolism of fat-soluble vitamins",0.000203458799593082,0.000811533243965676,1,6.16599404779067,0,29,"LDLR, AGRN"
"468","Metabolism of folate and pterines",0.359606899318091,0.382697447590094,0.214031261359506,1.0499673261908,1792,17,"ALDH1L1, ALDH1L2, DHFR, DHFR2, FOLR2, FPGS, MTHFD1, MTHFD1L, MTHFD2, MTHFD2L, MTHFR, MTHFS, SHMT1, SHMT2, SLC19A1, SLC25A32, SLC46A1"
"469","Metabolism of non-coding RNA",0.000199481348493916,0.000811533243965676,-0.377578532688307,-3.12651014105676,0,49,"TPR, TGS1, SNUPN, SNRPG, SNRPF, SNRPD3, SNRPD2, SNRPD1, SNRPB, SMN1, SEH1L, SEC13, RANBP2, RAE1, PRMT5, POM121, POM121C, PHAX, NUP42, NUP58, NUP98, NUP93, NUP88, NUP85, NUP54, NUP50, NUP43, NUP37, NUP35, NUP214, NUP210, NUP205, NUP188, NUP160, NUP155, NUP153, NUP133, NUP107, NDC1, NCBP2, NCBP1"
"470","Metabolism of nucleotides",0.0335984095427435,0.0515905085711234,0.177089421390999,1.52731337593394,168,84,"ADA, ADAL, ADK, ADPRM, ADSL, AGXT2, AK1, AK2, AK4, AK5, AK7, AK8, AK9, AMPD2, AMPD3, APRT, ATIC, CAD, CDA, CMPK1, CTPS1, CTPS2, DCK, DCTD, DCTPP1, DGUOK, DHODH, DPYD, DPYS, DTYMK, DUT, ENTPD1, ENTPD3, ENTPD5, ENTPD6, ENTPD7, GART, GDA, GLRX, GMPR, GMPR2, GMPS, GPX1, GSR, GUK1, HPRT1, IMPDH1, IMPDH2, ITPA, LHPP, NME4, NT5C, NT5C2, NT5C3A, NT5E, NT5M, NUDT1, NUDT13, NUDT15, NUDT16, NUDT18, NUDT5, NUDT9"
"471","Metabolism of polyamines",0.000201005025125628,0.000811533243965676,-0.493868921775898,-4.32633371619453,0,55,"SRM, SMS, SMOX, SAT1, PSMF1, PSME4, PSME3, PSME2, PSME1, PSMD9, PSMD8, PSMD7, PSMD6, PSMD5, PSMD4, PSMD3, PSMD2, PSMD14, PSMD13, PSMD12, PSMD11, PSMD10, PSMD1, PSMC6, PSMC5, PSMC4, PSMC3, PSMC2, PSMC1, PSMB8, PSMB7, PSMB6, PSMB5, PSMB4, PSMB3, PSMB2, PSMB10, PSMB1, PSMA8, PSMA7, PSMA6, PSMA5, PSMA4, PSMA3, PSMA1, PAOX, ODC1, OAZ3, OAZ2, OAZ1, NQO1"
"472","Metabolism of porphyrins",0.0126067507116714,0.0264977650093551,0.347563636363636,1.90491385780028,61,22,"ABCC1, ABCG2, ALAD, ALAS1, ALAS2, ALB, BLVRA, BLVRB, COX10, CPOX, FECH, FLVCR1, GUSB, HMBS, HMOX1, HMOX2"
"473","Metabolism of steroid hormones",0.0267038660821044,0.0432653984118711,-0.347150768704428,-1.70989960895629,133,17,"TSPOAP1, TSPO, STARD6, STARD4, STARD3NL, STARD3, STAR, SRD5A3, SRD5A1"
"474","Metabolism of steroids",0.0179028132992327,0.0336716754370668,0.99992680427463,8.89416989889411,90,110,"FDFT1, ABCC3"
"475","Metabolism of vitamins and cofactors",0.00019657951641439,0.000811533243965676,1,9.13726525229015,0,146,"LDLR, AASDHPPT"
"476","Metabolism of water-soluble vitamins and cofactors",0.0323719835197175,0.0501964345681509,0.193569389855378,1.70889985013134,164,101,"AASDHPPT, ABCC1, ABCD4, ACACA, ACACB, ALDH1L1, ALDH1L2, AMN, AOX1, BTD, CBLIF, CD320, CD38, COASY, CUBN, CYB5A, CYB5R3, DHFR, DHFR2, ENPP1, ENPP2, ENPP3, FASN, FLAD1, FOLR2, FPGS, GPHN, GSTO1, GSTO2, HLCS, LMBRD1, MCCC1, MCCC2, MMAA, MMAB, MMADHC, MMUT, MOCOS, MOCS1, MOCS2, MOCS3, MTHFD1, MTHFD1L, MTHFD2, MTHFD2L, MTHFR, MTHFS, MTR, MTRR, NADK, NADK2, NADSYN1, NAMPT, NAXD, NAXE, NFS1, NMNAT1, NMNAT2, NMNAT3, NMRK1, NNMT, NT5E, NUDT12, PANK1, PANK2, PANK3, PANK4, PARP10, PARP16, PARP4, PARP6, PARP8, PARP9, PCCA, PCCB, PC, PDXK, PDZD11, PNPO, PPCDC, PPCS, PTGIS, PTGS2, RFK, RNLS, SHMT1, SHMT2, SLC19A1, SLC19A2, SLC23A1, SLC23A2, SLC25A16, SLC25A19, SLC25A32, SLC2A1, SLC46A1, SLC52A1, SLC52A2, SLC5A6"
"477","Metal ion SLC transporters",0.000198452073824171,0.000811533243965676,-0.718981887205471,-3.75315898516823,0,19,"SLC41A2, SLC41A1, SLC39A6, SLC39A3, SLC39A2, SLC39A14, SLC39A10, SLC39A1, SLC31A1, SLC30A8, SLC30A7, SLC30A6, SLC30A5, SLC30A3, SLC30A10, SLC30A1, SLC11A2, SLC11A1"
"478","Metalloprotease DUBs",0.377007442224834,0.399114684910269,-0.22532528894381,-1.05572848798158,1924,15,"UIMC1, UBC, UBB, STAMBPL1, STAMBP, STAM"
"479","MicroRNA (miRNA) biogenesis",0.032696474295844,0.0505445497142176,-0.294038775942598,-1.67884443874406,165,23,"XPO5, TARBP2, PRKRA, POLR2L, POLR2K, POLR2J, POLR2I, POLR2H, POLR2G, POLR2F, POLR2E, POLR2D, POLR2C, POLR2B, POLR2A"
"480","Miscellaneous transport and binding events",0.0241691842900302,0.0406573133398012,0.340239641494487,1.74755535467461,119,19,"ADD1, ADD2, ADD3, ANKH, CTNS, DMTN, LRRC8B, LRRC8C, LRRC8D, MAGT1, MMGT1, MRS2, NIPA1, NIPA2, NIPAL2, NIPAL3, NIPAL4"
"481","Misspliced GSK3beta mutants stabilize beta-catenin",0.0406371247702675,0.05885978960278,0.34760485570982,1.60354276298513,198,15,"AMER1, APC, AXIN1, CSNK1A1, CTNNB1, GSK3B, PPP2CA, PPP2CB, PPP2R1A, PPP2R1B, PPP2R5A, PPP2R5B, PPP2R5C, PPP2R5D, PPP2R5E"
"482","Mitochondrial Fatty Acid Beta-Oxidation",0.00937627395026498,0.0215931958171251,0.493388650314191,3.19308642488592,45,33,"ACAA2, ACAD10, ACAD11, ACADL, ACADM, ACADS, ACADVL, ACBD6, ACOT11, ACOT12, ACOT13, ACOT1, ACOT2, ACOT7, ACOT9, ACSF2, ACSM3"
"483","Mitochondrial biogenesis",0.0337972166998012,0.0516147826034728,0.176261445548412,1.52017247181103,169,84,"ACSS2, ALAS1, APOO, APOOL, ATF2, ATP5F1A, ATP5F1B, ATP5F1C, ATP5F1D, ATP5F1E, ATP5MC3, ATP5PD, ATP5PF, ATP5MF, ATP5ME, ATP5MG, ATP5PO, CALM1, CAMK4, CARM1, CHCHD3, CHCHD6, CHD9, CREB1, CREBBP, CRTC1, CRTC2, CRTC3, DMAC2L, DNAJC11, ESRRA, GABPA, GABPB1, GLUD1, GLUD2, HCFC1, HDAC3, HELZ2, HSPA9, IDH2, IMMT, MAPK11, MAPK12, MAPK14, MED1, MEF2C, MEF2D, MICOS10, MICOS13, MTERF1, MTX1, MTX2, NCOA1, NCOA2, NCOA6, NCOR1, NR1D1, NRF1, POLG2, POLRMT, PPARA, PPARGC1A, PPARGC1B, PPRC1, PRKAA2, PRKAB1, PRKAB2, PRKAG1, PRKAG2, PRKAG3"
"484","Mitochondrial calcium ion transport",0.00768170179239708,0.0191111984419732,-0.354329208957963,-1.94144796950234,38,21,"YME1L1, VDAC3, VDAC2, VDAC1, STOML2, SMDT1, SLC8B1, SLC8A3, PMPCB, PMPCA, PHB2, PHB, PARL, MICU3, MICU2, MICU1, MCUB, MCU, LETM1"
"485","Mitochondrial protein import",0.0179182605194282,0.0336716754370668,-0.200486085794143,-1.78981064970642,88,57,"VDAC1, TOMM70, TOMM7, TOMM6, TOMM40, TOMM22, TOMM20, TIMM9, TIMM8B, TIMM8A, TIMM50, TIMM44, TIMM23, TIMM22, TIMM21, TIMM17B, TIMM17A, TIMM13, TIMM10"
"486","Mitochondrial tRNA aminoacylation",0.96050803730899,0.96050803730899,-0.107635845958968,-0.561870124374406,4839,19,"YARS2, WARS2, VARS2, TARS2, SARS2, RARS2, PPA2, PARS2, NARS2, MARS2, LARS2, KARS1, IARS2, HARS2, FARS2, EARS2, DARS2"
"487","Mitochondrial translation",0.000204792135981978,0.000811533243965676,-0.439559636328878,-4.90649318629931,0,91,"TUFM, TSFM, PTCD3, OXA1L, MTRF1L, MTIF3, MTIF2, MTFMT, MRRF, MRPS9, MRPS7, MRPS5, MRPS36, MRPS35, MRPS34, MRPS33, MRPS31, MRPS30, MRPS28, MRPS27, MRPS26, MRPS25, MRPS24, MRPS23, MRPS22, MRPS21, MRPS2, MRPS18C, MRPS18B, MRPS18A, MRPS17, MRPS16, MRPS15, MRPS14, MRPS12, MRPS11, MRPS10, MRPL9, MRPL58, MRPL57, MRPL55, MRPL54, MRPL52, MRPL51, MRPL50, MRPL49, MRPL48, MRPL47, MRPL46, MRPL45, MRPL44, MRPL43, MRPL42, MRPL41, MRPL40, MRPL4, MRPL39, MRPL38, MRPL37, MRPL36, MRPL35, MRPL34, MRPL32, MRPL30, MRPL3, MRPL28, MRPL27, MRPL24, MRPL23, MRPL22, MRPL21, MRPL20, MRPL2, MRPL19, MRPL18, MRPL17, MRPL16, MRPL15, MRPL14, MRPL13, MRPL12, MRPL11, MRPL10, MRPL1"
"488","Mitochondrial translation elongation",0.000201207243460765,0.000811533243965676,-0.445741128335604,-4.8354254479649,0,85,"TUFM, TSFM, PTCD3, OXA1L, MRPS9, MRPS7, MRPS5, MRPS36, MRPS35, MRPS34, MRPS33, MRPS31, MRPS30, MRPS28, MRPS27, MRPS26, MRPS25, MRPS24, MRPS23, MRPS22, MRPS21, MRPS2, MRPS18C, MRPS18B, MRPS18A, MRPS17, MRPS16, MRPS15, MRPS14, MRPS12, MRPS11, MRPS10, MRPL9, MRPL58, MRPL57, MRPL55, MRPL54, MRPL52, MRPL51, MRPL50, MRPL49, MRPL48, MRPL47, MRPL46, MRPL45, MRPL44, MRPL43, MRPL42, MRPL41, MRPL40, MRPL4, MRPL39, MRPL38, MRPL37, MRPL36, MRPL35, MRPL34, MRPL32, MRPL30, MRPL3, MRPL28, MRPL27, MRPL24, MRPL23, MRPL22, MRPL21, MRPL20, MRPL2, MRPL19, MRPL18, MRPL17, MRPL16, MRPL15, MRPL14, MRPL13, MRPL12, MRPL11, MRPL10, MRPL1"
"489","Mitochondrial translation initiation",0.000201207243460765,0.000811533243965676,-0.45757889624762,-4.96384223647755,0,85,"PTCD3, OXA1L, MTIF3, MTIF2, MTFMT, MRPS9, MRPS7, MRPS5, MRPS36, MRPS35, MRPS34, MRPS33, MRPS31, MRPS30, MRPS28, MRPS27, MRPS26, MRPS25, MRPS24, MRPS23, MRPS22, MRPS21, MRPS2, MRPS18C, MRPS18B, MRPS18A, MRPS17, MRPS16, MRPS15, MRPS14, MRPS12, MRPS11, MRPS10, MRPL9, MRPL58, MRPL57, MRPL55, MRPL54, MRPL52, MRPL51, MRPL50, MRPL49, MRPL48, MRPL47, MRPL46, MRPL45, MRPL44, MRPL43, MRPL42, MRPL41, MRPL40, MRPL4, MRPL39, MRPL38, MRPL37, MRPL36, MRPL35, MRPL34, MRPL32, MRPL30, MRPL3, MRPL28, MRPL27, MRPL24, MRPL23, MRPL22, MRPL21, MRPL20, MRPL2, MRPL19, MRPL18, MRPL17, MRPL16, MRPL15, MRPL14, MRPL13, MRPL12, MRPL11, MRPL10, MRPL1"
"490","Mitochondrial translation termination",0.0256359300476948,0.0422972766986985,0.453054207728244,3.92172163369789,128,85,"AURKAIP1, CHCHD1, DAP3, ERAL1, GADD45GIP1, GFM2, MRPL1, MRPL10, MRPL11, MRPL12, MRPL13, MRPL14, MRPL15, MRPL16, MRPL17, MRPL18, MRPL19, MRPL2, MRPL20, MRPL21, MRPL22, MRPL23, MRPL24, MRPL27, MRPL28, MRPL3, MRPL30, MRPL32, MRPL34, MRPL35, MRPL36, MRPL37, MRPL38, MRPL39, MRPL4, MRPL40, MRPL41, MRPL42, MRPL43, MRPL44, MRPL45, MRPL46, MRPL47, MRPL48, MRPL49, MRPL50, MRPL51, MRPL52, MRPL54, MRPL55, MRPL57, MRPL58, MRPL9, MRPS10, MRPS11, MRPS12, MRPS14, MRPS15, MRPS16, MRPS17, MRPS18A, MRPS18B, MRPS18C, MRPS2, MRPS21, MRPS22, MRPS23, MRPS24, MRPS25, MRPS26, MRPS27, MRPS28, MRPS30, MRPS31, MRPS33, MRPS34, MRPS35, MRPS36, MRPS5, MRPS7, MRPS9, MRRF, MTRF1L"
"491","Mitophagy",0.0283464566929134,0.0454172230056029,-0.278867138971897,-1.68838539163354,143,26,"VDAC1, ULK1, UBC, UBB, TOMM70, TOMM7, TOMM6, TOMM40, TOMM22, TOMM20, SRC, SQSTM1"
"492","Mitotic Anaphase",0.000204708290685773,0.000811533243965676,-0.191061518132433,-2.72708519093677,0,150,"ZWINT, ZWILCH, ZW10, XPO1, WAPL, VRK2, VRK1, UBE2E1, UBE2D1, UBC, UBB, TMPO, TAOK1, STAG2, STAG1, SPC25, SMC3, SMC1A, SKA2, SEH1L, SEC13, RPS27A, RCC2, RANGAP1, RANBP2, RAD21, PTTG1, PSMF1, PSME4, PSME3, PSME2, PSME1, PSMD9, PSMD8, PSMD7, PSMD6, PSMD5, PSMD4, PSMD3, PSMD2, PSMD14, PSMD13, PSMD12, PSMD11, PSMD10, PSMD1, PSMC6, PSMC5, PSMC4, PSMC3, PSMC2, PSMC1, PSMB8, PSMB7, PSMB6, PSMB5, PSMB4, PSMB3, PSMB2, PSMB10, PSMB1, PSMA8, PSMA7, PSMA6, PSMA5, PSMA4, PSMA3, PSMA1, PPP2R5E, PPP2R5D, PPP2R5C, PPP2R5B, PPP2R5A, PPP2R2A, PPP2R1B, PPP2R1A, PPP2CB, PPP2CA, PPP1CC, PMF1, PDS5B, PDS5A, PAFAH1B1, NUP98, NUP85, NUP43, NUP37, NUP160, NUP133, NUP107, NUF2, NUDC, NSL1"
"493","Mitotic G1 phase and G1/S transition",0.000204206657137023,0.000811533243965676,-0.196226363236587,-2.58906448683017,0,128,"WEE1, UBC, UBB, TYMS, TOP2A, TK1, TFDP2, TFDP1, SRC, SKP2, SKP1, RPS27A, RPA3, RPA2, RPA1, RBL2, RBL1, RB1, PSMF1, PSME3, PSME2, PSME1, PSMD9, PSMD8, PSMD7, PSMD6, PSMD5, PSMD4, PSMD3, PSMD2, PSMD14, PSMD13, PSMD12, PSMD11, PSMD10, PSMD1, PSMC6, PSMC5, PSMC4, PSMC3, PSMC2, PSMC1, PSMB8, PSMB7, PSMB6, PSMB5, PSMB4, PSMB3, PSMB2, PSMB10, PSMB1, PSMA7, PSMA6, PSMA5, PSMA4, PSMA3, PSMA1, PRIM2, PRIM1, PPP2R3B, PPP2R2A, PPP2R1B, PPP2R1A, PPP2CB, PPP2CA, POLE4, POLE3, POLE2, POLE, POLA2, POLA1, PCNA, ORC6, ORC5, ORC4, ORC3, ORC2, ORC1"
"494","Mitotic G2-G2/M phases",0.0457643622200584,0.0641022028219341,0.175873861460837,1.60746057663193,234,166,"ACTR1A, AKAP9, ALMS1, AURKA, BORA, BTRC, CCNA2, CCNB2, CCNH, CCP110, CDC25A, CDC25B, CDK11A, CDK11B, CDK2, CDK5RAP2, CDK7, CENPF, CENPJ, CEP131, CEP135, CEP152, CEP164, CEP192, CEP250, CEP290, CEP41, CEP57, CEP63, CEP70, CEP72, CEP76, CEP78, CETN2, CKAP5, CLASP1, CNTRL, CSNK1D, CSNK1E, CUL1, DCTN1, DCTN2, DCTN3, DYNC1H1, DYNC1I2, DYNLL1, E2F1, E2F3, EP300, FBXL18, FBXL7, FBXW11, FGFR1OP, FKBPL, FOXM1, UBA52, HAUS1, HAUS2, HAUS4, HAUS6, HAUS7, HAUS8, HMMR, HSP90AB1, LCMT1, LIN37, LIN52, LIN54, LIN9, MAPRE1, MNAT1, MYBL2, MZT1, MZT2A, MZT2B, NEK2, NINL, NME7, ODF2, OFD1, OPTN, PAFAH1B1, PCM1, PCNT, PHLDA1, PKMYT1, PLK4, PPME1, PPP1CB, PPP1R12A, PPP1R12B, PPP2CA, PPP2CB, PPP2R1A, PPP2R1B, PPP2R2A, PPP2R3B, PRKACA, PRKAR2B, PSMA1, PSMA3, PSMA4, PSMA5, PSMA6, PSMA7, PSMA8, PSMB1, PSMB10, PSMB2, PSMB3, PSMB4, PSMB5, PSMB6, PSMB7, PSMB8, PSMC1, PSMC2, PSMC3, PSMC4, PSMC5, PSMC6, PSMD1, PSMD10, PSMD11, PSMD12, PSMD13, PSMD14, PSMD2, PSMD3, PSMD4, PSMD5, PSMD6, PSMD7, PSMD8, PSMD9, PSME1, PSME2, PSME3, PSME4, PSMF1"
"495","Mitotic Metaphase and Anaphase",0.000204708290685773,0.000811533243965676,-0.191061518132433,-2.72708519093677,0,150,"ZWINT, ZWILCH, ZW10, XPO1, WAPL, VRK2, VRK1, UBE2E1, UBE2D1, UBC, UBB, TMPO, TAOK1, STAG2, STAG1, SPC25, SMC3, SMC1A, SKA2, SEH1L, SEC13, RPS27A, RCC2, RANGAP1, RANBP2, RAD21, PTTG1, PSMF1, PSME4, PSME3, PSME2, PSME1, PSMD9, PSMD8, PSMD7, PSMD6, PSMD5, PSMD4, PSMD3, PSMD2, PSMD14, PSMD13, PSMD12, PSMD11, PSMD10, PSMD1, PSMC6, PSMC5, PSMC4, PSMC3, PSMC2, PSMC1, PSMB8, PSMB7, PSMB6, PSMB5, PSMB4, PSMB3, PSMB2, PSMB10, PSMB1, PSMA8, PSMA7, PSMA6, PSMA5, PSMA4, PSMA3, PSMA1, PPP2R5E, PPP2R5D, PPP2R5C, PPP2R5B, PPP2R5A, PPP2R2A, PPP2R1B, PPP2R1A, PPP2CB, PPP2CA, PPP1CC, PMF1, PDS5B, PDS5A, PAFAH1B1, NUP98, NUP85, NUP43, NUP37, NUP160, NUP133, NUP107, NUF2, NUDC, NSL1"
"496","Mitotic Prometaphase",0.0540750826687415,0.0735799577094181,0.129744246060886,1.19440829843211,277,154,"ACTR1A, AHCTF1, AKAP9, ALMS1, B9D2, BIRC5, BUB3, CCNB2, CCP110, CDCA8, CDK5RAP2, CENPC, CENPF, CENPH, CENPJ, CENPK, CENPM, CENPN, CENPO, CENPP, CENPQ, CENPT, CENPU, CEP131, CEP135, CEP152, CEP164, CEP192, CEP250, CEP290, CEP41, CEP57, CEP63, CEP70, CEP72, CEP76, CEP78, CETN2, CKAP5, CLASP1, CLASP2, CLIP1, CNTRL, CSNK1D, CSNK1E, CSNK2A1, CSNK2A2, CSNK2B, DCTN1, DCTN2, DCTN3, DYNC1H1, DYNC1I1, DYNC1I2, DYNC1LI1, DYNC1LI2, DYNLL1, DYNLL2"
"497","Mitotic Prophase",0.000200843542880096,0.000811533243965676,-0.307201090263075,-3.13488817988512,0,75,"VRK2, VRK1, USO1, TPR, TMPO, SMC4, SMC2, SET, SEH1L, SEC13, RB1, RANBP2, RAE1, RAB2A, RAB1B, RAB1A, PRKCB, PRKCA, PPP2R2D, PPP2R1B, PPP2R1A, PPP2CB, PPP2CA, POM121, POM121C, PHF8, NUP42, NUP58, NUP98, NUP93, NUP88, NUP85, NUP54, NUP50, NUP43, NUP37, NUP35, NUP214, NUP210, NUP205, NUP188, NUP160, NUP155, NUP153, NUP133, NUP107, NUMA1, NEK9, NEK7, NEK6, NDC1, NCAPH2, NCAPG2, NCAPD3, MCPH1, MASTL, MAPK3, MAPK1, LPIN2, LPIN1, LMNB1, LMNA, LEMD3, LEMD2, KMT5A"
"498","Mitotic Spindle Checkpoint",0.025844930417495,0.042417572487155,0.217281038657427,1.87394726388311,129,84,"AHCTF1, ANAPC1, ANAPC10, ANAPC15, ANAPC16, ANAPC2, ANAPC4, ANAPC5, ANAPC7, B9D2, BIRC5, BUB3, CDC16, CDC23, CDC26, CDC27, CDCA8, CENPC, CENPF, CENPH, CENPK, CENPM, CENPN, CENPO, CENPP, CENPQ, CENPT, CENPU, CKAP5, CLASP1, CLASP2, CLIP1, DYNC1H1, DYNC1I1, DYNC1I2, DYNC1LI1, DYNC1LI2, DYNLL1, DYNLL2"
"499","Molecules associated with elastic fibres",0.0103700691337942,0.0230928191503656,0.367927272727273,2.0165221189813,50,22,"BMP7, EFEMP1, EFEMP2, FBLN1, FBLN2, FBLN5, ITGA8, ITGAV, ITGB1, ITGB3, ITGB5, ITGB6, ITGB8, LTBP3, LTBP4, MFAP1, MFAP2, MFAP3, MFAP4"
"500","Muscle contraction",0.0415937803692906,0.0599021537797048,0.1745744834412,1.60440395953339,213,149,"ACTA2, ACTG2, ACTN2, ACTN3, AHCYL1, AKAP9, ANXA6, ASPH, ATP1A1, ATP1A2, ATP1A3, ATP1B1, ATP1B2, ATP1B3, ATP2A1, ATP2A2, ATP2B1, ATP2B2, ATP2B3, ATP2B4, CACNA1C, CACNA1D, CACNA1F, CACNA2D1, CACNA2D2, CACNA2D3, CACNA2D4, CACNB1, CACNB2, CACNB3, CACNB4, CACNG1, CACNG2, CACNG3, CACNG4, CACNG7, CACNG8, CALD1, CALM1, CAMK2A, CAMK2B, CAMK2G, DMD, DMPK, DYSF, FGF11, FGF12, FGF14, FKBP1B, FXYD1, FXYD2, FXYD4, FXYD6, FXYD7, GATA4, GUCY1A2, HIPK1, HIPK2, ITGA1, ITGB5, ITPR1, ITPR2, ITPR3, KAT2B, KCND1, KCND2, KCND3, KCNE2, KCNH2, KCNIP1, KCNIP2, KCNIP3, KCNIP4, KCNJ11, KCNJ12, KCNJ14, KCNJ2, KCNJ4, KCNK1, KCNK10, KCNK12, KCNK13, KCNK2, KCNK3, KCNK4, KCNK5, KCNK6, KCNK9, KCNQ1"
"501","MyD88 cascade initiated on plasma membrane",0.00924065889915629,0.0213294660891484,-0.195720267154346,-1.93847170412951,45,71,"VRK3, UBE2N, UBC, UBB, TRAF6, TNIP2, TAB3, TAB2, TAB1, SKP1, S100B, RPS6KA5, RPS6KA3, RPS6KA2, RPS6KA1, RPS27A, RIPK2, RELA, PPP2R5D, PPP2R1B, PPP2R1A, PPP2CB, PPP2CA, PELI3, PELI2, PELI1, NKIRAS2, NKIRAS1, NFKBIB, NFKBIA, NFKB2, NFKB1, MEF2C, MEF2A, MAPKAPK2, MAPK9, MAPK8, MAPK7, MAPK3, MAPK14, MAPK11, MAPK10, MAPK1, MAP3K8, MAP3K7, MAP3K1, MAP2K7, MAP2K6, MAP2K4, MAP2K3, MAP2K1"
"502","MyD88 dependent cascade initiated on endosome",0.00565542314683902,0.0161515050888538,-0.193602434825381,-1.98396267994845,27,76,"VRK3, UBE2N, UBC, UBB, TRAF6, TNIP2, TLR7, TLR4, TICAM1, TAB3, TAB2, TAB1, SKP1, S100B, RPS6KA5, RPS6KA3, RPS6KA2, RPS6KA1, RPS27A, RIPK2, RELA, PPP2R5D, PPP2R1B, PPP2R1A, PPP2CB, PPP2CA, PELI3, PELI2, PELI1, NKIRAS2, NKIRAS1, NFKBIB, NFKBIA, NFKB2, NFKB1, MEF2C, MEF2A, MAPKAPK2, MAPK9, MAPK8, MAPK7, MAPK3, MAPK14, MAPK11, MAPK10, MAPK1, MAP3K8, MAP3K7, MAP3K1, MAP2K7, MAP2K6, MAP2K4, MAP2K3, MAP2K1, LY96"
"503","MyD88-independent TLR4 cascade",0.0122736418511066,0.0260139453070625,-0.1749508980183,-1.89787742401249,60,85,"VRK3, UBE2N, UBE2D3, UBE2D2, UBE2D1, UBC, UBB, TRAF6, TRAF3, TNIP2, TLR4, TICAM1, TBK1, TANK, TAB3, TAB2, TAB1, SKP1, SARM1, S100B, RPS6KA5, RPS6KA3, RPS6KA2, RPS6KA1, RPS27A, RIPK2, RIPK1, RELA, PTPN11, PPP2R5D, PPP2R1B, PPP2R1A, PPP2CB, PPP2CA, NKIRAS2, NKIRAS1, NFKBIB, NFKBIA, NFKB2, NFKB1, MEF2C, MEF2A, MAPKAPK2, MAPK9, MAPK8, MAPK7, MAPK3, MAPK14, MAPK11, MAPK10, MAPK1, MAP3K8, MAP3K7, MAP2K7, MAP2K6, MAP2K4, MAP2K3, MAP2K1, LY96, JUN, IRF3, IRAK2, IRAK1, IKBKG, IKBKE, IKBKB"
"504","MyD88:MAL(TIRAP) cascade initiated on plasma membrane",0.0164559502307847,0.0313905012892892,-0.173407829389425,-1.82716276621993,81,80,"VRK3, UBE2N, UBC, UBB, TRAF6, TNIP2, TLR4, TLR2, TIRAP, TAB3, TAB2, TAB1, SOCS1, SKP1, S100B, RPS6KA5, RPS6KA3, RPS6KA2, RPS6KA1, RPS27A, RIPK2, RELA, PPP2R5D, PPP2R1B, PPP2R1A, PPP2CB, PPP2CA, PELI3, PELI2, PELI1, NKIRAS2, NKIRAS1, NFKBIB, NFKBIA, NFKB2, NFKB1, MEF2C, MEF2A, MAPKAPK2, MAPK9, MAPK8, MAPK7, MAPK3, MAPK14, MAPK11, MAPK10, MAPK1, MAP3K8, MAP3K7, MAP3K1, MAP2K7, MAP2K6, MAP2K4, MAP2K3, MAP2K1, LY96, JUN, IRAK3, IRAK2, IRAK1, IKBKG, IKBKB"
"505","Myogenesis",0.0379695431472081,0.0562038186263945,0.291009306605698,1.63105383489641,186,23,"ABL1, BNIP2, BOC, CDC42, CDH2, CDH4, CDON, CTNNA1, CTNNA2, CTNNB1, MAP2K6, MAPK11, MAPK12, MAPK14, MEF2A, MEF2B, MEF2C, MEF2D"
"506","N-Glycan antennae elongation",0.0912803757402491,0.112817188109281,0.309500617867268,1.42776335764076,446,15,"B4GALT1, B4GALT2, B4GALT3, B4GALT4, B4GALT5, B4GALT6"
"507","N-glycan antennae elongation in the medial/trans-Golgi",0.0446700507614213,0.0635181734455653,0.284390643430194,1.59395744069442,219,23,"B4GALT1, B4GALT2, B4GALT3, B4GALT4, B4GALT5, B4GALT6, CHST10, CHST8, FUCA1, FUT8, MAN2A1, MAN2A2, MGAT2, MGAT3, MGAT4A, MGAT4B, MGAT4C, MGAT5"
"508","N-glycan trimming in the ER and Calnexin/Calreticulin cycle",0.4569354522268,0.477233204753404,-0.144285125069753,-0.986610819544368,2328,33,"VCP, UGGT2, UGGT1, UBXN1, UBC, UBB, TRIM13, SYVN1, SEL1L, RPS27A, RNF5, RNF185, RNF103, RAD23B, PSMC1, PRKCSH"
"509","NCAM signaling for neurite out-growth",0.0150330727600722,0.0295672050148344,0.276791384046149,2.07610464851837,74,49,"AGRN, CACNA1C, CACNA1D, CACNA1G, CACNA1H, CACNA1I, CACNB1, CACNB2, CACNB3, CACNB4, CNTN2, COL4A1, COL4A2, COL4A3, COL4A4, COL4A5, COL6A1, COL6A2, COL6A3, COL6A5, COL9A1, COL9A2, CREB1"
"510","NCAM1 interactions",0.00787719652595435,0.019226234396513,0.551045456750594,3.45514628500078,38,30,"AGRN, CACNA1C, CACNA1D, CACNA1G, CACNA1H, CACNA1I, CACNB1, CACNB2, CACNB3, CACNB4, CNTN2, COL4A1, COL4A2, COL4A3, COL4A4, COL4A5, COL6A1, COL6A2, COL6A3, COL6A5, COL9A1, COL9A2"
"511","NEP/NS2 Interacts with the Cellular Export Machinery",0.000197980597901406,0.000811533243965676,-0.509236889341678,-3.31692130510409,0,30,"XPO1, TPR, SEH1L, SEC13, RANBP2, RAE1, POM121, POM121C, NUP42, NUP58, NUP98, NUP93, NUP88, NUP85, NUP54, NUP50, NUP43, NUP37, NUP35, NUP214, NUP210, NUP205, NUP188, NUP160, NUP155, NUP153, NUP133, NUP107, NDC1"
"512","NIK-->noncanonical NF-kB signaling",0.000201005025125628,0.000811533243965676,-0.541313698330539,-4.74195398994562,0,55,"UBE2M, UBC, UBB, UBA3, SKP1, RPS27A, RELB, PSMF1, PSME4, PSME3, PSME2, PSME1, PSMD9, PSMD8, PSMD7, PSMD6, PSMD5, PSMD4, PSMD3, PSMD2, PSMD14, PSMD13, PSMD12, PSMD11, PSMD10, PSMD1, PSMC6, PSMC5, PSMC4, PSMC3, PSMC2, PSMC1, PSMB8, PSMB7, PSMB6, PSMB5, PSMB4, PSMB3, PSMB2, PSMB10, PSMB1, PSMA8, PSMA7, PSMA6, PSMA5, PSMA4, PSMA3, PSMA1"
"513","NOD1/2 Signaling Pathway",0.0654205607476635,0.0863448915351016,0.251720780310916,1.48585849318621,321,26,"BIRC2, BIRC3, CARD9, CASP2, CASP8, CASP9, CHUK, CYLD, IKBKB, IKBKG, IRAK1, IRAK2, ITCH, MAP2K6, MAP3K7, MAPK11, MAPK12, MAPK13, MAPK14"
"514","NOTCH1 Intracellular Domain Regulates Transcription",0.0203430394894296,0.0362730386663374,-0.219092297068718,-1.75101588428994,101,46,"UBC, UBB, TLE4, TLE3, TLE2, TLE1, TBL1XR1, TBL1X, SNW1, SKP1, RPS27A, RBX1, RBPJ, NOTCH1, NCOR2, NCOR1, MYC, MAMLD1, MAML3, MAML2, MAML1, KAT2B, KAT2A, HIF1A, HEY2, HEY1, HES5, HES1, HDAC9, HDAC8, HDAC7, HDAC6, HDAC5, HDAC4, HDAC3, HDAC2, HDAC11, HDAC10, HDAC1"
"515","NOTCH2 Activation and Transmission of Signal to the Nucleus",0.310898739324929,0.335094483430174,0.197745454545455,1.08379593625423,1528,22,"ADAM10, APH1A, APH1B, CNTN1, DLL1, DLL4, UBA52, JAG1, JAG2, MDK, MIB1, MIB2, NCSTN, NEURL1, NEURL1B, NOTCH2, PSEN1, PSEN2, PSENEN"
"516","NOTCH3 Activation and Transmission of Signal to the Nucleus",0.886877828054299,0.891285769545622,-0.111323197788608,-0.660802812443366,4507,25,"YBX1, WWP2, UBC, UBB, TACC3, RPS27A, PSENEN, PSEN2, PSEN1, NOTCH3, NEURL1B, NEURL1, NCSTN, MIB2, MIB1, JAG2, JAG1, UBA52, EGFR, EGF, DLL4, DLL1"
"517","NOTCH3 Intracellular Domain Regulates Transcription",0.234439426664049,0.259319759690758,-0.224854566608493,-1.20562382816112,1193,20,"WWC1, STAT1, SNW1, RBPJ, PBX1, NOTCH3, NOTCH1, MAMLD1, MAML3, MAML2, MAML1, KAT2B, KAT2A, HEY2, HEY1, HES5, HES1"
"518","NOTCH4 Intracellular Domain Regulates Transcription",0.11525355782722,0.138222238390652,0.272405603218458,1.36985591518885,574,18,"ACTA2, CREBBP, EP300, HES1, HES5, HEY1, HEY2, KAT2A, KAT2B, MAML1, MAML2, MAML3, MAMLD1, NOTCH1, NOTCH2"
"519","NR1H2 and NR1H3-mediated signaling",0.0927688879886571,0.114237936366056,0.202123200739873,1.36866999789447,457,37,"ABCA1, ABCG1, AGO1, AGO2, AGO3, AGO4, ANGPTL3, APOD, APOE, ARL4C"
"520","NR1H3 & NR1H2 regulate gene expression linked to cholesterol transport and efflux",0.0747323772975157,0.0952767130489134,0.231814874108572,1.45351765679591,369,30,"ABCA1, ABCG1, AGO1, AGO2, AGO3, AGO4, APOD, APOE, ARL4C"
"521","NRAGE signals death through JNK",0.0143712574850299,0.0287141132754254,0.354777491493646,2.70348100328973,71,51,"AATF, ABR, AKAP13, ARHGEF1, ARHGEF10, ARHGEF10L, ARHGEF11, ARHGEF12, ARHGEF15, ARHGEF17, ARHGEF18, ARHGEF2, ARHGEF26, ARHGEF3, ARHGEF33, ARHGEF37, ARHGEF4, ARHGEF40, ARHGEF6, ARHGEF7, ARHGEF9, BAD, BCL2L11"
"522","NRIF signals cell death from the nucleus",0.441441441441441,0.462005483744614,-0.213525235637615,-1.00044107442296,2253,15,"UBC, UBB, TRAF6, SQSTM1, RPS27A, PSENEN, PSEN2, PSEN1, NGF, NCSTN, MAPK8"
