"","pathway","pval","padj","ES","NES","nMoreExtreme","size","leadingEdge"
"231","Downstream signaling of activated FGFR4",0.0206978119455943,0.0384281956552611,-0.304566458276706,-1.75046711011469,104,23,"SOS1, SHC1, PTPN11, PLCG1, PIK3R1, PIK3CA, NRAS, KRAS, KLB, HRAS, GRB2, GAB1, FRS3, FRS2, FGFR4, FGF9, FGF23, FGF20, FGF2, FGF18, FGF17, FGF16, FGF1"
"232","Dual Incision in GG-NER",0.0743095569242996,0.0972029052696647,-0.198135927614123,-1.48084383330433,373,40,"XPA, UBC, UBB, RPS27A, RPA3, RPA2, RPA1, RFC5, RFC4, RFC3, RFC2, RFC1, RBX1, POLK, POLE4, POLE3, POLE2, POLE, POLD4, POLD2, POLD1, PCNA, PARP2, PARP1"
"233","Dual incision in TC-NER",0.000201694231544978,0.000853517877739331,-0.266976149914821,-2.52037460109485,0,64,"ZNF830, XPA, XAB2, UVSSA, USP7, UBC, UBB, TCEA1, RPS27A, RPA3, RPA2, RPA1, RFC5, RFC4, RFC3, RFC2, RFC1, RBX1, PRPF19, PPIE, POLR2L, POLR2K, POLR2J, POLR2I, POLR2H, POLR2G, POLR2F, POLR2E, POLR2D, POLR2C, POLR2B, POLR2A, POLK, POLE4, POLE3, POLE2, POLE, POLD4, POLD2, POLD1"
"234","E2F mediated regulation of DNA replication",0.00119784388101417,0.00440058957705917,-0.405801577643665,-2.2736636540884,5,22,"TFDP2, TFDP1, RB1, PRIM2, PRIM1, PPP2R3B, PPP2R1B, PPP2R1A, PPP2CB, PPP2CA, POLA2, POLA1, ORC6, ORC5, ORC4, ORC3, ORC2, ORC1"
"235","E3 ubiquitin ligases ubiquitinate target proteins",0.000197355437142293,0.000853517877739331,-0.428012519561815,-3.2799194488592,0,42,"WDR61, WAC, VCP, UBE2V2, UBE2N, UBE2J2, UBE2E1, UBE2D3, UBE2D2, UBE2D1, UBE2B, UBE2A, UBC, UBB, TMEM129, SHPRH, SELENOS, RTF1, RRAGA, RPS27A, RNF40, RNF20, RNF181, RNF152, RNF144A, RAD18, PRKDC, PEX5, PEX2, PEX14, PEX13, PEX12, PEX10, PCNA, PAF1"
"236","ECM proteoglycans",0.0259429255637597,0.045554018447551,0.23534682763507,1.70567781599165,129,49,"ACAN, AGRN, ASPN, BCAN, COL9A1, COL9A2, COMP, DAG1, DCN, DMP1, HAPLN1, HSPG2, ITGA2, ITGA2B, ITGA7, ITGA8, ITGA9, ITGAV, ITGAX, ITGB1, ITGB3, ITGB5, ITGB6, LAMA1, LAMA2, LAMA3, LAMA4, LAMA5, LAMB1, LAMB2, LAMC1, LRP4, LUM, MATN3, MATN4, MUSK, NCAM1, NCAN"
"237","EGFR downregulation",0.2032,0.229069858541893,-0.193855927236925,-1.23998402559135,1015,29,"UBC, UBB, TGFA, STAM2, STAM, SPRY2, SPRY1, SH3KBP1, SH3GL3, SH3GL2, SH3GL1, RPS27A, PTPRK, PTPN3, PTPN12"
"238","EML4 and NUDC in mitotic spindle formation",0.0433925049309665,0.0649633455324874,0.174842554152899,1.40786662302274,219,87,"AHCTF1, B9D2, BIRC5, BUB1, BUB3, CDC20, CDCA8, CENPC, CENPE, CENPF, CENPH, CENPI, CENPK, CENPL, CENPM, CENPN, CENPO, CENPP, CENPQ, CENPT, CENPU, CKAP5, CLASP1, CLASP2, CLIP1, DSN1, DYNC1H1, DYNC1I1, DYNC1I2, DYNC1LI1, DYNC1LI2, DYNLL1, DYNLL2, EML4, INCENP, ITGB3BP, KIF18A, KIF2A, KIF2C, KNL1, KNTC1, MAD1L1, MAD2L1, MAPRE1, MIS12, NDE1, NDEL1, NEK6, NEK7, NEK9, NUDC, NUF2, NUP107, NUP133, NUP160, NUP37, NUP43, NUP85, NUP98, PAFAH1B1, PLK1, PMF1, PPP1CC, PPP2CA, PPP2CB, PPP2R1A, PPP2R1B, PPP2R5A, PPP2R5B, PPP2R5C, PPP2R5D, PPP2R5E"
"239","EPH-Ephrin signaling",0.0363600628930818,0.057102459949435,0.24830080524089,1.9917121685532,184,85,"ACTB, ACTG1, ACTR2, ACTR3, ADAM10, AP2A1, AP2A2, AP2B1, AP2M1, AP2S1, APH1A, APH1B, ARHGEF28, ARHGEF7, ARPC1A, ARPC1B, ARPC2, ARPC3, ARPC4, ARPC5, CDC42, CFL1, CLTA, CLTB, CLTC, DNM1, EFNA1, EFNA2, EFNA3, EFNA4, EFNA5, EFNB1, EFNB2, EFNB3, EPHA10, EPHA3, EPHA4, EPHA5, EPHA6, EPHA7, EPHB1, EPHB2, EPHB3, EPHB6"
"240","EPH-ephrin mediated repulsion of cells",0.0170443152195709,0.0339575203220681,0.41227071669399,2.90267228798506,84,44,"ADAM10, AP2A1, AP2A2, AP2B1, AP2M1, AP2S1, APH1A, APH1B, CLTA, CLTB, CLTC, DNM1, EFNA1, EFNA2, EFNA3, EFNA4, EFNA5, EFNB1, EFNB2, EFNB3, EPHA10, EPHA3, EPHA4, EPHA5, EPHA6, EPHA7, EPHB1, EPHB2, EPHB3, EPHB6"
"241","EPHB-mediated forward signaling",0.0333733013589129,0.0538547355262208,0.251853111186671,1.63574228428546,166,34,"ACTB, ACTG1, ACTR2, ACTR3, ARHGEF28, ARPC1A, ARPC1B, ARPC2, ARPC3, ARPC4, ARPC5"
"242","ER Quality Control Compartment (ERQC)",0.0536751452032846,0.0753488488219551,-0.295659324942792,-1.54848559621747,267,19,"UGGT2, UGGT1, UBC, UBB, TRIM13, SYVN1, SEL1L, RPS27A, RNF5, RNF185, RNF103"
"243","ER to Golgi Anterograde Transport",0.0531873289010559,0.0749688064510122,0.199891198419373,1.59310283425,271,123,"ACTR10, ACTR1A, ANK1, ANK2, ANK3, ANKRD28, ARCN1, AREG, ARF1, ARF3, ARF4, ARF5, ARFGAP1, ARFGAP2, ARFGAP3, BET1L, CAPZA2, CAPZB, CD55, CD59, CNIH1, CNIH2, CNIH3, COG1, COG2, COG3, COG4, COG5, COG6, COG7, COG8, COPA, COPB1, COPB2, COPE, COPG1, COPG2, COPZ1, COPZ2, CSNK1D, CTSC, CTSZ, DCTN1, DCTN2, DCTN3, DCTN4, DCTN5, DCTN6, DYNC1H1, DYNC1I1, DYNC1I2, DYNC1LI1, DYNC1LI2, DYNLL1, DYNLL2"
"244","ER-Phagosome pathway",0.000201938610662359,0.000853517877739331,-0.509900483947924,-4.95638240304072,0,68,"VAMP8, UBC, UBB, TLR4, TIRAP, TAPBP, TAP2, TAP1, STX4, SNAP23, SEC61G, SEC61B, SEC61A2, SEC61A1, SEC22B, RPS27A, PSMF1, PSME4, PSME3, PSME2, PSME1, PSMD9, PSMD8, PSMD7, PSMD6, PSMD5, PSMD4, PSMD3, PSMD2, PSMD14, PSMD13, PSMD12, PSMD11, PSMD10, PSMD1, PSMC6, PSMC5, PSMC4, PSMC3, PSMC2, PSMC1, PSMB9, PSMB8, PSMB7, PSMB6, PSMB5, PSMB4, PSMB3, PSMB2, PSMB10, PSMB1, PSMA7, PSMA6, PSMA5, PSMA4, PSMA3, PSMA1"
"245","ERCC6 (CSB) and EHMT2 (G9a) positively regulate rRNA expression",0.0280078895463511,0.0478593664991746,0.351057868640902,1.66634662778683,141,16,"CBX3, CHD3, CHD4, EHMT2, ERCC6, GATAD2A, GATAD2B, H3-3A, HDAC1, HDAC2, MBD3, MTA1, MTA2, MTA3"
"246","ERK/MAPK targets",0.0433031218529708,0.0649233491167551,-0.291110981693941,-1.59287122603632,214,21,"VRK3, RPS6KA5, RPS6KA3, RPS6KA2, RPS6KA1, PPP2R5D, PPP2R1B, PPP2R1A, PPP2CB, PPP2CA, MEF2C, MEF2A, MAPK7, MAPK3, MAPK14, MAPK11, MAPK1"
"247","ESR-mediated signaling",0.0660835762876579,0.0891679915847626,0.141606399011232,1.12273070323548,339,141,"AGO1, AGO2, AGO3, AGO4, AKT1, AKT2, AKT3, AREG, ATF2, AXIN1, BCL2, BTC, CALM1, CARM1, CAV1, CAV2, CBFB, CCND1, CCNT1, CDK9, CDKN1B, CHD1, CITED1, CREB1, CREBBP, CTSD, CXCL12, CXXC5, DDX5, EBAG9, EGF, EGFR, ELK1, EP300, ERBB4, ESR1, FKBP4, FKBP5, FOS, FOSB, FOXO3, GNAI1, GNAI2, GNAI3, GNB1, GNB4, GNB5, GNG11, GNG12, GNG13, GNG2, GNG3, GNG4, GNG7, GPAM, GREB1, GTF2A1, GTF2A2, GTF2F1, GTF2F2, H3-3A, HBEGF, HDAC1, HRAS, HSP90AB1, IGF1R, JUN, JUND, KANK1, KAT2B, KAT5, KCTD6, KDM1A, KDM4B, KPNA2, KRAS, MAPK1, MAPK3, MED1, MMP2, MMP9, MOV10, MYB, MYC, NCOA1, NCOA2, NCOA3, NOS3, NRAS, NRIP1, PDPK1, PGR, PIK3CA, PIK3R1, PIK3R2, PIK3R3, POLR2A, POLR2B, POLR2C, POLR2D, POLR2E, POLR2F, POLR2G, POLR2H, POLR2I, POLR2J, POLR2K, POLR2L, POU2F1, PPID, PPP5C, PRKCZ, PRMT1, PTGES3, PTK2"
"248","Effects of PIP2 hydrolysis",0.0256818634282301,0.0452489974687864,0.292444565283064,1.73706136300397,128,27,"ABHD12, ABHD6, DAGLA, DAGLB, DGKA, DGKB, DGKD, DGKE, DGKG, DGKH, DGKI, DGKK, DGKQ, DGKZ"
"249","Elastic fibre formation",0.0117905675459632,0.0261616049642163,0.385243114586875,2.50208722572624,58,34,"BMP2, BMP7, EFEMP1, EFEMP2, ELN, FBLN1, FBLN2, FBLN5, FBN1, FBN2, FURIN, ITGA5, ITGA8, ITGAV, ITGB1, ITGB3, ITGB5, ITGB6, ITGB8, LOX, LOXL1, LOXL4, LTBP1, LTBP2, LTBP3, LTBP4, MFAP1, MFAP2, MFAP3, MFAP4"
"250","Endogenous sterols",0.00621616202125526,0.0173116770269367,0.456626587867672,2.27100093462397,30,18,"AHR, AHRR, ARNT, ARNT2, CYP11A1, CYP19A1, CYP1B1, CYP27A1, CYP39A1, CYP46A1, CYP51A1, CYP7B1"
"251","Endosomal Sorting Complex Required For Transport (ESCRT)",0.001,0.00371846750325007,-0.360648397758972,-2.30685880205091,4,29,"VTA1, VPS4B, VPS4A, VPS37D, VPS37C, VPS37B, VPS37A, VPS36, VPS28, UBC, UBB, UBAP1, TSG101"
"252","Energy dependent regulation of mTOR by LKB1-AMPK",6e-04,0.00229482269393578,-0.37780538690546,-2.41660211901892,2,29,"TSC2, TSC1, STRADB, STRADA, STK11, SLC38A9, RRAGD, RRAGC, RRAGB, RRAGA, RPTOR, RHEB, PRKAG3, PRKAG2, PRKAG1, PRKAB2, PRKAB1, PRKAA2, PRKAA1, PPM1A, MTOR, MLST8, LAMTOR5, LAMTOR4, LAMTOR3, LAMTOR2, LAMTOR1"
"253","Ephrin signaling",0.194732641660016,0.219763634814571,0.254109495992392,1.23611832861303,975,17,"ARHGEF7, EFNB1, EFNB2, EFNB3, EPHB1, EPHB2, EPHB3, EPHB6, FYN, GIT1"
"254","Epigenetic regulation of gene expression",0.397404703974047,0.422267972632936,-0.0948299396575259,-1.03383817739432,1959,87,"ZNRD1, UHRF1, UBTF, TWISTNB, TTF1, TET3, TET2, TET1, TDG, TBP, TAF1D, TAF1C, TAF1B, TAF1A, SUZ12, SUV39H1, SUDS3, SMARCA5, SIRT1, SIN3B, SIN3A, SF3B1, SAP30L, SAP30BP, SAP30, SAP18, SAP130, RRP8, RBBP7, POLR2L, POLR2K, POLR2H, POLR2F, POLR2E, POLR1E, POLR1D, POLR1C, POLR1B, POLR1A, PHF19, PHF1, MYO1C, MYBBP1A, MTF2, MTA3, MTA2, MTA1, MNAT1, MBD3, MBD2, KAT2B, KAT2A, JARID2, HDAC2, HDAC1, H3-3A, GTF2H5, GTF2H4, GTF2H3, GTF2H2, GTF2H1, GSK3B, GATAD2B, GATAD2A, EZH2, ERCC6, ERCC3, ERCC2, EP300, EHMT2, EED, DNMT3B, DNMT3A, DNMT1, DEK, DDX21"
"255","Estrogen-dependent gene expression",0.132665094339623,0.15761586896313,0.131595468813976,1.0555757010493,674,85,"AGO1, AGO2, AGO3, AGO4, ATF2, AXIN1, BCL2, CARM1, CBFB, CCND1, CCNT1, CDK9, CHD1, CITED1, CREBBP, CTSD, CXCL12, CXXC5, DDX5, EBAG9, EP300, ERBB4, ESR1, FKBP4, FOS, FOSB, GPAM, GREB1, GTF2A1, GTF2A2, GTF2F1, GTF2F2, H3-3A, HDAC1, HSP90AB1, JUN, JUND, KANK1, KAT2B, KAT5, KCTD6, KDM1A, KDM4B, KPNA2, MED1, MOV10, MYB, MYC, NCOA1, NCOA2, NCOA3, NRIP1, PGR, POLR2A, POLR2B, POLR2C, POLR2D, POLR2E, POLR2F, POLR2G, POLR2H, POLR2I, POLR2J, POLR2K, POLR2L, POU2F1"
"256","Estrogen-dependent nuclear events downstream of ESR-membrane signaling",0.0188225871045254,0.0362893248629424,0.323188396844713,1.76775333233343,93,22,"AKT1, AKT2, AKT3, AREG, BCL2, BTC, CCND1, CDKN1B, CREB1, EGF, EGFR, ELK1, FOS, FOXO3"
"257","Eukaryotic Translation Elongation",0.000202265372168285,0.000853517877739331,-0.581417710835694,-5.38940727052658,0,62,"RPSA, RPS9, RPS8, RPS7, RPS5, RPS4X, RPS3A, RPS28, RPS27L, RPS27A, RPS25, RPS24, RPS21, RPS20, RPS19, RPS17, RPS16, RPS15A, RPS15, RPS14, RPS13, RPS12, RPS11, RPLP1, RPL8, RPL7A, RPL6, RPL5, RPL4, RPL3L, RPL38, RPL37A, RPL36, RPL35, RPL34, RPL32, RPL30, RPL3, RPL29, RPL28, RPL27, RPL26, RPL23, RPL22L1, RPL19, RPL18A, RPL18, RPL14, RPL13A, RPL12, RPL11, RPL10A, RPL10"
"258","Eukaryotic Translation Initiation",0.000202757502027575,0.000853517877739331,-0.335307878411327,-3.65553418186965,0,87,"RPSA, RPS9, RPS8, RPS7, RPS5, RPS4X, RPS3A, RPS28, RPS27L, RPS27A, RPS25, RPS24, RPS21, RPS20, RPS19, RPS17, RPS16, RPS15A, RPS15, RPS14, RPS13, RPS12, RPS11, RPLP1, RPL8, RPL7A, RPL6, RPL5, RPL4, RPL3L, RPL38, RPL37A, RPL36, RPL35, RPL34, RPL32, RPL30, RPL3, RPL29, RPL28, RPL27, RPL26, RPL23, RPL22L1, RPL19, RPL18A, RPL18, RPL14, RPL13A, RPL12, RPL11, RPL10A, RPL10"
"259","Eukaryotic Translation Termination",0.000202183582693085,0.000853517877739331,-0.583771366273411,-5.45748909326765,0,63,"TRMT112, RPSA, RPS9, RPS8, RPS7, RPS5, RPS4X, RPS3A, RPS28, RPS27L, RPS27A, RPS25, RPS24, RPS21, RPS20, RPS19, RPS17, RPS16, RPS15A, RPS15, RPS14, RPS13, RPS12, RPS11, RPLP1, RPL8, RPL7A, RPL6, RPL5, RPL4, RPL3L, RPL38, RPL37A, RPL36, RPL35, RPL34, RPL32, RPL30, RPL3, RPL29, RPL28, RPL27, RPL26, RPL23, RPL22L1, RPL19, RPL18A, RPL18, RPL14, RPL13A, RPL12, RPL11, RPL10A, RPL10"
"260","Export of Viral Ribonucleoproteins from Nucleus",0.000200160128102482,0.000853517877739331,-0.480258713712967,-3.17054457978562,0,31,"XPO1, TPR, SEH1L, SEC13, RANBP2, RAE1, POM121, POM121C, NUP42, NUP58, NUP98, NUP93, NUP88, NUP85, NUP54, NUP50, NUP43, NUP37, NUP35, NUP214, NUP210, NUP205, NUP188, NUP160, NUP155, NUP153, NUP133, NUP107"
"261","Extension of Telomeres",2e-04,0.000853517877739331,-0.434503856161654,-2.77926936966861,0,29,"WRAP53, TERT, RUVBL2, RUVBL1, RPA3, RPA2, RPA1, RFC5, RFC4, RFC3, RFC2, RFC1, PRIM2, PRIM1, POLE4, POLE3, POLE2, POLE, POLD4, POLD2, POLD1, POLA2, POLA1"
"262","Extra-nuclear estrogen signaling",0.0623386936668652,0.0852016974127603,0.17879162240798,1.35838697113565,313,59,"AKT1, AKT2, AKT3, AREG, BCL2, BTC, CALM1, CAV1, CAV2, CCND1, CDKN1B, CREB1, EGF, EGFR, ELK1, ESR1, FOS, FOXO3, GNAI1, GNAI2, GNAI3, GNB1, GNB4, GNB5, GNG11, GNG12, GNG13, GNG2, GNG3, GNG4, GNG7, HBEGF, HRAS, IGF1R"
"263","Extracellular matrix organization",0.0907172995780591,0.113781019809769,0.247331227992996,1.75051048925116,472,237,"ACAN, ACTN1, ADAM10, ADAM12, ADAM15, ADAM17, ADAM8, ADAM9, ADAMTS1, ADAMTS14, ADAMTS16, ADAMTS18, ADAMTS2, ADAMTS3, ADAMTS5, ADAMTS8, ADAMTS9, AGRN, ASPN, BCAN, BMP1, BMP2, BMP7, BSG, CAPN1, CAPN10, CAPN11, CAPN12, CAPN15, CAPN2, CAPN3, CAPN5, CAPN6, CAPN7, CAPN9, CAPNS1, CASK, CASP3, CAST, CD151, CD44, CD47, COL11A1, COL11A2, COL12A1, COL13A1, COL14A1, COL15A1, COL16A1, COL17A1, COL18A1, COL19A1, COL1A1, COL1A2, COL20A1, COL23A1, COL25A1, COL26A1, COL27A1, COL28A1, COL3A1, COL4A1, COL4A2, COL4A3, COL4A4, COL4A5, COL4A6, COL5A1, COL5A2, COL5A3, COL6A1, COL6A2, COL6A3, COL6A5, COL6A6, COL8A1, COL8A2, COL9A1, COL9A2, COLGALT1, COLGALT2, COMP, CRTAP, CTRB2, CTRB1, CTSB, CTSD, CTSK, CTSS, DAG1, DCN, DDR1, DDR2, DMD, DMP1, DST, EFEMP1, EFEMP2, ELN, F11R, FBLN1, FBLN2, FBLN5, FBN1, FBN2, FGF2, FN1, FURIN, HAPLN1, HSPG2, HTRA1, ICAM1, ICAM4, ICAM5, ITGA1, ITGA11, ITGA2, ITGA2B, ITGA3, ITGA4, ITGA5, ITGA6, ITGA7, ITGA8, ITGA9, ITGAD, ITGAE, ITGAL, ITGAV, ITGAX, ITGB1, ITGB3, ITGB4, ITGB5, ITGB6, ITGB7, ITGB8, JAM2, JAM3, KDR, KLK7, KLKB1, LAMA1, LAMA2, LAMA3, LAMA4, LAMA5, LAMB1, LAMB2, LAMB3, LAMC1, LAMC2, LAMC3, LOX, LOXL1, LOXL4, LRP4, LTBP1, LTBP2, LTBP3, LTBP4, LUM, MATN3, MATN4, MFAP1, MFAP2, MFAP3, MFAP4, MMP11, MMP14, MMP15, MMP16, MMP17, MMP19, MMP1, MMP2, MMP24, MMP9"
"264","FBXL7 down-regulates AURKA during mitotic entry and in early mitosis",0.000201979398101394,0.000853517877739331,-0.573257080610022,-4.8258194016489,0,51,"UBC, UBB, SKP1, RPS27A, RBX1, PSMF1, PSME4, PSME3, PSME2, PSME1, PSMD9, PSMD8, PSMD7, PSMD6, PSMD5, PSMD4, PSMD3, PSMD2, PSMD14, PSMD13, PSMD12, PSMD11, PSMD10, PSMD1, PSMC6, PSMC5, PSMC4, PSMC3, PSMC2, PSMC1, PSMB9, PSMB8, PSMB7, PSMB6, PSMB5, PSMB4, PSMB3, PSMB2, PSMB10, PSMB1, PSMA7, PSMA6, PSMA5, PSMA4, PSMA3, PSMA1"
"265","FCERI mediated Ca+2 mobilization",0.0750099482690012,0.0978719224265557,-0.245180870920013,-1.48789386559124,376,26,"VAV3, VAV2, TXK, TEC, SYK, SOS1, SHC1, PPP3R1, PPP3CB, PPP3CA, PLCG2, PLCG1, NFATC3, NFATC2, LYN, LCP2, LAT, ITPR3, ITPR2, ITPR1, ITK, GRB2, GRAP2"
"266","FCERI mediated MAPK activation",0.0035964035964036,0.011790740904665,-0.325036173126038,-2.04878901043378,17,28,"VAV3, VAV2, SYK, SOS1, SHC1, RAC1, PLCG2, PLCG1, PAK2, PAK1, NRAS, MAPK9, MAPK8, MAPK3, MAPK10, MAPK1, MAP3K1, MAP2K7, MAP2K4, LYN, LCP2, LAT, KRAS, JUN, HRAS, GRB2, GRAP2"
"267","FCERI mediated NF-kB activation",0.000200762899016262,0.000853517877739331,-0.444397534881723,-4.48400018659046,0,73,"UBE2N, UBE2D2, UBE2D1, UBC, UBB, TRAF6, TAB3, TAB2, TAB1, SKP1, RPS27A, RELA, RASGRP4, RASGRP2, RASGRP1, PSMF1, PSME4, PSME3, PSME2, PSME1, PSMD9, PSMD8, PSMD7, PSMD6, PSMD5, PSMD4, PSMD3, PSMD2, PSMD14, PSMD13, PSMD12, PSMD11, PSMD10, PSMD1, PSMC6, PSMC5, PSMC4, PSMC3, PSMC2, PSMC1, PSMB9, PSMB8, PSMB7, PSMB6, PSMB5, PSMB4, PSMB3, PSMB2, PSMB10, PSMB1, PSMA7, PSMA6, PSMA5, PSMA4, PSMA3, PSMA1, PRKCQ"
"268","FGFR1 mutant receptor activation",0.0181166633485965,0.0354161396407792,0.309142952087487,1.83624639150461,90,27,"BAG4, BCR, CNTRL, CPSF6, CUX1, ERLIN2, FGF1, FGF17, FGF2, FGF20, FGF23, FGF5, FGF9, FGFR1, FGFR1OP, FGFR1OP2, GAB2"
"269","FGFR2 alternative splicing",0.00278884462151394,0.00935030106112766,-0.366904519198097,-2.14268684080984,13,24,"TIAL1, TIA1, RBFOX2, PTBP1, POLR2L, POLR2K, POLR2J, POLR2I, POLR2H, POLR2G, POLR2F, POLR2E, POLR2D, POLR2C, POLR2B, POLR2A, NCBP2, NCBP1, HNRNPM, HNRNPH1, HNRNPF, HNRNPA1, GTF2F2, GTF2F1"
"270","FGFR2 mutant receptor activation",0.0105936438137118,0.0246076569305054,0.357239972807614,2.18125279254791,52,29,"FGF1, FGF10, FGF16, FGF17, FGF18, FGF2, FGF20, FGF22, FGF23, FGF5, FGF7, FGF9, FGFR2, GTF2F1, GTF2F2, NCBP1, NCBP2, POLR2A, POLR2B, POLR2C, POLR2D, POLR2E, POLR2F, POLR2G, POLR2H, POLR2I, POLR2J, POLR2K, POLR2L"
"271","FLT3 Signaling",0.0883534136546185,0.111355397258132,0.188863076649656,1.3495179918008,461,228,"ACTN2, AKT2, ANGPT1, APBB1IP, ARAF, AREG, ARRB1, ARRB2, ARTN, BRAF, BRAP, BTC, CALM1, CAMK2A, CAMK2B, CAMK2G, CNKSR2, CSF2RA, CSK, CUL3, DAB2IP, DLG1, DLG2, DLG3, DLG4, DUSP1, DUSP10, DUSP16, DUSP2, DUSP4, DUSP5, DUSP6, DUSP7, DUSP8, EGF, EGFR, ERBB2, ERBB4, FGF1, FGF10, FGF16, FGF17, FGF18, FGF2, FGF20, FGF22, FGF23, FGF5, FGF7, FGF9, FGFR1, FGFR2, FGFR3, FGFR4, FLT3, FLT3LG, FN1, FRS2, FRS3, FYN, GAB1, GAB2, GFRA1, GFRA2, GFRA4, UBA52, GRB2, GRIN1, GRIN2B, GRIN2D, HBEGF, HCK, HGF, HRAS, IL17RD, IL2, IL2RA, IL5, IL5RA, IQGAP1, IRS1, IRS2, ITGA2B, ITGB3, JAK1, JAK2, JAK3, KBTBD7, KIT, KITLG, KL, KLB, KRAS, KSR1, KSR2, LAMTOR2, LAMTOR3, LAT, LRRC7, MAP2K1, MAP2K2, MAP3K11, MAPK1, MAPK3, MARK3, MET, NCAM1, NEFL, NF1, NRAS, NRG1, NRG2, NRG3, NRG4, NRTN, PAQR3, PDE3B, PDGFA, PDGFB, PDGFRA, PDGFRB, PDPK1, PEA15, PHB, PIK3C3, PIK3CA, PIK3CB, PIK3R1, PIK3R2, PIK3R4, PPP2CA, PPP2CB, PPP2R1A, PPP2R1B, PPP2R5A, PPP2R5B, PPP2R5C, PPP2R5D, PPP2R5E, PPP5C, PSMA1, PSMA3, PSMA4, PSMA5, PSMA6, PSMA7, PSMB1, PSMB10, PSMB2, PSMB3, PSMB4, PSMB5, PSMB6, PSMB7, PSMB8, PSMB9, PSMC1, PSMC2, PSMC3, PSMC4, PSMC5, PSMC6, PSMD1, PSMD10, PSMD11, PSMD12, PSMD13, PSMD14, PSMD2, PSMD3, PSMD4, PSMD5, PSMD6, PSMD7, PSMD8, PSMD9, PSME1, PSME2, PSME3, PSME4, PSMF1, PTK2, PTPN11, PTPRA, RAF1, RANBP9, RAP1A, RAP1B, RAPGEF2, RASA1, RASA2, RASA3, RASA4, RASAL1, RASAL2, RASGEF1A, RASGRF1, RASGRF2, RASGRP1, RASGRP3, RASGRP4"
"272","FOXO-mediated transcription",0.429620806035338,0.454170566380215,0.112476331224311,0.854550011004441,2163,59,"ABCA6, AGRP, AKT1, AKT2, AKT3, ATXN3, BCL2L11, BCL6, BTG1, CAT, CAV1, CCNG2, CDKN1A, CDKN1B, CITED2, CREBBP, DDIT3, EP300, FBXO32, FOXG1, FOXO1, FOXO3, FOXO4, FOXO6, GADD45A, GCK"
"273","FOXO-mediated transcription of cell cycle genes",0.156025538707103,0.180404529130088,0.26552098899606,1.29162965692284,781,17,"BTG1, CAV1, CCNG2, CDKN1A, CDKN1B, FOXG1, FOXO1, FOXO3, FOXO4, GADD45A"
"274","FOXO-mediated transcription of oxidative stress, metabolic and neuronal genes",0.336012861736334,0.361484241701809,0.18092843063957,1.05592627506779,1671,26,"ABCA6, AGRP, ATXN3, CAT, FBXO32, FOXO1, FOXO3, FOXO4, FOXO6, GCK, HDAC1, HDAC2, INS, NPY, NR3C1, PLXNA4, POMC, PPARGC1A, RETN, SIN3A, SIRT3, SMAD2, SMAD3, SMAD4, SOD2, SREBF1"
"275","FRS-mediated FGFR1 signaling",0.00798562587342783,0.0202994263354686,0.400868850114416,2.04892834868765,39,19,"FGF1, FGF10, FGF17, FGF2, FGF20, FGF22, FGF23, FGF5, FGF9, FGFR1, FRS2, FRS3, GRB2, HRAS, KL, KRAS"
"276","FRS-mediated FGFR2 signaling",0.00675004963271789,0.0181167135220097,0.422990313124842,2.27394545305648,33,21,"FGF1, FGF10, FGF16, FGF17, FGF18, FGF2, FGF20, FGF22, FGF23, FGF5, FGF7, FGF9, FGFR2, FRS2, FRS3, GRB2, HRAS"
"277","FRS-mediated FGFR3 signaling",0.00962502506516944,0.023243650273929,0.39205896338564,1.94987829428477,47,18,"FGF1, FGF16, FGF17, FGF18, FGF2, FGF20, FGF23, FGF5, FGF9, FGFR3, FRS2, FRS3, GRB2, HRAS, KRAS"
"278","FRS-mediated FGFR4 signaling",0.00962502506516944,0.023243650273929,0.39205896338564,1.94987829428477,47,18,"FGF1, FGF16, FGF17, FGF18, FGF2, FGF20, FGF23, FGF9, FGFR4, FRS2, FRS3, GRB2, HRAS, KLB, KRAS"
"279","Factors involved in megakaryocyte development and platelet production",0.0437855880620459,0.0654528847341575,0.292068046730887,2.35199633822015,222,102,"ABL1, AK3, AKAP1, AKAP10, CABLES1, CABLES2, CAPZA2, CAPZB, CARMIL1, CBX5, CDC42, CDK5, CENPE, DOCK1, DOCK10, DOCK11, DOCK2, DOCK3, DOCK4, DOCK5, DOCK6, DOCK7, DOCK8, DOCK9, EHD1, EHD2, EHD3, GATA1, GATA4, H3-3A, HDAC1, HDAC2, HMG20B, IRF1, IRF2, ITPK1, JAK2, JMJD1C, KDM1A, KIF11, KIF13B, KIF15, KIF16B, KIF18A, KIF19, KIF1A, KIF1B, KIF1C, KIF20A, KIF21A, KIF21B, KIF22, KIF23, KIF26A, KIF26B, KIF27, KIF2A, KIF2C, KIF3A, KIF3B, KIF3C, KIF4A, KIF5A, KIF5B, KIF5C, KIF6, KIF9, KIFAP3, KIFC2, KIFC1, KLC1, KLC2, KLC3, KLC4"
"280","Fanconi Anemia Pathway",0.0171862509992006,0.0341091111784902,0.293981638898334,1.90935976642799,85,34,"ATR, ATRIP, DCLRE1A, DCLRE1B, EME2, ERCC1, ERCC4, FAAP100, FAAP24, FAN1, FANCA, FANCB, FANCC, FANCD2, FANCE, FANCF, FANCG, FANCI, FANCL, FANCM"
"281","Fatty acid metabolism",0.0597625072999805,0.0825519434170398,0.277830692190791,2.19471897104982,306,143,"ABCC1, ABCD1, ACAA1, ACAA2, ACACA, ACAD10, ACAD11, ACADL, ACADM, ACADS, ACADVL, ACBD4, ACBD5, ACBD6, ACBD7, ACLY, ACOT11, ACOT12, ACOT13, ACOT2, ACOT1, ACOT6, ACOT7, ACOT8, ACOT9, ACOX1, ACOX2, ACOX3, ACOXL, ACSBG1, ACSBG2, ACSF2, ACSL1, ACSL3, ACSL4, ACSL5, ACSL6, ACSM3, ALDH3A2, ALOX12, ALOX12B, ALOX5, ALOX5AP, ALOX15B, ALOXE3, AMACR"
"282","Fatty acyl-CoA biosynthesis",0.0104,0.0243214446952596,0.378740906927731,2.34074416309986,51,30,"ACACA, ACLY, ACSBG1, ACSBG2, ACSL1, ACSL3, ACSL4, ACSL5, ACSL6, CBR4, ELOVL1, ELOVL2, ELOVL4, ELOVL5, ELOVL6, ELOVL7, FASN, HSD17B8, HACD1, HACD2, HACD3, HACD4, HSD17B12"
"283","Fc epsilon receptor (FCERI) signaling",0.000205338809034908,0.000853517877739331,-0.254593517317025,-3.26750651808573,0,122,"VAV3, VAV2, UBE2N, UBE2D2, UBE2D1, UBC, UBB, TXK, TRAF6, TEC, TAB3, TAB2, TAB1, SYK, SOS1, SKP1, SHC1, RPS27A, RELA, RASGRP4, RASGRP2, RASGRP1, RAC1, PSMF1, PSME4, PSME3, PSME2, PSME1, PSMD9, PSMD8, PSMD7, PSMD6, PSMD5, PSMD4, PSMD3, PSMD2, PSMD14, PSMD13, PSMD12, PSMD11, PSMD10, PSMD1, PSMC6, PSMC5, PSMC4, PSMC3, PSMC2, PSMC1, PSMB9, PSMB8, PSMB7, PSMB6, PSMB5, PSMB4, PSMB3, PSMB2, PSMB10, PSMB1, PSMA7, PSMA6, PSMA5, PSMA4, PSMA3, PSMA1, PRKCQ, PPP3R1, PPP3CB, PPP3CA, PLCG2, PLCG1, PIK3R2, PIK3R1, PIK3CB, PIK3CA, PDPK1, PAK2, PAK1, NRAS, NFKBIA, NFKB1, NFATC3, NFATC2, MAPK9, MAPK8, MAPK3, MAPK10, MAPK1, MAP3K7, MAP3K1, MAP2K7, MAP2K4, MALT1, LYN, LCP2, LAT2, LAT, KRAS, JUN, ITPR3, ITPR2, ITPR1, ITK, IKBKG, IKBKB"
"284","Fcgamma receptor (FCGR) dependent phagocytosis",0.0525490196078431,0.0743726561662917,0.165645678422812,1.32771093960521,267,80,"ABI1, ABI2, ABL1, ACTB, ACTG1, ACTR2, ACTR3, AHCYL1, ARPC1A, ARPC1B, ARPC2, ARPC3, ARPC4, ARPC5, BAIAP2, BRK1, BTK, CD247, CDC42, CFL1, CRK, CYFIP1, CYFIP2, DOCK1, ELMO1, ELMO2, FCGR1A, FCGR2A, FGR, FYN, GRB2, HCK, HSP90AB1, ITPR1, ITPR2, ITPR3, LIMK1, LYN, MAPK1, MAPK3, MYH9, MYO10, MYO1C, MYO5A, MYO9B, NCK1, NCKAP1, NCKAP1L, NCKIPSD, NF2, PAK1, PIK3CA, PIK3CB, PIK3R1, PIK3R2, PLA2G6, PLCG1, PLCG2, PLD1, PLD2, PLD3, PLD4, PLPP4, PLPP5"
"285","Fertilization",0.00532544378698225,0.0159455484488833,0.481279290905386,2.28446132407923,26,16,"ACR, ADAM2, ADAM21, B4GALT1, CATSPER2, CATSPER3, CATSPER4, CATSPERB, CATSPERD, CD9"
"286","Formation of Fibrin Clot (Clotting Cascade)",0.154521860650829,0.179266122770726,-0.235920734833557,-1.32183911938337,773,22,"THBD, TFPI, SERPING1, SERPINE2, SERPIND1, SERPINC1, PRTN3, PROS1, PRCP, KLKB1, GP5, GP1BB, F8, F5, F3, F2R, F2, F13B, F13A1, F12, F11"
"287","Formation of HIV elongation complex in the absence of HIV Tat",0.0272617124394184,0.0469155051283015,0.240960995556456,1.67694838132076,134,43,"CCNH, CCNK, CCNT1, CCNT2, CDK7, CDK9, CTDP1, ELL, ELOA, ELOC, ERCC2, ERCC3, GTF2F1, GTF2F2, GTF2H1, GTF2H2, GTF2H3, GTF2H4, GTF2H5, MNAT1, NCBP1, NCBP2, NELFA, NELFB, NELFCD, NELFE, POLR2A, POLR2B, POLR2C, POLR2D, POLR2E, POLR2F, POLR2G, POLR2H, POLR2I, POLR2J, POLR2K, POLR2L"
"288","Formation of HIV-1 elongation complex containing HIV-1 Tat",0.0300282144296655,0.0500953786620506,0.235240235107481,1.62634044003345,148,41,"CCNH, CCNT1, CDK7, CDK9, CTDP1, ELL, ELOA, ELOC, ERCC2, ERCC3, GTF2F1, GTF2F2, GTF2H1, GTF2H2, GTF2H3, GTF2H4, GTF2H5, MNAT1, NCBP1, NCBP2, NELFA, NELFB, NELFCD, NELFE, POLR2A, POLR2B, POLR2C, POLR2D, POLR2E, POLR2F, POLR2G, POLR2H, POLR2I, POLR2J, POLR2K, POLR2L"
"289","Formation of Incision Complex in GG-NER",0.374777975133215,0.400278332204135,-0.138395590936926,-1.06054465606544,1898,42,"XPC, XPA, USP45, UBE2V2, UBE2N, UBE2I, UBC, UBB, SUMO2, SUMO1, RPS27A, RPA3, RPA2, RPA1, RNF111, RBX1, RAD23B, RAD23A, PIAS3, PIAS1, PARP2, PARP1, MNAT1, GTF2H5, GTF2H4, GTF2H3, GTF2H2, GTF2H1, UBA52, ERCC5, ERCC4, ERCC3, ERCC2, ERCC1, DDB2, DDB1, CUL4B, CUL4A, CHD1L, CETN2, CDK7, CCNH"
"290","Formation of RNA Pol II elongation complex",0.0313803376365442,0.0516015611661945,0.214494896916745,1.60673729437144,157,56,"AFF4, CCNH, CCNK, CCNT1, CCNT2, CDC73, CDK7, CDK9, CTDP1, CTR9, EAF1, EAF2, ELL, ELOA, ELOC, ERCC2, ERCC3, GTF2F1, GTF2F2, GTF2H1, GTF2H2, GTF2H3, GTF2H4, GTF2H5, IWS1, LEO1, MLLT1, MLLT3, MNAT1, NCBP1, NCBP2, NELFA, NELFB, NELFCD, NELFE, PAF1, POLR2A, POLR2B, POLR2C, POLR2D, POLR2E, POLR2F, POLR2G, POLR2H, POLR2I, POLR2J, POLR2K, POLR2L"
"291","Formation of TC-NER Pre-Incision Complex",0.203567888999009,0.229235144568449,0.147695533417785,1.09521509778805,1026,53,"AQR, CCNH, CDK7, COPS2, COPS3, COPS4, COPS5, COPS6, COPS7A, COPS7B, COPS8, CUL4A, CUL4B, DDB1, EP300, ERCC2, ERCC3, ERCC6, ERCC8, UBA52, GPS1, GTF2H1, GTF2H2, GTF2H3, GTF2H4, GTF2H5, HMGN1, ISY1, MNAT1, POLR2A, POLR2B, POLR2C, POLR2D, POLR2E, POLR2F, POLR2G, POLR2H, POLR2I, POLR2J, POLR2K, POLR2L, PPIE, PRPF19"
"292","Formation of a pool of free 40S subunits",0.000200843542880096,0.000853517877739331,-0.472890108581678,-4.69961832814913,0,71,"RPSA, RPS9, RPS8, RPS7, RPS5, RPS4X, RPS3A, RPS28, RPS27L, RPS27A, RPS25, RPS24, RPS21, RPS20, RPS19, RPS17, RPS16, RPS15A, RPS15, RPS14, RPS13, RPS12, RPS11, RPLP1, RPL8, RPL7A, RPL6, RPL5, RPL4, RPL3L, RPL38, RPL37A, RPL36, RPL35, RPL34, RPL32, RPL30, RPL3, RPL29, RPL28, RPL27, RPL26, RPL23, RPL22L1, RPL19, RPL18A, RPL18, RPL14, RPL13A, RPL12, RPL11, RPL10A, RPL10"
"293","Formation of the Early Elongation Complex",0.0163934426229508,0.0332966703329667,0.2965950817848,1.90169466128525,81,33,"CCNH, CDK7, CTDP1, ERCC2, ERCC3, GTF2F1, GTF2F2, GTF2H1, GTF2H2, GTF2H3, GTF2H4, GTF2H5, MNAT1, NCBP1, NCBP2, NELFA, NELFB, NELFCD, NELFE, POLR2A, POLR2B, POLR2C, POLR2D, POLR2E, POLR2F, POLR2G, POLR2H, POLR2I, POLR2J, POLR2K, POLR2L"
"294","Formation of the HIV-1 Early Elongation Complex",0.0163934426229508,0.0332966703329667,0.2965950817848,1.90169466128525,81,33,"CCNH, CDK7, CTDP1, ERCC2, ERCC3, GTF2F1, GTF2F2, GTF2H1, GTF2H2, GTF2H3, GTF2H4, GTF2H5, MNAT1, NCBP1, NCBP2, NELFA, NELFB, NELFCD, NELFE, POLR2A, POLR2B, POLR2C, POLR2D, POLR2E, POLR2F, POLR2G, POLR2H, POLR2I, POLR2J, POLR2K, POLR2L"
