"","pathway","pval","padj","ES","NES","nMoreExtreme","size","leadingEdge"
"465","MAPK1/MAPK3 signaling",0.0852370896525245,0.108617004772467,0.191981719139624,1.38705333261573,443,217,"ACTN2, ANGPT1, APBB1IP, ARAF, AREG, ARRB1, ARRB2, ARTN, BRAF, BRAP, BTC, CALM1, CAMK2A, CAMK2B, CAMK2G, CDK1, CNKSR2, CSF2RA, CSK, CUL3, DAB2IP, DLG1, DLG2, DLG3, DLG4, DUSP1, DUSP10, DUSP16, DUSP2, DUSP4, DUSP5, DUSP6, DUSP7, DUSP8, EGF, EGFR, ERBB2, ERBB4, FGF1, FGF10, FGF16, FGF17, FGF18, FGF2, FGF20, FGF22, FGF23, FGF5, FGF7, FGF9, FGFR1, FGFR2, FGFR3, FGFR4, FLT3, FLT3LG, FN1, FRS2, FRS3, FYN, GFRA1, GFRA2, GFRA4, UBA52, GRB2, GRIN1, GRIN2B, GRIN2D, HBEGF, HGF, HRAS, IL17RD, IL2, IL2RA, IL5, IL5RA, IL6R, IL6ST, IQGAP1, IRS1, IRS2, ITGA2B, ITGB3, JAK1, JAK2, JAK3, KBTBD7, KIT, KITLG, KL, KLB, KRAS, KSR1, KSR2, LAMTOR2, LAMTOR3, LAT, LRRC7, MAP2K1, MAP2K2, MAP3K11, MAPK1, MAPK3, MARK3, MET, NCAM1, NEFL, NF1, NRAS, NRG1, NRG2, NRG3, NRG4, NRTN, PAQR3, PDGFA, PDGFB, PDGFRA, PDGFRB, PEA15, PHB, PPP2CA, PPP2CB, PPP2R1A, PPP2R1B, PPP2R5A, PPP2R5B, PPP2R5C, PPP2R5D, PPP2R5E, PPP5C, PSMA1, PSMA3, PSMA4, PSMA5, PSMA6, PSMA7, PSMB1, PSMB10, PSMB2, PSMB3, PSMB4, PSMB5, PSMB6, PSMB7, PSMB8, PSMB9, PSMC1, PSMC2, PSMC3, PSMC4, PSMC5, PSMC6, PSMD1, PSMD10, PSMD11, PSMD12, PSMD13, PSMD14, PSMD2, PSMD3, PSMD4, PSMD5, PSMD6, PSMD7, PSMD8, PSMD9, PSME1, PSME2, PSME3, PSME4, PSMF1, PTK2, PTPN11, PTPRA, RAF1, RANBP9, RAP1A, RAP1B, RAPGEF2, RASA1, RASA2, RASA3, RASA4, RASAL1, RASAL2, RASGEF1A, RASGRF1, RASGRF2, RASGRP1, RASGRP3, RASGRP4"
"466","MAPK6/MAPK4 signaling",0.000203998368013056,0.000853517877739331,-0.311914182413534,-3.27194311990925,0,80,"XPO1, UBC, UBB, TNRC6C, TNRC6B, TNRC6A, SEPTIN7, RPS27A, RAC1, PSMF1, PSME4, PSME3, PSME2, PSME1, PSMD9, PSMD8, PSMD7, PSMD6, PSMD5, PSMD4, PSMD3, PSMD2, PSMD14, PSMD13, PSMD12, PSMD11, PSMD10, PSMD1, PSMC6, PSMC5, PSMC4, PSMC3, PSMC2, PSMC1, PSMB9, PSMB8, PSMB7, PSMB6, PSMB5, PSMB4, PSMB3, PSMB2, PSMB10, PSMB1, PSMA7, PSMA6, PSMA5, PSMA4, PSMA3, PSMA1, PRKACB, PRKACA"
"467","MECP2 regulates neuronal receptors and channels",0.206012024048096,0.23173556668168,-0.249626409455237,-1.2377979391655,1027,17,"TRPC3, SIN3A, PTPN4, PTPN1, OPRM1, OPRK1, NOTCH1, MET, MECP2, HDAC2, HDAC1, GRIN2B, GRIN2A, GRIA2, GPRIN1, FKBP5"
"468","MET activates PTK2 signaling",0.00942450370964508,0.0229703515843183,0.393881756221271,1.9589438291076,46,18,"HGF, ITGA2, ITGA3, ITGB1, LAMA1, LAMA2, LAMA3, LAMA4, LAMA5, LAMB1, LAMB2, LAMB3, LAMC1, LAMC2, LAMC3, MET"
"469","MET promotes cell motility",0.0637617429542275,0.0869173232902364,0.244311868538878,1.49173101015214,318,29,"CRK, CRKL, DOCK7, GAB1, GRB2, HGF, ITGA2, ITGA3, ITGB1, LAMA1, LAMA2, LAMA3, LAMA4, LAMA5, LAMB1, LAMB2, LAMB3, LAMC1, LAMC2, LAMC3"
"470","MHC class II antigen presentation",0.0343137254901961,0.0548595981602518,0.398123881990845,3.21085119799139,174,83,"ACTR10, ACTR1A, ACTR1B, AP1B1, AP1G1, AP1M1, AP1S1, AP1S2, AP1S3, AP2A1, AP2A2, AP2B1, AP2M1, AP2S1, ARF1, CANX, CAPZA2, CAPZB, CD74, CENPE, CLTA, CLTC, CTSA, CTSB, CTSC, CTSD, CTSF, CTSH, CTSK, CTSO, CTSS, DCTN1, DCTN2, DCTN3, DCTN4, DCTN5, DCTN6, DNM1, DNM2, DNM3, DYNC1H1, DYNC1I1, DYNC1I2, DYNC1LI1, DYNC1LI2, DYNLL1, DYNLL2, HLA-DMA, KIF11, KIF15, KIF18A, KIF20A, KIF22, KIF23, KIF26A, KIF2A, KIF2C, KIF3A, KIF3B, KIF3C, KIF4A, KIF5A, KIF5B, KIF5C, KIFAP3, KLC1, KLC2, KLC3, KLC4"
"471","Macroautophagy",0.265245707519242,0.291713962834326,0.101758999931689,0.822575258365073,1343,100,"AMBRA1, ARL13B, ATG10, ATG101, ATG12, ATG13, ATG14, ATG16L1, ATG3, ATG4A, ATG4B, ATG4C, ATG4D, ATG5, ATG7, ATG9A, ATG9B, CFTR, CHMP2A, CHMP2B, CHMP3, CHMP4B, CHMP4C, CHMP6, CHMP7, CSNK2A1, CSNK2A2, CSNK2B, DYNC1H1, DYNC1I1, DYNC1I2, DYNC1LI1, DYNC1LI2, DYNLL1, DYNLL2"
"472","Major pathway of rRNA processing in the nucleolus and cytosol",0.000207986688851913,0.000853517877739331,-0.307327810258934,-4.35634450311412,0,149,"XRN2, WDR75, WDR46, WDR43, WDR36, WDR3, WDR18, WDR12, UTP6, UTP4, UTP3, UTP20, UTP18, UTP15, UTP14A, UTP14C, UTP11, TSR1, TEX10, TBL3, SNU13, SENP3, RRP9, RRP7A, RRP36, RRP1, RPSA, RPS9, RPS8, RPS7, RPS5, RPS4X, RPS3A, RPS28, RPS27L, RPS27A, RPS25, RPS24, RPS21, RPS20, RPS19, RPS17, RPS16, RPS15A, RPS15, RPS14, RPS13, RPS12, RPS11, RPP40, RPP38, RPP30, RPP25, RPP21, RPP14, RPLP1, RPL8, RPL7A, RPL6, RPL5, RPL4, RPL3L, RPL38, RPL37A, RPL36, RPL35, RPL34, RPL32, RPL30, RPL3, RPL29, RPL28, RPL27, RPL26, RPL23, RPL22L1, RPL19, RPL18A, RPL18, RPL14, RPL13A, RPL12, RPL11, RPL10A, RPL10, RIOK3, RIOK2, RIOK1"
"473","Meiosis",0.000201288244766506,0.000853517877739331,-0.279403537618821,-2.47090308249788,0,56,"PRDM9, UBE2I, TOP3A, TINF2, TEX15, TEX12, TERF2IP, TERF2, TERF1, SYNE2, SYNE1, SYCP3, SYCP2, SYCP1, SYCE3, SYCE2, SUN2, SUN1, STAG3, STAG2, STAG1, SMC3, SMC1B, SMC1A, RPA3, RPA2, RPA1, REC8, RBBP8, RAD51C, RAD51, RAD50, RAD21"
"474","Meiotic recombination",0.141773162939297,0.166338614728326,-0.225708848715509,-1.34387470118783,709,25,"PRDM9, TOP3A, TEX15, RPA3, RPA2, RPA1, RBBP8, RAD51C, RAD51, RAD50, PSMC3IP, NBN, MSH5, MSH4, MRE11, MND1, MLH3, MLH1"
"475","Meiotic synapsis",0.000200803212851406,0.000853517877739331,-0.452673471816142,-3.03522029690919,0,32,"UBE2I, TINF2, TEX12, TERF2IP, TERF2, TERF1, SYNE2, SYNE1, SYCP3, SYCP2, SYCP1, SYCE3, SYCE2, SUN2, SUN1, STAG3, STAG2, STAG1, SMC3, SMC1B, SMC1A"
"476","Metabolic disorders of biological oxidation enzymes",0.00822962665596146,0.020643809238683,0.385541963982331,2.17326271556649,40,24,"ACY1, AHCY, CYP11A1, CYP19A1, CYP1B1, CYP26B1, CYP26C1, CYP27A1, CYP27B1, CYP2R1, CYP2U1, CYP4F22, CYP7B1, FDX1, FMO3, GCLC, GCLM, GSS"
"477","Metabolism of amino acids and derivatives",0.000210084033613445,0.000853517877739331,-0.180866904355256,-3.55490972670965,0,287,"TYRP1, TYR, TXNRD1, TXN2, TSTD1, TST, TPO, TPH2, TPH1, TMLHE, TH, TDO2, SUOX, SRR, SRM, SMS, SMOX, SLC7A5, SLC6A8, SLC6A7, SLC6A11, SLC5A5, SLC44A1, SLC3A2, SLC36A4, SLC25A21, SLC25A15, SLC25A13, SLC25A12, SHMT1, SERINC5, SERINC4, SERINC3, SERINC2, SERINC1, SEPSECS, SEPHS2, SECISBP2, SDSL, SCLY, SAT1, SARDH, RPSA, RPS9, RPS8, RPS7, RPS5, RPS4X, RPS3A, RPS28, RPS27L, RPS27A, RPS25, RPS24, RPS21, RPS20, RPS19, RPS17, RPS16, RPS15A, RPS15, RPS14, RPS13, RPS12, RPS11, RPLP1, RPL8, RPL7A, RPL6, RPL5, RPL4, RPL3L, RPL38, RPL37A, RPL36, RPL35, RPL34, RPL32, RPL30, RPL3, RPL29, RPL28, RPL27, RPL26, RPL23, RPL22L1, RPL19, RPL18A, RPL18, RPL14, RPL13A, RPL12, RPL11, RPL10A, RPL10, RIMKLB, RIMKLA, RIDA, QDPR, PYCR2, PYCR1, PXMP2, PSTK, PSPH, PSMF1, PSME4, PSME3, PSME2, PSME1, PSMD9, PSMD8, PSMD7, PSMD6, PSMD5, PSMD4, PSMD3, PSMD2, PSMD14, PSMD13, PSMD12, PSMD11, PSMD10, PSMD1, PSMC6, PSMC5, PSMC4, PSMC3, PSMC2, PSMC1, PSMB9, PSMB8, PSMB7, PSMB6, PSMB5, PSMB4, PSMB3, PSMB2, PSMB10, PSMB1, PSMA7, PSMA6, PSMA5, PSMA4, PSMA3, PSMA1, PSAT1"
"478","Metabolism of carbohydrates",0.0952831975752984,0.118645904673088,0.130186047637171,0.907571347440465,502,251,"AAAS, ABCC5, ACAN, ADPGK, AGL, AGRN, AKR1A1, AKR1B1, ALDOA, ALDOB, ALDOC, ARSB, B3GALT1, B3GALT2, B3GALT4, B3GALT5, B3GALT6, B3GAT1, B3GAT2, B3GAT3, B3GNT2, B3GNT3, B4GALNT2, B4GALT1, B4GALT2, B4GALT3, B4GALT4, B4GALT5, B4GALT6, B4GALT7, BCAN, BPGM, CALM1, CD44, CEMIP, CHP1, CHPF, CHPF2, CHST1, CHST11, CHST12, CHST2, CHST3, CHST7, CHST9, CHSY1, CHSY3, CRYL1, CSGALNACT1, CSGALNACT2, CSPG4, CSPG5, DCN, DCXR, DERA, DSE, DSEL, ENO1, ENO2, ENO3, EPM2A, EXT1, EXT2, FBP1, FUT10, FUT11, FUT7, FUT9, G6PC2, G6PC3, G6PD, GAA, GALE, GALK1, GAPDH, GAPDHS, GBE1, GCK, GLB1, GLB1L, GLCE, UBA52, B4GAT1, GNPDA1, GNPDA2, GNS, GOT1, GOT2, GPC1, GPC3, GPC4, GPC5, GPC6, GPI, GUSB, GYG1, GYS1, GYS2, HAS1, HAS3, HEXA, HEXB, HK1, HK2, HK3, HMMR, HPSE, HPSE2, HS2ST1, HS3ST1, HS3ST2, HS3ST4, HS3ST5, HS6ST1, HS6ST2, HS6ST3, HSPG2, HYAL2, HYAL3, IDS, IDUA, KERA, KHK, LUM, MAN2B1, MAN2B2, MAN2C1, MANBA, MDH1, MDH2, NAGLU, NCAN, NDC1, NDST1, NDST2, NDST3, NDST4, NHLRC1, NUP107, NUP133, NUP153, NUP155, NUP160, NUP188, NUP205, NUP210, NUP214, NUP35, NUP37, NUP43, NUP50, NUP54, NUP85, NUP88, NUP93, NUP98, NUP58, NUP42, OGN, OMD, PAPSS1, PAPSS2, PCK2, PC, PFKFB1, PFKFB2, PFKFB3, PFKFB4, PFKL, PFKM, PFKP, PGAM1, PGD, PGK1, PGLS, PGM1, PGM2, PGM2L1, PGP, PHKA1, PHKA2, PHKB, PHKG1, PHKG2, PKM, POM121C, POM121, PPP1R3C, PPP2CA, PPP2CB, PPP2R1A, PPP2R1B, PPP2R5D, PRELP, PRKACA, PRKACB, PRPS1, PRPS2, PYGB, PYGL, RAE1, RANBP2, RBKS, RHD, RHCE, RPEL1, RPE, RPIA, RPS27A, SDC1, SDC2, SDC3, SDC4, SEC13, SEH1L, SGSH, SHPK, SLC25A1, SLC25A11, SLC25A12, SLC25A13, SLC26A2, SLC2A1, SLC35B2, SLC35B3, SLC35D2, SLC37A1, SLC37A2, SLC37A4"
"479","Metabolism of cofactors",0.093242430318829,0.116665649529356,0.282872540361841,1.40684712763017,464,18,"AKT1, CALM1, COQ2, COQ3, COQ5, COQ6, COQ7, COQ9, DHFR, GCH1, GCHFR"
"480","Metabolism of fat-soluble vitamins",0.289968025579536,0.317219508448152,0.164943896633798,1.07128200635463,1450,34,"AGRN, AKR1B10, APOA1, APOA2, APOE, APOM, BCO1, CLPS, GPC1, GPC3, GPC4, GPC5, GPC6, HSPG2, LDLR, LPL, LRP1, LRP10, LRP12, LRP2, LRP8, PLB1, RBP1, RBP2, RBP4, RDH11, RETSAT, SDC1, SDC2, SDC3, SDC4"
"481","Metabolism of folate and pterines",0.374501197126895,0.400278332204135,0.213422089390028,1.0381940092227,1876,17,"ALDH1L1, ALDH1L2, DHFR, DHFR2, FOLR2, FPGS, MTHFD1, MTHFD1L, MTHFD2, MTHFD2L, MTHFR, MTHFS, SHMT1, SHMT2, SLC19A1, SLC25A32, SLC46A1"
"482","Metabolism of non-coding RNA",0.000200360649168503,0.000853517877739331,-0.379280643503147,-3.13076839902823,0,49,"TPR, TGS1, SNUPN, SNRPG, SNRPF, SNRPD3, SNRPD2, SNRPD1, SNRPB, SMN1, SEH1L, SEC13, RANBP2, RAE1, PRMT5, POM121, POM121C, PHAX, NUP42, NUP58, NUP98, NUP93, NUP88, NUP85, NUP54, NUP50, NUP43, NUP37, NUP35, NUP214, NUP210, NUP205, NUP188, NUP160, NUP155, NUP153, NUP133, NUP107, NDC1, NCBP2, NCBP1"
"483","Metabolism of nucleotides",0.0375642546461052,0.0586783464280895,0.204648147295815,1.64441243145241,189,86,"ADAL, ADK, ADPRM, ADSL, AGXT2, AK1, AK2, AK4, AK5, AK7, AK8, AK9, AMPD1, AMPD2, AMPD3, APRT, ATIC, CAD, CDA, CMPK1, CTPS1, CTPS2, DCK, DCTD, DCTPP1, DGUOK, DHODH, DNPH1, DPYD, DPYS, DTYMK, DUT, ENTPD1, ENTPD3, ENTPD5, ENTPD6, ENTPD7, GART, GDA, GLRX, GMPR, GMPR2, GMPS, GPX1, GSR, GUK1, HPRT1, IMPDH1, IMPDH2, ITPA, LHPP, NME1, NME2, NME4, NT5C, NT5C1A, NT5C2, NT5C3A, NT5E, NT5M, NUDT1, NUDT13, NUDT15, NUDT16, NUDT18, NUDT5, NUDT9"
"484","Metabolism of polyamines",0.000203748981255094,0.000853517877739331,-0.512983770287141,-4.44047323325688,0,54,"SRM, SMS, SMOX, SAT1, PSMF1, PSME4, PSME3, PSME2, PSME1, PSMD9, PSMD8, PSMD7, PSMD6, PSMD5, PSMD4, PSMD3, PSMD2, PSMD14, PSMD13, PSMD12, PSMD11, PSMD10, PSMD1, PSMC6, PSMC5, PSMC4, PSMC3, PSMC2, PSMC1, PSMB9, PSMB8, PSMB7, PSMB6, PSMB5, PSMB4, PSMB3, PSMB2, PSMB10, PSMB1, PSMA7, PSMA6, PSMA5, PSMA4, PSMA3, PSMA1, PAOX, ODC1, OAZ3, OAZ2, OAZ1, NQO1"
"485","Metabolism of porphyrins",0.00694306685181512,0.0185866079030503,0.417229431347238,2.19124979073106,34,20,"ABCC1, ABCC2, ABCG2, ALAD, ALAS1, ALAS2, BLVRA, BLVRB, COX10, CPOX, FECH, FLVCR1, GUSB, HMBS, HMOX1, HMOX2"
"486","Metabolism of steroid hormones",0.0883106643012024,0.111355397258132,-0.254298781568715,-1.46155836002747,447,23,"TSPOAP1, TSPO, STARD6, STARD4, STARD3NL, STARD3, STAR, SRD5A3, SRD5A2, SRD5A1"
"487","Metabolism of steroids",0.219407638347623,0.245206378994754,0.0985538401407074,0.788776910077572,1125,119,"ABCB11, ABCC3, ACACA, ACAT2, ACOT8, ACOX2, AKR1B1, AMACR, ARV1, BAAT, CARM1, CGA, CHD9, CREBBP, CUBN, CYP11A1, CYP19A1, CYP27A1, CYP27B1, CYP2R1, CYP39A1, CYP46A1, CYP51A1, CYP7B1, DHCR24, DHCR7, EBP, ELOVL6, FABP6, FASN, FDFT1, FDX1, GC, GGPS1, GPAM, HELZ2, HMGCR, HMGCS1, HSD11B1, HSD17B11, HSD17B12, HSD17B2, HSD17B4, HSD17B7, HSD3B2, HSD3B1, IDI1, INSIG1, INSIG2, KPNB1, LBR, LGMN, LRP2, LSS, MBTPS1, MBTPS2, MED1, MSMO1, MTF1, MVD, MVK, NCOA1, NCOA2, NCOA6, NFYA, NFYB, NFYC, NSDHL, OSBP, OSBPL1A, OSBPL2, OSBPL3, OSBPL6, OSBPL7, OSBPL9, PIAS4, PLPP6, PMVK, POMC, PPARA, PTGIS, RXRA, SAR1B, SC5D, SCAP, SCD, SCP2, SEC23A, SEC24A, SEC24B, SEC24D, SERPINA6, SLC10A1, SLC27A2, SLC27A5, SLCO1A2, SMARCD3, SP1, SQLE, SRD5A1, SRD5A2, SRD5A3, SREBF1, SREBF2, STAR, STARD3, STARD3NL, STARD4, STARD5, STARD6, SUMO2, TBL1X, TBL1XR1"
"488","Metabolism of vitamins and cofactors",0.0656400384985563,0.0890092668645345,0.162908978667947,1.2698993347868,340,160,"AASDHPPT, ABCC1, ABCD4, ACACA, ACP5, AGRN, AKR1B10, AKT1, ALDH1L1, ALDH1L2, AMN, AOX1, APOA1, APOA2, APOE, APOM, BCO1, BST1, BTD, CALM1, CBLIF, CD320, CD38, CLPS, COASY, COQ2, COQ3, COQ5, COQ6, COQ7, COQ9, CTRB2, CTRB1, CUBN, CYB5A, CYB5R3, DHFR, DHFR2, ENPP1, ENPP2, ENPP3, FASN, FLAD1, FOLR2, FPGS, GCH1, GCHFR, GPC1, GPC3, GPC4, GPC5, GPC6, GPHN, GSTO1, GSTO2, HLCS, HSPG2, IDH1, LDLR, LMBRD1, LPL, LRP1, LRP10, LRP12, LRP2, LRP8, MCCC1, MCCC2, MMAA, MMAB, MMACHC, MMADHC, MMUT, MOCOS, MOCS1, MOCS2, MOCS3, MTHFD1, MTHFD1L, MTHFD2, MTHFD2L, MTHFR, MTHFS, MTR, MTRR, NADK, NADK2, NADSYN1, NAMPT, NAXD, NAXE, NFS1, NMNAT1, NMNAT2, NMNAT3, NMRK1, NMRK2, NNMT, NOS3, NT5E, NUDT12, PANK1, PANK2, PANK3, PANK4, PARP14, PARP16, PARP4, PARP6, PARP8, PARP9, PCCA, PCCB, PC, PDSS1, PDSS2, PDXK, PDZD11, PLB1, PNPO, PPCDC, PPCS, PRKG2, PTGIS, PTGS2, PTS, RBP1, RBP2, RBP4, RDH11, RETSAT, RFK, RNLS, SDC1, SDC2, SDC3, SDC4, SHMT1, SHMT2, SLC19A1, SLC19A2, SLC23A1, SLC23A2, SLC25A16, SLC25A19, SLC25A32, SLC2A1, SLC46A1, SLC52A2, SLC52A1, SLC5A6, SLC5A8"
"489","Metabolism of water-soluble vitamins and cofactors",0.00246964395966248,0.00836127824251742,-0.177311920334615,-2.15290382074084,11,109,"PRSS3, PRSS1, TPK1, TCN2, SLC5A8, SLC5A6, SLC52A1, SLC52A2, SLC46A1, SLC2A1, SLC25A32, SLC25A19, SLC25A16, SLC23A2, SLC23A1, SLC19A2, SLC19A1, SHMT2, SHMT1, RNLS, RFK, PTGS2, PTGIS, PPCS, PPCDC, PNPO, PDZD11, PDXK, PC, PCCB, PCCA, PARP9, PARP8, PARP6, PARP4, PARP16, PARP14, PANK4, PANK3, PANK2, PANK1, NUDT12, NT5E, NNMT, NMRK2, NMRK1, NMNAT3, NMNAT2, NMNAT1, NFS1, NAXE, NAXD, NAMPT, NADSYN1, NADK2, NADK, MTRR, MTR, MTHFS, MTHFR, MTHFD2L, MTHFD2, MTHFD1L, MTHFD1, MOCS3, MOCS2, MOCS1, MOCOS, MMUT, MMADHC, MMACHC, MMAB, MMAA"
"490","Metal ion SLC transporters",0.00019712201852947,0.000853517877739331,-0.684992377418249,-3.9369293458459,0,23,"SLC41A2, SLC41A1, SLC40A1, SLC39A8, SLC39A7, SLC39A6, SLC39A3, SLC39A2, SLC39A14, SLC39A10, SLC39A1, SLC31A1, SLC30A8, SLC30A7, SLC30A6, SLC30A5, SLC30A3, SLC30A10, SLC30A1, SLC11A2, SLC11A1"
"491","Metalloprotease DUBs",0.582164328657315,0.59778914702274,-0.179866865914957,-0.891888147730675,2904,17,"UIMC1, UBC, UBB, STAMBPL1, STAMBP, STAM"
"492","MicroRNA (miRNA) biogenesis",0.0268085945200079,0.0462895065378803,-0.295079593935025,-1.69594224844018,135,23,"XPO5, TARBP2, PRKRA, POLR2L, POLR2K, POLR2J, POLR2I, POLR2H, POLR2G, POLR2F, POLR2E, POLR2D, POLR2C, POLR2B, POLR2A"
"493","Miscellaneous transport and binding events",0.0148898153662895,0.030975599838305,0.348911925145109,1.87570887815281,74,21,"ADD1, ADD2, ADD3, ANKH, CTNS, DMTN, LRRC8A, LRRC8B, LRRC8C, LRRC8D, LRRC8E, MAGT1, MMGT1, MRS2, NIPA1, NIPA2, NIPAL2, NIPAL3, NIPAL4"
"494","Misspliced GSK3beta mutants stabilize beta-catenin",0.0413108242303873,0.0622969634682405,0.346577017114914,1.59255434786438,207,15,"AMER1, APC, AXIN1, CSNK1A1, CTNNB1, GSK3B, PPP2CA, PPP2CB, PPP2R1A, PPP2R1B, PPP2R5A, PPP2R5B, PPP2R5C, PPP2R5D, PPP2R5E"
"495","Mitochondrial Fatty Acid Beta-Oxidation",0.0121489743079068,0.0267225846772642,0.491774832892896,3.22743927845664,60,35,"ACAA2, ACAD10, ACAD11, ACADL, ACADM, ACADS, ACADVL, ACBD6, ACBD7, ACOT11, ACOT12, ACOT13, ACOT2, ACOT1, ACOT7, ACOT9, ACSF2, ACSM3"
"496","Mitochondrial biogenesis",0.0483234714003945,0.0701164094829253,0.168017547327892,1.35291032615677,244,87,"ACSS2, ALAS1, APOO, APOOL, ATF2, ATP5F1A, ATP5F1B, ATP5F1C, ATP5F1D, ATP5F1E, ATP5MC3, ATP5PD, ATP5PF, ATP5MF, ATP5ME, ATP5MG, ATP5PO, CALM1, CAMK4, CARM1, CHCHD3, CHCHD6, CHD9, CREB1, CREBBP, CRTC1, CRTC2, CRTC3, DMAC2L, DNAJC11, ESRRA, GABPA, GABPB1, GLUD1, GLUD2, HCFC1, HDAC3, HELZ2, HSPA9, IDH2, IMMT, MAPK11, MAPK12, MAPK14, MED1, MEF2C, MEF2D, MICOS10, MICOS13, MT-ATP6, MTERF1, MTX1, MTX2, NCOA1, NCOA2, NCOA6, NCOR1, NR1D1, NRF1, PERM1, POLG2, POLRMT, PPARA, PPARGC1A, PPARGC1B, PPRC1, PRKAA2, PRKAB1, PRKAB2, PRKAG1, PRKAG2, PRKAG3"
"497","Mitochondrial calcium ion transport",0.00704934541792548,0.01877409216702,-0.356317822685536,-1.94966333381547,34,21,"YME1L1, VDAC3, VDAC2, VDAC1, STOML2, SMDT1, SLC8B1, SLC8A3, PMPCB, PMPCA, PHB2, PHB, PARL, MICU3, MICU2, MICU1, MCUB, MCU, LETM1"
"498","Mitochondrial protein import",0.0184921763869132,0.0358091490408264,-0.196123772457481,-1.75656948553767,90,58,"VDAC1, TOMM70, TOMM7, TOMM40, TOMM22, TOMM20, TIMM9, TIMM8B, TIMM8A, TIMM50, TIMM44, TIMM23, TIMM22, TIMM21, TIMM17B, TIMM17A, TIMM13, TIMM10B, TIMM10"
"499","Mitochondrial tRNA aminoacylation",0.957740837172041,0.958666190637908,-0.109071081235698,-0.571248677138877,4781,19,"YARS2, WARS2, VARS2, TARS2, SARS2, RARS2, PPA2, PARS2, NARS2, MARS2, LARS2, KARS1, IARS2, HARS2, FARS2, EARS2, DARS2"
"500","Mitochondrial translation",0.000203045685279188,0.000853517877739331,-0.440895055245137,-4.91177169856456,0,91,"TUFM, TSFM, PTCD3, OXA1L, MTRF1L, MTIF3, MTIF2, MTFMT, MRRF, MRPS9, MRPS7, MRPS5, MRPS36, MRPS35, MRPS34, MRPS33, MRPS31, MRPS30, MRPS28, MRPS27, MRPS26, MRPS25, MRPS24, MRPS23, MRPS22, MRPS21, MRPS2, MRPS18C, MRPS18B, MRPS18A, MRPS17, MRPS16, MRPS15, MRPS14, MRPS12, MRPS11, MRPS10, MRPL9, MRPL58, MRPL57, MRPL55, MRPL54, MRPL52, MRPL51, MRPL50, MRPL49, MRPL48, MRPL47, MRPL46, MRPL45, MRPL44, MRPL43, MRPL42, MRPL41, MRPL40, MRPL4, MRPL39, MRPL38, MRPL37, MRPL36, MRPL35, MRPL34, MRPL32, MRPL30, MRPL3, MRPL28, MRPL27, MRPL24, MRPL23, MRPL22, MRPL21, MRPL20, MRPL2, MRPL19, MRPL18, MRPL17, MRPL16, MRPL15, MRPL14, MRPL13, MRPL12, MRPL11, MRPL10, MRPL1"
"501","Mitochondrial translation elongation",0.000203500203500203,0.000853517877739331,-0.447086119830763,-4.82076847708521,0,85,"TUFM, TSFM, PTCD3, OXA1L, MRPS9, MRPS7, MRPS5, MRPS36, MRPS35, MRPS34, MRPS33, MRPS31, MRPS30, MRPS28, MRPS27, MRPS26, MRPS25, MRPS24, MRPS23, MRPS22, MRPS21, MRPS2, MRPS18C, MRPS18B, MRPS18A, MRPS17, MRPS16, MRPS15, MRPS14, MRPS12, MRPS11, MRPS10, MRPL9, MRPL58, MRPL57, MRPL55, MRPL54, MRPL52, MRPL51, MRPL50, MRPL49, MRPL48, MRPL47, MRPL46, MRPL45, MRPL44, MRPL43, MRPL42, MRPL41, MRPL40, MRPL4, MRPL39, MRPL38, MRPL37, MRPL36, MRPL35, MRPL34, MRPL32, MRPL30, MRPL3, MRPL28, MRPL27, MRPL24, MRPL23, MRPL22, MRPL21, MRPL20, MRPL2, MRPL19, MRPL18, MRPL17, MRPL16, MRPL15, MRPL14, MRPL13, MRPL12, MRPL11, MRPL10, MRPL1"
"502","Mitochondrial translation initiation",0.000203500203500203,0.000853517877739331,-0.458919066466494,-4.94835887544997,0,85,"PTCD3, OXA1L, MTIF3, MTIF2, MTFMT, MRPS9, MRPS7, MRPS5, MRPS36, MRPS35, MRPS34, MRPS33, MRPS31, MRPS30, MRPS28, MRPS27, MRPS26, MRPS25, MRPS24, MRPS23, MRPS22, MRPS21, MRPS2, MRPS18C, MRPS18B, MRPS18A, MRPS17, MRPS16, MRPS15, MRPS14, MRPS12, MRPS11, MRPS10, MRPL9, MRPL58, MRPL57, MRPL55, MRPL54, MRPL52, MRPL51, MRPL50, MRPL49, MRPL48, MRPL47, MRPL46, MRPL45, MRPL44, MRPL43, MRPL42, MRPL41, MRPL40, MRPL4, MRPL39, MRPL38, MRPL37, MRPL36, MRPL35, MRPL34, MRPL32, MRPL30, MRPL3, MRPL28, MRPL27, MRPL24, MRPL23, MRPL22, MRPL21, MRPL20, MRPL2, MRPL19, MRPL18, MRPL17, MRPL16, MRPL15, MRPL14, MRPL13, MRPL12, MRPL11, MRPL10, MRPL1"
"503","Mitochondrial translation termination",0.0361635220125786,0.057102459949435,0.451289750238843,3.61996122494257,183,85,"AURKAIP1, CHCHD1, DAP3, ERAL1, GADD45GIP1, GFM2, MRPL1, MRPL10, MRPL11, MRPL12, MRPL13, MRPL14, MRPL15, MRPL16, MRPL17, MRPL18, MRPL19, MRPL2, MRPL20, MRPL21, MRPL22, MRPL23, MRPL24, MRPL27, MRPL28, MRPL3, MRPL30, MRPL32, MRPL34, MRPL35, MRPL36, MRPL37, MRPL38, MRPL39, MRPL4, MRPL40, MRPL41, MRPL42, MRPL43, MRPL44, MRPL45, MRPL46, MRPL47, MRPL48, MRPL49, MRPL50, MRPL51, MRPL52, MRPL54, MRPL55, MRPL57, MRPL58, MRPL9, MRPS10, MRPS11, MRPS12, MRPS14, MRPS15, MRPS16, MRPS17, MRPS18A, MRPS18B, MRPS18C, MRPS2, MRPS21, MRPS22, MRPS23, MRPS24, MRPS25, MRPS26, MRPS27, MRPS28, MRPS30, MRPS31, MRPS33, MRPS34, MRPS35, MRPS36, MRPS5, MRPS7, MRPS9, MRRF, MTRF1L"
"504","Mitophagy",0.0587060702875399,0.0814183250574182,-0.25908386570613,-1.54259017575011,293,25,"VDAC1, ULK1, UBC, UBB, TOMM70, TOMM7, TOMM40, TOMM22, TOMM20, SRC, SQSTM1"
"505","Mitotic Anaphase",0.000208986415882968,0.000853517877739331,-0.164697999232287,-2.44191676151627,0,163,"ZWINT, ZWILCH, ZW10, XPO1, WAPL, VRK2, VRK1, UBE2E1, UBE2D1, UBC, UBB, TMPO, TAOK1, STAG2, STAG1, SPDL1, SPC25, SPC24, SMC3, SMC1A, SKA2, SGO2, SEH1L, SEC13, RPS27A, RCC2, RANGAP1, RANBP2, RAD21, PTTG1, PSMF1, PSME4, PSME3, PSME2, PSME1, PSMD9, PSMD8, PSMD7, PSMD6, PSMD5, PSMD4, PSMD3, PSMD2, PSMD14, PSMD13, PSMD12, PSMD11, PSMD10, PSMD1, PSMC6, PSMC5, PSMC4, PSMC3, PSMC2, PSMC1, PSMB9, PSMB8, PSMB7, PSMB6, PSMB5, PSMB4, PSMB3, PSMB2, PSMB10, PSMB1, PSMA7, PSMA6, PSMA5, PSMA4, PSMA3, PSMA1, PPP2R5E, PPP2R5D, PPP2R5C, PPP2R5B, PPP2R5A, PPP2R2A, PPP2R1B, PPP2R1A, PPP2CB, PPP2CA, PPP1CC, PMF1, PLK1, PDS5B, PDS5A, PAFAH1B1, NUP98, NUP85, NUP43, NUP37, NUP160, NUP133, NUP107, NUF2, NUDC"
"506","Mitotic G1 phase and G1/S transition",0.0561667631731326,0.0781057270434435,0.200423019568459,1.60388734977647,290,135,"ABL1, AKT1, AKT2, AKT3, CABLES1, CCNA1, CCNA2, CCNB1, CCND1, CCND2, CCND3, CCNE1, CCNE2, CCNH, CDC25A, CDC45, CDC7, CDK1, CDK4, CDK6, CDK7, CDKN1A, CDKN1B, CDKN1C, CDKN2B, CDKN2D, CUL1, DBF4, DHFR, DYRK1A, E2F1, E2F3, E2F4, E2F5, E2F6, FBXO5, UBA52, GMNN, HDAC1, JAK2, LIN37, LIN52, LIN54, LIN9, LYN, MAX, MCM10, MCM2, MCM3, MCM4, MCM6, MCM7, MCM8, MNAT1, MYBL2, MYC, ORC1, ORC2, ORC3, ORC4, ORC5, ORC6, PCNA, POLA1, POLA2, POLE, POLE2, POLE3, POLE4, PPP2CA, PPP2CB, PPP2R1A, PPP2R1B, PPP2R2A, PPP2R3B, PRIM1, PRIM2, PSMA1, PSMA3, PSMA4, PSMA5, PSMA6, PSMA7, PSMB1, PSMB10, PSMB2, PSMB3, PSMB4, PSMB5, PSMB6, PSMB7, PSMB8, PSMB9, PSMC1, PSMC2, PSMC3, PSMC4, PSMC5, PSMC6, PSMD1, PSMD10, PSMD11, PSMD12, PSMD13, PSMD14, PSMD2, PSMD3, PSMD4, PSMD5, PSMD6, PSMD7, PSMD8, PSMD9, PSME1, PSME2, PSME3, PSMF1, PTK6"
"507","Mitotic G2-G2/M phases",0.0686860891375651,0.0915814521834201,0.178623713043659,1.3826973640894,355,172,"ACTR1A, AJUBA, AKAP9, ALMS1, AURKA, BORA, BTRC, CCNA1, CCNA2, CCNB1, CCNB2, CCNH, CCP110, CDC25A, CDC25B, CDK1, CDK11A, CDK11B, CDK5RAP2, CDK7, CDKN1A, CENPF, CENPJ, CEP131, CEP135, CEP152, CEP164, CEP192, CEP250, CEP290, CEP41, CEP57, CEP63, CEP70, CEP72, CEP76, CEP78, CETN2, CKAP5, CLASP1, CNTRL, CSNK1D, CSNK1E, CUL1, DCTN1, DCTN2, DCTN3, DYNC1H1, DYNC1I2, DYNLL1, E2F1, E2F3, EP300, FBXL18, FBXL7, FBXW11, FGFR1OP, FKBPL, UBA52, HAUS1, HAUS2, HAUS4, HAUS6, HAUS7, HAUS8, HMMR, HSP90AB1, LCMT1, LIN37, LIN52, LIN54, LIN9, MAPRE1, MNAT1, MYBL2, MZT1, MZT2A, MZT2B, NDE1, NEDD1, NEK2, NINL, NME7, ODF2, OFD1, OPTN, PAFAH1B1, PCM1, PCNT, PHLDA1, PKMYT1, PLK1, PLK4, PPME1, PPP1CB, PPP1R12A, PPP1R12B, PPP2CA, PPP2CB, PPP2R1A, PPP2R1B, PPP2R2A, PPP2R3B, PRKACA, PRKAR2B, PSMA1, PSMA3, PSMA4, PSMA5, PSMA6, PSMA7, PSMB1, PSMB10, PSMB2, PSMB3, PSMB4, PSMB5, PSMB6, PSMB7, PSMB8, PSMB9, PSMC1, PSMC2, PSMC3, PSMC4, PSMC5, PSMC6, PSMD1, PSMD10, PSMD11, PSMD12, PSMD13, PSMD14, PSMD2, PSMD3, PSMD4, PSMD5, PSMD6, PSMD7, PSMD8, PSMD9, PSME1, PSME2, PSME3, PSME4, PSMF1"
"508","Mitotic Metaphase and Anaphase",0.000416146483562214,0.00160868566033751,-0.161077688993014,-2.39826854385055,1,164,"ZWINT, ZWILCH, ZW10, XPO1, WAPL, VRK2, VRK1, UBE2E1, UBE2D1, UBC, UBB, TMPO, TAOK1, STAG2, STAG1, SPDL1, SPC25, SPC24, SMC3, SMC1A, SKA2, SGO2, SEH1L, SEC13, RPS27A, RCC2, RANGAP1, RANBP2, RAD21, PTTG1, PSMF1, PSME4, PSME3, PSME2, PSME1, PSMD9, PSMD8, PSMD7, PSMD6, PSMD5, PSMD4, PSMD3, PSMD2, PSMD14, PSMD13, PSMD12, PSMD11, PSMD10, PSMD1, PSMC6, PSMC5, PSMC4, PSMC3, PSMC2, PSMC1, PSMB9, PSMB8, PSMB7, PSMB6, PSMB5, PSMB4, PSMB3, PSMB2, PSMB10, PSMB1, PSMA7, PSMA6, PSMA5, PSMA4, PSMA3, PSMA1, PPP2R5E, PPP2R5D, PPP2R5C, PPP2R5B, PPP2R5A, PPP2R2A, PPP2R1B, PPP2R1A, PPP2CB, PPP2CA, PPP1CC, PMF1, PLK1, PDS5B, PDS5A, PAFAH1B1, NUP98, NUP85, NUP43, NUP37, NUP160, NUP133, NUP107, NUF2, NUDC"
"509","Mitotic Prometaphase",0.0706176640369444,0.0934772622875517,0.138642012774936,1.07335794318988,366,171,"ACTR1A, AHCTF1, AKAP9, ALMS1, B9D2, BIRC5, BUB1, BUB3, CCNB1, CCNB2, CCP110, CDC20, CDCA8, CDK1, CDK5RAP2, CENPC, CENPE, CENPF, CENPH, CENPI, CENPJ, CENPK, CENPL, CENPM, CENPN, CENPO, CENPP, CENPQ, CENPT, CENPU, CEP131, CEP135, CEP152, CEP164, CEP192, CEP250, CEP290, CEP41, CEP57, CEP63, CEP70, CEP72, CEP76, CEP78, CETN2, CKAP5, CLASP1, CLASP2, CLIP1, CNTRL, CSNK1D, CSNK1E, CSNK2A1, CSNK2A2, CSNK2B, DCTN1, DCTN2, DCTN3, DSN1, DYNC1H1, DYNC1I1, DYNC1I2, DYNC1LI1, DYNC1LI2, DYNLL1, DYNLL2"
"510","Mitotic Prophase",0.000202675314146737,0.000853517877739331,-0.29025679106153,-3.03608178284468,0,79,"VRK2, VRK1, USO1, TPR, TMPO, SMC4, SMC2, SET, SEH1L, SEC13, RB1, RANBP2, RAE1, RAB2A, RAB1B, RAB1A, PRKCB, PRKCA, PPP2R2D, PPP2R1B, PPP2R1A, PPP2CB, PPP2CA, POM121, POM121C, PLK1, PHF8, NUP42, NUP58, NUP98, NUP93, NUP88, NUP85, NUP54, NUP50, NUP43, NUP37, NUP35, NUP214, NUP210, NUP205, NUP188, NUP160, NUP155, NUP153, NUP133, NUP107, NUMA1, NEK9, NEK7, NEK6, NDC1, NCAPH2, NCAPG2, NCAPD3, MCPH1, MASTL, MAPK3, MAPK1, LPIN3, LPIN2, LPIN1, LMNB1, LMNA, LEMD3, LEMD2, KMT5A"
"511","Mitotic Spindle Checkpoint",0.0415436109470368,0.0625241037809448,0.216410354621714,1.7512201361089,210,97,"AHCTF1, ANAPC1, ANAPC10, ANAPC15, ANAPC16, ANAPC2, ANAPC4, ANAPC5, ANAPC7, B9D2, BIRC5, BUB1, BUB3, CDC16, CDC20, CDC23, CDC26, CDC27, CDCA8, CENPC, CENPE, CENPF, CENPH, CENPI, CENPK, CENPL, CENPM, CENPN, CENPO, CENPP, CENPQ, CENPT, CENPU, CKAP5, CLASP1, CLASP2, CLIP1, DSN1, DYNC1H1, DYNC1I1, DYNC1I2, DYNC1LI1, DYNC1LI2, DYNLL1, DYNLL2"
"512","Molecules associated with elastic fibres",0.00984726688102894,0.0235011761930363,0.348770579654832,2.03547898871575,48,26,"BMP2, BMP7, EFEMP1, EFEMP2, FBLN1, FBLN2, FBLN5, ITGA8, ITGAV, ITGB1, ITGB3, ITGB5, ITGB6, ITGB8, LTBP1, LTBP2, LTBP3, LTBP4, MFAP1, MFAP2, MFAP3, MFAP4"
