"","pathway","pval","padj","ES","NES","nMoreExtreme","size","leadingEdge"
"201","Degradation of GLI2 by the proteasome",0.0622443535479281,0.524922326529249,-0.451896609670191,-1.38312453952457,349,57,"PSMD4, PSMD3, PSMC3, PSMC6, PSMC2, UBB, PSMB4, PSMD12, PSME4, PSME3, PSMD13, PSMA3, PSMC5, PSMB1, PSMA1, PSMB8, PRKACA, PSMD2, PSMD6, GSK3B, PSME1, PSMB7, PSMA4"
"202","Degradation of beta-catenin by the destruction complex",0.725342225342225,0.983151838915143,-0.265621866019628,-0.865781664233986,4132,83,"PSMD4, PSMD3, AXIN1, PSMC3, PSMC6, TLE4, PSMC2, UBB, PSMB4, PSMD12, PSME4, PPP2CB, PSME3, PSMD13, PSMA3, PSMC5, CTNNB1, PSMB1, PSMA1, PPP2R5D, PSMB8, PSMD2, PSMD6"
"203","Degradation of the extracellular matrix",0.0120861797162375,0.379990280520716,-0.461588478205794,-1.5022439343255,68,82,"COL25A1, COL26A1, LAMA3, BCAN, HTRA1, COL9A1, SCUBE1, NCSTN, CAPN2, MMP24, ADAM10, CAPN7, COL19A1, CAPN15, PSEN1, ADAM9, COL18A1, SCUBE3, COL15A1"
"204","Deposition of new CENPA-containing nucleosomes at the centromere",0.376614699331849,0.83619643727818,0.406315353138458,1.05634088174016,1690,22,"ITGB3BP, CENPP, SMARCA5, CENPH, RUVBL1"
"205","Depyrimidination",0.629530798309984,0.953351752759586,0.365956837849506,0.873369303555029,2830,15,"TDG, UNG, MBD4, TERF1, SMUG1, NEIL3"
"206","Deregulated CDK5 triggers multiple neurodegenerative pathways in Alzheimer's disease models",0.918389553862894,0.990941572957721,-0.263339076468316,-0.654610135572387,5063,20,"CAPN2, LMNB1, JUN, CAPNS1, CDK5, APP, CDC25B, SOD2, CAPN1, FOXO3"
"207","Detoxification of Reactive Oxygen Species",0.271569065713008,0.757056336418695,0.418824876290674,1.14736676018133,1214,28,"CCS, TXN2, PRDX6, GPX7, PRDX2, PRDX1, P4HB, TXNRD1, ATP7A, NCF1"
"208","Deubiquitination",0.0962233169129721,0.554324356659014,-0.322629145872283,-1.19925577340971,585,223,"TRAF3, MBD6, USP19, USP15, USP9X, USP13, PSMD4, USP24, PSMD3, UBE2D1, AXIN1, WDR48, USP47, MAP3K7, PSMC3, OTUD7A, YY1, VDAC3, TNKS2, PSMC6, SMAD7, PSMC2, ATXN7, UBB, PSMB4, PSMD12, CYLD, PSME4, SMURF2, PSME3, USP48, PSMD13, SUDS3, SNX3, USP4, PSMA3, MDM2, OTUD3, HIF1A, TOMM20, FOXK2, MYSM1, UCHL3, USP34, PSMC5, PSMB1, JOSD2, USP8, RNF123, RNF146, PSMA1, STAMBP, MDM4, USP37, RNF128, TNIP1, BABAM1, STAMBPL1, PSMB8, PSMD2, PSMD6, USP30, USP21, ACTB, OTUB2, USP14, BAP1, STAM, INO80B, IKBKG, PSME1, PSMB7, STAM2, PSMA4, MCRS1, SIAH2"
"209","Disassembly of the destruction complex and recruitment of AXIN to the membrane",0.977495462794918,0.999106145251397,-0.216111094569884,-0.579990026918207,5385,29,"AXIN1, PPP2CB, DVL3, CTNNB1, PPP2R5D, GSK3B, FRAT1, CSNK1A1"
"210","Diseases associated with N-glycosylation of proteins",0.361395178962747,0.831189167823573,-0.459233958918321,-1.08733257886894,1978,16,"MAN1B1, RFT1, MPDU1, ALG3, B4GALT1, ALG6, ALG9, ALG11"
"211","Diseases associated with O-glycosylation of proteins",0.420550125028416,0.859819671958674,0.322984125101657,1.0174474799078,1849,56,"THSD7B, ADAMTS3, THSD7A, ADAMTS9, SEMA5B"
"212","Diseases associated with glycosaminoglycan metabolism",0.180900900900901,0.653423203056763,-0.437798565777906,-1.22891929349723,1003,36,"GPC6, GPC5, AGRN, BCAN, GPC3, CSPG5, B3GAT3, GPC1, GPC4"
"213","Diseases associated with glycosylation precursor biosynthesis",0.742281147838721,0.986393368078632,-0.329748261826697,-0.791867521243829,4086,17,"GFPT1, PGM1, MPI, GNE, GLB1, DPM3, CTSA"
"214","Diseases associated with the TLR signaling cascade",0.0628405375953505,0.524922326529249,-0.610818199329091,-1.46683743154211,345,17,"TRAF3, IKBKB"
"215","Diseases of Immune System",0.0628405375953505,0.524922326529249,-0.610818199329091,-1.46683743154211,345,17,"TRAF3, IKBKB"
"216","Diseases of carbohydrate metabolism",0.553539019963702,0.926440843122684,-0.346952957639468,-0.931138013257319,3049,29,"GAA, UBB, EPM2A, GUSB, GALNS, IDUA"
"217","Diseases of glycosylation",0.370667577257982,0.83619643727818,-0.299051372266342,-1.03804238494119,2170,124,"ADAMTSL1, SEMA5A, GPC6, SPON1, GPC5, AGRN, BCAN, NOTCH3, GPC3, ADAMTS10, CSPG5, MAN1B1, C1GALT1, RFT1, B3GAT3"
"218","Diseases of metabolism",0.153602254711996,0.624215965367603,-0.377029881486617,-1.21152178188812,871,76,"POMC, CSF2RA, GAA, MTR, UBB, MMADHC, EPM2A, PC, GUSB, ACACA, LMBRD1"
"219","Diseases of signal transduction",0.192056074766355,0.674074074074074,-0.284774017612535,-1.1066733436827,1232,347,"LRRFIP1, FGFR2, FGF1, NEURL1, HDAC3, RPS6KB2, ZMYM2, IRS1, PLCG1, CAMK2A, TTR, HDAC9, ZFYVE9, GTF2F2, OS9, PSMD4, CCNC, MET, PSMD3, NCOR2, PDGFA, NCSTN, AXIN1, AGGF1, PSMC3, FYN, TNKS2, PSMC6, POLR2C, HDAC11, RBPJ, PSMC2, TLN1, UBB, PSMB4, ADAM10, HDAC4, FRS2, HDAC6, PSMD12, PSME4, PPP2CB, FGFR1OP, PSME3, SPRED1, FXR1, PHB, PSMD13, PDGFB, STAT3, KSR2, STAT5B, NR4A1, PIK3R3, HDAC5, PTPN11, AKAP9, FGFR1OP2, PSMA3, MDM2, MIB2, KSR1, PSEN1, PSENEN, AKT2, PIK3CD, NCBP1, PSMC5, FBXW7, CTNNB1, NRG3, PDPK1, PSMB1, CNTRL, HHAT, RDH5, CBL, PSMA1, PPP2R5D, MYO18A, CASP9, CALM1, SPRED3, PSMB8, PSMD2, PSMD6"
"220","Disorders of transmembrane transporters",0.649214659685864,0.960735708407192,-0.258521557274422,-0.917240994067539,3843,149,"SLC1A1, SLC24A5, OS9, PSMD4, PSMD3, PSMC3, PSMC6, SLC24A4, PSMC2, RAE1, SLC11A2, UBB, SLC22A5, PSMB4, PSMD12, PSME4, PSME3, PSMD13, NUP155, PSMA3, SLC3A2, SLC27A4, NUP210, PSMC5, PSMB1, PSMA1, SLC26A4, NUP50, SEH1L, PSMB8, PSMD2, PSMD6"
"221","Dopamine Neurotransmitter Release Cycle",0.0261044176706827,0.446408190284879,0.595704767351742,1.56787885669359,116,23,"SYN2, SYT1, APBA1, RIMS1, RAB3A, SYN3, LIN7B, CASK, PPFIA2"
"222","Downregulation of ERBB2 signaling",0.0228187919463087,0.446408190284879,0.583514393592497,1.57165510652136,101,26,"NRG1, ERBB4, ERBIN"
"223","Downregulation of SMAD2/3:SMAD4 transcriptional activity",0.156930333817126,0.624215965367603,-0.50937837419491,-1.28771172294261,864,22,"USP9X, TRIM33, NCOR2, UBE2D1, NEDD4L, UBB, SMURF2"
"224","Downregulation of TGF-beta receptor signaling",0.483369486623283,0.888858075226702,-0.37230704322353,-0.976147873538693,2673,26,"USP15, ZFYVE9, NEDD4L, SMAD7, UBB, SMURF2"
"225","Downstream TCR signaling",0.131265334735366,0.584019497763282,-0.381010208942494,-1.23790479322326,748,81,"PSMD4, PSMD3, UBE2D1, MAP3K7, PSMC3, IKBKB, PSMC6, PSMC2, UBB, PSMB4, PSMD12, PSME4, PSME3, PSMD13, PSMA3, PSMC5, PDPK1, PSMB1, PSMA1, PSMB8, PSMD2, PSMD6, UBE2N, IKBKG, PSME1, PSMB7, PSMA4"
"226","Downstream signal transduction",0.317059891107078,0.800291161044838,-0.41164491295152,-1.10475561015813,1746,29,"PLCG1, PDGFA, NCK1, PDGFB, STAT3, STAT5B, PTPN11"
"227","Downstream signaling events of B Cell Receptor (BCR)",0.0739890517393608,0.524922326529249,-0.406256002852908,-1.31192005046775,418,79,"PRKCB, PSMD4, PSMD3, NFATC3, MAP3K7, PSMC3, IKBKB, PSMC6, PSMC2, UBB, PSMB4, PSMD12, PSME4, PSME3, PSMD13, PPP3CB, PSMA3, PPIA, PSMC5, PSMB1, PSMA1, CALM1, PSMB8, PSMD2, PSMD6, IKBKG, PSME1, NFATC1, PSMB7, REL, PSMA4"
"228","Downstream signaling of activated FGFR1",0.274602026049204,0.758073186148596,-0.428682817817158,-1.14335535778935,1517,28,"FLRT2, FGF1, PLCG1, FRS2, PTPN11"
"229","Downstream signaling of activated FGFR2",0.218162083936324,0.696261970009545,-0.450737657279151,-1.2021786131567,1205,28,"FGFR2, FGF1, PLCG1, FRS2, PTPN11"
"230","Downstream signaling of activated FGFR3",0.488691876243894,0.89239386096711,-0.377780250085817,-0.973371778612654,2700,24,"FGF1, PLCG1, FRS2, PTPN11"
"231","Downstream signaling of activated FGFR4",0.555334538878843,0.926440843122684,-0.357826255029076,-0.929814559648624,3070,25,"FGF1, PLCG1, FRS2, PTPN11"
"232","Dual Incision in GG-NER",0.952483801295896,0.992170626349892,-0.2295685000519,-0.657533420327434,5291,40,"UBB, CUL4A, GTF2H2, ERCC3, GTF2H4, GTF2H5, DDB1, CHD1L, POLD2, POLD4, GTF2H3, PARP2"
"233","Dual incision in TC-NER",0.926180651077487,0.990941572957721,0.228807838147823,0.738620097655647,4039,64,"ERCC4, GTF2H1, POLK, RFC2, USP7, POLR2D, POLR2K, TCEA1, CUL4B, POLR2H, CCNH, ERCC2, XPA, POLR2I, RBX1, POLR2E, ERCC5, POLE, RFC4"
"234","E2F mediated regulation of DNA replication",0.346341463414634,0.820051313051142,0.421706395065012,1.08636435543015,1561,21,"POLA1, PRIM1, ORC3, ORC6, PPP2R1A, ORC2, PRIM2, ORC4"
"235","E3 ubiquitin ligases ubiquitinate target proteins",0.126786037258094,0.571802122703501,-0.44558507055381,-1.28579233303541,700,42,"PEX13, PRKDC, UBE2D1, SELENOS, UBB, RNF40, PAF1, RTF1, PEX10, UBE2A, RAD18, CDC73, WAC, PEX5, UBE2D3, UBE2N, LEO1, CTR9"
"236","ECM proteoglycans",0.194691841824011,0.67690872157355,-0.399383428938981,-1.187297068357,1092,49,"PTPRS, LAMA3, AGRN, BCAN, COL9A1"
"237","EGFR downregulation",0.752532561505065,0.990099867216044,-0.303398395123611,-0.809204769100932,4159,28,"PTPN3, EPS15, EPN1, UBB, SH3GL1, EPS15L1, CBL, CDC42, STAM, STAM2, TGFA"
"238","EML4 and NUDC in mitotic spindle formation",0.604031510658017,0.94466610522828,0.271908632315924,0.930906172154954,2606,89,"CLASP1, ITGB3BP, CENPP, ZWINT, DYNC1I1, EML4, NUP133, KIF18A, CENPH, PPP2R5C, PPP2R1A, NEK7, BUB3, XPO1, RCC2, SPDL1, ZWILCH, DYNC1I2, MAD2L1, SPC24, MIS12, NEK6, PPP2R5B, B9D2, NUP37"
"239","EPH-Ephrin signaling",0.0503862359550562,0.524922326529249,-0.410948789223067,-1.35004869853243,286,87,"EPHA7, EPHA3, EPHA10, EPHA5, EPHA4, EPHB1, AP2A1, NCSTN, WASL, MYH9, FYN, KALRN, EFNA5, ARPC5, PAK2, ADAM10, AP2B1, ITSN1, ACTR3, MYL9, ACTG1, AP2S1, LIMK2, PSEN1, PSENEN"
"240","EPH-ephrin mediated repulsion of cells",0.0867208672086721,0.538444150224432,-0.457814032820066,-1.34230166176353,479,46,"EPHA7, EPHA3, EPHA10, EPHA5, EPHA4, EPHB1, AP2A1, NCSTN, FYN, EFNA5, ADAM10, AP2B1"
"241","EPHB-mediated forward signaling",0.392200806813088,0.85261044959367,0.363978817775021,1.03986608811485,1749,34,"TIAM1, ROCK2, YES1, SRC, GRIN1, HRAS, PTK2, ARPC1A, LYN"
"242","ER Quality Control Compartment (ERQC)",0.0458832063837505,0.5071301758204,-0.608849999466008,-1.49761604532589,252,19,"OS9, UGGT2, MAN1B1, UBB, AMFR"
"243","ER to Golgi Anterograde Transport",0.529016703977958,0.916613100951907,-0.280391969553124,-0.964105964052215,3071,118,"SAR1B, SEC24A, CAPZA2, CNIH2, MIA2, SPTBN1, ARFGAP1, COG1, USO1, PPP6R1, DCTN1, PREB, CAPZB, TRAPPC4, ARF4, DCTN2, DYNLL1, TMED7, COPG1, DCTN5, TRAPPC10, CTSC, TFG, COG8, YKT6, TRAPPC9, COG3, GBF1, ANK1, COG7, KDELR2, COG2, DYNC1H1, DYNLL2, DYNC1LI2, TRAPPC1, TGFA, TMEM115, COG5, ARF5"
"244","ER-Phagosome pathway",0.0252918287937743,0.446408190284879,-0.461273354971445,-1.45872097099872,142,69,"PSMD4, PSMD3, PSMC3, IKBKB, PSMC6, SEC61A1, PSMC2, UBB, PSMB4, PSMD12, PSME4, PSME3, PSMD13, PSMA3, PSMC5, PSMB1, PSMA1, SEC61A2, PSMB8, PSMD2, PSMD6, SNAP23, IKBKG, PSME1, PSMB7, PSMA4, CALR"
"245","ERCC6 (CSB) and EHMT2 (G9a) positively regulate rRNA expression",0.906683710737765,0.990941572957721,-0.273091891613061,-0.646602249265806,4964,16,"CHD3, MTA3, TTF1, EHMT2, GATAD2B"
"246","ERK/MAPK targets",0.105764966740576,0.556459755564598,0.53368031440803,1.37482209791544,476,21,"RPS6KA5, RPS6KA3, MEF2C, RPS6KA2, PPP2R1A, MEF2A"
"247","ESR-mediated signaling",0.453440311208364,0.879653416787332,0.271302545810995,0.99475789230329,1864,143,"ERBB4, GNG7, GTF2A2, NCOA2, CREBBP, KAT2B, STAG2, H3-3A, ESR1, ESR2, PIK3R1, SRC, GNG3, TNRC6A, USF2, POLR2D, CREB1, HRAS, RAD21, POLR2K, KCTD6, GNAI2, PTK2, ATF2, CBFB, UHMK1"
"248","Effects of PIP2 hydrolysis",0.00849909584086799,0.345925763233033,-0.629484972335742,-1.66494728485146,46,27,"DGKG, TRPC3, TRPC6, DGKH, DGKZ, PRKCD, DGKE"
"249","Elastic fibre formation",0.697490391137237,0.975186299193208,0.296947786063585,0.851839166244038,3084,35,"MFAP1, ITGAV, LTBP3, ITGA8, ITGB8, FBLN1, TGFB3"
"250","Elevation of cytosolic Ca2+ levels",0.0886466848319709,0.538444150224432,-0.606446194314307,-1.41809450857267,487,15,"TRPC3, TRPC6, P2RX4, P2RX7"
"251","Endogenous sterols",0.324206708975521,0.803146692419936,-0.457582023666228,-1.11190158432702,1787,18,"POMC, NCOA1"
"252","Endosomal Sorting Complex Required For Transport (ESCRT)",0.67459165154265,0.967503093445832,-0.319332170401924,-0.85701048562951,3716,29,"VPS37A, UBB, VPS37D, MVB12B, VPS37B, STAM, TSG101, STAM2"
"253","Energy dependent regulation of mTOR by LKB1-AMPK",0.882431828341529,0.990941572957721,0.260260308922243,0.712980637866076,3947,28,"SLC38A9, RRAGA, LAMTOR4, PRKAA2, RRAGC"
"254","Ephrin signaling",0.552311876699909,0.926440843122684,-0.38416141450776,-0.933493151689152,3045,18,"EPHB1, FYN, PAK2"
"255","Epigenetic regulation of gene expression",0.787043539325843,0.990099867216044,-0.256173674993538,-0.841581592628974,4482,87,"EED, CHD3, BAZ2A, TAF1B, BAZ1B, TET2, MTA3, AEBP2, GTF2H2, SUDS3, TTF1, DNMT3A, ERCC3, GTF2H4, EHMT2, SAP130, DEK, GTF2H5, POLR1D, TET1, ARID4B, GATAD2B, POLR1A, MYBBP1A, ACTB, GSK3B, GTF2H3"
"256","Estrogen-dependent gene expression",0.423890309086684,0.859819671958674,0.297020425909592,1.00902953281554,1823,86,"ERBB4, GTF2A2, NCOA2, CREBBP, KAT2B, STAG2, H3-3A, ESR1, TNRC6A, USF2, POLR2D, RAD21, POLR2K, KCTD6, ATF2, CBFB"
"257","Estrogen-dependent nuclear events downstream of ESR-membrane signaling",0.643015521064302,0.960735708407192,0.337758772231872,0.87010558810707,2899,21,"CREB1, PTK2, UHMK1, XPO1, EGF, MAPK1, CDKN1B, AKT1, HBEGF"
"258","Eukaryotic Translation Elongation",0.059981684981685,0.524922326529249,0.422994049530962,1.35890226731187,261,62,"RPL26, EEF1G, RPS24, RPL36, RPL32, RPL4, RPS8, RPL23, RPS9, RPS5, RPL28, RPL37A, RPS19, RPS25, RPLP1, RPS14, RPS21, RPL11, RPSA, RPL14, FAU, EEF2"
"259","Eukaryotic Translation Initiation",0.623548536925221,0.953351752759586,0.270347070775569,0.92124601524774,2684,87,"RPL26, RPS24, RPL36, RPL32, RPL4, RPS8, RPL23, RPS9, EIF4A1, RPS5, EIF3F, RPL28, RPL37A, EIF5B, EIF1AX, RPS19, RPS25, RPLP1, RPS14, RPS21, RPL11, RPSA, RPL14, FAU"
"260","Eukaryotic Translation Termination",0.110450491653327,0.557007311118821,0.393963191071024,1.26989538324401,482,63,"RPL26, RPS24, RPL36, RPL32, RPL4, RPS8, RPL23, RPS9, RPS5, RPL28, RPL37A, RPS19, RPS25, RPLP1, RPS14, RPS21, RPL11, RPSA, RPL14, FAU"
"261","Export of Viral Ribonucleoproteins from Nucleus",0.912115082040908,0.990941572957721,0.245067863534855,0.686441650222541,4057,31,"NUP54, NUP133, NUP88, NUP35, XPO1"
"262","Extension of Telomeres",0.395814781834372,0.85691859984761,0.376259516345417,1.04064688820563,1777,29,"POLA1, PRIM1, RFC2, NHP2, RUVBL1, TERT, PRIM2, POLE, RFC4"
"263","Extra-nuclear estrogen signaling",0.796633617708093,0.990941572957721,0.259102775147568,0.82484985662503,3454,60,"GNG7, ESR1, ESR2, PIK3R1, SRC, GNG3, CREB1, HRAS, GNAI2, PTK2, UHMK1, NRAS, XPO1, GNB1, EGF"
"264","Extracellular matrix organization",0.0377854443896829,0.478008633845386,-0.343491825657652,-1.28327713182169,229,232,"COL25A1, PRKCA, SH3PXD2A, COL8A1, COL6A3, COL26A1, PTPRS, LAMA3, TTR, DDR2, AGRN, BCAN, HTRA1, PDGFA, COL9A1, SCUBE1, NCSTN, P4HA1, P3H3, P3H2, CAPN2, MMP24, COLGALT2, ADAM10, TRAPPC4, PDGFB, FBLN5, CAPN7, COL4A2, ADAMTS2, COL19A1, NTN4, CAPN15, PSEN1, COL11A2, ADAM9, COL18A1, JAM3"
"265","FBXL7 down-regulates AURKA during mitotic entry and in early mitosis",0.0870651204281891,0.538444150224432,-0.443670519673158,-1.33753983098125,487,53,"PSMD4, PSMD3, PSMC3, PSMC6, PSMC2, UBB, PSMB4, PSMD12, PSME4, PSME3, PSMD13, PSMA3, PSMC5, PSMB1, PSMA1, PSMB8, PSMD2, PSMD6, PSME1, PSMB7, FBXL18, PSMA4"
"266","FCERI mediated Ca+2 mobilization",0.471153846153846,0.884778564696946,0.362656217825201,0.986147647691733,2106,27,"VAV3, ITPR1, LYN, GRB2"
"267","FCERI mediated MAPK activation",0.813282647584973,0.990941572957721,0.282611423519407,0.768487004540498,3636,27,"VAV3, HRAS, LYN, GRB2, NRAS, MAPK8, PAK1"
"268","FCERI mediated NF-kB activation",0.126295450553311,0.571802122703501,-0.388681985374961,-1.24631468872502,718,75,"PSMD4, PSMD3, UBE2D1, MAP3K7, PSMC3, IKBKB, PSMC6, PSMC2, UBB, PSMB4, PSMD12, PSME4, PSME3, PSMD13, PSMA3, PSMC5, PDPK1, PSMB1, PSMA1, PSMB8, PSMD2, PSMD6, TAB3, UBE2N, IKBKG, PSME1, PSMB7, PSMA4"
"269","FGFR1 mutant receptor activation",0.27059891107078,0.757056336418695,-0.427628807769358,-1.1476525266913,1490,29,"LRRFIP1, FGF1, ZMYM2, FGFR1OP, STAT3, STAT5B, FGFR1OP2, CNTRL, MYO18A"
"270","FGFR2 alternative splicing",0.821603039623666,0.990941572957721,-0.292174748248171,-0.75280445259757,4540,24,"TIAL1, GTF2F2, POLR2C, RBFOX2"
"271","FGFR2 ligand binding and activation",0.0272096420745069,0.446408190284879,-0.669789607444727,-1.58586717514944,148,16,"FGFR2, FGF1"
"272","FGFR2 mutant receptor activation",0.213758328831262,0.6935261370686,-0.441724119730043,-1.20267151127232,1186,31,"FGFR2, FGF1, GTF2F2, POLR2C"
"273","FLT3 Signaling",0.475307629204266,0.88488122458241,-0.265403975219747,-0.992947008171187,2896,235,"RASAL2, GFRA1, FGFR2, GFRA2, CSF2RA, FGF1, IRS1, CAMK2A, PSMD4, RASGRF2, MET, PSMD3, PDGFA, SPTBN1, PSMC3, FYN, PSMC6, PSMC2, TLN1, UBB, PSMB4, SHC3, FRS2, PSMD12, PSME4, PPP2CB, PSME3, SPRED1, PHB, PSMD13, PDGFB, KSR2, STAT5B, RASGRF1, DLG4, SYNGAP1, PPP5C, PTPN11, PSMA3, RASA4, KSR1, AKT2, PSMC5, NRG3, PDPK1, PSMB1, PSMA1, PPP2R5D, CALM1, SPRED3, PSMB8, PSMD2, PSMD6"
"274","FOXO-mediated transcription",0.457261029411765,0.882202221634539,0.31311084430599,0.994571143045353,1989,59,"SMAD3, ATXN3, CREBBP, NPY, KAT2B, YWHAB, YWHAZ, PLXNA4, NR3C1, SMAD2, FBXO32, PINK1, SIRT1, NFYA, HDAC1, FOXO1, SMAD4, HDAC2"
"275","FOXO-mediated transcription of cell cycle genes",0.786746720035579,0.990099867216044,0.316975351467847,0.756473204824851,3537,15,"SMAD3, SMAD2, FOXO1, SMAD4"
"276","FOXO-mediated transcription of cell death genes",0.306648877029131,0.789169904119086,0.475823993763393,1.13557126706512,1378,15,"CREBBP, PINK1, NFYA, FOXO1, NFYC, STK11"
"277","FOXO-mediated transcription of oxidative stress, metabolic and neuronal genes",0.686731742588576,0.968863741080505,-0.323619069270412,-0.848493392898881,3798,26,"POMC"
"278","FRS-mediated FGFR1 signaling",0.772578295702841,0.990099867216044,-0.313192504079867,-0.784333600910723,4242,21,"FGF1, FRS2, PTPN11"
"279","FRS-mediated FGFR2 signaling",0.236594202898551,0.722774904110505,-0.466985431209223,-1.19208037856461,1305,23,"FGFR2, FGF1, FRS2, PTPN11"
"280","FRS-mediated FGFR3 signaling",0.573268044976424,0.939131640777966,-0.372332268858962,-0.915842622197305,3160,19,"FGF1, FRS2, PTPN11"
"281","FRS-mediated FGFR4 signaling",0.653790351831701,0.960735708407192,-0.345208194929987,-0.858120968275691,3604,20,"FGF1, FRS2, PTPN11"
"282","Factors involved in megakaryocyte development and platelet production",0.13701714879612,0.599450025983024,-0.356058558977522,-1.20490766195337,790,106,"DOCK4, KIF5C, KIFAP3, KIF26B, CAPZA2, KIFC2, KIF21A, RCOR1, KIF5A, ABL1, KIF1C, DOCK5, MAFG, CAPZB, JMJD1C, DOCK10, CABLES1, KIF1B, KDM1A, PRKAR2A, DOCK11, CARMIL1, KIF21B, EHD3, DOCK1, PRKACA, KIF13B, CBX5, CDC42, KIF3A, MFN2, PHF21A, PRKAR1A, RAB5A, CDK5, VPS45, KIF3B"
"283","Fanconi Anemia Pathway",0.92942238267148,0.990941572957721,-0.244421947433323,-0.676903454779575,5148,34,"WDR48, UBB, SLX1A, FANCC, FANCA, FANCM, USP1"
"284","Fatty acid metabolism",0.734164247908486,0.984855220564751,-0.251269721581192,-0.880703361621179,4299,135,"PPT1, HACD4, PTGES3, HSD17B12, ACOT7, ACLY, TECR, CRAT, ABCC1, MLYCD, ELOVL6, SLC22A5, NUDT19, ACACA, ELOVL1, ACBD5, ACSL6, ACSL4, CBR1, MORC2, ACOT8, EPHX2, CYP4F3, FAAH, EHHADH, SLC25A17"
"285","Fatty acyl-CoA biosynthesis",0.13974428236989,0.608844383769231,-0.475284102959827,-1.29404446091769,775,31,"PPT1, HACD4, HSD17B12, ACLY, TECR, ELOVL6, ACACA, ELOVL1, ACSL6, ACSL4, MORC2"
"286","Fc epsilon receptor (FCERI) signaling",0.346764555233054,0.820051313051142,-0.302973472553504,-1.05165645500952,2030,124,"PLCG1, PSMD4, PSMD3, UBE2D1, NFATC3, MAP3K7, PSMC3, FYN, TEC, PAK2, IKBKB, PSMC6, PSMC2, UBB, PSMB4, PSMD12, PSME4, AHCYL1, PSME3, MAP3K1, PSMD13, PPP3CB, MAPK10, PSMA3, PSMC5, PDPK1, PSMB1, JUN, PSMA1, CALM1, PSMB8, PSMD2, PSMD6, TAB3, UBE2N, MAP2K4, IKBKG, PSME1, NFATC1, PSMB7, ITPR3, PSMA4"
"287","Fcgamma receptor (FCGR) dependent phagocytosis",0.602534765006161,0.94466610522828,-0.285907063001618,-0.922524638040994,3422,78,"MYO10, PRKCD, CYFIP1, PLCG1, ABI1, WIPF3, WASL, WASF1, ELMO2, MYH9, FYN, ABL1, ARPC5, NCK1, NF2, AHCYL1, ACTR3, ACTG1, WIPF2, PLPP4, ABI2"
"288","Fertilization",0.70002223704692,0.976242948313452,0.344085662062165,0.821172947073299,3147,15,"CD9, IZUMO4, ACR"
"289","Formation of ATP by chemiosmotic coupling",0.88991825613079,0.990941572957721,-0.282216212511132,-0.659925422806421,4898,15,"ATP5PO, ATP5MG"
"290","Formation of Fibrin Clot (Clotting Cascade)",0.981374722838137,0.999106145251397,0.207889384120012,0.535547052222173,4425,21,"PRCP, SERPINC1, PRTN3, SERPIND1, F5, PROS1"
"291","Formation of HIV elongation complex in the absence of HIV Tat",0.868274168341148,0.990941572957721,0.252289876847666,0.754536990326579,3888,43,"CCNK, NELFA, GTF2H1, POLR2D, POLR2K, TCEA1, POLR2H, NELFCD, CCNT1, CCNH, ERCC2, POLR2I, POLR2E"
"292","Formation of HIV-1 elongation complex containing HIV-1 Tat",0.946531791907514,0.99135329697839,-0.231198778774281,-0.66463625783541,5239,41,"GTF2F2, POLR2C, GTF2H2, ELOC, ERCC3, GTF2H4, NCBP1, GTF2H5"
"293","Formation of Incision Complex in GG-NER",0.942485078676072,0.99135329697839,-0.233234377386649,-0.67302742857006,5210,42,"PIAS1, UBB, CUL4A, GTF2H2, ERCC3, GTF2H4, GTF2H5, DDB1, CHD1L, UBE2N, GTF2H3, PARP2"
"294","Formation of RNA Pol II elongation complex",0.482420132072104,0.88866866434335,-0.32163851499397,-0.979622876632991,2702,56,"MLLT3, GTF2F2, POLR2C, SUPT6H, PAF1, RTF1, GTF2H2, ELOC, ERCC3, GTF2H4, CDC73, NCBP1, GTF2H5, AFF4, LEO1, CTR9, IWS1, GTF2H3"
"295","Formation of TC-NER Pre-Incision Complex",0.909938594496247,0.990941572957721,0.235573013241037,0.733836622803826,4000,53,"COPS8, GTF2H1, USP7, COPS7B, POLR2D, POLR2K, TCEA1, CUL4B, COPS3, POLR2H, CCNH, COPS4, ERCC2, XPA, POLR2I, RBX1, POLR2E"
"296","Formation of a pool of free 40S subunits",0.286609422139708,0.76536328303296,0.332518893399921,1.09161692658134,1234,71,"RPL26, RPS24, RPL36, RPL32, RPL4, RPS8, RPL23, RPS9, RPS5, EIF3F, RPL28, RPL37A, EIF1AX, RPS19, RPS25, RPLP1, RPS14, RPS21, RPL11, RPSA, RPL14, FAU"
"297","Formation of the Early Elongation Complex",0.941346850108617,0.99135329697839,-0.239680386238786,-0.659577951972296,5199,33,"GTF2F2, POLR2C, GTF2H2, ERCC3, GTF2H4, NCBP1, GTF2H5"
"298","Formation of the HIV-1 Early Elongation Complex",0.941346850108617,0.99135329697839,-0.239680386238786,-0.659577951972296,5199,33,"GTF2F2, POLR2C, GTF2H2, ERCC3, GTF2H4, NCBP1, GTF2H5"
"299","Formation of the beta-catenin:TCF transactivating complex",0.0654079568442347,0.524922326529249,0.504740227522654,1.41379089741432,290,31,"TCF7L2, LEF1, TLE1, CREBBP, H3-3A, TLE2, BCL9L, PYGO1, TCF7L1, RUVBL1, KMT2D, TERT, TCF4, HDAC1"
"300","Formation of the cornified envelope",0.881667413715822,0.990941572957721,0.256561181169855,0.714916625535458,3933,30,"PKP2, PCSK6, KAZN, JUP, DSG2"
"301","Formation of the ternary complex, and subsequently, the 43S complex",0.7719651240778,0.990099867216044,0.274579133502722,0.817172472422882,3452,42,"RPS24, RPS8, RPS9, RPS5, EIF3F, EIF1AX, RPS19, RPS25, RPS14, RPS21, RPSA, FAU, RPS27L"
"302","Formation of tubulin folding intermediates by CCT/TriC",0.447769314472252,0.87494554402986,-0.409963944070191,-1.00840696589158,2468,19,"CCT8, CCT7, CCT6A, CCT3, CCT5, TUBB4A"
"303","G alpha (12/13) signalling events",0.0510864539990754,0.524922326529249,0.421633560229809,1.36943671127931,220,67,"TIAM1, GNG7, VAV3, ADRA1A, TIAM2, ROCK2, PREX1, RHOB, ARHGEF33, MCF2, ARHGEF2, ADRA1B, ARHGEF26, ARHGEF10, GNG3, NGEF"
"304","G alpha (i) signalling events",0.0236282488842216,0.446408190284879,0.323304641951549,1.27885955098441,89,268,"HTR1F, PDE1A, CAMK4, PENK, GNG7, PDE4B, ITPR1, GRM7, OPRM1, PDE4D, RGS9, GRM3, PRKAR1B, APOE, SST, RGS17, PDE1C, PLCB1, LRP12, PDE1B, FNTB, NPY, RGS7, ADCY5, HRH3, GNAL, PRKCG, CAMKK1, NAPEPLD, ADCY9, SRC, NMT1, GRM4, NPY1R, ADCY8, CX3CL1, GNG3, RGS8, DRD3, CREB1, PDYN, GNAI2, PRKACB, ADORA1, CAMK2G, LPAR1, PPP2R1A, CX3CR1, GNAZ"
"305","G alpha (q) signalling events",0.00117568021498153,0.131020713750936,-0.446694480358973,-1.59864693357556,6,158,"DGKG, CHRM3, GRK5, PRKCA, TRPC3, PLCB4, TRPC6, DGKH, GRM1, GRM5, DGKZ, ARHGEF25, PRKCD, GNB3, DGKE, NPFFR1, QRFPR, KALRN, GNB5, DAGLB, GNG11, TRIO, DGKQ"
"306","G alpha (s) signalling events",0.00513573000733676,0.271632471008029,0.408716676288791,1.50077235262174,20,146,"PDE7B, PDE1A, GNG7, PDE4D, HTR4, VIPR2, GLP2R, PDE11A, PTH2R, GPR45, RAMP1, PDE8B, PDE10A, PDE1B, DRD1, ADORA2A, ADCY5, GNAL, CALCRL, GPR83, RAMP3, ADCY9, SRC, ADCY8, PDE3B, GNG3, VIPR1, GIPR, GNAI2"
"307","G alpha (z) signalling events",0.0626806358381503,0.524922326529249,-0.488084989131665,-1.40311718946758,346,41,"PRKCA, GNAS, GNAI1, ADCY2, PRKCD, PRKCB, GNB3"
"308","G beta:gamma signalling through CDC42",0.76050700466978,0.990099867216044,0.326188047011981,0.778459637811119,3419,15,"GNG7, GNG3, GNB1, PAK1"
"309","G beta:gamma signalling through PI3Kgamma",0.79651795429815,0.990941572957721,-0.30613851499979,-0.761001282056419,4391,20,"GNB3, GNB5, GNG11, AKT2, PDPK1"
"310","G beta:gamma signalling through PLC beta",0.42895263509006,0.859819671958674,0.429154717278357,1.02419334134942,1928,15,"GNG7, PLCB1, GNG3"
"311","G protein gated Potassium channels",0.609984399375975,0.94466610522828,0.357827225502323,0.887995278801837,2736,18,"GNG7, KCNJ9, GNG3, KCNJ4, GNB1"
"312","G-protein activation",0.255624092888244,0.748385093283896,-0.463629010864118,-1.17205704566791,1408,22,"POMC, GNAI1, GNB3, GNB5, GNG11"
"313","G-protein beta:gamma signalling",0.648926654740608,0.960735708407192,0.321580136255276,0.874452110084545,2901,27,"GNG7, PLCB1, GNG3"
"314","G-protein mediated events",0.219690063810392,0.696902015108494,0.382507075570217,1.17164976796279,963,49,"PDE1A, CAMK4, ITPR1, PRKAR1B, PDE1C, PLCB1, PDE1B, ADCY5, GNAL, PRKCG, CAMKK1, ADCY9, ADCY8, CREB1, GNAI2, PRKACB, CAMK2G, GNAZ"
"315","G0 and Early G1",0.948156424581006,0.99135329697839,0.23598323812737,0.626115011211844,4242,24,"DYRK1A, TOP2A, CDC25A, HDAC1, RBL1, E2F4, LIN37, CCNE1, LIN54"
