"","pathway","pval","padj","ES","NES","nMoreExtreme","size","leadingEdge"
"260","Eukaryotic Translation Initiation",0.666866148015161,0.75627106338389,-0.33389938507603,-0.507286510125301,3342,87,"RPSA, RPS9, RPS8, RPS7, RPS5, RPS4X, RPS3A, RPS28, RPS27L, RPS27A, RPS25, RPS24, RPS21, RPS20, RPS19, RPS17, RPS16, RPS15A, RPS15, RPS14, RPS13, RPS12, RPS11, RPLP1, RPL8, RPL7A, RPL6, RPL5, RPL4, RPL3L, RPL38, RPL37A, RPL36, RPL35, RPL34, RPL32, RPL30, RPL3, RPL29, RPL28, RPL27, RPL26, RPL23, RPL22L1, RPL19, RPL18A, RPL18, RPL14, RPL13A, RPL12, RPL11, RPL10A, RPL10"
"261","Eukaryotic Translation Termination",0.530519223147047,0.71690317834922,-0.582357795348123,-1.02519965788198,2676,63,"TRMT112, RPSA, RPS9, RPS8, RPS7, RPS5, RPS4X, RPS3A, RPS28, RPS27L, RPS27A, RPS25, RPS24, RPS21, RPS20, RPS19, RPS17, RPS16, RPS15A, RPS15, RPS14, RPS13, RPS12, RPS11, RPLP1, RPL8, RPL7A, RPL6, RPL5, RPL4, RPL3L, RPL38, RPL37A, RPL36, RPL35, RPL34, RPL32, RPL30, RPL3, RPL29, RPL28, RPL27, RPL26, RPL23, RPL22L1, RPL19, RPL18A, RPL18, RPL14, RPL13A, RPL12, RPL11, RPL10A, RPL10"
"262","Export of Viral Ribonucleoproteins from Nucleus",0.336226034308779,0.697118626563554,-0.483902657684831,-1.13391083965955,1665,32,"XPO1, TPR, SEH1L, SEC13, RANBP2, RAE1, POM121, POM121C, NUP42, NUP58, NUP98, NUP93, NUP88, NUP85, NUP62, NUP54, NUP50, NUP43, NUP37, NUP35, NUP214, NUP210, NUP205, NUP188, NUP160, NUP155, NUP153, NUP133, NUP107"
"263","Extension of Telomeres",0.3129265355279,0.697118626563554,-0.434237344536417,-1.05009500147893,1558,29,"WRAP53, TERT, RUVBL2, RUVBL1, RPA3, RPA2, RPA1, RFC5, RFC4, RFC3, RFC2, RFC1, PRIM2, PRIM1, POLE4, POLE3, POLE2, POLE, POLD4, POLD2, POLD1, POLA2, POLA1"
"264","Extra-nuclear estrogen signaling",0.441380678436818,0.697118626563554,-0.993886052136522,-1.71068357844068,2224,67,"PTK2"
"265","Extracellular matrix organization",0.153171527636141,0.697118626563554,0.996466190961604,1.25044622480734,750,236,"PRKCA, FBN2, NRXN1, A2M"
"266","FBXL7 down-regulates AURKA during mitotic entry and in early mitosis",0.464938126104891,0.698786920708878,-0.573555530314373,-1.10880251962565,2366,52,"UBC, UBB, SKP1, RPS27A, RBX1, PSMF1, PSME4, PSME3, PSME2, PSME1, PSMD9, PSMD8, PSMD7, PSMD6, PSMD5, PSMD4, PSMD3, PSMD2, PSMD14, PSMD13, PSMD12, PSMD11, PSMD10, PSMD1, PSMC6, PSMC5, PSMC4, PSMC3, PSMC2, PSMC1, PSMB9, PSMB8, PSMB7, PSMB6, PSMB5, PSMB4, PSMB3, PSMB2, PSMB10, PSMB1, PSMA8, PSMA7, PSMA6, PSMA5, PSMA4, PSMA3, PSMA1"
"267","FCERI mediated Ca+2 mobilization",0.213622902270484,0.697118626563554,0.995576407506702,2.42672556234414,1081,31,"ITPR1, AHCYL1"
"268","FCERI mediated MAPK activation",0.336629667003027,0.697118626563554,-0.332380270125344,-0.778854145970751,1667,32,"VAV3, VAV2, VAV1, SYK, SOS1, SHC1, RAC1, PLCG2, PLCG1, PAK2, PAK1, NRAS, MAPK9, MAPK8, MAPK3, MAPK10, MAPK1, MAP3K1, MAP2K7, MAP2K4, LYN, LCP2, KRAS, JUN, IGLC7, IGLC3, IGLC2, IGLC1, HRAS, GRB2, GRAP2"
"269","FCERI mediated NF-kB activation",0.624974944878733,0.748418380876615,-0.405796426841273,-0.647318415132906,3117,78,"UBE2N, UBE2D2, UBE2D1, UBC, UBB, TRAF6, TAB3, TAB2, TAB1, SKP1, RPS27A, RELA, RASGRP4, RASGRP2, RASGRP1, PSMF1, PSME4, PSME3, PSME2, PSME1, PSMD9, PSMD8, PSMD7, PSMD6, PSMD5, PSMD4, PSMD3, PSMD2, PSMD14, PSMD13, PSMD12, PSMD11, PSMD10, PSMD1, PSMC6, PSMC5, PSMC4, PSMC3, PSMC2, PSMC1, PSMB9, PSMB8, PSMB7, PSMB6, PSMB5, PSMB4, PSMB3, PSMB2, PSMB10, PSMB1, PSMA8, PSMA7, PSMA6, PSMA5, PSMA4, PSMA3, PSMA1, PRKCQ"
"270","FCGR activation",0.200279552715655,0.697118626563554,0.348259122865752,1.01399954562876,1002,16,"CD247, CD3G, FCGR1A, FCGR2A, FCGR3A, FGR, FYN, HCK, IGLC1, IGLC2, IGLC3, IGLC7"
"271","FGFR1 mutant receptor activation",0.300378712377915,0.697118626563554,0.284754597409559,0.7198893360436,1506,28,"BAG4, BCR, CNTRL, CPSF6, CUX1, ERLIN2, FGF1, FGF17, FGF20, FGF23, FGF4, FGF5, FGF9, FGFR1, FGFR1OP, FGFR1OP2, GAB2"
"272","FGFR2 alternative splicing",0.26497788500201,0.697118626563554,-0.369330742949019,-0.959332547203862,1317,24,"TIAL1, TIA1, RBFOX2, PTBP1, POLR2L, POLR2K, POLR2J, POLR2I, POLR2H, POLR2G, POLR2F, POLR2E, POLR2D, POLR2C, POLR2B, POLR2A, NCBP2, NCBP1, HNRNPM, HNRNPH1, HNRNPF, HNRNPA1, GTF2F2, GTF2F1"
"273","FGFR2 ligand binding and activation",0.170726837060703,0.697118626563554,0.69313692668229,2.01815396228771,854,16,"FGF1, FGF10, FGF16, FGF17, FGF18, FGF20, FGF22, FGF23, FGF3, FGF4, FGF5, FGF7, FGF9, FGFBP1, FGFBP3, FGFR2"
"274","FGFR2 mutant receptor activation",0.305632685442285,0.697118626563554,0.35754976208029,0.881254292929313,1540,30,"FGF1, FGF10, FGF16, FGF17, FGF18, FGF20, FGF22, FGF23, FGF3, FGF4, FGF5, FGF7, FGF9, FGFR2, GTF2F1, GTF2F2, NCBP1, NCBP2, POLR2A, POLR2B, POLR2C, POLR2D, POLR2E, POLR2F, POLR2G, POLR2H, POLR2I, POLR2J, POLR2K, POLR2L"
"275","FLT3 Signaling",0.347126887625025,0.697118626563554,-0.994019707781176,-1.22629411210478,1769,236,"NRG1, HGF, GRIN2B, PTK2"
"276","FOXO-mediated transcription",0.677211364094298,0.76343769435792,0.120606406554295,0.218517941645119,3360,60,"ABCA6, AGRP, AKT1, AKT2, AKT3, ATXN3, BCL2L11, BCL6, BTG1, CAT, CAV1, CCNG2, CDKN1A, CDKN1B, CITED2, CREBBP, DDIT3, EP300, FASLG, FBXO32, FOXG1, FOXO1, FOXO3, FOXO4, FOXO6, GADD45A, GCK"
"277","FOXO-mediated transcription of cell cycle genes",0.313169377231257,0.697118626563554,0.264008697090729,0.764294399098865,1578,17,"BTG1, CAV1, CCNG2, CDKN1A, CDKN1B, FOXG1, FOXO1, FOXO3, FOXO4, GADD45A"
"278","FOXO-mediated transcription of cell death genes",0.192414065586725,0.697118626563554,0.35125424031423,1.04213307112991,973,15,"BCL2L11, BCL6, CITED2, CREBBP, DDIT3, EP300, FASLG, FOXO1, FOXO3, FOXO4"
"279","FOXO-mediated transcription of oxidative stress, metabolic and neuronal genes",0.490453460620525,0.712437091771438,0.185259631490787,0.481503735643922,2465,26,"ABCA6, AGRP, ATXN3, CAT, FBXO32, FOXO1, FOXO3, FOXO4, FOXO6, GCK, HDAC1, HDAC2, INS, NPY, NR3C1, PLXNA4, POMC, PPARGC1A, RETN, SIN3A, SIRT3, SMAD2, SMAD3, SMAD4, SOD2, SREBF1"
"280","FRS-mediated FGFR1 signaling",0.217109144542773,0.697118626563554,0.406024378809189,1.13489251814039,1103,20,"FGF1, FGF10, FGF17, FGF20, FGF22, FGF23, FGF3, FGF4, FGF5, FGF9, FGFR1, FRS2, FRS3, GRB2, HRAS, KL, KRAS"
"281","FRS-mediated FGFR2 signaling",0.236454183266932,0.697118626563554,0.429207338980264,1.16558934410232,1186,22,"FGF1, FGF10, FGF16, FGF17, FGF18, FGF20, FGF22, FGF23, FGF3, FGF4, FGF5, FGF7, FGF9, FGFR2, FRS2, FRS3, GRB2, HRAS"
"282","FRS-mediated FGFR3 signaling",0.200434439178515,0.697118626563554,0.38928324292953,1.11594400962652,1014,18,"FGF1, FGF16, FGF17, FGF18, FGF20, FGF23, FGF4, FGF5, FGF9, FGFR3, FRS2, FRS3, GRB2, HRAS, KRAS"
"283","FRS-mediated FGFR4 signaling",0.200434439178515,0.697118626563554,0.38928324292953,1.11594400962652,1014,18,"FGF1, FGF16, FGF17, FGF18, FGF20, FGF23, FGF4, FGF9, FGFR4, FRS2, FRS3, GRB2, HRAS, KLB, KRAS"
"284","Factors involved in megakaryocyte development and platelet production",0.704832564668137,0.779375066271783,0.281956839010713,0.41734423666003,3514,103,"ABL1, AK3, AKAP1, AKAP10, CABLES1, CABLES2, CAPZA2, CAPZB, CARMIL1, CBX5, CDC42, CDK5, CENPE, DOCK1, DOCK10, DOCK11, DOCK2, DOCK3, DOCK4, DOCK5, DOCK6, DOCK7, DOCK8, DOCK9, EHD1, EHD2, EHD3, GATA1, GATA4, H3-3A, HDAC1, HDAC2, HMG20B, IRF1, IRF2, ITPK1, JAK2, JMJD1C, KDM1A, KIF11, KIF13B, KIF15, KIF16B, KIF18A, KIF19, KIF1A, KIF1B, KIF1C, KIF20A, KIF21A, KIF21B, KIF22, KIF23, KIF26A, KIF26B, KIF27, KIF2A, KIF2C, KIF3A, KIF3B, KIF3C, KIF4A, KIF5A, KIF5B, KIF5C, KIF6, KIF9, KIFAP3, KIFC2, KIFC1, KLC1, KLC2, KLC3, KLC4"
"285","Fanconi Anemia Pathway",0.346584099081103,0.697118626563554,0.303740949316171,0.70656665810865,1734,35,"ATR, ATRIP, DCLRE1A, DCLRE1B, EME1, EME2, ERCC1, ERCC4, FAAP100, FAAP24, FAN1, FANCA, FANCB, FANCC, FANCD2, FANCE, FANCF, FANCG, FANCI, FANCL, FANCM"
"286","Fatty acid metabolism",0.401545166402536,0.697118626563554,-0.994733643913308,-1.30285609008966,2026,140,"PRKAG2"
"287","Fatty acyl-CoA biosynthesis",0.306029353431178,0.697118626563554,0.342876929607041,0.845090105513132,1542,30,"ACACA, ACLY, ACSBG1, ACSBG2, ACSL1, ACSL3, ACSL4, ACSL5, ACSL6, CBR4, ELOVL1, ELOVL2, ELOVL4, ELOVL5, ELOVL6, ELOVL7, FASN, HACD1, HACD2, HACD3, HACD4, HSD17B12"
"288","Fc epsilon receptor (FCERI) signaling",0.352425601304525,0.697118626563554,0.995547460028334,1.36914847251184,1728,128,"ITPR1, AHCYL1"
"289","Fcgamma receptor (FCGR) dependent phagocytosis",0.505707991187663,0.714281631369859,0.924460197976757,1.44717163506362,2524,88,"WIPF3, ITPR1, ABI1"
"290","Fertilization",0.175319488817891,0.697118626563554,0.476221961834617,1.3865791912216,877,16,"ACR, ADAM2, ADAM21, B4GALT1, CATSPER2, CATSPER3, CATSPERB, CATSPERD, CATSPERG, CD9"
"291","Formation of ATP by chemiosmotic coupling",0.156854998024496,0.697118626563554,0.711823781467595,2.11190362519328,793,15,"ATP5F1A, ATP5F1B, ATP5F1C, ATP5F1D, ATP5F1E, ATP5MC3, ATP5PD, ATP5PF, ATP5MF, ATP5ME, ATP5MG, ATP5PO"
"292","Formation of Fibrin Clot (Clotting Cascade)",0.517921146953405,0.71690317834922,0.192265492935285,0.525507677466579,2600,21,"A2M, C1QBP, F12, F13A1, F13B, F2, F2R, F3, F5, F8"
"293","Formation of HIV elongation complex in the absence of HIV Tat",0.411859296482412,0.697118626563554,0.241247090683323,0.513949990161458,2048,43,"CCNH, CCNK, CCNT1, CCNT2, CDK7, CDK9, CTDP1, ELL, ELOA, ELOC, ERCC2, ERCC3, GTF2F1, GTF2F2, GTF2H1, GTF2H2, GTF2H3, GTF2H4, GTF2H5, MNAT1, NCBP1, NCBP2, NELFA, NELFB, NELFCD, NELFE, POLR2A, POLR2B, POLR2C, POLR2D, POLR2E, POLR2F, POLR2G, POLR2H, POLR2I, POLR2J, POLR2K, POLR2L"
"294","Formation of HIV-1 elongation complex containing HIV-1 Tat",0.40023942537909,0.697118626563554,0.23552698303643,0.516417270583043,2005,41,"CCNH, CCNT1, CDK7, CDK9, CTDP1, ELL, ELOA, ELOC, ERCC2, ERCC3, GTF2F1, GTF2F2, GTF2H1, GTF2H2, GTF2H3, GTF2H4, GTF2H5, MNAT1, NCBP1, NCBP2, NELFA, NELFB, NELFCD, NELFE, POLR2A, POLR2B, POLR2C, POLR2D, POLR2E, POLR2F, POLR2G, POLR2H, POLR2I, POLR2J, POLR2K, POLR2L"
"295","Formation of Incision Complex in GG-NER",0.595328408864045,0.736143793630482,-0.143738681333423,-0.302952391052111,2981,42,"XPC, XPA, USP45, UBE2V2, UBE2N, UBE2I, UBC, UBB, SUMO2, SUMO1, RPS27A, RPA3, RPA2, RPA1, RNF111, RBX1, RAD23B, RAD23A, PIAS3, PIAS1, PARP2, PARP1, MNAT1, GTF2H5, GTF2H4, GTF2H3, GTF2H2, GTF2H1, UBA52, ERCC5, ERCC4, ERCC3, ERCC2, ERCC1, DDB2, DDB1, CUL4B, CUL4A, CHD1L, CETN2, CDK7, CCNH"
"296","Formation of RNA Pol II elongation complex",0.506422018348624,0.714281631369859,0.214779648012276,0.400656880725202,2483,56,"AFF4, CCNH, CCNK, CCNT1, CCNT2, CDC73, CDK7, CDK9, CTDP1, CTR9, EAF1, EAF2, ELL, ELOA, ELOC, ERCC2, ERCC3, GTF2F1, GTF2F2, GTF2H1, GTF2H2, GTF2H3, GTF2H4, GTF2H5, IWS1, LEO1, MLLT1, MLLT3, MNAT1, NCBP1, NCBP2, NELFA, NELFB, NELFCD, NELFE, PAF1, POLR2A, POLR2B, POLR2C, POLR2D, POLR2E, POLR2F, POLR2G, POLR2H, POLR2I, POLR2J, POLR2K, POLR2L"
"297","Formation of TC-NER Pre-Incision Complex",0.576295389636883,0.732199987453736,0.148882843587971,0.284869764317039,2824,53,"AQR, CCNH, CDK7, COPS2, COPS3, COPS4, COPS5, COPS6, COPS7A, COPS7B, COPS8, CUL4A, CUL4B, DDB1, EP300, ERCC2, ERCC3, ERCC6, ERCC8, UBA52, GPS1, GTF2H1, GTF2H2, GTF2H3, GTF2H4, GTF2H5, HMGN1, ISY1, MNAT1, POLR2A, POLR2B, POLR2C, POLR2D, POLR2E, POLR2F, POLR2G, POLR2H, POLR2I, POLR2J, POLR2K, POLR2L, PPIE, PRPF19"
"298","Formation of a pool of free 40S subunits",0.585960737656157,0.735246351552465,-0.471478873239437,-0.788389459156393,2954,71,"RPSA, RPS9, RPS8, RPS7, RPS5, RPS4X, RPS3A, RPS28, RPS27L, RPS27A, RPS25, RPS24, RPS21, RPS20, RPS19, RPS17, RPS16, RPS15A, RPS15, RPS14, RPS13, RPS12, RPS11, RPLP1, RPL8, RPL7A, RPL6, RPL5, RPL4, RPL3L, RPL38, RPL37A, RPL36, RPL35, RPL34, RPL32, RPL30, RPL3, RPL29, RPL28, RPL27, RPL26, RPL23, RPL22L1, RPL19, RPL18A, RPL18, RPL14, RPL13A, RPL12, RPL11, RPL10A, RPL10"
"299","Formation of the Early Elongation Complex",0.332405566600398,0.697118626563554,0.296881538267783,0.70601385896066,1671,33,"CCNH, CDK7, CTDP1, ERCC2, ERCC3, GTF2F1, GTF2F2, GTF2H1, GTF2H2, GTF2H3, GTF2H4, GTF2H5, MNAT1, NCBP1, NCBP2, NELFA, NELFB, NELFCD, NELFE, POLR2A, POLR2B, POLR2C, POLR2D, POLR2E, POLR2F, POLR2G, POLR2H, POLR2I, POLR2J, POLR2K, POLR2L"
"300","Formation of the HIV-1 Early Elongation Complex",0.332405566600398,0.697118626563554,0.296881538267783,0.70601385896066,1671,33,"CCNH, CDK7, CTDP1, ERCC2, ERCC3, GTF2F1, GTF2F2, GTF2H1, GTF2H2, GTF2H3, GTF2H4, GTF2H5, MNAT1, NCBP1, NCBP2, NELFA, NELFB, NELFCD, NELFE, POLR2A, POLR2B, POLR2C, POLR2D, POLR2E, POLR2F, POLR2G, POLR2H, POLR2I, POLR2J, POLR2K, POLR2L"
"301","Formation of the beta-catenin:TCF transactivating complex",0.520559043953818,0.71690317834922,-0.172245524517859,-0.406155692305875,2569,31,"TRRAP, TLE4, TLE3, TLE2, TLE1, TERT, TCF7L2, TCF7L1, TCF7, TCF4"
"302","Formation of the cornified envelope",0.478562921794363,0.710439588071277,0.185743569889911,0.475747168879546,2410,27,"CAPN1, CAPNS1, CSTA, DSC2, DSC3, DSG1, DSG2, DSG3, DSP, EVPL, FURIN, JUP, KAZN, KLK12, KLK8, LIPK, LIPN, PCSK6, PERP, PKP2, PKP4, PPL, PRSS8"
"303","Formation of the ternary complex, and subsequently, the 43S complex",0.411659013775205,0.697118626563554,-0.274160063113045,-0.577836431227796,2061,42,"RPSA, RPS9, RPS8, RPS7, RPS5, RPS4X, RPS3A, RPS28, RPS27L, RPS27A, RPS25, RPS24, RPS21, RPS20, RPS19, RPS17, RPS16, RPS15A, RPS15, RPS14, RPS13, RPS12, RPS11"
"304","Formation of tubulin folding intermediates by CCT/TriC",0.218019117347976,0.697118626563554,-0.439991117627984,-1.21241146925165,1071,19,"TUBB6, TUBB4B, TUBB4A, TUBB2B, TUBB2A, TUBAL3, TUBA8, TUBA4A, TUBA1C, TUBA1B"
"305","G alpha (12/13) signalling events",0.223248343706083,0.697118626563554,0.996840973249093,1.66920702481783,1111,73,"ARHGEF3, ABR"
"306","G alpha (i) signalling events",0.593953764078245,0.735305011566972,-0.792975743338347,-0.983170536186968,3005,271,"HTR1F, GPC6, RGS6, PRKCG, GRM8, GABBR2"
"307","G alpha (q) signalling events",0.823691460055096,0.855278448198802,-0.575406717679094,-0.729766844357003,4185,168,"DGKB, DGKH"
"308","G alpha (s) signalling events",0.101970343286614,0.697118626563554,0.998108235930005,1.32212432419549,501,150,"RXFP1, ADCY1"
"309","G alpha (z) signalling events",0.400201005025126,0.697118626563554,0.545130065023327,1.1613387368191,1990,43,"PRKCA, ADCY1"
"310","G beta:gamma signalling through BTK",0.171525559105431,0.697118626563554,0.648141948443254,1.88714551342205,858,16,"BTK, GNB1, GNB2, GNB3, GNB4, GNB5, GNG10, GNG11, GNG12, GNG13, GNG2, GNG3, GNG4, GNG7, GNG8, GNGT2"
"311","G beta:gamma signalling through CDC42",0.192535545023697,0.697118626563554,0.592606233770099,1.69880257795424,974,18,"ARHGEF6, CDC42, GNB1, GNB2, GNB3, GNB4, GNB5, GNG10, GNG11, GNG12, GNG13, GNG2, GNG3, GNG4, GNG7, GNG8, GNGT2"
"312","G beta:gamma signalling through PI3Kgamma",0.244995044598612,0.697118626563554,0.430719628128058,1.15884690294106,1235,23,"AKT1, AKT2, AKT3, GNB1, GNB2, GNB3, GNB4, GNB5, GNG10, GNG11, GNG12, GNG13, GNG2, GNG3, GNG4, GNG7, GNG8, GNGT2"
"313","G beta:gamma signalling through PLC beta",0.194510268562401,0.697118626563554,0.481361191098016,1.37990049001353,984,18,"GNB1, GNB2, GNB3, GNB4, GNB5, GNG10, GNG11, GNG12, GNG13, GNG2, GNG3, GNG4, GNG7, GNG8, GNGT2"
"314","G protein gated Potassium channels",0.256001613879363,0.697118626563554,-0.515421932427507,-1.35163164793858,1268,23,"GABBR2"
"315","G-protein activation",0.253381066030231,0.697118626563554,0.523288336571314,1.38924515257015,1273,24,"GNAI1, GNAI2, GNAI3, GNAO1, GNAT2, GNAZ, GNB1, GNB2, GNB3, GNB4, GNB5, GNG10, GNG11, GNG12, GNG13, GNG2, GNG3, GNG4, GNG7, GNG8, GNGT2"
"316","G-protein beta:gamma signalling",0.305831019436731,0.697118626563554,0.348146907043764,0.858079039452652,1541,30,"AKT1, AKT2, AKT3, ARHGEF6, BTK, CDC42, GNB1, GNB2, GNB3, GNB4, GNB5, GNG10, GNG11, GNG12, GNG13, GNG2, GNG3, GNG4, GNG7, GNG8, GNGT2"
"317","G-protein mediated events",0.41641275644932,0.697118626563554,0.759069839768097,1.52593309611592,2049,48,"PRKCA, ITPR1, ADCY1"
"318","G0 and Early G1",0.3912092283214,0.697118626563554,0.218747906478194,0.580740000247043,1966,24,"CCNA1, CCNA2, CCNE1, CCNE2, CDC25A, CDC6, DYRK1A, E2F1, E2F4, E2F5, HDAC1, LIN37, LIN52, LIN54, LIN9, MAX, MYBL2, MYC"
"319","G1 Phase",0.417584618465852,0.697118626563554,0.208856058104985,0.464349221450389,2084,39,"ABL1, CCND1, CCND2, CCND3, CCNH, CDK4, CDK6, CDK7, CDKN1A, CDKN1B, CDKN1C, CDKN2D, CKS1B, CUL1, E2F1, E2F3, E2F4, E2F5"
"320","G1/S DNA Damage Checkpoints",0.538735177865613,0.718313570487483,-0.427552057266785,-0.756852964489568,2725,62,"ZNF385A, UBC, UBB, TP53, RPS27A, PSMF1, PSME4, PSME3, PSME2, PSME1, PSMD9, PSMD8, PSMD7, PSMD6, PSMD5, PSMD4, PSMD3, PSMD2, PSMD14, PSMD13, PSMD12, PSMD11, PSMD10, PSMD1, PSMC6, PSMC5, PSMC4, PSMC3, PSMC2, PSMC1, PSMB9, PSMB8, PSMB7, PSMB6, PSMB5, PSMB4, PSMB3, PSMB2, PSMB10, PSMB1, PSMA8, PSMA7, PSMA6, PSMA5, PSMA4, PSMA3, PSMA1"
"321","G1/S Transition",0.780935464772054,0.826320491782855,-0.226249003861951,-0.307931390403679,3956,121,"WEE1, UBC, UBB, TYMS, TK1, TFDP2, TFDP1, SKP2, SKP1, RRM2, RPS27A, RPA3, RPA2, RPA1, RBL2, RBL1, RB1, PSMF1, PSME3, PSME2, PSME1, PSMD9, PSMD8, PSMD7, PSMD6, PSMD5, PSMD4, PSMD3, PSMD2, PSMD14, PSMD13, PSMD12, PSMD11, PSMD10, PSMD1, PSMC6, PSMC5, PSMC4, PSMC3, PSMC2, PSMC1, PSMB9, PSMB8, PSMB7, PSMB6, PSMB5, PSMB4, PSMB3, PSMB2, PSMB10, PSMB1, PSMA7, PSMA6, PSMA5, PSMA4, PSMA3, PSMA1, PRIM2, PRIM1, PPP2R3B, PPP2R1B, PPP2R1A, PPP2CB, PPP2CA, POLE4, POLE3, POLE2, POLE, POLA2, POLA1, PCNA, ORC6, ORC5, ORC4, ORC3, ORC2, ORC1"
"322","G1/S-Specific Transcription",0.625099443118536,0.748418380876615,0.158098183223811,0.410909085849974,3142,26,"CCNA1, CCNE1, CDC25A, CDC45, CDC6, DHFR, E2F1, E2F4, E2F5, E2F6, FBXO5, HDAC1, LIN37, LIN52, LIN54, LIN9"
"323","G2/M Checkpoints",0.788560157790927,0.831887638988231,-0.304364846993493,-0.411256215193616,3997,123,"YWHAZ, YWHAQ, YWHAH, YWHAG, YWHAE, YWHAB, WRN, WEE1, UIMC1, UBE2V2, UBE2N, UBC, UBB, TP53BP1, TP53, TOPBP1, TOP3A, SUMO1, RPS27A, RPA3, RPA2, RPA1, RNF168, RMI2, RMI1, RHNO1, RFC5, RFC4, RFC3, RFC2, RBBP8, RAD9B, RAD9A, RAD50, RAD17, RAD1, PSMF1, PSME4, PSME3, PSME2, PSME1, PSMD9, PSMD8, PSMD7, PSMD6, PSMD5, PSMD4, PSMD3, PSMD2, PSMD14, PSMD13, PSMD12, PSMD11, PSMD10, PSMD1, PSMC6, PSMC5, PSMC4, PSMC3, PSMC2, PSMC1, PSMB9, PSMB8, PSMB7, PSMB6, PSMB5, PSMB4, PSMB3, PSMB2, PSMB10, PSMB1, PSMA8, PSMA7, PSMA6, PSMA5, PSMA4, PSMA3, PSMA1"
"324","G2/M DNA damage checkpoint",0.50029429075927,0.712437091771438,-0.277368963698269,-0.517074474432788,2549,56,"YWHAZ, YWHAQ, YWHAH, YWHAG, YWHAE, YWHAB, WRN, WEE1, UIMC1, UBE2V2, UBE2N, TP53BP1, TP53, TOPBP1, TOP3A, SUMO1, RPA3, RPA2, RPA1, RNF168, RMI2, RMI1, RHNO1, RFC5, RFC4, RFC3, RFC2, RBBP8, RAD9B, RAD9A, RAD50, RAD17, RAD1"
"325","G2/M Transition",0.872405372405372,0.892693869438056,0.179279332747747,0.231629543820752,4286,171,"ACTR1A, AKAP9, ALMS1, AURKA, BORA, BTRC, CCNA1, CCNA2, CCNB1, CCNB2, CCNH, CCP110, CDC25A, CDC25B, CDC25C, CDK11B, CDK11A, CDK5RAP2, CDK7, CDKN1A, CENPF, CENPJ, CEP131, CEP135, CEP152, CEP164, CEP192, CEP250, CEP290, CEP41, CEP57, CEP63, CEP70, CEP72, CEP76, CEP78, CETN2, CKAP5, CLASP1, CNTRL, CSNK1D, CSNK1E, CUL1, DCTN1, DCTN2, DCTN3, DYNC1H1, DYNC1I2, DYNLL1, EP300, FBXL18, FBXL7, FBXW11, FGFR1OP, FKBPL, FOXM1, UBA52, GTSE1, HAUS1, HAUS2, HAUS4, HAUS6, HAUS7, HAUS8, HMMR, HSP90AB1, LCMT1, LIN37, LIN52, LIN54, LIN9, MAPRE1, MNAT1, MYBL2, MZT1, MZT2A, MZT2B, NDE1, NEDD1, NINL, NME7, ODF2, OFD1, OPTN, PAFAH1B1, PCM1, PCNT, PHLDA1, PKMYT1, PLK1, PLK4, PPME1, PPP1CB, PPP1R12A, PPP1R12B, PPP2CA, PPP2CB, PPP2R1A, PPP2R1B, PPP2R2A, PPP2R3B, PRKACA, PRKAR2B, PSMA1, PSMA3, PSMA4, PSMA5, PSMA6, PSMA7, PSMA8, PSMB1, PSMB10, PSMB2, PSMB3, PSMB4, PSMB5, PSMB6, PSMB7, PSMB8, PSMB9, PSMC1, PSMC2, PSMC3, PSMC4, PSMC5, PSMC6, PSMD1, PSMD10, PSMD11, PSMD12, PSMD13, PSMD14, PSMD2, PSMD3, PSMD4, PSMD5, PSMD6, PSMD7, PSMD8, PSMD9, PSME1, PSME2, PSME3, PSME4, PSMF1"
"326","GAB1 signalosome",0.604233226837061,0.739727547035854,0.196124874455976,0.571041849380408,3025,16,"AREG, BTC, CSK, EGF, EGFR, EREG, GAB1, GRB2, HBEGF, PAG1, PIK3CA, PIK3R1, PTPN11, PXN"
"327","GABA B receptor activation",0.35728582866293,0.697118626563554,-0.515418806670319,-1.17021489055613,1784,35,"GABBR2"
"328","GABA receptor activation",0.422499011466983,0.697118626563554,-0.799506769126954,-1.57876728974721,2136,49,"GABRG3, GABBR2, GABRA2"
"329","GABA synthesis, release, reuptake and degradation",0.259821790198461,0.697118626563554,-0.295434421899298,-0.823224280664358,1282,18,"VAMP2, SYT1, STXBP1, STX1A, SNAP25, SLC6A13, SLC6A11, SLC6A1, SLC32A1, RIMS1, RAB3A"
"330","GLI3 is processed to GLI3R by the proteasome",0.4934275063763,0.712437091771438,-0.554220016304608,-1.0331834529352,2514,56,"UBC, UBB, SUFU, SKP1, RPS27A, RBX1, PSMF1, PSME4, PSME3, PSME2, PSME1, PSMD9, PSMD8, PSMD7, PSMD6, PSMD5, PSMD4, PSMD3, PSMD2, PSMD14, PSMD13, PSMD12, PSMD11, PSMD10, PSMD1, PSMC6, PSMC5, PSMC4, PSMC3, PSMC2, PSMC1, PSMB9, PSMB8, PSMB7, PSMB6, PSMB5, PSMB4, PSMB3, PSMB2, PSMB10, PSMB1, PSMA8, PSMA7, PSMA6, PSMA5, PSMA4, PSMA3, PSMA1, PRKACB, PRKACA"
"331","GPCR ligand binding",0.62440664556962,0.748418380876615,-0.769239486718985,-0.953183688836066,3156,277,"HTR1F, GRM8, GABBR2"
"332","GPVI-mediated activation cascade",0.313127258129265,0.697118626563554,-0.368793588730363,-0.891835557157502,1559,29,"VAV3, VAV2, VAV1, SYK, RHOG, RHOB, RHOA, RAC1, PTPN6, PTPN11, PRKCZ, PLCG2, PIK3R6, PIK3R5, PIK3R3, PIK3R2, PIK3R1, PIK3CG, PIK3CB, PIK3CA, PDPN, PDPK1"
"333","GRB2 events in ERBB2 signaling",0.0861033239887865,0.697118626563554,-0.99671911617007,-2.84038209239345,429,16,"NRG1"
"334","GTP hydrolysis and joining of the 60S ribosomal subunit",0.637893050270379,0.749726104029416,-0.379136051541342,-0.595343888520744,3184,81,"RPSA, RPS9, RPS8, RPS7, RPS5, RPS4X, RPS3A, RPS28, RPS27L, RPS27A, RPS25, RPS24, RPS21, RPS20, RPS19, RPS17, RPS16, RPS15A, RPS15, RPS14, RPS13, RPS12, RPS11, RPLP1, RPL8, RPL7A, RPL6, RPL5, RPL4, RPL3L, RPL38, RPL37A, RPL36, RPL35, RPL34, RPL32, RPL30, RPL3, RPL29, RPL28, RPL27, RPL26, RPL23, RPL22L1, RPL19, RPL18A, RPL18, RPL14, RPL13A, RPL12, RPL11, RPL10A, RPL10"
"335","Gamma carboxylation, hypusine formation and arylsulfatase activation",0.279475982532751,0.697118626563554,0.518965226282299,1.3292316783675,1407,27,"ARSA, ARSB, ARSG, ARSI, ARSJ, ARSK, DHPS, DNAJC24, DPH1, DPH2, DPH3, DPH5, DPH6, DPH7, EEF2, EIF5A, EIF5A2, F2, FN3K, FN3KRP, FURIN, GAS6, GGCX"
"336","Gap junction trafficking",0.17232428115016,0.697118626563554,0.602180281218614,1.75332242991279,862,16,"AP2M1, CLTA, CLTB, CLTC, DAB2, DNM1, DNM2, GJA3, GJA5, GJB1, GJB2, GJB6, GJC1, GJC2, GJD2"
"337","Gap junction trafficking and regulation",0.194510268562401,0.697118626563554,0.497968704658586,1.42750864065788,984,18,"AP2M1, CLTA, CLTB, CLTC, DAB2, DNM1, DNM2, GJA3, GJA5, GJB1, GJB2, GJB6, GJC1, GJC2, GJD2"
"338","Gap-filling DNA repair synthesis and ligation in GG-NER",0.264173703256936,0.697118626563554,-0.479140148723789,-1.24456127229647,1313,24,"XRCC1, UBC, UBB, RPS27A, RPA3, RPA2, RPA1, RFC5, RFC4, RFC3, RFC2, RFC1, POLK, POLE4, POLE3, POLE2, POLE, POLD4, POLD2, POLD1, PCNA"
"339","Gap-filling DNA repair synthesis and ligation in TC-NER",0.543004359889021,0.721536954359515,-0.276645514017894,-0.48701483622485,2739,63,"ZNF830, XRCC1, XAB2, UVSSA, USP7, UBC, UBB, TCEA1, RPS27A, RPA3, RPA2, RPA1, RFC5, RFC4, RFC3, RFC2, RFC1, RBX1, PRPF19, PPIE, POLR2L, POLR2K, POLR2J, POLR2I, POLR2H, POLR2G, POLR2F, POLR2E, POLR2D, POLR2C, POLR2B, POLR2A, POLK, POLE4, POLE3, POLE2, POLE, POLD4, POLD2, POLD1"
"340","Gastrin-CREB signalling pathway via PKC and MAPK",0.0313498402555911,0.697118626563554,0.998861734181453,2.90830958359815,156,16,"PRKCA, CCKBR"
"341","Gene Silencing by RNA",0.591026404605916,0.735246351552465,-0.328197459506687,-0.545783805106173,2976,72,"XPO5, TSNAX, TSN, TPR, TNRC6C, TNRC6B, TNRC6A, TDRKH, TDRD9, TDRD6, TDRD12, TARBP2, SEH1L, SEC13, RANBP2, RAE1, PRKRA, POM121, POM121C, POLR2L, POLR2K, POLR2J, POLR2I, POLR2H, POLR2G, POLR2F, POLR2E, POLR2D, POLR2C, POLR2B, POLR2A, PIWIL2, PIWIL1, NUP42, NUP58, NUP98, NUP93, NUP88, NUP85, NUP62, NUP54, NUP50, NUP43, NUP37, NUP35, NUP214, NUP210, NUP205, NUP188, NUP160, NUP155, NUP153, NUP133, NUP107"
"342","Gene and protein expression by JAK-STAT signaling after Interleukin-12 stimulation",0.635263784212614,0.749726104029416,0.150191005964748,0.37017635809833,3202,30,"AIP, ANXA2, ARF1, BOLA2, CA1, CDC42, CFL1, GSTO1, HNRNPA2B1, HNRNPF, HSPA9, LCP1, LMNB1, MIF, MSN, MTAP, PAK2, PDCD4, PITPNA, PPIA, PSME2, RALA, RAP1B, SERPINB2, SNRPA1, SOD1, SOD2, STAT4, TALDO1, TCP1"
"343","Generation of second messenger molecules",0.650540806293019,0.74982416870418,0.169834572366218,0.474710375926892,3307,20,"CD101, CD247, CD3G, ENAH, EVL, GRAP2, HLA-DQB1, ITK, LCK, LCP2, NCK1, PAK1, PAK2, PAK3, PLCG1, PLCG2"
"344","Global Genome Nucleotide Excision Repair (GG-NER)",0.728488720303454,0.793076380041698,0.107991089662729,0.173357604769631,3648,82,"ACTB, ACTL6A, ACTR5, ACTR8, CCNH, CDK7, CETN2, CHD1L, COPS2, COPS3, COPS4, COPS5, COPS6, COPS7A, COPS7B, COPS8, CUL4A, CUL4B, DDB1, DDB2, ERCC1, ERCC2, ERCC3, ERCC4, ERCC5, UBA52, GPS1, GTF2H1, GTF2H2, GTF2H3, GTF2H4, GTF2H5, INO80, INO80B, INO80C, INO80D, INO80E, LIG1, LIG3, MCRS1, MNAT1, NFRKB, PARP1, PARP2, PCNA, PIAS1, PIAS3, POLD1, POLD2, POLD4, POLE, POLE2, POLE3, POLE4, POLK, RAD23A, RAD23B, RBX1, RFC1, RFC2, RFC3, RFC4, RFC5, RNF111, RPA1, RPA2, RPA3, RPS27A, RUVBL1"
"345","Glucagon signaling in metabolic regulation",0.295418326693227,0.697118626563554,0.441474980242086,1.10506003724544,1482,29,"ADCY1, ADCY2, ADCY3, ADCY5, ADCY6, ADCY7, ADCY8, ADCY9, GCG, GNAS, GNB1, GNB2, GNB3, GNB4, GNG10, GNG11, GNG12, GNG13, GNG2, GNG3, GNG4, GNG7, GNG8"
"346","Glucagon-like Peptide-1 (GLP1) regulates insulin secretion",0.357128534188891,0.697118626563554,-0.845306678502334,-1.85813439576388,1780,38,"KCNC2, RAPGEF4"
