"","pathway","pval","padj","ES","NES","nMoreExtreme","size","leadingEdge"
"499","Mitotic G2-G2/M phases",0.251121076233184,0.294170403587444,0.178827605500264,0.604604568516417,1287,173,"ACTR1A, AKAP9, ALMS1, AURKA, BORA, BTRC, CCNA2, CCNB2, CCNH, CCP110, CDC25A, CDC25B, CDC25C, CDK1, CDK11B, CDK11A, CDK2, CDK5RAP2, CDK7, CDKN1A, CENPJ, CEP131, CEP135, CEP152, CEP164, CEP192, CEP250, CEP290, CEP41, CEP57, CEP63, CEP70, CEP72, CEP76, CEP78, CETN2, CKAP5, CLASP1, CNTRL, CSNK1D, CSNK1E, CUL1, DCTN1, DCTN2, DCTN3, DYNC1H1, DYNC1I2, DYNLL1, E2F1, E2F3, EP300, FBXL18, FBXL7, FBXW11, FGFR1OP, FKBPL, FOXM1, UBA52, GTSE1, HAUS1, HAUS2, HAUS3, HAUS4, HAUS6, HAUS7, HAUS8, HMMR, HSP90AB1, LCMT1, LIN37, LIN52, LIN54, LIN9, MAPRE1, MNAT1, MYBL2, MZT1, MZT2B, MZT2A, NDE1, NEDD1, NINL, NME7, ODF2, OFD1, OPTN, PAFAH1B1, PCM1, PCNT, PHLDA1, PKMYT1, PLK1, PLK4, PPME1, PPP1CB, PPP1R12A, PPP1R12B, PPP2CA, PPP2CB, PPP2R1A, PPP2R1B, PPP2R2A, PPP2R3B, PRKACA, PRKAR2B, PSMA1, PSMA3, PSMA4, PSMA5, PSMA6, PSMA7, PSMA8, PSMB1, PSMB10, PSMB2, PSMB3, PSMB4, PSMB5, PSMB6, PSMB7, PSMB8, PSMB9, PSMC1, PSMC2, PSMC3, PSMC4, PSMC5, PSMC6, PSMD1, PSMD10, PSMD11, PSMD12, PSMD13, PSMD14, PSMD2, PSMD3, PSMD4, PSMD5, PSMD6, PSMD7, PSMD8, PSMD9, PSME1, PSME2, PSME3, PSME4, PSMF1"
"500","Mitotic Metaphase and Anaphase",0.0217698044749043,0.177444946650036,-0.999928982316597,-3.90830037378068,107,163,"PTTG1"
"501","Mitotic Prometaphase",0.253731343283582,0.296348104345223,0.124042166332097,0.423893319098673,1291,169,"ACTR1A, AHCTF1, AKAP9, ALMS1, B9D2, BIRC5, BUB3, CCNB2, CCP110, CDC20, CDCA8, CDK1, CDK5RAP2, CENPA, CENPC, CENPE, CENPH, CENPJ, CENPK, CENPL, CENPM, CENPN, CENPO, CENPP, CENPQ, CENPT, CENPU, CEP131, CEP135, CEP152, CEP164, CEP192, CEP250, CEP290, CEP41, CEP57, CEP63, CEP70, CEP72, CEP76, CEP78, CETN2, CKAP5, CLASP1, CLASP2, CLIP1, CNTRL, CSNK1D, CSNK1E, CSNK2A1, CSNK2A2, CSNK2B, DCTN1, DCTN2, DCTN3, DSN1, DYNC1H1, DYNC1I1, DYNC1I2, DYNC1LI1, DYNC1LI2, DYNLL1, DYNLL2"
"502","Mitotic Prophase",0.105591311343524,0.181397866039711,-0.299861851990037,-1.5710680749214,524,77,"VRK2, VRK1, USO1, TPR, TMPO, SMC4, SMC2, SET, SEH1L, SEC13, RB1, RANBP2, RAE1, RAB2A, RAB1B, RAB1A, PRKCB, PRKCA, PPP2R2D, PPP2R1B, PPP2R1A, PPP2CB, PPP2CA, POM121C, POM121, PLK1, PHF8, NUP42, NUP58, NUP98, NUP93, NUP88, NUP85, NUP54, NUP50, NUP43, NUP37, NUP35, NUP214, NUP210, NUP205, NUP188, NUP160, NUP155, NUP153, NUP133, NUP107, NUMA1, NEK9, NEK7, NEK6, NDC1, NCAPH2, NCAPG2, NCAPD3, MCPH1, MASTL, MAPK3, MAPK1, LPIN2, LPIN1, LMNB1, LMNA, LEMD3, LEMD2, KMT5A"
"503","Mitotic Spindle Checkpoint",0.148750495834986,0.208053194574972,0.203780070006807,0.919399653131965,749,95,"AHCTF1, ANAPC1, ANAPC10, ANAPC15, ANAPC16, ANAPC2, ANAPC4, ANAPC5, ANAPC7, B9D2, BIRC5, BUB3, CDC16, CDC20, CDC23, CDC26, CDC27, CDCA8, CENPA, CENPC, CENPE, CENPH, CENPK, CENPL, CENPM, CENPN, CENPO, CENPP, CENPQ, CENPT, CENPU, CKAP5, CLASP1, CLASP2, CLIP1, DSN1, DYNC1H1, DYNC1I1, DYNC1I2, DYNC1LI1, DYNC1LI2, DYNLL1, DYNLL2"
"504","Molecules associated with elastic fibres",0.0478574289146976,0.177444946650036,0.34158238976018,1.6806732475474,238,25,"BMP2, BMP4, BMP7, EFEMP1, EFEMP2, FBLN1, FBLN2, FBLN5, ITGA8, ITGAV, ITGB1, ITGB3, ITGB5, ITGB8, LTBP1, LTBP3, LTBP4, MFAP1, MFAP2, MFAP3, MFAP4"
"505","Muscle contraction",0.23110151187905,0.275966745209209,0.163977358173208,0.584809802734595,1176,157,"ABCC9, ACTN2, ACTN3, AHCYL1, AKAP9, ANXA1, ANXA2, ANXA6, ASPH, ATP1A1, ATP1A2, ATP1A3, ATP1B1, ATP1B2, ATP1B3, ATP2A1, ATP2A2, ATP2B1, ATP2B2, ATP2B3, ATP2B4, CACNA1C, CACNA1D, CACNA1F, CACNA2D1, CACNA2D2, CACNA2D3, CACNA2D4, CACNB1, CACNB2, CACNB3, CACNB4, CACNG2, CACNG3, CACNG4, CACNG5, CACNG6, CACNG7, CACNG8, CALD1, CALM1, CAMK2A, CAMK2B, CAMK2G"
"506","MyD88 cascade initiated on plasma membrane",0.101030511214387,0.181397866039711,-0.202464954370119,-1.07696185958711,499,72,"VRK3, UBE2N, UBC, UBB, TRAF6, TNIP2, TLR5, TAB3, TAB2, TAB1, SKP1, S100B, RPS6KA5, RPS6KA3, RPS6KA2, RPS6KA1, RPS27A, RIPK2, RELA, PPP2R5D, PPP2R1B, PPP2R1A, PPP2CB, PPP2CA, PELI3, PELI2, PELI1, NOD1, NKIRAS2, NKIRAS1, NFKBIB, NFKBIA, NFKB2, NFKB1, MEF2C, MEF2A, MAPKAPK3, MAPKAPK2, MAPK9, MAPK8, MAPK7, MAPK3, MAPK14, MAPK11, MAPK10, MAPK1, MAP3K7, MAP3K1, MAP2K6, MAP2K4, MAP2K3, MAP2K1"
"507","MyD88 dependent cascade initiated on endosome",0.106647921269331,0.181397866039711,-0.192580986661021,-1.01877584469853,530,75,"VRK3, UBE2N, UBC, UBB, TRAF6, TNIP2, TLR4, TICAM1, TAB3, TAB2, TAB1, SKP1, S100B, RPS6KA5, RPS6KA3, RPS6KA2, RPS6KA1, RPS27A, RIPK2, RELA, PPP2R5D, PPP2R1B, PPP2R1A, PPP2CB, PPP2CA, PELI3, PELI2, PELI1, NOD1, NKIRAS2, NKIRAS1, NFKBIB, NFKBIA, NFKB2, NFKB1, MEF2C, MEF2A, MAPKAPK3, MAPKAPK2, MAPK9, MAPK8, MAPK7, MAPK3, MAPK14, MAPK11, MAPK10, MAPK1, MAP3K7, MAP3K1, MAP2K6, MAP2K4, MAP2K3, MAP2K1, LY96"
"508","MyD88-independent TLR4 cascade",0.114903069466882,0.181854838709677,-0.185434627429994,-0.961700316374183,568,83,"VRK3, UBE2N, UBE2D3, UBE2D2, UBE2D1, UBC, UBB, TRAF6, TRAF3, TNIP2, TLR4, TICAM1, TBK1, TANK, TAB3, TAB2, TAB1, SKP1, SARM1, S100B, RPS6KA5, RPS6KA3, RPS6KA2, RPS6KA1, RPS27A, RIPK2, RIPK1, RELA, PTPN11, PPP2R5D, PPP2R1B, PPP2R1A, PPP2CB, PPP2CA, NOD1, NKIRAS2, NKIRAS1, NFKBIB, NFKBIA, NFKB2, NFKB1, MEF2C, MEF2A, MAPKAPK3, MAPKAPK2, MAPK9, MAPK8, MAPK7, MAPK3, MAPK14, MAPK11, MAPK10, MAPK1, MAP3K7, MAP2K6, MAP2K4, MAP2K3, MAP2K1, LY96, JUN, IRF3, IRAK2, IRAK1, IKBKG, IKBKB"
"509","MyD88:MAL(TIRAP) cascade initiated on plasma membrane",0.111493322541481,0.181397866039711,-0.187069215886903,-0.977197242877827,550,79,"VRK3, UBE2N, UBC, UBB, TRAF6, TNIP2, TLR4, TLR2, TIRAP, TAB3, TAB2, TAB1, SOCS1, SKP1, S100B, RPS6KA5, RPS6KA3, RPS6KA2, RPS6KA1, RPS27A, RIPK2, RELA, PPP2R5D, PPP2R1B, PPP2R1A, PPP2CB, PPP2CA, PELI3, PELI2, PELI1, NOD1, NKIRAS2, NKIRAS1, NFKBIB, NFKBIA, NFKB2, NFKB1, MEF2C, MEF2A, MAPKAPK3, MAPKAPK2, MAPK9, MAPK8, MAPK7, MAPK3, MAPK14, MAPK11, MAPK10, MAPK1, MAP3K7, MAP3K1, MAP2K6, MAP2K4, MAP2K3, MAP2K1, LY96, JUN, IRAK3, IRAK2, IRAK1, IKBKG, IKBKB"
"510","Myogenesis",0.092110532639167,0.180867182164459,0.265908995006681,1.30834067442326,459,25,"ABL1, BNIP2, BOC, CDC42, CDH2, CDH4, CDON, CTNNA1, CTNNA2, CTNNB1, MAP2K6, MAPK11, MAPK12, MAPK14, MEF2A, MEF2B, MEF2C, MEF2D, MYOD1, NEO1, NTN3"
"511","N-glycan antennae elongation in the medial/trans-Golgi",0.051901025950513,0.177444946650036,0.325278293277242,1.57315155158499,257,23,"B4GALT1, B4GALT2, B4GALT3, B4GALT4, B4GALT5, B4GALT6, CGA, CHST10, CHST8, FUCA1, FUT8, MAN2A1, MAN2A2, MGAT2, MGAT3, MGAT4A, MGAT4B, MGAT4C, MGAT5"
"512","N-glycan trimming in the ER and Calnexin/Calreticulin cycle",0.452376217935971,0.480227722604488,-0.147504174103288,-0.793011338607327,2274,33,"VCP, UGGT2, UGGT1, UBXN1, UBC, UBB, TRIM13, SYVN1, SEL1L, RPS27A, RNF5, RNF185, RNF103, RAD23B, PSMC1, PRKCSH"
"513","NCAM signaling for neurite out-growth",0.0798486658701712,0.177444946650036,0.285731896308819,1.50233443952979,400,48,"AGRN, ARTN, CACNA1C, CACNA1D, CACNA1G, CACNA1H, CACNA1I, CACNB1, CACNB2, CACNB3, CACNB4, CNTN2, COL4A1, COL4A2, COL4A4, COL4A5, COL6A2, COL6A3, COL6A5, COL6A6, COL9A1, COL9A2, CREB1"
"514","NCAM1 interactions",0.0512360446570973,0.177444946650036,0.575011825778985,2.8895385305046,256,29,"AGRN, ARTN, CACNA1C, CACNA1D, CACNA1G, CACNA1H, CACNA1I, CACNB1, CACNB2, CACNB3, CACNB4, CNTN2, COL4A1, COL4A2, COL4A4, COL4A5, COL6A2, COL6A3, COL6A5, COL6A6, COL9A1, COL9A2"
"515","NEP/NS2 Interacts with the Cellular Export Machinery",0.0395626242544732,0.177444946650036,-0.5128183481075,-2.74710956257312,198,30,"XPO1, TPR, SEH1L, SEC13, RANBP2, RAE1, POM121C, POM121, NUP42, NUP58, NUP98, NUP93, NUP88, NUP85, NUP54, NUP50, NUP43, NUP37, NUP35, NUP214, NUP210, NUP205, NUP188, NUP160, NUP155, NUP153, NUP133, NUP107, NDC1"
"516","NIK-->noncanonical NF-kB signaling",0.076703386372909,0.177444946650036,-0.547046800112771,-3.02571921231186,375,56,"UBE2M, UBC, UBB, UBA3, SKP1, RPS27A, RELB, PSMF1, PSME4, PSME3, PSME2, PSME1, PSMD9, PSMD8, PSMD7, PSMD6, PSMD5, PSMD4, PSMD3, PSMD2, PSMD14, PSMD13, PSMD12, PSMD11, PSMD10, PSMD1, PSMC6, PSMC5, PSMC4, PSMC3, PSMC2, PSMC1, PSMB9, PSMB8, PSMB7, PSMB6, PSMB5, PSMB4, PSMB3, PSMB2, PSMB10, PSMB1, PSMA8, PSMA7, PSMA6, PSMA5, PSMA4, PSMA3, PSMA1"
"517","NOD1/2 Signaling Pathway",0.109877032923443,0.181397866039711,0.249055909627017,1.23194301269406,553,26,"BIRC2, BIRC3, CARD9, CASP1, CASP2, CASP9, CHUK, CYLD, IKBKB, IKBKG, IRAK1, IRAK2, ITCH, MAP2K6, MAP3K7, MAPK11, MAPK12, MAPK13, MAPK14"
"518","NOTCH1 Intracellular Domain Regulates Transcription",0.0836363636363636,0.177618758131686,-0.219893419724394,-1.22241683346611,413,45,"UBC, UBB, TLE4, TLE3, TLE2, TLE1, TBL1XR1, TBL1X, SNW1, SKP1, RPS27A, RBX1, RBPJ, NOTCH1, NCOR2, NCOR1, MYC, MAMLD1, MAML3, MAML2, MAML1, KAT2B, KAT2A, HIF1A, HEY1, HES5, HES1, HDAC9, HDAC8, HDAC7, HDAC6, HDAC5, HDAC4, HDAC3, HDAC2, HDAC11, HDAC10, HDAC1"
"519","NOTCH2 Activation and Transmission of Signal to the Nucleus",0.351123595505618,0.384921588655891,0.194250904488564,0.929104335249984,1749,22,"ADAM10, APH1A, APH1B, CNTN1, DLL1, DLL4, UBA52, JAG1, JAG2, MDK, MIB1, MIB2, NCSTN, NEURL1, NEURL1B, NOTCH2, PSEN1, PSEN2, PSENEN"
"520","NOTCH3 Activation and Transmission of Signal to the Nucleus",0.874600638977636,0.878027086143072,-0.113138757999859,-0.572868383223027,4379,25,"YBX1, WWP2, UBC, UBB, TACC3, RPS27A, PSENEN, PSEN2, PSEN1, NOTCH3, NEURL1B, NEURL1, NCSTN, MIB2, MIB1, JAG2, JAG1, UBA52, EGFR, EGF, DLL4, DLL1"
"521","NOTCH3 Intracellular Domain Regulates Transcription",0.282647584973166,0.322980796652726,-0.205103903290602,-1.0182819414417,1421,23,"WWC1, STAT1, SNW1, RBPJ, PTCRA, PLXND1, PBX1, NOTCH3, NOTCH1, MAMLD1, MAML3, MAML2, MAML1, KAT2B, KAT2A, IKZF1, HEY1, HES5, HES1"
"522","NOTCH4 Intracellular Domain Regulates Transcription",0.234730538922156,0.279116940133654,-0.253971043013776,-1.13115895525618,1175,16,"SNW1, SMAD3, RBPJ, NOTCH2, NOTCH1, MAMLD1, MAML3, MAML2, MAML1, KAT2B, KAT2A, HEY1, HES5, HES1"
"523","NR1H2 and NR1H3-mediated signaling",0.10547263681592,0.181397866039711,0.213765467197357,1.1153683967651,529,39,"ABCA1, ABCG1, ABCG8, AGO1, AGO2, AGO3, AGO4, ANGPTL3, APOD, APOE, ARL4C"
"524","NR1H3 & NR1H2 regulate gene expression linked to cholesterol transport and efflux",0.0845691382765531,0.177618758131686,0.254262907878521,1.28921100572085,421,31,"ABCA1, ABCG1, ABCG8, AGO1, AGO2, AGO3, AGO4, APOD, APOE, ARL4C"
"525","NRAGE signals death through JNK",0.0847257715746019,0.177618758131686,0.356853865657612,1.8721848755954,430,53,"AATF, ABR, AKAP13, ARHGEF1, ARHGEF10, ARHGEF10L, ARHGEF11, ARHGEF12, ARHGEF15, ARHGEF17, ARHGEF18, ARHGEF19, ARHGEF2, ARHGEF26, ARHGEF3, ARHGEF33, ARHGEF37, ARHGEF4, ARHGEF40, ARHGEF6, ARHGEF7, ARHGEF9, BAD, BCL2L11"
"526","NRIF signals cell death from the nucleus",0.3187624750499,0.356304838523607,-0.232850716896261,-1.03709135706758,1596,16,"UBC, UBB, TRAF6, SQSTM1, RPS27A, PSENEN, PSEN2, PSEN1, NGFR, NGF, NCSTN, MAPK8"
"527","NS1 Mediated Effects on Host Pathways",0.0540486236688768,0.177444946650036,-0.34002653453551,-1.87026465350541,268,39,"TPR, SEH1L, SEC13, RANBP2, RAE1, POM121C, POM121, PABPN1, NUP42, NUP58, NUP98, NUP93, NUP88, NUP85, NUP54, NUP50, NUP43, NUP37, NUP35, NUP214, NUP210, NUP205, NUP188, NUP160, NUP155, NUP153, NUP133, NUP107, NDC1, KPNB1, KPNA7, KPNA4, KPNA3, KPNA2, KPNA1"
"528","Neddylation",0.308096535616972,0.34627077742039,0.206350927172328,0.601733882108231,1582,213,"ANKRD9, ASB1, ASB11, ASB12, ASB13, ASB14, ASB15, ASB2, ASB3, ASB5, ASB6, ASB7, ASB8, BIRC5, BTBD1, BTBD6, BTRC, CAND1, CCDC8, CCNF, COMMD1, COMMD10, COMMD2, COMMD3, COMMD4, COMMD5, COMMD6, COMMD7, COMMD8, COMMD9, COPS2, COPS3, COPS4, COPS5, COPS6, COPS7A, COPS7B, COPS8, CUL1, CUL2, CUL3, CUL4A, CUL4B, CUL5, CUL7, CUL9, DCAF10, DCAF11, DCAF13, DCAF17, DCAF4, DCAF5, DCAF6, DCAF7, DCAF8, DCUN1D1, DCUN1D2, DCUN1D3, DCUN1D4, DCUN1D5, DDA1, DDB1, DDB2, DTL, ELOC, EPAS1, ERCC8, FBXL12, FBXL13, FBXL14, FBXL15, FBXL16, FBXL18, FBXL19, FBXL20, FBXL3, FBXL4, FBXL5, FBXL7, FBXL8, FBXO10, FBXO11, FBXO15, FBXO17, FBXO2, FBXO21, FBXO22, FBXO27, FBXO30, FBXO31, FBXO32, FBXO4, FBXO41, FBXO44, FBXO6, FBXO7, FBXO9, FBXW10, FBXW11, FBXW2, FBXW4, FBXW5, FBXW7, FBXW8, FBXW9, FEM1A, FEM1B, FEM1C"
"529","Nef-mediates down modulation of cell surface receptors by recruiting them to clathrin adapters",0.0254827792156082,0.177444946650036,0.778817907091152,3.34516501183435,127,15,"AP1B1, AP1G1, AP1M1, AP1S1, AP1S2, AP2A1, AP2A2, AP2B1, AP2M1, AP2S1, ARF1, ATP6V1H, B2M"
"530","Negative epigenetic regulation of rRNA expression",0.0713128038897893,0.177444946650036,-0.263581795124701,-1.45812412394411,351,50,"ZNRD1, UBTF, TWISTNB, TTF1, TBP, TAF1D, TAF1C, TAF1B, TAF1A, SUV39H1, SUDS3, SMARCA5, SIRT1, SIN3B, SIN3A, SAP30L, SAP30BP, SAP30, SAP18, SAP130, RRP8, POLR2L, POLR2K, POLR2H, POLR2F, POLR2E, POLR1E, POLR1D, POLR1C, POLR1B, POLR1A"
"531","Negative regulation of FGFR1 signaling",0.16105623866156,0.217589849921011,-0.228394126621725,-1.16777304153733,798,26,"UBC, UBB, SRC, SPRY2, RPS27A, PTPN11, PPP2R1A, PPP2CB, PPP2CA, MKNK1, MAPK3, MAPK1, KL, GRB2, UBA52, FRS2, FGFR1, FGF9, FGF5, FGF22, FGF20, FGF2, FGF10, FGF1"
"532","Negative regulation of FGFR2 signaling",0.16105623866156,0.217589849921011,-0.228394126621725,-1.16777304153733,798,26,"UBC, UBB, SRC, SPRY2, RPS27A, PTPN11, PPP2R1A, PPP2CB, PPP2CA, MKNK1, MAPK3, MAPK1, GRB2, UBA52, FRS2, FGFR2, FGF9, FGF7, FGF5, FGF22, FGF20, FGF2, FGF10, FGF1"
"533","Negative regulation of FGFR3 signaling",0.221824686940966,0.268441917490543,-0.218296273422954,-1.08377826820617,1115,23,"UBC, UBB, SRC, SPRY2, RPS27A, PTPN11, PPP2R1A, PPP2CB, PPP2CA, MKNK1, MAPK3, MAPK1, GRB2, UBA52, FRS2, FGFR3, FGF9, FGF5, FGF20, FGF2, FGF1"
"534","Negative regulation of FGFR4 signaling",0.221824686940966,0.268441917490543,-0.218296273422954,-1.08377826820617,1115,23,"UBC, UBB, SRC, SPRY2, RPS27A, PTPN11, PPP2R1A, PPP2CB, PPP2CA, MKNK1, MAPK3, MAPK1, KLB, GRB2, UBA52, FRS2, FGFR4, FGF9, FGF20, FGF2, FGF1"
"535","Negative regulation of MAPK pathway",0.111266480223732,0.181397866039711,0.213768089095045,1.10472738672918,556,38,"ARAF, BRAF, BRAP, DUSP1, DUSP10, DUSP16, DUSP2, DUSP4, DUSP5, DUSP6, DUSP7, DUSP8, UBA52, HRAS, KRAS, KSR1, MAP2K1, MAP2K2, MAPK1, MAPK3, MARK3, NRAS, PAQR3, PPP2CA, PPP2CB, PPP2R1A, PPP2R1B, PPP2R5A, PPP2R5B, PPP2R5C, PPP2R5D, PPP2R5E, PPP5C"
"536","Negative regulation of MET activity",0.0475435816164818,0.177444946650036,-0.327446569178853,-1.56802557507057,239,20,"USP8, UBC, UBB, STAM2, STAM, SH3KBP1, SH3GL3, SH3GL2, SH3GL1, RPS27A, PTPRJ, PTPN2, PTPN1"
"537","Negative regulation of NMDA receptor-mediated neuronal transmission",0.0359233097880928,0.177444946650036,0.437795275590551,2.0379484739835,177,20,"ACTN2, CALM1, CAMK1, CAMK2A, CAMK2B, CAMK2G, CAMK4, DLG1, DLG2, DLG3, DLG4, GRIN1, GRIN2A, GRIN2B, GRIN2C, GRIN2D"
"538","Negative regulation of NOTCH4 signaling",0.0708502024291498,0.177444946650036,-0.593590046460351,-3.29094604178282,349,51,"YWHAZ, UBC, UBB, TACC3, SKP1, RPS27A, RBX1, PSMF1, PSME3, PSME2, PSME1, PSMD9, PSMD8, PSMD7, PSMD6, PSMD5, PSMD4, PSMD3, PSMD2, PSMD14, PSMD13, PSMD12, PSMD11, PSMD10, PSMD1, PSMC6, PSMC5, PSMC4, PSMC3, PSMC2, PSMC1, PSMB9, PSMB8, PSMB7, PSMB6, PSMB5, PSMB4, PSMB3, PSMB2, PSMB10, PSMB1, PSMA7, PSMA6, PSMA5, PSMA4, PSMA3, PSMA1"
"539","Negative regulation of the PI3K/AKT network",0.14240317775571,0.202843186372745,0.222825114219773,1.02113574392782,716,90,"AKT1, AKT2, AKT3, AREG, BTC, CD80, CD86, EGF, EGFR, ERBB2, ERBB3, ERBB4, ESR1, FGF1, FGF10, FGF2, FGF20, FGF22, FGF5, FGF7, FGF9, FGFR1, FGFR2, FGFR3, FGFR4, FRS2, FYN, GAB1, GRB2, HBEGF, IER3, IL1RAP, IL1RL1, IL33, INSR, IRAK1, IRS1, IRS2, KIT, KITLG, KL, KLB, LCK, MAPK1, MAPK3, MET, NRG1, NRG2, NRG3, NRG4, PDGFA, PDGFB, PDGFRA, PDGFRB, PHLPP1, PHLPP2, PIK3AP1, PIK3CA, PIK3CB, PIK3CD, PIK3R1, PIK3R2, PIK3R3, PIP4K2A, PIP4K2B, PIP4K2C, PIP5K1A, PIP5K1B, PIP5K1C, PPP2CA, PPP2CB, PPP2R1A, PPP2R1B, PPP2R5A, PPP2R5B, PPP2R5C, PPP2R5D, PPP2R5E, PTEN, PTPN11, RAC1, RAC2"
"540","Negative regulators of DDX58/IFIH1 signaling",0.119935820296831,0.184309169121817,-0.227991315633073,-1.20754959908626,597,29,"UBE2L6, UBE2K, UBE2D3, UBE2D2, UBE2D1, UBC, UBB, TRIM25, TRAF3, TBK1, TAX1BP1"
"541","Nephrin family interactions",0.240766902119072,0.284315754230471,0.226476377952756,1.05425347091637,1192,20,"ACTN1, ACTN2, ACTN3, ACTN4, CASK, CD2AP, FYN, IQGAP1, KIRREL3, MAGI2, NCK1, NCK2, NPHS1, PIK3CA, PIK3CB, PIK3R1, PIK3R2"
"542","Netrin-1 signaling",0.0728752978554408,0.177444946650036,0.999225079253258,5.25643215734718,366,49,"UNC5C, ABLIM1"
"543","Neurexins and neuroligins",0.140980392156863,0.201822488772045,0.174096451156145,0.915913708561097,718,55,"APBA1, APBA2, APBA3, BEGAIN, CASK, DBNL, DLG2, DLG3, DLG4, DLGAP1, DLGAP2, DLGAP3, DLGAP4, EPB41, EPB41L1, EPB41L2, EPB41L3, EPB41L5, GRIN1, GRIN2A, GRIN2B, GRIN2C, GRIN2D, GRM1, GRM5, HOMER1, HOMER2, HOMER3, LIN7A, LIN7B, LIN7C, LRRTM1, LRRTM2, LRRTM3, LRRTM4, NLGN1, NLGN2, NLGN3, NRXN1, NRXN2, NRXN3"
"544","Neurodegenerative Diseases",0.0339903459372486,0.177444946650036,0.430616964203126,1.98545193376721,168,19,"APP, BCL2L11, CAPN1, CAPN2, CAPNS1, CAST, CDC25A, CDC25B, CDC25C, CDK5, CDK5R1"
"545","Neuronal System",0.439528593508501,0.468312690588579,0.22379882567171,0.494365340333611,2274,341,"ABAT, ABCC8, ABCC9, ACHE, ACTN2, ADCY1, ADCY2, ADCY3, ADCY5, ADCY6, ADCY7, ADCY8, ADCY9, AKAP5, ALDH2, ALDH5A1, AP2A1, AP2A2, AP2B1, AP2M1, AP2S1, APBA1, APBA2, APBA3, ARHGEF7, ARHGEF9, ARL6IP5, BCHE, BEGAIN, CACFD1, CACNA1A, CACNA1B, CACNA1E, CACNA2D1, CACNA2D2, CACNA2D3, CACNB1, CACNB2, CACNB3, CACNB4, CACNG2, CACNG3, CACNG4, CACNG8, CALM1, CAMK1, CAMK2A, CAMK2B, CAMK2G, CAMK4, CAMKK1, CAMKK2, CASK, CHRNA4, CHRNA5, CHRNA7, CHRNA9, CHRNB2, CHRNE, CHRNG, COMT, CPLX1, CREB1, DBNL, DLG1, DLG2, DLG3, DLG4, DLGAP1, DLGAP2, DLGAP3, DLGAP4, DNAJC5, EPB41, EPB41L1, EPB41L2, EPB41L3, EPB41L5, ERBB4, FLOT1, FLOT2, GABBR1, GABBR2, GABRA1, GABRA2, GABRA3, GABRA4, GABRA5, GABRB1, GABRB2, GABRB3, GABRG2, GABRG3, GABRR1, GABRR2, GABRR3, GAD1, GAD2, GIT1, GJC1, GJD2, GLRA2, GLRA3, GLRA4, GLRB, GLS, GLS2, GLUL, GNAI1, GNAI2, GNAI3, GNAL, GNB1, GNB2, GNB4, GNB5, GNG11, GNG12, GNG13, GNG2, GNG3, GNG4, GNG7, GNG8, GNGT2, GRIA1, GRIA2, GRIA3, GRIA4, GRIK1, GRIK2, GRIK3, GRIK4, GRIK5, GRIN1, GRIN2A, GRIN2B, GRIN2C, GRIN2D, GRIN3A, GRIN3B, GRIP1, GRIP2, GRM1, GRM5, HCN1, HCN2, HCN3, HCN4, HOMER1, HOMER2, HOMER3, HRAS, HSPA8, IL1RAP, IL1RAPL1, IL1RAPL2, KCNA1, KCNA2, KCNA3, KCNA4, KCNA6, KCNAB1, KCNAB2, KCNAB3, KCNB1, KCNC1, KCNC2, KCNC3, KCNC4, KCND2, KCND3, KCNF1, KCNG1, KCNG2, KCNG3, KCNH1, KCNH2, KCNH3, KCNH4, KCNH5, KCNH6, KCNH7, KCNH8, KCNJ10, KCNJ11, KCNJ12, KCNJ14, KCNJ15, KCNJ16, KCNJ2, KCNJ3, KCNJ4, KCNJ6, KCNJ9, KCNK1, KCNK10, KCNK13, KCNK2, KCNK3, KCNK4, KCNK9, KCNMA1, KCNMB2, KCNMB4, KCNN1, KCNN2, KCNN3, KCNN4, KCNQ1, KCNQ2, KCNQ3, KCNQ4, KCNQ5, KCNS1, KCNS2, KCNS3, KCNV1, KIF17, KPNA2, KRAS, LIN7A, LIN7B, LIN7C, LRFN1, LRFN2, LRFN3, LRFN4, LRRC4B, LRRC7, LRRTM1, LRRTM2, LRRTM3, LRRTM4"
"546","Neurotransmitter receptors and postsynaptic signal transmission",0.240071132187315,0.283821119367933,0.284083757210469,0.987472291102686,1214,161,"ACTN2, ADCY1, ADCY2, ADCY3, ADCY5, ADCY6, ADCY7, ADCY8, ADCY9, AKAP5, AP2A1, AP2A2, AP2B1, AP2M1, AP2S1, APBA1, ARHGEF7, ARHGEF9, CACNG2, CACNG3, CACNG4, CACNG8, CALM1, CAMK1, CAMK2A, CAMK2B, CAMK2G, CAMK4, CAMKK1, CAMKK2, CASK, CHRNA4, CHRNA5, CHRNA7, CHRNA9, CHRNB2, CHRNE, CHRNG, CREB1, DLG1, DLG2, DLG3, DLG4, EPB41L1, ERBB4, GABBR1, GABBR2, GABRA1, GABRA2, GABRA3, GABRA4, GABRA5, GABRB1, GABRB2, GABRB3, GABRG2, GABRG3, GABRR1, GABRR2, GABRR3, GIT1, GLRA2, GLRA3, GLRA4, GLRB, GNAI1, GNAI2, GNAI3, GNAL, GNB1, GNB2, GNB4, GNB5, GNG11, GNG12, GNG13, GNG2, GNG3, GNG4, GNG7, GNG8, GNGT2, GRIA1, GRIA2, GRIA3, GRIA4, GRIK1, GRIK2, GRIK3, GRIK4, GRIK5, GRIN1, GRIN2A, GRIN2B, GRIN2C, GRIN2D, GRIN3A, GRIN3B, GRIP1, GRIP2, HRAS, KCNJ10, KCNJ12, KCNJ15, KCNJ16, KCNJ2, KCNJ3, KCNJ4, KCNJ6, KCNJ9, KIF17, KPNA2, KRAS, LIN7A, LIN7B, LIN7C, LRRC7, MAPK1, MAPK3, MAPT, MDM2, MYO6, NCALD, NEFL, NPTN, NRAS, NRG1, NRGN, NSF, PDPK1, PICK1, PLCB1, PLCB2, PPM1E, PPM1F, PRKAA1, PRKAA2, PRKAB1, PRKAB2, PRKACA, PRKACB, PRKAG1, PRKAG2, PRKAG3, PRKAR1A, PRKAR1B, PRKAR2A, PRKAR2B, PRKCA, PRKCB, PRKCG, PRKX"
"547","Neurotransmitter release cycle",0.0632706690923792,0.177444946650036,-0.262227912932138,-1.4561541114638,312,44,"VAMP2, UNC13B, TSPOAP1, SYT1, SYN3, SYN2, SYN1, STXBP1, STX1A, SNAP25, SLC6A13, SLC6A11, SLC6A1, SLC38A2, SLC32A1, SLC1A6, SLC1A3, SLC1A2, SLC1A1, SLC18A2, SLC17A7, RIMS1, RAB3A, PPFIA4, PPFIA3, PPFIA2, PPFIA1"
"548","Neutrophil degranulation",0.447525515116503,0.476338165103235,0.13274644661414,0.288993264112229,2323,352,"C6orf120, ABCA13, ACLY, ACTR10, ACTR1B, ACTR2, ADAM10, ADAM8, AGA, AGL, ALAD, ALDH3B1, ALDOA, ALDOC, ALOX5, AMPD3, ANO6, ANXA2, AOC1, AP1M1, AP2A2, APAF1, APEH, APRT, ARG1, ARL8A, ARMC8, ARPC5, ARSA, ARSB, ASAH1, ATG7, ATP11A, ATP11B, ATP6AP2, ATP6V0A1, ATP6V0C, ATP6V1D, ATP8A1, ATP8B4, B2M, B4GALT1, BRI3, BST2, C3AR1, CAB39, CAMP, CAND1, CANT1, CAP1, CAPN1, CAT, CCT2, CCT8, CD14, CD300A, CD44, CD47, CD53, CD55, CD59, CD63, CD93, CDA, CDK13, CEP290, CFP, CHI3L1, CKAP4, CLEC4C, CLEC5A, CMTM6, CNN2, COMMD3, COMMD9, COPB1, COTL1, CPNE3, CPPED1, CR1, CRACR2A, CREG1, CSNK2B, CST3, CSTB, CTSA, CTSB, CTSC, CTSD, CTSH, CTSS, CTSZ, CXCR2, CYB5R3, CYBA, CYBB, CYFIP1, CYSTM1, DBNL, DDOST, DDX3X, DEGS1, DERA, DGAT1, DIAPH1, DNAJC13, DNAJC3, DNAJC5, DNASE1L1, DOCK2, DOK3, DPP7, DSN1, DSP, DYNC1H1, DYNC1LI1, DYNLL1, DYNLT1, EEF2, ENPP4, EPX, ERP44, FABP5, FAF2, FCER1G, FCGR2A, FGL2, FGR, FPR2, FRK, FRMPD3, FTH1, FTL, FUCA1, FUCA2, GAA, GALNS, GCA, GDI2, GGH, GHDC, GLA, GLB1, GLIPR1, GM2A, GNS, GOLGA7, GPI, GRN, GSN, GUSB, GYG1, HEXB, HGSNAT, HMOX2, HPSE, HSP90AB1, HSPA1A, HSPA1B, HSPA8, HUWE1, HVCN1, IDH1, IGF2R, ILF2, IMPDH1, IMPDH2, IQGAP1, IQGAP2, IST1, ITGAV, ITGB2, JUP, KCMF1, KCNAB2, KPNB1, KRT1, LAIR1, LAMP1, LAMP2, LAMTOR1, LAMTOR2, LAMTOR3, LPCAT1, LRRC7, LTA4H, LTF, MAGT1, MAN2B1, MANBA, MAPK1, MAPK14, METTL7A, MGAM, MGST1, MIF, MLEC, MME, MOSPD2, MPO, MVP, NAPRT, NBEAL2, NCSTN, NDUFC2, NEU1, NFAM1, NFASC, NFKB1, NHLRC3, NIT2, NPC2, NRAS, ORMDL3, OSCAR, OSTF1, PA2G4, PADI2, PAFAH1B2, PDAP1, PDXK, PECAM1, PFKL, PGAM1, PGLYRP1, PGM1, PGM2, PGRMC1, LILRB3, PKM, PKP1, PLAU, PLAUR, PLD1, PLEKHO2, PNP, PPIA, PPIE, PRCP, PRDX4, PRDX6, PRKCD, PRTN3, PSAP, PSEN1, PSMA5, PSMB1, PSMB7, PSMC2, PSMC3, PSMD1, PSMD11, PSMD12, PSMD13, PSMD14, PSMD2, PSMD3, PSMD6, PSMD7, PTAFR, PTGES2, PTPRB, PTPRC, PTPRJ, PTPRN2, PYCARD, PYGB, PYGL, QPCT, QSOX1, RAB10, RAB14, RAB18, RAB24, RAB27A, RAB31, RAB37, RAB3A, RAB3D, RAB4B, RAB5B, RAB5C, RAB6A, RAB7A, RAB9B, RAC1, RAP1A, RAP1B, RAP2B, RAP2C"
"549","Nicotinamide salvaging",0.0209580838323353,0.177444946650036,-0.540483553556368,-2.40725401021724,104,16,"SLC5A8, RNLS, PTGS2, PTGIS, PARP9, PARP8, PARP6, PARP4, PARP16, PARP10, NUDT12, NNMT, NAXE, NAXD, NAPRT, NAMPT"
"550","Nicotinate metabolism",0.0353434504792332,0.177444946650036,-0.499981714607216,-2.5316144666222,176,25,"SLC5A8, RNLS, PTGS2, PTGIS, PARP9, PARP8, PARP6, PARP4, PARP16, PARP10, NUDT12, NT5E, NNMT, NMRK1, NMNAT3, NMNAT2, NMNAT1, NAXE, NAXD, NAPRT, NAMPT, NADSYN1, NADK2, NADK"
"551","Nitric oxide stimulates guanylate cyclase",0.0550898203592814,0.177444946650036,-0.346499859432106,-1.54327207677126,275,16,"PRKG2, PRKG1, PDE9A, PDE5A, PDE1B, PDE1A, PDE11A, PDE10A, NOS3, NOS1, KCNMB4, KCNMB2, KCNMA1, ITPR1, GUCY1A2, PDE2A"
"552","NoRC negatively regulates rRNA expression",0.0725252525252525,0.177444946650036,-0.239190479259178,-1.32700181091433,358,47,"ZNRD1, UBTF, TWISTNB, TTF1, TBP, TAF1D, TAF1C, TAF1B, TAF1A, SUDS3, SMARCA5, SIN3B, SIN3A, SAP30L, SAP30BP, SAP30, SAP18, SAP130, POLR2L, POLR2K, POLR2H, POLR2F, POLR2E, POLR1E, POLR1D, POLR1C, POLR1B, POLR1A"
"553","Non-integrin membrane-ECM interactions",0.114662405113863,0.181854838709677,0.212097186511259,1.09609236616704,573,38,"ACTN1, AGRN, CASK, DAG1, DDR1, DDR2, DMD, FGF2, HSPG2, ITGA2, ITGA6, ITGAV, ITGB1, ITGB3, ITGB4, ITGB5, LAMA1, LAMA2, LAMA3, LAMA4, LAMA5, LAMB1, LAMC1, LAMC2, LAMC3"
"554","Nonhomologous End-Joining (NHEJ)",0.146205800556218,0.206420035220555,-0.210236068111455,-1.12995848954767,735,32,"XRCC6, XRCC5, XRCC4, UIMC1, UBE2V2, UBE2N, TP53BP1, TDP2, TDP1, SUMO1, RNF168, RIF1, RAD50, PRKDC, POLM, POLL, PIAS4, PAXIP1, NSD2, NHEJ1, NBN, MRE11, MDC1"
"555","Nonsense Mediated Decay (NMD) enhanced by the Exon Junction Complex (EJC)",0.11126817447496,0.181397866039711,-0.485538510230456,-2.51809786215232,550,83,"UPF3B, UPF3A, UPF2, UPF1, SMG9, SMG8, SMG7, SMG6, SMG5, SMG1, RPSA, RPS9, RPS8, RPS7, RPS5, RPS4X, RPS3A, RPS28, RPS27L, RPS27A, RPS25, RPS24, RPS21, RPS20, RPS19, RPS17, RPS16, RPS15A, RPS15, RPS14, RPS13, RPS12, RPS11, RPLP1, RPL8, RPL7A, RPL6, RPL5, RPL4, RPL38, RPL37A, RPL36, RPL35, RPL34, RPL32, RPL30, RPL3, RPL29, RPL28, RPL27, RPL26, RPL23, RPL22L1, RPL19, RPL18A, RPL18, RPL14, RPL13A, RPL12, RPL11, RPL10A, RPL10, RNPS1"
"556","Nonsense Mediated Decay (NMD) independent of the Exon Junction Complex (EJC)",0.0847799757771498,0.177618758131686,-0.56999137007599,-3.13296636845959,419,63,"UPF1, RPSA, RPS9, RPS8, RPS7, RPS5, RPS4X, RPS3A, RPS28, RPS27L, RPS27A, RPS25, RPS24, RPS21, RPS20, RPS19, RPS17, RPS16, RPS15A, RPS15, RPS14, RPS13, RPS12, RPS11, RPLP1, RPL8, RPL7A, RPL6, RPL5, RPL4, RPL38, RPL37A, RPL36, RPL35, RPL34, RPL32, RPL30, RPL3, RPL29, RPL28, RPL27, RPL26, RPL23, RPL22L1, RPL19, RPL18A, RPL18, RPL14, RPL13A, RPL12, RPL11, RPL10A, RPL10"
"557","Nonsense-Mediated Decay (NMD)",0.11126817447496,0.181397866039711,-0.485538510230456,-2.51809786215232,550,83,"UPF3B, UPF3A, UPF2, UPF1, SMG9, SMG8, SMG7, SMG6, SMG5, SMG1, RPSA, RPS9, RPS8, RPS7, RPS5, RPS4X, RPS3A, RPS28, RPS27L, RPS27A, RPS25, RPS24, RPS21, RPS20, RPS19, RPS17, RPS16, RPS15A, RPS15, RPS14, RPS13, RPS12, RPS11, RPLP1, RPL8, RPL7A, RPL6, RPL5, RPL4, RPL38, RPL37A, RPL36, RPL35, RPL34, RPL32, RPL30, RPL3, RPL29, RPL28, RPL27, RPL26, RPL23, RPL22L1, RPL19, RPL18A, RPL18, RPL14, RPL13A, RPL12, RPL11, RPL10A, RPL10, RNPS1"
