"","pathway","pval","padj","ES","NES","nMoreExtreme","size","leadingEdge"
"261","Energy dependent regulation of mTOR by LKB1-AMPK",0.0688739014919272,0.327670681256273,-0.380842701764007,-1.76339642996635,336,28,"TSC2, TSC1, STRADB, STRADA, STK11, SLC38A9, RRAGD, RRAGC, RRAGB, RRAGA, RPTOR, RHEB, PRKAG2, PRKAG1, PRKAB2, PRKAB1, PRKAA2, PRKAA1, PPM1A, MTOR, MLST8, LAMTOR5, LAMTOR4, LAMTOR3, LAMTOR2, LAMTOR1"
"262","Ephrin signaling",0.26024671707123,0.356634390060574,0.243376040331021,0.901558864803371,1307,19,"ARHGEF7, EFNB1, EFNB2, EFNB3, EPHB1, EPHB2, EPHB3, EPHB4, EPHB6, FYN, GIT1"
"263","Epigenetic regulation of gene expression",0.509799651567944,0.555345204195334,-0.0964133885789749,-0.339731817458913,2340,87,"ZNRD1, UHRF1, UBTF, TWISTNB, TTF1, TET3, TET2, TET1, TDG, TBP, TAF1D, TAF1C, TAF1B, TAF1A, SUZ12, SUV39H1, SUDS3, SMARCA5, SIRT1, SIN3B, SIN3A, SF3B1, SAP30L, SAP30BP, SAP30, SAP18, SAP130, RRP8, RBBP7, POLR2L, POLR2K, POLR2H, POLR2F, POLR2E, POLR1E, POLR1D, POLR1C, POLR1B, POLR1A, PHF1, MYO1C, MYBBP1A, MTF2, MTA3, MTA2, MTA1, MNAT1, MBD3, MBD2, KAT2B, KAT2A, JARID2, HDAC2, HDAC1, H3-3A, GTF2H5, GTF2H4, GTF2H3, GTF2H2, GTF2H1, GSK3B, GATAD2B, GATAD2A, EZH2, ERCC6, ERCC3, ERCC2, EP300, EHMT2, EED, DNMT3L, DNMT3B, DNMT3A, DNMT1, DEK, DDX21"
"264","Estrogen-dependent gene expression",0.425535846267554,0.480126144106293,0.130469716067599,0.315377091504758,2302,86,"AGO1, AGO2, AGO3, AGO4, ATF2, AXIN1, BCL2, CARM1, CBFB, CCND1, CCNT1, CDK9, CHD1, CREBBP, CTSD, CXCL12, CXXC5, DDX5, EBAG9, EP300, ERBB4, ESR1, FKBP4, FOS, FOSB, GATA3, GPAM, GREB1, GTF2A1, GTF2A2, GTF2F1, GTF2F2, H3-3A, HDAC1, HSP90AB1, JUN, JUND, KANK1, KAT2B, KAT5, KCTD6, KDM1A, KDM4B, KPNA2, MED1, MOV10, MYB, MYC, NCOA1, NCOA2, NCOA3, NR5A2, NRIP1, PGR, POLR2A, POLR2B, POLR2C, POLR2D, POLR2E, POLR2F, POLR2G, POLR2H, POLR2I, POLR2J, POLR2K, POLR2L, POU2F1"
"265","Estrogen-dependent nuclear events downstream of ESR-membrane signaling",0.122699386503067,0.327670681256273,0.321833065885253,1.2020883478336,619,22,"AKT1, AKT2, AKT3, BCL2, BTC, CCND1, CDKN1B, CREB1, EGF, EGFR, ELK1, EREG, FOS, FOXO3"
"266","Eukaryotic Translation Elongation",0.152981116061956,0.327670681256273,-0.598544066376783,-2.45705562436212,720,61,"RPSA, RPS9, RPS8, RPS7, RPS5, RPS4X, RPS3A, RPS28, RPS27L, RPS27A, RPS25, RPS24, RPS21, RPS20, RPS19, RPS17, RPS16, RPS15A, RPS15, RPS14, RPS13, RPS12, RPS11, RPLP1, RPL8, RPL7A, RPL6, RPL5, RPL4, RPL3L, RPL38, RPL37A, RPL36, RPL35, RPL34, RPL32, RPL30, RPL3, RPL29, RPL28, RPL27, RPL26, RPL23, RPL22L1, RPL19, RPL18A, RPL18, RPL14, RPL13A, RPL12, RPL11, RPL10A, RPL10"
"267","Eukaryotic Translation Initiation",0.217429193899782,0.327670681256273,-0.345536711688839,-1.22066262131776,997,86,"RPSA, RPS9, RPS8, RPS7, RPS5, RPS4X, RPS3A, RPS28, RPS27L, RPS27A, RPS25, RPS24, RPS21, RPS20, RPS19, RPS17, RPS16, RPS15A, RPS15, RPS14, RPS13, RPS12, RPS11, RPLP1, RPL8, RPL7A, RPL6, RPL5, RPL4, RPL3L, RPL38, RPL37A, RPL36, RPL35, RPL34, RPL32, RPL30, RPL3, RPL29, RPL28, RPL27, RPL26, RPL23, RPL22L1, RPL19, RPL18A, RPL18, RPL14, RPL13A, RPL12, RPL11, RPL10A, RPL10"
"268","Eukaryotic Translation Termination",0.156954487452148,0.327670681256273,-0.600706136395602,-2.43668856629366,737,62,"TRMT112, RPSA, RPS9, RPS8, RPS7, RPS5, RPS4X, RPS3A, RPS28, RPS27L, RPS27A, RPS25, RPS24, RPS21, RPS20, RPS19, RPS17, RPS16, RPS15A, RPS15, RPS14, RPS13, RPS12, RPS11, RPLP1, RPL8, RPL7A, RPL6, RPL5, RPL4, RPL3L, RPL38, RPL37A, RPL36, RPL35, RPL34, RPL32, RPL30, RPL3, RPL29, RPL28, RPL27, RPL26, RPL23, RPL22L1, RPL19, RPL18A, RPL18, RPL14, RPL13A, RPL12, RPL11, RPL10A, RPL10"
"269","Export of Viral Ribonucleoproteins from Nucleus",0.0781347150259067,0.327670681256273,-0.483893674512888,-2.23033360628982,376,31,"XPO1, TPR, SEH1L, SEC13, RANBP2, RAE1, POM121, POM121C, NUP42, NUP58, NUP98, NUP93, NUP88, NUP85, NUP54, NUP50, NUP43, NUP37, NUP35, NUP214, NUP210, NUP205, NUP188, NUP160, NUP155, NUP153, NUP133, NUP107, NDC1"
"270","Extension of Telomeres",0.0725558516089363,0.327670681256273,-0.438378257924592,-2.02208694691006,353,29,"WRAP53, TERT, RUVBL2, RUVBL1, RPA3, RPA2, RPA1, RFC5, RFC4, RFC3, RFC2, RFC1, PRIM2, PRIM1, POLE4, POLE3, POLE2, POLE, POLD4, POLD2, POLD1, POLA2, POLA1"
"271","Extra-nuclear estrogen signaling",0.296789938051436,0.384608216822694,0.212985486268867,0.585679904670106,1580,67,"AKT1, AKT2, AKT3, BCL2, BTC, CALM1, CAV1, CAV2, CCND1, CDKN1B, CREB1, EGF, EGFR, ELK1, EREG, ESR1, ESR2, FOS, FOXO3, GNAI1, GNAI2, GNAI3, GNAT3, GNB1, GNB3, GNB4, GNB5, GNG10, GNG11, GNG12, GNG13, GNG2, GNG3, GNG4, GNG7, GNG8, GNGT1, GNGT2"
"272","Extracellular matrix organization",0.000252016129032258,0.0540826612903226,-1,-1.91394092234524,0,249,"TTR"
"273","FBXL7 down-regulates AURKA during mitotic entry and in early mitosis",0.130782169890664,0.327670681256273,-0.580828592674095,-2.51726836192397,621,53,"UBC, UBB, SKP1, RPS27A, RBX1, PSMF1, PSME4, PSME3, PSME2, PSME1, PSMD9, PSMD8, PSMD7, PSMD6, PSMD5, PSMD4, PSMD3, PSMD2, PSMD14, PSMD13, PSMD12, PSMD11, PSMD10, PSMD1, PSMC6, PSMC5, PSMC4, PSMC3, PSMC2, PSMC1, PSMB9, PSMB8, PSMB7, PSMB6, PSMB5, PSMB4, PSMB3, PSMB2, PSMB11, PSMB10, PSMB1, PSMA8, PSMA7, PSMA6, PSMA5, PSMA4, PSMA3, PSMA1"
"274","FCERI mediated Ca+2 mobilization",0.10790925812385,0.327670681256273,-0.258756055205191,-1.19810489177696,527,28,"VAV3, VAV2, VAV1, TXK, TEC, SYK, SOS1, SHC1, PPP3R1, PPP3CB, PPP3CA, PLCG2, PLCG1, NFATC3, NFATC2, NFATC1, LYN, LCP2, LAT, ITPR3, ITPR2, ITPR1, ITK, GRB2, GRAP2"
"275","FCERI mediated MAPK activation",0.0711220110361741,0.327670681256273,-0.330312585686866,-1.52942942499686,347,28,"VAV3, VAV2, VAV1, SYK, SOS1, SHC1, RAC1, PLCG2, PLCG1, PAK2, PAK1, NRAS, MAPK9, MAPK8, MAPK3, MAPK10, MAPK1, MAP3K1, MAP2K4, LYN, LCP2, LAT, KRAS, JUN, HRAS, GRB2, GRAP2"
"276","FCERI mediated NF-kB activation",0.190856156998059,0.327670681256273,-0.453033861686881,-1.70564558444691,884,75,"UBE2N, UBE2D2, UBE2D1, UBC, UBB, TRAF6, TAB3, TAB2, TAB1, SKP1, RPS27A, RELA, RASGRP4, RASGRP2, RASGRP1, PSMF1, PSME4, PSME3, PSME2, PSME1, PSMD9, PSMD8, PSMD7, PSMD6, PSMD5, PSMD4, PSMD3, PSMD2, PSMD14, PSMD13, PSMD12, PSMD11, PSMD10, PSMD1, PSMC6, PSMC5, PSMC4, PSMC3, PSMC2, PSMC1, PSMB9, PSMB8, PSMB7, PSMB6, PSMB5, PSMB4, PSMB3, PSMB2, PSMB11, PSMB10, PSMB1, PSMA8, PSMA7, PSMA6, PSMA5, PSMA4, PSMA3, PSMA1, PRKCQ"
"277","FGFR1 mutant receptor activation",0.0206611570247934,0.327670681256273,-0.999616073713847,-4.6216593309844,99,30,"FGF1"
"278","FGFR2 alternative splicing",0.0670197596251782,0.327670681256273,-0.331969551589586,-1.51465061002219,328,25,"TIAL1, TIA1, RBFOX2, PTBP1, POLR2L, POLR2K, POLR2J, POLR2I, POLR2H, POLR2G, POLR2F, POLR2E, POLR2D, POLR2C, POLR2B, POLR2A, NCBP2, NCBP1, HNRNPM, HNRNPH1, HNRNPF, HNRNPA1, GTF2F2, GTF2F1"
"279","FGFR2 ligand binding and activation",0.0110220440881764,0.327670681256273,-0.999616417337936,-4.19336509968834,54,16,"FGF1"
"280","FGFR2 mutant receptor activation",0.021139896373057,0.327670681256273,-0.999616049145709,-4.60737014188218,101,31,"FGF1"
"281","FLT3 Signaling",0.0892768079800499,0.327670681256273,-0.99961079398028,-1.95213846844234,357,242,"FGF1"
"282","FOXO-mediated transcription",0.658009478672986,0.682168280788516,0.0991709797096139,0.278380504499386,3470,63,"ABCA6, AGRP, AKT1, AKT2, AKT3, ATXN3, BCL2L11, BCL6, BTG1, CAT, CAV1, CCNG2, CDKN1A, CDKN1B, CITED2, CREBBP, DDIT3, EP300, FASLG, FBXO32, FOXG1, FOXO1, FOXO3, FOXO4, FOXO6, GADD45A, GCK"
"283","FOXO-mediated transcription of cell cycle genes",0.232898378805852,0.336339112326621,0.264406894398959,0.971383500079965,1177,17,"BTG1, CAV1, CCNG2, CDKN1A, CDKN1B, FOXG1, FOXO1, FOXO3, FOXO4, GADD45A"
"284","FOXO-mediated transcription of cell death genes",0.110650069156293,0.327670681256273,0.35195721195849,1.27840090944712,559,15,"BCL2L11, BCL6, CITED2, CREBBP, DDIT3, EP300, FASLG, FOXO1, FOXO3, FOXO4"
"285","FOXO-mediated transcription of oxidative stress, metabolic and neuronal genes",0.488044144696505,0.534904358794025,-0.157846631934924,-0.730869164479191,2387,28,"TRIM63, SREBF1, SOD2, SMAD4, SMAD3, SMAD2, SIRT3, SIN3A, RETN, PPARGC1A, POMC, PLXNA4, NR3C1, NPY, INS, IGFBP1, HDAC2, HDAC1, GCK, FOXO6, FOXO4, FOXO3, FOXO1, FBXO32"
"286","FRS-mediated FGFR1 signaling",0.0148207490486681,0.327670681256273,-0.999616294685681,-4.44526108625087,73,21,"FGF1"
"287","FRS-mediated FGFR2 signaling",0.015647226173542,0.327670681256273,-0.999616245602814,-4.5117839060928,76,23,"FGF1"
"288","FRS-mediated FGFR3 signaling",0.0137944822071172,0.327670681256273,-0.999616319222407,-4.42428706359457,68,20,"FGF1"
"289","FRS-mediated FGFR4 signaling",0.0137944822071172,0.327670681256273,-0.999616319222407,-4.42428706359457,68,20,"FGF1"
"290","Factors involved in megakaryocyte development and platelet production",0.166006481814908,0.327670681256273,0.99877829218107,2.16503327234631,921,106,"ZFPM2, ITPK1, CAPZA1"
"291","Fanconi Anemia Pathway",0.162459047986124,0.327670681256273,0.3047302054663,1.0957225442776,842,35,"ATR, ATRIP, DCLRE1A, DCLRE1B, EME1, EME2, ERCC1, ERCC4, FAAP100, FAAP24, FAN1, FANCA, FANCB, FANCC, FANCD2, FANCE, FANCF, FANCG, FANCI, FANCL, FANCM"
"292","Fatty acid metabolism",0.534340418057263,0.577388991516056,0.259897189486329,0.468083784591465,3041,147,"ABCC1, ABCD1, ACAA1, ACAA2, ACACA, ACAD10, ACAD11, ACADL, ACADM, ACADS, ACADVL, ACBD4, ACBD5, ACBD6, ACBD7, ACLY, ACOT11, ACOT12, ACOT13, ACOT2, ACOT1, ACOT6, ACOT7, ACOT8, ACOT9, ACOX1, ACOX2, ACOX3, ACOXL, ACSBG1, ACSF2, ACSL1, ACSL3, ACSL4, ACSL5, ACSL6, ACSM3, ALDH3A2, ALOX12, ALOX12B, ALOX5, ALOX5AP, ALOX15B, ALOXE3, AMACR"
"293","Fatty acyl-CoA biosynthesis",0.150086922928337,0.327670681256273,0.315743842852631,1.15597344248881,776,31,"ACACA, ACLY, ACSBG1, ACSL1, ACSL3, ACSL4, ACSL5, ACSL6, CBR4, ELOVL1, ELOVL2, ELOVL4, ELOVL5, ELOVL6, ELOVL7, FASN, HSD17B8, HACD1, HACD2, HACD3, HACD4, HSD17B12"
"294","Fc epsilon receptor (FCERI) signaling",0.311872146118721,0.396022263651347,-0.264227644370051,-0.747045383965814,1365,125,"VAV3, VAV2, VAV1, UBE2N, UBE2D2, UBE2D1, UBC, UBB, TXK, TRAF6, TEC, TAB3, TAB2, TAB1, SYK, SOS1, SKP1, SHC1, RPS27A, RELA, RASGRP4, RASGRP2, RASGRP1, RAC1, PSMF1, PSME4, PSME3, PSME2, PSME1, PSMD9, PSMD8, PSMD7, PSMD6, PSMD5, PSMD4, PSMD3, PSMD2, PSMD14, PSMD13, PSMD12, PSMD11, PSMD10, PSMD1, PSMC6, PSMC5, PSMC4, PSMC3, PSMC2, PSMC1, PSMB9, PSMB8, PSMB7, PSMB6, PSMB5, PSMB4, PSMB3, PSMB2, PSMB11, PSMB10, PSMB1, PSMA8, PSMA7, PSMA6, PSMA5, PSMA4, PSMA3, PSMA1, PRKCQ, PPP3R1, PPP3CB, PPP3CA, PLCG2, PLCG1, PIK3R2, PIK3R1, PIK3CB, PIK3CA, PDPK1, PAK2, PAK1, NRAS, NFKBIA, NFKB1, NFATC3, NFATC2, NFATC1, MAPK9, MAPK8, MAPK3, MAPK10, MAPK1, MAP3K7, MAP3K1, MAP2K4, MALT1, LYN, LCP2, LAT2, LAT, KRAS, JUN, ITPR3, ITPR2, ITPR1, ITK, IKBKG, IKBKB"
"295","Fcgamma receptor (FCGR) dependent phagocytosis",0.391974735277726,0.452751273176919,0.141812920440452,0.350976859878342,2109,82,"ABI1, ABI2, ABL1, ACTB, ACTG1, ACTR2, ACTR3, AHCYL1, ARPC1A, ARPC1B, ARPC2, ARPC3, ARPC4, ARPC5, BAIAP2, BRK1, BTK, CD247, CDC42, CFL1, CRK, CYFIP1, CYFIP2, DOCK1, ELMO1, ELMO2, FCGR1A, FCGR2A, FGR, FYN, GRB2, HCK, HSP90AB1, ITPR1, ITPR2, ITPR3, LIMK1, LYN, MAPK1, MAPK3, MYH9, MYO10, MYO1C, MYO5A, MYO9B, NCK1, NCKAP1, NCKAP1L, NCKIPSD, NF2, PAK1, PIK3CA, PIK3CB, PIK3R1, PIK3R2, PLA2G6, PLCG1, PLCG2, PLD1, PLD2, PLD3, PLD4, PLPP4, PLPP5"
"296","Fertilization",0.0690409868682849,0.327670681256273,0.998081718779973,3.69728022586115,346,19,"IZUMO4, ACR"
"297","Formation of ATP by chemiosmotic coupling",0.0776526378186129,0.327670681256273,0.715936840759445,2.60047039025164,392,15,"ATP5F1A, ATP5F1B, ATP5F1C, ATP5F1D, ATP5F1E, ATP5MC3, ATP5PD, ATP5PF, ATP5MF, ATP5ME, ATP5MG, ATP5PO"
"298","Formation of Fibrin Clot (Clotting Cascade)",0.150539824811571,0.327670681256273,-0.242287468815966,-1.10546542803581,738,25,"VWF, THBD, TFPI, SERPING1, SERPINE2, SERPIND1, SERPINC1, PRTN3, PROS1, PROCR, PRCP, KLKB1, GP5, GP1BB, FGG, F8, F5, F3, F2R, F2, F13B, F13A1, F12, F11"
"299","Formation of HIV elongation complex in the absence of HIV Tat",0.207241910631741,0.327670681256273,0.237163133242485,0.79501523368544,1075,43,"CCNH, CCNK, CCNT1, CCNT2, CDK7, CDK9, CTDP1, ELL, ELOA, ELOC, ERCC2, ERCC3, GTF2F1, GTF2F2, GTF2H1, GTF2H2, GTF2H3, GTF2H4, GTF2H5, MNAT1, NCBP1, NCBP2, NELFA, NELFB, NELFCD, NELFE, POLR2A, POLR2B, POLR2C, POLR2D, POLR2E, POLR2F, POLR2G, POLR2H, POLR2I, POLR2J, POLR2K, POLR2L"
"300","Formation of HIV-1 elongation complex containing HIV-1 Tat",0.201995012468828,0.327670681256273,0.231445719720692,0.793608730744652,1052,41,"CCNH, CCNT1, CDK7, CDK9, CTDP1, ELL, ELOA, ELOC, ERCC2, ERCC3, GTF2F1, GTF2F2, GTF2H1, GTF2H2, GTF2H3, GTF2H4, GTF2H5, MNAT1, NCBP1, NCBP2, NELFA, NELFB, NELFCD, NELFE, POLR2A, POLR2B, POLR2C, POLR2D, POLR2E, POLR2F, POLR2G, POLR2H, POLR2I, POLR2J, POLR2K, POLR2L"
"301","Formation of Incision Complex in GG-NER",0.426476749057394,0.480682302246412,-0.139664446721311,-0.62992411865716,2035,42,"XPC, XPA, USP45, UBE2V2, UBE2N, UBE2I, UBC, UBB, SUMO2, SUMO1, RPS27A, RPA3, RPA2, RPA1, RNF111, RBX1, RAD23B, RAD23A, PIAS3, PIAS1, PARP2, PARP1, MNAT1, GTF2H5, GTF2H4, GTF2H3, GTF2H2, GTF2H1, UBA52, ERCC5, ERCC4, ERCC3, ERCC2, ERCC1, DDB2, DDB1, CUL4B, CUL4A, CHD1L, CETN2, CDK7, CCNH"
"302","Formation of RNA Pol II elongation complex",0.263696682464455,0.359525464147853,0.210687274525244,0.626492028100139,1390,56,"AFF4, CCNH, CCNK, CCNT1, CCNT2, CDC73, CDK7, CDK9, CTDP1, CTR9, EAF1, EAF2, ELL, ELOA, ELOC, ERCC2, ERCC3, GTF2F1, GTF2F2, GTF2H1, GTF2H2, GTF2H3, GTF2H4, GTF2H5, IWS1, LEO1, MLLT1, MLLT3, MNAT1, NCBP1, NCBP2, NELFA, NELFB, NELFCD, NELFE, PAF1, POLR2A, POLR2B, POLR2C, POLR2D, POLR2E, POLR2F, POLR2G, POLR2H, POLR2I, POLR2J, POLR2K, POLR2L"
"303","Formation of TC-NER Pre-Incision Complex",0.390202058711399,0.452751273176919,0.144739530750304,0.44006323912564,2046,53,"AQR, CCNH, CDK7, COPS2, COPS3, COPS4, COPS5, COPS6, COPS7A, COPS7B, COPS8, CUL4A, CUL4B, DDB1, EP300, ERCC2, ERCC3, ERCC6, ERCC8, UBA52, GPS1, GTF2H1, GTF2H2, GTF2H3, GTF2H4, GTF2H5, HMGN1, ISY1, MNAT1, POLR2A, POLR2B, POLR2C, POLR2D, POLR2E, POLR2F, POLR2G, POLR2H, POLR2I, POLR2J, POLR2K, POLR2L, PPIE, PRPF19"
"304","Formation of a pool of free 40S subunits",0.178563818453015,0.327670681256273,-0.486678397301954,-1.88904015015105,837,70,"RPSA, RPS9, RPS8, RPS7, RPS5, RPS4X, RPS3A, RPS28, RPS27L, RPS27A, RPS25, RPS24, RPS21, RPS20, RPS19, RPS17, RPS16, RPS15A, RPS15, RPS14, RPS13, RPS12, RPS11, RPLP1, RPL8, RPL7A, RPL6, RPL5, RPL4, RPL3L, RPL38, RPL37A, RPL36, RPL35, RPL34, RPL32, RPL30, RPL3, RPL29, RPL28, RPL27, RPL26, RPL23, RPL22L1, RPL19, RPL18A, RPL18, RPL14, RPL13A, RPL12, RPL11, RPL10A, RPL10"
"305","Formation of the Early Elongation Complex",0.158880308880309,0.327670681256273,0.29280193939394,1.05961296879465,822,33,"CCNH, CDK7, CTDP1, ERCC2, ERCC3, GTF2F1, GTF2F2, GTF2H1, GTF2H2, GTF2H3, GTF2H4, GTF2H5, MNAT1, NCBP1, NCBP2, NELFA, NELFB, NELFCD, NELFE, POLR2A, POLR2B, POLR2C, POLR2D, POLR2E, POLR2F, POLR2G, POLR2H, POLR2I, POLR2J, POLR2K, POLR2L"
"306","Formation of the HIV-1 Early Elongation Complex",0.158880308880309,0.327670681256273,0.29280193939394,1.05961296879465,822,33,"CCNH, CDK7, CTDP1, ERCC2, ERCC3, GTF2F1, GTF2F2, GTF2H1, GTF2H2, GTF2H3, GTF2H4, GTF2H5, MNAT1, NCBP1, NCBP2, NELFA, NELFB, NELFCD, NELFE, POLR2A, POLR2B, POLR2C, POLR2D, POLR2E, POLR2F, POLR2G, POLR2H, POLR2I, POLR2J, POLR2K, POLR2L"
"307","Formation of the beta-catenin:TCF transactivating complex",0.278512396694215,0.369251946487719,-0.187953246310042,-0.868989502510018,1347,30,"TRRAP, TLE4, TLE3, TLE2, TLE1, TERT, TCF7L2, TCF7L1, TCF7, TCF4"
"308","Formation of the cornified envelope",0.436652460286711,0.48989898989899,0.162806074567016,0.598890865746563,2253,30,"CAPN1, CAPNS1, CSTA, DSC2, DSC3, DSG2, DSG3, DSG4, DSP, EVPL, FURIN, JUP, KAZN, KLK12, KLK8, LIPK, LIPM, LIPN, PCSK6, PERP, PKP1, PKP2, PKP4, PPL, PRSS8"
"309","Formation of the ternary complex, and subsequently, the 43S complex",0.105658801419921,0.327670681256273,-0.291973880870908,-1.31698682720674,505,41,"RPSA, RPS9, RPS8, RPS7, RPS5, RPS4X, RPS3A, RPS28, RPS27L, RPS27A, RPS25, RPS24, RPS21, RPS20, RPS19, RPS17, RPS16, RPS15A, RPS15, RPS14, RPS13, RPS12, RPS11"
"310","Formation of tubulin folding intermediates by CCT/TriC",0.0460579243765084,0.327670681256273,-0.42039641943734,-1.81668175579325,228,18,"TUBB6, TUBB4B, TUBB4A, TUBB2B, TUBB2A, TUBA8, TUBA4A, TUBA1C, TUBA1B"
"311","G alpha (12/13) signalling events",0.319220681903335,0.400612621850618,0.29495255008602,0.771282347440203,1703,74,"ABR, ADRA1A, ADRA1B, ADRA1D, AKAP13, ARHGEF1, ARHGEF10, ARHGEF10L, ARHGEF11, ARHGEF12, ARHGEF15, ARHGEF17, ARHGEF18, ARHGEF19, ARHGEF2, ARHGEF26, ARHGEF3, ARHGEF33, ARHGEF37, ARHGEF38, ARHGEF4, ARHGEF40, ARHGEF6, ARHGEF7, ARHGEF9, BTK, ECT2, FGD1, FGD2, FGD3, FGD4, GNA12, GNA13, GNB1, GNB3, GNB4, GNB5, GNG10, GNG11, GNG12, GNG13, GNG2, GNG3, GNG4, GNG7, GNG8, GNGT1, GNGT2"
"312","G alpha (i) signalling events",0.446874196038076,0.496887059428866,-0.868103737279171,-1.53595524574553,1736,287,"TTR"
"313","G alpha (q) signalling events",0.590751645306547,0.622668482724877,0.180713593711075,0.300268524583155,3410,175,"ABHD12, ABHD6, ADRA1A, ADRA1B, ADRA1D, AGT, AGTR1, ANXA1, APP, ARHGEF25, AVP, BDKRB1, BDKRB2, BTK, CCK, CCKBR, CCL23, CHRM1, CHRM3, CREB1, CYSLTR1, DAGLA, DAGLB, DGKA, DGKB, DGKD, DGKE, DGKG, DGKH, DGKI, DGKK, DGKQ, DGKZ, EDN1, EDNRA, EDNRB, EGFR, F2, F2R, F2RL2, F2RL3, FFAR1, FFAR4, FPR2, GHRL, GHSR, GNA11, GNA14, GNA15, GNB1, GNB3, GNB4, GNB5, GNG10, GNG11, GNG12, GNG13, GNG2, GNG3, GNG4, GNG7, GNG8, GNGT1, GNGT2, GNRH1, GNRHR, GPR143, GPR17, GPR39, GPR4, GPR68, GRB2, GRK2, GRK5, GRM1, GRM5, GRP, GRPR, HBEGF, HCRT, HCRTR1, HCRTR2, HRAS, HRH1, HTR2A, HTR2B, HTR2C, ITPR1, ITPR2, ITPR3, KALRN, KISS1R, KRAS, LPAR1, LPAR2, LPAR3, LPAR4, LPAR6, LTB4R2, MAPK1, MAPK3, MAPK7, MCHR1, MGLL, NMB, NMBR, NMU, NMUR1, NMUR2, NPFFR1, NPFFR2, NPS, NPSR1, NRAS, NTS, NTSR1, NTSR2, OPN4, OXT, OXTR, P2RY1, P2RY6, PIK3CA, PIK3R1, PIK3R2, PIK3R3, PLCB1, PLCB2, PLCB3, PLCB4, PRKCA, PRKCD, PRKCE, PRKCH, PRKCQ, PROK2, PROKR2, PTAFR, PTGER1, PTGFR, QRFP, QRFPR, RASGRP1, RASGRP2, RGS1, RGS13, RGS16, RGS17, RGS18, RGS19, RGS2, RGS21, RGS3, RGS4, RGS5, RGSL1"
"314","G alpha (s) signalling events",0.600826588599966,0.628962858114891,0.241537522975636,0.396055028391246,3488,181,"ADCY1, ADCY2, ADCY3, ADCY5, ADCY6, ADCY7, ADCY8, ADCY9, ADCYAP1, ADCYAP1R1, ADM, ADM2, ADORA2A, ADORA2B, ADRB1, ADRB2, ADRB3, ARRB1, ARRB2, AVP, CALCA, CALCB, CALCR, CALCRL, CRH, CRHR1, CRHR2, DRD1, DRD5, FSHR, GHRH, GIP, GIPR, GLP1R, GLP2R, PDE2A, GNAI1, GNAI2, GNAI3, GNAL, GNAS, GNAT3, GNAZ, GNB1, GNB3, GNB4, GNB5, GNG10, GNG11, GNG12, GNG13, GNG2, GNG3, GNG4, GNG7, GNG8, GNGT1, GNGT2, GPR176, GPR20, GPR25, GPR27, GPR39, GPR45, GPR83, GRK2, GRK3, GRK5, GRK6, HRH2, HTR4, HTR6, HTR7, LHCGR, MC2R, MC4R, MC5R, NPS, NPSR1, OR5M3, OR8J1, OR8J3, OR5V1, OR5L1, OR5L2, OR4S2, OR4C15, OR4C3, OR4B1, OR7C2, OR2W1, OR10V1, OR4D11, OR4D10, OR4D6, OR5A2, OR5B3, OR2C1, OR2AJ1, OR7E24, OR6P1, OR5AU1, OR10H5, OR10H2, OR2K2, OR13C8, OR8S1, OR10AD1, OR2T1, OR14C36, OR11L1, OR6Y1, OR2A5, OR5P2, OR52K2, OR52I2, OR52I1, OR51E1, OR2V1, OR2V2, OR51A7, OR51V1, OR51Q1, OR56B1, OR51B4, OR52E5, OR56A3, OR56B4, OR52B2, OR2AG1, OR2AG2, OR2T6, OR5D18, OR11H4, OR6S1, OR6C70, OR9K2, OR7G2, OR2H1, OR10G6, OR6X1, PDE10A, PDE11A, PDE1A, PDE1B, PDE3A, PDE3B, PDE4A, PDE4C, PDE4D, PDE7A, PDE7B, PDE8A, PDE8B"
"315","G alpha (z) signalling events",0.200459506031017,0.327670681256273,0.350440164421207,1.16906871938585,1046,44,"ADCY1, ADCY2, ADCY3, ADCY5, ADCY6, ADCY7, ADCY8, ADCY9, ADRA2A, ADRA2C, GNAI1, GNAI2, GNAI3, GNAS, GNAT3, GNAZ, GNB1, GNB3, GNB4, GNB5, GNG10, GNG11, GNG12, GNG13, GNG2, GNG3, GNG4, GNG7, GNG8, GNGT1, GNGT2"
"316","G beta:gamma signalling through BTK",0.0832003192338388,0.327670681256273,0.645569620253165,2.35827908600385,416,16,"BTK, GNB1, GNB3, GNB4, GNB5, GNG10, GNG11, GNG12, GNG13, GNG2, GNG3, GNG4, GNG7, GNG8, GNGT1, GNGT2"
"317","G beta:gamma signalling through CDC42",0.0942158616577221,0.327670681256273,0.590032679738562,2.17040578842962,473,18,"ARHGEF6, CDC42, GNB1, GNB3, GNB4, GNB5, GNG10, GNG11, GNG12, GNG13, GNG2, GNG3, GNG4, GNG7, GNG8, GNGT1, GNGT2"
"318","G beta:gamma signalling through PI3Kgamma",0.115528439283606,0.327670681256273,0.428147550784889,1.60055568135472,586,23,"AKT1, AKT2, AKT3, GNB1, GNB3, GNB4, GNB5, GNG10, GNG11, GNG12, GNG13, GNG2, GNG3, GNG4, GNG7, GNG8, GNGT1, GNGT2"
"319","G beta:gamma signalling through PLC beta",0.0948121645796064,0.327670681256273,0.478793691389599,1.76121871709889,476,18,"GNB1, GNB3, GNB4, GNB5, GNG10, GNG11, GNG12, GNG13, GNG2, GNG3, GNG4, GNG7, GNG8, GNGT1, GNGT2"
"320","G protein gated Potassium channels",0.107406667997604,0.327670681256273,0.569226833791648,2.11204492489852,537,21,"GABBR1, GABBR2, GNB1, GNB3, GNG10, GNG12, GNG2, GNG3, GNG4, GNG7, GNG8, GNGT1, GNGT2, KCNJ10, KCNJ12, KCNJ16, KCNJ2, KCNJ3, KCNJ4, KCNJ6, KCNJ9"
"321","G-protein activation",0.119575888474377,0.327670681256273,0.520708072150441,1.94261725098929,608,24,"GNAI1, GNAI2, GNAI3, GNAO1, GNAT3, GNAZ, GNB1, GNB3, GNB4, GNB5, GNG10, GNG11, GNG12, GNG13, GNG2, GNG3, GNG4, GNG7, GNG8, GNGT1, GNGT2"
"322","G-protein beta:gamma signalling",0.143742735373886,0.327670681256273,0.345572050166368,1.27120529656133,741,30,"AKT1, AKT2, AKT3, ARHGEF6, BTK, CDC42, GNB1, GNB3, GNB4, GNB5, GNG10, GNG11, GNG12, GNG13, GNG2, GNG3, GNG4, GNG7, GNG8, GNGT1, GNGT2"
"323","G-protein mediated events",0.219521531100478,0.32805933547467,0.336002562459962,1.07692032575654,1146,48,"ADCY1, ADCY2, ADCY3, ADCY5, ADCY6, ADCY7, ADCY8, ADCY9, AHCYL1, CALM1, CAMK2A, CAMK2B, CAMK2G, CAMK4, CAMKK1, CAMKK2, CREB1, GNAI1, GNAI2, GNAI3, GNAL, GNAO1, GNAT3, GNAZ, GRK2, ITPR1, ITPR2, ITPR3, KPNA2, MAPK1, PDE1A, PDE1B, PDE1C, PLA2G4A, PLCB1, PLCB2, PLCB3, PLCB4, PRKACA, PRKACB, PRKAR1A, PRKAR1B, PRKAR2A, PRKAR2B, PRKCA, PRKCD, PRKCG, PRKX"
"324","G0 and Early G1",0.234243078735519,0.336451557579615,0.225617603786861,0.847380569216707,1192,25,"CCNA1, CCNA2, CCNE1, CCNE2, CDC25A, CDC6, CDK2, DYRK1A, E2F1, E2F4, E2F5, HDAC1, LIN37, LIN52, LIN54, LIN9, MAX, MYBL2, MYC"
"325","G1 Phase",0.207241910631741,0.327670681256273,0.237267386010768,0.79536470848705,1075,43,"ABL1, CCND1, CCND2, CCND3, CCNH, CDK4, CDK6, CDK7, CDKN1A, CDKN1B, CDKN1C, CDKN2B, CDKN2C, CDKN2D, CKS1B, CUL1, E2F1, E2F2, E2F3, E2F4, E2F5"
"326","G1/S DNA Damage Checkpoints",0.162334895611419,0.327670681256273,-0.424939079133,-1.7133416383916,761,64,"ZNF385A, UBC, UBB, TP53, RPS27A, PSMF1, PSME4, PSME3, PSME2, PSME1, PSMD9, PSMD8, PSMD7, PSMD6, PSMD5, PSMD4, PSMD3, PSMD2, PSMD14, PSMD13, PSMD12, PSMD11, PSMD10, PSMD1, PSMC6, PSMC5, PSMC4, PSMC3, PSMC2, PSMC1, PSMB9, PSMB8, PSMB7, PSMB6, PSMB5, PSMB4, PSMB3, PSMB2, PSMB11, PSMB10, PSMB1, PSMA8, PSMA7, PSMA6, PSMA5, PSMA4, PSMA3, PSMA1"
"327","G1/S Transition",0.311872146118721,0.396022263651347,-0.217703727547801,-0.615509270895844,1365,125,"WEE1, UBC, UBB, TYMS, TK1, TFDP2, TFDP1, SKP2, SKP1, RRM2, RPS27A, RPA3, RPA2, RPA1, RBL2, RBL1, RB1, PTK6, PSMF1, PSME3, PSME2, PSME1, PSMD9, PSMD8, PSMD7, PSMD6, PSMD5, PSMD4, PSMD3, PSMD2, PSMD14, PSMD13, PSMD12, PSMD11, PSMD10, PSMD1, PSMC6, PSMC5, PSMC4, PSMC3, PSMC2, PSMC1, PSMB9, PSMB8, PSMB7, PSMB6, PSMB5, PSMB4, PSMB3, PSMB2, PSMB10, PSMB1, PSMA7, PSMA6, PSMA5, PSMA4, PSMA3, PSMA1, PRIM2, PRIM1, PPP2R3B, PPP2R1B, PPP2R1A, PPP2CB, PPP2CA, POLE4, POLE3, POLE2, POLE, POLA2, POLA1, PCNA, ORC6, ORC5, ORC4, ORC3, ORC2, ORC1"
"328","G1/S-Specific Transcription",0.556494399685596,0.592967716844732,0.155110818045823,0.58015842827866,2831,26,"CCNA1, CCNE1, CDC25A, CDC45, CDC6, DHFR, E2F1, E2F4, E2F5, E2F6, FBXO5, HDAC1, LIN37, LIN52, LIN54, LIN9"
"329","G2/M Checkpoints",0.313269493844049,0.396389347753142,-0.305602156114492,-0.862829865879657,1373,127,"YWHAZ, YWHAQ, YWHAH, YWHAG, YWHAE, YWHAB, WRN, WEE1, UIMC1, UBE2V2, UBE2N, UBC, UBB, TP53BP1, TP53, TOPBP1, TOP3A, SUMO1, SFN, RPS27A, RPA3, RPA2, RPA1, RNF168, RMI2, RMI1, RHNO1, RFC5, RFC4, RFC3, RFC2, RBBP8, RAD9B, RAD9A, RAD50, RAD17, RAD1, PSMF1, PSME4, PSME3, PSME2, PSME1, PSMD9, PSMD8, PSMD7, PSMD6, PSMD5, PSMD4, PSMD3, PSMD2, PSMD14, PSMD13, PSMD12, PSMD11, PSMD10, PSMD1, PSMC6, PSMC5, PSMC4, PSMC3, PSMC2, PSMC1, PSMB9, PSMB8, PSMB7, PSMB6, PSMB5, PSMB4, PSMB3, PSMB2, PSMB11, PSMB10, PSMB1, PSMA8, PSMA7, PSMA6, PSMA5, PSMA4, PSMA3, PSMA1"
"330","G2/M DNA damage checkpoint",0.143763213530655,0.327670681256273,-0.290036513628794,-1.22017717017307,679,57,"YWHAZ, YWHAQ, YWHAH, YWHAG, YWHAE, YWHAB, WRN, WEE1, UIMC1, UBE2V2, UBE2N, TP53BP1, TP53, TOPBP1, TOP3A, SUMO1, SFN, RPA3, RPA2, RPA1, RNF168, RMI2, RMI1, RHNO1, RFC5, RFC4, RFC3, RFC2, RBBP8, RAD9B, RAD9A, RAD50, RAD17, RAD1"
"331","G2/M Transition",0.589868147120056,0.622348595732369,0.176394914141999,0.293352094557581,3399,174,"ACTR1A, AJUBA, AKAP9, ALMS1, AURKA, BORA, BTRC, CCNA1, CCNA2, CCNB1, CCNB2, CCNH, CCP110, CDC25A, CDC25B, CDC25C, CDK11A, CDK11B, CDK2, CDK5RAP2, CDK7, CDKN1A, CENPF, CENPJ, CEP131, CEP135, CEP152, CEP164, CEP192, CEP250, CEP290, CEP41, CEP57, CEP63, CEP70, CEP72, CEP76, CEP78, CETN2, CKAP5, CLASP1, CNTRL, CSNK1D, CSNK1E, CUL1, DCTN1, DCTN2, DCTN3, DYNC1H1, DYNC1I2, DYNLL1, EP300, FBXL18, FBXL7, FBXW11, FGFR1OP, FKBPL, FOXM1, UBA52, HAUS1, HAUS2, HAUS3, HAUS4, HAUS6, HAUS7, HAUS8, HMMR, HSP90AB1, LCMT1, LIN37, LIN52, LIN54, LIN9, MAPRE1, MNAT1, MYBL2, MZT1, MZT2A, MZT2B, NDE1, NEDD1, NINL, NME7, ODF2, OFD1, OPTN, PAFAH1B1, PCM1, PCNT, PHLDA1, PKMYT1, PLK1, PLK4, PPME1, PPP1CB, PPP1R12A, PPP1R12B, PPP2CA, PPP2CB, PPP2R1A, PPP2R1B, PPP2R2A, PPP2R3B, PRKACA, PRKAR2B, PSMA1, PSMA3, PSMA4, PSMA5, PSMA6, PSMA7, PSMA8, PSMB1, PSMB10, PSMB11, PSMB2, PSMB3, PSMB4, PSMB5, PSMB6, PSMB7, PSMB8, PSMB9, PSMC1, PSMC2, PSMC3, PSMC4, PSMC5, PSMC6, PSMD1, PSMD10, PSMD11, PSMD12, PSMD13, PSMD14, PSMD2, PSMD3, PSMD4, PSMD5, PSMD6, PSMD7, PSMD8, PSMD9, PSME1, PSME2, PSME3, PSME4, PSMF1"
"332","GAB1 signalosome",0.66804979253112,0.691131804123425,0.182143237656886,0.661592013911251,3380,15,"BTC, CSK, EGF, EGFR, EREG, GAB1, GRB2, HBEGF, PAG1, PIK3CA, PIK3R1, PTPN11, PXN"
