"","pathway","pval","padj","ES","NES","nMoreExtreme","size","leadingEdge"
"500","Mitotic G1 phase and G1/S transition",0.60367107195301,0.885384238864415,0.26875725534249,0.935728940714161,4110,135,"E2F3, UBB, PSMC2, TOP2A, MAX, PSMD1, PPP2R3B, PSMD4, CCND2, AKT3, PSMA6, PSMA3, PSME3, PSME1, PSMD6, E2F1, ORC3, E2F4, ABL1, CUL1, PSMD11, PSMD13, DYRK1A, PSMB2, PSMB4, AKT2, CDK6, PSMD3, PSMB7, PSMC6, PSMB6, ORC4, UBC, PSMB10, RPA1, DHFR, PSMC3, PCNA, E2F5, PSMB5, FBXO5, PPP2CA, MCM3, LIN9, POLA2, PSMB3, CDK1"
"501","Mitotic G2-G2/M phases",0.00687974774258277,0.254059255922521,0.403630008646562,1.44667693690378,47,170,"E2F3, ALMS1, CEP41, MAPRE1, UBB, CCP110, DCTN3, PPP1CB, PSMC2, TUBB, BTRC, YWHAE, PPP1R12A, TUBG1, PSMD1, PPP2R3B, TUBB4A, PSMD4, CSNK1E, PSMA6, PSMA3, PSME3, CCNB2, PPME1, CKAP5, PSME1, CEP76, DCTN1, PSMD6, TUBA4A, BORA, E2F1, LCMT1, CNTRL, PCNT, FBXW11, TUBGCP4, FGFR1OP, RBX1, CUL1, PSMD11, PSMD13, TUBGCP3, AKAP9, TUBGCP6, PSMB2, MZT1, CEP192, CDC25B, PSMB4, PRKACA, DCTN2, PSMD3, TUBB4B, XPO1, ACTR1A, PSMB7, PAFAH1B1, PSMC6, PSMB6, HSP90AB1, CENPJ, DYNLL1, UBC, RAB8A, PSMB10"
"502","Mitotic Metaphase and Anaphase",0.301731601731602,0.683320889331342,0.301941235770168,1.07822471656658,2090,165,"MAPRE1, UBB, CENPC, UBE2D1, CLASP2, SMC1A, PSMC2, ANAPC16, NUP98, NDEL1, PSMD1, PSMD4, LEMD3, PSMA6, PSMA3, PSME3, CKAP5, PSME1, VRK1, SEH1L, ANAPC5, PSMD6, ANAPC2, PDS5A, CDC23, DYNC1LI1, AHCTF1, PPP2R5C, PSMD11, PSMD13, PPP2R5D, PSMB2, PSMB4, SKA2, BIRC5, CENPN, DYNLL2, NDC80, PSMD3, PTTG1, ZWINT, XPO1, CENPO, TMPO, PSMB7, PAFAH1B1, PSMC6, PSMB6, DYNLL1, NUP107, UBC, PSMB10, ANAPC1, RANBP2, CENPA, LMNA, ANKLE2, PSMC3"
"503","Mitotic Prometaphase",0.281035469107552,0.656383780905874,0.301868834855051,1.08427447257942,1964,173,"ALMS1, CEP41, MAPRE1, CCP110, CENPC, DCTN3, CLASP2, SMC1A, TUBB, YWHAE, NUP98, NDEL1, TUBG1, SMC2, TUBB4A, CSNK2A1, CSNK1E, CCNB2, CKAP5, CEP76, DCTN1, SEH1L, TUBA4A, PDS5A, DYNC1LI1, AHCTF1, NCAPD2, CNTRL, PCNT, TUBGCP4, FGFR1OP, PPP2R5C, TUBGCP3, AKAP9, PPP2R5D, TUBGCP6, MZT1, CEP192, SKA2, BIRC5, CENPN, PRKACA, DYNLL2, DCTN2, NDC80, ZWINT, TUBB4B, XPO1, CENPO, ACTR1A"
"504","Mitotic Prophase",0.020650331329943,0.348109078666816,0.454942071013746,1.46405700703982,133,77,"PRKCA, PRKCB, LPIN2, NCAPG2, NUP153, ENSA, NUP98, LPIN1, SMC2, LEMD3, POM121, POM121C, CCNB2, VRK1, SEH1L, NCAPD3, KMT5A, RAB1B, NUP205, NUP155, RAB2A, MAPK3, H3-3A, RAB1A, PPP2R2D, USO1, RAE1, TMPO, PHF8, SET"
"505","Mitotic Spindle Checkpoint",0.752310256021815,0.944514041131642,0.257841079770449,0.860572973140185,4965,99,"MAPRE1, CENPC, UBE2D1, CLASP2, ANAPC16, NUP98, NDEL1, CKAP5, SEH1L, ANAPC5, ANAPC2, CDC23, DYNC1LI1, AHCTF1, PPP2R5C, PPP2R5D, SKA2, BIRC5, CENPN, DYNLL2, NDC80, ZWINT, XPO1, CENPO, PAFAH1B1, DYNLL1, NUP107, ANAPC1, RANBP2, CENPA"
"506","Molecules associated with elastic fibres",0.917161226508407,0.997950766135466,-0.240802664849671,-0.670501850899733,3708,26,"MFAP1, ITGB8, ITGAV, TGFB3, EFEMP1, LTBP1, FBLN2, LTBP4"
"507","Muscle contraction",0.00358773646444879,0.185485975212003,-0.37871625139684,-1.47109261719896,10,167,"KCND2, CACNA2D3, KCNIP4, SORBS1, FGF14, DMD, CACNA1C, TMOD1, CACNG3, CACNB2, CACNG2, GUCY1A2, CACNG4, KCNIP3, ITPR1, SCN2B, KCND3, SCN3A, NOS1, FXYD7, ATP2B1, CAMK2A, CACNA1D, ATP1A3, ATP2B4, ATP2B3, CAMK2G, SCN3B, RYR1"
"508","MyD88 cascade initiated on plasma membrane",0.723531081464661,0.935040032685428,-0.255667091832649,-0.874442332972659,2548,74,"RPS6KA5, MEF2C, RIPK2, PELI1, MAP2K6, ATF1, MAPK8, PELI2, MAP2K1, MAP2K4, TRAF6, RPS6KA3, MAPKAPK2, MAPK11, RPS6KA2, TAB3, TAB2, TNIP2"
"509","MyD88 dependent cascade initiated on endosome",0.741750358680057,0.939554767080899,-0.252650662276659,-0.875445894206347,2584,79,"RPS6KA5, MEF2C, RIPK2, PELI1, MAP2K6, ATF1, MAPK8, PELI2, MAP2K1, MAP2K4, TRAF6, RPS6KA3, MAPKAPK2, MAPK11, RPS6KA2, TAB3, TAB2, TNIP2"
"510","MyD88-independent TLR4 cascade",0.600768049155146,0.884891969838206,0.284669208134006,0.926620105069975,3910,83,"TANK, UBB, UBE2D2, UBE2D3, UBE2D1, BTRC, MEF2A, APP, TBK1, IKBKB, JUN, IKBKG, VRK3, FBXW11, CUL1, MAPK3, PPP2R5D, TAB1, IRF3, RIPK1, NFKBIA, NFKB1, ELK1, DUSP6, TRAF3, NFKB2, MAPK10, DUSP7, UBC, MAPK7, CREB1"
"511","MyD88:MAL(TIRAP) cascade initiated on plasma membrane",0.784207525655644,0.955550770285231,-0.243699090629687,-0.851138388100608,2750,81,"RPS6KA5, MEF2C, RIPK2, PELI1, MAP2K6, ATF1, MAPK8, PELI2, MAP2K1, MAP2K4, TRAF6, RPS6KA3, MAPKAPK2, MAPK11, RPS6KA2, TAB3, TAB2, TNIP2"
"512","Myogenesis",0.227654569892473,0.623622047244095,0.459758132594059,1.19931246753828,1354,25,"TCF4, TCF12, SPAG9, CDC42, NEO1, MEF2A, TCF3, BOC"
"513","N-Glycan antennae elongation",0.189617021276596,0.587017964071856,0.541111474290749,1.27087452891334,1113,15,"MGAT4C, ST6GAL1, MGAT5, B4GALT5, ST8SIA3, MGAT4B, ST8SIA2, B4GALT6, B4GALT3, B4GALT2"
"514","N-glycan antennae elongation in the medial/trans-Golgi",0.0589915966386555,0.469210084033613,0.564219951779489,1.44673441823833,350,23,"MGAT4C, MAN2A1, CHST8, ST6GAL1, MGAT5, B4GALT5, CHST10, ST8SIA3, MGAT4B"
"515","N-glycan trimming in the ER and Calnexin/Calreticulin cycle",0.554731289152654,0.8630132030033,0.340057736365049,0.938810781532729,3364,33,"CANX, UBB, CALR, AMFR, RAD23B, PDIA3, UGGT2, EDEM3, OS9, SYVN1, UBC, EDEM2"
"516","NCAM signaling for neurite out-growth",0.233920914721296,0.626040090386309,0.391574974169068,1.16571216736004,1472,49,"COL6A3, GFRA2, CACNA1G, GFRA1, CNTN2, CACNA1I, ST8SIA4, COL9A1, NCAM1, FYN, FGFR1, NCAN, COL4A3, CACNB4, SPTBN1, MAPK3"
"517","NCAM1 interactions",0.0780656874071629,0.482987599510104,0.508796865023503,1.38863630009962,472,31,"COL6A3, GFRA2, CACNA1G, GFRA1, CNTN2, CACNA1I, ST8SIA4, COL9A1, NCAM1, NCAN, COL4A3, CACNB4"
"518","NEP/NS2 Interacts with the Cellular Export Machinery",0.569073524563139,0.866718477551006,0.340800728452041,0.925855952722752,3451,30,"NUP153, NUP98, POM121, POM121C, SEH1L, NUP205, NUP155, RAE1, XPO1, NUP107, RANBP2, NUP42, NUP188, NUP93, SEC13"
"519","NIK-->noncanonical NF-kB signaling",0.040082057756036,0.443410852713178,0.474487745462397,1.43471107408703,253,54,"UBB, PSMC2, BTRC, PSMD1, PSMD4, PSMA6, PSMA3, PSME3, PSME1, PSMD6, FBXW11, CUL1, PSMD11, PSMD13, RELB, PSMB2, PSMB4, PSMD3, PSMB7, NFKB2, PSMC6, PSMB6, UBC, PSMB10, PSMC3, CHUK, PSMB5, PSME4"
"520","NOD1/2 Signaling Pathway",0.708456973293769,0.930465067005668,-0.300418416049578,-0.83649864976103,2864,26,"RIPK2, CYLD, MAP2K6, TRAF6, MAPK11, TAB3, TAB2"
"521","NOTCH1 Intracellular Domain Regulates Transcription",0.108194622279129,0.5298226810327,0.443341817870337,1.30497235270006,675,46,"MAML3, HDAC9, UBB, NCOR2, HDAC5, HDAC4, TLE4, KAT2B, HDAC3, RBX1, CUL1, HDAC2, TBL1X, RBPJ, TLE3, NCOR1"
"522","NOTCH2 Activation and Transmission of Signal to the Nucleus",0.236024844720497,0.627377093678647,0.471494961256852,1.20031570581638,1405,22,"UBB, ADAM10, MIB1, NEURL1, NCSTN, PSEN1, UBC, PSENEN"
"523","NOTCH3 Activation and Transmission of Signal to the Nucleus",0.0512432795698925,0.453455970815384,0.561675219390008,1.46517058767617,304,25,"EGFR, UBB, ADAM10, MIB1, NEURL1, NCSTN, PSEN1, YBX1, TACC3, UBC, PSENEN"
"524","NOTCH3 Intracellular Domain Regulates Transcription",0.422863857646466,0.781616475109023,0.40567544403758,1.03275463568969,2518,22,"MAML3, PBX1, KAT2B, RBPJ"
"525","NOTCH4 Intracellular Domain Regulates Transcription",0.774970323893505,0.955088575573164,0.313856902104305,0.764566954934316,4569,18,"MAML3, KAT2B, RBPJ"
"526","NR1H2 and NR1H3-mediated signaling",0.0283110966482265,0.390893065732187,0.531982202273917,1.50963468388408,173,38,"NCOA1, NCOR2, APOD, KDM1A, ANGPTL3, ABCG1, KDM3A, AGO1, TNRC6C, HDAC3, NR1H2, KDM1B, TBL1X, RXRA, NCOR1, KDM4A, TNRC6B, AGO4, APOE, TNRC6A, SREBF1"
"527","NR1H3 & NR1H2 regulate gene expression linked to cholesterol transport and efflux",0.0364746657864334,0.442224646338718,0.549002372656768,1.49836737590117,220,31,"NCOA1, NCOR2, APOD, KDM1A, ABCG1, KDM3A, AGO1, TNRC6C, HDAC3, NR1H2, KDM1B, TBL1X, RXRA, NCOR1, KDM4A, TNRC6B, AGO4, APOE, TNRC6A"
"528","NRAGE signals death through JNK",0.661748633879781,0.920356747355,-0.275546123976342,-0.886307573727387,2421,53,"TIAM1, AKAP13, PREX1, VAV3, RASGRF2, MCF2, MAPK8, RAC1, NGEF"
"529","NRIF signals cell death from the nucleus",0.631233276575043,0.895507906985839,-0.348889112939188,-0.867329754490968,2594,16,"ITGB3BP, MAPK8, SQSTM1, TRAF6"
"530","NS1 Mediated Effects on Host Pathways",0.503486298037944,0.834772867737948,0.340239628418011,0.969671610233728,3104,39,"KPNA4, NUP153, NUP98, POM121, POM121C, SEH1L, NUP205, NUP155, RAE1, KPNB1, NUP107, RANBP2, NUP42, NUP188, NUP93, KPNA2, SEC13, KPNA3, NUP50"
"531","Neddylation",0.0377568017767907,0.442224646338718,0.351713080445175,1.29427179549355,271,216,"KLHL5, TULP4, UBB, CUL4A, UBE2D2, UBE2D3, UBE2D1, PSMC2, BTRC, DCAF4, DCUN1D3, FBXO10, DCAF11, PSMD1, COPS2, DDB1, PSMD4, PSMA6, PSMA3, PSME3, WSB1, FBXL3, PSME1, ZBTB16, FBXO21, FBXL19, FBXL4, SENP8, FBXW4, WSB2, PSMD6, UBXN7, FBXL12, UCHL3, FBXW11, RBX1, CUL1, COMMD6, FBXL20, PSMD11, PSMD13, ELOC, FBXW2, COPS4, FBXL15, GAN, ASB12, PSMB2, FBXO9, KLHL41, PSMB4, FEM1A, CAND1, BIRC5, FBXW8, FBXO11, FBXO17, COMMD7, FEM1C, PSMD3, FBXW5, PUM2, PSMB7, KEAP1, FBXO30, FBXL13, KCTD7, SPSB4, PSMC6, PSMB6, CUL7"
"532","Nef-mediates down modulation of cell surface receptors by recruiting them to clathrin adapters",0.912058465286236,0.997950766135466,-0.253424925526468,-0.649208723381615,3743,18,"AP1S1, AP1B1, AP1M1, ATP6V1H, AP1S3"
"533","Negative epigenetic regulation of rRNA expression",0.945018274273002,1,0.229062379667835,0.683536571224036,5946,50,"POLR2F, ARID4B, TAF1B, POLR1D, POLR2E, SAP18, H3-3A, HDAC2, MBD2, ERCC3, POLR1A"
"534","Negative regulation of FGFR1 signaling",0.516619811476765,0.834772867737948,0.35705055622448,0.96257684656771,3123,29,"FRS2, UBB, FGFR1, FGF9, FGF1, MAPK3"
"535","Negative regulation of FGFR2 signaling",0.413434560158442,0.777516380655226,0.379506054636733,1.03576873169573,2504,31,"FGFR2, FRS2, UBB, FGF9, FGF1, MAPK3"
"536","Negative regulation of FGFR3 signaling",0.671221463089485,0.920356747355,0.322595813497336,0.854616836277656,4027,27,"FRS2, UBB, FGF9, FGF1, MAPK3, UBC, FGF16, BRAF, PPP2CA"
"537","Negative regulation of FGFR4 signaling",0.672054657557074,0.920356747355,0.322478966983268,0.854307287938823,4032,27,"FRS2, UBB, FGF9, FGF1, MAPK3, UBC, FGF16, BRAF, PPP2CA"
"538","Negative regulation of MAPK pathway",0.516228497241155,0.834772867737948,0.335358425102788,0.959945749693653,3180,40,"UBB, DUSP8, DUSP16, PPP5C, PPP2R5C, MAPK3, PPP2R5D, DUSP6, KRAS, DUSP7, UBC, PAQR3, BRAF, PPP2R5A, PPP2CA, PPP2R5E, PPP2CB, HRAS, KSR1"
"539","Negative regulation of MET activity",0.598688634835239,0.884891969838206,0.357654205387346,0.900750148856257,3560,21,"MET, UBB, STAM2, USP8, SH3KBP1, PTPN1, STAM, EPS15, SH3GL1, UBC"
"540","Negative regulation of NMDA receptor-mediated neuronal transmission",0.0344064880806095,0.442224646338718,-0.598397929654596,-1.5703928404294,139,20,"GRIN2A, GRIN1, LRRC7, DLG2, CAMK4, CAMK1, DLG4, CAMK2A, CAMK2G"
"541","Negative regulation of NOTCH4 signaling",0.052915938344192,0.453455970815384,0.467062551924358,1.39374407858889,332,50,"UBB, PSMC2, PSMD1, PSMD4, PSMA6, PSMA3, PSME3, PSME1, PSMD6, RBX1, CUL1, PSMD11, PSMD13, PSMB2, PSMB4, PSMD3, PSMB7, PSMC6, PSMB6, TACC3, UBC, PSMB10"
"542","Negative regulation of the PI3K/AKT network",0.403880070546737,0.776689908196131,-0.283038327694987,-1.01268846189673,1373,96,"NRG1, ERBB4, ESR2, ESR1, IL1RAP, RAC1, PTEN, PHLPP2, SRC, GRB2, THEM4, FGF10, IRS2, PIK3CB, TRAF6"
"543","Negative regulators of DDX58/IFIH1 signaling",0.177973129872284,0.5764,0.467429299610553,1.25030691053111,1072,28,"TAX1BP1, ITCH, UBB, UBE2D2, UBE2D3, UBE2D1, TBK1, UBE2K, IRF3, DDX58, OTUD5, TRAF3, ATG5, UBC"
"544","Nephrin family interactions",0.303463349024882,0.683320889331342,0.451001478397553,1.1358447424406,1804,21,"PIK3CA, MAGI2, FYN, PIK3R1, CD2AP, NCK1, KIRREL2, ACTN4, NPHS1, NCK2, SPTBN1"
"545","Netrin-1 signaling",0.254296455424275,0.630407976793492,-0.35790193549228,-1.13115234769856,946,48,"UNC5D, ABLIM2, SLIT2, ROBO1, UNC5C, SLIT3, TRPC5, MAPK8, ABLIM1, RAC1"
"546","Neurexins and neuroligins",0.0366748166259169,0.442224646338718,-0.44426164781086,-1.44162695989235,134,55,"GRIN2A, SYT10, GRIN1, LRRTM4, DLG2, DLGAP2, NLGN1, SYT1, STXBP1, SIPA1L1, LRRTM3, DLGAP3, DLG4, NRXN3, LIN7B"
"547","Neurodegenerative Diseases",0.287881341648407,0.661531748323547,0.462460961597893,1.15293937651608,1707,20,"YWHAE, APP, JUN, PRDX1, CAPN2, CAPNS1, CDC25B"
"548","Neuronal System",0.000427715996578272,0.0626362975527017,-0.432738201564042,-1.81662655198124,0,349,"NRG1, KCND2, CACNA2D3, KCNC2, IL1RAPL1, GRIK1, GLRA3, GRIN2A, KCNQ3, ERBB4, PLCB1, HCN1, SYN2, KCNMA1, GRIK2, KCNQ5, SYT10, LRFN2, GRIN1, GABRB3, ADCY5, LRRTM4, GRIA4, KCNH7, LRRC7, DLG2, DLGAP2, NLGN1, IL1RAP, NSF, GNG7, CACNG3, SYT1, CACNB2, GRIA3, CACNG2, GLRA2, CACNA1E, CHRNA7, ADCY9, CACNG4, KCNMB4, KCNH3, CAMK4, NPTN, STXBP1, SLC38A2, KIF17, CAMK1, KCND3, SIPA1L1, LRRTM3, GABRA5, ADCY8, KCNH1, PRKAR1B, RASGRF2, DLGAP3, DLG4, ARL6IP5, GABRA4, CAMK2A, GABRG3, ALDH5A1, RAC1, NRXN3, LIN7B, PPFIBP1, KCNB1, GRIN3A, CAMK2G, SRC, PTPRF, GABRA1, PRKCG, KCNH4, DLGAP1, CAMKK1, GABRA3"
"549","Neurotransmitter receptors and postsynaptic signal transmission",0.000325839035516455,0.061437908496732,-0.45422010119905,-1.75239404627186,0,162,"NRG1, GRIK1, GLRA3, GRIN2A, ERBB4, PLCB1, GRIK2, GRIN1, GABRB3, ADCY5, GRIA4, LRRC7, DLG2, NSF, GNG7, CACNG3, GRIA3, CACNG2, GLRA2, CHRNA7, ADCY9, CACNG4, CAMK4, NPTN, KIF17, CAMK1, GABRA5, ADCY8, PRKAR1B, RASGRF2, DLG4, GABRA4, CAMK2A, GABRG3, RAC1, LIN7B, GRIN3A, CAMK2G, SRC, GABRA1, PRKCG, CAMKK1, GABRA3, GNAI2, RPS6KA6, PRKAR1A, KCNJ9"
"550","Neurotransmitter release cycle",0.523949692266524,0.839944157835017,-0.306601025661727,-0.952665220900312,1957,45,"SYN2, SYT1, STXBP1, SLC38A2, ARL6IP5, ALDH5A1, LIN7B"
"551","Neutrophil degranulation",0.128001043841336,0.543207373271889,0.298836010744037,1.14896577014127,980,349,"FTH1, ATG7, FRMPD3, CYFIP1, BRI3, RAB10, ATP6V0C, SLC44A2, GAA, ARPC5, ADAM10, GGH, PKM, XRCC5, PSMC2, TUBB, KCNAB2, PRKCD, RAP1A, B2M, PSMD1, UBR4, LAMP1, RAB3A, PYGB, GDI2, NFASC, SCAMP1, LAMP2, RAB31, ACTR10, CST3, HSPA8, APRT, IST1, CTSS, ERP44, SYNGR1, DDOST, XRCC6, PSMD6, C6orf120, PGRMC1, CKAP4, DNAJC13, CD63, CCT8, DOCK2, DYNC1LI1, ASAH1, APAF1, DPP7, LAMTOR1, HUWE1, SURF4, DBNL, NCSTN, PSMD11, PSMD13, PSEN1, CD300A, TMEM30A, NIT2, DEGS1, PTGES2, CTSA, GRN, CSTB, IDH1, CTSZ, SRP14, CAND1, DNAJC5, NFKB1, ROCK1, CPNE3, TYROBP, STOM, TIMP2, ACTR2, ALDOA, KPNB1, ARL8A, PSMD3, TUBB4B, AMPD3, CAP1, ACTR1B, GLB1, PSMB7, SLCO4C1, HSP90AB1, RHOF, ALAD, APEH, PRDX6, COMMD9, DYNLL1, TOM1"
"552","Nicotinamide salvaging",0.987076322848086,1,-0.201857022455864,-0.508765352142385,4047,17,"RNLS, PTGIS"
"553","Nicotinate metabolism",0.944108761329305,1,0.241003785881988,0.632444451574155,5624,26,"NADK2, NMRK1, NAXD, PARP16, NADK, NAMPT, PARP9, NADSYN1, NAPRT, NUDT12"
"554","Nitric oxide stimulates guanylate cyclase",0.000243961941937058,0.061437908496732,-0.79815705510632,-2.07151019363435,0,19,"PDE1A, KCNMA1, PDE11A, PRKG1, GUCY1A2, ITPR1, KCNMB4, PDE1B, PDE10A, NOS1"
"555","NoRC negatively regulates rRNA expression",0.880921895006402,0.991156952596975,0.250782280452087,0.741069628792376,5503,47,"POLR2F, ARID4B, TAF1B, POLR1D, POLR2E, SAP18, H3-3A, HDAC2, MBD2, ERCC3, POLR1A"
"556","Non-integrin membrane-ECM interactions",0.419019798766634,0.780660309774234,0.358363290585159,1.02579596006277,2581,40,"PRKCA, NTN4, PDGFA, ITGB5, DDR2, HSPG2, NRXN1, CASK, SDC3"
"557","Nonhomologous End-Joining (NHEJ)",0.73178753494491,0.936470682095343,0.300274255755032,0.82411678469857,4449,32,"TP53BP1, RAD50, XRCC5, MDC1, XRCC6, BABAM1, NSD2"
"558","Nonsense Mediated Decay (NMD) enhanced by the Exon Junction Complex (EJC)",0.677572964669739,0.920356747355,0.272995925049618,0.888622673352403,4410,83,"SMG1, RPS4X, EIF4G1, RPL19, RPS15A, RPL14, RPS20, SMG7, RPS16, RPL32, RPS5, RPL8, UPF3B, RPS13, RPL29, CASC3, RPS28, RPLP1, RPS9, RPS15, NCBP1, ETF1, RPS14, RPL35"
"559","Nonsense Mediated Decay (NMD) independent of the Exon Junction Complex (EJC)",0.533426834969612,0.846058934447618,0.306851120765354,0.95615224075241,3422,63,"RPS4X, EIF4G1, RPL19, RPS15A, RPL14, RPS20, RPS16, RPL32, RPS5, RPL8, RPS13, RPL29, RPS28, RPLP1, RPS9, RPS15, NCBP1, ETF1, RPS14, RPL35, RPL3"
"560","Nonsense-Mediated Decay (NMD)",0.677572964669739,0.920356747355,0.272995925049618,0.888622673352403,4410,83,"SMG1, RPS4X, EIF4G1, RPL19, RPS15A, RPL14, RPS20, SMG7, RPS16, RPL32, RPS5, RPL8, UPF3B, RPS13, RPL29, CASC3, RPS28, RPLP1, RPS9, RPS15, NCBP1, ETF1, RPS14, RPL35"
"561","Norepinephrine Neurotransmitter Release Cycle",0.816873933187028,0.968813005107741,-0.292112890485255,-0.736248438547911,3349,17,"SYT1, STXBP1"
"562","Notch-HLH transcription pathway",0.129811698050325,0.543207373271889,0.496519530934736,1.31537339582063,778,27,"MAML3, HDAC9, NCOR2, HDAC5, HDAC4, KAT2B, HDAC3, HDAC2, TBL1X, RBPJ"
"563","Nuclear Envelope Breakdown",0.0373193584246467,0.442224646338718,0.485660518398738,1.44580326336012,234,49,"PRKCA, PRKCB, LPIN2, NUP153, NUP98, LPIN1, LEMD3, POM121, POM121C, CCNB2, VRK1, SEH1L, NUP205, NUP155"
"564","Nuclear Events (kinase and transcription factor activation)",0.359489946051986,0.739545098039216,-0.389184480113286,-1.06601147297607,1465,24,"RPS6KA5, MEF2C, ATF1, RPS6KA3, MAPKAPK2, MAPK11, RPS6KA2"
"565","Nuclear Pore Complex (NPC) Disassembly",0.609760105159382,0.886818803114043,0.326042064761579,0.9050257115736,3710,34,"NUP153, NUP98, POM121, POM121C, CCNB2, SEH1L, NUP205, NUP155, RAE1, NUP107, RANBP2, NUP42, NUP188, NUP93, SEC13, CDK1, NUP50"
"566","Nuclear Receptor transcription pathway",0.281216648879402,0.656383780905874,-0.360179016687706,-1.11453491551448,1053,44,"RARB, ESR2, THRB, ESR1, NR3C1, ESRRA, AR, NR1D2, RXRG, PPARG, NR1D1"
"567","Nuclear import of Rev protein",0.500907740551246,0.834772867737948,0.357036535594871,0.97444368837836,3034,31,"NUP153, NUP98, POM121, POM121C, SEH1L, NUP205, NUP155, RCC1, RAE1, KPNB1, NUP107, RANBP2, NUP42, NUP188, NUP93, SEC13"
"568","Nuclear signaling by ERBB4",0.00889227642276423,0.270346177039889,-0.589090684219508,-1.68159377321406,34,30,"NRG1, ERBB4, ESR1, STMN1"
"569","Nucleobase catabolism",0.0899390243902439,0.490279753437648,-0.479070376887911,-1.36753437846904,353,30,"DPYD, GDA, ENTPD7, ENTPD3, ITPA, NUDT9"
"570","Nucleosome assembly",0.780957079427726,0.955550770285231,-0.292561504404886,-0.775318676436679,3165,21,"ITGB3BP, CENPP, SMARCA5, RUVBL1"
"571","Nucleotide Excision Repair",0.999549278846154,1,0.17260963872416,0.583444965025119,6652,108,"ACTB, POLR2F, UBB, CUL4A, RAD23B, COPS2, DDB1, POLR2E, XPA, RBX1, COPS4, ERCC5, ERCC3, INO80B, POLD4, PARP2, INO80E, INO80, UBC, TFPT, ELL, RPA1, PARP1, XPC, XAB2, POLD1, PCNA, YY1, COPS3, LIG1, ERCC6"
"572","Nucleotide salvage",0.953649081409068,1,0.23846922955596,0.594516267692183,5657,20,"ADAL, APRT, UCKL1, UCK2, UPP2, AMPD3, UCK1, GMPR, DCK, TYMP, HPRT1, TK1"
"573","Nucleotide-binding domain, leucine rich repeat containing receptor (NLR) signaling pathways",0.447233770386952,0.802846733646022,0.345438148440003,1.00906944499311,2796,44,"ITCH, SUGT1, APP, P2RX7, IKBKB, BCL2L1, PANX1, IKBKG, BCL2, TAB1, NFKB1, AIM2, NFKB2, HSP90AB1"
"574","O-glycosylation of TSR domain-containing proteins",0.149307253463733,0.544781405033639,0.453722177976223,1.26924032221614,915,35,"SEMA5A, ADAMTSL1, SPON1, ADAMTS18, ADAMTS17, ADAMTS2, ADAMTS10, THSD7A, ADAMTS1"
"575","O-linked glycosylation",0.130441377218262,0.543207373271889,0.374280206324603,1.22934001459629,859,87,"SEMA5A, ADAMTSL1, GALNT17, SPON1, ADAMTS18, ADAMTS17, ST6GAL1, GALNT7, GALNT9, B3GALNT2, C1GALT1C1, ADAMTS2, GALNT10, ADAMTS10, THSD7A, B4GALT5, ADAMTS1, ST3GAL3"
"576","O-linked glycosylation of mucins",0.567658349328215,0.866718477551006,0.319518700453281,0.929356436556307,3548,43,"GALNT17, ST6GAL1, GALNT7, GALNT9, C1GALT1C1, GALNT10, B4GALT5, ST3GAL3, GALNT1, GALNT3, B3GNT8, GALNT16"
"577","Olfactory Signaling Pathway",0.0985892654451111,0.514855052880025,0.468371649541627,1.33484360334675,607,39,"REEP5, REEP3, GNAL, GNB1"
"578","Oncogene Induced Senescence",0.111404522198383,0.5298226810327,0.48710995742903,1.32944720285312,674,31,"E2F3, UBB, MDM2, AGO1, TNRC6C, E2F1, MAPK3, MDM4, SP1, CDK6, TNRC6B, AGO4, UBC, TNRC6A"
"579","Oncogenic MAPK signaling",0.822647793505412,0.968813005107741,-0.246140737121959,-0.814182641638418,2963,62,"CNKSR2, KDM7A, CAMK2A, CAMK2G, MAP2K2, ARRB2, SRC, MAP2K1, JAK2, RAF1, TENT4A, YWHAB, PAPSS1, APBB1IP"
"580","Opioid Signalling",0.0537542662116041,0.453455970815384,-0.385981176068632,-1.3376131546747,188,78,"PDE1A, PLCB1, OPRM1, PDE4B, ADCY5, PDE4D, GNG7, PPP3CA, ADCY9, ITPR1, PDE1B, CAMK4, ADCY8, PRKAR1B, CAMK2A, CAMK2G, PRKCG, CAMKK1, GNAI2, PRKAR1A, GNAZ"
"581","Orc1 removal from chromatin",0.199093608376309,0.600892138967221,0.381426910333909,1.18432953538207,1273,62,"UBB, PSMC2, PSMD1, PSMD4, PSMA6, PSMA3, PSME3, PSME1, PSMD6, ORC3, RBX1, CUL1, PSMD11, PSMD13, PSMB2, PSMB4, PSMD3, PSMB7, PSMC6, PSMB6, ORC4, UBC, PSMB10"
"582","Organelle biogenesis and maintenance",0.162448979591837,0.555399555399555,0.305295892330476,1.14448768268816,1193,263,"NCOA1, ALMS1, PDE6D, SMARCD3, RP2, CEP41, MAPRE1, CCP110, HSPA9, DCTN3, RAB3IP, TUBB, ATP5PO, CHD9, HCFC1, PKD2, CEP97, ATP5MC3, PKD1, YWHAE, MTX2, KIF3C, TUBG1, ATP5PF, CNGB1, TUBB4A, ARF4, CEP89, CSNK1E, CKAP5, SMO, ACSS2, CEP76, DCTN1, ATP5F1A, IFT88, CALM1, HDAC3, TGS1, IFT80, TUBA4A, CCT8, KIFAP3, CNTRL, CNGA2, PCNT, UNC119B, FGFR1OP, TMEM11, EXOC5, TMEM216, BBS5, CARM1, AKAP9, TBL1X, TCP1, GBF1, CEP192, RXRA, IMMT, MICOS10, CRTC3, PRKACA, DYNLL2, DCTN2, NCOR1, TUBB4B, IDH2, CCT3, ACTR1A, ASAP1, PRKAB2, CCT5, MICOS13, PAFAH1B1, BBS2, IFT20, SAMM50, ATP5MF, EXOC7, EXOC2, ARL6, MKS1, CENPJ, DYNLL1, KIF24, RAB8A"
"583","Other interleukin signaling",0.977306364084854,1,-0.205313171949782,-0.544101443062112,3961,21,"IL34, TXLNA, SNAP25, CASP3, CSF1, STX4, PTPRZ1, STXBP2, IL16, CSF1R, IL10RB, JAK1, CD4, PRTN3, STX1A, STX3, VAMP2, SDC1, CSF3R, TYK2, IFNLR1"
"584","Other semaphorin interactions",0.112146366254447,0.5298226810327,0.549916650148563,1.35613639706697,661,19,"SEMA5A, SEMA6D, PLXNA2, PLXNA4, SEMA4D, TYROBP, PLXNA1"
"585","Ovarian tumor domain proteases",0.854930725346373,0.978957220385548,0.263692894602889,0.737653283788604,5244,35,"UBB, UBE2D1, RNF128, OTUD7B, OTUD7A, IKBKG, RIPK1, DDX58, APC, OTUD5, TRAF3, UBC"
"586","Oxidative Stress Induced Senescence",0.204634413652732,0.600892138967221,0.386734619299808,1.18152388531054,1306,57,"MAP4K4, E2F3, UBB, MDM2, EZH2, SUZ12, PHC3, TNIK, JUN, AGO1, TNRC6C, EED, E2F1, MAPK3, H3-3A, MDM4, CDK6, TNRC6B, PHC1, AGO4, MAPK10, UBC, CBX4, TNRC6A"
"587","Oxygen-dependent proline hydroxylation of Hypoxia-inducible Factor Alpha",0.0167344385361276,0.34324790864427,0.49417327419006,1.51847078346558,106,59,"EGLN1, UBB, UBE2D2, UBE2D3, UBE2D1, PSMC2, PSMD1, PSMD4, PSMA6, PSMA3, PSME3, PSME1, PSMD6, RBX1, PSMD11, PSMD13, WTIP, ELOC, PSMB2, PSMB4, LIMD1, PSMD3, PSMB7, PSMC6, PSMB6, UBC, PSMB10, HIF1A, PSMC3"
"588","PCNA-Dependent Long Patch Base Excision Repair",0.975423937085279,1,-0.212720210847552,-0.558247747151211,3968,20,"RFC2, RFC4, POLE4, POLB, RFC5, POLE, POLD2, RPA2, POLE2, APEX1, RFC1, POLE3, RPA3, FEN1, RFC3, LIG1, PCNA, POLD1, RPA1, POLD4"
"589","PCP/CE pathway",0.169039963252182,0.563830070976633,0.364908741821177,1.19079631837934,1103,84,"PRKCA, PRKCB, ROR1, UBB, PSMC2, PSMD1, DAAM1, PSMD4, PSMA6, PSMA3, PSME3, FZD3, PSME1, SMURF2, PSMD6, RYK, PSMD11, PSMD13, PSMB2, PSMB4, PSMD3, FZD7, PSMB7, PFN1, PSMC6, PSMB6"
"590","PERK regulates gene expression",0.773871021496417,0.954871880939493,0.297925322095376,0.789260075807694,4643,27,"ASNS, CEBPG, KHSRP, HSPA5, PARN"
"591","PI Metabolism",0.742984890533457,0.939554767080899,0.265266859828327,0.855071208157127,4818,78,"PIK3CA, PTPN13, PLEKHA6, PIK3R1, PLEKHA1, GDE1, MTMR2, PNPLA7, SACM1L, FIG4, MTMR3, VAC14, PIP4K2A, GDPD3, PIP4K2B, PIKFYVE, MTMR7, PLEKHA3, ARF3, MTMR4, MTM1, PIK3R4, PIP4K2C, MTMR9"
"592","PI-3K cascade:FGFR1",0.0322197727658131,0.432665519998062,0.633941670537133,1.54430522126122,189,18,"PIK3CA, FRS2, FGFR1, PIK3R1, FGF9, FGF1"
"593","PI-3K cascade:FGFR2",0.0239339288724086,0.363936506677507,0.633144272685964,1.57846180242559,141,20,"PIK3CA, FGFR2, FRS2, PIK3R1, FGF9, FGF1"
"594","PI-3K cascade:FGFR3",0.0493973858428111,0.453455970815384,0.630938150643875,1.50205957100017,290,16,"PIK3CA, FRS2, PIK3R1, FGF9, FGF1"
"595","PI-3K cascade:FGFR4",0.0499066372432524,0.453455970815384,0.630688209785774,1.50146454269556,293,16,"PIK3CA, FRS2, PIK3R1, FGF9, FGF1"
"596","PI3K Cascade",0.155144433625446,0.552602355905388,0.438729868021581,1.25584103617462,955,40,"PIK3CA, FGFR2, FRS2, FGFR1, PIK3R1, PDE3B, FGF9, FGF1, AKT2, IRS1"
"597","PI3K/AKT Signaling in Cancer",0.109948437973916,0.5298226810327,0.37957047167691,1.25253350667269,724,90,"KITLG, EGFR, PIK3CA, FGFR2, FRS2, MET, GSK3B, NR4A1, MDM2, PDGFA, FYN, FGFR1, NRG3, PIK3R1, RICTOR, AKT3, AKT1S1, TGFA, RPS6KB2, FGF9"
"598","PI5P, PP2A and IER3 Regulate PI3K/AKT Signaling",0.566232191573204,0.866412265864446,0.286379012721734,0.943964413327009,3735,89,"KITLG, EGFR, PIK3CA, FGFR2, FRS2, MET, PDGFA, FYN, FGFR1, NRG3, PIK3R1, TGFA, FGF9, FGF1, PIP4K2A, PPP2R5C, MAPK3, PIP4K2B, PPP2R5D"
"599","PIP3 activates AKT signaling",0.15460256760448,0.552602355905388,0.309143569045201,1.15225968613437,1131,243,"KITLG, EGFR, PIK3CA, FGFR2, GATAD2B, FRS2, MET, CHD4, UBB, GSK3B, NR4A1, MDM2, PDGFA, HDAC5, FYN, PSMC2, FGFR1, NRG3, PIK3R1, KDM1A, RICTOR, EZH2, PSMD1, SUZ12, PHC3, PSMD4, TNKS2, CSNK2A1, AKT3, AKT1S1, TGFA, PSMA6, PSMA3, RPS6KB2, PSME3, JUN, FGF9, PSME1, AGO1, TNRC6C, HDAC3, EED, PSMD6, BAD, TNKS, FGF1, LAMTOR1, PIP4K2A, PPP2R5C, PSMD11, PSMD13, MAPK3, HDAC2, PIP4K2B, PPP2R5D, RRAGD, PSMB2, MTOR, PSMB4, AKT2, PRR5, CNOT6L"
