"","pathway","pval","padj","ES","NES","nMoreExtreme","size","leadingEdge"
"753","Regulation of PTEN stability and activity",0.170267379679144,0.327670681256273,-0.500242677319579,-1.98072584766373,795,67,"XIAP, WWP2, USP13, UBC, UBB, TRIM27, TNKS2, TNKS, STUB1, RPS27A, RNF146, PTEN, PSMF1, PSME4, PSME3, PSME2, PSME1, PSMD9, PSMD8, PSMD7, PSMD6, PSMD5, PSMD4, PSMD3, PSMD2, PSMD14, PSMD13, PSMD12, PSMD11, PSMD10, PSMD1, PSMC6, PSMC5, PSMC4, PSMC3, PSMC2, PSMC1, PSMB9, PSMB8, PSMB7, PSMB6, PSMB5, PSMB4, PSMB3, PSMB2, PSMB11, PSMB10, PSMB1, PSMA8, PSMA7, PSMA6, PSMA5, PSMA4, PSMA3, PSMA1, PREX2"
"754","Regulation of RAS by GAPs",0.164758269720102,0.327670681256273,-0.554326616602143,-2.22175337251923,776,66,"UBC, UBB, SYNGAP1, SPRED3, SPRED2, SPRED1, RPS27A, RBX1, RASAL3, RASAL2, RASAL1, RASA4, RASA3, RASA2, RASA1, PSMF1, PSME4, PSME3, PSME2, PSME1, PSMD9, PSMD8, PSMD7, PSMD6, PSMD5, PSMD4, PSMD3, PSMD2, PSMD14, PSMD13, PSMD12, PSMD11, PSMD10, PSMD1, PSMC6, PSMC5, PSMC4, PSMC3, PSMC2, PSMC1, PSMB9, PSMB8, PSMB7, PSMB6, PSMB5, PSMB4, PSMB3, PSMB2, PSMB11, PSMB10, PSMB1, PSMA8, PSMA7, PSMA6, PSMA5, PSMA4, PSMA3, PSMA1"
"755","Regulation of RUNX1 Expression and Activity",0.0986555950968762,0.327670681256273,0.378142664264734,1.3892283163721,498,17,"AGO1, AGO2, AGO3, AGO4, CBFB, CCND1, CCND2, CCND3, CDK6"
"756","Regulation of RUNX2 expression and activity",0.178563818453015,0.327670681256273,-0.466646504637267,-1.81128644310982,837,70,"WWP1, UBC, UBB, TWIST1, STUB1, STAT1, SMURF1, SKP2, SKP1, RUNX2, RPS27A, RBX1, PSMF1, PSME4, PSME3, PSME2, PSME1, PSMD9, PSMD8, PSMD7, PSMD6, PSMD5, PSMD4, PSMD3, PSMD2, PSMD14, PSMD13, PSMD12, PSMD11, PSMD10, PSMD1, PSMC6, PSMC5, PSMC4, PSMC3, PSMC2, PSMC1, PSMB9, PSMB8, PSMB7, PSMB6, PSMB5, PSMB4, PSMB3, PSMB2, PSMB11, PSMB10, PSMB1, PSMA8, PSMA7, PSMA6, PSMA5, PSMA4, PSMA3, PSMA1, PPARGC1B, PPARGC1A"
"757","Regulation of RUNX3 expression and activity",0.125447274258051,0.327670681256273,-0.59671439537563,-2.61619022304552,595,51,"UBC, UBB, TGFB1, SRC, SMURF2, SMURF1, RPS27A, PSMF1, PSME3, PSME2, PSME1, PSMD9, PSMD8, PSMD7, PSMD6, PSMD5, PSMD4, PSMD3, PSMD2, PSMD14, PSMD13, PSMD12, PSMD11, PSMD10, PSMD1, PSMC6, PSMC5, PSMC4, PSMC3, PSMC2, PSMC1, PSMB9, PSMB8, PSMB7, PSMB6, PSMB5, PSMB4, PSMB3, PSMB2, PSMB10, PSMB1, PSMA7, PSMA6, PSMA5, PSMA4, PSMA3, PSMA1"
"758","Regulation of TNFR1 signaling",0.0811145510835913,0.327670681256273,-0.318075643158838,-1.47216872940279,392,32,"XIAP, USP4, USP21, USP2, UBC, UBB, TRAF2, TRAF1, TRADD, TNFRSF1A, TNFAIP3, TAX1BP1, SPPL2B, SPPL2A, SHARPIN, RPS27A, RNF31, RIPK1, RBCK1, RACK1"
"759","Regulation of TP53 Activity",0.362221189591078,0.435068686935974,-0.170344768291634,-0.434083840350959,1558,150,"ZNF385A, WRN, USP7, USP2, UBC, UBB, TTC5, TP73, TP63, TP53RK, TP53INP1, TP53BP2, TP53, TPX2, TOPBP1, TOP3A, TBP, TAF9B, TAF7L, TAF7, TAF6, TAF5, TAF4B, TAF4, TAF3, TAF2, TAF15, TAF13, TAF12, TAF11, TAF10, TAF1, TAF1L, SUPT16H, STK11, SSRP1, SMYD2, SGK1, RPS27A, RPA3, RPA2, RPA1, RNF34, RMI2, RMI1, RICTOR, RHNO1, RFFL, RFC5, RFC4, RFC3, RFC2, RBBP8, RBBP7, RAD9B, RAD9A, RAD50, RAD17, RAD1, PRR5, PRMT5, PRKAG2, PRKAG1, PRKAB2, PRKAB1, PRKAA2, PRKAA1, PRDM1, PPP2R5C, PPP2R1B, PPP2R1A, PPP2CB, PPP2CA, PPP1R13L, PPP1R13B, PML, PLK3, PIP4K2C, PIP4K2B, PIP4K2A, PIN1, PHF20"
"760","Regulation of TP53 Activity through Acetylation",0.145038167938931,0.327670681256273,0.287624531578466,1.0720828673214,740,28,"AKT1, AKT2, AKT3, BRD1, BRD7, BRPF1, BRPF3, CHD3, CHD4, EP300, GATAD2A, GATAD2B, HDAC1, HDAC2, ING2, ING5, KAT6A, MAP2K6, MBD3, MEAF6, MTA2, PIN1, PIP4K2A, PIP4K2B, PIP4K2C, PML"
"761","Regulation of TP53 Activity through Methylation",0.784794851166533,0.797428859187206,-0.148415743108838,-0.641356967643037,3901,18,"UBC, UBB, TTC5, TP53, SMYD2, RPS27A, PRMT5, MDM4, MDM2, L3MBTL1, KMT5A, JMY, UBA52, EP300, EHMT2, EHMT1"
"762","Regulation of TP53 Activity through Phosphorylation",0.224787627967763,0.33086025351085,-0.242089185794222,-0.841492606823531,1031,90,"WRN, UBC, UBB, TP53RK, TP53INP1, TP53, TPX2, TOPBP1, TOP3A, TBP, TAF9B, TAF7L, TAF7, TAF6, TAF5, TAF4B, TAF4, TAF3, TAF2, TAF15, TAF13, TAF12, TAF11, TAF10, TAF1, TAF1L, SUPT16H, STK11, SSRP1, RPS27A, RPA3, RPA2, RPA1, RMI2, RMI1, RHNO1, RFC5, RFC4, RFC3, RFC2, RBBP8, RAD9B, RAD9A, RAD50, RAD17, RAD1, PRKAG2, PRKAG1, PRKAB2, PRKAB1, PRKAA2, PRKAA1"
"763","Regulation of TP53 Degradation",0.362489660876758,0.435068686935974,-0.163669768982862,-0.755578704466867,1752,34,"USP7, USP2, UBC, UBB, TP53, SGK1, RPS27A, RNF34, RICTOR, RFFL, PRR5, PPP2R5C, PPP2R1B, PPP2R1A, PPP2CB, PPP2CA, PHF20, PDPK1, MTOR, MLST8, MDM4, MDM2, MAPKAP1"
"764","Regulation of TP53 Expression and Degradation",0.298774153334718,0.386665642115416,-0.172944651201068,-0.79628942844172,1437,35,"USP7, USP2, UBC, UBB, TP53, SGK1, RPS27A, RNF34, RICTOR, RFFL, PRR5, PRDM1, PPP2R5C, PPP2R1B, PPP2R1A, PPP2CB, PPP2CA, PHF20, PDPK1, MTOR, MLST8, MDM4, MDM2, MAPKAP1"
"765","Regulation of actin dynamics for phagocytic cup formation",0.286608497723824,0.375495626444033,0.181685384540127,0.534736529961293,1510,57,"ABI1, ABI2, ABL1, ACTB, ACTG1, ACTR2, ACTR3, ARPC1A, ARPC1B, ARPC2, ARPC3, ARPC4, ARPC5, BAIAP2, BRK1, BTK, CD247, CDC42, CFL1, CRK, CYFIP1, CYFIP2, DOCK1, ELMO1, ELMO2, FCGR1A, FCGR2A, GRB2, HSP90AB1, LIMK1, MAPK1, MAPK3, MYH9, MYO10, MYO1C, MYO5A, MYO9B, NCK1, NCKAP1, NCKAP1L, NCKIPSD, NF2"
"766","Regulation of activated PAK-2p34 by proteasome mediated degradation",0.118693740841532,0.327670681256273,-0.633477471706171,-2.80981832314902,566,48,"UBC, UBB, RPS27A, PSMF1, PSME4, PSME3, PSME2, PSME1, PSMD9, PSMD8, PSMD7, PSMD6, PSMD5, PSMD4, PSMD3, PSMD2, PSMD14, PSMD13, PSMD12, PSMD11, PSMD10, PSMD1, PSMC6, PSMC5, PSMC4, PSMC3, PSMC2, PSMC1, PSMB9, PSMB8, PSMB7, PSMB6, PSMB5, PSMB4, PSMB3, PSMB2, PSMB11, PSMB10, PSMB1, PSMA8, PSMA7, PSMA6, PSMA5, PSMA4, PSMA3, PSMA1"
"767","Regulation of beta-cell development",0.161140197789412,0.327670681256273,0.275186388071163,0.999258373558821,830,32,"AKT1, AKT2, AKT3, CREBBP, EP300, FGF10, FOXA3, FOXO1, GCK, HES1, HNF1A, HNF1B, HNF4A, HNF4G, INS, INSM1, KAT2A, KAT2B, MAFA, MAML1, MAML2, MAML3, MAMLD1, NKX2-2, NOTCH1, NR5A2, ONECUT3, PAX6, PKLR"
"768","Regulation of cholesterol biosynthesis by SREBP (SREBF)",0.0841042893187553,0.327670681256273,-0.99903876962512,-4.32976048154685,399,53,"SAR1B"
"769","Regulation of expression of SLITs and ROBOs",0.330048132019253,0.407997287622878,-0.499733012662215,-1.36072674867782,1439,135,"ZSWIM8, USP33, UPF3B, UPF3A, UPF2, UBC, UBB, SLIT2, SLIT1, RPSA, RPS9, RPS8, RPS7, RPS5, RPS4X, RPS3A, RPS28, RPS27L, RPS27A, RPS25, RPS24, RPS21, RPS20, RPS19, RPS17, RPS16, RPS15A, RPS15, RPS14, RPS13, RPS12, RPS11, RPLP1, RPL8, RPL7A, RPL6, RPL5, RPL4, RPL3L, RPL38, RPL37A, RPL36, RPL35, RPL34, RPL32, RPL30, RPL3, RPL29, RPL28, RPL27, RPL26, RPL23, RPL22L1, RPL19, RPL18A, RPL18, RPL14, RPL13A, RPL12, RPL11, RPL10A, RPL10, ROBO3, ROBO2, ROBO1, RNPS1, RBX1, RBM8A, PSMF1, PSME4, PSME3, PSME2, PSME1, PSMD9, PSMD8, PSMD7, PSMD6, PSMD5, PSMD4, PSMD3, PSMD2, PSMD14, PSMD13, PSMD12, PSMD11, PSMD10, PSMD1, PSMC6, PSMC5, PSMC4, PSMC3, PSMC2, PSMC1, PSMB9, PSMB8, PSMB7, PSMB6, PSMB5, PSMB4, PSMB3, PSMB2, PSMB11, PSMB10, PSMB1, PSMA8, PSMA7, PSMA6, PSMA5, PSMA4, PSMA3, PSMA1"
"770","Regulation of gene expression in beta cells",0.178423236514523,0.327670681256273,0.301996633211873,1.09693098317179,902,15,"AKT1, AKT2, AKT3, FOXA3, FOXO1, GCK, HNF1A, HNF4A, HNF4G, INS, MAFA, NKX2-2, PAX6, PKLR"
"771","Regulation of insulin secretion",0.317206325301205,0.39855080450608,0.280118308348825,0.73479802618102,1684,73,"ABCC8, ACSL3, ACSL4, ADCY5, ADCY6, ADCY8, ADRA2A, ADRA2C, AHCYL1, AKAP5, CACNA1A, CACNA1C, CACNA1D, CACNA1E, CACNA2D2, CACNB2, CACNB3, CD36, CHRM3, FFAR1, GLP1R, GNA11, GNA14, GNA15, GNAI1, GNAI2, GNAS, GNB1, GNB3, GNB4, GNB5, GNG10, GNG11, GNG12, GNG13, GNG2, GNG3, GNG4, GNG7, GNG8, GNGT1, GNGT2, INS, IQGAP1, ITPR1, ITPR2, ITPR3, KCNB1, KCNC2, KCNG2, KCNJ11, KCNS3"
"772","Regulation of lipid metabolism by PPARalpha",0.441772833303427,0.49357112366374,0.190396137960873,0.397963910791692,2461,113,"ABCA1, ABCB4, ACADM, ACOX1, ACSL1, AGT, AHR, AHRR, ALAS1, ANGPTL4, ANKRD1, APOA1, ARNT, ARNT2, ARNTL, CARM1, CCNC, CD36, CDK19, CDK8, CHD9, CLOCK, CPT1A, CPT2, CREBBP, CYP1A1, EP300, ESRRA, FADS1, FAM120B, FDFT1, FHL2, G0S2, GLIPR1, MED20, GPS2, GRHL1, HDAC3, HELZ2, HMGCR, HMGCS1, HMGCS2, ME1, MED1, MED10, MED11, MED12, MED13, MED13L, MED14, MED15, MED16, MED17, MED18, MED19, MED21, MED22, MED23, MED24, MED25, MED26, MED27, MED28, MED29, MED30, MED31, MED4, MED6, MED7, MED8, MED9, MTF1, NCOA1, NCOA2, NCOA3, NCOA6, NCOR1, NCOR2, NFYA, NFYB, NFYC, NPAS2, NR1D1, NR1H2, NR1H3, NRF1"
"773","Regulation of mRNA stability by proteins that bind AU-rich elements",0.210240833152528,0.327670681256273,-0.340188361793885,-1.22268063608945,968,83,"ZFP36L1, ZFP36, YWHAZ, YWHAB, XRN1, XPO1, UBC, UBB, TNPO1, SET, RPS27A, PSMF1, PSME4, PSME3, PSME2, PSME1, PSMD9, PSMD8, PSMD7, PSMD6, PSMD5, PSMD4, PSMD3, PSMD2, PSMD14, PSMD13, PSMD12, PSMD11, PSMD10, PSMD1, PSMC6, PSMC5, PSMC4, PSMC3, PSMC2, PSMC1, PSMB9, PSMB8, PSMB7, PSMB6, PSMB5, PSMB4, PSMB3, PSMB2, PSMB11, PSMB10, PSMB1, PSMA8, PSMA7, PSMA6, PSMA5, PSMA4, PSMA3, PSMA1, PRKCD, PRKCA"
"774","Regulation of mitotic cell cycle",0.199355531686359,0.327670681256273,-0.333110703226755,-1.23061087363485,927,79,"UBE2E1, UBE2D1, UBE2C, UBC, UBB, SKP2, SKP1, RPS27A, PTTG1, PSMF1, PSME4, PSME3, PSME2, PSME1, PSMD9, PSMD8, PSMD7, PSMD6, PSMD5, PSMD4, PSMD3, PSMD2, PSMD14, PSMD13, PSMD12, PSMD11, PSMD10, PSMD1, PSMC6, PSMC5, PSMC4, PSMC3, PSMC2, PSMC1, PSMB9, PSMB8, PSMB7, PSMB6, PSMB5, PSMB4, PSMB3, PSMB2, PSMB11, PSMB10, PSMB1, PSMA8, PSMA7, PSMA6, PSMA5, PSMA4, PSMA3, PSMA1"
"775","Regulation of ornithine decarboxylase (ODC)",0.122895622895623,0.327670681256273,-0.552482149884747,-2.42902644624078,583,49,"PSMF1, PSME4, PSME3, PSME2, PSME1, PSMD9, PSMD8, PSMD7, PSMD6, PSMD5, PSMD4, PSMD3, PSMD2, PSMD14, PSMD13, PSMD12, PSMD11, PSMD10, PSMD1, PSMC6, PSMC5, PSMC4, PSMC3, PSMC2, PSMC1, PSMB9, PSMB8, PSMB7, PSMB6, PSMB5, PSMB4, PSMB3, PSMB2, PSMB11, PSMB10, PSMB1, PSMA8, PSMA7, PSMA6, PSMA5, PSMA4, PSMA3, PSMA1"
"776","Regulation of pyruvate dehydrogenase (PDH) complex",0.0457304734925132,0.327670681256273,-0.4130537620661,-1.68982330489642,225,15,"RXRA, PPARD, PDPR, PDP2, PDP1, PDK4, PDK3, PDK2, PDK1, PDHX, PDHB, PDHA1"
"777","Regulation of signaling by CBL",0.543041029766693,0.583266291230893,-0.182921284455811,-0.790467627345407,2699,18,"YES1, VAV1, SYK, RAPGEF1, PIK3R3, PIK3R2, PIK3R1, PIK3CD, PIK3CB, PIK3CA"
"778","Reproduction",0.226686600635395,0.332719289972496,0.998074454428755,2.53041827956528,1212,78,"IZUMO4, ACD"
"779","Resolution of AP sites via the multiple-nucleotide patch replacement pathway",0.0594825830107965,0.327670681256273,-0.436250053302631,-1.98016167251422,291,24,"RPA3, RPA2, RPA1, RFC5, RFC4, RFC3, RFC2, RFC1, POLE4, POLE3, POLE2, POLE, POLD4, POLD2, POLD1, POLB, PCNA, PARP2, PARP1, PARG"
"780","Resolution of Abasic Sites (AP sites)",0.0920016576875259,0.327670681256273,-0.378812651714515,-1.74759927247075,443,37,"XRCC1, UNG, TDG, SMUG1, RPA3, RPA2, RPA1, RFC5, RFC4, RFC3, RFC2, RFC1, POLE4, POLE3, POLE2, POLE, POLD4, POLD2, POLD1, POLB, PNKP, PCNA, PARP2, PARP1, PARG, OGG1, NTHL1, NEIL2, NEIL1, MUTYH, MPG, MBD4, LIG3, LIG1"
"781","Resolution of D-Loop Structures",0.174823724595603,0.327670681256273,-0.208527515151515,-0.963080231110094,842,33,"XRCC3, XRCC2, WRN, TOP3A, SPIDR, SLX4, SLX1A, RTEL1, RMI2, RMI1, RBBP8, RAD51D, RAD51C, RAD51B, RAD51AP1, RAD51, RAD50"
"782","Resolution of D-loop Structures through Holliday Junction Intermediates",0.23405572755418,0.336451557579615,-0.193331626775886,-0.894808456622068,1133,32,"XRCC3, XRCC2, WRN, TOP3A, SPIDR, SLX4, SLX1A, RMI2, RMI1, RBBP8, RAD51D, RAD51C, RAD51B, RAD51AP1, RAD51, RAD50"
"783","Resolution of D-loop Structures through Synthesis-Dependent Strand Annealing (SDSA)",0.165886423773662,0.327670681256273,-0.231782930477915,-1.06170830519885,814,26,"XRCC3, XRCC2, WRN, TOP3A, RTEL1, RMI2, RMI1, RBBP8, RAD51D, RAD51C, RAD51B, RAD51AP1, RAD51, RAD50"
"784","Resolution of Sister Chromatid Cohesion",0.483412322274882,0.530369551943709,0.11407019614488,0.255412100652944,2651,99,"AHCTF1, B9D2, BIRC5, BUB1, BUB3, CCNB1, CCNB2, CDC20, CDCA8, CENPA, CENPC, CENPE, CENPF, CENPH, CENPI, CENPK, CENPL, CENPM, CENPN, CENPO, CENPP, CENPQ, CENPT, CENPU, CKAP5, CLASP1, CLASP2, CLIP1, DSN1, DYNC1H1, DYNC1I1, DYNC1I2, DYNC1LI1, DYNC1LI2, DYNLL1, DYNLL2"
"785","Respiratory electron transport",0.244134572819832,0.34434901775872,-0.284407953412728,-0.941802326650077,1102,98,"UQCRQ, UQCRH, UQCRFS1, UQCRC2, UQCRC1, UQCRB, UQCR11, UQCR10, TRAP1, TMEM126B, TIMMDC1, TACO1, SURF1, SDHD, SDHC, SDHB, SDHA, SCO2, SCO1, NUBPL, NDUFV3, NDUFV2, NDUFV1, NDUFS8, NDUFS7, NDUFS6, NDUFS5, NDUFS4, NDUFS3, NDUFS2, NDUFS1, NDUFC2, NDUFC1, NDUFB9, NDUFB8, NDUFB7, NDUFB6, NDUFB5, NDUFB4, NDUFB3, NDUFB2, NDUFB11, NDUFB10, NDUFB1, NDUFAF7, NDUFAF6, NDUFAF5, NDUFAF4, NDUFAF3, NDUFAF2, NDUFAF1, NDUFAB1, NDUFA9, NDUFA8, NDUFA7, NDUFA6, NDUFA5, NDUFA4, NDUFA3, NDUFA2, NDUFA12, NDUFA11, NDUFA10, NDUFA1, MT-ND6, MT-ND5, MT-ND4, MT-ND3, MT-ND2, MT-ND1, MT-CYB, MT-CO3, MT-CO2, MT-CO1"
"786","Respiratory electron transport, ATP synthesis by chemiosmotic coupling, and heat production by uncoupling proteins.",0.453846153846154,0.502556164166071,0.238006893091639,0.487383891101923,2536,118,"ACAD9, ATP5F1A, ATP5F1B, ATP5F1C, ATP5F1D, ATP5F1E, ATP5MC3, ATP5PD, ATP5PF, ATP5MF, ATP5ME, ATP5MG, ATP5PO, COQ10A, COQ10B, COX11, COX14, COX18, COX19, COX20, COX5A, COX5B, COX6A1, COX6B1, COX6C, COX7A2L, COX7B, COX7C, COX8A, CYC1, DMAC2L, ECSIT, ETFA, ETFB, ETFDH, CYCS, LRPPRC, MT-ATP6, MT-ATP8, MT-CO1, MT-CO2, MT-CO3, MT-CYB, MT-ND1, MT-ND2, MT-ND3, MT-ND4, MT-ND5, MT-ND6, NDUFA1, NDUFA10, NDUFA11, NDUFA12, NDUFA2, NDUFA3, NDUFA4, NDUFA5, NDUFA6, NDUFA7, NDUFA8, NDUFA9, NDUFAB1, NDUFAF1, NDUFAF2, NDUFAF3, NDUFAF4, NDUFAF5, NDUFAF6, NDUFAF7, NDUFB1, NDUFB10, NDUFB11, NDUFB2, NDUFB3, NDUFB4, NDUFB5, NDUFB6, NDUFB7, NDUFB8, NDUFB9, NDUFC1, NDUFC2, NDUFS1, NDUFS2, NDUFS3, NDUFS4, NDUFS5, NDUFS6, NDUFS7, NDUFS8, NDUFV1, NDUFV2, NDUFV3"
"787","Response of EIF2AK1 (HRI) to heme deficiency",0.0780478166370283,0.327670681256273,0.539564022246372,1.95983805220636,394,15,"ASNS, ATF3, ATF4, ATF5, CEBPB, CEBPG, CHAC1, DDIT3, EIF2AK1, EIF2S1, EIF2S2, EIF2S3"
"788","Response of EIF2AK4 (GCN2) to amino acid deficiency",0.178563818453015,0.327670681256273,-0.501028263499395,-1.9447390953817,837,70,"TRIB3, RPSA, RPS9, RPS8, RPS7, RPS5, RPS4X, RPS3A, RPS28, RPS27L, RPS27A, RPS25, RPS24, RPS21, RPS20, RPS19, RPS17, RPS16, RPS15A, RPS15, RPS14, RPS13, RPS12, RPS11, RPLP1, RPL8, RPL7A, RPL6, RPL5, RPL4, RPL3L, RPL38, RPL37A, RPL36, RPL35, RPL34, RPL32, RPL30, RPL3, RPL29, RPL28, RPL27, RPL26, RPL23, RPL22L1, RPL19, RPL18A, RPL18, RPL14, RPL13A, RPL12, RPL11, RPL10A, RPL10"
"789","Response of Mtb to phagocytosis",0.612244897959184,0.640291204200979,-0.158742063768925,-0.713459966419694,3029,22,"VPS33B, UBC, UBB, TRIM27, SFPQ, RPS27A, RNF213, RAB7A, RAB5A, PGK1, NOS2, MAPK3, MAPK1, KPNB1, KPNA1, HGS, GSK3A, UBA52"
"790","Response to elevated platelet cytosolic Ca2+",0.195959234757733,0.327670681256273,0.998648822545361,2.06806091597122,1095,116,"FAM49B, ABCC4"
"791","Retinoid metabolism and transport",0.0767801857585139,0.327670681256273,-0.868103737279171,-4.01789701093805,371,32,"TTR"
"792","Retrograde transport at the Trans-Golgi-Network",0.261051749423842,0.357281284606866,-0.163437875844204,-0.727362611161696,1245,45,"VTI1A, VPS54, VPS53, VPS52, VPS51, VAMP4, USP6NL, TMF1, TGOLN2, STX6, STX16, SCOC, RIC1, RHOBTB3, RGP1, RABEPK, RAB9B, RAB9A, RAB6B, RAB6A, PLIN3, NSF, NAPG, NAPB, NAPA, NAA38, NAA35, NAA30"
"793","Rev-mediated nuclear export of HIV RNA",0.0821236001659063,0.327670681256273,-0.519681939393939,-2.40014082521244,395,33,"XPO1, TPR, SEH1L, SEC13, RCC1, RANGAP1, RANBP2, RANBP1, RAE1, POM121, POM121C, NUP42, NUP58, NUP98, NUP93, NUP88, NUP85, NUP54, NUP50, NUP43, NUP37, NUP35, NUP214, NUP210, NUP205, NUP188, NUP160, NUP155, NUP153, NUP133, NUP107"
"794","Rho GTPase cycle",0.490963855421687,0.53674920498803,0.392194438940885,0.755231452160775,2770,131,"ABR, AKAP13, ARAP1, ARAP2, ARAP3, ARHGAP1, ARHGAP10, ARHGAP11B, ARHGAP11A, ARHGAP12, ARHGAP15, ARHGAP17, ARHGAP18, ARHGAP19, ARHGAP20, ARHGAP21, ARHGAP22, ARHGAP23, ARHGAP24, ARHGAP25, ARHGAP26, ARHGAP27, ARHGAP28, ARHGAP29, ARHGAP30, ARHGAP31, ARHGAP32, ARHGAP33, ARHGAP35, ARHGAP39, ARHGAP4, ARHGAP40, ARHGAP42, ARHGAP44, ARHGAP5, ARHGAP6, ARHGAP8, ARHGDIA, ARHGDIB, ARHGDIG, ARHGEF1, ARHGEF10, ARHGEF10L, ARHGEF11, ARHGEF12, ARHGEF15, ARHGEF17, ARHGEF18, ARHGEF19, ARHGEF2, ARHGEF26, ARHGEF3, ARHGEF33, ARHGEF37, ARHGEF38, ARHGEF4, ARHGEF40, ARHGEF6, ARHGEF7, ARHGEF9"
"795","Ribosomal scanning and start codon recognition",0.21329534662868,0.327670681256273,0.268400486836205,0.875722664519939,1122,47,"EIF1AX, EIF2S1, EIF2S2, EIF2S3, EIF3A, EIF3B, EIF3C, EIF3D, EIF3E, EIF3F, EIF3G, EIF3H, EIF3I, EIF3J, EIF3K, EIF3L, EIF3M, EIF4A1, EIF4A2, EIF4E, EIF4G1, EIF4H, EIF5, FAU, RPS11, RPS12, RPS13, RPS14, RPS15, RPS15A, RPS16, RPS17, RPS19, RPS20, RPS21, RPS24, RPS25, RPS27A, RPS27L, RPS28, RPS3A, RPS4X, RPS5, RPS7, RPS8, RPS9, RPSA"
"796","Role of phospholipids in phagocytosis",0.069701280227596,0.327670681256273,-0.323282490510421,-1.45914068946221,342,23,"SYK, PRKCE, PRKCD, PLPP5, PLPP4, PLD4, PLD3, PLD2, PLD1, PLCG2, PLCG1, PLA2G6, PIK3R2, PIK3R1, PIK3CB, PIK3CA"
"797","S Phase",0.367323290845886,0.438906337502936,-0.191249346628604,-0.48321394356928,1584,154,"WEE1, WAPL, UBE2E1, UBE2D1, UBE2C, UBC, UBB, TFDP2, TFDP1, STAG2, STAG1, SMC3, SMC1A, SKP2, SKP1, RPS27A, RPA3, RPA2, RPA1, RFC5, RFC4, RFC3, RFC2, RFC1, RBX1, RBL2, RB1, RAD21, PTK6, PSMF1, PSME4, PSME3, PSME2, PSME1, PSMD9, PSMD8, PSMD7, PSMD6, PSMD5, PSMD4, PSMD3, PSMD2, PSMD14, PSMD13, PSMD12, PSMD11, PSMD10, PSMD1, PSMC6, PSMC5, PSMC4, PSMC3, PSMC2, PSMC1, PSMB9, PSMB8, PSMB7, PSMB6, PSMB5, PSMB4, PSMB3, PSMB2, PSMB11, PSMB10, PSMB1, PSMA8, PSMA7, PSMA6, PSMA5, PSMA4, PSMA3, PSMA1, PRIM2, PRIM1, POLE4, POLE3, POLE2, POLE, POLD4, POLD2, POLD1, POLA2, POLA1, PDS5B, PDS5A, PCNA, ORC6, ORC5, ORC4, ORC3, ORC2, ORC1"
"798","S33 mutants of beta-catenin aren't phosphorylated",0.117170519660146,0.327670681256273,0.343284536214281,1.24689947636939,592,15,"AMER1, APC, AXIN1, CSNK1A1, CTNNB1, GSK3B, PPP2CA, PPP2CB, PPP2R1A, PPP2R1B, PPP2R5A, PPP2R5B, PPP2R5C, PPP2R5D, PPP2R5E"
"799","S37 mutants of beta-catenin aren't phosphorylated",0.117170519660146,0.327670681256273,0.343284536214281,1.24689947636939,592,15,"AMER1, APC, AXIN1, CSNK1A1, CTNNB1, GSK3B, PPP2CA, PPP2CB, PPP2R1A, PPP2R1B, PPP2R5A, PPP2R5B, PPP2R5C, PPP2R5D, PPP2R5E"
"800","S45 mutants of beta-catenin aren't phosphorylated",0.117170519660146,0.327670681256273,0.343284536214281,1.24689947636939,592,15,"AMER1, APC, AXIN1, CSNK1A1, CTNNB1, GSK3B, PPP2CA, PPP2CB, PPP2R1A, PPP2R1B, PPP2R5A, PPP2R5B, PPP2R5C, PPP2R5D, PPP2R5E"
"801","SCF(Skp2)-mediated degradation of p27/p21",0.146740284561478,0.327670681256273,-0.468039345711759,-1.9554875483961,690,58,"UBC, UBB, SKP2, SKP1, RPS27A, PTK6, PSMF1, PSME3, PSME2, PSME1, PSMD9, PSMD8, PSMD7, PSMD6, PSMD5, PSMD4, PSMD3, PSMD2, PSMD14, PSMD13, PSMD12, PSMD11, PSMD10, PSMD1, PSMC6, PSMC5, PSMC4, PSMC3, PSMC2, PSMC1, PSMB9, PSMB8, PSMB7, PSMB6, PSMB5, PSMB4, PSMB3, PSMB2, PSMB10, PSMB1, PSMA7, PSMA6, PSMA5, PSMA4, PSMA3, PSMA1"
"802","SCF-beta-TrCP mediated degradation of Emi1",0.130782169890664,0.327670681256273,-0.561896586120801,-2.43521843923519,621,53,"UBC, UBB, SKP1, RPS27A, PSMF1, PSME4, PSME3, PSME2, PSME1, PSMD9, PSMD8, PSMD7, PSMD6, PSMD5, PSMD4, PSMD3, PSMD2, PSMD14, PSMD13, PSMD12, PSMD11, PSMD10, PSMD1, PSMC6, PSMC5, PSMC4, PSMC3, PSMC2, PSMC1, PSMB9, PSMB8, PSMB7, PSMB6, PSMB5, PSMB4, PSMB3, PSMB2, PSMB11, PSMB10, PSMB1, PSMA8, PSMA7, PSMA6, PSMA5, PSMA4, PSMA3, PSMA1"
"803","SHC-mediated cascade:FGFR1",0.0126607717041801,0.327670681256273,-0.999616343755995,-4.38453167264151,62,19,"FGF1"
"804","SHC-mediated cascade:FGFR2",0.0148207490486681,0.327670681256273,-0.999616294685681,-4.44526108625087,73,21,"FGF1"
"805","SHC-mediated cascade:FGFR3",0.0124698310539019,0.327670681256273,-0.999616368286445,-4.31969620837591,61,18,"FGF1"
"806","SHC-mediated cascade:FGFR4",0.0124698310539019,0.327670681256273,-0.999616368286445,-4.31969620837591,61,18,"FGF1"
"807","SHC1 events in ERBB2 signaling",0.258262418365328,0.354821478752876,0.229121607479244,0.855798995762304,1304,22,"BTC, EGF, EGFR, ERBB2, ERBB3, ERBB4, EREG, GRB2, HBEGF, HRAS, KRAS, NRAS, NRG1, NRG2, NRG3, NRG4, PRKCA, PRKCD, PRKCE, PTPN12"
"808","SLC transporter disorders",0.215980840409319,0.327670681256273,-0.475893798089453,-1.68469077730215,991,85,"TPR, SLCO2A1, SLCO1B1, SLCO1B3, SLC9A9, SLC9A6, SLC7A9, SLC7A7, SLC6A5, SLC6A20, SLC6A2, SLC6A19, SLC5A7, SLC5A5, SLC5A2, SLC5A1, SLC4A4, SLC4A1, SLC40A1, SLC3A2, SLC3A1, SLC35C1, SLC35A3, SLC35A2, SLC35A1, SLC34A1, SLC33A1, SLC2A9, SLC2A2, SLC2A1, SLC29A3, SLC27A4, SLC26A4, SLC26A2, SLC24A5, SLC24A4, SLC24A1, SLC22A5, SLC22A18, SLC22A12, SLC20A2, SLC1A3, SLC1A1, SLC17A8, SLC17A5, SLC16A1, SLC12A6, SLC12A3, SLC12A1, SLC11A2, SEH1L, SEC13, RANBP2, RAE1, POM121, POM121C, NUP42, NUP58, NUP98, NUP93, NUP88, NUP85, NUP54, NUP50, NUP43, NUP37, NUP35, NUP214, NUP210, NUP205, NUP188, NUP160, NUP155, NUP153, NUP133, NUP107"
"809","SLC-mediated transmembrane transport",0.0735222276502198,0.327670681256273,-0.99967612385024,-2.05585745965661,300,220,"SLC15A2"
"810","SMAD2/SMAD3:SMAD4 heterotrimer regulates transcription",0.127760577915377,0.327670681256273,-0.232837098425701,-1.07765401947493,618,32,"WWTR1, UBC, UBB, TGIF2, TGIF1, TFDP2, TFDP1, SP1, SNW1, SMAD7, SMAD4, SMAD3, SMAD2, SERPINE1, RPS27A, RNF111, RBL1"
"811","SRP-dependent cotranslational protein targeting to membrane",0.197442566103164,0.327670681256273,-0.669092687303297,-2.43933507171622,910,81,"TRAM1, SSR4, SSR3, SSR2, SSR1, SRPRB, SRPRA, SRP9, SRP72, SRP68, SRP54, SRP19, SRP14, SPCS2, SPCS1, SEC61G, SEC61B, SEC61A2, SEC61A1, SEC11C, SEC11A, RPSA, RPS9, RPS8, RPS7, RPS5, RPS4X, RPS3A, RPS28, RPS27L, RPS27A, RPS25, RPS24, RPS21, RPS20, RPS19, RPS17, RPS16, RPS15A, RPS15, RPS14, RPS13, RPS12, RPS11, RPN2, RPN1, RPLP1, RPL8, RPL7A, RPL6, RPL5, RPL4, RPL3L, RPL38, RPL37A, RPL36, RPL35, RPL34, RPL32, RPL30, RPL3, RPL29, RPL28, RPL27, RPL26, RPL23, RPL22L1, RPL19, RPL18A, RPL18, RPL14, RPL13A, RPL12, RPL11, RPL10A, RPL10"
"812","SUMO E3 ligases SUMOylate target proteins",0.363805104408353,0.435672853828306,-0.253154127095114,-0.643227089270133,1567,152,"ZNF131, XRCC4, XPC, WRN, VDR, UHRF2, UBE2I, TP53BP1, TP53, TRIM28, TRIM27, TPR, TOPORS, TOP2B, TOP2A, TOP1, THRB, THRA, TFAP2B, TFAP2A, TDG, SUZ12, SUMO2, SUMO1, STAG2, STAG1, SP3, SMC6, SMC5, SMC3, SMC1A, SIN3A, SEH1L, SEC13, SCMH1, SATB2, SATB1, SAFB, RXRA, RPA1, RORA, RNF2, RNF168, RING1, RELA, RARA, RANGAP1, RANBP2, RAE1, RAD52, RAD21, PPARGC1A, PPARG, PPARA, POM121, POM121C, PML, PIAS4, PIAS3, PIAS2, PIAS1, PHC3, PHC2, PHC1, PGR, PCNA, PCGF2, PARP1, PARK7, NUP42, NUP58, NUP98, NUP93, NUP88, NUP85, NUP54, NUP50, NUP43, NUP37, NUP35, NUP214, NUP210, NUP205, NUP188, NUP160, NUP155, NUP153, NUP133, NUP107, NSMCE2, NSMCE1, NRIP1, NR5A2, NR4A2, NR3C2, NR3C1, NR2C1, NR1I2, NR1H3, NR1H2, NOP58, NFKBIA, NFKB2, NDC1, NCOR2, NCOA2, NCOA1"
"813","SUMOylation",0.374564864237642,0.444253165625042,-0.264609228256431,-0.659261317622753,1613,158,"ZNF131, XRCC4, XPC, WRN, VDR, UHRF2, UBE2I, UBA2, TP53BP1, TP53, TRIM28, TRIM27, TPR, TOPORS, TOP2B, TOP2A, TOP1, THRB, THRA, TFAP2B, TFAP2A, TDG, SUZ12, SUMO2, SUMO1, STAG2, STAG1, SP3, SMC6, SMC5, SMC3, SMC1A, SIN3A, SENP5, SENP2, SENP1, SEH1L, SEC13, SCMH1, SATB2, SATB1, SAFB, SAE1, RXRA, RWDD3, RPA1, RORA, RNF2, RNF168, RING1, RELA, RARA, RANGAP1, RANBP2, RAE1, RAD52, RAD21, PPARGC1A, PPARG, PPARA, POM121, POM121C, PML, PIAS4, PIAS3, PIAS2, PIAS1, PHC3, PHC2, PHC1, PGR, PCNA, PCGF2, PARP1, PARK7, NUP42, NUP58, NUP98, NUP93, NUP88, NUP85, NUP54, NUP50, NUP43, NUP37, NUP35, NUP214, NUP210, NUP205, NUP188, NUP160, NUP155, NUP153, NUP133, NUP107, NSMCE2, NSMCE1, NRIP1, NR5A2, NR4A2, NR3C2, NR3C1, NR2C1, NR1I2, NR1H3, NR1H2, NOP58, NFKBIA, NFKB2, NDC1, NCOR2, NCOA2, NCOA1"
"814","SUMOylation of DNA damage response and repair proteins",0.178563818453015,0.327670681256273,-0.404463140144433,-1.56992197563058,837,70,"XRCC4, XPC, WRN, UBE2I, TPR, TDG, SUMO2, SUMO1, STAG2, STAG1, SMC6, SMC5, SMC3, SMC1A, SEH1L, SEC13, SCMH1, RPA1, RNF2, RNF168, RING1, RANBP2, RAE1, RAD52, RAD21, POM121, POM121C, PML, PIAS4, PIAS2, PIAS1, PHC3, PHC2, PHC1, PCGF2, PARP1, NUP42, NUP58, NUP98, NUP93, NUP88, NUP85, NUP54, NUP50, NUP43, NUP37, NUP35, NUP214, NUP210, NUP205, NUP188, NUP160, NUP155, NUP153, NUP133, NUP107, NSMCE2, NSMCE1"
"815","SUMOylation of DNA methylation proteins",0.550079808459697,0.587884098084915,0.197505114435494,0.721490240772743,2756,16,"BMI1, CBX2, CBX4, CBX8, DNMT1, DNMT3A, DNMT3B"
"816","SUMOylation of DNA replication proteins",0.108523908523909,0.327670681256273,-0.440868574492326,-1.98783801153643,521,43,"UBE2I, TPR, TOP2B, TOP2A, TOP1, SUMO2, SUMO1, SEH1L, SEC13, RANGAP1, RANBP2, RAE1, POM121, POM121C, PIAS4, PIAS3, PCNA, NUP42, NUP58, NUP98, NUP93, NUP88, NUP85, NUP54, NUP50, NUP43, NUP37, NUP35, NUP214, NUP210, NUP205, NUP188, NUP160, NUP155, NUP153, NUP133, NUP107"
"817","SUMOylation of RNA binding proteins",0.117374842238115,0.327670681256273,-0.396442535841994,-1.75687641196674,557,46,"UBE2I, TPR, SUMO2, SUMO1, SEH1L, SEC13, SCMH1, RNF2, RING1, RANBP2, RAE1, POM121, POM121C, PHC3, PHC2, PHC1, PCGF2, NUP42, NUP58, NUP98, NUP93, NUP88, NUP85, NUP54, NUP50, NUP43, NUP37, NUP35, NUP214, NUP210, NUP205, NUP188, NUP160, NUP155, NUP153, NUP133, NUP107, NOP58, NDC1"
