"","pathway","pval","padj","ES","NES","nMoreExtreme","size","leadingEdge"
"1","A tetrasaccharide linker sequence is required for GAG synthesis",0.0416836112240748,0.0599461322155614,0.293818181818182,1.61034776846895,204,22,"AGRN, B3GALT6, B3GAT1, B3GAT2, B3GAT3, B4GALT7, BCAN, CSPG5, DCN, GPC1, GPC3, GPC4, GPC5, GPC6, HSPG2"
"2","ABC transporter disorders",0.00020259319286872,0.000811533243965676,-0.41836883571637,-3.93101694436335,0,64,"VCP, UBC, UBB, SEL1L, RPS27A, RNF5, RNF185, PSMF1, PSME4, PSME3, PSME2, PSME1, PSMD9, PSMD8, PSMD7, PSMD6, PSMD5, PSMD4, PSMD3, PSMD2, PSMD14, PSMD13, PSMD12, PSMD11, PSMD10, PSMD1, PSMC6, PSMC5, PSMC4, PSMC3, PSMC2, PSMC1, PSMB8, PSMB7, PSMB6, PSMB5, PSMB4, PSMB3, PSMB2, PSMB10, PSMB1, PSMA8, PSMA7, PSMA6, PSMA5, PSMA4, PSMA3, PSMA1"
"3","ABC transporters in lipid homeostasis",0.00428833979987748,0.0132991151462458,0.808296382447724,3.72876786135325,20,15,"ABCA12, ABCA2, ABCA3, ABCA5, ABCA6, ABCA7, ABCA9, ABCD1, ABCD2, ABCD3, ABCG1, ABCG4, APOA1"
"4","ABC-family proteins mediated transport",0.0265241488519398,0.0432653984118711,0.281496638409822,2.44637050257487,133,88,"ABCA12, ABCA2, ABCA3, ABCA4, ABCA5, ABCA6, ABCA7, ABCA8, ABCA9, ABCB10, ABCB1, ABCB4, ABCB7, ABCB8, ABCB9, ABCC1, ABCC10, ABCC3, ABCC4, ABCC5, ABCD1, ABCD2, ABCD3, ABCF1, ABCG1, ABCG4"
"5","ADP signalling through P2Y purinoceptor 1",0.00501504513540622,0.0148686528794595,0.465887612678104,2.22960486097556,24,16,"GNA11, GNA14, GNA15, GNB1, GNB4, GNB5, GNG12, GNG13, GNG2, GNG3, GNG4, GNG7, GNGT2"
"6","APC-Cdc20 mediated degradation of Nek2A",0.00590631364562118,0.0165409504036649,0.506893542757417,2.655262837956,28,20,"ANAPC1, ANAPC10, ANAPC15, ANAPC16, ANAPC2, ANAPC4, ANAPC5, ANAPC7, BUB3, CDC16, CDC23, CDC26, CDC27"
"7","APC/C-mediated degradation of cell cycle proteins",0.000200883889112093,0.000811533243965676,-0.358413233947147,-3.54983120804855,0,71,"UBE2E1, UBE2D1, UBC, UBB, SKP2, SKP1, RPS27A, PTTG1, PSMF1, PSME4, PSME3, PSME2, PSME1, PSMD9, PSMD8, PSMD7, PSMD6, PSMD5, PSMD4, PSMD3, PSMD2, PSMD14, PSMD13, PSMD12, PSMD11, PSMD10, PSMD1, PSMC6, PSMC5, PSMC4, PSMC3, PSMC2, PSMC1, PSMB8, PSMB7, PSMB6, PSMB5, PSMB4, PSMB3, PSMB2, PSMB10, PSMB1, PSMA8, PSMA7, PSMA6, PSMA5, PSMA4, PSMA3, PSMA1"
"8","APC/C:Cdc20 mediated degradation of Cyclin B",0.00501102425335739,0.0148686528794595,0.523508312733265,2.63258519786426,24,18,"ANAPC1, ANAPC10, ANAPC15, ANAPC16, ANAPC2, ANAPC4, ANAPC5, ANAPC7, CDC16, CDC23, CDC26, CDC27"
"9","APC/C:Cdc20 mediated degradation of Securin",0.000201328769881216,0.000811533243965676,-0.451725982108129,-4.13413742849547,0,60,"UBE2E1, UBE2D1, UBC, UBB, RPS27A, PTTG1, PSMF1, PSME4, PSME3, PSME2, PSME1, PSMD9, PSMD8, PSMD7, PSMD6, PSMD5, PSMD4, PSMD3, PSMD2, PSMD14, PSMD13, PSMD12, PSMD11, PSMD10, PSMD1, PSMC6, PSMC5, PSMC4, PSMC3, PSMC2, PSMC1, PSMB8, PSMB7, PSMB6, PSMB5, PSMB4, PSMB3, PSMB2, PSMB10, PSMB1, PSMA8, PSMA7, PSMA6, PSMA5, PSMA4, PSMA3, PSMA1"
"10","APC/C:Cdc20 mediated degradation of mitotic proteins",0.000202061022428773,0.000811533243965676,-0.414351827729901,-3.87050914348872,0,63,"UBE2E1, UBE2D1, UBC, UBB, RPS27A, PTTG1, PSMF1, PSME4, PSME3, PSME2, PSME1, PSMD9, PSMD8, PSMD7, PSMD6, PSMD5, PSMD4, PSMD3, PSMD2, PSMD14, PSMD13, PSMD12, PSMD11, PSMD10, PSMD1, PSMC6, PSMC5, PSMC4, PSMC3, PSMC2, PSMC1, PSMB8, PSMB7, PSMB6, PSMB5, PSMB4, PSMB3, PSMB2, PSMB10, PSMB1, PSMA8, PSMA7, PSMA6, PSMA5, PSMA4, PSMA3, PSMA1"
"11","APC/C:Cdh1 mediated degradation of Cdc20 and other APC/C:Cdh1 targeted proteins in late mitosis/early G1",0.000202061022428773,0.000811533243965676,-0.430297788383717,-4.01946223692732,0,63,"UBE2E1, UBE2D1, UBC, UBB, SKP2, RPS27A, PTTG1, PSMF1, PSME4, PSME3, PSME2, PSME1, PSMD9, PSMD8, PSMD7, PSMD6, PSMD5, PSMD4, PSMD3, PSMD2, PSMD14, PSMD13, PSMD12, PSMD11, PSMD10, PSMD1, PSMC6, PSMC5, PSMC4, PSMC3, PSMC2, PSMC1, PSMB8, PSMB7, PSMB6, PSMB5, PSMB4, PSMB3, PSMB2, PSMB10, PSMB1, PSMA8, PSMA7, PSMA6, PSMA5, PSMA4, PSMA3, PSMA1"
"12","APC:Cdc20 mediated degradation of cell cycle proteins prior to satisfation of the cell cycle checkpoint",0.000202634245187437,0.000811533243965676,-0.41020681866309,-3.80193433091121,0,62,"UBE2E1, UBE2D1, UBC, UBB, RPS27A, PSMF1, PSME4, PSME3, PSME2, PSME1, PSMD9, PSMD8, PSMD7, PSMD6, PSMD5, PSMD4, PSMD3, PSMD2, PSMD14, PSMD13, PSMD12, PSMD11, PSMD10, PSMD1, PSMC6, PSMC5, PSMC4, PSMC3, PSMC2, PSMC1, PSMB8, PSMB7, PSMB6, PSMB5, PSMB4, PSMB3, PSMB2, PSMB10, PSMB1, PSMA8, PSMA7, PSMA6, PSMA5, PSMA4, PSMA3, PSMA1"
"13","ATF4 activates genes in response to endoplasmic reticulum  stress",0.00630337535583571,0.0173171534911682,0.447563636363636,2.45299014038563,30,22,"ASNS, ATF4, ATF6, CEBPB, CEBPG, DCP2, DDIT3, DIS3, EXOSC1, EXOSC2, EXOSC3, EXOSC4, EXOSC5, EXOSC7, EXOSC8, EXOSC9"
"14","AUF1 (hnRNP D0) binds and destabilizes mRNA",0.000199481348493916,0.000811533243965676,-0.566399029188299,-4.69002381050029,0,49,"UBC, UBB, RPS27A, PSMF1, PSME4, PSME3, PSME2, PSME1, PSMD9, PSMD8, PSMD7, PSMD6, PSMD5, PSMD4, PSMD3, PSMD2, PSMD14, PSMD13, PSMD12, PSMD11, PSMD10, PSMD1, PSMC6, PSMC5, PSMC4, PSMC3, PSMC2, PSMC1, PSMB8, PSMB7, PSMB6, PSMB5, PSMB4, PSMB3, PSMB2, PSMB10, PSMB1, PSMA8, PSMA7, PSMA6, PSMA5, PSMA4, PSMA3, PSMA1"
"15","AURKA Activation by TPX2",0.0185550730359258,0.0342320781739434,0.268615954187336,2.19139561493425,93,64,"ACTR1A, AKAP9, ALMS1, AURKA, CCP110, CDK5RAP2, CENPJ, CEP131, CEP135, CEP152, CEP164, CEP192, CEP250, CEP290, CEP41, CEP57, CEP63, CEP70, CEP72, CEP76, CEP78, CETN2, CKAP5, CLASP1, CNTRL, CSNK1D, CSNK1E, DCTN1, DCTN2, DCTN3, DYNC1H1, DYNC1I2, DYNLL1"
"16","Abortive elongation of HIV-1 transcript in the absence of Tat",0.000590900137876699,0.00218670873299227,-0.409749958099719,-2.33950925766885,2,23,"SUPT5H, SUPT4H1, POLR2L, POLR2K, POLR2J, POLR2I, POLR2H, POLR2G, POLR2F, POLR2E, POLR2D, POLR2C, POLR2B, POLR2A, NELFE, NELFCD, NELFB, NELFA, NCBP2, NCBP1"
"17","Acetylcholine Neurotransmitter Release Cycle",0.000199282582702272,0.000811533243965676,-0.521917708636231,-2.50005719247022,0,16,"VAMP2, UNC13B, TSPOAP1, SYT1, STXBP1, STX1A, SNAP25, SLC5A7, RIMS1, RAB3A, PPFIA4, PPFIA3, PPFIA2, PPFIA1"
"18","Activated NOTCH1 Transmits Signal to the Nucleus",0.0704908099373864,0.0911786079574778,0.234303594818804,1.46912234786272,348,30,"ADAM10, ADAM17, APH1A, APH1B, ARRB1, ARRB2, CNTN1, DLL1, DLL4, DNER, DTX1, DTX2, DTX4, UBA52, ITCH, JAG1, JAG2, MIB1, MIB2, NCSTN, NEURL1, NEURL1B, NOTCH1, NUMB, PSEN1, PSEN2, PSENEN"
"19","Activation of APC/C and APC/C:Cdc20 mediated degradation of mitotic proteins",0.000202061022428773,0.000811533243965676,-0.414351827729901,-3.87050914348872,0,63,"UBE2E1, UBE2D1, UBC, UBB, RPS27A, PTTG1, PSMF1, PSME4, PSME3, PSME2, PSME1, PSMD9, PSMD8, PSMD7, PSMD6, PSMD5, PSMD4, PSMD3, PSMD2, PSMD14, PSMD13, PSMD12, PSMD11, PSMD10, PSMD1, PSMC6, PSMC5, PSMC4, PSMC3, PSMC2, PSMC1, PSMB8, PSMB7, PSMB6, PSMB5, PSMB4, PSMB3, PSMB2, PSMB10, PSMB1, PSMA8, PSMA7, PSMA6, PSMA5, PSMA4, PSMA3, PSMA1"
"20","Activation of ATR in response to replication stress",0.0208248264597795,0.036525416575044,0.277874818049491,1.77809978770682,101,32,"ATR, ATRIP, CDC25A, CDC45, CDC6, CDC7, CDK2, CHEK1, HUS1, MCM10, MCM2, MCM4, MCM6, MCM7, MCM8, ORC1, ORC2, ORC3, ORC4, ORC5, ORC6, RAD1, RAD17, RAD9A, RAD9B, RFC2, RFC3, RFC4, RFC5, RPA1, RPA2, RPA3"
"21","Activation of BH3-only proteins",0.0078740157480315,0.019226234396513,-0.322079709901622,-1.95001346929682,39,26,"YWHAZ, YWHAQ, YWHAH, YWHAG, YWHAE, YWHAB, TP73, TP63, TP53BP2, TP53, TFDP2, TFDP1"
"22","Activation of G protein gated Potassium channels",0.00481347773766546,0.0144005982444375,0.577462740821519,2.83284323095569,23,17,"GABBR1, GABBR2, GNB1, GNG12, GNG2, GNG3, GNG4, GNG7, GNGT2, KCNJ10, KCNJ12, KCNJ16, KCNJ2, KCNJ3, KCNJ4, KCNJ6, KCNJ9"
"23","Activation of GABAB receptors",0.00773143438453713,0.0191111984419732,0.577966965000364,3.56374086601188,37,29,"ADCY1, ADCY2, ADCY3, ADCY5, ADCY6, ADCY7, ADCY8, ADCY9, GABBR1, GABBR2, GNAI1, GNAI2, GNAI3, GNAL, GNB1, GNG12, GNG2, GNG3, GNG4, GNG7, GNGT2, KCNJ10, KCNJ12, KCNJ16, KCNJ2, KCNJ3, KCNJ4, KCNJ6, KCNJ9"
"24","Activation of HOX genes during differentiation",0.0342822774659182,0.0519630922309495,0.218376423037206,1.60523159197961,170,46,"ASH2L, CNOT6, CREBBP, CTCF, EED, EGR2, EP300, EZH2, H3-3A, HDAC3, JUN, KDM6A, KMT2C, KMT2D, MAFB, MEIS1, NCOA3, NCOA6, NCOR1, PAX6, PAXIP1, PBX1, PCGF2, PIAS2, PKNOX1, POLR2A, POLR2B, POLR2C, POLR2D, POLR2E, POLR2F, POLR2G, POLR2H, POLR2I, POLR2J, POLR2K, POLR2L, RARA, RARB, RARG, RBBP5, RBBP7"
"25","Activation of IRF3/IRF7 mediated by TBK1/IKK epsilon",0.0489620054837446,0.0677162620301858,-0.340723510455283,-1.59640987569058,249,15,"UBC, UBB, TRAF3, TLR4, TICAM1, TBK1, TANK, SARM1, RPS27A, PTPN11"
"26","Activation of Matrix Metalloproteinases",0.0812437311935807,0.102800265627923,0.306393573713289,1.46631200901841,404,16,"COL18A1, CTSK, FURIN, KLK2, KLKB1, MMP11, MMP14, MMP15, MMP16, MMP17, MMP2, MMP24, MMP9"
"27","Activation of NF-kappaB in B cells",0.000202634245187437,0.000811533243965676,-0.434660360932684,-4.02857795953289,0,62,"UBC, UBB, SKP1, RPS27A, RELA, REL, PSMF1, PSME4, PSME3, PSME2, PSME1, PSMD9, PSMD8, PSMD7, PSMD6, PSMD5, PSMD4, PSMD3, PSMD2, PSMD14, PSMD13, PSMD12, PSMD11, PSMD10, PSMD1, PSMC6, PSMC5, PSMC4, PSMC3, PSMC2, PSMC1, PSMB8, PSMB7, PSMB6, PSMB5, PSMB4, PSMB3, PSMB2, PSMB10, PSMB1, PSMA8, PSMA7, PSMA6, PSMA5, PSMA4, PSMA3, PSMA1, PRKCB"
"28","Activation of NMDA receptors and postsynaptic events",0.0205015923566879,0.0364443658786401,0.258377357055258,2.16679452694456,102,71,"ACTN2, ADCY1, ADCY8, APBA1, ARHGEF7, CALM1, CAMK1, CAMK2A, CAMK2B, CAMK2G, CAMK4, CAMKK1, CAMKK2, CASK, CREB1, DLG1, DLG2, DLG3, DLG4, ERBB4, GIT1, GRIA1, GRIA2, GRIA3, GRIA4, GRIN1, GRIN2A, GRIN2B, GRIN2D, GRIN3A, GRIN3B, HRAS, KIF17, KPNA2, KRAS, LIN7A, LIN7B, LIN7C, LRRC7, MAPK1, MAPK3, MAPT, NEFL, NRAS, NRG1, NRGN, PDPK1, PPM1E, PPM1F, PRKAA1, PRKAA2, PRKAB1, PRKAB2, PRKACA, PRKACB, PRKAG1, PRKAG2, PRKAG3, PRKAR1A, PRKAR1B, PRKAR2A, PRKAR2B, PRKX, RAC1, RASGRF1, RASGRF2, RPS6KA1, RPS6KA2, RPS6KA3, RPS6KA6"
"29","Activation of anterior HOX genes in hindbrain development during early embryogenesis",0.0342822774659182,0.0519630922309495,0.218376423037206,1.60523159197961,170,46,"ASH2L, CNOT6, CREBBP, CTCF, EED, EGR2, EP300, EZH2, H3-3A, HDAC3, JUN, KDM6A, KMT2C, KMT2D, MAFB, MEIS1, NCOA3, NCOA6, NCOR1, PAX6, PAXIP1, PBX1, PCGF2, PIAS2, PKNOX1, POLR2A, POLR2B, POLR2C, POLR2D, POLR2E, POLR2F, POLR2G, POLR2H, POLR2I, POLR2J, POLR2K, POLR2L, RARA, RARB, RARG, RBBP5, RBBP7"
"30","Activation of gene expression by SREBF (SREBP)",0.00570729718711782,0.0162537393131721,0.999927177395864,6.95186619135647,27,40,"FDFT1, ACACA"
"31","Activation of kainate receptors upon glutamate binding",0.00649746192893401,0.0176361497459134,0.468024551983227,2.62319184648018,31,23,"CALM1, DLG1, DLG3, DLG4, GNB1, GNB4, GNB5, GNG12, GNG13, GNG2, GNG3, GNG4, GNG7, GNGT2, GRIK1, GRIK2, GRIK3, GRIK4, GRIK5"
"32","Activation of the mRNA upon binding of the cap-binding complex and eIFs, and subsequent binding to 43S",0.0154030806161232,0.0300493314393355,0.271495190906441,2.02098888971826,76,48,"EIF1AX, EIF2S1, EIF2S2, EIF2S3, EIF3A, EIF3B, EIF3C, EIF3D, EIF3E, EIF3F, EIF3G, EIF3H, EIF3I, EIF3J, EIF3K, EIF3L, EIF3M, EIF4A1, EIF4A2, EIF4E, EIF4EBP1, EIF4G1, EIF4H, FAU, RPS18, RPS11, RPS12, RPS13, RPS14, RPS15, RPS15A, RPS16, RPS17, RPS19, RPS20, RPS21, RPS24, RPS25, RPS27A, RPS27L, RPS28, RPS3A, RPS4X, RPS5, RPS7, RPS8, RPS9, RPSA"
"33","Activation of the pre-replicative complex",0.00686813186813187,0.0181297162367658,-0.308477465491435,-1.94123011691692,34,28,"RPA3, RPA2, RPA1, PRIM2, PRIM1, POLE4, POLE3, POLE2, POLE, POLA2, POLA1, ORC6, ORC5, ORC4, ORC3, ORC2, ORC1, MCM8, MCM7, MCM6, MCM4, MCM2, MCM10"
"34","Acyl chain remodelling of PC",0.00159426066161817,0.00542692770672045,-0.457909275952312,-2.1934480472693,7,16,"TMEM86B, PNPLA8, PLAAT3, PLA2G6, PLA2G5, PLA2G4E, PLA2G4C, PLA2G4A, PLA2G3, PLA2G12A, PLA2G10, MBOAT2, LPCAT4, LPCAT3, LPCAT2, LPCAT1"
"35","Acyl chain remodelling of PE",0.0063770426464727,0.0174720599338317,-0.399191737763808,-1.96622867593901,31,17,"PNPLA8, PLAAT5, PLAAT3, PLAAT1, PLA2G6, PLA2G5, PLA2G4E, PLA2G4C, PLA2G4A, PLA2G3, PLA2G12A, PLA2G10, MBOAT2, MBOAT1, LPCAT4, LPCAT3"
"36","Adherens junctions interactions",0.00731409995936611,0.0185931604388059,0.56822684081523,3.35413181398383,35,26,"AFDN, CADM1, CADM2, CADM3, CDH10, CDH11, CDH12, CDH13, CDH18, CDH2, CDH24, CDH3, CDH4, CDH6, CDH7, CDH8, CDH9, CTNNA1, CTNNB1, CTNND1"
"37","Adrenaline,noradrenaline inhibits insulin secretion",0.00609137055837563,0.0168722620123774,0.653843356846775,3.50591163637345,29,21,"ADCY5, ADCY6, ADRA2A, ADRA2C, CACNA1C, CACNA1D, CACNA2D2, CACNB2, CACNB3, GNAI1, GNAI2, GNB1, GNB4, GNB5, GNG12, GNG13, GNG2, GNG3, GNG4, GNG7, GNGT2"
"38","Aggrephagy",0.195971802618328,0.219897327910244,0.236683288239504,1.21566418865287,972,19,"ARL13B, DYNC1H1, DYNC1I1, DYNC1I2, DYNC1LI1, DYNC1LI2, DYNLL1, DYNLL2, UBA52, HDAC6, HSF1, IFT88"
"39","Amine ligand-binding receptors",0.00731112916328188,0.0185931604388059,0.611786104037832,3.66485578147573,35,27,"ADRA1A, ADRA1B, ADRA1D, ADRA2A, ADRA2C, ADRB1, ADRB3, CHRM1, CHRM2, CHRM3, CHRM4, DRD2, DRD3, DRD5, HRH1, HRH2, HRH3, HRH4, HTR1A, HTR1F, HTR2A, HTR2B, HTR2C, HTR4, HTR5A, HTR6, HTR7"
"40","Amino acid transport across the plasma membrane",0.000196927924379677,0.000811533243965676,-0.773517642779192,-4.77905240947659,0,27,"SLC7A8, SLC7A6, SLC7A5, SLC7A3, SLC7A2, SLC7A11, SLC7A10, SLC7A1, SLC6A6, SLC6A20, SLC6A19, SLC6A15, SLC6A12, SLC43A2, SLC43A1, SLC3A2, SLC3A1, SLC38A5, SLC38A3, SLC38A2, SLC38A1, SLC36A4, SLC36A1, SLC25A29, SLC1A5, SLC1A4, SLC16A10"
"41","Amino acids regulate mTORC1",0.0192423331328924,0.0349892064700615,0.244191562801613,1.83158605318751,95,49,"ATP6V0B, ATP6V0C, ATP6V0D1, ATP6V0E1, ATP6V0E2, ATP6V1A, ATP6V1B2, ATP6V1C1, ATP6V1C2, ATP6V1D, ATP6V1E1, ATP6V1F, ATP6V1G1, ATP6V1G2, ATP6V1H, C12orf66, BMT2"
"42","Amplification  of signal from unattached  kinetochores via a MAD2  inhibitory signal",0.0437475029964043,0.0622939796188236,0.176695789978523,1.48005871054164,218,70,"AHCTF1, B9D2, BIRC5, BUB3, CDCA8, CENPC, CENPF, CENPH, CENPK, CENPM, CENPN, CENPO, CENPP, CENPQ, CENPT, CENPU, CKAP5, CLASP1, CLASP2, CLIP1, DYNC1H1, DYNC1I1, DYNC1I2, DYNC1LI1, DYNC1LI2, DYNLL1, DYNLL2, INCENP, ITGB3BP, KIF2A, KNL1, KNTC1, MAD1L1, MAPRE1, MIS12, NDEL1, NSL1, NUDC, NUF2, NUP107, NUP133, NUP160, NUP37, NUP43, NUP85, NUP98, PAFAH1B1, PMF1, PPP1CC, PPP2CA, PPP2CB, PPP2R1A, PPP2R1B, PPP2R5A, PPP2R5B, PPP2R5C, PPP2R5D, PPP2R5E"
"43","Amplification of signal from the kinetochores",0.0437475029964043,0.0622939796188236,0.176695789978523,1.48005871054164,218,70,"AHCTF1, B9D2, BIRC5, BUB3, CDCA8, CENPC, CENPF, CENPH, CENPK, CENPM, CENPN, CENPO, CENPP, CENPQ, CENPT, CENPU, CKAP5, CLASP1, CLASP2, CLIP1, DYNC1H1, DYNC1I1, DYNC1I2, DYNC1LI1, DYNC1LI2, DYNLL1, DYNLL2, INCENP, ITGB3BP, KIF2A, KNL1, KNTC1, MAD1L1, MAPRE1, MIS12, NDEL1, NSL1, NUDC, NUF2, NUP107, NUP133, NUP160, NUP37, NUP43, NUP85, NUP98, PAFAH1B1, PMF1, PPP1CC, PPP2CA, PPP2CB, PPP2R1A, PPP2R1B, PPP2R5A, PPP2R5B, PPP2R5C, PPP2R5D, PPP2R5E"
"44","Amyloid fiber formation",0.414246467817896,0.434894266836857,-0.136520535974366,-1.02230814050027,2110,40,"USP9X, UBE2L6, UBC, UBB, TTR, TSPAN5, TSPAN33, TSPAN15, TSPAN14"
"45","Anchoring of the basal body to the plasma membrane",0.0266009852216749,0.0432653984118711,0.224424762408712,1.94957884193086,134,87,"ACTR1A, AHI1, AKAP9, ALMS1, B9D1, B9D2, C2CD3, CC2D2A, CCP110, CDK5RAP2, CENPJ, CEP131, CEP135, CEP152, CEP162, CEP164, CEP192, CEP250, CEP290, CEP41, CEP57, CEP63, CEP70, CEP72, CEP76, CEP78, CEP83, CEP89, CEP97, CETN2, CKAP5, CLASP1, CNTRL, CSNK1D, CSNK1E, DCTN1, DCTN2, DCTN3, DYNC1H1, DYNC1I2, DYNLL1"
"46","Antigen Presentation: Folding, assembly and peptide loading of class I MHC",0.0225189318453567,0.0385222336643919,-0.365040709508578,-1.74859491496472,112,16,"TAPBP, TAP2, TAP1, SEC31A, SEC24D, SEC24B, SEC24A, SEC23A, SEC13, SAR1B"
"47","Antigen activates B Cell Receptor (BCR) leading to generation of second messengers",0.910629921259843,0.914247120549852,-0.105955298884151,-0.641500391411102,4625,26,"VAV1, TRPC1, SYK, STIM1, SOS1, SH3KBP1, PTPN6, PLCG2, PIK3R1, PIK3CD, PIK3AP1, ORAI2, ORAI1, NCK1, LYN, ITPR3, ITPR2, ITPR1"
"48","Antigen processing-Cross presentation",0.000202388180530257,0.000811533243965676,-0.412349784483566,-4.28432929650013,0,78,"VAMP8, UBC, UBB, TLR4, TLR2, TIRAP, TAPBP, TAP2, TAP1, STX4, SNAP23, SEC61G, SEC61B, SEC61A2, SEC61A1, SEC22B, RPS27A, PSMF1, PSME4, PSME3, PSME2, PSME1, PSMD9, PSMD8, PSMD7, PSMD6, PSMD5, PSMD4, PSMD3, PSMD2, PSMD14, PSMD13, PSMD12, PSMD11, PSMD10, PSMD1, PSMC6, PSMC5, PSMC4, PSMC3, PSMC2, PSMC1, PSMB8, PSMB7, PSMB6, PSMB5, PSMB4, PSMB3, PSMB2, PSMB10, PSMB1, PSMA8, PSMA7, PSMA6, PSMA5, PSMA4, PSMA3, PSMA1"
"49","Antigen processing: Ubiquitination & Proteasome degradation",0.000206015657189946,0.000811533243965676,-0.192011803819489,-3.67992497367108,0,276,"ZNRF2, ZNRF1, ZBTB16, WWP1, WSB1, UNKL, UFL1, UBR4, UBR2, UBR1, UBOX5, UBE4A, UBE3C, UBE3B, UBE3A, UBE2Z, UBE2W, UBE2V2, UBE2U, UBE2S, UBE2R2, UBE2Q2, UBE2Q1, UBE2O, UBE2N, UBE2M, UBE2L6, UBE2K, UBE2J2, UBE2J1, UBE2H, UBE2G2, UBE2G1, UBE2F, UBE2E3, UBE2E2, UBE2E1, UBE2D3, UBE2D2, UBE2D1, UBE3D, UBE2B, UBE2A, UBC, UBB, UBAC1, UBA6, UBA5, UBA3, UBA1, TRIP12, TRIM9, TRIM71, TRIM69, TRIM39, TRIM37, TRIM36, TRIM32, TRIM21, TRIM11, TRAIP, TRAF7, TPP2, THOP1, STUB1, SPSB2, SPSB1, SOCS3, SOCS1, SMURF2, SMURF1, SKP2, SKP1, SIAH2, SIAH1, SH3RF1, RPS27A, RNF7, RNF6, RNF41, RNF4, RNF34, RNF25, RNF220, RNF217, RNF213, RNF19B, RNF19A, RNF182, RNF144B, RNF14, RNF138, RNF130, RNF126, RNF123, RNF115, RNF114, RNF111, RLIM, RCHY1, RBX1, RBCK1, RBBP6, PSMF1, PSME4, PSME3, PSME2, PSME1, PSMD9, PSMD8, PSMD7, PSMD6, PSMD5, PSMD4, PSMD3, PSMD2, PSMD14, PSMD13, PSMD12, PSMD11, PSMD10, PSMD1, PSMC6, PSMC5, PSMC4, PSMC3, PSMC2, PSMC1, PSMB8, PSMB7, PSMB6, PSMB5, PSMB4, PSMB3, PSMB2, PSMB10, PSMB1, PSMA8, PSMA7, PSMA6, PSMA5, PSMA4, PSMA3, PSMA1"
"50","Antiviral mechanism by IFN-stimulated genes",0.0078125,0.019226234396513,-0.200516809175509,-1.94653152411686,38,68,"UBE2N, UBE2L6, UBE2E1, UBC, UBB, TRIM25, TPR, STAT1, SEH1L, SEC13, RPS27A, RNASEL, RANBP2, RAE1, PPM1B, POM121, POM121C, PLCG1, PIN1, PDE12, NUP42, NUP58, NUP98, NUP93, NUP88, NUP85, NUP54, NUP50, NUP43, NUP37, NUP35, NUP214, NUP210, NUP205, NUP188, NUP160, NUP155, NUP153, NUP133, NUP107, NEDD4, NDC1, MAPK3, KPNB1, KPNA7, KPNA4, KPNA3, KPNA2, KPNA1, JAK1, ISG15, IRF3, UBA52, FLNB, FLNA, EIF4G3, EIF4G2, EIF4G1, EIF4E2, EIF4E, EIF4A3, EIF4A2, EIF4A1, EIF2AK2"
"51","Apoptosis",0.000203707476064372,0.000811533243965676,-0.206065210836203,-2.92458543440652,0,148,"YWHAZ, YWHAQ, YWHAH, YWHAG, YWHAE, YWHAB, XIAP, VIM, UNC5B, UNC5A, UBC, UBB, UACA, TP73, TP63, TP53BP2, TP53, TRAF2, TRADD, TNFSF10, TNFRSF10B, TLR4, TJP2, TJP1, TICAM1, TFDP2, TFDP1, STK26, STK24, STAT3, SPTAN1, SATB1, RPS27A, ROCK1, RIPK1, PTK2, PSMF1, PSME4, PSME3, PSME2, PSME1, PSMD9, PSMD8, PSMD7, PSMD6, PSMD5, PSMD4, PSMD3, PSMD2, PSMD14, PSMD13, PSMD12, PSMD11, PSMD10, PSMD1, PSMC6, PSMC5, PSMC4, PSMC3, PSMC2, PSMC1, PSMB8, PSMB7, PSMB6, PSMB5, PSMB4, PSMB3, PSMB2, PSMB10, PSMB1, PSMA8, PSMA7, PSMA6, PSMA5, PSMA4, PSMA3, PSMA1, PRKCQ, PRKCD, PPP3R1, PPP3CC, PPP1R13B"
"52","Apoptotic cleavage of cellular proteins",0.0807466017447758,0.102299266120261,0.213494316704625,1.4194926594426,397,35,"ACIN1, ADD1, APC, BCAP31, BIRC2, BMX, CASP3, CASP6, CASP7, CASP8, CTNNB1, DBNL, DSG1, DSG2, DSG3, DSP"
"53","Apoptotic execution phase",0.0448692152917505,0.0636224076577276,0.219878110950653,1.55091716390028,222,41,"ACIN1, ADD1, APC, BCAP31, BIRC2, BMX, CASP3, CASP6, CASP7, CASP8, CTNNB1, DBNL, DFFA, DFFB, DNM1L, DSG1, DSG2, DSG3, DSP"
"54","Aquaporin-mediated transport",0.00869741100323625,0.020498068212788,0.363341635932963,2.30692171096101,42,31,"ADCY1, ADCY2, ADCY3, ADCY5, ADCY6, ADCY7, ADCY8, ADCY9, AQP11, AQP12A, AQP4, GNAS, GNB1, GNB4, GNB5, GNG12, GNG13, GNG2, GNG3, GNG4, GNG7, GNGT2"
"55","Arachidonic acid metabolism",0.0125506072874494,0.0264347165991903,0.300410923445286,2.02173651859828,61,36,"ABCC1, ALOX12, ALOX5, ALOX5AP, ALOX15B, ALOXE3, CBR1, CYP2U1, CYP4B1, CYP4F8, CYP4F3, EPHX2, FAAH, GGT5, GPX1, GPX2, GPX4, HPGD, HPGDS, LTA4H, LTC4S, MAPKAPK2, PLA2G4A, PON2, PON3, PRXL2B, PTGDS, PTGES, PTGES2, PTGES3, PTGIS, PTGR1, PTGR2, PTGS1, PTGS2"
"56","Asparagine N-linked glycosylation",0.0736576855979841,0.0945024367253324,0.114156091931078,0.940883279346583,379,258,"ACTR10, ACTR1A, ALG1, ALG10B, ALG10, ALG11, ALG12, ALG14, ALG2, ALG3, ALG5, ALG6, ALG8, ALG9, AMDHD2, AMFR, ANK1, ANK2, ANK3, ANKRD28, ARCN1, AREG, ARF1, ARF3, ARF4, ARF5, ARFGAP1, ARFGAP2, ARFGAP3, B4GALNT2, B4GALT1, B4GALT2, B4GALT3, B4GALT4, B4GALT5, B4GALT6, CALR, CANX, CAPZA2, CAPZB, CD55, CD59, CHST10, CHST8, CMAS, CNIH1, CNIH2, CNIH3, COG1, COG2, COG3, COG4, COG5, COG6, COG7, COG8, COPA, COPB1, COPB2, COPE, COPG1, COPG2, COPZ1, COPZ2, CSNK1D, CTSA, CTSC, CTSZ, DAD1, DCTN1, DCTN2, DCTN3, DCTN4, DCTN5, DCTN6, DDOST, DERL1, DERL2, DHDDS, DOLK, DOLPP1, DPAGT1, DPM2, DPM3, DYNC1H1, DYNC1I1, DYNC1I2, DYNC1LI1, DYNC1LI2, DYNLL1, DYNLL2, EDEM1, EDEM2, EDEM3"
"57","Assembly Of The HIV Virion",0.000797130330809087,0.00281782784772024,-0.473157167781332,-2.26648753415844,3,16,"VPS37D, VPS37C, VPS37B, VPS37A, VPS28, UBC, UBB, UBAP1, TSG101"
"58","Assembly and cell surface presentation of NMDA receptors",0.00630337535583571,0.0173171534911682,0.491927272727273,2.69613670938713,30,22,"ACTN2, APBA1, CAMK2A, CAMK2B, CAMK2G, CASK, DLG1, DLG2, DLG3, DLG4, GRIN1, GRIN2A, GRIN2B, GRIN2D, GRIN3A, GRIN3B, KIF17, LIN7A, LIN7B, LIN7C, LRRC7"
"59","Assembly of collagen fibrils and other multimeric structures",0.0112084776849399,0.024369399869837,0.413389421326507,2.84942816531697,54,39,"BMP1, CD151, COL11A1, COL11A2, COL15A1, COL18A1, COL4A1, COL4A2, COL4A3, COL4A4, COL4A5, COL5A1, COL5A2, COL5A3, COL6A1, COL6A2, COL6A3, COL6A5, COL8A1, COL8A2, COL9A1, COL9A2, CTSB, CTSS"
"60","Assembly of the pre-replicative complex",0.000201328769881216,0.000811533243965676,-0.420191559704395,-3.84553849660127,0,60,"UBC, UBB, RPS27A, PSMF1, PSME4, PSME3, PSME2, PSME1, PSMD9, PSMD8, PSMD7, PSMD6, PSMD5, PSMD4, PSMD3, PSMD2, PSMD14, PSMD13, PSMD12, PSMD11, PSMD10, PSMD1, PSMC6, PSMC5, PSMC4, PSMC3, PSMC2, PSMC1, PSMB8, PSMB7, PSMB6, PSMB5, PSMB4, PSMB3, PSMB2, PSMB10, PSMB1, PSMA8, PSMA7, PSMA6, PSMA5, PSMA4, PSMA3, PSMA1, ORC6, ORC5, ORC4, ORC3, ORC2, ORC1"
"61","Association of TriC/CCT with target proteins during biosynthesis",0.0111021396851029,0.0243476425632084,0.331842603450522,2.27453000389518,54,38,"AP3M1, ARFGEF2, CCNE1, CCNE2, CCT2, CCT3, CCT4, CCT5, CCT6A, CCT7, CCT8, DCAF7, FBXL3, FBXL5, FBXO4, FBXO6, FBXW10, FBXW2, FBXW4, FBXW5, FBXW7, FBXW9, FKBP9, GAPDHS, GBA"
"62","Asymmetric localization of PCP proteins",0.000201126307320998,0.000811533243965676,-0.534157188684748,-4.72695587364367,0,56,"WNT5A, UBC, UBB, SMURF2, SMURF1, SCRIB, RPS27A, PSMF1, PSME4, PSME3, PSME2, PSME1, PSMD9, PSMD8, PSMD7, PSMD6, PSMD5, PSMD4, PSMD3, PSMD2, PSMD14, PSMD13, PSMD12, PSMD11, PSMD10, PSMD1, PSMC6, PSMC5, PSMC4, PSMC3, PSMC2, PSMC1, PSMB8, PSMB7, PSMB6, PSMB5, PSMB4, PSMB3, PSMB2, PSMB10, PSMB1, PSMA8, PSMA7, PSMA6, PSMA5, PSMA4, PSMA3, PSMA1, PRICKLE1"
"63","Attenuation phase",0.00873096446700508,0.020498068212788,0.373932978034498,2.00503066244679,42,21,"COL4A6, CREBBP, DEDD2, DNAJB1, DNAJB6, EP300, FKBP4, HSBP1, HSF1, HSP90AB1, HSPA1B, HSPA1A, HSPA1L, HSPA2, HSPA8, HSPH1"
"64","Autodegradation of Cdh1 by Cdh1:APC/C",0.000201612903225806,0.000811533243965676,-0.426842944285477,-3.84210107317736,0,58,"UBE2E1, UBE2D1, UBC, UBB, RPS27A, PSMF1, PSME3, PSME2, PSME1, PSMD9, PSMD8, PSMD7, PSMD6, PSMD5, PSMD4, PSMD3, PSMD2, PSMD14, PSMD13, PSMD12, PSMD11, PSMD10, PSMD1, PSMC6, PSMC5, PSMC4, PSMC3, PSMC2, PSMC1, PSMB8, PSMB7, PSMB6, PSMB5, PSMB4, PSMB3, PSMB2, PSMB10, PSMB1, PSMA7, PSMA6, PSMA5, PSMA4, PSMA3, PSMA1"
"65","Autodegradation of the E3 ubiquitin ligase COP1",0.000199203187250996,0.000811533243965676,-0.626007828547068,-5.06866689061225,0,47,"UBC, UBB, TP53, RPS27A, PSMF1, PSME4, PSME3, PSME2, PSME1, PSMD9, PSMD8, PSMD7, PSMD6, PSMD5, PSMD4, PSMD3, PSMD2, PSMD14, PSMD13, PSMD12, PSMD11, PSMD10, PSMD1, PSMC6, PSMC5, PSMC4, PSMC3, PSMC2, PSMC1, PSMB8, PSMB7, PSMB6, PSMB5, PSMB4, PSMB3, PSMB2, PSMB10, PSMB1, PSMA8, PSMA7, PSMA6, PSMA5, PSMA4, PSMA3, PSMA1"
"66","Autophagy",0.0870717781402936,0.10827745104531,-0.117504183225267,-1.45233885543069,426,112,"WIPI2, WIPI1, WDR45B, VPS37D, VPS37C, VPS37B, VPS37A, VPS28, VDAC1, VCP, UVRAG, ULK1, UBE2N, UBC, UBB, UBAP1, TSG101, TSC2, TSC1, TOMM70, TOMM7, TOMM6, TOMM40, TOMM22, TOMM20"
