"","pathway","pval","padj","ES","NES","nMoreExtreme","size","leadingEdge"
"768","Resolution of D-Loop Structures",0.413917940466613,0.697118626563554,-0.20311236781273,-0.472651002047529,2057,33,"XRCC3, XRCC2, WRN, TOP3A, SPIDR, SLX4, SLX1A, RTEL1, RMI2, RMI1, RBBP8, RAD51D, RAD51C, RAD51B, RAD51AP1, RAD51, RAD50"
"769","Resolution of D-loop Structures through Holliday Junction Intermediates",0.453077699293643,0.697261918948401,-0.187914739593807,-0.44033351909383,2244,32,"XRCC3, XRCC2, WRN, TOP3A, SPIDR, SLX4, SLX1A, RMI2, RMI1, RBBP8, RAD51D, RAD51C, RAD51B, RAD51AP1, RAD51, RAD50"
"770","Resolution of D-loop Structures through Synthesis-Dependent Strand Annealing (SDSA)",0.364897466827503,0.697118626563554,-0.22636773611648,-0.569685258760463,1814,26,"XRCC3, XRCC2, WRN, TOP3A, RTEL1, RMI2, RMI1, RBBP8, RAD51D, RAD51C, RAD51B, RAD51AP1, RAD51, RAD50"
"771","Resolution of Sister Chromatid Cohesion",0.722233380196827,0.788705738870578,0.120846340810001,0.182342800288398,3595,97,"AHCTF1, B9D2, BIRC5, BUB1, BUB3, CCNB1, CCNB2, CDC20, CDCA8, CENPA, CENPC, CENPE, CENPF, CENPH, CENPI, CENPK, CENPL, CENPM, CENPN, CENPO, CENPP, CENPQ, CENPT, CENPU, CKAP5, CLASP1, CLASP2, CLIP1, DSN1, DYNC1H1, DYNC1I1, DYNC1I2, DYNC1LI1, DYNC1LI2, DYNLL1, DYNLL2, HDAC8, INCENP, ITGB3BP, KIF18A, KIF2A, KIF2C, KNL1, KNTC1, MAD1L1, MAD2L1, MAPRE1, MIS12, NDC80, NDE1, NDEL1, NSL1, NUDC, NUP107, NUP133, NUP160, NUP37, NUP43, NUP85, NUP98, PAFAH1B1, PDS5A, PDS5B, PLK1, PMF1, PPP1CC, PPP2CA, PPP2CB, PPP2R1A, PPP2R1B, PPP2R5A, PPP2R5B, PPP2R5C, PPP2R5D, PPP2R5E"
"772","Respiratory electron transport",0.705753533744774,0.779577125140671,-0.28663679456973,-0.418878611927681,3544,96,"UQCRQ, UQCRH, UQCRFS1, UQCRC2, UQCRC1, UQCRB, UQCR11, UQCR10, TRAP1, TMEM126B, TIMMDC1, TACO1, SURF1, SDHD, SDHC, SDHB, SDHA, SCO2, SCO1, NUBPL, NDUFV3, NDUFV2, NDUFV1, NDUFS8, NDUFS7, NDUFS6, NDUFS5, NDUFS4, NDUFS3, NDUFS2, NDUFS1, NDUFC2, NDUFC1, NDUFB9, NDUFB8, NDUFB7, NDUFB6, NDUFB5, NDUFB4, NDUFB3, NDUFB2, NDUFB11, NDUFB10, NDUFB1, NDUFAF7, NDUFAF6, NDUFAF5, NDUFAF4, NDUFAF3, NDUFAF2, NDUFAF1, NDUFAB1, NDUFA9, NDUFA8, NDUFA7, NDUFA6, NDUFA5, NDUFA4, NDUFA3, NDUFA2, NDUFA12, NDUFA11, NDUFA10, NDUFA1, MT-ND6, MT-ND5, MT-ND4, MT-ND3, MT-ND2, MT-ND1, MT-CYB, MT-CO3, MT-CO1"
"773","Respiratory electron transport, ATP synthesis by chemiosmotic coupling, and heat production by uncoupling proteins.",0.745256358498183,0.802917402478069,0.243919608004032,0.348119183699547,3691,115,"ACAD9, ATP5F1A, ATP5F1B, ATP5F1C, ATP5F1D, ATP5F1E, ATP5MC3, ATP5PD, ATP5PF, ATP5MF, ATP5ME, ATP5MG, ATP5PO, COQ10A, COQ10B, COX11, COX14, COX18, COX19, COX20, COX5A, COX5B, COX6A1, COX6B1, COX6C, COX7A2L, COX7B, COX7C, COX8A, CYC1, DMAC2L, ECSIT, ETFA, ETFDH, CYCS, LRPPRC, MT-ATP6, MT-ATP8, MT-CO1, MT-CO3, MT-CYB, MT-ND1, MT-ND2, MT-ND3, MT-ND4, MT-ND5, MT-ND6, NDUFA1, NDUFA10, NDUFA11, NDUFA12, NDUFA2, NDUFA3, NDUFA4, NDUFA5, NDUFA6, NDUFA7, NDUFA8, NDUFA9, NDUFAB1, NDUFAF1, NDUFAF2, NDUFAF3, NDUFAF4, NDUFAF5, NDUFAF6, NDUFAF7, NDUFB1, NDUFB10, NDUFB11, NDUFB2, NDUFB3, NDUFB4, NDUFB5, NDUFB6, NDUFB7, NDUFB8, NDUFB9, NDUFC1, NDUFC2, NDUFS1, NDUFS2, NDUFS3, NDUFS4, NDUFS5, NDUFS6, NDUFS7, NDUFS8, NDUFV1, NDUFV2, NDUFV3"
"774","Response of EIF2AK1 (HRI) to heme deficiency",0.159225602528645,0.697118626563554,0.537546866630959,1.59484300174494,805,15,"ASNS, ATF3, ATF4, ATF5, CEBPB, CEBPG, CHAC1, DDIT3, EIF2AK1, EIF2S1, EIF2S2, EIF2S3"
"775","Response of EIF2AK4 (GCN2) to amino acid deficiency",0.585960737656157,0.735246351552465,-0.485630584582765,-0.81205342521164,2954,71,"TRIB3, RPSA, RPS9, RPS8, RPS7, RPS5, RPS4X, RPS3A, RPS28, RPS27L, RPS27A, RPS25, RPS24, RPS21, RPS20, RPS19, RPS17, RPS16, RPS15A, RPS15, RPS14, RPS13, RPS12, RPS11, RPLP1, RPL8, RPL7A, RPL6, RPL5, RPL4, RPL3L, RPL38, RPL37A, RPL36, RPL35, RPL34, RPL32, RPL30, RPL3, RPL29, RPL28, RPL27, RPL26, RPL23, RPL22L1, RPL19, RPL18A, RPL18, RPL14, RPL13A, RPL12, RPL11, RPL10A, RPL10"
"776","Response of Mtb to phagocytosis",0.68151715833835,0.766434631741531,-0.15907416316017,-0.422486070145319,3395,22,"VPS33B, UBC, UBB, TRIM27, SFPQ, RPS27A, RNF213, RAB7A, RAB5A, PGK1, NOS2, MAPK3, MAPK1, KPNB1, KPNA1, HGS, GSK3A, UBA52, ENO1, DUSP16"
"777","Response to elevated platelet cytosolic Ca2+",0.701542721518987,0.776550433882653,-0.59624062926888,-0.843860985247778,3546,108,"PCDH7, PRKCB, PRKCG, HGF"
"778","Retinoid metabolism and transport",0.0150541951023685,0.697118626563554,-0.999597909127463,-2.4172788938366,74,29,"GPC6"
"779","Retrograde transport at the Trans-Golgi-Network",0.531859816806053,0.71690317834922,-0.160461857268512,-0.327432385643151,2670,45,"VTI1A, VPS54, VPS53, VPS52, VPS51, VAMP4, USP6NL, TMF1, TGOLN2, STX6, STX16, SCOC, RIC1, RHOBTB3, RGP1, RABEPK, RAB9B, RAB9A, RAB6B, RAB6A, PLIN3, NSF, NAPG, NAPB, NAPA, NAA38, NAA35, NAA30"
"780","Rev-mediated nuclear export of HIV RNA",0.350944154278827,0.697118626563554,-0.51897361478613,-1.18919223000247,1746,34,"XPO1, TPR, SEH1L, SEC13, RCC1, RANGAP1, RANBP2, RANBP1, RAE1, POM121, POM121C, NUP42, NUP58, NUP98, NUP93, NUP88, NUP85, NUP62, NUP54, NUP50, NUP43, NUP37, NUP35, NUP214, NUP210, NUP205, NUP188, NUP160, NUP155, NUP153, NUP133, NUP107"
"781","Rho GTPase cycle",0.770453207769276,0.820987474676444,-0.56640703570123,-0.756469230229754,3926,131,"ARHGAP15"
"782","Ribosomal scanning and start codon recognition",0.446272598009344,0.697118626563554,0.272830973629471,0.548463119591116,2196,48,"EIF1AX, EIF2S1, EIF2S2, EIF2S3, EIF3A, EIF3B, EIF3C, EIF3D, EIF3E, EIF3F, EIF3G, EIF3H, EIF3I, EIF3J, EIF3K, EIF3L, EIF3M, EIF4A1, EIF4A2, EIF4E, EIF4G1, EIF4H, EIF5, FAU, RPS18, RPS11, RPS12, RPS13, RPS14, RPS15, RPS15A, RPS16, RPS17, RPS19, RPS20, RPS21, RPS24, RPS25, RPS27A, RPS27L, RPS28, RPS3A, RPS4X, RPS5, RPS7, RPS8, RPS9, RPSA"
"783","Role of LAT2/NTAL/LAB on calcium mobilization",0.233467741935484,0.697118626563554,-0.321949912950315,-0.905043229107352,1157,17,"SYK, SOS1, SHC1, PIK3R2, PIK3R1, PIK3CB, PIK3CA, PDPK1, LYN, LAT2, IGLC7, IGLC3, IGLC2, IGLC1, GRB2, GAB2, FYN"
"784","Role of phospholipids in phagocytosis",0.20398406374502,0.697118626563554,0.995577000402091,2.49203784219381,1023,29,"ITPR1, AHCYL1"
"785","S Phase",0.847353870458136,0.873119019584285,-0.191299334868206,-0.246954879188105,4290,148,"WEE1, WAPL, UBE2E1, UBE2D1, UBC, UBB, TFDP2, TFDP1, STAG2, STAG1, SMC3, SMC1A, SKP2, SKP1, RPS27A, RPA3, RPA2, RPA1, RFC5, RFC4, RFC3, RFC2, RFC1, RBX1, RBL2, RB1, RAD21, PSMF1, PSME4, PSME3, PSME2, PSME1, PSMD9, PSMD8, PSMD7, PSMD6, PSMD5, PSMD4, PSMD3, PSMD2, PSMD14, PSMD13, PSMD12, PSMD11, PSMD10, PSMD1, PSMC6, PSMC5, PSMC4, PSMC3, PSMC2, PSMC1, PSMB9, PSMB8, PSMB7, PSMB6, PSMB5, PSMB4, PSMB3, PSMB2, PSMB10, PSMB1, PSMA8, PSMA7, PSMA6, PSMA5, PSMA4, PSMA3, PSMA1, PRIM2, PRIM1, POLE4, POLE3, POLE2, POLE, POLD4, POLD2, POLD1, POLA2, POLA1, PDS5B, PDS5A, PCNA, ORC6, ORC5, ORC4, ORC3, ORC2, ORC1"
"786","S33 mutants of beta-catenin aren't phosphorylated",0.19537732121691,0.697118626563554,0.347214783074451,1.03014844149178,988,15,"AMER1, APC, AXIN1, CSNK1A1, CTNNB1, GSK3B, PPP2CA, PPP2CB, PPP2R1A, PPP2R1B, PPP2R5A, PPP2R5B, PPP2R5C, PPP2R5D, PPP2R5E"
"787","S37 mutants of beta-catenin aren't phosphorylated",0.19537732121691,0.697118626563554,0.347214783074451,1.03014844149178,988,15,"AMER1, APC, AXIN1, CSNK1A1, CTNNB1, GSK3B, PPP2CA, PPP2CB, PPP2R1A, PPP2R1B, PPP2R5A, PPP2R5B, PPP2R5C, PPP2R5D, PPP2R5E"
"788","S45 mutants of beta-catenin aren't phosphorylated",0.19537732121691,0.697118626563554,0.347214783074451,1.03014844149178,988,15,"AMER1, APC, AXIN1, CSNK1A1, CTNNB1, GSK3B, PPP2CA, PPP2CB, PPP2R1A, PPP2R1B, PPP2R5A, PPP2R5B, PPP2R5C, PPP2R5D, PPP2R5E"
"789","SCF(Skp2)-mediated degradation of p27/p21",0.500098096919757,0.712437091771438,-0.473057833405265,-0.881879959902189,2548,56,"UBC, UBB, SKP2, SKP1, RPS27A, PSMF1, PSME3, PSME2, PSME1, PSMD9, PSMD8, PSMD7, PSMD6, PSMD5, PSMD4, PSMD3, PSMD2, PSMD14, PSMD13, PSMD12, PSMD11, PSMD10, PSMD1, PSMC6, PSMC5, PSMC4, PSMC3, PSMC2, PSMC1, PSMB9, PSMB8, PSMB7, PSMB6, PSMB5, PSMB4, PSMB3, PSMB2, PSMB10, PSMB1, PSMA7, PSMA6, PSMA5, PSMA4, PSMA3, PSMA1"
"790","SCF-beta-TrCP mediated degradation of Emi1",0.467491651934787,0.698786920708878,-0.55425764248504,-1.07149567570613,2379,52,"UBC, UBB, SKP1, RPS27A, PSMF1, PSME4, PSME3, PSME2, PSME1, PSMD9, PSMD8, PSMD7, PSMD6, PSMD5, PSMD4, PSMD3, PSMD2, PSMD14, PSMD13, PSMD12, PSMD11, PSMD10, PSMD1, PSMC6, PSMC5, PSMC4, PSMC3, PSMC2, PSMC1, PSMB9, PSMB8, PSMB7, PSMB6, PSMB5, PSMB4, PSMB3, PSMB2, PSMB10, PSMB1, PSMA8, PSMA7, PSMA6, PSMA5, PSMA4, PSMA3, PSMA1"
"791","SHC-mediated cascade:FGFR1",0.200434439178515,0.697118626563554,0.38928324292953,1.11594400962652,1014,18,"FGF1, FGF10, FGF17, FGF20, FGF22, FGF23, FGF3, FGF4, FGF5, FGF9, FGFR1, GRB2, HRAS, KL, KRAS"
"792","SHC-mediated cascade:FGFR2",0.216912487708948,0.697118626563554,0.410943674234814,1.14864260770259,1102,20,"FGF1, FGF10, FGF16, FGF17, FGF18, FGF20, FGF22, FGF23, FGF3, FGF4, FGF5, FGF7, FGF9, FGFR2, GRB2, HRAS"
"793","SHC-mediated cascade:FGFR3",0.190894568690096,0.697118626563554,0.368375460328088,1.07257075225983,955,16,"FGF1, FGF16, FGF17, FGF18, FGF20, FGF23, FGF4, FGF5, FGF9, FGFR3, GRB2, HRAS, KRAS"
"794","SHC-mediated cascade:FGFR4",0.190894568690096,0.697118626563554,0.368375460328088,1.07257075225983,955,16,"FGF1, FGF16, FGF17, FGF18, FGF20, FGF23, FGF4, FGF9, FGFR4, GRB2, HRAS, KLB, KRAS"
"795","SHC1 events in ERBB2 signaling",0.229282868525896,0.697118626563554,0.744711127838129,2.02239634835893,1150,22,"PRKCA, BTC"
"796","SLC transporter disorders",0.651125722255429,0.74982416870418,-0.472126665962006,-0.730937506528945,3267,84,"TPR, SLCO2A1, SLCO1B3, SLCO1B1, SLC9A9, SLC9A6, SLC7A7, SLC6A20, SLC6A19, SLC5A7, SLC5A5, SLC5A2, SLC5A1, SLC4A4, SLC4A1, SLC40A1, SLC3A2, SLC3A1, SLC35C1, SLC35A3, SLC35A2, SLC35A1, SLC34A1, SLC33A1, SLC2A9, SLC2A2, SLC2A1, SLC29A3, SLC27A4, SLC26A4, SLC26A3, SLC26A2, SLC24A5, SLC24A4, SLC24A1, SLC22A5, SLC22A12, SLC20A2, SLC1A3, SLC1A1, SLC17A8, SLC17A5, SLC16A1, SLC12A6, SLC12A3, SLC12A1, SLC11A2, SEH1L, SEC13, RHAG, RANBP2, RAE1, POM121, POM121C, NUP42, NUP58, NUP98, NUP93, NUP88, NUP85, NUP62, NUP54, NUP50, NUP43, NUP37, NUP35, NUP214, NUP210, NUP205, NUP188, NUP160, NUP155, NUP153, NUP133, NUP107"
"797","SLC-mediated transmembrane transport",0.750439710768028,0.805349933507152,-0.693920925739618,-0.858819679232232,3839,203,"SRI, SLCO4C1, SLCO4A1, SLCO3A1, SLCO2B1, SLCO2A1, SLCO1C1, SLCO1B3, SLCO1B1, SLC9A9, SLC9A8, SLC9A7, SLC9A6, SLC9A5, SLC9A4, SLC9A3, SLC9A2, SLC9A1, SLC8B1, SLC8A3, SLC8A2, SLC8A1, SLC7A8, SLC7A7, SLC7A6, SLC7A5, SLC7A3, SLC7A2, SLC7A11, SLC7A10, SLC7A1, SLC6A9, SLC6A7, SLC6A6, SLC6A20, SLC6A19, SLC6A15, SLC6A13, SLC6A11, SLC6A1, SLC5A7, SLC5A6, SLC5A5, SLC5A4, SLC5A2, SLC5A12, SLC5A10, SLC5A1, SLC50A1, SLC4A9, SLC4A8, SLC4A7, SLC4A5, SLC4A4, SLC4A3, SLC4A2, SLC4A10, SLC4A1, SLC47A1, SLC44A5, SLC44A4, SLC44A3, SLC44A2, SLC44A1, SLC43A2, SLC43A1, SLC41A2, SLC41A1, SLC40A1, SLC3A2, SLC3A1, SLC39A8, SLC39A7, SLC39A6, SLC39A3, SLC39A2, SLC39A14, SLC39A10, SLC39A1, SLC38A5, SLC38A4, SLC38A3, SLC38A2, SLC38A1, SLC36A4, SLC36A1, SLC35D2, SLC35D1, SLC35C1, SLC35B4, SLC35B3, SLC35B2, SLC35A3, SLC35A2, SLC35A1, SLC34A1, SLC33A1, SLC32A1, SLC31A1, SLC30A8, SLC30A7, SLC30A6, SLC30A5, SLC30A3, SLC30A2, SLC30A10, SLC30A1, SLC2A9, SLC2A8, SLC2A7, SLC2A6, SLC2A2, SLC2A13, SLC2A12, SLC2A1, SLC29A4, SLC29A3, SLC29A2, SLC29A1, SLC28A3, SLC28A2, SLC28A1, SLC27A6, SLC27A4, SLC27A1, SLC26A9, SLC26A7, SLC26A6, SLC26A4, SLC26A3, SLC26A2, SLC26A11, SLC26A1, SLC25A5, SLC25A4, SLC25A29, SLC25A26, SLC25A22, SLC25A18, SLC24A5, SLC24A4, SLC24A3, SLC24A2, SLC24A1, SLC22A5, SLC22A4, SLC22A3, SLC22A15, SLC22A12, SLC22A1, SLC20A2, SLC20A1, SLC1A6, SLC1A4, SLC1A3, SLC1A2, SLC1A1, SLC18A2, SLC18A1, SLC17A8, SLC17A7, SLC17A6, SLC17A5, SLC16A7, SLC16A3, SLC16A2, SLC16A10, SLC16A1, SLC15A4, SLC15A3, SLC15A2, SLC15A1, SLC14A2, SLC13A5, SLC13A4, SLC13A3, SLC13A1, SLC12A7, SLC12A6, SLC12A5, SLC12A4, SLC12A3, SLC12A2, SLC12A1, SLC11A2, SLC11A1"
"798","SMAD2/SMAD3:SMAD4 heterotrimer regulates transcription",0.357873620862588,0.697118626563554,-0.232089009295335,-0.568094156137073,1783,28,"WWTR1, UBC, UBB, TGIF2, TFDP2, TFDP1, SP1, SNW1, SMAD7, SMAD4, SMAD3, SMAD2, RPS27A, RNF111, RBL1"
"799","SRP-dependent cotranslational protein targeting to membrane",0.603845383536952,0.739727547035854,-0.653172667310774,-1.02024301165122,3014,82,"TRAM1, SSR4, SSR3, SSR2, SSR1, SRPRB, SRPRA, SRP9, SRP72, SRP68, SRP54, SRP19, SRP14, SPCS2, SPCS1, SEC61G, SEC61B, SEC61A2, SEC61A1, SEC11C, SEC11A, RPSA, RPS9, RPS8, RPS7, RPS5, RPS4X, RPS3A, RPS28, RPS27L, RPS27A, RPS25, RPS24, RPS21, RPS20, RPS19, RPS17, RPS16, RPS15A, RPS15, RPS14, RPS13, RPS12, RPS11, RPN2, RPN1, RPLP1, RPL8, RPL7A, RPL6, RPL5, RPL4, RPL3L, RPL38, RPL37A, RPL36, RPL35, RPL34, RPL32, RPL30, RPL3, RPL29, RPL28, RPL27, RPL26, RPL23, RPL22L1, RPL19, RPL18A, RPL18, RPL14, RPL13A, RPL12, RPL11, RPL10A, RPL10"
"800","SUMO E3 ligases SUMOylate target proteins",0.350702218603704,0.697118626563554,0.995337837837838,1.31528292818415,1722,151,"NR3C2, RORA, AAAS"
"801","SUMOylation",0.342185282789378,0.697118626563554,0.995335947005543,1.30469727980108,1687,157,"NR3C2, RORA, AAAS"
"802","SUMOylation of DNA damage response and repair proteins",0.585960737656157,0.735246351552465,-0.404373012267151,-0.67617753102765,2954,71,"XRCC4, XPC, WRN, UBE2I, TPR, TDG, SUMO2, SUMO1, STAG2, STAG1, SMC6, SMC5, SMC3, SMC1A, SEH1L, SEC13, SCMH1, RPA1, RNF2, RNF168, RING1, RANBP2, RAE1, RAD52, RAD21, POM121, POM121C, PML, PIAS4, PIAS2, PIAS1, PHC3, PHC2, PHC1, PCGF2, PARP1, NUP42, NUP58, NUP98, NUP93, NUP88, NUP85, NUP62, NUP54, NUP50, NUP43, NUP37, NUP35, NUP214, NUP210, NUP205, NUP188, NUP160, NUP155, NUP153, NUP133, NUP107, NSMCE2, NSMCE1"
"803","SUMOylation of DNA methylation proteins",0.605231629392971,0.739727547035854,0.196053732842317,0.570834711765944,3030,16,"BMI1, CBX2, CBX4, CBX8, DNMT1, DNMT3A, DNMT3B"
"804","SUMOylation of DNA replication proteins",0.424496309595053,0.697118626563554,-0.44155277874336,-0.910193470935047,2127,44,"UBE2I, TPR, TOP2B, TOP2A, TOP1, SUMO2, SUMO1, SEH1L, SEC13, RANGAP1, RANBP2, RAE1, POM121, POM121C, PIAS4, PIAS3, PCNA, NUP42, NUP58, NUP98, NUP93, NUP88, NUP85, NUP62, NUP54, NUP50, NUP43, NUP37, NUP35, NUP214, NUP210, NUP205, NUP188, NUP160, NUP155, NUP153, NUP133, NUP107"
"805","SUMOylation of RNA binding proteins",0.445348145209284,0.697118626563554,-0.396957549593997,-0.794434674718901,2244,47,"UBE2I, TPR, SUMO2, SUMO1, SEH1L, SEC13, SCMH1, RNF2, RING1, RANBP2, RAE1, POM121, POM121C, PHC3, PHC2, PHC1, PCGF2, NUP42, NUP58, NUP98, NUP93, NUP88, NUP85, NUP62, NUP54, NUP50, NUP43, NUP37, NUP35, NUP214, NUP210, NUP205, NUP188, NUP160, NUP155, NUP153, NUP133, NUP107, NOP58, NDC1"
"806","SUMOylation of SUMOylation proteins",0.357085668534828,0.697118626563554,-0.520693023790369,-1.18218955529485,1783,35,"UBE2I, TPR, TOPORS, SUMO2, SUMO1, SEH1L, SEC13, RANBP2, RAE1, POM121, POM121C, PIAS4, NUP42, NUP58, NUP98, NUP93, NUP88, NUP85, NUP62, NUP54, NUP50, NUP43, NUP37, NUP35, NUP214, NUP210, NUP205, NUP188, NUP160, NUP155, NUP153, NUP133, NUP107"
"807","SUMOylation of chromatin organization proteins",0.498618239242006,0.712437091771438,-0.35975856849917,-0.670988851531964,2525,55,"UBE2I, TPR, SUZ12, SUMO2, SUMO1, SEH1L, SEC13, SCMH1, SATB2, SATB1, RNF2, RING1, RANBP2, RAE1, POM121, POM121C, PIAS2, PIAS1, PHC3, PHC2, PHC1, PCGF2, NUP42, NUP58, NUP98, NUP93, NUP88, NUP85, NUP62, NUP54, NUP50, NUP43, NUP37, NUP35, NUP214, NUP210, NUP205, NUP188, NUP160, NUP155, NUP153, NUP133, NUP107"
"808","SUMOylation of intracellular receptors",0.206232631996824,0.697118626563554,0.995376574644867,2.54946961360215,1038,27,"NR3C2, RORA, AR"
"809","SUMOylation of transcription cofactors",0.472945891783567,0.705410821643287,-0.180870589389999,-0.383585491759225,2359,41,"ZNF131, UHRF2, UBE2I, TRIM28, TOPORS, SUMO2, SUMO1, SIN3A, SCMH1, SAFB, RNF2, RING1, PPARGC1A, PIAS4, PIAS3, PIAS2, PIAS1, PHC3, PHC2, PHC1, PCGF2, PARK7, NRIP1, NCOR2, NCOA2, NCOA1, MRTFA"
"810","SUMOylation of ubiquitinylation proteins",0.379987968718669,0.697118626563554,-0.498937698299258,-1.09675378431374,1894,38,"UBE2I, TRIM27, TPR, SUMO1, SEH1L, SEC13, RANBP2, RAE1, POM121, POM121C, PML, PIAS4, PIAS2, PIAS1, NUP42, NUP58, NUP98, NUP93, NUP88, NUP85, NUP62, NUP54, NUP50, NUP43, NUP37, NUP35, NUP214, NUP210, NUP205, NUP188, NUP160, NUP155, NUP153, NUP133, NUP107"
"811","Selective autophagy",0.320654316121403,0.697118626563554,-0.994765451983088,-1.95104865543552,1626,50,"PRKAG2"
"812","Selenoamino acid metabolism",0.618181818181818,0.747766323024055,-0.478471978471979,-0.769957896297217,3093,77,"TXNRD1, SEPSECS, SEPHS2, SECISBP2, SCLY, RPSA, RPS9, RPS8, RPS7, RPS5, RPS4X, RPS3A, RPS28, RPS27L, RPS27A, RPS25, RPS24, RPS21, RPS20, RPS19, RPS17, RPS16, RPS15A, RPS15, RPS14, RPS13, RPS12, RPS11, RPLP1, RPL8, RPL7A, RPL6, RPL5, RPL4, RPL3L, RPL38, RPL37A, RPL36, RPL35, RPL34, RPL32, RPL30, RPL3, RPL29, RPL28, RPL27, RPL26, RPL23, RPL22L1, RPL19, RPL18A, RPL18, RPL14, RPL13A, RPL12, RPL11, RPL10A, RPL10"
"813","Selenocysteine synthesis",0.519565217391304,0.71690317834922,-0.628593527588022,-1.11273672229599,2628,62,"SEPSECS, SEPHS2, SECISBP2, RPSA, RPS9, RPS8, RPS7, RPS5, RPS4X, RPS3A, RPS28, RPS27L, RPS27A, RPS25, RPS24, RPS21, RPS20, RPS19, RPS17, RPS16, RPS15A, RPS15, RPS14, RPS13, RPS12, RPS11, RPLP1, RPL8, RPL7A, RPL6, RPL5, RPL4, RPL3L, RPL38, RPL37A, RPL36, RPL35, RPL34, RPL32, RPL30, RPL3, RPL29, RPL28, RPL27, RPL26, RPL23, RPL22L1, RPL19, RPL18A, RPL18, RPL14, RPL13A, RPL12, RPL11, RPL10A, RPL10"
"814","Sema3A PAK dependent Axon repulsion",0.382259976293955,0.697118626563554,0.250200856989823,0.742318689906439,1934,15,"CFL1, FES, FYN, HSP90AB1, LIMK1, NRP1, PAK1, PAK2, PAK3, PLXNA1, PLXNA2, PLXNA3, PLXNA4, RAC1, SEMA3A"
"815","Sema4D in semaphorin signaling",0.282428888440589,0.697118626563554,-0.283080525653572,-0.742344423696544,1399,23,"SEMA4D, RRAS, ROCK2, ROCK1, RND1, RHOC, RHOB, RHOA, RAC1, PLXNB1, MYL9, MYL12B, MYH9, MYH14, MYH11, MYH10, MET, LIMK2, LIMK1"
"816","Sema4D induced cell migration and growth-cone collapse",0.25503355704698,0.697118626563554,-0.299043382632848,-0.824024877734978,1253,19,"SEMA4D, ROCK2, ROCK1, RND1, RHOC, RHOB, RHOA, PLXNB1, MYL9, MYL12B, MYH9, MYH14, MYH11, MYH10, LIMK2, LIMK1"
"817","Semaphorin interactions",0.399231080534197,0.697118626563554,0.994694069447243,1.77315250410188,1972,62,"SEMA6D, DPYSL2"
"818","Senescence-Associated Secretory Phenotype (SASP)",0.405628140703518,0.697118626563554,0.309428057980419,0.659201928215043,2017,43,"ANAPC1, ANAPC10, ANAPC15, ANAPC16, ANAPC2, ANAPC4, ANAPC5, ANAPC7, CCNA1, CCNA2, CDC16, CDC23, CDC26, CDC27, CDK4, CDK6, CDKN1A, CDKN1B, CDKN2D, CEBPB"
"819","Separation of Sister Chromatids",0.301033853638759,0.697118626563554,0.995741516831148,1.30522890517825,1484,157,"PTTG1, AHCTF1"
"820","Serotonin Neurotransmitter Release Cycle",0.0708925750394945,0.697118626563554,0.997790129243956,2.8603284056484,358,18,"PPFIA2, CPLX1"
"821","Sialic acid metabolism",0.18284561049445,0.697118626563554,-0.996045311347946,-2.33399539637393,905,32,"ST6GAL1"
"822","Signal amplification",0.270286396181384,0.697118626563554,0.494462053859039,1.28514411991116,1358,26,"GNA11, GNA13, GNA14, GNA15, GNAI1, GNAI2, GNAI3, GNB1, GNB2, GNB3, GNB4, GNB5, GNG10, GNG11, GNG12, GNG13, GNG2, GNG3, GNG4, GNG7, GNG8, GNGT2"
"823","Signal transduction by L1",0.250497809637595,0.697118626563554,0.309852326731094,0.846900679327205,1257,21,"CSNK2A1, CSNK2A2, CSNK2B, EGFR, FGFR1, ITGA2B, ITGA5, ITGA9, ITGAV, ITGB1, ITGB3, L1CAM, MAP2K1, MAP2K2, MAPK1, MAPK3, NCAM1, NRP1, PAK1"
"824","Signaling by BMP",0.133466135458167,0.697118626563554,0.996516846406323,2.7062198427205,669,22,"FSTL1, ACVR2A"
"825","Signaling by BRAF and RAF fusions",0.506625891946993,0.714281631369859,0.211299333429243,0.394164589683264,2484,56,"AGGF1, AGK, AGTRAP, AKAP9, AP3B1, APBB1IP, ARAF, ARRB1, ARRB2, ATG7, BCL2L11, BRAF, CALM1, CAMK2A, CAMK2B, CAMK2G, CLCN6, CNKSR1, CNKSR2, CSK, FAM114A2, FAM131B, FN1, FXR1, HRAS, IQGAP1, ITGA2B, ITGB3, JAK2, KDM7A, KRAS, KSR1, KSR2, LMNA, MAP2K1, MAP2K2, MAPK1, MAPK3, MARK3"
"826","Signaling by EGFR",0.139988186650916,0.697118626563554,-0.997584378984097,-1.99894294019977,710,48,"SH3GL2"
"827","Signaling by EGFR in Cancer",0.825768087215064,0.856592436246668,0.132336665268652,0.356050490103344,4165,23,"AREG, BTC, CBL, CDC37, EGF, EGFR, EREG, GAB1, UBA52, GRB2, HBEGF, HRAS"
"828","Signaling by ERBB2",0.41722526914483,0.697118626563554,0.744709141204194,1.49706425681557,2053,48,"PRKCA, AKT1"
"829","Signaling by ERBB2 KD Mutants",0.119823080016084,0.697118626563554,-0.996717357807999,-2.58896238659515,595,24,"NRG1"
"830","Signaling by ERBB2 in Cancer",0.124722949828733,0.697118626563554,-0.996717137880209,-2.54506100401427,618,25,"NRG1"
"831","Signaling by ERBB4",0.199332940945654,0.697118626563554,-0.996777442094663,-1.85820419532675,1015,56,"GABRG3, NRG1"
"832","Signaling by Erythropoietin",0.347370542010881,0.697118626563554,-0.23435347715396,-0.598408388089115,1723,25,"VAV1, STAT5B, STAT5A, SOS1, SHC1, RAPGEF1, PLCG2, PLCG1, PIK3R5, PIK3R1, PIK3CG, PIK3CD, PIK3CB, PIK3CA, NRAS, LYN, KRAS, JAK2, IRS2, HRAS, GRB2, GAB1, EPOR, EPO"
"833","Signaling by FGFR",0.618181818181818,0.747766323024055,-0.281609677132065,-0.453166756544431,3093,77,"UBC, UBB, TIAL1, TIA1, SRC, SPRY2, SPRED2, SPRED1, SOS1, SHC1, RPS27A, RBFOX2, PTPN11, PTBP1, PPP2R1A, PPP2CB, PPP2CA, POLR2L, POLR2K, POLR2J, POLR2I, POLR2H, POLR2G, POLR2F, POLR2E, POLR2D, POLR2C, POLR2B, POLR2A, PLCG1, PIK3R1, PIK3CA, NRAS, NCBP2, NCBP1, MKNK1, MAPK3, MAPK1, KRAS, KLB, KL, HRAS, HNRNPM, HNRNPH1, HNRNPF, HNRNPA1, GTF2F2, GTF2F1, GRB2, UBA52, GALNT3, GAB1, FRS3, FRS2, FLRT3, FLRT2, FGFR4, FGFR3, FGFR2, FGFR1, FGFBP3, FGFBP1, FGF9, FGF7, FGF5, FGF4, FGF3, FGF23, FGF22, FGF20, FGF18, FGF17, FGF16, FGF10, FGF1"
"834","Signaling by FGFR in disease",0.523473705420109,0.71690317834922,0.241133346764265,0.436891904023398,2597,60,"BAG4, BCR, CNTRL, CPSF6, CUX1, ERLIN2, FGF1, FGF10, FGF16, FGF17, FGF18, FGF20, FGF22, FGF23, FGF3, FGF4, FGF5, FGF7, FGF9, FGFR1, FGFR1OP, FGFR1OP2, FGFR2, FGFR3, FGFR4, FRS2, GAB1, GAB2, GRB2, GTF2F1, GTF2F2, HRAS, KRAS, LRRFIP1, MYO18A, NCBP1, NCBP2, NRAS, PIK3CA, PIK3R1, PLCG1, POLR2A, POLR2B, POLR2C, POLR2D, POLR2E, POLR2F, POLR2G, POLR2H, POLR2I, POLR2J, POLR2K, POLR2L"
"835","Signaling by FGFR1",0.426092160383004,0.697118626563554,-0.261448251888984,-0.53893555496125,2135,44,"UBC, UBB, SRC, SPRY2, SPRED2, SPRED1, SOS1, SHC1, RPS27A, PTPN11, PPP2R1A, PPP2CB, PPP2CA, PLCG1, PIK3R1, PIK3CA, NRAS, MKNK1, MAPK3, MAPK1, KRAS, KL, HRAS, GRB2, UBA52, GAB1, FRS3, FRS2, FLRT3, FLRT2, FGFR1, FGF9, FGF5, FGF4, FGF3, FGF23, FGF22, FGF20, FGF18, FGF17, FGF10, FGF1"
"836","Signaling by FGFR1 in disease",0.387335197762685,0.697118626563554,0.220451672221584,0.512817918251549,1938,35,"BAG4, BCR, CNTRL, CPSF6, CUX1, ERLIN2, FGF1, FGF17, FGF20, FGF23, FGF4, FGF5, FGF9, FGFR1, FGFR1OP, FGFR1OP2, FRS2, GAB1, GAB2"
"837","Signaling by FGFR2",0.562190041658401,0.727528904728358,-0.277526302911671,-0.477680200819576,2833,67,"UBC, UBB, TIAL1, TIA1, SRC, SPRY2, SOS1, SHC1, RPS27A, RBFOX2, PTPN11, PTBP1, PPP2R1A, PPP2CB, PPP2CA, POLR2L, POLR2K, POLR2J, POLR2I, POLR2H, POLR2G, POLR2F, POLR2E, POLR2D, POLR2C, POLR2B, POLR2A, PLCG1, PIK3R1, PIK3CA, NRAS, NCBP2, NCBP1, MKNK1, MAPK3, MAPK1, KRAS, HRAS, HNRNPM, HNRNPH1, HNRNPF, HNRNPA1, GTF2F2, GTF2F1, GRB2, UBA52, GAB1, FRS3, FRS2, FGFR2, FGFBP3, FGFBP1, FGF9, FGF7, FGF5, FGF4, FGF3, FGF23, FGF22, FGF20, FGF18, FGF17, FGF16, FGF10, FGF1"
"838","Signaling by FGFR2 IIIa TM",0.20695102685624,0.697118626563554,0.357262438893725,1.02415114390163,1047,18,"FGF1, FGFR2, GTF2F1, GTF2F2, NCBP1, NCBP2, POLR2A, POLR2B, POLR2C, POLR2D, POLR2E, POLR2F, POLR2G, POLR2H, POLR2I, POLR2J, POLR2K, POLR2L"
"839","Signaling by FGFR2 in disease",0.383523295340932,0.697118626563554,0.332722486754745,0.731938578046075,1917,40,"FGF1, FGF10, FGF16, FGF17, FGF18, FGF20, FGF22, FGF23, FGF3, FGF4, FGF5, FGF7, FGF9, FGFR2, FRS2, GAB1, GRB2, GTF2F1, GTF2F2, HRAS, KRAS, NCBP1, NCBP2, NRAS, PIK3CA, PIK3R1, PLCG1, POLR2A, POLR2B, POLR2C, POLR2D, POLR2E, POLR2F, POLR2G, POLR2H, POLR2I, POLR2J, POLR2K, POLR2L"
"840","Signaling by FGFR3",0.385803088028875,0.697118626563554,-0.254147741108958,-0.558661928706086,1923,38,"UBC, UBB, SRC, SPRY2, SOS1, SHC1, RPS27A, PTPN11, PPP2R1A, PPP2CB, PPP2CA, PLCG1, PIK3R1, PIK3CA, NRAS, MKNK1, MAPK3, MAPK1, KRAS, HRAS, GRB2, UBA52, GALNT3, GAB1, FRS3, FRS2, FGFR3, FGF9, FGF5, FGF4, FGF23, FGF20, FGF18, FGF17, FGF16, FGF1"
"841","Signaling by FGFR3 in disease",0.235201573254671,0.697118626563554,0.320102471368294,0.894729279211208,1195,20,"FGF1, FGF16, FGF17, FGF18, FGF20, FGF23, FGF4, FGF5, FGF9, FGFR3, FRS2, GAB1, GRB2, HRAS, KRAS, NRAS, PIK3CA, PIK3R1, PLCG1"
"842","Signaling by FGFR3 point mutants in cancer",0.235201573254671,0.697118626563554,0.320102471368294,0.894729279211208,1195,20,"FGF1, FGF16, FGF17, FGF18, FGF20, FGF23, FGF4, FGF5, FGF9, FGFR3, FRS2, GAB1, GRB2, HRAS, KRAS, NRAS, PIK3CA, PIK3R1, PLCG1"
"843","Signaling by FGFR4",0.380465302847974,0.697118626563554,-0.252704696113574,-0.563138578925208,1896,37,"UBC, UBB, SRC, SPRY2, SOS1, SHC1, RPS27A, PTPN11, PPP2R1A, PPP2CB, PPP2CA, PLCG1, PIK3R1, PIK3CA, NRAS, MKNK1, MAPK3, MAPK1, KRAS, KLB, HRAS, GRB2, UBA52, GAB1, FRS3, FRS2, FGFR4, FGF9, FGF4, FGF23, FGF20, FGF18, FGF17, FGF16, FGF1"
"844","Signaling by Hedgehog",0.794337396775462,0.836311356924116,-0.22467250194063,-0.302285714976789,4039,126,"WDR35, WDR19, VCP, UBC, UBB, TULP3, TTC21B, SYVN1, SUFU, SPOPL, SPOP, SMURF2, SMURF1, SMO, SKP1, SHH, SEL1L, SCUBE2, RPS27A, RPGRIP1L, RBX1, PTCH2, PTCH1, PSMF1, PSME4, PSME3, PSME2, PSME1, PSMD9, PSMD8, PSMD7, PSMD6, PSMD5, PSMD4, PSMD3, PSMD2, PSMD14, PSMD13, PSMD12, PSMD11, PSMD10, PSMD1, PSMC6, PSMC5, PSMC4, PSMC3, PSMC2, PSMC1, PSMB9, PSMB8, PSMB7, PSMB6, PSMB5, PSMB4, PSMB3, PSMB2, PSMB10, PSMB1, PSMA8, PSMA7, PSMA6, PSMA5, PSMA4, PSMA3, PSMA1, PRKAR2B, PRKAR2A, PRKAR1B, PRKAR1A, PRKACB, PRKACA"
