"","pathway","pval","padj","ES","NES","nMoreExtreme","size","leadingEdge"
"228","Dual incision in TC-NER",0.000607779578606159,0.00218670873299227,-0.265866647213306,-2.49809786464381,2,64,"ZNF830, XPA, XAB2, UVSSA, USP7, UBC, UBB, TCEA1, RPS27A, RPA3, RPA2, RPA1, RFC5, RFC4, RFC3, RFC2, RFC1, RBX1, PRPF19, PPIE, POLR2L, POLR2K, POLR2J, POLR2I, POLR2H, POLR2G, POLR2F, POLR2E, POLR2D, POLR2C, POLR2B, POLR2A, POLK, POLE4, POLE3, POLE2, POLE, POLD4, POLD2, POLD1"
"229","E2F mediated regulation of DNA replication",0.000196347928529354,0.000811533243965676,-0.485732984293194,-2.60440011879912,0,20,"TFDP2, TFDP1, RB1, PRIM2, PRIM1, PPP2R3B, PPP2R1B, PPP2R1A, PPP2CB, PPP2CA, POLA2, POLA1, ORC6, ORC5, ORC4, ORC3, ORC2, ORC1"
"230","E3 ubiquitin ligases ubiquitinate target proteins",0.000198294665873488,0.000811533243965676,-0.426268511774703,-3.25150296054008,0,42,"WDR61, WAC, VCP, UBE2V2, UBE2N, UBE2J2, UBE2E1, UBE2D3, UBE2D2, UBE2D1, UBE2B, UBE2A, UBC, UBB, TMEM129, SHPRH, SELENOS, RTF1, RRAGA, RPS27A, RNF40, RNF20, RNF181, RNF152, RNF144A, RAD18, PRKDC, PEX5, PEX2, PEX14, PEX13, PEX12, PEX10, PCNA, PAF1"
"231","ECM proteoglycans",0.0176829268292683,0.0334157738773649,0.257065850815851,1.85056702436912,86,44,"ACAN, AGRN, ASPN, BCAN, COL9A1, COL9A2, COMP, DAG1, DCN, DMP1, FMOD, HAPLN1, HSPG2, ITGA2, ITGA2B, ITGA7, ITGA8, ITGA9, ITGAV, ITGB1, ITGB3, ITGB5, ITGB6, LAMA1, LAMA2, LAMA3, LAMA4, LAMB1, LAMC1, LRP4, LUM, MATN4, MUSK, NCAM1, NCAN"
"232","EGFR downregulation",0.211519559661883,0.235513518522207,-0.191402770564074,-1.22604806469536,1075,29,"UBC, UBB, TGFA, STAM2, STAM, SPRY2, SPRY1, SH3KBP1, SH3GL3, SH3GL2, SH3GL1, RPS27A, PTPRK, PTPN3, PTPN12"
"233","EML4 and NUDC in mitotic spindle formation",0.0322902132748655,0.0501554589217726,0.186063856234684,1.56357547057889,161,74,"AHCTF1, B9D2, BIRC5, BUB3, CDCA8, CENPC, CENPF, CENPH, CENPK, CENPM, CENPN, CENPO, CENPP, CENPQ, CENPT, CENPU, CKAP5, CLASP1, CLASP2, CLIP1, DYNC1H1, DYNC1I1, DYNC1I2, DYNC1LI1, DYNC1LI2, DYNLL1, DYNLL2, EML4, INCENP, ITGB3BP, KIF2A, KNL1, KNTC1, MAD1L1, MAPRE1, MIS12, NDEL1, NEK6, NEK7, NEK9, NSL1, NUDC, NUF2, NUP107, NUP133, NUP160, NUP37, NUP43, NUP85, NUP98, PAFAH1B1, PMF1, PPP1CC, PPP2CA, PPP2CB, PPP2R1A, PPP2R1B, PPP2R5A, PPP2R5B, PPP2R5C, PPP2R5D, PPP2R5E"
"234","EPH-Ephrin signaling",0.0257323832145685,0.0423434351244642,0.265776604168578,2.30739795516767,129,86,"ACTB, ACTG1, ACTR2, ACTR3, ADAM10, AP2A1, AP2A2, AP2B1, AP2M1, AP2S1, APH1A, APH1B, ARHGEF28, ARHGEF7, ARPC1A, ARPC1B, ARPC2, ARPC3, ARPC4, ARPC5, CDC42, CFL1, CLTA, CLTB, CLTC, DNM1, EFNA1, EFNA2, EFNA3, EFNA5, EFNB1, EFNB2, EFNB3, EPHA1, EPHA10, EPHA3, EPHA4, EPHA5, EPHA6, EPHA7, EPHA8, EPHB1, EPHB2, EPHB3, EPHB4, EPHB6"
"235","EPH-ephrin mediated repulsion of cells",0.0132317562149158,0.0275047693349551,0.426309320933297,3.1336953889061,65,46,"ADAM10, AP2A1, AP2A2, AP2B1, AP2M1, AP2S1, APH1A, APH1B, CLTA, CLTB, CLTC, DNM1, EFNA1, EFNA2, EFNA3, EFNA5, EFNB1, EFNB2, EFNB3, EPHA1, EPHA10, EPHA3, EPHA4, EPHA5, EPHA6, EPHA7, EPHA8, EPHB1, EPHB2, EPHB3, EPHB4, EPHB6"
"236","EPHB-mediated forward signaling",0.0322188449848024,0.0501554589217726,0.252412800904319,1.65735885201798,158,34,"ACTB, ACTG1, ACTR2, ACTR3, ARHGEF28, ARPC1A, ARPC1B, ARPC2, ARPC3, ARPC4, ARPC5"
"237","ER Quality Control Compartment (ERQC)",0.0569557451875372,0.0770846832457833,-0.294863895724186,-1.53921969291929,286,19,"UGGT2, UGGT1, UBC, UBB, TRIM13, SYVN1, SEL1L, RPS27A, RNF5, RNF185, RNF103"
"238","ER to Golgi Anterograde Transport",0.0364140114783297,0.0544160547945684,0.199705649269784,1.79930033308789,183,121,"ACTR10, ACTR1A, ANK1, ANK2, ANK3, ANKRD28, ARCN1, AREG, ARF1, ARF3, ARF4, ARF5, ARFGAP1, ARFGAP2, ARFGAP3, CAPZA2, CAPZB, CD55, CD59, CNIH1, CNIH2, CNIH3, COG1, COG2, COG3, COG4, COG5, COG6, COG7, COG8, COPA, COPB1, COPB2, COPE, COPG1, COPG2, COPZ1, COPZ2, CSNK1D, CTSC, CTSZ, DCTN1, DCTN2, DCTN3, DCTN4, DCTN5, DCTN6, DYNC1H1, DYNC1I1, DYNC1I2, DYNC1LI1, DYNC1LI2, DYNLL1, DYNLL2"
"239","ER-Phagosome pathway",0.000200682319887618,0.000811533243965676,-0.509557306291757,-4.98274342461571,0,69,"VAMP8, UBC, UBB, TLR4, TLR2, TIRAP, TAPBP, TAP2, TAP1, STX4, SNAP23, SEC61G, SEC61B, SEC61A2, SEC61A1, SEC22B, RPS27A, PSMF1, PSME4, PSME3, PSME2, PSME1, PSMD9, PSMD8, PSMD7, PSMD6, PSMD5, PSMD4, PSMD3, PSMD2, PSMD14, PSMD13, PSMD12, PSMD11, PSMD10, PSMD1, PSMC6, PSMC5, PSMC4, PSMC3, PSMC2, PSMC1, PSMB8, PSMB7, PSMB6, PSMB5, PSMB4, PSMB3, PSMB2, PSMB10, PSMB1, PSMA8, PSMA7, PSMA6, PSMA5, PSMA4, PSMA3, PSMA1"
"240","ERCC6 (CSB) and EHMT2 (G9a) positively regulate rRNA expression",0.0290872617853561,0.0462377699135141,0.352827856935156,1.68853320737193,144,16,"CBX3, CHD3, CHD4, EHMT2, ERCC6, GATAD2A, GATAD2B, H3-3A, HDAC1, HDAC2, MBD3, MTA1, MTA2, MTA3"
"241","ERK/MAPK targets",0.0488477447311404,0.067650780716689,-0.289052571068424,-1.58378285784168,247,21,"VRK3, RPS6KA5, RPS6KA3, RPS6KA2, RPS6KA1, PPP2R5D, PPP2R1B, PPP2R1A, PPP2CB, PPP2CA, MEF2C, MEF2A, MAPK7, MAPK3, MAPK14, MAPK11, MAPK1"
"242","ESR-mediated signaling",0.0528398970908371,0.0719961401062484,0.134296435806684,1.22442551124111,266,139,"AGO1, AGO2, AGO3, AGO4, AKT1, AKT2, AKT3, AREG, ATF2, AXIN1, BCL2, CALM1, CARM1, CAV2, CBFB, CCND1, CCNT1, CDK9, CDKN1B, CHD1, CREB1, CREBBP, CXCL12, CXXC5, DDX5, EBAG9, EGF, EGFR, ELK1, EP300, EPGN, ERBB4, ESR1, ESR2, FKBP4, FKBP5, FOS, FOSB, FOXO3, GNAI1, GNAI2, GNAI3, GNB1, GNB4, GNB5, GNG12, GNG13, GNG2, GNG3, GNG4, GNG7, GNGT2, GPAM, GTF2A1, GTF2A2, GTF2F1, GTF2F2, H3-3A, HBEGF, HDAC1, HRAS, HSP90AB1, IGF1R, JUN, JUND, KANK1, KAT2B, KAT5, KCTD6, KDM1A, KDM4B, KPNA2, KRAS, MAPK1, MAPK3, MED1, MMP2, MMP9, MOV10, MYB, MYC, NCOA1, NCOA2, NCOA3, NOS3, NRAS, NRIP1, PDPK1, PGR, PIK3CA, PIK3R1, PIK3R2, PIK3R3, POLR2A, POLR2B, POLR2C, POLR2D, POLR2E, POLR2F, POLR2G, POLR2H, POLR2I, POLR2J, POLR2K, POLR2L, POU2F1, PPID, PPP5C, PRKCZ, PRMT1, PTGES3, PTK2"
"243","Effects of PIP2 hydrolysis",0.0156440471353109,0.0302411695101324,0.313668871503878,1.85152594949254,76,26,"ABHD12, ABHD6, DAGLA, DAGLB, DGKA, DGKB, DGKD, DGKE, DGKG, DGKH, DGKI, DGKK, DGKQ, DGKZ"
"244","Elastic fibre formation",0.00787719652595435,0.019226234396513,0.404584485518847,2.53681173664425,38,30,"BMP7, EFEMP1, EFEMP2, ELN, FBLN1, FBLN2, FBLN5, FBN1, FBN2, FURIN, ITGA5, ITGA8, ITGAV, ITGB1, ITGB3, ITGB5, ITGB6, ITGB8, LOXL1, LOXL2, LOXL4, LTBP3, LTBP4, MFAP1, MFAP2, MFAP3, MFAP4"
"245","Endosomal Sorting Complex Required For Transport (ESCRT)",0.000393159032828779,0.00151134517942926,-0.359139574504387,-2.30050160182618,1,29,"VTA1, VPS4B, VPS4A, VPS37D, VPS37C, VPS37B, VPS37A, VPS36, VPS28, UBC, UBB, UBAP1, TSG101"
"246","Energy dependent regulation of mTOR by LKB1-AMPK",0.000393159032828779,0.00151134517942926,-0.376133806050478,-2.40935971624461,1,29,"TSC2, TSC1, STRADB, STRADA, STK11, SLC38A9, RRAGD, RRAGC, RRAGB, RRAGA, RPTOR, RHEB, PRKAG3, PRKAG2, PRKAG1, PRKAB2, PRKAB1, PRKAA2, PRKAA1, PPM1A, MTOR, MLST8, LAMTOR5, LAMTOR4, LAMTOR3, LAMTOR2, LAMTOR1"
"247","Ephrin signaling",0.102826217678894,0.125174314796231,0.278189779134959,1.3989430099479,512,18,"ARHGEF7, EFNB1, EFNB2, EFNB3, EPHB1, EPHB2, EPHB3, EPHB4, EPHB6, FYN, GIT1"
"248","Epigenetic regulation of gene expression",0.400435471100554,0.421708605502771,0.095896672546041,0.832548022171918,2022,86,"ACTB, AEBP2, ARID4B, BAZ1B, BAZ2A, CBX3, CCNH, CD3EAP, CDK7, CHD3, CHD4, DDX21, DEK, DNMT1, DNMT3A, DNMT3B, DNMT3L, EED, EHMT2, EP300, ERCC2, ERCC3, ERCC6, EZH2, GATAD2A, GATAD2B, GSK3B, GTF2H1, GTF2H2, GTF2H3, GTF2H4, GTF2H5, H3-3A, HDAC1, HDAC2, JARID2, KAT2A, KAT2B, MBD2, MBD3, MNAT1, MTA1, MTA2, MTA3, MTF2, MYBBP1A, MYO1C, PHF1, POLR1A, POLR1B, POLR1C, POLR1D, POLR1E, POLR2E, POLR2F, POLR2H, POLR2K, POLR2L, RBBP7, RRP8, SAP130, SAP18, SAP30, SAP30BP, SAP30L, SF3B1, SIN3A, SIN3B, SIRT1, SMARCA5, SUDS3, SUV39H1, SUZ12, TAF1A, TAF1B, TAF1C, TAF1D, TBP, TDG, TET1, TET2, TET3"
"249","Estrogen-dependent gene expression",0.162291169451074,0.186598870874349,0.124392025512658,1.06976837576335,815,82,"AGO1, AGO2, AGO3, AGO4, ATF2, AXIN1, BCL2, CARM1, CBFB, CCND1, CCNT1, CDK9, CHD1, CREBBP, CXCL12, CXXC5, DDX5, EBAG9, EP300, ERBB4, ESR1, FKBP4, FOS, FOSB, GPAM, GTF2A1, GTF2A2, GTF2F1, GTF2F2, H3-3A, HDAC1, HSP90AB1, JUN, JUND, KANK1, KAT2B, KAT5, KCTD6, KDM1A, KDM4B, KPNA2, MED1, MOV10, MYB, MYC, NCOA1, NCOA2, NCOA3, NRIP1, PGR, POLR2A, POLR2B, POLR2C, POLR2D, POLR2E, POLR2F, POLR2G, POLR2H, POLR2I, POLR2J, POLR2K, POLR2L, POU2F1"
"250","Estrogen-dependent nuclear events downstream of ESR-membrane signaling",0.0189101260675071,0.0345716771324588,0.323636363636364,1.77377415091258,92,22,"AKT1, AKT2, AKT3, AREG, BCL2, CCND1, CDKN1B, CREB1, EGF, EGFR, ELK1, EPGN, FOS, FOXO3"
"251","Eukaryotic Translation Elongation",0.000202634245187437,0.000811533243965676,-0.581242794287193,-5.38715309852084,0,62,"RPSA, RPS9, RPS8, RPS7, RPS5, RPS4X, RPS3A, RPS28, RPS27L, RPS27A, RPS25, RPS24, RPS21, RPS20, RPS19, RPS17, RPS16, RPS15A, RPS15, RPS14, RPS13, RPS12, RPS11, RPLP1, RPL8, RPL7A, RPL6, RPL5, RPL4, RPL3L, RPL38, RPL37A, RPL36, RPL35, RPL34, RPL32, RPL30, RPL3, RPL29, RPL28, RPL27, RPL26, RPL23, RPL22L1, RPL19, RPL18A, RPL18, RPL14, RPL13A, RPL12, RPL11, RPL10A, RPL10"
"252","Eukaryotic Translation Initiation",0.000202963263649279,0.000811533243965676,-0.33509967705223,-3.66784000301115,0,87,"RPSA, RPS9, RPS8, RPS7, RPS5, RPS4X, RPS3A, RPS28, RPS27L, RPS27A, RPS25, RPS24, RPS21, RPS20, RPS19, RPS17, RPS16, RPS15A, RPS15, RPS14, RPS13, RPS12, RPS11, RPLP1, RPL8, RPL7A, RPL6, RPL5, RPL4, RPL3L, RPL38, RPL37A, RPL36, RPL35, RPL34, RPL32, RPL30, RPL3, RPL29, RPL28, RPL27, RPL26, RPL23, RPL22L1, RPL19, RPL18A, RPL18, RPL14, RPL13A, RPL12, RPL11, RPL10A, RPL10"
"253","Eukaryotic Translation Termination",0.000202061022428773,0.000811533243965676,-0.583599929139356,-5.45147555942648,0,63,"TRMT112, RPSA, RPS9, RPS8, RPS7, RPS5, RPS4X, RPS3A, RPS28, RPS27L, RPS27A, RPS25, RPS24, RPS21, RPS20, RPS19, RPS17, RPS16, RPS15A, RPS15, RPS14, RPS13, RPS12, RPS11, RPLP1, RPL8, RPL7A, RPL6, RPL5, RPL4, RPL3L, RPL38, RPL37A, RPL36, RPL35, RPL34, RPL32, RPL30, RPL3, RPL29, RPL28, RPL27, RPL26, RPL23, RPL22L1, RPL19, RPL18A, RPL18, RPL14, RPL13A, RPL12, RPL11, RPL10A, RPL10"
"254","Export of Viral Ribonucleoproteins from Nucleus",0.000197706603400554,0.000811533243965676,-0.478802547591268,-3.16708036651173,0,31,"XPO1, TPR, SEH1L, SEC13, RANBP2, RAE1, POM121, POM121C, NUP42, NUP58, NUP98, NUP93, NUP88, NUP85, NUP54, NUP50, NUP43, NUP37, NUP35, NUP214, NUP210, NUP205, NUP188, NUP160, NUP155, NUP153, NUP133, NUP107"
"255","Extension of Telomeres",0.00019657951641439,0.000811533243965676,-0.433356668096862,-2.77590602621463,0,29,"WRAP53, TERT, RUVBL2, RUVBL1, RPA3, RPA2, RPA1, RFC5, RFC4, RFC3, RFC2, RFC1, PRIM2, PRIM1, POLE4, POLE3, POLE2, POLE, POLD4, POLD2, POLD1, POLA2, POLA1"
"256","Extra-nuclear estrogen signaling",0.069116186693148,0.0900469906530575,0.17175709840529,1.36659400801047,347,60,"AKT1, AKT2, AKT3, AREG, BCL2, CALM1, CAV2, CCND1, CDKN1B, CREB1, EGF, EGFR, ELK1, EPGN, ESR1, ESR2, FOS, FOXO3, GNAI1, GNAI2, GNAI3, GNB1, GNB4, GNB5, GNG12, GNG13, GNG2, GNG3, GNG4, GNG7, GNGT2, HBEGF, HRAS, IGF1R"
"257","Extracellular matrix organization",0.0602691632533645,0.0803853879276406,0.259248255676891,2.24287255053575,308,214,"ACAN, ACTN1, ADAM10, ADAM12, ADAM15, ADAM17, ADAM8, ADAM9, ADAMTS1, ADAMTS14, ADAMTS18, ADAMTS2, ADAMTS3, ADAMTS4, ADAMTS5, ADAMTS8, ADAMTS9, AGRN, ASPN, BCAN, BMP1, BMP7, BSG, CAPN1, CAPN10, CAPN11, CAPN12, CAPN15, CAPN2, CAPN3, CAPN5, CAPN6, CAPN7, CAPN9, CAPNS1, CASK, CASP3, CAST, CD151, CD44, CD47, COL11A1, COL11A2, COL12A1, COL13A1, COL14A1, COL15A1, COL16A1, COL17A1, COL18A1, COL19A1, COL20A1, COL23A1, COL25A1, COL26A1, COL28A1, COL4A1, COL4A2, COL4A3, COL4A4, COL4A5, COL4A6, COL5A1, COL5A2, COL5A3, COL6A1, COL6A2, COL6A3, COL6A5, COL8A1, COL8A2, COL9A1, COL9A2, COLGALT1, COLGALT2, COMP, CRTAP, CTSB, CTSK, CTSS, DAG1, DCN, DDR1, DDR2, DMD, DMP1, DST, EFEMP1, EFEMP2, ELN, F11R, FBLN1, FBLN2, FBLN5, FBN1, FBN2, FGF2, FMOD, FN1, FURIN, HAPLN1, HSPG2, HTRA1, ICAM1, ICAM5, ITGA1, ITGA11, ITGA2, ITGA2B, ITGA3, ITGA4, ITGA5, ITGA6, ITGA7, ITGA8, ITGA9, ITGAD, ITGAE, ITGAL, ITGAV, ITGB1, ITGB3, ITGB4, ITGB5, ITGB6, ITGB7, ITGB8, JAM2, JAM3, KDR, KLK2, KLK7, KLKB1, LAMA1, LAMA2, LAMA3, LAMA4, LAMB1, LAMB3, LAMC1, LAMC2, LAMC3, LOXL1, LOXL2, LOXL4, LRP4, LTBP3, LTBP4, LUM, MATN4, MFAP1, MFAP2, MFAP3, MFAP4, MMP11, MMP14, MMP15, MMP16, MMP17, MMP2, MMP20, MMP24, MMP9"
"258","FBXL7 down-regulates AURKA during mitotic entry and in early mitosis",0.000200320512820513,0.000811533243965676,-0.570498062937733,-4.82072591989993,0,51,"UBC, UBB, SKP1, RPS27A, RBX1, PSMF1, PSME4, PSME3, PSME2, PSME1, PSMD9, PSMD8, PSMD7, PSMD6, PSMD5, PSMD4, PSMD3, PSMD2, PSMD14, PSMD13, PSMD12, PSMD11, PSMD10, PSMD1, PSMC6, PSMC5, PSMC4, PSMC3, PSMC2, PSMC1, PSMB8, PSMB7, PSMB6, PSMB5, PSMB4, PSMB3, PSMB2, PSMB10, PSMB1, PSMA8, PSMA7, PSMA6, PSMA5, PSMA4, PSMA3, PSMA1"
"259","FCERI mediated Ca+2 mobilization",0.0838582677165354,0.105579960973122,-0.2422466955422,-1.46666897875754,425,26,"VAV3, VAV2, VAV1, TEC, SYK, SOS1, SHC1, PPP3R1, PPP3CB, PPP3CA, PLCG2, PLCG1, NFATC3, NFATC2, LYN, LCP2, LAT, ITPR3, ITPR2, ITPR1, ITK, GRB2, GRAP2"
"260","FCERI mediated MAPK activation",0.00294869274621584,0.009452532268882,-0.32337214933245,-2.0713900676412,14,29,"VAV3, VAV2, VAV1, SYK, SOS1, SHC1, RAC1, PLCG2, PLCG1, PAK2, PAK1, NRAS, MAPK9, MAPK8, MAPK3, MAPK10, MAPK1, MAP3K1, MAP2K7, MAP2K4, LYN, LCP2, LAT, KRAS, JUN, HRAS, GRB2, GRAP2"
"261","FCERI mediated NF-kB activation",0.000200883889112093,0.000811533243965676,-0.453053527980535,-4.52067565968697,0,72,"UBE2N, UBE2D2, UBE2D1, UBC, UBB, TRAF6, TAB3, TAB2, TAB1, SKP1, RPS27A, RELA, RASGRP4, RASGRP2, RASGRP1, PSMF1, PSME4, PSME3, PSME2, PSME1, PSMD9, PSMD8, PSMD7, PSMD6, PSMD5, PSMD4, PSMD3, PSMD2, PSMD14, PSMD13, PSMD12, PSMD11, PSMD10, PSMD1, PSMC6, PSMC5, PSMC4, PSMC3, PSMC2, PSMC1, PSMB8, PSMB7, PSMB6, PSMB5, PSMB4, PSMB3, PSMB2, PSMB10, PSMB1, PSMA8, PSMA7, PSMA6, PSMA5, PSMA4, PSMA3, PSMA1, PRKCQ"
"262","FGFR1 mutant receptor activation",0.0215359609914669,0.0374747961486627,0.296869578842516,1.75236301328372,105,26,"BAG4, BCR, CNTRL, CPSF6, CUX1, ERLIN2, FGF1, FGF2, FGF20, FGF4, FGF5, FGF9, FGFR1, FGFR1OP, FGFR1OP2, GAB2, GRB2"
"263","FGFR2 alternative splicing",0.00314465408805031,0.0100291649306589,-0.363762001745708,-2.12083779364486,15,24,"TIAL1, TIA1, RBFOX2, PTBP1, POLR2L, POLR2K, POLR2J, POLR2I, POLR2H, POLR2G, POLR2F, POLR2E, POLR2D, POLR2C, POLR2B, POLR2A, NCBP2, NCBP1, HNRNPM, HNRNPH1, HNRNPF, HNRNPA1, GTF2F2, GTF2F1"
"264","FGFR2 mutant receptor activation",0.00832656376929326,0.0199482368975248,0.358239359767188,2.14600426542829,40,27,"FGF1, FGF10, FGF18, FGF2, FGF20, FGF22, FGF4, FGF5, FGF7, FGF9, FGFR2, GTF2F1, GTF2F2, NCBP1, NCBP2, POLR2A, POLR2B, POLR2C, POLR2D, POLR2E, POLR2F, POLR2G, POLR2H, POLR2I, POLR2J, POLR2K, POLR2L"
"265","FLT3 Signaling",0.0638547158758055,0.084831954994007,0.187950263236544,1.59355737148885,326,223,"ACTN2, AKT2, ANGPT1, APBB1IP, ARAF, AREG, ARRB1, ARRB2, BRAF, BRAP, CALM1, CAMK2A, CAMK2B, CAMK2G, CNKSR1, CNKSR2, CSF2RA, CSF2RB, CSK, CUL3, DAB2IP, DLG1, DLG2, DLG3, DLG4, DUSP1, DUSP16, DUSP2, DUSP4, DUSP5, DUSP6, DUSP7, DUSP8, EGF, EGFR, EPGN, ERBB2, ERBB3, ERBB4, FGF1, FGF10, FGF18, FGF2, FGF20, FGF22, FGF4, FGF5, FGF7, FGF9, FGFR1, FGFR2, FGFR3, FGFR4, FLT3, FLT3LG, FN1, FRS2, FRS3, FYN, GAB1, GAB2, GDNF, GFRA1, GFRA2, GFRA4, UBA52, GRB2, GRIN1, GRIN2B, GRIN2D, HBEGF, HCK, HGF, HRAS, IL17RD, IL2, IL5, IL5RA, IQGAP1, IRS1, IRS2, ITGA2B, ITGB3, JAK1, JAK2, JAK3, KBTBD7, KIT, KITLG, KLB, KRAS, KSR1, KSR2, LAMTOR2, LAMTOR3, LAT, LRRC7, MAP2K1, MAP2K2, MAP3K11, MAPK1, MAPK3, MARK3, NCAM1, NEFL, NF1, NRAS, NRG1, NRG2, NRG3, NRG4, PAQR3, PDE3B, PDGFA, PDGFB, PDGFRB, PDPK1, PEA15, PHB, PIK3C3, PIK3CA, PIK3CB, PIK3R1, PIK3R2, PIK3R4, PPP2CA, PPP2CB, PPP2R1A, PPP2R1B, PPP2R5A, PPP2R5B, PPP2R5C, PPP2R5D, PPP2R5E, PPP5C, PSMA1, PSMA3, PSMA4, PSMA5, PSMA6, PSMA7, PSMA8, PSMB1, PSMB10, PSMB2, PSMB3, PSMB4, PSMB5, PSMB6, PSMB7, PSMB8, PSMC1, PSMC2, PSMC3, PSMC4, PSMC5, PSMC6, PSMD1, PSMD10, PSMD11, PSMD12, PSMD13, PSMD14, PSMD2, PSMD3, PSMD4, PSMD5, PSMD6, PSMD7, PSMD8, PSMD9, PSME1, PSME2, PSME3, PSME4, PSMF1, PTK2, PTPN11, PTPRA, RAF1, RANBP9, RAP1A, RAP1B, RAPGEF2, RASA1, RASA2, RASA3, RASA4, RASAL1, RASAL2, RASAL3, RASGEF1A, RASGRF1, RASGRF2, RASGRP1, RASGRP4"
"266","FOXO-mediated transcription",0.489100277447483,0.507680062114379,0.112145805225366,0.865177007300353,2467,53,"ABCA6, AGRP, AKT1, AKT2, AKT3, ATXN3, BCL2L11, BCL6, BTG1, CAT, CCNG2, CDKN1B, CITED2, CREBBP, DDIT3, EP300, FBXO32, FOXG1, FOXO1, FOXO3, FOXO4, FOXO6, GADD45A"
"267","FOXO-mediated transcription of oxidative stress, metabolic and neuronal genes",0.323846310225656,0.347936896533622,0.182803520768168,1.0608393739803,1592,25,"ABCA6, AGRP, ATXN3, CAT, FBXO32, FOXO1, FOXO3, FOXO4, FOXO6, HDAC1, HDAC2, INS, NPY, NR3C1, PLXNA4, POMC, PPARGC1A, RETN, SIN3A, SIRT3, SMAD2, SMAD3, SMAD4, SOD2, SREBF1"
"268","FRS-mediated FGFR1 signaling",0.0148415563578018,0.0293636271579993,0.383762054440097,1.88261105239738,73,17,"FGF1, FGF10, FGF2, FGF20, FGF22, FGF4, FGF5, FGF9, FGFR1, FRS2, FRS3, GRB2, HRAS, KRAS"
"269","FRS-mediated FGFR2 signaling",0.00684793554884189,0.0181297162367658,0.405557447753026,2.08304384032351,33,19,"FGF1, FGF10, FGF18, FGF2, FGF20, FGF22, FGF4, FGF5, FGF7, FGF9, FGFR2, FRS2, FRS3, GRB2, HRAS"
"270","FRS-mediated FGFR3 signaling",0.0184553660982949,0.0341728482149746,0.372691916254725,1.78359691375174,91,16,"FGF1, FGF18, FGF2, FGF20, FGF4, FGF5, FGF9, FGFR3, FRS2, FRS3, GRB2, HRAS, KRAS"
"271","FRS-mediated FGFR4 signaling",0.0184553660982949,0.0341728482149746,0.372691916254725,1.78359691375174,91,16,"FGF1, FGF18, FGF2, FGF20, FGF4, FGF9, FGFR4, FRS2, FRS3, GRB2, HRAS, KLB, KRAS"
"272","Factors involved in megakaryocyte development and platelet production",0.031035160086427,0.0487213460363008,0.288607372732592,2.53854342382385,157,100,"ABL1, AK3, AKAP1, AKAP10, CABLES1, CABLES2, CAPZA2, CAPZB, CARMIL1, CBX5, CDC42, CDK2, CDK5, DOCK1, DOCK10, DOCK11, DOCK2, DOCK3, DOCK4, DOCK5, DOCK6, DOCK7, DOCK8, DOCK9, EHD1, EHD2, EHD3, GATA1, GATA4, H3-3A, HDAC1, HDAC2, HMG20B, IRF1, IRF2, ITPK1, JAK2, JMJD1C, KDM1A, KIF11, KIF13B, KIF15, KIF16B, KIF19, KIF1A, KIF1B, KIF1C, KIF20A, KIF20B, KIF21A, KIF21B, KIF22, KIF23, KIF26B, KIF27, KIF2A, KIF3A, KIF3B, KIF3C, KIF4A, KIF5A, KIF5B, KIF5C, KIF6, KIF9, KIFAP3, KIFC2, KIFC1, KLC1, KLC2, KLC3, KLC4"
"273","Fanconi Anemia Pathway",0.0141843971631206,0.0285473279309719,0.294815582369212,1.93577827036462,69,34,"ATR, ATRIP, DCLRE1A, DCLRE1B, EME1, EME2, ERCC1, ERCC4, FAAP100, FAN1, FANCA, FANCB, FANCC, FANCD2, FANCE, FANCF, FANCG, FANCI, FANCL, FANCM"
"274","Fatty acid metabolism",0.0388253843121797,0.0571174706220725,0.275180540957471,2.50968027699145,196,135,"ABCC1, ABCD1, ACAA1, ACAA2, ACACA, ACAD10, ACAD11, ACADL, ACADM, ACADS, ACADVL, ACBD4, ACBD5, ACBD6, ACLY, ACOT11, ACOT12, ACOT13, ACOT1, ACOT2, ACOT6, ACOT7, ACOT8, ACOT9, ACOX1, ACOX2, ACOX3, ACSBG1, ACSBG2, ACSF2, ACSL1, ACSL3, ACSL4, ACSL5, ACSL6, ACSM3, ALDH3A2, ALOX12, ALOX5, ALOX5AP, ALOX15B, ALOXE3, AMACR"
"275","Fatty acyl-CoA biosynthesis",0.00793489318413021,0.019226234396513,0.373260870110677,2.3015243033756,38,29,"ACACA, ACLY, ACSBG1, ACSBG2, ACSL1, ACSL3, ACSL4, ACSL5, ACSL6, CBR4, ELOVL1, ELOVL2, ELOVL4, ELOVL5, ELOVL6, ELOVL7, FASN, HACD1, HACD2, HACD3, HACD4, HSD17B12"
"276","Fc epsilon receptor (FCERI) signaling",0.000202061022428773,0.000811533243965676,-0.259181811522299,-3.32799200056479,0,121,"VAV3, VAV2, VAV1, UBE2N, UBE2D2, UBE2D1, UBC, UBB, TRAF6, TEC, TAB3, TAB2, TAB1, SYK, SOS1, SKP1, SHC1, RPS27A, RELA, RASGRP4, RASGRP2, RASGRP1, RAC1, PSMF1, PSME4, PSME3, PSME2, PSME1, PSMD9, PSMD8, PSMD7, PSMD6, PSMD5, PSMD4, PSMD3, PSMD2, PSMD14, PSMD13, PSMD12, PSMD11, PSMD10, PSMD1, PSMC6, PSMC5, PSMC4, PSMC3, PSMC2, PSMC1, PSMB8, PSMB7, PSMB6, PSMB5, PSMB4, PSMB3, PSMB2, PSMB10, PSMB1, PSMA8, PSMA7, PSMA6, PSMA5, PSMA4, PSMA3, PSMA1, PRKCQ, PPP3R1, PPP3CB, PPP3CA, PLCG2, PLCG1, PIK3R2, PIK3R1, PIK3CB, PIK3CA, PDPK1, PAK2, PAK1, NRAS, NFKBIA, NFKB1, NFATC3, NFATC2, MAPK9, MAPK8, MAPK3, MAPK10, MAPK1, MAP3K7, MAP3K1, MAP2K7, MAP2K4, MALT1, LYN, LCP2, LAT2, LAT, KRAS, JUN, ITPR3, ITPR2, ITPR1, ITK, IKBKG, IKBKB"
"277","Fcgamma receptor (FCGR) dependent phagocytosis",0.0703777335984095,0.0911786079574778,0.152272204129062,1.29708355044218,353,79,"ABI1, ABI2, ABL1, ACTB, ACTG1, ACTR2, ACTR3, AHCYL1, ARPC1A, ARPC1B, ARPC2, ARPC3, ARPC4, ARPC5, BAIAP2, BRK1, BTK, CD247, CDC42, CFL1, CRK, CYFIP1, CYFIP2, DOCK1, ELMO1, ELMO2, FCGR2A, FYN, GRB2, HCK, HSP90AB1, ITPR1, ITPR2, ITPR3, LIMK1, LYN, MAPK1, MAPK3, MYH9, MYO10, MYO1C, MYO5A, MYO9B, NCK1, NCKAP1, NCKAP1L, NCKIPSD, NF2, PAK1, PIK3CA, PIK3CB, PIK3R1, PIK3R2, PLA2G6, PLCG1, PLCG2, PLD1, PLD2, PLD3, PLD4, PLPP4, PLPP5, PRKCD, PRKCE"
"278","Fertilization",0.00461384152457372,0.0140499812691085,0.512667199767374,2.45347858487457,22,16,"ACR, ADAM2, ADAM21, B4GALT1, CATSPER1, CATSPER2, CATSPER3, CATSPERB, CATSPERD, CD9, HVCN1, SPAM1, IZUMO2, IZUMO4, KCNU1"
"279","Formation of Fibrin Clot (Clotting Cascade)",0.20655802081288,0.23060624137212,-0.231704479348458,-1.2423516480346,1051,20,"VWF, THBD, TFPI, SERPING1, SERPINE2, SERPIND1, SERPINC1, PRTN3, PROS1, PRCP, KNG1, KLKB1, F8, F7, F3, F2R, F2, F13A1, F12"
"280","Formation of HIV elongation complex in the absence of HIV Tat",0.0224358974358974,0.0385222336643919,0.242013595393895,1.74016249770714,111,43,"CCNH, CCNK, CCNT1, CCNT2, CDK7, CDK9, CTDP1, ELL, ELOA, ELOC, ERCC2, ERCC3, GTF2F1, GTF2F2, GTF2H1, GTF2H2, GTF2H3, GTF2H4, GTF2H5, MNAT1, NCBP1, NCBP2, NELFA, NELFB, NELFCD, NELFE, POLR2A, POLR2B, POLR2C, POLR2D, POLR2E, POLR2F, POLR2G, POLR2H, POLR2I, POLR2J, POLR2K, POLR2L"
"281","Formation of HIV-1 elongation complex containing HIV-1 Tat",0.0295774647887324,0.0466972394907881,0.236289258238879,1.66667370691659,146,41,"CCNH, CCNT1, CDK7, CDK9, CTDP1, ELL, ELOA, ELOC, ERCC2, ERCC3, GTF2F1, GTF2F2, GTF2H1, GTF2H2, GTF2H3, GTF2H4, GTF2H5, MNAT1, NCBP1, NCBP2, NELFA, NELFB, NELFCD, NELFE, POLR2A, POLR2B, POLR2C, POLR2D, POLR2E, POLR2F, POLR2G, POLR2H, POLR2I, POLR2J, POLR2K, POLR2L"
"282","Formation of Incision Complex in GG-NER",0.387071187785049,0.408485355794034,-0.13714493809177,-1.04611802164774,1951,42,"XPC, XPA, USP45, UBE2V2, UBE2N, UBE2I, UBC, UBB, SUMO2, SUMO1, RPS27A, RPA3, RPA2, RPA1, RNF111, RBX1, RAD23B, RAD23A, PIAS3, PIAS1, PARP2, PARP1, MNAT1, GTF2H5, GTF2H4, GTF2H3, GTF2H2, GTF2H1, UBA52, ERCC5, ERCC4, ERCC3, ERCC2, ERCC1, DDB2, DDB1, CUL4B, CUL4A, CHD1L, CETN2, CDK7, CCNH"
"283","Formation of RNA Pol II elongation complex",0.0266401590457256,0.0432653984118711,0.215556388784735,1.6819017029902,133,56,"AFF4, CCNH, CCNK, CCNT1, CCNT2, CDC73, CDK7, CDK9, CTDP1, CTR9, EAF1, EAF2, ELL, ELOA, ELOC, ERCC2, ERCC3, GTF2F1, GTF2F2, GTF2H1, GTF2H2, GTF2H3, GTF2H4, GTF2H5, IWS1, LEO1, MLLT1, MLLT3, MNAT1, NCBP1, NCBP2, NELFA, NELFB, NELFCD, NELFE, PAF1, POLR2A, POLR2B, POLR2C, POLR2D, POLR2E, POLR2F, POLR2G, POLR2H, POLR2I, POLR2J, POLR2K, POLR2L"
"284","Formation of TC-NER Pre-Incision Complex",0.180142687277051,0.204633996446178,0.149975175593138,1.15702119511526,908,53,"AQR, CCNH, CDK7, COPS2, COPS3, COPS4, COPS5, COPS6, COPS7A, COPS7B, COPS8, CUL4A, CUL4B, DDB1, EP300, ERCC2, ERCC3, ERCC6, ERCC8, UBA52, GPS1, GTF2H1, GTF2H2, GTF2H3, GTF2H4, GTF2H5, HMGN1, ISY1, MNAT1, POLR2A, POLR2B, POLR2C, POLR2D, POLR2E, POLR2F, POLR2G, POLR2H, POLR2I, POLR2J, POLR2K, POLR2L, PPIE, PRPF19"
"285","Formation of a pool of free 40S subunits",0.000200883889112093,0.000811533243965676,-0.472703236424606,-4.68179336551246,0,71,"RPSA, RPS9, RPS8, RPS7, RPS5, RPS4X, RPS3A, RPS28, RPS27L, RPS27A, RPS25, RPS24, RPS21, RPS20, RPS19, RPS17, RPS16, RPS15A, RPS15, RPS14, RPS13, RPS12, RPS11, RPLP1, RPL8, RPL7A, RPL6, RPL5, RPL4, RPL3L, RPL38, RPL37A, RPL36, RPL35, RPL34, RPL32, RPL30, RPL3, RPL29, RPL28, RPL27, RPL26, RPL23, RPL22L1, RPL19, RPL18A, RPL18, RPL14, RPL13A, RPL12, RPL11, RPL10A, RPL10"
"286","Formation of the Early Elongation Complex",0.0144720750101916,0.028801708337212,0.297644175946818,1.92627774687748,70,33,"CCNH, CDK7, CTDP1, ERCC2, ERCC3, GTF2F1, GTF2F2, GTF2H1, GTF2H2, GTF2H3, GTF2H4, GTF2H5, MNAT1, NCBP1, NCBP2, NELFA, NELFB, NELFCD, NELFE, POLR2A, POLR2B, POLR2C, POLR2D, POLR2E, POLR2F, POLR2G, POLR2H, POLR2I, POLR2J, POLR2K, POLR2L"
"287","Formation of the HIV-1 Early Elongation Complex",0.0144720750101916,0.028801708337212,0.297644175946818,1.92627774687748,70,33,"CCNH, CDK7, CTDP1, ERCC2, ERCC3, GTF2F1, GTF2F2, GTF2H1, GTF2H2, GTF2H3, GTF2H4, GTF2H5, MNAT1, NCBP1, NCBP2, NELFA, NELFB, NELFCD, NELFE, POLR2A, POLR2B, POLR2C, POLR2D, POLR2E, POLR2F, POLR2G, POLR2H, POLR2I, POLR2J, POLR2K, POLR2L"
"288","Formation of the beta-catenin:TCF transactivating complex",0.376449773933556,0.398942056023926,-0.163433672816506,-1.04688943463153,1914,29,"TRRAP, TLE4, TLE3, TLE2, TLE1, TERT, TCF7L2, TCF7, TCF4"
"289","Formation of the cornified envelope",0.523388364779874,0.541048708376741,-0.160411211327708,-0.93524380742214,2662,24,"TGM5, TGM1, TCHH, ST14, SPINK9, PPL, PKP4, PKP3, PKP2, PERP, PCSK6, LIPM, LIPK, KLK12, KAZN, JUP, FURIN, DSP, DSG3, DSG2, DSG1, DSC2"
"290","Formation of the ternary complex, and subsequently, the 43S complex",0.0033710093198493,0.0106502825698989,-0.275441334581903,-2.10101917009888,16,42,"RPSA, RPS9, RPS8, RPS7, RPS5, RPS4X, RPS3A, RPS28, RPS27L, RPS27A, RPS25, RPS24, RPS21, RPS20, RPS19, RPS17, RPS16, RPS15A, RPS15, RPS14, RPS13, RPS12, RPS11"
"291","Formation of tubulin folding intermediates by CCT/TriC",0.00179354324432045,0.00606445558531094,-0.447550623302756,-2.20442155041025,8,17,"TUBB6, TUBB4B, TUBB4A, TUBB2B, TUBB2A, TUBA8, TUBA4A, TUBA1C, TUBA1B"
