"","pathway","pval","padj","ES","NES","nMoreExtreme","size","leadingEdge"
"1","A tetrasaccharide linker sequence is required for GAG synthesis",0.0290258449304175,0.053142209019257,0.290504678196768,1.69227187525782,145,25,"AGRN, B3GALT6, B3GAT1, B3GAT2, B3GAT3, B4GALT7, BCAN, BGN, CSPG4, CSPG5, DCN, GPC1, GPC3, GPC4, GPC5, GPC6, HSPG2"
"2","ABC transporter disorders",0.0256614282872489,0.0503544974743471,-0.403647869429242,-3.12333118916324,128,64,"VCP, UBC, UBB, SEL1L, RPS27A, RNF5, RNF185, PSMF1, PSME4, PSME3, PSME2, PSME1, PSMD9, PSMD8, PSMD7, PSMD6, PSMD5, PSMD4, PSMD3, PSMD2, PSMD14, PSMD13, PSMD12, PSMD11, PSMD10, PSMD1, PSMC6, PSMC5, PSMC4, PSMC3, PSMC2, PSMC1, PSMB8, PSMB7, PSMB6, PSMB5, PSMB4, PSMB3, PSMB2, PSMB10, PSMB1, PSMA7, PSMA6, PSMA5, PSMA4, PSMA3, PSMA1"
"3","ABC transporters in lipid homeostasis",0.00317965023847377,0.0470433599779914,0.809080606318175,3.74493743022132,15,15,"ABCA2, ABCA3, ABCA5, ABCA6, ABCA7, ABCA9, ABCD1, ABCD2, ABCD3, ABCG1, ABCG4, ABCG8, APOA1"
"4","ABC-family proteins mediated transport",0.0108783239323127,0.0470433599779914,0.272832614021908,2.70345252705648,53,87,"ABCA2, ABCA3, ABCA4, ABCA5, ABCA6, ABCA7, ABCA8, ABCA9, ABCB10, ABCB1, ABCB4, ABCB7, ABCB8, ABCB9, ABCC1, ABCC10, ABCC4, ABCC5, ABCD1, ABCD2, ABCD3, ABCF1, ABCG1, ABCG4, ABCG8"
"5","ADP signalling through P2Y purinoceptor 1",0.00398247710075667,0.0470433599779914,0.474280332705482,2.32811271751248,19,17,"GNA11, GNA14, GNA15, GNB1, GNB3, GNB4, GNB5, GNG11, GNG12, GNG13, GNG2, GNG3, GNG4, GNG7"
"6","ADP signalling through P2Y purinoceptor 12",0.00317965023847377,0.0470433599779914,0.584133729990084,2.70374082954399,15,15,"GNAI1, GNAI2, GNAI3, GNB1, GNB3, GNB4, GNB5, GNG11, GNG12, GNG13, GNG2, GNG3, GNG4, GNG7"
"7","APC-Cdc20 mediated degradation of Nek2A",0.00400801603206413,0.0470433599779914,0.506940409551477,2.659472780222,19,20,"ANAPC1, ANAPC10, ANAPC15, ANAPC16, ANAPC2, ANAPC4, ANAPC5, ANAPC7, BUB3, CDC16, CDC23, CDC26, CDC27"
"8","APC/C-mediated degradation of cell cycle proteins",0.0291608807776235,0.053142209019257,-0.326666536760264,-2.59760606527701,146,73,"UBE2E1, UBE2D1, UBC, UBB, SKP2, SKP1, RPS27A, PTTG1, PSMF1, PSME4, PSME3, PSME2, PSME1, PSMD9, PSMD8, PSMD7, PSMD6, PSMD5, PSMD4, PSMD3, PSMD2, PSMD14, PSMD13, PSMD12, PSMD11, PSMD10, PSMD1, PSMC6, PSMC5, PSMC4, PSMC3, PSMC2, PSMC1, PSMB8, PSMB7, PSMB6, PSMB5, PSMB4, PSMB3, PSMB2, PSMB10, PSMB1, PSMA7, PSMA6, PSMA5, PSMA4, PSMA3, PSMA1"
"9","APC/C:Cdc20 mediated degradation of Cyclin B",0.00381143430290873,0.0470433599779914,0.590391772260465,3.01813640849095,18,19,"ANAPC1, ANAPC10, ANAPC15, ANAPC16, ANAPC2, ANAPC4, ANAPC5, ANAPC7, CCNB1, CDC16, CDC23, CDC26, CDC27, CDK1"
"10","APC/C:Cdc20 mediated degradation of Securin",0.0239984133280444,0.0502497389277012,-0.462446254670178,-3.47849187281134,120,58,"UBE2E1, UBE2D1, UBC, UBB, RPS27A, PTTG1, PSMF1, PSME4, PSME3, PSME2, PSME1, PSMD9, PSMD8, PSMD7, PSMD6, PSMD5, PSMD4, PSMD3, PSMD2, PSMD14, PSMD13, PSMD12, PSMD11, PSMD10, PSMD1, PSMC6, PSMC5, PSMC4, PSMC3, PSMC2, PSMC1, PSMB8, PSMB7, PSMB6, PSMB5, PSMB4, PSMB3, PSMB2, PSMB10, PSMB1, PSMA7, PSMA6, PSMA5, PSMA4, PSMA3, PSMA1"
"11","APC/C:Cdc20 mediated degradation of mitotic proteins",0.0256614282872489,0.0503544974743471,-0.38795179117208,-3.00187866957616,128,64,"UBE2E1, UBE2D1, UBC, UBB, RPS27A, PTTG1, PSMF1, PSME4, PSME3, PSME2, PSME1, PSMD9, PSMD8, PSMD7, PSMD6, PSMD5, PSMD4, PSMD3, PSMD2, PSMD14, PSMD13, PSMD12, PSMD11, PSMD10, PSMD1, PSMC6, PSMC5, PSMC4, PSMC3, PSMC2, PSMC1, PSMB8, PSMB7, PSMB6, PSMB5, PSMB4, PSMB3, PSMB2, PSMB10, PSMB1, PSMA7, PSMA6, PSMA5, PSMA4, PSMA3, PSMA1"
"12","APC/C:Cdh1 mediated degradation of Cdc20 and other APC/C:Cdh1 targeted proteins in late mitosis/early G1",0.0248178057908214,0.0503544974743471,-0.439835180197392,-3.36288715679596,125,61,"UBE2E1, UBE2D1, UBC, UBB, SKP2, RPS27A, PTTG1, PSMF1, PSME4, PSME3, PSME2, PSME1, PSMD9, PSMD8, PSMD7, PSMD6, PSMD5, PSMD4, PSMD3, PSMD2, PSMD14, PSMD13, PSMD12, PSMD11, PSMD10, PSMD1, PSMC6, PSMC5, PSMC4, PSMC3, PSMC2, PSMC1, PSMB8, PSMB7, PSMB6, PSMB5, PSMB4, PSMB3, PSMB2, PSMB10, PSMB1, PSMA7, PSMA6, PSMA5, PSMA4, PSMA3, PSMA1"
"13","APC:Cdc20 mediated degradation of cell cycle proteins prior to satisfation of the cell cycle checkpoint",0.0256155679110405,0.0503544974743471,-0.394984193066958,-3.01600038048859,128,62,"UBE2E1, UBE2D1, UBC, UBB, RPS27A, PSMF1, PSME4, PSME3, PSME2, PSME1, PSMD9, PSMD8, PSMD7, PSMD6, PSMD5, PSMD4, PSMD3, PSMD2, PSMD14, PSMD13, PSMD12, PSMD11, PSMD10, PSMD1, PSMC6, PSMC5, PSMC4, PSMC3, PSMC2, PSMC1, PSMB8, PSMB7, PSMB6, PSMB5, PSMB4, PSMB3, PSMB2, PSMB10, PSMB1, PSMA7, PSMA6, PSMA5, PSMA4, PSMA3, PSMA1"
"14","ATF4 activates genes in response to endoplasmic reticulum  stress",0.0041866028708134,0.0470433599779914,0.459187132160355,2.57703490333681,20,23,"ASNS, ATF4, ATF6, CCL2, CEBPB, CEBPG, DCP2, DDIT3, DIS3, EXOSC1, EXOSC2, EXOSC3, EXOSC4, EXOSC5, EXOSC7, EXOSC8, EXOSC9"
"15","AUF1 (hnRNP D0) binds and destabilizes mRNA",0.019740777666999,0.0494829099272216,-0.584281661888521,-4.15348826268199,98,47,"UBC, UBB, RPS27A, PSMF1, PSME4, PSME3, PSME2, PSME1, PSMD9, PSMD8, PSMD7, PSMD6, PSMD5, PSMD4, PSMD3, PSMD2, PSMD14, PSMD13, PSMD12, PSMD11, PSMD10, PSMD1, PSMC6, PSMC5, PSMC4, PSMC3, PSMC2, PSMC1, PSMB8, PSMB7, PSMB6, PSMB5, PSMB4, PSMB3, PSMB2, PSMB10, PSMB1, PSMA7, PSMA6, PSMA5, PSMA4, PSMA3, PSMA1"
"16","AURKA Activation by TPX2",0.00945293644408689,0.0470433599779914,0.267621835760032,2.37678858409878,46,66,"ACTR1A, AKAP9, ALMS1, AURKA, CCP110, CDK1, CDK5RAP2, CENPJ, CEP131, CEP135, CEP152, CEP164, CEP192, CEP250, CEP290, CEP41, CEP57, CEP63, CEP70, CEP72, CEP76, CEP78, CETN2, CKAP5, CLASP1, CNTRL, CSNK1D, CSNK1E, DCTN1, DCTN2, DCTN3, DYNC1H1, DYNC1I2, DYNLL1"
"17","Abortive elongation of HIV-1 transcript in the absence of Tat",0.0106297633373446,0.0470433599779914,-0.410812559701722,-2.26157206357706,52,23,"SUPT5H, SUPT4H1, POLR2L, POLR2K, POLR2J, POLR2I, POLR2H, POLR2G, POLR2F, POLR2E, POLR2D, POLR2C, POLR2B, POLR2A, NELFE, NELFCD, NELFB, NELFA, NCBP2, NCBP1"
"18","Acetylcholine Neurotransmitter Release Cycle",0.0062374245472837,0.0470433599779914,-0.579954667799972,-2.6605536156078,30,15,"VAMP2, UNC13B, TSPOAP1, SYT1, STXBP1, STX1A, SNAP25, SLC5A7, RIMS1, RAB3A, PPFIA4, PPFIA3, PPFIA2, PPFIA1"
"19","Activated NOTCH1 Transmits Signal to the Nucleus",0.0824415378517638,0.104168741177229,0.229790521642185,1.44015838841752,415,29,"ADAM10, ADAM17, APH1A, APH1B, ARRB1, ARRB2, CNTN1, DLK1, DLL1, DNER, DTX1, DTX2, DTX4, ITCH, JAG1, JAG2, MIB1, MIB2, NCSTN, NEURL1, NEURL1B, NOTCH1, NUMB, PSEN1, PSEN2, PSENEN"
"20","Activation of APC/C and APC/C:Cdc20 mediated degradation of mitotic proteins",0.0256614282872489,0.0503544974743471,-0.38795179117208,-3.00187866957616,128,64,"UBE2E1, UBE2D1, UBC, UBB, RPS27A, PTTG1, PSMF1, PSME4, PSME3, PSME2, PSME1, PSMD9, PSMD8, PSMD7, PSMD6, PSMD5, PSMD4, PSMD3, PSMD2, PSMD14, PSMD13, PSMD12, PSMD11, PSMD10, PSMD1, PSMC6, PSMC5, PSMC4, PSMC3, PSMC2, PSMC1, PSMB8, PSMB7, PSMB6, PSMB5, PSMB4, PSMB3, PSMB2, PSMB10, PSMB1, PSMA7, PSMA6, PSMA5, PSMA4, PSMA3, PSMA1"
"21","Activation of ATR in response to replication stress",0.0132716670018098,0.0470433599779914,0.277537414000993,1.85455966393771,65,34,"ATR, ATRIP, CDC25A, CDC45, CDC6, CDC7, CDK2, CHEK1, CLSPN, DBF4, HUS1, MCM10, MCM2, MCM4, MCM6, MCM7, MCM8, ORC1, ORC2, ORC3, ORC4, ORC5, ORC6, RAD1, RAD17, RAD9A, RAD9B, RFC2, RFC3, RFC4, RFC5, RPA1, RPA2, RPA3"
"22","Activation of BAD and translocation to mitochondria",0.0289738430583501,0.053142209019257,-0.366638334041649,-1.68196067626336,143,15,"YWHAZ, YWHAQ, YWHAH, YWHAG, YWHAE, YWHAB"
"23","Activation of BH3-only proteins",0.0255687537749144,0.0503544974743471,-0.290322580645161,-1.71346038236726,126,28,"YWHAZ, YWHAQ, YWHAH, YWHAG, YWHAE, YWHAB, TP73, TP63, TP53BP2, TP53, TFDP2, TFDP1"
"24","Activation of G protein gated Potassium channels",0.00339185953711093,0.0470433599779914,0.575334702840547,2.73678438689046,16,16,"GABBR1, GABBR2, GNB1, GNB3, GNG12, GNG2, GNG3, GNG4, GNG7, KCNJ10, KCNJ16, KCNJ2, KCNJ3, KCNJ4, KCNJ6, KCNJ9"
"25","Activation of GABAB receptors",0.00476663356504469,0.0470433599779914,0.575824175824176,3.54709572275813,23,28,"ADCY1, ADCY2, ADCY3, ADCY5, ADCY6, ADCY7, ADCY8, ADCY9, GABBR1, GABBR2, GNAI1, GNAI2, GNAI3, GNAL, GNB1, GNB3, GNG12, GNG2, GNG3, GNG4, GNG7, KCNJ10, KCNJ16, KCNJ2, KCNJ3, KCNJ4, KCNJ6, KCNJ9"
"26","Activation of HOX genes during differentiation",0.0412926391382406,0.0629775721779356,-0.212184948526802,-1.51819978363318,206,48,"ZNF335, YY1, WDR5, SUZ12, RXRA, RBBP7, RBBP5, RARG, RARB, RARA, POLR2L, POLR2K, POLR2J, POLR2I, POLR2H, POLR2G, POLR2F, POLR2E, POLR2D, POLR2C, POLR2B, POLR2A, PKNOX1, PIAS2, PCGF2, PBX1, PAXIP1, PAX6, PAGR1, NCOR1, NCOA6, NCOA3, MEIS1, MAFB, KMT2D, KMT2C, KDM6A, JUN"
"27","Activation of IRF3/IRF7 mediated by TBK1/IKK epsilon",0.0490945674044266,0.0699597585513079,-0.341478963025924,-1.56654155949647,243,15,"UBC, UBB, TRAF3, TLR4, TICAM1, TBK1, TANK, SARM1, RPS27A, PTPN11"
"28","Activation of NF-kappaB in B cells",0.0246305418719212,0.0503544974743471,-0.444812762026576,-3.37932327817589,124,60,"UBC, UBB, SKP1, RPS27A, RELA, REL, PSMF1, PSME4, PSME3, PSME2, PSME1, PSMD9, PSMD8, PSMD7, PSMD6, PSMD5, PSMD4, PSMD3, PSMD2, PSMD14, PSMD13, PSMD12, PSMD11, PSMD10, PSMD1, PSMC6, PSMC5, PSMC4, PSMC3, PSMC2, PSMC1, PSMB8, PSMB7, PSMB6, PSMB5, PSMB4, PSMB3, PSMB2, PSMB10, PSMB1, PSMA7, PSMA6, PSMA5, PSMA4, PSMA3, PSMA1, PRKCB"
"29","Activation of NMDA receptors and postsynaptic events",0.00987704091916952,0.0470433599779914,0.257846832112636,2.34031384618293,48,70,"ACTN2, ADCY1, ADCY8, APBA1, ARHGEF7, CALM1, CAMK1, CAMK2A, CAMK2B, CAMK2G, CAMK4, CAMKK1, CAMKK2, CASK, CREB1, DLG1, DLG2, DLG3, DLG4, ERBB4, GIT1, GRIA1, GRIA2, GRIA3, GRIA4, GRIN1, GRIN2A, GRIN2B, GRIN2D, GRIN3A, GRIN3B, HRAS, KIF17, KPNA2, KRAS, LIN7A, LIN7B, LIN7C, LRRC7, MAPK1, MAPK3, MAPT, NEFL, NRAS, NRG1, NRGN, PDPK1, PPM1E, PPM1F, PRKAA1, PRKAA2, PRKAB1, PRKAB2, PRKACA, PRKACB, PRKAG1, PRKAG2, PRKAR1A, PRKAR1B, PRKAR2A, PRKAR2B, PRKX, RAC1, RASGRF1, RASGRF2, RPS6KA1, RPS6KA2, RPS6KA3, RPS6KA6"
"30","Activation of anterior HOX genes in hindbrain development during early embryogenesis",0.0412926391382406,0.0629775721779356,-0.212184948526802,-1.51819978363318,206,48,"ZNF335, YY1, WDR5, SUZ12, RXRA, RBBP7, RBBP5, RARG, RARB, RARA, POLR2L, POLR2K, POLR2J, POLR2I, POLR2H, POLR2G, POLR2F, POLR2E, POLR2D, POLR2C, POLR2B, POLR2A, PKNOX1, PIAS2, PCGF2, PBX1, PAXIP1, PAX6, PAGR1, NCOR1, NCOA6, NCOA3, MEIS1, MAFB, KMT2D, KMT2C, KDM6A, JUN"
"31","Activation of gene expression by SREBF (SREBP)",0.451749095295537,0.472953644666552,0.129018522461145,0.949526763731596,2246,42,"ACACA, ACACB, CARM1, CHD9, CREBBP, CYP51A1, DHCR7, ELOVL6, FASN, FDFT1, FDPS, GGPS1, GPAM, HELZ2, HMGCR, HMGCS1, IDI1, LSS, MED1, MTF1, MVD, MVK, NCOA1, NCOA2, NCOA6, NFYA, NFYB, NFYC, PMVK, PPARA, RXRA, SC5D, SCD, SMARCD3, SP1, SQLE, SREBF1, SREBF2, TBL1X, TBL1XR1, TGS1, TM7SF2"
"32","Activation of kainate receptors upon glutamate binding",0.00437985267768266,0.0470433599779914,0.472287192572117,2.70355021181443,21,24,"CALM1, DLG1, DLG3, DLG4, GNB1, GNB3, GNB4, GNB5, GNG11, GNG12, GNG13, GNG2, GNG3, GNG4, GNG7, GRIK1, GRIK2, GRIK3, GRIK4, GRIK5"
"33","Activation of the mRNA upon binding of the cap-binding complex and eIFs, and subsequent binding to 43S",0.0090198436560433,0.0470433599779914,0.271210507632233,2.11702493004816,44,48,"EIF1AX, EIF2S1, EIF2S2, EIF2S3, EIF3A, EIF3B, EIF3C, EIF3D, EIF3E, EIF3F, EIF3G, EIF3H, EIF3I, EIF3J, EIF3K, EIF3L, EIF3M, EIF4A1, EIF4A2, EIF4E, EIF4EBP1, EIF4G1, EIF4H, FAU, RPS18, RPS11, RPS12, RPS13, RPS14, RPS15, RPS15A, RPS16, RPS17, RPS19, RPS20, RPS21, RPS24, RPS25, RPS27A, RPS27L, RPS28, RPS3A, RPS4X, RPS5, RPS7, RPS8, RPS9, RPSA"
"34","Activation of the pre-replicative complex",0.0270379338175948,0.0515363014109986,-0.281900952529974,-1.69252361725374,133,29,"RPA3, RPA2, RPA1, PRIM2, PRIM1, POLE4, POLE3, POLE2, POLE, POLA2, POLA1, ORC6, ORC5, ORC4, ORC3, ORC2, ORC1, MCM8, MCM7, MCM6, MCM4, MCM2, MCM10"
"35","Acyl chain remodelling of PC",0.010962726729121,0.0470433599779914,-0.406982988149132,-2.06663323275524,54,19,"TMEM86B, PNPLA8, PLAAT3, PLA2G6, PLA2G5, PLA2G4E, PLA2G4C, PLA2G4A, PLA2G3, PLA2G2D, PLA2G1B, PLA2G12A, PLA2G10, MBOAT2, LPCAT4, LPCAT3, LPCAT2, LPCAT1"
"36","Acyl chain remodelling of PE",0.0104208416833667,0.0470433599779914,0.362431800467654,1.901362546504,51,20,"ABHD4, PLA2G4B, LPCAT3, LPCAT4, MBOAT1, MBOAT2, PLA2G10, PLA2G12A, PLA2G1B, PLA2G2D, PLA2G3, PLA2G4A, PLA2G4C, PLA2G4E, PLA2G5, PLA2G6, PLAAT1, PLAAT3, PLAAT5, PNPLA8"
"37","Acyl chain remodelling of PS",0.0164989939637827,0.0486785153275759,-0.3929593426831,-1.80270882882691,81,15,"PLAAT3, PLA2G5, PLA2G4E, PLA2G4A, PLA2G2D, PLA2G1B, PLA2G12A, PLA2G10, OSBPL8, OSBPL5, OSBPL10, MBOAT1, LPCAT4, LPCAT3"
"38","Adherens junctions interactions",0.00457165573444643,0.0470433599779914,0.607224454853292,3.60628623508939,22,26,"AFDN, CADM1, CADM2, CADM3, CDH1, CDH10, CDH11, CDH12, CDH13, CDH18, CDH2, CDH24, CDH3, CDH4, CDH6, CDH7, CDH8, CDH9, CTNNA1, CTNNB1, CTNND1"
"39","Adrenaline,noradrenaline inhibits insulin secretion",0.00394555139080687,0.0470433599779914,0.651147959183674,3.52041670249814,19,21,"ADCY5, ADCY6, ADRA2C, CACNA1C, CACNA1D, CACNA2D2, CACNB2, CACNB3, GNAI1, GNAI2, GNB1, GNB3, GNB4, GNB5, GNG11, GNG12, GNG13, GNG2, GNG3, GNG4, GNG7"
"40","Aggrephagy",0.217853560682046,0.242690285841237,0.235093188547392,1.2018177506547,1085,19,"ARL13B, CFTR, DYNC1H1, DYNC1I1, DYNC1I2, DYNC1LI1, DYNC1LI2, DYNLL1, DYNLL2, HDAC6, HSF1, IFT88"
"41","Amine ligand-binding receptors",0.00701965503409547,0.0470433599779914,-0.999858256555634,-5.5043387724195,34,23,"HTR2C"
"42","Amino acid transport across the plasma membrane",0.010443864229765,0.0470433599779914,-0.773619675384506,-4.3286893510336,51,24,"SLC7A8, SLC7A7, SLC7A6, SLC7A5, SLC7A3, SLC7A2, SLC7A11, SLC7A10, SLC7A1, SLC6A6, SLC6A20, SLC6A15, SLC43A2, SLC3A2, SLC3A1, SLC38A3, SLC38A2, SLC38A1, SLC36A4, SLC36A1, SLC25A29, SLC1A5, SLC1A4, SLC16A10"
"43","Amino acids regulate mTORC1",0.00941317844982976,0.0470433599779914,0.258317119931833,2.05282700137206,46,50,"ATP6V0B, ATP6V0C, ATP6V0D1, ATP6V0E1, ATP6V0E2, ATP6V1A, ATP6V1B2, ATP6V1C1, ATP6V1C2, ATP6V1D, ATP6V1E1, ATP6V1E2, ATP6V1F, ATP6V1G1, ATP6V1G2, ATP6V1H, C12orf66, BMT2"
"44","Amplification  of signal from unattached  kinetochores via a MAD2  inhibitory signal",0.0344688570852651,0.0553443620805664,0.170353085601824,1.57446722240963,170,73,"AHCTF1, B9D2, BUB3, CDCA8, CENPC, CENPI, CENPK, CENPL, CENPM, CENPN, CENPO, CENPP, CENPQ, CENPT, CENPU, CKAP5, CLASP1, CLASP2, CLIP1, DYNC1H1, DYNC1I1, DYNC1I2, DYNC1LI1, DYNC1LI2, DYNLL1, DYNLL2, INCENP, ITGB3BP, KIF18A, KIF2A, KNL1, MAD1L1, MAD2L1, MAPRE1, MIS12, NDC80, NDE1, NDEL1, NSL1, NUDC, NUF2, NUP107, NUP133, NUP160, NUP37, NUP43, NUP85, NUP98, PAFAH1B1, PMF1, PPP1CC, PPP2CA, PPP2CB, PPP2R1A, PPP2R1B, PPP2R5A, PPP2R5B, PPP2R5C, PPP2R5D, PPP2R5E"
"45","Amplification of signal from the kinetochores",0.0344688570852651,0.0553443620805664,0.170353085601824,1.57446722240963,170,73,"AHCTF1, B9D2, BUB3, CDCA8, CENPC, CENPI, CENPK, CENPL, CENPM, CENPN, CENPO, CENPP, CENPQ, CENPT, CENPU, CKAP5, CLASP1, CLASP2, CLIP1, DYNC1H1, DYNC1I1, DYNC1I2, DYNC1LI1, DYNC1LI2, DYNLL1, DYNLL2, INCENP, ITGB3BP, KIF18A, KIF2A, KNL1, MAD1L1, MAD2L1, MAPRE1, MIS12, NDC80, NDE1, NDEL1, NSL1, NUDC, NUF2, NUP107, NUP133, NUP160, NUP37, NUP43, NUP85, NUP98, PAFAH1B1, PMF1, PPP1CC, PPP2CA, PPP2CB, PPP2R1A, PPP2R1B, PPP2R5A, PPP2R5B, PPP2R5C, PPP2R5D, PPP2R5E"
"46","Amyloid fiber formation",0.447399761810242,0.469358032328536,-0.135927260506712,-0.910164735889022,2253,38,"USP9X, UBC, UBB, TTR, TSPAN5, TSPAN33, TSPAN15, TSPAN14, TGFBI, SORL1, SNCAIP, SNCA, SIAH2, SIAH1"
"47","Anchoring of the basal body to the plasma membrane",0.0112903225806452,0.0470433599779914,0.219283628854233,2.20377140333081,55,90,"ACTR1A, AHI1, AKAP9, ALMS1, B9D1, B9D2, C2CD3, CC2D2A, CCP110, CDK1, CDK5RAP2, CENPJ, CEP131, CEP135, CEP152, CEP162, CEP164, CEP192, CEP250, CEP290, CEP41, CEP57, CEP63, CEP70, CEP72, CEP76, CEP78, CEP83, CEP89, CEP97, CETN2, CKAP5, CLASP1, CNTRL, CSNK1D, CSNK1E, DCTN1, DCTN2, DCTN3, DYNC1H1, DYNC1I2, DYNLL1"
"48","Antigen Presentation: Folding, assembly and peptide loading of class I MHC",0.0230460921843687,0.0498989506809845,-0.365738117163703,-1.72930010583691,114,16,"TAPBP, TAP2, TAP1, SEC31A, SEC24D, SEC24B, SEC24A, SEC23A, SEC13, SAR1B"
"49","Antigen activates B Cell Receptor (BCR) leading to generation of second messengers",0.489348994624726,0.509200880816399,0.145559312108555,0.939394923943902,2457,31,"AHCYL1, BLNK, BTK, CALM1, CD79A, DAPP1, FYN, GRB2, IGHM, IGLC2, IGLC3, IGLC1, IGLC7, ITPR1, ITPR2, ITPR3, LYN, NCK1, ORAI1, ORAI2, PIK3AP1, PIK3CD, PIK3R1, PLCG2"
"50","Antigen processing-Cross presentation",0.0301407892127702,0.0531764149534065,-0.396880012417861,-3.19874694881578,151,77,"VAMP8, UBC, UBB, TLR4, TIRAP, TAPBP, TAP2, TAP1, STX4, SNAP23, SEC61G, SEC61B, SEC61A2, SEC61A1, SEC22B, RPS27A, PSMF1, PSME4, PSME3, PSME2, PSME1, PSMD9, PSMD8, PSMD7, PSMD6, PSMD5, PSMD4, PSMD3, PSMD2, PSMD14, PSMD13, PSMD12, PSMD11, PSMD10, PSMD1, PSMC6, PSMC5, PSMC4, PSMC3, PSMC2, PSMC1, PSMB8, PSMB7, PSMB6, PSMB5, PSMB4, PSMB3, PSMB2, PSMB10, PSMB1, PSMA7, PSMA6, PSMA5, PSMA4, PSMA3, PSMA1"
"51","Antigen processing: Ubiquitination & Proteasome degradation",0.108202443280977,0.131379534681991,-0.189473904777263,-1.22537164899948,557,272,"ZNRF2, ZNRF1, ZBTB16, WWP1, WSB1, UNKL, UFL1, UBR4, UBR2, UBR1, UBOX5, UBE4A, UBE3C, UBE3B, UBE3A, UBE2Z, UBE2W, UBE2V2, UBE2U, UBE2S, UBE2R2, UBE2Q2, UBE2Q1, UBE2O, UBE2N, UBE2M, UBE2K, UBE2J2, UBE2J1, UBE2H, UBE2G2, UBE2G1, UBE2F, UBE2E3, UBE2E2, UBE2E1, UBE2D3, UBE2D2, UBE2D1, UBE3D, UBE2B, UBE2A, UBC, UBB, UBAC1, UBA6, UBA5, UBA3, UBA1, TRIP12, TRIM9, TRIM39, TRIM37, TRIM36, TRIM32, TRIM21, TRIM11, TRAIP, TRAF7, TPP2, THOP1, STUB1, SPSB4, SPSB2, SPSB1, SOCS3, SOCS1, SMURF2, SMURF1, SKP2, SKP1, SIAH2, SIAH1, SH3RF1, RPS27A, RNF7, RNF6, RNF41, RNF4, RNF34, RNF25, RNF220, RNF217, RNF213, RNF19B, RNF19A, RNF182, RNF144B, RNF14, RNF138, RNF130, RNF126, RNF123, RNF115, RNF114, RNF111, RLIM, RCHY1, RBX1, RBCK1, RBBP6, PSMF1, PSME4, PSME3, PSME2, PSME1, PSMD9, PSMD8, PSMD7, PSMD6, PSMD5, PSMD4, PSMD3, PSMD2, PSMD14, PSMD13, PSMD12, PSMD11, PSMD10, PSMD1, PSMC6, PSMC5, PSMC4, PSMC3, PSMC2, PSMC1, PSMB8, PSMB7, PSMB6, PSMB5, PSMB4, PSMB3, PSMB2, PSMB10, PSMB1, PSMA7, PSMA6, PSMA5, PSMA4, PSMA3, PSMA1"
"52","Antimicrobial peptides",0.00401203610832497,0.0470433599779914,0.463011716623286,2.36695798477714,19,19,"ART1, ATOX1, ATP7A, BPIFB1, CAMP, CCR2, CHGA, CLU, DEFB107A, DEFB129, DEFB135, DEFB105A, DEFB136"
"53","Antiviral mechanism by IFN-stimulated genes",0.0336318407960199,0.0551615868902521,-0.201467974320905,-1.58706220776426,168,68,"USP41, USP18, UBE2N, UBE2E1, UBC, UBB, TRIM25, TPR, STAT1, SEH1L, SEC13, RPS27A, RANBP2, RAE1, PPM1B, POM121C, POM121, PLCG1, PIN1, PDE12, OAS1, NUP42, NUP58, NUP98, NUP93, NUP88, NUP85, NUP54, NUP50, NUP43, NUP37, NUP35, NUP214, NUP210, NUP205, NUP188, NUP160, NUP155, NUP153, NUP133, NUP107, NEDD4, NDC1, MAPK3, KPNB1, KPNA7, KPNA4, KPNA3, KPNA2, KPNA1, JAK1, ISG15, IRF3, FLNB, FLNA, EIF4G3, EIF4G2, EIF4G1, EIF4E2, EIF4E, EIF4A3, EIF4A2, EIF4A1, EIF2AK2"
"54","Apoptosis",0.056192883531013,0.0759122632103689,-0.187832795429507,-1.53166656575117,288,151,"YWHAZ, YWHAQ, YWHAH, YWHAG, YWHAE, YWHAB, XIAP, VIM, UNC5B, UNC5A, UBC, UBB, UACA, TP73, TP63, TP53BP2, TP53, TRAF2, TRADD, TNFRSF10B, TLR4, TJP2, TJP1, TICAM1, TFDP2, TFDP1, STK26, STK24, STAT3, SPTAN1, SFN, SATB1, RPS27A, ROCK1, RIPK1, PTK2, PSMF1, PSME4, PSME3, PSME2, PSME1, PSMD9, PSMD8, PSMD7, PSMD6, PSMD5, PSMD4, PSMD3, PSMD2, PSMD14, PSMD13, PSMD12, PSMD11, PSMD10, PSMD1, PSMC6, PSMC5, PSMC4, PSMC3, PSMC2, PSMC1, PSMB8, PSMB7, PSMB6, PSMB5, PSMB4, PSMB3, PSMB2, PSMB10, PSMB1, PSMA7, PSMA6, PSMA5, PSMA4, PSMA3, PSMA1, PRKCQ, PRKCD, PPP3R1, PPP3CC, PPP1R13B"
"55","Apoptotic cleavage of cellular proteins",0.0616562562965948,0.0814148249167391,0.21534765469215,1.49575565287211,305,37,"ACIN1, ADD1, APC, BCAP31, BIRC2, BMX, CASP3, CASP6, CASP7, CASP8, CDH1, CLSPN, CTNNB1, DBNL, DSG2, DSG3, DSP"
"56","Apoptotic execution phase",0.0429845904298459,0.063997621556394,0.210525296975719,1.58142678549853,211,44,"ACIN1, ADD1, APC, BCAP31, BIRC2, BMX, CASP3, CASP6, CASP7, CASP8, CDH1, CLSPN, CTNNB1, DBNL, DFFA, DFFB, DNM1L, DSG2, DSG3, DSP"
"57","Apoptotic factor-mediated response",0.00417329093799682,0.0470433599779914,0.477319733673325,2.20933801015315,20,15,"APAF1, APIP, AVEN, BAK1, BAX, C1QBP, CASP3, CASP7, CASP9"
"58","Aquaporin-mediated transport",0.00603621730382294,0.0470433599779914,0.365370974606327,2.47765253178787,29,35,"ADCY1, ADCY2, ADCY3, ADCY5, ADCY6, ADCY7, ADCY8, ADCY9, AQP1, AQP11, AQP4, AQP7, AQP9, GNAS, GNB1, GNB3, GNB4, GNB5, GNG11, GNG12, GNG13, GNG2, GNG3, GNG4, GNG7"
"59","Arachidonic acid metabolism",0.00705218617771509,0.0470433599779914,0.300370816332791,2.08630712570264,34,37,"ABCC1, ALOX12, ALOX12B, ALOX5, ALOX5AP, ALOXE3, CBR1, CYP2J2, CYP2U1, CYP4F8, CYP4F3, EPHX2, FAAH, GGT1, GGT5, GPX1, GPX4, HPGD, HPGDS, LTA4H, LTC4S, MAPKAPK2, PLA2G4A, PON1, PON2, PON3, PRXL2B, PTGDS, PTGES, PTGES2, PTGES3, PTGIS, PTGR1, PTGR2, PTGS1, PTGS2"
"60","Asparagine N-linked glycosylation",0.0346534653465347,0.0554671691818168,0.111673010764837,1.32564295668049,167,259,"CAPZA1, ACTR10, ACTR1A, ALG1, ALG10B, ALG10, ALG11, ALG12, ALG14, ALG2, ALG3, ALG5, ALG6, ALG8, ALG9, AMDHD2, AMFR, ANK1, ANK2, ANK3, ANKRD28, ARCN1, ARF1, ARF3, ARF4, ARF5, ARFGAP1, ARFGAP2, ARFGAP3, B4GALNT2, B4GALT1, B4GALT2, B4GALT3, B4GALT4, B4GALT5, B4GALT6, CALR, CANX, CAPZA2, CAPZB, CD55, CD59, CHST10, CHST8, CMAS, CNIH1, CNIH2, CNIH3, COG1, COG2, COG3, COG4, COG5, COG6, COG7, COG8, COPA, COPB1, COPB2, COPE, COPG1, COPG2, COPZ1, COPZ2, CSNK1D, CTSA, CTSC, CTSZ, DAD1, DCTN1, DCTN2, DCTN3, DCTN4, DCTN5, DCTN6, DDOST, DERL1, DERL2, DHDDS, DOLK, DOLPP1, DPAGT1, DPM2, DPM3, DYNC1H1, DYNC1I1, DYNC1I2, DYNC1LI1, DYNC1LI2, DYNLL1, DYNLL2, EDEM1, EDEM2, EDEM3"
"61","Assembly Of The HIV Virion",0.006841046277666,0.0470433599779914,-0.511035557444397,-2.3443858210859,33,15,"VPS37D, VPS37C, VPS37B, VPS37A, VPS28, UBC, UBB, UBAP1, TSG101"
"62","Assembly and cell surface presentation of NMDA receptors",0.00418576838748256,0.0470433599779914,0.490085104463958,2.69409495153563,20,22,"ACTN2, APBA1, CAMK2A, CAMK2B, CAMK2G, CASK, DLG1, DLG2, DLG3, DLG4, GRIN1, GRIN2A, GRIN2B, GRIN2D, GRIN3A, GRIN3B, KIF17, LIN7A, LIN7B, LIN7C, LRRC7"
"63","Assembly of collagen fibrils and other multimeric structures",0.00584323997582108,0.0470433599779914,0.419933199374176,2.9167601462413,28,37,"BMP1, CD151, COL11A1, COL11A2, COL18A1, COL1A2, COL27A1, COL2A1, COL4A1, COL4A2, COL4A3, COL4A4, COL4A5, COL5A1, COL5A2, COL5A3, COL6A1, COL6A5, COL6A6, COL8A1, COL8A2, CTSB, CTSS"
"64","Assembly of the pre-replicative complex",0.0242641209228321,0.0503544974743471,-0.416979982321049,-3.14664587858235,121,59,"UBC, UBB, RPS27A, PSMF1, PSME4, PSME3, PSME2, PSME1, PSMD9, PSMD8, PSMD7, PSMD6, PSMD5, PSMD4, PSMD3, PSMD2, PSMD14, PSMD13, PSMD12, PSMD11, PSMD10, PSMD1, PSMC6, PSMC5, PSMC4, PSMC3, PSMC2, PSMC1, PSMB8, PSMB7, PSMB6, PSMB5, PSMB4, PSMB3, PSMB2, PSMB10, PSMB1, PSMA7, PSMA6, PSMA5, PSMA4, PSMA3, PSMA1, ORC6, ORC5, ORC4, ORC3, ORC2, ORC1"
"65","Association of TriC/CCT with target proteins during biosynthesis",0.00624622204311908,0.0470433599779914,0.348065005982146,2.41758008002926,30,37,"AP3M1, ARFGEF2, CCNE1, CCNE2, CCT2, CCT3, CCT4, CCT5, CCT6A, CCT7, CCT8, DCAF7, FBXL3, FBXL5, FBXO4, FBXO6, FBXW10, FBXW2, FBXW4, FBXW5, FBXW7, FBXW9, FKBP9, GAPDHS, GBA"
"66","Asymmetric localization of PCP proteins",0.023587710604559,0.0498989506809845,-0.519850884671184,-3.89509173861851,118,57,"WNT5A, VANGL2, UBC, UBB, SMURF2, SMURF1, SCRIB, RPS27A, PSMF1, PSME4, PSME3, PSME2, PSME1, PSMD9, PSMD8, PSMD7, PSMD6, PSMD5, PSMD4, PSMD3, PSMD2, PSMD14, PSMD13, PSMD12, PSMD11, PSMD10, PSMD1, PSMC6, PSMC5, PSMC4, PSMC3, PSMC2, PSMC1, PSMB8, PSMB7, PSMB6, PSMB5, PSMB4, PSMB3, PSMB2, PSMB10, PSMB1, PSMA7, PSMA6, PSMA5, PSMA4, PSMA3, PSMA1, PRICKLE1"
"67","Attenuation phase",0.0192577733199599,0.0494829099272216,0.347228955199391,1.77506598331661,95,19,"COL4A6, CREBBP, DEDD2, DNAJB1, DNAJB6, EP300, FKBP4, GML, HSBP1, HSF1, HSP90AB1, HSPA2, HSPA8, HSPH1"
"68","Autodegradation of Cdh1 by Cdh1:APC/C",0.023587710604559,0.0498989506809845,-0.441154035985103,-3.30543910127358,118,57,"UBE2E1, UBE2D1, UBC, UBB, RPS27A, PSMF1, PSME3, PSME2, PSME1, PSMD9, PSMD8, PSMD7, PSMD6, PSMD5, PSMD4, PSMD3, PSMD2, PSMD14, PSMD13, PSMD12, PSMD11, PSMD10, PSMD1, PSMC6, PSMC5, PSMC4, PSMC3, PSMC2, PSMC1, PSMB8, PSMB7, PSMB6, PSMB5, PSMB4, PSMB3, PSMB2, PSMB10, PSMB1, PSMA7, PSMA6, PSMA5, PSMA4, PSMA3, PSMA1"
"69","Autodegradation of the E3 ubiquitin ligase COP1",0.0183903500098873,0.0494829099272216,-0.647283740299073,-4.55798810319418,92,45,"UBC, UBB, TP53, RPS27A, PSMF1, PSME4, PSME3, PSME2, PSME1, PSMD9, PSMD8, PSMD7, PSMD6, PSMD5, PSMD4, PSMD3, PSMD2, PSMD14, PSMD13, PSMD12, PSMD11, PSMD10, PSMD1, PSMC6, PSMC5, PSMC4, PSMC3, PSMC2, PSMC1, PSMB8, PSMB7, PSMB6, PSMB5, PSMB4, PSMB3, PSMB2, PSMB10, PSMB1, PSMA7, PSMA6, PSMA5, PSMA4, PSMA3, PSMA1"
"70","Autophagy",0.111458130001952,0.134378427005879,-0.122231010093807,-1.01054835827921,570,110,"WIPI2, WIPI1, WDR45B, VPS37D, VPS37C, VPS37B, VPS37A, VPS28, VDAC1, VCP, UVRAG, ULK1, UBE2N, UBC, UBB, UBAP1, TSG101, TSC2, TSC1, TOMM70, TOMM7, TOMM6, TOMM40, TOMM22, TOMM20"
