"","pathway","pval","padj","ES","NES","nMoreExtreme","size","leadingEdge"
"726","Regulation of RUNX2 expression and activity",0.0255192878338279,0.0503544974743471,-0.488888888888889,-3.76465212279544,128,63,"WWP1, UBC, UBB, STUB1, STAT1, SMURF1, SKP2, SKP1, RUNX2, RPS27A, RBX1, PSMF1, PSME4, PSME3, PSME2, PSME1, PSMD9, PSMD8, PSMD7, PSMD6, PSMD5, PSMD4, PSMD3, PSMD2, PSMD14, PSMD13, PSMD12, PSMD11, PSMD10, PSMD1, PSMC6, PSMC5, PSMC4, PSMC3, PSMC2, PSMC1, PSMB8, PSMB7, PSMB6, PSMB5, PSMB4, PSMB3, PSMB2, PSMB10, PSMB1, PSMA7, PSMA6, PSMA5, PSMA4, PSMA3, PSMA1, PPARGC1B, PPARGC1A"
"727","Regulation of RUNX3 expression and activity",0.0204490777866881,0.0494829099272216,-0.608329614151824,-4.37660990649903,101,49,"UBC, UBB, TGFB1, SRC, SMURF2, SMURF1, RPS27A, PSMF1, PSME3, PSME2, PSME1, PSMD9, PSMD8, PSMD7, PSMD6, PSMD5, PSMD4, PSMD3, PSMD2, PSMD14, PSMD13, PSMD12, PSMD11, PSMD10, PSMD1, PSMC6, PSMC5, PSMC4, PSMC3, PSMC2, PSMC1, PSMB8, PSMB7, PSMB6, PSMB5, PSMB4, PSMB3, PSMB2, PSMB10, PSMB1, PSMA7, PSMA6, PSMA5, PSMA4, PSMA3, PSMA1"
"728","Regulation of TNFR1 signaling",0.0148624221731271,0.0477005428226779,-0.333574281387678,-2.05297244764611,73,31,"XIAP, USP4, USP21, USP2, UBC, UBB, TRAF2, TRAF1, TRADD, TNFRSF1A, TNFAIP3, TAX1BP1, SPPL2B, SPPL2A, SHARPIN, RPS27A, RNF31, RIPK1, RBCK1, RACK1"
"729","Regulation of TP53 Activity",0.0548851693265862,0.074926906853993,-0.173082931214993,-1.41464150084231,281,146,"ZNF385A, WRN, USP7, USP2, UBC, UBB, TTC5, TP73, TP63, TP53RK, TP53INP1, TP53BP2, TP53, TPX2, TOPBP1, TOP3A, TBP, TAF9B, TAF7L, TAF7, TAF6, TAF5, TAF4B, TAF4, TAF3, TAF2, TAF15, TAF13, TAF12, TAF11, TAF10, TAF1, TAF1L, SUPT16H, STK11, SSRP1, SMYD2, SGK1, RPS27A, RPA3, RPA2, RPA1, RNF34, RMI2, RMI1, RICTOR, RHNO1, RFFL, RFC5, RFC4, RFC3, RFC2, RBBP8, RBBP7, RAD9B, RAD9A, RAD50, RAD17, RAD1, PRMT5, PRKAG2, PRKAG1, PRKAB2, PRKAB1, PRKAA2, PRKAA1, PRDM1, PPP2R5C, PPP2R1B, PPP2R1A, PPP2CB, PPP2CA, PPP1R13L, PPP1R13B, PML, PLK3, PIP4K2C, PIP4K2B, PIP4K2A, PIN1, PHF20"
"730","Regulation of TP53 Activity through Acetylation",0.0174776564051639,0.0494829099272216,0.293052109181141,1.8052105602094,87,28,"AKT1, AKT2, AKT3, BRD1, BRD7, BRPF1, BRPF3, CHD3, CHD4, EP300, GATAD2A, GATAD2B, HDAC1, HDAC2, ING2, ING5, KAT6A, MAP2K6, MBD3, MEAF6, MTA2, PIN1, PIP4K2A, PIP4K2B, PIP4K2C, PML"
"731","Regulation of TP53 Activity through Methylation",0.835943775100402,0.840861091424522,-0.142704148817362,-0.689733428811929,4162,17,"UBC, UBB, TTC5, TP53"
"732","Regulation of TP53 Activity through Phosphorylation",0.0338173861149791,0.0551615868902521,-0.264934497310524,-2.1570697455767,169,86,"WRN, UBC, UBB, TP53RK, TP53INP1, TP53, TPX2, TOPBP1, TOP3A, TBP, TAF9B, TAF7L, TAF7, TAF6, TAF5, TAF4B, TAF4, TAF3, TAF2, TAF15, TAF13, TAF12, TAF11, TAF10, TAF1, TAF1L, SUPT16H, STK11, SSRP1, RPS27A, RPA3, RPA2, RPA1, RMI2, RMI1, RHNO1, RFC5, RFC4, RFC3, RFC2, RBBP8, RAD9B, RAD9A, RAD50, RAD17, RAD1, PRKAG2, PRKAG1, PRKAB2, PRKAB1, PRKAA2, PRKAA1"
"733","Regulation of TP53 Degradation",0.293279839518556,0.31541416702939,-0.169948053329551,-1.05935109249305,1461,32,"USP7, USP2, UBC, UBB, TP53, SGK1, RPS27A, RNF34, RICTOR, RFFL, PPP2R5C, PPP2R1B, PPP2R1A, PPP2CB, PPP2CA, PHF20, PDPK1, MTOR, MLST8, MDM4, MDM2, MAPKAP1"
"734","Regulation of TP53 Expression and Degradation",0.226954609078184,0.251192479950612,-0.179451966473243,-1.13409315463061,1134,33,"USP7, USP2, UBC, UBB, TP53, SGK1, RPS27A, RNF34, RICTOR, RFFL, PRDM1, PPP2R5C, PPP2R1B, PPP2R1A, PPP2CB, PPP2CA, PHF20, PDPK1, MTOR, MLST8, MDM4, MDM2, MAPKAP1"
"735","Regulation of actin dynamics for phagocytic cup formation",0.0160340978282931,0.0486715513959429,0.215895686776096,1.84219493873355,78,60,"ABI1, ABI2, ABL1, ACTB, ACTG1, ACTR2, ACTR3, ARPC1A, ARPC1B, ARPC2, ARPC3, ARPC4, ARPC5, BAIAP2, BRK1, BTK, CD247, CDC42, CFL1, CRK, CYFIP1, CYFIP2, DOCK1, ELMO1, ELMO2, FCGR1A, FCGR2A, GRB2, HSP90AB1, IGLC2, IGLC3, IGLC1, IGLC7, LIMK1, MAPK1, MAPK3, MYH9, MYO10, MYO1C, MYO5A, MYO9B, NCK1, NCKAP1, NCKAP1L, NCKIPSD, NF2"
"736","Regulation of activated PAK-2p34 by proteasome mediated degradation",0.0179487179487179,0.0494829099272216,-0.646731170029488,-4.52696588678231,90,44,"UBC, UBB, RPS27A, PSMF1, PSME4, PSME3, PSME2, PSME1, PSMD9, PSMD8, PSMD7, PSMD6, PSMD5, PSMD4, PSMD3, PSMD2, PSMD14, PSMD13, PSMD12, PSMD11, PSMD10, PSMD1, PSMC6, PSMC5, PSMC4, PSMC3, PSMC2, PSMC1, PSMB8, PSMB7, PSMB6, PSMB5, PSMB4, PSMB3, PSMB2, PSMB10, PSMB1, PSMA7, PSMA6, PSMA5, PSMA4, PSMA3, PSMA1"
"737","Regulation of beta-cell development",0.0516795865633075,0.072535233671619,0.259181203003419,1.5392687124417,259,26,"AKT1, AKT2, AKT3, CREBBP, EP300, FGF10, FOXO1, GCK, HES1, HNF1A, HNF1B, HNF4G, INS, KAT2A, KAT2B, MAML1, MAML2, MAML3, MAMLD1, NKX2-2, NOTCH1, PAX6, PKLR"
"738","Regulation of cholesterol biosynthesis by SREBP (SREBF)",0.216194494675507,0.241366214947846,-0.145647512864494,-1.06782267916429,1075,53,"TM7SF2, TGS1, TBL1XR1, TBL1X, SREBF2, SREBF1, SQLE, SP1, SMARCD3, SEC24D, SEC24B, SEC24A, SEC23A, SCD, SCAP, SC5D, SAR1B, RXRA, PPARA, PMVK, NFYC, NFYB, NFYA, NCOA6, NCOA2, NCOA1, MVK, MVD, MTF1, MED1, MBTPS2, MBTPS1, LSS, KPNB1, INSIG2, INSIG1, IDI1, HMGCS1, HMGCR, HELZ2, GPAM, GGPS1, FDPS, FDFT1, FASN"
"739","Regulation of expression of SLITs and ROBOs",0.0481974921630094,0.0690651214514632,-0.509302989843433,-4.23357528409942,245,129,"ZSWIM8, USP33, UPF3B, UPF3A, UPF2, UBC, UBB, SLIT2, SLIT1, RPSA, RPS9, RPS8, RPS7, RPS5, RPS4X, RPS3A, RPS28, RPS27L, RPS27A, RPS25, RPS24, RPS21, RPS20, RPS19, RPS17, RPS16, RPS15A, RPS15, RPS14, RPS13, RPS12, RPS11, RPLP1, RPL8, RPL7A, RPL6, RPL5, RPL4, RPL3L, RPL38, RPL37A, RPL36, RPL35, RPL34, RPL32, RPL30, RPL3, RPL29, RPL28, RPL27, RPL26, RPL23, RPL22L1, RPL19, RPL18A, RPL18, RPL14, RPL13A, RPL12, RPL11, RPL10A, RPL10, ROBO3, ROBO2, ROBO1, RNPS1, RBX1, RBM8A, PSMF1, PSME4, PSME3, PSME2, PSME1, PSMD9, PSMD8, PSMD7, PSMD6, PSMD5, PSMD4, PSMD3, PSMD2, PSMD14, PSMD13, PSMD12, PSMD11, PSMD10, PSMD1, PSMC6, PSMC5, PSMC4, PSMC3, PSMC2, PSMC1, PSMB8, PSMB7, PSMB6, PSMB5, PSMB4, PSMB3, PSMB2, PSMB10, PSMB1, PSMA7, PSMA6, PSMA5, PSMA4, PSMA3, PSMA1"
"740","Regulation of insulin secretion",0.00945293644408689,0.0470433599779914,0.255643446622333,2.27040676186249,46,66,"ABCC8, ACSL3, ACSL4, ADCY5, ADCY6, ADCY8, ADRA2C, AHCYL1, AKAP5, CACNA1A, CACNA1C, CACNA1D, CACNA1E, CACNA2D2, CACNB2, CACNB3, CHRM3, GCG, GNA11, GNA14, GNA15, GNAI1, GNAI2, GNAS, GNB1, GNB3, GNB4, GNB5, GNG11, GNG12, GNG13, GNG2, GNG3, GNG4, GNG7, INS, IQGAP1, ITPR1, ITPR2, ITPR3, KCNB1, KCNC2, KCNG2, KCNJ11, KCNS3"
"741","Regulation of lipid metabolism by PPARalpha",0.0139059304703476,0.0470433599779914,0.204256006740738,2.16521554750148,67,109,"ABCA1, ABCB4, ACADM, ACOX1, ACSL1, AGT, AHR, AHRR, ALAS1, ANGPTL4, APOA1, ARNT, ARNT2, ARNTL, CARM1, CCNC, CDK19, CDK8, CHD9, CLOCK, CPT1A, CPT2, CREBBP, EP300, ESRRA, FADS1, FAM120B, FDFT1, FHL2, G0S2, GLIPR1, MED20, GPS2, GRHL1, HDAC3, HELZ2, HMGCR, HMGCS1, HMGCS2, ME1, MED1, MED10, MED11, MED12, MED13, MED13L, MED14, MED15, MED16, MED17, MED18, MED19, MED21, MED22, MED23, MED24, MED25, MED26, MED27, MED28, MED29, MED30, MED31, MED4, MED6, MED7, MED8, MED9, MTF1, NCOA1, NCOA2, NCOA3, NCOA6, NCOR1, NCOR2, NFYA, NFYB, NFYC, NPAS2, NR1D1, NR1H2, NR1H3, NR1H4, NRF1"
"742","Regulation of mRNA stability by proteins that bind AU-rich elements",0.0304235434480016,0.0531764149534065,-0.340888815915497,-2.75483795590075,152,78,"ZFP36L1, ZFP36, YWHAZ, YWHAB, XRN1, XPO1, UBC, UBB, TNPO1, SET, RPS27A, PSMF1, PSME4, PSME3, PSME2, PSME1, PSMD9, PSMD8, PSMD7, PSMD6, PSMD5, PSMD4, PSMD3, PSMD2, PSMD14, PSMD13, PSMD12, PSMD11, PSMD10, PSMD1, PSMC6, PSMC5, PSMC4, PSMC3, PSMC2, PSMC1, PSMB8, PSMB7, PSMB6, PSMB5, PSMB4, PSMB3, PSMB2, PSMB10, PSMB1, PSMA7, PSMA6, PSMA5, PSMA4, PSMA3, PSMA1, PRKCD, PRKCA"
"743","Regulation of mitotic cell cycle",0.0291608807776235,0.053142209019257,-0.326666536760264,-2.59760606527701,146,73,"UBE2E1, UBE2D1, UBC, UBB, SKP2, SKP1, RPS27A, PTTG1, PSMF1, PSME4, PSME3, PSME2, PSME1, PSMD9, PSMD8, PSMD7, PSMD6, PSMD5, PSMD4, PSMD3, PSMD2, PSMD14, PSMD13, PSMD12, PSMD11, PSMD10, PSMD1, PSMC6, PSMC5, PSMC4, PSMC3, PSMC2, PSMC1, PSMB8, PSMB7, PSMB6, PSMB5, PSMB4, PSMB3, PSMB2, PSMB10, PSMB1, PSMA7, PSMA6, PSMA5, PSMA4, PSMA3, PSMA1"
"744","Regulation of ornithine decarboxylase (ODC)",0.0188941925218775,0.0494829099272216,-0.545734426745596,-3.86708465246363,94,46,"PSMF1, PSME4, PSME3, PSME2, PSME1, PSMD9, PSMD8, PSMD7, PSMD6, PSMD5, PSMD4, PSMD3, PSMD2, PSMD14, PSMD13, PSMD12, PSMD11, PSMD10, PSMD1, PSMC6, PSMC5, PSMC4, PSMC3, PSMC2, PSMC1, PSMB8, PSMB7, PSMB6, PSMB5, PSMB4, PSMB3, PSMB2, PSMB10, PSMB1, PSMA7, PSMA6, PSMA5, PSMA4, PSMA3, PSMA1, ODC1, OAZ3, OAZ2, OAZ1, NQO1"
"745","Regulation of pyruvate dehydrogenase (PDH) complex",0.0124748490945674,0.0470433599779914,-0.407097322566936,-1.86756709376686,61,15,"RXRA, PPARD, PDPR, PDP2, PDP1, PDK4, PDK3, PDK2, PDK1, PDHX, PDHB, PDHA1"
"746","Regulation of signaling by CBL",0.573984720546844,0.58773285756593,-0.177801393316802,-0.878860424220895,2854,18,"YES1, VAV1, SYK, RAPGEF1, PIK3R3, PIK3R2, PIK3R1, PIK3CD, PIK3CB, PIK3CA"
"747","Reproduction",0.054726368159204,0.074926906853993,-0.174096108404258,-1.37144057311622,274,68,"ZP3, PRDM9, UBE2I, TOP3A, TINF2, TEX15, TEX12, TERF2IP, TERF2, TERF1, SYNE2, SYNE1, SYCP3, SYCP2, SYCE3, SYCE2, SUN2, SUN1, STAG2, STAG1, SPO11, SMC3, SMC1B, SMC1A, RPA3, RPA2, RPA1, REC8, RBBP8, RAD51C, RAD51, RAD50, RAD21"
"748","Resolution of AP sites via the multiple-nucleotide patch replacement pathway",0.010443864229765,0.0470433599779914,-0.429761145368205,-2.40467319102082,51,24,"RPA3, RPA2, RPA1, RFC5, RFC4, RFC3, RFC2, RFC1, POLE4, POLE3, POLE2, POLE, POLD4, POLD2, POLD1, POLB, PCNA, PARP2, PARP1, PARG"
"749","Resolution of Abasic Sites (AP sites)",0.015082357610637,0.0477194889915738,-0.373161257170905,-2.47478543674385,75,37,"XRCC1, UNG, TDG, SMUG1, RPA3, RPA2, RPA1, RFC5, RFC4, RFC3, RFC2, RFC1, POLE4, POLE3, POLE2, POLE, POLD4, POLD2, POLD1, POLB, PNKP, PCNA, PARP2, PARP1, PARG, OGG1, NTHL1, NEIL2, NEIL1, MUTYH, MPG, MBD4, LIG3, LIG1"
"750","Resolution of D-Loop Structures",0.140188792930307,0.162401497018227,-0.204825671032706,-1.2605931651909,697,31,"XRCC3, XRCC2, WRN, TOP3A, SPIDR, SLX4, SLX1A, RTEL1, RMI2, RMI1, RBBP8, RAD51D, RAD51C, RAD51B, RAD51, RAD50"
"751","Resolution of D-loop Structures through Holliday Junction Intermediates",0.225683279742765,0.250824382030341,-0.188647805431469,-1.14662714182843,1122,30,"XRCC3, XRCC2, WRN, TOP3A, SPIDR, SLX4, SLX1A, RMI2, RMI1, RBBP8, RAD51D, RAD51C, RAD51B, RAD51, RAD50"
"752","Resolution of D-loop Structures through Synthesis-Dependent Strand Annealing (SDSA)",0.136774452701346,0.159398601132537,-0.230305124388688,-1.28864268987767,680,24,"XRCC3, XRCC2, WRN, TOP3A, RTEL1, RMI2, RMI1, RBBP8, RAD51D, RAD51C, RAD51B, RAD51, RAD50"
"753","Resolution of Sister Chromatid Cohesion",0.140072347266881,0.162401497018227,0.124776396891331,1.22562360930814,696,85,"AHCTF1, B9D2, BUB3, CCNB1, CCNB2, CDCA8, CDK1, CENPC, CENPI, CENPK, CENPL, CENPM, CENPN, CENPO, CENPP, CENPQ, CENPT, CENPU, CKAP5, CLASP1, CLASP2, CLIP1, DYNC1H1, DYNC1I1, DYNC1I2, DYNC1LI1, DYNC1LI2, DYNLL1, DYNLL2, HDAC8, INCENP, ITGB3BP, KIF18A, KIF2A, KNL1, MAD1L1, MAD2L1, MAPRE1, MIS12, NDC80, NDE1, NDEL1, NSL1, NUDC, NUF2, NUP107, NUP133, NUP160, NUP37, NUP43, NUP85, NUP98, PAFAH1B1, PDS5A, PDS5B, PMF1, PPP1CC, PPP2CA, PPP2CB, PPP2R1A, PPP2R1B, PPP2R5A, PPP2R5B, PPP2R5C, PPP2R5D, PPP2R5E"
"754","Respiratory electron transport",0.0363958292347039,0.0573611686556163,-0.280000394039098,-2.30801162488492,184,94,"UQCRQ, UQCRH, UQCRFS1, UQCRC2, UQCRC1, UQCRB, UQCR11, UQCR10, TRAP1, TMEM126B, TIMMDC1, TACO1, SURF1, SDHD, SDHC, SDHB, SDHA, SCO2, SCO1, NUBPL, NDUFV3, NDUFV2, NDUFV1, NDUFS8, NDUFS7, NDUFS6, NDUFS5, NDUFS4, NDUFS3, NDUFS2, NDUFS1, NDUFC2, NDUFC1, NDUFB9, NDUFB8, NDUFB7, NDUFB6, NDUFB5, NDUFB4, NDUFB3, NDUFB2, NDUFB11, NDUFB10, NDUFB1, NDUFAF7, NDUFAF6, NDUFAF5, NDUFAF4, NDUFAF3, NDUFAF2, NDUFAF1, NDUFAB1, NDUFA9, NDUFA8, NDUFA7, NDUFA6, NDUFA5, NDUFA4, NDUFA3, NDUFA2, NDUFA12, NDUFA11, NDUFA10, NDUFA1, MT-ND5, MT-ND4, MT-ND3, MT-ND2, MT-ND1, MT-CYB, MT-CO1"
"755","Respiratory electron transport, ATP synthesis by chemiosmotic coupling, and heat production by uncoupling proteins.",0.0141538461538462,0.0470433599779914,0.23529908657799,2.52328434126698,68,114,"ACAD9, ATP5F1A, ATP5F1B, ATP5F1C, ATP5F1D, ATP5F1E, ATP5MC3, ATP5PD, ATP5PF, ATP5MF, ATP5ME, ATP5MG, ATP5PO, COQ10A, COQ10B, COX11, COX14, COX18, COX19, COX20, COX5A, COX5B, COX6A1, COX6B1, COX6C, COX7A2L, COX7B, COX7C, COX8A, CYC1, DMAC2L, ECSIT, ETFA, ETFDH, CYCS, LRPPRC, MT-ATP6, MT-ATP8, MT-CO1, MT-CYB, MT-ND1, MT-ND2, MT-ND3, MT-ND4, MT-ND5, NDUFA1, NDUFA10, NDUFA11, NDUFA12, NDUFA2, NDUFA3, NDUFA4, NDUFA5, NDUFA6, NDUFA7, NDUFA8, NDUFA9, NDUFAB1, NDUFAF1, NDUFAF2, NDUFAF3, NDUFAF4, NDUFAF5, NDUFAF6, NDUFAF7, NDUFB1, NDUFB10, NDUFB11, NDUFB2, NDUFB3, NDUFB4, NDUFB5, NDUFB6, NDUFB7, NDUFB8, NDUFB9, NDUFC1, NDUFC2, NDUFS1, NDUFS2, NDUFS3, NDUFS4, NDUFS5, NDUFS6, NDUFS7, NDUFS8, NDUFV1, NDUFV2, NDUFV3"
"756","Response of EIF2AK4 (GCN2) to amino acid deficiency",0.0265609514370664,0.051032839277959,-0.509215635356383,-4.03809077774509,133,69,"TRIB3, RPSA, RPS9, RPS8, RPS7, RPS5, RPS4X, RPS3A, RPS28, RPS27L, RPS27A, RPS25, RPS24, RPS21, RPS20, RPS19, RPS17, RPS16, RPS15A, RPS15, RPS14, RPS13, RPS12, RPS11, RPLP1, RPL8, RPL7A, RPL6, RPL5, RPL4, RPL3L, RPL38, RPL37A, RPL36, RPL35, RPL34, RPL32, RPL30, RPL3, RPL29, RPL28, RPL27, RPL26, RPL23, RPL22L1, RPL19, RPL18A, RPL18, RPL14, RPL13A, RPL12, RPL11, RPL10A, RPL10"
"757","Response of Mtb to phagocytosis",0.601157222665603,0.613718716870556,-0.164344930206193,-0.852153655299804,3012,20,"VPS33B, UBC, UBB, TRIM27, SFPQ, RPS27A, RNF213, RAB7A, RAB5A, PGK1, MAPK3, MAPK1, KPNB1, KPNA1, HGS, GSK3A"
"758","Response to elevated platelet cytosolic Ca2+",0.550721810378463,0.566740799847846,-0.0769612108887234,-0.639895226987847,2822,107,"WDR1, VTI1B, VEGFD, VEGFC, VEGFB, VEGFA, VCL, TUBA4A, TTN, TF, TMX3, TMSB4X, TLN1, TIMP3, THBS1, TGFB3, TGFB2, TGFB1, TEX264, TAGLN2, SYTL4, STXBP3, STXBP2, STX4, SPP2, SPARC, SOD1, SERPING1, SERPINF2, SERPINA3, SELENOP, SCG3, SCCPDH, RARRES2, RAB27B, QSOX1, PSAP, PROS1, PRKCG, PRKCB, PRKCA, PPIA, PLEK, PHACTR2, PFN1, PECAM1, PDGFB, PDGFA, PCYOX1L, PCDH7, ORM1, ORM2, OLA1"
"759","Retinoid metabolism and transport",0.109393579072533,0.132512174885972,0.218778727482544,1.37114454216659,551,29,"AGRN, AKR1B10, APOA1, APOB, APOE, CLPS, GPC1, GPC3, GPC4, GPC5, GPC6, HSPG2, LDLR, LPL, LRP1, LRP10, LRP12, LRP2, LRP8, RBP1, RBP2, RBP4, RDH11, RETSAT, SDC1, SDC2, SDC3, SDC4"
"760","Retrograde transport at the Trans-Golgi-Network",0.200118647419419,0.226374566981614,-0.15792636759417,-1.11207258866461,1011,45,"VTI1A, VPS54, VPS53, VPS52, VPS51, VAMP4, USP6NL, TMF1, TGOLN2, STX6, STX16, SCOC, RIC1, RHOBTB3, RGP1, RABEPK, RAB9B, RAB9A, RAB6B, RAB6A, PLIN3, NSF, NAPG, NAPB, NAPA, NAA38, NAA35, NAA30"
"761","Rev-mediated nuclear export of HIV RNA",0.013997200559888,0.0470433599779914,-0.51598968407479,-3.26093037635496,69,33,"XPO1, TPR, SEH1L, SEC13, RCC1, RANGAP1, RANBP2, RANBP1, RAE1, POM121C, POM121, NUP42, NUP58, NUP98, NUP93, NUP88, NUP85, NUP54, NUP50, NUP43, NUP37, NUP35, NUP214, NUP210, NUP205, NUP188, NUP160, NUP155, NUP153, NUP133, NUP107"
"762","Rho GTPase cycle",0.0150345388053637,0.0477194889915738,0.401178754997145,4.43580142874089,73,125,"A2M, ABR, AKAP13, ARAP1, ARAP2, ARHGAP1, ARHGAP10, ARHGAP12, ARHGAP15, ARHGAP17, ARHGAP18, ARHGAP19, ARHGAP20, ARHGAP21, ARHGAP22, ARHGAP23, ARHGAP24, ARHGAP25, ARHGAP26, ARHGAP27, ARHGAP28, ARHGAP29, ARHGAP30, ARHGAP31, ARHGAP32, ARHGAP33, ARHGAP35, ARHGAP39, ARHGAP4, ARHGAP42, ARHGAP44, ARHGAP5, ARHGAP6, ARHGDIA, ARHGDIB, ARHGDIG, ARHGEF1, ARHGEF10, ARHGEF10L, ARHGEF11, ARHGEF12, ARHGEF15, ARHGEF16, ARHGEF17, ARHGEF18, ARHGEF19, ARHGEF2, ARHGEF26, ARHGEF3, ARHGEF33, ARHGEF37, ARHGEF38, ARHGEF4, ARHGEF40, ARHGEF5, ARHGEF6, ARHGEF7, ARHGEF9"
"763","Ribosomal scanning and start codon recognition",0.0090198436560433,0.0470433599779914,0.271210507632233,2.11702493004816,44,48,"EIF1AX, EIF2S1, EIF2S2, EIF2S3, EIF3A, EIF3B, EIF3C, EIF3D, EIF3E, EIF3F, EIF3G, EIF3H, EIF3I, EIF3J, EIF3K, EIF3L, EIF3M, EIF4A1, EIF4A2, EIF4E, EIF4G1, EIF4H, EIF5, FAU, RPS18, RPS11, RPS12, RPS13, RPS14, RPS15, RPS15A, RPS16, RPS17, RPS19, RPS20, RPS21, RPS24, RPS25, RPS27A, RPS27L, RPS28, RPS3A, RPS4X, RPS5, RPS7, RPS8, RPS9, RPSA"
"764","Role of LAT2/NTAL/LAB on calcium mobilization",0.0522088353413655,0.072879272190804,-0.320983281382828,-1.55141179211845,259,17,"SYK, SOS1, SHC1, PIK3R2, PIK3R1, PIK3CB, PIK3CA, PDPK1, LYN, LAT2, IGLC7, IGLC1, IGLC3, IGLC2, GRB2, GAB2, FYN"
"765","Role of phospholipids in phagocytosis",0.0174915523752733,0.0494829099272216,0.302291279288515,1.79529804962997,87,26,"AHCYL1, CD247, FCGR1A, FCGR2A, IGLC2, IGLC3, IGLC1, IGLC7, ITPR1, ITPR2, ITPR3, PIK3CA, PIK3CB, PIK3R1, PIK3R2, PLA2G6, PLCG1, PLCG2, PLD1, PLD2, PLD3, PLPP4, PLPP5, PRKCD, PRKCE"
"766","S Phase",0.0538371182458888,0.0745437021866153,-0.199410385549664,-1.6271921210283,274,142,"WEE1, WAPL, UBE2E1, UBE2D1, UBC, UBB, TFDP2, TFDP1, STAG2, STAG1, SMC3, SMC1A, SKP2, SKP1, RPS27A, RPA3, RPA2, RPA1, RFC5, RFC4, RFC3, RFC2, RFC1, RBX1, RBL2, RB1, RAD21, PSMF1, PSME4, PSME3, PSME2, PSME1, PSMD9, PSMD8, PSMD7, PSMD6, PSMD5, PSMD4, PSMD3, PSMD2, PSMD14, PSMD13, PSMD12, PSMD11, PSMD10, PSMD1, PSMC6, PSMC5, PSMC4, PSMC3, PSMC2, PSMC1, PSMB8, PSMB7, PSMB6, PSMB5, PSMB4, PSMB3, PSMB2, PSMB10, PSMB1, PSMA7, PSMA6, PSMA5, PSMA4, PSMA3, PSMA1, PRIM2, PRIM1, POLE4, POLE3, POLE2, POLE, POLD4, POLD2, POLD1, POLA2, POLA1, PDS5B, PDS5A, PCNA, ORC6, ORC5, ORC4, ORC3, ORC2, ORC1"
"767","S33 mutants of beta-catenin aren't phosphorylated",0.0417329093799682,0.0629775721779356,0.347924635217453,1.61041554963381,209,15,"AMER1, APC, AXIN1, CSNK1A1, CTNNB1, GSK3B, PPP2CA, PPP2CB, PPP2R1A, PPP2R1B, PPP2R5A, PPP2R5B, PPP2R5C, PPP2R5D, PPP2R5E"
"768","S37 mutants of beta-catenin aren't phosphorylated",0.0417329093799682,0.0629775721779356,0.347924635217453,1.61041554963381,209,15,"AMER1, APC, AXIN1, CSNK1A1, CTNNB1, GSK3B, PPP2CA, PPP2CB, PPP2R1A, PPP2R1B, PPP2R5A, PPP2R5B, PPP2R5C, PPP2R5D, PPP2R5E"
"769","S45 mutants of beta-catenin aren't phosphorylated",0.0417329093799682,0.0629775721779356,0.347924635217453,1.61041554963381,209,15,"AMER1, APC, AXIN1, CSNK1A1, CTNNB1, GSK3B, PPP2CA, PPP2CB, PPP2R1A, PPP2R1B, PPP2R5A, PPP2R5B, PPP2R5C, PPP2R5D, PPP2R5E"
"770","SCF(Skp2)-mediated degradation of p27/p21",0.0221016676712879,0.0498989506809845,-0.499506861063465,-3.66216177778456,109,53,"UBC, UBB, SKP2, SKP1, RPS27A, PSMF1, PSME3, PSME2, PSME1, PSMD9, PSMD8, PSMD7, PSMD6, PSMD5, PSMD4, PSMD3, PSMD2, PSMD14, PSMD13, PSMD12, PSMD11, PSMD10, PSMD1, PSMC6, PSMC5, PSMC4, PSMC3, PSMC2, PSMC1, PSMB8, PSMB7, PSMB6, PSMB5, PSMB4, PSMB3, PSMB2, PSMB10, PSMB1, PSMA7, PSMA6, PSMA5, PSMA4, PSMA3, PSMA1"
"771","SCF-beta-TrCP mediated degradation of Emi1",0.0201476161978855,0.0494829099272216,-0.586102236421725,-4.19360701454274,100,48,"UBC, UBB, SKP1, RPS27A, PSMF1, PSME4, PSME3, PSME2, PSME1, PSMD9, PSMD8, PSMD7, PSMD6, PSMD5, PSMD4, PSMD3, PSMD2, PSMD14, PSMD13, PSMD12, PSMD11, PSMD10, PSMD1, PSMC6, PSMC5, PSMC4, PSMC3, PSMC2, PSMC1, PSMB8, PSMB7, PSMB6, PSMB5, PSMB4, PSMB3, PSMB2, PSMB10, PSMB1, PSMA7, PSMA6, PSMA5, PSMA4, PSMA3, PSMA1"
"772","SHC-mediated cascade:FGFR1",0.0201516360734238,0.0494829099272216,0.371471452858256,1.76703624401351,100,16,"FGF1, FGF10, FGF17, FGF2, FGF20, FGF22, FGF5, FGF9, FGFR1, GRB2, HRAS, KL, KRAS"
"773","SHC-mediated cascade:FGFR2",0.0125448028673835,0.0470433599779914,0.382540463054023,1.87778673410062,62,17,"FGF1, FGF10, FGF17, FGF18, FGF2, FGF20, FGF22, FGF5, FGF7, FGF9, FGFR2, GRB2, HRAS, KRAS"
"774","SHC1 events in ERBB2 signaling",0.286058174523571,0.308293788929815,0.220441815890158,1.12691860176944,1425,19,"BTC, EGF, EGFR, ERBB3, ERBB4, GRB2, HRAS, KRAS, NRAS, NRG1, NRG2, NRG3, NRG4, PRKCA, PRKCD, PRKCE, PTPN12"
"775","SLC transporter disorders",0.031015408929277,0.0534922079399386,-0.478097203444104,-3.88532166448231,156,80,"TPR, SLCO2A1, SLCO1B1, SLCO1B3, SLC9A9, SLC9A6, SLC7A7, SLC6A20, SLC5A7, SLC5A5, SLC5A2, SLC5A1, SLC4A4, SLC4A1, SLC3A2, SLC3A1, SLC39A4, SLC35C1, SLC35A3, SLC35A2, SLC35A1, SLC33A1, SLC2A9, SLC2A2, SLC2A1, SLC29A3, SLC27A4, SLC26A4, SLC26A3, SLC26A2, SLC24A5, SLC24A4, SLC24A1, SLC22A5, SLC22A18, SLC20A2, SLC1A3, SLC1A1, SLC17A8, SLC17A5, SLC16A1, SLC12A6, SLC12A3, SLC12A1, SLC11A2, SEH1L, SEC13, RHAG, RANBP2, RAE1, POM121C, POM121, NUP42, NUP58, NUP98, NUP93, NUP88, NUP85, NUP54, NUP50, NUP43, NUP37, NUP35, NUP214, NUP210, NUP205, NUP188, NUP160, NUP155, NUP153, NUP133, NUP107"
"776","SLC-mediated transmembrane transport",0.072953046177726,0.0936469408224674,-0.693705860043666,-5.30810441571054,375,196,"SRI, SLCO4C1, SLCO4A1, SLCO3A1, SLCO2B1, SLCO2A1, SLCO1C1, SLCO1B1, SLCO1B3, SLCO1A2, SLC9A9, SLC9A8, SLC9A7, SLC9A6, SLC9A5, SLC9A4, SLC9A2, SLC9A1, SLC8B1, SLC8A3, SLC8A2, SLC8A1, SLC7A8, SLC7A7, SLC7A6, SLC7A5, SLC7A3, SLC7A2, SLC7A11, SLC7A10, SLC7A1, SLC6A9, SLC6A7, SLC6A6, SLC6A20, SLC6A15, SLC6A13, SLC6A11, SLC6A1, SLC5A8, SLC5A7, SLC5A6, SLC5A5, SLC5A4, SLC5A2, SLC5A12, SLC5A11, SLC5A10, SLC5A1, SLC50A1, SLC4A9, SLC4A8, SLC4A7, SLC4A5, SLC4A4, SLC4A3, SLC4A2, SLC4A10, SLC4A1, SLC44A5, SLC44A4, SLC44A3, SLC44A2, SLC44A1, SLC43A2, SLC41A2, SLC41A1, SLC3A2, SLC3A1, SLC39A8, SLC39A7, SLC39A6, SLC39A4, SLC39A3, SLC39A2, SLC39A14, SLC39A10, SLC39A1, SLC38A3, SLC38A2, SLC38A1, SLC36A4, SLC36A1, SLC35D2, SLC35D1, SLC35C1, SLC35B4, SLC35B3, SLC35B2, SLC35A3, SLC35A2, SLC35A1, SLC33A1, SLC32A1, SLC31A1, SLC30A7, SLC30A6, SLC30A5, SLC30A3, SLC30A10, SLC30A1, SLC2A9, SLC2A8, SLC2A7, SLC2A6, SLC2A2, SLC2A13, SLC2A12, SLC2A1, SLC29A4, SLC29A3, SLC29A2, SLC29A1, SLC28A3, SLC27A4, SLC27A1, SLC26A7, SLC26A6, SLC26A4, SLC26A3, SLC26A2, SLC26A11, SLC26A1, SLC25A5, SLC25A4, SLC25A29, SLC25A26, SLC25A22, SLC25A18, SLC24A5, SLC24A4, SLC24A3, SLC24A2, SLC24A1, SLC22A8, SLC22A5, SLC22A4, SLC22A3, SLC22A18, SLC22A15, SLC22A1, SLC20A2, SLC20A1, SLC1A7, SLC1A6, SLC1A5, SLC1A4, SLC1A3, SLC1A2, SLC1A1, SLC18A2, SLC18A1, SLC17A8, SLC17A7, SLC17A6, SLC17A5, SLC16A8, SLC16A7, SLC16A3, SLC16A2, SLC16A10, SLC16A1, SLC15A4, SLC15A3, SLC15A2, SLC14A2, SLC14A1, SLC13A5, SLC13A4, SLC13A1, SLC12A7, SLC12A6, SLC12A5, SLC12A4, SLC12A3, SLC12A2, SLC12A1, SLC11A2, SLC11A1"
"777","SMAD2/SMAD3:SMAD4 heterotrimer regulates transcription",0.051452784503632,0.0723158313708581,-0.249114949048448,-1.49567758069434,254,29,"WWTR1, UBC, UBB, TGIF2, TGIF1, TFDP2, TFDP1, SP1, SNW1, SMAD7, SMAD4, SMAD3, SMAD2, RPS27A, RNF111, RBL1"
"778","SRP-dependent cotranslational protein targeting to membrane",0.03152260111023,0.0538246289893604,-0.666210688342769,-5.40779024147207,158,81,"TRAM1, SSR4, SSR3, SSR2, SSR1, SRPRB, SRPRA, SRP9, SRP72, SRP68, SRP54, SRP19, SRP14, SPCS2, SPCS1, SEC61G, SEC61B, SEC61A2, SEC61A1, SEC11C, SEC11A, RPSA, RPS9, RPS8, RPS7, RPS5, RPS4X, RPS3A, RPS28, RPS27L, RPS27A, RPS25, RPS24, RPS21, RPS20, RPS19, RPS17, RPS16, RPS15A, RPS15, RPS14, RPS13, RPS12, RPS11, RPN2, RPN1, RPLP1, RPL8, RPL7A, RPL6, RPL5, RPL4, RPL3L, RPL38, RPL37A, RPL36, RPL35, RPL34, RPL32, RPL30, RPL3, RPL29, RPL28, RPL27, RPL26, RPL23, RPL22L1, RPL19, RPL18A, RPL18, RPL14, RPL13A, RPL12, RPL11, RPL10A, RPL10"
"779","SUMO E3 ligases SUMOylate target proteins",0.0549902152641879,0.074926906853993,-0.258758758758759,-2.11201655258683,280,147,"ZNF131, XRCC4, XPC, WRN, VDR, UHRF2, UBE2I, TP53BP1, TP53, TRIM28, TRIM27, TPR, TOPORS, TOP2B, TOP1, THRB, THRA, TDG, SUZ12, SUMO3, SUMO2, SUMO1, STAG2, STAG1, SP3, SMC6, SMC5, SMC3, SMC1A, SIN3A, SEH1L, SEC13, SCMH1, SATB2, SATB1, SAFB, RXRA, RPA1, RORA, RNF2, RNF168, RING1, RELA, RARA, RANGAP1, RANBP2, RAE1, RAD52, RAD21, PPARGC1A, PPARG, PPARA, POM121C, POM121, PML, PIAS4, PIAS3, PIAS2, PIAS1, PHC3, PHC2, PHC1, PGR, PCNA, PCGF2, PARP1, PARK7, NUP42, NUP58, NUP98, NUP93, NUP88, NUP85, NUP54, NUP50, NUP43, NUP37, NUP35, NUP214, NUP210, NUP205, NUP188, NUP160, NUP155, NUP153, NUP133, NUP107, NSMCE2, NSMCE1, NRIP1, NR4A2, NR3C2, NR3C1, NR2C1, NR1I2, NR1H4, NR1H3, NR1H2, NOP58, NFKBIA, NFKB2, NDC1, NCOR2, NCOA2, NCOA1"
"780","SUMOylation",0.0566660197942946,0.0761511345193476,-0.270196919969705,-2.20491972746015,291,153,"ZNF131, XRCC4, XPC, WRN, VDR, UHRF2, UBE2I, UBA2, TP53BP1, TP53, TRIM28, TRIM27, TPR, TOPORS, TOP2B, TOP1, THRB, THRA, TDG, SUZ12, SUMO3, SUMO2, SUMO1, STAG2, STAG1, SP3, SMC6, SMC5, SMC3, SMC1A, SIN3A, SENP5, SENP2, SENP1, SEH1L, SEC13, SCMH1, SATB2, SATB1, SAFB, SAE1, RXRA, RWDD3, RPA1, RORA, RNF2, RNF168, RING1, RELA, RARA, RANGAP1, RANBP2, RAE1, RAD52, RAD21, PPARGC1A, PPARG, PPARA, POM121C, POM121, PML, PIAS4, PIAS3, PIAS2, PIAS1, PHC3, PHC2, PHC1, PGR, PCNA, PCGF2, PARP1, PARK7, NUP42, NUP58, NUP98, NUP93, NUP88, NUP85, NUP54, NUP50, NUP43, NUP37, NUP35, NUP214, NUP210, NUP205, NUP188, NUP160, NUP155, NUP153, NUP133, NUP107, NSMCE2, NSMCE1, NRIP1, NR4A2, NR3C2, NR3C1, NR2C1, NR1I2, NR1H4, NR1H3, NR1H2, NOP58, NFKBIA, NFKB2, NDC1, NCOR2, NCOA2, NCOA1"
"781","SUMOylation of DNA damage response and repair proteins",0.0271771473913906,0.0515363014109986,-0.414925691530968,-3.28785435689588,136,70,"XRCC4, XPC, WRN, UBE2I, TPR, TDG, SUMO3, SUMO2, SUMO1, STAG2, STAG1, SMC6, SMC5, SMC3, SMC1A, SEH1L, SEC13, SCMH1, RPA1, RNF2, RNF168, RING1, RANBP2, RAE1, RAD52, RAD21, POM121C, POM121, PML, PIAS4, PIAS2, PIAS1, PHC3, PHC2, PHC1, PCGF2, PARP1, NUP42, NUP58, NUP98, NUP93, NUP88, NUP85, NUP54, NUP50, NUP43, NUP37, NUP35, NUP214, NUP210, NUP205, NUP188, NUP160, NUP155, NUP153, NUP133, NUP107, NSMCE2, NSMCE1"
"782","SUMOylation of DNA methylation proteins",0.521931589537223,0.539820373856039,-0.20086414506304,-0.921468275133809,2593,15,"UBE2I, SUMO1, SCMH1, RNF2, RING1, PHC3, PHC2, PHC1, PCGF2"
