"","pathway","pval","padj","ES","NES","nMoreExtreme","size","leadingEdge"
"421","JNK (c-Jun kinases) phosphorylation and  activation mediated by activated human TAK1",0.158063997427239,0.570569114914493,0.518260315111524,1.29189408094873,982,15,"IKBKG, TRAF6, IRAK1, RIPK2, TAB2, IRAK2"
"422","KSRP (KHSRP) binds and destabilizes mRNA",0.61808,0.848425716294097,0.350536996365207,0.887719165059886,3862,16,"EXOSC8, DIS3, AKT1, EXOSC9"
"423","Keratan sulfate biosynthesis",0.350772139930665,0.721776004121827,0.408411699822617,1.09032816726143,2225,20,"ST3GAL3, ST3GAL6, B4GALT6, ST3GAL4, CHST2, ST3GAL2, OMD"
"424","Keratan sulfate/keratin metabolism",0.0788246268656716,0.496979295426452,0.493652467902527,1.38464717566509,506,25,"HEXB, ST3GAL3, ST3GAL6, GNS, B4GALT6, ST3GAL4, CHST2, ST3GAL2, OMD"
"425","Keratinization",0.84734239802225,0.931603262183121,0.261762682864687,0.741226265926264,5483,26,"PKP2, DSP, DSG2, CAPNS1, KRT12"
"426","Kinesins",0.890535917901938,0.950420111947405,-0.228565573014736,-0.722047013856281,3123,29,"KIF5B, KLC2, KLC1, KIF16B, KIF1A, KIF3B, KIF1B, KIF5C, KIF13B"
"427","L13a-mediated translational silencing of Ceruloplasmin expression",0.352030282174811,0.721776004121827,-0.271844387582618,-1.04606114500098,1022,77,"EIF4E, RPL22L1, RPSA, EIF3H, RPL37A, RPL35, RPL6, RPL8, RPL36, RPL36AL, RPS14, RPS4X"
"428","L1CAM interactions",0.213960014030165,0.617409541952147,-0.285143747958011,-1.12509005845243,609,88,"ANK3, NRP1, SPTAN1, AP2B1, EPHB2, MAPK1, DLG4, DNM2, RANBP9, CSNK2B, SRC, NCAN, NRCAM, ITGB1, RAC1, SCN9A, ITGA9, EZR, AP2A1, LYPLA2, ALCAM, RPS6KA2, RPS6KA4"
"429","LDL clearance",0.625972632143815,0.848425716294097,-0.311635411374558,-0.878715662333406,2332,18,"AP2B1, NPC1, LSR"
"430","Lagging Strand Synthesis",0.523477327609337,0.804846391199356,-0.334631417818205,-0.943557301940484,1950,18,"RPA1, PRIM2, RFC1, RFC5, RPA2, LIG1, POLD2"
"431","Laminin interactions",0.984974510330024,0.996971612093817,-0.18782451651742,-0.529607157627181,3670,18,"ITGB1, LAMC2, ITGB4, NID1, ITGAV, LAMA3, ITGA2, LAMA4, LAMA5, LAMB1, LAMC3, LAMB2, ITGA1, HSPG2, LAMA2, ITGA6, LAMC1, ITGA7"
"432","Late Phase of HIV Life Cycle",0.288464091331475,0.695707514387675,0.293326578769265,1.09391603991443,2172,129,"XPO1, POLR2A, NMT1, TSG101, POLR2K, TPR, NUP37, GTF2H2, AAAS, TAF3, NUP54, CHMP3, NUP42, GTF2F2, RNMT, PPIA, NUP93, NUP107, NUP205, NEDD4L, GTF2A1, TAF5, SEH1L, NUP155, POLR2H, NUP43, VTA1, CCNH, VPS4B, GTF2A2, TAF7, CDK9, POLR2G, NUP98, ELL, NUP153, GTF2H1, TAF7L"
"433","Late endosomal microautophagy",0.691322901849218,0.863938555951208,-0.273840412245914,-0.857515711689409,2429,28,"CHMP2A, PARK7, PCNT, VPS37A, VPS37C, UBB, CHMP7, CHMP2B, HSPA8, UBAP1, CHMP6"
"434","Listeria monocytogenes entry into host cells",0.532139430764311,0.805244292841312,0.370583152088021,0.951021575411249,3327,17,"SH3GL2, STAM, EPS15, SH3GL1"
"435","Long-term potentiation",0.0021959923140269,0.154346888357319,-0.657585398858451,-1.92186215997228,7,21,"DLG2, GRIN2A, GRIN2B, LRRC7, GRIN1, DLG4, CAMK2B, NRG1, SRC"
"436","Loss of Nlp from mitotic centrosomes",0.490950876185004,0.790663931531987,0.292157160378355,0.982544764802445,3417,62,"PRKAR2B, CEP70, DYNC1I2, OFD1, SDCCAG8, CEP164, AKAP9, CSNK1E, PPP2R1A, TUBB4A, SSNA1, CEP152, ODF2, DCTN3, CLASP1, CEP250, CDK5RAP2, PAFAH1B1, MAPRE1, HAUS2, HAUS1, ALMS1, CCP110, PCM1, HAUS7"
"437","Loss of proteins required for interphase microtubule organization from the centrosome",0.490950876185004,0.790663931531987,0.292157160378355,0.982544764802445,3417,62,"PRKAR2B, CEP70, DYNC1I2, OFD1, SDCCAG8, CEP164, AKAP9, CSNK1E, PPP2R1A, TUBB4A, SSNA1, CEP152, ODF2, DCTN3, CLASP1, CEP250, CDK5RAP2, PAFAH1B1, MAPRE1, HAUS2, HAUS1, ALMS1, CCP110, PCM1, HAUS7"
"438","Lysosome Vesicle Biogenesis",0.267082635824075,0.679093833723231,0.385079930744789,1.14810868767685,1754,33,"SH3GL2, CLVS2, CTSZ, GNS"
"439","M Phase",0.00529992772825825,0.20088321567869,0.341774463570743,1.38349216133285,43,274,"DYNC1I1, XPO1, STAG1, NEK7, CLASP2, PRKAR2B, RAB1A, ANAPC15, H3-3A, AHCTF1, PDS5B, NCAPD3, LPIN1, CLIP1, LPIN2, KMT5A, TPR, NCAPH2, NIPBL, CEP70, NUP37, RAB2A, DYNC1I2, EML4, SMC1A, AAAS, PSMA5, CENPC, MAD1L1, PSMA1, OFD1, ARPP19, NUP54, TMPO, PSME1, MAU2, SDCCAG8, CEP164, PSMB1, NUP42, HDAC8, PSMD13, TAOK1, BUB3, CDC26, NUP93, TUBGCP6, NUP107, AKAP9, NUP205, ANAPC4, NDEL1, CSNK1E, CNEP1R1, SEH1L, ZWINT, NUP155, ANAPC10, PPP2R2A, PSMB9, MAPK3, PPP2R1A, TUBB4A, NCAPD2, SSNA1, NUP43, CSNK2A1, PSMD12, CEP152, ODF2, NME7, RAB1B, NEK6, DCTN3, CLASP1, CDC16, LEMD2, VRK2, PPP2CB, CEP250, EMD, NUP98, PSMB7, CDK5RAP2, ENSA, NUP153, KIF2A, NUDC, PAFAH1B1"
"440","MAP kinase activation",0.34329224075417,0.721776004121827,0.321870461485191,1.07022602777273,2366,58,"NFKB1, IKBKG, TRAF6, IRAK1, RPS6KA1, MEF2C, CUL1, RIPK2, MAP2K3, TAB2, IRAK2, MAPK3, PPP2R1A, CREB1, VRK3, PPP2CB, IKBKB, MAP3K8, SKP1"
"441","MAP2K and MAPK activation",0.356378097277455,0.721776004121827,0.363365226219183,1.0748802937062,2329,32,"RAP1A, APBB1IP, YWHAB, CSK, WDR83, MAPK3, KSR1, RAF1, ARAF, BRAF, NRAS, ARRB2, TLN1"
"442","MAP3K8 (TPL2)-dependent MAPK1/3 activation",0.20373050329635,0.608360046956538,0.496810080943161,1.23842398156227,1266,15,"NFKB1, IKBKG, CUL1, IKBKB, MAP3K8, SKP1"
"443","MAPK family signaling cascades",0.00531632110579479,0.20088321567869,-0.303838075620331,-1.36304438384786,9,233,"MAPK4, SPRED2, GFRA1, FYN, SPTAN1, KITLG, DLG2, GRB2, FGFR4, PSMF1, RASAL2, MAPK1, GRIN2B, PSMD1, PSMD9, LRRC7, GRIN1, DLG4, PSMA7, CAMK2B, PAK3, RANBP9, TYK2, NRG3, PSME4, NRG1, FOXO1, AGO2, KRAS, SRC, PSMB6, PPP2R5C, CUL3, RASAL1, PSMA3, PSMD11, PAK2, PSMC1, RAC1, FGF22, PSMB10, PPP2R5A, DUSP4, EGF, NF1, AGO1, LAMTOR3, DUSP5, PPP2CA, PSMD5"
"444","MAPK targets/ Nuclear events mediated by MAP kinases",0.314104413037208,0.715460051918085,-0.34383699863566,-1.09296154435366,1088,30,"FOS, MAPK10, MAPK1, ATF2, MAPKAPK2, DUSP4, PPP2CA, RPS6KA2"
"445","MAPK1/MAPK3 signaling",0.00868725868725869,0.238584635599981,-0.310759046407208,-1.36641217129749,17,199,"SPRED2, GFRA1, FYN, SPTAN1, KITLG, DLG2, GRB2, FGFR4, PSMF1, RASAL2, MAPK1, GRIN2B, PSMD1, PSMD9, LRRC7, GRIN1, DLG4, PSMA7, CAMK2B, RANBP9, TYK2, NRG3, PSME4, NRG1, KRAS, SRC, PSMB6, PPP2R5C, CUL3, RASAL1, PSMA3, PSMD11, PSMC1, FGF22, PSMB10, PPP2R5A, DUSP4, EGF, NF1, LAMTOR3, DUSP5, PPP2CA, PSMD5, PSMB5, NRG2, PSMC6, RASGRP1, PDGFA, RAP1B, CNKSR2, UBB"
"446","MAPK6/MAPK4 signaling",0.162422573984859,0.575686397327487,-0.305127122135626,-1.17732161300188,471,78,"MAPK4, PSMF1, PSMD1, PSMD9, PSMA7, PAK3, PSME4, FOXO1, AGO2, PSMB6, PSMA3, PSMD11, PAK2, PSMC1, RAC1, PSMB10, AGO1, PSMD5, PSMB5, PSMC6, UBB, KALRN, CDC42EP3, PSMC4"
"447","MECP2 regulates neuronal receptors and channels",0.677922495578067,0.860454334724154,0.339857634261782,0.847180564025153,4215,15,"FKBP5, SIN3A, MECP2, GRIA2, CREB1, PTPN4, OPRM1, HDAC2"
"448","MET promotes cell motility",0.413725490196078,0.756676510325161,-0.333990989518823,-1.01517171819051,1476,25,"GRB2, SRC, CRK, ITGB1, RAC1, GAB1"
"449","MHC class II antigen presentation",0.205749718151071,0.608360046956538,0.334366307449671,1.16390895812074,1459,77,"SH3GL2, DYNC1I1, SAR1B, SEC31A, DNM1, SEC24D, DYNC1I2, AP2A2, SEC24A, CAPZA1, CTSB, LGMN, CTSA, AP1M1, CAPZB, KIF3C, CTSO, HLA-DMA, SPTBN2, DCTN3, CTSF, AP1G1, CTSE, CTSH, KIF2A, DCTN5, AP2M1, CLTC, SEC23A"
"450","Macroautophagy",0.63899164269078,0.852658227848101,0.253786552072814,0.914680899560114,4663,99,"DYNC1I1, SLC38A9, PRKAG2, LAMTOR4, ATG4B, DYNC1I2, WDR45B, ATG10, PIK3C3, CHMP3, PRKAA2, TOMM70, MTMR3, PGAM5, CSNK2A1, MAP1LC3A, TSC1, RB1CC1, SQSTM1, LAMTOR5, TOMM22, GABARAPL2, ATG12, ARL13B, TOMM40, ATG3, PRKAA1, ATG7, CHMP4C, WIPI2"
"451","Major pathway of rRNA processing in the nucleolus and cytosol",0.669498725573492,0.860454334724154,-0.218232707993678,-0.924784579159339,1575,146,"RPL22L1, NCL, MPHOSPH10, RPSA, RPL37A, RPL35, RRP1, BMS1, RPL6, RPL8, UTP3, EBNA1BP2, RPL36, RBM28, RPL36AL, RPS14, RPS4X, NOL9, FTSJ3, RRP7A, DDX47, DCAF13, WDR3, CSNK1D, RPS13, NOC4L, WDR12, NOP14, WDR75, RPL38, RPS9, RPL23, RPL19, RPP30"
"452","Meiosis",0.520992366412214,0.804010901604829,0.295959918159834,0.962460080099354,3548,51,"STAG1, H3-3A, DIDO1, MLH3, SMC1A, BLM, MLH1, TERF1, NBN, TERF2, MRE11, RAD50, RAD51C"
"453","Meiotic recombination",0.370225422667502,0.7300637593283,0.3851144468761,1.06948418881643,2364,24,"H3-3A, MLH3, BLM, MLH1, NBN, MRE11, RAD50, RAD51C"
"454","Meiotic synapsis",0.861999690928759,0.941406987651386,0.255883288181654,0.730661919719243,5577,27,"STAG1, DIDO1, SMC1A, TERF1, TERF2, SUN1, SMC3, UBE2I"
"455","Metabolic disorders of biological oxidation enzymes",0.0600796812749004,0.446675117338724,0.554095788865477,1.44355610287196,376,18,"CYP7B1, TBXAS1, CYP27A1, GCLM, FDX1"
"456","Metabolism of amino acids and derivatives",0.959505334626576,0.986576018048643,0.194578758731043,0.784838511545288,7913,265,"GLS, SLC44A1, RPS3A, DLST, SAT1, EEFSEC, SERINC1, SLC3A2, PPM1K, SRR, MCCC1, ACADSB, PDHX, MRI1, PSMA5, RPS11, CARNMT1, PSMA1, IVD, PRODH, SERINC3, PSME1, PSMB1, GSR, PSMD13, AZIN1, GOT1, PSTK, RPL12, AUH, SECISBP2, OAZ1, SMS, SLC25A13, ACAT1, PSMB9, NAT8L, PSMD12, RPL29, RPL3, RPLP1, RPS25, KARS1, GPT2, GATM, MTR, AMD1, ENOPH1, RPS24, LIAS, RPL5, SCLY, OAZ2, PSMB7"
"457","Metabolism of carbohydrates",0.00697162426614481,0.2298967758379,0.34706502156512,1.38829687913362,56,241,"CSGALNACT1, HEXB, ST3GAL3, ARSB, EPM2A, AKR1B1, ST3GAL6, B3GALT1, GNS, GPC3, GUSB, CEMIP, TPR, PFKFB3, NUP37, GBE1, CSGALNACT2, AAAS, B3GALT5, ABCC5, CHP1, NUP54, NUP42, PHKA2, MAN2C1, NDST4, PYGB, MDH2, NUP93, NUP107, NUP205, GOT1, FUT9, CSPG5, GNPDA2, SEH1L, B3GAT2, SLC25A13, PGP, NUP155, B4GALT6, HK3, CHST9, RBKS, PPP2R1A, NUP43, ST3GAL4, PGK1, MANBA, CHST12, SDC3, CHST2, PHKG2, ST3GAL2, AKR1A1, FUT11, B4GALT7, DSEL, ALDOA, OMD, PPP2CB, GAPDHS, NUP98, CHPF2, FUT10, NUP153, CHSY1, GCK, AGRN, STAB2, G6PC3"
"458","Metabolism of cofactors",0.66832,0.860454334724154,0.337229882917209,0.854019499227449,4176,16,"COQ5, IDH1, AKT1, COQ7, CALM1, PDSS2"
"459","Metabolism of fat-soluble vitamins",0.26930806775768,0.68123171895516,-0.352816149479016,-1.13205335417887,937,31,"TTR, AKR1B10"
"460","Metabolism of folate and pterines",0.30288,0.70402203245721,0.447833470456601,1.13411810622528,1892,16,"MTHFD2L, MTHFS, MTHFD1L"
"461","Metabolism of non-coding RNA",0.105053779283925,0.515249758200798,0.402642789918468,1.29937160184456,712,49,"SNRPD2, TPR, NUP37, AAAS, NUP54, NUP42, SNRPB, NUP93, NUP107, NUP205, PHAX, SEH1L, NUP155, SNRPD1, GEMIN8, NUP43, TGS1"
"462","Metabolism of nucleotides",0.101626016260163,0.515249758200798,0.36044507686001,1.26711681706249,724,84,"ADK, NUDT13, DPYD, AK2, GMPR, NT5C2, AK5, NT5C, TK2, TXN, GSR, NUDT5, GART, CMPK1, ENTPD1, DGUOK, ENTPD3, UPP2, GLRX, CTPS2, IMPDH1, ADSL, NT5C3A, DHODH, NUDT16, PFAS"
"463","Metabolism of polyamines",0.676770899808551,0.860454334724154,-0.246902816506081,-0.887477080888153,2120,54,"PSMF1, PSMD1, PSMD9, PSMA7, PSME4, PSMB6, PSMA3, PSMD11, PSMC1, PSMB10, PSMD5, PSMB5, PSMC6"
"464","Metabolism of porphyrins",0.0485868529691966,0.405164943404148,0.55892354532919,1.47310563844579,305,19,"HMOX2, HMBS, GUSB, SLCO2B1, FLVCR1, UROS, COX10, ALAS2"
"465","Metabolism of steroid hormones",0.580428525743524,0.836224991700773,0.356501332007568,0.914883627309417,3629,17,"AKR1B1, TSPOAP1, FDX1, TSPO, HSD11B2, CYP11A1, SRD5A1, HSD3B1, HSD3B2"
"466","Metabolism of steroids",0.0286563936198973,0.330303992380348,0.377397603703047,1.37796610189725,211,110,"CYP7B1, SAR1B, OSBPL9, TBL1XR1, AKR1B1, SCD, SEC24D, CREBBP, TSPOAP1, GGPS1, SEC24A, MTF1, GPAM, PTGIS, LGMN, ARV1, STARD5, NCOA1, MBTPS1, SQLE, NFYA, TGS1, SCP2, CYP27A1, NFYC, DHCR7, RXRA, SP1, PMVK, CYP46A1, MED1, HMGCS1, HSD17B4, NCOA6, PIAS4, SEC23A, OSBP, FDX1, OSBPL2, UBE2I, TBL1X, MVK"
"467","Metabolism of vitamins and cofactors",0.953229398663697,0.983875930705896,0.198748981335534,0.751500460992278,7275,144,"NMNAT2, MTHFD2L, GPC3, PARP8, COQ5, PPCDC, ENPP2, MCCC1, PARP14, MTHFS, TPK1, PTGIS, MTHFD1L, HLCS, IDH1, LRP8, LDLR, PDZD11, NMNAT3, LMBRD1, AKT1, SDC3, MTR, PARP9, RFK, AGRN, MTHFD2, NAMPT, MOCS2, RNLS, COQ7, CALM1, RDH11, APOE, MOCS1, NUDT12, PDSS2, PANK4, PPCS, GPC6, PCCB, NAXD, PDXK, MOCS3, SLC2A1, RBP4, SLC19A2, SHMT2"
"468","Metabolism of water-soluble vitamins and cofactors",0.718043567612002,0.874449097190853,0.242908348281399,0.874689759692903,5240,98,"NMNAT2, MTHFD2L, PARP8, PPCDC, ENPP2, MCCC1, PARP14, MTHFS, TPK1, PTGIS, MTHFD1L, HLCS, PDZD11, NMNAT3, LMBRD1, MTR, PARP9, RFK, MTHFD2, NAMPT, MOCS2, RNLS, MOCS1, NUDT12, PANK4, PPCS, PCCB, NAXD, PDXK, MOCS3, SLC2A1, SLC19A2, SHMT2"
"469","Metal ion SLC transporters",0.323359868240461,0.719919220072159,-0.373814339088803,-1.09251153446681,1177,21,"SLC39A6, SLC30A3, SLC39A14"
"470","Metalloprotease DUBs",0.35552339604438,0.721776004121827,0.437724593026012,1.09113855397998,2210,15,"STAM, MYSM1, UIMC1, BRCC3, BABAM1"
"471","MicroRNA (miRNA) biogenesis",0.831690911934929,0.922642454728264,0.271185229971188,0.747119993230853,5316,23,"POLR2A, POLR2K, TARBP2, POLR2H, POLR2G, POLR2J, POLR2I, PRKRA"
"472","Miscellaneous transport and binding events",0.80882819942839,0.91797802564883,0.286650919154051,0.755500620434226,5093,19,"ANKH, ADD1"
"473","Misspliced GSK3beta mutants stabilize beta-catenin",0.680941052075073,0.860454334724154,-0.311474780804317,-0.83627967559349,2575,15,"CTNNB1, PPP2R5C, PPP2R5A, AXIN1, PPP2CA"
"474","Mitochondrial Fatty Acid Beta-Oxidation",0.392596910521714,0.741488214881701,-0.318889645353353,-1.03595930028191,1346,33,"MMUT, HADHA, ACAD10, ACADM, THEM4, ACOT7, MMAA, HADH, ECI1, ACSM3"
"475","Mitochondrial biogenesis",0.533538289547233,0.805244292841312,0.271987944913245,0.960273610249938,3817,86,"TBL1XR1, CRTC1, PRKAG2, CREBBP, ATP5F1A, IMMT, PPARGC1A, ATP5PO, MEF2C, ATP5F1C, PRKAA2, CHCHD3, NCOA1, TGS1, CREB1, GABPB1, TFB2M, CHCHD6, RXRA, TFB1M, ATP5PF, MED1, MAPK12, SIRT3, GABPA, ATP5F1B, ESRRA, NCOA6, PRKAB1, CALM1, MTERF1, POLRMT, TBL1X"
"476","Mitochondrial calcium ion transport",0.143837496568762,0.562290439415457,-0.446162669111825,-1.30395710191677,523,21,"MCU, VDAC1, YME1L1, SLC8A3, MICU2"
"477","Mitochondrial protein import",0.55,0.810179640718563,-0.259384623429727,-0.949811860600014,1704,59,"VDAC1, HSPA9, PITRM1, CS, GRPEL2, TIMM44, TIMM23, SAMM50, GFER, CMC4, TOMM7, COX17, IDH3G, MTX1, TIMM9, TIMM22, PMPCB, COA4, CHCHD5, TOMM20, NDUFB8"
"478","Mitochondrial tRNA aminoacylation",0.93188313750397,0.974666812402084,0.240508611499741,0.633887397759146,5868,19,"HARS2, PARS2, KARS1, AARS2, MARS2, LARS2, DARS2, YARS2, VARS2, IARS2"
"479","Mitochondrial translation",0.882123992215735,0.948037098208614,0.21980298534792,0.782837981880665,6345,91,"MRPS26, MRPS28, GFM2, MRPL4, MRPL12, MRPS5, DAP3, PTCD3, MRPL21, MRPL38, MRPL1, MRPL32, MRPS33, MRPL17, MRPL20, MRPS27, MRPL27, MRPL9, OXA1L, MRPS7, MRPL58, MRPL54, MRPL2, MRPL23, MRPL55, MRPS10"
"480","Mitochondrial translation elongation",0.919165032221911,0.969408779963945,0.213181952238142,0.750536371292689,6560,85,"MRPS26, MRPS28, MRPL4, MRPL12, MRPS5, DAP3, PTCD3, MRPL21, MRPL38, MRPL1, MRPL32, MRPS33, MRPL17, MRPL20, MRPS27, MRPL27, MRPL9, OXA1L, MRPS7, MRPL58, MRPL54, MRPL2, MRPL23, MRPL55, MRPS10"
"481","Mitochondrial translation initiation",0.930652843933875,0.974666812402084,0.209359758426367,0.737079812499839,6642,85,"MRPS26, MRPS28, MRPL4, MRPL12, MRPS5, DAP3, PTCD3, MRPL21, MRPL38, MRPL1, MRPL32, MRPS33, MRPL17, MRPL20, MRPS27, MRPL27, MRPL9, OXA1L, MRPS7, MRPL58, MRPL54, MRPL2, MRPL23, MRPL55, MRPS10"
"482","Mitochondrial translation termination",0.826421966937517,0.922642454728264,0.232156133955786,0.817337586616493,5898,85,"MRPS26, MRPS28, GFM2, MRPL4, MRPL12, MRPS5, DAP3, PTCD3, MRPL21, MRPL38, MRPL1, MRPL32, MRPS33, MRPL17, MRPL20, MRPS27, MRPL27, MRPL9, OXA1L, MRPS7, MRPL58, MRPL54, MRPL2, MRPL23, MRPL55, MRPS10"
"483","Mitophagy",0.781792717086835,0.904637824766644,-0.260797683329203,-0.792699326011285,2790,25,"VDAC1, CSNK2B, SRC, TOMM7, MFN1, UBB, MTERF3, TOMM20"
"484","Mitotic Anaphase",0.101047120418848,0.515249758200798,0.323503612637211,1.22659846384227,771,148,"DYNC1I1, XPO1, STAG1, CLASP2, ANAPC15, AHCTF1, PDS5B, CLIP1, NUP37, DYNC1I2, SMC1A, PSMA5, CENPC, MAD1L1, PSMA1, TMPO, PSME1, PSMB1, HDAC8, PSMD13, TAOK1, BUB3, CDC26, NUP107, ANAPC4, NDEL1, SEH1L, ZWINT, ANAPC10, PPP2R2A, PSMB9, PPP2R1A, NUP43, PSMD12, CLASP1, CDC16, LEMD2, VRK2, PPP2CB, EMD, NUP98, PSMB7, KIF2A, NUDC, PAFAH1B1, PPP1CC, PSMC3, ANAPC1, WAPL, MAPRE1"
"485","Mitotic G1 phase and G1/S transition",0.989634551495017,0.996971612093817,0.181527309919462,0.67517323158256,7446,127,"AKT3, CCND2, CCND3, CDK6, CDC7, PSMA5, PSMA1, ORC6, PSME1, PSMB1, PSMD13, CUL1, CABLES1, E2F4, PPP2R2A, PSMB9, PPP2R1A, CCNH, PSMD12, LYN, AKT1, ORC1, PPP2CB, POLE4, DBF4, PSMB7, SKP1"
"486","Mitotic G2-G2/M phases",0.512730465320457,0.800879278685437,-0.227749251670958,-0.978247641160189,1167,162,"HSP90AB1, YWHAG, TUBGCP4, PSMF1, PSMD1, PSMD9, DYNLL1, PPP1R12B, PSMA7, LIN52, PSME4, PPME1, HAUS6, PSMB6, DCTN2, CEP78, PSMA3, CDK11A, CDK11B, PSMD11, PSMC1, PCNT, CEP290, PSMB10, PPP2R3B, BTRC, PPP2CA, PSMD5, CSNK1D, CETN2, FBXL18, PSMB5, CNTRL"
"487","Mitotic Metaphase and Anaphase",0.100497252028265,0.515249758200798,0.323151206705202,1.22632885470991,767,149,"DYNC1I1, XPO1, STAG1, CLASP2, ANAPC15, AHCTF1, PDS5B, CLIP1, NUP37, DYNC1I2, SMC1A, PSMA5, CENPC, MAD1L1, PSMA1, TMPO, PSME1, PSMB1, HDAC8, PSMD13, TAOK1, BUB3, CDC26, NUP107, ANAPC4, NDEL1, SEH1L, ZWINT, ANAPC10, PPP2R2A, PSMB9, PPP2R1A, NUP43, PSMD12, CLASP1, CDC16, LEMD2, VRK2, PPP2CB, EMD, NUP98, PSMB7, KIF2A, NUDC, PAFAH1B1, PPP1CC, PSMC3, ANAPC1, WAPL, MAPRE1"
"488","Mitotic Prometaphase",0.0188458539121393,0.297163865546218,0.359126319220351,1.37068159396184,144,156,"DYNC1I1, XPO1, STAG1, NEK7, CLASP2, PRKAR2B, AHCTF1, PDS5B, CLIP1, CEP70, NUP37, DYNC1I2, EML4, SMC1A, CENPC, MAD1L1, OFD1, SDCCAG8, CEP164, HDAC8, TAOK1, BUB3, TUBGCP6, NUP107, AKAP9, NDEL1, CSNK1E, SEH1L, ZWINT, PPP2R1A, TUBB4A, NCAPD2, SSNA1, NUP43, CSNK2A1, CEP152, ODF2, NME7, NEK6, DCTN3, CLASP1, PPP2CB, CEP250, NUP98, CDK5RAP2, KIF2A, NUDC, PAFAH1B1"
"489","Mitotic Prophase",0.0101983002832861,0.243273311632123,0.438296135016422,1.51808591833726,71,75,"NEK7, RAB1A, H3-3A, NCAPD3, LPIN1, LPIN2, KMT5A, TPR, NCAPH2, NUP37, RAB2A, AAAS, ARPP19, NUP54, TMPO, NUP42, NUP93, NUP107, NUP205, CNEP1R1, SEH1L, NUP155, MAPK3, PPP2R1A, NUP43, RAB1B, NEK6, LEMD2, VRK2, PPP2CB, EMD, NUP98, ENSA, NUP153"
"490","Mitotic Spindle Checkpoint",0.0270535463975329,0.325105358217941,0.40181031063691,1.41253310022284,192,84,"DYNC1I1, XPO1, CLASP2, ANAPC15, AHCTF1, CLIP1, NUP37, DYNC1I2, CENPC, MAD1L1, TAOK1, BUB3, CDC26, NUP107, ANAPC4, NDEL1, SEH1L, ZWINT, ANAPC10, PPP2R1A, NUP43, CLASP1, CDC16, PPP2CB, NUP98, KIF2A, NUDC, PAFAH1B1, PPP1CC, ANAPC1, MAPRE1"
"491","Molecules associated with elastic fibres",0.284321434187765,0.68909431340089,0.424572986769851,1.14716368593024,1807,21,"ITGB5, TGFB1, LTBP4, ITGB3, EFEMP1, MFAP1, LTBP3, ITGB8, VTN, MFAP3"
"492","Muscle contraction",0.310018406521168,0.711091170202398,0.285426965165597,1.07587758917816,2357,141,"SLC8A2, ITGB5, TPM3, ORAI2, TRPC1, ITPR1, KCNIP4, TPM1, KCNK10, FGF12, ASPH, SCN1A, ORAI1, SCN3B, SCN3A, PAK1, DMD, SLC8A1, KCNK2"
"493","MyD88 cascade initiated on plasma membrane",0.349332575972735,0.721776004121827,0.308843488326883,1.06375948970876,2459,72,"NFKB1, IKBKG, PELI2, TRAF6, IRAK1, RPS6KA1, MAP3K1, MEF2C, CUL1, RIPK2, MAP2K3, TAB2, IRAK2, MAPK3, PPP2R1A, CREB1, VRK3, PPP2CB, IKBKB, MAP3K8, SKP1, NFKBIA"
"494","MyD88 dependent cascade initiated on endosome",0.430028328611898,0.766171415229451,0.292885418841813,1.01444022547315,3035,75,"NFKB1, IKBKG, PELI2, TRAF6, IRAK1, RPS6KA1, MAP3K1, MEF2C, CUL1, RIPK2, MAP2K3, TAB2, IRAK2, MAPK3, PPP2R1A, CREB1, VRK3, PPP2CB, IKBKB, MAP3K8, SKP1, NFKBIA, TLR7"
"495","MyD88-independent TLR4 cascade",0.510838963963964,0.800879278685437,0.277870573068129,0.973116499673056,3628,82,"NFKB1, IKBKG, TRAF6, TANK, IRAK1, RPS6KA1, MEF2C, CUL1, RIPK2, RIPK1, MAP2K3, TAB2, IRAK2, MAPK3, PPP2R1A, CREB1, BIRC2, VRK3, PPP2CB, IKBKB, MAP3K8, SKP1, NFKBIA"
"496","MyD88:MAL(TIRAP) cascade initiated on plasma membrane",0.407011122061101,0.750650921475634,0.294864451709679,1.02982584119082,2890,80,"NFKB1, IKBKG, PELI2, TRAF6, IRAK1, RPS6KA1, MAP3K1, BTK, MEF2C, CUL1, RIPK2, MAP2K3, TAB2, IRAK2, MAPK3, PPP2R1A, CREB1, VRK3, PPP2CB, IKBKB, MAP3K8, SKP1, NFKBIA"
"497","Myogenesis",0.182543406851244,0.588991229141726,0.450056661656559,1.23991387748541,1166,23,"TCF4, SPAG9, CTNNA2, CDON, TCF12, MEF2C"
"498","N-glycan antennae elongation in the medial/trans-Golgi",0.876630520194877,0.947142029195494,0.2576537957614,0.703583432218826,5577,22,"MGAT5, FUT8, MAN2A2, B4GALT6, ST8SIA3, ST3GAL4, MAN2A1"
"499","N-glycan trimming in the ER and Calnexin/Calreticulin cycle",0.538849801162435,0.805244292841312,0.320942341827632,0.949388036483024,3522,32,"SEL1L, RAD23B, EDEM2, MAN1B1, UGGT1, DERL1, RNF185, EDEM1, PDIA3, DERL2"
"500","NCAM signaling for neurite out-growth",0.00151469251741896,0.135496130649115,-0.560983297287396,-1.93001664944737,4,43,"GFRA1, FYN, SPTAN1, COL4A1, GRB2, CACNA1C, MAPK1, CACNB2, CACNB3, CACNB4, KRAS, SRC, NCAN"
"501","NCAM1 interactions",0.023249299719888,0.313225280883004,-0.530077986915815,-1.61118173136216,82,25,"GFRA1, COL4A1, CACNA1C, CACNB2, CACNB3, CACNB4, NCAN"
"502","NEP/NS2 Interacts with the Cellular Export Machinery",0.00994644223412395,0.243273311632123,0.551642704400571,1.61211046203024,64,30,"XPO1, TPR, NUP37, AAAS, NUP54, NUP42, NUP93, NUP107, NUP205, SEH1L, NUP155, NUP43, NUP98, NUP153"
"503","NIK-->noncanonical NF-kB signaling",0.267070835992342,0.679093833723231,-0.307760594996341,-1.10622664546651,836,54,"PSMF1, PSMD1, PSMD9, PSMA7, PSME4, PSMB6, PSMA3, PSMD11, PSMC1, PSMB10, CHUK, BTRC, PSMD5, PSMB5, PSMC6, UBB"
"504","NOD1/2 Signaling Pathway",0.142945448925977,0.562290439415457,0.446931962415242,1.27619184497264,924,27,"IKBKG, TRAF6, IRAK1, RIPK2, CYLD, TAB2, IRAK2, CASP9, BIRC2, IKBKB, MAPK12"
"505","NOTCH1 Intracellular Domain Regulates Transcription",0.108748481166464,0.515249758200798,-0.372362915274752,-1.28595686661135,357,44,"MAML3, MAMLD1, FBXW7, HDAC3, NCOR2, TLE1, HDAC9, HIF1A, MAML1, RBPJ"
"506","NOTCH2 Activation and Transmission of Signal to the Nucleus",0.649343544857768,0.852658227848101,-0.299297459495437,-0.864314428299861,2373,20,"NEURL1, JAG2, NEURL1B, MDK, UBB"
"507","NOTCH3 Activation and Transmission of Signal to the Nucleus",0.58464948739263,0.839567742303752,-0.305284575411997,-0.912984061892173,2109,23,"NEURL1, NOTCH3, EGF, JAG2, NEURL1B, UBB"
"508","NOTCH3 Intracellular Domain Regulates Transcription",0.325765864332604,0.719919220072159,-0.378140395493805,-1.09199790836612,1190,20,"MAML3, MAMLD1, MAML1, RBPJ, NOTCH3"
"509","NOTCH4 Intracellular Domain Regulates Transcription",0.0557036247334755,0.431593438879842,-0.557050187411674,-1.52356991042024,208,16,"MAML3, MAMLD1, SMAD3, MAML1, RBPJ"
"510","NR1H2 and NR1H3-mediated signaling",0.331077015643803,0.719919220072159,0.354096035016679,1.08876329590837,2200,38,"TBL1XR1, SCD, ABCA1, ABCG1, MOV10, TNRC6C, APOD, NRIP1, NCOA1, TNRC6A, TNRC6B, NR1H2, RXRA, RXRB, APOE, GPS2, TBL1X"
"511","NR1H3 & NR1H2 regulate gene expression linked to cholesterol transport and efflux",0.484123331799356,0.790012203135267,0.334795372607496,0.982360213614743,3155,31,"TBL1XR1, ABCA1, ABCG1, MOV10, TNRC6C, APOD, NCOA1, TNRC6A, TNRC6B, NR1H2, RXRA, RXRB, APOE, GPS2, TBL1X"
"512","NRAGE signals death through JNK",0.585308405711762,0.839567742303752,0.285645183213592,0.925838633408026,3975,50,"RASGRF2, FGD4, VAV1, FGD3, MCF2L, ARHGEF4, ARHGEF12, ARHGEF10L, FGD2, SOS1, ITSN1, ARHGEF7, BCL2L11, VAV2, ARHGEF17, VAV3, ARHGEF2, ARHGEF11, ARHGEF6, AATF, ARHGEF1"
"513","NS1 Mediated Effects on Host Pathways",0.0847842543527631,0.51326640113617,0.443813840866628,1.3564879201295,559,37,"TPR, NUP37, AAAS, NUP54, NUP42, NUP93, NUP107, NUP205, SEH1L, NUP155, NUP43, CPSF4, EIF2AK2, NUP98, NUP153"
"514","Neddylation",0.46146293568974,0.779634688521078,-0.225165728992836,-0.996822121595212,939,207,"ZBTB16, LMO7, SPSB1, FBXL16, PSMF1, KLHL2, PSMD1, PSMD9, FBXW7, PSMA7, PSME4, UCHL3, COPS2, GPS1, PSMB6, ASB3, HIF1A, CUL3, DCUN1D4, PSMA3, FBXL5, PSMD11, PSMC1, ASB11, SPSB3, RBBP7, FBXO41, BTBD1, NUB1, PSMB10, DCAF4, DCAF11, SOCS2, DCAF13, FBXW8, BTRC, PSMD5, FBXL18, PSMB5, FBXW9, PSMC6, RNF7, UBB, ASB2, FBXL13, CCNF, CUL2, UBE2F, PSMC4, COPS6"
"515","Nef-mediates down modulation of cell surface receptors by recruiting them to clathrin adapters",0.334488272921109,0.719919220072159,-0.400590370710845,-1.09564173751563,1254,16,"AP2B1, ATP6V1H, AP1S3, AP1B1, AP2A1, AP1S1, AP2S1"
"516","Negative epigenetic regulation of rRNA expression",0.505819949904229,0.800203907887076,0.300564735674656,0.969954738617443,3432,49,"H3-3A, POLR2K, SIN3A, GTF2H2, TAF1B, SAP30BP, POLR2H, CCNH, SAP18, GTF2H1, SUV39H1, SIRT1, POLR1A, DNMT3B, POLR1E, POLR1B, ERCC3, HDAC2, SAP130, CD3EAP"
"517","Negative regulation of FGFR1 signaling",0.0752628666297731,0.496979295426452,-0.465059003072531,-1.40428588432847,271,24,"SPRY2, GRB2, MAPK1, CBL, SRC, FGF22, PPP2CA"
"518","Negative regulation of FGFR2 signaling",0.126330532212885,0.538122603373204,-0.430035268255536,-1.3071000591556,450,25,"SPRY2, GRB2, MAPK1, CBL, SRC, FGF22, PPP2CA"
"519","Negative regulation of FGFR3 signaling",0.102244389027431,0.515249758200798,-0.452540559493521,-1.35336781303073,368,23,"SPRY2, GRB2, MAPK1, CBL, SRC"
"520","Negative regulation of FGFR4 signaling",0.0404544195067886,0.382761046102692,-0.512790350894077,-1.53355084129805,145,23,"SPRY2, GRB2, FGFR4, MAPK1, CBL, SRC"
"521","Negative regulation of MAPK pathway",0.894832550386422,0.952938560151774,0.236033513849184,0.713334902788064,5904,35,"YWHAB, MAPK3, PPP2R1A, KSR1, RAF1, ARAF, DUSP16, BRAF, DUSP8, PPP2CB, NRAS"
"522","Negative regulation of MET activity",0.232931089234678,0.649303659509696,0.456024980319262,1.20190493922524,1466,19,"SH3GL2, STAM, USP8, EPS15, SH3GL1"
