"","pathway","pval","padj","ES","NES","nMoreExtreme","size","leadingEdge"
"1","HALLMARK_TNFA_SIGNALING_VIA_NFKB",0.343863179074447,0.452443193243515,0.0878137997091516,1.08698224551289,1708,113,"ABCA1, ACKR3, AREG, ATF3, ATP2B1, B4GALT1, B4GALT5, BCL6, BHLHE40, BIRC2, BTG2, BTG3, CCND1, CCNL1, CEBPB, CEBPD, CFLAR, CSF1, DENND5A, DNAJB4, DRAM1, DUSP1, DUSP5, EFNA1, EGR1, EHD1, EIF1, ETS2, FJX1, FOS, FOSL1, FOSL2, G0S2, GADD45A, GADD45B, GFPT2, GPR183, ID2, IER2, IER3, IER5, IFNGR2, IL12B, IL6, IL6ST, INHBA, IRS2, JUN, JUNB, KDM6B, KLF10, KLF6, KLF9, LAMB3, LDLR, LITAF, MAP2K3, MAP3K8, MARCKS, MCL1, MXD1, NAMPT, NFAT5, NFE2L2, NFIL3, NFKB1, NFKB2, NFKBIA, NINJ1, NR4A1, NR4A2, NR4A3, PANX1, PDE4B, PFKFB3, PLAU, PLEK, PLK2, PLPP3, PMEPA1, PNRC1"
"2","HALLMARK_HYPOXIA",0.0012,0.0120433560818948,0.164511644655852,2.17186360416412,5,129,"ACKR3, AK4, AKAP12, ALDOA, ALDOB, ALDOC, AMPD3, ANKZF1, ATF3, ATP7A, B3GALT6, BCAN, BCL2, BHLHE40, BNIP3L, CA12, CCN2, CCNG2, CDKN1B, CHST2, CITED2, CP, CSRP2, DCN, DDIT3, DDIT4, DPYSL4, DTNA, DUSP1, EFNA1, EFNA3, ENO1, ENO2, ERO1A, ERRFI1, EXT1, FAM162A, FOS, FOSL2, FOXO3, GAA, GALK1, GAPDH, GAPDHS, GCK, GLRX, GPC1, GPC4, GPI, GRHPR, GYS1, HAS1, HDLBP, HEXA, HK1, HS3ST1, HSPA5, IDS, IER3, IL6, ILVBL, INHA, IRS2, JMJD6, JUN, KDM3A, KIF5A, KLF6, KLF7, KLHL24, LARGE1, LDHA, LXN, MAP3K1, MIF, MXI1, MYH9, NAGK, NCAN, NDRG1, NDST1, NDST2, NEDD4L, NFIL3, NOCT, NR3C1, P4HA1, P4HA2, PAM, PDGFB, PDK1, PDK3, PFKFB3, PFKL, PFKP, PGK1, PGM1, PGM2, PHKG1, PIM1, PNRC1, PPARGC1A, PPFIA4, PRDX5, PRKCA"
"3","HALLMARK_CHOLESTEROL_HOMEOSTASIS",0.0128436684728075,0.0535152853033648,0.221139519637642,1.8590356114569,63,51,"ABCA2, ACAT2, ACSS2, ACTG1, ALCAM, ALDOC, ATF3, ATF5, ATXN2, CBS, CD9, CHKA, CLU, CPEB2, CTNNB1, CYP51A1, DHCR7, EBP, ECH1, ERRFI1, ETHE1, FABP5, FADS2, FDFT1, GLDC, GNAI1, GUSB, HMGCR, HMGCS1, HSD17B7, IDI1, LDLR, LGMN, LSS, MAL2"
"4","HALLMARK_MITOTIC_SPINDLE",0.0140224358974359,0.0539324457593688,0.121773353333642,1.80465373433494,69,164,"ABI1, ABL1, ABR, ACTN4, AKAP13, ALMS1, ALS2, ANLN, APC, ARFGEF1, ARFIP2, ARHGAP10, ARHGAP27, ARHGAP29, ARHGAP4, ARHGAP5, ARHGDIA, ARHGEF11, ARHGEF12, ARHGEF2, ARHGEF3, ARHGEF7, ARL8A, ATG4B, BCAR1, BCL2L11, BCR, BIN1, BRCA2, CAPZB, CCDC88A, CCNB2, CD2AP, CDC27, CDC42, CDC42BPA, CDC42EP2, CDK5RAP2, CEP131, CEP192, CEP250, CEP57, CEP72, CKAP5, CLASP1, CLIP1, CLIP2, CNTRL, CNTROB"
"5","HALLMARK_WNT_BETA_CATENIN_SIGNALING",0.2232,0.328235294117647,0.194954901377738,1.21297521230634,1115,27,"ADAM17, AXIN1, AXIN2, CCND2, CSNK1E, CTNNB1, CUL1, DVL2, FRAT1, GNAI1, HDAC11, HDAC2, HDAC5, HEY1, JAG2, KAT2A, MAML1, NCOR2, NCSTN, NUMB, PPARD, PSEN2, PTCH1, RBPJ"
"6","HALLMARK_TGF_BETA_SIGNALING",0.288955823293173,0.401327532351629,-0.152788272631102,-1.12881608704356,1438,39,"XIAP, WWTR1, UBE2D3, TRIM33, TJP1, TGFBR1, SPTBN1, SMURF2, SMURF1, SMAD7, SMAD3, SMAD1, SLC20A1, SKIL, SKI"
"7","HALLMARK_IL6_JAK_STAT3_SIGNALING",0.140926257205327,0.228934467104028,0.200356375904613,1.33334259823671,708,31,"ACVR1B, BAK1, CBL, CD9, CNTFR, CRLF2, CSF1, CSF2RA, GRB2, IFNAR1, IFNGR1, IFNGR2, IL17RA, IL1R2, IL6, IL6ST, IRF9, ITGA4, JUN"
"8","HALLMARK_DNA_REPAIR",0.0158730158730159,0.0544055201698514,-0.136250239197148,-1.78781293040856,79,127,"ZWINT, ZNRD1, XPC, VPS37D, VPS37B, VPS28, USP11, UPF3B, UMPS, TYMS, TSG101, TP53, TMED2, TK2, TARBP2, TAF6, TAF1C, TAF13, TAF12, SURF1, SUPT5H, STX3, SSRP1, SRSF6, SNAPC5, SNAPC4, SMAD5, SF3A3, SEC61A1, SDCBP, RRM2B, RPA3, RPA2, RNMT, RFC5, RFC4, RFC3, RFC2, REV3L, RBX1, RALA, RAE1, RAD52, RAD51, PRIM1, POM121, POLR3C, POLR2K, POLR2J, POLR2H, POLR2G, POLR2F, POLR2E, POLR2D, POLR2C, POLR2A, POLR1D, POLR1C, POLH, POLE4, POLD4, POLB, POLA2, POLA1"
"9","HALLMARK_G2M_CHECKPOINT",0.345292368681863,0.452443193243515,-0.0802351388155144,-1.08093761509219,1741,134,"YTHDC1, XPO1, WRN, UPF1, UCK2, UBE2S, TRAIP, TRA2B, TPX2, TOP1, TNPO2, TMPO, TLE3, TFDP1, TENT4A, TACC3, SYNCRIP, SUV39H1, STMN1, STAG1, SRSF2, SRSF10, SRSF1, SQLE, SNRPD1, SMC4, SMC2, SMC1A, SMARCC1, SMAD3, SLC7A5, SLC7A1, SLC38A1, SLC12A2, SFPQ, SAP30, RPS6KA5, RPA2, RASAL2, RAD54L, RAD23B, RAD21, RACGAP1, PURA, PTTG1, PRPF4B, PRMT5, PRIM2, POLQ, POLA2, PLK4, PDS5B, PAFAH1B1, ORC6, ORC5, ODF2, ODC1, NUSAP1, NUP98, NUP50, NUMA1, NSD2, NOTCH2, NOLC1, NCL, NASP, MYBL2, MTF2, MNAT1, MEIS2, MARCKS, MAPK14, LMNB1, LIG3, LBR, KPNB1, KPNA2, KMT5A, KIF5B, KIF4A, KIF22, KIF20B, KIF15, KATNA1, ILF3, HUS1, HSPA8, HNRNPU, HNRNPD, HMGN2, HMGB3, HIRA, HIF1A, GSPT1, GINS2, G3BP1, FOXN3, FBXO5, FANCC, EZH2, EWSR1, EGF, EFNA5, E2F4, E2F3, DTYMK, DMD, DKC1, DDX39A, CUL5, CUL4A, CUL3, CUL1, CTCF, CKS2, CHMP1A, CHAF1A, CDKN1B, CDK4, CDC7, CDC27, CDC25B, CDC25A, CCNT1, CCND1, CCNB2, CBX1, CASP8AP2"
"10","HALLMARK_APOPTOSIS",0.0368209255533199,0.0929274663451879,0.14972296740841,1.63832885814808,182,88,"ADD1, AIFM3, ANKH, ANXA1, APP, ATF3, BAX, BCAP31, BCL10, BCL2L1, BCL2L11, BNIP3L, BTG2, BTG3, CASP2, CASP8, CASP9, CCND1, CCND2, CDC25B, CDKN1B, CFLAR, CLU, CREBBP, CTNNB1, CYLD, DAP3, DCN, DDIT3, DFFA, DIABLO, DNAJC3, DNM1L, DPYD, EBP"
"11","HALLMARK_NOTCH_SIGNALING",0.663071699620531,0.714614244587159,0.150320970042796,0.832554187498829,3319,21,"APH1A, ARRB1, CCND1, CUL1, DTX1, DTX2, DTX4, FBXW11, KAT2A, MAML2, NOTCH2, NOTCH3, PPARD, PRKCA, PSEN2, PSENEN, RBX1, SAP30, SKP1, ST3GAL6, TCF7L2"
"12","HALLMARK_ADIPOGENESIS",0.00625252117789431,0.0312626058894716,0.138212150293401,1.93619222946224,30,146,"ABCA1, ABCB8, ACADL, ACADM, ACLY, ACO2, ACOX1, ADCY6, ADIPOR2, AGPAT3, AIFM1, AK2, ALDOA, ANGPT1, APLP2, APOE, ARAF, ARL4A, ATL2, ATP1B3, ATP5PO, BAZ2A, BCKDHA, BCL2L13, BCL6, CAT, CCNG2, CHCHD10, CHUK, CMPK1, COL4A1, COQ3, COQ5, COQ9, COX6A1, COX7B, COX8A, CRAT, CS, CYC1, CYP4B1, DBT, DDT, DECR1, DGAT1, DHCR7, DHRS7, DHRS7B, DLAT, DLD, DNAJB9, DNAJC15, DRAM2, ECH1, ECHS1, ELMOD3, ELOVL6, ENPP2, EPHX2, ESRRA, FAH"
"13","HALLMARK_ESTROGEN_RESPONSE_EARLY",0.741,0.756122448979592,0.0592289096761046,0.781933178705714,3704,129,"ABAT, ABCA3, ABHD2, ABLIM1, ADCY1, ADCY9, ADD3, AFF1, AKAP1, AMFR, AR, AREG, ARL3, ASB13, B4GALT1, BAG1, BCL11B, BCL2, BHLHE40, BLVRB, CANT1, CA12, CBFA2T3, CCND1, CELSR2, CHPT1, CXCL12, DEPTOR, DHCR7, DLC1, DYNLT3, ELOVL2, ELOVL5, ENDOD1, FAM102A, FARP1, FDFT1, FHL2, FKBP4, FKBP5, FLNB, FOS, GAB2, GFRA1, GLA, IGF1R, IGFBP4, IL6ST, INPP5F, ISG20L2, ITPK1, JAK2, KAZN, KDM4B, KLF10, LRIG1, MAPT, MAST4, MED13L, MED24, MINDY1, MPPED2, MREG, MYB, MYBBP1A, MYBL1, NADSYN1, NAV2, NCOR2, NPY1R, NRIP1, NXT1, OLFM1, PAPSS2, PDLIM3, PDZK1, PEX11A, PGR, PLAAT3, PPIF, PTGES, RAB31, RAPGEFL1, RARA, RASGRP1, RBBP8, REEP1, RETREG1, RHOBTB3, RHOD, RPS6KA2, RRP12, SCARB1, SCNN1A, SEC14L2, SH3BP5, SIAH2, SLC16A1, SLC19A2, SLC1A1, SLC1A4, SLC22A5, SLC24A3, SLC27A2, SLC37A1, SLC39A6, SLC7A5, SLC9A3R1, SNX24, SULT2B1, SYBU, SYNGR1, SYT12, TBC1D30, TGIF2, TGM2, THSD4, TIAM1, TIPARP"
"14","HALLMARK_ESTROGEN_RESPONSE_LATE",0.141939369604497,0.228934467104028,0.104867831974891,1.32784647186329,706,118,"ABCA3, ABHD2, ADD3, AFF1, ALDH3A2, AMFR, AREG, ARL3, ATP2B4, BAG1, BCL2, BLVRB, BTG3, CACNA2D2, CA12, CA2, CCND1, CD9, CELSR2, CHPT1, CHST8, CKB, COX6C, CPE, CXCL12, CXCL14, DHCR7, DLG5, DNAJC1, DNAJC12, DYNLT3, ELOVL5, EMP2, FABP5, FAM102A, FARP1, FDFT1, FKBP4, FKBP5, FLNB, FOS, GALE, GINS2, GLA, HOMER2, HPRT1, HSPA4L, ID2, IDH2, IGFBP4, IL6ST, ITPK1, JAK1, JAK2, LAMC2, LARGE1, LLGL2, LSR, LTF, MAPT, MDK, MEST, METTL3, MOCS2, MYB, NAB2, NCOR2, NPY1R, NRIP1, NXT1, OLFM1, PAPSS2, PCP4, PDCD4, PDLIM3, PDZK1, PERP, PGR, PLAAT3, PLK4, PPIF, PRKAR2B, PTGES, PTPN6, RAB31, RABEP1, RAPGEFL1, RBBP8, RNASEH2A, RPS6KA2, SCARB1, SCNN1A, SCUBE2, SERPINA3, SGK1, SIAH2, SLC16A1, SLC1A4, SLC22A5, SLC24A3, SLC27A2, SLC29A1, SLC2A8, SLC7A5, SLC9A3R1"
"15","HALLMARK_ANDROGEN_RESPONSE",0.512691377921031,0.610346878477418,0.0920616432219335,0.940332671149996,2544,76,"ABCC4, ABHD2, ACSL3, ACTN1, ADRM1, AKAP12, AKT1, ANKH, APPBP2, ARID5B, SPCS3, B2M, B4GALT1, CAMKK2, CCND1, CCND3, CENPN, DBI, DHCR24, DNAJB9, ELK4, ELL2, ELOVL5, FADS1, FKBP5, GNAI3, GPD1L, GSR, GUCY1A1, HERC3, HMGCR, HMGCS1, HOMER2, IDI1, INPP4B, INSIG1, IQGAP2, ITGAV"
"16","HALLMARK_MYOGENESIS",0.019895498392283,0.0621734324758842,0.148086592105699,1.75653028111282,98,103,"ABLIM1, ACHE, ACSL1, ACTN2, ACTN3, ADCY9, AEBP1, AGL, AGRN, AK1, AKT2, ANKRD2, APOD, APP, ATP6AP1, BAG1, BHLHE40, BIN1, CACNA1H, CAMK2B, CDH13, CHRNB1, CKB, CKMT2, CLU, CNN3, COL4A2, COL6A2, CRAT, CRYAB, DAPK2, DMD, DMPK, DTNA, EIF4A2, EPHB3, FABP3, FHL1, FKBP1B, FLII, GAA, GABARAPL2, GADD45B, GJA5, GNAO1, GSN, HDAC5, IFRD1, IGFBP7, ITGB1, ITGB4, KIFC3, LAMA2, LARGE1, LDB3, LPIN1, MAPK12, MAPRE3, MEF2A, MEF2C, MEF2D, MRAS, MYBPH, MYH7, MYH9, MYL1, MYLK, MYO1C, NAV2, NCAM1"
"17","HALLMARK_PROTEIN_SECRETION",0.0461446264482621,0.109868158210148,0.147291965566714,1.58869115415104,230,85,"ABCA1, ADAM10, ANP32E, AP1G1, AP2B1, AP2M1, AP2S1, AP3B1, AP3S1, ARCN1, ARF1, ARFGAP3, ARFGEF1, ARFGEF2, ATP1A1, ATP6V1B1, ATP6V1H, ATP7A, BNIP3, CD63, CLCN3, CLN5, CLTA, CLTC, COG2, COPB1, COPB2, COPE"
"18","HALLMARK_INTERFERON_ALPHA_RESPONSE",0.797251543517228,0.797251543517228,0.101439978193542,0.742223928643332,4002,38,"ADAR, B2M, BATF2, CASP8, CD47, CD74, CMPK2, CMTR1, CNP, CSF1, EIF2AK2, GMPR, HERC6, IFIT3, IL15, IRF2, IRF9, LAP3, LPAR6, LY6E, MOV10, MVB12A, NCOA7, NUB1, OGFR, PARP9, PNPT1, PSMA3, PSME2, RIPK2, RNF31"
"19","HALLMARK_INTERFERON_GAMMA_RESPONSE",0.0602099425628837,0.136840778552009,-0.14749621439289,-1.53243638992069,303,78,"ZNFX1, VAMP8, TXNIP, TRIM26, TRAFD1, TOR1B, TNFAIP6, TNFAIP3, TDRD7, TAPBP, STAT3, STAT2, STAT1, ST8SIA4, ST3GAL5, SRI, SPPL2A, SOD2, SLC25A28, SAMHD1, RNF31, RIPK2, RIPK1, RBCK1, RAPGEF6, PTPN6, PTPN2, PTPN1, PSME2, PSMB2, PSMA3, PNPT1, PIM1, PFKP, PELI1, PDE4B, P2RY14, OGFR, NUP93, NLRC5, NFKBIA, NFKB1, NCOA3, NAMPT, MVP, MTHFD2, LYSMD2, LY6E, LAP3, KLRK1, JAK2, IRF9, IRF2, IL6, IL18BP, IL15, IFNAR2, IFIT3, HIF1A, HERC6, HLA-DMA"
"20","HALLMARK_APICAL_JUNCTION",0.075372833534865,0.157026736530969,0.112391475368009,1.46974452106693,373,127,"ACTB, ACTG1, ACTG2, ACTN1, ACTN2, ACTN3, ACTN4, ADAM15, ADAM23, ADAM9, AKT2, AKT3, AMIGO1, ARHGEF6, ARPC2, ATP1A3, B4GALT1, BAIAP2, CADM2, CADM3, CAP1, CD276, CDH11, CDH4, CDH6, CDH8, CDK8, CERCAM, CLDN11, CLDN18, CLDN19, CNTN1, CRAT, CTNNA1, CX3CL1, DHX16, DLG1, EPB41L2, EVL, EXOC4, FBN1, FSCN1, FYB1, GAMT, GNAI1, GNAI2, GTF2F1, HADH, HRAS, ICAM5, IKBKG, INPPL1, INSIG1, IRS1, ITGA2, ITGA3, ITGA9, ITGB1, ITGB4, JAM3, LAMB3, LAMC2, LIMA1, MAP4K2, MAPK11, MAPK14, MDK, MPP5, MPZL1, MVD, MYH10, MYH9, MYL12B, NECTIN1, NECTIN3, NECTIN4, NEGR1, NEXN, NF1, NF2, NFASC, NLGN2, NLGN3, NRTN, NRXN2, PARD6G, PBX2, PCDH1, PECAM1, PFN1, PIK3CB, PKD1, PLCG1"
"21","HALLMARK_APICAL_SURFACE",0.106471403126855,0.209621108058608,0.231246097582731,1.41878529310081,537,26,"ADAM10, ADIPOR2, AFAP1L2, AKAP7, APP, ATP8B1, B4GALT1, CD160, CROCC, CX3CL1, DCBLD2, EFNA5, EPHB4"
"22","HALLMARK_HEDGEHOG_SIGNALING",0.67173738991193,0.714614244587159,-0.131453678804022,-0.83095966887825,3355,28,"VLDLR, VEGFA, UNC5C, TLE3, TLE1, THY1, SLIT1, SCG2, RTN1, RASA1, PTCH1, OPHN1, NRP2, NRP1, NRCAM, NF1, MYH9"
"23","HALLMARK_COMPLEMENT",0.00583383625025146,0.0312626058894716,0.161348387755003,1.97855828645461,28,111,"ACTN2, ADAM9, AKAP10, ATOX1, BRPF3, C1QA, C1QC, CALM1, CALM3, CA2, CASP9, CBLB, CD46, CD55, CD59, CDH13, CDK5R1, CEBPB, CLU, COL4A2, CP, CPM, CPQ, CR1, CR2, CSRP1, CTSB, CTSO, CTSS, DGKG, DGKH, DOCK10, DOCK4, DOCK9, DPP4, DUSP5, DUSP6, DYRK2, EHD1, F8, FDX1, FYN, GCA, GMFB, GNAI2, GNAI3, GNB4, GNG2, GPD2, GRB2, GZMK, HPCAL4, HSPA5, IL6, IRF2, JAK2, KCNIP2, KCNIP3, KIF2A, L3MBTL4, LAMP2, LAP3, LCK, LGMN, LIPA, LRP1, LTA4H, LTF, LYN"
"24","HALLMARK_UNFOLDED_PROTEIN_RESPONSE",0.00258861011549184,0.021571750962432,0.18555961794632,2.11845351617614,12,95,"ALDH18A1, ARFGAP1, SPCS3, ASNS, ATF3, ATF4, ATF6, ATP6V0D1, BAG3, CALR, CEBPB, CEBPG, CHAC1, CNOT4, CNOT6, CXXC1, DCP1A, DCP2, DCTN1, DDIT4, DDX10, DKC1, DNAJA4, DNAJB9, DNAJC3, EDC4, EDEM1, EEF2, EIF2AK3, EIF2S1, EIF4A1, EIF4A2, EIF4A3, EIF4E, EIF4G1, ERN1, ERO1A, EXOC2, EXOSC1, EXOSC10, EXOSC2, EXOSC4, EXOSC5, EXOSC9"
"25","HALLMARK_PI3K_AKT_MTOR_SIGNALING",0.115687462144155,0.209621108058608,0.133999002759644,1.38440022928969,572,78,"ACACA, ACTR2, ACTR3, ADCY2, AKT1, AKT1S1, AP2M1, ARF1, ARHGDIA, ARPC3, ATF1, CAB39, CAB39L, CALR, CAMK4, CDK4, CDKN1B, CFL1, CLTC, CSNK2B, DAPP1, DDIT3, ECSIT, EIF4E, FGF22, GRB2, GRK2, GSK3B, HRAS, HSP90B1, IL4, LCK, MAP2K3, MAP2K6, MAP3K7, MAPK1, MAPK10, MAPK8, MAPK9, MAPKAP1, MKNK1, MKNK2, NCK1, NFKBIB, PDK1, PFN1, PIKFYVE, PIN1, PLA2G12A, PLCB1, PLCG1, PPP1CA, PPP2R1B, PRKAA2, PRKAG1, PRKAR2A, PRKCB, PTEN, PTPN11, RAC1, RAF1, RALB, RIPK1, RIT1, RPS6KA1, RPS6KA3, RPTOR"
"26","HALLMARK_MTORC1_SIGNALING",0.390002023881805,0.487502529852257,0.0708571383709168,1.03926878268434,1926,161,"ABCF2, ACACA, ACLY, ACSL3, ACTR2, ACTR3, ADD3, ADIPOR2, AK4, ALDOA, ARPC5L, ASNS, ATP2A2, ATP6V1D, BCAT1, BHLHE40, BTG2, CACYBP, CALR, CANX, CCNG1, CCT6A, CD9, CDC25A, CFP, COPS5, CORO1A, CYB5B, CYP51A1, DAPP1, DDIT3, DDIT4, DDX39A, DHCR24, DHCR7, EBP, EDEM1, EEF1E1, EIF2S2, ELOVL5, ELOVL6, ENO1, ERO1A, ETF1, FADS1, FADS2, FGL2, FKBP2, G6PD, GAPDH, GCLC, GGA2, GLA, GLRX, GMPS, GOT1, GPI, GSK3B, GSR, GTF2H1, HMBS, HMGCR, HMGCS1, HPRT1, HSP90B1, HSPA4, HSPA5, HSPA9, HSPD1, IDH1, IDI1, IFRD1, IGFBP5, IMMT, INSIG1, LDHA, LDLR, LGMN, LTA4H, M6PR, MAP2K3, MCM4, ME1, MLLT11, MTHFD2, MTHFD2L, NAMPT, NFIL3, NFKBIB, NFYC, NMT1, NUFIP1, NUP205, P4HA1, PDAP1, PDK1, PFKL, PGK1, PGM1, PHGDH, PITPNB, PLOD2, PPA1, PPIA, PRDX1, PSAT1, PSMA3, PSMA4, PSMB5, PSMC2, PSMC4, PSMC6, PSMD12, PSMD13, PSMD14, PSME3, PSMG1, PSPH"
"27","HALLMARK_E2F_TARGETS",0.0271555996035679,0.0798694105987291,-0.125559718295849,-1.69155589994589,136,134,"ZW10, XRCC6, XPO1, WEE1, WDR90, USP1, UNG, UBR7, UBE2T, UBE2S, TUBG1, TUBB, TP53, TRA2B, TMPO, TIPIN, TIMELESS, TFRC, TBRG4, TACC3, SYNCRIP, SUV39H1, STMN1, STAG1, SSRP1, SRSF2, SRSF1, SPAG5, SNRPB, SMC6, SMC4, SMC3, SMC1A, SLBP, RPA3, RPA2, RPA1, RNASEH2A, RFC3, RFC2, RFC1, RBBP7, RANBP1, RAD51C, RAD50, RAD21, RACGAP1, PTTG1, PSMC3IP, PSIP1, PRPS1, PRKDC, PRIM2, PRDX4, PPP1R8, PPM1D, POLE4, POLA2, PNN, PLK4, PDS5B, PCNA, PAN2, PAICS, PA2G4, ORC6, ORC2, NUP205, NUP153, NUP107, NUDT21, NOP56, NOLC1, NCAPD2, NBN, NASP, NAP1L1, NAA38, MYBL2, MTHFD2, MSH2, MRE11, MMS22L, MLH1"
"28","HALLMARK_MYC_TARGETS_V1",0.034380557202134,0.0929274663451879,-0.11262390395887,-1.65743205532697,173,161,"YWHAQ, YWHAE, XRCC6, XPOT, XPO1, VDAC3, VDAC1, VBP1, USP1, UBE2E1, UBA2, U2AF1, TYMS, TXNL4A, TUFM, TRIM28, TRA2B, TOMM70, TFDP1, TCP1, TARDBP, SYNCRIP, STARD7, SSBP1, SSB, SRSF7, SRSF3, SRSF2, SRSF1, SRPK1, SRM, SNRPG, SNRPD3, SNRPD2, SNRPD1, SNRPB2, SNRPA1, SNRPA, SMARCC1, SLC25A3, SF3B3, SF3A1, SET, SERBP1, RSL1D1, RRP9, RPS5, RPL34, RPL18, RPL14, RNPS1, RFC4, RANBP1, RAD23B, RACK1, PWP1, PTGES3, PSMD8, PSMD7, PSMD3, PSMD14, PSMD1, PSMC6, PSMC4, PSMB3, PSMB2, PSMA7, PSMA6, PSMA4, PSMA1, PRPS2, PRPF31, PRDX4, PRDX3, PPM1G, PPIA"
"29","HALLMARK_MYC_TARGETS_V2",0.135616987179487,0.228934467104028,-0.169883249940434,-1.34791801617358,676,45,"WDR74, WDR43, UTP20, UNG, TFB2M, TCOF1, TBRG4, SUPV3L1, SRM, SORD, SLC29A2, RRP9, RRP12, RCL1, RABEPK, PUS1, PRMT3, PPRC1, PPAN, PLK4, PHB, PES1, PA2G4, NOP56, NOLC1, NIP7, NDUFAF4, MYBBP1A, MRTO4, MPHOSPH10"
"30","HALLMARK_EPITHELIAL_MESENCHYMAL_TRANSITION",0.0371709865380751,0.0929274663451879,0.139472928077579,1.62954809659159,184,100,"APLP1, AREG, BASP1, BDNF, CADM1, CALU, CAP2, CCN2, CD59, CDH11, CDH2, CDH6, COL11A1, COL4A1, COL4A2, COL6A2, COLGALT1, COPA, CTHRC1, CXCL12, DCN, DPYSL3, DST, ECM2, EDIL3, EFEMP2, ENO2, FAP, FBLN1, FBLN2, FBN1, FBN2, FERMT2, FLNA, FSTL1, FSTL3, FUCA1, GADD45A, GADD45B, GLIPR1, GPC1, GPX7, HTRA1, ID2, IGFBP2, IGFBP4, IL15, IL6, INHBA, ITGA2, ITGA5, ITGAV, ITGB1, JUN, LAMA2, LAMC1, LAMC2, LRP1, MAGEE1, MATN2, MATN3, MEST, MGP"
"31","HALLMARK_INFLAMMATORY_RESPONSE",0.115734195112099,0.209621108058608,0.135821537358896,1.37630452284897,572,75,"ABCA1, ABI1, ACVR1B, ACVR2A, ADRM1, AHR, ATP2A2, ATP2B1, ATP2C1, BTG2, CALCRL, CCL17, CD55, CHST2, CSF1, CX3CL1, DCBLD2, EIF2AK2, FPR1, GABBR1, GNAI3, GPR183, HIF1A, HPN, IFNAR1, IFNGR2, IL12B, IL15, IL6, INHBA, IRAK2, ITGA5, ITGB8, KIF1B, KLF6, LCK, LDLR, LPAR1, LY6E, LYN, MXD1, NAMPT, NFKB1, NFKBIA, P2RX4, P2RX7, PCDH7, PDE4B, PSEN1, PTAFR, PTGER4, PTPRE, PVR, RAF1, RASGRP1, RELA, RGS16, RIPK2, RNF144B, SCN1B, SELENOS, SEMA4D, SGMS2, SLC11A2, SLC1A2, SLC31A1, SLC31A2, SLC4A4, SLC7A1"
"32","HALLMARK_XENOBIOTIC_METABOLISM",0.00381832797427653,0.0238645498392283,0.171244033407685,2.03121245389858,18,103,"ABCC2, ABCC3, ABCD2, ABHD6, ACO2, ACOX1, ACOX3, ACP2, ALAS1, ALDH9A1, ANGPTL3, APOE, ARG2, ARPP19, ATP2A2, BCAR1, BCAT1, BLVRB, BPHL, CA2, CAT, CBR1, CNDP2, COMT, CROT, CRP, CSAD, CYB5A, CYFIP2, CYP27A1, CYP2S1, DDC, DDT, DHPS, DHRS1, DHRS7, ECH1, ELOVL5, ENTPD5, ESR1, ETFDH, ETS2, FAH, FBLN1, GABARAPL1, GAD1, GART, GCLC, GSR, GSS, GSTO1, GSTT2, HPRT1, HSD11B1, HSD17B2, ID2, IDH1, IGFBP4"
"33","HALLMARK_FATTY_ACID_METABOLISM",0.000200843542880096,0.00503626107977438,0.249727939804739,2.97900817247989,0,104,"ACADL, ACADM, ACADVL, ACAT2, ACO2, ACOT2, ACOT8, ACOX1, ACSL1, ACSL4, ACSL5, ACSS1, ADIPOR2, ADSL, ALAD, ALDH3A2, ALDH9A1, ALDOA, AUH, BCKDHB, BLVRA, BPHL, CA2, CA4, CBR1, CCDC58, CPOX, CPT1A, CRAT, DECR1, DHCR24, DLD, DLST, ECH1, ECHS1, ECI1, EHHADH, ELOVL5, ENO2, ERP29, ETFDH, FH, G0S2, GABARAPL1, GAPDHS, GCDH, GLUL, GPD1, GPD2, GRHPR, GSTZ1, HADH, HADHB, HCCS, HIBCH, HMGCL, HMGCS1, HSD17B11, HSD17B4, HSD17B7, HSDL2, HSPH1, IDH1, IDH3B, IDH3G, IDI1, IL4I1"
"34","HALLMARK_OXIDATIVE_PHOSPHORYLATION",0.000201450443190975,0.00503626107977438,0.173708891408956,2.66683629180025,0,177,"ABCB7, ACADM, ACADSB, ACADVL, ACAT1, ACO2, AFG3L2, AIFM1, ALAS1, ALDH6A1, ATP1B1, ATP5F1A, ATP5F1B, ATP5F1C, ATP5F1D, ATP5F1E, ATP5MC3, ATP5PD, ATP5PF, ATP5MF, ATP5ME, ATP5MG, ATP5PO, ATP6AP1, ATP6V0B, ATP6V0C, ATP6V0E1, ATP6V1C1, ATP6V1D, ATP6V1E1, ATP6V1F, ATP6V1G1, ATP6V1H, BAX, BCKDHA, COX10, COX11, COX17, COX5A, COX5B, COX6A1, COX6B1, COX6C, COX7A2, COX7A2L, COX7B, COX7C, COX8A, CPT1A, CS, CYB5A, CYC1, DECR1, DLAT, DLD, DLST, ECH1, ECHS1, ECI1, ETFA, ETFDH, FDX1, FH, FXN, GLUD1, GOT2, GPI, GRPEL1, HADHA, HADHB, HCCS, HSPA9, HTRA2, IDH1, IDH2, IDH3A, IDH3B, IDH3G, IMMT, ISCU, LDHA, LDHB, LRPPRC, MDH1, MDH2, MFN2, MGST3, MPC1, MRPL11, MRPL15, MRPL34, MRPL35, MRPS11, MRPS12, MRPS15, MRPS22, MRPS30, MTRF1, MTX2, NDUFA1, NDUFA2, NDUFA3, NDUFA4, NDUFA5, NDUFA6, NDUFA7, NDUFA8, NDUFA9, NDUFAB1, NDUFB1, NDUFB2, NDUFB3, NDUFB4, NDUFB5, NDUFB6, NDUFB7, NDUFC1, NDUFC2, NDUFS1, NDUFS2, NDUFS3, NDUFS4, NDUFS6, NDUFS7, NDUFV1, NDUFV2"
"35","HALLMARK_GLYCOLYSIS",0.00120433560818948,0.0120433560818948,0.159636519232502,2.16345773769467,5,136,"AGL, AGRN, AK3, AK4, AKR1A1, ALDH7A1, ALDH9A1, ALDOA, ALDOB, ALG1, ANKZF1, ARPP19, B3GALT6, B3GAT1, B3GAT3, B4GALT1, B4GALT2, B4GALT4, B4GALT7, BPNT1, CACNA1H, CAPN5, CHPF2, CHST1, CHST12, CHST2, CITED2, COG2, COPB2, CYB5A, DCN, DDIT4, DLD, DPYSL4, ECD, EFNA3, ENO1, ENO2, ERO1A, EXT1, EXT2, FAM162A, AC074143.1, FKBP4, FUT8, G6PD, GAL3ST1, GALE, GALK1, GALK2, GAPDHS, GCLC, GFPT1, GLCE, GLRX, GMPPA, GNE, GNPDA1, GOT1, GOT2, GPC1, GPC4, GPR87, GUSB, GYS1, HDLBP, HOMER1, HS2ST1, HS6ST2, HSPA5, IDH1, IER3, IRS2, KIF2A, LDHA, LHPP, MDH1, MDH2, ME1, ME2, MED24, MIF, MPI, MXI1, NASP, NDST3, NDUFV3, NSDHL, NT5E, P4HA1, P4HA2, PAM, PAXIP1, PC, PDK3, PFKFB1, PFKP, PGAM1, PGK1, PGM2, PHKA2, PKM, PLOD1, PLOD2, PMM2, POLR3K, PPFIA4, PPIA, PPP2CB"
"36","HALLMARK_REACTIVE_OXYGEN_SPECIES_PATHWAY",0.352905690729942,0.452443193243515,-0.150001487962384,-1.06899935451556,1754,36,"TXNRD2, TXNRD1, TXN, STK25, SOD2, SELENOS, SCAF4, SBNO2, PTPA, PRDX6, PRDX4, PRDX2, PRDX1, PFKP, NQO1, NDUFS2, NDUFB4, NDUFA6, MSRA, MBP, LAMTOR5, JUNB, IPCEF1, HMOX2, GSR, GLRX, GCLM, GCLC, G6PD, FTL"
"37","HALLMARK_P53_PATHWAY",0.733976290938316,0.756122448979592,0.0599049756953821,0.785695702807474,3652,128,"ABAT, ABCC5, ABHD4, ACVR1B, AK1, ANKRA2, APAF1, APP, ATF3, BAIAP2, BAK1, BAX, BLCAP, BTG2, CCND2, CCND3, CCNG1, CCNK, CCP110, CD81, CDH13, CDK5R1, CDKN2AIP, CEBPA, CGRRF1, COQ8A, CSRNP2, CTSF, CYFIP2, DDB2, DDIT3, DDIT4, DGKA, DNTTIP2, DRAM1, EI24, ELP1, EPS8L2, ERCC5, FAM162A, FBXW7, FOS, FOXO3, FUCA1, GADD45A, GLS2, GM2A, HDAC3, HEXIM1, HINT1, HRAS, HSPA4L, IER3, IER5, IP6K2, IRAK1, ISCU, ITGB4, JAG2, JUN, KIF13B, LDHB, LRMP, MDM2, MKNK2, MXD1, MXD4, NDRG1, NINJ1, NOL8, PCNA, PDGFA, PERP, PIDD1, PLK2, PLK3, PLXNB2, PMM1, POLH, POM121, PPM1D, PRKAB1, PRMT2, PTPRE, RAB40C, RACK1, RAD51C, RAD9A, RALGDS, RAP2B, RB1, RCHY1, RETSAT, RGS16, RNF19B, RPL18, RPL36, RPS12, RPS27L, RRP8, RXRA, SAT1"
"38","HALLMARK_UV_RESPONSE_UP",0.175938943562964,0.274904599317132,0.106235990623342,1.27176017813819,875,105,"ABCB1, AGO2, ALAS1, ALDOA, AP2S1, ARRB2, ASNS, ATF3, ATP6V1C1, ATP6V1F, BAK1, BCL2L11, BSG, BTG2, BTG3, CA2, CCK, CCND3, CDC34, CDC5L, CEBPG, CHKA, CHRNA5, CLCN2, CLTB, CNP, COL2A1, CREG1, CYB5B, CYB5R1, DDX21, DGAT1, DLG4, DNAJB1, E2F5, EIF2S3, EIF5, ENO2, FGF18, FKBP4, FOS, FURIN, GLS, GRINA, GRPEL1, HNRNPU, HSPA13, HTR7, HYAL2, IGFBP2, IL6, IL6ST, JUNB, KLHDC3, LHX2, LYN, MAOA, MAPK8IP2, MARK2, MGAT1, MRPL23, NFKBIA, NPTXR, NR4A1, NTRK3, NXF1, OLFM1, PARP2, PDAP1, PDLIM3, PLCL1, POLG2, POLR2H, PPAT, PPIF, PPP1R2, PPT1, PRKACA, PRPF3, PSMC3, PTPRD, RAB27A, RASGRP1, RFC4, RHOB"
"39","HALLMARK_UV_RESPONSE_DN",0.19047619047619,0.288600288600289,0.103729081122839,1.24996792636049,943,107,"ABCC1, ACVR2A, ADD3, ADGRL2, AGGF1, AKT3, AMPH, ANXA4, APBB2, ARHGEF9, ATP2B1, ATP2B4, ATP2C1, ATRN, ATRX, ATXN1, BCKDHB, BDNF, BHLHE40, BMPR1A, CACNA1A, CAP2, CDC42BPA, CDK13, CDKN1B, CDON, CELF2"
"40","HALLMARK_ANGIOGENESIS",0.492273730684327,0.600333817907716,-0.198160814544158,-0.954734451435952,2452,16,"VTN, VEGFA, VCAN, VAV2, TNFRSF21"
"41","HALLMARK_HEME_METABOLISM",0.117387820512821,0.209621108058608,0.0969697527342767,1.36660393535048,585,147,"ABCG2, ACKR1, ACSL6, ADD1, ADD2, ADIPOR1, AGPAT4, ALAD, ALAS2, ALDH1L1, ALDH6A1, ANK1, ARHGEF12, ARL2BP, ASNS, ATG4A, ATP6V0A1, BACH1, BLVRA, BLVRB, BMP2K, BNIP3L, BPGM, BSG, BTG2, BTRC, CA1, CA2, CAST, CAT, CCDC28A, CCND3, CDC27, CIR1, CLCN3, CPOX, CTNS, CTSB, DAAM1, DCAF10, DCAF11, DCUN1D1, DMTN, EIF2AK1, ELL2, ENDOD1, EPB41, EZH1, FBXO34, FBXO7, FBXO9, FECH, FN3K, FOXJ2, FOXO3, FTCD, GAPVD1, GCLC, GCLM, GDE1, GLRX5, GMPS, GYPE, GYPB, GYPA, HAGH, HDGF, HEBP1, HMBS, HTATIP2, HTRA2"
"42","HALLMARK_COAGULATION",0.0163216560509554,0.0544055201698514,0.210715007236513,1.83369055386218,81,54,"ADAM9, ANXA1, ARF4, C1QA, CAPN2, CAPN5, CASP9, CD9, CFI, CLU, CPQ, CRIP2, CSRP1, CTSB, CTSK, CTSO, DPP4, DUSP14, DUSP6, F12, F8, FBN1, FURIN, FYN, GDA, GNG12, GSN, HPN, HTRA1, ISCU, ITGA2, KLF7, LAMP2, LGMN, LRP1, LTA4H, MASP2"
"43","HALLMARK_IL2_STAT5_SIGNALING",0.597467845659164,0.66948697287134,0.0743607004522141,0.882030035344755,2972,103,"ABCB1, AHR, ALCAM, AMACR, ANXA4, APLP1, ARL4A, BCL2, BCL2L1, BHLHE40, BMPR2, CA2, CCND2, CCND3, CD81, CDC42SE2, CKAP4, COL6A1, CSF1, CTSZ, CYFIP1, DCPS, DENND5A, DRC1, EEF1AKMT1, ETFBKMT, ETV4, FAH, FAM126B, FGL2, FURIN, GABARAPL1, GADD45B, GALM, GSTO1, GUCY1B1, HIPK2, HUWE1, IFNGR1, IGF1R, IGF2R, IKZF2, IKZF4, IL1R2, ITGAV, KLF6, LCLAT1, LRIG1, LRRC8C, MAP3K8, MAP6, MAPKAPK2, MXD1, MYO1C, MYO1E, NCOA3, NCS1, NDRG1, NFIL3, NRP1, NT5E, ODC1, P2RX4, P4HA1, PDCD2L, PENK, PHTF2, PIM1, PLEC, PLPP1, POU2F1, PRAF2, PTCH1, PTRH2, PUS1, RABGAP1L, RGS16, RHOB, RNH1, RORA, S100A1, SCN9A, SERPINC1, SH3BGRL2, SLC29A2, SMPDL3A, SNX14, SNX9, SOCS2, SPRED2, SPRY4, ST3GAL4"
"44","HALLMARK_BILE_ACID_METABOLISM",0.0100060036021613,0.0454818345552786,0.19310885913727,1.91016816772106,49,71,"ABCA1, ABCA2, ABCA3, ABCA5, ABCA6, ABCA8, ABCA9, ABCD1, ABCD2, ABCD3, ABCG4, ACSL1, ACSL5, ALDH9A1, AMACR, AR, ATXN1, BCAR3, BMP6, CAT, CROT, CYP27A1, CYP46A1, CYP7B1, DHCR24, EFHC1, EPHX2, FADS1, FADS2, GCLM, GNPAT, GSTK1, HSD17B11, HSD17B4, IDH1, IDH2, IDI1, LCK, LIPE, LONP2, NEDD4, NPC1, NR3C2, NUDT12, OPTN, PAOX, PECR, PEX1, PEX11A, PEX13, PEX16, PEX19, PEX26, PEX6, PEX7, PFKM, PHYH"
"45","HALLMARK_PEROXISOME",0.00322645694696511,0.0230461210497508,0.206168544249705,2.0778522533366,15,74,"ABCB1, ABCB4, ABCB9, ABCC5, ABCC8, ABCD1, ABCD2, ABCD3, ACOT8, ACOX1, ACSL1, ACSL4, ACSL5, ALDH9A1, ATXN1, BCL10, CACNA1B, CADM1, CAT, CDK7, CNBP, CRAT, CTBP1, CTPS1, DHCR24, DLG4, ECH1, EHHADH, ELOVL5, EPHX2, ERCC1, ERCC3, FADS1, FIS1, GNPAT, GSTK1, HMGCL, HRAS, HSD17B11, HSD17B4, IDE, IDH1, IDH2, IDI1"
"46","HALLMARK_ALLOGRAFT_REJECTION",0.000800480288172904,0.0120433560818948,0.238340485326431,2.35758426715219,3,71,"ABCE1, ABI1, ACHE, ACVR2A, AKT1, APBB1, B2M, BCAT1, BCL10, CCND2, CCND3, CCR5, CD47, CD7, CD74, CFP, CSF1, CSK, CTSS, DEGS1, DYRK3, EIF3A, EIF3D, EIF3J, EIF4G3, EIF5A, FLNA, FYB1, GALNT1, GLMN, HLA-DMA, HDAC9, HIF1A, IFNAR2, IFNGR1, IFNGR2, IGSF6, IKBKB, IL11, IL12B, IL15, IL4, IL6, INHBA, ITK, JAK2"
"47","HALLMARK_SPERMATOGENESIS",0.602538275584206,0.66948697287134,0.0861328686827721,0.879775198961324,2990,76,"ACRBP, ADCYAP1, AGFG1, ARL4A, ART3, BRAF, CAMK4, CCNB2, CFTR, CHFR, CLGN, CLPB, CLVS1, CNIH2, COIL, CSNK2A2, DCC, DDX25, DDX4, DMC1, EZH2, GAD1, GAPDHS, GMCL1, GRM8, GSG1, GSTM3, HSPA4L, HTR5A, IDE, IFT88, IL12RB2, IP6K1, JAM3, LPIN1, MAP7, MAST2, MLLT10, MTOR, NEFH, NF2, NOS1, NPHP1, NPY5R, OAZ3, PACRG, PARP2, PCSK1N, PCSK4, PGS1, PHF7, PHKG2, PIAS2"
"48","HALLMARK_KRAS_SIGNALING_UP",0.0685289389067524,0.148975954145114,0.126040938191597,1.49503558320382,340,103,"ABCB1, ADAM17, ADAM8, ADGRA2, AKAP12, AKT2, AMMECR1, ANKH, ANO1, APOD, ATG10, AVL9, BPGM, BTBD3, CAB39L, CA2, CBL, CBR4, CCND2, CCSER2, CDADC1, CPE, CROT, CSF2RA, CTSS, DCBLD2, DNMBP, DUSP6, EPB41L3, EPHB2, ERO1A, ETV1, ETV4, ETV5, EVI5, F13A1, FBXO4, FGF9, FUCA1, G0S2, GABRA3, GFPT2, GLRX, RBM4, GNG11, GPRC5B, GUCY1A1, HDAC9, HKDC1, HSD11B1, ID2, IL33, INHBA, ITGA2, ITGBL1"
