"","pathway","pval","padj","ES","NES","nMoreExtreme","size","leadingEdge"
"674","Regulation of RAS by GAPs",0.069364161849711,0.726256492954425,-0.335562554672021,-1.33450048571462,335,60,"PSMB5, SPRED2, PSMD7, SPRED1, PSMD4, SPRED3, UBB, PSMB1, PSMD8, PSMD5, PSMD9, RASA1, KBTBD7, PSMD11"
"675","Regulation of RUNX1 Expression and Activity",0.281957186544342,0.778695553454004,-0.389652436403661,-1.14281044914223,1382,17,"SRC, PTPN11, TNRC6B, AGO4, AGO3, CCND1, TNRC6A, TNRC6C, PML, CCND3"
"676","Regulation of RUNX2 expression and activity",0.241628772219926,0.771119417666732,-0.285891641733234,-1.13333298958946,1168,59,"PSMB5, PSMD7, HIVEP3, PSMD4, UBB, PSMB1, PSMD8, PSMD5, PPARGC1A"
"677","Regulation of RUNX3 expression and activity",0.149816551161843,0.771119417666732,-0.325396628324354,-1.23550475131713,734,48,"PSMB5, PSMD7, PSMD4, SRC, UBB, PSMB1, EP300, PSMD8, PSMD5"
"678","Regulation of TNFR1 signaling",0.700534759358289,0.874474162290525,0.256288311861324,0.844645720295473,3536,28,"TAX1BP1, XIAP, OTULIN, USP21, OTUD7B, RBCK1"
"679","Regulation of TP53 Activity",0.537884615384615,0.840765317103482,0.215330430184614,0.966914565242629,2796,131,"MDM4, EHMT1, PRR5, KAT6A, PPP2R1A, HIPK1, TAF6, TAF15, MDM2, ZNF385A, PIP4K2A, ATM, SGK1, PPP2CB, SMYD2, HDAC1, NOC2L, TP53, PRKAA1, TAF12, RFC2, EHMT2, RAD9B, RAD50, TAF3, RMI1, BLM, MAPKAP1, TP53INP1, TP53RK, ATR, TPX2, GATAD2A, MAPK14, MTA2, RNF34, DAXX, JMY"
"680","Regulation of TP53 Activity through Acetylation",0.711891782757925,0.877021319995588,-0.251633234510633,-0.840922289295611,3525,28,"CHD4, EP300, MBD3, PIP4K2B"
"681","Regulation of TP53 Activity through Methylation",0.0843373493975904,0.726256492954425,0.49582301106164,1.42197315914858,426,16,"MDM4, EHMT1, MDM2, ATM, SMYD2, TP53, EHMT2"
"682","Regulation of TP53 Activity through Phosphorylation",0.787528868360277,0.905254308043864,0.204914752085988,0.837577293803682,4091,75,"MDM4, HIPK1, TAF6, TAF15, MDM2, ATM, NOC2L, TP53, PRKAA1, TAF12, RFC2, RAD9B, RAD50, TAF3, RMI1, BLM, TP53INP1, TP53RK, ATR, TPX2, MAPK14"
"683","Regulation of TP53 Degradation",0.0864197530864197,0.726256492954425,0.402007143902437,1.36773246021603,440,32,"MDM4, PRR5, PPP2R1A, MDM2, ATM, SGK1, PPP2CB, TP53"
"684","Regulation of TP53 Expression and Degradation",0.0846560846560847,0.726256492954425,0.39915940394422,1.36607941033539,431,33,"MDM4, PRR5, PPP2R1A, MDM2, ATM, SGK1, PPP2CB, TP53"
"685","Regulation of actin dynamics for phagocytic cup formation",0.203875489589775,0.771119417666732,-0.305899651695689,-1.17462728710398,988,51,"MYO10, CFL1, DOCK1, MAPK1, PAK1, WIPF2, BAIAP2, MYO1C, ARPC1A, MYO9B, ARPC2, ARPC4, ACTB, PTK2, WIPF3, VAV3, WASL, NF2"
"686","Regulation of activated PAK-2p34 by proteasome mediated degradation",0.232310838445808,0.771119417666732,-0.310208796574234,-1.15212553334886,1135,43,"PSMB5, PSMD7, PSMD4, UBB, PSMB1, PSMD8, PSMD5, PSMD9, PSMD11, PSME3"
"687","Regulation of beta-cell development",0.800118156754628,0.906651156754262,0.256595428957286,0.759601301984179,4062,18,"NOTCH1, MAMLD1, HES1, FGF10, MAML1, MAML2, CREBBP, AKT2"
"688","Regulation of cholesterol biosynthesis by SREBP (SREBF)",0.502743344848608,0.826187854513869,-0.254058046348786,-0.970409227055619,2473,49,"SREBF2, NCOA6, MTF1, MED1, NCOA2, HELZ2, SCD, TBL1XR1, GGPS1, TGS1, SCAP, CHD9, NCOA1, MBTPS2, PMVK, FASN, IDI1, INSIG2, ELOVL6"
"689","Regulation of expression of SLITs and ROBOs",0.0827285921625544,0.726256492954425,-0.279360783339473,-1.25494004756896,398,117,"PSMB5, PSMD7, RPL22L1, GSPT2, PSMD4, RPL8, UPF2, UBB, PSMB1, RPL35, RPL29, PSMD8, RPS17, RPL28, PSMD5, NCBP2, UPF3B, SLIT1, USP33, RPL18A, RBM8A, PSMD9"
"690","Regulation of insulin secretion",0.360185902401239,0.782042559127477,0.271102135518183,1.05761479599921,1859,59,"MARCKS, GNG12, KCNC2, CACNA1C, STXBP1, RAPGEF3, ITPR2, ITPR1, GNB5, GNG13, CACNB3, GNAI1, KCNS3, AHCYL1, CHRM3, KCNB1"
"691","Regulation of lipid metabolism by PPARalpha",0.640116763969975,0.859482621285528,-0.210622074590145,-0.920249987897626,3069,101,"SREBF2, NCOA6, EP300, MED25, MED4, MTF1, G0S2, MED1, MED19, PPARGC1A, NCOA2, HELZ2, TBL1XR1, THRAP3, MED30, MED9, TGS1, CPT1A"
"692","Regulation of mRNA stability by proteins that bind AU-rich elements",0.26067136344799,0.774472222873076,-0.266987356152505,-1.10920391963661,1257,77,"PSMB5, HSPA8, PSMD7, PSMD4, ENPP2, UBB, PSMB1, PSMD8, PSMD5, HSPA1A, PSMD9, PSMD11, PSME3, DCP1A, ZFP36L1, DIS3, EIF4G1, ANP32A"
"693","Regulation of mitotic cell cycle",0.4336596542387,0.808182657273221,-0.249786255817776,-1.01059827405302,2081,66,"PSMB5, CDC26, PSMD7, PSMD4, UBB, PSMB1, PSMD8, PSMD5, PSMD9, ANAPC7, PSMD11, BUB3, PSME3, ANAPC2"
"694","Regulation of ornithine decarboxylase (ODC)",0.0955010224948875,0.726256492954425,-0.356009392620266,-1.32223043279068,466,43,"PSMB5, PSMD7, AZIN1, OAZ2, PSMD4, PSMB1, PSMD8, PSMD5, PSMD9, PSMD11, PSME3"
"695","Regulation of signaling by CBL",0.477627050010124,0.816501462959306,-0.342580346512116,-0.988425012257158,2358,16,"PIK3CD, CBL, LYN, RAPGEF1, PIK3CA, CRK"
"696","Reproduction",0.891541469438156,0.940782857851308,-0.192954981487998,-0.751400523359592,4331,54,"LMNA, UBE2I, SMC1A, STAG2, TINF2, DIDO1"
"697","Resolution of AP sites via the multiple-nucleotide patch replacement pathway",0.430981906891645,0.808182657273221,-0.33132672042134,-1.01815691144521,2119,20,"POLD4, POLE4, LIG1"
"698","Resolution of Abasic Sites (AP sites)",0.408479412963718,0.793235968658333,-0.301042849727087,-1.02961468763243,2003,31,"PNKP, POLD4, POLE4, LIG1"
"699","Resolution of D-Loop Structures",0.644250304754165,0.86020012757679,-0.27003336253637,-0.874979184799975,3170,25,"SPIDR, GEN1, EXO1, SLX4, WRN, RAD51D, PALB2, NBN"
"700","Resolution of D-loop Structures through Holliday Junction Intermediates",0.606924643584521,0.85144321519517,-0.280097309025874,-0.898734048179347,2979,24,"SPIDR, GEN1, EXO1, SLX4, WRN, RAD51D, PALB2, NBN"
"701","Resolution of D-loop Structures through Synthesis-Dependent Strand Annealing (SDSA)",0.928838215057991,0.949699822027208,0.21460344949266,0.643880321922454,4724,19,"ATM, RAD50, RMI1, BLM"
"702","Resolution of Sister Chromatid Cohesion",0.259402869329197,0.774472222873076,0.277484499933627,1.12177581007787,1337,70,"SMC3, NUDC, PPP2R1A, NUP160, DYNC1LI2, CENPC, NUP98, CENPP, PPP2R5A, PPP2CB, DYNLL2, RAD21, STAG1, MAD1L1, NDEL1, XPO1, NUP107, RCC2, ITGB3BP, NDE1, DYNC1H1"
"703","Respiratory electron transport",0.00083629521220991,0.199874555718169,-0.402264173296016,-1.72448701087589,3,92,"UQCRC2, NDUFA11, NDUFC1, MT-CYB, NDUFB5, NDUFB9, COX6C, NDUFA10, NDUFS4, NDUFA8, UQCRFS1, NDUFAF5, TRAP1, MT-ND4, UQCR10, COX6B1, NDUFA6, UQCRB, MT-ND3, MT-ND1, MT-ND2, NDUFAF1, ETFA, UQCR11, TIMMDC1, NDUFS3, NDUFA1, COX7C, COX18, NUBPL, COX5A, NDUFB10, UQCRC1, COX20, NDUFS6, NDUFA9, ECSIT, NDUFB8"
"704","Respiratory electron transport, ATP synthesis by chemiosmotic coupling, and heat production by uncoupling proteins.",0.00104690117252931,0.200167504187605,-0.374129189832027,-1.65789057748755,4,110,"UQCRC2, NDUFA11, NDUFC1, MT-CYB, NDUFB5, NDUFB9, COX6C, NDUFA10, NDUFS4, NDUFA8, ATP5F1E, UQCRFS1, NDUFAF5, TRAP1, MT-ND4, UQCR10, COX6B1, NDUFA6, UQCRB, MT-ND3, MT-ND1, MT-ND2, NDUFAF1, ETFA, UQCR11, ATP5MC3, TIMMDC1, NDUFS3, NDUFA1, ATP5PO, COX7C, COX18, SLC25A14, NUBPL, COX5A, MT-ATP6, NDUFB10, UQCRC1, COX20, NDUFS6, NDUFA9, ECSIT, NDUFB8"
"705","Response of EIF2AK4 (GCN2) to amino acid deficiency",0.340821068938807,0.781948655310053,0.273709883766875,1.0677880582894,1759,59,"RPL19, RPSA, RPL30, RPL6, RPS15, CEBPB, RPL4, RPL14, RPS14, RPL34, RPLP1"
"706","Response of Mtb to phagocytosis",0.17410977769034,0.771119417666732,0.412451399413341,1.25612037630648,884,20,"ENO1, MAPK3, KPNA1, GSK3A, KPNB1, ATP6V1H"
"707","Response to elevated platelet cytosolic Ca2+",0.0368734396005377,0.652796449224335,0.334692036231309,1.39840011860939,191,85,"TIMP3, VCL, PROS1, RARRES2, CAP1, TLN1, MANF, GTPBP2, LAMP2, HABP4, FLNA, FAM3C, PHACTR2"
"708","Retinoid metabolism and transport",0.770424194815397,0.901500037017771,0.247702175651625,0.78982831364424,3922,24,"LDLR, GPC3, TTR, LPL, GPC4, LRP12, SDC3, SDC4, RDH11, LRP1"
"709","Retrograde transport at the Trans-Golgi-Network",0.0127151799687011,0.478157108764308,0.436247946701826,1.58677797117151,64,43,"COG3, VPS53, COG4, STX6, RAB9A, RIC1, NAPA, NAPG, NAA35, ARFRP1, GOLGA1, VAMP4, RAB6B, COG1, NAPB"
"710","Rev-mediated nuclear export of HIV RNA",0.7083163473298,0.874871354066265,-0.247223223688426,-0.845542959961347,3474,31,"RANGAP1, NUP205, RANBP1, NUP54, TPR, NUP85, NUP35, NUP188, SEH1L, NDC1"
"711","Rho GTPase cycle",0.1022185361808,0.726256492954425,-0.273583059467398,-1.22898544870155,492,117,"FAM13B, ARHGEF17, RHOBTB2, BCR, GDI2, ARAP2, RHOJ, STARD8, ARHGAP44, ARHGEF15, ARHGEF40, MCF2L, STARD13, RHOA, MYO9B, RHOBTB1, ARAP1, ARHGAP32, RHOC, SRGAP1, ARHGAP33, VAV3, NET1, ARHGEF11, ARHGEF18, ARHGAP31, CHN1, RHOQ, ARHGAP18"
"712","Ribosomal scanning and start codon recognition",0.899775464380486,0.940782857851308,-0.195569381251939,-0.733432809196835,4407,45,"EIF4A1, EIF3H, RPS17, EIF3J"
"713","Role of phospholipids in phagocytosis",0.050029429075927,0.726256492954425,0.518374641214334,1.51249827222993,254,17,"PLCG1, PLD3, ITPR2, ITPR1, PLPP5, AHCYL1, PIK3R2, PIK3R1"
"714","S Phase",0.218386023294509,0.771119417666732,-0.246983430135802,-1.1203491245591,1049,127,"PSMB5, CDC26, PSMD7, ESCO1, PSMD4, POLD4, MNAT1, UBB, PSMB1, PSMD8, SMC1A, STAG2, PSMD5, POLE4, LIG1, PSMD9, CDKN1B, LIN37, CDK7, ANAPC7, E2F4, POLA1, PSMD11, ORC2, PSME3, ANAPC2, CCND1"
"715","S33 mutants of beta-catenin aren't phosphorylated",0.328650573802928,0.781948655310053,0.392231856410959,1.10436076996065,1660,15,"PPP2R1A, PPP2R5A, PPP2CB"
"716","S37 mutants of beta-catenin aren't phosphorylated",0.328650573802928,0.781948655310053,0.392231856410959,1.10436076996065,1660,15,"PPP2R1A, PPP2R5A, PPP2CB"
"717","S45 mutants of beta-catenin aren't phosphorylated",0.328650573802928,0.781948655310053,0.392231856410959,1.10436076996065,1660,15,"PPP2R1A, PPP2R5A, PPP2CB"
"718","SCF(Skp2)-mediated degradation of p27/p21",0.21123872026251,0.771119417666732,-0.305552094128996,-1.17017607116618,1029,50,"PSMB5, PSMD7, PSMD4, UBB, PSMB1, PSMD8, PSMD5, PSMD9, CDKN1B, PSMD11, PSME3, CCND1, CKS1B"
"719","SCF-beta-TrCP mediated degradation of Emi1",0.307093070930709,0.781948655310053,-0.289238108992566,-1.08774002522847,1497,46,"PSMB5, PSMD7, PSMD4, UBB, PSMB1, PSMD8, PSMD5"
"720","SHC1 events in ERBB2 signaling",0.478675873273761,0.816501462959306,-0.330911686267861,-0.987047552391571,2356,18,"NRG3, NRG1, PRKCE"
"721","SLC transporter disorders",0.793647738209817,0.905254308043864,0.208807185954497,0.824330389660579,4122,62,"NUP160, SLC35A3, CP, SLC17A5, NUP98, SLC20A2, POM121, POM121C, BSG"
"722","SLC-mediated transmembrane transport",0.907750631844987,0.943271308743269,-0.174488722559324,-0.813001762560749,4309,150,"SLC7A2, ARL2BP, SLC17A7, SLC38A1, SLCO1A2, SLC44A1, SLC20A1, SLC9A1, SLC6A12, SLC39A10, SLC25A4, SLC24A5, SLC2A1, SLC9A4, SLC4A4, CALM1, SLC43A2, SLC8B1, SLC13A3, SLC6A13, SLC14A2, SLC8A1, SLC4A3, SLCO2A1, RSC1A1, SLC9A2, SLC39A14, SLC33A1, SLC1A4, SLC25A18, SLC2A4, SLC2A12, SLC5A7, SLC29A3, SLC2A10, SLC44A5, SLC9A9, SLC39A8, SLC1A2, SLC15A4, SLC24A4, SLC30A1, SLC2A9, SLC16A1, SLC12A5, SLC22A8"
"723","SMAD2/SMAD3:SMAD4 heterotrimer regulates transcription",0.181692094313454,0.771119417666732,0.37663847890172,1.23214612600428,916,27,"JUNB, E2F5, SMAD2, SMAD7, WWTR1, HDAC1, CCNT2, TFDP1, CDK8, TFDP2, RNF111, CDK9"
"724","SRP-dependent cotranslational protein targeting to membrane",0.0570705103233346,0.726256492954425,0.332996832568204,1.34931748823361,292,72,"RPL19, SRPRA, RPSA, RPL30, SPCS2, SPCS1, RPL6, RPS15, SPCS3, RPL4, RPL14, SRP72, RPN2, RPS14, RPL34, RPLP1"
"725","SUMO E3 ligases SUMOylate target proteins",0.138194311891582,0.771119417666732,0.259361772341218,1.18267285127056,723,144,"UHRF2, NRIP1, CASP8AP2, SMC3, PHC1, TRIM28, NUP160, MRTFA, CTBP1, SCMH1, SUMO1, NR2C1, MDM2, NUP98, DDX17, HERC2, NR1H3, POM121, POM121C, RAD21, HDAC1, STAG1, TP53, PCGF2, DNMT1, THRB, NUP107, HNRNPK, RING1, PHC3, NR1H2, PPARG"
"726","SUMOylation",0.135135135135135,0.771119417666732,0.256983887035864,1.18057433864798,709,150,"UHRF2, NRIP1, CASP8AP2, SMC3, PHC1, TRIM28, NUP160, MRTFA, CTBP1, SCMH1, SUMO1, NR2C1, MDM2, NUP98, DDX17, HERC2, NR1H3, POM121, POM121C, RAD21, HDAC1, STAG1, TP53, PCGF2, DNMT1, THRB, NUP107, SENP5, HNRNPK, RING1, PHC3, NR1H2, PPARG"
"727","SUMOylation of DNA damage response and repair proteins",0.394696089818041,0.793235968658333,0.256491435555391,1.03155431219358,2038,68,"SMC3, PHC1, NUP160, SCMH1, SUMO1, NUP98, HERC2, POM121, POM121C, RAD21, STAG1, PCGF2, NUP107, RING1, PHC3"
"728","SUMOylation of DNA methylation proteins",0.0532251681836169,0.726256492954425,0.534141298042515,1.50391837259635,268,15,"PHC1, SCMH1, SUMO1, PCGF2, DNMT1, RING1, PHC3"
"729","SUMOylation of DNA replication proteins",0.779752066115702,0.905254308043864,-0.225480566696871,-0.816142075818719,3773,39,"UBE2I, RANGAP1, NUP205, TOP2B, NUP54, TPR, NUP85, NUP35, NUP188, SEH1L, NDC1"
"730","SUMOylation of RNA binding proteins",0.153257456828885,0.771119417666732,0.338634464187659,1.23779932015141,780,44,"PHC1, NUP160, SCMH1, SUMO1, NUP98, POM121, POM121C, PCGF2, NUP107, HNRNPK, RING1, PHC3"
"731","SUMOylation of SUMOylation proteins",0.65843621399177,0.868477499682939,0.255362990875615,0.873951911316092,3359,33,"NUP160, SUMO1, NUP98, POM121, POM121C"
"732","SUMOylation of chromatin organization proteins",0.350224127850322,0.781948655310053,0.278762729555651,1.06336034686214,1796,53,"PHC1, NUP160, SCMH1, SUMO1, NUP98, POM121, POM121C, HDAC1, PCGF2, NUP107, RING1, PHC3"
"733","SUMOylation of intracellular receptors",0.560729146027343,0.844184352129354,0.28511322200634,0.93272772604675,2829,27,"SUMO1, NR2C1, NR1H3, THRB, NR1H2, PPARG, THRA, PIAS1, HDAC4, SUMO2, PPARA"
"734","SUMOylation of transcription cofactors",0.014501273760533,0.478157108764308,0.440245205179806,1.58511338667954,73,41,"UHRF2, NRIP1, CASP8AP2, PHC1, TRIM28, MRTFA, CTBP1, SCMH1, SUMO1, DDX17"
"735","SUMOylation of transcription factors",0.409064155385521,0.793235968658333,0.35460731355772,1.03466278331001,2084,17,"SUMO1, MDM2, TP53, SP3, TP53BP1, PIAS1, MTA1, SUMO2"
"736","SUMOylation of ubiquitinylation proteins",0.492705047318612,0.820734221624942,0.280169976231025,0.975547672794616,2498,36,"NUP160, SUMO1, MDM2, NUP98, POM121, POM121C"
"737","Selective autophagy",0.0809758097580976,0.726256492954425,-0.353846003673226,-1.33071144152862,394,46,"HSPA8, PRKAG2, SRC, UBB, ATG12, ARL13B, MFN2, IFT88, DYNC1I1, FUNDC1, DYNLL1, CSNK2A1, CSNK2B, MFN1"
"738","Selenoamino acid metabolism",0.220784237975662,0.771119417666732,0.289603742922145,1.15100989154457,1142,64,"RPL19, RPSA, RPL30, RPL6, RPS15, RPL4, AIMP2, RPL14, RPS14, RPL34, RPLP1, HNMT, RPS13, PSTK"
"739","Selenocysteine synthesis",0.223897911832947,0.771119417666732,0.304957932807619,1.16043276935675,1157,52,"RPL19, RPSA, RPL30, RPL6, RPS15, RPL4, RPL14, RPS14, RPL34, RPLP1, RPS13, PSTK"
"740","Sema4D in semaphorin signaling",0.787829614604462,0.905254308043864,-0.250633077840192,-0.779283886054016,3883,21,"MYH11, RHOA, RHOC, MYH10, ARHGEF11, MYL9, LIMK1"
"741","Sema4D induced cell migration and growth-cone collapse",0.628350934199838,0.856923670606341,-0.297161302014324,-0.886376480464656,3093,18,"MYH11, RHOA, RHOC, MYH10, ARHGEF11, MYL9, LIMK1"
"742","Semaphorin interactions",0.588098016336056,0.845791307710081,0.2407633180966,0.930316549776418,3023,56,"SEMA6A, TLN1, ARHGEF12, SEMA4A, CRMP1, MYH14, ITGA1, DPYSL2, LIMK2, PTPRC, ROCK1, PLXNB1, PAK2, SEMA7A, MYH9, RRAS, ARHGAP35"
"743","Senescence-Associated Secretory Phenotype (SASP)",0.348618459729571,0.781948655310053,0.297025466794558,1.06944729451057,1778,41,"UBE2D1, MAPK3, EHMT1, STAT3, CDC16, JUN, CEBPB, ANAPC1, CDC27"
"744","Separation of Sister Chromatids",0.46553715825953,0.812606183617881,0.222919229350045,0.997468069587863,2417,127,"UBE2D1, PSMD12, PSMA1, SMC3, NUDC, PPP2R1A, NUP160, DYNC1LI2, CENPC, CDC16, NUP98, PSMB7, CENPP, PPP2R5A, PPP2CB, DYNLL2, RAD21, ANAPC1, CDC27, PSMC2, PSMC5, STAG1, MAD1L1, NDEL1, PSMB3, XPO1, NUP107, RCC2, ITGB3BP, ANAPC16, PSMB2, NDE1, DYNC1H1, PSMD1, PSMA4, CDC23, HDAC8, PSMD2, DYNC1I2, PSMD3, CENPE, PSMD6"
"745","Serotonin Neurotransmitter Release Cycle",0.15453618756371,0.771119417666732,-0.438124389919849,-1.28497369462301,757,17,"RIMS1, VAMP2, PPFIA2, SYN2"
"746","Sialic acid metabolism",0.522704339051463,0.835627672463543,-0.288097637982421,-0.951740677862047,2589,27,"ST6GAL1, CMAS, NEU1, CTSA, ST6GALNAC4"
"747","Signal amplification",0.603706624605678,0.848740489886806,0.29246133503177,0.90109267457347,3061,21,"GNG12, TBXA2R, GNB5, GNG13, GNAI1, GNA13"
"748","Signal transduction by L1",0.58128563003735,0.845791307710081,0.303669192261476,0.911106590940135,2956,19,"EGFR, MAPK3, ITGAV, ITGA9"
"749","Signaling by BMP",0.666936135812449,0.868652514763899,-0.300869374633379,-0.854076092865633,3299,15,"FSTL1, ACVR2A, BMPR1A"
"750","Signaling by BRAF and RAF fusions",0.406625258799172,0.793235968658333,-0.266531045967634,-1.02566807293852,1963,52,"ARAF, KDM7A, LMNA, CNKSR2, SRC, FAM131B, MAPK1, CSK"
"751","Signaling by EGFR",0.299882629107981,0.781948655310053,0.302914421864799,1.10179987183697,1532,43,"EGFR, STAM2, PAG1, NRAS, PLCG1, SPRY2, ADAM12, GRB2, PTPRK, ARHGEF7, EPS15, SPRY1, PIK3R1"
"752","Signaling by EGFR in Cancer",0.340291453328082,0.781948655310053,0.369197486582844,1.09293798660887,1727,18,"EGFR, NRAS, PLCG1, GRB2"
"753","Signaling by ERBB2",0.666470703507741,0.868652514763899,0.243026111719964,0.875021325542109,3400,41,"EGFR, NRAS, ERBIN, PLCG1, DIAPH1, ERBB4, GRB2"
"754","Signaling by ERBB2 KD Mutants",0.241983080857761,0.771119417666732,0.386721371289433,1.17775959815092,1229,20,"EGFR, NRAS, ERBIN, PLCG1, ERBB4, GRB2"
"755","Signaling by ERBB2 in Cancer",0.235607255520505,0.771119417666732,0.385978356932785,1.1892247908198,1194,21,"EGFR, NRAS, ERBIN, PLCG1, ERBB4, GRB2"
"756","Signaling by ERBB4",0.241820768136558,0.771119417666732,-0.29993339149742,-1.14563634096281,1189,49,"NRG3, GABRB1, GABRB3, NRG1, SRC, UBB, PSENEN, GABRG2"
"757","Signaling by Erythropoietin",0.832573806221518,0.927321282684127,0.240960417450383,0.748967486415149,4201,22,"NRAS, PLCG1, CRKL, GRB2"
"758","Signaling by FGFR",0.293688814830244,0.781948655310053,-0.269899425597622,-1.09197318637036,1409,66,"HNRNPM, SPRED2, SPRED1, SRC, MAPK1, HNRNPH1, UBB, PTPN11, CBL, NCBP2"
"759","Signaling by FGFR in disease",0.225349340680968,0.771119417666732,0.310197582720024,1.16200527044333,1144,49,"CUX1, NRAS, STAT3, PLCG1, POLR2K, ERLIN2, POLR2G, GRB2, LRRFIP1, FGF10, POLR2C, PIK3R1, BAG4"
"760","Signaling by FGFR1",0.427838226236912,0.808182657273221,-0.281295954228518,-1.01326992623679,2083,38,"SPRED2, SPRED1, SRC, MAPK1, UBB, PTPN11, CBL"
"761","Signaling by FGFR1 in disease",0.361655773420479,0.782042559127477,0.321862523177204,1.06075770974772,1825,28,"CUX1, NRAS, STAT3, PLCG1, ERLIN2, GRB2, LRRFIP1, PIK3R1, BAG4"
"762","Signaling by FGFR2",0.382723222932404,0.788541812765901,0.26788359548366,1.03967284789029,1975,57,"NRAS, MAPK3, PPP2R1A, PLCG1, POLR2K, SPRY2, RBFOX2, POLR2G, PPP2CB, GRB2, BRAF, PTBP1, FGF10, POLR2C, PIK3R1"
"763","Signaling by FGFR2 IIIa TM",0.641788105553368,0.859841616798653,0.294695652970836,0.872389670366997,3258,18,"POLR2K, POLR2G, POLR2C, POLR2B"
"764","Signaling by FGFR2 in disease",0.214383695865177,0.771119417666732,0.350029098319644,1.19088968207021,1093,32,"NRAS, PLCG1, POLR2K, POLR2G, GRB2, FGF10, POLR2C, PIK3R1, KRAS, POLR2B"
"765","Signaling by FGFR3",0.376766091051805,0.784724146068684,0.312391749365302,1.05434259045282,1919,31,"NRAS, MAPK3, PPP2R1A, PLCG1, SPRY2, PPP2CB, GRB2, BRAF"
"766","Signaling by FGFR4",0.374210110584518,0.784724146068684,0.316805978277021,1.05434213297923,1894,29,"NRAS, MAPK3, PPP2R1A, PLCG1, SPRY2, PPP2CB, GRB2, BRAF"
"767","Signaling by GPCR",0.890547263681592,0.940782857851308,0.168618036019861,0.870326405546396,4832,399,"PLCB4, METAP1, GNG12, METAP2, EGFR, NRAS, MAPK3, GPER1, FNTA, RDH5, REEP5, GRK4, PPP2R1A, LDLR, ARHGEF12, TBXA2R, P2RY14, ABHD6, PDE7A, PDE8A, GPC3, PTGFR, ARHGEF2, TTR, RGS10, ITPR2, HTR1F, ITPR1, GNB5, PPP2CB, LPAR1, RAMP1, CAMK2A, OPRM1, CALCRL, PDE6A, S1PR3, TRIO, GRM3, ARHGEF4, GIPR, GRB2, LPL, GPR37, PDE4B, GNG13, PDE8B, EDNRA, AKAP13, GRP, ROCK1, PRKCB, DGKG, SST, GPC4, ARHGEF7, RGS2, GNAI1, LRP12, ARHGEF6, GRK6, AHCYL1, PTGER3, PLXNB1, MGLL, GNA13, PIK3R2, HEBP1, CHRM3, NLN, CREB1, PIK3R1, TAC1, PROKR2, RGS14, PRKX, XK, GRM4, ADCYAP1R1, NMT1, PPP3CC, MC2R, MYO7A, ARHGEF5, ARHGEF26, CCR5, OR5AU1, GNAS, RASGRF2, PDE7B, DGKZ, TAC3, SDC3, CORT, PNOC, KRAS, F2R, SDC4, OR2V1, OR2V2, ADRA1B, ADCY4, CRH, FZD8, ADRA2C, S1PR2, RGS13, ADRB1, OXTR, PDE3A, GRM2, ARHGEF1, GNG3, WNT4, DAGLB, PTGER4, CCL27, HRH3, RDH11, GNA12, AKT2, LRP1, GABBR2, ARHGEF10L, PTH1R, RDH10"
"768","Signaling by Hedgehog",0.450862248078122,0.811015495228973,-0.222630709880682,-1.00096109057283,2169,118,"PSMB5, ADCY1, PSMD7, WDR35, SMO, PSMD4, SEL1L, UBB, PSMB1, PSMD8, PSMD5, ADCY6, PRKACA, IFT88, PSMD9, IFT52, PSMD11, ADCY2"
"769","Signaling by Hippo",0.27078674527343,0.774472222873076,-0.375146467635227,-1.1528136587998,1331,20,"MOB1B, STK4, LATS1, DVL2, AMOTL2"
"770","Signaling by Insulin receptor",0.726440809968847,0.879352451163944,0.223077491157794,0.857094174181919,3730,55,"NRAS, MAPK3, ATP6V0D1, ATP6V1A, PIK3C3, INSR, ATP6V1H, GRB2, FGF10, ATP6V0A2, PIK3R2, PIK3R1"
"771","Signaling by Interleukins",0.116086956521739,0.749777574756668,-0.228881914299978,-1.1536772385128,533,279,"PSMB5, SOD2, PIK3CD, PTPN13, HSPA8, POU2F1, PSMD7, PITPNA, RPS6KA3, PTPRZ1, VAMP2, PSMD4, VIM, CFL1, PELI2, MAPK1, UBB, PTPN11, PSMB1, PSMD8, PSMD5, CBL, PRKACA, IL1R1, IRAK1, FOS, RPS6KA5, IL2RA, PTPN2, LYN, STAT5B, PSMD9, IL1RAPL1, NFKB2, CSF2RA, ELK1, CHUK, MAPK10, IKBKB, NFKB1, AIP, RIPK2, PSMD11, IL1RAP, MAP2K6, GAB2, RALA, PPP2R5D, PTK2B, MAOA, SOCS2, PSME3, RAPGEF1, JAK2, CCND1, MAP2K1, PTPN14, FOXO1, CAPZA1, IKBKG"
"772","Signaling by Ligand-Responsive EGFR Variants in Cancer",0.315425636974126,0.781948655310053,0.387175276803676,1.11038180806075,1596,16,"EGFR, NRAS, PLCG1, GRB2"
"773","Signaling by MET",0.0611370716510903,0.726256492954425,0.353897391417947,1.35972208970176,313,55,"STAM2, NRAS, RANBP9, DOCK7, LAMA2, STAT3, GGA3, CRKL, TNS3, RANBP10, PTPN1, LAMC3"
"774","Signaling by NODAL",0.69800513529528,0.874474162290525,0.289759380945773,0.831002299457968,3533,16,"FOXO3, SMAD2"
"775","Signaling by NOTCH",0.494780793319415,0.821875771033802,0.214446522562288,0.982297449736336,2606,147,"NUMB, ST3GAL6, NCSTN, EGFR, PSMD12, PSMA1, WWP2, ITCH, NOTCH1, FBXW7, SKP1, DNER, MIB2, PSMB7, TBL1X, JUN, HDAC1, POFUT1, PSMC2, MOV10, PSMC5, TP53, MAMLD1, ATP2A2, PSMB3, HES1, TFDP1, MAML1, DTX4, CDK8, PSMB2, CREB1, FCER2, IKZF1, AGO2, TFDP2, PSMD1, HDAC3, RUNX1, PSMA4, PRKCI, HDAC8, PSMD2"
"776","Signaling by NOTCH1",0.507629901487348,0.826338845894082,0.244179100651046,0.970472816828781,2627,64,"NUMB, NCSTN, ITCH, NOTCH1, FBXW7, SKP1, DNER, MIB2, TBL1X"
"777","Signaling by NOTCH1 HD+PEST Domain Mutants in Cancer",0.844884488448845,0.927321282684127,0.206090189792027,0.780089583075257,4351,51,"NCSTN, NOTCH1, FBXW7, SKP1, MIB2, TBL1X, HDAC1, MAMLD1, HES1, MAML1, CDK8, HDAC3, HDAC8, MAML2, HEYL, HDAC4, CREBBP"
"778","Signaling by NOTCH1 PEST Domain Mutants in Cancer",0.844884488448845,0.927321282684127,0.206090189792027,0.780089583075257,4351,51,"NCSTN, NOTCH1, FBXW7, SKP1, MIB2, TBL1X, HDAC1, MAMLD1, HES1, MAML1, CDK8, HDAC3, HDAC8, MAML2, HEYL, HDAC4, CREBBP"
"779","Signaling by NOTCH1 in Cancer",0.844884488448845,0.927321282684127,0.206090189792027,0.780089583075257,4351,51,"NCSTN, NOTCH1, FBXW7, SKP1, MIB2, TBL1X, HDAC1, MAMLD1, HES1, MAML1, CDK8, HDAC3, HDAC8, MAML2, HEYL, HDAC4, CREBBP"
"780","Signaling by NOTCH2",0.447830474268416,0.811015495228973,-0.303331618290062,-1.00206666750246,2218,27,"ADAM10, CNTN1, UBB, EP300, PSENEN, RBPJ, NOTCH2, NEURL1"
"781","Signaling by NOTCH3",0.529179810725552,0.840358636301707,0.273308681480238,0.95165674694834,2683,36,"NCSTN, EGFR, WWP2, NOTCH1, MIB2, MAMLD1, HES1, MAML1, IKZF1"
"782","Signaling by NOTCH4",0.239677952105698,0.771119417666732,-0.275589808048096,-1.12752387049711,1160,70,"PSMB5, PSMD7, PSMD4, ADAM10, UBB, PSMB1, EP300, PSMD8, PSMD5, PSENEN, ACTA2, PSMD9, RBPJ, NOTCH2, PSMD11"
"783","Signaling by NTRK1 (TRKA)",0.437705870955241,0.809730728490535,0.248355871381563,1.00911012527429,2258,73,"NRAS, MAPK3, PPP2R1A, STAT3, NGF, ATF1, PLCG1, CRKL, KIDINS220, PPP2CB, DNM2, DNAL4, GRB2, MAPKAPK2, BRAF, DNM3, NTRK2, PIK3R2, CREB1, PIK3R1"
"784","Signaling by NTRK2 (TRKB)",0.920659858601728,0.944510151015361,0.207848565835083,0.662750263759421,4687,24,"NRAS, PLCG1, GRB2, BDNF, NTRK2, PIK3R1"
"785","Signaling by NTRK3 (TRKC)",0.453796350794585,0.811015495228973,0.342405069721181,0.999059435359073,2312,17,"NRAS, BAX, PLCG1, GRB2, PIK3R1"
"786","Signaling by NTRKs",0.714524905818334,0.878003759835497,-0.20606393379845,-0.885466546338601,3413,93,"CLTA, RPS6KA3, SRC, MAPK1, PTPN11, PCSK5, CLTC, RPS6KA5, NTRK3, SH3GL2, DOCK3, ELK1, RHOA, RIT1, NELFB, GRIN2B, RALA, PPP2R5D, RAPGEF1, MAP2K1, ADORA2A, PTPRS, FRS2"
"787","Signaling by Non-Receptor Tyrosine Kinases",0.241681975913452,0.771119417666732,-0.304857301499446,-1.14328912640403,1183,45,"NRG3, NRG1, DOCK1, UBB, CBL, EPAS1, CDKN1B, RASA1, RHOA, ARAP1, CCND1, KHDRBS2, KHDRBS3, CCNE1"
"788","Signaling by Nuclear Receptors",0.105494086226631,0.726256492954425,0.254289631361247,1.19465327252398,552,176,"GNG12, NRIP1, EGFR, NRAS, MAPK3, RDH5, SMC3, KANK1, ALDH1A1, FOXO3, POLR2K, ZDHHC21, YY1, CHD1, TBL1X, JUN, PDK2, POLR2G, NR1H3, GNB5, USF2, RAD21, S1PR3, ERBB4, HDAC1, PTGES3, MOV10, STAG1, NCOA3, CBFB, GNG13, ANGPTL3, XPO1, GPAM, IGF1R, GNAI1, NR1H2, SREBF1, PIK3R2, PDHX, PPARD, DLAT, POLR2C, CREB1, PIK3R1, AGO2, HDAC3, RUNX1, CDK9"
