"","pathway","pval","padj","ES","NES","nMoreExtreme","size","leadingEdge"
"772","S33 mutants of beta-catenin aren't phosphorylated",0.0599400599400599,0.102727937914758,0.344341816732009,1.50814492206356,299,15,"AMER1, APC, AXIN1, CSNK1A1, CTNNB1, GSK3B, PPP2CA, PPP2CB, PPP2R1A, PPP2R1B, PPP2R5A, PPP2R5B, PPP2R5C, PPP2R5D, PPP2R5E"
"773","S37 mutants of beta-catenin aren't phosphorylated",0.0599400599400599,0.102727937914758,0.344341816732009,1.50814492206356,299,15,"AMER1, APC, AXIN1, CSNK1A1, CTNNB1, GSK3B, PPP2CA, PPP2CB, PPP2R1A, PPP2R1B, PPP2R5A, PPP2R5B, PPP2R5C, PPP2R5D, PPP2R5E"
"774","S45 mutants of beta-catenin aren't phosphorylated",0.0599400599400599,0.102727937914758,0.344341816732009,1.50814492206356,299,15,"AMER1, APC, AXIN1, CSNK1A1, CTNNB1, GSK3B, PPP2CA, PPP2CB, PPP2R1A, PPP2R1B, PPP2R5A, PPP2R5B, PPP2R5C, PPP2R5D, PPP2R5E"
"775","SCF(Skp2)-mediated degradation of p27/p21",0.0316045380875203,0.0969897719784841,-0.455947037837903,-3.21869188836857,155,55,"UBC, UBB, SKP2, SKP1, RPS27A, PSMF1, PSME3, PSME2, PSME1, PSMD9, PSMD8, PSMD7, PSMD6, PSMD5, PSMD4, PSMD3, PSMD2, PSMD14, PSMD13, PSMD12, PSMD11, PSMD10, PSMD1, PSMC6, PSMC5, PSMC4, PSMC3, PSMC2, PSMC1, PSMB7, PSMB6, PSMB5, PSMB4, PSMB3, PSMB2, PSMB10, PSMB1, PSMA7, PSMA6, PSMA5, PSMA4, PSMA3, PSMA1"
"776","SCF-beta-TrCP mediated degradation of Emi1",0.0281862745098039,0.0969897719784841,-0.572284857999144,-3.93816388413012,137,49,"UBC, UBB, SKP1, RPS27A, PSMF1, PSME4, PSME3, PSME2, PSME1, PSMD9, PSMD8, PSMD7, PSMD6, PSMD5, PSMD4, PSMD3, PSMD2, PSMD14, PSMD13, PSMD12, PSMD11, PSMD10, PSMD1, PSMC6, PSMC5, PSMC4, PSMC3, PSMC2, PSMC1, PSMB7, PSMB6, PSMB5, PSMB4, PSMB3, PSMB2, PSMB10, PSMB1, PSMA8, PSMA7, PSMA6, PSMA5, PSMA4, PSMA3, PSMA1"
"777","SHC-mediated cascade:FGFR1",0.0294117647058824,0.0969897719784841,0.379254805530905,1.74331351260647,148,17,"FGF1, FGF10, FGF2, FGF20, FGF22, FGF23, FGF3, FGF5, FGF9, FGFR1, GRB2, HRAS, KL, KRAS"
"778","SHC-mediated cascade:FGFR2",0.0294117647058824,0.0969897719784841,0.379254805530905,1.74331351260647,148,17,"FGF1, FGF10, FGF2, FGF20, FGF22, FGF23, FGF3, FGF5, FGF7, FGF9, FGFR2, GRB2, HRAS, KRAS"
"779","SHC1 events in ERBB2 signaling",0.144570963806425,0.177894058300814,-0.257826520438684,-1.30314483814325,710,19,"SOS1, SHC1, PTPN12, PRKCE, PRKCD, PRKCA, NRG4, NRG3, NRG2, NRG1, NRAS, KRAS, HRAS, HBEGF, GRB2, ERBB4, ERBB3, EGFR, EGF"
"780","SLC transporter disorders",0.0437971073538399,0.0969897719784841,-0.469739296912392,-3.52960569925582,214,82,"TPR, SLCO2A1, SLCO1B3, SLCO1B1, SLC9A9, SLC9A6, SLC7A7, SLC6A20, SLC6A2, SLC5A7, SLC5A5, SLC5A2, SLC5A1, SLC4A4, SLC4A1, SLC40A1, SLC3A2, SLC3A1, SLC39A4, SLC35C1, SLC35A3, SLC35A2, SLC35A1, SLC33A1, SLC2A9, SLC2A2, SLC2A10, SLC2A1, SLC29A3, SLC27A4, SLC26A4, SLC26A3, SLC26A2, SLC24A5, SLC24A4, SLC24A1, SLC22A5, SLC20A2, SLC1A3, SLC1A1, SLC17A8, SLC17A5, SLC16A1, SLC12A6, SLC12A1, SLC11A2, SEH1L, SEC13, RHAG, RANBP2, RAE1, POM121, POM121C, NUP42, NUP58, NUP98, NUP93, NUP88, NUP85, NUP54, NUP50, NUP43, NUP37, NUP35, NUP214, NUP210, NUP205, NUP188, NUP160, NUP155, NUP153, NUP133, NUP107"
"781","SLC-mediated transmembrane transport",0.0842240273621206,0.125973006442482,-0.999798061389338,-5.79187157015393,393,208,"SLC16A2"
"782","SMAD2/SMAD3:SMAD4 heterotrimer regulates transcription",0.0726714431934493,0.115497667731879,-0.232420835550825,-1.39986405188511,354,32,"WWTR1, UBC, UBB, TGIF2, TGIF1, TFDP2, TFDP1, SP1, SNW1, SMAD7, SMAD4, SMAD3, SMAD2, SERPINE1, RPS27A, RNF111, RBL1"
"783","SRP-dependent cotranslational protein targeting to membrane",0.0435933998777755,0.0969897719784841,-0.657773067518421,-4.94248529597259,213,82,"TRAM1, SSR4, SSR3, SSR2, SSR1, SRPRB, SRPRA, SRP9, SRP72, SRP68, SRP54, SRP19, SRP14, SPCS2, SPCS1, SEC61G, SEC61B, SEC61A2, SEC61A1, SEC11C, SEC11A, RPSA, RPS9, RPS8, RPS7, RPS5, RPS4X, RPS3A, RPS28, RPS27L, RPS27A, RPS25, RPS24, RPS21, RPS20, RPS19, RPS17, RPS16, RPS15A, RPS15, RPS14, RPS13, RPS12, RPS11, RPN2, RPN1, RPLP1, RPL8, RPL7A, RPL6, RPL5, RPL4, RPL3L, RPL38, RPL37A, RPL36, RPL35, RPL34, RPL32, RPL30, RPL3, RPL29, RPL28, RPL27, RPL26, RPL23, RPL22L1, RPL19, RPL18A, RPL18, RPL14, RPL13A, RPL12, RPL11, RPL10A, RPL10"
"784","SUMO E3 ligases SUMOylate target proteins",0.0858050847457627,0.126519962068469,-0.239866791828707,-1.61467847179554,404,150,"ZNF131, XRCC4, XPC, WRN, VDR, UHRF2, UBE2I, TP53BP1, TP53, TRIM28, TRIM27, TPR, TOPORS, TOP2B, TOP2A, TOP1, THRB, THRA, TDG, SUZ12, SUMO2, SUMO1, STAG2, STAG1, SP3, SMC6, SMC5, SMC3, SMC1A, SIN3A, SEH1L, SEC13, SCMH1, SATB2, SATB1, SAFB, RXRA, RPA1, RORA, RNF2, RNF168, RING1, RELA, RARA, RANGAP1, RANBP2, RAE1, RAD52, RAD21, PPARGC1A, PPARG, PPARA, POM121, POM121C, PML, PIAS4, PIAS3, PIAS2, PIAS1, PHC3, PHC2, PHC1, PGR, PCNA, PCGF2, PARP1, PARK7, NUP42, NUP58, NUP98, NUP93, NUP88, NUP85, NUP54, NUP50, NUP43, NUP37, NUP35, NUP214, NUP210, NUP205, NUP188, NUP160, NUP155, NUP153, NUP133, NUP107, NSMCE2, NSMCE1, NRIP1, NR5A2, NR4A2, NR3C2, NR3C1, NR2C1, NR1H3, NR1H2, NOP58, NFKBIA, NFKB2, NDC1, NCOR2, NCOA2, NCOA1"
"785","SUMOylation",0.0882784650870203,0.128965725674704,-0.251881626110228,-1.69108628808074,420,156,"ZNF131, XRCC4, XPC, WRN, VDR, UHRF2, UBE2I, UBA2, TP53BP1, TP53, TRIM28, TRIM27, TPR, TOPORS, TOP2B, TOP2A, TOP1, THRB, THRA, TDG, SUZ12, SUMO2, SUMO1, STAG2, STAG1, SP3, SMC6, SMC5, SMC3, SMC1A, SIN3A, SENP5, SENP2, SENP1, SEH1L, SEC13, SCMH1, SATB2, SATB1, SAFB, SAE1, RXRA, RWDD3, RPA1, RORA, RNF2, RNF168, RING1, RELA, RARA, RANGAP1, RANBP2, RAE1, RAD52, RAD21, PPARGC1A, PPARG, PPARA, POM121, POM121C, PML, PIAS4, PIAS3, PIAS2, PIAS1, PHC3, PHC2, PHC1, PGR, PCNA, PCGF2, PARP1, PARK7, NUP42, NUP58, NUP98, NUP93, NUP88, NUP85, NUP54, NUP50, NUP43, NUP37, NUP35, NUP214, NUP210, NUP205, NUP188, NUP160, NUP155, NUP153, NUP133, NUP107, NSMCE2, NSMCE1, NRIP1, NR5A2, NR4A2, NR3C2, NR3C1, NR2C1, NR1H3, NR1H2, NOP58, NFKBIA, NFKB2, NDC1, NCOR2, NCOA2, NCOA1"
"786","SUMOylation of DNA damage response and repair proteins",0.0382726156365125,0.0969897719784841,-0.390502422257147,-2.90147658489009,186,71,"XRCC4, XPC, WRN, UBE2I, TPR, TDG, SUMO2, SUMO1, STAG2, STAG1, SMC6, SMC5, SMC3, SMC1A, SEH1L, SEC13, SCMH1, RPA1, RNF2, RNF168, RING1, RANBP2, RAE1, RAD52, RAD21, POM121, POM121C, PML, PIAS4, PIAS2, PIAS1, PHC3, PHC2, PHC1, PCGF2, PARP1, NUP42, NUP58, NUP98, NUP93, NUP88, NUP85, NUP54, NUP50, NUP43, NUP37, NUP35, NUP214, NUP210, NUP205, NUP188, NUP160, NUP155, NUP153, NUP133, NUP107, NSMCE2, NSMCE1"
"787","SUMOylation of DNA methylation proteins",0.502186878727634,0.520693765692696,0.198664274322169,0.890454901800516,2525,16,"BMI1, CBX2, CBX4, CBX8, DNMT1, DNMT3A, DNMT3B"
"788","SUMOylation of DNA replication proteins",0.0254567850544036,0.0969897719784841,-0.419071540975669,-2.79693434667994,123,44,"UBE2I, TPR, TOP2B, TOP2A, TOP1, SUMO2, SUMO1, SEH1L, SEC13, RANGAP1, RANBP2, RAE1, POM121, POM121C, PIAS4, PIAS3, PCNA, NUP42, NUP58, NUP98, NUP93, NUP88, NUP85, NUP54, NUP50, NUP43, NUP37, NUP35, NUP214, NUP210, NUP205, NUP188, NUP160, NUP155, NUP153, NUP133, NUP107"
"789","SUMOylation of RNA binding proteins",0.0270435136234242,0.0969897719784841,-0.393904126642232,-2.65729136534045,132,46,"UBE2I, TPR, SUMO2, SUMO1, SEH1L, SEC13, SCMH1, RNF2, RING1, RANBP2, RAE1, POM121, POM121C, PHC3, PHC2, PHC1, PCGF2, NUP42, NUP58, NUP98, NUP93, NUP88, NUP85, NUP54, NUP50, NUP43, NUP37, NUP35, NUP214, NUP210, NUP205, NUP188, NUP160, NUP155, NUP153, NUP133, NUP107, NOP58, NDC1"
"790","SUMOylation of SUMOylation proteins",0.0208845208845209,0.0969897719784841,-0.519286916363352,-3.20140494373079,101,34,"UBE2I, TPR, TOPORS, SUMO2, SUMO1, SEH1L, SEC13, RANBP2, RAE1, POM121, POM121C, PIAS4, NUP42, NUP58, NUP98, NUP93, NUP88, NUP85, NUP54, NUP50, NUP43, NUP37, NUP35, NUP214, NUP210, NUP205, NUP188, NUP160, NUP155, NUP153, NUP133, NUP107"
"791","SUMOylation of chromatin organization proteins",0.0316045380875203,0.0969897719784841,-0.341822785116809,-2.41304830256661,155,55,"UBE2I, TPR, SUZ12, SUMO2, SUMO1, SEH1L, SEC13, SCMH1, SATB2, SATB1, RNF2, RING1, RANBP2, RAE1, POM121, POM121C, PIAS2, PIAS1, PHC3, PHC2, PHC1, PCGF2, NUP42, NUP58, NUP98, NUP93, NUP88, NUP85, NUP54, NUP50, NUP43, NUP37, NUP35, NUP214, NUP210, NUP205, NUP188, NUP160, NUP155, NUP153, NUP133, NUP107"
"792","SUMOylation of intracellular receptors",0.0148979591836735,0.0969897719784841,-0.420382808824652,-2.41796840649156,72,27,"VDR, UBE2I, THRB, THRA, SUMO2, SUMO1, RXRA, RORA, RARA, PPARG, PPARA, PIAS4, PIAS3, PIAS2, PIAS1, PGR, NR5A2, NR4A2, NR3C2, NR3C1, NR2C1, NR1H3, NR1H2"
"793","SUMOylation of transcription cofactors",0.20069558101473,0.231623170550259,-0.165690320862735,-1.09203103025978,980,42,"ZNF131, UHRF2, UBE2I, TRIM28, TOPORS, SUMO2, SUMO1, SIN3A, SCMH1, SAFB, RNF2, RING1, PPARGC1A, PIAS4, PIAS3, PIAS2, PIAS1, PHC3, PHC2, PHC1, PCGF2, PARK7, NRIP1, NCOR2, NCOA2, NCOA1, MRTFA"
"794","SUMOylation of transcription factors",0.040016006402561,0.0969897719784841,-0.359722683677764,-1.64240651055152,199,15,"UBE2I, TP53BP1, TP53, SUMO2, SUMO1, SP3, PIAS4, PIAS3, PIAS2, PIAS1, MTA1, MITF, MDM2"
"795","SUMOylation of ubiquitinylation proteins",0.0219487179487179,0.0969897719784841,-0.497078232155094,-3.15548251766813,106,37,"UBE2I, TRIM27, TPR, SUMO1, SEH1L, SEC13, RANBP2, RAE1, POM121, POM121C, PML, PIAS4, PIAS2, PIAS1, NUP42, NUP58, NUP98, NUP93, NUP88, NUP85, NUP54, NUP50, NUP43, NUP37, NUP35, NUP214, NUP210, NUP205, NUP188, NUP160, NUP155, NUP153, NUP133, NUP107"
"796","Scavenging by Class A Receptors",0.0205794205794206,0.0969897719784841,0.482401931468315,2.11281926267993,102,15,"APOA1, APOB, APOE, CALR, COL1A2, COL3A1, COL4A1, COL4A2, COLEC11, COLEC12"
"797","Selective autophagy",0.0208739758095981,0.0969897719784841,0.999733581990143,6.06336002906841,106,50,"PRKAG2, ARL13B"
"798","Selenoamino acid metabolism",0.0415737172987224,0.0969897719784841,-0.473404237117036,-3.55689900935417,204,78,"TXNRD1, SEPSECS, SEPHS2, SECISBP2, SCLY, RPSA, RPS9, RPS8, RPS7, RPS5, RPS4X, RPS3A, RPS28, RPS27L, RPS27A, RPS25, RPS24, RPS21, RPS20, RPS19, RPS17, RPS16, RPS15A, RPS15, RPS14, RPS13, RPS12, RPS11, RPLP1, RPL8, RPL7A, RPL6, RPL5, RPL4, RPL3L, RPL38, RPL37A, RPL36, RPL35, RPL34, RPL32, RPL30, RPL3, RPL29, RPL28, RPL27, RPL26, RPL23, RPL22L1, RPL19, RPL18A, RPL18, RPL14, RPL13A, RPL12, RPL11, RPL10A, RPL10"
"799","Selenocysteine synthesis",0.0353514831369362,0.0969897719784841,-0.63319514387329,-4.56561946907712,173,62,"SEPSECS, SEPHS2, SECISBP2, RPSA, RPS9, RPS8, RPS7, RPS5, RPS4X, RPS3A, RPS28, RPS27L, RPS27A, RPS25, RPS24, RPS21, RPS20, RPS19, RPS17, RPS16, RPS15A, RPS15, RPS14, RPS13, RPS12, RPS11, RPLP1, RPL8, RPL7A, RPL6, RPL5, RPL4, RPL3L, RPL38, RPL37A, RPL36, RPL35, RPL34, RPL32, RPL30, RPL3, RPL29, RPL28, RPL27, RPL26, RPL23, RPL22L1, RPL19, RPL18A, RPL18, RPL14, RPL13A, RPL12, RPL11, RPL10A, RPL10"
"800","Sema3A PAK dependent Axon repulsion",0.283516483516484,0.312318158032444,0.245664163731809,1.07595750229042,1418,15,"CFL1, FES, FYN, HSP90AB1, LIMK1, NRP1, PAK1, PAK2, PAK3, PLXNA1, PLXNA2, PLXNA3, PLXNA4, RAC1, SEMA3A"
"801","Sema4D in semaphorin signaling",0.032513716724243,0.0969897719784841,-0.314498437811607,-1.66732517520421,159,21,"SEMA4D, RRAS, ROCK2, ROCK1, RND1, RHOC, RHOB, RHOA, RAC1, PLXNB1, MYL12B, MYH9, MYH14, MYH11, MYH10, MET, LIMK2, LIMK1"
"802","Sema4D induced cell migration and growth-cone collapse",0.0399108589951378,0.0969897719784841,-0.339653399739639,-1.63854389472889,196,17,"SEMA4D, ROCK2, ROCK1, RND1, RHOC, RHOB, RHOA, PLXNB1, MYL12B, MYH9, MYH14, MYH11, MYH10, LIMK2, LIMK1"
"803","Semaphorin interactions",0.0784775358053757,0.121209369099994,0.194934684084244,1.18201640161423,399,60,"ARHGAP35, ARHGEF11, ARHGEF12, CD72, CDK5, CDK5R1, CFL1, CRMP1, DPYSL2, DPYSL3, DPYSL4, DPYSL5, FARP2, FES, FYN, GSK3B, HSP90AB1, ITGA1, ITGB1, LIMK1, LIMK2, MET, MYH10, MYH11, MYH14, MYH9, MYL12B, NRP1, PAK1, PAK2, PAK3, PIP5K1C, PLXNA1, PLXNA2, PLXNA3, PLXNA4, PLXNB1, PLXNB3, PLXNC1, PLXND1, PTPRC, RAC1, RHOA, RHOB, RHOC, RND1, ROCK1, ROCK2, RRAS, SEMA3A, SEMA3E, SEMA4A, SEMA4D, SEMA5A, SEMA6A, SEMA6D, SEMA7A"
"804","Senescence-Associated Secretory Phenotype (SASP)",0.0489771833202203,0.0980844051158958,0.349647090158477,2.10062756305915,248,46,"ANAPC1, ANAPC10, ANAPC15, ANAPC16, ANAPC2, ANAPC4, ANAPC5, ANAPC7, CCNA1, CCNA2, CDC16, CDC23, CDC26, CDC27, CDK2, CDK4, CDK6, CDKN1A, CDKN1B, CDKN2B, CDKN2C, CDKN2D, CEBPB"
"805","Separation of Sister Chromatids",0.0882909396678579,0.128965725674704,-0.164215596609963,-1.10334125090066,419,154,"ZWINT, ZWILCH, ZW10, XPO1, WAPL, UBE2E1, UBE2D1, UBC, UBB, TAOK1, STAG2, STAG1, SPC25, SPC24, SMC3, SMC1A, SKA2, SKA1, SGO2, SEH1L, SEC13, RPS27A, RCC2, RANGAP1, RANBP2, RAD21, PTTG1, PSMF1, PSME4, PSME3, PSME2, PSME1, PSMD9, PSMD8, PSMD7, PSMD6, PSMD5, PSMD4, PSMD3, PSMD2, PSMD14, PSMD13, PSMD12, PSMD11, PSMD10, PSMD1, PSMC6, PSMC5, PSMC4, PSMC3, PSMC2, PSMC1, PSMB7, PSMB6, PSMB5, PSMB4, PSMB3, PSMB2, PSMB10, PSMB1, PSMA8, PSMA7, PSMA6, PSMA5, PSMA4, PSMA3, PSMA1, PPP2R5E, PPP2R5D, PPP2R5C, PPP2R5B, PPP2R5A, PPP2R1B, PPP2R1A, PPP2CB, PPP2CA, PPP1CC, PMF1, PLK1, PDS5B, PDS5A, PAFAH1B1, NUP98, NUP85, NUP43, NUP37, NUP160, NUP133, NUP107, NUDC, NSL1"
"806","Serotonin Neurotransmitter Release Cycle",0.00707499494643218,0.0969897719784841,-0.594849867812782,-2.94694352794403,34,18,"VAMP2, UNC13B, TSPOAP1, SYT1, SYN3, SYN2, SYN1, STXBP1, STX1A, SNAP25, SLC18A2, RIMS1, RAB3A, PPFIA4, PPFIA3, PPFIA2, PPFIA1"
"807","Sialic acid metabolism",0.0195559177021797,0.0969897719784841,-0.454310194990376,-2.70381026133029,95,31,"ST8SIA6, ST8SIA5, ST8SIA4, ST8SIA3, ST8SIA2, ST8SIA1, ST6GALNAC6, ST6GALNAC5, ST6GALNAC4, ST6GALNAC3, ST6GALNAC2, ST6GAL2, ST6GAL1, ST3GAL6, ST3GAL5, ST3GAL4, ST3GAL3, ST3GAL2, ST3GAL1, SLC35A1, SLC17A5"
"808","Signal amplification",0.0290652003142184,0.0969897719784841,0.449045814216371,2.37238145958003,147,25,"GNA11, GNA13, GNA14, GNA15, GNAI1, GNAI2, GNAI3, GNB1, GNB3, GNB4, GNB5, GNG11, GNG12, GNG13, GNG2, GNG3, GNG4, GNG7, GNG8, GNGT2"
"809","Signal transduction by L1",0.048809289509939,0.0980844051158958,0.308537747346496,1.52204991052821,247,21,"CSNK2A1, CSNK2A2, CSNK2B, EGFR, FGFR1, ITGA2B, ITGA5, ITGA9, ITGAV, ITGB1, ITGB3, L1CAM, MAP2K1, MAP2K2, MAPK1, MAPK3, NCAM1, NRP1, PAK1"
"810","Signaling by BMP",0.0540646425073457,0.10014464919955,0.2894494179677,1.48159848916604,275,23,"ACVR2A, ACVR2B, ACVRL1, AMH, AMHR2, BMP2, BMPR1A, BMPR1B, BMPR2"
"811","Signaling by BRAF and RAF fusions",0.068479749559773,0.111232086306283,0.20934377806268,1.27596633875802,349,59,"AGGF1, AGK, AGTRAP, AKAP9, AP3B1, APBB1IP, ARAF, ARRB1, ARRB2, ATG7, BCL2L11, BRAF, CALM1, CAMK2A, CAMK2B, CAMK2G, CLCN6, CNKSR1, CNKSR2, CSK, ESRP1, FAM114A2, FAM131B, FGG, FN1, FXR1, HRAS, IQGAP1, ITGA2B, ITGB3, JAK2, KDM7A, KRAS, KSR1, KSR2, LMNA, MAP2K1, MAP2K2, MAPK1, MAPK3, MARK3"
"812","Signaling by EGFR",0.365699100572363,0.391256694445868,-0.136718674863691,-0.915645453116926,1788,45,"UBC, UBB, TGFA, STAM2, STAM, SRC, SPRY2, SPRY1, SOS1, SHC1, SH3KBP1, SH3GL3, SH3GL2, SH3GL1, RPS27A, PXN, PTPRK, PTPN3, PTPN12, PTPN11, PLCG1, PIK3R1, PIK3CA"
"813","Signaling by EGFR in Cancer",0.645437844458053,0.65679452207315,-0.15771071523531,-0.817007141007601,3161,20,"UBC, UBB, TGFA, SOS1, SHC1, RPS27A, PLCG1, PIK3R1, PIK3CA, NRAS, KRAS, HRAS, HBEGF, GRB2, UBA52, GAB1, EGFR, EGF"
"814","Signaling by ERBB2",0.472199509403107,0.493038805705752,-0.124540027076814,-0.834081442331386,2309,45,"YES1, USP8, UBC, UBB, STUB1, SRC, SOS1, SHC1, RPS27A, RNF41, RHOA, PTPN18, PTPN12, PRKCE, PRKCD, PRKCA, PLCG1, PIK3R1, PIK3CA, NRG4, NRG3, NRG2, NRG1, NRAS, MEMO1, MATK, KRAS, HRAS, HBEGF, GRB7, GRB2, UBA52, GAB1, FYN, ERBIN, ERBB4, ERBB3, EGFR, EGF"
"815","Signaling by ERBB2 KD Mutants",0.0899429246211376,0.129324011782602,0.272308271842939,1.34332600908368,456,21,"CDC37, EGF, EGFR, ERBB3, ERBB4, ERBIN, GAB1, GRB2, HBEGF, HRAS, KRAS, NRAS, NRG1, NRG2, NRG3, NRG4, PIK3CA, PIK3R1, PLCG1"
"816","Signaling by ERBB2 in Cancer",0.174425456688273,0.208230390381299,0.231140684870242,1.16122860287542,887,22,"CDC37, EGF, EGFR, ERBB3, ERBB4, ERBIN, GAB1, GRB2, HBEGF, HRAS, KRAS, NRAS, NRG1, NRG2, NRG3, NRG4, PIK3CA, PIK3R1, PLCG1"
"817","Signaling by ERBB4",0.329692556634304,0.356767101305936,-0.128331729464308,-0.900977397307646,1629,54,"YAP1, WWP1, WWOX, UBC, UBB, TAB2, STMN1, STAT5A, SRC, SPARC, SOS1, SHC1, S100B, RPS27A, PSENEN, PSEN2, PSEN1, PIK3R1, PIK3CA, PGR, NRG4, NRG3, NRG2, NRG1, NRAS, NEDD4, NCSTN, NCOR1, MXD4, KRAS, ITCH, HRAS, HBEGF, GRB2, UBA52, GFAP, GABRG3, GABRG2, GABRB3, GABRB2, GABRB1, GABRA1, ESR1, ERBB4, ERBB3, EGFR, EGF"
"818","Signaling by Erythropoietin",0.128920570264766,0.163466886291865,-0.232092559345701,-1.30738854035866,632,25,"VAV1, STAT5B, STAT5A, SOS1, SHC1, RAPGEF1, PLCG2, PLCG1, PIK3R5, PIK3R1, PIK3CG, PIK3CD, PIK3CB, PIK3CA, NRAS, LYN, KRAS, JAK2, IRS2, HRAS, GRB2, GAB1, EPOR, EPO"
"819","Signaling by FGFR",0.0408456486042693,0.0969897719784841,-0.266424711455067,-1.98284585400088,198,75,"UBC, UBB, TIAL1, TIA1, SRC, SPRY2, SPRED2, SPRED1, SOS1, SHC1, RPS27A, RBFOX2, PTPN11, PTBP1, PPP2R1A, PPP2CB, PPP2CA, POLR2L, POLR2K, POLR2J, POLR2I, POLR2H, POLR2G, POLR2F, POLR2E, POLR2D, POLR2C, POLR2B, POLR2A, PLCG1, PIK3R1, PIK3CA, NRAS, NCBP2, NCBP1, MKNK1, MAPK3, MAPK1, KRAS, KLB, KL, HRAS, HNRNPM, HNRNPH1, HNRNPF, HNRNPA1, GTF2F2, GTF2F1, GRB2, UBA52, GALNT3, GAB1, FRS3, FRS2, FLRT3, FLRT2, FGFRL1, FGFR4, FGFR3, FGFR2, FGFR1, FGFBP3, FGF9, FGF7, FGF5, FGF3, FGF23, FGF22, FGF20, FGF2, FGF10, FGF1"
"820","Signaling by FGFR in disease",0.0627697136131816,0.105904816647199,0.23209402863459,1.41523050969763,319,57,"BAG4, BCR, CNTRL, CPSF6, CUX1, ERLIN2, FGF1, FGF10, FGF2, FGF20, FGF22, FGF23, FGF3, FGF5, FGF7, FGF9, FGFR1, FGFR1OP, FGFR1OP2, FGFR2, FGFR3, FGFR4, FRS2, GAB1, GAB2, GRB2, GTF2F1, GTF2F2, HRAS, KRAS, LRRFIP1, MYO18A, NCBP1, NCBP2, NRAS, PIK3CA, PIK3R1, PLCG1, POLR2A, POLR2B, POLR2C, POLR2D, POLR2E, POLR2F, POLR2G, POLR2H, POLR2I, POLR2J, POLR2K, POLR2L"
"821","Signaling by FGFR1",0.0288934426229508,0.0969897719784841,-0.259326864869802,-1.71991831111182,140,43,"UBC, UBB, SRC, SPRY2, SPRED2, SPRED1, SOS1, SHC1, RPS27A, PTPN11, PPP2R1A, PPP2CB, PPP2CA, PLCG1, PIK3R1, PIK3CA, NRAS, MKNK1, MAPK3, MAPK1, KRAS, KL, HRAS, GRB2, UBA52, GAB1, FRS3, FRS2, FLRT3, FLRT2, FGFRL1, FGFR1, FGF9, FGF5, FGF3, FGF23, FGF22, FGF20, FGF2, FGF10, FGF1"
"822","Signaling by FGFR1 in disease",0.119773348964439,0.15469485889824,0.207854878478337,1.17985510307389,612,34,"BAG4, BCR, CNTRL, CPSF6, CUX1, ERLIN2, FGF1, FGF2, FGF20, FGF23, FGF5, FGF9, FGFR1, FGFR1OP, FGFR1OP2, FRS2, GAB1, GAB2"
"823","Signaling by FGFR2",0.0365853658536585,0.0969897719784841,-0.259325,-1.88137063218759,179,64,"UBC, UBB, TIAL1, TIA1, SRC, SPRY2, SOS1, SHC1, RPS27A, RBFOX2, PTPN11, PTBP1, PPP2R1A, PPP2CB, PPP2CA, POLR2L, POLR2K, POLR2J, POLR2I, POLR2H, POLR2G, POLR2F, POLR2E, POLR2D, POLR2C, POLR2B, POLR2A, PLCG1, PIK3R1, PIK3CA, NRAS, NCBP2, NCBP1, MKNK1, MAPK3, MAPK1, KRAS, HRAS, HNRNPM, HNRNPH1, HNRNPF, HNRNPA1, GTF2F2, GTF2F1, GRB2, UBA52, GAB1, FRS3, FRS2, FGFR2, FGFBP3, FGF9, FGF7, FGF5, FGF3, FGF23, FGF22, FGF20, FGF2, FGF10, FGF1"
"824","Signaling by FGFR2 IIIa TM",0.034618410700236,0.0969897719784841,0.354469923562645,1.70206058222709,175,19,"FGF1, FGF2, FGFR2, GTF2F1, GTF2F2, NCBP1, NCBP2, POLR2A, POLR2B, POLR2C, POLR2D, POLR2E, POLR2F, POLR2G, POLR2H, POLR2I, POLR2J, POLR2K, POLR2L"
"825","Signaling by FGFR2 in disease",0.0403744880046811,0.0969897719784841,0.327800949282283,1.90195521311542,206,37,"FGF1, FGF10, FGF2, FGF20, FGF22, FGF23, FGF3, FGF5, FGF7, FGF9, FGFR2, FRS2, GAB1, GRB2, GTF2F1, GTF2F2, HRAS, KRAS, NCBP1, NCBP2, NRAS, PIK3CA, PIK3R1, PLCG1, POLR2A, POLR2B, POLR2C, POLR2D, POLR2E, POLR2F, POLR2G, POLR2H, POLR2I, POLR2J, POLR2K, POLR2L"
"826","Signaling by FGFR3",0.0430857611817809,0.0969897719784841,-0.248532836516069,-1.54724222108193,209,35,"UBC, UBB, SRC, SPRY2, SOS1, SHC1, RPS27A, PTPN11, PPP2R1A, PPP2CB, PPP2CA, PLCG1, PIK3R1, PIK3CA, NRAS, MKNK1, MAPK3, MAPK1, KRAS, HRAS, GRB2, UBA52, GALNT3, GAB1, FRS3, FRS2, FGFR3, FGF9, FGF5, FGF23, FGF20, FGF2, FGF1"
"827","Signaling by FGFR3 in disease",0.0754046585076984,0.118039472942126,0.308691589881118,1.41895689130266,381,17,"FGF1, FGF2, FGF20, FGF23, FGF5, FGF9, FGFR3, FRS2, GAB1, GRB2, HRAS, KRAS, NRAS, PIK3CA, PIK3R1, PLCG1"
"828","Signaling by FGFR3 point mutants in cancer",0.0754046585076984,0.118039472942126,0.308691589881118,1.41895689130266,381,17,"FGF1, FGF2, FGF20, FGF23, FGF5, FGF9, FGFR3, FRS2, GAB1, GRB2, HRAS, KRAS, NRAS, PIK3CA, PIK3R1, PLCG1"
"829","Signaling by FGFR4",0.0479115479115479,0.0980844051158958,-0.246831826542992,-1.52171873556683,233,34,"UBC, UBB, SRC, SPRY2, SOS1, SHC1, RPS27A, PTPN11, PPP2R1A, PPP2CB, PPP2CA, PLCG1, PIK3R1, PIK3CA, NRAS, MKNK1, MAPK3, MAPK1, KRAS, KLB, HRAS, GRB2, UBA52, GAB1, FRS3, FRS2, FGFR4, FGF9, FGF23, FGF20, FGF2, FGF1"
"830","Signaling by Hedgehog",0.0688131313131313,0.111406640275225,-0.220507837802824,-1.57879005077501,326,124,"WDR35, WDR19, VCP, UBC, UBB, TULP3, TTC21B, SYVN1, SUFU, SPOPL, SPOP, SMURF2, SMURF1, SMO, SKP1, SHH, SEL1L, SCUBE2, RPS27A, RPGRIP1L, RBX1, PTCH2, PTCH1, PSMF1, PSME4, PSME3, PSME2, PSME1, PSMD9, PSMD8, PSMD7, PSMD6, PSMD5, PSMD4, PSMD3, PSMD2, PSMD14, PSMD13, PSMD12, PSMD11, PSMD10, PSMD1, PSMC6, PSMC5, PSMC4, PSMC3, PSMC2, PSMC1, PSMB7, PSMB6, PSMB5, PSMB4, PSMB3, PSMB2, PSMB10, PSMB1, PSMA8, PSMA7, PSMA6, PSMA5, PSMA4, PSMA3, PSMA1, PRKAR2B, PRKAR2A, PRKAR1B, PRKAR1A, PRKACB, PRKACA"
"831","Signaling by Hippo",0.0789957134109002,0.121287377326837,-0.281028981653815,-1.45584708368538,386,20,"YWHAE, YWHAB, YAP1, WWTR1, WWC1, TJP2, TJP1, STK4, STK3"
"832","Signaling by Insulin receptor",0.0712312549329124,0.11355549216717,0.302913318982204,1.81081821042474,360,67,"AKT2, ATP6AP1, ATP6V0A1, ATP6V0A2, ATP6V0A4, ATP6V0B, ATP6V0C, ATP6V0D1, ATP6V0E1, ATP6V0E2, ATP6V1A, ATP6V1B1, ATP6V1B2, ATP6V1C1, ATP6V1C2, ATP6V1D, ATP6V1E1, ATP6V1F, ATP6V1G1, ATP6V1G2, ATP6V1H, FGF1, FGF10, FGF2, FGF20, FGF22, FGF23, FGF3, FGF5, FGF7, FGF9, FGFR1, FGFR2, FGFR3, FGFR4, FLT3, FLT3LG, FRS2, GAB1, GAB2, GRB10, GRB2, HRAS, INS, INSR, IRS1, IRS2, KL, KLB, KRAS"
"833","Signaling by Interleukins",0.198892988929889,0.230308789183554,0.999592280511008,2.88408808928733,1077,348,"HAVCR2, AIP"
"834","Signaling by Ligand-Responsive EGFR Variants in Cancer",0.784313725490196,0.788099023393141,-0.146565347748386,-0.72609884668229,3879,18,"UBC, UBB, SOS1, SHC1, RPS27A, PLCG1, PIK3R1, PIK3CA, NRAS, KRAS, HRAS, GRB2, UBA52, GAB1, EGFR, EGF"
"835","Signaling by MET",0.0378048780487805,0.0969897719784841,-0.229116666666667,-1.66221292976528,185,64,"USP8, UBC, UBB, TNS4, TNS3, STAT3, STAM2, STAM, SRC, SPINT2, SPINT1, SOS1, SHC1, SH3KBP1, SH3GL3, SH3GL2, SH3GL1, RPS27A, RAPGEF1, RAP1B, RAP1A, RANBP9, RANBP10, RAC1, RAB4B, PTPRJ, PTPN2, PTPN11, PTPN1, PTK2, PIK3R1, PIK3CA, NRAS, MUC20, MET, LRIG1, LAMC3, LAMC2, LAMC1, LAMB3, LAMB2, LAMB1, LAMA5, LAMA4, LAMA3, LAMA2, KRAS, ITGB1, ITGA3, ITGA2, HRAS, HPN, HGS, HGF, GRB2, UBA52, GGA3, GAB1"
"836","Signaling by NODAL",0.256063618290258,0.283878835612523,0.24345427963849,1.09121309006395,1287,16,"ACVR1B, ACVR1C, ACVR2A, ACVR2B, GDF1, DAND5, DRAP1, FOXO3, FURIN"
"837","Signaling by NOTCH",0.0989429175475687,0.137018291359097,-0.136294675277833,-0.893944204806509,467,166,"YWHAZ, YBX1, WWP2, WWC1, UBC, UBB, TP53, TNRC6C, TNRC6B, TNRC6A, TMED2, TLE4, TLE3, TLE2, TLE1, TFDP2, TFDP1, TBL1XR1, TBL1X, TACC3, STAT1, ST3GAL6, ST3GAL4, ST3GAL3, SNW1, SMAD3, SKP1, SIRT6, SEL1L, RUNX1, RPS27A, RFNG, RBX1, RBPJ, RAB6A, PTCRA, PSMF1, PSME3, PSME2, PSME1, PSMD9, PSMD8, PSMD7, PSMD6, PSMD5, PSMD4, PSMD3, PSMD2, PSMD14, PSMD13, PSMD12, PSMD11, PSMD10, PSMD1, PSMC6, PSMC5, PSMC4, PSMC3, PSMC2, PSMC1, PSMB7, PSMB6, PSMB5, PSMB4, PSMB3, PSMB2, PSMB10, PSMB1, PSMA7, PSMA6, PSMA5, PSMA4, PSMA3, PSMA1, PSENEN, PSEN2, PSEN1"
"838","Signaling by NOTCH1",0.0807271305707584,0.122507249456719,0.198712450786893,1.17827061505946,412,71,"ADAM10, ADAM17, APH1A, APH1B, ARRB1, ARRB2, CCNC, CDK8, CNTN1, CREBBP, CUL1, DLK1, DLL1, DLL4, DNER, DTX1, DTX2, DTX4, EP300, FBXW7, UBA52, HDAC1, HDAC10, HDAC11, HDAC2, HDAC3, HDAC4, HDAC5, HDAC6, HDAC7, HDAC8, HDAC9, HES1, HES5, HEY1, HEY2, HIF1A, ITCH, JAG2, KAT2A, KAT2B, MAML1, MAML2, MAML3, MAMLD1, MIB1, MIB2, MYC, NCOR1, NCOR2, NCSTN, NEURL1, NEURL1B, NOTCH1, NUMB"
"839","Signaling by NOTCH1 HD+PEST Domain Mutants in Cancer",0.0646560220776661,0.107785306433194,0.222481343283582,1.35236011018018,327,56,"ADAM10, ADAM17, APH1A, APH1B, CCNC, CDK8, CREBBP, CUL1, DLL1, DLL4, EP300, FBXW7, UBA52, HDAC1, HDAC10, HDAC11, HDAC2, HDAC3, HDAC4, HDAC5, HDAC6, HDAC7, HDAC8, HDAC9, HES1, HES5, HEY1, HEY2, JAG2, KAT2A, KAT2B, MAML1, MAML2, MAML3, MAMLD1, MIB1, MIB2, MYC, NCOR1, NCOR2, NCSTN, NEURL1, NEURL1B, NOTCH1"
"840","Signaling by NOTCH1 PEST Domain Mutants in Cancer",0.0646560220776661,0.107785306433194,0.222481343283582,1.35236011018018,327,56,"ADAM10, ADAM17, APH1A, APH1B, CCNC, CDK8, CREBBP, CUL1, DLL1, DLL4, EP300, FBXW7, UBA52, HDAC1, HDAC10, HDAC11, HDAC2, HDAC3, HDAC4, HDAC5, HDAC6, HDAC7, HDAC8, HDAC9, HES1, HES5, HEY1, HEY2, JAG2, KAT2A, KAT2B, MAML1, MAML2, MAML3, MAMLD1, MIB1, MIB2, MYC, NCOR1, NCOR2, NCSTN, NEURL1, NEURL1B, NOTCH1"
"841","Signaling by NOTCH1 in Cancer",0.0646560220776661,0.107785306433194,0.222481343283582,1.35236011018018,327,56,"ADAM10, ADAM17, APH1A, APH1B, CCNC, CDK8, CREBBP, CUL1, DLL1, DLL4, EP300, FBXW7, UBA52, HDAC1, HDAC10, HDAC11, HDAC2, HDAC3, HDAC4, HDAC5, HDAC6, HDAC7, HDAC8, HDAC9, HES1, HES5, HEY1, HEY2, JAG2, KAT2A, KAT2B, MAML1, MAML2, MAML3, MAMLD1, MIB1, MIB2, MYC, NCOR1, NCOR2, NCSTN, NEURL1, NEURL1B, NOTCH1"
"842","Signaling by NOTCH2",0.10590074247753,0.141975450930675,0.217585816923896,1.219433532263,541,32,"ADAM10, APH1A, APH1B, CNTN1, CREB1, DLL1, DLL4, EP300, FCER2, UBA52, GZMB, HES1, HES5, JAG2, MAML1, MAML2, MAML3, MAMLD1, MDK, MIB1, MIB2, NCSTN, NEURL1, NEURL1B, NOTCH2"
