"","pathway","pval","padj","ES","NES","nMoreExtreme","size","leadingEdge"
"756","S37 mutants of beta-catenin aren't phosphorylated",0.0460579243765084,0.0610898840294159,0.344304707150557,1.60934663369956,228,15,"AMER1, APC, AXIN1, CSNK1A1, CTNNB1, GSK3B, PPP2CA, PPP2CB, PPP2R1A, PPP2R1B, PPP2R5A, PPP2R5B, PPP2R5C, PPP2R5D, PPP2R5E"
"757","S45 mutants of beta-catenin aren't phosphorylated",0.0460579243765084,0.0610898840294159,0.344304707150557,1.60934663369956,228,15,"AMER1, APC, AXIN1, CSNK1A1, CTNNB1, GSK3B, PPP2CA, PPP2CB, PPP2R1A, PPP2R1B, PPP2R5A, PPP2R5B, PPP2R5C, PPP2R5D, PPP2R5E"
"758","SCF(Skp2)-mediated degradation of p27/p21",0.000199004975124378,0.000551454923716307,-0.5018035816017,-4.31461611798457,0,53,"UBC, UBB, SKP2, SKP1, RPS27A, PSMF1, PSME3, PSME2, PSME1, PSMD9, PSMD8, PSMD7, PSMD6, PSMD5, PSMD4, PSMD3, PSMD2, PSMD14, PSMD13, PSMD12, PSMD11, PSMD10, PSMD1, PSMC6, PSMC5, PSMC4, PSMC3, PSMC2, PSMC1, PSMB8, PSMB7, PSMB6, PSMB5, PSMB4, PSMB3, PSMB2, PSMB10, PSMB1, PSMA7, PSMA6, PSMA5, PSMA4, PSMA3, PSMA1"
"759","SCF-beta-TrCP mediated degradation of Emi1",0.000198807157057654,0.000551454923716307,-0.588399846323777,-4.81906932333065,0,48,"UBC, UBB, SKP1, RPS27A, PSMF1, PSME4, PSME3, PSME2, PSME1, PSMD9, PSMD8, PSMD7, PSMD6, PSMD5, PSMD4, PSMD3, PSMD2, PSMD14, PSMD13, PSMD12, PSMD11, PSMD10, PSMD1, PSMC6, PSMC5, PSMC4, PSMC3, PSMC2, PSMC1, PSMB8, PSMB7, PSMB6, PSMB5, PSMB4, PSMB3, PSMB2, PSMB10, PSMB1, PSMA7, PSMA6, PSMA5, PSMA4, PSMA3, PSMA1"
"760","SHC-mediated cascade:FGFR1",0.0100180324584252,0.0162333667906858,0.379699899797481,1.88745033868666,49,17,"FGF1, FGF10, FGF2, FGF20, FGF22, FGF23, FGF4, FGF5, FGF9, FGFR1, GRB2, HRAS, KL, KRAS"
"761","SHC-mediated cascade:FGFR2",0.00560672807368843,0.00984431735327389,0.389543799118267,1.98959318975271,27,18,"FGF1, FGF10, FGF18, FGF2, FGF20, FGF22, FGF23, FGF4, FGF5, FGF7, FGF9, FGFR2, GRB2, HRAS, KRAS"
"762","SHC-mediated cascade:FGFR3",0.0317779565567176,0.0442279504953769,0.356090549766439,1.66443593612635,157,15,"FGF1, FGF18, FGF2, FGF20, FGF23, FGF4, FGF5, FGF9, FGFR3, GRB2, HRAS, KRAS"
"763","SHC-mediated cascade:FGFR4",0.0317779565567176,0.0442279504953769,0.356090549766439,1.66443593612635,157,15,"FGF1, FGF18, FGF2, FGF20, FGF23, FGF4, FGF9, FGFR4, GRB2, HRAS, KLB, KRAS"
"764","SHC1 events in ERBB2 signaling",0.120375924815037,0.1423282007147,-0.257296908698778,-1.38126941553817,601,20,"SOS1, SHC1, PTPN12, PRKCE, PRKCD, PRKCA, NRG4, NRG3, NRG2, NRG1, NRAS, KRAS, HRAS, HBEGF, GRB2, ERBB4, ERBB3, ERBB2, EGFR, EGF"
"765","SLC transporter disorders",0.000198807157057654,0.000551454923716307,-0.494098236214841,-4.80927880218159,0,69,"TPR, SLCO2A1, SLC9A9, SLC9A6, SLC7A7, SLC6A20, SLC6A19, SLC5A5, SLC4A4, SLC4A1, SLC3A2, SLC3A1, SLC35C1, SLC35A3, SLC35A2, SLC35A1, SLC33A1, SLC2A9, SLC2A2, SLC2A1, SLC29A3, SLC27A4, SLC26A4, SLC26A3, SLC26A2, SLC24A5, SLC24A4, SLC24A1, SLC22A5, SLC20A2, SLC1A3, SLC1A1, SLC17A5, SLC16A1, SLC12A6, SLC12A1, SLC11A2, SEH1L, SEC13, RANBP2, RAE1, POM121C, POM121, NUP42, NUP58, NUP98, NUP93, NUP88, NUP85, NUP54, NUP50, NUP43, NUP37, NUP35, NUP214, NUP210, NUP205, NUP188, NUP160, NUP155, NUP153, NUP133, NUP107"
"766","SLC-mediated transmembrane transport",0.000198333994446648,0.000551454923716307,-0.695919705333784,-11.0061982304623,0,186,"SRI, SLCO4C1, SLCO4A1, SLCO3A1, SLCO2B1, SLCO2A1, SLCO1C1, SLCO1A2, SLC9A9, SLC9A8, SLC9A7, SLC9A6, SLC9A5, SLC9A4, SLC9A3, SLC9A2, SLC9A1, SLC8B1, SLC8A3, SLC8A2, SLC8A1, SLC7A8, SLC7A7, SLC7A6, SLC7A5, SLC7A3, SLC7A11, SLC7A10, SLC7A1, SLC6A9, SLC6A7, SLC6A6, SLC6A20, SLC6A19, SLC6A15, SLC6A13, SLC6A12, SLC6A11, SLC6A1, SLC5A9, SLC5A6, SLC5A5, SLC5A4, SLC5A12, SLC5A11, SLC5A10, SLC50A1, SLC4A9, SLC4A8, SLC4A7, SLC4A5, SLC4A4, SLC4A3, SLC4A2, SLC4A10, SLC4A1, SLC47A1, SLC44A5, SLC44A2, SLC44A1, SLC43A2, SLC41A2, SLC41A1, SLC3A2, SLC3A1, SLC39A6, SLC39A3, SLC39A2, SLC39A14, SLC39A10, SLC39A1, SLC38A5, SLC38A3, SLC38A2, SLC38A1, SLC36A4, SLC36A1, SLC35D2, SLC35D1, SLC35C1, SLC35B4, SLC35B3, SLC35B2, SLC35A3, SLC35A2, SLC35A1, SLC33A1, SLC32A1, SLC31A1, SLC30A8, SLC30A7, SLC30A6, SLC30A5, SLC30A3, SLC30A10, SLC30A1, SLC2A9, SLC2A8, SLC2A7, SLC2A6, SLC2A2, SLC2A13, SLC2A12, SLC2A1, SLC29A4, SLC29A3, SLC29A2, SLC29A1, SLC28A3, SLC28A2, SLC27A4, SLC27A1, SLC26A6, SLC26A4, SLC26A3, SLC26A2, SLC26A11, SLC26A1, SLC25A5, SLC25A4, SLC25A29, SLC25A26, SLC25A22, SLC25A18, SLC24A5, SLC24A4, SLC24A3, SLC24A2, SLC24A1, SLC22A8, SLC22A7, SLC22A5, SLC22A4, SLC22A3, SLC22A2, SLC22A15, SLC22A1, SLC20A2, SLC20A1, SLC1A7, SLC1A6, SLC1A5, SLC1A4, SLC1A3, SLC1A2, SLC1A1, SLC18A2, SLC18A1, SLC17A7, SLC17A6, SLC17A5, SLC16A7, SLC16A3, SLC16A2, SLC16A10, SLC16A1, SLC15A4, SLC15A3, SLC15A2, SLC14A2, SLC14A1, SLC13A5, SLC13A4, SLC13A1, SLC12A6, SLC12A5, SLC12A2, SLC12A1, SLC11A2, SLC11A1"
"767","SMAD2/SMAD3:SMAD4 heterotrimer regulates transcription",0.0429423459244533,0.0577108775915933,-0.250738597322445,-1.60448858944167,215,29,"WWTR1, UBC, UBB, TGIF2, TFDP2, TFDP1, SP1, SNW1, SMAD7, SMAD4, SMAD3, SMAD2, SERPINE1, RPS27A, RNF111, RBL1"
"768","SRP-dependent cotranslational protein targeting to membrane",0.000197941409342835,0.000551454923716307,-0.667927175737607,-7.04778741571719,0,81,"TRAM1, SSR4, SSR3, SSR2, SSR1, SRPRB, SRPRA, SRP9, SRP72, SRP68, SRP54, SRP19, SRP14, SPCS2, SPCS1, SEC61G, SEC61B, SEC61A2, SEC61A1, SEC11C, SEC11A, RPSA, RPS9, RPS8, RPS7, RPS5, RPS4X, RPS3A, RPS28, RPS27L, RPS27A, RPS25, RPS24, RPS21, RPS20, RPS19, RPS17, RPS16, RPS15A, RPS15, RPS14, RPS13, RPS12, RPS11, RPN2, RPN1, RPLP1, RPL8, RPL7A, RPL6, RPL5, RPL4, RPL3L, RPL38, RPL37A, RPL36, RPL35, RPL34, RPL32, RPL30, RPL3, RPL29, RPL28, RPL27, RPL26, RPL23, RPL22L1, RPL19, RPL18A, RPL18, RPL14, RPL13A, RPL12, RPL11, RPL10A, RPL10"
"769","SUMO E3 ligases SUMOylate target proteins",0.000200440970134295,0.000551454923716307,-0.236787505834088,-3.33997917308005,0,148,"ZNF131, XRCC4, XPC, WRN, VDR, UHRF2, UBE2I, TP53BP1, TP53, TRIM28, TRIM27, TPR, TOPORS, TOP2B, TOP2A, TOP1, THRB, THRA, TDG, SUZ12, SUMO2, SUMO1, STAG2, STAG1, SP3, SMC6, SMC5, SMC3, SMC1A, SIN3A, SEH1L, SEC13, SCMH1, SATB2, SATB1, SAFB, RPA1, RORA, RNF2, RNF168, RING1, RELA, RARA, RANGAP1, RANBP2, RAE1, RAD52, RAD21, PPARGC1A, PPARG, PPARA, POM121C, POM121, PML, PIAS4, PIAS3, PIAS2, PIAS1, PHC3, PHC2, PHC1, PGR, PCNA, PCGF2, PARP1, PARK7, NUP42, NUP58, NUP98, NUP93, NUP88, NUP85, NUP54, NUP50, NUP43, NUP37, NUP35, NUP214, NUP210, NUP205, NUP188, NUP160, NUP155, NUP153, NUP133, NUP107, NSMCE2, NSMCE1, NRIP1, NR4A2, NR3C2, NR3C1, NR2C1, NR1H3, NR1H2, NOP58, NFKBIA, NFKB2, NDC1, NCOR2, NCOA2, NCOA1"
"770","SUMOylation",0.000198807157057654,0.000551454923716307,-0.249135518952592,-3.58549647866213,0,154,"ZNF131, XRCC4, XPC, WRN, VDR, UHRF2, UBE2I, UBA2, TP53BP1, TP53, TRIM28, TRIM27, TPR, TOPORS, TOP2B, TOP2A, TOP1, THRB, THRA, TDG, SUZ12, SUMO2, SUMO1, STAG2, STAG1, SP3, SMC6, SMC5, SMC3, SMC1A, SIN3A, SENP5, SENP2, SENP1, SEH1L, SEC13, SCMH1, SATB2, SATB1, SAFB, SAE1, RWDD3, RPA1, RORA, RNF2, RNF168, RING1, RELA, RARA, RANGAP1, RANBP2, RAE1, RAD52, RAD21, PPARGC1A, PPARG, PPARA, POM121C, POM121, PML, PIAS4, PIAS3, PIAS2, PIAS1, PHC3, PHC2, PHC1, PGR, PCNA, PCGF2, PARP1, PARK7, NUP42, NUP58, NUP98, NUP93, NUP88, NUP85, NUP54, NUP50, NUP43, NUP37, NUP35, NUP214, NUP210, NUP205, NUP188, NUP160, NUP155, NUP153, NUP133, NUP107, NSMCE2, NSMCE1, NRIP1, NR4A2, NR3C2, NR3C1, NR2C1, NR1H3, NR1H2, NOP58, NFKBIA, NFKB2, NDC1, NCOR2, NCOA2, NCOA1"
"771","SUMOylation of DNA damage response and repair proteins",0.000198333994446648,0.000551454923716307,-0.403896103896104,-3.96086147260946,0,70,"XRCC4, XPC, WRN, UBE2I, TPR, TDG, SUMO2, SUMO1, STAG2, STAG1, SMC6, SMC5, SMC3, SMC1A, SEH1L, SEC13, SCMH1, RPA1, RNF2, RNF168, RING1, RANBP2, RAE1, RAD52, RAD21, POM121C, POM121, PML, PIAS4, PIAS2, PIAS1, PHC3, PHC2, PHC1, PCGF2, PARP1, NUP42, NUP58, NUP98, NUP93, NUP88, NUP85, NUP54, NUP50, NUP43, NUP37, NUP35, NUP214, NUP210, NUP205, NUP188, NUP160, NUP155, NUP153, NUP133, NUP107, NSMCE2, NSMCE1"
"772","SUMOylation of DNA methylation proteins",0.497017892644135,0.513703132173389,-0.204527488321955,-0.958431589776584,2499,15,"UBE2I, SUMO1, SCMH1, RNF2, RING1, PHC3, PHC2, PHC1, PCGF2"
"773","SUMOylation of DNA replication proteins",0.000198452073824171,0.000551454923716307,-0.402128596006882,-3.19057518868875,0,45,"UBE2I, TPR, TOP2B, TOP2A, TOP1, SUMO2, SUMO1, SEH1L, SEC13, RANGAP1, RANBP2, RAE1, POM121C, POM121, PIAS4, PIAS3, PCNA, NUP42, NUP58, NUP98, NUP93, NUP88, NUP85, NUP54, NUP50, NUP43, NUP37, NUP35, NUP214, NUP210, NUP205, NUP188, NUP160, NUP155, NUP153, NUP133, NUP107"
"774","SUMOylation of RNA binding proteins",0.000198452073824171,0.000551454923716307,-0.413875885247869,-3.28378072034909,0,45,"UBE2I, TPR, SUMO2, SUMO1, SEH1L, SEC13, SCMH1, RNF2, RING1, RANBP2, RAE1, POM121C, POM121, PHC3, PHC2, PHC1, PCGF2, NUP42, NUP58, NUP98, NUP93, NUP88, NUP85, NUP54, NUP50, NUP43, NUP37, NUP35, NUP214, NUP210, NUP205, NUP188, NUP160, NUP155, NUP153, NUP133, NUP107, NOP58, NDC1"
"775","SUMOylation of SUMOylation proteins",0.000198728139904611,0.000551454923716307,-0.521055572488063,-3.61411291419444,0,34,"UBE2I, TPR, TOPORS, SUMO2, SUMO1, SEH1L, SEC13, RANBP2, RAE1, POM121C, POM121, PIAS4, NUP42, NUP58, NUP98, NUP93, NUP88, NUP85, NUP54, NUP50, NUP43, NUP37, NUP35, NUP214, NUP210, NUP205, NUP188, NUP160, NUP155, NUP153, NUP133, NUP107"
"776","SUMOylation of chromatin organization proteins",0.000198333994446648,0.000551454923716307,-0.357772012427533,-3.10233558663126,0,54,"UBE2I, TPR, SUZ12, SUMO2, SUMO1, SEH1L, SEC13, SCMH1, SATB2, SATB1, RNF2, RING1, RANBP2, RAE1, POM121C, POM121, PIAS2, PIAS1, PHC3, PHC2, PHC1, PCGF2, NUP42, NUP58, NUP98, NUP93, NUP88, NUP85, NUP54, NUP50, NUP43, NUP37, NUP35, NUP214, NUP210, NUP205, NUP188, NUP160, NUP155, NUP153, NUP133, NUP107"
"777","SUMOylation of intracellular receptors",0.000795070562512423,0.00183190058333232,-0.409795037756203,-2.44566115837523,3,25,"VDR, UBE2I, THRB, THRA, SUMO2, SUMO1, RORA, RARA, PPARG, PPARA, PIAS4, PIAS3, PIAS2, PIAS1, PGR, NR4A2, NR3C2, NR3C1, NR2C1, NR1H3, NR1H2"
"778","SUMOylation of transcription cofactors",0.116117506947201,0.138468764153001,-0.182044397303358,-1.38328871806755,584,41,"ZNF131, UHRF2, UBE2I, TRIM28, TOPORS, SUMO2, SUMO1, SIN3A, SCMH1, SAFB, RNF2, RING1, PPARGC1A, PIAS4, PIAS3, PIAS2, PIAS1, PHC3, PHC2, PHC1, PCGF2, PARK7, NRIP1, NCOR2, NCOA2, NCOA1, MRTFA"
"779","SUMOylation of transcription factors",0.0300198807157058,0.0420692397340097,-0.359013055455743,-1.68236287608125,150,15,"UBE2I, TP53BP1, TP53, SUMO2, SUMO1, SP3, PIAS4, PIAS3, PIAS2, PIAS1, MTA1, MITF, MDM2"
"780","SUMOylation of ubiquitinylation proteins",0.000197355437142293,0.000551454923716307,-0.498851258946271,-3.60878525162193,0,37,"UBE2I, TRIM27, TPR, SUMO1, SEH1L, SEC13, RANBP2, RAE1, POM121C, POM121, PML, PIAS4, PIAS2, PIAS1, NUP42, NUP58, NUP98, NUP93, NUP88, NUP85, NUP54, NUP50, NUP43, NUP37, NUP35, NUP214, NUP210, NUP205, NUP188, NUP160, NUP155, NUP153, NUP133, NUP107"
"781","Selective autophagy",0.278825163722961,0.302656374297573,-0.138544979262507,-1.1487435088885,1404,49,"VDAC1, VCP, ULK1, UBE2N, UBC, UBB, TOMM70, TOMM7, TOMM40, TOMM22, TOMM20, SRC, SQSTM1, RPS27A, PRKAG3, PRKAG2, PRKAG1, PRKAB2, PRKAB1, PRKAA2, PLIN3, PLIN2, PINK1, PGAM5, PCNT, PARK7, MTERF3, MFN2, MFN1, MAP1LC3A, IFT88, HSPA8, HSF1, HDAC6, UBA52, FUNDC1, DYNLL2, DYNLL1, DYNC1LI2, DYNC1LI1, DYNC1I2, DYNC1I1, DYNC1H1, CSNK2B, CSNK2A2, CSNK2A1"
"782","Selenoamino acid metabolism",0.000198886237072395,0.000551454923716307,-0.501806808613016,-5.09216395652887,0,75,"TXNRD1, SEPSECS, SEPHS2, SECISBP2, SCLY, RPSA, RPS9, RPS8, RPS7, RPS5, RPS4X, RPS3A, RPS28, RPS27L, RPS27A, RPS25, RPS24, RPS21, RPS20, RPS19, RPS17, RPS16, RPS15A, RPS15, RPS14, RPS13, RPS12, RPS11, RPLP1, RPL8, RPL7A, RPL6, RPL5, RPL4, RPL3L, RPL38, RPL37A, RPL36, RPL35, RPL34, RPL32, RPL30, RPL3, RPL29, RPL28, RPL27, RPL26, RPL23, RPL22L1, RPL19, RPL18A, RPL18, RPL14, RPL13A, RPL12, RPL11, RPL10A, RPL10"
"783","Selenocysteine synthesis",0.000198649185538339,0.000551454923716307,-0.646636146896782,-5.94758513713144,0,61,"SEPSECS, SEPHS2, SECISBP2, RPSA, RPS9, RPS8, RPS7, RPS5, RPS4X, RPS3A, RPS28, RPS27L, RPS27A, RPS25, RPS24, RPS21, RPS20, RPS19, RPS17, RPS16, RPS15A, RPS15, RPS14, RPS13, RPS12, RPS11, RPLP1, RPL8, RPL7A, RPL6, RPL5, RPL4, RPL3L, RPL38, RPL37A, RPL36, RPL35, RPL34, RPL32, RPL30, RPL3, RPL29, RPL28, RPL27, RPL26, RPL23, RPL22L1, RPL19, RPL18A, RPL18, RPL14, RPL13A, RPL12, RPL11, RPL10A, RPL10"
"784","Sema3A PAK dependent Axon repulsion",0.271520514883347,0.295675073013376,0.246784045993532,1.15351624715598,1349,15,"CFL1, FES, FYN, HSP90AB1, LIMK1, NRP1, PAK1, PAK2, PAK3, PLXNA1, PLXNA2, PLXNA3, PLXNA4, RAC1, SEMA3A"
"785","Sema4D in semaphorin signaling",0.0594691678307723,0.0773632196108382,-0.274394070123147,-1.53630386856405,297,22,"SEMA4D, RRAS, ROCK2, ROCK1, RND1, RHOC, RHOB, RHOA, RAC1, PLXNB1, MYL9, MYL12B, MYH9, MYH14, MYH11, MYH10, LIMK2, LIMK1"
"786","Sema4D induced cell migration and growth-cone collapse",0.0552208835341365,0.0722995073075808,-0.298291015440261,-1.56067035617897,274,19,"SEMA4D, ROCK2, ROCK1, RND1, RHOC, RHOB, RHOA, PLXNB1, MYL9, MYL12B, MYH9, MYH14, MYH11, MYH10, LIMK2, LIMK1"
"787","Semaphorin interactions",0.0227642276422764,0.0332783529274142,0.195277551384488,1.76388582178848,111,59,"ARHGAP35, ARHGEF11, ARHGEF12, CD72, CDK5, CDK5R1, CFL1, CRMP1, DPYSL2, DPYSL3, DPYSL4, DPYSL5, ERBB2, FARP2, FES, FYN, GSK3B, HSP90AB1, ITGA1, ITGB1, LIMK1, LIMK2, MYH10, MYH11, MYH14, MYH9, MYL12B, MYL9, NRP1, PAK1, PAK2, PAK3, PIP5K1C, PLXNA1, PLXNA2, PLXNA3, PLXNA4, PLXNB1, PLXNC1, PTPRC, RAC1, RHOA, RHOB, RHOC, RND1, ROCK1, ROCK2, RRAS, SEMA3A, SEMA3E, SEMA4A, SEMA4D, SEMA5A, SEMA6A, SEMA6D, SEMA7A"
"788","Senescence-Associated Secretory Phenotype (SASP)",0.00040290088638195,0.00100512455234364,0.313295835096734,2.38325004724826,1,41,"ANAPC1, ANAPC10, ANAPC15, ANAPC16, ANAPC2, ANAPC4, ANAPC5, ANAPC7, CCNA2, CDC16, CDC23, CDC26, CDC27, CDK2, CDK4, CDK6, CDKN1B, CDKN2D, CEBPB"
"789","Separation of Sister Chromatids",0.0001998001998002,0.000551454923716307,-0.197557139313867,-2.73514972357842,0,143,"ZWINT, ZWILCH, ZW10, XPO1, WAPL, UBE2E1, UBE2D1, UBC, UBB, TAOK1, STAG2, STAG1, SPC25, SMC3, SMC1A, SKA2, SGO2, SEH1L, SEC13, RPS27A, RCC2, RANGAP1, RANBP2, RAD21, PTTG1, PSMF1, PSME4, PSME3, PSME2, PSME1, PSMD9, PSMD8, PSMD7, PSMD6, PSMD5, PSMD4, PSMD3, PSMD2, PSMD14, PSMD13, PSMD12, PSMD11, PSMD10, PSMD1, PSMC6, PSMC5, PSMC4, PSMC3, PSMC2, PSMC1, PSMB8, PSMB7, PSMB6, PSMB5, PSMB4, PSMB3, PSMB2, PSMB10, PSMB1, PSMA7, PSMA6, PSMA5, PSMA4, PSMA3, PSMA1, PPP2R5E, PPP2R5D, PPP2R5C, PPP2R5B, PPP2R5A, PPP2R1B, PPP2R1A, PPP2CB, PPP2CA, PPP1CC, PMF1, PDS5B, PDS5A, PAFAH1B1, NUP98, NUP85, NUP43, NUP37, NUP160, NUP133, NUP107, NUF2, NUDC, NSL1"
"790","Serotonin Neurotransmitter Release Cycle",0.000199680511182109,0.000551454923716307,-0.594674461695738,-3.03493416006753,0,18,"VAMP2, UNC13B, TSPOAP1, SYT1, SYN3, SYN2, SYN1, STXBP1, STX1A, SNAP25, SLC18A2, RIMS1, RAB3A, PPFIA4, PPFIA3, PPFIA2, PPFIA1"
"791","Sialic acid metabolism",0.00019952114924182,0.000551454923716307,-0.47568345323741,-3.08689685397266,0,30,"ST8SIA6, ST8SIA5, ST8SIA4, ST8SIA3, ST8SIA2, ST8SIA1, ST6GALNAC6, ST6GALNAC5, ST6GALNAC4, ST6GALNAC3, ST6GALNAC2, ST6GAL2, ST6GAL1, ST3GAL6, ST3GAL5, ST3GAL4, ST3GAL3, ST3GAL2, ST3GAL1, SLC35A1, SLC17A5"
"792","Signal amplification",0.000801442596674013,0.00183190058333232,0.422065782937224,2.36816412788711,3,22,"GNA11, GNA13, GNA14, GNA15, GNAI1, GNAI2, GNAI3, GNB1, GNB4, GNB5, GNG12, GNG13, GNG2, GNG3, GNG4, GNG7, GNGT2"
"793","Signal transduction by L1",0.026080031853474,0.037320158257929,0.308744937330745,1.69929352844954,130,21,"CSNK2A1, CSNK2A2, CSNK2B, EGFR, FGFR1, ITGA2B, ITGA5, ITGA9, ITGAV, ITGB1, ITGB3, L1CAM, MAP2K1, MAP2K2, MAPK1, MAPK3, NCAM1, NRP1, PAK1"
"794","Signaling by BMP",0.0869826034793041,0.107250394581278,-0.272034507548526,-1.46038655166148,434,20,"UBE2D3, UBE2D1, SMURF2, SMURF1, SMAD7, SMAD6, SMAD5, SMAD4, SMAD1, SKI"
"795","Signaling by BRAF and RAF fusions",0.0176256077795786,0.0267277873194804,0.20600819000819,1.80055826190534,86,55,"AGGF1, AGK, AGTRAP, AKAP9, AP3B1, APBB1IP, ARAF, ARRB1, ARRB2, ATG7, BCL2L11, BRAF, CALM1, CAMK2A, CAMK2B, CAMK2G, CLCN6, CNKSR2, CSK, FAM114A2, FAM131B, FN1, FXR1, HRAS, IQGAP1, ITGA2B, ITGB3, JAK2, KDM7A, KRAS, KSR1, KSR2, LMNA, MAP2K1, MAP2K2, MAPK1, MAPK3, MARK3"
"796","Signaling by EGFR",0.432007952286282,0.452327932465503,-0.125540190146932,-1.00617266714052,2172,46,"UBC, UBB, TGFA, STAM2, STAM, SRC, SPRY2, SPRY1, SOS1, SHC1, SH3KBP1, SH3GL3, SH3GL2, SH3GL1, RPS27A, PXN, PTPRK, PTPN3, PTPN12, PTPN11, PLCG1, PIK3R1, PIK3CA"
"797","Signaling by EGFR in Cancer",0.922072705362523,0.924803424134574,-0.114242576748868,-0.625572838989478,4590,21,"UBC, UBB, TGFA, SOS1, SHC1, RPS27A, PLCG1, PIK3R1, PIK3CA, NRAS, KRAS, HRAS, HBEGF, GRB2, UBA52, GAB1, EGFR, EGF"
"798","Signaling by ERBB2",0.459615002976781,0.478451683426649,-0.123994718521186,-0.983800894466534,2315,45,"YES1, USP8, UBC, UBB, STUB1, SRC, SOS1, SHC1, RPS27A, RNF41, RHOA, PTPN18, PTPN12, PRKCE, PRKCD, PRKCA, PLCG1, PIK3R1, PIK3CA, NRG4, NRG3, NRG2, NRG1, NRAS, MEMO1, MATK, KRAS, HRAS, HBEGF, GRB2, UBA52, GAB1, FYN, ERBIN, ERBB4, ERBB3, ERBB2, EGFR, EGF"
"799","Signaling by ERBB2 KD Mutants",0.0557002604688439,0.0728332878202644,0.276936753209402,1.55386129640738,277,22,"CDC37, EGF, EGFR, ERBB2, ERBB3, ERBB4, ERBIN, GAB1, GRB2, HBEGF, HRAS, KRAS, NRAS, NRG1, NRG2, NRG3, NRG4, PIK3CA, PIK3R1, PLCG1"
"800","Signaling by ERBB2 in Cancer",0.127327327327327,0.149901001812937,0.237365605684969,1.36029165607636,635,23,"CDC37, EGF, EGFR, ERBB2, ERBB3, ERBB4, ERBIN, GAB1, GRB2, HBEGF, HRAS, KRAS, NRAS, NRG1, NRG2, NRG3, NRG4, PIK3CA, PIK3R1, PLCG1"
"801","Signaling by ERBB4",0.375445544554455,0.398113369164045,-0.122770405844336,-1.04784298519711,1895,52,"YAP1, WWP1, WWOX, UBC, UBB, TAB2, STMN1, SRC, SOS1, SHC1, S100B, RPS27A, PSENEN, PSEN2, PSEN1, PIK3R1, PIK3CA, PGR, NRG4, NRG3, NRG2, NRG1, NRAS, NEDD4, NCSTN, NCOR1, MXD4, KRAS, ITCH, HRAS, HBEGF, GRB2, UBA52, GFAP, GABRG3, GABRG2, GABRB3, GABRB2, GABRB1, GABRA1, ESR1, ERBB4, ERBB3, EGFR, EGF"
"802","Signaling by Erythropoietin",0.135311572700297,0.157656603054474,-0.23023035620116,-1.34818307626836,683,24,"VAV1, STAT5B, SOS1, SHC1, RAPGEF1, PLCG2, PLCG1, PIK3R5, PIK3R1, PIK3CG, PIK3CD, PIK3CB, PIK3CA, NRAS, LYN, KRAS, JAK2, IRS2, HRAS, GRB2, GAB1, EPOR, EPO"
"803","Signaling by FGFR",0.000198886237072395,0.000551454923716307,-0.277988692409479,-2.82093422311812,0,75,"UBC, UBB, TIAL1, TIA1, SRC, SPRY2, SPRED2, SPRED1, SOS1, SHC1, RPS27A, RBFOX2, PTPN11, PTBP1, PPP2R1A, PPP2CB, PPP2CA, POLR2L, POLR2K, POLR2J, POLR2I, POLR2H, POLR2G, POLR2F, POLR2E, POLR2D, POLR2C, POLR2B, POLR2A, PLCG1, PIK3R1, PIK3CA, NRAS, NCBP2, NCBP1, MKNK1, MAPK3, MAPK1, KRAS, KLB, KL, HRAS, HNRNPM, HNRNPH1, HNRNPF, HNRNPA1, GTF2F2, GTF2F1, GRB2, UBA52, GALNT3, GAB1, FRS3, FRS2, FLRT3, FLRT2, FGFRL1, FGFR4, FGFR3, FGFR2, FGFR1, FGFBP3, FGF9, FGF7, FGF5, FGF4, FGF23, FGF22, FGF20, FGF2, FGF18, FGF10, FGF1"
"804","Signaling by FGFR in disease",0.0016116035455278,0.00337306758252977,0.250103381426246,2.22962065979177,7,57,"BAG4, BCR, CNTRL, CPSF6, CUX1, ERLIN2, FGF1, FGF10, FGF18, FGF2, FGF20, FGF22, FGF23, FGF4, FGF5, FGF7, FGF9, FGFR1, FGFR1OP, FGFR1OP2, FGFR2, FGFR3, FGFR4, FRS2, GAB1, GAB2, GRB2, GTF2F1, GTF2F2, HRAS, KRAS, LRRFIP1, MYO18A, NCBP1, NCBP2, NRAS, PIK3CA, PIK3R1, PLCG1, POLR2A, POLR2B, POLR2C, POLR2D, POLR2E, POLR2F, POLR2G, POLR2H, POLR2I, POLR2J, POLR2K, POLR2L"
"805","Signaling by FGFR1",0.00517825134435371,0.00923000590502346,-0.258520681392639,-2.0257668804884,25,44,"UBC, UBB, SRC, SPRY2, SPRED2, SPRED1, SOS1, SHC1, RPS27A, PTPN11, PPP2R1A, PPP2CB, PPP2CA, PLCG1, PIK3R1, PIK3CA, NRAS, MKNK1, MAPK3, MAPK1, KRAS, KL, HRAS, GRB2, UBA52, GAB1, FRS3, FRS2, FLRT3, FLRT2, FGFRL1, FGFR1, FGF9, FGF5, FGF4, FGF23, FGF22, FGF20, FGF2, FGF18, FGF10, FGF1"
"806","Signaling by FGFR1 in disease",0.03420523138833,0.0472180911556294,0.238875342883267,1.65521837573243,169,34,"BAG4, BCR, CNTRL, CPSF6, CUX1, ERLIN2, FGF1, FGF2, FGF20, FGF23, FGF4, FGF5, FGF9, FGFR1, FGFR1OP, FGFR1OP2, FRS2, GAB1, GAB2"
"807","Signaling by FGFR2",0.000198649185538339,0.000551454923716307,-0.273163673734314,-2.57056945323166,0,64,"UBC, UBB, TIAL1, TIA1, SRC, SPRY2, SOS1, SHC1, RPS27A, RBFOX2, PTPN11, PTBP1, PPP2R1A, PPP2CB, PPP2CA, POLR2L, POLR2K, POLR2J, POLR2I, POLR2H, POLR2G, POLR2F, POLR2E, POLR2D, POLR2C, POLR2B, POLR2A, PLCG1, PIK3R1, PIK3CA, NRAS, NCBP2, NCBP1, MKNK1, MAPK3, MAPK1, KRAS, HRAS, HNRNPM, HNRNPH1, HNRNPF, HNRNPA1, GTF2F2, GTF2F1, GRB2, UBA52, GAB1, FRS3, FRS2, FGFR2, FGFBP3, FGF9, FGF7, FGF5, FGF4, FGF23, FGF22, FGF20, FGF2, FGF18, FGF10, FGF1"
"808","Signaling by FGFR2 IIIa TM",0.00975706889685384,0.0159120096295401,0.35482711523255,1.86328861488327,48,19,"FGF1, FGF2, FGFR2, GTF2F1, GTF2F2, NCBP1, NCBP2, POLR2A, POLR2B, POLR2C, POLR2D, POLR2E, POLR2F, POLR2G, POLR2H, POLR2I, POLR2J, POLR2K, POLR2L"
"809","Signaling by FGFR2 in disease",0.000804990943851882,0.00183190058333232,0.328924636670859,2.40283498308859,3,38,"FGF1, FGF10, FGF18, FGF2, FGF20, FGF22, FGF23, FGF4, FGF5, FGF7, FGF9, FGFR2, FRS2, GAB1, GRB2, GTF2F1, GTF2F2, HRAS, KRAS, NCBP1, NCBP2, NRAS, PIK3CA, PIK3R1, PLCG1, POLR2A, POLR2B, POLR2C, POLR2D, POLR2E, POLR2F, POLR2G, POLR2H, POLR2I, POLR2J, POLR2K, POLR2L"
"810","Signaling by FGFR3",0.0169725675942372,0.0257759770937893,-0.24976801461362,-1.80686950528796,85,37,"UBC, UBB, SRC, SPRY2, SOS1, SHC1, RPS27A, PTPN11, PPP2R1A, PPP2CB, PPP2CA, PLCG1, PIK3R1, PIK3CA, NRAS, MKNK1, MAPK3, MAPK1, KRAS, HRAS, GRB2, UBA52, GALNT3, GAB1, FRS3, FRS2, FGFR3, FGF9, FGF5, FGF4, FGF23, FGF20, FGF2, FGF18, FGF1"
"811","Signaling by FGFR3 in disease",0.0360414177618479,0.0494171126127361,0.315206822317817,1.65523224732529,180,19,"FGF1, FGF18, FGF2, FGF20, FGF23, FGF4, FGF5, FGF9, FGFR3, FRS2, GAB1, GRB2, HRAS, KRAS, NRAS, PIK3CA, PIK3R1, PLCG1"
"812","Signaling by FGFR3 point mutants in cancer",0.0360414177618479,0.0494171126127361,0.315206822317817,1.65523224732529,180,19,"FGF1, FGF18, FGF2, FGF20, FGF23, FGF4, FGF5, FGF9, FGFR3, FRS2, GAB1, GRB2, HRAS, KRAS, NRAS, PIK3CA, PIK3R1, PLCG1"
"813","Signaling by FGFR4",0.0199132492113565,0.0296654856286483,-0.248244645970283,-1.77347411641924,100,36,"UBC, UBB, SRC, SPRY2, SOS1, SHC1, RPS27A, PTPN11, PPP2R1A, PPP2CB, PPP2CA, PLCG1, PIK3R1, PIK3CA, NRAS, MKNK1, MAPK3, MAPK1, KRAS, KLB, HRAS, GRB2, UBA52, GAB1, FRS3, FRS2, FGFR4, FGF9, FGF4, FGF23, FGF20, FGF2, FGF18, FGF1"
"814","Signaling by Hedgehog",0.000198925800676348,0.000551454923716307,-0.214803332126041,-2.79991659408452,0,125,"WDR35, WDR19, VCP, UBC, UBB, TULP3, TTC21B, SYVN1, SUFU, SPOPL, SPOP, SMURF2, SMURF1, SMO, SKP1, SHH, SEL1L, SCUBE2, RPS27A, RPGRIP1L, RBX1, PTCH2, PTCH1, PSMF1, PSME4, PSME3, PSME2, PSME1, PSMD9, PSMD8, PSMD7, PSMD6, PSMD5, PSMD4, PSMD3, PSMD2, PSMD14, PSMD13, PSMD12, PSMD11, PSMD10, PSMD1, PSMC6, PSMC5, PSMC4, PSMC3, PSMC2, PSMC1, PSMB8, PSMB7, PSMB6, PSMB5, PSMB4, PSMB3, PSMB2, PSMB10, PSMB1, PSMA7, PSMA6, PSMA5, PSMA4, PSMA3, PSMA1, PRKAR2B, PRKAR2A, PRKAR1B, PRKAR1A, PRKACB, PRKACA"
"815","Signaling by Hippo",0.0703859228154369,0.0891672039656907,-0.279834651329978,-1.50226074321943,351,20,"YWHAE, YWHAB, YAP1, WWTR1, WWC1, TJP2, TJP1, STK4, STK3"
"816","Signaling by Insulin receptor",0.000202020202020202,0.000551454923716307,0.318432722774356,3.05419868060492,0,67,"AKT2, ATP6AP1, ATP6V0A1, ATP6V0A2, ATP6V0A4, ATP6V0B, ATP6V0C, ATP6V0D1, ATP6V0E1, ATP6V0E2, ATP6V1A, ATP6V1B1, ATP6V1B2, ATP6V1C1, ATP6V1C2, ATP6V1D, ATP6V1E1, ATP6V1F, ATP6V1G1, ATP6V1G2, ATP6V1H, FGF1, FGF10, FGF18, FGF2, FGF20, FGF22, FGF23, FGF4, FGF5, FGF7, FGF9, FGFR1, FGFR2, FGFR3, FGFR4, FLT3, FLT3LG, FRS2, GAB1, GAB2, GRB10, GRB2, HRAS, INS, INSR, IRS1, IRS2, KL, KLB, KRAS"
"817","Signaling by Interleukins",0.000196463654223969,0.000551454923716307,-0.170530257246196,-3.48710866388606,0,318,"ZEB1, YWHAZ, YES1, VRK3, VEGFA, VCAM1, VAV1, VAMP7, VAMP2, UBE2N, UBC, UBB, TYK2, TXLNA, TWIST1, TP53, TRAF6, TOLLIP, TNIP2, TNFRSF1B, TNFRSF1A, TIMP1, TEC, TCP1, TBK1, TALDO1, TAB3, TAB2, TAB1, SYK, STXBP2, STX4, STX3, STX1A, STAT6, STAT5B, STAT4, STAT3, STAT2, STAT1, SQSTM1, SOS2, SOS1, SOD2, SOD1, SOCS5, SOCS3, SOCS2, SOCS1, SNRPA1, SNAP25, SMARCA4, SMAD3, SKP1, SHC1, S1PR1, S100B, RPS6KA5, RPS6KA3, RPS6KA2, RPS6KA1, RPS27A, RORC, RORA, RIPK2, RELA, RBX1, RAPGEF1, RAP1B, RALA, PTPRZ1, PTPN9, PTPN6, PTPN5, PTPN4, PTPN23, PTPN20, PTPN2, PTPN18, PTPN14, PTPN13, PTPN12, PTPN11, PTK2B, PTGS2, PSMF1, PSME4, PSME3, PSME2, PSME1, PSMD9, PSMD8, PSMD7, PSMD6, PSMD5, PSMD4, PSMD3, PSMD2, PSMD14, PSMD13, PSMD12, PSMD11, PSMD10, PSMD1, PSMC6, PSMC5, PSMC4, PSMC3, PSMC2, PSMC1, PSMB8, PSMB7, PSMB6, PSMB5, PSMB4, PSMB3, PSMB2, PSMB10, PSMB1, PSMA7, PSMA6, PSMA5, PSMA4, PSMA3, PSMA1, PRTN3, PRKACA, PPP2R5D, PPP2R1B, PPP2R1A, PPP2CB, PPP2CA, PPIA, POU2F1, PITPNA, PIM1, PIK3R3, PIK3R2, PIK3R1, PIK3CD, PIK3CB, PIK3CA, PELI3, PELI2, PELI1, PDCD4, PAK2, P4HB, OPRM1, OPRD1, NOD1, NKIRAS2, NKIRAS1, NFKBIB, NFKBIA, NFKB2, NFKB1, NDN, NANOG, MYC, MTAP, MSN, MMP9, MMP2, MMP1, MIF, MEF2C, MEF2A, MCL1, MAPKAPK3, MAPKAPK2, MAPK9, MAPK8, MAPK7, MAPK3, MAPK14, MAPK11, MAPK10, MAPK1, MAP3K8, MAP3K7, MAP3K3, MAP2K6, MAP2K4, MAP2K3, MAP2K1, MAOA, LYN, LMNB1, LIFR, LCP1, LCK, LBP, LAMA5, JUNB, JUN, JAK3, JAK2, JAK1, ITGB1, IRS2, IRS1, IRAK3, IRAK2, IRAK1, INPPL1, INPP5D, IL6ST, IL6R, IL5RA, IL5, IL4, IL34, IL33, IL31RA, IL2RA, IL27RA, IL27, IL23R, IL20RB, IL2, IL1RL1, IL1RAPL1, IL1RAP, IL1R2, IL18R1, IL18BP, IL18, IL17RE, IL17RB, IL17RA, IL16, IL15RA, IL13RA1, IL12RB2, IL12B, IL11RA, IL11, IL10RB, IKBKG, IKBKB, ICAM1, HSPA9, HSPA8, HSP90B1, HNRNPF, HNRNPA2B1, HMOX1, HIF1A, HGF"
"818","Signaling by Ligand-Responsive EGFR Variants in Cancer",0.78594249201278,0.793755041635173,-0.146005047600792,-0.745139963203344,3935,18,"UBC, UBB, SOS1, SHC1, RPS27A, PLCG1, PIK3R1, PIK3CA, NRAS, KRAS, HRAS, GRB2, UBA52, GAB1, EGFR, EGF"
