"","pathway","pval","padj","ES","NES","nMoreExtreme","size","leadingEdge"
"1","A tetrasaccharide linker sequence is required for GAG synthesis",0.01138147566719,0.673372198452951,-0.999601408357138,-2.75156028657155,57,23,"GPC6"
"2","ABC transporter disorders",0.57768691588785,0.723883666382134,-0.360983897386317,-0.609223840187122,2966,71,"VCP, UBC, UBB, SEL1L, RPS27A, RNF5, RNF185, PSMF1, PSME4, PSME3, PSME2, PSME1, PSMD9, PSMD8, PSMD7, PSMD6, PSMD5, PSMD4, PSMD3, PSMD2, PSMD14, PSMD13, PSMD12, PSMD11, PSMD10, PSMD1, PSMC6, PSMC5, PSMC4, PSMC3, PSMC2, PSMC1, PSMB9, PSMB8, PSMB7, PSMB6, PSMB5, PSMB4, PSMB3, PSMB2, PSMB10, PSMB1, PSMA8, PSMA7, PSMA6, PSMA5, PSMA4, PSMA3, PSMA1"
"3","ABC transporters in lipid homeostasis",0.163310511478051,0.673372198452951,0.81105577689243,2.40893209448959,810,16,"ABCA12, ABCA2, ABCA3, ABCA5, ABCA6, ABCA7, ABCA9, ABCD1, ABCD2, ABCD3, ABCG1, ABCG4, ABCG5, APOA1"
"4","ABC-family proteins mediated transport",0.675036314588089,0.756555530544701,0.289020583565527,0.441539549514447,3252,94,"ABCA12, ABCA2, ABCA3, ABCA4, ABCA5, ABCA6, ABCA7, ABCA8, ABCA9, ABCB10, ABCB1, ABCB4, ABCB6, ABCB7, ABCB8, ABCB9, ABCC1, ABCC10, ABCC2, ABCC3, ABCC4, ABCC5, ABCD1, ABCD2, ABCD3, ABCF1, ABCG1, ABCG4, ABCG5"
"5","ADP signalling through P2Y purinoceptor 1",0.216515609264854,0.673372198452951,0.504967500118613,1.42771267578174,1074,21,"GNA11, GNA14, GNA15, GNB1, GNB2, GNB3, GNB4, GNB5, GNG10, GNG11, GNG12, GNG13, GNG2, GNG3, GNG4, GNG7, GNG8, GNGT2"
"6","ADP signalling through P2Y purinoceptor 12",0.193832599118943,0.673372198452951,0.595239842982631,1.72790380972999,967,19,"GNAI1, GNAI2, GNAI3, GNB1, GNB2, GNB3, GNB4, GNB5, GNG10, GNG11, GNG12, GNG13, GNG2, GNG3, GNG4, GNG7, GNG8, GNGT2"
"7","APC-Cdc20 mediated degradation of Nek2A",0.215911379657603,0.673372198452951,0.517480349828407,1.4630907033511,1071,21,"ANAPC1, ANAPC10, ANAPC15, ANAPC16, ANAPC2, ANAPC4, ANAPC5, ANAPC7, BUB3, CDC16, CDC20, CDC23, CDC26, CDC27"
"8","APC/C-mediated degradation of cell cycle proteins",0.310408921933086,0.673372198452951,0.995866666666667,1.67125428452088,1502,76,"PTTG1, ANAPC1"
"9","APC/C:Cdc20 mediated degradation of Cyclin B",0.204431017119839,0.673372198452951,0.550823591923486,1.5796076047753,1014,20,"ANAPC1, ANAPC10, ANAPC15, ANAPC16, ANAPC2, ANAPC4, ANAPC5, ANAPC7, CCNB1, CDC16, CDC20, CDC23, CDC26, CDC27"
"10","APC/C:Cdc20 mediated degradation of Securin",0.291299897645855,0.673372198452951,0.995870520847209,1.81855894388578,1422,62,"PTTG1, ANAPC1"
"11","APC/C:Cdc20 mediated degradation of mitotic proteins",0.300245098039216,0.673372198452951,0.995869145179559,1.7670174393872,1469,67,"PTTG1, ANAPC1"
"12","APC/C:Cdh1 mediated degradation of Cdc20 and other APC/C:Cdh1 targeted proteins in late mitosis/early G1",0.299363057324841,0.673372198452951,0.995869420386409,1.7708585224611,1456,66,"PTTG1, ANAPC1"
"13","APC:Cdc20 mediated degradation of cell cycle proteins prior to satisfation of the cell cycle checkpoint",0.547907704341025,0.716215998024466,-0.393918306062733,-0.688833966863793,2801,65,"UBE2E1, UBE2D1, UBC, UBB, RPS27A, PSMF1, PSME4, PSME3, PSME2, PSME1, PSMD9, PSMD8, PSMD7, PSMD6, PSMD5, PSMD4, PSMD3, PSMD2, PSMD14, PSMD13, PSMD12, PSMD11, PSMD10, PSMD1, PSMC6, PSMC5, PSMC4, PSMC3, PSMC2, PSMC1, PSMB9, PSMB8, PSMB7, PSMB6, PSMB5, PSMB4, PSMB3, PSMB2, PSMB10, PSMB1, PSMA8, PSMA7, PSMA6, PSMA5, PSMA4, PSMA3, PSMA1"
"14","ATF4 activates genes in response to endoplasmic reticulum  stress",0.237260497350183,0.673372198452951,0.457525439100685,1.25565847886963,1163,23,"ASNS, ATF3, ATF4, ATF6, CEBPB, CEBPG, DCP2, DDIT3, DIS3, EXOSC1, EXOSC2, EXOSC3, EXOSC4, EXOSC5, EXOSC7, EXOSC8, EXOSC9"
"15","AUF1 (hnRNP D0) binds and destabilizes mRNA",0.441474834178697,0.681590901644993,-0.571036869426328,-1.1395873720544,2262,50,"UBC, UBB, RPS27A, PSMF1, PSME4, PSME3, PSME2, PSME1, PSMD9, PSMD8, PSMD7, PSMD6, PSMD5, PSMD4, PSMD3, PSMD2, PSMD14, PSMD13, PSMD12, PSMD11, PSMD10, PSMD1, PSMC6, PSMC5, PSMC4, PSMC3, PSMC2, PSMC1, PSMB9, PSMB8, PSMB7, PSMB6, PSMB5, PSMB4, PSMB3, PSMB2, PSMB10, PSMB1, PSMA8, PSMA7, PSMA6, PSMA5, PSMA4, PSMA3, PSMA1"
"16","AURKA Activation by TPX2",0.541812204643518,0.716215998024466,0.24983344437042,0.444254713622499,2636,66,"ACTR1A, AKAP9, ALMS1, AURKA, CCP110, CDK5RAP2, CENPJ, CEP131, CEP135, CEP152, CEP164, CEP192, CEP250, CEP290, CEP41, CEP57, CEP63, CEP70, CEP72, CEP76, CEP78, CETN2, CKAP5, CLASP1, CNTRL, CSNK1D, CSNK1E, DCTN1, DCTN2, DCTN3, DYNC1H1, DYNC1I2, DYNLL1"
"17","Abortive elongation of HIV-1 transcript in the absence of Tat",0.235675039246468,0.673372198452951,-0.412779194671581,-1.1362397348439,1200,23,"SUPT5H, SUPT4H1, POLR2L, POLR2K, POLR2J, POLR2I, POLR2H, POLR2G, POLR2F, POLR2E, POLR2D, POLR2C, POLR2B, POLR2A, NELFE, NELFCD, NELFB, NELFA, NCBP2, NCBP1"
"18","Acetylcholine Neurotransmitter Release Cycle",0.0608135320177205,0.673372198452951,0.997808764940239,2.96361067451758,301,16,"PPFIA2, CHAT"
"19","Activated NOTCH1 Transmits Signal to the Nucleus",0.186586079157731,0.673372198452951,-0.995746095048189,-2.45330515027679,956,31,"DNER"
"20","Activation of APC/C and APC/C:Cdc20 mediated degradation of mitotic proteins",0.302453987730061,0.673372198452951,0.995868869936034,1.75655705099984,1478,68,"PTTG1, ANAPC1"
"21","Activation of ATR in response to replication stress",0.326185567010309,0.673372198452951,0.277755617604042,0.678760981686221,1581,34,"ATR, ATRIP, CDC25A, CDC25C, CDC45, CDC6, CDC7, CHEK1, CLSPN, DBF4, HUS1, MCM10, MCM4, MCM5, MCM6, MCM7, MCM8, ORC1, ORC2, ORC3, ORC4, ORC5, ORC6, RAD1, RAD17, RAD9A, RAD9B, RFC2, RFC3, RFC4, RFC5, RPA1, RPA2, RPA3"
"22","Activation of BH3-only proteins",0.279319781078968,0.673372198452951,-0.302375203963349,-0.790428023975303,1428,27,"YWHAZ, YWHAQ, YWHAH, YWHAG, YWHAE, YWHAB, TP73, TP63, TP53BP2, TP53, TFDP2, TFDP1"
"23","Activation of G protein gated Potassium channels",0.234497645211931,0.673372198452951,-0.515454196064193,-1.41886884470071,1194,23,"GABBR2"
"24","Activation of GABAB receptors",0.335026372338347,0.673372198452951,-0.51545112202453,-1.21807638927425,1714,35,"GABBR2"
"25","Activation of HOX genes during differentiation",0.445160031225605,0.681590901644993,-0.21567518410079,-0.439777701119567,2280,48,"ZNF335, YY1, WDR5, SUZ12, RXRA, RBBP7, RBBP5, RARG, RARB, RARA, POLR2L, POLR2K, POLR2J, POLR2I, POLR2H, POLR2G, POLR2F, POLR2E, POLR2D, POLR2C, POLR2B, POLR2A, PKNOX1, PIAS2, PCGF2, PBX1, PAXIP1, PAX6, PAGR1, NCOR1, NCOA6, NCOA3, MEIS1, MAFB, KMT2D, KMT2C, KDM6A, JUN"
"26","Activation of IRF3/IRF7 mediated by TBK1/IKK epsilon",0.23669579030977,0.673372198452951,-0.30109561752988,-0.896274800979682,1191,16,"UBC, UBB, TRAF3, TLR4, TICAM1, TBK1, TANK, SARM1, RPS27A, PTPN11"
"27","Activation of Matrix Metalloproteinases",0.239017571884984,0.673372198452951,-0.297875092193524,-0.859433438695865,1196,19,"PRSS2, PRSS1, TIMP2, TIMP1, SPOCK3, MMP9, MMP25, MMP24, MMP2, MMP1, MMP17, MMP16, MMP15, MMP14, MMP11"
"28","Activation of NF-kappaB in B cells",0.14004291008387,0.673372198452951,-0.997668687137814,-1.78132829855589,717,63,"PRKCB"
"29","Activation of NMDA receptors and postsynaptic events",0.469841889517861,0.697892203229877,-0.961589378344561,-1.63845199627381,2406,69,"GRIA1, NRG1, GRIN2B, PRKAG2"
"30","Activation of SMO",0.179657603222558,0.673372198452951,0.363773985791116,1.08986126492558,891,15,"ARRB1, ARRB2, BOC, CDON, CSNK1A1, EFCAB7, EVC, EVC2, GAS1, GRK2, IHH, KIF3A"
"31","Activation of anterior HOX genes in hindbrain development during early embryogenesis",0.445160031225605,0.681590901644993,-0.21567518410079,-0.439777701119567,2280,48,"ZNF335, YY1, WDR5, SUZ12, RXRA, RBBP7, RBBP5, RARG, RARB, RARA, POLR2L, POLR2K, POLR2J, POLR2I, POLR2H, POLR2G, POLR2F, POLR2E, POLR2D, POLR2C, POLR2B, POLR2A, PKNOX1, PIAS2, PCGF2, PBX1, PAXIP1, PAX6, PAGR1, NCOR1, NCOA6, NCOA3, MEIS1, MAFB, KMT2D, KMT2C, KDM6A, JUN"
"32","Activation of gene expression by SREBF (SREBP)",0.63982612295591,0.740090160111923,0.132956434985035,0.294524918701938,3090,41,"ACACA, ACACB, CARM1, CHD9, CREBBP, CYP51A1, DHCR7, ELOVL6, FASN, FDFT1, GGPS1, GPAM, HELZ2, HMGCR, HMGCS1, IDI1, LSS, MED1, MTF1, MVD, MVK, NCOA1, NCOA2, NCOA6, NFYA, NFYB, NFYC, PMVK, PPARA, RXRA, SC5D, SCD, SMARCD3, SP1, SQLE, SREBF1, SREBF2, TBL1X, TBL1XR1, TGS1, TM7SF2"
"33","Activation of kainate receptors upon glutamate binding",0.242341993020551,0.673372198452951,-0.994019138755981,-2.57134618409525,1249,28,"GRIK3"
"34","Activation of the mRNA upon binding of the cap-binding complex and eIFs, and subsequent binding to 43S",0.430094300943009,0.678445586759412,0.271759382486026,0.563833438531411,2097,48,"EIF1AX, EIF2S1, EIF2S2, EIF2S3, EIF3A, EIF3B, EIF3C, EIF3D, EIF3E, EIF3F, EIF3G, EIF3H, EIF3I, EIF3J, EIF3K, EIF3L, EIF3M, EIF4A1, EIF4A2, EIF4E, EIF4EBP1, EIF4G1, EIF4H, FAU, RPS18, RPS11, RPS12, RPS13, RPS14, RPS15, RPS15A, RPS16, RPS17, RPS19, RPS20, RPS21, RPS24, RPS25, RPS27A, RPS27L, RPS28, RPS3A, RPS4X, RPS5, RPS7, RPS8, RPS9, RPSA"
"35","Activation of the pre-replicative complex",0.284994183792168,0.673372198452951,-0.312058555479608,-0.8072385576509,1469,28,"RPA3, RPA2, RPA1, PRIM2, PRIM1, POLE4, POLE3, POLE2, POLE, POLA2, POLA1, ORC6, ORC5, ORC4, ORC3, ORC2, ORC1, MCM8, MCM7, MCM6, MCM5, MCM4, MCM10"
"36","Acyl chain remodelling of PC",0.228351126927639,0.673372198452951,-0.46286701208981,-1.28260870424163,1154,22,"TMEM86B, PNPLA8, PLB1, PLAAT3, PLA2R1, PLA2G6, PLA2G5, PLA2G4F, PLA2G4E, PLA2G4D, PLA2G4C, PLA2G4A, PLA2G3, PLA2G2D, PLA2G1B, PLA2G12A, PLA2G10, MBOAT2, LPCAT4, LPCAT3, LPCAT2, LPCAT1"
"37","Acyl chain remodelling of PE",0.229339659944642,0.673372198452951,-0.417478894162832,-1.15683781627221,1159,22,"PNPLA8, PLAAT5, PLAAT3, PLAAT1, PLA2R1, PLA2G6, PLA2G5, PLA2G4F, PLA2G4E, PLA2G4D, PLA2G4C, PLA2G4A, PLA2G3, PLA2G2D, PLA2G1B, PLA2G12A, PLA2G10, MBOAT2, MBOAT1, LPCAT4, LPCAT3"
"38","Acyl chain remodelling of PS",0.18421574459647,0.673372198452951,-0.462876876079161,-1.35826659236179,928,18,"PLAAT3, PLA2R1, PLA2G5, PLA2G4F, PLA2G4E, PLA2G4D, PLA2G4A, PLA2G2D, PLA2G1B, PLA2G12A, PLA2G10, PLA1A, OSBPL8, OSBPL5, OSBPL10, MBOAT1, LPCAT4, LPCAT3"
"39","Adherens junctions interactions",0.258977361436378,0.673372198452951,-0.622605778805704,-1.64720630771193,1326,26,"CDH4, CDH9"
"40","Adrenaline,noradrenaline inhibits insulin secretion",0.254817548175482,0.673372198452951,0.648239202657807,1.73062859942103,1242,26,"ADCY5, ADCY6, ADRA2A, ADRA2C, CACNA1C, CACNA1D, CACNA2D2, CACNB2, CACNB3, GNAI1, GNAI2, GNB1, GNB2, GNB3, GNB4, GNB5, GNG10, GNG11, GNG12, GNG13, GNG2, GNG3, GNG4, GNG7, GNG8, GNGT2"
"41","Aggrephagy",0.309768378650554,0.673372198452951,0.249561636556854,0.71567279387724,1537,20,"ARL13B, CFTR, DYNC1H1, DYNC1I1, DYNC1I2, DYNC1LI1, DYNC1LI2, DYNLL1, DYNLL2, UBA52, HDAC6, HSF1, IFT88"
"42","Amine ligand-binding receptors",0.0101285547331515,0.673372198452951,-0.999667707848741,-2.52211001383964,51,29,"HTR1F"
"43","Amino acid transport across the plasma membrane",0.26192337763878,0.673372198452951,-0.772011429330852,-2.01808700109649,1339,27,"SLC7A8, SLC7A7, SLC7A6, SLC7A5, SLC7A3, SLC7A2, SLC7A11, SLC7A10, SLC7A1, SLC6A6, SLC6A20, SLC6A19, SLC6A15, SLC43A2, SLC43A1, SLC3A2, SLC3A1, SLC38A5, SLC38A4, SLC38A3, SLC38A2, SLC38A1, SLC36A4, SLC36A1, SLC25A29, SLC1A4, SLC16A10"
"44","Amino acids regulate mTORC1",0.451157075568298,0.683343669317115,0.265394277511337,0.533784833999204,2202,51,"ATP6V0B, ATP6V0C, ATP6V0D1, ATP6V0D2, ATP6V0E1, ATP6V0E2, ATP6V1A, ATP6V1B1, ATP6V1B2, ATP6V1C1, ATP6V1C2, ATP6V1D, ATP6V1E1, ATP6V1F, ATP6V1G1, ATP6V1G2, ATP6V1H, C12orf66, BMT2"
"45","Amplification  of signal from unattached  kinetochores via a MAD2  inhibitory signal",0.647619047619048,0.743146369176738,0.161385109452813,0.256340655485068,3127,86,"AHCTF1, B9D2, BIRC5, BUB1, BUB3, CDC20, CDCA8, CENPA, CENPC, CENPE, CENPF, CENPH, CENPI, CENPK, CENPL, CENPM, CENPN, CENPO, CENPP, CENPQ, CENPT, CENPU, CKAP5, CLASP1, CLASP2, CLIP1, DSN1, DYNC1H1, DYNC1I1, DYNC1I2, DYNC1LI1, DYNC1LI2, DYNLL1, DYNLL2, INCENP, ITGB3BP, KIF18A, KIF2A, KIF2C, KNL1, KNTC1, MAD1L1, MAD2L1, MAPRE1, MIS12, NDC80, NDE1, NDEL1, NSL1, NUDC, NUP107, NUP133, NUP160, NUP37, NUP43, NUP85, NUP98, PAFAH1B1, PLK1, PMF1, PPP1CC, PPP2CA, PPP2CB, PPP2R1A, PPP2R1B, PPP2R5A, PPP2R5B, PPP2R5C, PPP2R5D, PPP2R5E"
"46","Amplification of signal from the kinetochores",0.647619047619048,0.743146369176738,0.161385109452813,0.256340655485068,3127,86,"AHCTF1, B9D2, BIRC5, BUB1, BUB3, CDC20, CDCA8, CENPA, CENPC, CENPE, CENPF, CENPH, CENPI, CENPK, CENPL, CENPM, CENPN, CENPO, CENPP, CENPQ, CENPT, CENPU, CKAP5, CLASP1, CLASP2, CLIP1, DSN1, DYNC1H1, DYNC1I1, DYNC1I2, DYNC1LI1, DYNC1LI2, DYNLL1, DYNLL2, INCENP, ITGB3BP, KIF18A, KIF2A, KIF2C, KNL1, KNTC1, MAD1L1, MAD2L1, MAPRE1, MIS12, NDC80, NDE1, NDEL1, NSL1, NUDC, NUP107, NUP133, NUP160, NUP37, NUP43, NUP85, NUP98, PAFAH1B1, PLK1, PMF1, PPP1CC, PPP2CA, PPP2CB, PPP2R1A, PPP2R1B, PPP2R5A, PPP2R5B, PPP2R5C, PPP2R5D, PPP2R5E"
"47","Amyloid fiber formation",0.74217991062755,0.798918299216593,-0.116905598381236,-0.252191340906134,3819,43,"USP9X, UBE2L6, UBC, UBB, TTR, TSPAN5, TSPAN33, TSPAN15, TSPAN14"
"48","Anchoring of the basal body to the plasma membrane",0.657503100454733,0.748803315695488,0.205522191082047,0.320338678690025,3180,90,"ACTR1A, AHI1, AKAP9, ALMS1, B9D1, B9D2, C2CD3, CC2D2A, CCP110, CDK5RAP2, CENPJ, CEP131, CEP135, CEP152, CEP162, CEP164, CEP192, CEP250, CEP290, CEP41, CEP57, CEP63, CEP70, CEP72, CEP76, CEP78, CEP83, CEP89, CEP97, CETN2, CKAP5, CLASP1, CNTRL, CSNK1D, CSNK1E, DCTN1, DCTN2, DCTN3, DYNC1H1, DYNC1I2, DYNLL1"
"49","Antigen Presentation: Folding, assembly and peptide loading of class I MHC",0.194560254119516,0.673372198452951,-0.339658721200451,-1.01693493103832,979,15,"TAPBP, TAP2, SEC31A, SEC24D, SEC24B, SEC24A, SEC23A, SEC13, SAR1B"
"50","Antigen activates B Cell Receptor (BCR) leading to generation of second messengers",0.205622819618305,0.673372198452951,0.995613160518445,2.50481256350261,1001,31,"ITPR1, AHCYL1"
"51","Antigen processing-Cross presentation",0.627880184331797,0.738782274395303,-0.378518887229689,-0.602779060219544,3269,82,"VAMP8, UBC, UBB, TLR4, TLR2, TIRAP, TAPBP, TAP2, STX4, SNAP23, SEC61G, SEC61B, SEC61A2, SEC61A1, SEC22B, RPS27A, PSMF1, PSME4, PSME3, PSME2, PSME1, PSMD9, PSMD8, PSMD7, PSMD6, PSMD5, PSMD4, PSMD3, PSMD2, PSMD14, PSMD13, PSMD12, PSMD11, PSMD10, PSMD1, PSMC6, PSMC5, PSMC4, PSMC3, PSMC2, PSMC1, PSMB9, PSMB8, PSMB7, PSMB6, PSMB5, PSMB4, PSMB3, PSMB2, PSMB10, PSMB1, PSMA8, PSMA7, PSMA6, PSMA5, PSMA4, PSMA3, PSMA1"
"52","Antigen processing: Ubiquitination & Proteasome degradation",0.0272912423625255,0.673372198452951,0.998783126014062,1.25731777813543,133,284,"HECW2, ZBTB16, ANAPC1"
"53","Antimicrobial peptides",0.316817724068479,0.673372198452951,0.247011158342189,0.708358737539111,1572,20,"ATOX1, ATP7A, BPIFB1, CAMP, CHGA, CLU, DEFB129, DEFB110, DEFB136, RNASE3"
"54","Antiviral mechanism by IFN-stimulated genes",0.58398133748056,0.723883666382134,-0.207241032021091,-0.347839701410616,3003,72,"USP41, USP18, UBE2N, UBE2L6, UBE2E1, UBC, UBB, UBA7, TPR, STAT1, SEH1L, SEC13, RPS27A, RNASEL, RANBP2, RAE1, PPM1B, POM121, POM121C, PLCG1, PIN1, PDE12, OAS1, NUP42, NUP58, NUP98, NUP93, NUP88, NUP85, NUP62, NUP54, NUP50, NUP43, NUP37, NUP35, NUP214, NUP210, NUP205, NUP188, NUP160, NUP155, NUP153, NUP133, NUP107, NEDD4, NDC1, MAPK3, KPNB1, KPNA7, KPNA4, KPNA3, KPNA2, KPNA1, JAK1, ISG15, IRF3, UBA52, FLNB, FLNA, EIF4G3, EIF4G2, EIF4G1, EIF4E2, EIF4E, EIF4A3, EIF4A2, EIF4A1, EIF2AK2"
"55","Apoptosis",0.710315130162458,0.780098424828992,-0.714697749109498,-0.922233531355596,3628,157,"DCC, PTK2"
"56","Apoptotic cleavage of cellular proteins",0.304347826086957,0.673372198452951,-0.993949065762351,-2.29043465230476,1567,37,"PTK2"
"57","Apoptotic execution phase",0.344552529182879,0.673372198452951,-0.993946248004258,-2.11967773780465,1770,44,"PTK2"
"58","Apoptotic factor-mediated response",0.159718026183283,0.673372198452951,0.47185445853529,1.41366869849605,792,15,"APAF1, APIP, AVEN, BAK1, BAX, C1QBP, CASP3, CASP7, CASP9"
"59","Aquaporin-mediated transport",0.357408940397351,0.673372198452951,0.384933606792617,0.886715079415723,1726,38,"ADCY1, ADCY2, ADCY3, ADCY5, ADCY6, ADCY7, ADCY8, ADCY9, AQP11, AQP12A, AQP4, AQP7, GNAS, GNB1, GNB2, GNB3, GNB4, GNB5, GNG10, GNG11, GNG12, GNG13, GNG2, GNG3, GNG4, GNG7, GNG8, GNGT2"
"60","Arachidonic acid metabolism",0.368399339933993,0.673372198452951,0.300221845942402,0.681640338489364,1785,39,"ABCC1, ALOX12, ALOX12B, ALOX5, ALOX5AP, ALOX15B, ALOXE3, CBR1, CYP1B1, CYP2J2, CYP2U1, CYP4F11, CYP4A22, CYP4A11, CYP4B1, CYP4F8, CYP4F3, EPHX2, FAAH, GPX1, GPX4, HPGD, HPGDS, LTA4H, LTC4S, MAPKAPK2, PLA2G4A, PON2, PON3, PRXL2B, PTGDS, PTGES, PTGES2, PTGES3, PTGIS, PTGR2, PTGS1, PTGS2"
"61","Asparagine N-linked glycosylation",0.91452468380253,0.922370939430959,0.533992949885321,0.670925445248647,4482,268,"MGAT4C, ACTR10"
"62","Assembly Of The HIV Virion",0.166799046862589,0.673372198452951,-0.469339309428951,-1.39708774110148,839,16,"VPS37D, VPS37C, VPS37B, VPS37A, VPS28, UBC, UBB, UBAP1, TSG101"
"63","Assembly and cell surface presentation of NMDA receptors",0.214767764986106,0.673372198452951,-0.622112720457035,-1.74875302822928,1081,21,"GRIN2B"
"64","Assembly of collagen fibrils and other multimeric structures",0.403331962155492,0.678445586759412,0.407609221539504,0.87691186948903,1960,44,"BMP1, CD151, COL11A1, COL11A2, COL15A1, COL18A1, COL1A1, COL27A1, COL4A1, COL4A2, COL4A3, COL4A4, COL4A5, COL5A1, COL5A2, COL5A3, COL6A1, COL6A2, COL6A3, COL6A5, COL6A6, COL8A1, COL8A2, COL9A1, COL9A2, CTSB, CTSS"
"65","Assembly of the pre-replicative complex",0.52265625,0.706220067049808,-0.426608364313282,-0.770393744737786,2675,61,"UBC, UBB, RPS27A, PSMF1, PSME4, PSME3, PSME2, PSME1, PSMD9, PSMD8, PSMD7, PSMD6, PSMD5, PSMD4, PSMD3, PSMD2, PSMD14, PSMD13, PSMD12, PSMD11, PSMD10, PSMD1, PSMC6, PSMC5, PSMC4, PSMC3, PSMC2, PSMC1, PSMB9, PSMB8, PSMB7, PSMB6, PSMB5, PSMB4, PSMB3, PSMB2, PSMB10, PSMB1, PSMA8, PSMA7, PSMA6, PSMA5, PSMA4, PSMA3, PSMA1, ORC6, ORC5, ORC4, ORC3, ORC2, ORC1"
"66","Association of TriC/CCT with target proteins during biosynthesis",0.367780528052805,0.673372198452951,0.339274234665603,0.770307048883277,1782,39,"AP3M1, ARFGEF2, CCNE1, CCNE2, CCT2, CCT3, CCT4, CCT5, CCT6A, CCT6B, CCT7, CCT8, DCAF7, FBXL3, FBXL5, FBXO4, FBXO6, FBXW10, FBXW2, FBXW4, FBXW5, FBXW7, FBXW9, FKBP9, GAPDHS, GBA"
"67","Asymmetric localization of PCP proteins",0.5224609375,0.706220067049808,-0.496871434576353,-0.897278809225153,2674,61,"WNT5A, VANGL2, UBC, UBB, SMURF2, SMURF1, SCRIB, RPS27A, PSMF1, PSME4, PSME3, PSME2, PSME1, PSMD9, PSMD8, PSMD7, PSMD6, PSMD5, PSMD4, PSMD3, PSMD2, PSMD14, PSMD13, PSMD12, PSMD11, PSMD10, PSMD1, PSMC6, PSMC5, PSMC4, PSMC3, PSMC2, PSMC1, PSMB9, PSMB8, PSMB7, PSMB6, PSMB5, PSMB4, PSMB3, PSMB2, PSMB10, PSMB1, PSMA8, PSMA7, PSMA6, PSMA5, PSMA4, PSMA3, PSMA1, PRICKLE1"
"68","Attenuation phase",0.217119838872105,0.673372198452951,0.41616612104822,1.17664136030912,1077,21,"COL4A6, CREBBP, DEDD2, DNAJB1, DNAJB6, EP300, FKBP4, GML, HSBP1, HSF1, HSP90AB1, HSPA1B, HSPA1A, HSPA1L, HSPA2, HSPA8, HSPH1"
"69","Autodegradation of Cdh1 by Cdh1:APC/C",0.511292834890966,0.704774715267802,-0.433551579396458,-0.794740187439042,2625,59,"UBE2E1, UBE2D1, UBC, UBB, RPS27A, PSMF1, PSME3, PSME2, PSME1, PSMD9, PSMD8, PSMD7, PSMD6, PSMD5, PSMD4, PSMD3, PSMD2, PSMD14, PSMD13, PSMD12, PSMD11, PSMD10, PSMD1, PSMC6, PSMC5, PSMC4, PSMC3, PSMC2, PSMC1, PSMB9, PSMB8, PSMB7, PSMB6, PSMB5, PSMB4, PSMB3, PSMB2, PSMB10, PSMB1, PSMA7, PSMA6, PSMA5, PSMA4, PSMA3, PSMA1"
"70","Autodegradation of the E3 ubiquitin ligase COP1",0.422911787665886,0.678445586759412,-0.629480525241771,-1.28355749153317,2166,48,"UBC, UBB, TP53, RPS27A, PSMF1, PSME4, PSME3, PSME2, PSME1, PSMD9, PSMD8, PSMD7, PSMD6, PSMD5, PSMD4, PSMD3, PSMD2, PSMD14, PSMD13, PSMD12, PSMD11, PSMD10, PSMD1, PSMC6, PSMC5, PSMC4, PSMC3, PSMC2, PSMC1, PSMB9, PSMB8, PSMB7, PSMB6, PSMB5, PSMB4, PSMB3, PSMB2, PSMB10, PSMB1, PSMA8, PSMA7, PSMA6, PSMA5, PSMA4, PSMA3, PSMA1"
"71","Autophagy",0.410714285714286,0.678445586759412,-0.994787489975942,-1.40170658575845,2115,112,"PRKAG2"
"72","Axon guidance",0.510344827586207,0.704774715267802,0.732225004876562,0.977954063470398,2589,474,"DAB1, SEMA6D, UNC5D, PRKCA, EPHB1, EPHB2, DPYSL2"
"73","B-WICH complex positively regulates rRNA expression",0.344827586206897,0.673372198452951,-0.236464703536294,-0.575226330705883,1759,32,"ZNRD1, TWISTNB, TBP, TAF1D, TAF1C, TAF1B, TAF1A, SMARCA5, SF3B1, POLR2L, POLR2K, POLR2H, POLR2F, POLR2E, POLR1E, POLR1D, POLR1C, POLR1B, POLR1A"
"74","BBSome-mediated cargo-targeting to cilium",0.216918429003021,0.673372198452951,0.474975882083155,1.34291630130939,1076,21,"ARL6, BBS1, BBS10, BBS2, BBS4, BBS5, BBS7, BBS9, CCT2, CCT3, CCT4, CCT5, CCT8"
"75","BMAL1:CLOCK,NPAS2 activates circadian gene expression",0.490746390075249,0.698009904216332,0.18549030029232,0.505173186371222,2412,24,"ARNTL, ARNTL2, BHLHE40, BHLHE41, CARM1, CHD9, CLOCK, CREBBP, DBP, HELZ2, KLF15, MED1, NAMPT, NCOA1, NCOA2, NCOA6, NOCT, NPAS2"
"76","Base Excision Repair",0.396930250631436,0.676036774350512,-0.364370477971718,-0.786028049115617,2042,43,"XRCC1, UNG, TINF2, TERF2IP, TERF2, TERF1, TDG, SMUG1, RPA3, RPA2, RPA1, RFC5, RFC4, RFC3, RFC2, RFC1, POT1, POLE4, POLE3, POLE2, POLE, POLD4, POLD2, POLD1, POLB, PNKP, PCNA, PARP2, PARP1, PARG, OGG1, NTHL1, NEIL2, NEIL1, MUTYH, MPG, MBD4, LIG3, LIG1"
"77","Base-Excision Repair, AP Site Formation",0.168983320095314,0.673372198452951,-0.425946215139442,-1.26791901633795,850,16,"UNG, TINF2, TERF2IP, TERF2, TERF1, TDG, SMUG1, POT1, OGG1, NTHL1, NEIL2, NEIL1, MUTYH, MPG, MBD4"
"78","Basigin interactions",0.169498381877023,0.673372198452951,0.995416500597848,2.77349088899832,837,22,"ATP1B1, ATP1B2"
"79","Beta-catenin independent WNT signaling",0.777664143996727,0.821946717630907,0.53895650056572,0.733720414261076,3801,140,"PRKCA, ITPR1, AGO1"
"80","Beta-catenin phosphorylation cascade",0.197665056360709,0.673372198452951,0.346902184740023,1.02064096916935,981,17,"AMER1, APC, AXIN1, CSNK1A1, CTNNB1, FRAT1, FRAT2, GSK3B, PPP2CA, PPP2CB, PPP2R1A, PPP2R1B, PPP2R5A, PPP2R5B, PPP2R5C, PPP2R5D, PPP2R5E"
"81","Bile acid and bile salt metabolism",0.473219782474861,0.698009904216332,0.177977894274167,0.447765541158105,2305,31,"ABCB11, ABCC3, ACOT8, ACOX2, AMACR, BAAT, CH25H, CYP27A1, CYP39A1, CYP46A1, CYP7B1, HSD17B4, NCOA1, NCOA2, OSBP, OSBPL1A, OSBPL2, OSBPL3, OSBPL6, OSBPL7, OSBPL9, PTGIS, RXRA, SCP2, SLC10A1, SLC27A2, SLC27A5, SLCO1A2, SLCO1B1, SLCO1B3"
"82","Binding and Uptake of Ligands by Scavenger Receptors",0.190103092783505,0.673372198452951,0.99607764924877,2.43414930316052,921,34,"FTH1, AMBP"
"83","Biological oxidations",0.79611054247697,0.836309329401628,0.254282256358339,0.3474619357075,3888,137,"ABHD10, ABHD14B, ACSM2A, ACSM2B, ACSS1, ACSS2, ACY1, ADH4, ADH5, AHCY, AHR, AHRR, AIP, AKR1A1, AKR7L, ALDH1A1, ALDH1B1, ALDH2, ALDH3A1, AOC2, AOC3, ARNT, ARNT2, AS3MT, BPHL, BPNT1, CBR3, CES1, CHAC1, CHAC2, CMBL, CNDP2, COMT, CYB5B, CYB5R3, CYP11A1, CYP19A1, CYP1B1, CYP26B1, CYP26C1, CYP27A1, CYP27B1, CYP2D6, CYP2J2, CYP2R1, CYP2S1, CYP2U1, CYP39A1, CYP3A5, CYP3A4, CYP3A43, CYP3A7, CYP46A1, CYP4F12, CYP4F11, CYP4A22, CYP4A11, CYP4B1, CYP4F8, CYP4F3, CYP51A1, CYP7B1, EPHX1, ESD, FDX1, FMO1, GCLC, GCLM, GGCT, GGT7, GLYAT, CYP4V2, GSS, GSTA5, GSTK1, GSTM1, GSTM4, GSTM3, GSTM2, GSTO1, GSTO2, GSTP1, GSTT2, GSTT2B, GSTZ1"
"84","Biosynthesis of the N-glycan precursor (dolichol lipid-linked oligosaccharide, LLO) and transfer to a nascent protein",0.276550387596899,0.673372198452951,-0.996066666666667,-1.62855696597361,1426,76,"ST6GAL1"
"85","Blood group systems biosynthesis",0.0473313192346425,0.673372198452951,0.998207290352566,2.99061368491115,234,15,"FUT9, B3GALT1"
"86","Branched-chain amino acid catabolism",0.196836203444133,0.673372198452951,0.458426400729858,1.33075218945826,982,19,"ACAD8, ACADSB, ACAT1, ALDH6A1, AUH, BCAT1, BCAT2, BCKDHA, BCKDHB, BCKDK, DBT, DLD, HIBADH, HIBCH, HSD17B10, IVD, MCCC1, MCCC2"
"87","Budding and maturation of HIV virion",0.263856362217018,0.673372198452951,-0.368515205724508,-0.974967775791559,1351,26,"VTA1, VPS4B, VPS4A, VPS37D, VPS37C, VPS37B, VPS37A, VPS28, UBC, UBB, UBAP1, TSG101"
"88","Butyrate Response Factor 1 (BRF1) binds and destabilizes mRNA",0.170157068062827,0.673372198452951,0.468193891102258,1.39059152632085,844,16,"AKT1, DCP1A, DCP2, DIS3, EXOSC1, EXOSC2, EXOSC3, EXOSC4, EXOSC5, EXOSC7, EXOSC8, EXOSC9"
"89","C-type lectin receptors (CLRs)",0.342704699363842,0.673372198452951,0.995586465159823,1.40286928111284,1669,122,"ITPR1, AHCYL1"
"90","CD209 (DC-SIGN) signaling",0.273442226255293,0.673372198452951,0.27181564616815,0.795338975603682,1355,18,"CD209, CREBBP, EP300, FYN, HRAS, KRAS, LYN, NFKB1, NRAS, PAK1, PAK2, PAK3, PRKACA, PRKACB, RAF1, RELA, RELB, RPS6KA5"
"91","CD28 co-stimulation",0.551245406288281,0.716215998024466,0.157479726136666,0.393285946784819,2699,32,"AKT1, AKT2, AKT3, CD28, CD80, CD86, CDC42, FYN, GRAP2, GRB2, LCK, LYN, MAP3K14, MAP3K8, MAPKAP1, MLST8, MTOR, PAK1, PAK2, PAK3, PDPK1, PIK3CA, PIK3R1, PIK3R2, PIK3R3"
"92","CD28 dependent PI3K/Akt signaling",0.34159113796576,0.673372198452951,0.233363381885468,0.659796637017069,1695,21,"AKT1, AKT2, AKT3, CD28, CD80, CD86, FYN, LCK, MAP3K14, MAP3K8, MAPKAP1, MLST8, MTOR, PDPK1, PIK3CA, PIK3R1, PIK3R2, PIK3R3"
"93","CDK-mediated phosphorylation and removal of Cdc6",0.551509250243427,0.716215998024466,-0.382940665818747,-0.667509966626185,2831,66,"UBE2E1, UBE2D1, UBC, UBB, RPS27A, PSMF1, PSME4, PSME3, PSME2, PSME1, PSMD9, PSMD8, PSMD7, PSMD6, PSMD5, PSMD4, PSMD3, PSMD2, PSMD14, PSMD13, PSMD12, PSMD11, PSMD10, PSMD1, PSMC6, PSMC5, PSMC4, PSMC3, PSMC2, PSMC1, PSMB9, PSMB8, PSMB7, PSMB6, PSMB5, PSMB4, PSMB3, PSMB2, PSMB10, PSMB1, PSMA8, PSMA7, PSMA6, PSMA5, PSMA4, PSMA3, PSMA1"
