"","pathway","pval","padj","ES","NES","nMoreExtreme","size","leadingEdge"
"1","A tetrasaccharide linker sequence is required for GAG synthesis",0.0398717691845322,0.0541573763255143,0.288950767380448,1.62127059264031,198,22,"AGRN, B3GALT6, B3GAT1, B3GAT2, B3GAT3, B4GALT7, BCAN, CSPG5, DCN, GPC1, GPC3, GPC4, GPC5, GPC6, HSPG2"
"2","ABC transporter disorders",0.000198570293884035,0.000551454923716307,-0.383644582000035,-3.65846598040158,0,66,"VCP, UBC, UBB, SEL1L, RPS27A, RNF5, RNF185, PSMF1, PSME4, PSME3, PSME2, PSME1, PSMD9, PSMD8, PSMD7, PSMD6, PSMD5, PSMD4, PSMD3, PSMD2, PSMD14, PSMD13, PSMD12, PSMD11, PSMD10, PSMD1, PSMC6, PSMC5, PSMC4, PSMC3, PSMC2, PSMC1, PSMB8, PSMB7, PSMB6, PSMB5, PSMB4, PSMB3, PSMB2, PSMB10, PSMB1, PSMA7, PSMA6, PSMA5, PSMA4, PSMA3, PSMA1"
"3","ABC transporters in lipid homeostasis",0.000201126307320998,0.000551454923716307,0.80838423763325,3.77854390181767,0,15,"ABCA12, ABCA2, ABCA3, ABCA5, ABCA6, ABCA7, ABCA9, ABCD1, ABCD2, ABCD3, ABCG1, ABCG4, APOA1"
"4","ABC-family proteins mediated transport",0.000200561572402728,0.000551454923716307,0.301168406192642,3.33294309736374,0,89,"ABCA12, ABCA2, ABCA3, ABCA4, ABCA5, ABCA6, ABCA7, ABCA8, ABCA9, ABCB10, ABCB1, ABCB4, ABCB6, ABCB7, ABCB8, ABCB9, ABCC1, ABCC10, ABCC3, ABCC4, ABCC5, ABCC9, ABCD1, ABCD2, ABCD3, ABCF1, ABCG1, ABCG4"
"5","ADP signalling through P2Y purinoceptor 1",0.00219167164773859,0.0044618332801022,0.461702242345839,2.23454377888426,10,16,"GNA11, GNA14, GNA15, GNB1, GNB4, GNB5, GNG12, GNG13, GNG2, GNG3, GNG4, GNG7, GNGT2"
"6","APC-Cdc20 mediated degradation of Nek2A",0.000399920015996801,0.00100512455234364,0.507728253055356,2.72607320242829,1,20,"ANAPC1, ANAPC10, ANAPC15, ANAPC16, ANAPC2, ANAPC4, ANAPC5, ANAPC7, BUB3, CDC16, CDC23, CDC26, CDC27"
"7","APC/C-mediated degradation of cell cycle proteins",0.000198688654877806,0.000551454923716307,-0.347533356572076,-3.4285062211484,0,71,"UBE2E1, UBE2D1, UBC, UBB, SKP2, SKP1, RPS27A, PTTG1, PSMF1, PSME4, PSME3, PSME2, PSME1, PSMD9, PSMD8, PSMD7, PSMD6, PSMD5, PSMD4, PSMD3, PSMD2, PSMD14, PSMD13, PSMD12, PSMD11, PSMD10, PSMD1, PSMC6, PSMC5, PSMC4, PSMC3, PSMC2, PSMC1, PSMB8, PSMB7, PSMB6, PSMB5, PSMB4, PSMB3, PSMB2, PSMB10, PSMB1, PSMA7, PSMA6, PSMA5, PSMA4, PSMA3, PSMA1"
"8","APC/C:Cdc20 mediated degradation of Cyclin B",0.00040048057669203,0.00100512455234364,0.524343492428599,2.67808201282742,1,18,"ANAPC1, ANAPC10, ANAPC15, ANAPC16, ANAPC2, ANAPC4, ANAPC5, ANAPC7, CDC16, CDC23, CDC26, CDC27"
"9","APC/C:Cdc20 mediated degradation of Securin",0.000196772924045651,0.000551454923716307,-0.451278059700216,-4.09881731257676,0,59,"UBE2E1, UBE2D1, UBC, UBB, RPS27A, PTTG1, PSMF1, PSME4, PSME3, PSME2, PSME1, PSMD9, PSMD8, PSMD7, PSMD6, PSMD5, PSMD4, PSMD3, PSMD2, PSMD14, PSMD13, PSMD12, PSMD11, PSMD10, PSMD1, PSMC6, PSMC5, PSMC4, PSMC3, PSMC2, PSMC1, PSMB8, PSMB7, PSMB6, PSMB5, PSMB4, PSMB3, PSMB2, PSMB10, PSMB1, PSMA7, PSMA6, PSMA5, PSMA4, PSMA3, PSMA1"
"10","APC/C:Cdc20 mediated degradation of mitotic proteins",0.000198216055500496,0.000551454923716307,-0.413481489062776,-3.83724330976496,0,62,"UBE2E1, UBE2D1, UBC, UBB, RPS27A, PTTG1, PSMF1, PSME4, PSME3, PSME2, PSME1, PSMD9, PSMD8, PSMD7, PSMD6, PSMD5, PSMD4, PSMD3, PSMD2, PSMD14, PSMD13, PSMD12, PSMD11, PSMD10, PSMD1, PSMC6, PSMC5, PSMC4, PSMC3, PSMC2, PSMC1, PSMB8, PSMB7, PSMB6, PSMB5, PSMB4, PSMB3, PSMB2, PSMB10, PSMB1, PSMA7, PSMA6, PSMA5, PSMA4, PSMA3, PSMA1"
"11","APC/C:Cdh1 mediated degradation of Cdc20 and other APC/C:Cdh1 targeted proteins in late mitosis/early G1",0.000197980597901406,0.000551454923716307,-0.41762617885788,-3.90618007580077,0,63,"UBE2E1, UBE2D1, UBC, UBB, SKP2, RPS27A, PTTG1, PSMF1, PSME4, PSME3, PSME2, PSME1, PSMD9, PSMD8, PSMD7, PSMD6, PSMD5, PSMD4, PSMD3, PSMD2, PSMD14, PSMD13, PSMD12, PSMD11, PSMD10, PSMD1, PSMC6, PSMC5, PSMC4, PSMC3, PSMC2, PSMC1, PSMB8, PSMB7, PSMB6, PSMB5, PSMB4, PSMB3, PSMB2, PSMB10, PSMB1, PSMA7, PSMA6, PSMA5, PSMA4, PSMA3, PSMA1"
"12","APC:Cdc20 mediated degradation of cell cycle proteins prior to satisfation of the cell cycle checkpoint",0.000198649185538339,0.000551454923716307,-0.40920250257385,-3.76373441859832,0,61,"UBE2E1, UBE2D1, UBC, UBB, RPS27A, PSMF1, PSME4, PSME3, PSME2, PSME1, PSMD9, PSMD8, PSMD7, PSMD6, PSMD5, PSMD4, PSMD3, PSMD2, PSMD14, PSMD13, PSMD12, PSMD11, PSMD10, PSMD1, PSMC6, PSMC5, PSMC4, PSMC3, PSMC2, PSMC1, PSMB8, PSMB7, PSMB6, PSMB5, PSMB4, PSMB3, PSMB2, PSMB10, PSMB1, PSMA7, PSMA6, PSMA5, PSMA4, PSMA3, PSMA1"
"13","ATF4 activates genes in response to endoplasmic reticulum  stress",0.0002002002002002,0.000551454923716307,0.459558995938861,2.63363458175208,0,23,"ASNS, ATF3, ATF4, ATF6, CEBPB, CEBPG, DCP2, DDIT3, DIS3, EXOSC1, EXOSC2, EXOSC3, EXOSC4, EXOSC5, EXOSC7, EXOSC8, EXOSC9"
"14","AUF1 (hnRNP D0) binds and destabilizes mRNA",0.000198807157057654,0.000551454923716307,-0.567494477260721,-4.64785170086846,0,48,"UBC, UBB, RPS27A, PSMF1, PSME4, PSME3, PSME2, PSME1, PSMD9, PSMD8, PSMD7, PSMD6, PSMD5, PSMD4, PSMD3, PSMD2, PSMD14, PSMD13, PSMD12, PSMD11, PSMD10, PSMD1, PSMC6, PSMC5, PSMC4, PSMC3, PSMC2, PSMC1, PSMB8, PSMB7, PSMB6, PSMB5, PSMB4, PSMB3, PSMB2, PSMB10, PSMB1, PSMA7, PSMA6, PSMA5, PSMA4, PSMA3, PSMA1"
"15","AURKA Activation by TPX2",0.000201288244766506,0.000551454923716307,0.26818521924131,2.52699781087306,0,64,"ACTR1A, AKAP9, ALMS1, AURKA, CCP110, CDK5RAP2, CENPJ, CEP131, CEP135, CEP152, CEP164, CEP192, CEP250, CEP290, CEP41, CEP57, CEP63, CEP70, CEP72, CEP76, CEP78, CETN2, CKAP5, CLASP1, CNTRL, CSNK1D, CSNK1E, DCTN1, DCTN2, DCTN3, DYNC1H1, DYNC1I2, DYNLL1"
"16","Abortive elongation of HIV-1 transcript in the absence of Tat",0.000599161174355902,0.0014318611658394,-0.414183035756157,-2.36742108891001,2,23,"SUPT5H, SUPT4H1, POLR2L, POLR2K, POLR2J, POLR2I, POLR2H, POLR2G, POLR2F, POLR2E, POLR2D, POLR2C, POLR2B, POLR2A, NELFE, NELFCD, NELFB, NELFA, NCBP2, NCBP1"
"17","Acetylcholine Neurotransmitter Release Cycle",0.000596421471172962,0.0014318611658394,-0.516684632890167,-2.42122405245856,2,15,"VAMP2, UNC13B, TSPOAP1, SYT1, STXBP1, STX1A, SNAP25, RIMS1, RAB3A, PPFIA4, PPFIA3, PPFIA2, PPFIA1"
"18","Activated NOTCH1 Transmits Signal to the Nucleus",0.086082059533387,0.106268982364424,0.227535106628399,1.4576177660639,427,29,"ADAM10, ADAM17, APH1A, APH1B, ARRB1, ARRB2, CNTN1, DLL1, DNER, DTX1, DTX2, DTX4, UBA52, ITCH, JAG1, JAG2, MIB1, MIB2, NCSTN, NEURL1, NEURL1B, NOTCH1, NUMB, PSEN1, PSEN2, PSENEN"
"19","Activation of APC/C and APC/C:Cdc20 mediated degradation of mitotic proteins",0.000198216055500496,0.000551454923716307,-0.413481489062776,-3.83724330976496,0,62,"UBE2E1, UBE2D1, UBC, UBB, RPS27A, PTTG1, PSMF1, PSME4, PSME3, PSME2, PSME1, PSMD9, PSMD8, PSMD7, PSMD6, PSMD5, PSMD4, PSMD3, PSMD2, PSMD14, PSMD13, PSMD12, PSMD11, PSMD10, PSMD1, PSMC6, PSMC5, PSMC4, PSMC3, PSMC2, PSMC1, PSMB8, PSMB7, PSMB6, PSMB5, PSMB4, PSMB3, PSMB2, PSMB10, PSMB1, PSMA7, PSMA6, PSMA5, PSMA4, PSMA3, PSMA1"
"20","Activation of ATR in response to replication stress",0.0104501607717042,0.0168529576889705,0.275886882060876,1.88231734977644,51,33,"ATR, ATRIP, CDC25A, CDC45, CDC6, CDC7, CDK2, CHEK1, DBF4, HUS1, MCM10, MCM3, MCM4, MCM6, MCM7, MCM8, ORC1, ORC2, ORC3, ORC4, ORC5, ORC6, RAD1, RAD17, RAD9A, RAD9B, RFC2, RFC3, RFC4, RFC5, RPA1, RPA2, RPA3"
"21","Activation of BAD and translocation to mitochondria",0.0260437375745527,0.037320158257929,-0.366295364714337,-1.71648833910445,130,15,"YWHAZ, YWHAQ, YWHAH, YWHAG, YWHAE, YWHAB"
"22","Activation of BH3-only proteins",0.011519364448858,0.0184020035849681,-0.306128972963469,-1.8941055201328,57,27,"YWHAZ, YWHAQ, YWHAH, YWHAG, YWHAE, YWHAB, TP73, TP63, TP53BP2, TP53, TFDP2, TFDP1"
"23","Activation of G protein gated Potassium channels",0.000200360649168503,0.000551454923716307,0.572989290591533,2.84827262574376,0,17,"GABBR1, GABBR2, GNB1, GNG12, GNG2, GNG3, GNG4, GNG7, GNGT2, KCNJ10, KCNJ12, KCNJ16, KCNJ2, KCNJ3, KCNJ4, KCNJ6, KCNJ9"
"24","Activation of GABAB receptors",0.000201126307320998,0.000551454923716307,0.573483922019999,3.6738082561191,0,29,"ADCY1, ADCY2, ADCY3, ADCY5, ADCY6, ADCY7, ADCY8, ADCY9, GABBR1, GABBR2, GNAI1, GNAI2, GNAI3, GNAL, GNB1, GNG12, GNG2, GNG3, GNG4, GNG7, GNGT2, KCNJ10, KCNJ12, KCNJ16, KCNJ2, KCNJ3, KCNJ4, KCNJ6, KCNJ9"
"25","Activation of HOX genes during differentiation",0.0244096050803731,0.0352776084803116,-0.222614332012964,-1.76627022156596,122,45,"ZNF335, YY1, WDR5, SUZ12, RBBP7, RBBP5, RARG, RARB, RARA, POLR2L, POLR2K, POLR2J, POLR2I, POLR2H, POLR2G, POLR2F, POLR2E, POLR2D, POLR2C, POLR2B, POLR2A, PKNOX1, PIAS2, PCGF2, PBX1, PAXIP1, PAX6, NCOR1, NCOA6, NCOA3, MEIS1, MAFB, KMT2D, KMT2C, KDM6A, JUN"
"26","Activation of Matrix Metalloproteinases",0.106629392971246,0.128207648826966,-0.275685259727813,-1.40696577046403,533,18,"TIMP2, TIMP1, SPOCK3, PRSS2, PRSS1, MMP9, MMP24, MMP2, MMP1, MMP17, MMP16, MMP15, MMP14, KLKB1, KLK2"
"27","Activation of NF-kappaB in B cells",0.000198216055500496,0.000551454923716307,-0.421534374796468,-3.911976720385,0,62,"UBC, UBB, SKP1, RPS27A, RELA, REL, PSMF1, PSME4, PSME3, PSME2, PSME1, PSMD9, PSMD8, PSMD7, PSMD6, PSMD5, PSMD4, PSMD3, PSMD2, PSMD14, PSMD13, PSMD12, PSMD11, PSMD10, PSMD1, PSMC6, PSMC5, PSMC4, PSMC3, PSMC2, PSMC1, PSMB8, PSMB7, PSMB6, PSMB5, PSMB4, PSMB3, PSMB2, PSMB10, PSMB1, PSMA7, PSMA6, PSMA5, PSMA4, PSMA3, PSMA1, PRKCB"
"28","Activation of NMDA receptors and postsynaptic events",0.00020124773596297,0.000551454923716307,0.256353475496169,2.53622585309292,0,71,"ACTN2, ADCY1, ADCY8, APBA1, ARHGEF7, CALM1, CAMK1, CAMK2A, CAMK2B, CAMK2G, CAMK4, CAMKK1, CAMKK2, CASK, CREB1, DLG1, DLG2, DLG3, DLG4, ERBB4, GIT1, GRIA1, GRIA2, GRIA3, GRIA4, GRIN1, GRIN2A, GRIN2B, GRIN2D, GRIN3A, GRIN3B, HRAS, KIF17, KPNA2, KRAS, LIN7A, LIN7B, LIN7C, LRRC7, MAPK1, MAPK3, MAPT, NEFL, NRAS, NRG1, NRGN, PDPK1, PPM1E, PPM1F, PRKAA1, PRKAA2, PRKAB1, PRKAB2, PRKACA, PRKACB, PRKAG1, PRKAG2, PRKAG3, PRKAR1A, PRKAR1B, PRKAR2A, PRKAR2B, PRKX, RAC1, RASGRF1, RASGRF2, RPS6KA1, RPS6KA2, RPS6KA3, RPS6KA6"
"29","Activation of SMO",0.0257441673370877,0.0369958614066211,0.365073661516349,1.70642473370774,127,15,"ARRB1, ARRB2, BOC, CDON, CSNK1A1, EFCAB7, EVC, EVC2, GAS1, GRK2, IHH, KIF3A"
"30","Activation of anterior HOX genes in hindbrain development during early embryogenesis",0.0244096050803731,0.0352776084803116,-0.222614332012964,-1.76627022156596,122,45,"ZNF335, YY1, WDR5, SUZ12, RBBP7, RBBP5, RARG, RARB, RARA, POLR2L, POLR2K, POLR2J, POLR2I, POLR2H, POLR2G, POLR2F, POLR2E, POLR2D, POLR2C, POLR2B, POLR2A, PKNOX1, PIAS2, PCGF2, PBX1, PAXIP1, PAX6, NCOR1, NCOA6, NCOA3, MEIS1, MAFB, KMT2D, KMT2C, KDM6A, JUN"
"31","Activation of gene expression by SREBF (SREBP)",0.474884002420819,0.493182498812677,0.129157667386609,0.968904608426307,2353,40,"ACACA, ACACB, CARM1, CHD9, CREBBP, CYP51A1, DHCR7, ELOVL6, FASN, FDFT1, GGPS1, GPAM, HELZ2, HMGCR, HMGCS1, IDI1, LSS, MED1, MTF1, MVD, MVK, NCOA1, NCOA2, NCOA6, NFYA, NFYB, NFYC, PMVK, PPARA, SC5D, SCD, SMARCD3, SP1, SQLE, SREBF1, SREBF2, TBL1X, TBL1XR1, TGS1, TM7SF2"
"32","Activation of kainate receptors upon glutamate binding",0.000200360649168503,0.000551454923716307,0.501326901456323,2.81288944133679,0,22,"CALM1, DLG1, DLG3, DLG4, GNB1, GNB4, GNB5, GNG12, GNG13, GNG2, GNG3, GNG4, GNG7, GNGT2, GRIK1, GRIK2, GRIK3, GRIK4, GRIK5"
"33","Activation of the mRNA upon binding of the cap-binding complex and eIFs, and subsequent binding to 43S",0.00120675784392599,0.0026310428528515,0.269485664889785,2.20813387506487,5,48,"EIF1AX, EIF2S1, EIF2S2, EIF2S3, EIF3A, EIF3B, EIF3C, EIF3D, EIF3E, EIF3F, EIF3G, EIF3H, EIF3I, EIF3J, EIF3K, EIF3L, EIF3M, EIF4A1, EIF4A2, EIF4E, EIF4EBP1, EIF4G1, EIF4H, FAU, RPS18, RPS11, RPS12, RPS13, RPS14, RPS15, RPS15A, RPS16, RPS17, RPS19, RPS20, RPS21, RPS24, RPS25, RPS27A, RPS27L, RPS28, RPS3A, RPS4X, RPS5, RPS7, RPS8, RPS9, RPSA"
"34","Activation of the pre-replicative complex",0.0121151936444886,0.0192931610388721,-0.305212570694841,-1.88843548315829,60,27,"RPA3, RPA2, RPA1, PRIM2, PRIM1, POLE4, POLE3, POLE2, POLA2, POLA1, ORC6, ORC5, ORC4, ORC3, ORC2, ORC1, MCM8, MCM7, MCM6, MCM4, MCM3, MCM10"
"35","Acyl chain remodelling of PC",0.00119808306709265,0.0026310428528515,-0.461615871190339,-2.35586672464454,5,18,"TMEM86B, PNPLA8, PLBD1, PLB1, PLAAT3, PLA2G6, PLA2G5, PLA2G4E, PLA2G4C, PLA2G4A, PLA2G3, PLA2G12A, PLA2G10, MBOAT2, LPCAT4, LPCAT3, LPCAT2, LPCAT1"
"36","Acyl chain remodelling of PE",0.00718419477150269,0.0121652364797446,-0.402831038258759,-1.99384973576445,35,17,"PNPLA8, PLBD1, PLAAT3, PLAAT1, PLA2G6, PLA2G5, PLA2G4E, PLA2G4C, PLA2G4A, PLA2G3, PLA2G12A, PLA2G10, MBOAT2, MBOAT1, LPCAT4, LPCAT3"
"37","Adherens junctions interactions",0.000201085863663784,0.000551454923716307,0.598921251348436,3.58478224734042,0,25,"AFDN, CADM1, CADM2, CADM3, CDH10, CDH11, CDH12, CDH13, CDH18, CDH2, CDH24, CDH3, CDH4, CDH6, CDH7, CDH8, CDH9, CTNNA1, CTNNB1, CTNND1"
"38","Adrenaline,noradrenaline inhibits insulin secretion",0.000199084212621939,0.000551454923716307,0.64965130491049,3.57559954740435,0,21,"ADCY5, ADCY6, ADRA2A, ADRA2C, CACNA1C, CACNA1D, CACNA2D2, CACNB2, CACNB3, GNAI1, GNAI2, GNB1, GNB4, GNB5, GNG12, GNG13, GNG2, GNG3, GNG4, GNG7, GNGT2"
"39","Aggrephagy",0.219434488251693,0.244457719368114,0.231679587149889,1.21660921193782,1101,19,"ARL13B, DYNC1H1, DYNC1I1, DYNC1I2, DYNC1LI1, DYNC1LI2, DYNLL1, DYNLL2, UBA52, HDAC6, HSF1, IFT88"
"40","Amine ligand-binding receptors",0.000200360649168503,0.000551454923716307,0.606978417266187,3.96266298639196,0,30,"ADRA1A, ADRA1B, ADRA1D, ADRA2A, ADRA2C, ADRB1, ADRB2, ADRB3, CHRM1, CHRM2, CHRM3, CHRM4, DRD2, DRD3, DRD4, DRD5, HRH1, HRH2, HRH3, HRH4, HTR1A, HTR1B, HTR1F, HTR2A, HTR2B, HTR2C, HTR4, HTR5A, HTR6, HTR7"
"41","Amino acid transport across the plasma membrane",0.000199123855037834,0.000551454923716307,-0.775316455696203,-4.70810017944756,0,26,"SLC7A8, SLC7A7, SLC7A6, SLC7A5, SLC7A3, SLC7A11, SLC7A10, SLC7A1, SLC6A6, SLC6A20, SLC6A19, SLC6A15, SLC6A12, SLC43A2, SLC3A2, SLC3A1, SLC38A5, SLC38A3, SLC38A2, SLC38A1, SLC36A4, SLC36A1, SLC25A29, SLC1A5, SLC1A4, SLC16A10"
"42","Amino acids regulate mTORC1",0.00221105527638191,0.0044618332801022,0.258054755043228,2.17060549407846,10,50,"ATP6V0B, ATP6V0C, ATP6V0D1, ATP6V0E1, ATP6V0E2, ATP6V1A, ATP6V1B1, ATP6V1B2, ATP6V1C1, ATP6V1C2, ATP6V1D, ATP6V1E1, ATP6V1F, ATP6V1G1, ATP6V1G2, ATP6V1H, C12orf66, BMT2"
"43","Amplification  of signal from unattached  kinetochores via a MAD2  inhibitory signal",0.0241254523522316,0.0350664657938016,0.171524118849994,1.74429468463329,119,75,"AHCTF1, AURKB, B9D2, BIRC5, BUB3, CDCA8, CENPC, CENPF, CENPH, CENPK, CENPM, CENPN, CENPO, CENPP, CENPQ, CENPT, CENPU, CKAP5, CLASP1, CLASP2, CLIP1, DYNC1H1, DYNC1I1, DYNC1I2, DYNC1LI1, DYNC1LI2, DYNLL1, DYNLL2, INCENP, ITGB3BP, KIF18A, KIF2A, KNL1, KNTC1, MAD1L1, MAD2L1, MAPRE1, MIS12, NDE1, NDEL1, NSL1, NUDC, NUF2, NUP107, NUP133, NUP160, NUP37, NUP43, NUP85, NUP98, PAFAH1B1, PMF1, PPP1CC, PPP2CA, PPP2CB, PPP2R1A, PPP2R1B, PPP2R5A, PPP2R5B, PPP2R5C, PPP2R5D, PPP2R5E"
"44","Amplification of signal from the kinetochores",0.0241254523522316,0.0350664657938016,0.171524118849994,1.74429468463329,119,75,"AHCTF1, AURKB, B9D2, BIRC5, BUB3, CDCA8, CENPC, CENPF, CENPH, CENPK, CENPM, CENPN, CENPO, CENPP, CENPQ, CENPT, CENPU, CKAP5, CLASP1, CLASP2, CLIP1, DYNC1H1, DYNC1I1, DYNC1I2, DYNC1LI1, DYNC1LI2, DYNLL1, DYNLL2, INCENP, ITGB3BP, KIF18A, KIF2A, KNL1, KNTC1, MAD1L1, MAD2L1, MAPRE1, MIS12, NDE1, NDEL1, NSL1, NUDC, NUF2, NUP107, NUP133, NUP160, NUP37, NUP43, NUP85, NUP98, PAFAH1B1, PMF1, PPP1CC, PPP2CA, PPP2CB, PPP2R1A, PPP2R1B, PPP2R5A, PPP2R5B, PPP2R5C, PPP2R5D, PPP2R5E"
"45","Amyloid fiber formation",0.475222112537019,0.493182498812677,-0.125936059907834,-0.969967336786515,2406,42,"USP9X, UBE2L6, UBC, UBB, TTR, TSPAN5, TSPAN33, TSPAN15, TSPAN14"
"46","Anchoring of the basal body to the plasma membrane",0.000200280392549569,0.000551454923716307,0.223991377857268,2.45313952521962,0,87,"ACTR1A, AHI1, AKAP9, ALMS1, B9D1, B9D2, C2CD3, CC2D2A, CCP110, CDK5RAP2, CENPJ, CEP131, CEP135, CEP152, CEP162, CEP164, CEP192, CEP250, CEP290, CEP41, CEP57, CEP63, CEP70, CEP72, CEP76, CEP78, CEP83, CEP89, CEP97, CETN2, CKAP5, CLASP1, CNTRL, CSNK1D, CSNK1E, DCTN1, DCTN2, DCTN3, DYNC1H1, DYNC1I2, DYNLL1"
"47","Antigen Presentation: Folding, assembly and peptide loading of class I MHC",0.0208709612683123,0.0309109280591913,-0.366986488428921,-1.76244612554553,103,16,"TAPBP, TAP2, TAP1, SEC31A, SEC24D, SEC24B, SEC24A, SEC23A, SEC13, SAR1B"
"48","Antigen activates B Cell Receptor (BCR) leading to generation of second messengers",0.67580997813556,0.687998935657043,-0.138410643653362,-0.82603619834491,3399,25,"VAV1, TRPC1, SYK, STIM1, SOS1, SH3KBP1, PTPN6, PLCG2, PIK3R1, PIK3CD, PIK3AP1, ORAI2, ORAI1, NCK1, LYN, ITPR3, ITPR2, ITPR1"
"49","Antigen processing-Cross presentation",0.000197706603400554,0.000551454923716307,-0.386125748935249,-3.97712799511137,0,77,"VAMP8, UBC, UBB, TIRAP, TAPBP, TAP2, TAP1, STX4, SNAP23, SEC61G, SEC61B, SEC61A2, SEC61A1, SEC22B, RPS27A, PSMF1, PSME4, PSME3, PSME2, PSME1, PSMD9, PSMD8, PSMD7, PSMD6, PSMD5, PSMD4, PSMD3, PSMD2, PSMD14, PSMD13, PSMD12, PSMD11, PSMD10, PSMD1, PSMC6, PSMC5, PSMC4, PSMC3, PSMC2, PSMC1, PSMB8, PSMB7, PSMB6, PSMB5, PSMB4, PSMB3, PSMB2, PSMB10, PSMB1, PSMA7, PSMA6, PSMA5, PSMA4, PSMA3, PSMA1"
"50","Antigen processing: Ubiquitination & Proteasome degradation",0.000198491464867011,0.000551454923716307,-0.186040491490874,-3.54431502077116,0,277,"ZNRF2, ZNRF1, ZBTB16, WWP1, WSB1, UNKL, UFL1, UBR4, UBR2, UBR1, UBOX5, UBE4A, UBE3C, UBE3B, UBE3A, UBE2Z, UBE2W, UBE2V2, UBE2U, UBE2S, UBE2R2, UBE2Q2, UBE2Q1, UBE2O, UBE2N, UBE2M, UBE2L6, UBE2K, UBE2J2, UBE2J1, UBE2H, UBE2G2, UBE2G1, UBE2F, UBE2E3, UBE2E2, UBE2E1, UBE2D3, UBE2D2, UBE2D1, UBE3D, UBE2B, UBE2A, UBC, UBB, UBAC1, UBA6, UBA5, UBA3, UBA1, TRIP12, TRIM9, TRIM71, TRIM39, TRIM37, TRIM36, TRIM32, TRIM21, TRIM11, TRAIP, TRAF7, TPP2, THOP1, STUB1, SPSB2, SPSB1, SOCS3, SOCS1, SMURF2, SMURF1, SKP2, SKP1, SIAH2, SIAH1, SH3RF1, RPS27A, RNF7, RNF6, RNF41, RNF4, RNF34, RNF25, RNF220, RNF217, RNF213, RNF19B, RNF19A, RNF182, RNF144B, RNF14, RNF138, RNF130, RNF126, RNF123, RNF115, RNF114, RNF111, RLIM, RCHY1, RBX1, RBCK1, RBBP6, PSMF1, PSME4, PSME3, PSME2, PSME1, PSMD9, PSMD8, PSMD7, PSMD6, PSMD5, PSMD4, PSMD3, PSMD2, PSMD14, PSMD13, PSMD12, PSMD11, PSMD10, PSMD1, PSMC6, PSMC5, PSMC4, PSMC3, PSMC2, PSMC1, PSMB8, PSMB7, PSMB6, PSMB5, PSMB4, PSMB3, PSMB2, PSMB10, PSMB1, PSMA7, PSMA6, PSMA5, PSMA4, PSMA3, PSMA1"
"51","Antimicrobial peptides",0.246844319775596,0.271715957629475,0.238042287999797,1.18328447636305,1231,17,"ATOX1, ATP7A, BPIFB2, CAMP, CD4, CHGA, CLU"
"52","Antiviral mechanism by IFN-stimulated genes",0.00556660039761431,0.0098018474938928,-0.202111230655504,-1.96723887282145,27,69,"UBE2N, UBE2L6, UBE2E1, UBC, UBB, TRIM25, TPR, STAT1, SEH1L, SEC13, RPS27A, RNASEL, RANBP2, RAE1, PPM1B, POM121C, POM121, PLCG1, PIN1, PDE12, NUP42, NUP58, NUP98, NUP93, NUP88, NUP85, NUP54, NUP50, NUP43, NUP37, NUP35, NUP214, NUP210, NUP205, NUP188, NUP160, NUP155, NUP153, NUP133, NUP107, NEDD4, NDC1, MX1, MAPK3, KPNB1, KPNA7, KPNA4, KPNA3, KPNA2, KPNA1, JAK1, ISG15, IRF3, UBA52, FLNB, FLNA, EIF4G3, EIF4G2, EIF4G1, EIF4E2, EIF4E, EIF4A3, EIF4A2, EIF4A1, EIF2AK2"
"53","Apoptosis",0.0002000400080016,0.000551454923716307,-0.192569866951351,-2.70879239405806,0,147,"YWHAZ, YWHAQ, YWHAH, YWHAG, YWHAE, YWHAB, XIAP, UNC5B, UNC5A, UBC, UBB, UACA, TP73, TP63, TP53BP2, TP53, TRAF2, TRADD, TNFSF10, TNFRSF10B, TJP2, TJP1, TICAM1, TFDP2, TFDP1, STK26, STK24, STAT3, SPTAN1, SFN, SATB1, RPS27A, ROCK1, RIPK1, PTK2, PSMF1, PSME4, PSME3, PSME2, PSME1, PSMD9, PSMD8, PSMD7, PSMD6, PSMD5, PSMD4, PSMD3, PSMD2, PSMD14, PSMD13, PSMD12, PSMD11, PSMD10, PSMD1, PSMC6, PSMC5, PSMC4, PSMC3, PSMC2, PSMC1, PSMB8, PSMB7, PSMB6, PSMB5, PSMB4, PSMB3, PSMB2, PSMB10, PSMB1, PSMA7, PSMA6, PSMA5, PSMA4, PSMA3, PSMA1, PRKCD, PPP3R1, PPP3CC, PPP1R13B"
"54","Apoptotic cleavage of cellular proteins",0.0345659163987138,0.0476512497436815,0.24076702841904,1.64270207942425,171,33,"ACIN1, ADD1, APC, BCAP31, BIRC2, BMX, CASP3, CASP6, CASP7, CASP8, CTNNB1, DBNL, DSG1, DSG2, DSG3, DSP"
"55","Apoptotic execution phase",0.0248133951987089,0.0358102407981367,0.231011519078474,1.73298364676026,122,40,"ACIN1, ADD1, APC, BCAP31, BIRC2, BMX, CASP3, CASP6, CASP7, CASP8, CTNNB1, DBNL, DFFA, DFFB, DNM1L, DSG1, DSG2, DSG3, DSP"
"56","Apoptotic factor-mediated response",0.000603378921962993,0.0014318611658394,0.505090429991616,2.36089012534302,2,15,"APAF1, APIP, AVEN, BAK1, BAX, C1QBP, CASP3, CASP7, CASP9, CYCS, DIABLO"
"57","Aquaporin-mediated transport",0.00119688809096349,0.0026310428528515,0.359148604332175,2.38210927457171,5,31,"ADCY1, ADCY2, ADCY3, ADCY5, ADCY6, ADCY7, ADCY8, ADCY9, AQP11, AQP12A, AQP4, GNAS, GNB1, GNB4, GNB5, GNG12, GNG13, GNG2, GNG3, GNG4, GNG7, GNGT2"
"58","Arachidonic acid metabolism",0.00181378476420798,0.00375316765872772,0.299533547823808,2.21633808111245,8,39,"ABCC1, ALOX12, ALOX12B, ALOX5, ALOX15B, ALOXE3, CBR1, CYP2J2, CYP2U1, CYP4F11, CYP4A22, CYP4A11, CYP4F8, CYP4F2, CYP4F3, EPHX2, FAAH, GGT5, GPX1, GPX2, GPX4, HPGD, HPGDS, LTA4H, LTC4S, MAPKAPK2, PLA2G4A, PON2, PON3, PRXL2B, PTGDS, PTGES, PTGES2, PTGES3, PTGIS, PTGR2, PTGS1, PTGS2"
"59","Asparagine N-linked glycosylation",0.0024174053182917,0.00479541603538035,0.115899309447697,2.14952005610582,11,259,"ACTR10, ACTR1A, ALG1, ALG10, ALG10B, ALG11, ALG12, ALG14, ALG2, ALG3, ALG5, ALG6, ALG8, ALG9, AMDHD2, AMFR, ANK1, ANK2, ANK3, ANKRD28, ARCN1, AREG, ARF1, ARF3, ARF4, ARF5, ARFGAP1, ARFGAP2, ARFGAP3, B4GALNT2, B4GALT1, B4GALT2, B4GALT3, B4GALT4, B4GALT5, B4GALT6, CALR, CANX, CAPZA1, CAPZA2, CAPZB, CD55, CD59, CHST10, CHST8, CMAS, CNIH1, CNIH2, CNIH3, COG1, COG2, COG3, COG4, COG5, COG6, COG7, COG8, COPA, COPB1, COPB2, COPE, COPG1, COPG2, COPZ1, COPZ2, CSNK1D, CTSA, CTSC, CTSZ, DAD1, DCTN1, DCTN2, DCTN3, DCTN4, DCTN5, DCTN6, DDOST, DERL1, DERL2, DHDDS, DOLK, DOLPP1, DPAGT1, DPM2, DPM3, DYNC1H1, DYNC1I1, DYNC1I2, DYNC1LI1, DYNC1LI2, DYNLL1, DYNLL2, EDEM1, EDEM2, EDEM3"
"60","Assembly Of The HIV Virion",0.000802729279550472,0.00183190058333232,-0.473237386804657,-2.27271418740176,3,16,"VPS37D, VPS37C, VPS37B, VPS37A, VPS28, UBC, UBB, UBAP1, TSG101"
"61","Assembly and cell surface presentation of NMDA receptors",0.000200360649168503,0.000551454923716307,0.488195152560985,2.73920865998099,0,22,"ACTN2, APBA1, CAMK2A, CAMK2B, CAMK2G, CASK, DLG1, DLG2, DLG3, DLG4, GRIN1, GRIN2A, GRIN2B, GRIN2D, GRIN3A, GRIN3B, KIF17, LIN7A, LIN7B, LIN7C, LRRC7"
"62","Assembly of collagen fibrils and other multimeric structures",0.000202634245187437,0.000551454923716307,0.446676432424651,3.21821266943422,0,37,"BMP1, CD151, COL11A1, COL11A2, COL15A1, COL18A1, COL2A1, COL4A1, COL4A2, COL4A3, COL4A4, COL4A5, COL5A1, COL5A2, COL5A3, COL6A1, COL6A2, COL6A3, COL6A5, COL6A6, COL8A1, COL9A2, CTSB, CTSS"
"63","Assembly of the pre-replicative complex",0.00019739439399921,0.000551454923716307,-0.435802211351072,-3.92268803991284,0,58,"UBC, UBB, RPS27A, PSMF1, PSME4, PSME3, PSME2, PSME1, PSMD9, PSMD8, PSMD7, PSMD6, PSMD5, PSMD4, PSMD3, PSMD2, PSMD14, PSMD13, PSMD12, PSMD11, PSMD10, PSMD1, PSMC6, PSMC5, PSMC4, PSMC3, PSMC2, PSMC1, PSMB8, PSMB7, PSMB6, PSMB5, PSMB4, PSMB3, PSMB2, PSMB10, PSMB1, PSMA7, PSMA6, PSMA5, PSMA4, PSMA3, PSMA1, ORC6, ORC5, ORC4, ORC3, ORC2, ORC1"
"64","Association of TriC/CCT with target proteins during biosynthesis",0.00060459492140266,0.0014318611658394,0.340628224509874,2.52040985381387,2,39,"AP3M1, ARFGEF2, CCNE1, CCNE2, CCT2, CCT3, CCT4, CCT5, CCT6A, CCT6B, CCT7, CCT8, DCAF7, FBXL3, FBXL5, FBXO4, FBXO6, FBXW10, FBXW2, FBXW4, FBXW5, FBXW7, FBXW9, FKBP9, GAPDHS, GBA"
"65","Asymmetric localization of PCP proteins",0.000198491464867011,0.000551454923716307,-0.504254762184781,-4.48593883379794,0,57,"WNT5A, UBC, UBB, SMURF2, SMURF1, SCRIB, RPS27A, PSMF1, PSME4, PSME3, PSME2, PSME1, PSMD9, PSMD8, PSMD7, PSMD6, PSMD5, PSMD4, PSMD3, PSMD2, PSMD14, PSMD13, PSMD12, PSMD11, PSMD10, PSMD1, PSMC6, PSMC5, PSMC4, PSMC3, PSMC2, PSMC1, PSMB8, PSMB7, PSMB6, PSMB5, PSMB4, PSMB3, PSMB2, PSMB10, PSMB1, PSMA7, PSMA6, PSMA5, PSMA4, PSMA3, PSMA1, PRICKLE1"
"66","Attenuation phase",0.00537527374079236,0.00951442181297044,0.369065593021305,2.03129087465055,26,21,"COL4A6, CREBBP, DEDD2, DNAJB1, DNAJB6, EP300, FKBP4, HSBP1, HSF1, HSP90AB1, HSPA1B, HSPA1A, HSPA1L, HSPA2, HSPA8, HSPH1"
"67","Autodegradation of Cdh1 by Cdh1:APC/C",0.00019739439399921,0.000551454923716307,-0.43011722944756,-3.87151709598649,0,58,"UBE2E1, UBE2D1, UBC, UBB, RPS27A, PSMF1, PSME3, PSME2, PSME1, PSMD9, PSMD8, PSMD7, PSMD6, PSMD5, PSMD4, PSMD3, PSMD2, PSMD14, PSMD13, PSMD12, PSMD11, PSMD10, PSMD1, PSMC6, PSMC5, PSMC4, PSMC3, PSMC2, PSMC1, PSMB8, PSMB7, PSMB6, PSMB5, PSMB4, PSMB3, PSMB2, PSMB10, PSMB1, PSMA7, PSMA6, PSMA5, PSMA4, PSMA3, PSMA1"
"68","Autodegradation of the E3 ubiquitin ligase COP1",0.000198807157057654,0.000551454923716307,-0.628302205854722,-5.0356822424374,0,46,"UBC, UBB, TP53, RPS27A, PSMF1, PSME4, PSME3, PSME2, PSME1, PSMD9, PSMD8, PSMD7, PSMD6, PSMD5, PSMD4, PSMD3, PSMD2, PSMD14, PSMD13, PSMD12, PSMD11, PSMD10, PSMD1, PSMC6, PSMC5, PSMC4, PSMC3, PSMC2, PSMC1, PSMB8, PSMB7, PSMB6, PSMB5, PSMB4, PSMB3, PSMB2, PSMB10, PSMB1, PSMA7, PSMA6, PSMA5, PSMA4, PSMA3, PSMA1"
"69","Autophagy",0.127902321857486,0.15040365625834,-0.111071126122867,-1.3604266854411,638,111,"WIPI2, WIPI1, WDR45B, VPS37D, VPS37C, VPS37B, VPS37A, VPS28, VDAC1, VCP, UVRAG, ULK1, UBE2N, UBC, UBB, UBAP1, TSG101, TSC2, TSC1, TOMM70, TOMM7, TOMM40, TOMM22, TOMM20"
