"","pathway","pval","padj","ES","NES","nMoreExtreme","size","leadingEdge"
"1","A tetrasaccharide linker sequence is required for GAG synthesis",0.0364992150706436,0.0969897719784841,0.314849290780142,1.63995894408602,185,24,"AGRN, B3GALT6, B3GAT1, B3GAT2, B3GAT3, B4GALT7, BCAN, BGN, CSPG4, CSPG5, DCN, GPC1, GPC3, GPC4, GPC5, GPC6, HSPG2"
"2","ABC transporter disorders",0.0376016260162602,0.0969897719784841,-0.345498199279712,-2.56975246130265,184,70,"VCP, UBC, UBB, SEL1L, RPS27A, RNF5, RNF185, PSMF1, PSME4, PSME3, PSME2, PSME1, PSMD9, PSMD8, PSMD7, PSMD6, PSMD5, PSMD4, PSMD3, PSMD2, PSMD14, PSMD13, PSMD12, PSMD11, PSMD10, PSMD1, PSMC6, PSMC5, PSMC4, PSMC3, PSMC2, PSMC1, PSMB7, PSMB6, PSMB5, PSMB4, PSMB3, PSMB2, PSMB10, PSMB1, PSMA8, PSMA7, PSMA6, PSMA5, PSMA4, PSMA3, PSMA1"
"3","ABC transporters in lipid homeostasis",0.0214711729622266,0.0969897719784841,0.817251461988304,3.66309228377412,107,16,"ABCA12, ABCA2, ABCA3, ABCA5, ABCA6, ABCA7, ABCA9, ABCD1, ABCD2, ABCD3, ABCG1, ABCG4, ABCG8, APOA1"
"4","ABC-family proteins mediated transport",0.103602726387537,0.140613348330411,0.315491976861524,1.72947600317827,531,94,"ABCA12, ABCA2, ABCA3, ABCA4, ABCA5, ABCA6, ABCA7, ABCA8, ABCA9, ABCB10, ABCB1, ABCB4, ABCB5, ABCB7, ABCB8, ABCB9, ABCC1, ABCC10, ABCC2, ABCC3, ABCC4, ABCC5, ABCC6, ABCC9, ABCD1, ABCD2, ABCD3, ABCF1, ABCG1, ABCG4, ABCG8"
"5","ADP signalling through P2Y purinoceptor 1",0.0238001573564123,0.0969897719784841,0.491025170103724,2.35775881495119,120,19,"GNA11, GNA14, GNA15, GNB1, GNB3, GNB4, GNB5, GNG11, GNG12, GNG13, GNG2, GNG3, GNG4, GNG7, GNG8, GNGT2"
"6","ADP signalling through P2Y purinoceptor 12",0.0219107777339124,0.0969897719784841,0.590143041997819,2.71269954785491,110,17,"GNAI1, GNAI2, GNAI3, GNB1, GNB3, GNB4, GNB5, GNG11, GNG12, GNG13, GNG2, GNG3, GNG4, GNG7, GNG8, GNGT2"
"7","APC-Cdc20 mediated degradation of Nek2A",0.0269631962212163,0.0969897719784841,0.475259810764697,2.34450779093717,136,21,"ANAPC1, ANAPC10, ANAPC15, ANAPC16, ANAPC2, ANAPC4, ANAPC5, ANAPC7, BUB3, CDC16, CDC23, CDC26, CDC27"
"8","APC/C-mediated degradation of cell cycle proteins",0.0404600533990552,0.0969897719784841,-0.322698014892811,-2.39619728060391,196,74,"UBE2E1, UBE2D1, UBC, UBB, SKP2, SKP1, RPS27A, PTTG1, PSMF1, PSME4, PSME3, PSME2, PSME1, PSMD9, PSMD8, PSMD7, PSMD6, PSMD5, PSMD4, PSMD3, PSMD2, PSMD14, PSMD13, PSMD12, PSMD11, PSMD10, PSMD1, PSMC6, PSMC5, PSMC4, PSMC3, PSMC2, PSMC1, PSMB7, PSMB6, PSMB5, PSMB4, PSMB3, PSMB2, PSMB10, PSMB1, PSMA8, PSMA7, PSMA6, PSMA5, PSMA4, PSMA3, PSMA1"
"9","APC/C:Cdc20 mediated degradation of Cyclin B",0.0227497527200791,0.0969897719784841,0.522841065177899,2.46233395535525,114,18,"ANAPC1, ANAPC10, ANAPC15, ANAPC16, ANAPC2, ANAPC4, ANAPC5, ANAPC7, CDC16, CDC23, CDC26, CDC27"
"10","APC/C:Cdc20 mediated degradation of Securin",0.0333197056418643,0.0969897719784841,-0.453902936309366,-3.25445855585032,162,59,"UBE2E1, UBE2D1, UBC, UBB, RPS27A, PTTG1, PSMF1, PSME4, PSME3, PSME2, PSME1, PSMD9, PSMD8, PSMD7, PSMD6, PSMD5, PSMD4, PSMD3, PSMD2, PSMD14, PSMD13, PSMD12, PSMD11, PSMD10, PSMD1, PSMC6, PSMC5, PSMC4, PSMC3, PSMC2, PSMC1, PSMB7, PSMB6, PSMB5, PSMB4, PSMB3, PSMB2, PSMB10, PSMB1, PSMA8, PSMA7, PSMA6, PSMA5, PSMA4, PSMA3, PSMA1"
"11","APC/C:Cdc20 mediated degradation of mitotic proteins",0.0361788617886179,0.0969897719784841,-0.392883333333333,-2.85031973473172,177,64,"UBE2E1, UBE2D1, UBC, UBB, RPS27A, PTTG1, PSMF1, PSME4, PSME3, PSME2, PSME1, PSMD9, PSMD8, PSMD7, PSMD6, PSMD5, PSMD4, PSMD3, PSMD2, PSMD14, PSMD13, PSMD12, PSMD11, PSMD10, PSMD1, PSMC6, PSMC5, PSMC4, PSMC3, PSMC2, PSMC1, PSMB7, PSMB6, PSMB5, PSMB4, PSMB3, PSMB2, PSMB10, PSMB1, PSMA8, PSMA7, PSMA6, PSMA5, PSMA4, PSMA3, PSMA1"
"12","APC/C:Cdh1 mediated degradation of Cdc20 and other APC/C:Cdh1 targeted proteins in late mitosis/early G1",0.0360342019543974,0.0969897719784841,-0.420253464583843,-3.03433739845744,176,63,"UBE2E1, UBE2D1, UBC, UBB, SKP2, RPS27A, PTTG1, PSMF1, PSME4, PSME3, PSME2, PSME1, PSMD9, PSMD8, PSMD7, PSMD6, PSMD5, PSMD4, PSMD3, PSMD2, PSMD14, PSMD13, PSMD12, PSMD11, PSMD10, PSMD1, PSMC6, PSMC5, PSMC4, PSMC3, PSMC2, PSMC1, PSMB7, PSMB6, PSMB5, PSMB4, PSMB3, PSMB2, PSMB10, PSMB1, PSMA8, PSMA7, PSMA6, PSMA5, PSMA4, PSMA3, PSMA1"
"13","APC:Cdc20 mediated degradation of cell cycle proteins prior to satisfation of the cell cycle checkpoint",0.0360342019543974,0.0969897719784841,-0.388374108392774,-2.80416030086922,176,63,"UBE2E1, UBE2D1, UBC, UBB, RPS27A, PSMF1, PSME4, PSME3, PSME2, PSME1, PSMD9, PSMD8, PSMD7, PSMD6, PSMD5, PSMD4, PSMD3, PSMD2, PSMD14, PSMD13, PSMD12, PSMD11, PSMD10, PSMD1, PSMC6, PSMC5, PSMC4, PSMC3, PSMC2, PSMC1, PSMB7, PSMB6, PSMB5, PSMB4, PSMB3, PSMB2, PSMB10, PSMB1, PSMA8, PSMA7, PSMA6, PSMA5, PSMA4, PSMA3, PSMA1"
"14","ATF4 activates genes in response to endoplasmic reticulum  stress",0.0274240940254652,0.0969897719784841,0.459095862613205,2.34996408424635,139,23,"ASNS, ATF4, ATF6, CCL2, CEBPB, CEBPG, DCP2, DDIT3, DIS3, EXOSC1, EXOSC2, EXOSC3, EXOSC4, EXOSC5, EXOSC7, EXOSC8, EXOSC9"
"15","AUF1 (hnRNP D0) binds and destabilizes mRNA",0.0281862745098039,0.0969897719784841,-0.551810094667238,-3.79726731424404,137,49,"UBC, UBB, RPS27A, PSMF1, PSME4, PSME3, PSME2, PSME1, PSMD9, PSMD8, PSMD7, PSMD6, PSMD5, PSMD4, PSMD3, PSMD2, PSMD14, PSMD13, PSMD12, PSMD11, PSMD10, PSMD1, PSMC6, PSMC5, PSMC4, PSMC3, PSMC2, PSMC1, PSMB7, PSMB6, PSMB5, PSMB4, PSMB3, PSMB2, PSMB10, PSMB1, PSMA8, PSMA7, PSMA6, PSMA5, PSMA4, PSMA3, PSMA1"
"16","AURKA Activation by TPX2",0.0718232044198895,0.114324091438998,0.244621063516186,1.46234664740707,363,67,"ACTR1A, AKAP9, ALMS1, AURKA, CCP110, CDK5RAP2, CENPJ, CEP131, CEP135, CEP152, CEP164, CEP192, CEP250, CEP290, CEP41, CEP57, CEP63, CEP70, CEP72, CEP76, CEP78, CETN2, CKAP5, CLASP1, CNTRL, CSNK1D, CSNK1E, DCTN1, DCTN2, DCTN3, DYNC1H1, DYNC1I2, DYNLL1"
"17","Abortive elongation of HIV-1 transcript in the absence of Tat",0.0108229528282622,0.0969897719784841,-0.413279066204548,-2.25741373443774,52,23,"SUPT5H, SUPT4H1, POLR2L, POLR2K, POLR2J, POLR2I, POLR2H, POLR2G, POLR2F, POLR2E, POLR2D, POLR2C, POLR2B, POLR2A, NELFE, NELFCD, NELFB, NELFA, NCBP2, NCBP1"
"18","Acetylcholine Neurotransmitter Release Cycle",0.00623491552695093,0.0969897719784841,-0.525252525252525,-2.46479600146299,30,16,"VAMP2, UNC13B, TSPOAP1, SYT1, STXBP1, STX1A, SNAP25, SLC5A7, RIMS1, RAB3A, PPFIA4, PPFIA3, PPFIA2, PPFIA1"
"19","Activated NOTCH1 Transmits Signal to the Nucleus",0.094836049479678,0.13393047031758,0.2293202075296,1.26689186229122,482,30,"ADAM10, ADAM17, APH1A, APH1B, ARRB1, ARRB2, CNTN1, DLK1, DLL1, DLL4, DNER, DTX1, DTX2, DTX4, UBA52, ITCH, JAG2, MIB1, MIB2, NCSTN, NEURL1, NEURL1B, NOTCH1, NUMB, PSEN1, PSEN2, PSENEN"
"20","Activation of APC/C and APC/C:Cdc20 mediated degradation of mitotic proteins",0.0368271954674221,0.0969897719784841,-0.381803915132804,-2.77392108798282,181,65,"UBE2E1, UBE2D1, UBC, UBB, RPS27A, PTTG1, PSMF1, PSME4, PSME3, PSME2, PSME1, PSMD9, PSMD8, PSMD7, PSMD6, PSMD5, PSMD4, PSMD3, PSMD2, PSMD14, PSMD13, PSMD12, PSMD11, PSMD10, PSMD1, PSMC6, PSMC5, PSMC4, PSMC3, PSMC2, PSMC1, PSMB7, PSMB6, PSMB5, PSMB4, PSMB3, PSMB2, PSMB10, PSMB1, PSMA8, PSMA7, PSMA6, PSMA5, PSMA4, PSMA3, PSMA1"
"21","Activation of ATR in response to replication stress",0.046996879875195,0.097923887587822,0.274269745159359,1.56784046191162,240,35,"ATR, ATRIP, CDC25A, CDC45, CDC6, CDC7, CDK2, CHEK1, CLSPN, DBF4, HUS1, MCM10, MCM2, MCM4, MCM5, MCM6, MCM7, MCM8, ORC1, ORC2, ORC3, ORC4, ORC5, ORC6, RAD1, RAD17, RAD9A, RAD9B, RFC2, RFC3, RFC4, RFC5, RPA1, RPA2, RPA3"
"22","Activation of BH3-only proteins",0.0304890525885001,0.0969897719784841,-0.291367384942804,-1.69366169623664,148,28,"YWHAZ, YWHAQ, YWHAH, YWHAG, YWHAE, YWHAB, TP73, TP63, TP53BP2, TP53, TFDP2, TFDP1"
"23","Activation of G protein gated Potassium channels",0.00347009593794652,0.0969897719784841,-0.999867056633874,-5.17972747830917,16,20,"KCNJ3"
"24","Activation of GABAB receptors",0.00859774820880246,0.0969897719784841,-0.999866950505588,-6.02217007508644,41,32,"KCNJ3"
"25","Activation of HOX genes during differentiation",0.0793775851881032,0.121287377326837,0.202500316718974,1.22172180669415,402,51,"AJUBA, ASH2L, CNOT6, CREBBP, CTCF, EED, EGR2, EP300, EZH2, H3-3A, HDAC3, HOXB3, HOXB4, JUN, KDM6A, KMT2C, KMT2D, MAFB, MEIS1, NCOA3, NCOA6, NCOR1, PAGR1, PAX6, PAXIP1, PBX1, PCGF2, PIAS2, PKNOX1, POLR2A, POLR2B, POLR2C, POLR2D, POLR2E, POLR2F, POLR2G, POLR2H, POLR2I, POLR2J, POLR2K, POLR2L, RARA, RARB, RARG, RBBP5, RBBP7"
"26","Activation of IRF3/IRF7 mediated by TBK1/IKK epsilon",0.0909090909090909,0.130532915360502,-0.304492291334397,-1.42885820833798,451,16,"UBC, UBB, TRAF3, TLR4, TICAM1, TBK1, TANK, SARM1, RPS27A, PTPN11"
"27","Activation of Matrix Metalloproteinases",0.0646604310695405,0.107785306433194,-0.298745867660177,-1.5099654399229,317,19,"PRSS1, PRSS2, TIMP2, TIMP1, SPOCK3, PLG, MMP9, MMP25, MMP24, MMP2, MMP17, MMP16, MMP15, MMP14, MMP11"
"28","Activation of NF-kappaB in B cells",0.0353514831369362,0.0969897719784841,-0.422575914609235,-3.04696086438887,173,62,"UBC, UBB, SKP1, RPS27A, RELA, REL, PSMF1, PSME4, PSME3, PSME2, PSME1, PSMD9, PSMD8, PSMD7, PSMD6, PSMD5, PSMD4, PSMD3, PSMD2, PSMD14, PSMD13, PSMD12, PSMD11, PSMD10, PSMD1, PSMC6, PSMC5, PSMC4, PSMC3, PSMC2, PSMC1, PSMB7, PSMB6, PSMB5, PSMB4, PSMB3, PSMB2, PSMB10, PSMB1, PSMA8, PSMA7, PSMA6, PSMA5, PSMA4, PSMA3, PSMA1, PRKCB"
"29","Activation of NMDA receptors and postsynaptic events",0.0302971071149335,0.0969897719784841,0.999733208830788,5.92794391191775,154,71,"PRKAG2, ACTN2"
"30","Activation of anterior HOX genes in hindbrain development during early embryogenesis",0.0793775851881032,0.121287377326837,0.202500316718974,1.22172180669415,402,51,"AJUBA, ASH2L, CNOT6, CREBBP, CTCF, EED, EGR2, EP300, EZH2, H3-3A, HDAC3, HOXB3, HOXB4, JUN, KDM6A, KMT2C, KMT2D, MAFB, MEIS1, NCOA3, NCOA6, NCOR1, PAGR1, PAX6, PAXIP1, PBX1, PCGF2, PIAS2, PKNOX1, POLR2A, POLR2B, POLR2C, POLR2D, POLR2E, POLR2F, POLR2G, POLR2H, POLR2I, POLR2J, POLR2K, POLR2L, RARA, RARB, RARG, RBBP5, RBBP7"
"31","Activation of gene expression by SREBF (SREBP)",0.483908491663435,0.503748739821636,0.127870598415763,0.760957305978016,2495,41,"ACACA, ACACB, CARM1, CHD9, CREBBP, CYP51A1, DHCR7, ELOVL6, FASN, FDFT1, FDPS, GGPS1, GPAM, HMGCR, HMGCS1, IDI1, LSS, MED1, MTF1, MVD, MVK, NCOA1, NCOA2, NCOA6, NFYA, NFYB, NFYC, PMVK, PPARA, RXRA, SC5D, SCD, SMARCD3, SP1, SQLE, SREBF1, SREBF2, TBL1X, TBL1XR1, TGS1, TM7SF2"
"32","Activation of kainate receptors upon glutamate binding",0.0299507389162562,0.0969897719784841,0.483206645728258,2.57498501125199,151,26,"CALM1, DLG1, DLG3, DLG4, GNB1, GNB3, GNB4, GNB5, GNG11, GNG12, GNG13, GNG2, GNG3, GNG4, GNG7, GNG8, GNGT2, GRIK1, GRIK2, GRIK3, GRIK4, GRIK5"
"33","Activation of the mRNA upon binding of the cap-binding complex and eIFs, and subsequent binding to 43S",0.0510679611650485,0.0980844051158958,0.268247202983484,1.62470173374609,262,48,"EIF1AX, EIF2S1, EIF2S2, EIF2S3, EIF3A, EIF3B, EIF3C, EIF3D, EIF3E, EIF3F, EIF3G, EIF3H, EIF3I, EIF3J, EIF3K, EIF3L, EIF3M, EIF4A1, EIF4A2, EIF4E, EIF4EBP1, EIF4G1, EIF4H, FAU, RPS18, RPS11, RPS12, RPS13, RPS14, RPS15, RPS15A, RPS16, RPS17, RPS19, RPS20, RPS21, RPS24, RPS25, RPS27A, RPS27L, RPS28, RPS3A, RPS4X, RPS5, RPS7, RPS8, RPS9, RPSA"
"34","Activation of the pre-replicative complex",0.0279079242208189,0.0969897719784841,-0.291086869761873,-1.72071454774215,136,30,"RPA3, RPA2, RPA1, PRIM2, PRIM1, POLE4, POLE3, POLE2, POLE, POLA2, POLA1, ORC6, ORC5, ORC4, ORC3, ORC2, ORC1, MCM8, MCM7, MCM6, MCM5, MCM4, MCM2, MCM10"
"35","Acyl chain remodelling of PC",0.0085348506401138,0.0969897719784841,-0.462873097121585,-2.45393895475521,41,21,"TMEM86B, PNPLA8, PLBD1, PLB1, PLAAT3, PLA2R1, PLA2G6, PLA2G5, PLA2G4F, PLA2G4E, PLA2G4D, PLA2G4C, PLA2G4A, PLA2G3, PLA2G12A, PLA2G10, MBOAT2, LPCAT4, LPCAT3, LPCAT2, LPCAT1"
"36","Acyl chain remodelling of PE",0.00894127209916684,0.0969897719784841,-0.415320525604379,-2.20183722672109,43,21,"PNPLA8, PLBD1, PLAAT5, PLAAT3, PLAAT1, PLA2R1, PLA2G6, PLA2G5, PLA2G4F, PLA2G4E, PLA2G4D, PLA2G4C, PLA2G4A, PLA2G3, PLA2G12A, PLA2G10, MBOAT2, MBOAT1, LPCAT4, LPCAT3"
"37","Acyl chain remodelling of PS",0.00800320128051221,0.0969897719784841,-0.462821449930228,-2.11313046710513,39,15,"PLAAT3, PLA2R1, PLA2G5, PLA2G4F, PLA2G4E, PLA2G4D, PLA2G4A, PLA2G12A, PLA2G10, OSBPL8, OSBPL5, OSBPL10, MBOAT1, LPCAT4, LPCAT3"
"38","Adherens junctions interactions",0.0338716029933045,0.0969897719784841,0.591773218811279,3.23176664525599,171,29,"AFDN, ANG, CADM1, CADM2, CADM3, CDH10, CDH11, CDH12, CDH13, CDH17, CDH18, CDH2, CDH24, CDH3, CDH4, CDH5, CDH6, CDH7, CDH8, CDH9, CTNNA1, CTNNB1, CTNND1"
"39","Adrenaline,noradrenaline inhibits insulin secretion",0.00183448838157358,0.0969897719784841,-0.999933510638298,-5.56027125778075,8,24,"CACNA1C"
"40","Aggrephagy",0.152067411326671,0.185365544720216,0.249375166179208,1.21587347948411,775,20,"ARL13B, CFTR, DYNC1H1, DYNC1I1, DYNC1I2, DYNC1LI1, DYNC1LI2, DYNLL1, DYNLL2, UBA52, HDAC6, HSF1, IFT88"
"41","Amine ligand-binding receptors",0.0338716029933045,0.0969897719784841,0.606252078483538,3.31083797572976,171,29,"ADRA1A, ADRA1B, ADRA1D, ADRA2A, ADRA2C, ADRB1, ADRB3, CHRM1, CHRM2, CHRM3, CHRM4, CHRM5, DRD3, DRD5, GPR143, HRH1, HRH2, HRH3, HRH4, HTR1A, HTR1B, HTR1F, HTR2A, HTR2B, HTR2C, HTR4, HTR5A, HTR6, HTR7"
"42","Amino acid transport across the plasma membrane",0.0122199592668024,0.0969897719784841,-0.776447902121152,-4.37376834604464,59,25,"SLC7A8, SLC7A7, SLC7A6, SLC7A5, SLC7A3, SLC7A2, SLC7A11, SLC7A10, SLC7A1, SLC6A6, SLC6A20, SLC6A15, SLC43A2, SLC3A2, SLC3A1, SLC38A4, SLC38A3, SLC38A2, SLC38A1, SLC36A4, SLC36A1, SLC25A29, SLC1A5, SLC1A4, SLC16A10"
"43","Amino acids regulate mTORC1",0.0538431525555989,0.099955591295894,0.258428133741841,1.56736038955274,275,50,"ATP6V0B, ATP6V0C, ATP6V0D1, ATP6V0E1, ATP6V0E2, ATP6V1A, ATP6V1B1, ATP6V1B2, ATP6V1C1, ATP6V1C2, ATP6V1D, ATP6V1E1, ATP6V1F, ATP6V1G1, ATP6V1G2, ATP6V1H, C12orf66, BMT2"
"44","Amplification  of signal from unattached  kinetochores via a MAD2  inhibitory signal",0.108623060302495,0.144046631560378,0.166355140186916,0.93516658462762,552,84,"AHCTF1, B9D2, BIRC5, BUB1, BUB3, CDCA8, CENPA, CENPC, CENPE, CENPF, CENPH, CENPI, CENPK, CENPL, CENPM, CENPN, CENPO, CENPP, CENPQ, CENPT, CENPU, CKAP5, CLASP1, CLASP2, CLIP1, DSN1, DYNC1H1, DYNC1I1, DYNC1I2, DYNC1LI1, DYNC1LI2, DYNLL1, DYNLL2, ERCC6L, INCENP, ITGB3BP, KIF18A, KIF2A, KIF2C, KNL1, KNTC1, MAD1L1, MAD2L1, MAPRE1, MIS12, NDE1, NDEL1, NSL1, NUDC, NUP107, NUP133, NUP160, NUP37, NUP43, NUP85, NUP98, PAFAH1B1, PLK1, PMF1, PPP1CC, PPP2CA, PPP2CB, PPP2R1A, PPP2R1B, PPP2R5A, PPP2R5B, PPP2R5C, PPP2R5D, PPP2R5E"
"45","Amplification of signal from the kinetochores",0.108623060302495,0.144046631560378,0.166355140186916,0.93516658462762,552,84,"AHCTF1, B9D2, BIRC5, BUB1, BUB3, CDCA8, CENPA, CENPC, CENPE, CENPF, CENPH, CENPI, CENPK, CENPL, CENPM, CENPN, CENPO, CENPP, CENPQ, CENPT, CENPU, CKAP5, CLASP1, CLASP2, CLIP1, DSN1, DYNC1H1, DYNC1I1, DYNC1I2, DYNC1LI1, DYNC1LI2, DYNLL1, DYNLL2, ERCC6L, INCENP, ITGB3BP, KIF18A, KIF2A, KIF2C, KNL1, KNTC1, MAD1L1, MAD2L1, MAPRE1, MIS12, NDE1, NDEL1, NSL1, NUDC, NUP107, NUP133, NUP160, NUP37, NUP43, NUP85, NUP98, PAFAH1B1, PLK1, PMF1, PPP1CC, PPP2CA, PPP2CB, PPP2R1A, PPP2R1B, PPP2R5A, PPP2R5B, PPP2R5C, PPP2R5D, PPP2R5E"
"46","Amyloid fiber formation",0.584627964022895,0.596664422105719,-0.113176642918969,-0.757977493499781,2859,45,"USP9X, UBE2L6, UBC, UBB, TTR, TSPAN5, TSPAN33, TSPAN15, TSPAN14"
"47","Anchoring of the basal body to the plasma membrane",0.10480264437099,0.141503959520364,0.193047777674831,1.05755795936183,538,93,"ACTR1A, AHI1, AKAP9, ALMS1, B9D1, B9D2, C2CD3, CC2D2A, CCP110, CDK5RAP2, CENPJ, CEP131, CEP135, CEP152, CEP162, CEP164, CEP192, CEP250, CEP290, CEP41, CEP57, CEP63, CEP70, CEP72, CEP76, CEP78, CEP83, CEP89, CEP97, CETN2, CKAP5, CLASP1, CNTRL, CSNK1D, CSNK1E, DCTN1, DCTN2, DCTN3, DYNC1H1, DYNC1I2, DYNLL1"
"48","Antigen Presentation: Folding, assembly and peptide loading of class I MHC",0.0275543041029767,0.0969897719784841,-0.368288144603934,-1.72822614373835,136,16,"TAPBP, TAP2, TAP1, SEC31A, SEC24D, SEC24B, SEC24A, SEC23A, SEC13, SAR1B"
"49","Antigen activates B Cell Receptor (BCR) leading to generation of second messengers",0.714257581725089,0.723290021960912,0.125963556299669,0.687906797446534,3626,29,"AHCYL1, BLK, BLNK, BTK, CALM1, CD22, CD79B, DAPP1, FYN, GRB2, IGHM, ITPR1, ITPR2, ITPR3, LYN, NCK1, ORAI1, ORAI2, PIK3AP1, PIK3CD, PIK3R1, PLCG2"
"50","Antigen processing-Cross presentation",0.0426443582942257,0.0969897719784841,-0.387019487453284,-2.91018063089744,208,80,"VAMP8, UBC, UBB, TLR4, TLR2, TIRAP, TAPBP, TAP2, TAP1, STX4, SNAP23, SEC61G, SEC61B, SEC61A2, SEC61A1, SEC22B, RPS27A, PSMF1, PSME4, PSME3, PSME2, PSME1, PSMD9, PSMD8, PSMD7, PSMD6, PSMD5, PSMD4, PSMD3, PSMD2, PSMD14, PSMD13, PSMD12, PSMD11, PSMD10, PSMD1, PSMC6, PSMC5, PSMC4, PSMC3, PSMC2, PSMC1, PSMB7, PSMB6, PSMB5, PSMB4, PSMB3, PSMB2, PSMB10, PSMB1, PSMA8, PSMA7, PSMA6, PSMA5, PSMA4, PSMA3, PSMA1"
"51","Antigen processing: Ubiquitination & Proteasome degradation",0.000214638334406525,0.0751407535729753,-1,-4.91404594275133,0,279,"UBE3A"
"52","Antimicrobial peptides",0.0329282634261074,0.0969897719784841,0.342010694607622,1.84003736044542,167,27,"ATOX1, ATP7A, BPIFB1, CAMP, CCR2, CHGA, CLU, DEFB108B, DEFB127, DEFB121, DEFB132, DEFB104A, DEFB134, DEFB105A, DEFB136, RNASE3"
"53","Antiviral mechanism by IFN-stimulated genes",0.0439244663382594,0.0969897719784841,-0.207191051215336,-1.54200379778848,213,75,"USP41, USP18, UBE2N, UBE2L6, UBE2E1, UBC, UBB, UBA7, TRIM25, TPR, STAT1, SEH1L, SEC13, RPS27A, RNASEL, RANBP2, RAE1, PPM1B, POM121, POM121C, PLCG1, PIN1, PDE12, OASL, OAS3, OAS2, OAS1, NUP42, NUP58, NUP98, NUP93, NUP88, NUP85, NUP54, NUP50, NUP43, NUP37, NUP35, NUP214, NUP210, NUP205, NUP188, NUP160, NUP155, NUP153, NUP133, NUP107, NEDD4, NDC1, MAPK3, KPNB1, KPNA7, KPNA4, KPNA3, KPNA2, KPNA1, JAK1, ISG15, IRF3, UBA52, FLNB, FLNA, EIF4G3, EIF4G2, EIF4G1, EIF4E2, EIF4E, EIF4A3, EIF4A2, EIF4A1, EIF2AK2"
"54","Apoptosis",0.0882784650870203,0.128965725674704,-0.17391281913686,-1.16761825110302,420,156,"YWHAZ, YWHAQ, YWHAH, YWHAG, YWHAE, YWHAB, XIAP, VIM, UNC5B, UNC5A, UBC, UBB, UACA, TP73, TP63, TP53BP2, TP53, TRAF2, TRADD, TNFSF10, TNFRSF10B, TLR4, TJP2, TJP1, TICAM1, TFDP2, TFDP1, STK26, STK24, STAT3, SPTAN1, SATB1, RPS27A, ROCK1, RIPK1, PTK2, PSMF1, PSME4, PSME3, PSME2, PSME1, PSMD9, PSMD8, PSMD7, PSMD6, PSMD5, PSMD4, PSMD3, PSMD2, PSMD14, PSMD13, PSMD12, PSMD11, PSMD10, PSMD1, PSMC6, PSMC5, PSMC4, PSMC3, PSMC2, PSMC1, PSMB7, PSMB6, PSMB5, PSMB4, PSMB3, PSMB2, PSMB10, PSMB1, PSMA8, PSMA7, PSMA6, PSMA5, PSMA4, PSMA3, PSMA1, PRKCQ, PRKCD, PPP3R1, PPP3CC, PPP1R13B"
"55","Apoptotic cleavage of cellular proteins",0.0756862745098039,0.118125055119499,0.227811788365422,1.30890014258913,385,36,"ACIN1, ADD1, APC, BCAP31, BIRC2, BMX, CASP3, CASP6, CASP7, CASP8, CLSPN, CTNNB1, DBNL, DSG1, DSG2, DSG3, DSP"
"56","Apoptotic execution phase",0.0683193441342963,0.111232086306283,0.220791666860194,1.31924273094174,349,43,"ACIN1, ADD1, APC, BCAP31, BIRC2, BMX, CASP3, CASP6, CASP7, CASP8, CLSPN, CTNNB1, DBNL, DFFA, DFFB, DNM1L, DSG1, DSG2, DSG3, DSP"
"57","Apoptotic factor-mediated response",0.0207792207792208,0.0969897719784841,0.477533390922985,2.09149607640246,103,15,"APAF1, APIP, AVEN, BAK1, BAX, C1QBP, CASP3, CASP7, CASP9"
"58","Aquaporin-mediated transport",0.0403744880046811,0.0969897719784841,0.378961113239412,2.19879492866581,206,37,"ADCY1, ADCY2, ADCY3, ADCY5, ADCY6, ADCY7, ADCY8, ADCY9, AQP1, AQP11, AQP12A, AQP4, AQP9, GNAS, GNB1, GNB3, GNB4, GNB5, GNG11, GNG12, GNG13, GNG2, GNG3, GNG4, GNG7, GNG8, GNGT2"
"59","Arachidonic acid metabolism",0.0449657869012708,0.0969897719784841,0.298850574712644,1.78030197551501,229,42,"ABCC1, ALOX12, ALOX5, ALOX5AP, ALOX15B, ALOXE3, CBR1, CYP2J2, CYP2U1, CYP4A22, CYP4F11, CYP4A11, CYP4B1, CYP4F8, CYP4F2, CYP4F3, CYP4F22, DPEP3, EPHX2, FAAH, GPX1, GPX2, GPX4, HPGD, HPGDS, LTA4H, LTC4S, MAPKAPK2, PLA2G4A, PON1, PON2, PON3, PRXL2B, PTGDS, PTGES, PTGES2, PTGES3, PTGIS, PTGR2, PTGS1, PTGS2"
"60","Asparagine N-linked glycosylation",0.252326014142166,0.280686013247943,0.115599918099918,0.3991052409282,1355,264,"ACTR10, ACTR1A, ALG1, ALG10, ALG10B, ALG11, ALG12, ALG14, ALG2, ALG3, ALG5, ALG6, ALG8, ALG9, AMDHD2, AMFR, ANK1, ANK2, ANK3, ANKRD28, ARCN1, ARF1, ARF3, ARF4, ARF5, ARFGAP1, ARFGAP2, ARFGAP3, B4GALNT2, B4GALT1, B4GALT2, B4GALT3, B4GALT4, B4GALT5, B4GALT6, BET1L, CALR, CANX, CAPZA1, CAPZA2, CAPZB, CD55, CD59, CGA, CHST10, CHST8, CMAS, CNIH1, CNIH2, CNIH3, COG1, COG2, COG3, COG4, COG5, COG6, COG7, COG8, COPA, COPB1, COPB2, COPE, COPG1, COPG2, COPZ1, COPZ2, CSNK1D, CTSA, CTSC, CTSZ, DAD1, DCTN1, DCTN2, DCTN3, DCTN4, DCTN5, DCTN6, DDOST, DERL1, DERL2, DHDDS, DOLK, DOLPP1, DPAGT1, DPM1, DPM2, DPM3, DYNC1H1, DYNC1I1, DYNC1I2, DYNC1LI1, DYNC1LI2, DYNLL1, DYNLL2, EDEM1, EDEM2, EDEM3"
"61","Assembly Of The HIV Virion",0.00643604183427192,0.0969897719784841,-0.474647793726741,-2.22732862353864,31,16,"VPS37D, VPS37C, VPS37B, VPS37A, VPS28, UBC, UBB, UBAP1, TSG101"
"62","Assembly and cell surface presentation of NMDA receptors",0.0274240940254652,0.0969897719784841,0.489398542534464,2.50507375799953,139,23,"ACTN2, APBA1, CAMK2A, CAMK2B, CAMK2G, CASK, DLG1, DLG2, DLG3, DLG4, GRIN1, GRIN2A, GRIN2B, GRIN2C, GRIN2D, GRIN3A, GRIN3B, KIF17, LIN7A, LIN7B, LIN7C, LRRC7"
"63","Assembly of collagen fibrils and other multimeric structures",0.044574780058651,0.0969897719784841,0.440487285314872,2.62405513186431,227,42,"BMP1, CD151, COL11A1, COL11A2, COL15A1, COL18A1, COL1A2, COL27A1, COL3A1, COL4A1, COL4A2, COL4A3, COL4A4, COL4A5, COL5A1, COL5A2, COL5A3, COL6A1, COL6A2, COL6A5, COL6A6, COL8A1, COL8A2, COL9A1, COL9A2, CTSB, CTSS"
"64","Assembly of the pre-replicative complex",0.0344757655647942,0.0969897719784841,-0.394227165495863,-2.84332486632125,169,61,"UBC, UBB, RPS27A, PSMF1, PSME4, PSME3, PSME2, PSME1, PSMD9, PSMD8, PSMD7, PSMD6, PSMD5, PSMD4, PSMD3, PSMD2, PSMD14, PSMD13, PSMD12, PSMD11, PSMD10, PSMD1, PSMC6, PSMC5, PSMC4, PSMC3, PSMC2, PSMC1, PSMB7, PSMB6, PSMB5, PSMB4, PSMB3, PSMB2, PSMB10, PSMB1, PSMA8, PSMA7, PSMA6, PSMA5, PSMA4, PSMA3, PSMA1, ORC6, ORC5, ORC4, ORC3, ORC2, ORC1"
"65","Association of TriC/CCT with target proteins during biosynthesis",0.0405063291139241,0.0969897719784841,0.356711524585455,2.09191572141465,207,38,"AP3M1, ARFGEF2, CCNE1, CCNE2, CCT2, CCT3, CCT4, CCT5, CCT6A, CCT6B, CCT7, CCT8, DCAF7, FBXL3, FBXL5, FBXO4, FBXO6, FBXW10, FBXW2, FBXW4, FBXW5, FBXW7, FBXW9, FKBP9, GAPDHS, GBA"
"66","Asymmetric localization of PCP proteins",0.032546786004882,0.0969897719784841,-0.508228892351106,-3.64237673291247,159,58,"WNT5A, VANGL2, UBC, UBB, SMURF2, SMURF1, SCRIB, RPS27A, PSMF1, PSME4, PSME3, PSME2, PSME1, PSMD9, PSMD8, PSMD7, PSMD6, PSMD5, PSMD4, PSMD3, PSMD2, PSMD14, PSMD13, PSMD12, PSMD11, PSMD10, PSMD1, PSMC6, PSMC5, PSMC4, PSMC3, PSMC2, PSMC1, PSMB7, PSMB6, PSMB5, PSMB4, PSMB3, PSMB2, PSMB10, PSMB1, PSMA8, PSMA7, PSMA6, PSMA5, PSMA4, PSMA3, PSMA1, PRICKLE1"
"67","Attenuation phase",0.0269631962212163,0.0969897719784841,0.416051762724634,2.05242811836238,136,21,"COL4A6, CREBBP, CRYBA4, DEDD2, DNAJB1, DNAJB6, EP300, FKBP4, HSBP1, HSF1, HSP90AB1, HSPA1A, HSPA1B, HSPA1L, HSPA2, HSPA8, HSPH1"
"68","Autodegradation of Cdh1 by Cdh1:APC/C",0.0322120285423038,0.0969897719784841,-0.428471391713107,-3.0529013449828,157,57,"UBE2E1, UBE2D1, UBC, UBB, RPS27A, PSMF1, PSME3, PSME2, PSME1, PSMD9, PSMD8, PSMD7, PSMD6, PSMD5, PSMD4, PSMD3, PSMD2, PSMD14, PSMD13, PSMD12, PSMD11, PSMD10, PSMD1, PSMC6, PSMC5, PSMC4, PSMC3, PSMC2, PSMC1, PSMB7, PSMB6, PSMB5, PSMB4, PSMB3, PSMB2, PSMB10, PSMB1, PSMA7, PSMA6, PSMA5, PSMA4, PSMA3, PSMA1"
"69","Autodegradation of the E3 ubiquitin ligase COP1",0.0270435136234242,0.0969897719784841,-0.630912470253088,-4.25615815142718,132,46,"UBC, UBB, TP53, RPS27A, PSMF1, PSME4, PSME3, PSME2, PSME1, PSMD9, PSMD8, PSMD7, PSMD6, PSMD5, PSMD4, PSMD3, PSMD2, PSMD14, PSMD13, PSMD12, PSMD11, PSMD10, PSMD1, PSMC6, PSMC5, PSMC4, PSMC3, PSMC2, PSMC1, PSMB7, PSMB6, PSMB5, PSMB4, PSMB3, PSMB2, PSMB10, PSMB1, PSMA8, PSMA7, PSMA6, PSMA5, PSMA4, PSMA3, PSMA1"
"70","Autophagy",0.0500290866783013,0.0980844051158958,0.999732477260567,5.16674320482857,257,112,"PRKAG2, AMBRA1"
"71","Axon guidance",0.0516556291390728,0.0986027133853221,-0.999931492772487,-3.55363746737072,233,467,"CACNA1C"
"72","B-WICH complex positively regulates rRNA expression",0.0591606960081883,0.102727937914758,-0.238906998403406,-1.43893002542609,288,32,"ZNRD1, TWISTNB, TBP, TAF1D, TAF1C, TAF1B, TAF1A, SMARCA5, SF3B1, POLR2L, POLR2K, POLR2H, POLR2F, POLR2E, POLR1E, POLR1D, POLR1C, POLR1B, POLR1A"
"73","BBSome-mediated cargo-targeting to cilium",0.0267663845699665,0.0969897719784841,0.480444946708325,2.3700866245384,135,21,"ARL6, BBS1, BBS10, BBS2, BBS4, BBS5, BBS7, BBS9, CCT2, CCT3, CCT4, CCT5, CCT8"
"74","BMAL1:CLOCK,NPAS2 activates circadian gene expression",0.52276295133438,0.540413338966325,0.160771276595745,0.837411106602841,2663,24,"ARNTL, ARNTL2, BHLHE40, BHLHE41, CARM1, CHD9, CLOCK, CREBBP, DBP"
"75","Base Excision Repair",0.0254567850544036,0.0969897719784841,-0.366614211354558,-2.44682775960221,123,44,"XRCC1, UNG, TINF2, TERF2IP, TERF2, TERF1, TDG, SMUG1, RPA3, RPA2, RPA1, RFC5, RFC4, RFC3, RFC2, RFC1, POT1, POLE4, POLE3, POLE2, POLE, POLD4, POLD2, POLD1, POLB, PNKP, PCNA, PARP2, PARP1, PARG, OGG1, NTHL1, NEIL3, NEIL2, NEIL1, MUTYH, MPG, MBD4, LIG3, LIG1"
"76","Base-Excision Repair, AP Site Formation",0.00790113452188006,0.0969897719784841,-0.430044683521046,-2.07460632275188,38,17,"UNG, TINF2, TERF2IP, TERF2, TERF1, TDG, SMUG1, POT1, OGG1, NTHL1, NEIL3, NEIL2, NEIL1, MUTYH, MPG, MBD4"
"77","Basigin interactions",0.177764202810018,0.210447770854549,-0.229974253907242,-1.23718425179876,872,22,"SLC7A8, SLC7A7, SLC7A6, SLC7A5, SLC7A11, SLC7A10, SLC3A2, SLC16A8, SLC16A3, SLC16A1"
