"","pathway","pval","padj","ES","NES","nMoreExtreme","size","leadingEdge"
"205","Diseases of carbohydrate metabolism",0.107742537313433,0.515249758200798,0.475761658708558,1.33446519536213,692,25,"ARSB, EPM2A, GNS, GUSB, GBE1, GALNS, G6PC3, GYS1, IDUA, TALDO1, NAGLU, GYG1"
"206","Diseases of glycosylation",0.829245409462539,0.922642454728264,0.224561745693155,0.824532330749697,6186,114,"HEXB, SEMA5A, ST3GAL3, ADAMTS17, DPM2, GPC3, THSD7A, DAG1, MAN1B1, GNE, MUC15, CTSA, CSPG5, ALG6, GALNT3, SPON1, SDC3, ADAMTSL1, B4GALT7, ADAMTS16, OMD, THSD1, CHSY1, AGRN"
"207","Diseases of metabolism",0.123009101251422,0.530962465925771,0.364199996031709,1.24877931799453,864,70,"CYP7B1, TBXAS1, ARSB, EPM2A, GNS, GUSB, GBE1, MCCC1, HLCS, IDH1, CSF2RB, CSF2RA, LMBRD1, CYP27A1, MTR, GALNS, GCLM, G6PC3, FDX1, GYS1, IDUA, TALDO1, NAGLU, PCCB, GYG1, ACY1"
"208","Diseases of signal transduction",0.619170984455959,0.848425716294097,0.230742634136173,0.94737918771286,5257,327,"GAB2, TGFBR1, AKT3, PIK3R1, RAP1A, POLR2A, MAPKAP1, CUX1, FXR1, CD86, PIK3AP1, TBL1XR1, QKI, SEL1L, PIK3CD, VAV1, APBB1IP, GSK3B, POLR2K, PTEN, LRP6, CREBBP, ZFYVE9, CDK8, CSNK1A1, TENT4A, AGK, SND1, PIK3CA, HDAC4, STRA6, PSMA5, TRIM24, TGFB1, PSMA1, FAM114A2, APH1A, PSME1, PSMB1, IRS1, HDAC8, GTF2F2, PSMD13, CUL1, SOS1, YWHAB, SMAD2, ZC3HAV1, AKAP9, TGFBR2, CSK, HDAC7, BCL2L11, PSMB9, RICTOR, POLR2H, IRS2, MAPK3, PPP2R1A, PSMD12, STAT3, KSR1, RAF1, ARAF, CASP9, AKT1S1, CREB1, PHB, AKT1, FGFR2"
"209","Disorders of transmembrane transporters",0.478094987501645,0.790012203135267,0.263976654238068,0.994295644216684,3633,140,"SLC9A9, SEL1L, ABCA1, SLC17A5, TPR, SLC3A2, NUP37, SLC20A2, SLC24A5, AAAS, PSMA5, PSMA1, NUP54, PSME1, PSMB1, NUP42, PSMD13, SLC29A3, NUP93, NUP107, NUP205, DERL1, SEH1L, NUP155, PSMB9, NUP43, SLC7A7, PSMD12, SLC12A6, RNF185, SLC16A1, SLC1A3, NUP98, PSMB7, SLC11A2, NUP153, GCK, ABCD1, ABCC8, ERLIN1, ABCB4, PSMC3"
"210","Dopamine Neurotransmitter Release Cycle",0.470767525630368,0.786477496129512,-0.328712961744924,-0.983048994877889,1698,23,"RIMS1, SYN2, SYT1, STX1A, UNC13B, SLC18A2, LIN7A, PPFIA3, RAB3A, CPLX1, STXBP1"
"211","Downregulation of ERBB2 signaling",0.689110556940981,0.863473535051231,-0.283469906568306,-0.847745112486137,2486,23,"NRG3, NRG1, PTPN12, STUB1, EGF, NRG2, UBB, ERBB4, MATK, RNF41"
"212","Downregulation of SMAD2/3:SMAD4 transcriptional activity",0.292662819455894,0.698189797701052,-0.379140113478676,-1.1193416455142,1064,22,"SKI, SMAD3, NCOR2, PARP1, SMURF2, UBB, SKIL, TRIM33"
"213","Downregulation of TGF-beta receptor signaling",0.163090796019901,0.575686397327487,0.447793743944777,1.25601791371184,1048,25,"XPO1, TGFBR1, ZFYVE9, PPP1CB, TGFB1, SMAD2, NEDD4L, STRAP, TGFBR2, UCHL5, SMURF1, MTMR4, PPP1CC"
"214","Downstream TCR signaling",0.407365439093484,0.750650921475634,0.296774218013699,1.02983916793297,2875,76,"PIK3R1, INPP5D, NFKB1, IKBKG, TRAF6, PTEN, PIK3CA, PSMA5, PSMA1, PSME1, PSMB1, PSMD13, CUL1, RIPK2, TAB2, PSMB9, PSMD12, BCL10, IKBKB, PSMB7, SKP1, NFKBIA, PIK3CB, PSMC3"
"215","Downstream signal transduction",0.782930298719772,0.904637824766644,-0.254731995683622,-0.797678789544562,2751,28,"GRB2, NCK2, KRAS, SRC, CRK, STAT5B"
"216","Downstream signaling events of B Cell Receptor (BCR)",0.778611898016997,0.904637824766644,0.240886052938517,0.835901090011152,5496,76,"NFKB1, IKBKG, NFATC3, RASGRP3, NFATC1, PSMA5, PSMA1, PSME1, PSMB1, PSMD13, CUL1, PPIA, PSMB9, PSMD12, PPP3CA, BCL10, NRAS, IKBKB, PSMB7, REL, SKP1, NFKBIA"
"217","Downstream signaling of activated FGFR1",0.459466886507282,0.779634688521078,-0.335611335562433,-0.990830912495364,1671,22,"GRB2, FLRT2, KRAS, FGF22, GAB1"
"218","Downstream signaling of activated FGFR2",0.865073124705142,0.942671046190321,0.263358025994045,0.711573211751243,5500,21,"PIK3R1, PIK3CA, SOS1, FGFR2, NRAS"
"219","Downstream signaling of activated FGFR3",0.735789139409336,0.886189122617854,0.305628593876547,0.805518408863294,4633,19,"PIK3R1, PIK3CA, SOS1"
"220","Downstream signaling of activated FGFR4",0.613930885529158,0.848425716294097,-0.309527961810242,-0.884387741052897,2273,19,"GRB2, FGFR4, KRAS, GAB1"
"221","Dual Incision in GG-NER",0.867930204572804,0.943963459936012,0.241394293249841,0.742231542693743,5769,38,"XPA, POLD4, GTF2H2, DDB2, POLK, ERCC5, POLE4, GTF2H1, DDB1, RFC3, CUL4B, CHD1L, PCNA, ERCC3, RFC2, POLE3"
"222","Dual incision in TC-NER",0.330939385234128,0.719919220072159,0.320795702040715,1.07885816388357,2303,62,"POLR2A, POLR2K, ISY1, XPA, POLD4, GTF2H2, ERCC6, POLR2H, POLK, CCNH, POLR2G, ERCC5, POLE4, ZNF830, GTF2H1, UVSSA, DDB1, RFC3, CUL4B, POLR2J, TCEA1, PCNA, POLR2I, ERCC3, RFC2"
"223","E2F mediated regulation of DNA replication",0.887308533916849,0.950001203050937,-0.240574146146816,-0.694732611299638,3243,20,"TFDP1, PPP2R3B, PRIM2, PPP2CA"
"224","E3 ubiquitin ligases ubiquitinate target proteins",0.197455089820359,0.603948379869182,0.386023681125559,1.20252014840389,1318,41,"PRKDC, UBE2B, CDC73, RAD18, RTF1, RNF144A, PEX13, DERL1, UBE2A, BCL10, HLTF"
"225","ECM proteoglycans",0.644461077844311,0.852658227848101,0.285699797387023,0.88999659749127,4304,41,"ITGB5, NCAM1, TGFB1, DAG1"
"226","EGFR downregulation",0.482923813939113,0.790012203135267,0.345739764645797,0.987242589989077,3124,27,"SH3GL2, PTPRK, STAM, EPS15, SH3GL1, ARHGEF7"
"227","EML4 and NUDC in mitotic spindle formation",0.0106564364876385,0.243273311632123,0.440784529590687,1.52274078221959,74,74,"DYNC1I1, XPO1, NEK7, CLASP2, AHCTF1, CLIP1, NUP37, DYNC1I2, EML4, CENPC, MAD1L1, TAOK1, BUB3, NUP107, NDEL1, SEH1L, ZWINT, PPP2R1A, NUP43, NEK6, CLASP1, PPP2CB, NUP98, KIF2A, NUDC, PAFAH1B1, NEK9, PPP1CC, MAPRE1"
"228","EPH-Ephrin signaling",0.00484094052558783,0.20088321567869,-0.419296338066493,-1.63047507102246,13,81,"EPHA10, FYN, EPHB1, EPHA7, AP2B1, EPHB2, CLTB, TIAM1, GRIN2B, EPHA6, GRIN1, EPHA4, MYH10, PAK3, NCK2, RHOA, SRC, EFNA5, ACTG1, ARPC2, MYL12B, EFNA2, PAK2, RAC1"
"229","EPH-ephrin mediated repulsion of cells",0.000607533414337789,0.0863885377159713,-0.589834678235095,-2.01363023434264,1,42,"EPHA10, FYN, EPHB1, EPHA7, AP2B1, EPHB2, CLTB, TIAM1, EPHA6, EPHA4, SRC, EFNA5, EFNA2, RAC1"
"230","EPHB-mediated forward signaling",0.401243932038835,0.750650921475634,0.346920648796501,1.04077498032289,2644,34,"ACTR3, WASL, ACTR2, RASA1, ARPC5, PAK1, ROCK1, ITSN1, CFL1, ARPC1B, LIMK2, YES1, LYN"
"231","ER Quality Control Compartment (ERQC)",0.497848605577689,0.794175733021066,0.375346316301287,0.977869668882791,3123,18,"SEL1L, EDEM2, MAN1B1, UGGT1, RNF185, EDEM1, DERL2, UGGT2, AMFR"
"232","ER to Golgi Anterograde Transport",0.463218544821118,0.779634688521078,0.27069275854828,0.999790001501081,3456,120,"DYNC1I1, SAR1B, MIA2, RAB1A, CNIH2, CTSZ, SEC31A, SEC22A, NAPG, SEC24D, TRAPPC4, GOSR2, SCFD1, DYNC1I2, TMEM115, SEC24A, PPP6R3, CAPZA1"
"233","ER-Phagosome pathway",0.574369189907039,0.836064027912021,-0.248117409912427,-0.935024754136092,1729,68,"PSMF1, PSMD1, PSMD9, PSMA7, PSME4, PSMB6, PSMA3, PSMD11, PSMC1, PSMB10, TLR4, SEC61B, TLR1, CHUK, PSMD5, PSMB5, PSMC6, UBB, SEC61A2, PSMC4"
"234","ERCC6 (CSB) and EHMT2 (G9a) positively regulate rRNA expression",0.33616,0.719919220072159,0.43614062133768,1.10450649214559,2100,16,"H3-3A, CBX3, EHMT2, ERCC6, MTA3"
"235","ERK/MAPK targets",0.79352099386696,0.908992616955866,0.284246994967139,0.76801360572159,5045,21,"RPS6KA1, MEF2C, MAPK3, PPP2R1A, VRK3, PPP2CB"
"236","ESR-mediated signaling",0.0120833886602045,0.243273311632123,0.384640526294769,1.43754110343979,90,132,"XPO1, STAG1, AKT3, PIK3R1, FKBP5, RUNX1, POLR2A, NCOA3, H3-3A, CBFB, POLR2K, CREBBP, MOV10, PIK3CA, KCTD6, SMC1A, GNAI2, GPAM, TNRC6C, GTF2F2, GNAI3, JUND, USF1, FOSB, NRIP1, GTF2A1, NCOA1, POLR2H, MAPK3, TNRC6A, CXCL12, GNG12, DDX5, TNRC6B, ZDHHC7, CREB1, GTF2A2, AKT1, UHMK1, CDK9, POLR2G, NRAS, YY1, USF2, GNG7, SP1, ESR1, MED1"
"237","Effects of PIP2 hydrolysis",0.541977611940298,0.805244292841312,0.339260934335112,0.951593935175805,3485,25,"ITPR1, DGKH, MGLL, ABHD12, ITPR2, DGKQ, PRKCD, DGKD, PRKCQ, DGKE, ABHD6, TRPC6"
"238","Elastic fibre formation",0.815329933549683,0.920892246280881,0.268186361694694,0.765792730235886,5275,27,"ITGB5, TGFB1, LTBP4"
"239","Endogenous sterols",0.03504,0.355457319587629,0.596097569190204,1.50959026266216,218,16,"CYP7B1, ARNT2, PTGIS, NCOA1, CYP27A1, RXRA, CYP46A1, CYP4V2, ARNT, FDX1"
"240","Endosomal Sorting Complex Required For Transport (ESCRT)",0.971943887775551,0.99125744954068,0.208519381491427,0.600172791674615,6304,28,"TSG101, STAM, CHMP3, VTA1, VPS4B, CHMP4C, MVB12B, STAM2, SNF8"
"241","Energy dependent regulation of mTOR by LKB1-AMPK",0.754586095267458,0.894512739868448,0.281950649785925,0.811527002363795,4894,28,"SLC38A9, PRKAG2, LAMTOR4, PPM1A, PRKAA2, TSC1, LAMTOR5"
"242","Ephrin signaling",0.0111022997620936,0.243273311632123,-0.652603202901018,-1.7521765113825,41,15,"FYN, EPHB1, EPHB2, PAK3, NCK2, SRC, PAK2, RAC1"
"243","Epigenetic regulation of gene expression",0.771644718408518,0.904637824766644,0.240615813648026,0.847121052017071,5507,85,"BAZ1B, H3-3A, GSK3B, POLR2K, SIN3A, TET1, CBX3, GTF2H2, TAF1B, EHMT2, SAP30BP, SUZ12, ERCC6"
"244","Estrogen-dependent gene expression",0.020393811533052,0.308730931515742,0.413737389314661,1.44739986080622,144,81,"STAG1, RUNX1, POLR2A, NCOA3, H3-3A, CBFB, POLR2K, CREBBP, MOV10, KCTD6, SMC1A, GPAM, TNRC6C, GTF2F2, JUND, USF1, FOSB, NRIP1, GTF2A1, NCOA1, POLR2H, TNRC6A, CXCL12, DDX5, TNRC6B, GTF2A2, CDK9, POLR2G, YY1, USF2, SP1, ESR1, MED1"
"245","Estrogen-dependent nuclear events downstream of ESR-membrane signaling",0.495360905802799,0.793868292035756,0.362254394217599,0.978783622756372,3149,21,"XPO1, AKT3, MAPK3, CREB1, AKT1, UHMK1"
"246","Eukaryotic Translation Elongation",0.256827048114434,0.673388548501336,-0.302565101599622,-1.11114133376683,789,60,"RPL22L1, RPSA, RPL37A, RPL35, EEF1A2, RPL6, RPL8, RPL36, RPL36AL, RPS14, RPS4X, EEF1B2, RPS13, RPL38, RPS9, RPL23, RPL19"
"247","Eukaryotic Translation Initiation",0.351256983240223,0.721776004121827,-0.265933708078506,-1.04430559456546,1005,85,"EIF4E, RPL22L1, RPSA, EIF3H, RPL37A, RPL35, EIF5B, RPL6, RPL8, RPL36, RPL36AL, RPS14, RPS4X, EIF2B4"
"248","Eukaryotic Translation Termination",0.377908882333661,0.735917474282049,-0.280919956657557,-1.03414262861908,1152,61,"RPL22L1, RPSA, RPL37A, RPL35, ETF1, RPL6, RPL8, RPL36, RPL36AL, RPS14, RPS4X"
"249","Export of Viral Ribonucleoproteins from Nucleus",0.0107378432274889,0.243273311632123,0.546232290521999,1.60276071147958,69,31,"XPO1, TPR, NUP37, AAAS, NUP54, NUP42, NUP93, NUP107, NUP205, SEH1L, NUP155, NUP43, NUP98, NUP153"
"250","Extension of Telomeres",0.609388335704125,0.848144444600932,-0.287381381358783,-0.899918488074944,2141,28,"RPA1, RUVBL1, PRIM2, RFC1, RFC5, NHP2, RPA2, POLE2, LIG1, POLD2"
"251","Extra-nuclear estrogen signaling",0.642981945253349,0.852658227848101,0.271506959769329,0.893395109739736,4415,54,"XPO1, AKT3, PIK3R1, PIK3CA, GNAI2, GNAI3, MAPK3, GNG12, ZDHHC7, CREB1, AKT1, UHMK1, NRAS, GNG7, ESR1, PIK3R2, CALM1, GNGT2, FOXO3"
"252","Extracellular matrix organization",0.0277255639097744,0.328698251653229,-0.295980713620568,-1.29300868782532,58,185,"TTR, SPOCK3, TLL1, PRKCA, COL4A1, FURIN, ACTN1, FBN1, ITGA11, CAPN15, P3H3, COL23A1, DCN, PHYKPL, MMP24, MMP17, CD47, NCAN, COL20A1, ITGB1, ADAMTS18, ITGA9, CAST, FBN2, CAPN3, TGFB2, THBS1"
"253","FBXL7 down-regulates AURKA during mitotic entry and in early mitosis",0.242301710730949,0.655013415822125,-0.32002236026826,-1.12930217506123,778,49,"PSMF1, PSMD1, PSMD9, PSMA7, PSME4, PSMB6, PSMA3, PSMD11, PSMC1, PSMB10, PSMD5, FBXL18, PSMB5, PSMC6, UBB"
"254","FCERI mediated Ca+2 mobilization",0.0307478368355995,0.339153608357318,0.537204596707451,1.52118763797101,198,26,"ITPR1, NFATC3, VAV1, NFATC1, BTK, SOS1, SYK, LCP2, VAV2, PPP3CA, LYN, PLCG2, VAV3, ITPR2"
"255","FCERI mediated MAPK activation",0.366468422543189,0.729780503562698,-0.340332359704494,-1.05485009787708,1293,27,"GRB2, FOS, MAPK10, MAPK1, KRAS, PAK2, RAC1"
"256","FCERI mediated NF-kB activation",0.836026936026936,0.924326410169107,-0.218109611713192,-0.823824122000031,2482,70,"PSMF1, PSMD1, PSMD9, PSMA7, PSME4, PSMB6, PSMA3, PSMD11, PSMC1, PSMB10, UBE2N, CHUK, BTRC, PSMD5, PSMB5, PSMC6, RASGRP1, UBB, TAB1, PSMC4, MAP3K7"
"257","FGFR1 mutant receptor activation",0.169931592039801,0.587241623622311,0.445103510472823,1.24847207038881,1092,25,"GAB2, PIK3R1, CUX1, PIK3CA, TRIM24"
"258","FGFR2 alternative splicing",0.449279899812148,0.779634688521078,0.365525850328717,1.01508556924122,2869,24,"POLR2A, POLR2K, GTF2F2, HNRNPF, POLR2H, HNRNPM, POLR2G, TIAL1, POLR2J, POLR2I"
"259","FGFR2 mutant receptor activation",0.741293532338308,0.88955223880597,0.290525395523103,0.814895487263073,4767,25,"POLR2A, POLR2K, GTF2F2, POLR2H, FGFR2, POLR2G"
"260","FLT3 Signaling",0.0342942345924453,0.355457319587629,-0.280509664603321,-1.24316200581425,68,210,"SPRED2, GFRA1, FYN, SPTAN1, KITLG, DLG2, GRB2, FGFR4, PSMF1, RASAL2, MAPK1, GRIN2B, PSMD1, PSMD9, LRRC7, GRIN1, DLG4, PSMA7, CAMK2B, RANBP9, NRG3, PSME4, NRG1, KRAS, SRC, PSMB6, PPP2R5C, CUL3, RASAL1, PSMA3, PSMD11, PSMC1, FGF22, PSMB10, STAT5B, GAB1, PPP2R5A, DUSP4, EGF, NF1, THEM4, LAMTOR3, DUSP5, PPP2CA, PSMD5"
"261","FOXO-mediated transcription",0.480997969248622,0.790012203135267,0.300107079753722,0.991154718327352,3315,55,"AKT3, CREBBP, SIN3A, PPARGC1A, TXN, YWHAB, SMAD2, BCL2L11, NFYA, AKT1, NFYC, DDIT3, GCK, SIRT3, SIRT1, CAT, ATXN3"
"262","FOXO-mediated transcription of cell cycle genes",0.500660851176315,0.795880900739086,-0.357029774202145,-0.958590428977834,1893,15,"SMAD3, FOXO1"
"263","FOXO-mediated transcription of oxidative stress, metabolic and neuronal genes",0.888212506917543,0.950001203050937,-0.23486622518716,-0.70919888133937,3209,24,"SMAD3, PLXNA4, FOXO1"
"264","FRS-mediated FGFR1 signaling",0.332540311921755,0.719919220072159,-0.409761512663403,-1.10017004906774,1257,15,"GRB2, KRAS, FGF22, FGF20, FGF9, FGF1"
"265","FRS-mediated FGFR2 signaling",0.44589552238806,0.777604195187002,-0.364752220703815,-0.997621975149971,1672,16,"GRB2, KRAS, FGF22, FGF20, FGF9, FGF16, FGF1"
"266","Factors involved in megakaryocyte development and platelet production",0.459134282948417,0.779634688521078,0.279823909116488,1.00295102201381,3319,95,"PRKAR2B, H3-3A, DOCK8, CARMIL1, EHD1, IRF2, SIN3A, KIF26B, DOCK2, CAPZA1, AKAP10, DOCK10, ITPK1, KIFC2, CABLES1, DOCK9, CAPZB, MAFG, KIF3C, HMG20B, CBX5, RCOR1, SH2B2, RBSN, AKAP1, ZFPM2, RAD51C, PRKAR1A"
"267","Fanconi Anemia Pathway",0.312933025404157,0.714445700690697,-0.338653117839132,-1.09632276305511,1083,32,"RPA1, FAAP100, ATRIP, ERCC4, USP1, UBB, FANCM, RPA2, SLX1A, POLN, FANCI"
"268","Fatty acid metabolism",0.918337538175541,0.969408779963945,0.207216743338628,0.773555574379635,6915,130,"TBXAS1, SCD, HPGDS, PRKAG2, FAAH, ACBD4, PPARD, ECHS1, ACOT13, ACBD5, PTGIS, MORC2, PRKAA2, ECI2, ELOVL5, ACOX1, HACD2, SCP2, CYP4F8, ACSL3, RXRA, PTGR2, ALDH3A2, PLA2G4A, ABCD1, CBR1, MCEE, MLYCD, HSD17B4, DBI, ELOVL4, FADS1, SLC25A17, PHYH, PON3, ACAA2, PPT1"
"269","Fatty acyl-CoA biosynthesis",0.92155196828094,0.970414551225979,-0.22014897504441,-0.68234524649602,3253,27,"HSD17B12, HACD3, ACSL6, TECR, SLC25A1, ACSL4"
"270","Fc epsilon receptor (FCERI) signaling",0.304733727810651,0.70402203245721,0.293803260998883,1.0827760921783,2265,118,"GAB2, PIK3R1, NFKB1, IKBKG, ITPR1, TRAF6, NFATC3, VAV1, PAK1, PIK3CA, NFATC1, PSMA5, MAP3K1, BTK, PSMA1, PSME1, PSMB1, PSMD13, CUL1, SOS1, SYK, TAB2, LCP2, PSMB9, VAV2, MAPK3, PSMD12, FCER1G, PPP3CA, LYN, PLCG2, VAV3, BCL10, NRAS, ITPR2, IKBKB, PSMB7, SKP1, NFKBIA"
"271","Fcgamma receptor (FCGR) dependent phagocytosis",0.303350225225225,0.70402203245721,0.311756109518954,1.0917853254378,2154,82,"MYH9, PIK3R1, ACTR3, WASL, ACTR2, ITPR1, VAV1, ARPC5, PAK1, PIK3CA, WASF2, CYFIP1, MYO5A, NCKAP1, BTK, BRK1, ABI1, WASF3, SYK, VAV2, MAPK3, CFL1, ARPC1B, NCKAP1L, WAS, YES1, WIPF2, LYN, PLCG2, PLD4, NF2, VAV3, ITPR2, PLA2G6, NCKIPSD, ELMO2, PIK3CB, HCK, MYO1C"
"272","Formation of Fibrin Clot (Clotting Cascade)",0.12048,0.530962465925771,0.52994923358698,1.34207258019016,752,16,"SERPINE2, PROS1, PRCP"
"273","Formation of HIV elongation complex in the absence of HIV Tat",0.896433368154007,0.953611280284911,0.231086681005437,0.726281724778365,6006,43,"POLR2A, POLR2K, GTF2H2, GTF2F2, POLR2H, CCNH, CDK9, POLR2G, ELL, GTF2H1, POLR2J, TCEA1, POLR2I, ERCC3"
"274","Formation of HIV-1 elongation complex containing HIV-1 Tat",0.830538922155689,0.922642454728264,0.249085042518,0.775936288210536,5547,41,"POLR2A, POLR2K, GTF2H2, GTF2F2, POLR2H, CCNH, CDK9, POLR2G, ELL, GTF2H1, POLR2J, TCEA1, POLR2I, ERCC3"
"275","Formation of Incision Complex in GG-NER",0.933233979135618,0.974666812402084,0.217903305054058,0.682665621306734,6261,42,"RAD23B, XPA, GTF2H2, DDB2, PIAS1, CCNH, ERCC5, GTF2H1, DDB1, CUL4B, PIAS3, UBE2I, CHD1L, ERCC3"
"276","Formation of RNA Pol II elongation complex",0.565053607649956,0.824944732830204,0.284705581342921,0.942766692278966,3899,56,"POLR2A, MLLT3, CDC73, POLR2K, IWS1, RTF1, GTF2H2, SUPT6H, GTF2F2, POLR2H, CCNH, CDK9, POLR2G, ELL, GTF2H1"
"277","Formation of TC-NER Pre-Incision Complex",0.10570886260768,0.515249758200798,0.396151355595178,1.29362435418229,723,52,"POLR2A, POLR2K, ISY1, COPS7A, XPA, COPS5, GTF2H2, ERCC6, POLR2H, CCNH, COPS8, COPS3, POLR2G, ZNF830, COPS4, GTF2H1, UVSSA, DDB1, CUL4B, COPS7B, POLR2J, TCEA1, POLR2I, ERCC3"
"278","Formation of a pool of free 40S subunits",0.328666666666667,0.719919220072159,-0.280864659416112,-1.06047249823492,985,69,"RPL22L1, RPSA, EIF3H, RPL37A, RPL35, RPL6, RPL8, RPL36, RPL36AL, RPS14, RPS4X, RPS13, EIF3C, RPL38, RPS9, RPL23, RPL19"
"279","Formation of the Early Elongation Complex",0.78420331760767,0.904637824766644,0.267918357590062,0.798793625371049,5152,33,"POLR2A, POLR2K, GTF2H2, GTF2F2, POLR2H, CCNH, POLR2G, GTF2H1, POLR2J, POLR2I, ERCC3"
"280","Formation of the HIV-1 Early Elongation Complex",0.78420331760767,0.904637824766644,0.267918357590062,0.798793625371049,5152,33,"POLR2A, POLR2K, GTF2H2, GTF2F2, POLR2H, CCNH, POLR2G, GTF2H1, POLR2J, POLR2I, ERCC3"
"281","Formation of the beta-catenin:TCF transactivating complex",0.438712657838004,0.771557844625928,0.351432186123122,1.01868312696656,2848,29,"TCF4, H3-3A, CDC73, CREBBP, SMARCA4"
"282","Formation of the cornified envelope",0.738166378361378,0.887653486204005,0.299034361653821,0.807967937725975,4693,21,"PKP2, DSP, DSG2"
"283","Formation of the ternary complex, and subsequently, the 43S complex",0.998177399756987,0.998177399756987,-0.154721610105389,-0.528202432835267,3285,42,"RPSA, EIF3H, RPS14, RPS4X, RPS13, EIF3C, RPS9, RPS28"
"284","Formation of tubulin folding intermediates by CCT/TriC",0.391752577319588,0.74131641554322,-0.389444399416981,-1.04562056409551,1481,15,"CCT4, CCT5, CCT7, TUBB2B, CCT2, TUBB2A, CCT3"
"285","G alpha (12/13) signalling events",0.610991224284276,0.848204069351904,0.273748400215732,0.918185297821036,4246,61,"RASGRF2, FGD4, VAV1, FGD3, MCF2L, ARHGEF4, BTK, ARHGEF12, ARHGEF10L, FGD2, ROCK1, SOS1, ITSN1, ARHGEF7, GNA12, VAV2, GNG12, ARHGEF17, VAV3, ARHGEF2, ARHGEF11, GNG7, ARHGEF6, RHOB, ARHGEF1"
"286","G alpha (i) signalling events",0.0130344108446298,0.248043091782312,-0.294720379130844,-1.31652391573379,24,226,"RGS7, TTR, PDE4D, PRKCA, GRM8, RGS6, PDE4A, GRM7, PDE1A, GNAO1, ADCY1, AKR1B10, MAPK1, NMT2, PDYN, GPR37L1, CAMK2B, GNG3, GPR183, GNB5, CCR9, CDK5, NPY1R, PNOC, SRC, GNB1"
"287","G alpha (q) signalling events",0.447202521670607,0.777604195187002,-0.242885322796808,-1.00225624767463,1134,121,"PRKCA, PRKCE, GRB2, MAPK1, TRHR, GNG3, DGKB, GNB5, KRAS, TRIO, GNB1, APP, F2RL2, NTS, CHRM3, CHRM1, GNG13, HTR2C, LPAR6, GNG2, GRK5, ADRA1D, RPS6KA2, RASGRP1, HTR2A, GPR4, KALRN"
"288","G alpha (s) signalling events",0.09658873131468,0.515249758200798,-0.302254275603197,-1.22798372939493,251,108,"PDE4D, PDE10A, PDE4A, PDE8B, PDE1A, ADCY1, GPR176, GPR45, GIPR, GNG3, GNB5, REEP5, SRC, GNB1, REEP1"
"289","G alpha (z) signalling events",0.546658816602885,0.808786475718747,-0.281619746623427,-0.938871254994266,1856,37,"PRKCA, PRKCE, ADCY1, GNG3, GNB5, GNB1"
"290","G beta:gamma signalling through PI3Kgamma",0.60182452374564,0.845594293865906,-0.316218583996145,-0.891638794361319,2242,18,"GNG3, GNB5, RHOA, GNB1, GNG13, GNG2"
"291","G protein gated Potassium channels",0.109808102345416,0.515249758200798,-0.507161321027955,-1.38712048915645,411,16,"KCNJ4, KCNJ6, GNG3, GNB1, GNG2"
"292","G-protein activation",0.186766275346852,0.596681866692539,-0.447066571399485,-1.24409438476105,699,17,"GNAO1, PDYN, GNG3, GNB5, GNB1, GNG13, GNG2"
"293","G-protein beta:gamma signalling",0.691853233830846,0.863938555951208,0.30361706966291,0.851616360349016,4449,25,"AKT3, PAK1, BTK, PIK3CG, GNG12, AKT1, GNG7, ARHGEF6"
"294","G-protein mediated events",0.608785989907985,0.848144444600932,0.286644487077522,0.913643869053506,4101,46,"ADCY2, PRKAR2B, ITPR1, GNAI2, CAMKK1, ADCY8, GNAI3, PDE1B, ADCY3, ADCY9, GNAZ, CREB1, PRKAR1A, ITPR2, ADCY7, PLA2G4A, ADCY5, GNAL, PDE1C, CALM1, PRKCD, PLCB4, PRKAR1B, CAMK2A"
"295","G0 and Early G1",0.584501236603463,0.839567742303752,-0.308122289125073,-0.909674544759715,2126,22,"TFDP1, LIN52, RBL1, MAX, E2F5, DYRK1A"
"296","G1 Phase",0.54337623012869,0.805244292841312,0.309491722122857,0.945941166728718,3588,37,"CCND2, CCND3, CDK6, CUL1, E2F4, PPP2R2A, PPP2R1A, CCNH, LYN, PPP2CB, SKP1"
"297","G1/S DNA Damage Checkpoints",0.360154489861603,0.721776004121827,-0.286562926117036,-1.04610428239321,1118,58,"PSMF1, PSMD1, PSMD9, PSMA7, PSME4, PSMB6, PSMA3, PSMD11, PSMC1, PSMB10, PSMD5, PSMB5, PSMC6, UBB, PSMC4, CDKN1B, PSMA4"
"298","G1/S Transition",0.852813852813853,0.935528239876066,-0.206328814421538,-0.842244702477216,2166,114,"RPA1, PSMF1, PSMD1, PSMD9, TFDP1, PSMA7, LIN52, PSMB6, PSMA3, PSMD11, PSMC1, TK1, PSMB10, PPP2R3B, PRIM2, PPP2CA, PSMD5, PSMB5, PSMC6, DHFR, UBB, CCND1, RBL1, PSMC4, GMNN, MAX, CDKN1B, PSMA4, MNAT1"
"299","G1/S-Specific Transcription",0.625658077029648,0.848425716294097,-0.297150118946495,-0.888657156102267,2257,23,"TFDP1, LIN52, TK1, DHFR, RBL1, E2F5"
"300","G2/M Checkpoints",0.716698656429942,0.874449097190853,-0.220603349929974,-0.900343389717789,1866,111,"YWHAG, RPA1, PSMF1, PSMD1, PSMD9, PSMA7, PSME4, PSMB6, TP53BP1, PSMA3, ATRIP, PSMD11, PSMC1, PSMB10, UBE2N, PSMD5, NSD2, PSMB5, RFC5, PSMC6, RAD1, KAT5, UBB, BARD1, PSMC4, YWHAZ, CCNB2, PSMA4, UBE2V2, WRN, TOPBP1, RPA2, PKMYT1"
"301","G2/M DNA damage checkpoint",0.953879713306326,0.983875930705896,-0.196833713969777,-0.698319813647705,3060,50,"YWHAG, RPA1, TP53BP1, ATRIP, UBE2N, NSD2, RFC5, RAD1, KAT5, BARD1, YWHAZ, UBE2V2, WRN, TOPBP1, RPA2"
"302","G2/M Transition",0.483786152497809,0.790012203135267,-0.230022979833037,-0.986826779627721,1103,160,"HSP90AB1, YWHAG, TUBGCP4, PSMF1, PSMD1, PSMD9, DYNLL1, PPP1R12B, PSMA7, LIN52, PSME4, PPME1, HAUS6, PSMB6, DCTN2, CEP78, PSMA3, CDK11A, CDK11B, PSMD11, PSMC1, PCNT, CEP290, PSMB10, PPP2R3B, BTRC, PPP2CA, PSMD5, CSNK1D, CETN2, FBXL18, PSMB5, CNTRL"
"303","GABA B receptor activation",0.579516358463727,0.836135039191066,-0.29304782901397,-0.917662647360773,2036,28,"KCNJ4, KCNJ6, ADCY1, GNG3, GNB1"
"304","GABA receptor activation",0.240886998784933,0.655013415822125,-0.333864359579229,-1.13977592946853,792,42,"KCNJ4, KCNJ6, GABRB1, ADCY1, GNG3, ARHGEF9, GNB1, GABRA1, GABRB3, GABRB2, GNG2"
"305","GABA synthesis, release, reuptake and degradation",0.145144076840982,0.562290439415457,-0.472961799238753,-1.31615548171601,543,17,"GAD1, RIMS1, SYT1, STX1A, RAB3A, CPLX1, STXBP1, HSPA8"
"306","GLI3 is processed to GLI3R by the proteasome",0.548500319081047,0.809181880023613,-0.263509053374828,-0.947167184182096,1718,54,"PSMF1, PSMD1, PSMD9, PSMA7, PSME4, PSMB6, PSMA3, PSMD11, PSMC1, PSMB10, BTRC, PSMD5, PSMB5, PSMC6, UBB"
"307","GPCR downstream signalling",0.0562180579216354,0.432176320272572,-0.240854148239506,-1.15037569325963,65,437,"RGS7, ABR, TTR, PDE4D, PDE10A, PRKCA, GRM8, RGS6, PDE4A, PRKCE, GRB2, PDE8B, GRM7, PDE1A, GNAO1, ADCY1, AKR1B10, MAPK1, TIAM1, NMT2, TRHR, GPR176, GPR45, PDYN, PLEKHG5, GPR37L1, PREX1, CAMK2B, GIPR, GNG3, ARHGEF9, GPR183, DGKB, GNB5, RHOA, CCR9, CDK5, NPY1R, REEP5, KRAS, TRIO, PNOC, SRC, GNB1"
"308","GPCR ligand binding",0.696124763705104,0.865975685822784,-0.211502634813436,-0.924497491465204,1472,187,"GRM8, GRM7, TRHR, PDYN, GPR37L1, GIPR, GNG3, GPR183, GNB5, CCR9, NPY1R, PNOC, GNB1, ADGRE1, APP, F2RL2, NTS, WNT4, CHRM3, CHRM1, GNG13, HTR2C, LPAR6, GNG2, GPR18, CORT, CCR5, ADRA1D, PTCH1, HTR2A, GPR4, CALCRL, FSHR, SMO, RXFP1, GNG11, CHRM2, CRHR1, NTSR2, HTR7, WNT7B, HRH2, TAS1R1, GRP, C5AR1, NPSR1, HTR1B, ADRB2, VIP, GPR39"
"309","GPVI-mediated activation cascade",0.354019094548814,0.721776004121827,0.37290151373445,1.08091545129133,2298,29,"PIK3R1, VAV1, PIK3CA, SYK, LCP2, PIK3CG, VAV2, FCER1G, LYN, PLCG2, VAV3, PIK3CB, RHOB, PIK3R2"
"310","GTP hydrolysis and joining of the 60S ribosomal subunit",0.300863557858376,0.70402203245721,-0.278002897363611,-1.07474536876463,870,79,"EIF4E, RPL22L1, RPSA, EIF3H, RPL37A, RPL35, EIF5B, RPL6, RPL8, RPL36, RPL36AL, RPS14, RPS4X"
"311","Gamma carboxylation, hypusine formation and arylsulfatase activation",0.77008652657602,0.904637824766644,0.281768469989522,0.797876108925935,4983,26,"ARSJ, ARSB, PROS1, DPH5, DPH3, ARSK, DPH1, EEF2"
"312","Gap-filling DNA repair synthesis and ligation in GG-NER",0.924979389942292,0.971376435115491,-0.223953304793193,-0.661181056273684,3365,22,"RPA1, RFC1, RFC5, UBB, RPA2, POLE2, XRCC1, LIG1, POLD2"
"313","Gap-filling DNA repair synthesis and ligation in TC-NER",0.375197813264279,0.735447506478187,0.312247171228017,1.04731483976466,2607,61,"POLR2A, POLR2K, ISY1, POLD4, GTF2H2, ERCC6, LIG3, POLR2H, POLK, CCNH, POLR2G, POLE4, ZNF830, GTF2H1, UVSSA, DDB1, RFC3, CUL4B, POLR2J, TCEA1, PCNA, POLR2I, ERCC3, RFC2"
"314","Gastrin-CREB signalling pathway via PKC and MAPK",0.100213219616205,0.515249758200798,-0.515012326396382,-1.40859351944383,375,16,"PRKCA, GRB2, MAPK1, KRAS"
