"","pathway","pval","padj","ES","NES","nMoreExtreme","size","leadingEdge"
"446","Metabolism of non-coding RNA",0.82574568288854,0.924371045481785,0.21195913132895,0.790962059977046,4207,48,"NUP160, CLNS1A, NUP98, GEMIN6, POM121, POM121C"
"447","Metabolism of nucleotides",0.642217128568452,0.859841616798653,-0.224537123683845,-0.905565193448592,3081,65,"GART, GMPR, GSR, GPX1, NUDT9, AK5, LHPP, DGUOK, NT5C2, DHODH, DCTPP1, AK1, IMPDH1, AK4, UPP2, PFAS, GDA, CMPK1, TK2, ENTPD6, ADPRM, PNP, GUK1"
"448","Metabolism of polyamines",0.210008203445447,0.771119417666732,-0.305880601627262,-1.1714341597902,1023,50,"PSMB5, PSMD7, AZIN1, OAZ2, PSMD4, PSMB1, PSMD8, PSMD5"
"449","Metabolism of porphyrins",0.332611264277274,0.781948655310053,0.371172943994734,1.09878594745596,1688,18,"HMOX2, SLCO2B1, ALAD, ABCC1, BLVRA, CPOX, UROD, GUSB, PPOX, ABCC2, HMBS"
"450","Metabolism of steroids",0.487072560467056,0.820734221624942,-0.225544159064151,-0.985447560769951,2335,101,"ARV1, SREBF2, SLCO1A2, NCOA6, CYP39A1, UBE2I, MTF1, MED1, OSBPL6, SLC27A2, NCOA2, HELZ2, SCD, TBL1XR1, GGPS1, OSBPL3, OSBP, TGS1"
"451","Metabolism of vitamins and cofactors",0.697039600153787,0.874474162290525,0.201322398531331,0.89893550516864,3625,125,"PCCA, MCCC1, LDLR, SLC19A1, COQ7, PDSS2, BTD, GPC3, TTR, MTHFS, PPCDC, CYB5A, NADSYN1, GSTO1, PARP4, LPL, NADK2, COASY, GPC4, LMBRD1, SLC25A16, COQ2, LRP12, ABCC1"
"452","Metabolism of water-soluble vitamins and cofactors",0.77991165738429,0.905254308043864,0.201737936853273,0.842895331482172,4060,85,"PCCA, MCCC1, SLC19A1, BTD, MTHFS, PPCDC, CYB5A, NADSYN1, GSTO1, PARP4, NADK2, COASY, LMBRD1, SLC25A16, ABCC1, RFK, ACACA, MTHFD1L, ALDH1L1, NADK, PANK3, PANK4, ABCD4, SLC25A19, TCN2, MMACHC, MTHFD1, MCCC2"
"453","Metal ion SLC transporters",0.137849547065774,0.771119417666732,0.441177202707223,1.30602006023237,699,18,"SLC30A10, CP, SLC39A6, SLC31A1, SLC30A5, SLC30A3, SLC39A3, SLC41A1"
"454","MicroRNA (miRNA) biogenesis",0.810876623376623,0.911997708174179,-0.240613651700832,-0.764950972586994,3995,23,"DGCR8, AGO4, AGO3"
"455","Miscellaneous transport and binding events",0.18675054059367,0.771119417666732,0.41221894417881,1.23679124034521,949,19,"NIPA1, LRRC8B, NIPA2, NIPAL4, ADD3, LRRC8C, ADD2, SLC66A1, MAGT1"
"456","Misspliced GSK3beta mutants stabilize beta-catenin",0.328650573802928,0.781948655310053,0.392231856410959,1.10436076996065,1660,15,"PPP2R1A, PPP2R5A, PPP2CB"
"457","Mitochondrial Fatty Acid Beta-Oxidation",0.467617349970291,0.812803975584724,0.300124713957175,0.989116723106742,2360,28,"PCCA, DBI, ACADL, MCEE, ACOT1, ACOT2, HADH"
"458","Mitochondrial biogenesis",0.10675562969141,0.726256492954425,-0.291893305198743,-1.23718390569938,511,86,"SOD2, CAMK4, GABPB1, PRKAG2, MICOS10, NCOA6, ATP5F1E, MED1, SIRT3, PPARGC1A, NCOA2, HELZ2, TBL1XR1, CALM1, ATP5MC3, TGS1, TFB2M, ATP5PO, PRKAB2, CRTC2, IDH2, MTERF1, MT-ATP6, CHD9, PRKAA2, NCOA1, ACSS2"
"459","Mitochondrial calcium ion transport",0.583367139959432,0.845791307710081,-0.294119779174556,-0.914495430753319,2875,21,"VDAC2, MICU2, PMPCB, SLC8B1"
"460","Mitochondrial protein import",0.400816802800467,0.793235968658333,0.266550325912395,1.02995830720818,2060,56,"TOMM22, PITRM1, TIMM17A, TIMM10, CYC1, MTX2, PMPCA, GFER, SAMM50, TIMM22, TOMM7, TIMM8B"
"461","Mitochondrial tRNA aminoacylation",0.173921846527637,0.771119417666732,-0.4375828201057,-1.26252953133492,858,16,"IARS2, PPA2, AARS2, FARS2, DARS2, PARS2"
"462","Mitochondrial translation",0.363220303723736,0.782068942252009,-0.244244624058637,-1.04404233781899,1745,90,"MRPL4, MRPL34, MRPS16, MRPL37, MTIF3, MRPL20, PTCD3, MRPL27, MRPL32, MRPL10, MRPL17, MRPS34, MRPS5, MRPS7, CHCHD1, MRPL9, MRPL39, MRPS24, MRPS18A, MRPL21, MRPL11, MRPL3, MRPL49, MRPS11, MRPL24, MRPL52, MRPL44"
"463","Mitochondrial translation elongation",0.305549738219895,0.781948655310053,-0.256527002426468,-1.08224347661762,1458,84,"MRPL4, MRPL34, MRPS16, MRPL37, MRPL20, PTCD3, MRPL27, MRPL32, MRPL10, MRPL17, MRPS34, MRPS5, MRPS7, CHCHD1, MRPL9, MRPL39, MRPS24, MRPS18A, MRPL21, MRPL11, MRPL3, MRPL49, MRPS11, MRPL24, MRPL52, MRPL44"
"464","Mitochondrial translation initiation",0.226485922836288,0.771119417666732,-0.267458223902048,-1.13133886885973,1085,85,"MRPL4, MRPL34, MRPS16, MRPL37, MTIF3, MRPL20, PTCD3, MRPL27, MRPL32, MRPL10, MRPL17, MRPS34, MRPS5, MRPS7, CHCHD1, MRPL9, MRPL39, MRPS24, MRPS18A, MRPL21, MRPL11, MRPL3, MRPL49, MRPS11, MRPL24, MRPL52, MRPL44"
"465","Mitochondrial translation termination",0.436287799791449,0.809730728490535,-0.238284134828117,-1.00793349941032,2091,85,"MRPL4, MRPL34, MRPS16, MRPL37, MRPL20, PTCD3, MRPL27, MRPL32, MRPL10, MRPL17, MRPS34, MRPS5, MRPS7, CHCHD1, MRPL9, MRPL39, MRPS24, MRPS18A, MRPL21, MRPL11, MRPL3, MRPL49, MRPS11, MRPL24, MRPL52, MRPL44"
"466","Mitophagy",0.271028037383178,0.774472222873076,-0.352561064334875,-1.14239066523638,1333,25,"SRC, UBB, ATG12, MFN2, FUNDC1, CSNK2A1, CSNK2B, MFN1"
"467","Mitotic Anaphase",0.398162327718224,0.793235968658333,0.227240029649315,1.02667740993838,2079,136,"UBE2D1, PSMD12, PSMA1, SMC3, NUDC, PPP2R1A, NUP160, DYNC1LI2, CENPC, CDC16, NUP98, PSMB7, CENPP, ANKLE2, VRK1, PPP2R5A, PPP2CB, DYNLL2, RAD21, ANAPC1, CDC27, PSMC2, PSMC5, STAG1, MAD1L1, NDEL1, PSMB3, XPO1, NUP107, LEMD2, RCC2, ITGB3BP, ANAPC16, PSMB2, NDE1, DYNC1H1, PSMD1, PSMA4, CDC23, HDAC8, PSMD2, DYNC1I2, PSMD3, CENPE, PSMD6"
"468","Mitotic G1 phase and G1/S transition",0.40461215932914,0.793235968658333,-0.231108616505734,-1.02597192661758,1929,111,"PSMB5, PSMD7, PSMD4, SRC, MNAT1, UBB, PSMB1, PSMD8, PSMD5, POLE4, LYN, CDKN2D, PSMD9, CDKN1B, LIN37, CDK7, E2F4, POLA1, PSMD11, ORC2, PSME3, JAK2, CCND1"
"469","Mitotic G2-G2/M phases",0.384388185654008,0.790269044054263,-0.218654278990277,-1.02746037992793,1821,159,"PSMB5, CEP70, PSMD7, ACTR1A, PSMD4, MNAT1, UBB, PSMB1, EP300, PSMD8, PSMD5, SFI1, CCP110, PPP1R12B, PRKACA, SSNA1, CETN2, CEP76, AKAP9, PSMD9, NME7, LIN37, CDK7, TUBG2, DYNLL1, PSMD11, TUBGCP4, CKAP5, CEP290, PSME3, PPP1CB"
"470","Mitotic Metaphase and Anaphase",0.398162327718224,0.793235968658333,0.227240029649315,1.02667740993838,2079,136,"UBE2D1, PSMD12, PSMA1, SMC3, NUDC, PPP2R1A, NUP160, DYNC1LI2, CENPC, CDC16, NUP98, PSMB7, CENPP, ANKLE2, VRK1, PPP2R5A, PPP2CB, DYNLL2, RAD21, ANAPC1, CDC27, PSMC2, PSMC5, STAG1, MAD1L1, NDEL1, PSMB3, XPO1, NUP107, LEMD2, RCC2, ITGB3BP, ANAPC16, PSMB2, NDE1, DYNC1H1, PSMD1, PSMA4, CDC23, HDAC8, PSMD2, DYNC1I2, PSMD3, CENPE, PSMD6"
"471","Mitotic Prometaphase",0.375644206909716,0.784724146068684,0.226690215723705,1.03369267323011,1967,144,"TUBGCP5, SMC3, NUDC, PPP2R1A, HAUS4, NUP160, DYNC1LI2, CEP63, CENPC, NUP98, ODF2, CENPP, YWHAG, EML4, PPP2R5A, NUMA1, NINL, PPP2CB, DYNLL2, RAD21, NEK7, STAG1, MAD1L1, NDEL1, DCTN3, XPO1, NUP107, NEK6, CDK5RAP2, SDCCAG8, RCC2, CEP57, ITGB3BP, TUBB, NDE1, DYNC1H1, MZT2B, MZT2A, CSNK1E"
"472","Mitotic Prophase",0.192637319828594,0.771119417666732,0.289362988408755,1.17251127494584,988,72,"MAPK3, PPP2R1A, NUP160, NUP98, VRK1, NUMA1, POM121, POM121C, PPP2CB, CTDNEP1, NEK7, ENSA, BLZF1, PRKCB, NUP107, USO1, NCAPH2, NEK6, LEMD2"
"473","Mitotic Spindle Checkpoint",0.228252501924557,0.771119417666732,0.279049583983212,1.14059916628952,1185,75,"UBE2D1, NUDC, PPP2R1A, NUP160, DYNC1LI2, CENPC, CDC16, NUP98, CENPP, PPP2R5A, PPP2CB, DYNLL2, ANAPC1, CDC27, MAD1L1, NDEL1, XPO1, NUP107, RCC2, ITGB3BP, ANAPC16, NDE1, DYNC1H1"
"474","Molecules associated with elastic fibres",0.559869892254523,0.844184352129354,-0.301921238095075,-0.927794760675138,2753,20,"ITGA8, ITGB8, LTBP3, ITGB5, LTBP1, MFAP1, TGFB1"
"475","Muscle contraction",0.230479380364245,0.771119417666732,-0.24099808347202,-1.10933318836864,1100,139,"LMOD1, MYH11, FGF14, KCNIP3, KCNIP4, SCN2A, KCNQ1, CACNB4, VIM, ATP2A3, PAK1, STIM1, PRKACA, ACTA2, KCND3, ATP2B4, TPM2, TTN, SCN3B, AKAP9, CACNG8, CALM1, RYR3, TRDN, ITGB5, KCND2, SLC8A1, SORBS3, MYL9, KCNIP2, RANGRF, SCN9A, GUCY1A2, KCND1, KCNK9, ASPH, HIPK2, DMPK"
"476","MyD88 cascade initiated on plasma membrane",0.254202116621706,0.774472222873076,-0.275298811021498,-1.1186128774119,1224,67,"RPS6KA3, PELI2, MAPK1, UBB, IRAK1, FOS, RPS6KA5, NFKB2, ELK1, CHUK, MAPK10, IKBKB, NFKB1, RIPK2, MAP2K6, PPP2R5D, MAP2K1, IKBKG, TRAF6, NKIRAS1"
"477","MyD88 dependent cascade initiated on endosome",0.328423236514523,0.781948655310053,-0.261351513142265,-1.07089042019555,1582,71,"RPS6KA3, PELI2, MAPK1, UBB, IRAK1, FOS, RPS6KA5, NFKB2, ELK1, CHUK, MAPK10, IKBKB, NFKB1, RIPK2, MAP2K6, PPP2R5D, MAP2K1, IKBKG, TRAF6, NKIRAS1"
"478","MyD88-independent TLR4 cascade",0.34014172571905,0.781948655310053,-0.253153646850586,-1.05897129032715,1631,80,"IRF3, RPS6KA3, MAPK1, UBB, PTPN11, IRAK1, FOS, RPS6KA5, NFKB2, ELK1, CHUK, MAPK10, IKBKB, NFKB1, RIPK2, MAP2K6, PPP2R5D, UBE2D2, MAP2K1, IKBKG, TRAF6, NKIRAS1"
"479","MyD88:MAL(TIRAP) cascade initiated on plasma membrane",0.407499482079967,0.793235968658333,-0.248397223511451,-1.02569347605494,1966,74,"RPS6KA3, PELI2, MAPK1, UBB, IRAK1, FOS, RPS6KA5, NFKB2, ELK1, CHUK, MAPK10, IKBKB, NFKB1, RIPK2, MAP2K6, PPP2R5D, MAP2K1, IKBKG, TRAF6, NKIRAS1"
"480","Myogenesis",0.596185064935065,0.847702748064008,-0.284709815436919,-0.905140039578152,2937,23,"CTNNA2, SPAG9, CTNNB1, MAP2K6"
"481","N-glycan antennae elongation in the medial/trans-Golgi",0.851000594412522,0.927658572700537,0.235768410297594,0.732829381294732,4294,22,"FUCA1, MGAT4B, ST8SIA3, MGAT2, ST8SIA6, B4GALT4, B4GALT6, B4GALT2, MAN2A2"
"482","N-glycan trimming in the ER and Calnexin/Calreticulin cycle",0.232496427842417,0.771119417666732,-0.33796627981748,-1.16506641843513,1138,32,"AMFR, SEL1L, UBB, UGGT1, EDEM1, UBXN1, RNF185, CALR, PDIA3"
"483","NCAM signaling for neurite out-growth",0.21154591243704,0.771119417666732,0.332167515551148,1.18461561637488,1091,39,"COL4A3, COL4A4, NRAS, MAPK3, CACNA1C, GFRA1, GFRA2, GRB2, COL4A1, SPTBN1, CACNB3, CACNA1I, CREB1"
"484","NCAM1 interactions",0.114156151419558,0.749777574756668,0.434575047777275,1.33895440250924,578,21,"COL4A3, COL4A4, CACNA1C, GFRA1, GFRA2, COL4A1, CACNB3, CACNA1I"
"485","NEP/NS2 Interacts with the Cellular Export Machinery",0.616706161137441,0.853046440467673,0.26970665874194,0.897593837727479,3122,29,"NUP160, NUP98, POM121, POM121C, XPO1, NUP107"
"486","NIK-->noncanonical NF-kB signaling",0.0559006211180124,0.726256492954425,-0.356227941414355,-1.37084077718168,269,52,"PSMB5, PSMD7, PSMD4, UBB, UBE2M, PSMB1, PSMD8, UBA3, PSMD5, PSMD9, NFKB2, CHUK, PSMD11, MAP3K14, PSME3"
"487","NOD1/2 Signaling Pathway",0.123579545454545,0.771119417666732,-0.414565339967231,-1.31797243326445,608,23,"IRAK1, CHUK, CASP9, IKBKB, RIPK2, MAP2K6, IKBKG, TRAF6, CASP8"
"488","NOTCH1 Intracellular Domain Regulates Transcription",0.887715179968701,0.940782857851308,0.201694615201493,0.73362997975184,4537,43,"NOTCH1, FBXW7, SKP1, TBL1X, HDAC1, MAMLD1, HES1, MAML1, CDK8, HDAC3, HDAC8, MAML2, HEYL, HDAC4, CREBBP"
"489","NOTCH2 Activation and Transmission of Signal to the Nucleus",0.365353371242892,0.783986632735695,-0.358023179700976,-1.0679160570269,1798,18,"ADAM10, CNTN1, UBB, PSENEN, NOTCH2, NEURL1"
"490","NOTCH3 Activation and Transmission of Signal to the Nucleus",0.198152152545705,0.771119417666732,0.407268645161238,1.22193872920159,1007,19,"NCSTN, EGFR, WWP2, MIB2"
"491","NOTCH3 Intracellular Domain Regulates Transcription",0.694761717211501,0.874474162290525,0.283097749029216,0.838056311545516,3527,18,"NOTCH1, MAMLD1, HES1, MAML1, IKZF1, MAML2, HEYL, CREBBP"
"492","NOTCH4 Intracellular Domain Regulates Transcription",0.757440777485321,0.898403701334946,-0.274096135666561,-0.790831928959701,3740,16,"EP300, ACTA2, RBPJ, NOTCH2, SNW1, HEY2, KAT2B"
"493","NR1H2 and NR1H3-mediated signaling",0.863114754098361,0.933413693346191,-0.209992356973084,-0.751406050756342,4211,37,"EP300, TNRC6B, AGO4, ABCG1, SCD, TBL1XR1, AGO3"
"494","NR1H3 & NR1H2 regulate gene expression linked to cholesterol transport and efflux",0.637994292702813,0.859482621285528,-0.259327709295617,-0.886942236438757,3129,31,"EP300, TNRC6B, AGO4, ABCG1, TBL1XR1, AGO3, TNRC6A, NCOA1, TNRC6C"
"495","NRAGE signals death through JNK",0.883684314111395,0.938669115878327,0.200944940728048,0.752743068296779,4489,49,"ARHGEF12, NGF, ARHGEF2, TRIO, ARHGEF4, AKAP13, MAPK8, ARHGEF7, ARHGEF6, GNA13, ARHGEF5, ARHGEF26, RASGRF2"
"496","NS1 Mediated Effects on Host Pathways",0.579258675078864,0.845791307710081,0.265189312933331,0.923385226933769,2937,36,"KPNA1, NUP160, NUP98, POM121, POM121C, KPNB1, NUP107"
"497","Neddylation",0.200339238597814,0.771119417666732,0.234869100993484,1.11854782171859,1062,194,"ZBTB16, DCUN1D2, UBE2D1, PSMD12, PSMA1, KLHL5, CUL3, DDA1, NEDD8, FBXW7, SKP1, WDTC1, ASB3, PSMB7, FBXO22, DCAF5, CUL4A, CUL2, WDR5, KLHL20, ANKRD9, ASB5, FBXL5, DCAF8, PSMC2, CCNF, RNF7, PSMC5, FBXW11, CAND1, WSB1, NAE1, COMMD9, PSMB3, KLHL22, PUM2, DCAF10, ERCC8, HIF3A, SOCS5, FBXL7, FBXL15, ASB1, PSMB2, FBXW9, LRRC41, FBXL20, PSMD1, UBE2D3, SOCS3, FEM1C, FBXO6, FBXO44, PSMA4"
"498","Nef-mediates down modulation of cell surface receptors by recruiting them to clathrin adapters",0.904009480545131,0.941983001970676,0.232582688734099,0.667024993362766,4576,16,"AP1S1, ATP6V1H, PACS1"
"499","Negative epigenetic regulation of rRNA expression",0.822869513875221,0.924371045481785,0.212236227742081,0.795040416023812,4180,49,"POLR2K, GTF2H5, RRP8, SMARCA5, SIRT1, HDAC1, ERCC2, DNMT1"
"500","Negative regulation of FGFR1 signaling",0.514833501513623,0.826338845894082,-0.303899639467197,-0.955975094165385,2550,22,"SRC, MAPK1, UBB, PTPN11, CBL"
"501","Negative regulation of FGFR2 signaling",0.479313824419778,0.816501462959306,-0.313497744232999,-0.986167789106988,2374,22,"SRC, MAPK1, UBB, PTPN11, CBL"
"502","Negative regulation of FGFR3 signaling",0.413295385240903,0.794990720906042,-0.335858860647899,-1.0320840402003,2032,20,"SRC, MAPK1, UBB, PTPN11, CBL"
"503","Negative regulation of FGFR4 signaling",0.428280773143438,0.808182657273221,-0.337868117084047,-1.02298815770625,2104,19,"SRC, MAPK1, UBB, PTPN11, CBL"
"504","Negative regulation of MAPK pathway",0.637718094491276,0.859482621285528,0.256234688920634,0.883854677771221,3252,34,"NRAS, MAPK3, PPP2R1A, PPP2R5A, PPP2CB, BRAF, DUSP8, DUSP1"
"505","Negative regulation of MET activity",0.454711616571893,0.811015495228973,-0.336713345043697,-1.00435281337853,2238,18,"UBB, CBL, PTPN2, SH3GL2, SH3GL1, STAM"
"506","Negative regulation of NMDA receptor-mediated neuronal transmission",0.0641754670999188,0.726256492954425,-0.485074223284421,-1.4468855126306,315,18,"CAMK4, GRIN2A, DLG2, LRRC7, CALM1, GRIN2B"
"507","Negative regulation of NOTCH4 signaling",0.353833538335383,0.781948655310053,-0.280456000834935,-1.05471308219454,1725,46,"PSMB5, PSMD7, PSMD4, UBB, PSMB1, PSMD8, PSMD5"
"508","Negative regulation of the PI3K/AKT network",0.574282147315855,0.845791307710081,-0.227312167498062,-0.940502363569243,2759,75,"NRG3, PIK3CD, NRG1, SRC, MAPK1, PTPN11, THEM4, PIP4K2B, IRAK1, PIP5K1C"
"509","Negative regulators of DDX58/IFIH1 signaling",0.240118577075099,0.771119417666732,0.361245918014243,1.17299495489038,1214,26,"TAX1BP1, UBE2D1, IFIH1, ITCH, ATG5, UBE2K"
"510","Nephrin family interactions",0.445871559633028,0.811015495228973,-0.344062494147642,-1.00909984574697,2186,17,"CD2AP, KIRREL3, NCK2, ACTN4, WASL, PIK3CA"
"511","Netrin-1 signaling",0.014288630332721,0.478157108764308,-0.417879079966985,-1.56714832129038,69,45,"DCC, NTN1, PITPNA, RGMA, MYO10, SRC, DOCK1, SIAH2, PTPN11, PAK1, DSCAM, SLIT1, UNC5D, PTK2, ABLIM1, WASL"
"512","Neurexins and neuroligins",0.0139946491047541,0.478157108764308,-0.39533437583191,-1.53950136250104,67,54,"NLGN1, GRIN2A, DLGAP1, DLG2, NRXN1, GRM5, EPB41L5, LRRTM4"
"513","Neurodegenerative Diseases",0.408179793480462,0.793235968658333,-0.360483941429504,-1.04008110171424,2015,16,"SOD2, LMNA, PRDX2, CAPN2"
"514","Neuronal System",0.000217108119843682,0.10377768128528,-0.331436993451495,-1.69064266368517,0,311,"KCNH7, KCNC3, CAMK4, GRIK2, NLGN1, GRIN2A, HSPA8, DLGAP1, GABRB1, RIMS1, ADCY1, PLCB1, DLG2, NRXN1, GRM5, GABRB3, GNG2, KCNA1, PTPRD, PRKAG2, RPS6KA3, EPB41L5, GLRB, GABRA5, CACFD1, KCNQ1, SLC17A7, VAMP2, NRG1, CACNB4, SLC38A1, LRRTM4, SRC, RTN3, MAPK1, KCNJ6, KCNN2, GNAI2, SLC6A12, PPFIA2, ADCY6, PRKACA, KCND3, SYN2, LRRC7, GRIA2, NTRK3, KCNJ9, GABRG2, GRIA3, NSF, KCNQ3, IL1RAPL2, IL1RAPL1, CACNG8, KCNH8, GRIA1, GIT1, CALM1, GRIK1, KCNH1, IL1RAP, KCNG1, GRIN2B, ADCY2, PTPRF, MAOA, SYN1, HOMER1, SLC6A13, NPTN, GABRG3, CAMKK1, KCND2, PRKAB2, GNB1, PTPRS, GLS, KCNJ8, LRRTM1, KCNC1"
"515","Neurotransmitter receptors and postsynaptic signal transmission",0.00167224080267559,0.26644370122631,-0.338829820998951,-1.56585539590506,7,142,"CAMK4, GRIK2, GRIN2A, GABRB1, ADCY1, PLCB1, DLG2, GABRB3, GNG2, PRKAG2, RPS6KA3, GLRB, GABRA5, NRG1, SRC, MAPK1, KCNJ6, GNAI2, ADCY6, PRKACA, LRRC7, GRIA2, KCNJ9, GABRG2, GRIA3, NSF, CACNG8, GRIA1, GIT1, CALM1, GRIK1, GRIN2B, ADCY2"
"516","Neurotransmitter release cycle",0.350553505535055,0.781948655310053,-0.28090935274887,-1.0564180062933,1709,46,"HSPA8, RIMS1, SLC17A7, VAMP2, SLC6A12, PPFIA2, SYN2"
"517","Neutrophil degranulation",0.060229799851742,0.726256492954425,0.241032246988365,1.21344231207426,324,311,"VCL, NCSTN, ANO6, CTSS, SLC44A2, NRAS, CAP1, PSMD12, PGM1, FUCA1, SYNGR1, ITGAV, KCMF1, LAMP2, GNS, ACLY, PGAM1, ACTR2, DIAPH1, CNN2, PSMB7, RAB5B, PKM, HMOX2, TTR, ACTR10, TRAPPC1, HEXB, IST1, MLEC, TMEM179B, PTPRC, FTL, GRN, RAB3A, PSMC2, RAB10, KPNB1, TMEM63A, CPNE3, FUCA2, CCT8, MIF, PADI2, CAND1, COMMD9, CANT1, PTPRJ, ALAD, RHOG, PYCARD, TOLLIP, CYBA, ROCK1, CTSH, IQGAP2, VPS35L, CAB39, PDAP1, GGH, APRT, SDCBP, C6orf120, VAT1, GM2A, TUBB, MAN2B1, CPPED1, VCP, DYNC1H1, ARPC5, SRP14, PSMD1, LAIR1, RAB31, CKAP4, DOK3, PRDX6, ACAA1, TCIRG1, PSMD2, MAGT1, GHDC, DNAJC13, IGF2R, PSMD3, LTA4H, GALNS, IDH1, PSMD6, MAPK14, GUSB, DEGS1, STBD1, BST2"
"518","Nicotinate metabolism",0.955239064089522,0.965784253046172,-0.200101095929063,-0.60586081115358,4694,19,"NAMPT, PARP14, PTGS2, PARP16, PTGIS, PARP9"
"519","Nitric oxide stimulates guanylate cyclase",0.506331618519984,0.826338845894082,0.340873311246284,0.959756598843316,2558,15,"ITPR1, PDE9A, KCNMB1, PDE5A, KCNMA1"
"520","NoRC negatively regulates rRNA expression",0.859422958870473,0.933413693346191,-0.206089393551611,-0.777800240495593,4199,47,"MNAT1, GTF2H1, CDK7, SAP30L, ARID4B, TTF1, SAP130, TAF1D, TAF1B, H3-3A, SAP18, SAP30, TWISTNB, SAP30BP, UBTF, GTF2H3, SIN3A, GTF2H4, POLR1B, HDAC2, POLR1A"
"521","Non-integrin membrane-ECM interactions",0.388551264457949,0.793235968658333,0.303775717846514,1.04784246950699,1981,34,"LAMA2, ITGAV, DDR1, TTR, LAMC3, NTN4, LAMA4, ACTN1, SDC3, DAG1, SDC4, VTN, LAMB2, LAMC1, ITGB4, PDGFA"
"522","Nonhomologous End-Joining (NHEJ)",0.136462665874431,0.771119417666732,0.392967051261692,1.29509588500048,688,28,"NSD2, UBE2V2, SUMO1, RIF1, HERC2, ATM, RAD50, TP53BP1, UIMC1, PAXIP1, PRKDC, UBE2N"
"523","Nonsense Mediated Decay (NMD) enhanced by the Exon Junction Complex (EJC)",0.306135096054534,0.781948655310053,-0.261943396149076,-1.07999927026403,1481,73,"SMG6, RPL22L1, GSPT2, RPL8, UPF2, RPL35, RPL29, RPS17, RPL28, NCBP2, UPF3B, UPF1, RPL18A, RBM8A"
"524","Nonsense Mediated Decay (NMD) independent of the Exon Junction Complex (EJC)",0.330935251798561,0.781948655310053,0.280404962614285,1.07466140108029,1701,54,"RPL19, RPSA, RPL30, RPL6, RPS15, RPL4, RPL14, RPS14, RPL34, GSPT1, RPLP1"
"525","Nonsense-Mediated Decay (NMD)",0.306135096054534,0.781948655310053,-0.261943396149076,-1.07999927026403,1481,73,"SMG6, RPL22L1, GSPT2, RPL8, UPF2, RPL35, RPL29, RPS17, RPL28, NCBP2, UPF3B, UPF1, RPL18A, RBM8A"
"526","Norepinephrine Neurotransmitter Release Cycle",0.216845515286495,0.771119417666732,-0.418214187823371,-1.20664646391445,1070,16,"RIMS1, VAMP2, PPFIA2, MAOA"
"527","Notch-HLH transcription pathway",0.873818897637795,0.936514423925709,0.221879556585785,0.714287211751262,4438,25,"NOTCH1, TBL1X, HDAC1, MAMLD1, MAML1, HDAC3, HDAC8, MAML2, HDAC4, CREBBP"
"528","Nuclear Envelope Breakdown",0.406593406593407,0.793235968658333,0.280884574755187,1.02670806560409,2071,44,"NUP160, NUP98, VRK1, POM121, POM121C, CTDNEP1, NEK7, PRKCB, NUP107, NEK6, LEMD2"
"529","Nuclear Events (kinase and transcription factor activation)",0.68584942845881,0.873065317718538,0.270435056034268,0.851284196329574,3479,23,"MAPK3, PPP2R1A, ATF1, PPP2CB, MAPKAPK2, CREB1, MAPK14, MEF2C, DUSP7, MEF2A"
"530","Nuclear Pore Complex (NPC) Disassembly",0.692503924646782,0.874474162290525,0.251538819870352,0.848959972471696,3528,31,"NUP160, NUP98, POM121, POM121C, NEK7, NUP107, NEK6"
"531","Nuclear Receptor transcription pathway",0.796784192173576,0.905254308043864,0.223638272084746,0.797565617128779,4112,39,"NR1D1, NR2C1, NR1H3, NR4A3, THRB, NR1H2, PPARG, PPARD, NRBF2, THRA, NR2F1"
"532","Nuclear import of Rev protein",0.596761453396525,0.847702748064008,0.27362553572642,0.910636006758414,3021,29,"NUP160, NUP98, POM121, POM121C, KPNB1, NUP107"
"533","Nuclear signaling by ERBB4",0.220963172804533,0.771119417666732,-0.36375460237893,-1.19069697815423,1091,26,"NRG3, NRG1, SRC, PSENEN"
"534","Nucleobase catabolism",0.544013010774548,0.844184352129354,-0.305250726019598,-0.938026175568616,2675,20,"GPX1, NUDT9, NT5C2, UPP2, GDA, ENTPD6, ADPRM, PNP"
"535","Nucleotide Excision Repair",0.260012581253932,0.774472222873076,-0.2523742998652,-1.10293127583615,1239,102,"HMGN1, ACTR8, DDB2, ISY1, POLD4, UBE2I, MNAT1, UBB, INO80, EP300, GTF2H1, POLE4, LIG1, CETN2, CDK7, ACTB, COPS5, PRPF19, COPS7B, COPS6, CUL4B, ACTR5"
"536","Nucleotide salvage",0.793798143393245,0.905254308043864,0.266085141594955,0.763106836421588,4018,16,"HPRT1, APRT, ADK, UCKL1, GMPR2, ADA"
"537","Nucleotide-binding domain, leucine rich repeat containing receptor (NLR) signaling pathways",0.20922131147541,0.771119417666732,-0.330473791623118,-1.18251926032637,1020,37,"IRAK1, NFKB2, CHUK, CASP9, IKBKB, NFKB1, RIPK2, MAP2K6, IKBKG, TRAF6"
"538","O-glycosylation of TSR domain-containing proteins",0.719546742209632,0.878003759835497,-0.254274836890374,-0.832331131828902,3555,26,"THSD7B, SEMA5A"
"539","O-linked glycosylation",0.844759324859346,0.927321282684127,-0.198380900686164,-0.800076333743904,4053,65,"ST6GAL1, THSD7B, SEMA5A, B3GNTL1, C1GALT1C1, ST6GALNAC4, B3GALNT2, POMT2"
"540","O-linked glycosylation of mucins",0.938967136150235,0.953934731306721,-0.194628748710721,-0.670940956912539,4599,32,"ST6GAL1, B3GNTL1, C1GALT1C1, ST6GALNAC4"
"541","Oncogene Induced Senescence",0.651581027667984,0.865034829584576,0.268419685589273,0.87158060835739,3296,26,"MAPK3, MDM4, MDM2, MOV10, TP53, ETS1, TFDP1"
"542","Oncogenic MAPK signaling",0.0698635799917321,0.726256492954425,-0.334991646884551,-1.32797546073566,337,59,"ARAF, KDM7A, SPRED2, SPRED1, LMNA, CNKSR2, SRC, FAM131B, MAPK1, SPRED3, CSK"
"543","Opioid Signalling",0.343110927494319,0.781948655310053,-0.256856263992157,-1.05902489527318,1660,73,"CAMK4, ADCY1, PLCB1, GNG2, MAPK1, GNAI2, ADCY6, PRKACA, PDE1A, PPP1CA, CALM1, ADCY2, PPP2R5D, PDE4D, CAMKK1, GNB1"
"544","Orc1 removal from chromatin",0.516029593094945,0.826338845894082,-0.247211410737224,-0.967706495478674,2510,55,"PSMB5, PSMD7, PSMD4, UBB, PSMB1, PSMD8, PSMD5, PSMD9, PSMD11, ORC2, PSME3"
"545","Organelle biogenesis and maintenance",0.06517047906776,0.726256492954425,-0.243638506191362,-1.21570067198433,301,253,"SOD2, CAMK4, CEP70, GABPB1, PRKAG2, MICOS10, WDR35, TRIP11, SMO, ACTR1A, NCOA6, ATP5F1E, ARL13B, ARL3, MARK4, SFI1, CCP110, MED1, PRKACA, BBS5, SIRT3, AHI1, PPARGC1A, IFT80, SSNA1, NCOA2, CETN2, IFT88, CEP76, HELZ2, AKAP9, EXOC7, CCT5, TBL1XR1, CCT3, IFT52, DYNLL1, CALM1, TCTEX1D2, ATP5MC3, RP2, TGS1, ARL6, TCTE3, IFT20, CKAP5, CEP290, TFB2M, ATP5PO, PRKAB2, CEP72, WDR34, NPHP3, CRTC2, CSNK1D, CCT2, KIF3B, IDH2, IFT22, MTERF1, IFT43, CEP41, NEDD1, MT-ATP6, CHD9, HAUS6, PRKAA2, IFT57, NCOA1"
"546","Other interleukin signaling",0.512130479102956,0.826338845894082,-0.327980642458754,-0.961933431695398,2511,17,"PTPRZ1, VAMP2"
"547","Other semaphorin interactions",0.525775232075844,0.837735203107512,0.331954147661089,0.952012870543092,2661,16,"SEMA6A, SEMA4A, ITGA1, PTPRC"
"548","Ovarian tumor domain proteases",0.670977856163041,0.870373915670083,0.253556628351362,0.862665344034917,3423,32,"UBE2D1, IFIH1, ZRANB1, TNIP2, TP53, OTUD7B"
"549","Oxidative Stress Induced Senescence",0.326150262085032,0.781948655310053,0.285244812801454,1.07970450858052,1679,51,"MAPK3, MDM4, PHC1, MAP3K5, SCMH1, MDM2, JUN, MOV10, TP53, MAPKAPK2, MAPK8, RING1, TFDP1, PHC3"
"550","Oxygen-dependent proline hydroxylation of Hypoxia-inducible Factor Alpha",0.446786526141765,0.811015495228973,-0.255405626181288,-1.00523698968172,2161,57,"PSMB5, PSMD7, PSMD4, UBB, PSMB1, PSMD8, PSMD5, EPAS1, PSMD9, PSMD11, PSME3, UBE2D2"
"551","PCNA-Dependent Long Patch Base Excision Repair",0.361814132415469,0.782042559127477,-0.372909489646622,-1.07593173580299,1786,16,"POLD4, POLE4, LIG1"
"552","PCP/CE pathway",0.127020306672192,0.771119417666732,-0.295244290612956,-1.22659787758323,612,77,"PSMB5, PSMD7, CLTA, PSMD4, UBB, PSMB1, CLTC, PSMD8, PSMD5, PSMD9, RHOA, FZD3, PSMD11, FZD4, PSME3, PRICKLE1, DVL2, FZD7"
"553","PERK regulates gene expression",0.703763658437879,0.874474162290525,-0.257277772356207,-0.84216079765684,3477,26,"CEBPG, ATF6, EIF2S2, DIS3, EXOSC1, EXOSC5, EIF2S3, NFYA, PARN, ATF4, KHSRP, EXOSC8"
"554","PI Metabolism",0.143964347994575,0.771119417666732,0.3000715390599,1.2192392581159,742,73,"SACM1L, SBF2, PIP5K1A, MTM1, PLEKHA1, INPP5D, MTMR4, PIKFYVE, GDE1, PIP4K2A, INPP4A, PIK3C3, SYNJ2"
"555","PI3K Cascade",0.740965071673733,0.889902774522725,-0.246131488751951,-0.822536241651664,3669,28,"PTPN11, THEM4, GAB2, FRS2, PDE3B, PIK3CA, FLT3, GAB1, FGFR1, IRS2"
"556","PI3K/AKT Signaling in Cancer",0.879041682898325,0.938036102007882,0.192198855411656,0.778798028874085,4512,72,"EGFR, PRR5, FOXO3, GSK3A, MDM2, ERBB4, GRB2, RPS6KB2, FOXO4, RHOG, FGF10, PDGFRB, PIK3R2, CREB1, PIK3R1, CD86, KITLG, MAPKAP1"
