"","pathway","pval","padj","ES","NES","nMoreExtreme","size","leadingEdge"
"420","Keratinization",0.345653006510915,0.868595870268453,-0.371604896927952,-1.08060381577442,1804,22,"TCHH, JUP, CAPN1, KRT2, DSC3, PCSK6"
"421","Kinesins",0.723292836196062,0.928585036605612,0.263440805986259,0.834985651208107,3452,29,"KIF21B, KIF3A, KIF3C, KIF21A, KIF5B, KIF2A, KIF1C, KIF6, KLC1, KIFAP3, KIF18A, KIF13B, KIF16B, CENPE"
"422","L13a-mediated translational silencing of Ceruloplasmin expression",0.145930361499224,0.868595870268453,0.309218643243828,1.19766160441772,657,78,"RPL29, RPL19, EIF2S1, RPS8, EIF3F, EIF4G1, EIF3A, EIF2S2, EIF4A2, EIF3J, RPS9, FAU, EIF3K, RPL11, RPS20, RPS16, RPS14, RPS13, RPL34, RPL10A, RPSA, RPL36, RPL26, RPS27A, RPL6, EIF3G, RPL32, RPS17, RPL38, EIF3L, EIF3E"
"423","L1CAM interactions",0.0197442225712363,0.690157027958637,0.364172757778512,1.43671891694416,87,87,"LAMC1, CNTN2, MAP2K2, RDX, RPS6KA5, NRP2, MAPK3, NRP1, DLG1, AP2M1, AP2A2, SCN1B, RPS6KA1, SCN8A, NCAM1, RPS6KA3, SCN3A, CHL1, CNTN1, KCNQ3"
"424","LDL clearance",0.623867360709466,0.928585036605612,-0.334496207854233,-0.883902628579358,3235,15,"NPC2, NPC1, AP2B1, CLTA"
"425","Lagging Strand Synthesis",0.199132410658955,0.868595870268453,0.428005626386967,1.21800385473584,963,19,"RPA1, PRIM1, RFC2, LIG1, PCNA, RFC3, RPA3, FEN1, POLD4"
"426","Laminin interactions",0.404461888039661,0.884200182688848,0.363554796944296,1.03459187633553,1957,19,"LAMC1, ITGA6, LAMB1, LAMA2"
"427","Late Phase of HIV Life Cycle",0.534158642824393,0.915865513828162,0.229560183661481,0.965991038050691,2329,128,"TAF3, GTF2A1, VTA1, GTF2H2, ELOC, POLR2E, RANBP1, CHMP2A, MVB12B, TAF11, NMT1, NUP88, NEDD4L, POLR2C, POLR2K, NUP155, RANGAP1, CCNH, UBAP1, TCEA1, SSRP1, NUP54, CHMP5, CHMP2B, TAF6, POM121C, POM121, GTF2F1, NUP42, CDK7, NUP160"
"428","Late endosomal microautophagy",0.931140015302219,0.989336266258607,-0.220669251320358,-0.678716793196741,4867,28,"HSPA8, PLIN3, PARK7, TSG101, CHMP3, VPS37A, PLIN2, UBB, VPS28"
"429","Listeria monocytogenes entry into host cells",0.167874146139516,0.868595870268453,0.450427076709594,1.26210351100393,810,18,"SH3KBP1, SH3GL1, STAM, STAM2, GRB2, HGS, RPS27A, CBLL1"
"430","Long-term potentiation",0.849212447176335,0.960233340499847,-0.258251936958202,-0.741260438226613,4420,21,"NRG1, NEFL, CALM1, GRIA1, SRC, DLG4, ACTN2, GRIN2B, LRRC7"
"431","Loss of Nlp from mitotic centrosomes",0.343429941163652,0.868595870268453,0.284988403916977,1.06059766095464,1575,62,"SDCCAG8, DCTN2, CEP250, CDK5RAP2, PAFAH1B1, TUBA4A, CEP57, CLASP1, FGFR1OP, HAUS6, DYNLL1, CETN2, CEP78, TUBB4A, OFD1, DYNC1I2, DCTN1, ALMS1, DYNC1H1, NINL, DCTN3, NEDD1, HAUS1, AKAP9"
"432","Loss of proteins required for interphase microtubule organization from the centrosome",0.343429941163652,0.868595870268453,0.284988403916977,1.06059766095464,1575,62,"SDCCAG8, DCTN2, CEP250, CDK5RAP2, PAFAH1B1, TUBA4A, CEP57, CLASP1, FGFR1OP, HAUS6, DYNLL1, CETN2, CEP78, TUBB4A, OFD1, DYNC1I2, DCTN1, ALMS1, DYNC1H1, NINL, DCTN3, NEDD1, HAUS1, AKAP9"
"433","Lysosome Vesicle Biogenesis",0.303995476818696,0.868595870268453,-0.344728820610319,-1.10177826021106,1612,33,"VAMP2, AP4S1, DNAJC6, HSPA8, SH3GL2, AP1G2, AP1G1, AP4E1, CLTA"
"434","M Phase",0.172308475439043,0.868595870268453,0.239315326223768,1.10750527942258,676,275,"MAU2, ITGB3BP, SMC3, RB1, PSMD4, SDCCAG8, DCTN2, SET, CEP250, PSMB4, PSMB1, PPP2R5E, EML4, MAPK3, CDK5RAP2, PPP2R5C, ANAPC1, PAFAH1B1, NUP88, PSMD5, TUBA4A, UBE2D1, CEP57, CDC16, UBE2E1, NEK9, PSMD3, ZWINT, PSMB2, RAB2A, PSMA3, CENPC, NUP155, RANGAP1, PPP2R2D, CENPP, PSME4, LEMD2, SMC1A, CLASP1, ANAPC5, FGFR1OP, RAD21, HAUS6, DYNLL1, TUBGCP6, USO1, NUP54, VRK2, CETN2, PSMC3, POM121C, POM121, ANAPC7, CEP78, NUP42, ANAPC16, NUP160, TUBB4A, OFD1, RCC2, EMD, DYNC1I2, H3-3A, TMPO, DCTN1, ALMS1, DYNC1H1, NINL, MIS12, AHCTF1, PSMA4, LMNA, DCTN3, NUP133, RPS27A, KIF2A"
"435","MAP kinase activation",0.716808371484631,0.928585036605612,0.235932718161345,0.868706474518597,3287,59,"UBE2N, RPS6KA5, MAPK3, TAB2, TNIP2, RPS6KA1, RPS6KA3, DUSP7, MAPK14, IRAK2, ATF2, MAPK7, ELK1, VRK3, RPS6KA2, RPS27A, IKBKB"
"436","MAP2K and MAPK activation",0.672978723404255,0.928585036605612,0.270435629391405,0.875767482773632,3162,32,"MAP2K2, MAPK3, TLN1, CNKSR2, APBB1IP, MARK3, RAF1, RAP1B, RAP1A"
"437","MAP3K8 (TPL2)-dependent MAPK1/3 activation",0.900694176629387,0.978765645230902,-0.248584262020497,-0.667051288084568,4670,16,"IKBKG, CUL1"
"438","MAPK family signaling cascades",0.461939169887414,0.894238228962925,-0.227514191882625,-0.997226518857763,2748,229,"NRG1, PSMB7, CDC14A, PSMC4, ERBB3, CDC42EP2, NCOA3, PPP2R1B, SPTBN1, PAQR3, IRS2, KSR1, PSMD14, PRKACA, MAPK6, PSMD9, LAMTOR2, KITLG, RASGRF1, IRS1, WDR83, AGO2, KSR2, TNRC6B, PHB, PSMB5, NEFL, LAMTOR3, CALM1, PEA15, PSMA1, ANGPT1, KIT, PSMB3, FGF10, PSMD7, PSMD1, RASGRP3, PSMD8, SRC, PSMA5, EGFR, BTC, RASA1, RASA2, PRKACB, CSK, DLG4, PSMA7, YWHAB, PTPRA, PSMD11, PDGFB, SPRED2, ACTN2, PSMB6, NRAS, RASA4, SHC1, RASAL2, GFRA2, UBB, PPP2CB, GRIN2B, SOS1, JAK1, PSMD12"
"439","MAPK targets/ Nuclear events mediated by MAP kinases",0.285293498842836,0.868595870268453,0.351422347424314,1.12064312575673,1355,30,"RPS6KA5, MAPK3, RPS6KA1, RPS6KA3, DUSP7, MAPK14, ATF2, MAPK7, ELK1, VRK3, RPS6KA2"
"440","MAPK1/MAPK3 signaling",0.654867256637168,0.928585036605612,-0.215884951783622,-0.930433460670569,3847,198,"NRG1, PSMB7, PSMC4, ERBB3, PPP2R1B, SPTBN1, PAQR3, IRS2, KSR1, PSMD14, PSMD9, LAMTOR2, KITLG, RASGRF1, IRS1, WDR83, KSR2, PHB, PSMB5, NEFL, LAMTOR3, CALM1, PEA15, PSMA1, ANGPT1, KIT, PSMB3, FGF10, PSMD7, PSMD1, RASGRP3, PSMD8, SRC, PSMA5, EGFR, BTC, RASA1, RASA2, CSK, DLG4, PSMA7, YWHAB, PTPRA, PSMD11, PDGFB, SPRED2, ACTN2, PSMB6, NRAS, RASA4, SHC1, RASAL2, GFRA2, UBB, PPP2CB, GRIN2B, SOS1, JAK1, PSMD12"
"441","MAPK6/MAPK4 signaling",0.301307664366146,0.868595870268453,-0.290359735443521,-1.08643484307693,1658,75,"PSMB7, CDC14A, PSMC4, CDC42EP2, NCOA3, PSMD14, PRKACA, MAPK6, PSMD9, AGO2, TNRC6B, PSMB5, PSMA1, PSMB3, PSMD7, PSMD1, PSMD8, PSMA5, PRKACB, PSMA7"
"442","MECP2 regulates neuronal receptors and channels",0.404153686396677,0.884200182688848,0.389913887353719,1.0380379192498,1945,15,"FKBP5, PTPN1, GRIN2A"
"443","MET activates PTK2 signaling",0.11484942886812,0.868595870268453,0.512876007519192,1.36539056685458,552,15,"LAMC1, LAMB1, LAMA2"
"444","MET promotes cell motility",0.57762938230384,0.928585036605612,0.301050775058147,0.919673538795406,2767,25,"LAMC1, TNS3, GRB2, RAP1B, RAP1A"
"445","MHC class II antigen presentation",0.0861839182585518,0.868595870268453,0.332427912962174,1.27466094742379,387,74,"DCTN2, CANX, CTSO, CTSB, KIF3A, AP1S1, AP2M1, SEC23A, CAPZA2, AP2A2, OSBPL1A, KIF3C, DCTN6, ARF1, DYNLL1, AP1M1, DNM3, DCTN5, DYNC1I2, SAR1B, CTSS, KIF5B, DCTN1, DYNC1H1, DCTN3, CAPZB, KIF2A, HLA-DMA, SPTBN2"
"446","Macroautophagy",0.434658073755818,0.886531274586939,-0.257521642345384,-1.00791581630885,2427,100,"ATG4D, PRKAA1, WIPI1, HSPA8, CSNK2B, ATG4C, LAMTOR2, ATG16L1, TOMM40, RRAGB, PLIN3, PARK7, TOMM70, MFN1, TSC1, LAMTOR3, ATG9B, PGAM5, PINK1, MTMR14, MLST8, FUNDC1, GABARAPL1, CHMP3, MFN2, SRC, ATG4A, RRAGD, DYNC1I1"
"447","Major pathway of rRNA processing in the nucleolus and cytosol",0.169873298920694,0.868595870268453,0.266089147877713,1.14051033918324,723,148,"RPL29, IMP3, RPL19, RIOK2, RPS8, PDCD11, DDX47, XRN2, DDX21, RPS9, MTREX, EXOSC4, BMS1, ERI1, DCAF13, EMG1, NCL, FAU, FCF1, RPL11, RPS20, SENP3, WDR18, RPS16, RPS14, RPS13, DDX49, RPL34, IMP4, EXOSC3, NOL12, NOP56, TEX10, RPL10A, RPSA, EXOSC10, UTP15, RIOK1, RPL36, MPHOSPH6, NOL9, RRP36, RPL26, RPS27A, RPL6, EXOSC7, NOL6, RPL32, RPS17"
"448","Meiosis",0.361674579197238,0.868595870268453,0.295902200996057,1.04600443084892,1675,48,"SMC3, RAD50, RPA1, ATR, SYNE1, DIDO1, SMC1A, RAD21, ATM, POT1, CDK4, H3-3A, TOP3A, LMNA"
"449","Meiotic recombination",0.571338912133891,0.928585036605612,0.312856889758214,0.921834989969958,2730,22,"RAD50, RPA1, ATM, CDK4, H3-3A, TOP3A"
"450","Meiotic synapsis",0.510933557611438,0.906236808670356,0.310344333952058,0.964319284411304,2429,27,"SMC3, ATR, SYNE1, DIDO1, SMC1A, RAD21, POT1, LMNA, TINF2, SYNE2, TEX12"
"451","Metabolic disorders of biological oxidation enzymes",0.104512148091014,0.868595870268453,-0.510856817831022,-1.37083375910929,541,16,"TBXAS1, FDX1, CYP2U1, GCLC, GSS, MAOA, OPLAH, ACY1, CYP27A1"
"452","Metabolism of amino acids and derivatives",0.623475107154632,0.928585036605612,-0.212110781658788,-0.944281244049448,3781,261,"GOT1, PSMB7, SLC3A2, PSMC4, SRR, PDHB, ACAT1, RPS24, ALDH6A1, CKB, SLC25A12, GSR, PSMD14, PAPSS2, BCKDHB, PSMD9, GPT2, PYCR2, MCCC1, RPS19, ADO, RIDA, RPS4X, PSMB5, PSMA1, SLC36A4, KARS1, SAT1, RPS15, RPS5, DBT, IVD, PSMB3, PSMD7, PSMD1, RPL13A, DDC, AUH, PSMD8, PXMP2, ALDH7A1, KMO, PSMA5, GSTZ1, AZIN2, NAGS, RPL18, RPL12, GLS, SLC5A5, PSMA7, OAZ2, RPL35, QDPR, LIAS"
"453","Metabolism of carbohydrates",0.0464453386988598,0.803422876439926,-0.283660973535521,-1.24722178111364,276,237,"HS2ST1, XYLT1, MANBA, HS6ST3, GOT1, B3GALT2, EXT1, B3GAT1, HS6ST1, SLC25A12, GPI, PPP2R1B, GPC6, PGK1, ABCC5, PAPSS2, FUT10, PRKACA, PGM2, SLC35B3, ST3GAL4, PFKFB4, DSE, PC, GPC5, FUT9, NUP35, HS6ST2, GAPDHS, PHKA1, PGAM1, CHST12, CALM1, NUP43, IDS, PHKA2, NUP50, PCK2, AAAS, RANBP2, SLC9A1, PPP1R3C, CHST1, SEC13, MDH2, GBE1, NUP205, GALE, PRKACB, AKR1B1, SLC37A1, ALDOC"
"454","Metabolism of cofactors",0.815614617940199,0.955741685310263,0.276630529102207,0.749375319184503,3927,16,"COQ5, PDSS1, COQ7, SPR, AKT1, COQ6"
"455","Metabolism of fat-soluble vitamins",0.0662188099808061,0.868595870268453,-0.473763533022726,-1.41661599791134,344,25,"TTR, GPC6, GPC5, LRP12, RDH11, RBP4, AGRN"
"456","Metabolism of folate and pterines",0.908301158301158,0.982135568491717,-0.244288503057848,-0.66576101576177,4704,17,"MTHFD2L, FOLR2, MTHFD2, MTHFD1L, MTHFD1"
"457","Metabolism of non-coding RNA",0.758308157099698,0.928585036605612,0.238824366390243,0.844236185462539,3513,48,"PHAX, SNUPN, NUP88, NUP155, GEMIN8, SMN1, GEMIN2, NUP54, TGS1, POM121C, POM121, NUP42, GEMIN5, GEMIN7, NUP160"
"458","Metabolism of nucleotides",0.782996541052248,0.936935181404754,-0.223649580919145,-0.842221274634507,4300,78,"CMPK1, GSR, SAMHD1, GMPR, RRM2B, NUDT5, UCK2, TK2, UCK1, GMPS, NUDT1, GART, DUT, ADPRM, DGUOK, TXN, TK1, UMPS"
"459","Metabolism of polyamines",0.633700317223363,0.928585036605612,-0.258506203207485,-0.90390493275221,3395,52,"PSMB7, PSMC4, PSMD14, PSMD9, PSMB5, PSMA1, SAT1, PSMB3, PSMD7, PSMD1, PSMD8, PSMA5, AZIN2, PSMA7, OAZ2, PSMD11, PSMB6, SRM"
"460","Metabolism of porphyrins",0.970746887966805,0.990597217527538,0.202507503757329,0.58317332824135,4678,20,"COX10, HMOX2, ALAS1, HMBS, GUSB, UROS, ALAD, UROD, PPOX, FLVCR1"
"461","Metabolism of steroid hormones",0.143049932523617,0.868595870268453,-0.49511905776054,-1.30834678043642,741,15,"HSD17B11, FDX1, HSD11B1, AKR1B1, TSPOAP1, STAR, STARD4, STARD3, SRD5A1, HSD17B12"
"462","Metabolism of steroids",0.237987307343608,0.868595870268453,0.273327616070419,1.10853538167626,1049,102,"NCOA2, MSMO1, SCAP, TBL1X, NCOA1, HMGCS1, MBTPS2, SCD, SEC23A, KPNB1, OSBPL1A, SQLE, SREBF1, OSBP, FASN, CYP7B1, TGS1, HMGCR, OSBPL2, SC5D"
"463","Metabolism of vitamins and cofactors",0.649903288201161,0.928585036605612,-0.225186069110698,-0.921918696974631,3695,136,"TTR, SLC23A2, GPC6, PANK2, MMADHC, COQ2, MTHFD2L, PCCA, PARP6, MCCC1, RNLS, BTD, PC, GPC5"
"464","Metabolism of water-soluble vitamins and cofactors",0.693018018018018,0.928585036605612,0.224023961268936,0.900104441339972,3076,96,"LMBRD1, PARP8, PDXK, NAMPT, NADK2, NMRK1, PARP4, NADK, PANK3, SLC25A32, FASN, MMAA, PDZD11, NFS1, NAXD, NMNAT2, PPCDC, MTR, CD320, CYB5A, SLC25A19, MTHFS, RFK, ALDH1L2"
"465","Metal ion SLC transporters",0.278764478764479,0.868595870268453,-0.420461340466416,-1.14588597340248,1443,17,"SLC39A3, SLC39A10, SLC30A7, SLC30A1, SLC31A1, SLC30A5"
"466","Metalloprotease DUBs",0.0784805244890089,0.868595870268453,-0.530114174233773,-1.42250897092338,406,16,"STAMBP, BABAM1, PSMD14, MYSM1, EP300, BARD1, STAMBPL1, UBB"
"467","MicroRNA (miRNA) biogenesis",0.401720159429411,0.884200182688848,0.346165259569331,1.03346951149758,1914,23,"DICER1, POLR2E, POLR2C, POLR2K, BCDIN3D, TARBP2, POLR2A, PRKRA"
"468","Miscellaneous transport and binding events",0.113070539419087,0.868595870268453,0.466117130823433,1.34230620342024,544,20,"LRRC8D, ADD1, ADD2, ANKH, ADD3, NIPA1, TUSC3"
"469","Misspliced GSK3beta mutants stabilize beta-catenin",0.308203530633437,0.868595870268453,0.421696546745166,1.12265046241114,1483,15,"APC, PPP2R5E, PPP2R5C"
"470","Mitochondrial Fatty Acid Beta-Oxidation",0.182384006035458,0.868595870268453,-0.38184530696985,-1.21287029860349,966,32,"DBI, PCCA, HADHB, ACADVL, ACOT1, ACOT2, ACOT7, ACADS, THEM4, PCCB, ACAD10, ACOT11, ACBD6, ACOT9"
"471","Mitochondrial biogenesis",0.331168831168831,0.868595870268453,0.268606120558748,1.05719040247396,1478,86,"NCOA2, IMMT, ATP5MC3, TBL1X, NCOA1, SSBP1, MICOS10, ATP5PO, CRTC1, TFAM, DMAC2L, CHCHD6, MAPK14, ATF2, MICOS13, TGS1, PRKAA2, ALAS1, PRKAB2, CHCHD3, PRKAG1, SIRT5, PRKAG2, IDH2"
"472","Mitochondrial calcium ion transport",0.303880138301959,0.868595870268453,-0.389026670842602,-1.11662310806715,1581,21,"LETM1, MCU, VDAC3, PHB2, YME1L1, PHB"
"473","Mitochondrial protein import",0.088301043219076,0.868595870268453,-0.368214504494606,-1.31097284987161,473,57,"IDH3G, SLC25A12, COQ2, TIMM17A, TOMM40, HSPA9, CHCHD10, CYC1, TOMM70, NDUFB8, HSPD1, SAMM50, GRPEL2, TIMM13"
"474","Mitochondrial tRNA aminoacylation",0.426855260608409,0.884200182688848,-0.36491178101891,-1.02080314561545,2202,19,"IARS2, RARS2, KARS1, LARS2, YARS2, FARS2, HARS2, VARS2"
"475","Mitochondrial translation",0.507345037620924,0.906236808670356,-0.251745061559392,-0.972712650862327,2831,91,"MRPL36, MRPL42, MRPL13, MRPL21, MRPS12, MRPL54, MRPL12, MRPL35, MRPL55, ERAL1, MRPS14, MRPS25, MRPS26, OXA1L, MRPL20, MTIF2, PTCD3, MRPL52, MRPL17, MRPL28, MRPL9, MRPS21, MRPL19, MRPS28, MRPL40, MRPL49, GFM2"
"476","Mitochondrial translation elongation",0.538197579916923,0.915865513828162,-0.250910679883353,-0.957304327682735,2979,85,"MRPL36, MRPL42, MRPL13, MRPL21, MRPS12, MRPL54, MRPL12, MRPL35, MRPL55, ERAL1, MRPS14, MRPS25, MRPS26, OXA1L, MRPL20, PTCD3, MRPL52, MRPL17, MRPL28, MRPL9, MRPS21, MRPL19, MRPS28, MRPL40, MRPL49"
"477","Mitochondrial translation initiation",0.436698573234604,0.886531274586939,-0.263992925462182,-1.00721727006623,2417,85,"MRPL36, MRPL42, MRPL13, MRPL21, MRPS12, MRPL54, MRPL12, MRPL35, MRPL55, ERAL1, MRPS14, MRPS25, MRPS26, OXA1L, MRPL20, MTIF2, PTCD3, MRPL52, MRPL17, MRPL28, MRPL9, MRPS21, MRPL19, MRPS28, MRPL40, MRPL49"
"478","Mitochondrial translation termination",0.530973451327434,0.915865513828162,-0.251779375141843,-0.96061867735799,2939,85,"MRPL36, MRPL42, MRPL13, MRPL21, MRPS12, MRPL54, MRPL12, MRPL35, MRPL55, ERAL1, MRPS14, MRPS25, MRPS26, OXA1L, MRPL20, PTCD3, MRPL52, MRPL17, MRPL28, MRPL9, MRPS21, MRPL19, MRPS28, MRPL40, MRPL49, GFM2"
"479","Mitophagy",0.272570111409912,0.868595870268453,-0.37627891208995,-1.13457864294059,1418,26,"CSNK2B, TOMM40, TOMM70, MFN1, PGAM5, PINK1, FUNDC1, MFN2, SRC, UBB, TOMM7, ATG5, ULK1"
"480","Mitotic Anaphase",0.198068770607631,0.868595870268453,0.260531347290179,1.11883467763923,840,151,"ITGB3BP, SMC3, PSMD4, PSMB4, PSMB1, PPP2R5E, PPP2R5C, ANAPC1, PAFAH1B1, PSMD5, UBE2D1, CDC16, UBE2E1, PSMD3, ZWINT, PSMB2, PSMA3, CENPC, RANGAP1, CENPP, PSME4, LEMD2, SMC1A, CLASP1, ANAPC5, RAD21, DYNLL1, VRK2, PSMC3, ANAPC7, ANAPC16, NUP160, RCC2, EMD, DYNC1I2, TMPO, DYNC1H1, MIS12, AHCTF1, PSMA4, LMNA, NUP133, RPS27A, KIF2A"
"481","Mitotic G1 phase and G1/S transition",0.0528368794326241,0.868595870268453,-0.318543036855576,-1.29338349434018,297,128,"PSMB7, PSMC4, RBL2, TFDP2, PPP2R1B, MAX, LIN54, ORC4, PSMD14, ORC6, AKT2, PSMD9, CUL1, E2F5, SKP2, ORC1, HDAC1, CDC7, LYN, PSMB5, PSMA1, FBXO5, CCND1, TFDP1, CDC6, PSMB3, PSMD7, PSMD1, PSMD8, SRC, MCM6, PSMA5, MNAT1, CDKN1B, CCNB1, POLE4, SKP1, PSMA7, POLA1"
"482","Mitotic G2-G2/M phases",0.878498174865288,0.974988408341152,-0.198775225462515,-0.83388454944478,5053,162,"PSMB7, CEP290, HSP90AB1, PSMC4, PPP2R1B, PHLDA1, CNTRL, LIN54, PSMD14, PRKACA, PSMD9, TUBB4B, CUL1, TUBB, CSNK1D, PSMB5, MZT2B, MZT2A, PSMA1, ODF2, CEP164, PSMB3, PSMD7, PSMD1, PSMD8, PPP1R12B, PSMA5, MNAT1, CCNB1, EP300, CSNK1E, SFI1, SKP1, CEP63, TP53, PSMA7"
"483","Mitotic Metaphase and Anaphase",0.233640444129459,0.868595870268453,0.255668932718784,1.09744020568822,988,152,"ITGB3BP, SMC3, PSMD4, PSMB4, PSMB1, PPP2R5E, PPP2R5C, ANAPC1, PAFAH1B1, PSMD5, UBE2D1, CDC16, UBE2E1, PSMD3, ZWINT, PSMB2, PSMA3, CENPC, RANGAP1, CENPP, PSME4, LEMD2, SMC1A, CLASP1, ANAPC5, RAD21, DYNLL1, VRK2, PSMC3, ANAPC7, ANAPC16, NUP160, RCC2, EMD, DYNC1I2, TMPO, DYNC1H1, MIS12, AHCTF1, PSMA4, LMNA, NUP133, RPS27A, KIF2A"
"484","Mitotic Prometaphase",0.422714420358153,0.884200182688848,0.232599816551479,1.00608312698885,1793,158,"ITGB3BP, SMC3, SDCCAG8, DCTN2, CEP250, PPP2R5E, EML4, CDK5RAP2, PPP2R5C, PAFAH1B1, TUBA4A, CEP57, NEK9, ZWINT, CENPC, RANGAP1, CENPP, SMC1A, CLASP1, FGFR1OP, RAD21, HAUS6, DYNLL1, TUBGCP6, CETN2, CEP78, NUP160, TUBB4A, OFD1, RCC2, DYNC1I2, DCTN1, ALMS1, DYNC1H1, NINL, MIS12, AHCTF1, DCTN3, NUP133, KIF2A, PPP1CC, NEDD1, HAUS1, AKAP9, PCNT, DYNC1LI2, NUP37, PPP2R5A, HAUS2, HAUS8, CENPO"
"485","Mitotic Prophase",0.941818181818182,0.990597217527538,-0.19700777197417,-0.735276019196117,5179,74,"SMC4, LMNB1, PPP2R1B, ARPP19, KMT5A, PHF8, NUP35, NUP43, NUP50, RAB1B, AAAS, RANBP2, SEC13, NUP205, CCNB1, NCAPG2, MCPH1, PRKCB, LPIN2, NUP85, LEMD3, NUP93, NCAPH2, PPP2CB"
"486","Mitotic Spindle Checkpoint",0.0729190038142248,0.868595870268453,0.32587182103931,1.28561568592389,324,87,"ITGB3BP, PPP2R5E, PPP2R5C, ANAPC1, PAFAH1B1, UBE2D1, CDC16, UBE2E1, ZWINT, CENPC, RANGAP1, CENPP, CLASP1, ANAPC5, DYNLL1, ANAPC7, ANAPC16, NUP160, RCC2, DYNC1I2, DYNC1H1, MIS12, AHCTF1, NUP133, KIF2A, PPP1CC, CDC23, ANAPC10, DYNC1LI2, NUP37, PPP2R5A, CENPO, DYNLL2, NUP107"
"487","Molecules associated with elastic fibres",0.843834037648867,0.958548803135694,-0.259397206125424,-0.744547703889678,4392,21,"ITGB8"
"488","Muscle contraction",0.504835589941973,0.906236808670356,-0.238697171456667,-0.977233565779253,2870,136,"ITPR1, FGF14, DMPK, FKBP1B, CACNG3, SLC8A1, KCNIP2, CACNB4, PRKACA, ATP1B2, ATP1A2, CALD1, NPPC, SCN3B, GATA4, CALM1, KCND3, TMOD1, KCNQ1, FXYD7, CACNG2, HIPK1, SLC8A2, FXYD6, FXYD2"
"489","MyD88 cascade initiated on plasma membrane",0.585165445258716,0.928585036605612,0.245370254070312,0.936111474609535,2634,72,"UBE2N, RPS6KA5, MAPK3, ECSIT, TAB2, TNIP2, RPS6KA1, RPS6KA3, DUSP7, MAPK14, NKIRAS1, IRAK2, ATF2, APP, MAPK7, ELK1, RELA, PELI1, VRK3, RPS6KA2, RPS27A"
"490","MyD88 dependent cascade initiated on endosome",0.626875551632833,0.928585036605612,0.238344380514226,0.92188571041192,2840,77,"UBE2N, RPS6KA5, MAPK3, ECSIT, TAB2, TNIP2, RPS6KA1, RPS6KA3, DUSP7, MAPK14, NKIRAS1, IRAK2, ATF2, APP, MAPK7, ELK1, RELA, PELI1, VRK3, RPS6KA2, RPS27A, IKBKB, LY96"
"491","MyD88-independent TLR4 cascade",0.412709030100334,0.884200182688848,0.259706462026273,1.01655385035787,1850,83,"UBE2N, RPS6KA5, MAPK3, UBE2D3, UBE2D1, TAB2, TNIP2, RPS6KA1, PTPN11, RPS6KA3, DUSP7, MAPK14, NKIRAS1, TBK1, IRAK2, ATF2, APP, MAPK7, ELK1, TRAF3, RELA, VRK3, RPS6KA2, RPS27A, IKBKB, LY96"
"492","MyD88:MAL(TIRAP) cascade initiated on plasma membrane",0.511591618368257,0.906236808670356,0.250964233028806,0.973647531521153,2294,79,"UBE2N, RPS6KA5, MAPK3, ECSIT, TAB2, TNIP2, RPS6KA1, RPS6KA3, DUSP7, MAPK14, NKIRAS1, IRAK2, ATF2, APP, MAPK7, ELK1, RELA, PELI1, VRK3, TIRAP, RPS6KA2, RPS27A, IKBKB, LY96"
"493","Myogenesis",0.335355648535565,0.868595870268453,0.368056390923415,1.08448070201515,1602,22,"NEO1, CTNNA2, CTNNA1, TCF12, MAPK14, CDH2, CDC42"
"494","N-glycan antennae elongation in the medial/trans-Golgi",0.256066945606695,0.868595870268453,0.39138308745593,1.15321297471882,1223,22,"ST6GAL1, CHST8, FUCA1, MAN2A2, MGAT5, B4GALT6, MGAT4A"
"495","N-glycan trimming in the ER and Calnexin/Calreticulin cycle",0.259369676320273,0.868595870268453,0.347296815641109,1.13178196662156,1217,33,"CANX, VCP, MAN1B1, EDEM2, RNF185, RNF103, UGGT2, DERL2, EDEM1, UBXN1"
"496","NCAM signaling for neurite out-growth",0.260615251299827,0.868595870268453,0.323847228226592,1.11721573016048,1202,43,"CNTN2, RPS6KA5, MAPK3, CACNB2, CACNA1C, GFRA1, NCAM1, GRB2, FYN, NCAN, GFRA4, CACNB3, KRAS, SPTBN2, CACNA1D"
"497","NCAM1 interactions",0.29465776293823,0.868595870268453,0.364132014714123,1.11237906129342,1411,25,"CNTN2, CACNB2, CACNA1C, GFRA1, NCAM1, NCAN, GFRA4, CACNB3"
"498","NEP/NS2 Interacts with the Cellular Export Machinery",0.968247895944912,0.990597217527538,-0.20173139459573,-0.625343332290957,5061,29,"NUP35, NUP43, NUP50, AAAS, RANBP2, SEC13, NUP205"
"499","NIK-->noncanonical NF-kB signaling",0.339475153545505,0.868595870268453,-0.302561469267921,-1.06572828418334,1823,54,"PSMB7, PSMC4, PSMD14, PSMD9, CUL1, UBA3, PSMB5, PSMA1, PSMB3, PSMD7, PSMD1, PSMD8, PSMA5, UBE2M, SKP1, PSMA7, PSMD11, RELB, PSMB6, UBB, PSMD12"
"500","NOD1/2 Signaling Pathway",0.878892072588348,0.974988408341152,-0.242672938190262,-0.713285546145362,4600,23,"TRAF6, IKBKG, CYLD, RIPK2, NOD1, MAP3K7, ITCH, TAB1, MAPK11"
"501","NOTCH1 Intracellular Domain Regulates Transcription",0.26388588718392,0.868595870268453,0.318022112589867,1.11356725125681,1220,46,"MAML2, TLE1, HDAC7, TBL1X, HDAC11, HDAC5"
"502","NOTCH2 Activation and Transmission of Signal to the Nucleus",0.17139282735613,0.868595870268453,0.427498553706735,1.24537242873989,821,21,"MIB1, APH1A, MIB2, CNTN1, ADAM10, RPS27A"
"503","NOTCH3 Activation and Transmission of Signal to the Nucleus",0.489672438973503,0.906236808670356,0.32205993464373,0.974497007823964,2346,24,"MIB1, APH1A, MIB2, ADAM10, RPS27A"
"504","NOTCH3 Intracellular Domain Regulates Transcription",0.310991957104558,0.868595870268453,-0.380847303766166,-1.10748015722976,1623,22,"PBX1, MAML3, CREBBP, EP300, PLXND1, WWC1"
"505","NOTCH4 Intracellular Domain Regulates Transcription",0.913320463320463,0.98274060112851,-0.241798770177797,-0.65897573086113,4730,17,"MAML3, CREBBP, EP300, SMAD3, RBPJ, NOTCH2"
"506","NR1H2 and NR1H3-mediated signaling",0.0148556876061121,0.666690391459075,0.475716037302251,1.58405208563384,69,36,"TBL1X, NCOA1, SCD, TNRC6C, GPS2, TNRC6A, RXRB, SREBF1, FASN, KDM4A, KDM3A, NR1H2, APOD"
"507","NR1H3 & NR1H2 regulate gene expression linked to cholesterol transport and efflux",0.0816326530612245,0.868595870268453,0.428828367024095,1.3674815080977,387,30,"TBL1X, NCOA1, TNRC6C, GPS2, TNRC6A, RXRB, KDM4A, KDM3A, NR1H2, APOD"
"508","NRAGE signals death through JNK",0.857173771910842,0.965912387547531,0.222436671042636,0.794794148659395,3960,51,"ARHGEF2, AATF, GNA13, ITSN1, ARHGEF11, PLEKHG5, BAD, TIAM2, MAGED1"
"509","NRIF signals cell death from the nucleus",0.586586378737541,0.928585036605612,0.335389684279586,0.908550305434091,2824,16,"ITGB3BP, APH1A"
"510","NS1 Mediated Effects on Host Pathways",0.969023712881863,0.990597217527538,0.193317188619727,0.650333244502681,4535,38,"KPNB1, NUP88, NUP155, KPNA3, NUP54, POM121C, POM121, NUP42, NUP160, NUP133, RAE1"
"511","Neddylation",0.240466358999271,0.868595870268453,0.242965723242136,1.08184955433344,989,202,"ZBTB16, COPS5, CUL4A, PSMD4, TULP4, PSMB4, COPS3, BTBD1, PSMB1, DCAF10, FBXO31, ELOC, DCAF6, DCAF8, FEM1B, DCUN1D4, PSMD5, UBE2D3, UBE2D1, ASB3, FBXW2, PSMD3, SOCS6, PSMB2, PSMA3, FBXL16, CUL3, COMMD4, WDR5, PSME4, FBXO2, DCAF13, COMMD7, WSB2, COMMD9, NEDD8, DCAF11, RBBP7, FBXL3, HIF1A, PSMC3, SPSB3, DDB1, WSB1, ASB13, DCUN1D3, FBXL18, DCUN1D5, RNF7"
"512","Nef-mediates down modulation of cell surface receptors by recruiting them to clathrin adapters",0.264327242524917,0.868595870268453,0.428074003581196,1.15962650293643,1272,16,"AP1S1, AP2M1, AP2A2, ARF1, AP1M1"
"513","Negative epigenetic regulation of rRNA expression",0.40876700496653,0.884200182688848,0.286661077896781,1.02239938027074,1892,50,"MBD2, GTF2H2, POLR2E, SAP130, TAF1A, TAF1B, POLR2K, CCNH, SAP30L, CDK7, ARID4B, SMARCA5, SAP30BP, H3-3A, TWISTNB, ERCC2, GTF2H3, DNMT1"
"514","Negative regulation of FGFR1 signaling",0.991652754590985,0.99670704997626,0.177075109774329,0.540942944947701,4751,25,"MAPK3, PTPN11, GRB2, RPS27A, FGF9, FGF22, BRAF, FGF20, SPRY2, UBA52, MAPK1"
"515","Negative regulation of FGFR2 signaling",0.969557964970809,0.990597217527538,0.197383753520607,0.609000142742848,4649,26,"MAPK3, PTPN11, GRB2, RPS27A, FGFR2, FGF9, FGF22, BRAF, FGF20, SPRY2, UBA52, MAPK1"
"516","Negative regulation of FGFR3 signaling",0.924900356618418,0.985893785541363,0.226089217710238,0.674984871886231,4408,23,"MAPK3, PTPN11, GRB2, RPS27A, FGF9, BRAF, FGF20, SPRY2, UBA52, MAPK1"
"517","Negative regulation of FGFR4 signaling",0.920285294734634,0.98274060112851,0.227773529091921,0.680013350084773,4386,23,"MAPK3, PTPN11, GRB2, RPS27A, FGF9, BRAF, FGF20, SPRY2, UBA52, MAPK1"
"518","Negative regulation of MAPK pathway",0.40552016985138,0.884200182688848,0.306808320872458,1.0265801094101,1909,37,"MAP2K2, PPP2R5E, MAPK3, PPP2R5C, DUSP7, BRAP, MARK3, RAF1"
"519","Negative regulation of MET activity",0.0165255112580045,0.666690391459075,0.587732155689207,1.67254817938874,79,19,"SH3KBP1, PTPN2, SH3GL1, PTPN1, USP8, STAM, STAM2, GRB2, LRIG1, HGS"
"520","Negative regulation of NMDA receptor-mediated neuronal transmission",0.846153846153846,0.959311545155676,-0.26128662036118,-0.730922425215151,4366,19,"CAMK4, NEFL, PPM1E, CALM1, DLG4, ACTN2, GRIN2B, LRRC7, GRIN1"
"521","Negative regulation of NOTCH4 signaling",0.626698938745113,0.928585036605612,-0.261594510516952,-0.908202718888918,3365,50,"PSMB7, PSMC4, PSMD14, PSMD9, CUL1, PSMB5, PSMA1, PSMB3, PSMD7, PSMD1, PSMD8, PSMA5, SKP1, PSMA7, PSMD11, PSMB6, UBB, PSMD12"
"522","Negative regulation of the PI3K/AKT network",0.617457136495213,0.928585036605612,0.238052865706108,0.926594471198604,2772,80,"PIK3R1, PPP2R5E, MAPK3, PIP4K2A, PIP5K1B, PHLPP1, PPP2R5C, AKT3, TGFA, PTPN11, PIP5K1C, PIP4K2C, GRB2, NRG3, FYN, IL1RAP, IL33, PIK3CA, NRG2, AKT1"
