"","pathway","pval","padj","ES","NES","nMoreExtreme","size","leadingEdge"
"228","Downstream signaling of activated FGFR4",0.0285372181201357,0.0403251927817217,-0.303638193845269,-1.70003867663369,142,22,"SOS1, SHC1, PTPN11, PLCG1, PIK3R1, PIK3CA, NRAS, KRAS, KLB, HRAS, GRB2, GAB1, FRS3, FRS2, FGFR4, FGF9, FGF4, FGF23, FGF20, FGF2, FGF18, FGF1"
"229","Dual Incision in GG-NER",0.107265043268263,0.128819484586945,0.191496052252716,1.39890224743677,532,38,"CHD1L, CUL4A, CUL4B, DDB1, DDB2, ERCC1, ERCC2, ERCC3, ERCC4, ERCC5, UBA52, GTF2H1, GTF2H2, GTF2H3, GTF2H4, GTF2H5, PARP1, PARP2, PCNA, POLD2, POLD4, POLE2, POLE3, POLE4, POLK, RBX1, RFC1, RFC2, RFC3, RFC4, RFC5, RPA1, RPA2, RPA3, RPS27A"
"230","Dual incision in TC-NER",0.000792864222001982,0.00183190058333232,-0.257048019576281,-2.38548960352048,3,62,"ZNF830, XPA, XAB2, UVSSA, USP7, UBC, UBB, TCEA1, RPS27A, RPA3, RPA2, RPA1, RFC5, RFC4, RFC3, RFC2, RFC1, RBX1, PRPF19, PPIE, POLR2L, POLR2K, POLR2J, POLR2I, POLR2H, POLR2G, POLR2F, POLR2E, POLR2D, POLR2C, POLR2B, POLR2A, POLK, POLE4, POLE3, POLE2, POLD4, POLD2"
"231","E2F mediated regulation of DNA replication",0.0001999600079984,0.000551454923716307,-0.489863407620417,-2.62977641728894,0,20,"TFDP2, TFDP1, RB1, PRIM2, PRIM1, PPP2R3B, PPP2R1B, PPP2R1A, PPP2CB, PPP2CA, POLA2, POLA1, ORC6, ORC5, ORC4, ORC3, ORC2, ORC1"
"232","E3 ubiquitin ligases ubiquitinate target proteins",0.000197433366238894,0.000551454923716307,-0.430323540706605,-3.31437857466084,0,42,"WDR61, WAC, VCP, UBE2V2, UBE2N, UBE2J2, UBE2E1, UBE2D3, UBE2D2, UBE2D1, UBE2B, UBE2A, UBC, UBB, TMEM129, SHPRH, SELENOS, RTF1, RRAGA, RPS27A, RNF40, RNF20, RNF181, RNF152, RNF144A, RAD18, PRKDC, PEX5, PEX2, PEX14, PEX13, PEX12, PEX10, PCNA, PAF1"
"233","ECM proteoglycans",0.00425359530078995,0.0078149237352669,0.266681067588326,2.04992452560084,20,42,"ACAN, AGRN, ASPN, BCAN, COL9A2, COMP, DAG1, DCN, FMOD, HAPLN1, HSPG2, ITGA2, ITGA2B, ITGA7, ITGA8, ITGA9, ITGAV, ITGB1, ITGB3, ITGB5, ITGB6, LAMA1, LAMA2, LAMA3, LAMA4, LAMA5, LAMB1, LAMC1, LRP4, LUM, MATN4, MUSK, NCAM1, NCAN"
"234","EGFR downregulation",0.135263784212614,0.157656603054474,-0.212883038411739,-1.34182015153314,681,28,"UBC, UBB, TGFA, STAM2, STAM, SPRY2, SPRY1, SH3KBP1, SH3GL3, SH3GL2, SH3GL1, RPS27A, PTPRK, PTPN3, PTPN12"
"235","EML4 and NUDC in mitotic spindle formation",0.0109002825999193,0.01749555627412,0.180400080787477,1.87874427301516,53,79,"AHCTF1, AURKB, B9D2, BIRC5, BUB3, CDCA8, CENPC, CENPF, CENPH, CENPK, CENPM, CENPN, CENPO, CENPP, CENPQ, CENPT, CENPU, CKAP5, CLASP1, CLASP2, CLIP1, DYNC1H1, DYNC1I1, DYNC1I2, DYNC1LI1, DYNC1LI2, DYNLL1, DYNLL2, EML4, INCENP, ITGB3BP, KIF18A, KIF2A, KNL1, KNTC1, MAD1L1, MAD2L1, MAPRE1, MIS12, NDE1, NDEL1, NEK6, NEK7, NEK9, NSL1, NUDC, NUF2, NUP107, NUP133, NUP160, NUP37, NUP43, NUP85, NUP98, PAFAH1B1, PMF1, PPP1CC, PPP2CA, PPP2CB, PPP2R1A, PPP2R1B, PPP2R5A, PPP2R5B, PPP2R5C, PPP2R5D, PPP2R5E"
"236","EPH-Ephrin signaling",0.000200762899016262,0.000551454923716307,0.248163490748412,2.68667012719622,0,85,"ACTB, ACTG1, ACTR2, ACTR3, ADAM10, AP2A1, AP2A2, AP2B1, AP2M1, AP2S1, APH1A, APH1B, ARHGEF28, ARHGEF7, ARPC1A, ARPC1B, ARPC2, ARPC3, ARPC4, ARPC5, CDC42, CFL1, CLTA, CLTB, CLTC, DNM1, EFNA1, EFNA2, EFNA3, EFNA5, EFNB1, EFNB2, EFNB3, EPHA10, EPHA3, EPHA4, EPHA5, EPHA6, EPHA7, EPHA8, EPHB1, EPHB2, EPHB3, EPHB6"
"237","EPH-ephrin mediated repulsion of cells",0.000200762899016262,0.000551454923716307,0.41212208503005,3.24629236880068,0,44,"ADAM10, AP2A1, AP2A2, AP2B1, AP2M1, AP2S1, APH1A, APH1B, CLTA, CLTB, CLTC, DNM1, EFNA1, EFNA2, EFNA3, EFNA5, EFNB1, EFNB2, EFNB3, EPHA10, EPHA3, EPHA4, EPHA5, EPHA6, EPHA7, EPHA8, EPHB1, EPHB2, EPHB3, EPHB6"
"238","EPHB-mediated forward signaling",0.020523138832998,0.0304401592033956,0.252645704222967,1.75063615663368,101,34,"ACTB, ACTG1, ACTR2, ACTR3, ARHGEF28, ARPC1A, ARPC1B, ARPC2, ARPC3, ARPC4, ARPC5"
"239","ER Quality Control Compartment (ERQC)",0.0568273092369478,0.0740622929092114,-0.297084094752733,-1.55435569954573,282,19,"UGGT2, UGGT1, UBC, UBB, TRIM13, SYVN1, SEL1L, RPS27A, RNF5, RNF185, RNF103"
"240","ER to Golgi Anterograde Transport",0.000201085863663784,0.000551454923716307,0.203861387079004,2.60647359740913,0,122,"ACTR10, ACTR1A, ANK1, ANK2, ANK3, ANKRD28, ARCN1, AREG, ARF1, ARF3, ARF4, ARF5, ARFGAP1, ARFGAP2, ARFGAP3, CAPZA1, CAPZA2, CAPZB, CD55, CD59, CNIH1, CNIH2, CNIH3, COG1, COG2, COG3, COG4, COG5, COG6, COG7, COG8, COPA, COPB1, COPB2, COPE, COPG1, COPG2, COPZ1, COPZ2, CSNK1D, CTSC, CTSZ, DCTN1, DCTN2, DCTN3, DCTN4, DCTN5, DCTN6, DYNC1H1, DYNC1I1, DYNC1I2, DYNC1LI1, DYNC1LI2, DYNLL1, DYNLL2"
"241","ER-Phagosome pathway",0.000199084212621939,0.000551454923716307,-0.518277899525646,-4.90480140925013,0,65,"VAMP8, UBC, UBB, TIRAP, TAPBP, TAP2, TAP1, STX4, SNAP23, SEC61G, SEC61B, SEC61A2, SEC61A1, SEC22B, RPS27A, PSMF1, PSME4, PSME3, PSME2, PSME1, PSMD9, PSMD8, PSMD7, PSMD6, PSMD5, PSMD4, PSMD3, PSMD2, PSMD14, PSMD13, PSMD12, PSMD11, PSMD10, PSMD1, PSMC6, PSMC5, PSMC4, PSMC3, PSMC2, PSMC1, PSMB8, PSMB7, PSMB6, PSMB5, PSMB4, PSMB3, PSMB2, PSMB10, PSMB1, PSMA7, PSMA6, PSMA5, PSMA4, PSMA3, PSMA1"
"242","ERCC6 (CSB) and EHMT2 (G9a) positively regulate rRNA expression",0.0304841601912732,0.0426610285872363,0.348983038666092,1.68900604429665,152,16,"CBX3, CHD3, CHD4, EHMT2, ERCC6, GATAD2A, GATAD2B, H3-3A, HDAC1, HDAC2, MBD3, MTA1, MTA2, MTA3"
"243","ERK/MAPK targets",0.0439847358907411,0.058881264481854,-0.292520430416757,-1.601791917916,218,21,"VRK3, RPS6KA5, RPS6KA3, RPS6KA2, RPS6KA1, PPP2R5D, PPP2R1B, PPP2R1A, PPP2CB, PPP2CA, MEF2C, MEF2A, MAPK7, MAPK3, MAPK14, MAPK11, MAPK1"
"244","ESR-mediated signaling",0.00920368147258904,0.0151554949370348,0.138451779363979,1.88963135756569,45,139,"AGO1, AGO2, AGO3, AGO4, AKT1, AKT2, AKT3, AREG, ATF2, AXIN1, BCL2, CALM1, CARM1, CAV2, CBFB, CCND1, CCNT1, CDK9, CDKN1B, CHD1, CITED1, CREB1, CREBBP, CXCL12, CXXC5, DDX5, EBAG9, EGF, EGFR, ELK1, EP300, ERBB4, ESR1, ESR2, FKBP4, FKBP5, FOS, FOSB, FOXO3, GNAI1, GNAI2, GNAI3, GNB1, GNB4, GNB5, GNG12, GNG13, GNG2, GNG3, GNG4, GNG7, GNGT2, GPAM, GREB1, GTF2A1, GTF2A2, GTF2F1, GTF2F2, H3-3A, HBEGF, HDAC1, HRAS, HSP90AB1, IGF1R, JUN, JUND, KANK1, KAT2B, KAT5, KCTD6, KDM1A, KDM4B, KPNA2, KRAS, MAPK1, MAPK3, MED1, MMP2, MMP9, MOV10, MYB, MYC, NCOA1, NCOA2, NCOA3, NOS3, NRAS, NRIP1, PDPK1, PGR, PIK3CA, PIK3R1, PIK3R2, PIK3R3, POLR2A, POLR2B, POLR2C, POLR2D, POLR2E, POLR2F, POLR2G, POLR2H, POLR2I, POLR2J, POLR2K, POLR2L, POU2F1, PPID, PPP5C, PRKCZ, PRMT1, PTGES3, PTK2"
"245","Effects of PIP2 hydrolysis",0.00663583350090489,0.0113693201297123,0.334541531823085,2.00236432014628,32,25,"ABHD12, ABHD6, DAGLA, DAGLB, DGKA, DGKB, DGKD, DGKE, DGKG, DGKH, DGKI, DGKK, DGKQ, DGKZ"
"246","Elastic fibre formation",0.000398962696987832,0.00100512455234364,0.404412942216776,2.6823320731059,1,31,"BMP7, EFEMP1, EFEMP2, ELN, FBLN1, FBLN2, FBLN5, FBN1, FBN2, FURIN, ITGA5, ITGA8, ITGAV, ITGB1, ITGB3, ITGB5, ITGB6, ITGB8, LOXL1, LOXL2, LTBP1, LTBP3, LTBP4, MFAP1, MFAP2, MFAP3, MFAP4, MFAP5"
"247","Endosomal Sorting Complex Required For Transport (ESCRT)",0.00178926441351889,0.00371757186939711,-0.359217520942428,-2.29865054536641,8,29,"VTA1, VPS4B, VPS4A, VPS37D, VPS37C, VPS37B, VPS37A, VPS36, VPS28, UBC, UBB, UBAP1, TSG101"
"248","Energy dependent regulation of mTOR by LKB1-AMPK",0.000795228628230616,0.00183190058333232,-0.379994989197006,-2.43160658439652,3,29,"TSC2, TSC1, STRADB, STRADA, STK11, SLC38A9, RRAGD, RRAGC, RRAGB, RRAGA, RPTOR, RHEB, PRKAG3, PRKAG2, PRKAG1, PRKAB2, PRKAB1, PRKAA2, PRKAA1, PPM1A, MTOR, MLST8, LAMTOR5, LAMTOR4, LAMTOR3, LAMTOR2, LAMTOR1"
"249","Ephrin signaling",0.185533961130034,0.209913702124849,0.25494987760072,1.26733041826521,925,17,"ARHGEF7, EFNB1, EFNB2, EFNB3, EPHB1, EPHB2, EPHB3, EPHB6, FYN, GIT1"
"250","Epigenetic regulation of gene expression",0.404809619238477,0.426203702742272,0.0945603166177271,1.03006108649978,2019,86,"ACTB, AEBP2, ARID4B, BAZ1B, BAZ2A, CBX3, CCNH, CD3EAP, CDK7, CHD3, CHD4, DDX21, DEK, DNMT1, DNMT3A, DNMT3B, DNMT3L, EED, EHMT2, EP300, ERCC2, ERCC3, ERCC6, EZH2, GATAD2A, GATAD2B, GSK3B, GTF2H1, GTF2H2, GTF2H3, GTF2H4, GTF2H5, H3-3A, HDAC1, HDAC2, JARID2, KAT2A, KAT2B, MBD2, MBD3, MNAT1, MTA1, MTA2, MTA3, MTF2, MYBBP1A, MYO1C, PHF1, POLR1A, POLR1B, POLR1C, POLR1D, POLR1E, POLR2E, POLR2F, POLR2H, POLR2K, POLR2L, RBBP7, RRP8, SAP130, SAP18, SAP30, SAP30BP, SAP30L, SF3B1, SIN3A, SIN3B, SIRT1, SMARCA5, SUDS3, SUV39H1, SUZ12, TAF1A, TAF1B, TAF1C, TAF1D, TBP, TDG, TET1, TET2, TET3"
"251","Estrogen-dependent gene expression",0.0885616300181561,0.108147375118325,0.13606096227185,1.45116754354135,438,83,"AGO1, AGO2, AGO3, AGO4, ATF2, AXIN1, BCL2, CARM1, CBFB, CCND1, CCNT1, CDK9, CHD1, CITED1, CREBBP, CXCL12, CXXC5, DDX5, EBAG9, EP300, ERBB4, ESR1, FKBP4, FOS, FOSB, GPAM, GREB1, GTF2A1, GTF2A2, GTF2F1, GTF2F2, H3-3A, HDAC1, HSP90AB1, JUN, JUND, KANK1, KAT2B, KAT5, KCTD6, KDM1A, KDM4B, KPNA2, MED1, MOV10, MYB, MYC, NCOA1, NCOA2, NCOA3, NRIP1, PGR, POLR2A, POLR2B, POLR2C, POLR2D, POLR2E, POLR2F, POLR2G, POLR2H, POLR2I, POLR2J, POLR2K, POLR2L, POU2F1"
"252","Estrogen-dependent nuclear events downstream of ESR-membrane signaling",0.0286681266175592,0.040453912004778,0.30637237280418,1.68623522996965,143,21,"AKT1, AKT2, AKT3, AREG, BCL2, CCND1, CDKN1B, CREB1, EGF, EGFR, ELK1, FOS, FOXO3"
"253","Eukaryotic Translation Elongation",0.000198649185538339,0.000551454923716307,-0.59723950927236,-5.49324816699887,0,61,"RPSA, RPS9, RPS8, RPS7, RPS5, RPS4X, RPS3A, RPS28, RPS27L, RPS27A, RPS25, RPS24, RPS21, RPS20, RPS19, RPS17, RPS16, RPS15A, RPS15, RPS14, RPS13, RPS12, RPS11, RPLP1, RPL8, RPL7A, RPL6, RPL5, RPL4, RPL3L, RPL38, RPL37A, RPL36, RPL35, RPL34, RPL32, RPL30, RPL3, RPL29, RPL28, RPL27, RPL26, RPL23, RPL22L1, RPL19, RPL18A, RPL18, RPL14, RPL13A, RPL12, RPL11, RPL10A, RPL10"
"254","Eukaryotic Translation Initiation",0.00019952114924182,0.000551454923716307,-0.344175631454816,-3.7261880735101,0,86,"RPSA, RPS9, RPS8, RPS7, RPS5, RPS4X, RPS3A, RPS28, RPS27L, RPS27A, RPS25, RPS24, RPS21, RPS20, RPS19, RPS17, RPS16, RPS15A, RPS15, RPS14, RPS13, RPS12, RPS11, RPLP1, RPL8, RPL7A, RPL6, RPL5, RPL4, RPL3L, RPL38, RPL37A, RPL36, RPL35, RPL34, RPL32, RPL30, RPL3, RPL29, RPL28, RPL27, RPL26, RPL23, RPL22L1, RPL19, RPL18A, RPL18, RPL14, RPL13A, RPL12, RPL11, RPL10A, RPL10"
"255","Eukaryotic Translation Termination",0.000198216055500496,0.000551454923716307,-0.599407315053453,-5.56269572001043,0,62,"TRMT112, RPSA, RPS9, RPS8, RPS7, RPS5, RPS4X, RPS3A, RPS28, RPS27L, RPS27A, RPS25, RPS24, RPS21, RPS20, RPS19, RPS17, RPS16, RPS15A, RPS15, RPS14, RPS13, RPS12, RPS11, RPLP1, RPL8, RPL7A, RPL6, RPL5, RPL4, RPL3L, RPL38, RPL37A, RPL36, RPL35, RPL34, RPL32, RPL30, RPL3, RPL29, RPL28, RPL27, RPL26, RPL23, RPL22L1, RPL19, RPL18A, RPL18, RPL14, RPL13A, RPL12, RPL11, RPL10A, RPL10"
"256","Export of Viral Ribonucleoproteins from Nucleus",0.000200440970134295,0.000551454923716307,-0.482907797961794,-3.18510978949636,0,31,"XPO1, TPR, SEH1L, SEC13, RANBP2, RAE1, POM121C, POM121, NUP42, NUP58, NUP98, NUP93, NUP88, NUP85, NUP54, NUP50, NUP43, NUP37, NUP35, NUP214, NUP210, NUP205, NUP188, NUP160, NUP155, NUP153, NUP133, NUP107"
"257","Extension of Telomeres",0.000198609731876862,0.000551454923716307,-0.42130795112166,-2.60675005103356,0,27,"WRAP53, TERT, RUVBL2, RUVBL1, RPA3, RPA2, RPA1, RFC5, RFC4, RFC3, RFC2, RFC1, PRIM2, PRIM1, POLE4, POLE3, POLE2, POLD4, POLD2, POLA2, POLA1"
"258","Extra-nuclear estrogen signaling",0.0878048780487805,0.107861929250429,0.159422963896142,1.44002167013161,431,59,"AKT1, AKT2, AKT3, AREG, BCL2, CALM1, CAV2, CCND1, CDKN1B, CREB1, EGF, EGFR, ELK1, ESR1, ESR2, FOS, FOXO3, GNAI1, GNAI2, GNAI3, GNB1, GNB4, GNB5, GNG12, GNG13, GNG2, GNG3, GNG4, GNG7, GNGT2, HBEGF, HRAS, IGF1R"
"259","Extracellular matrix organization",0.000201328769881216,0.000551454923716307,0.251046428227335,4.27654046106505,0,218,"ACAN, ACTN1, ADAM10, ADAM12, ADAM15, ADAM17, ADAM8, ADAM9, ADAMTS1, ADAMTS14, ADAMTS18, ADAMTS2, ADAMTS3, ADAMTS4, ADAMTS5, ADAMTS8, ADAMTS9, AGRN, ASPN, BCAN, BMP1, BMP7, BSG, CAPN1, CAPN10, CAPN11, CAPN13, CAPN15, CAPN2, CAPN3, CAPN5, CAPN6, CAPN7, CAPN9, CAPNS1, CASK, CASP3, CAST, CD151, CD44, CD47, CEACAM8, CEACAM1, CEACAM6, COL11A1, COL11A2, COL12A1, COL13A1, COL14A1, COL15A1, COL16A1, COL17A1, COL18A1, COL19A1, COL20A1, COL23A1, COL25A1, COL26A1, COL28A1, COL2A1, COL4A1, COL4A2, COL4A3, COL4A4, COL4A5, COL4A6, COL5A1, COL5A2, COL5A3, COL6A1, COL6A2, COL6A3, COL6A5, COL6A6, COL8A1, COL9A2, COLGALT1, COLGALT2, COMP, CRTAP, CTSB, CTSK, CTSS, DAG1, DCN, DDR1, DDR2, DMD, DST, EFEMP1, EFEMP2, ELN, F11R, FBLN1, FBLN2, FBLN5, FBN1, FBN2, FGF2, FMOD, FN1, FURIN, HAPLN1, HSPG2, HTRA1, ICAM1, ICAM5, ITGA1, ITGA11, ITGA2, ITGA2B, ITGA3, ITGA4, ITGA5, ITGA6, ITGA7, ITGA8, ITGA9, ITGAD, ITGAE, ITGAL, ITGAV, ITGB1, ITGB3, ITGB4, ITGB5, ITGB6, ITGB7, ITGB8, JAM2, JAM3, KDR, KLK2, KLK7, KLKB1, LAMA1, LAMA2, LAMA3, LAMA4, LAMA5, LAMB1, LAMB3, LAMC1, LAMC2, LOXL1, LOXL2, LRP4, LTBP1, LTBP3, LTBP4, LUM, MATN4, MFAP1, MFAP2, MFAP3, MFAP4, MFAP5, MMP14, MMP15, MMP16, MMP17, MMP1, MMP2, MMP24, MMP9"
"260","FBXL7 down-regulates AURKA during mitotic entry and in early mitosis",0.000198925800676348,0.000551454923716307,-0.571757925072046,-4.77947336652936,0,50,"UBC, UBB, SKP1, RPS27A, RBX1, PSMF1, PSME4, PSME3, PSME2, PSME1, PSMD9, PSMD8, PSMD7, PSMD6, PSMD5, PSMD4, PSMD3, PSMD2, PSMD14, PSMD13, PSMD12, PSMD11, PSMD10, PSMD1, PSMC6, PSMC5, PSMC4, PSMC3, PSMC2, PSMC1, PSMB8, PSMB7, PSMB6, PSMB5, PSMB4, PSMB3, PSMB2, PSMB10, PSMB1, PSMA7, PSMA6, PSMA5, PSMA4, PSMA3, PSMA1"
"261","FCERI mediated Ca+2 mobilization",0.0696933492632417,0.088510553564317,-0.246381782774188,-1.4961505165657,349,26,"VAV3, VAV2, VAV1, TEC, SYK, SOS1, SHC1, PPP3R1, PPP3CB, PPP3CA, PLCG2, PLCG1, NFATC3, NFATC2, LYN, LCP2, LAT, ITPR3, ITPR2, ITPR1, ITK, GRB2, GRAP2"
"262","FCERI mediated MAPK activation",0.00476001586671956,0.00863602878676262,-0.326248021867357,-2.05636941959066,23,28,"VAV3, VAV2, VAV1, SYK, SOS1, SHC1, RAC1, PLCG2, PLCG1, PAK2, PAK1, NRAS, MAPK9, MAPK8, MAPK3, MAPK10, MAPK1, MAP3K1, MAP2K4, LYN, LCP2, LAT, KRAS, JUN, HRAS, GRB2, GRAP2"
"263","FCERI mediated NF-kB activation",0.000198333994446648,0.000551454923716307,-0.443362193362193,-4.34789098770724,0,70,"UBE2N, UBE2D2, UBE2D1, UBC, UBB, TRAF6, TAB3, TAB2, TAB1, SKP1, RPS27A, RELA, RASGRP2, RASGRP1, PSMF1, PSME4, PSME3, PSME2, PSME1, PSMD9, PSMD8, PSMD7, PSMD6, PSMD5, PSMD4, PSMD3, PSMD2, PSMD14, PSMD13, PSMD12, PSMD11, PSMD10, PSMD1, PSMC6, PSMC5, PSMC4, PSMC3, PSMC2, PSMC1, PSMB8, PSMB7, PSMB6, PSMB5, PSMB4, PSMB3, PSMB2, PSMB10, PSMB1, PSMA7, PSMA6, PSMA5, PSMA4, PSMA3, PSMA1"
"264","FGFR1 mutant receptor activation",0.00865713710489229,0.0143485339291526,0.309698679474987,1.92092369132153,42,27,"BAG4, BCR, CNTRL, CPSF6, CUX1, ERLIN2, FGF1, FGF2, FGF20, FGF23, FGF4, FGF5, FGF9, FGFR1, FGFR1OP, FGFR1OP2, GAB2"
"265","FGFR2 alternative splicing",0.00237388724035608,0.00475713892741969,-0.368330217172444,-2.15686833597331,11,24,"TIAL1, TIA1, RBFOX2, PTBP1, POLR2L, POLR2K, POLR2J, POLR2I, POLR2H, POLR2G, POLR2F, POLR2E, POLR2D, POLR2C, POLR2B, POLR2A, NCBP2, NCBP1, HNRNPM, HNRNPH1, HNRNPF, HNRNPA1, GTF2F2, GTF2F1"
"266","FGFR2 mutant receptor activation",0.00221774193548387,0.0044618332801022,0.35505682635592,2.23652067399451,10,28,"FGF1, FGF10, FGF18, FGF2, FGF20, FGF22, FGF23, FGF4, FGF5, FGF7, FGF9, FGFR2, GTF2F1, GTF2F2, NCBP1, NCBP2, POLR2A, POLR2B, POLR2C, POLR2D, POLR2E, POLR2F, POLR2G, POLR2H, POLR2I, POLR2J, POLR2K, POLR2L"
"267","FLT3 Signaling",0.000201085863663784,0.000551454923716307,0.184914707529239,3.1756704918895,0,222,"ACTN2, AKT2, ANGPT1, APBB1IP, ARAF, AREG, ARRB1, ARRB2, ARTN, BRAF, BRAP, CALM1, CAMK2A, CAMK2B, CAMK2G, CNKSR2, CSF2RA, CSF2RB, CSK, CUL3, DAB2IP, DLG1, DLG2, DLG3, DLG4, DUSP1, DUSP10, DUSP16, DUSP4, DUSP5, DUSP6, DUSP7, DUSP8, EGF, EGFR, ERBB2, ERBB3, ERBB4, FGF1, FGF10, FGF18, FGF2, FGF20, FGF22, FGF23, FGF4, FGF5, FGF7, FGF9, FGFR1, FGFR2, FGFR3, FGFR4, FLT3, FLT3LG, FN1, FRS2, FRS3, FYN, GAB1, GAB2, GFRA1, GFRA2, GFRA4, UBA52, GRB2, GRIN1, GRIN2B, GRIN2D, HBEGF, HCK, HGF, HRAS, IL17RD, IL2, IL2RA, IL5, IL5RA, IQGAP1, IRS1, IRS2, ITGA2B, ITGB3, JAK1, JAK2, JAK3, KBTBD7, KIT, KITLG, KL, KLB, KRAS, KSR1, KSR2, LAMTOR2, LAMTOR3, LAT, LRRC7, MAP2K1, MAP2K2, MAP3K11, MAPK1, MAPK3, MARK3, NCAM1, NEFL, NF1, NRAS, NRG1, NRG2, NRG3, NRG4, PAQR3, PDE3B, PDGFA, PDGFB, PDGFRB, PDPK1, PEA15, PHB, PIK3C3, PIK3CA, PIK3CB, PIK3R1, PIK3R2, PIK3R4, PPP2CA, PPP2CB, PPP2R1A, PPP2R1B, PPP2R5A, PPP2R5B, PPP2R5C, PPP2R5D, PPP2R5E, PPP5C, PSMA1, PSMA3, PSMA4, PSMA5, PSMA6, PSMA7, PSMB1, PSMB10, PSMB2, PSMB3, PSMB4, PSMB5, PSMB6, PSMB7, PSMB8, PSMC1, PSMC2, PSMC3, PSMC4, PSMC5, PSMC6, PSMD1, PSMD10, PSMD11, PSMD12, PSMD13, PSMD14, PSMD2, PSMD3, PSMD4, PSMD5, PSMD6, PSMD7, PSMD8, PSMD9, PSME1, PSME2, PSME3, PSME4, PSMF1, PTK2, PTPN11, PTPRA, RAF1, RANBP9, RAP1A, RAP1B, RAPGEF2, RASA1, RASA2, RASA3, RASA4, RASAL1, RASAL2, RASAL3, RASGEF1A, RASGRF1, RASGRF2, RASGRP1"
"268","FOXO-mediated transcription",0.411088709677419,0.431919471594889,0.116900483648826,1.01602732312245,2038,54,"ABCA6, AGRP, AKT1, AKT2, AKT3, ATXN3, BCL2L11, BCL6, BTG1, CAT, CCNG2, CDKN1B, CITED2, CREBBP, DDIT3, EP300, FBXO32, FOXG1, FOXO1, FOXO3, FOXO4, FOXO6, GADD45A, GCK"
"269","FOXO-mediated transcription of oxidative stress, metabolic and neuronal genes",0.343856826865071,0.366973252200538,0.181661272923409,1.08731507646277,1709,25,"ABCA6, AGRP, ATXN3, CAT, FBXO32, FOXO1, FOXO3, FOXO4, FOXO6, GCK, HDAC1, HDAC2, INS, NPY, NR3C1, PLXNA4, PPARGC1A, RETN, SIN3A, SIRT3, SMAD2, SMAD3, SMAD4, SOD2, SREBF1"
"270","FRS-mediated FGFR1 signaling",0.003584229390681,0.00671877686518801,0.398355712442633,2.09186849539841,17,19,"FGF1, FGF10, FGF2, FGF20, FGF22, FGF23, FGF4, FGF5, FGF9, FGFR1, FRS2, FRS3, GRB2, HRAS, KL, KRAS"
"271","FRS-mediated FGFR2 signaling",0.0023995200959808,0.00478022042650293,0.411214953271028,2.20787804855077,11,20,"FGF1, FGF10, FGF18, FGF2, FGF20, FGF22, FGF23, FGF4, FGF5, FGF7, FGF9, FGFR2, FRS2, FRS3, GRB2, HRAS"
"272","FRS-mediated FGFR3 signaling",0.0100180324584252,0.0162333667906858,0.379699899797481,1.88745033868666,49,17,"FGF1, FGF18, FGF2, FGF20, FGF23, FGF4, FGF5, FGF9, FGFR3, FRS2, FRS3, GRB2, HRAS, KRAS"
"273","FRS-mediated FGFR4 signaling",0.0100180324584252,0.0162333667906858,0.379699899797481,1.88745033868666,49,17,"FGF1, FGF18, FGF2, FGF20, FGF23, FGF4, FGF9, FGFR4, FRS2, FRS3, GRB2, HRAS, KLB, KRAS"
"274","Factors involved in megakaryocyte development and platelet production",0.000201085863663784,0.000551454923716307,0.301830392713192,3.49519541360592,0,99,"ABL1, AK3, AKAP1, AKAP10, CABLES1, CABLES2, CAPZA1, CAPZA2, CAPZB, CARMIL1, CBX5, CDC42, CDK2, CDK5, DOCK1, DOCK10, DOCK11, DOCK2, DOCK3, DOCK4, DOCK5, DOCK6, DOCK7, DOCK8, DOCK9, EHD1, EHD2, EHD3, GATA4, H3-3A, HDAC1, HDAC2, HMG20B, IRF1, IRF2, ITPK1, JAK2, JMJD1C, KDM1A, KIF11, KIF13B, KIF15, KIF16B, KIF18A, KIF19, KIF1A, KIF1B, KIF1C, KIF20A, KIF20B, KIF21A, KIF21B, KIF22, KIF23, KIF26B, KIF27, KIF2A, KIF3A, KIF3B, KIF3C, KIF4A, KIF5A, KIF5B, KIF5C, KIF6, KIF9, KIFAP3, KIFC2, KIFC1, KLC1, KLC2, KLC3, KLC4"
"275","Fanconi Anemia Pathway",0.0163306451612903,0.024987854644384,0.269364297021154,1.80893792028417,80,32,"ATR, ATRIP, DCLRE1A, DCLRE1B, EME2, ERCC1, ERCC4, FAAP100, FAN1, FANCA, FANCB, FANCC, FANCD2, FANCE, FANCG, FANCI, FANCL, FANCM"
"276","Fatty acid metabolism",0.000201005025125628,0.000551454923716307,0.27107922256969,3.68287250253149,0,138,"ABCC1, ABCD1, ACAA1, ACAA2, ACACA, ACAD10, ACAD11, ACADL, ACADM, ACADS, ACADVL, ACBD4, ACBD5, ACBD6, ACLY, ACOT11, ACOT12, ACOT13, ACOT2, ACOT1, ACOT6, ACOT7, ACOT8, ACOT9, ACOX1, ACOX2, ACOX3, ACOXL, ACSBG1, ACSBG2, ACSF2, ACSL1, ACSL3, ACSL4, ACSL5, ACSL6, ALDH3A2, ALOX12, ALOX12B, ALOX5, ALOX15B, ALOXE3, AMACR, CBR1, CBR4, CPT1A, CPT2, CRAT, CROT, CYP2J2, CYP2U1, CYP4F11, CYP4A22, CYP4A11, CYP4F8, CYP4F2, CYP4F3, DBI, DECR1, DECR2, ECHS1, ECI1, ECI2, EHHADH, ELOVL1, ELOVL2, ELOVL4, ELOVL5, ELOVL6, ELOVL7, EPHX2, FAAH, FADS1, FADS2, FASN, GGT5, GPX1, GPX2, GPX4, HACD1, HACD2, HACD3, HACD4, HADH, HADHA, HADHB, HAO2, HPGD, HPGDS, HSD17B12, HSD17B4"
"277","Fatty acyl-CoA biosynthesis",0.00120675784392599,0.0026310428528515,0.368432933378646,2.36022650417991,5,29,"ACACA, ACLY, ACSBG1, ACSBG2, ACSL1, ACSL3, ACSL4, ACSL5, ACSL6, CBR4, ELOVL1, ELOVL2, ELOVL4, ELOVL5, ELOVL6, ELOVL7, FASN, HACD1, HACD2, HACD3, HACD4, HSD17B12"
"278","Fc epsilon receptor (FCERI) signaling",0.00020096463022508,0.000551454923716307,-0.251888556745056,-3.18445056967441,0,118,"VAV3, VAV2, VAV1, UBE2N, UBE2D2, UBE2D1, UBC, UBB, TRAF6, TEC, TAB3, TAB2, TAB1, SYK, SOS1, SKP1, SHC1, RPS27A, RELA, RASGRP2, RASGRP1, RAC1, PSMF1, PSME4, PSME3, PSME2, PSME1, PSMD9, PSMD8, PSMD7, PSMD6, PSMD5, PSMD4, PSMD3, PSMD2, PSMD14, PSMD13, PSMD12, PSMD11, PSMD10, PSMD1, PSMC6, PSMC5, PSMC4, PSMC3, PSMC2, PSMC1, PSMB8, PSMB7, PSMB6, PSMB5, PSMB4, PSMB3, PSMB2, PSMB10, PSMB1, PSMA7, PSMA6, PSMA5, PSMA4, PSMA3, PSMA1, PPP3R1, PPP3CB, PPP3CA, PLCG2, PLCG1, PIK3R2, PIK3R1, PIK3CB, PIK3CA, PDPK1, PAK2, PAK1, NRAS, NFKBIA, NFKB1, NFATC3, NFATC2, MAPK9, MAPK8, MAPK3, MAPK10, MAPK1, MAP3K7, MAP3K1, MAP2K4, MALT1, LYN, LCP2, LAT2, LAT, KRAS, JUN, ITPR3, ITPR2, ITPR1, ITK, IKBKG, IKBKB"
"279","Fcgamma receptor (FCGR) dependent phagocytosis",0.0408080808080808,0.0552813468013468,0.153900669389152,1.62187643586982,201,81,"ABI1, ABI2, ABL1, ACTB, ACTG1, ACTR2, ACTR3, AHCYL1, ARPC1A, ARPC1B, ARPC2, ARPC3, ARPC4, ARPC5, BAIAP2, BRK1, BTK, CD247, CDC42, CFL1, CRK, CYFIP1, CYFIP2, DOCK1, ELMO1, ELMO2, FCGR1A, FCGR2A, FGR, FYN, GRB2, HCK, HSP90AB1, ITPR1, ITPR2, ITPR3, LIMK1, LYN, MAPK1, MAPK3, MYH9, MYO10, MYO1C, MYO5A, MYO9B, NCK1, NCKAP1, NCKAP1L, NCKIPSD, NF2, PAK1, PIK3CA, PIK3CB, PIK3R1, PIK3R2, PLA2G6, PLCG1, PLCG2, PLD1, PLD2, PLD3, PLD4, PLPP4, PLPP5, PRKCD, PRKCE"
"280","Fertilization",0.000201126307320998,0.000551454923716307,0.591975086836747,2.76700577555024,0,15,"ACR, ADAM2, ADAM21, B4GALT1, CATSPER1, CATSPER2, CATSPER3, CATSPERB, CATSPERD, CATSPERG, CD9"
"281","Formation of Fibrin Clot (Clotting Cascade)",0.272963258785943,0.296927913197556,-0.226071816497348,-1.15376247461484,1366,18,"VWF, THBD, TFPI, SERPING1, SERPINE2, SERPIND1, SERPINC1, PRTN3, PROS1, PRCP, KLKB1, F8, F7, F3, F2, F13A1, F12"
"282","Formation of HIV elongation complex in the absence of HIV Tat",0.0147534357316087,0.0229197105555267,0.238801221152123,1.85792369153111,72,43,"CCNH, CCNK, CCNT1, CCNT2, CDK7, CDK9, CTDP1, ELL, ELOA, ELOC, ERCC2, ERCC3, GTF2F1, GTF2F2, GTF2H1, GTF2H2, GTF2H3, GTF2H4, GTF2H5, MNAT1, NCBP1, NCBP2, NELFA, NELFB, NELFCD, NELFE, POLR2A, POLR2B, POLR2C, POLR2D, POLR2E, POLR2F, POLR2G, POLR2H, POLR2I, POLR2J, POLR2K, POLR2L"
"283","Formation of HIV-1 elongation complex containing HIV-1 Tat",0.0197421434327156,0.0294537705251674,0.233077940254527,1.77303031159867,97,41,"CCNH, CCNT1, CDK7, CDK9, CTDP1, ELL, ELOA, ELOC, ERCC2, ERCC3, GTF2F1, GTF2F2, GTF2H1, GTF2H2, GTF2H3, GTF2H4, GTF2H5, MNAT1, NCBP1, NCBP2, NELFA, NELFB, NELFCD, NELFE, POLR2A, POLR2B, POLR2C, POLR2D, POLR2E, POLR2F, POLR2G, POLR2H, POLR2I, POLR2J, POLR2K, POLR2L"
"284","Formation of Incision Complex in GG-NER",0.362683023347843,0.385849164106187,-0.136530568157269,-1.06241776088395,1832,43,"XPC, XPA, USP45, UBE2V2, UBE2N, UBE2I, UBC, UBB, SUMO2, SUMO1, RPS27A, RPA3, RPA2, RPA1, RNF111, RBX1, RAD23B, RAD23A, PIAS3, PIAS1, PARP2, PARP1, MNAT1, GTF2H5, GTF2H4, GTF2H3, GTF2H2, GTF2H1, SUMO3, UBA52, ERCC5, ERCC4, ERCC3, ERCC2, ERCC1, DDB2, DDB1, CUL4B, CUL4A, CHD1L, CETN2, CDK7, CCNH"
"285","Formation of RNA Pol II elongation complex",0.0131154156577885,0.0207558602933227,0.212339628081303,1.87357050922345,64,56,"AFF4, CCNH, CCNK, CCNT1, CCNT2, CDC73, CDK7, CDK9, CTDP1, CTR9, EAF1, EAF2, ELL, ELOA, ELOC, ERCC2, ERCC3, GTF2F1, GTF2F2, GTF2H1, GTF2H2, GTF2H3, GTF2H4, GTF2H5, IWS1, LEO1, MLLT1, MLLT3, MNAT1, NCBP1, NCBP2, NELFA, NELFB, NELFCD, NELFE, PAF1, POLR2A, POLR2B, POLR2C, POLR2D, POLR2E, POLR2F, POLR2G, POLR2H, POLR2I, POLR2J, POLR2K, POLR2L"
"286","Formation of TC-NER Pre-Incision Complex",0.181836447659232,0.20618954332788,0.146912020840783,1.26517570134814,904,53,"AQR, CCNH, CDK7, COPS2, COPS3, COPS4, COPS5, COPS6, COPS7A, COPS7B, COPS8, CUL4A, CUL4B, DDB1, EP300, ERCC2, ERCC3, ERCC6, ERCC8, UBA52, GPS1, GTF2H1, GTF2H2, GTF2H3, GTF2H4, GTF2H5, HMGN1, ISY1, MNAT1, POLR2A, POLR2B, POLR2C, POLR2D, POLR2E, POLR2F, POLR2G, POLR2H, POLR2I, POLR2J, POLR2K, POLR2L, PPIE, PRPF19"
"287","Formation of a pool of free 40S subunits",0.000198333994446648,0.000551454923716307,-0.485353535353535,-4.75968473137618,0,70,"RPSA, RPS9, RPS8, RPS7, RPS5, RPS4X, RPS3A, RPS28, RPS27L, RPS27A, RPS25, RPS24, RPS21, RPS20, RPS19, RPS17, RPS16, RPS15A, RPS15, RPS14, RPS13, RPS12, RPS11, RPLP1, RPL8, RPL7A, RPL6, RPL5, RPL4, RPL3L, RPL38, RPL37A, RPL36, RPL35, RPL34, RPL32, RPL30, RPL3, RPL29, RPL28, RPL27, RPL26, RPL23, RPL22L1, RPL19, RPL18A, RPL18, RPL14, RPL13A, RPL12, RPL11, RPL10A, RPL10"
"288","Formation of the Early Elongation Complex",0.00442122186495177,0.0080710506664972,0.294434595650686,2.00886444338228,21,33,"CCNH, CDK7, CTDP1, ERCC2, ERCC3, GTF2F1, GTF2F2, GTF2H1, GTF2H2, GTF2H3, GTF2H4, GTF2H5, MNAT1, NCBP1, NCBP2, NELFA, NELFB, NELFCD, NELFE, POLR2A, POLR2B, POLR2C, POLR2D, POLR2E, POLR2F, POLR2G, POLR2H, POLR2I, POLR2J, POLR2K, POLR2L"
"289","Formation of the HIV-1 Early Elongation Complex",0.00442122186495177,0.0080710506664972,0.294434595650686,2.00886444338228,21,33,"CCNH, CDK7, CTDP1, ERCC2, ERCC3, GTF2F1, GTF2F2, GTF2H1, GTF2H2, GTF2H3, GTF2H4, GTF2H5, MNAT1, NCBP1, NCBP2, NELFA, NELFB, NELFCD, NELFE, POLR2A, POLR2B, POLR2C, POLR2D, POLR2E, POLR2F, POLR2G, POLR2H, POLR2I, POLR2J, POLR2K, POLR2L"
"290","Formation of the beta-catenin:TCF transactivating complex",0.324113048707156,0.34809604385462,-0.166510006521704,-1.09824826614902,1616,31,"TRRAP, TLE4, TLE2, TLE1, TERT, TCF7L2, TCF7L1, TCF7, TCF4, SMARCA4, RUVBL1, RUNX3, RBBP5, PYGO2, PYGO1"
