"","pathway","pval","padj","ES","NES","nMoreExtreme","size","leadingEdge"
"260","Eukaryotic Translation Initiation",0.653459605720912,0.745803951297438,-0.334994321506269,-0.51833045972941,3380,87,"RPSA, RPS9, RPS8, RPS7, RPS5, RPS4X, RPS3A, RPS28, RPS27L, RPS27A, RPS25, RPS24, RPS21, RPS20, RPS19, RPS17, RPS16, RPS15A, RPS15, RPS14, RPS13, RPS12, RPS11, RPLP1, RPL8, RPL7A, RPL6, RPL5, RPL4, RPL3L, RPL38, RPL37A, RPL36, RPL35, RPL34, RPL32, RPL30, RPL3, RPL29, RPL28, RPL27, RPL26, RPL23, RPL22L1, RPL19, RPL18A, RPL18, RPL14, RPL13A, RPL12, RPL11, RPL10A, RPL10"
"261","Eukaryotic Translation Termination",0.519407060659255,0.706220067049808,-0.583446727122208,-1.04173878475053,2662,63,"TRMT112, RPSA, RPS9, RPS8, RPS7, RPS5, RPS4X, RPS3A, RPS28, RPS27L, RPS27A, RPS25, RPS24, RPS21, RPS20, RPS19, RPS17, RPS16, RPS15A, RPS15, RPS14, RPS13, RPS12, RPS11, RPLP1, RPL8, RPL7A, RPL6, RPL5, RPL4, RPL3L, RPL38, RPL37A, RPL36, RPL35, RPL34, RPL32, RPL30, RPL3, RPL29, RPL28, RPL27, RPL26, RPL23, RPL22L1, RPL19, RPL18A, RPL18, RPL14, RPL13A, RPL12, RPL11, RPL10A, RPL10"
"262","Export of Viral Ribonucleoproteins from Nucleus",0.316418495297806,0.673372198452951,-0.483689510768413,-1.17662779399774,1614,32,"XPO1, TPR, SEH1L, SEC13, RANBP2, RAE1, POM121, POM121C, NUP42, NUP58, NUP98, NUP93, NUP88, NUP85, NUP62, NUP54, NUP50, NUP43, NUP37, NUP35, NUP214, NUP210, NUP205, NUP188, NUP160, NUP155, NUP153, NUP133, NUP107"
"263","Extension of Telomeres",0.292559407869108,0.673372198452951,-0.434626675497235,-1.09654066240906,1501,29,"WRAP53, TERT, RUVBL2, RUVBL1, RPA3, RPA2, RPA1, RFC5, RFC4, RFC3, RFC2, RFC1, PRIM2, PRIM1, POLE4, POLE3, POLE2, POLE, POLD4, POLD2, POLD1, POLA2, POLA1"
"264","Extra-nuclear estrogen signaling",0.433999216607912,0.678445586759412,-0.993936971150643,-1.71657947069894,2215,67,"PTK2"
"265","Extracellular matrix organization",0.148518896833504,0.673372198452951,0.99649477586788,1.2546047049149,726,241,"PRKCA, FBN2, NRXN1, A2M"
"266","FBXL7 down-regulates AURKA during mitotic entry and in early mitosis",0.456291650333203,0.686098692038573,-0.574972351929221,-1.12249063230954,2327,52,"UBC, UBB, SKP1, RPS27A, RBX1, PSMF1, PSME4, PSME3, PSME2, PSME1, PSMD9, PSMD8, PSMD7, PSMD6, PSMD5, PSMD4, PSMD3, PSMD2, PSMD14, PSMD13, PSMD12, PSMD11, PSMD10, PSMD1, PSMC6, PSMC5, PSMC4, PSMC3, PSMC2, PSMC1, PSMB9, PSMB8, PSMB7, PSMB6, PSMB5, PSMB4, PSMB3, PSMB2, PSMB10, PSMB1, PSMA8, PSMA7, PSMA6, PSMA5, PSMA4, PSMA3, PSMA1"
"267","FCERI mediated Ca+2 mobilization",0.205622819618305,0.673372198452951,0.995613160518445,2.50481256350261,1001,31,"ITPR1, AHCYL1"
"268","FCERI mediated MAPK activation",0.317006269592476,0.673372198452951,-0.332615993086945,-0.809124889999199,1617,32,"VAV3, VAV2, VAV1, SYK, SOS1, SHC1, RAC1, PLCG2, PLCG1, PAK2, PAK1, NRAS, MAPK9, MAPK8, MAPK3, MAPK10, MAPK1, MAP3K1, MAP2K7, MAP2K4, LYN, LCP2, KRAS, JUN, IGLC1, IGLC7, IGLC3, IGLC2, HRAS, GRB2, GRAP2"
"269","FCERI mediated NF-kB activation",0.611175560711524,0.734968690595997,-0.406078075367314,-0.659235322884572,3160,78,"UBE2N, UBE2D2, UBE2D1, UBC, UBB, TRAF6, TAB3, TAB2, TAB1, SKP1, RPS27A, RELA, RASGRP4, RASGRP2, RASGRP1, PSMF1, PSME4, PSME3, PSME2, PSME1, PSMD9, PSMD8, PSMD7, PSMD6, PSMD5, PSMD4, PSMD3, PSMD2, PSMD14, PSMD13, PSMD12, PSMD11, PSMD10, PSMD1, PSMC6, PSMC5, PSMC4, PSMC3, PSMC2, PSMC1, PSMB9, PSMB8, PSMB7, PSMB6, PSMB5, PSMB4, PSMB3, PSMB2, PSMB10, PSMB1, PSMA8, PSMA7, PSMA6, PSMA5, PSMA4, PSMA3, PSMA1, PRKCQ"
"270","FCGR activation",0.191502215062424,0.673372198452951,0.347742363877822,1.03283616839346,950,16,"CD247, CD3G, FCGR1A, FCGR2A, FCGR3A, FGR, FYN, HCK, IGLC2, IGLC3, IGLC7, IGLC1"
"271","FGFR1 mutant receptor activation",0.285714285714286,0.673372198452951,0.285505430242272,0.743582970175691,1383,28,"BAG4, BCR, CNTRL, CPSF6, CUX1, ERLIN2, FGF1, FGF17, FGF20, FGF23, FGF4, FGF5, FGF9, FGFR1, FGFR1OP, FGFR1OP2, GAB2"
"272","FGFR2 alternative splicing",0.245427728613569,0.673372198452951,-0.369519000797236,-1.00424638037145,1247,24,"TIAL1, TIA1, RBFOX2, PTBP1, POLR2L, POLR2K, POLR2J, POLR2I, POLR2H, POLR2G, POLR2F, POLR2E, POLR2D, POLR2C, POLR2B, POLR2A, NCBP2, NCBP1, HNRNPM, HNRNPH1, HNRNPF, HNRNPA1, GTF2F2, GTF2F1"
"273","FGFR2 ligand binding and activation",0.165726943213854,0.673372198452951,0.693758300132802,2.06054464146934,822,16,"FGF1, FGF10, FGF16, FGF17, FGF18, FGF20, FGF22, FGF23, FGF3, FGF4, FGF5, FGF7, FGF9, FGFBP1, FGFBP3, FGFR2"
"274","FGFR2 mutant receptor activation",0.292617725683734,0.673372198452951,0.357171341220258,0.908580823631077,1422,30,"FGF1, FGF10, FGF16, FGF17, FGF18, FGF20, FGF22, FGF23, FGF3, FGF4, FGF5, FGF7, FGF9, FGFR2, GTF2F1, GTF2F2, NCBP1, NCBP2, POLR2A, POLR2B, POLR2C, POLR2D, POLR2E, POLR2F, POLR2G, POLR2H, POLR2I, POLR2J, POLR2K, POLR2L"
"275","FLT3 Signaling",0.349882720875684,0.673372198452951,-0.994069681245367,-1.23449351097375,1789,237,"NRG1, HGF, GRIN2B, PTK2"
"276","FOXO-mediated transcription",0.665298584034476,0.751976157685205,0.121283963771977,0.2242118481889,3241,60,"ABCA6, AGRP, AKT1, AKT2, AKT3, ATXN3, BCL2L11, BCL6, BTG1, CAT, CAV1, CCNG2, CDKN1A, CDKN1B, CITED2, CREBBP, DDIT3, EP300, FASLG, FBXO32, FOXG1, FOXO1, FOXO3, FOXO4, FOXO6, GADD45A, GCK"
"277","FOXO-mediated transcription of cell cycle genes",0.294484702093398,0.673372198452951,0.264774240926864,0.779007598563258,1462,17,"BTG1, CAV1, CCNG2, CDKN1A, CDKN1B, FOXG1, FOXO1, FOXO3, FOXO4, GADD45A"
"278","FOXO-mediated transcription of cell death genes",0.187109768378651,0.673372198452951,0.351946528561627,1.05442638502632,928,15,"BCL2L11, BCL6, CITED2, CREBBP, DDIT3, EP300, FASLG, FOXO1, FOXO3, FOXO4"
"279","FOXO-mediated transcription of oxidative stress, metabolic and neuronal genes",0.477039770397704,0.698009904216332,0.184252491694352,0.491905812443061,2326,26,"ABCA6, AGRP, ATXN3, CAT, FBXO32, FOXO1, FOXO3, FOXO4, FOXO6, GCK, HDAC1, HDAC2, INS, NPY, NR3C1, PLXNA4, POMC, PPARGC1A, RETN, SIN3A, SIRT3, SMAD2, SMAD3, SMAD4, SOD2, SREBF1"
"280","FRS-mediated FGFR1 signaling",0.206646525679758,0.673372198452951,0.405658873538788,1.16331589819679,1025,20,"FGF1, FGF10, FGF17, FGF20, FGF22, FGF23, FGF3, FGF4, FGF5, FGF9, FGFR1, FRS2, FRS3, GRB2, HRAS, KL, KRAS"
"281","FRS-mediated FGFR2 signaling",0.227144012944984,0.673372198452951,0.429115789219416,1.19562889605564,1122,22,"FGF1, FGF10, FGF16, FGF17, FGF18, FGF20, FGF22, FGF23, FGF3, FGF4, FGF5, FGF7, FGF9, FGFR2, FRS2, FRS3, GRB2, HRAS"
"282","FRS-mediated FGFR3 signaling",0.190360959870942,0.673372198452951,0.388918404391907,1.13798440120377,943,18,"FGF1, FGF16, FGF17, FGF18, FGF20, FGF23, FGF4, FGF5, FGF9, FGFR3, FRS2, FRS3, GRB2, HRAS, KRAS"
"283","FRS-mediated FGFR4 signaling",0.190360959870942,0.673372198452951,0.388918404391907,1.13798440120377,943,18,"FGF1, FGF16, FGF17, FGF18, FGF20, FGF23, FGF4, FGF9, FGFR4, FRS2, FRS3, GRB2, HRAS, KLB, KRAS"
"284","Factors involved in megakaryocyte development and platelet production",0.704205128205128,0.776902007967701,0.284338457428225,0.422474008515747,3432,104,"ABL1, AK3, AKAP1, AKAP10, CABLES1, CABLES2, CAPZA1, CAPZA2, CAPZB, CARMIL1, CBX5, CDC42, CDK5, CENPE, DOCK1, DOCK10, DOCK11, DOCK2, DOCK3, DOCK4, DOCK5, DOCK6, DOCK7, DOCK8, DOCK9, EHD1, EHD2, EHD3, GATA1, GATA4, H3-3A, HDAC1, HDAC2, HMG20B, IRF1, IRF2, ITPK1, JAK2, JMJD1C, KDM1A, KIF11, KIF13B, KIF15, KIF16B, KIF18A, KIF19, KIF1A, KIF1B, KIF1C, KIF20A, KIF21A, KIF21B, KIF22, KIF23, KIF26A, KIF26B, KIF27, KIF2A, KIF2C, KIF3A, KIF3B, KIF3C, KIF4A, KIF5A, KIF5B, KIF5C, KIF6, KIF9, KIFAP3, KIFC2, KIFC1, KLC1, KLC2, KLC3, KLC4"
"285","Fanconi Anemia Pathway",0.331558468154823,0.673372198452951,0.304274981716641,0.732944752057448,1618,35,"ATR, ATRIP, DCLRE1A, DCLRE1B, EME1, EME2, ERCC1, ERCC4, FAAP100, FAAP24, FAN1, FANCA, FANCB, FANCC, FANCD2, FANCE, FANCF, FANCG, FANCI, FANCL, FANCM"
"286","Fatty acid metabolism",0.3908203125,0.676036774350512,-0.994776319314224,-1.31345253689731,2000,144,"PRKAG2"
"287","Fatty acyl-CoA biosynthesis",0.293028994447872,0.673372198452951,0.34279764278435,0.872016672882296,1424,30,"ACACA, ACLY, ACSBG1, ACSBG2, ACSL1, ACSL3, ACSL4, ACSL5, ACSL6, CBR4, ELOVL1, ELOVL2, ELOVL4, ELOVL5, ELOVL6, ELOVL7, FASN, HACD1, HACD2, HACD3, HACD4, HSD17B12"
"288","Fc epsilon receptor (FCERI) signaling",0.340438614470178,0.673372198452951,0.995584693604496,1.38196551438073,1660,128,"ITPR1, AHCYL1"
"289","Fcgamma receptor (FCGR) dependent phagocytosis",0.498551923872569,0.700963295133699,0.924496671121273,1.45836969217538,2409,88,"WIPF3, ITPR1, ABI1"
"290","Fertilization",0.169754329440193,0.673372198452951,0.476726427622842,1.4159341743328,842,16,"ACR, ADAM2, ADAM21, B4GALT1, CATSPER2, CATSPER3, CATSPERB, CATSPERD, CATSPERG, CD9"
"291","Formation of ATP by chemiosmotic coupling",0.155287009063444,0.673372198452951,0.712090830622137,2.13341317333611,770,15,"ATP5F1A, ATP5F1B, ATP5F1C, ATP5F1D, ATP5F1E, ATP5MC3, ATP5PD, ATP5PF, ATP5MF, ATP5ME, ATP5MG, ATP5PO"
"292","Formation of Fibrin Clot (Clotting Cascade)",0.495468277945619,0.698009904216332,0.192696620328636,0.544818047416662,2459,21,"A2M, C1QBP, F12, F13A1, F13B, F2, F2R, F3, F5, F8"
"293","Formation of HIV elongation complex in the absence of HIV Tat",0.403707518022657,0.678445586759412,0.240868538826984,0.522829093629303,1959,43,"CCNH, CCNK, CCNT1, CCNT2, CDK7, CDK9, CTDP1, ELL, ELOA, ELOC, ERCC2, ERCC3, GTF2F1, GTF2F2, GTF2H1, GTF2H2, GTF2H3, GTF2H4, GTF2H5, MNAT1, NCBP1, NCBP2, NELFA, NELFB, NELFCD, NELFE, POLR2A, POLR2B, POLR2C, POLR2D, POLR2E, POLR2F, POLR2G, POLR2H, POLR2I, POLR2J, POLR2K, POLR2L"
"294","Formation of HIV-1 elongation complex containing HIV-1 Tat",0.393707306975781,0.676036774350512,0.235148880255015,0.520901488128462,1901,41,"CCNH, CCNT1, CDK7, CDK9, CTDP1, ELL, ELOA, ELOC, ERCC2, ERCC3, GTF2F1, GTF2F2, GTF2H1, GTF2H2, GTF2H3, GTF2H4, GTF2H5, MNAT1, NCBP1, NCBP2, NELFA, NELFB, NELFCD, NELFE, POLR2A, POLR2B, POLR2C, POLR2D, POLR2E, POLR2F, POLR2G, POLR2H, POLR2I, POLR2J, POLR2K, POLR2L"
"295","Formation of Incision Complex in GG-NER",0.58597241111327,0.725098024512093,-0.143151732854387,-0.308810082335451,3015,43,"XPC, XPA, USP45, UBE2V2, UBE2N, UBE2I, UBC, UBB, SUMO2, SUMO1, RPS27A, RPA3, RPA2, RPA1, RNF111, RBX1, RAD23B, RAD23A, PIAS3, PIAS1, PARP2, PARP1, MNAT1, GTF2H5, GTF2H4, GTF2H3, GTF2H2, GTF2H1, SUMO3, UBA52, ERCC5, ERCC4, ERCC3, ERCC2, ERCC1, DDB2, DDB1, CUL4B, CUL4A, CHD1L, CETN2, CDK7, CCNH"
"296","Formation of RNA Pol II elongation complex",0.491675231243577,0.698009904216332,0.214399847821952,0.409733948505465,2391,56,"AFF4, CCNH, CCNK, CCNT1, CCNT2, CDC73, CDK7, CDK9, CTDP1, CTR9, EAF1, EAF2, ELL, ELOA, ELOC, ERCC2, ERCC3, GTF2F1, GTF2F2, GTF2H1, GTF2H2, GTF2H3, GTF2H4, GTF2H5, IWS1, LEO1, MLLT1, MLLT3, MNAT1, NCBP1, NCBP2, NELFA, NELFB, NELFCD, NELFE, PAF1, POLR2A, POLR2B, POLR2C, POLR2D, POLR2E, POLR2F, POLR2G, POLR2H, POLR2I, POLR2J, POLR2K, POLR2L"
"297","Formation of TC-NER Pre-Incision Complex",0.554640872607532,0.716215998024466,0.148537023105452,0.292677667575739,2694,53,"AQR, CCNH, CDK7, COPS2, COPS3, COPS4, COPS5, COPS6, COPS7A, COPS7B, COPS8, CUL4A, CUL4B, DDB1, EP300, ERCC2, ERCC3, ERCC6, ERCC8, UBA52, GPS1, GTF2H1, GTF2H2, GTF2H3, GTF2H4, GTF2H5, HMGN1, ISY1, MNAT1, POLR2A, POLR2B, POLR2C, POLR2D, POLR2E, POLR2F, POLR2G, POLR2H, POLR2I, POLR2J, POLR2K, POLR2L, PPIE, PRPF19"
"298","Formation of a pool of free 40S subunits",0.57768691588785,0.723883666382134,-0.47257017613847,-0.797545318640289,2966,71,"RPSA, RPS9, RPS8, RPS7, RPS5, RPS4X, RPS3A, RPS28, RPS27L, RPS27A, RPS25, RPS24, RPS21, RPS20, RPS19, RPS17, RPS16, RPS15A, RPS15, RPS14, RPS13, RPS12, RPS11, RPLP1, RPL8, RPL7A, RPL6, RPL5, RPL4, RPL3L, RPL38, RPL37A, RPL36, RPL35, RPL34, RPL32, RPL30, RPL3, RPL29, RPL28, RPL27, RPL26, RPL23, RPL22L1, RPL19, RPL18A, RPL18, RPL14, RPL13A, RPL12, RPL11, RPL10A, RPL10"
"299","Formation of the Early Elongation Complex",0.316588066434283,0.673372198452951,0.296503558485876,0.73214096491121,1543,33,"CCNH, CDK7, CTDP1, ERCC2, ERCC3, GTF2F1, GTF2F2, GTF2H1, GTF2H2, GTF2H3, GTF2H4, GTF2H5, MNAT1, NCBP1, NCBP2, NELFA, NELFB, NELFCD, NELFE, POLR2A, POLR2B, POLR2C, POLR2D, POLR2E, POLR2F, POLR2G, POLR2H, POLR2I, POLR2J, POLR2K, POLR2L"
"300","Formation of the HIV-1 Early Elongation Complex",0.316588066434283,0.673372198452951,0.296503558485876,0.73214096491121,1543,33,"CCNH, CDK7, CTDP1, ERCC2, ERCC3, GTF2F1, GTF2F2, GTF2H1, GTF2H2, GTF2H3, GTF2H4, GTF2H5, MNAT1, NCBP1, NCBP2, NELFA, NELFB, NELFCD, NELFE, POLR2A, POLR2B, POLR2C, POLR2D, POLR2E, POLR2F, POLR2G, POLR2H, POLR2I, POLR2J, POLR2K, POLR2L"
"301","Formation of the beta-catenin:TCF transactivating complex",0.500877364008579,0.700963295133699,-0.173095766464049,-0.426470902039348,2568,31,"TRRAP, TLE4, TLE3, TLE2, TLE1, TERT, TCF7L2, TCF7L1, TCF7, TCF4"
"302","Formation of the cornified envelope",0.463160049119935,0.690173706998438,0.185428833711112,0.489197528700612,2262,27,"CAPN1, CAPNS1, CSTA, DSC2, DSC3, DSG1, DSG2, DSG3, DSP, EVPL, FURIN, JUP, KAZN, KLK12, KLK8, LIPK, LIPN, PCSK6, PERP, PKP2, PKP4, PPL, PRSS8"
"303","Formation of the ternary complex, and subsequently, the 43S complex",0.391566265060241,0.676036774350512,-0.275236448177781,-0.5988816421436,2014,42,"RPSA, RPS9, RPS8, RPS7, RPS5, RPS4X, RPS3A, RPS28, RPS27L, RPS27A, RPS25, RPS24, RPS21, RPS20, RPS19, RPS17, RPS16, RPS15A, RPS15, RPS14, RPS13, RPS12, RPS11"
"304","Formation of tubulin folding intermediates by CCT/TriC",0.196884984025559,0.673372198452951,-0.440574938042456,-1.27115305686266,985,19,"TUBB6, TUBB4B, TUBB4A, TUBB2B, TUBB2A, TUBAL3, TUBA8, TUBA4A, TUBA1C, TUBA1B"
"305","G alpha (12/13) signalling events",0.219757650441569,0.673372198452951,0.996867293208025,1.70488461846386,1069,73,"ARHGEF3, ABR"
"306","G alpha (i) signalling events",0.592621664050236,0.726528065544785,-0.793005742228402,-0.986505827939612,3019,273,"HTR1F, GPC6, RGS6, PRKCG, GRM8, GABBR2"
"307","G alpha (q) signalling events",0.811438610189342,0.845657788373812,-0.575435414846611,-0.737632201529175,4156,169,"DGKB, DGKH"
"308","G alpha (s) signalling events",0.100654664484452,0.673372198452951,0.998122317596567,1.31209665153383,491,164,"RXFP1, ADCY1"
"309","G alpha (z) signalling events",0.392378990731205,0.676036774350512,0.545139546891059,1.1832795457246,1904,43,"PRKCA, ADCY1"
"310","G beta:gamma signalling through BTK",0.166532420459122,0.673372198452951,0.647808764940239,1.92406905840111,826,16,"BTK, GNB1, GNB2, GNB3, GNB4, GNB5, GNG10, GNG11, GNG12, GNG13, GNG2, GNG3, GNG4, GNG7, GNG8, GNGT2"
"311","G beta:gamma signalling through CDC42",0.185117967332123,0.673372198452951,0.592272841309898,1.73300426787755,917,18,"ARHGEF6, CDC42, GNB1, GNB2, GNB3, GNB4, GNB5, GNG10, GNG11, GNG12, GNG13, GNG2, GNG3, GNG4, GNG7, GNG8, GNGT2"
"312","G beta:gamma signalling through PI3Kgamma",0.237260497350183,0.673372198452951,0.430386547243219,1.18117698176439,1163,23,"AKT1, AKT2, AKT3, GNB1, GNB2, GNB3, GNB4, GNB5, GNG10, GNG11, GNG12, GNG13, GNG2, GNG3, GNG4, GNG7, GNG8, GNGT2"
"313","G beta:gamma signalling through PLC beta",0.188142770719903,0.673372198452951,0.481028910435206,1.40750190893949,932,18,"GNB1, GNB2, GNB3, GNB4, GNB5, GNG10, GNG11, GNG12, GNG13, GNG2, GNG3, GNG4, GNG7, GNG8, GNGT2"
"314","G protein gated Potassium channels",0.234497645211931,0.673372198452951,-0.515454196064193,-1.41886884470071,1194,23,"GABBR2"
"315","G-protein activation",0.243237746593451,0.673372198452951,0.522953760297635,1.42423736981414,1195,24,"GNAI1, GNAI2, GNAI3, GNAO1, GNAT2, GNAZ, GNB1, GNB2, GNB3, GNB4, GNB5, GNG10, GNG11, GNG12, GNG13, GNG2, GNG3, GNG4, GNG7, GNG8, GNGT2"
"316","G-protein beta:gamma signalling",0.292617725683734,0.673372198452951,0.34781337232487,0.884775803168245,1422,30,"AKT1, AKT2, AKT3, ARHGEF6, BTK, CDC42, GNB1, GNB2, GNB3, GNB4, GNB5, GNG10, GNG11, GNG12, GNG13, GNG2, GNG3, GNG4, GNG7, GNG8, GNGT2"
"317","G-protein mediated events",0.397908979089791,0.676036774350512,0.759106118197906,1.57495726152441,1940,48,"PRKCA, ITPR1, ADCY1"
"318","G0 and Early G1",0.364653243847875,0.673372198452951,0.219040659048631,0.596545843648252,1792,24,"CCNA1, CCNA2, CCNE1, CCNE2, CDC25A, CDC6, DYRK1A, E2F1, E2F4, E2F5, HDAC1, LIN37, LIN52, LIN54, LIN9, MAX, MYBL2, MYC"
"319","G1 Phase",0.398721122112211,0.676036774350512,0.209293997882147,0.475192706621187,1932,39,"ABL1, CCND1, CCND2, CCND3, CCNH, CDK4, CDK6, CDK7, CDKN1A, CDKN1B, CDKN1C, CDKN2D, CKS1B, CUL1, E2F1, E2F3, E2F4, E2F5"
"320","G1/S DNA Damage Checkpoints",0.52921633769787,0.71054680873648,-0.428971669452597,-0.768144026616719,2707,62,"ZNF385A, UBC, UBB, TP53, RPS27A, PSMF1, PSME4, PSME3, PSME2, PSME1, PSMD9, PSMD8, PSMD7, PSMD6, PSMD5, PSMD4, PSMD3, PSMD2, PSMD14, PSMD13, PSMD12, PSMD11, PSMD10, PSMD1, PSMC6, PSMC5, PSMC4, PSMC3, PSMC2, PSMC1, PSMB9, PSMB8, PSMB7, PSMB6, PSMB5, PSMB4, PSMB3, PSMB2, PSMB10, PSMB1, PSMA8, PSMA7, PSMA6, PSMA5, PSMA4, PSMA3, PSMA1"
"321","G1/S Transition",0.767804878048781,0.814781906695697,-0.227002218777545,-0.312865691708087,3934,121,"WEE1, UBC, UBB, TYMS, TK1, TFDP2, TFDP1, SKP2, SKP1, RRM2, RPS27A, RPA3, RPA2, RPA1, RBL2, RBL1, RB1, PSMF1, PSME3, PSME2, PSME1, PSMD9, PSMD8, PSMD7, PSMD6, PSMD5, PSMD4, PSMD3, PSMD2, PSMD14, PSMD13, PSMD12, PSMD11, PSMD10, PSMD1, PSMC6, PSMC5, PSMC4, PSMC3, PSMC2, PSMC1, PSMB9, PSMB8, PSMB7, PSMB6, PSMB5, PSMB4, PSMB3, PSMB2, PSMB10, PSMB1, PSMA7, PSMA6, PSMA5, PSMA4, PSMA3, PSMA1, PRIM2, PRIM1, PPP2R3B, PPP2R1B, PPP2R1A, PPP2CB, PPP2CA, POLE4, POLE3, POLE2, POLE, POLA2, POLA1, PCNA, ORC6, ORC5, ORC4, ORC3, ORC2, ORC1"
"322","G1/S-Specific Transcription",0.611316113161132,0.734968690595997,0.157843087145413,0.421399631054027,2981,26,"CCNA1, CCNE1, CDC25A, CDC45, CDC6, DHFR, E2F1, E2F4, E2F5, E2F6, FBXO5, HDAC1, LIN37, LIN52, LIN54, LIN9"
"323","G2/M Checkpoints",0.775083121455114,0.82168130510973,-0.305784139898511,-0.418661059617261,3962,123,"YWHAZ, YWHAQ, YWHAH, YWHAG, YWHAE, YWHAB, WRN, WEE1, UIMC1, UBE2V2, UBE2N, UBC, UBB, TP53BP1, TP53, TOPBP1, TOP3A, SUMO1, RPS27A, RPA3, RPA2, RPA1, RNF168, RMI2, RMI1, RHNO1, RFC5, RFC4, RFC3, RFC2, RBBP8, RAD9B, RAD9A, RAD50, RAD17, RAD1, PSMF1, PSME4, PSME3, PSME2, PSME1, PSMD9, PSMD8, PSMD7, PSMD6, PSMD5, PSMD4, PSMD3, PSMD2, PSMD14, PSMD13, PSMD12, PSMD11, PSMD10, PSMD1, PSMC6, PSMC5, PSMC4, PSMC3, PSMC2, PSMC1, PSMB9, PSMB8, PSMB7, PSMB6, PSMB5, PSMB4, PSMB3, PSMB2, PSMB10, PSMB1, PSMA8, PSMA7, PSMA6, PSMA5, PSMA4, PSMA3, PSMA1"
"324","G2/M DNA damage checkpoint",0.490948024138602,0.698009904216332,-0.278633250903557,-0.525189205324672,2521,56,"YWHAZ, YWHAQ, YWHAH, YWHAG, YWHAE, YWHAB, WRN, WEE1, UIMC1, UBE2V2, UBE2N, TP53BP1, TP53, TOPBP1, TOP3A, SUMO1, RPA3, RPA2, RPA1, RNF168, RMI2, RMI1, RHNO1, RFC5, RFC4, RFC3, RFC2, RBBP8, RAD9B, RAD9A, RAD50, RAD17, RAD1"
"325","G2/M Transition",0.864364981504316,0.884078409894799,0.177842515267258,0.231116422445224,4205,171,"ACTR1A, AKAP9, ALMS1, AURKA, BORA, BTRC, CCNA1, CCNA2, CCNB1, CCNB2, CCNH, CCP110, CDC25A, CDC25B, CDC25C, CDK11A, CDK11B, CDK5RAP2, CDK7, CDKN1A, CENPF, CENPJ, CEP131, CEP135, CEP152, CEP164, CEP192, CEP250, CEP290, CEP41, CEP57, CEP63, CEP70, CEP72, CEP76, CEP78, CETN2, CKAP5, CLASP1, CNTRL, CSNK1D, CSNK1E, CUL1, DCTN1, DCTN2, DCTN3, DYNC1H1, DYNC1I2, DYNLL1, EP300, FBXL18, FBXL7, FBXW11, FGFR1OP, FKBPL, FOXM1, UBA52, GTSE1, HAUS1, HAUS2, HAUS4, HAUS6, HAUS7, HAUS8, HMMR, HSP90AB1, LCMT1, LIN37, LIN52, LIN54, LIN9, MAPRE1, MNAT1, MYBL2, MZT1, MZT2A, MZT2B, NDE1, NEDD1, NINL, NME7, ODF2, OFD1, OPTN, PAFAH1B1, PCM1, PCNT, PHLDA1, PKMYT1, PLK1, PLK4, PPME1, PPP1CB, PPP1R12A, PPP1R12B, PPP2CA, PPP2CB, PPP2R1A, PPP2R1B, PPP2R2A, PPP2R3B, PRKACA, PRKAR2B, PSMA1, PSMA3, PSMA4, PSMA5, PSMA6, PSMA7, PSMA8, PSMB1, PSMB10, PSMB2, PSMB3, PSMB4, PSMB5, PSMB6, PSMB7, PSMB8, PSMB9, PSMC1, PSMC2, PSMC3, PSMC4, PSMC5, PSMC6, PSMD1, PSMD10, PSMD11, PSMD12, PSMD13, PSMD14, PSMD2, PSMD3, PSMD4, PSMD5, PSMD6, PSMD7, PSMD8, PSMD9, PSME1, PSME2, PSME3, PSME4, PSMF1"
"326","GAB1 signalosome",0.589407974224728,0.725768093757304,0.194787516600266,0.578542085159868,2926,16,"AREG, BTC, CSK, EGF, EGFR, EREG, GAB1, GRB2, HBEGF, PAG1, PIK3CA, PIK3R1, PTPN11, PXN"
"327","GABA B receptor activation",0.335026372338347,0.673372198452951,-0.51545112202453,-1.21807638927425,1714,35,"GABBR2"
"328","GABA receptor activation",0.411007025761124,0.678445586759412,-0.799557565717071,-1.61485601026429,2105,49,"GABRG3, GABBR2, GABRA2"
"329","GABA synthesis, release, reuptake and degradation",0.235772357723577,0.673372198452951,-0.296726730715308,-0.870715359136691,1188,18,"VAMP2, SYT1, STXBP1, STX1A, SNAP25, SLC6A13, SLC6A11, SLC6A1, SLC32A1, RIMS1, RAB3A"
"330","GLI3 is processed to GLI3R by the proteasome",0.483550710531439,0.698009904216332,-0.554508274681377,-1.04517949376641,2483,56,"UBC, UBB, SUFU, SKP1, RPS27A, RBX1, PSMF1, PSME4, PSME3, PSME2, PSME1, PSMD9, PSMD8, PSMD7, PSMD6, PSMD5, PSMD4, PSMD3, PSMD2, PSMD14, PSMD13, PSMD12, PSMD11, PSMD10, PSMD1, PSMC6, PSMC5, PSMC4, PSMC3, PSMC2, PSMC1, PSMB9, PSMB8, PSMB7, PSMB6, PSMB5, PSMB4, PSMB3, PSMB2, PSMB10, PSMB1, PSMA8, PSMA7, PSMA6, PSMA5, PSMA4, PSMA3, PSMA1, PRKACB, PRKACA"
"331","GPCR ligand binding",0.620506776664702,0.738782274395303,-0.769271465225303,-0.9588345905577,3158,278,"HTR1F, GRM8, GABBR2"
"332","GPVI-mediated activation cascade",0.292754187767822,0.673372198452951,-0.369373663669926,-0.931910682596056,1502,29,"VAV3, VAV2, VAV1, SYK, RHOG, RHOB, RHOA, RAC1, PTPN6, PTPN11, PRKCZ, PLCG2, PIK3R6, PIK3R5, PIK3R3, PIK3R2, PIK3R1, PIK3CG, PIK3CB, PIK3CA, PDPN, PDPK1"
"333","GRB2 events in ERBB2 signaling",0.0808181096108022,0.673372198452951,-0.996746347941567,-2.96702636178322,406,16,"NRG1"
"334","GTP hydrolysis and joining of the 60S ribosomal subunit",0.625313041803121,0.738782274395303,-0.380229623866392,-0.607173709196767,3245,81,"RPSA, RPS9, RPS8, RPS7, RPS5, RPS4X, RPS3A, RPS28, RPS27L, RPS27A, RPS25, RPS24, RPS21, RPS20, RPS19, RPS17, RPS16, RPS15A, RPS15, RPS14, RPS13, RPS12, RPS11, RPLP1, RPL8, RPL7A, RPL6, RPL5, RPL4, RPL3L, RPL38, RPL37A, RPL36, RPL35, RPL34, RPL32, RPL30, RPL3, RPL29, RPL28, RPL27, RPL26, RPL23, RPL22L1, RPL19, RPL18A, RPL18, RPL14, RPL13A, RPL12, RPL11, RPL10A, RPL10"
"335","Gamma carboxylation, hypusine formation and arylsulfatase activation",0.274772914946325,0.673372198452951,0.525005696058328,1.367348055352,1330,28,"ARSA, ARSB, ARSG, ARSI, ARSJ, ARSK, BGLAP, DHPS, DNAJC24, DPH1, DPH2, DPH3, DPH5, DPH6, DPH7, EEF2, EIF5A, EIF5A2, F2, FN3K, FN3KRP, FURIN, GAS6, GGCX"
"336","Gap junction trafficking",0.166935159081756,0.673372198452951,0.602905046480744,1.79069967538105,828,16,"AP2M1, CLTA, CLTB, CLTC, DAB2, DNM1, DNM2, GJA3, GJA5, GJB1, GJB2, GJB6, GJC1, GJC2, GJD2"
"337","Gap junction trafficking and regulation",0.187941117160718,0.673372198452951,0.498693938991455,1.45919019809429,931,18,"AP2M1, CLTA, CLTB, CLTC, DAB2, DNM1, DNM2, GJA3, GJA5, GJB1, GJB2, GJB6, GJC1, GJC2, GJD2"
"338","Gap-filling DNA repair synthesis and ligation in GG-NER",0.243657817109145,0.673372198452951,-0.479770130215254,-1.30387724484941,1238,24,"XRCC1, UBC, UBB, RPS27A, RPA3, RPA2, RPA1, RFC5, RFC4, RFC3, RFC2, RFC1, POLK, POLE4, POLE3, POLE2, POLE, POLD4, POLD2, POLD1, PCNA"
"339","Gap-filling DNA repair synthesis and ligation in TC-NER",0.532280085820168,0.711020629255251,-0.277030806105608,-0.494635965676551,2728,63,"ZNF830, XRCC1, XAB2, UVSSA, USP7, UBC, UBB, TCEA1, RPS27A, RPA3, RPA2, RPA1, RFC5, RFC4, RFC3, RFC2, RFC1, RBX1, PRPF19, PPIE, POLR2L, POLR2K, POLR2J, POLR2I, POLR2H, POLR2G, POLR2F, POLR2E, POLR2D, POLR2C, POLR2B, POLR2A, POLK, POLE4, POLE3, POLE2, POLE, POLD4, POLD2, POLD1"
"340","Gastrin-CREB signalling pathway via PKC and MAPK",0.0330245670559807,0.673372198452951,0.998871181938911,2.96676617932841,163,16,"PRKCA, CCKBR"
"341","Gene Silencing by RNA",0.582426127527216,0.723883666382134,-0.327979205545188,-0.550490353252628,2995,72,"XPO5, TSNAX, TSN, TPR, TNRC6C, TNRC6B, TNRC6A, TDRKH, TDRD9, TDRD6, TDRD12, TARBP2, SEH1L, SEC13, RANBP2, RAE1, PRKRA, POM121, POM121C, POLR2L, POLR2K, POLR2J, POLR2I, POLR2H, POLR2G, POLR2F, POLR2E, POLR2D, POLR2C, POLR2B, POLR2A, PIWIL2, PIWIL1, NUP42, NUP58, NUP98, NUP93, NUP88, NUP85, NUP62, NUP54, NUP50, NUP43, NUP37, NUP35, NUP214, NUP210, NUP205, NUP188, NUP160, NUP155, NUP153, NUP133, NUP107"
"342","Gene and protein expression by JAK-STAT signaling after Interleukin-12 stimulation",0.606402626718654,0.734968690595997,0.149351944167498,0.375746967767566,2954,31,"AIP, ANXA2, ARF1, BOLA2, CAPZA1, CA1, CDC42, CFL1, GSTO1, HNRNPA2B1, HNRNPF, HSPA9, LCP1, LMNB1, MIF, MSN, MTAP, PAK2, PDCD4, PITPNA, PPIA, PSME2, RALA, RAP1B, SERPINB2, SNRPA1, SOD1, SOD2, STAT4, TALDO1, TCP1"
"343","Generation of second messenger molecules",0.641691842900302,0.740090160111923,0.169354410201913,0.485660959660453,3185,20,"CD101, CD247, CD3G, ENAH, EVL, GRAP2, HLA-DQB1, ITK, LCK, LCP2, NCK1, PAK1, PAK2, PAK3, PLCG1, PLCG2"
"344","Global Genome Nucleotide Excision Repair (GG-NER)",0.725947521865889,0.789743404271137,0.108897405134444,0.174737249543291,3485,83,"ACTB, ACTL6A, ACTR5, ACTR8, CCNH, CDK7, CETN2, CHD1L, COPS2, COPS3, COPS4, COPS5, COPS6, COPS7A, COPS7B, COPS8, CUL4A, CUL4B, DDB1, DDB2, ERCC1, ERCC2, ERCC3, ERCC4, ERCC5, UBA52, SUMO3, GPS1, GTF2H1, GTF2H2, GTF2H3, GTF2H4, GTF2H5, INO80, INO80B, INO80C, INO80D, INO80E, LIG1, LIG3, MCRS1, MNAT1, NFRKB, PARP1, PARP2, PCNA, PIAS1, PIAS3, POLD1, POLD2, POLD4, POLE, POLE2, POLE3, POLE4, POLK, RAD23A, RAD23B, RBX1, RFC1, RFC2, RFC3, RFC4, RFC5, RNF111, RPA1, RPA2, RPA3, RPS27A, RUVBL1"
"345","Glucagon signaling in metabolic regulation",0.283278553820871,0.673372198452951,0.441139601661919,1.13796858327767,1378,29,"ADCY1, ADCY2, ADCY3, ADCY5, ADCY6, ADCY7, ADCY8, ADCY9, GCG, GNAS, GNB1, GNB2, GNB3, GNB4, GNG10, GNG11, GNG12, GNG13, GNG2, GNG3, GNG4, GNG7, GNG8"
"346","Glucagon-like Peptide-1 (GLP1) regulates insulin secretion",0.337137330754352,0.673372198452951,-0.845358515264077,-1.9306333585259,1742,38,"KCNC2, RAPGEF4"
