"","pathway","pval","padj","ES","NES","nMoreExtreme","size","leadingEdge"
"500","Metabolism of water-soluble vitamins and cofactors",0.722622057965376,0.787367803632717,-0.207829495468925,-0.299137010740182,3714,106,"PRSS3, PRSS1, TPK1, TCN2, SLC5A6, SLC52A1, SLC52A2, SLC46A1, SLC2A1, SLC25A32, SLC25A19, SLC25A16, SLC23A2, SLC23A1, SLC19A2, SLC19A1, SHMT2, SHMT1, RNLS, RFK, QPRT, PTGS2, PTGIS, PPCS, PPCDC, PNPO, PDZD11, PDXK, PC, PCCB, PCCA, PARP9, PARP8, PARP6, PARP4, PARP16, PARP14, PARP10, PANK4, PANK3, PANK2, PANK1, NUDT12, NT5E, NNMT, NMRK2, NMRK1, NMNAT3, NMNAT2, NMNAT1, NFS1, NAXE, NAXD, NAMPT, NADSYN1, NADK2, NADK, MTRR, MTR, MTHFS, MTHFR, MTHFD2L, MTHFD2, MTHFD1L, MTHFD1, MOCS3, MOCS2, MOCS1, MOCOS, MMUT, MMADHC, MMACHC, MMAB, MMAA, MCCC2, MCCC1"
"501","Metal ion SLC transporters",0.238938053097345,0.673372198452951,-0.686929754628399,-1.86687753042922,1214,24,"SLC41A2, SLC41A1, SLC40A1, SLC39A8, SLC39A7, SLC39A6, SLC39A3, SLC39A2, SLC39A14, SLC39A10, SLC39A1, SLC31A1, SLC30A8, SLC30A7, SLC30A6, SLC30A5, SLC30A3, SLC30A2, SLC30A10, SLC30A1, SLC11A2, SLC11A1"
"502","Metalloprotease DUBs",0.67938021454112,0.760618271941276,-0.176236215981844,-0.519684377181221,3419,17,"UIMC1, UBC, UBB, STAMBPL1, STAMBP, STAM"
"503","MicroRNA (miRNA) biogenesis",0.256475667189953,0.673372198452951,-0.295168664920181,-0.812498231239525,1306,23,"XPO5, TARBP2, PRKRA, POLR2L, POLR2K, POLR2J, POLR2I, POLR2H, POLR2G, POLR2F, POLR2E, POLR2D, POLR2C, POLR2B, POLR2A"
"504","Miscellaneous transport and binding events",0.179657603222558,0.673372198452951,0.994951843241448,2.81306293584153,891,21,"ADD2, ADD1"
"505","Misspliced GSK3beta mutants stabilize beta-catenin",0.190533736153072,0.673372198452951,0.34685611845163,1.03917559465052,945,15,"AMER1, APC, AXIN1, CSNK1A1, CTNNB1, GSK3B, PPP2CA, PPP2CB, PPP2R1A, PPP2R1B, PPP2R5A, PPP2R5B, PPP2R5C, PPP2R5D, PPP2R5E"
"506","Mitochondrial Fatty Acid Beta-Oxidation",0.329510546795003,0.673372198452951,0.486694463703971,1.1723611024959,1608,35,"ACAA2, ACAD10, ACAD11, ACADL, ACADM, ACADS, ACADVL, ACBD6, ACBD7, ACOT11, ACOT12, ACOT13, ACOT1, ACOT2, ACOT7, ACOT9, ACSF2, ACSM3"
"507","Mitochondrial biogenesis",0.390286377708978,0.676036774350512,-0.994862556712036,-1.52845422626254,2016,88,"MEF2C, PRKAG2"
"508","Mitochondrial calcium ion transport",0.222508932115919,0.673372198452951,-0.359029589916338,-1.00922881327496,1120,21,"YME1L1, VDAC3, VDAC2, VDAC1, STOML2, SMDT1, SLC8B1, SLC8A3, PMPCB, PMPCA, PHB2, PHB, PARL, MICU3, MICU2, MICU1, MCUB, MCU, LETM1"
"509","Mitochondrial protein import",0.519789432637941,0.706220067049808,-0.191616037766175,-0.353732997357431,2665,58,"VDAC1, TOMM70, TOMM7, TOMM6, TOMM40, TOMM22, TOMM20, TIMM9, TIMM8B, TIMM8A, TIMM50, TIMM44, TIMM23, TIMM22, TIMM21, TIMM17B, TIMM17A, TIMM13, TIMM10"
"510","Mitochondrial tRNA aminoacylation",0.965654952076677,0.967483844031368,-0.111977992400807,-0.323080491083024,4835,19,"YARS2, WARS2, VARS2, TARS2, SARS2, RARS2, PPA2, PARS2, NARS2, MARS2, LARS2, KARS1, IARS2, HARS2, FARS2, EARS2, DARS2"
"511","Mitochondrial translation",0.663337814480507,0.750876915176367,-0.441995841995842,-0.677474746204004,3453,91,"TUFM, TSFM, PTCD3, OXA1L, MTRF1L, MTIF3, MTIF2, MTFMT, MRRF, MRPS9, MRPS7, MRPS5, MRPS36, MRPS35, MRPS34, MRPS33, MRPS31, MRPS30, MRPS28, MRPS27, MRPS26, MRPS25, MRPS24, MRPS23, MRPS22, MRPS21, MRPS2, MRPS18C, MRPS18B, MRPS18A, MRPS17, MRPS16, MRPS15, MRPS14, MRPS12, MRPS11, MRPS10, MRPL9, MRPL58, MRPL57, MRPL55, MRPL54, MRPL52, MRPL51, MRPL50, MRPL49, MRPL48, MRPL47, MRPL46, MRPL45, MRPL44, MRPL43, MRPL42, MRPL41, MRPL40, MRPL4, MRPL39, MRPL38, MRPL37, MRPL36, MRPL35, MRPL34, MRPL32, MRPL30, MRPL3, MRPL28, MRPL27, MRPL24, MRPL23, MRPL22, MRPL21, MRPL20, MRPL2, MRPL19, MRPL18, MRPL17, MRPL16, MRPL15, MRPL14, MRPL13, MRPL12, MRPL11, MRPL10, MRPL1"
"512","Mitochondrial translation elongation",0.642857142857143,0.740090160111923,-0.448189698132605,-0.702098380224643,3320,85,"TUFM, TSFM, PTCD3, OXA1L, MRPS9, MRPS7, MRPS5, MRPS36, MRPS35, MRPS34, MRPS33, MRPS31, MRPS30, MRPS28, MRPS27, MRPS26, MRPS25, MRPS24, MRPS23, MRPS22, MRPS21, MRPS2, MRPS18C, MRPS18B, MRPS18A, MRPS17, MRPS16, MRPS15, MRPS14, MRPS12, MRPS11, MRPS10, MRPL9, MRPL58, MRPL57, MRPL55, MRPL54, MRPL52, MRPL51, MRPL50, MRPL49, MRPL48, MRPL47, MRPL46, MRPL45, MRPL44, MRPL43, MRPL42, MRPL41, MRPL40, MRPL4, MRPL39, MRPL38, MRPL37, MRPL36, MRPL35, MRPL34, MRPL32, MRPL30, MRPL3, MRPL28, MRPL27, MRPL24, MRPL23, MRPL22, MRPL21, MRPL20, MRPL2, MRPL19, MRPL18, MRPL17, MRPL16, MRPL15, MRPL14, MRPL13, MRPL12, MRPL11, MRPL10, MRPL1"
"513","Mitochondrial translation initiation",0.642857142857143,0.740090160111923,-0.460021110705639,-0.720632531361778,3320,85,"PTCD3, OXA1L, MTIF3, MTIF2, MTFMT, MRPS9, MRPS7, MRPS5, MRPS36, MRPS35, MRPS34, MRPS33, MRPS31, MRPS30, MRPS28, MRPS27, MRPS26, MRPS25, MRPS24, MRPS23, MRPS22, MRPS21, MRPS2, MRPS18C, MRPS18B, MRPS18A, MRPS17, MRPS16, MRPS15, MRPS14, MRPS12, MRPS11, MRPS10, MRPL9, MRPL58, MRPL57, MRPL55, MRPL54, MRPL52, MRPL51, MRPL50, MRPL49, MRPL48, MRPL47, MRPL46, MRPL45, MRPL44, MRPL43, MRPL42, MRPL41, MRPL40, MRPL4, MRPL39, MRPL38, MRPL37, MRPL36, MRPL35, MRPL34, MRPL32, MRPL30, MRPL3, MRPL28, MRPL27, MRPL24, MRPL23, MRPL22, MRPL21, MRPL20, MRPL2, MRPL19, MRPL18, MRPL17, MRPL16, MRPL15, MRPL14, MRPL13, MRPL12, MRPL11, MRPL10, MRPL1"
"514","Mitochondrial translation termination",0.633995037220844,0.740090160111923,0.450555038905696,0.719617535445638,3065,85,"AURKAIP1, CHCHD1, DAP3, ERAL1, GADD45GIP1, GFM2, MRPL1, MRPL10, MRPL11, MRPL12, MRPL13, MRPL14, MRPL15, MRPL16, MRPL17, MRPL18, MRPL19, MRPL2, MRPL20, MRPL21, MRPL22, MRPL23, MRPL24, MRPL27, MRPL28, MRPL3, MRPL30, MRPL32, MRPL34, MRPL35, MRPL36, MRPL37, MRPL38, MRPL39, MRPL4, MRPL40, MRPL41, MRPL42, MRPL43, MRPL44, MRPL45, MRPL46, MRPL47, MRPL48, MRPL49, MRPL50, MRPL51, MRPL52, MRPL54, MRPL55, MRPL57, MRPL58, MRPL9, MRPS10, MRPS11, MRPS12, MRPS14, MRPS15, MRPS16, MRPS17, MRPS18A, MRPS18B, MRPS18C, MRPS2, MRPS21, MRPS22, MRPS23, MRPS24, MRPS25, MRPS26, MRPS27, MRPS28, MRPS30, MRPS31, MRPS33, MRPS34, MRPS35, MRPS36, MRPS5, MRPS7, MRPS9, MRRF, MTRF1L"
"515","Mitophagy",0.285714285714286,0.673372198452951,-0.277352415026834,-0.733781572615162,1463,26,"VDAC1, ULK1, UBC, UBB, TOMM70, TOMM7, TOMM6, TOMM40, TOMM22, TOMM20, SRC, SQSTM1"
"516","Mitotic Anaphase",0.277789150460594,0.673372198452951,0.995841438057549,1.30266906410434,1356,167,"PTTG1, AHCTF1"
"517","Mitotic G1 phase and G1/S transition",0.788312219043727,0.830711481820979,0.190053221684304,0.261668446648864,3857,135,"ABL1, AKT1, AKT2, AKT3, CABLES1, CCNA1, CCNA2, CCNB1, CCND1, CCND2, CCND3, CCNE1, CCNE2, CCNH, CDC25A, CDC45, CDC6, CDC7, CDK4, CDK6, CDK7, CDKN1A, CDKN1B, CDKN1C, CDKN2D, CKS1B, CUL1, DBF4, DHFR, DYRK1A, E2F1, E2F3, E2F4, E2F5, E2F6, FBXO5, UBA52, GMNN, HDAC1, JAK2, LIN37, LIN52, LIN54, LIN9, LYN, MAX, MCM10, MCM4, MCM5, MCM6, MCM7, MCM8, MNAT1, MYBL2, MYC, ORC1, ORC2, ORC3, ORC4, ORC5, ORC6, PCNA, POLA1, POLA2, POLE, POLE2, POLE3, POLE4, PPP2CA, PPP2CB, PPP2R1A, PPP2R1B, PPP2R2A, PPP2R3B, PRIM1, PRIM2, PSMA1, PSMA3, PSMA4, PSMA5, PSMA6, PSMA7, PSMB1, PSMB10, PSMB2, PSMB3, PSMB4, PSMB5, PSMB6, PSMB7, PSMB8, PSMB9, PSMC1, PSMC2, PSMC3, PSMC4, PSMC5, PSMC6, PSMD1, PSMD10, PSMD11, PSMD12, PSMD13, PSMD14, PSMD2, PSMD3, PSMD4, PSMD5, PSMD6, PSMD7, PSMD8, PSMD9, PSME1, PSME2, PSME3, PSMF1, RB1, RBL1, RBL2, RPA1, RPA2, RPA3, RPS27A, RRM2"
"518","Mitotic G2-G2/M phases",0.867378361732704,0.884943400880618,0.179644553081022,0.233040737159854,4224,173,"ACTR1A, AKAP9, ALMS1, AURKA, BORA, BTRC, CCNA1, CCNA2, CCNB1, CCNB2, CCNH, CCP110, CDC25A, CDC25B, CDC25C, CDK11A, CDK11B, CDK5RAP2, CDK7, CDKN1A, CENPF, CENPJ, CEP131, CEP135, CEP152, CEP164, CEP192, CEP250, CEP290, CEP41, CEP57, CEP63, CEP70, CEP72, CEP76, CEP78, CETN2, CKAP5, CLASP1, CNTRL, CSNK1D, CSNK1E, CUL1, DCTN1, DCTN2, DCTN3, DYNC1H1, DYNC1I2, DYNLL1, E2F1, E2F3, EP300, FBXL18, FBXL7, FBXW11, FGFR1OP, FKBPL, FOXM1, UBA52, GTSE1, HAUS1, HAUS2, HAUS4, HAUS6, HAUS7, HAUS8, HMMR, HSP90AB1, LCMT1, LIN37, LIN52, LIN54, LIN9, MAPRE1, MNAT1, MYBL2, MZT1, MZT2A, MZT2B, NDE1, NEDD1, NINL, NME7, ODF2, OFD1, OPTN, PAFAH1B1, PCM1, PCNT, PHLDA1, PKMYT1, PLK1, PLK4, PPME1, PPP1CB, PPP1R12A, PPP1R12B, PPP2CA, PPP2CB, PPP2R1A, PPP2R1B, PPP2R2A, PPP2R3B, PRKACA, PRKAR2B, PSMA1, PSMA3, PSMA4, PSMA5, PSMA6, PSMA7, PSMA8, PSMB1, PSMB10, PSMB2, PSMB3, PSMB4, PSMB5, PSMB6, PSMB7, PSMB8, PSMB9, PSMC1, PSMC2, PSMC3, PSMC4, PSMC5, PSMC6, PSMD1, PSMD10, PSMD11, PSMD12, PSMD13, PSMD14, PSMD2, PSMD3, PSMD4, PSMD5, PSMD6, PSMD7, PSMD8, PSMD9, PSME1, PSME2, PSME3, PSME4, PSMF1"
"519","Mitotic Metaphase and Anaphase",0.276970317297851,0.673372198452951,0.995841159109203,1.30183237641318,1352,168,"PTTG1, AHCTF1"
"520","Mitotic Prometaphase",0.864859314027521,0.884078409894799,0.133922218477325,0.174132926590486,4210,172,"ACTR1A, AHCTF1, AKAP9, ALMS1, B9D2, BIRC5, BUB1, BUB3, CCNB1, CCNB2, CCP110, CDC20, CDCA8, CDK5RAP2, CENPA, CENPC, CENPE, CENPF, CENPH, CENPI, CENPJ, CENPK, CENPL, CENPM, CENPN, CENPO, CENPP, CENPQ, CENPT, CENPU, CEP131, CEP135, CEP152, CEP164, CEP192, CEP250, CEP290, CEP41, CEP57, CEP63, CEP70, CEP72, CEP76, CEP78, CETN2, CKAP5, CLASP1, CLASP2, CLIP1, CNTRL, CSNK1D, CSNK1E, CSNK2A1, CSNK2A2, CSNK2B, DCTN1, DCTN2, DCTN3, DSN1, DYNC1H1, DYNC1I1, DYNC1I2, DYNC1LI1, DYNC1LI2, DYNLL1, DYNLL2"
"521","Mitotic Prophase",0.555876288659794,0.716342403656592,0.672554707623255,1.11161715123273,2695,79,"PRKCA, AAAS"
"522","Mitotic Spindle Checkpoint",0.689286448694222,0.765230915759167,0.210066773504274,0.317252348374699,3351,100,"AHCTF1, ANAPC1, ANAPC10, ANAPC15, ANAPC16, ANAPC2, ANAPC4, ANAPC5, ANAPC7, B9D2, BIRC5, BUB1, BUB3, CDC16, CDC20, CDC23, CDC26, CDC27, CDCA8, CENPA, CENPC, CENPE, CENPF, CENPH, CENPI, CENPK, CENPL, CENPM, CENPN, CENPO, CENPP, CENPQ, CENPT, CENPU, CKAP5, CLASP1, CLASP2, CLIP1, DSN1, DYNC1H1, DYNC1I1, DYNC1I2, DYNC1LI1, DYNC1LI2, DYNLL1, DYNLL2"
"523","Molecules associated with elastic fibres",0.268522308636922,0.673372198452951,0.3533469678064,0.932198407147655,1311,27,"BMP2, BMP4, BMP7, EFEMP1, EFEMP2, FBLN1, FBLN2, FBLN5, ITGA8, ITGAV, ITGB1, ITGB3, ITGB5, ITGB6, ITGB8, LTBP1, LTBP2, LTBP3, LTBP4, MFAP1, MFAP2, MFAP3, MFAP4"
"524","Muscle contraction",0.638297872340426,0.740090160111923,-0.803406684105655,-1.02986125954392,3269,169,"KCNIP4, CACNA2D3"
"525","MyD88 cascade initiated on plasma membrane",0.332364341085271,0.673372198452951,-0.9954,-1.62746697402797,1714,76,"MEF2C"
"526","MyD88 dependent cascade initiated on endosome",0.336544018493547,0.673372198452951,-0.995398466155385,-1.58951260209202,1746,81,"MEF2C"
"527","MyD88-independent TLR4 cascade",0.343919442292796,0.673372198452951,-0.995395702655812,-1.52037745695577,1775,90,"MEF2C"
"528","MyD88:MAL(TIRAP) cascade initiated on plasma membrane",0.339137163861482,0.673372198452951,-0.995397545357524,-1.56528979603625,1752,84,"MEF2C"
"529","Myogenesis",0.164970645792564,0.673372198452951,-0.995482027772241,-2.66492274882804,842,25,"CDH4, MEF2C"
"530","N-Glycan antennae elongation",0.152870090634441,0.673372198452951,0.864088169542359,2.58879486232813,758,15,"MGAT4C, B4GALT1"
"531","N-glycan antennae elongation in the medial/trans-Golgi",0.232865568436038,0.673372198452951,0.86408761373726,2.35329767889556,1144,24,"MGAT4C, B4GALT1"
"532","N-glycan trimming in the ER and Calnexin/Calreticulin cycle",0.623414634146341,0.738782274395303,-0.146158789248598,-0.351718688567548,3194,33,"VCP, UGGT2, UGGT1, UBXN1, UBC, UBB, TRIM13, SYVN1, SEL1L, RPS27A, RNF5, RNF185, RNF103, RAD23B, PSMC1, PRKCSH, PDIA3, OS9, NGLY1, MOGS, MLEC, MAN1B1"
"533","NCAM signaling for neurite out-growth",0.386933696286214,0.676036774350512,-0.993942621313985,-1.93008697137177,1989,53,"PTK2"
"534","NCAM1 interactions",0.311051876153373,0.673372198452951,0.539544215672648,1.33226874136707,1516,33,"AGRN, ARTN, CACNA1C, CACNA1D, CACNA1G, CACNA1H, CACNA1I, CACNB1, CACNB2, CACNB3, CACNB4, CNTN2, COL4A1, COL4A2, COL4A3, COL4A4, COL4A5, COL6A1, COL6A2, COL6A3, COL6A5, COL6A6, COL9A1, COL9A2"
"535","NEP/NS2 Interacts with the Cellular Export Machinery",0.30688243322285,0.673372198452951,-0.513305245553662,-1.26467420645014,1573,31,"XPO1, TPR, SEH1L, SEC13, RANBP2, RAE1, POM121, POM121C, NUP42, NUP58, NUP98, NUP93, NUP88, NUP85, NUP62, NUP54, NUP50, NUP43, NUP37, NUP35, NUP214, NUP210, NUP205, NUP188, NUP160, NUP155, NUP153, NUP133, NUP107, NDC1"
"536","NIK-->noncanonical NF-kB signaling",0.484329375121666,0.698009904216332,-0.546171770972037,-1.02946621567021,2487,56,"UBE2M, UBC, UBB, UBA3, SKP1, RPS27A, RELB, PSMF1, PSME4, PSME3, PSME2, PSME1, PSMD9, PSMD8, PSMD7, PSMD6, PSMD5, PSMD4, PSMD3, PSMD2, PSMD14, PSMD13, PSMD12, PSMD11, PSMD10, PSMD1, PSMC6, PSMC5, PSMC4, PSMC3, PSMC2, PSMC1, PSMB9, PSMB8, PSMB7, PSMB6, PSMB5, PSMB4, PSMB3, PSMB2, PSMB10, PSMB1, PSMA8, PSMA7, PSMA6, PSMA5, PSMA4, PSMA3, PSMA1"
"537","NOD1/2 Signaling Pathway",0.424029727497936,0.678445586759412,0.195384294068505,0.508867497146568,2053,28,"BIRC2, BIRC3, CARD9, CASP1, CASP2, CASP8, CASP9, CHUK, CYLD, IKBKB, IKBKG, IRAK1, IRAK2, ITCH, MAP2K6, MAP3K7, MAPK11, MAPK12, MAPK14"
"538","NOTCH1 Intracellular Domain Regulates Transcription",0.0616424329305755,0.673372198452951,0.998935462408516,2.11289103034582,300,46,"HDAC9, CCNC"
"539","NOTCH2 Activation and Transmission of Signal to the Nucleus",0.462985436893204,0.690173706998438,0.19610613911132,0.546403028054305,2288,22,"ADAM10, APH1A, APH1B, CNTN1, DLL1, DLL4, UBA52, JAG1, JAG2, MDK, MIB1, MIB2, NCSTN, NEURL1, NEURL1B, NOTCH2, PSEN1, PSEN2, PSENEN"
"540","NOTCH3 Activation and Transmission of Signal to the Nucleus",0.901369863013699,0.910839842472295,-0.115000996611521,-0.307859673462689,4605,25,"YBX1, WWP2, UBC, UBB, TACC3, RPS27A, PSENEN, PSEN2, PSEN1, NOTCH3, NEURL1B, NEURL1, NCSTN, MIB2, MIB1, JAG2, JAG1, UBA52, EGFR, EGF, DLL4, DLL1"
"541","NOTCH3 Intracellular Domain Regulates Transcription",0.413657770800628,0.678445586759412,-0.206874839335796,-0.569455572439401,2107,23,"WWC1, STAT1, SNW1, RBPJ, PLXND1, PBX1, NOTCH3, NOTCH1, MAMLD1, MAML3, MAML2, MAML1, KAT2B, KAT2A, IKZF1, HEY2, HEY1, HES5, HES1"
"542","NOTCH4 Intracellular Domain Regulates Transcription",0.277273643879814,0.673372198452951,0.269579846814539,0.788796974094115,1374,18,"CREBBP, EP300, FLT4, HES1, HES5, HEY1, HEY2, KAT2A, KAT2B, MAML1, MAML2, MAML3, MAMLD1, NOTCH1, NOTCH2"
"543","NR1H2 and NR1H3-mediated signaling",0.388451986754967,0.676036774350512,0.215594178957168,0.496632681953816,1876,38,"ABCA1, ABCG1, ABCG5, AGO1, AGO2, AGO3, AGO4, ANGPTL3, APOD, APOE, ARL4C"
"544","NR1H3 & NR1H2 regulate gene expression linked to cholesterol transport and efflux",0.334830543078808,0.673372198452951,0.238583488433927,0.595832463250108,1639,32,"ABCA1, ABCG1, ABCG5, AGO1, AGO2, AGO3, AGO4, APOD, APOE, ARL4C"
"545","NRAGE signals death through JNK",0.196593474245844,0.673372198452951,0.996871255491945,1.95056021316742,957,54,"ARHGEF3, AATF"
"546","NRIF signals cell death from the nucleus",0.492356561445305,0.698009904216332,-0.218896487617024,-0.655373969944317,2479,15,"UBC, UBB, TRAF6, SQSTM1, RPS27A, PSENEN, PSEN2, PSEN1, NGF, NCSTN, MAPK8, ITGB3BP"
"547","NS1 Mediated Effects on Host Pathways",0.375024238898584,0.676036774350512,-0.345198191008247,-0.769638513422091,1933,40,"TPR, SEH1L, SEC13, RANBP2, RAE1, POM121, POM121C, PABPN1, NUP42, NUP58, NUP98, NUP93, NUP88, NUP85, NUP62, NUP54, NUP50, NUP43, NUP37, NUP35, NUP214, NUP210, NUP205, NUP188, NUP160, NUP155, NUP153, NUP133, NUP107, NDC1, KPNB1, KPNA7, KPNA4, KPNA3, KPNA2, KPNA1"
"548","Neddylation",0.315015321756895,0.673372198452951,0.994817257858249,1.25439835698198,1541,219,"ZBTB16, SOCS2"
"549","Nef-mediates down modulation of cell surface receptors by recruiting them to clathrin adapters",0.182496471062714,0.673372198452951,0.74351765764968,2.17555015877389,904,18,"AP1B1, AP1G1, AP1M1, AP1M2, AP1S1, AP1S2, AP1S3, AP2A1, AP2A2, AP2B1, AP2M1, AP2S1, ARF1, ATP6V1H, B2M, CD28"
"550","Negative epigenetic regulation of rRNA expression",0.450058525165821,0.683159138630472,-0.26308531878078,-0.525025130788275,2306,50,"ZNRD1, UBTF, TWISTNB, TTF1, TBP, TAF1D, TAF1C, TAF1B, TAF1A, SUV39H1, SUDS3, SMARCA5, SIRT1, SIN3B, SIN3A, SAP30L, SAP30BP, SAP30, SAP18, SAP130, RRP8, POLR2L, POLR2K, POLR2H, POLR2F, POLR2E, POLR1E, POLR1D, POLR1C, POLR1B, POLR1A"
"551","Negative regulation of FGFR1 signaling",0.334826645890144,0.673372198452951,-0.237009095638264,-0.597961711463816,1718,29,"UBC, UBB, SRC, SPRY2, RPS27A, PTPN11, PPP2R1A, PPP2CB, PPP2CA, MKNK1, MAPK3, MAPK1, KL, GRB2, UBA52, FRS2, FGFR1, FGF9, FGF5, FGF4, FGF3, FGF23, FGF22, FGF20, FGF17, FGF10, FGF1"
"552","Negative regulation of FGFR2 signaling",0.322183459880977,0.673372198452951,0.249925492340184,0.628774847479199,1569,31,"BRAF, CBL, FGF1, FGF10, FGF16, FGF17, FGF18, FGF20, FGF22, FGF23, FGF3, FGF4, FGF5, FGF7, FGF9, FGFR2, FRS2, UBA52, GRB2"
"553","Negative regulation of FGFR3 signaling",0.333072713057076,0.673372198452951,-0.231859875025534,-0.606096467082689,1703,27,"UBC, UBB, SRC, SPRY2, RPS27A, PTPN11, PPP2R1A, PPP2CB, PPP2CA, MKNK1, MAPK3, MAPK1, GRB2, UBA52, FRS2, FGFR3, FGF9, FGF5, FGF4, FGF23, FGF20, FGF18, FGF17, FGF16, FGF1"
"554","Negative regulation of FGFR4 signaling",0.333072713057076,0.673372198452951,-0.231859875025534,-0.606096467082689,1703,27,"UBC, UBB, SRC, SPRY2, RPS27A, PTPN11, PPP2R1A, PPP2CB, PPP2CA, MKNK1, MAPK3, MAPK1, KLB, GRB2, UBA52, FRS2, FGFR4, FGF9, FGF4, FGF23, FGF20, FGF18, FGF17, FGF16, FGF1"
"555","Negative regulation of MAPK pathway",0.389232673267327,0.676036774350512,0.218140552449258,0.495278415010132,1886,39,"ARAF, BRAF, BRAP, DUSP1, DUSP10, DUSP16, DUSP2, DUSP4, DUSP5, DUSP6, DUSP7, DUSP8, DUSP9, UBA52, HRAS, KRAS, KSR1, MAP2K1, MAP2K2, MAPK1, MAPK3, MARK3, NRAS, PAQR3, PPP2CA, PPP2CB, PPP2R1A, PPP2R1B, PPP2R5A, PPP2R5B, PPP2R5C, PPP2R5D, PPP2R5E, PPP5C"
"556","Negative regulation of MET activity",0.145891226677253,0.673372198452951,-0.995416805048157,-2.79810731228811,734,21,"SH3GL2, HGF"
"557","Negative regulation of NMDA receptor-mediated neuronal transmission",0.137579872204473,0.673372198452951,-0.995218170950389,-2.87141757511169,688,19,"GRIN2B"
"558","Negative regulation of NOTCH4 signaling",0.446571596014847,0.681778857985148,-0.592716713973443,-1.17074650464885,2285,51,"YWHAZ, UBC, UBB, TACC3, SKP1, RPS27A, RBX1, PSMF1, PSME3, PSME2, PSME1, PSMD9, PSMD8, PSMD7, PSMD6, PSMD5, PSMD4, PSMD3, PSMD2, PSMD14, PSMD13, PSMD12, PSMD11, PSMD10, PSMD1, PSMC6, PSMC5, PSMC4, PSMC3, PSMC2, PSMC1, PSMB9, PSMB8, PSMB7, PSMB6, PSMB5, PSMB4, PSMB3, PSMB2, PSMB10, PSMB1, PSMA7, PSMA6, PSMA5, PSMA4, PSMA3, PSMA1"
"559","Negative regulation of the PI3K/AKT network",0.346950629235237,0.673372198452951,-0.995392935834947,-1.47064255146532,1791,99,"NRG1, HGF"
"560","Negative regulators of DDX58/IFIH1 signaling",0.341197114447261,0.673372198452951,-0.23791207024089,-0.586164394856847,1749,31,"UBE2L6, UBE2K, UBE2D3, UBE2D2, UBE2D1, UBC, UBB, UBA7, TRAF3, TNFAIP3, TBK1, TAX1BP1, RPS27A, RNF216, RNF125, PIN1, PCBP2, OTUD5, NLRX1, NLRC5, MAVS, ITCH, ISG15, IRF3, IKBKE, IFIH1"
"561","Nephrin family interactions",0.340785498489426,0.673372198452951,0.2335626512312,0.660360038366126,1691,21,"ACTN1, ACTN2, ACTN3, ACTN4, CASK, CD2AP, FYN, IQGAP1, KIRREL2, KIRREL3, MAGI2, NCK1, NCK2, NPHS1, PIK3CA, PIK3CB, PIK3R1, PIK3R2"
"562","Netrin-1 signaling",0.430913348946136,0.678445586759412,-0.537269881237945,-1.09553314738884,2207,48,"DCC, UNC5C, PTK2"
"563","Neurexins and neuroligins",0.437923250564334,0.680313993017964,0.727781239459724,1.42403657619686,2133,54,"HOMER2, NRXN1, APBA1"
"564","Neurodegenerative Diseases",0.207049345417925,0.673372198452951,0.396838469713071,1.13802145336076,1027,20,"APP, BCL2L11, CAPN1, CAPN2, CAPNS1, CAST, CDC25A, CDC25B, CDC25C, CDK5, CDK5R1"
"565","Neuronal System",0.812087252351411,0.845657788373812,-0.604692830257423,-0.767072793372033,4057,355,"GRIA1, KCNC2, GABRG3, PRKCB, PRKCG, NRG1, CACNA2D3, GABBR2, LRRTM4, GRIP1, GRIN2B, PRKAG2, DLGAP2, GRIK3, GABRA2"
"566","Neurotransmitter receptors and postsynaptic signal transmission",0.705882352941177,0.777749395998142,-0.716205208922638,-0.919784059059308,3611,167,"GRIA1, GABRG3, PRKCB, PRKCG, NRG1, GABBR2, GRIP1, GRIN2B, PRKAG2, GRIK3, GABRA2"
"567","Neurotransmitter release cycle",0.31825624232501,0.673372198452951,0.994943109987358,2.08641643804157,1554,47,"PPFIA2, APBA1, ABAT"
"568","Neutrophil degranulation",0.0691308691308691,0.673372198452951,0.995983662355344,1.28416855204998,345,386,"FTH1, C6orf120"
"569","Nicotinamide salvaging",0.156839388524916,0.673372198452951,-0.539871190491999,-1.61636913055607,789,15,"RNLS, PTGS2, PTGIS, PARP9, PARP8, PARP6, PARP4, PARP16, PARP14, PARP10, NUDT12, NNMT, NAXE, NAXD, NAMPT"
"570","Nicotinate metabolism",0.252446183953033,0.673372198452951,-0.539499036608863,-1.44424832947231,1289,25,"RNLS, QPRT, PTGS2, PTGIS, PARP9, PARP8, PARP6, PARP4, PARP16, PARP14, PARP10, NUDT12, NT5E, NNMT, NMRK2, NMRK1, NMNAT3, NMNAT2, NMNAT1, NAXE, NAXD, NAMPT, NADSYN1, NADK2, NADK"
"571","Nitric oxide stimulates guanylate cyclase",0.187336156483162,0.673372198452951,0.514923896723022,1.50667943625363,928,18,"ITPR1, GUCY1A2"
"572","NoRC negatively regulates rRNA expression",0.434128225175919,0.678445586759412,-0.23870163074793,-0.48899858873056,2220,47,"ZNRD1, UBTF, TWISTNB, TTF1, TBP, TAF1D, TAF1C, TAF1B, TAF1A, SUDS3, SMARCA5, SIN3B, SIN3A, SAP30L, SAP30BP, SAP30, SAP18, SAP130, POLR2L, POLR2K, POLR2H, POLR2F, POLR2E, POLR1E, POLR1D, POLR1C, POLR1B, POLR1A"
"573","Non-integrin membrane-ECM interactions",0.187912541254125,0.673372198452951,0.996475360776751,2.26245295402817,910,39,"PRKCA, NRXN1, ACTN1"
"574","Nonhomologous End-Joining (NHEJ)",0.38205329153605,0.676036774350512,-0.210706926349375,-0.512567712160318,1949,32,"XRCC6, XRCC5, XRCC4, UIMC1, UBE2V2, UBE2N, TP53BP1, TDP2, TDP1, SUMO1, RNF168, RIF1, RAD50, PRKDC, POLM, POLL, PIAS4, PAXIP1, NSD2, NHEJ1, NBN, MRE11, MDC1"
"575","Nonsense Mediated Decay (NMD) enhanced by the Exon Junction Complex (EJC)",0.639195202166763,0.740090160111923,-0.485757483356203,-0.763866894781837,3303,84,"UPF3B, UPF3A, UPF2, UPF1, SMG9, SMG8, SMG7, SMG6, SMG5, SMG1, RPSA, RPS9, RPS8, RPS7, RPS5, RPS4X, RPS3A, RPS28, RPS27L, RPS27A, RPS25, RPS24, RPS21, RPS20, RPS19, RPS17, RPS16, RPS15A, RPS15, RPS14, RPS13, RPS12, RPS11, RPLP1, RPL8, RPL7A, RPL6, RPL5, RPL4, RPL3L, RPL38, RPL37A, RPL36, RPL35, RPL34, RPL32, RPL30, RPL3, RPL29, RPL28, RPL27, RPL26, RPL23, RPL22L1, RPL19, RPL18A, RPL18, RPL14, RPL13A, RPL12, RPL11, RPL10A, RPL10, RNPS1"
"576","Nonsense Mediated Decay (NMD) independent of the Exon Junction Complex (EJC)",0.52656158785756,0.707880762329477,-0.570035638156142,-1.01071853667767,2705,64,"UPF1, RPSA, RPS9, RPS8, RPS7, RPS5, RPS4X, RPS3A, RPS28, RPS27L, RPS27A, RPS25, RPS24, RPS21, RPS20, RPS19, RPS17, RPS16, RPS15A, RPS15, RPS14, RPS13, RPS12, RPS11, RPLP1, RPL8, RPL7A, RPL6, RPL5, RPL4, RPL3L, RPL38, RPL37A, RPL36, RPL35, RPL34, RPL32, RPL30, RPL3, RPL29, RPL28, RPL27, RPL26, RPL23, RPL22L1, RPL19, RPL18A, RPL18, RPL14, RPL13A, RPL12, RPL11, RPL10A, RPL10"
"577","Nonsense-Mediated Decay (NMD)",0.639195202166763,0.740090160111923,-0.485757483356203,-0.763866894781837,3303,84,"UPF3B, UPF3A, UPF2, UPF1, SMG9, SMG8, SMG7, SMG6, SMG5, SMG1, RPSA, RPS9, RPS8, RPS7, RPS5, RPS4X, RPS3A, RPS28, RPS27L, RPS27A, RPS25, RPS24, RPS21, RPS20, RPS19, RPS17, RPS16, RPS15A, RPS15, RPS14, RPS13, RPS12, RPS11, RPLP1, RPL8, RPL7A, RPL6, RPL5, RPL4, RPL3L, RPL38, RPL37A, RPL36, RPL35, RPL34, RPL32, RPL30, RPL3, RPL29, RPL28, RPL27, RPL26, RPL23, RPL22L1, RPL19, RPL18A, RPL18, RPL14, RPL13A, RPL12, RPL11, RPL10A, RPL10, RNPS1"
"578","Norepinephrine Neurotransmitter Release Cycle",0.0634057971014493,0.673372198452951,0.997808619430241,2.9357104140005,314,17,"PPFIA2, CPLX1"
"579","Notch-HLH transcription pathway",0.0435939418747442,0.673372198452951,0.998936806432321,2.63539066311611,212,27,"HDAC9, CREBBP"
"580","Nuclear Envelope Breakdown",0.429449109154208,0.678445586759412,0.672556820081243,1.35270674985358,2096,51,"PRKCA, AAAS"
"581","Nuclear Events (kinase and transcription factor activation)",0.161061946902655,0.673372198452951,-0.99541589157587,-2.70525413827858,818,24,"MEF2C"
"582","Nuclear Pore Complex (NPC) Disassembly",0.33639382691932,0.673372198452951,-0.459861141451461,-1.08671021327231,1721,35,"TPR, SEH1L, SEC13, RANBP2, RAE1, POM121, POM121C, NUP42, NUP58, NUP98, NUP93, NUP88, NUP85, NUP62, NUP54, NUP50, NUP43, NUP37, NUP35, NUP214, NUP210, NUP205, NUP188, NUP160, NUP155, NUP153, NUP133, NUP107, NEK9, NEK7, NEK6, NDC1"
"583","Nuclear Receptor transcription pathway",0.278735632183908,0.673372198452951,0.995409487060076,2.11946625197575,1357,45,"NR3C2, RORA, AR"
"584","Nuclear import of Rev protein",0.316418495297806,0.673372198452951,-0.483689510768413,-1.17662779399774,1614,32,"TPR, SEH1L, SEC13, RCC1, RANBP2, RAE1, POM121, POM121C, NUP42, NUP58, NUP98, NUP93, NUP88, NUP85, NUP62, NUP54, NUP50, NUP43, NUP37, NUP35, NUP214, NUP210, NUP205, NUP188, NUP160, NUP155, NUP153, NUP133, NUP107"
"585","Nuclear signaling by ERBB4",0.135503996880484,0.673372198452951,-0.99674310402127,-2.45576156688811,694,31,"NRG1"
"586","Nucleobase catabolism",0.182881653343732,0.673372198452951,-0.995812562313061,-2.45346891138421,937,31,"DPYD"
"587","Nucleosome assembly",0.244254626804962,0.673372198452951,0.425480556293737,1.15877416783074,1200,24,"CENPA, CENPC, CENPH, CENPI, CENPK, CENPL, CENPM, CENPN, CENPO, CENPP, CENPQ, CENPT, CENPU, CENPW"
"588","Nucleotide Excision Repair",0.740690193020082,0.798918299216593,-0.141538295565228,-0.201171065517407,3798,109,"ZNF830, YY1, XRCC1, XPC, XPA, XAB2, UVSSA, USP7, USP45, UBE2V2, UBE2N, UBE2I, UBC, UBB, TFPT, TCEA1, SUMO2, SUMO1, RUVBL1, RPS27A, RPA3, RPA2, RPA1, RNF111, RFC5, RFC4, RFC3, RFC2, RFC1, RBX1, RAD23B, RAD23A, PRPF19, PPIE, POLR2L, POLR2K, POLR2J, POLR2I, POLR2H, POLR2G, POLR2F, POLR2E, POLR2D, POLR2C, POLR2B, POLR2A, POLK, POLE4, POLE3, POLE2, POLE, POLD4, POLD2, POLD1, PIAS3, PIAS1, PCNA, PARP2, PARP1"
