"","pathway","pval","padj","ES","NES","nMoreExtreme","size","leadingEdge"
"455","MAPK1/MAPK3 signaling",0.000201734920314706,0.000551454923716307,0.18314068875317,3.06688108163176,0,211,"ACTN2, ANGPT1, APBB1IP, ARAF, AREG, ARRB1, ARRB2, ARTN, BRAF, BRAP, CALM1, CAMK2A, CAMK2B, CAMK2G, CNKSR2, CSF2RA, CSF2RB, CSK, CUL3, DAB2IP, DLG1, DLG2, DLG3, DLG4, DUSP1, DUSP10, DUSP16, DUSP4, DUSP5, DUSP6, DUSP7, DUSP8, EGF, EGFR, ERBB2, ERBB3, ERBB4, FGF1, FGF10, FGF18, FGF2, FGF20, FGF22, FGF23, FGF4, FGF5, FGF7, FGF9, FGFR1, FGFR2, FGFR3, FGFR4, FLT3, FLT3LG, FN1, FRS2, FRS3, FYN, GFRA1, GFRA2, GFRA4, UBA52, GRB2, GRIN1, GRIN2B, GRIN2D, HBEGF, HGF, HRAS, IL17RD, IL2, IL2RA, IL5, IL5RA, IL6R, IL6ST, IQGAP1, IRS1, IRS2, ITGA2B, ITGB3, JAK1, JAK2, JAK3, KBTBD7, KIT, KITLG, KL, KLB, KRAS, KSR1, KSR2, LAMTOR2, LAMTOR3, LAT, LRRC7, MAP2K1, MAP2K2, MAP3K11, MAPK1, MAPK3, MARK3, NCAM1, NEFL, NF1, NRAS, NRG1, NRG2, NRG3, NRG4, PAQR3, PDGFA, PDGFB, PDGFRB, PEA15, PHB, PPP2CA, PPP2CB, PPP2R1A, PPP2R1B, PPP2R5A, PPP2R5B, PPP2R5C, PPP2R5D, PPP2R5E, PPP5C, PSMA1, PSMA3, PSMA4, PSMA5, PSMA6, PSMA7, PSMB1, PSMB10, PSMB2, PSMB3, PSMB4, PSMB5, PSMB6, PSMB7, PSMB8, PSMC1, PSMC2, PSMC3, PSMC4, PSMC5, PSMC6, PSMD1, PSMD10, PSMD11, PSMD12, PSMD13, PSMD14, PSMD2, PSMD3, PSMD4, PSMD5, PSMD6, PSMD7, PSMD8, PSMD9, PSME1, PSME2, PSME3, PSME4, PSMF1, PTK2, PTPN11, PTPRA, RAF1, RANBP9, RAP1A, RAP1B, RAPGEF2, RASA1, RASA2, RASA3, RASA4, RASAL1, RASAL2, RASAL3, RASGEF1A, RASGRF1, RASGRF2, RASGRP1"
"456","MAPK6/MAPK4 signaling",0.000197706603400554,0.000551454923716307,-0.325010007678022,-3.34763067159343,0,77,"XPO1, UBC, UBB, TNRC6C, TNRC6B, TNRC6A, SEPTIN7, RPS27A, RAC1, PSMF1, PSME4, PSME3, PSME2, PSME1, PSMD9, PSMD8, PSMD7, PSMD6, PSMD5, PSMD4, PSMD3, PSMD2, PSMD14, PSMD13, PSMD12, PSMD11, PSMD10, PSMD1, PSMC6, PSMC5, PSMC4, PSMC3, PSMC2, PSMC1, PSMB8, PSMB7, PSMB6, PSMB5, PSMB4, PSMB3, PSMB2, PSMB10, PSMB1, PSMA7, PSMA6, PSMA5, PSMA4, PSMA3, PSMA1, PRKACB, PRKACA"
"457","MET activates PTK2 signaling",0.00724054706355591,0.0122199266056027,0.419163971733142,1.95925328021116,35,15,"HGF, ITGA2, ITGA3, ITGB1, LAMA1, LAMA2, LAMA3, LAMA4, LAMA5, LAMB1, LAMB3, LAMC1, LAMC2"
"458","MET promotes cell motility",0.0388095716871104,0.0527851738073684,0.272535059331176,1.63123088430851,192,25,"CRK, CRKL, DOCK7, GAB1, GRB2, HGF, ITGA2, ITGA3, ITGB1, LAMA1, LAMA2, LAMA3, LAMA4, LAMA5, LAMB1, LAMB3, LAMC1, LAMC2"
"459","MHC class II antigen presentation",0.000202020202020202,0.000551454923716307,0.391749994874168,4.1284426374517,0,81,"ACTR10, ACTR1A, ACTR1B, AP1B1, AP1G1, AP1M1, AP1S1, AP1S2, AP1S3, AP2A1, AP2A2, AP2B1, AP2M1, AP2S1, ARF1, CANX, CAPZA1, CAPZA2, CAPZB, CD74, CLTA, CLTC, CTSA, CTSB, CTSC, CTSF, CTSH, CTSK, CTSO, CTSS, DCTN1, DCTN2, DCTN3, DCTN4, DCTN5, DCTN6, DNM1, DNM2, DNM3, DYNC1H1, DYNC1I1, DYNC1I2, DYNC1LI1, DYNC1LI2, DYNLL1, DYNLL2, HLA-DMA, HLA-DOA, KIF11, KIF15, KIF18A, KIF20A, KIF22, KIF23, KIF2A, KIF3A, KIF3B, KIF3C, KIF4A, KIF5A, KIF5B, KIF5C, KIFAP3, KLC1, KLC2, KLC3, KLC4"
"460","Macroautophagy",0.312889603860849,0.336754065172269,0.0953684046012873,1.10436595655254,1555,99,"AMBRA1, ARL13B, ATG10, ATG101, ATG12, ATG13, ATG14, ATG16L1, ATG3, ATG4A, ATG4B, ATG4C, ATG4D, ATG5, ATG7, ATG9A, ATG9B, CHMP2A, CHMP2B, CHMP3, CHMP4B, CHMP4C, CHMP6, CHMP7, CSNK2A1, CSNK2A2, CSNK2B, DYNC1H1, DYNC1I1, DYNC1I2, DYNC1LI1, DYNC1LI2, DYNLL1, DYNLL2"
"461","Major pathway of rRNA processing in the nucleolus and cytosol",0.000200440970134295,0.000551454923716307,-0.312922848839262,-4.41389757547566,0,148,"XRN2, WDR75, WDR46, WDR43, WDR36, WDR3, WDR18, WDR12, UTP6, UTP4, UTP3, UTP20, UTP18, UTP15, UTP14C, UTP14A, UTP11, TSR1, TEX10, TBL3, SNU13, SENP3, RRP9, RRP7A, RRP36, RRP1, RPSA, RPS9, RPS8, RPS7, RPS5, RPS4X, RPS3A, RPS28, RPS27L, RPS27A, RPS25, RPS24, RPS21, RPS20, RPS19, RPS17, RPS16, RPS15A, RPS15, RPS14, RPS13, RPS12, RPS11, RPP40, RPP38, RPP30, RPP25, RPP21, RPP14, RPLP1, RPL8, RPL7A, RPL6, RPL5, RPL4, RPL3L, RPL38, RPL37A, RPL36, RPL35, RPL34, RPL32, RPL30, RPL3, RPL29, RPL28, RPL27, RPL26, RPL23, RPL22L1, RPL19, RPL18A, RPL18, RPL14, RPL13A, RPL12, RPL11, RPL10A, RPL10, RIOK3, RIOK2, RIOK1"
"462","Meiosis",0.00157915515199368,0.00337306758252977,-0.254447174447175,-2.23257860396835,7,55,"PRDM9, UBE2I, TOP3A, TINF2, TEX15, TERF2IP, TERF2, TERF1, SYNE2, SYNE1, SYCP3, SYCP2, SYCP1, SYCE2, SUN2, SUN1, STAG3, STAG2, STAG1, SMC3, SMC1B, SMC1A, RPA3, RPA2, RPA1, REC8, RBBP8, RAD51C, RAD51, RAD50, RAD21"
"463","Meiotic recombination",0.219235364396655,0.244457719368114,-0.200147162963619,-1.21539132433191,1100,26,"PRDM9, TOP3A, TEX15, RPA3, RPA2, RPA1, RBBP8, RAD51C, RAD51, RAD50, PSMC3IP, NBN, MSH5, MSH4, MRE11, MND1, MLH3, MLH1"
"464","Meiotic synapsis",0.00019952114924182,0.000551454923716307,-0.430815347721823,-2.79573008578437,0,30,"UBE2I, TINF2, TERF2IP, TERF2, TERF1, SYNE2, SYNE1, SYCP3, SYCP2, SYCP1, SYCE2, SUN2, SUN1, STAG3, STAG2, STAG1, SMC3, SMC1B, SMC1A"
"465","Metabolic disorders of biological oxidation enzymes",0.111021721641191,0.133173635404309,0.300658761528327,1.40533706251744,551,15,"AHCY, CYP26B1, CYP27A1, CYP2R1, CYP2U1, CYP7B1, FDX1, GCLC, GCLM, GSS"
"466","Metabolism of amino acids and derivatives",0.000197941409342835,0.000551454923716307,-0.185442611378029,-3.5141072516829,0,273,"TYRP1, TYR, TXNRD1, TXN2, TST, TPO, TMLHE, TDO2, SRR, SRM, SMS, SMOX, SLC7A5, SLC6A8, SLC6A7, SLC6A12, SLC6A11, SLC5A5, SLC44A1, SLC3A2, SLC36A4, SLC25A21, SLC25A15, SLC25A13, SLC25A12, SHMT1, SERINC5, SERINC4, SERINC3, SERINC2, SERINC1, SEPSECS, SEPHS2, SECISBP2, SDSL, SCLY, SAT1, RPSA, RPS9, RPS8, RPS7, RPS5, RPS4X, RPS3A, RPS28, RPS27L, RPS27A, RPS25, RPS24, RPS21, RPS20, RPS19, RPS17, RPS16, RPS15A, RPS15, RPS14, RPS13, RPS12, RPS11, RPLP1, RPL8, RPL7A, RPL6, RPL5, RPL4, RPL3L, RPL38, RPL37A, RPL36, RPL35, RPL34, RPL32, RPL30, RPL3, RPL29, RPL28, RPL27, RPL26, RPL23, RPL22L1, RPL19, RPL18A, RPL18, RPL14, RPL13A, RPL12, RPL11, RPL10A, RPL10, RIMKLB, RIMKLA, RIDA, QDPR, PYCR2, PYCR1, PXMP2, PSTK, PSPH, PSMF1, PSME4, PSME3, PSME2, PSME1, PSMD9, PSMD8, PSMD7, PSMD6, PSMD5, PSMD4, PSMD3, PSMD2, PSMD14, PSMD13, PSMD12, PSMD11, PSMD10, PSMD1, PSMC6, PSMC5, PSMC4, PSMC3, PSMC2, PSMC1, PSMB8, PSMB7, PSMB6, PSMB5, PSMB4, PSMB3, PSMB2, PSMB10, PSMB1, PSMA7, PSMA6, PSMA5, PSMA4, PSMA3, PSMA1, PSAT1"
"467","Metabolism of carbohydrates",0.00100725221595488,0.00224916099211023,0.126334677293776,2.2714635512219,4,244,"AAAS, ABCC5, ACAN, ADPGK, AGL, AGRN, AKR1A1, AKR1B1, ALDH1A1, ALDOA, ALDOB, ALDOC, ARSB, B3GALT1, B3GALT2, B3GALT4, B3GALT5, B3GALT6, B3GAT1, B3GAT2, B3GAT3, B3GNT2, B4GALNT2, B4GALT1, B4GALT2, B4GALT3, B4GALT4, B4GALT5, B4GALT6, B4GALT7, BCAN, BPGM, CALM1, CD44, CEMIP, CHP1, CHPF, CHPF2, CHST1, CHST11, CHST12, CHST13, CHST2, CHST3, CHST7, CHST9, CHSY1, CHSY3, CRYL1, CSGALNACT1, CSGALNACT2, CSPG5, DCN, DERA, DSE, DSEL, ENO1, ENO2, ENO3, EPM2A, EXT1, EXT2, FBP1, FMOD, FUT10, FUT11, FUT9, G6PC3, G6PD, GAA, GALE, GALK1, GAPDH, GAPDHS, GBE1, GCK, GLB1, GLB1L, GLCE, UBA52, GNPDA1, GNPDA2, GNS, GOT1, GOT2, GPC1, GPC3, GPC4, GPC5, GPC6, GPI, GUSB, GYG1, GYS1, GYS2, HAS1, HAS3, HEXA, HEXB, HK1, HK2, HMMR, HPSE, HPSE2, HS2ST1, HS3ST1, HS3ST2, HS3ST4, HS3ST5, HS6ST1, HS6ST2, HS6ST3, HSPG2, HYAL2, IDS, IDUA, KHK, LUM, MAN2B1, MAN2B2, MAN2C1, MANBA, MDH1, MDH2, NAGLU, NCAN, NDC1, NDST1, NDST2, NDST3, NDST4, NHLRC1, NUP107, NUP133, NUP153, NUP155, NUP160, NUP188, NUP205, NUP210, NUP214, NUP35, NUP37, NUP43, NUP50, NUP54, NUP85, NUP88, NUP93, NUP98, NUP58, NUP42, OGN, OMD, PAPSS1, PAPSS2, PCK2, PC, PFKFB1, PFKFB2, PFKFB3, PFKFB4, PFKL, PFKM, PFKP, PGAM1, PGD, PGK1, PGLS, PGM1, PGM2, PGM2L1, PGP, PHKA1, PHKA2, PHKB, PHKG1, PHKG2, PKM, POM121, POM121C, PPP1R3C, PPP2CA, PPP2CB, PPP2R1A, PPP2R1B, PPP2R5D, PRKACA, PRKACB, PRPS1, PRPS2, PYGB, PYGL, RAE1, RANBP2, RBKS, RHD, RHCE, RPEL1, RPE, RPIA, RPS27A, SDC2, SDC3, SDC4, SEC13, SEH1L, SGSH, SHPK, SLC25A1, SLC25A11, SLC25A12, SLC25A13, SLC26A1, SLC26A2, SLC2A1, SLC35B2, SLC35B3, SLC35D2, SLC37A1, SLC37A2, SLC37A4"
"468","Metabolism of cofactors",0.0707273091564817,0.0894881022453118,0.30322043285797,1.50727853496865,352,17,"AKT1, CALM1, COQ2, COQ3, COQ5, COQ6, COQ7, COQ9, DHFR"
"469","Metabolism of fat-soluble vitamins",0.432293722858271,0.452327932465503,-0.143360921194674,-1.00834692439837,2189,35,"VKORC1L1, UBIAD1, TTR, TTPA, SDC4, SDC3, SDC2, RETSAT, RDH11, RBP4, RBP2, RBP1, PNLIP, PLB1, LRP8, LRP2, LRP12, LRP10, LRP1, LPL, LDLR, HSPG2, GPC6, GPC5, GPC4, GPC3, GPC1, VKORC1"
"470","Metabolism of folate and pterines",0.350069735006974,0.373211805631779,0.221970677015955,1.0742923683901,1756,16,"ALDH1L1, ALDH1L2, DHFR, DHFR2, FOLR2, FPGS, MTHFD1, MTHFD1L, MTHFD2, MTHFD2L, MTHFR, MTHFS"
"471","Metabolism of non-coding RNA",0.000198452073824171,0.000551454923716307,-0.382012411621229,-3.16744988162473,0,49,"TPR, TGS1, SNUPN, SNRPG, SNRPF, SNRPD3, SNRPD2, SNRPD1, SNRPB, SMN1, SEH1L, SEC13, RANBP2, RAE1, PRMT5, POM121C, POM121, PHAX, NUP42, NUP58, NUP98, NUP93, NUP88, NUP85, NUP54, NUP50, NUP43, NUP37, NUP35, NUP214, NUP210, NUP205, NUP188, NUP160, NUP155, NUP153, NUP133, NUP107, NDC1, NCBP2, NCBP1"
"472","Metabolism of nucleotides",0.00847286665321767,0.0140660662086097,0.182015851374009,1.94130257138903,41,83,"ADA, ADAL, ADK, ADPRM, ADSL, AGXT2, AK1, AK2, AK4, AK5, AK7, AK8, AK9, AMPD2, AMPD3, APRT, ATIC, CAD, CDA, CMPK1, CTPS1, CTPS2, DCK, DCTD, DCTPP1, DGUOK, DHODH, DPYD, DPYS, DTYMK, DUT, ENTPD1, ENTPD3, ENTPD5, ENTPD6, ENTPD7, GART, GDA, GLRX, GMPR, GMPR2, GMPS, GPX1, GSR, GUK1, HPRT1, IMPDH1, IMPDH2, ITPA, LHPP, NME4, NT5C, NT5C2, NT5C3A, NT5E, NT5M, NUDT1, NUDT13, NUDT15, NUDT16, NUDT18, NUDT5, NUDT9"
"473","Metabolism of polyamines",0.000199004975124378,0.000551454923716307,-0.514124770048444,-4.42055637073319,0,53,"SRM, SMS, SMOX, SAT1, PSMF1, PSME4, PSME3, PSME2, PSME1, PSMD9, PSMD8, PSMD7, PSMD6, PSMD5, PSMD4, PSMD3, PSMD2, PSMD14, PSMD13, PSMD12, PSMD11, PSMD10, PSMD1, PSMC6, PSMC5, PSMC4, PSMC3, PSMC2, PSMC1, PSMB8, PSMB7, PSMB6, PSMB5, PSMB4, PSMB3, PSMB2, PSMB10, PSMB1, PSMA7, PSMA6, PSMA5, PSMA4, PSMA3, PSMA1, PAOX, ODC1, OAZ3, OAZ2, OAZ1, NQO1"
"474","Metabolism of porphyrins",0.001999600079984,0.00410422965911868,0.415312724658519,2.22987963050312,9,20,"ABCC1, ABCG2, ALAD, ALAS1, ALAS2, ALB, BLVRA, BLVRB, COX10, CPOX, FECH, FLVCR1, GUSB, HMBS, HMOX1, HMOX2"
"475","Metabolism of steroid hormones",0.0134457154324704,0.0212124951543322,-0.38138745148771,-1.83160649615139,66,16,"TSPOAP1, TSPO, STARD6, STARD4, STARD3NL, STARD3, STAR, SRD5A3, SRD5A1"
"476","Metabolism of steroids",0.138950331791675,0.161525786155998,-0.110876648606355,-1.33997295915122,690,108,"VDR, UBE2I, TSPOAP1, TSPO, TM7SF2, TGS1, TBL1XR1, TBL1X, SUMO2, STARD6, STARD5, STARD4, STARD3NL, STARD3, STAR, SREBF2, SREBF1, SRD5A3, SRD5A1, SQLE, SP1, SMARCD3, SLCO1A2, SLC27A2, SLC10A1, SEC24D, SEC24B, SEC24A, SEC23A, SCP2, SCD, SCAP, SC5D, SAR1B, PTGIS, PPARA, PMVK, PLPP6, PIAS4, OSBPL9, OSBPL7, OSBPL6, OSBPL3, OSBPL2, OSBPL1A, OSBP, NSDHL, NFYC, NFYB, NFYA, NCOA6, NCOA2, NCOA1, MVK, MVD, MTF1, MSMO1, MED1, MBTPS2, MBTPS1, LSS, LRP2, LGMN, LBR, KPNB1, INSIG2, INSIG1, IDI2, IDI1, HSD3B1, HSD3B2, HSD17B7, HSD17B4, HSD17B12, HSD17B11, HSD11B1, HMGCS1, HMGCR, HELZ2"
"477","Metabolism of vitamins and cofactors",0.000802407221664995,0.00183190058333232,0.167034716936947,2.40984729289787,3,155,"AASDHPPT, ABCC1, ABCD4, ACACA, ACACB, AGRN, AKR1B10, AKT1, ALDH1L1, ALDH1L2, AMN, AOX1, APOA1, APOE, APOM, BCO1, BCO2, BTD, CALM1, CBLIF, CD320, CD38, COASY, COQ2, COQ3, COQ5, COQ6, COQ7, COQ9, CUBN, CYB5A, CYB5R3, DHFR, DHFR2, ENPP1, ENPP2, ENPP3, FASN, FLAD1, FOLR2, FPGS, GCH1, VKORC1, GPC1, GPC3, GPC4, GPC5, GPC6, GPHN, GSTO1, GSTO2, HLCS, HSPG2, IDH1, LDLR, LMBRD1, LPL, LRP1, LRP10, LRP12, LRP2, LRP8, MCCC1, MCCC2, MMAA, MMAB, MMACHC, MMADHC, MMUT, MOCOS, MOCS1, MOCS2, MOCS3, MTHFD1, MTHFD1L, MTHFD2, MTHFD2L, MTHFR, MTHFS, MTR, MTRR, NADK, NADK2, NADSYN1, NAMPT, NAXD, NAXE, NFS1, NMNAT1, NMNAT2, NMNAT3, NMRK1, NNMT, NOS3, NT5E, NUDT12, PANK1, PANK2, PANK3, PANK4, PARP10, PARP14, PARP16, PARP4, PARP6, PARP8, PARP9, PCCA, PCCB, PC, PDSS1, PDSS2, PDXK, PDZD11, PLB1, PNLIP, PNPO, PPCDC, PPCS, PRKG2, PRSS1, PRSS3, PTGIS, PTGS2, PTS, RBP1, RBP2, RBP4, RDH11, RETSAT, RFK, RNLS, SDC2, SDC3, SDC4, SHMT1, SHMT2, SLC19A1, SLC19A2, SLC23A1, SLC23A2, SLC25A16, SLC25A19, SLC25A32, SLC2A1, SLC52A2, SLC52A1, SLC5A6"
"478","Metabolism of water-soluble vitamins and cofactors",0.000602046959662854,0.0014318611658394,0.192544147592607,2.2778194186739,2,104,"AASDHPPT, ABCC1, ABCD4, ACACA, ACACB, ALDH1L1, ALDH1L2, AMN, AOX1, BTD, CBLIF, CD320, CD38, COASY, CUBN, CYB5A, CYB5R3, DHFR, DHFR2, ENPP1, ENPP2, ENPP3, FASN, FLAD1, FOLR2, FPGS, GPHN, GSTO1, GSTO2, HLCS, LMBRD1, MCCC1, MCCC2, MMAA, MMAB, MMACHC, MMADHC, MMUT, MOCOS, MOCS1, MOCS2, MOCS3, MTHFD1, MTHFD1L, MTHFD2, MTHFD2L, MTHFR, MTHFS, MTR, MTRR, NADK, NADK2, NADSYN1, NAMPT, NAXD, NAXE, NFS1, NMNAT1, NMNAT2, NMNAT3, NMRK1, NNMT, NT5E, NUDT12, PANK1, PANK2, PANK3, PANK4, PARP10, PARP14, PARP16, PARP4, PARP6, PARP8, PARP9, PCCA, PCCB, PC, PDXK, PDZD11, PNPO, PPCDC, PPCS, PRSS1, PRSS3, PTGIS, PTGS2, RFK, RNLS, SHMT1, SHMT2, SLC19A1, SLC19A2, SLC23A1, SLC23A2, SLC25A16, SLC25A19, SLC25A32, SLC2A1, SLC52A2, SLC52A1, SLC5A6"
"479","Metal ion SLC transporters",0.000200803212851406,0.000551454923716307,-0.721000798308041,-3.77230461011349,0,19,"SLC41A2, SLC41A1, SLC39A6, SLC39A3, SLC39A2, SLC39A14, SLC39A10, SLC39A1, SLC31A1, SLC30A8, SLC30A7, SLC30A6, SLC30A5, SLC30A3, SLC30A10, SLC30A1, SLC11A2, SLC11A1"
"480","Metalloprotease DUBs",0.359642147117296,0.383015116846093,-0.226590010779734,-1.06181827215937,1808,15,"UIMC1, UBC, UBB, STAMBPL1, STAMBP, STAM"
"481","MicroRNA (miRNA) biogenesis",0.0277611344118234,0.0393928946402411,-0.297244740684235,-1.69901566919254,138,23,"XPO5, TARBP2, PRKRA, POLR2L, POLR2K, POLR2J, POLR2I, POLR2H, POLR2G, POLR2F, POLR2E, POLR2D, POLR2C, POLR2B, POLR2A"
"482","Miscellaneous transport and binding events",0.0135972805438912,0.021418351988517,0.341480948957585,1.83346516269514,67,20,"ADD1, ADD2, ADD3, ANKH, CTNS, DMTN, LRRC8A, LRRC8B, LRRC8C, LRRC8D, MAGT1, MMGT1, MRS2, NIPA1, NIPA2, NIPAL2, NIPAL3, NIPAL4"
"483","Misspliced GSK3beta mutants stabilize beta-catenin",0.0460579243765084,0.0610898840294159,0.344304707150557,1.60934663369956,228,15,"AMER1, APC, AXIN1, CSNK1A1, CTNNB1, GSK3B, PPP2CA, PPP2CB, PPP2R1A, PPP2R1B, PPP2R5A, PPP2R5B, PPP2R5C, PPP2R5D, PPP2R5E"
"484","Mitochondrial Fatty Acid Beta-Oxidation",0.000201612903225806,0.000551454923716307,0.478845877104619,3.21572856776283,0,32,"ACAA2, ACAD10, ACAD11, ACADL, ACADM, ACADS, ACADVL, ACBD6, ACOT11, ACOT12, ACOT13, ACOT2, ACOT1, ACOT7, ACOT9, ACSF2"
"485","Mitochondrial biogenesis",0.0108411965468781,0.0174282526766269,0.175127992692201,1.89597246953211,53,85,"ACSS2, ALAS1, APOO, APOOL, ATF2, ATP5F1A, ATP5F1B, ATP5F1C, ATP5F1D, ATP5F1E, ATP5MC3, ATP5PD, ATP5PF, ATP5MF, ATP5ME, ATP5MG, ATP5PO, CALM1, CAMK4, CARM1, CHCHD3, CHCHD6, CHD9, CREB1, CREBBP, CRTC1, CRTC2, CRTC3, CYCS, DMAC2L, DNAJC11, ESRRA, GABPA, GABPB1, GLUD2, GLUD1, HCFC1, HDAC3, HELZ2, HSPA9, IDH2, IMMT, MAPK11, MAPK12, MAPK14, MED1, MEF2C, MEF2D, MICOS10, MICOS13, MTERF1, MTX1, MTX2, NCOA1, NCOA2, NCOA6, NCOR1, NR1D1, NRF1, POLG2, POLRMT, PPARA, PPARGC1A, PPARGC1B, PPRC1, PRKAA2, PRKAB1, PRKAB2, PRKAG1, PRKAG2, PRKAG3"
"486","Mitochondrial calcium ion transport",0.00943964651536453,0.0154439305307735,-0.358209312914899,-1.96149301958794,46,21,"YME1L1, VDAC3, VDAC2, VDAC1, STOML2, SMDT1, SLC8B1, SLC8A3, PMPCB, PMPCA, PHB2, PHB, PARL, MICU3, MICU2, MICU1, MCUB, MCU, LETM1"
"487","Mitochondrial protein import",0.0270430319778918,0.0384814012458517,-0.195308763308763,-1.71368444974102,136,55,"VDAC1, TOMM70, TOMM7, TOMM40, TOMM22, TOMM20, TIMM9, TIMM8B, TIMM8A, TIMM50, TIMM44, TIMM23, TIMM22, TIMM21, TIMM17B, TIMM17A, TIMM13, TIMM10"
"488","Mitochondrial tRNA aminoacylation",0.955421686746988,0.956362988901418,-0.110071923392696,-0.575900643983648,4757,19,"YARS2, WARS2, VARS2, TARS2, SARS2, RARS2, PPA2, PARS2, NARS2, MARS2, LARS2, KARS1, IARS2, HARS2"
"489","Mitochondrial translation",0.000199760287654814,0.000551454923716307,-0.443128949957478,-4.93567360360006,0,91,"TUFM, TSFM, PTCD3, OXA1L, MTRF1L, MTIF3, MTIF2, MTFMT, MRRF, MRPS9, MRPS7, MRPS5, MRPS36, MRPS35, MRPS34, MRPS33, MRPS31, MRPS30, MRPS28, MRPS27, MRPS26, MRPS25, MRPS24, MRPS23, MRPS22, MRPS21, MRPS2, MRPS18C, MRPS18B, MRPS18A, MRPS17, MRPS16, MRPS15, MRPS14, MRPS12, MRPS11, MRPS10, MRPL9, MRPL58, MRPL57, MRPL55, MRPL54, MRPL52, MRPL51, MRPL50, MRPL49, MRPL48, MRPL47, MRPL46, MRPL45, MRPL44, MRPL43, MRPL42, MRPL41, MRPL40, MRPL4, MRPL39, MRPL38, MRPL37, MRPL36, MRPL35, MRPL34, MRPL32, MRPL30, MRPL3, MRPL28, MRPL27, MRPL24, MRPL23, MRPL22, MRPL21, MRPL20, MRPL2, MRPL19, MRPL18, MRPL17, MRPL16, MRPL15, MRPL14, MRPL13, MRPL12, MRPL11, MRPL10, MRPL1"
"490","Mitochondrial translation elongation",0.000199163513244374,0.000551454923716307,-0.449310645168143,-4.83810457061801,0,85,"TUFM, TSFM, PTCD3, OXA1L, MRPS9, MRPS7, MRPS5, MRPS36, MRPS35, MRPS34, MRPS33, MRPS31, MRPS30, MRPS28, MRPS27, MRPS26, MRPS25, MRPS24, MRPS23, MRPS22, MRPS21, MRPS2, MRPS18C, MRPS18B, MRPS18A, MRPS17, MRPS16, MRPS15, MRPS14, MRPS12, MRPS11, MRPS10, MRPL9, MRPL58, MRPL57, MRPL55, MRPL54, MRPL52, MRPL51, MRPL50, MRPL49, MRPL48, MRPL47, MRPL46, MRPL45, MRPL44, MRPL43, MRPL42, MRPL41, MRPL40, MRPL4, MRPL39, MRPL38, MRPL37, MRPL36, MRPL35, MRPL34, MRPL32, MRPL30, MRPL3, MRPL28, MRPL27, MRPL24, MRPL23, MRPL22, MRPL21, MRPL20, MRPL2, MRPL19, MRPL18, MRPL17, MRPL16, MRPL15, MRPL14, MRPL13, MRPL12, MRPL11, MRPL10, MRPL1"
"491","Mitochondrial translation initiation",0.000199163513244374,0.000551454923716307,-0.461147579291738,-4.96556276841797,0,85,"PTCD3, OXA1L, MTIF3, MTIF2, MTFMT, MRPS9, MRPS7, MRPS5, MRPS36, MRPS35, MRPS34, MRPS33, MRPS31, MRPS30, MRPS28, MRPS27, MRPS26, MRPS25, MRPS24, MRPS23, MRPS22, MRPS21, MRPS2, MRPS18C, MRPS18B, MRPS18A, MRPS17, MRPS16, MRPS15, MRPS14, MRPS12, MRPS11, MRPS10, MRPL9, MRPL58, MRPL57, MRPL55, MRPL54, MRPL52, MRPL51, MRPL50, MRPL49, MRPL48, MRPL47, MRPL46, MRPL45, MRPL44, MRPL43, MRPL42, MRPL41, MRPL40, MRPL4, MRPL39, MRPL38, MRPL37, MRPL36, MRPL35, MRPL34, MRPL32, MRPL30, MRPL3, MRPL28, MRPL27, MRPL24, MRPL23, MRPL22, MRPL21, MRPL20, MRPL2, MRPL19, MRPL18, MRPL17, MRPL16, MRPL15, MRPL14, MRPL13, MRPL12, MRPL11, MRPL10, MRPL1"
"492","Mitochondrial translation termination",0.000199163513244374,0.000551454923716307,-0.449310645168143,-4.83810457061801,0,85,"PTCD3, OXA1L, MTRF1L, MRRF, MRPS9, MRPS7, MRPS5, MRPS36, MRPS35, MRPS34, MRPS33, MRPS31, MRPS30, MRPS28, MRPS27, MRPS26, MRPS25, MRPS24, MRPS23, MRPS22, MRPS21, MRPS2, MRPS18C, MRPS18B, MRPS18A, MRPS17, MRPS16, MRPS15, MRPS14, MRPS12, MRPS11, MRPS10, MRPL9, MRPL58, MRPL57, MRPL55, MRPL54, MRPL52, MRPL51, MRPL50, MRPL49, MRPL48, MRPL47, MRPL46, MRPL45, MRPL44, MRPL43, MRPL42, MRPL41, MRPL40, MRPL4, MRPL39, MRPL38, MRPL37, MRPL36, MRPL35, MRPL34, MRPL32, MRPL30, MRPL3, MRPL28, MRPL27, MRPL24, MRPL23, MRPL22, MRPL21, MRPL20, MRPL2, MRPL19, MRPL18, MRPL17, MRPL16, MRPL15, MRPL14, MRPL13, MRPL12, MRPL11, MRPL10, MRPL1"
"493","Mitophagy",0.0622142715165971,0.0801136880365813,-0.258410643653362,-1.54219747890103,312,25,"VDAC1, ULK1, UBC, UBB, TOMM70, TOMM7, TOMM40, TOMM22, TOMM20, SRC, SQSTM1"
"494","Mitotic Anaphase",0.000199600798403194,0.000551454923716307,-0.183004638307381,-2.62310137526883,0,153,"ZWINT, ZWILCH, ZW10, XPO1, WAPL, VRK2, VRK1, UBE2E1, UBE2D1, UBC, UBB, TMPO, TAOK1, STAG2, STAG1, SPC25, SMC3, SMC1A, SKA2, SGO2, SEH1L, SEC13, RPS27A, RCC2, RANGAP1, RANBP2, RAD21, PTTG1, PSMF1, PSME4, PSME3, PSME2, PSME1, PSMD9, PSMD8, PSMD7, PSMD6, PSMD5, PSMD4, PSMD3, PSMD2, PSMD14, PSMD13, PSMD12, PSMD11, PSMD10, PSMD1, PSMC6, PSMC5, PSMC4, PSMC3, PSMC2, PSMC1, PSMB8, PSMB7, PSMB6, PSMB5, PSMB4, PSMB3, PSMB2, PSMB10, PSMB1, PSMA7, PSMA6, PSMA5, PSMA4, PSMA3, PSMA1, PPP2R5E, PPP2R5D, PPP2R5C, PPP2R5B, PPP2R5A, PPP2R2A, PPP2R1B, PPP2R1A, PPP2CB, PPP2CA, PPP1CC, PMF1, PDS5B, PDS5A, PAFAH1B1, NUP98, NUP85, NUP43, NUP37, NUP160, NUP133, NUP107, NUF2, NUDC, NSL1"
"495","Mitotic G1 phase and G1/S transition",0.000199084212621939,0.000551454923716307,-0.197257699883798,-2.58864132145361,0,127,"WEE1, UBC, UBB, TYMS, TOP2A, TK1, TFDP2, TFDP1, SRC, SKP2, SKP1, RPS27A, RPA3, RPA2, RPA1, RBL2, RBL1, RB1, PSMF1, PSME3, PSME2, PSME1, PSMD9, PSMD8, PSMD7, PSMD6, PSMD5, PSMD4, PSMD3, PSMD2, PSMD14, PSMD13, PSMD12, PSMD11, PSMD10, PSMD1, PSMC6, PSMC5, PSMC4, PSMC3, PSMC2, PSMC1, PSMB8, PSMB7, PSMB6, PSMB5, PSMB4, PSMB3, PSMB2, PSMB10, PSMB1, PSMA7, PSMA6, PSMA5, PSMA4, PSMA3, PSMA1, PRIM2, PRIM1, PPP2R3B, PPP2R2A, PPP2R1B, PPP2R1A, PPP2CB, PPP2CA, POLE4, POLE3, POLE2, POLA2, POLA1, PCNA, ORC6, ORC5, ORC4, ORC3, ORC2, ORC1"
"496","Mitotic G2-G2/M phases",0.000403632694248234,0.00100512455234364,0.171665070611674,2.54160794247146,1,165,"ACTR1A, AKAP9, ALMS1, AURKA, BORA, BTRC, CCNA2, CCNB2, CCNH, CCP110, CDC25A, CDC25B, CDK11B, CDK11A, CDK2, CDK5RAP2, CDK7, CENPF, CENPJ, CEP131, CEP135, CEP152, CEP164, CEP192, CEP250, CEP290, CEP41, CEP57, CEP63, CEP70, CEP72, CEP76, CEP78, CETN2, CKAP5, CLASP1, CNTRL, CSNK1D, CSNK1E, CUL1, DCTN1, DCTN2, DCTN3, DYNC1H1, DYNC1I2, DYNLL1, E2F1, E2F3, EP300, FBXL18, FBXL7, FBXW11, FGFR1OP, FKBPL, FOXM1, UBA52, HAUS1, HAUS2, HAUS4, HAUS6, HAUS7, HAUS8, HMMR, HSP90AB1, LCMT1, LIN37, LIN52, LIN54, LIN9, MAPRE1, MNAT1, MYBL2, MZT1, MZT2B, MZT2A, NDE1, NINL, NME7, ODF2, OFD1, OPTN, PAFAH1B1, PCM1, PCNT, PHLDA1, PKMYT1, PLK4, PPME1, PPP1CB, PPP1R12A, PPP1R12B, PPP2CA, PPP2CB, PPP2R1A, PPP2R1B, PPP2R2A, PPP2R3B, PRKACA, PRKAR2B, PSMA1, PSMA3, PSMA4, PSMA5, PSMA6, PSMA7, PSMB1, PSMB10, PSMB2, PSMB3, PSMB4, PSMB5, PSMB6, PSMB7, PSMB8, PSMC1, PSMC2, PSMC3, PSMC4, PSMC5, PSMC6, PSMD1, PSMD10, PSMD11, PSMD12, PSMD13, PSMD14, PSMD2, PSMD3, PSMD4, PSMD5, PSMD6, PSMD7, PSMD8, PSMD9, PSME1, PSME2, PSME3, PSME4, PSMF1"
"497","Mitotic Metaphase and Anaphase",0.000199600798403194,0.000551454923716307,-0.183004638307381,-2.62310137526883,0,153,"ZWINT, ZWILCH, ZW10, XPO1, WAPL, VRK2, VRK1, UBE2E1, UBE2D1, UBC, UBB, TMPO, TAOK1, STAG2, STAG1, SPC25, SMC3, SMC1A, SKA2, SGO2, SEH1L, SEC13, RPS27A, RCC2, RANGAP1, RANBP2, RAD21, PTTG1, PSMF1, PSME4, PSME3, PSME2, PSME1, PSMD9, PSMD8, PSMD7, PSMD6, PSMD5, PSMD4, PSMD3, PSMD2, PSMD14, PSMD13, PSMD12, PSMD11, PSMD10, PSMD1, PSMC6, PSMC5, PSMC4, PSMC3, PSMC2, PSMC1, PSMB8, PSMB7, PSMB6, PSMB5, PSMB4, PSMB3, PSMB2, PSMB10, PSMB1, PSMA7, PSMA6, PSMA5, PSMA4, PSMA3, PSMA1, PPP2R5E, PPP2R5D, PPP2R5C, PPP2R5B, PPP2R5A, PPP2R2A, PPP2R1B, PPP2R1A, PPP2CB, PPP2CA, PPP1CC, PMF1, PDS5B, PDS5A, PAFAH1B1, NUP98, NUP85, NUP43, NUP37, NUP160, NUP133, NUP107, NUF2, NUDC, NSL1"
"498","Mitotic Prometaphase",0.0143029814665592,0.0223403201030672,0.126104332033074,1.83251480254099,70,158,"ACTR1A, AHCTF1, AKAP9, ALMS1, AURKB, B9D2, BIRC5, BUB3, CCNB2, CCP110, CDCA8, CDK5RAP2, CENPC, CENPF, CENPH, CENPJ, CENPK, CENPM, CENPN, CENPO, CENPP, CENPQ, CENPT, CENPU, CEP131, CEP135, CEP152, CEP164, CEP192, CEP250, CEP290, CEP41, CEP57, CEP63, CEP70, CEP72, CEP76, CEP78, CETN2, CKAP5, CLASP1, CLASP2, CLIP1, CNTRL, CSNK1D, CSNK1E, CSNK2A1, CSNK2A2, CSNK2B, DCTN1, DCTN2, DCTN3, DYNC1H1, DYNC1I1, DYNC1I2, DYNC1LI1, DYNC1LI2, DYNLL1, DYNLL2"
"499","Mitotic Prophase",0.000198886237072395,0.000551454923716307,-0.311415854685432,-3.16014163917755,0,75,"VRK2, VRK1, USO1, TPR, TMPO, SMC4, SMC2, SET, SEH1L, SEC13, RB1, RANBP2, RAE1, RAB2A, RAB1B, RAB1A, PRKCB, PRKCA, PPP2R2D, PPP2R1B, PPP2R1A, PPP2CB, PPP2CA, POM121C, POM121, PHF8, NUP42, NUP58, NUP98, NUP93, NUP88, NUP85, NUP54, NUP50, NUP43, NUP37, NUP35, NUP214, NUP210, NUP205, NUP188, NUP160, NUP155, NUP153, NUP133, NUP107, NUMA1, NEK9, NEK7, NEK6, NDC1, NCAPH2, NCAPG2, NCAPD3, MCPH1, MASTL, MAPK3, MAPK1, LPIN2, LPIN1, LMNB1, LMNA, LEMD3, LEMD2, KMT5A"
"500","Mitotic Spindle Checkpoint",0.00120336943441637,0.0026310428528515,0.20198498354912,2.23530902594263,5,89,"AHCTF1, ANAPC1, ANAPC10, ANAPC15, ANAPC16, ANAPC2, ANAPC4, ANAPC5, ANAPC7, AURKB, B9D2, BIRC5, BUB3, CDC16, CDC23, CDC26, CDC27, CDCA8, CENPC, CENPF, CENPH, CENPK, CENPM, CENPN, CENPO, CENPP, CENPQ, CENPT, CENPU, CKAP5, CLASP1, CLASP2, CLIP1, DYNC1H1, DYNC1I1, DYNC1I2, DYNC1LI1, DYNC1LI2, DYNLL1, DYNLL2"
"501","Molecules associated with elastic fibres",0.00161681487469685,0.00337306758252977,0.375934848266935,2.20161581808479,7,24,"BMP7, EFEMP1, EFEMP2, FBLN1, FBLN2, FBLN5, ITGA8, ITGAV, ITGB1, ITGB3, ITGB5, ITGB6, ITGB8, LTBP1, LTBP3, LTBP4, MFAP1, MFAP2, MFAP3, MFAP4, MFAP5"
"502","Muscle contraction",0.000797925393975663,0.00183190058333232,0.161368922252684,2.27652165157131,3,148,"ABCC9, ACTG2, ACTN2, ACTN3, AHCYL1, AKAP9, ANXA1, ANXA6, ASPH, ATP1A1, ATP1A2, ATP1A3, ATP1B1, ATP1B2, ATP1B3, ATP2A2, ATP2B1, ATP2B2, ATP2B3, ATP2B4, CACNA1C, CACNA1D, CACNA1F, CACNA2D1, CACNA2D2, CACNA2D3, CACNA2D4, CACNB1, CACNB2, CACNB3, CACNB4, CACNG2, CACNG3, CACNG4, CACNG7, CACNG8, CALD1, CALM1, CAMK2A, CAMK2B, CAMK2G"
"503","MyD88 cascade initiated on plasma membrane",0.00336833762631266,0.00638475938121952,-0.203244014688668,-2.01830968603587,16,72,"VRK3, UBE2N, UBC, UBB, TRAF6, TNIP2, TAB3, TAB2, TAB1, SKP1, S100B, RPS6KA5, RPS6KA3, RPS6KA2, RPS6KA1, RPS27A, RIPK2, RELA, PPP2R5D, PPP2R1B, PPP2R1A, PPP2CB, PPP2CA, PELI3, PELI2, PELI1, NOD1, NKIRAS2, NKIRAS1, NFKBIB, NFKBIA, NFKB2, NFKB1, MEF2C, MEF2A, MAPKAPK3, MAPKAPK2, MAPK9, MAPK8, MAPK7, MAPK3, MAPK14, MAPK11, MAPK10, MAPK1, MAP3K8, MAP3K7, MAP3K1, MAP2K6, MAP2K4, MAP2K3, MAP2K1"
"504","MyD88 dependent cascade initiated on endosome",0.00397061743101052,0.00736158268231148,-0.19741021023759,-2.01859222021653,19,76,"VRK3, UBE2N, UBC, UBB, TRAF6, TNIP2, TLR7, TICAM1, TAB3, TAB2, TAB1, SKP1, S100B, RPS6KA5, RPS6KA3, RPS6KA2, RPS6KA1, RPS27A, RIPK2, RELA, PPP2R5D, PPP2R1B, PPP2R1A, PPP2CB, PPP2CA, PELI3, PELI2, PELI1, NOD1, NKIRAS2, NKIRAS1, NFKBIB, NFKBIA, NFKB2, NFKB1, MEF2C, MEF2A, MAPKAPK3, MAPKAPK2, MAPK9, MAPK8, MAPK7, MAPK3, MAPK14, MAPK11, MAPK10, MAPK1, MAP3K8, MAP3K7, MAP3K1, MAP2K6, MAP2K4, MAP2K3, MAP2K1, LY96"
