"","pathway","pval","padj","ES","NES","nMoreExtreme","size","leadingEdge"
"1","HALLMARK_TNFA_SIGNALING_VIA_NFKB",0.321913762551683,0.435018598042815,0.0779080657252817,1.10309507657122,1634,148,"ABCA1, ACKR3, ATF3, ATP2B1, B4GALT1, B4GALT5, BCL2A1, BCL3, BCL6, BHLHE40, BIRC2, BIRC3, BMP2, BTG1, BTG2, BTG3, CCL2, CCL5, CCN1, CCND1, CCNL1, CD44, CD80, CD83, CEBPB, CEBPD, CFLAR, CSF1, CXCL10, DDX58, DENND5A, DNAJB4, DRAM1, DUSP1, DUSP5, EFNA1, EGR1, EHD1, EIF1, ETS2, F3, FJX1, FOS, FOSL1, FOSL2, G0S2, GADD45B, GCH1, GFPT2, GPR183, HES1, ICAM1, ICOSLG, ID2, IER2, IER3, IER5, IFIH1, IFIT2, IFNGR2, IL15RA, IL18, IL1A, IL6ST, INHBA, IRF1, IRS2, JAG1, JUN, JUNB, KDM6B, KLF10, KLF4, KLF6, KLF9, KYNU, LDLR, LITAF"
"2","HALLMARK_HYPOXIA",0.00511006289308176,0.0212248132216436,0.13806772525097,1.9595665208267,25,149,"ACKR3, AK4, AKAP12, ALDOA, ALDOC, AMPD3, ANKZF1, ANXA2, ATF3, ATP7A, B3GALT6, BCAN, BCL2, BHLHE40, BNIP3L, BTG1, CA12, CASP6, CAVIN3, CCN1, CCNG2, CDKN1B, CDKN1C, CHST2, CHST3, CITED2, CP, CSRP2, CXCR4, DCN, DDIT3, DDIT4, DPYSL4, DTNA, DUSP1, EFNA1, EFNA3, EGFR, ENO1, ENO2, ERO1A, ERRFI1, ETS1, EXT1, F3, FAM162A, FOS, FOSL2, FOXO3, GAA, GALK1, GAPDHS, GBE1, GCNT2, GLRX, GPC1, GPC3, GPC4, GPI, GRHPR, GYS1, HDLBP, HEXA, HK1, HK2, HMOX1, HS3ST1, HSPA5, IDS, IER3, ILVBL, INHA, IRS2, JMJD6, JUN, KDM3A, KIF5A, KLF6, KLF7, KLHL24, LARGE1, LDHA, LXN, MAP3K1, MIF, MXI1, MYH9, NAGK, NCAN, NDRG1, NDST1, NDST2, NEDD4L, NOCT, NR3C1, P4HA1, PAM, PDGFB, PDK1, PDK3, PFKFB3, PFKL, PFKP, PGAM2, PGK1, PGM1, PGM2, PHKG1, PIM1, PLAUR, PLIN2, PNRC1, PPARGC1A, PPFIA4, PPP1R15A, PPP1R3C, PRDX5, PRKCA"
"3","HALLMARK_CHOLESTEROL_HOMEOSTASIS",0.00342258908798067,0.0155572231271849,0.225313683823986,2.07938284725313,16,62,"ABCA2, ACAT2, ACSS2, ACTG1, ALCAM, ALDOC, ANTXR2, ANXA5, ATF3, ATF5, ATXN2, CD9, CHKA, CLU, CPEB2, CTNNB1, CXCL16, CYP51A1, DHCR7, EBP, ECH1, ERRFI1, ETHE1, FABP5, FADS2, FASN, FDFT1, GLDC, GNAI1, GPX8, GSTM2, GUSB, HMGCR, HMGCS1, HSD17B7, IDI1, JAG1, LDLR, LGALS3, LGMN, LPL, LSS, MAL2"
"4","HALLMARK_MITOTIC_SPINDLE",0.00552486187845304,0.0212248132216436,0.126914410416709,1.98379102621573,27,181,"ABI1, ABL1, ABR, ACTN4, AKAP13, ALMS1, ALS2, ANLN, APC, ARAP3, ARF6, ARFGEF1, ARFIP2, ARHGAP10, ARHGAP27, ARHGAP29, ARHGAP4, ARHGAP5, ARHGDIA, ARHGEF11, ARHGEF12, ARHGEF2, ARHGEF3, ARHGEF7, ARL8A, ATG4B, AURKA, BCAR1, BCL2L11, BCR, BIN1, BIRC5, CAPZB, CCDC88A, CD2AP, CDC27, CDC42, CDC42BPA, CDC42EP2, CDC42EP4, CDK1, CDK5RAP2, CENPE, CENPF, CENPJ, CEP131, CEP192, CEP250, CEP57, CKAP5, CLASP1, CLIP1, CLIP2, CNTRL, CNTROB"
"5","HALLMARK_WNT_BETA_CATENIN_SIGNALING",0.320024198427102,0.435018598042815,0.169112613740713,1.09894997759957,1586,30,"ADAM17, AXIN1, AXIN2, CCND2, CSNK1E, CTNNB1, CUL1, DVL2, GNAI1, HDAC11, HDAC2, HDAC5, HEY1, HEY2, JAG1, KAT2A, LEF1, MAML1, NCOR2, NCSTN, NOTCH1, NUMB, PPARD, PSEN2, PTCH1, RBPJ"
"6","HALLMARK_TGF_BETA_SIGNALING",0.318622600435385,0.435018598042815,-0.138686675219608,-1.10296160944643,1609,46,"XIAP, WWTR1, UBE2D3, TRIM33, TJP1, TGIF1, TGFBR1, TGFB1, SPTBN1, SMURF2, SMURF1, SMAD7, SMAD3, SMAD1, SLC20A1, SKIL, SKI"
"7","HALLMARK_IL6_JAK_STAT3_SIGNALING",0.00278108859753675,0.0150814397747838,0.23997703265345,2.14933816617516,13,58,"ACVR1B, ACVRL1, BAK1, CBL, CCL7, CCR1, CD14, CD36, CD38, CD44, CD9, CNTFR, CRLF2, CSF1, CSF2RA, CSF2RB, CSF3R, CXCL10, EBI3, FAS, GRB2, HAX1, HMOX1, IFNAR1, IFNGR1, IFNGR2, IL10RB, IL13RA1, IL15RA, IL17RA, IL17RB, IL4R, IL6ST, IRF1, IRF9, ITGA4, ITGB3, JUN"
"8","HALLMARK_DNA_REPAIR",0.00594294770206022,0.0212248132216436,-0.150451987059276,-1.98852240414572,29,131,"ZWINT, ZNRD1, XPC, VPS37D, VPS37B, VPS28, USP11, UPF3B, UMPS, TYMS, TSG101, TP53, TMED2, TK2, TARBP2, TAF6, TAF1C, TAF13, TAF12, TAF10, SURF1, SUPT5H, SUPT4H1, STX3, SSRP1, SRSF6, SNAPC5, SNAPC4, SMAD5, SF3A3, SEC61A1, SDCBP, SAC3D1, RRM2B, RPA3, RNMT, RFC3, RFC2, REV3L, RBX1, RALA, RAE1, RAD52, RAD51, PRIM1, POM121, POLR3C, POLR2K, POLR2J, POLR2I, POLR2H, POLR2G, POLR2F, POLR2E, POLR2D, POLR2C, POLR2A, POLR1D, POLR1C, POLL, POLE4, POLD4, POLD1, POLB, POLA2, POLA1, PNP, PDE4B, PCNA, NUDT9, NUDT21, NT5C3A, NT5C, NPR2, NME4, NFX1, NELFE, NELFCD, NELFB"
"9","HALLMARK_G2M_CHECKPOINT",0.510741791649777,0.580388399602019,-0.0653548757392125,-0.942584609894208,2519,157,"YTHDC1, XPO1, WRN, UPF1, UCK2, UBE2S, TTK, TROAP, TRAIP, TRA2B, TPX2, TOP2A, TOP1, TNPO2, TMPO, TLE3, TGFB1, TFDP1, TENT4A, TACC3, SYNCRIP, SUV39H1, STMN1, STAG1, SRSF2, SRSF10, SRSF1, SQLE, SNRPD1, SMC4, SMC2, SMC1A, SMARCC1, SMAD3, SLC7A1, SLC38A1, SLC12A2, SFPQ, SAP30, RPS6KA5, RBL1, RASAL2, RAD54L, RAD23B, RAD21, RACGAP1, PURA, PTTG1, PRPF4B, PRMT5, PRIM2, PRC1, POLQ, POLE, POLA2, PML, PDS5B, PBK, PAFAH1B1, ORC6, ORC5, ODF2, ODC1, NUSAP1, NUP98, NUP50, NUMA1, NSD2, NOTCH2, NOLC1, NDC80, NCL, NASP, MTF2, MNAT1, MKI67, MEIS2, MEIS1, MCM6, MARCKS, MAPK14, MAP3K20, LMNB1, LIG3, LBR, KPNB1, KNL1, KMT5A, KIF5B, KIF20B, KIF15, KIF11, KATNA1, INCENP, ILF3, HUS1, HSPA8, HNRNPU, HNRNPD, HMMR, HMGN2, HMGB3, HMGA1, HIRA, HIF1A, GSPT1, GINS2, G3BP1, FOXN3, FBXO5, FANCC, EZH2, EWSR1, ESPL1, EFNA5, E2F4, E2F3, E2F2, E2F1, DTYMK, DR1, DMD, DKC1, DDX39A, DBF4, CUL5, CUL4A, CUL3, CUL1, CTCF, CHMP1A, CHAF1A, CENPF, CENPE, CENPA, CDKN3, CDKN2C, CDKN1B, CDK4, CDK1, CDC7, CDC27, CDC25A, CCNT1, CCND1, CCNA2, CBX1, CASP8AP2"
"10","HALLMARK_APOPTOSIS",0.00039912193175015,0.00498902414687687,0.186327697871983,2.37905836617126,1,120,"ADD1, ANKH, ANXA1, APP, ATF3, BAX, BCAP31, BCL10, BCL2L1, BCL2L11, BID, BIRC3, BMF, BMP2, BNIP3L, BRCA1, BTG2, BTG3, CASP1, CASP2, CASP3, CASP6, CASP7, CASP8, CASP9, CCND1, CCND2, CD14, CD38, CD44, CDK2, CDKN1B, CFLAR, CLU, CREBBP, CTNNB1, CYLD, DAP3, DCN, DDIT3, DFFA, DIABLO, DNAJC3, DNM1L, DPYD, EBP, ENO2, ERBB3, ETF1, F2R, FAS, FEZ1, GADD45B, GCH1, GNA15, GPX1, GPX3, GSN, GSR, GSTM1, HGF, HMOX1, HSPB1, IER3, IFITM3, IFNGR1, IGF2R, IGFBP6, IL18, IL1A"
"11","HALLMARK_NOTCH_SIGNALING",0.9654,0.985102040816327,-0.0921690343371058,-0.557872028752253,4826,26,"WNT5A, WNT2, TCF7L2, ST3GAL6, SKP1, SAP30, RBX1, PSENEN, PSEN2, PRKCA, PPARD, NOTCH2, NOTCH1, MAML2, LFNG, KAT2A, JAG1, HES1, FZD7, FBXW11, DTX4, DTX2"
"12","HALLMARK_ADIPOGENESIS",0.00989707046714173,0.0329902348904724,0.123241581912725,1.85572391246754,49,168,"ABCA1, ABCB8, ACAA2, ACADL, ACADM, ACADS, ACLY, ACO2, ACOX1, ADIPOR2, AGPAT3, AIFM1, AK2, ALDH2, ALDOA, ANGPT1, APLP2, APOE, ARAF, ARL4A, ATL2, ATP1B3, ATP5PO, BAZ2A, BCKDHA, BCL2L13, BCL6, CAT, CCNG2, CD151, CD36, CDKN2C, CHCHD10, CHUK, CIDEA, CMPK1, COL15A1, COL4A1, COQ3, COQ5, COQ9, COX6A1, COX7B, COX8A, CPT2, CRAT, CS, CYC1, DBT, DDT, DECR1, DGAT1, DHCR7, DHRS7, DHRS7B, DLAT, DLD, DNAJB9, DNAJC15, DRAM2, ECH1, ECHS1, ELMOD3, ELOVL6, ENPP2, ESRRA, ESYT1"
"13","HALLMARK_ESTROGEN_RESPONSE_EARLY",0.481207516993203,0.559543624410701,0.070744195756557,0.966614447919101,2406,138,"ABCA3, ABHD2, ABLIM1, ADCY1, ADCY9, ADD3, AFF1, AKAP1, ALDH3B1, AMFR, ANXA9, AR, ARL3, ASB13, B4GALT1, BAG1, BCL11B, BCL2, BHLHE40, BLVRB, CALB2, CANT1, CA12, CBFA2T3, CCND1, CD44, CELSR2, CHPT1, CXCL12, CYP26B1, DEPTOR, DHCR7, DHRS3, DLC1, DYNLT3, ELF1, ELOVL2, ELOVL5, ENDOD1, FAM102A, FARP1, FASN, FDFT1, FHL2, FKBP4, FKBP5, FLNB, FOS, GAB2, GFRA1, GLA, HES1, HR, IGF1R, IGFBP4, IL17RB, IL6ST, INPP5F, ITPK1, JAK2, KAZN, KDM4B, KLF10, KLF4, LRIG1, MAPT, MAST4, MED13L, MICB, MINDY1, MPPED2, MREG, MYBBP1A, MYBL1, MYOF, NADSYN1, NAV2, NBL1, NCOR2, NPY1R, NRIP1, NXT1, OLFM1, OLFML3, OVOL2, PAPSS2, PDZK1, PEX11A, PLAAT3, PPIF, RAB31, RAPGEFL1, RARA, RASGRP1, RBBP8, REEP1, RETREG1, RHOBTB3, RPS6KA2, RRP12, SCARB1, SCNN1A, SEC14L2, SH3BP5, SIAH2, SLC16A1, SLC19A2, SLC1A1, SLC1A4, SLC22A5, SLC24A3, SLC26A2, SLC2A1, SLC37A1, SLC39A6, SLC7A2, SLC9A3R1, SNX24, SVIL, SYBU, SYNGR1, SYT12, TBC1D30, TGIF2, TGM2, THSD4, TIAM1, TIPARP, TJP3"
"14","HALLMARK_ESTROGEN_RESPONSE_LATE",0.444132397191575,0.541624874623872,0.076967443375358,0.996481905897614,2213,124,"ABCA3, ABHD2, ADD3, AFF1, ALDH3B1, AMFR, ANXA9, ARL3, ATP2B4, BAG1, BATF, BCL2, BLVRB, BTG3, CA12, CA2, CCND1, CD44, CD9, CELSR2, CHPT1, CHST8, CKB, COX6C, CPE, CXCL12, CXCL14, CYP26B1, DCXR, DHCR7, DNAJC1, DNAJC12, DYNLT3, ELOVL5, FABP5, FAM102A, FARP1, FDFT1, FGFR3, FKBP4, FKBP5, FLNB, FOS, GALE, GINS2, GLA, HOMER2, HPRT1, HR, HSPA4L, ID2, IDH2, IGFBP4, IL17RB, IL6ST, IMPA2, ITPK1, JAK1, JAK2, KIF20A, KLF4, LARGE1, LSR, LTF, MAPT, MEST, METTL3, MICB, MOCS2, MYOF, NAB2, NBL1, NCOR2, NPY1R, NRIP1, NXT1, OLFM1, OVOL2, PAPSS2, PCP4, PDCD4, PDZK1, PERP, PLAAT3, PLAC1, PPIF, PRKAR2B, PTPN6, RAB31, RABEP1, RAPGEFL1, RBBP8, RNASEH2A, RPS6KA2, SCARB1, SCNN1A, SERPINA3, SGK1, SIAH2, SLC16A1, SLC1A4, SLC22A5, SLC24A3, SLC26A2, SLC29A1, SLC2A8"
"15","HALLMARK_ANDROGEN_RESPONSE",0.611077664057797,0.664214852236735,0.0829476878654089,0.872101056666829,3044,82,"ABCC4, ABHD2, ACSL3, ACTN1, ADAMTS1, ADRM1, AKAP12, AKT1, ANKH, APPBP2, ARID5B, SPCS3, B2M, B4GALT1"
"16","HALLMARK_MYOGENESIS",0.0767704820472129,0.153540964094426,0.117898966937955,1.48497956735369,386,116,"ABLIM1, ACHE, ACSL1, ADAM12, ADCY9, AEBP1, AGL, AGRN, AK1, AKT2, APOD, APP, ATP6AP1, BAG1, BDKRB2, BHLHE40, BIN1, CACNA1H, CAMK2B, CD36, CDH13, CKB, CKMT2, CLU, CNN3, COL15A1, COL4A2, COL6A2, COX6A2, CRAT, CRYAB, DAPK2, DMD, DMPK, DTNA, EIF4A2, ERBB3, FABP3, FGF2, FKBP1B, FLII, FOXO4, FST, FXYD1, GAA, GABARAPL2, GADD45B, GNAO1, GPX3, GSN, HDAC5, IFRD1, IGF1, ITGB1, ITGB4, ITGB5, KCNH1, KIFC3, KLF5, LAMA2, LARGE1, LDB3, LPIN1, LSP1, MAPRE3, MEF2A, MEF2C, MEF2D, MRAS, MYH9, MYLK, MYO1C, MYOM1, NAV2, NCAM1, NOS1, NOTCH1, NQO1, OCEL1, PC, PDE4DIP, PDLIM7, PFKM, PGAM2"
"17","HALLMARK_PROTEIN_SECRETION",0.0805831139906864,0.154967526905166,0.132705014028188,1.4788775528623,397,92,"ABCA1, ADAM10, ANP32E, AP1G1, AP2B1, AP2M1, AP2S1, AP3B1, AP3S1, ARCN1, ARF1, ARFGAP3, ARFGEF1, ARFGEF2, ARFIP1, ATP1A1, ATP6V1H, ATP7A, BNIP3, CAV2, CD63, CLCN3, CLN5, CLTA, CLTC, COG2, COPB1, COPB2, COPE"
"18","HALLMARK_INTERFERON_ALPHA_RESPONSE",0.131832797427653,0.235415709692237,-0.132817567949985,-1.34871854273217,655,77,"USP18, UBA7, TXNIP, TRIM5, TRIM26, TRIM25, TRIM21, TRIM14, TRAFD1, TMEM140, TENT5A, TDRD7, TAP1, STAT2, SP110, SLC25A28, SAMD9L, RTP4, RSAD2, RNF31, RIPK2, PSME2, PSME1, PSMB9, PSMB8, PSMA3, PNPT1, PARP9, PARP14, PARP12, OGFR, OASL, NUB1, NMI, NCOA7, MX1, MVB12A, MOV10, LY6E, LPAR6, LGALS3BP, LAP3, ISG15, IRF9, IRF7, IRF2, IRF1, IL4R, IL15, IFITM2, IFITM1, IFITM3, IFIT3, IFIT2, IFIH1, IFI44, IFI35"
"19","HALLMARK_INTERFERON_GAMMA_RESPONSE",0.0838591491960106,0.155294720733353,-0.103754110801923,-1.46229107140496,411,150,"ZNFX1, XAF1, VCAM1, VAMP8, VAMP5, USP18, TXNIP, TRIM26, TRIM25, TRIM21, TRIM14, TRAFD1, TOR1B, TNFSF10, TNFAIP6, TNFAIP3, TNFAIP2, TDRD7, TAPBP, TAP1, STAT3, STAT2, STAT1, ST8SIA4, ST3GAL5, SSPN, SRI, SPPL2A, SP110, SOD2, SOCS1, SLC25A28, SLAMF7, SAMHD1, SAMD9L, RTP4, RSAD2, RNF31, RIPK2, RIPK1, RBCK1, RAPGEF6, PTPN6, PTPN2, PTPN1, PSME2, PSME1, PSMB9, PSMB8, PSMB2, PSMB10, PSMA3, PNPT1, PNP, PML, PLA2G4A, PIM1, PFKP, PELI1, PDE4B, PARP14, PARP12, P2RY14, OGFR, OASL, OAS3, OAS2, NUP93, NOD1, NMI, NLRC5, NFKBIA, NFKB1, NCOA3, NAMPT, MX1, MVP, MTHFD2, LYSMD2, LY6E, LGALS3BP, LCP2, LAP3, JAK2, ITGB7, ISOC1, ISG15, IRF9, IRF7, IRF5, IRF4, IRF2, IRF1, IL4R, IL18BP, IL15RA, IL15, IL10RA, IFNAR2, IFITM2, IFITM3, IFIT3, IFIT2, IFIH1, IFI44, IFI35, ICAM1"
"20","HALLMARK_APICAL_JUNCTION",0.185700099304866,0.30950016550811,0.0907517394117765,1.26130001830323,934,143,"ACTB, ACTG1, ACTN1, ACTN4, ADAM15, ADAM23, ADAM9, AKT2, AKT3, AMIGO1, ARHGEF6, ARPC2, ATP1A3, B4GALT1, BAIAP2, BMP1, CADM2, CADM3, CALB2, CAP1, CD209, CD274, CD86, CDH11, CDH6, CDH8, CDK8, CERCAM, CLDN11, CLDN15, CNN2, CNTN1, COL17A1, CRAT, CRB3, CTNNA1, CX3CL1, DHX16, DLG1, DMP1, EGFR, EPB41L2, EVL, EXOC4, FBN1, FSCN1, FYB1, GAMT, PIK3R3, GNAI1, GNAI2, GTF2F1, HADH, HRAS, ICAM1, ICAM5, IKBKG, INSIG1, IRS1, ITGA2, ITGA9, ITGB1, ITGB4, JAM3, JUP, LAYN, LDLRAP1, LIMA1, MAP3K20, MAP4K2, MAPK14, MMP2, MMP9, MPP5, MPZL1, MPZL2, MSN, MVD, MYH10, MYH9, MYL12B, NECTIN1, NECTIN3, NECTIN4, NEGR1, NEXN, NF1, NF2, NFASC, NLGN2, NLGN3, NRAP, NRXN2, PARD6G, PARVA, PBX2, PCDH1, PECAM1, PFN1, PIK3CB, PKD1, PLCG1"
"21","HALLMARK_APICAL_SURFACE",0.0723498589278517,0.152294169551347,0.23425248978182,1.49825243784586,358,29,"ADAM10, ADIPOR2, AFAP1L2, AKAP7, APP, ATP6V0A4, ATP8B1, B4GALT1, BRCA1, CROCC, CRYBG1, CX3CL1, DCBLD2"
"22","HALLMARK_HEDGEHOG_SIGNALING",0.677176283957961,0.720400302082938,-0.126588196009684,-0.824641240034794,3414,30,"VLDLR, VEGFA, UNC5C, TLE3, TLE1, THY1, SLIT1, SCG2, RTN1, RASA1, PTCH1, PML, OPHN1, NRP2, NRP1, NRCAM, NF1, MYH9"
"23","HALLMARK_COMPLEMENT",0.00260625501202887,0.0150814397747838,0.153338254697032,2.05872915240998,12,133,"ADAM9, AKAP10, ANXA5, ATOX1, BRPF3, C1QA, C1QC, C2, CALM1, CALM3, CA2, CASP1, CASP3, CASP7, CASP9, CBLB, CCL5, CD36, CD46, CD55, CD59, CDH13, CDK5R1, CEBPB, CLU, COL4A2, CP, CPM, CPQ, CR1, CR2, CSRP1, CTSB, CTSC, CTSH, CTSO, CTSS, DGKG, DGKH, DOCK10, DOCK4, DOCK9, DPP4, DUSP5, DUSP6, DYRK2, EHD1, F3, FCER1G, FDX1, FN1, FYN, GMFB, GNAI2, GNAI3, GNB4, GNG2, GNGT2, GPD2, GRB2, HPCAL4, HSPA1A, HSPA5, IRF1, IRF2, IRF7, JAK2, KCNIP2, KCNIP3, KIF2A, KYNU, L3MBTL4, LAMP2, LAP3, LCP2, LGALS3, LGMN, LIPA, LRP1, LTA4H, LTF, LYN"
"24","HALLMARK_UNFOLDED_PROTEIN_RESPONSE",0.00220661985957874,0.0150814397747838,0.189730295610814,2.18710434856628,10,98,"ALDH18A1, ARFGAP1, SPCS3, ASNS, ATF3, ATF4, ATF6, ATP6V0D1, BAG3, CALR, CCL2, CEBPB, CEBPG, CHAC1, CNOT4, CNOT6, CXXC1, DCP1A, DCP2, DCTN1, DDIT4, DDX10, DKC1, DNAJA4, DNAJB9, DNAJC3, EDC4, EDEM1, EEF2, EIF2AK3, EIF2S1, EIF4A1, EIF4A2, EIF4A3, EIF4E, EIF4EBP1, EIF4G1, ERN1, ERO1A, EXOC2, EXOSC1, EXOSC10, EXOSC2, EXOSC4, EXOSC5, EXOSC9"
"25","HALLMARK_PI3K_AKT_MTOR_SIGNALING",0.31110215595406,0.435018598042815,0.102005818608872,1.11311406837041,1543,88,"ACACA, ACTR2, ACTR3, ADCY2, AKT1, AKT1S1, AP2M1, ARF1, ARHGDIA, ARPC3, ATF1, CAB39, CAB39L, CALR, CAMK4, CDK1, CDK2, CDK4, CDKN1B, CFL1, CLTC, CSNK2B, CXCR4, DAPP1, DDIT3, E2F1, ECSIT, EGFR, EIF4E, PIK3R3, GRB2, GRK2, GSK3B, HRAS, HSP90B1, IL4, ITPR2, MAP2K3, MAP2K6, MAP3K7, MAPK1, MAPK10, MAPK8, MAPK9, MAPKAP1, MKNK1, MKNK2, NCK1, NFKBIB, NOD1, PDK1, PFN1, PIKFYVE, PIN1, PLA2G12A, PLCB1, PLCG1, PPP1CA, PPP2R1B, PRKAA2, PRKAG1, PRKAR2A, PRKCB, PTEN, PTPN11, RAC1, RAF1, RALB, RIPK1, RIT1, RPS6KA1, RPS6KA3, RPTOR"
"26","HALLMARK_MTORC1_SIGNALING",0.476427292619853,0.559543624410701,0.0642413127147632,0.97546208522898,2394,172,"ABCF2, ACACA, ACLY, ACSL3, ACTR2, ACTR3, ADD3, ADIPOR2, AK4, ALDOA, ARPC5L, ASNS, ATP2A2, ATP6V1D, AURKA, BCAT1, BHLHE40, BTG2, CACYBP, CALR, CANX, CCNG1, CCT6A, CD9, CDC25A, CFP, COPS5, CORO1A, CTSC, CXCR4, CYB5B, CYP51A1, DAPP1, DDIT3, DDIT4, DDX39A, DHCR24, DHCR7, EBP, EDEM1, EEF1E1, EIF2S2, ELOVL5, ELOVL6, ENO1, ERO1A, ETF1, FADS1, FADS2, FGL2, FKBP2, G6PD, GBE1, GCLC, GGA2, GLA, GLRX, PIK3R3, GMPS, GOT1, GPI, GSK3B, GSR, GTF2H1, HK2, HMBS, HMGCR, HMGCS1, HPRT1, HSP90B1, HSPA4, HSPA5, HSPA9, HSPD1, IDH1, IDI1, IFRD1, IGFBP5, IMMT, INSIG1, LDHA, LDLR, LGMN, LTA4H, M6PR, MAP2K3, MCM4, ME1, MLLT11, MTHFD2, MTHFD2L, NAMPT, NFKBIB, NFYC, NMT1, NUFIP1, NUP205, NUPR1, P4HA1, PDAP1, PDK1, PFKL, PGK1, PGM1, PHGDH, PITPNB, PNO1, PNP, PPA1, PPIA, PPP1R15A, PRDX1, PSAT1, PSMA3, PSMA4, PSMB5, PSMC2, PSMC4, PSMC6, PSMD12, PSMD13, PSMD14, PSMG1, PSPH, QDPR, RAB1A, RIT1, RPA1, RPN1, RRP9, SC5D, SCD, SDF2L1, SEC11A, SERP1, SERPINH1, SHMT2, SKAP2, SLA, SLC1A4, SLC1A5, SLC2A1, SLC37A4, SLC6A6, SLC7A11, SLC9A3R1, SORD, SQLE, SQSTM1, SRD5A1, SSR1, STARD4, STIP1"
"27","HALLMARK_E2F_TARGETS",0.0731012013846467,0.152294169551347,-0.105903299418394,-1.49649951228542,358,151,"ZW10, XRCC6, XPO1, WEE1, WDR90, USP1, UBR7, UBE2T, UBE2S, TUBG1, TUBB, TP53, TRIP13, TRA2B, TOP2A, TMPO, TK1, TIPIN, TFRC, TBRG4, TACC3, SYNCRIP, SUV39H1, STMN1, STAG1, SSRP1, SRSF2, SRSF1, SPC25, SPC24, SPAG5, SNRPB, SMC6, SMC4, SMC3, SMC1A, SLBP, SHMT1, RPA3, RPA1, RNASEH2A, RFC3, RFC2, RFC1, RBBP7, RANBP1, RAD51C, RAD50, RAD21, RAD1, RACGAP1, PTTG1, PSMC3IP, PSIP1, PRPS1, PRKDC, PRIM2, PRDX4, PPP1R8, PPM1D, POLE4, POLE, POLD2, POLD1, POLA2, PNN, PHF5A, PDS5B, PCNA, PAN2, PAICS, PA2G4, ORC6, ORC2, NUP205, NUP153, NUP107, NUDT21, NOP56, NOLC1, NCAPD2, NBN, NASP, NAP1L1, NAA38, MTHFD2, MSH2, MRE11, MMS22L, MLH1, MKI67, MCM7, MCM6, MCM4"
"28","HALLMARK_MYC_TARGETS_V1",0.0527059773828756,0.136244974180148,-0.10565740103997,-1.57604846144404,260,168,"YWHAQ, YWHAE, XRCC6, XPOT, XPO1, VDAC3, VDAC1, VBP1, USP1, UBE2E1, UBA2, U2AF1, TYMS, TXNL4A, TUFM, TRIM28, TRA2B, TOMM70, TFDP1, TCP1, TARDBP, SYNCRIP, STARD7, SSBP1, SSB, SRSF7, SRSF3, SRSF2, SRSF1, SRPK1, SRM, SNRPG, SNRPD3, SNRPD2, SNRPD1, SNRPB2, SNRPA1, SNRPA, SMARCC1, SLC25A3, SF3B3, SF3A1, SET, SERBP1, RUVBL2, RSL1D1, RRP9, RRM1, RPS5, RPL34, RPL18, RPL14, RNPS1, RANBP1, RAD23B, RACK1, PWP1, PTGES3, PSMD8, PSMD7, PSMD3, PSMD14, PSMD1, PSMC6, PSMC4, PSMB3, PSMB2, PSMA7, PSMA6, PSMA4, PSMA1, PRPS2, PRPF31, PRDX4, PRDX3, PPM1G, PPIA, POLE3, POLD2"
"29","HALLMARK_MYC_TARGETS_V2",0.0637490007993605,0.144884092725819,-0.194780230216921,-1.51665850247743,318,44,"WDR74, WDR43, UTP20, TMEM97, TFB2M, TCOF1, TBRG4, SUPV3L1, SRM, SORD, RRP9, RRP12, RCL1, RABEPK, PUS1, PRMT3, PPRC1, PPAN, PHB, PES1, PA2G4, NOP56, NOLC1, NOC4L, NIP7, NDUFAF4, MYBBP1A, MRTO4, MPHOSPH10, MCM4, MAP3K6, LAS1L, IPO4, IMP4, HSPD1, HK2"
"30","HALLMARK_EPITHELIAL_MESENCHYMAL_TRANSITION",0.348938702638365,0.459129871892586,0.0854081073479908,1.075745594657,1758,116,"ADAM12, ANPEP, APLP1, BASP1, BDNF, BMP1, CADM1, CALD1, CALU, CAP2, CAPG, CCN1, CD44, CD59, CDH11, CDH2, CDH6, COL4A1, COL4A2, COL6A2, COLGALT1, COPA, CXCL12, DAB2, DCN, DPYSL3, DST, ECM2, EDIL3, EMP3, ENO2, FAP, FAS, FBN1, FBN2, FERMT2, FGF2, FLNA, FN1, FSTL1, FUCA1, GADD45B, GLIPR1, GPC1, HTRA1, ID2, IGFBP2, IGFBP4, IL15, INHBA, ITGA2, ITGA5, ITGAV, ITGB1, ITGB3, ITGB5, JUN, LAMA2, LAMC1, LGALS1, LRP1, MAGEE1, MATN2, MCM7, MEST, MGP, MMP14, MMP2"
"31","HALLMARK_INFLAMMATORY_RESPONSE",0.0405622489959839,0.112672913877733,0.118121759961073,1.59842074153469,201,135,"ABCA1, ABI1, ACVR1B, ACVR2A, ADGRE1, ADRM1, AHR, ATP2A2, ATP2B1, ATP2C1, AXL, BST2, BTG2, C3AR1, C5AR1, CALCRL, CCL2, CCL24, CCL5, CCL7, CD14, CD40, CD48, CD55, CD82, CHST2, CLEC5A, CMKLR1, CSF1, CSF3R, CX3CL1, CXCL10, CXCR6, CYBB, DCBLD2, EBI3, EIF2AK2, EMP3, F3, FPR1, GABBR1, GCH1, GNA15, GNAI3, GPC3, GPR183, HIF1A, HPN, HRH1, ICAM1, ICOSLG, IFITM1, IFNAR1, IFNGR2, IL10, IL10RA, IL15, IL15RA, IL18, IL18RAP, IL1A, IL4R, INHBA, IRAK2, IRF1, IRF7, ITGA5, ITGB3, ITGB8, KCNJ2, KCNMB2, KIF1B, KLF6, LCP2, LDLR, LPAR1, LY6E, LYN, MET, MMP14, MSR1, MXD1, NAMPT, NFKB1, NFKBIA, NLRP3, NMI, NOD2, OSM, P2RX4, P2RX7, PCDH7, PDE4B, PIK3R5, PLAUR, PROK2, PSEN1, PTAFR, PTGER4, PTPRE, PVR, RAF1, RASGRP1, RELA, RGS1, RHOG, RIPK2, RNF144B, ROS1, RTP4, SCARF1, SCN1B, SELENOS, SEMA4D, SLAMF1, SLC11A2, SLC1A2, SLC31A1, SLC31A2, SLC4A4, SLC7A1, SLC7A2"
"32","HALLMARK_XENOBIOTIC_METABOLISM",0.00139944022391044,0.0116620018659203,0.168561532985551,2.15974070553964,6,121,"ABCC3, ABCD2, ABHD6, ACO2, ACOX1, ACOX3, ACP2, ADH5, AHCY, ALAS1, ALDH2, ALDH9A1, ANGPTL3, APOE, ARPP19, ASL, ATP2A2, BCAR1, BCAT1, BLVRB, BPHL, CA2, CASP6, CAT, CBR1, CD36, CDO1, CES1, CNDP2, COMT, CROT, CSAD, CYB5A, CYFIP2, CYP27A1, DCXR, DDAH2, DDT, DHPS, DHRS1, DHRS7, ECH1, ELOVL5, ENTPD5, EPHX1, ESR1, ETFDH, ETS2, FAH, FAS, FMO1, GABARAPL1, GAD1, GART, GCH1, GCLC, GCNT2, GSR, GSS, GSTT2, HES6, HMOX1, HPRT1, HSD11B1, ID2, IDH1, IGF1, IGFBP4"
"33","HALLMARK_FATTY_ACID_METABOLISM",0.000199920031987205,0.00334336342360415,0.273286903662837,3.50156313648448,0,121,"ACAA1, ACAA2, ACADL, ACADM, ACADS, ACAT2, ACO2, ACOT2, ACOT8, ACOX1, ACSL1, ACSL4, ACSL5, ACSS1, ADIPOR2, ADSL, ALDH1A1, ALDH9A1, ALDOA, APEX1, AUH, BCKDHB, BLVRA, BPHL, CA2, CA4, CBR1, CBR3, CCDC58, CD36, CIDEA, CPOX, CPT1A, CPT2, CRAT, D2HGDH, DECR1, DHCR24, DLD, DLST, ECH1, ECHS1, ECI1, ECI2, EHHADH, ELOVL5, ENO2, EPHX1, ERP29, ETFDH, FASN, FH, FMO1, G0S2, GABARAPL1, GAD2, GAPDHS, GCDH, GLUL, GPD1, GPD2, GRHPR, GSTZ1, HADH, HADHB, HCCS, HIBCH, HMGCL, HMGCS1, HPGD, HSD17B10, HSD17B11, HSD17B4, HSD17B7, HSDL2, HSPH1, IDH1, IDH3B, IDH3G, IDI1"
"34","HALLMARK_OXIDATIVE_PHOSPHORYLATION",0.000196734212079481,0.00334336342360415,0.180469263334747,2.84005416032228,0,183,"ABCB7, ACAA1, ACAA2, ACADM, ACADSB, ACAT1, ACO2, AFG3L2, AIFM1, ALAS1, ALDH6A1, ATP1B1, ATP5F1A, ATP5F1B, ATP5F1C, ATP5F1D, ATP5F1E, ATP5MC3, ATP5PD, ATP5PF, ATP5MF, ATP5ME, ATP5MG, ATP5PO, ATP6AP1, ATP6V0B, ATP6V0C, ATP6V0E1, ATP6V1C1, ATP6V1D, ATP6V1E1, ATP6V1F, ATP6V1G1, ATP6V1H, BAX, BCKDHA, CASP7, COX10, COX11, COX17, COX5A, COX5B, COX6A1, COX6B1, COX6C, COX7A2, COX7A2L, COX7B, COX7C, COX8A, CPT1A, CS, CYB5A, CYC1, DECR1, DLAT, DLD, DLST, ECH1, ECHS1, ECI1, ETFA, ETFDH, FDX1, FH, FXN, GLUD1, CYCS, GOT2, GPI, GRPEL1, HADHA, HADHB, HCCS, HSD17B10, HSPA9, HTRA2, IDH1, IDH2, IDH3A, IDH3B, IDH3G, IMMT, ISCA1, ISCU, LDHA, LDHB, LRPPRC, MDH1, MDH2, MFN2, MGST3, MPC1, MRPL11, MRPL15, MRPL34, MRPL35, MRPS11, MRPS12, MRPS15, MRPS22, MRPS30, MTRR, MTX2, NDUFA1, NDUFA2, NDUFA4, NDUFA5, NDUFA6, NDUFA7, NDUFA8, NDUFA9, NDUFAB1, NDUFB1, NDUFB2, NDUFB3, NDUFB4, NDUFB5, NDUFB6, NDUFB7, NDUFB8, NDUFC1, NDUFC2, NDUFS1, NDUFS2, NDUFS3, NDUFS4, NDUFS6, NDUFS7, NDUFS8, NDUFV1, NDUFV2"
"35","HALLMARK_GLYCOLYSIS",0.000783699059561128,0.00783699059561128,0.154458072027732,2.22205943030187,3,153,"AGL, AGRN, AK3, AK4, AKR1A1, ALDH7A1, ALDH9A1, ALDOA, ALG1, ANKZF1, ARPP19, AURKA, B3GALT6, B3GAT1, B3GAT3, B4GALT1, B4GALT4, B4GALT7, BPNT1, CACNA1H, CASP6, CD44, CDK1, CENPA, CHPF2, CHST1, CHST12, CHST2, CITED2, CLN6, COG2, COPB2, CXCR4, CYB5A, DCN, DDIT4, DEPDC1, DLD, DPYSL4, ECD, EFNA3, EGFR, ENO1, ENO2, ERO1A, EXT1, EXT2, FAM162A, FKBP4, FUT8, G6PD, GALE, GALK1, GALK2, GAPDHS, GCLC, GFPT1, GLCE, GLRX, GMPPA, GMPPB, GNE, GNPDA1, GOT1, GOT2, GPC1, GPC3, GPC4, GUSB, GYS1, HAX1, HDLBP, HK2, HMMR, HOMER1, HS2ST1, HS6ST2, HSPA5, IDH1, IDUA, IER3, IL13RA1, IRS2, KIF20A, KIF2A, LCT, LDHA, LHPP, LHX9, MDH1, MDH2, ME1, ME2, MERTK, MET, MIF, MPI, MXI1, NASP, NDST3, NDUFV3, NSDHL, NT5E, P4HA1, PAM, PAXIP1, PC, PDK3, PFKP, PGAM1, PGAM2, PGK1, PGM2, PHKA2, PKM, PKP2, PLOD1, PMM2, POLR3K, PPFIA4, PPIA, PPP2CB, PRPS1, PSMC4, PYGB, PYGL, QSOX1"
"36","HALLMARK_REACTIVE_OXYGEN_SPECIES_PATHWAY",0.202042018456705,0.315690653838602,-0.162888419343671,-1.24557274154481,1028,42,"TXNRD2, TXNRD1, TXN, STK25, SRXN1, SOD2, SOD1, SELENOS, SCAF4, SBNO2, PTPA, PRDX6, PRDX4, PRDX2, PRDX1, PFKP, NQO1, NDUFS2, NDUFB4, NDUFA6, MSRA, MGST1, MBP, LSP1, LAMTOR5, JUNB, IPCEF1, HMOX2, GSR, GPX3, GLRX, GCLM, GCLC, G6PD, FTL, FES, ERCC2, EGLN2"
"37","HALLMARK_P53_PATHWAY",0.606686930091185,0.664214852236735,-0.0626014369753761,-0.867989636293259,2993,145,"ZMAT3, ZFP36L1, ZNF365, ZBTB16, XPC, WWP1, WRAP73, VWA5A, VAMP8, TXNIP, TSPYL2, TSC22D1, TP53, TRIAP1, TRAFD1, TPRKB, TPD52L1, TOB1, TNNI1, TNFSF9, TM7SF3, TGFB1, TGFA, TCN2, TAX1BP3, TAP1, STOM, STEAP3, SP1, SOCS1, SLC7A11, SLC3A2, SLC35D1, SLC19A2, SESN1, SERTAD3, SEC61A1, SAT1, RXRA, RRP8, RPS27L, RPS12, RPL36, RPL18, RNF19B, RHBDF2, RETSAT, RCHY1, RB1, RAP2B, RALGDS, RAD9A, RAD51C, RACK1, RAB40C, PTPRE, PRMT2, PPP1R15A, PPM1D, POM121, PMM1, PLXNB2, PLK2"
"38","HALLMARK_UV_RESPONSE_UP",0.0565697091273821,0.136244974180148,0.119632363917652,1.54885599385604,281,124,"ABCB1, ACAA1, AGO2, ALAS1, ALDOA, AMD1, AP2S1, ARRB2, ASNS, ATF3, ATP6V1C1, ATP6V1F, BAK1, BCL2L11, BID, BMP2, BSG, BTG1, BTG2, BTG3, CA2, CASP3, CCK, CCND3, CDC5L, CDK2, CDKN1C, CDO1, CEBPG, CHKA, CLCN2, CLTB, CNP, CREG1, CYB5B, CYB5R1, DDX21, DGAT1, DLG4, DNAJB1, E2F5, EIF2S3, EIF5, ENO2, EPHX1, FKBP4, FMO1, FOS, FURIN, GCH1, GGH, GLS, GPX3, GRINA, GRPEL1, HMOX1, HNRNPU, HSPA13, HSPA2, HTR7, HYAL2, ICAM1, IGFBP2, IL6ST, IRF1, JUNB, KLHDC3, LHX2, LYN, MAOA, MAPK8IP2, MARK2, MGAT1, MMP14, MRPL23, NAT1, NFKBIA, NPTX2, NPTXR, NR4A1, NTRK3, NXF1, OLFM1, PARP2, PDAP1, PLCL1, POLE3, POLG2, POLR2H, PPAT, PPIF, PPP1R2, PPT1, PRKACA, PRKCD, PRPF3, PSMC3, PTPRD, RAB27A"
"39","HALLMARK_UV_RESPONSE_DN",0.292785571142285,0.435018598042815,0.0877072021603609,1.13191572088014,1460,123,"ABCC1, ACVR2A, ADD3, ADGRL2, AGGF1, AKT3, AMPH, ANXA2, ANXA4, APBB2, ARHGEF9, ATP2B1, ATP2B4, ATP2C1, ATRN, ATRX, ATXN1, BCKDHB, BDNF, BHLHE40, BMPR1A, CACNA1A, CAP2, CCN1, CDC42BPA, CDK13, CDKN1B, CDON, CELF2, CITED2, DAB2, DBP, DDAH1, DLC1, DLG1, DMAC2L, DUSP1, DYRK1A, EFEMP1, F3, FHL2, FYN, GCNT1, PIK3R3, GRK5, ICA1, IGF1R, IGFBP5, INPP4B, INSIG1, IRS1, ITGB3, KALRN, KCNMA1, KIT, LAMC1, LDLR, LPAR1, MAGI2, MAP1B, MAP2K5, MAPK14, MET, MGLL, MGMT, MIOS, MMP16, MRPS31, MTA1, NEK7, NFIB, NFKB1, NIPBL, NOTCH2, NR1D2, NR3C1, NRP1, PDGFRB, PDLIM5, PEX14, PHF3, PIAS3, PIK3CD, PLCB4, PLPP3, PMP22, PPARG, PRDM2, PRKAR2B, PRKCA, PRKCE, PTEN, PTPRM, RASA2, RBPMS, RGS4, RND3, RUNX1, RXRA, SCAF8, SCN8A, SDC2, SFMBT1, SIPA1L1, SLC22A18, SLC7A1, SMAD3, SMAD7"
"40","HALLMARK_ANGIOGENESIS",0.370149253731343,0.474550325296594,-0.201066678372328,-1.05509094865003,1859,19,"VTN, VEGFA, VCAN, VAV2, TNFRSF21, SPP1, SLCO2A1, PTK2, PGLYRP1, PDGFA, NRP1, LRPAP1, LPL, JAG1, ITGAV"
"41","HALLMARK_HEME_METABOLISM",0.15262539184953,0.263147227326775,0.0908218888095049,1.30657874889669,778,153,"ABCG2, ACKR1, ACSL6, ADD1, ADD2, ADIPOR1, AGPAT4, ALAS2, ALDH1L1, ALDH6A1, ANK1, ARHGEF12, ARL2BP, ASNS, ATG4A, ATP6V0A1, BACH1, BCAM, BLVRA, BLVRB, BMP2K, BNIP3L, BPGM, BSG, BTG2, BTRC, CA1, CA2, CAST, CAT, CCDC28A, CCND3, CDC27, CIR1, CLCN3, CPOX, CTNS, CTSB, CTSE, DAAM1, DCAF10, DCAF11, DCUN1D1, DMTN, E2F2, EIF2AK1, ELL2, ENDOD1, EPB41, EPOR, EZH1, FBXO34, FBXO7, FBXO9, FECH, FN3K, FOXJ2, FOXO3, GAPVD1, GCLC, GCLM, GDE1, GLRX5, GMPS, GYPA, GYPE, GYPB, HAGH, HDGF, HEBP1, HMBS, HTATIP2, HTRA2"
"42","HALLMARK_COAGULATION",0.0267038660821044,0.0785407825944248,0.175675009975517,1.69689154585187,133,68,"ADAM9, ANXA1, ARF4, BMP1, C1QA, C2, CAPN2, CASP9, CD9, CLU, CPN1, CPQ, CRIP2, CSRP1, CTSB, CTSE, CTSH, CTSO, DPP4, DUSP14, DUSP6, F2RL2, F3, FBN1, FN1, FURIN, FYN, GDA, GNG12, GSN, HPN, HTRA1, ISCU, ITGA2, ITGB3, KLF7, LAMP2, LEFTY2, LGMN, LRP1, LTA4H, MASP2, MMP11, MMP14, MMP2, MMP9"
