"","pathway","pval","padj","ES","NES","nMoreExtreme","size","leadingEdge"
"271","FGFR2 alternative splicing",0.0179226069246436,0.0969897719784841,-0.328708025799588,-1.851628105898,87,25,"TIAL1, TIA1, RBFOX2, PTBP1, POLR2L, POLR2K, POLR2J, POLR2I, POLR2H, POLR2G, POLR2F, POLR2E, POLR2D, POLR2C, POLR2B, POLR2A, NCBP2, NCBP1, HNRNPM, HNRNPH1, HNRNPF, HNRNPA1, GTF2F2, GTF2F1"
"272","FGFR2 mutant receptor activation",0.0325362602900823,0.0969897719784841,0.354658509011106,1.90808333502258,165,27,"FGF1, FGF10, FGF2, FGF20, FGF22, FGF23, FGF3, FGF5, FGF7, FGF9, FGFR2, GTF2F1, GTF2F2, NCBP1, NCBP2, POLR2A, POLR2B, POLR2C, POLR2D, POLR2E, POLR2F, POLR2G, POLR2H, POLR2I, POLR2J, POLR2K, POLR2L"
"273","FLT3 Signaling",0.22680412371134,0.257192911528873,0.17801173567187,0.659062397071157,1209,230,"ACTN2, AKT2, ANGPT1, APBB1IP, ARAF, ARRB1, ARRB2, ARTN, BRAF, BRAP, CALM1, CAMK2A, CAMK2B, CAMK2G, CNKSR1, CNKSR2, CSF2RA, CSF2RB, CSK, CUL3, DAB2IP, DLG1, DLG2, DLG3, DLG4, DUSP1, DUSP10, DUSP16, DUSP2, DUSP4, DUSP5, DUSP6, DUSP7, DUSP8, DUSP9, EGF, EGFR, ERBB3, ERBB4, FGF1, FGF10, FGF2, FGF20, FGF22, FGF23, FGF3, FGF5, FGF7, FGF9, FGFR1, FGFR2, FGFR3, FGFR4, FGG, FLT3, FLT3LG, FN1, FRS2, FRS3, FYN, GAB1, GAB2, GFRA1, GFRA2, GFRA3, GFRA4, UBA52, GRB2, GRIN1, GRIN2B, GRIN2D, HBEGF, HCK, HGF, HRAS, IL17RD, IL2, IL2RA, IL5RA, IQGAP1, IRS1, IRS2, ITGA2B, ITGB3, JAK1, JAK2, JAK3, KBTBD7, KIT, KITLG, KL, KLB, KRAS, KSR1, KSR2, LAMTOR2, LAMTOR3, LRRC7, MAP2K1, MAP2K2, MAP3K11, MAPK1, MAPK3, MARK3, MET, NCAM1, NEFL, NF1, NRAS, NRG1, NRG2, NRG3, NRG4, NRTN, PAQR3, PEBP1, PDE3B, PDGFA, PDGFB, PDGFRA, PDGFRB, PDPK1, PEA15, PHB, PIK3C3, PIK3CA, PIK3CB, PIK3R1, PIK3R2, PIK3R4, PPP2CA, PPP2CB, PPP2R1A, PPP2R1B, PPP2R5A, PPP2R5B, PPP2R5C, PPP2R5D, PPP2R5E, PPP5C, PSMA1, PSMA3, PSMA4, PSMA5, PSMA6, PSMA7, PSMA8, PSMB1, PSMB10, PSMB2, PSMB3, PSMB4, PSMB5, PSMB6, PSMB7, PSMC1, PSMC2, PSMC3, PSMC4, PSMC5, PSMC6, PSMD1, PSMD10, PSMD11, PSMD12, PSMD13, PSMD14, PSMD2, PSMD3, PSMD4, PSMD5, PSMD6, PSMD7, PSMD8, PSMD9, PSME1, PSME2, PSME3, PSME4, PSMF1, PTK2, PTPN11, PTPRA, RAF1, RANBP9, RAP1A, RAP1B, RAPGEF2, RASA1, RASA2, RASA3, RASA4, RASAL1, RASAL2, RASAL3, RASGEF1A, RASGRF1, RASGRF2, RASGRP1, RASGRP3, RASGRP4"
"274","FOXO-mediated transcription",0.252211519559662,0.280686013247943,0.136582148749695,0.82956018215184,1282,58,"ABCA6, AGRP, AKT1, AKT2, AKT3, ATXN3, BCL2L11, BCL6, BTG1, CAT, CAV1, CCNG2, CDKN1A, CDKN1B, CITED2, CREBBP, DDIT3, EP300, FASLG, FBXO32, FOXG1, FOXO1, FOXO3, FOXO4, FOXO6, GADD45A, GCK"
"275","FOXO-mediated transcription of cell cycle genes",0.102186878727634,0.139418795223417,0.301435406698565,1.35109664979667,513,16,"BTG1, CAV1, CCNG2, CDKN1A, CDKN1B, FOXG1, FOXO1, FOXO3, FOXO4, GADD45A"
"276","FOXO-mediated transcription of cell death genes",0.0533466533466533,0.099955591295894,0.352360068221587,1.54326318153783,266,15,"BCL2L11, BCL6, CITED2, CREBBP, DDIT3, EP300, FASLG, FOXO1, FOXO3, FOXO4"
"277","FOXO-mediated transcription of oxidative stress, metabolic and neuronal genes",0.351531814611155,0.377651825603934,0.179732694993018,0.949556815323821,1789,25,"ABCA6, AGRP, ATXN3, CAT, FBXO32, FOXO1, FOXO3, FOXO4, FOXO6, GCK, HDAC1, HDAC2, INS, NPY, NR3C1, PLXNA4, POMC, PPARGC1A, SIN3A, SIRT3, SMAD2, SMAD3, SMAD4, SOD2, SREBF1"
"278","FRS-mediated FGFR1 signaling",0.0257671125098348,0.0969897719784841,0.397904532017981,1.91062082963333,130,19,"FGF1, FGF10, FGF2, FGF20, FGF22, FGF23, FGF3, FGF5, FGF9, FGFR1, FRS2, FRS3, GRB2, HRAS, KL, KRAS"
"279","FRS-mediated FGFR2 signaling",0.0255704169944925,0.0969897719784841,0.400640184709031,1.92375663129825,129,19,"FGF1, FGF10, FGF2, FGF20, FGF22, FGF23, FGF3, FGF5, FGF7, FGF9, FGFR2, FRS2, FRS3, GRB2, HRAS"
"280","FRS-mediated FGFR3 signaling",0.050949050949051,0.0980844051158958,0.355651538308193,1.55767913004025,254,15,"FGF1, FGF2, FGF20, FGF23, FGF5, FGF9, FGFR3, FRS2, FRS3, GRB2, HRAS, KRAS"
"281","FRS-mediated FGFR4 signaling",0.050949050949051,0.0980844051158958,0.355651538308193,1.55767913004025,254,15,"FGF1, FGF2, FGF20, FGF23, FGF9, FGFR4, FRS2, FRS3, GRB2, HRAS, KLB, KRAS"
"282","Factors involved in megakaryocyte development and platelet production",0.114804793196753,0.149576708032315,0.287416716803708,1.52463690296586,593,105,"ABL1, AK3, AKAP1, AKAP10, CABLES1, CABLES2, CAPZA1, CAPZA2, CAPZB, CARMIL1, CBX5, CDC42, CDK2, CDK5, CENPE, DOCK1, DOCK10, DOCK11, DOCK2, DOCK3, DOCK4, DOCK5, DOCK6, DOCK7, DOCK8, DOCK9, EHD1, EHD2, EHD3, GATA4, H3-3A, HDAC1, HDAC2, HMG20B, IRF1, IRF2, ITPK1, JAK2, JMJD1C, KDM1A, KIF11, KIF13B, KIF15, KIF16B, KIF18A, KIF19, KIF1A, KIF1B, KIF1C, KIF20A, KIF20B, KIF21A, KIF21B, KIF22, KIF23, KIF26A, KIF26B, KIF27, KIF2A, KIF2C, KIF3A, KIF3B, KIF3C, KIF4A, KIF5A, KIF5B, KIF5C, KIF6, KIF9, KIFAP3, KIFC2, KIFC1, KLC1, KLC2, KLC3, KLC4"
"283","Fanconi Anemia Pathway",0.0411466458658346,0.0969897719784841,0.30510346663118,1.74409889714933,210,35,"ATR, ATRIP, DCLRE1A, DCLRE1B, EME1, EME2, ERCC1, ERCC4, FAAP100, FAAP24, FAN1, FANCA, FANCB, FANCC, FANCD2, FANCE, FANCF, FANCG, FANCI, FANCL, FANCM"
"284","Fatty acid metabolism",0.0647125999238675,0.107785306433194,0.999731885515115,4.64589585764587,339,145,"PRKAG2, ABCC1"
"285","Fatty acyl-CoA biosynthesis",0.0338716029933045,0.0969897719784841,0.368065318853709,2.01006261002539,171,29,"ACACA, ACLY, ACSBG1, ACSBG2, ACSL1, ACSL3, ACSL4, ACSL5, ACSL6, CBR4, ELOVL1, ELOVL2, ELOVL4, ELOVL5, ELOVL6, ELOVL7, FASN, HACD1, HACD2, HACD3, HACD4, HSD17B12"
"286","Fc epsilon receptor (FCERI) signaling",0.0667083593912862,0.109187739192341,-0.256446120602643,-1.85462298578109,319,121,"VAV3, VAV2, VAV1, UBE2N, UBE2D2, UBE2D1, UBC, UBB, TXK, TRAF6, TEC, TAB3, TAB2, TAB1, SYK, SOS1, SKP1, SHC1, RPS27A, RELA, RASGRP4, RASGRP2, RASGRP1, RAC1, PSMF1, PSME4, PSME3, PSME2, PSME1, PSMD9, PSMD8, PSMD7, PSMD6, PSMD5, PSMD4, PSMD3, PSMD2, PSMD14, PSMD13, PSMD12, PSMD11, PSMD10, PSMD1, PSMC6, PSMC5, PSMC4, PSMC3, PSMC2, PSMC1, PSMB7, PSMB6, PSMB5, PSMB4, PSMB3, PSMB2, PSMB10, PSMB1, PSMA8, PSMA7, PSMA6, PSMA5, PSMA4, PSMA3, PSMA1, PRKCQ, PPP3R1, PPP3CB, PPP3CA, PLCG2, PLCG1, PIK3R2, PIK3R1, PIK3CB, PIK3CA, PDPK1, PAK2, PAK1, NRAS, NFKBIA, NFKB1, NFATC3, NFATC2, NFATC1, MAPK9, MAPK8, MAPK3, MAPK10, MAPK1, MAP3K7, MAP3K1, MAP2K4, MALT1, LYN, LCP2, LAT2, KRAS, JUN, ITPR3, ITPR2, ITPR1, ITK, IKBKG, IKBKB"
"287","Fcgamma receptor (FCGR) dependent phagocytosis",0.143530335754958,0.177242087213418,0.143523447649374,0.816810319206298,730,82,"ABI1, ABI2, ABL1, ACTB, ACTG1, ACTR2, ACTR3, AHCYL1, ARPC1A, ARPC1B, ARPC2, ARPC3, ARPC4, ARPC5, BAIAP2, BRK1, BTK, CD247, CDC42, CFL1, CRK, CYFIP1, CYFIP2, DOCK1, ELMO1, ELMO2, FCGR1A, FCGR2A, FGR, FYN, GRB2, HCK, HSP90AB1, ITPR1, ITPR2, ITPR3, LIMK1, LYN, MAPK1, MAPK3, MYH9, MYO10, MYO1C, MYO5A, MYO9B, NCK1, NCKAP1, NCKAP1L, NCKIPSD, NF2, PAK1, PIK3CA, PIK3CB, PIK3R1, PIK3R2, PLA2G6, PLCG1, PLCG2, PLD1, PLD2, PLD3, PLD4, PLPP4, PLPP5"
"288","Fertilization",0.0227497527200791,0.0969897719784841,0.523904470734193,2.4673420922136,114,18,"ACR, ADAM2, ADAM21, B4GALT1, CATSPER1, CATSPER2, CATSPER3, CATSPER4, CATSPERB, CATSPERD, CATSPERG, CD9"
"289","Formation of Fibrin Clot (Clotting Cascade)",0.31345721870533,0.340970704986675,-0.195006113723937,-1.06516278083601,1534,23,"VWF, THBD, TFPI, SERPING1, SERPINE2, SERPIND1, SERPINC1, PRTN3, PROS1, PRCP, KNG1, KLKB1, GP5, FGG, F8, F5, F3, F2R, F2, F13A1, F12"
"290","Formation of HIV elongation complex in the absence of HIV Tat",0.056021862190123,0.102199096799529,0.238424345451252,1.42459898550099,286,43,"CCNH, CCNK, CCNT1, CCNT2, CDK7, CDK9, CTDP1, ELL, ELOA, ELOC, ERCC2, ERCC3, GTF2F1, GTF2F2, GTF2H1, GTF2H2, GTF2H3, GTF2H4, GTF2H5, MNAT1, NCBP1, NCBP2, NELFA, NELFB, NELFCD, NELFE, POLR2A, POLR2B, POLR2C, POLR2D, POLR2E, POLR2F, POLR2G, POLR2H, POLR2I, POLR2J, POLR2K, POLR2L"
"291","Formation of HIV-1 elongation complex containing HIV-1 Tat",0.060294687863513,0.102727937914758,0.232704974323923,1.38482616444366,310,41,"CCNH, CCNT1, CDK7, CDK9, CTDP1, ELL, ELOA, ELOC, ERCC2, ERCC3, GTF2F1, GTF2F2, GTF2H1, GTF2H2, GTF2H3, GTF2H4, GTF2H5, MNAT1, NCBP1, NCBP2, NELFA, NELFB, NELFCD, NELFE, POLR2A, POLR2B, POLR2C, POLR2D, POLR2E, POLR2F, POLR2G, POLR2H, POLR2I, POLR2J, POLR2K, POLR2L"
"292","Formation of Incision Complex in GG-NER",0.381967213114754,0.406988606809068,-0.137474202782771,-0.911762068269697,1863,43,"XPC, XPA, USP45, UBE2V2, UBE2N, UBE2I, UBC, UBB, SUMO2, SUMO1, RPS27A, RPA3, RPA2, RPA1, RNF111, RBX1, RAD23B, RAD23A, PIAS3, PIAS1, PARP2, PARP1, MNAT1, GTF2H5, GTF2H4, GTF2H3, GTF2H2, GTF2H1, SUMO3, UBA52, ERCC5, ERCC4, ERCC3, ERCC2, ERCC1, DDB2, DDB1, CUL4B, CUL4A, CHD1L, CETN2, CDK7, CCNH"
"293","Formation of RNA Pol II elongation complex",0.0685984624482555,0.111232086306283,0.211953624733475,1.28836702919531,347,56,"AFF4, CCNH, CCNK, CCNT1, CCNT2, CDC73, CDK7, CDK9, CTDP1, CTR9, EAF1, EAF2, ELL, ELOA, ELOC, ERCC2, ERCC3, GTF2F1, GTF2F2, GTF2H1, GTF2H2, GTF2H3, GTF2H4, GTF2H5, IWS1, LEO1, MLLT1, MLLT3, MNAT1, NCBP1, NCBP2, NELFA, NELFB, NELFCD, NELFE, PAF1, POLR2A, POLR2B, POLR2C, POLR2D, POLR2E, POLR2F, POLR2G, POLR2H, POLR2I, POLR2J, POLR2K, POLR2L"
"294","Formation of TC-NER Pre-Incision Complex",0.233891625615764,0.264079373390466,0.145742179005836,0.87841945201676,1186,53,"AQR, CCNH, CDK7, COPS2, COPS3, COPS4, COPS5, COPS6, COPS7A, COPS7B, COPS8, CUL4A, CUL4B, DDB1, EP300, ERCC2, ERCC3, ERCC6, ERCC8, UBA52, GPS1, GTF2H1, GTF2H2, GTF2H3, GTF2H4, GTF2H5, HMGN1, ISY1, MNAT1, POLR2A, POLR2B, POLR2C, POLR2D, POLR2E, POLR2F, POLR2G, POLR2H, POLR2I, POLR2J, POLR2K, POLR2L, PPIE, PRPF19"
"295","Formation of a pool of free 40S subunits",0.0382726156365125,0.0969897719784841,-0.476086023242771,-3.53737229297572,186,71,"RPSA, RPS9, RPS8, RPS7, RPS5, RPS4X, RPS3A, RPS28, RPS27L, RPS27A, RPS25, RPS24, RPS21, RPS20, RPS19, RPS17, RPS16, RPS15A, RPS15, RPS14, RPS13, RPS12, RPS11, RPLP1, RPL8, RPL7A, RPL6, RPL5, RPL4, RPL3L, RPL38, RPL37A, RPL36, RPL35, RPL34, RPL32, RPL30, RPL3, RPL29, RPL28, RPL27, RPL26, RPL23, RPL22L1, RPL19, RPL18A, RPL18, RPL14, RPL13A, RPL12, RPL11, RPL10A, RPL10"
"296","Formation of the Early Elongation Complex",0.0419906687402799,0.0969897719784841,0.294060960882862,1.65952954346324,215,33,"CCNH, CDK7, CTDP1, ERCC2, ERCC3, GTF2F1, GTF2F2, GTF2H1, GTF2H2, GTF2H3, GTF2H4, GTF2H5, MNAT1, NCBP1, NCBP2, NELFA, NELFB, NELFCD, NELFE, POLR2A, POLR2B, POLR2C, POLR2D, POLR2E, POLR2F, POLR2G, POLR2H, POLR2I, POLR2J, POLR2K, POLR2L"
"297","Formation of the HIV-1 Early Elongation Complex",0.0419906687402799,0.0969897719784841,0.294060960882862,1.65952954346324,215,33,"CCNH, CDK7, CTDP1, ERCC2, ERCC3, GTF2F1, GTF2F2, GTF2H1, GTF2H2, GTF2H3, GTF2H4, GTF2H5, MNAT1, NCBP1, NCBP2, NELFA, NELFB, NELFCD, NELFE, POLR2A, POLR2B, POLR2C, POLR2D, POLR2E, POLR2F, POLR2G, POLR2H, POLR2I, POLR2J, POLR2K, POLR2L"
"298","Formation of the beta-catenin:TCF transactivating complex",0.222517911975435,0.253436702807908,-0.184938797232571,-1.11388109173256,1086,32,"TRRAP, TLE4, TLE3, TLE2, TLE1, TERT, TCF7L2, TCF7L1, TCF7, TCF4, SMARCA4, RUVBL1, RUNX3, RBBP5, PYGO2, PYGO1"
"299","Formation of the cornified envelope",0.504689331770223,0.522767755594828,0.15170258047353,0.822188066579465,2582,28,"CAPN1, CAPNS1, CSTA, DSC2, DSC3, DSG1, DSG2, DSG3, DSP, EVPL, FURIN, JUP, KAZN, KLK12, KLK8, LIPK, LIPM, PCSK6, PERP, PKP2, PKP4, PPL, PRSS8"
"300","Formation of the ternary complex, and subsequently, the 43S complex",0.0259819967266776,0.0969897719784841,-0.278746727022589,-1.83716268945003,126,42,"RPSA, RPS9, RPS8, RPS7, RPS5, RPS4X, RPS3A, RPS28, RPS27L, RPS27A, RPS25, RPS24, RPS21, RPS20, RPS19, RPS17, RPS16, RPS15A, RPS15, RPS14, RPS13, RPS12, RPS11"
"301","Formation of tubulin folding intermediates by CCT/TriC",0.007883565797453,0.0969897719784841,-0.419912269041606,-2.08028581750634,38,18,"TUBB6, TUBB4B, TUBB4A, TUBB2B, TUBB2A, TUBA8, TUBA4A, TUBA1C, TUBA1B"
"302","G alpha (12/13) signalling events",0.0770283479960899,0.119325164083229,0.302524309261236,1.79044546396486,393,72,"ABR, ADRA1A, ADRA1B, ADRA1D, AKAP13, ARHGEF1, ARHGEF10, ARHGEF10L, ARHGEF11, ARHGEF12, ARHGEF15, ARHGEF16, ARHGEF17, ARHGEF18, ARHGEF19, ARHGEF2, ARHGEF26, ARHGEF3, ARHGEF33, ARHGEF37, ARHGEF38, ARHGEF4, ARHGEF40, ARHGEF6, ARHGEF7, ARHGEF9, BTK, ECT2, FGD1, FGD2, FGD3, FGD4, GNA12, GNA13, GNB1, GNB3, GNB4, GNB5, GNG11, GNG12, GNG13, GNG2, GNG3, GNG4, GNG7, GNG8, GNGT2"
"303","G alpha (i) signalling events",0.254464285714286,0.282707920414697,0.213281160029842,0.728544252002905,1367,270,"ABCA4, ACKR3, ADCY1, ADCY2, ADCY3, ADCY5, ADCY6, ADCY7, ADCY8, ADCY9, ADORA1, ADRA2A, ADRA2C, AGRN, AGT, AGTR2, AHCYL1, AKR1B10, ANXA1, APOA1, APOA2, APOB, APOE, APOM, APP, AWAT2, BCO2, BDKRB2, C3AR1, C5AR1, CALM1, CAMK2A, CAMK2B, CAMK2G, CAMK4, CAMKK1, CAMKK2, CAMKMT, CCL27, CCL28, CCL4, CCL5, CCL23, CCR1, CCR10, CCR2, CCR4, CCR5, CCR9, CDK5, CHRM2, CHRM4, CLPS, CNGA1, CNR1, CNR2, CORT, CREB1, CX3CL1, CX3CR1, CXCL11, CXCL12, CXCL16, CXCR5, CXCR6, CYP4V2, DHRS3, DRD3, FNTA, FNTB, FPR1, FPR2, GABBR1, GABBR2, GALR1, GNAI1, GNAI2, GNAI3, GNAL, GNAO1, GNAS, GNAT1, GNAZ, GNB1, GNB3, GNB4, GNB5, GNG11, GNG12, GNG13, GNG2, GNG3, GNG4, GNG7, GNG8, GNGT2, GPC1, GPC3, GPC4, GPC5, GPC6, GPER1, GPR17, GPR18, GPR183, GPR37, GPR37L1, GPR55, GPSM1, GPSM2, GRK2, GRK4, GRM2, GRM3, GRM4, GRM7, GRM8, GUCA1B, GUCY2D, C5, HEBP1, HRH3, HRH4, HSD17B1, HSD17B6, HSPG2, HTR1A, HTR1B, HTR1F, HTR5A, INSL5, ITPR1, ITPR2, ITPR3, KNG1, KPNA2, LDLR, LPAR1, LPAR2, LPAR5, LPL, LRP1, LRP10, LRP12, LRP8, MAPK1, MCHR1, METAP1, METAP2, MTNR1B, MYO7A, NAPEPLD, NMS, NMT1, NMT2, NMU, NMUR1, NPB, NPY, NPY1R, NPY2R, NPY5R, OPN1LW, OPN1MW, OPN1SW, OPN3, OPN5, OPRD1, OPRL1, OPRM1, P2RY12, P2RY13, P2RY14, PCP2, PDE1A, PDE1B, PDE1C, PDE4A, PDE4B, PDE4C, PDE4D, PDE6A, PDE6B, PDE6G, PDYN, PENK, PLA2G4A, PLB1, PLCB1, PLCB2, PLCB3, PLCB4, PNLIP, PNOC, POMC, PPEF1, PPP1CA, PPP1R1B, PPP2CA, PPP2CB, PPP2R1A, PPP2R1B, PPP2R5D, PPP3CA, PPP3CB, PPP3CC, PPP3R1, PRKACA, PRKACB, PRKAR1A, PRKAR1B, PRKAR2A, PRKAR2B, PRKCA, PRKCD, PRKCG, PRKCQ, PRKX, PSAP, PTGER3, RBP1, RBP4, RCVRN, RDH10, RDH11, RDH12, RDH5, RETSAT, RGR, RGS10, RGS11, RGS12, RGS14, RGS16, RGS17, RGS19, RGS20, RGS21, RGS22, RGS3, RGS4, RGS5, RGS6, RGS7, RGS8, RGS9, RGSL1, RHO, RLBP1, RPE65, RRH, S1PR1, S1PR2, S1PR3, S1PR5, SAG, SDC2, SDC3, SDC4"
"304","G alpha (q) signalling events",0.165044838771227,0.199086532051967,0.181046906959027,0.816124889053824,864,157,"ABHD12, ABHD6, ADRA1A, ADRA1B, ADRA1D, AGT, AGTR1, ANXA1, APP, ARHGEF25, AVPR1B, BDKRB2, BTK, CCK, CCKBR, CCL23, CHRM1, CHRM3, CHRM5, CREB1, CYSLTR1, DAGLA, DAGLB, DGKA, DGKB, DGKD, DGKE, DGKG, DGKH, DGKI, DGKK, DGKQ, DGKZ, EDNRA, EDNRB, EGFR, F2, F2R, F2RL2, FPR2, GCG, GHSR, GNA11, GNA14, GNA15, GNB1, GNB3, GNB4, GNB5, GNG11, GNG12, GNG13, GNG2, GNG3, GNG4, GNG7, GNG8, GNGT2, GNRH1, GNRHR, GPR143, GPR17, GPR39, GPR4, GPR68, GRB2, GRK2, GRK5, GRM1, GRM5, GRP, HBEGF, HCRT, HCRTR2, HRAS, HRH1, HTR2A, HTR2B, HTR2C, ITPR1, ITPR2, ITPR3, KALRN, KISS1R, KNG1, KRAS, LPAR1, LPAR2, LPAR4, LPAR5, LPAR6, MAPK1, MAPK3, MAPK7, MCHR1, MGLL, NMB, NMBR, NMS, NMU, NMUR1, NPFFR1, NPFFR2, NPS, NPSR1, NRAS, NTS, NTSR1, NTSR2, OPN4, P2RY2, P2RY6, PIK3CA, PIK3R1, PIK3R2, PIK3R3, PLCB1, PLCB2, PLCB3, PLCB4, PRKCA, PRKCD, PRKCE, PRKCH, PRKCQ, PROK2, PTAFR, PTGER1, QRFPR, RASGRP1, RASGRP2, RGS16, RGS17, RGS19, RGS2, RGS21, RGS3, RGS4, RGS5, RGSL1"
"305","G alpha (s) signalling events",0.174928774928775,0.208353380664593,0.249386706884278,1.08759601750796,920,167,"ADCY1, ADCY2, ADCY3, ADCY5, ADCY6, ADCY7, ADCY8, ADCY9, ADCYAP1, ADCYAP1R1, ADM, ADORA2A, ADRB1, ADRB3, ARRB1, ARRB2, CALCA, CALCB, CALCR, CALCRL, CGA, CRHR1, DRD5, FSHR, GCG, GIPR, GLP1R, GLP2R, OR10AD1, GNAI1, GNAI2, GNAI3, GNAL, GNAS, GNAZ, GNB1, GNB3, GNB4, GNB5, GNG11, GNG12, GNG13, GNG2, GNG3, GNG4, GNG7, GNG8, GNGT2, GPR176, GPR27, GPR39, GPR45, GPR83, GRK2, GRK3, GRK5, GRK6, HRH2, HTR4, HTR6, HTR7, LHCGR, MC2R, MC4R, MC5R, NPS, NPSR1, OR5M3, OR8K3, OR5V1, OR5L2, OR5L1, OR4A16, OR4C5, OR2W1, OR2Y1, OR10V1, OR4D11, OR4D10, OR4D6, OR5A2, OR8B8, OR2C1, OR10G3, OR7E24, OR6A2, OR6P1, OR5AU1, OR2T5, OR2T4, OR2T29, OR10H5, OR10H2, OR2K2, OR13D1, OR13C8, OR13F1, OR8S1, OR14C36, OR2T1, OR2AK2, OR2W3, OR11L1, OR8G1, OR8G5, OR5P2, OR10A6, OR10A3, OR52K2, OR2V1, OR2V2, OR51S1, OR51Q1, OR56B1, OR51B4, OR52E8, OR52E6, OR52E5, OR56A3, OR56B4, OR52B2, OR2D2, OR5D18, OR5A1, OR6C1, OR6C6, OR9K2, OR2H1, OR6X1, PDE10A, PDE11A, PDE1A, PDE1B, PDE2A, PDE3A, PDE3B, PDE4A, PDE4C, PDE4D, PDE7A, PDE7B, PDE8A, PDE8B"
"306","G alpha (z) signalling events",0.0434276851492827,0.0969897719784841,0.332131382286997,1.97651223210912,223,41,"ADCY1, ADCY2, ADCY3, ADCY5, ADCY6, ADCY7, ADCY8, ADCY9, ADRA2A, ADRA2C, GNAI1, GNAI2, GNAI3, GNAS, GNAZ, GNB1, GNB3, GNB4, GNB5, GNG11, GNG12, GNG13, GNG2, GNG3, GNG4, GNG7, GNG8, GNGT2"
"307","G beta:gamma signalling through CDC42",0.0214711729622266,0.0969897719784841,0.586423444976077,2.62847274826514,107,16,"ARHGEF6, CDC42, GNB1, GNB3, GNB4, GNB5, GNG11, GNG12, GNG13, GNG2, GNG3, GNG4, GNG7, GNG8, GNGT2"
"308","G beta:gamma signalling through PI3Kgamma",0.0269631962212163,0.0969897719784841,0.41077799197855,2.02641203974232,136,21,"AKT1, AKT2, AKT3, GNB1, GNB3, GNB4, GNB5, GNG11, GNG12, GNG13, GNG2, GNG3, GNG4, GNG7, GNG8, GNGT2"
"309","G beta:gamma signalling through PLC beta",0.0226640159045726,0.0969897719784841,0.461290536948432,2.067600836544,113,16,"GNB1, GNB3, GNB4, GNB5, GNG11, GNG12, GNG13, GNG2, GNG3, GNG4, GNG7, GNG8, GNGT2"
"310","G protein gated Potassium channels",0.00347009593794652,0.0969897719784841,-0.999867056633874,-5.17972747830917,16,20,"KCNJ3"
"311","G-protein activation",0.0274995089373404,0.0969897719784841,0.512685692183099,2.5756836810543,139,22,"GNAI1, GNAI2, GNAI3, GNAO1, GNAT1, GNAZ, GNB1, GNB3, GNB4, GNB5, GNG11, GNG12, GNG13, GNG2, GNG3, GNG4, GNG7, GNG8, GNGT2"
"312","G-protein beta:gamma signalling",0.0351699882766706,0.0969897719784841,0.332468741686619,1.80189309286749,179,28,"AKT1, AKT2, AKT3, ARHGEF6, BTK, CDC42, GNB1, GNB3, GNB4, GNB5, GNG11, GNG12, GNG13, GNG2, GNG3, GNG4, GNG7, GNG8, GNGT2, PAK1, PDPK1, PIK3CG, PIK3R5, PIK3R6, PLCB1, PLCB2, PLCB3"
"313","G-protein mediated events",0.0502912621359223,0.0980844051158958,0.33697389451252,2.04096096642383,258,48,"ADCY1, ADCY2, ADCY3, ADCY5, ADCY6, ADCY7, ADCY8, ADCY9, AHCYL1, CALM1, CAMK2A, CAMK2B, CAMK2G, CAMK4, CAMKK1, CAMKK2, CREB1, GNAI1, GNAI2, GNAI3, GNAL, GNAO1, GNAT1, GNAZ, GRK2, ITPR1, ITPR2, ITPR3, KPNA2, MAPK1, PDE1A, PDE1B, PDE1C, PLA2G4A, PLCB1, PLCB2, PLCB3, PLCB4, PRKACA, PRKACB, PRKAR1A, PRKAR1B, PRKAR2A, PRKAR2B, PRKCA, PRKCD, PRKCG, PRKX"
"314","G0 and Early G1",0.137666928515318,0.172042344038951,0.228448700046546,1.2069313270437,700,25,"CCNA1, CCNA2, CCNE1, CCNE2, CDC25A, CDC6, CDK2, DYRK1A, E2F1, E2F4, E2F5, HDAC1, LIN37, LIN52, LIN54, LIN9, MAX, MYBL2, MYC"
"315","G1 Phase",0.0520039100684262,0.0986027133853221,0.250099853548129,1.48988591966363,265,42,"ABL1, CCND1, CCND2, CCND3, CCNH, CDK4, CDK6, CDK7, CDKN1A, CDKN1B, CDKN1C, CDKN2B, CDKN2C, CDKN2D, CKS1B, CUL1, E2F1, E2F2, E2F3, E2F4, E2F5"
"316","G1/S DNA Damage Checkpoints",0.0344757655647942,0.0969897719784841,-0.411836758331394,-2.97033233200942,169,61,"ZNF385A, UBC, UBB, TP53, RPS27A, PSMF1, PSME4, PSME3, PSME2, PSME1, PSMD9, PSMD8, PSMD7, PSMD6, PSMD5, PSMD4, PSMD3, PSMD2, PSMD14, PSMD13, PSMD12, PSMD11, PSMD10, PSMD1, PSMC6, PSMC5, PSMC4, PSMC3, PSMC2, PSMC1, PSMB7, PSMB6, PSMB5, PSMB4, PSMB3, PSMB2, PSMB10, PSMB1, PSMA8, PSMA7, PSMA6, PSMA5, PSMA4, PSMA3, PSMA1"
"317","G1/S Transition",0.0662210152496344,0.108731982452475,-0.216073340471092,-1.56433048554029,316,120,"WEE1, UBC, UBB, TYMS, TK1, TFDP2, TFDP1, SKP2, SKP1, RRM2, RPS27A, RPA3, RPA2, RPA1, RBL2, RBL1, RB1, PSMF1, PSME3, PSME2, PSME1, PSMD9, PSMD8, PSMD7, PSMD6, PSMD5, PSMD4, PSMD3, PSMD2, PSMD14, PSMD13, PSMD12, PSMD11, PSMD10, PSMD1, PSMC6, PSMC5, PSMC4, PSMC3, PSMC2, PSMC1, PSMB7, PSMB6, PSMB5, PSMB4, PSMB3, PSMB2, PSMB10, PSMB1, PSMA7, PSMA6, PSMA5, PSMA4, PSMA3, PSMA1, PRIM2, PRIM1, PPP2R3B, PPP2R1B, PPP2R1A, PPP2CB, PPP2CA, POLE4, POLE3, POLE2, POLE, POLA2, POLA1, PCNA, ORC6, ORC5, ORC4, ORC3, ORC2, ORC1"
"318","G1/S-Specific Transcription",0.495369458128079,0.514137194328345,0.157677473477447,0.840255684407209,2513,26,"CCNA1, CCNE1, CDC25A, CDC45, CDC6, DHFR, E2F1, E2F4, E2F5, E2F6, FBXO5, HDAC1, LIN37, LIN52, LIN54, LIN9"
"319","G2/M Checkpoints",0.0662210152496344,0.108731982452475,-0.308253033547466,-2.23169418581322,316,120,"YWHAZ, YWHAQ, YWHAH, YWHAG, YWHAE, YWHAB, WRN, WEE1, UIMC1, UBE2V2, UBE2N, UBC, UBB, TP53BP1, TP53, TOPBP1, TOP3A, SUMO1, RPS27A, RPA3, RPA2, RPA1, RNF168, RMI2, RMI1, RHNO1, RFC5, RFC4, RFC3, RFC2, RBBP8, RAD9B, RAD9A, RAD50, RAD17, RAD1, PSMF1, PSME4, PSME3, PSME2, PSME1, PSMD9, PSMD8, PSMD7, PSMD6, PSMD5, PSMD4, PSMD3, PSMD2, PSMD14, PSMD13, PSMD12, PSMD11, PSMD10, PSMD1, PSMC6, PSMC5, PSMC4, PSMC3, PSMC2, PSMC1, PSMB7, PSMB6, PSMB5, PSMB4, PSMB3, PSMB2, PSMB10, PSMB1, PSMA8, PSMA7, PSMA6, PSMA5, PSMA4, PSMA3, PSMA1"
"320","G2/M DNA damage checkpoint",0.0313511326860841,0.0969897719784841,-0.303915907913243,-2.13369963028684,154,54,"YWHAZ, YWHAQ, YWHAH, YWHAG, YWHAE, YWHAB, WRN, WEE1, UIMC1, UBE2V2, UBE2N, TP53BP1, TP53, TOPBP1, TOP3A, SUMO1, RPA3, RPA2, RPA1, RNF168, RMI2, RMI1, RHNO1, RFC5, RFC4, RFC3, RFC2, RBBP8, RAD9B, RAD9A, RAD50, RAD17, RAD1"
"321","G2/M Transition",0.176984428408659,0.209841446438969,0.171835839598998,0.744476812254299,931,168,"ACTR1A, AJUBA, AKAP9, ALMS1, AURKA, BORA, BTRC, CCNA1, CCNA2, CCNB2, CCNH, CCP110, CDC25A, CDC25B, CDK11A, CDK11B, CDK2, CDK5RAP2, CDK7, CDKN1A, CENPF, CENPJ, CEP131, CEP135, CEP152, CEP164, CEP192, CEP250, CEP290, CEP41, CEP57, CEP63, CEP70, CEP72, CEP76, CEP78, CETN2, CKAP5, CLASP1, CNTRL, CSNK1D, CSNK1E, CUL1, DCTN1, DCTN2, DCTN3, DYNC1H1, DYNC1I2, DYNLL1, EP300, FBXL18, FBXL7, FBXW11, FGFR1OP, FKBPL, UBA52, HAUS1, HAUS2, HAUS3, HAUS4, HAUS6, HAUS7, HAUS8, HSP90AB1, LCMT1, LIN37, LIN52, LIN54, LIN9, MAPRE1, MNAT1, MYBL2, MZT1, MZT2A, MZT2B, NDE1, NEDD1, NEK2, NINL, NME7, ODF2, OFD1, OPTN, PAFAH1B1, PCM1, PCNT, PHLDA1, PKMYT1, PLK1, PLK4, PPME1, PPP1CB, PPP1R12A, PPP1R12B, PPP2CA, PPP2CB, PPP2R1A, PPP2R1B, PPP2R2A, PPP2R3B, PRKACA, PRKAR2B, PSMA1, PSMA3, PSMA4, PSMA5, PSMA6, PSMA7, PSMA8, PSMB1, PSMB10, PSMB2, PSMB3, PSMB4, PSMB5, PSMB6, PSMB7, PSMC1, PSMC2, PSMC3, PSMC4, PSMC5, PSMC6, PSMD1, PSMD10, PSMD11, PSMD12, PSMD13, PSMD14, PSMD2, PSMD3, PSMD4, PSMD5, PSMD6, PSMD7, PSMD8, PSMD9, PSME1, PSME2, PSME3, PSME4, PSMF1"
"322","GABA B receptor activation",0.00859774820880246,0.0969897719784841,-0.999866950505588,-6.02217007508644,41,32,"KCNJ3"
"323","GABA receptor activation",0.0125721352019786,0.0969897719784841,-0.999866808737347,-6.82828891140384,60,48,"KCNJ3"
"324","GABA synthesis, release, reuptake and degradation",0.0677178087729937,0.110492537512048,-0.300197911589644,-1.48720936244681,334,18,"VAMP2, SYT1, STXBP1, STX1A, SNAP25, SLC6A13, SLC6A11, SLC6A1, SLC32A1, RIMS1, RAB3A"
"325","GLI3 is processed to GLI3R by the proteasome",0.0313511326860841,0.0969897719784841,-0.553112739655045,-3.88323354381899,154,54,"UBC, UBB, SUFU, SKP1, RPS27A, RBX1, PSMF1, PSME4, PSME3, PSME2, PSME1, PSMD9, PSMD8, PSMD7, PSMD6, PSMD5, PSMD4, PSMD3, PSMD2, PSMD14, PSMD13, PSMD12, PSMD11, PSMD10, PSMD1, PSMC6, PSMC5, PSMC4, PSMC3, PSMC2, PSMC1, PSMB7, PSMB6, PSMB5, PSMB4, PSMB3, PSMB2, PSMB10, PSMB1, PSMA8, PSMA7, PSMA6, PSMA5, PSMA4, PSMA3, PSMA1, PRKACB, PRKACA"
"326","GPCR ligand binding",0.252374743900168,0.280686013247943,0.16397231200042,0.563430017076023,1354,268,"ACKR1, ACKR3, ACKR4, ADCYAP1, ADCYAP1R1, ADGRE1, ADM, ADORA1, ADORA2A, ADRA1A, ADRA1B, ADRA1D, ADRA2A, ADRA2C, ADRB1, ADRB3, AGT, AGTR1, AGTR2, ANXA1, APP, AVPR1B, BDKRB2, C3AR1, C5AR1, C5AR2, CALCA, CALCB, CALCR, CALCRL, CCK, CCKBR, CCL17, CCL2, CCL27, CCL28, CCL3, CCL4, CCL5, CCL23, CCR1, CCR10, CCR2, CCR4, CCR5, CCR9, CD55, CGA, CHRM1, CHRM2, CHRM3, CHRM4, CHRM5, CMKLR1, CNR1, CNR2, CORT, CRHBP, CRHR1, CX3CL1, CX3CR1, CXCL11, CXCL12, CXCL16, CXCR5, CXCR6, CYSLTR1, DRD3, DRD5, ECE1, ECE2, EDNRA, EDNRB, F2, F2R, F2RL2, FPR1, FPR2, FSHR, FZD1, FZD2, FZD3, FZD4, FZD6, FZD7, FZD8, FZD9, GABBR1, GABBR2, GALR1, GCG, GHSR, GIPR, GLP1R, GLP2R, GNAS, GNB1, GNB3, GNB4, GNB5, GNG11, GNG12, GNG13, GNG2, GNG3, GNG4, GNG7, GNG8, GNGT2, GNRH1, GNRHR, GPER1, GPR143, GPR17, GPR18, GPR183, GPR35, GPR37, GPR37L1, GPR39, GPR4, GPR55, GPR68, GRM1, GRM2, GRM3, GRM4, GRM5, GRM7, GRM8, GRP, C5, HCRT, HCRTR2, HEBP1, HRH1, HRH2, HRH3, HRH4, HTR1A, HTR1B, HTR1F, HTR2A, HTR2B, HTR2C, HTR4, HTR5A, HTR6, HTR7"
"327","GPVI-mediated activation cascade",0.0187410877979222,0.0969897719784841,-0.379078533102745,-2.24086351672357,91,30,"VAV3, VAV2, VAV1, SYK, RHOG, RHOB, RHOA, RAC2, RAC1, PTPN6, PTPN11, PRKCZ, PLCG2, PIK3R6, PIK3R5, PIK3R3, PIK3R2, PIK3R1, PIK3CG, PIK3CB, PIK3CA, PDPN, PDPK1"
"328","GTP hydrolysis and joining of the 60S ribosomal subunit",0.0437091503267974,0.0969897719784841,-0.383747671229039,-2.87117789587028,213,81,"RPSA, RPS9, RPS8, RPS7, RPS5, RPS4X, RPS3A, RPS28, RPS27L, RPS27A, RPS25, RPS24, RPS21, RPS20, RPS19, RPS17, RPS16, RPS15A, RPS15, RPS14, RPS13, RPS12, RPS11, RPLP1, RPL8, RPL7A, RPL6, RPL5, RPL4, RPL3L, RPL38, RPL37A, RPL36, RPL35, RPL34, RPL32, RPL30, RPL3, RPL29, RPL28, RPL27, RPL26, RPL23, RPL22L1, RPL19, RPL18A, RPL18, RPL14, RPL13A, RPL12, RPL11, RPL10A, RPL10"
"329","Gamma carboxylation, hypusine formation and arylsulfatase activation",0.0330207112153185,0.0969897719784841,0.524940143655227,2.8450374438894,168,28,"ARSA, ARSB, ARSG, ARSI, ARSJ, ARSK, BGLAP, DHPS, DNAJC24, DPH1, DPH2, DPH3, DPH5, DPH6, DPH7, EEF2, EIF5A, EIF5A2, F2, FN3K, FN3KRP, FURIN, GAS6, GGCX"
"330","Gap junction trafficking",0.0214711729622266,0.0969897719784841,0.602771132376396,2.70174650837316,107,16,"AP2M1, CLTA, CLTB, CLTC, DAB2, DNM1, DNM2, GJA4, GJA5, GJB1, GJB2, GJB6, GJC2, GJD2, GJD4"
"331","Gap junction trafficking and regulation",0.0227497527200791,0.0969897719784841,0.498559971642519,2.3479814970896,114,18,"AP2M1, CLTA, CLTB, CLTC, DAB2, DNM1, DNM2, GJA4, GJA5, GJB1, GJB2, GJB6, GJC2, GJD2, GJD4"
