"","pathway","pval","padj","ES","NES","nMoreExtreme","size","leadingEdge"
"43","HALLMARK_IL2_STAT5_SIGNALING",0.194461048017533,0.313646851641183,0.0897025364456054,1.24223686284894,975,142,"ABCB1, AHCY, AHNAK, AHR, ALCAM, AMACR, ANXA4, APLP1, ARL4A, BATF, BATF3, BCL2, BCL2L1, BHLHE40, BMP2, BMPR2, CAPG, CAPN3, CA2, CASP3, CCND2, CCND3, CD44, CD48, CD81, CD83, CD86, CDC42SE2, CDKN1C, COCH, COL6A1, CSF1, CTSZ, CXCL10, CYFIP1, DCPS, DENND5A, DHRS3, DRC1, EEF1AKMT1, ENPP1, ETFBKMT, ETV4, F2RL2, FAH, FAM126B, FGL2, FURIN, GABARAPL1, GADD45B, GALM, GLIPR2, GPR65, GUCY1B1, HIPK2, HK2, HOPX, HUWE1, ICOS, IFITM3, IFNGR1, IGF1R, IGF2R, IKZF2, IL10, IL10RA, IL1RL1, IL4R, IRF4, ITGA6, ITGAV"
"44","HALLMARK_BILE_ACID_METABOLISM",0.010752688172043,0.0336021505376344,0.183415451650746,1.85611259917552,53,75,"ABCA1, ABCA2, ABCA3, ABCA4, ABCA5, ABCA6, ABCA8, ABCA9, ABCD1, ABCD2, ABCD3, ACSL1, ACSL5, ALDH1A1, ALDH9A1, AMACR, AR, ATXN1, BCAR3, BMP6, CAT, CROT, CYP27A1, CYP39A1, CYP46A1, CYP7B1, DHCR24, EFHC1, FADS1, FADS2, GCLM, HSD3B1, GNPAT, HSD17B11, HSD17B4, IDH1, IDH2, IDI1, ISOC1, LIPE, LONP2, MLYCD, NEDD4, NPC1, NR3C2, NUDT12, PAOX, PECR, PEX1, PEX11A, PEX12, PEX13, PEX16, PEX19, PEX26, PEX6, PEX7, PFKM, PHYH, PNPLA8, PRDX5, RBP1, RETSAT, RXRA, RXRG, SCP2, SLC22A18, SLC23A1, SLC23A2, SLC29A1, SLC35B2, SLCO1A2, SOAT2, SOD1"
"45","HALLMARK_PEROXISOME",0.00301628795495677,0.0150814397747838,0.205192678413699,2.10667825294713,14,78,"ABCB1, ABCB4, ABCB9, ABCC5, ABCD1, ABCD2, ABCD3, ACAA1, ACOT8, ACOX1, ACSL1, ACSL4, ACSL5, ALDH1A1, ALDH9A1, ATXN1, BCL10, CACNA1B, CADM1, CAT, CDK7, CLN6, CNBP, CRAT, CTBP1, CTPS1, DHCR24, DHRS3, DLG4, ECH1, ECI2, EHHADH, ELOVL5, ERCC1, ERCC3, FADS1, FIS1, GNPAT, HMGCL, HRAS, HSD17B11, HSD17B4, IDE, IDH1, IDH2, IDI1, ISOC1, ITGB1BP1"
"46","HALLMARK_ALLOGRAFT_REJECTION",0.000200601805416249,0.00334336342360415,0.233129317247276,3.01827806905629,0,124,"ABCE1, ABI1, ACHE, ACVR2A, AKT1, APBB1, B2M, BCAT1, BCL10, BCL3, BRCA1, C2, CAPG, CCL2, CCL5, CCL7, CCND2, CCND3, CCR1, CCR2, CCR5, CD28, CD4, CD40, CD47, CD74, CD80, CD86, CFP, CSF1, CSK, CTSS, CXCR3, DEGS1, DYRK3, EGFR, EIF3A, EIF3D, EIF3J, EIF4G3, EIF5A, ELF4, ETS1, F2R, FAS, FCGR2B, FGR, FLNA, FYB1, GALNT1, GBP2, GCNT1, GLMN, GPR65, HLA-DMA, HLA-DMB, HLA-DOB, HCLS1, HDAC9, HIF1A, ICAM1, ICOSLG, IFNAR2, IFNGR1, IFNGR2, IGSF6, IKBKB, IL10, IL12A, IL15, IL16, IL18, IL18RAP, IL4, IL4R, INHBA, IRF4, IRF7, ITK, JAK2"
"47","HALLMARK_SPERMATOGENESIS",0.989255869478711,0.989255869478711,0.0489451045099721,0.501300144808734,4971,77,"ACRBP, AGFG1, ARL4A, ART3, AURKA, BRAF, CAMK4, CCT6B, CDK1, CDKN3, CFTR, CHFR, CLPB, CLVS1, CNIH2, COIL, CSNK2A2, DBF4, DCC, DDX25, EZH2, GAD1, GAPDHS, GMCL1, GRM8, GSTM3, HSPA2, HSPA4L, HTR5A, IDE, IFT88, IL12RB2, IP6K1, JAM3, LPIN1, MAP7, MAST2, MLLT10, MTOR, NF2, NOS1, NPHP1, NPY5R, OAZ3, PACRG, PARP2, PCSK1N, PGS1, PHF7, PHKG2, PIAS2"
"48","HALLMARK_KRAS_SIGNALING_UP",0.0572228891556623,0.136244974180148,0.113117167056879,1.53905282455692,285,137,"ABCB1, ADAM17, ADAM8, ADGRL4, AKAP12, AKT2, AMMECR1, ANKH, APOD, ATG10, AVL9, BIRC3, BMP2, BPGM, BTBD3, C3AR1, CAB39L, CA2, CBL, CBR4, CBX8, CCND2, CCSER2, CD37, CDADC1, CIDEA, CLEC4A, CMKLR1, CPE, CROT, CSF2RA, CTSS, CXCL10, CXCR4, DCBLD2, DNMBP, DOCK2, DUSP6, EPB41L3, EPHB2, ERO1A, ETS1, ETV1, ETV4, ETV5, EVI5, F13A1, FBXO4, FCER1G, FGF9, FUCA1, G0S2, GABRA3, GADD45G, GALNT3, GFPT2, GLRX, RBM4, GPRC5B, HDAC9, HSD11B1, ID2, IKZF1, IL10RA, IL1RL2, IL33, INHBA, ITGA2, ITGBL1, JUP, KCNN4, KIF5C, KLF4, LAPTM5, LAT2, LCP1"
"49","HALLMARK_KRAS_SIGNALING_DN",0.43589236248516,0.541624874623872,-0.0906747228715783,-0.993770731560636,2202,89,"ZNF112, ZBTB16, YPEL1, YBX2, VPS50, TSHB, TNNI3, THRB, THNSL2, TGFB2, TG, TENT5C, TENM2, TCF7L1, SYNPO, SPTBN2, SPHK2, SOX10, SNN, SNCB, SLC5A5, SLC38A3, SLC30A3, SLC29A3, SLC25A23, SLC16A7, SKIL, SIDT1, SGK1, SELENOP, RYR2, RSAD2"
"50","HALLMARK_PANCREAS_BETA_CELLS",0.697185889813714,0.726235301889285,-0.162731036377193,-0.808897225598563,3517,17,"SYT13, STXBP1, SST, SRP9, SRP14, SPCS1"
