"","pathway","pval","padj","ES","NES","nMoreExtreme","size","leadingEdge"
"508","Mitotic Anaphase",0.0943952802359882,0.13393047031758,-0.152556883286954,-1.00632133577733,447,164,"ZWINT, ZWILCH, ZW10, XPO1, WAPL, VRK2, VRK1, UBE2E1, UBE2D1, UBC, UBB, TMPO, TAOK1, STAG2, STAG1, SPC25, SPC24, SMC3, SMC1A, SKA2, SKA1, SGO2, SEH1L, SEC13, RPS27A, RCC2, RANGAP1, RANBP2, RAD21, PTTG1, PSMF1, PSME4, PSME3, PSME2, PSME1, PSMD9, PSMD8, PSMD7, PSMD6, PSMD5, PSMD4, PSMD3, PSMD2, PSMD14, PSMD13, PSMD12, PSMD11, PSMD10, PSMD1, PSMC6, PSMC5, PSMC4, PSMC3, PSMC2, PSMC1, PSMB7, PSMB6, PSMB5, PSMB4, PSMB3, PSMB2, PSMB10, PSMB1, PSMA8, PSMA7, PSMA6, PSMA5, PSMA4, PSMA3, PSMA1, PPP2R5E, PPP2R5D, PPP2R5C, PPP2R5B, PPP2R5A, PPP2R2A, PPP2R1B, PPP2R1A, PPP2CB, PPP2CA, PPP1CC, PMF1, PLK1, PDS5B, PDS5A, PAFAH1B1, NUP98, NUP85, NUP43, NUP37, NUP160, NUP133, NUP107, NUDC, NSL1"
"509","Mitotic G1 phase and G1/S transition",0.147631779984721,0.181018472278086,0.187745813078637,0.895266314749018,772,137,"ABL1, AKT1, AKT2, AKT3, CABLES1, CCNA1, CCNA2, CCND1, CCND2, CCND3, CCNE1, CCNE2, CCNH, CDC25A, CDC45, CDC6, CDC7, CDK2, CDK4, CDK6, CDK7, CDKN1A, CDKN1B, CDKN1C, CDKN2B, CDKN2C, CDKN2D, CKS1B, CUL1, DBF4, DHFR, DYRK1A, E2F1, E2F2, E2F3, E2F4, E2F5, E2F6, FBXO5, UBA52, GMNN, HDAC1, JAK2, LIN37, LIN52, LIN54, LIN9, LYN, MAX, MCM10, MCM2, MCM4, MCM5, MCM6, MCM7, MCM8, MNAT1, MYBL2, MYC, ORC1, ORC2, ORC3, ORC4, ORC5, ORC6, PCNA, POLA1, POLA2, POLE, POLE2, POLE3, POLE4, PPP2CA, PPP2CB, PPP2R1A, PPP2R1B, PPP2R2A, PPP2R3B, PRIM1, PRIM2, PSMA1, PSMA3, PSMA4, PSMA5, PSMA6, PSMA7, PSMB1, PSMB10, PSMB2, PSMB3, PSMB4, PSMB5, PSMB6, PSMB7, PSMC1, PSMC2, PSMC3, PSMC4, PSMC5, PSMC6, PSMD1, PSMD10, PSMD11, PSMD12, PSMD13, PSMD14, PSMD2, PSMD3, PSMD4, PSMD5, PSMD6, PSMD7, PSMD8, PSMD9, PSME1, PSME2, PSME3, PSMF1, RB1, RBL1, RBL2, RPA1, RPA2, RPA3, RPS27A, RRM2"
"510","Mitotic G2-G2/M phases",0.177900132902981,0.210447770854549,0.173700424173967,0.750072778031837,936,170,"ACTR1A, AJUBA, AKAP9, ALMS1, AURKA, BORA, BTRC, CCNA1, CCNA2, CCNB2, CCNH, CCP110, CDC25A, CDC25B, CDK11A, CDK11B, CDK2, CDK5RAP2, CDK7, CDKN1A, CENPF, CENPJ, CEP131, CEP135, CEP152, CEP164, CEP192, CEP250, CEP290, CEP41, CEP57, CEP63, CEP70, CEP72, CEP76, CEP78, CETN2, CKAP5, CLASP1, CNTRL, CSNK1D, CSNK1E, CUL1, DCTN1, DCTN2, DCTN3, DYNC1H1, DYNC1I2, DYNLL1, E2F1, E2F3, EP300, FBXL18, FBXL7, FBXW11, FGFR1OP, FKBPL, UBA52, HAUS1, HAUS2, HAUS3, HAUS4, HAUS6, HAUS7, HAUS8, HSP90AB1, LCMT1, LIN37, LIN52, LIN54, LIN9, MAPRE1, MNAT1, MYBL2, MZT1, MZT2A, MZT2B, NDE1, NEDD1, NEK2, NINL, NME7, ODF2, OFD1, OPTN, PAFAH1B1, PCM1, PCNT, PHLDA1, PKMYT1, PLK1, PLK4, PPME1, PPP1CB, PPP1R12A, PPP1R12B, PPP2CA, PPP2CB, PPP2R1A, PPP2R1B, PPP2R2A, PPP2R3B, PRKACA, PRKAR2B, PSMA1, PSMA3, PSMA4, PSMA5, PSMA6, PSMA7, PSMA8, PSMB1, PSMB10, PSMB2, PSMB3, PSMB4, PSMB5, PSMB6, PSMB7, PSMC1, PSMC2, PSMC3, PSMC4, PSMC5, PSMC6, PSMD1, PSMD10, PSMD11, PSMD12, PSMD13, PSMD14, PSMD2, PSMD3, PSMD4, PSMD5, PSMD6, PSMD7, PSMD8, PSMD9, PSME1, PSME2, PSME3, PSME4, PSMF1"
"511","Mitotic Metaphase and Anaphase",0.0951378657124816,0.13393047031758,-0.149017526089813,-0.982319292047473,451,165,"ZWINT, ZWILCH, ZW10, XPO1, WAPL, VRK2, VRK1, UBE2E1, UBE2D1, UBC, UBB, TMPO, TAOK1, STAG2, STAG1, SPC25, SPC24, SMC3, SMC1A, SKA2, SKA1, SGO2, SEH1L, SEC13, RPS27A, RCC2, RANGAP1, RANBP2, RAD21, PTTG1, PSMF1, PSME4, PSME3, PSME2, PSME1, PSMD9, PSMD8, PSMD7, PSMD6, PSMD5, PSMD4, PSMD3, PSMD2, PSMD14, PSMD13, PSMD12, PSMD11, PSMD10, PSMD1, PSMC6, PSMC5, PSMC4, PSMC3, PSMC2, PSMC1, PSMB7, PSMB6, PSMB5, PSMB4, PSMB3, PSMB2, PSMB10, PSMB1, PSMA8, PSMA7, PSMA6, PSMA5, PSMA4, PSMA3, PSMA1, PPP2R5E, PPP2R5D, PPP2R5C, PPP2R5B, PPP2R5A, PPP2R2A, PPP2R1B, PPP2R1A, PPP2CB, PPP2CA, PPP1CC, PMF1, PLK1, PDS5B, PDS5A, PAFAH1B1, NUP98, NUP85, NUP43, NUP37, NUP160, NUP133, NUP107, NUDC, NSL1"
"512","Mitotic Prometaphase",0.184165881244109,0.216874075084975,0.130324382062478,0.560659641385431,976,172,"ACTR1A, AHCTF1, AKAP9, ALMS1, B9D2, BIRC5, BUB1, BUB3, CCNB2, CCP110, CDCA5, CDCA8, CDK5RAP2, CENPA, CENPC, CENPE, CENPF, CENPH, CENPI, CENPJ, CENPK, CENPL, CENPM, CENPN, CENPO, CENPP, CENPQ, CENPT, CENPU, CEP131, CEP135, CEP152, CEP164, CEP192, CEP250, CEP290, CEP41, CEP57, CEP63, CEP70, CEP72, CEP76, CEP78, CETN2, CKAP5, CLASP1, CLASP2, CLIP1, CNTRL, CSNK1D, CSNK1E, CSNK2A1, CSNK2A2, CSNK2B, DCTN1, DCTN2, DCTN3, DSN1, DYNC1H1, DYNC1I1, DYNC1I2, DYNC1LI1, DYNC1LI2, DYNLL1, DYNLL2"
"513","Mitotic Prophase",0.0408453566348303,0.0969897719784841,-0.315182248858101,-2.36792964485181,200,77,"VRK2, VRK1, USO1, TPR, TMPO, SMC4, SMC2, SET, SEH1L, SEC13, RB1, RANBP2, RAE1, RAB2A, RAB1B, RAB1A, PRKCB, PRKCA, PPP2R2D, PPP2R1B, PPP2R1A, PPP2CB, PPP2CA, POM121, POM121C, PLK1, PHF8, NUP42, NUP58, NUP98, NUP93, NUP88, NUP85, NUP54, NUP50, NUP43, NUP37, NUP35, NUP214, NUP210, NUP205, NUP188, NUP160, NUP155, NUP153, NUP133, NUP107, NUMA1, NEK9, NEK7, NEK6, NDC1, NCAPH2, NCAPG2, NCAPD3, MCPH1, MASTL, MAPK3, MAPK1, LPIN3, LPIN2, LPIN1, LMNB1, LMNA, LEMD3, LEMD2, KMT5A"
"514","Mitotic Spindle Checkpoint",0.108349514563107,0.144046631560378,0.211488898646456,1.14737135925676,557,98,"AHCTF1, ANAPC1, ANAPC10, ANAPC15, ANAPC16, ANAPC2, ANAPC4, ANAPC5, ANAPC7, B9D2, BIRC5, BUB1, BUB3, CDC16, CDC23, CDC26, CDC27, CDCA8, CENPA, CENPC, CENPE, CENPF, CENPH, CENPI, CENPK, CENPL, CENPM, CENPN, CENPO, CENPP, CENPQ, CENPT, CENPU, CKAP5, CLASP1, CLASP2, CLIP1, DSN1, DYNC1H1, DYNC1I1, DYNC1I2, DYNC1LI1, DYNC1LI2, DYNLL1, DYNLL2"
"515","Molecules associated with elastic fibres",0.0310290652003142,0.0969897719784841,0.34076467850256,1.80031475578946,157,25,"BMP2, BMP4, BMP7, EFEMP1, EFEMP2, FBLN1, FBLN2, FBLN5, ITGA8, ITGAV, ITGB1, ITGB3, ITGB5, ITGB8, LTBP1, LTBP2, LTBP3, LTBP4, MFAP1, MFAP2, MFAP3"
"516","Muscle contraction",0.0198731501057082,0.0969897719784841,-0.999932876896228,-6.55846751661225,93,166,"CACNA1C"
"517","MyD88 cascade initiated on plasma membrane",0.0442079410560786,0.0969897719784841,-0.200134710752342,-1.48702323974135,215,71,"VRK3, UBE2N, UBC, UBB, TRAF6, TNIP2, TAB3, TAB2, TAB1, SKP1, S100B, RPS6KA5, RPS6KA3, RPS6KA2, RPS6KA1, RPS27A, RIPK2, RELA, PPP2R5D, PPP2R1B, PPP2R1A, PPP2CB, PPP2CA, PELI3, PELI2, PELI1, NKIRAS2, NKIRAS1, NFKBIB, NFKBIA, NFKB2, NFKB1, MEF2C, MEF2A, MAPKAPK3, MAPKAPK2, MAPK9, MAPK8, MAPK7, MAPK3, MAPK14, MAPK11, MAPK10, MAPK1, MAP3K8, MAP3K7, MAP3K1, MAP2K6, MAP2K4, MAP2K3, MAP2K1"
"518","MyD88 dependent cascade initiated on endosome",0.0454268910971405,0.0974195289700528,-0.199049026955073,-1.49554488802426,223,78,"VRK3, UBE2N, UBC, UBB, TRAF6, TNIP2, TLR8, TLR7, TLR4, TICAM1, TAB3, TAB2, TAB1, SKP1, S100B, RPS6KA5, RPS6KA3, RPS6KA2, RPS6KA1, RPS27A, RIPK2, RELA, PPP2R5D, PPP2R1B, PPP2R1A, PPP2CB, PPP2CA, PELI3, PELI2, PELI1, NKIRAS2, NKIRAS1, NFKBIB, NFKBIA, NFKB2, NFKB1, MEF2C, MEF2A, MAPKAPK3, MAPKAPK2, MAPK9, MAPK8, MAPK7, MAPK3, MAPK14, MAPK11, MAPK10, MAPK1, MAP3K8, MAP3K7, MAP3K1, MAP2K6, MAP2K4, MAP2K3, MAP2K1, LY96, JUN, IRF7, IRAK2, IRAK1, IKBKG, IKBKB"
"519","MyD88-independent TLR4 cascade",0.0531173092698934,0.099955591295894,-0.183262583572185,-1.37538000845516,258,86,"VRK3, UBE2N, UBE2D3, UBE2D2, UBE2D1, UBC, UBB, TRAF6, TRAF3, TNIP2, TLR4, TICAM1, TBK1, TANK, TAB3, TAB2, TAB1, SKP1, SARM1, S100B, RPS6KA5, RPS6KA3, RPS6KA2, RPS6KA1, RPS27A, RIPK2, RIPK1, RELA, PTPN11, PPP2R5D, PPP2R1B, PPP2R1A, PPP2CB, PPP2CA, NKIRAS2, NKIRAS1, NFKBIB, NFKBIA, NFKB2, NFKB1, MEF2C, MEF2A, MAPKAPK3, MAPKAPK2, MAPK9, MAPK8, MAPK7, MAPK3, MAPK14, MAPK11, MAPK10, MAPK1, MAP3K8, MAP3K7, MAP2K6, MAP2K4, MAP2K3, MAP2K1, LY96, JUN, IRF7, IRF3, IRAK2, IRAK1, IKBKG, IKBKE, IKBKB"
"520","MyD88:MAL(TIRAP) cascade initiated on plasma membrane",0.0538665578453377,0.099955591295894,-0.179097704217832,-1.34671944630656,263,80,"VRK3, UBE2N, UBC, UBB, TRAF6, TNIP2, TLR4, TLR2, TIRAP, TAB3, TAB2, TAB1, SOCS1, SKP1, S100B, RPS6KA5, RPS6KA3, RPS6KA2, RPS6KA1, RPS27A, RIPK2, RELA, PPP2R5D, PPP2R1B, PPP2R1A, PPP2CB, PPP2CA, PELI3, PELI2, PELI1, NKIRAS2, NKIRAS1, NFKBIB, NFKBIA, NFKB2, NFKB1, MEF2C, MEF2A, MAPKAPK3, MAPKAPK2, MAPK9, MAPK8, MAPK7, MAPK3, MAPK14, MAPK11, MAPK10, MAPK1, MAP3K8, MAP3K7, MAP3K1, MAP2K6, MAP2K4, MAP2K3, MAP2K1, LY96, JUN, IRAK3, IRAK2, IRAK1, IKBKG, IKBKB"
"521","Myogenesis",0.0808477237048666,0.122507249456719,0.260128546099291,1.35493440283947,411,24,"ABL1, BNIP2, BOC, CDC42, CDH2, CDH4, CDON, CTNNA1, CTNNA2, CTNNB1, MAP2K6, MAPK11, MAPK12, MAPK14, MEF2A, MEF2B, MEF2C, MEF2D, NEO1, NTN3"
"522","N-Glycan antennae elongation",0.0987012987012987,0.137018291359097,0.310824639510931,1.36134671699045,493,15,"B4GALT1, B4GALT2, B4GALT3, B4GALT4, B4GALT5, B4GALT6"
"523","N-glycan antennae elongation in the medial/trans-Golgi",0.04925431711146,0.0980844051158958,0.290070921985816,1.51089558357016,250,24,"B4GALT1, B4GALT2, B4GALT3, B4GALT4, B4GALT5, B4GALT6, CGA, CHST10, CHST8, FUCA1, FUT8, MAN2A1, MAN2A2, MGAT2, MGAT3, MGAT4A, MGAT4B, MGAT4C, MGAT5"
"524","N-glycan trimming in the ER and Calnexin/Calreticulin cycle",0.435776039522437,0.459617889709075,-0.148476985946216,-0.904791396600651,2116,33,"VCP, UGGT2, UGGT1, UBXN1, UBC, UBB, TRIM13, SYVN1, SEL1L, RPS27A, RNF5, RNF185, RNF103, RAD23B, PSMC1, PRKCSH"
"525","NCAM signaling for neurite out-growth",0.00609137055837563,0.0969897719784841,-0.99993339106108,-6.94346372570685,29,51,"CACNA1C"
"526","NCAM1 interactions",0.00388945752302968,0.0969897719784841,-0.999933475252794,-6.02257075173814,18,32,"CACNA1C"
"527","NEP/NS2 Interacts with the Cellular Export Machinery",0.0183336728457934,0.0969897719784841,-0.51256263580329,-3.02993393270294,89,30,"XPO1, TPR, SEH1L, SEC13, RANBP2, RAE1, POM121, POM121C, NUP42, NUP58, NUP98, NUP93, NUP88, NUP85, NUP54, NUP50, NUP43, NUP37, NUP35, NUP214, NUP210, NUP205, NUP188, NUP160, NUP155, NUP153, NUP133, NUP107, NDC1"
"528","NIK-->noncanonical NF-kB signaling",0.0313511326860841,0.0969897719784841,-0.544787425666839,-3.82478408817639,154,54,"UBE2M, UBC, UBB, UBA3, SKP1, RPS27A, RELB, PSMF1, PSME4, PSME3, PSME2, PSME1, PSMD9, PSMD8, PSMD7, PSMD6, PSMD5, PSMD4, PSMD3, PSMD2, PSMD14, PSMD13, PSMD12, PSMD11, PSMD10, PSMD1, PSMC6, PSMC5, PSMC4, PSMC3, PSMC2, PSMC1, PSMB7, PSMB6, PSMB5, PSMB4, PSMB3, PSMB2, PSMB10, PSMB1, PSMA8, PSMA7, PSMA6, PSMA5, PSMA4, PSMA3, PSMA1"
"529","NOD1/2 Signaling Pathway",0.0691885535084281,0.111494247991136,0.257399648767608,1.38482502964213,352,27,"BIRC2, BIRC3, CARD9, CASP1, CASP2, CASP8, CASP9, CHUK, CYLD, IKBKB, IKBKG, IRAK1, IRAK2, ITCH, MAP2K6, MAP3K7, MAPK11, MAPK12, MAPK13, MAPK14"
"530","NOTCH1 Intracellular Domain Regulates Transcription",0.0429036193574624,0.0969897719784841,-0.224307642423295,-1.5131874003764,210,46,"UBC, UBB, TLE4, TLE3, TLE2, TLE1, TBL1XR1, TBL1X, SNW1, SKP1, RPS27A, RBX1, RBPJ, NOTCH1, NCOR2, NCOR1, MYC, MAMLD1, MAML3, MAML2, MAML1, KAT2B, KAT2A, HIF1A, HEY2, HEY1, HES5, HES1, HDAC9, HDAC8, HDAC7, HDAC6, HDAC5, HDAC4, HDAC3, HDAC2, HDAC11, HDAC10, HDAC1"
"531","NOTCH2 Activation and Transmission of Signal to the Nucleus",0.419996063766975,0.444325104046159,0.186266037359569,0.918870407059764,2133,21,"ADAM10, APH1A, APH1B, CNTN1, DLL1, DLL4, UBA52, JAG2, MDK, MIB1, MIB2, NCSTN, NEURL1, NEURL1B, NOTCH2, PSEN1, PSEN2, PSENEN"
"532","NOTCH3 Activation and Transmission of Signal to the Nucleus",0.77639624949042,0.782408998760433,-0.128324468085106,-0.713566296131182,3808,24,"YBX1, WWP2, UBC, UBB, TACC3, RPS27A, PSENEN, PSEN2, PSEN1, NOTCH3, NEURL1B, NEURL1, NCSTN, MIB2, MIB1"
"533","NOTCH3 Intracellular Domain Regulates Transcription",0.109863181539718,0.145114372654381,-0.249526656125431,-1.36296499558746,537,23,"WWC1, STAT1, SNW1, RBPJ, PTCRA, PLXND1, PBX1, NOTCH3, NOTCH1, MAMLD1, MAML3, MAML2, MAML1, KAT2B, KAT2A, IKZF1, HEY2, HEY1, HES5, HES1"
"534","NOTCH4 Intracellular Domain Regulates Transcription",0.0991345397324941,0.137050538992731,0.278329922513162,1.33645863435365,503,19,"ACTA2, CREBBP, EP300, FLT4, HES1, HES5, HEY1, HEY2, KAT2A, KAT2B, MAML1, MAML2, MAML3, MAMLD1, NOTCH1, NOTCH2"
"535","NR1H2 and NR1H3-mediated signaling",0.0923106947697112,0.131930217127026,0.207374866879659,1.22593803769933,472,40,"ABCA1, ABCG1, ABCG8, AGO1, AGO2, AGO3, AGO4, ANGPTL3, APOD, APOE, ARL4C"
"536","NR1H3 & NR1H2 regulate gene expression linked to cholesterol transport and efflux",0.0658460336068777,0.108731982452475,0.244844332091538,1.37220060093066,336,32,"ABCA1, ABCG1, ABCG8, AGO1, AGO2, AGO3, AGO4, APOD, APOE, ARL4C"
"537","NRAGE signals death through JNK",0.0576277876455496,0.102727937914758,0.37805074531039,2.2967952717259,291,55,"AATF, ABR, AKAP13, ARHGEF1, ARHGEF10, ARHGEF10L, ARHGEF11, ARHGEF12, ARHGEF15, ARHGEF16, ARHGEF17, ARHGEF18, ARHGEF19, ARHGEF2, ARHGEF26, ARHGEF3, ARHGEF33, ARHGEF37, ARHGEF38, ARHGEF4, ARHGEF40, ARHGEF6, ARHGEF7, ARHGEF9, BAD, BCL2L11"
"538","NRIF signals cell death from the nucleus",0.304907481898632,0.332713510122093,-0.23444976076555,-1.10017716259633,1515,16,"UBC, UBB, TRAF6, SQSTM1, RPS27A, PSENEN, PSEN2, PSEN1, NGFR, NGF, NCSTN, MAPK8"
"539","NS1 Mediated Effects on Host Pathways",0.0230595017500515,0.0969897719784841,-0.342427577968343,-2.2002906405131,111,39,"TPR, SEH1L, SEC13, RANBP2, RAE1, POM121, POM121C, PABPN1, NUP42, NUP58, NUP98, NUP93, NUP88, NUP85, NUP54, NUP50, NUP43, NUP37, NUP35, NUP214, NUP210, NUP205, NUP188, NUP160, NUP155, NUP153, NUP133, NUP107, NDC1, KPNB1, KPNA7, KPNA4, KPNA3, KPNA2, KPNA1"
"540","Neddylation",0.215763732129421,0.246282944239832,0.224887745944837,0.861224402174944,1146,215,"ANKRD9, ASB1, ASB11, ASB12, ASB13, ASB14, ASB15, ASB16, ASB18, ASB2, ASB3, ASB5, ASB6, ASB7, ASB8, BIRC5, BTBD1, BTBD6, BTRC, CAND1, CCDC8, CCNF, CISH, COMMD1, COMMD10, COMMD2, COMMD3, COMMD4, COMMD5, COMMD6, COMMD7, COMMD8, COMMD9, COPS2, COPS3, COPS4, COPS5, COPS6, COPS7A, COPS7B, COPS8, CUL1, CUL2, CUL3, CUL4A, CUL4B, CUL5, CUL7, CUL9, DCAF10, DCAF11, DCAF13, DCAF17, DCAF4, DCAF5, DCAF6, DCAF7, DCAF8, DCUN1D1, DCUN1D2, DCUN1D3, DCUN1D4, DCUN1D5, DDA1, DDB1, DDB2, DTL, ELOC, EPAS1, ERCC8, FBXL12, FBXL13, FBXL14, FBXL15, FBXL16, FBXL18, FBXL19, FBXL20, FBXL22, FBXL3, FBXL4, FBXL5, FBXL7, FBXL8, FBXO10, FBXO11, FBXO15, FBXO17, FBXO2, FBXO21, FBXO22, FBXO27, FBXO30, FBXO31, FBXO32, FBXO4, FBXO41, FBXO44, FBXO6, FBXO7, FBXO9, FBXW10, FBXW11, FBXW2, FBXW12, FBXW4, FBXW5, FBXW7, FBXW8, FBXW9, FEM1A, FEM1B, FEM1C"
"541","Nef-mediates down modulation of cell surface receptors by recruiting them to clathrin adapters",0.0219107777339124,0.0969897719784841,0.795425314407015,3.65631675235821,110,17,"AP1B1, AP1G1, AP1M1, AP1M2, AP1S1, AP1S2, AP1S3, AP2A1, AP2A2, AP2B1, AP2M1, AP2S1, ARF1, ATP6V1H, B2M"
"542","Negative epigenetic regulation of rRNA expression",0.0301476620180476,0.0969897719784841,-0.265530837884641,-1.8276590459527,146,50,"ZNRD1, UBTF, TWISTNB, TTF1, TBP, TAF1D, TAF1C, TAF1B, TAF1A, SUV39H1, SUDS3, SMARCA5, SIRT1, SIN3B, SIN3A, SAP30L, SAP30BP, SAP30, SAP18, SAP130, RRP8, POLR2L, POLR2K, POLR2H, POLR2F, POLR2E, POLR1E, POLR1D, POLR1C, POLR1B, POLR1A"
"543","Negative regulation of FGFR1 signaling",0.0974012686719869,0.135735904534857,-0.234104815110402,-1.3608055628288,475,28,"UBC, UBB, SRC, SPRY2, RPS27A, PTPN11, PPP2R1A, PPP2CB, PPP2CA, MKNK1, MAPK3, MAPK1, KL, GRB2, UBA52, FRS2, FGFR1, FGF9, FGF5, FGF3, FGF23, FGF22, FGF20, FGF2, FGF10, FGF1"
"544","Negative regulation of FGFR2 signaling",0.0974012686719869,0.135735904534857,-0.234104815110402,-1.3608055628288,475,28,"UBC, UBB, SRC, SPRY2, RPS27A, PTPN11, PPP2R1A, PPP2CB, PPP2CA, MKNK1, MAPK3, MAPK1, GRB2, UBA52, FRS2, FGFR2, FGF9, FGF7, FGF5, FGF3, FGF23, FGF22, FGF20, FGF2, FGF10, FGF1"
"545","Negative regulation of FGFR3 signaling",0.175499388503873,0.208555780174123,-0.222118794326241,-1.23512287043639,860,24,"UBC, UBB, SRC, SPRY2, RPS27A, PTPN11, PPP2R1A, PPP2CB, PPP2CA, MKNK1, MAPK3, MAPK1, GRB2, UBA52, FRS2, FGFR3, FGF9, FGF5, FGF23, FGF20, FGF2, FGF1"
"546","Negative regulation of FGFR4 signaling",0.175499388503873,0.208555780174123,-0.222118794326241,-1.23512287043639,860,24,"UBC, UBB, SRC, SPRY2, RPS27A, PTPN11, PPP2R1A, PPP2CB, PPP2CA, MKNK1, MAPK3, MAPK1, KLB, GRB2, UBA52, FRS2, FGFR4, FGF9, FGF23, FGF20, FGF2, FGF1"
"547","Negative regulation of MAPK pathway",0.0755269320843091,0.118053357807456,0.218849840255591,1.29377463986243,386,40,"ARAF, BRAF, BRAP, DUSP1, DUSP10, DUSP16, DUSP2, DUSP4, DUSP5, DUSP6, DUSP7, DUSP8, DUSP9, UBA52, HRAS, KRAS, KSR1, MAP2K1, MAP2K2, MAPK1, MAPK3, MARK3, NRAS, PAQR3, PEBP1, PPP2CA, PPP2CB, PPP2R1A, PPP2R1B, PPP2R5A, PPP2R5B, PPP2R5C, PPP2R5D, PPP2R5E, PPP5C"
"548","Negative regulation of MET activity",0.0467384677910994,0.097923887587822,-0.298566332070287,-1.58286052354692,229,21,"USP8, UBC, UBB, STAM2, STAM, SH3KBP1, SH3GL3, SH3GL2, SH3GL1, RPS27A, PTPRJ, PTPN2, PTPN1"
"549","Negative regulation of NMDA receptor-mediated neuronal transmission",0.0258671369782481,0.0969897719784841,0.43646636532837,2.12807027427993,131,20,"ACTN2, CALM1, CAMK1, CAMK2A, CAMK2B, CAMK2G, CAMK4, DLG1, DLG2, DLG3, DLG4, GRIN1, GRIN2A, GRIN2B, GRIN2C, GRIN2D"
"550","Negative regulation of NOTCH4 signaling",0.0281862745098039,0.0969897719784841,-0.59275962133105,-4.07906045401621,137,49,"YWHAZ, UBC, UBB, TACC3, SKP1, RPS27A, RBX1, PSMF1, PSME3, PSME2, PSME1, PSMD9, PSMD8, PSMD7, PSMD6, PSMD5, PSMD4, PSMD3, PSMD2, PSMD14, PSMD13, PSMD12, PSMD11, PSMD10, PSMD1, PSMC6, PSMC5, PSMC4, PSMC3, PSMC2, PSMC1, PSMB7, PSMB6, PSMB5, PSMB4, PSMB3, PSMB2, PSMB10, PSMB1, PSMA7, PSMA6, PSMA5, PSMA4, PSMA3, PSMA1"
"551","Negative regulation of the PI3K/AKT network",0.10421932724091,0.141266041221077,0.21302475107789,1.16699619004662,535,93,"AKT1, AKT2, AKT3, CD80, CD86, EGF, EGFR, ERBB3, ERBB4, ESR1, ESR2, FGF1, FGF10, FGF2, FGF20, FGF22, FGF23, FGF3, FGF5, FGF7, FGF9, FGFR1, FGFR2, FGFR3, FGFR4, FRS2, FYN, GAB1, GRB2, HBEGF, HGF, IER3, IL1RAP, IL1RL1, IL33, INS, INSR, IRAK1, IRS1, IRS2, KIT, KITLG, KL, KLB, LCK, MAPK1, MAPK3, MET, NRG1, NRG2, NRG3, NRG4, PDGFA, PDGFB, PDGFRA, PDGFRB, PHLPP1, PHLPP2, PIK3AP1, PIK3CA, PIK3CB, PIK3CD, PIK3R1, PIK3R2, PIK3R3, PIP4K2A, PIP4K2B, PIP4K2C, PIP5K1A, PIP5K1B, PIP5K1C, PPP2CA, PPP2CB, PPP2R1A, PPP2R1B, PPP2R5A, PPP2R5B, PPP2R5C, PPP2R5D, PPP2R5E, PTEN, PTPN11, RAC1, RAC2"
"552","Negative regulators of DDX58/IFIH1 signaling",0.0440122824974411,0.0969897719784841,-0.255904071314529,-1.54130290993605,214,32,"UBE2L6, UBE2K, UBE2D3, UBE2D2, UBE2D1, UBC, UBB, UBA7, TRIM25, TRAF3, TNFAIP3, TBK1, TAX1BP1"
"553","Nephrin family interactions",0.236723495982755,0.26694497776465,0.224634405743153,1.09524545169224,1207,20,"ACTN1, ACTN2, ACTN3, ACTN4, CASK, CD2AP, FYN, IQGAP1, KIRREL3, MAGI2, NCK1, NCK2, NPHS1, PIK3CA, PIK3CB, PIK3R1, PIK3R2"
"554","Netrin-1 signaling",0.0296160130718954,0.0969897719784841,-0.259892488463917,-1.78844363522691,144,49,"WASL, UNC5D, UNC5C, UNC5B, UNC5A, TRPC7, TRPC6, TRPC5, TRPC4, TRPC3, TRPC1, TRIO, SRC, SLIT3, SLIT2, SLIT1, SIAH2, SIAH1, ROBO1, RGMB, RGMA, RAC1, PTPN11, PTK2, PRKCQ, PLCG1, PITPNA, PAK1, NTN4, NTN1, NEO1, NCK1, MYO10, MAPK8, MAPK14, MAPK13, MAPK12, MAPK11"
"555","Neurexins and neuroligins",0.115255575291099,0.149976317347543,0.174996820089764,1.06316909551188,583,55,"APBA1, APBA2, APBA3, BEGAIN, CASK, DBNL, DLG2, DLG3, DLG4, DLGAP1, DLGAP2, DLGAP3, DLGAP4, EPB41, EPB41L1, EPB41L2, EPB41L3, EPB41L5, GRIN1, GRIN2A, GRIN2B, GRIN2C, GRIN2D, GRM1, GRM5, HOMER1, HOMER2, HOMER3, LIN7A, LIN7B, LIN7C, LRRTM1, LRRTM2, LRRTM3, LRRTM4, NLGN1, NLGN2, NLGN3, NRXN1, NRXN2, NRXN3"
"556","Neurodegenerative Diseases",0.0281274586939418,0.0969897719784841,0.377827919749523,1.81421882738909,142,19,"APP, BCL2L11, CAPN1, CAPN2, CAPNS1, CAST, CDC25A, CDC25B, CDK5, CDK5R1"
"557","Neuronal System",0.200043630017452,0.231126990952461,-0.682206160739721,-2.85760017613733,916,356,"KCNJ3"
"558","Neurotransmitter receptors and postsynaptic signal transmission",0.0926746886214904,0.13215664500681,-0.682207885939369,-4.45972211188827,438,167,"KCNJ3"
"559","Neurotransmitter release cycle",0.0282357790601814,0.0969897719784841,-0.276971230687267,-1.89149151342271,136,48,"VAMP2, UNC13B, TSPOAP1, SYT1, SYN3, SYN2, SYN1, STXBP1, STX1A, SNAP25, SLC6A13, SLC6A11, SLC6A1, SLC5A7, SLC38A2, SLC32A1, SLC22A2, SLC22A1, SLC1A6, SLC1A3, SLC1A2, SLC1A1, SLC18A2, SLC17A7"
"560","Neutrophil degranulation",0.345708509465172,0.372163969341514,0.135413828337875,0.363099882931642,1880,384,"C6orf120, ABCA13, ACAA1, ACLY, ACPP, ACTR10, ACTR1B, ACTR2, ADAM10, ADAM8, AGA, AGL, ALAD, ALDH3B1, ALDOA, ALDOC, ALOX5, AMPD3, ANO6, ANXA2, AP1M1, AP2A2, APAF1, APEH, APRT, ARG1, ARL8A, ARMC8, ARPC5, ARSA, ARSB, ASAH1, ATG7, ATP11A, ATP11B, ATP6AP2, ATP6V0A1, ATP6V0C, ATP6V1D, ATP8A1, ATP8B4, B2M, B4GALT1, BIN2, BRI3, BST2, C3AR1, C5AR1, CAB39, CAMP, CAND1, CANT1, CAP1, CAPN1, CAT, CCT2, CCT8, CD14, CD300A, CD33, CD36, CD44, CD47, CD53, CD55, CD59, CD63, CD93, CDA, CDK13, CEP290, CFP, CHI3L1, CKAP4, CLEC4C, CLEC5A, CMTM6, CNN2, COMMD3, COMMD9, COPB1, COTL1, CPNE3, CPPED1, CR1, CRACR2A, CREG1, CSNK2B, CST3, CSTB, CTSA, CTSB, CTSC, CTSD, CTSH, CTSS, CTSZ, CYB5R3, CYBA, CYBB, CYFIP1, CYSTM1, DBNL, DDOST, DDX3X, DEGS1, DERA, DGAT1, DIAPH1, DNAJC13, DNAJC3, DNAJC5, DNASE1L1, DOCK2, DOK3, DPP7, DSG1, DSN1, DSP, DYNC1H1, DYNC1LI1, DYNLL1, DYNLT1, RNASE2, RNASE3, EEF2, ENPP4, ERP44, FABP5, FAF2, FCER1G, FCGR2A, FGR, FPR1, FPR2, FRK, FRMPD3, FTH1, FTL, FUCA1, FUCA2, GAA, GALNS, GCA, GDI2, GGH, GHDC, GLA, GLB1, GLIPR1, GM2A, RNASET2, GMFG, GNS, GOLGA7, GPI, GRN, GSDMD, GSN, GSTP1, GUSB, GYG1, HEBP2, HEXB, HGSNAT, HK3, HMOX2, HPSE, HRNR, HSP90AB1, HSPA1A, HSPA1B, HSPA8, HUWE1, HVCN1, IDH1, MNDA, IGF2R, ILF2, IMPDH1, IMPDH2, IQGAP1, IQGAP2, IST1, ITGAL, ITGAV, ITGAX, JUP, KCMF1, KCNAB2, KPNB1, KRT1, LAIR1, LAMP1, LAMP2, LAMTOR1, LAMTOR2, LAMTOR3, LCN2, LGALS3, LPCAT1, LRG1, LRMP, LRRC7, LTA4H, LTF, MAGT1, MAN2B1, MANBA, MAPK1, MAPK14, METTL7A, MGAM, MGST1, MIF, MLEC, MME, MMP25, MMP9, MOSPD2, MPO, MVP, NAPRT, NBEAL2, NCKAP1L, NCSTN, NDUFC2, NEU1, NFAM1, NFASC, NFKB1, NHLRC3, NIT2, NME2, NPC2, NRAS, OLFM4, ORMDL3, OSCAR, OSTF1, PA2G4, PADI2, PAFAH1B2, PDAP1, PDXK, PECAM1, PFKL, PGAM1, PGLYRP1, PGM1, PGM2, PGRMC1, LILRB3, PKM, PLAC8, PLAU, PLD1, PLEKHO2, PNP, PPIA, PPIE, PRCP, PRDX4, PRDX6, PRKCD, PRTN3, PSAP, PSEN1, CEACAM1, CEACAM3, CEACAM8, CEACAM6, PSMA5, PSMB1, PSMB7, PSMC2, PSMC3, PSMD1, PSMD11, PSMD12, PSMD13, PSMD14, PSMD2, PSMD3, PSMD6, PSMD7, PTAFR, PTGES2, PTPN6, PTPRB, PTPRC, PTPRJ, PTPRN2, PYCARD, PYGB, PYGL, QPCT, QSOX1, RAB10, RAB14, RAB18, RAB24, RAB27A, RAB31, RAB37, RAB3A, RAB3D, RAB4B, RAB5B, RAB5C, RAB6A, RAB7A, RAB9B, RAC1, RAP1A, RAP1B, RAP2B, RAP2C"
"561","Nicotinamide salvaging",0.00623491552695093,0.0969897719784841,-0.540271132376396,-2.53527220292183,30,16,"RNLS, PTGS2, PTGIS, PARP9, PARP8, PARP6, PARP4, PARP16, PARP14, PARP10, NUDT12, NNMT, NAXE, NAXD, NAPRT, NAMPT"
"562","Nicotinate metabolism",0.0110069302894415,0.0969897719784841,-0.539760638297872,-3.00141512538494,53,24,"RNLS, PTGS2, PTGIS, PARP9, PARP8, PARP6, PARP4, PARP16, PARP14, PARP10, NUDT12, NT5E, NNMT, NMRK1, NMNAT3, NMNAT2, NMNAT1, NAXE, NAXD, NAPRT, NAMPT, NADSYN1, NADK2, NADK"
"563","Nitric oxide stimulates guanylate cyclase",0.0218800648298217,0.0969897719784841,-0.370505748654217,-1.78738070304813,107,17,"PRKG2, PRKG1, PDE9A, PDE5A, PDE2A, PDE1B, PDE1A, PDE11A, PDE10A, NOS3, NOS1, KCNMB4, KCNMB3, KCNMB2, KCNMA1, ITPR1, GUCY1A2"
"564","NoRC negatively regulates rRNA expression",0.0347435111383609,0.0969897719784841,-0.241146558722809,-1.64054910371071,169,47,"ZNRD1, UBTF, TWISTNB, TTF1, TBP, TAF1D, TAF1C, TAF1B, TAF1A, SUDS3, SMARCA5, SIN3B, SIN3A, SAP30L, SAP30BP, SAP30, SAP18, SAP130, POLR2L, POLR2K, POLR2H, POLR2F, POLR2E, POLR1E, POLR1D, POLR1C, POLR1B, POLR1A"
"565","Non-integrin membrane-ECM interactions",0.103044496487119,0.140221334435414,0.201916932907348,1.19367236845702,527,40,"ACTN1, AGRN, CASK, DAG1, DDR1, DDR2, DMD, FGF2, HSPG2, ITGA2, ITGA6, ITGAV, ITGB1, ITGB3, ITGB4, ITGB5, LAMA2, LAMA3, LAMA4, LAMA5, LAMB1, LAMB2, LAMB3, LAMC1, LAMC2, LAMC3"
"566","Nonhomologous End-Joining (NHEJ)",0.124667349027636,0.159237681396035,-0.211299228312932,-1.27264921496961,608,32,"XRCC6, XRCC5, XRCC4, UIMC1, UBE2V2, UBE2N, TP53BP1, TDP2, TDP1, SUMO1, RNF168, RIF1, RAD50, PRKDC, POLM, POLL, PIAS4, PAXIP1, NSD2, NHEJ1, NBN, MRE11, MDC1"
"567","Nonsense Mediated Decay (NMD) enhanced by the Exon Junction Complex (EJC)",0.045001018122582,0.0969897719784841,-0.489274588340009,-3.67526140605802,220,84,"UPF3B, UPF3A, UPF2, UPF1, SMG9, SMG8, SMG7, SMG6, SMG5, SMG1, RPSA, RPS9, RPS8, RPS7, RPS5, RPS4X, RPS3A, RPS28, RPS27L, RPS27A, RPS25, RPS24, RPS21, RPS20, RPS19, RPS17, RPS16, RPS15A, RPS15, RPS14, RPS13, RPS12, RPS11, RPLP1, RPL8, RPL7A, RPL6, RPL5, RPL4, RPL3L, RPL38, RPL37A, RPL36, RPL35, RPL34, RPL32, RPL30, RPL3, RPL29, RPL28, RPL27, RPL26, RPL23, RPL22L1, RPL19, RPL18A, RPL18, RPL14, RPL13A, RPL12, RPL11, RPL10A, RPL10, RNPS1"
"568","Nonsense Mediated Decay (NMD) independent of the Exon Junction Complex (EJC)",0.0361788617886179,0.0969897719784841,-0.57355,-4.16103393846021,177,64,"UPF1, RPSA, RPS9, RPS8, RPS7, RPS5, RPS4X, RPS3A, RPS28, RPS27L, RPS27A, RPS25, RPS24, RPS21, RPS20, RPS19, RPS17, RPS16, RPS15A, RPS15, RPS14, RPS13, RPS12, RPS11, RPLP1, RPL8, RPL7A, RPL6, RPL5, RPL4, RPL3L, RPL38, RPL37A, RPL36, RPL35, RPL34, RPL32, RPL30, RPL3, RPL29, RPL28, RPL27, RPL26, RPL23, RPL22L1, RPL19, RPL18A, RPL18, RPL14, RPL13A, RPL12, RPL11, RPL10A, RPL10"
"569","Nonsense-Mediated Decay (NMD)",0.045001018122582,0.0969897719784841,-0.489274588340009,-3.67526140605802,220,84,"UPF3B, UPF3A, UPF2, UPF1, SMG9, SMG8, SMG7, SMG6, SMG5, SMG1, RPSA, RPS9, RPS8, RPS7, RPS5, RPS4X, RPS3A, RPS28, RPS27L, RPS27A, RPS25, RPS24, RPS21, RPS20, RPS19, RPS17, RPS16, RPS15A, RPS15, RPS14, RPS13, RPS12, RPS11, RPLP1, RPL8, RPL7A, RPL6, RPL5, RPL4, RPL3L, RPL38, RPL37A, RPL36, RPL35, RPL34, RPL32, RPL30, RPL3, RPL29, RPL28, RPL27, RPL26, RPL23, RPL22L1, RPL19, RPL18A, RPL18, RPL14, RPL13A, RPL12, RPL11, RPL10A, RPL10, RNPS1"
